Symbol,Name,Last Sale,Net Change,% Change,Market Cap
PMAX,Powell Max Limited Class A Ordinary Shares,$2.67,0.02,0.755%,"33,375,000"
BOLD,"Boundless Bio, Inc. Common Stock",$1.49,0.03,2.055%,"33,354,560"
AMBI,Ambipar Emergency Response Class A Ordinary Shares,$0.6016,-0.1184,-16.444%,"33,346,598"
CREX,"Creative Realities, Inc. Common Stock",$3.17,0.01,0.316%,"33,345,014"
UG,"United-Guardian, Inc. Common Stock",$7.25,-0.11,-1.495%,"33,308,813"
MGN,Megan Holdings Limited Ordinary Shares,$1.90,0.10,5.556%,"33,250,000"
PFAI,Pinnacle Food Group Limited Class A Common Shares,$2.84,-0.09,-3.072%,"33,228,000"
BTAI,"BioXcel Therapeutics, Inc. Common Stock",$2.28,-0.05,-2.146%,"33,189,374"
KLXE,"KLX Energy Services Holdings, Inc. Common Stock",$1.86,-0.01,-0.535%,"33,183,250"
NDLS,Noodles & Company Class A Common Stock,$0.7067,-0.0858,-10.826%,"32,820,238"
RDI,Reading International Inc Class A Common Stock,$1.44,UNCH,--,"32,712,854"
CVU,"CPI Aerostructures, Inc. Common Stock",$2.50,UNCH,--,"32,576,858"
POCI,"Precision Optics Corporation, Inc. Common stock",$4.22,-0.08,-1.86%,"32,556,038"
ARBK,Argo Blockchain plc American Depositary Shares,$0.4527,-0.0152,-3.249%,"32,469,923"
GREE,Greenidge Generation Holdings Inc. Class A Common Stock,$2.07,UNCH,--,"32,443,973"
SLMT,Brera Holdings PLC Class B Ordinary Shares,$13.39,1.38,11.49%,"32,332,940"
SWAG,"Stran & Company, Inc. Common Stock",$1.74,-0.03,-1.695%,"32,286,337"
NIXX,"Nixxy, Inc. Common Stock",$1.54,-0.03,-1.911%,"32,083,302"
MIRA,"MIRA Pharmaceuticals, Inc. Common Stock",$1.67,0.17,11.333%,"31,845,756"
RSVRW,"Reservoir Media, Inc. Warrant",$0.4854,0.0054,1.125%,"31,822,350"
NINE,"Nine Energy Service, Inc. Common Stock",$0.734,0.063,9.389%,"31,811,964"
PLUR,Pluri Inc. Common Stock,$3.90,UNCH,--,"31,808,197"
NERV,"Minerva Neurosciences, Inc Common Stock",$4.53,-0.17,-3.617%,"31,680,129"
VWAVW,"VisionWave Holdings, Inc. Warrant",$2.18,0.49,28.994%,"31,655,983"
FEDU,"Four Seasons Education (Cayman) Inc. American Depositary Shares, each ADS representing 10 ordinary shares",$14.00,UNCH,--,"31,640,812"
ELOG,Eastern International Ltd. Ordinary Shares,$2.63,0.10,3.953%,"31,604,710"
BURU,"Nuburu, Inc. Common Stock",$0.395,-0.005,-1.25%,"31,581,403"
SCYX,"SCYNEXIS, Inc. Common Stock",$0.753,-0.017,-2.208%,"31,569,481"
SABS,"SAB Biotherapeutics, Inc. Common Stock",$3.03,UNCH,--,"31,545,515"
MBBC,"Marathon Bancorp, Inc. Common Stock",$10.72,-0.28,-2.545%,"31,502,843"
CNF,"CNFinance Holdings Limited American Depositary Shares, each representing two hundred (200) Ordinary Shares",$4.59,0.05,1.101%,"31,479,211"
RNTX,"Rein Therapeutics, Inc. Common Stock",$1.35,-0.09,-6.25%,"31,461,896"
BOF,BranchOut Food Inc. Common Stock,$2.66,-0.21,-7.317%,"31,344,070"
FCUV,Focus Universal Inc. Common Stock,$4.24,-0.64,-13.115%,"31,319,629"
LITM,Snow Lake Resources Ltd. Common Shares,$4.00,-0.43,-9.707%,"31,293,440"
XTIA,"XTI Aerospace, Inc. Common Stock",$1.54,0.07,4.762%,"31,190,107"
TRT,Trio-Tech International Common Stock,$7.22,0.01,0.139%,"31,138,452"
MYND,"Mynd.ai, Inc. American Depositary Shares",$0.68,-0.02,-2.857%,"31,040,492"
DTST,Data Storage Corporation Common Stock,$4.27,0.047,1.113%,"31,010,602"
CRWS,Crown Crafts Inc Common Stock,$2.93,UNCH,--,"30,955,482"
SWVL,Swvl Holdings Corp Class A Common Shares,$3.1264,0.0864,2.842%,"30,946,720"
DDC,DDC Enterprise Limited Class A Ordinary Shares,$7.64,0.44,6.111%,"30,943,138"
TAOX,Tao Synergies Inc. Common Stock,$8.87,0.25,2.90%,"30,930,994"
VNTG,Vantage Corp Class A Ordinary Shares,$0.97,-0.01,-1.02%,"30,785,375"
NRXS,"Neuraxis, Inc. Common Stock",$3.11,-0.38,-10.888%,"30,660,607"
SIDU,"Sidus Space, Inc. Class A Common Stock",$1.20,UNCH,--,"30,416,980"
BCG,"Binah Capital Group, Inc. Common Stock",$1.83,0.05,2.809%,"30,382,502"
ITRM,Iterum Therapeutics plc Ordinary Share,$0.6775,-0.0171,-2.462%,"30,255,054"
BTOC,Armlogi Holding Corp. Common Stock,$0.6654,-0.0066,-0.982%,"30,237,426"
MODD,"Modular Medical, Inc. Common Stock",$0.5463,-0.0049,-0.889%,"30,196,512"
AHT,Ashford Hospitality Trust Inc Common Stock,$4.92,-0.02,-0.405%,"30,170,390"
MKDW,MKDWELL Tech Inc. Ordinary Share,$0.21,-0.0051,-2.371%,"30,160,062"
ZBAO,Zhibao Technology Inc. Class A Ordinary Shares,$0.9557,-0.0543,-5.376%,"30,127,262"
CVV,CVD Equipment Corporation Common Stock,$4.35,0.32,7.94%,"29,935,995"
KFFB,Kentucky First Federal Bancorp Common Stock,$3.70,-0.16,-4.145%,"29,920,846"
MTEN,Mingteng International Corporation Inc. Class A Ordinary Shares,$4.37,-0.7282,-14.283%,"29,889,052"
EBON,Ebang International Holdings Inc. Class A Ordinary Shares,$4.56,0.08,1.786%,"29,840,357"
MSW,Ming Shing Group Holdings Limited Ordinary Shares,$2.29,0.05,2.232%,"29,712,750"
BOSC,B.O.S. Better Online Solutions Common Stock,$5.00,0.04,0.806%,"29,617,795"
XCUR,"Exicure, Inc. Common Stock",$4.68,-0.3201,-6.402%,"29,567,271"
ASTLW,Algoma Steel Group Inc. Warrant,$0.28,-0.0598,-17.599%,"29,381,465"
NCT,Intercont (Cayman) Limited Ordinary shares,$1.09,-0.02,-1.802%,"29,293,751"
OMH,Ohmyhome Limited Class A Ordinary Shares,$1.24,0.08,6.897%,"29,251,982"
LEE,"Lee Enterprises, Incorporated Common Stock",$4.6668,0.1268,2.793%,"29,228,014"
FENG,"Phoenix New Media Limited American Depositary Shares, each representing 48 Class A ordinary shares.",$2.42,-0.008,-0.329%,"29,066,078"
CSAI,"Cloudastructure, Inc. Class A Common Stock",$1.61,0.26,19.259%,"29,042,267"
FOXX,Foxx Development Holdings Inc. Common Stock,$4.28,-0.22,-4.889%,"29,020,955"
PXS,Pyxis Tankers Inc. Common Stock,$2.76,-0.07,-2.473%,"28,940,987"
BMGL,Basel Medical Group Ltd Ordinary Shares,$1.56,-0.10,-6.024%,"28,789,800"
JBDI,JBDI Holdings Limited Ordinary Shares,$1.49,-0.12,-7.453%,"28,353,305"
DAIO,Data I/O Corporation Common Stock,$3.01,-0.03,-0.987%,"28,256,866"
WETH,Wetouch Technology Inc. Common Stock,$2.36,0.17,7.763%,"28,158,420"
MIGI,Mawson Infrastructure Group Inc. Common Stock,$1.35,-0.02,-1.46%,"28,142,238"
NNVC,"NanoViricides, Inc. Common Stock",$1.61,0.08,5.229%,"28,063,910"
NWGL,Nature Wood Group Limited American Depositary Shares,$1.69,-0.06,-3.429%,"27,974,849"
QRHC,Quest Resource Holding Corporation Common Stock,$1.35,-0.02,-1.46%,"27,961,475"
WETO,Webus International Limited Ordinary Shares,$1.27,0.09,7.627%,"27,940,000"
GDTC,CytoMed Therapeutics Limited Ordinary Shares,$2.42,0.03,1.255%,"27,926,800"
TOPS,"TOP Ships, Inc. Common Stock",$6.02,0.03,0.501%,"27,849,706"
AENTW,Alliance Entertainment Holding Corporation Warrants,$0.546,0.0002,0.037%,"27,822,724"
NSYS,Nortech Systems Incorporated Common Stock,$9.9438,0.2374,2.446%,"27,704,759"
COSM,Cosmos Health Inc. Common Stock,$0.9156,-0.1044,-10.235%,"27,663,825"
RVP,"Retractable Technologies, Inc. Common Stock",$0.924,-0.027,-2.839%,"27,661,935"
EPOW,"Sunrise New Energy Co., Ltd Class A Ordinary Shares",$1.02,-0.06,-5.556%,"27,526,689"
CTXR,"Citius Pharmaceuticals, Inc. Common Stock",$1.615,-0.205,-11.264%,"27,474,688"
DRTSW,Alpha Tau Medical Ltd. Warrant,$0.39,0.0522,15.453%,"27,448,422"
DARE,"Dare Bioscience, Inc. Common Stock",$2.03,-0.08,-3.791%,"27,363,389"
NRSN,NeuroSense Therapeutics Ltd. Ordinary Shares,$1.14,-0.04,-3.39%,"27,347,083"
UONEK,"Urban One, Inc. Class D Common Stock",$0.6001,-0.0199,-3.21%,"27,230,112"
AIFF,"Firefly Neuroscience, Inc. Common Stock",$2.03,-0.05,-2.404%,"27,187,624"
ELBM,Electra Battery Materials Corporation Common Stock,$1.50,0.02,1.351%,"26,943,260"
CVKD,"Cadrenal Therapeutics, Inc. Common Stock",$13.10,-1.0345,-7.319%,"26,813,787"
CLGN,CollPlant Biotechnologies Ltd Ordinary Shares,$2.335,0.055,2.412%,"26,746,286"
TBLAW,Taboola.com Ltd. Warrant,$0.09,-0.01,-10.00%,"26,704,700"
ROLR,"High Roller Technologies, Inc. Common Stock",$3.14,0.01,0.319%,"26,634,026"
MSAI,"MultiSensor AI Holdings, Inc. Common Stock",$0.7701,-0.1915,-19.915%,"26,625,811"
ARBEW,Arbe Robotics Ltd. Warrant,$0.25,-0.02,-7.407%,"26,290,797"
MDAIW,"Spectral AI, Inc. Warrants",$0.98,0.0475,5.094%,"26,196,368"
CLPS,CLPS Incorporation Common Stock,$0.88,-0.08,-8.333%,"26,174,238"
RLYB,Rallybio Corporation Common Stock,$0.6249,0.0149,2.443%,"26,112,366"
TC,Token Cat Limited American Depositary Shares,$15.4074,-0.0411,-0.266%,"26,064,899"
AUST,Austin Gold Corp. Common Shares,$1.96,-0.15,-7.109%,"26,012,630"
ZSPC,"zSpace, Inc. Common stock",$1.09,-0.03,-2.679%,"25,997,337"
IINN,Inspira Technologies Oxy B.H.N. Ltd. Ordinary Shares,$1.07,-0.03,-2.727%,"25,949,743"
AKTX,Akari Therapeutics plc ADS,$0.7943,0.0543,7.338%,"25,905,881"
TLPH,"Talphera, Inc. Common Stock",$1.26,0.11,9.565%,"25,858,545"
AGAE,Allied Gaming & Entertainment Inc. Common Stock,$0.6794,-0.0314,-4.418%,"25,830,028"
NXL,"Nexalin Technology, Inc. Common Stock",$1.48,0.04,2.778%,"25,778,535"
ENLV,Enlivex Therapeutics Ltd. Ordinary Shares,$1.08,0.015,1.408%,"25,757,930"
RVSN,Rail Vision Ltd. Ordinary Share,$0.4924,-0.0408,-7.652%,"25,598,984"
ARKR,Ark Restaurants Corp. Common Stock,$7.06,-0.1667,-2.307%,"25,459,468"
APLM,Apollomics Inc. Class A Ordinary Shares,$23.00,UNCH,--,"25,377,004"
SLAI,SOLAI Limited American Depositary Shares (each representing one hundred (100) Class A Ordinary Shares),$2.38,0.05,2.146%,"25,359,228"
JVA,"Coffee Holding Co., Inc. Common Stock",$4.41,-0.09,-2.00%,"25,174,922"
SGRP,"SPAR Group, Inc. Common Stock",$1.0624,-0.0076,-0.71%,"25,162,681"
IBIO,"iBio, Inc. Common Stock",$1.28,0.07,5.785%,"25,157,934"
MBNKO,"Medallion Bank Fixed-Rate Reset Non-Cumulative Perpetual Preferred Stock, Series G, par value $1.00 per share",$25.11,UNCH,--,"25,110,000"
CASI,"CASI Pharmaceuticals, Inc. Ordinary Shares",$1.62,-0.02,-1.22%,"25,098,143"
ECXWW,ECARX Holdings Inc. Warrants,$0.0725,-0.0124,-14.605%,"25,065,427"
TOPP,Toppoint Holdings Inc. Common Stock,$1.43,0.01,0.704%,"25,025,000"
PSHG,Performance Shipping Inc. Common Shares,$2.01,-0.02,-0.985%,"24,988,638"
SPWRW,SunPower Inc. Warrants,$0.30,-0.004,-1.316%,"24,932,612"
NYC,American Strategic Investment Co. Class A Common Stock,$9.48,-0.50,-5.01%,"24,929,584"
HHS,"Harte Hanks, Inc. Common Stock",$3.35,-0.11,-3.179%,"24,839,560"
NXTC,"NextCure, Inc. Common Stock",$9.2701,0.0701,0.762%,"24,807,807"
MOGU,MOGU Inc. American Depositary Shares (each  representing 25 Class A Ordinary Shares),$3.03,-0.09,-2.885%,"24,766,132"
SELX,Semilux International Ltd. Ordinary Shares,$0.661,-0.1432,-17.807%,"24,740,142"
PMN,ProMIS Neurosciences Inc. Common Shares (ON),$0.4582,0.0267,6.188%,"24,656,251"
PRZO,ParaZero Technologies Ltd. Ordinary Shares,$1.47,-0.12,-7.547%,"24,519,058"
LSTA,"Lisata Therapeutics, Inc. Common Stock",$2.80,0.45,19.149%,"24,516,654"
LGPS,LogProstyle Inc. Common Shares,$1.03,0.02,1.98%,"24,361,673"
TIRX,TIAN RUIXIANG Holdings Ltd Class A Ordinary Shares,$1.00,0.05,5.263%,"24,361,431"
LNAI,Lunai Bioworks Inc. Common Stock,$1.05,-0.03,-2.778%,"24,339,259"
TLF,"Tandy Leather Factory, Inc. Common Stock",$3.015,-0.035,-1.148%,"24,323,519"
APUS,"Apimeds Pharmaceuticals US, Inc. Common Stock",$1.93,-0.05,-2.525%,"24,271,647"
AFRIW,Forafric Global PLC Warrants,$0.90,UNCH,--,"24,211,433"
EQS,"Equus Total Return, Inc. Common Stock",$1.78,-0.0701,-3.789%,"24,183,388"
XOS,"Xos, Inc. Common Stock",$2.78,-0.04,-1.418%,"24,159,821"
UTSI,UTStarcom Holdings Corp. Ordinary Shares,$2.5455,0.0455,1.82%,"24,106,534"
SAGT,SAGTEC GLOBAL LIMITED Ordinary shares,$1.92,0.04,2.128%,"24,096,000"
IZM,ICZOOM Group Inc. Class A Ordinary Shares,$1.9968,0.0268,1.36%,"23,997,762"
CCM,Concord Medical Services Holdings Limited American Depositary Shares (Each represents thirty (30) Class A ordinary shares),$5.52,0.43,8.448%,"23,966,311"
SPCB,"SuperCom, Ltd. Ordinary Shares (Israel)",$11.02,-0.14,-1.254%,"23,944,862"
KAPA,"Kairos Pharma, Ltd. Common Stock",$1.15,0.06,5.505%,"23,855,330"
KMRK,K-Tech Solutions Company Limited Class A Ordinary Shares,$1.22,0.01,0.826%,"23,790,000"
IPW,iPower Inc. Common Stock,$22.6298,2.3346,11.503%,"23,756,538"
RMSG,Real Messenger Corporation Ordinary Shares,$2.48,0.16,6.897%,"23,736,777"
TRSG,Tungray Technologies Inc Class A Ordinary Shares,$1.45,0.05,3.571%,"23,712,553"
NCRA,"Nocera, Inc. Common Stock",$1.65,0.06,3.774%,"23,706,439"
BQ,Boqii Holding Limited Class A Ordinary Shares,$8.20,UNCH,--,"23,612,835"
BCTX,BriaCell Therapeutics Corp. Common Shares,$13.42,-0.37,-2.683%,"23,553,563"
WXM,WF International Limited Ordinary Shares,$3.41,0.15,4.601%,"23,529,000"
BGI,Birks Group Inc. Common Stock,$1.20,0.01,0.84%,"23,513,624"
GLBS,Globus Maritime Limited Common Stock,$1.14,-0.04,-3.39%,"23,463,823"
MTVA,MetaVia Inc. Common Stock,$0.9668,-0.0132,-1.347%,"23,394,442"
FEMY,Femasys Inc. Common Stock,$0.7091,0.0757,11.951%,"23,099,221"
CAPT,Captivision Inc. Ordinary Shares,$0.79,0.0033,0.419%,"23,034,537"
LEDS,SemiLEDS Corporation Common Stock,$2.80,0.25,9.804%,"23,022,728"
BNAI,Brand Engagement Network Inc. Common Stock,$0.5126,0.0676,15.191%,"23,005,896"
LIQT,"LiqTech International, Inc. Common Stock",$2.39,-0.09,-3.629%,"22,977,563"
PASG,"Passage Bio, Inc. Common Stock",$7.20,0.057,0.798%,"22,886,712"
SNYR,Synergy CHC Corp. Common Stock,$2.38,-0.08,-3.252%,"22,737,816"
MGRX,"Mangoceuticals, Inc. Common Stock",$2.14,-0.19,-8.155%,"22,546,593"
GFAI,"Guardforce AI Co., Limited Ordinary Shares",$1.07,-0.02,-1.835%,"22,495,175"
SJ,Scienjoy Holding Corporation Class A Ordinary Shares ,$0.5348,0.0148,2.846%,"22,463,417"
SQFTP,"Presidio Property Trust, Inc. 9.375% Series D Cumulative Redeemable Perpetual Preferred Stock, $0.01 par value per share",$15.37,-0.0418,-0.271%,"22,303,223"
NTCL,NETCLASS TECHNOLOGY INC Class A Ordinary Shares,$1.25,0.09,7.759%,"22,287,500"
MNDO,MIND C.T.I. Ltd. Ordinary Shares,$1.09,UNCH,--,"22,199,295"
CURX,Curanex Pharmaceuticals Inc Common Stock,$0.7999,0.1394,21.105%,"22,197,225"
LRE,"Lead Real Estate Co., Ltd American Depositary Shares",$1.62,-0.02,-1.22%,"22,099,878"
XTKG,"X3 Holdings Co., Ltd. Ordinary Shares",$1.60,-0.04,-2.439%,"22,029,072"
CKX,"CKX Lands, Inc. Common Stock",$10.7114,-0.0386,-0.359%,"21,991,886"
AYTU,"Aytu BioPharma, Inc.  Common Stock",$2.21,-0.06,-2.643%,"21,905,328"
ANY,Sphere 3D Corp. Common Shares,$0.769,-0.0197,-2.498%,"21,778,720"
DXST,Decent Holding Inc Class A Ordinary Shares,$1.34,UNCH,--,"21,775,000"
GYRO,"Gyrodyne, LLC Common Stock",$9.90,UNCH,--,"21,773,149"
SPPL,SIMPPLE LTD. Ordinary Shares,$6.1073,0.4773,8.478%,"21,618,559"
IQST,iQSTEL Inc. Common Stock,$5.98,-0.41,-6.416%,"21,571,457"
HOVRW,New Horizon Aircraft Ltd. Warrant,$0.5261,-0.0539,-9.293%,"21,553,035"
LSH,Lakeside Holding Limited Common Stock,$1.23,-0.01,-0.806%,"21,435,898"
WKSP,"Worksport, Ltd. Common Stock",$3.22,-0.18,-5.294%,"21,387,362"
JOB,GEE Group Inc. Common Stock,$0.1952,-0.0108,-5.243%,"21,357,465"
RPGL,Republic Power Group Limited Class A Ordinary Shares,$1.32,0.22,20.00%,"21,252,000"
MGIH,Millennium Group International Holdings Limited Ordinary Shares,$1.88,UNCH,--,"21,150,000"
MRM,MEDIROM Healthcare Technologies Inc. American Depositary Share,$2.66,-0.05,-1.845%,"21,019,187"
WFF,WF Holding Limited Ordinary Shares,$0.8399,0.0289,3.564%,"20,955,505"
EDHL,Everbright Digital Holding Limited Ordinary Shares,$0.79,0.03,3.947%,"20,935,000"
COHN,Cohen & Company Inc.,$10.25,0.0566,0.555%,"20,867,596"
NXGL,"NexGel, Inc Common Stock",$2.58,-0.01,-0.386%,"20,814,356"
AMBR,Amber International Holding Limited American Depositary Shares,$2.18,0.05,2.347%,"20,662,326"
DLPN,"Dolphin Entertainment, Inc. Common Stock",$1.76,0.15,9.317%,"20,658,394"
SYBX,"Synlogic, Inc. Common Stock",$1.76,-0.01,-0.565%,"20,590,097"
HUDI,"Huadi International Group Co., Ltd. Ordinary Shares",$1.44,-0.01,-0.69%,"20,562,022"
NXPL,NextPlat Corp Common Stock,$0.79,0.0098,1.256%,"20,510,810"
VVOS,"Vivos Therapeutics, Inc. Common Stock",$2.72,-0.29,-9.635%,"20,413,075"
GTEC,Greenland Technologies Holding Corporation Ordinary Shares,$1.17,-0.04,-3.306%,"20,351,244"
CING,Cingulate Inc. Common Stock,$3.76,-0.10,-2.591%,"20,351,086"
KIDZ,"Classover Holdings, Inc. Class B Common Stock",$0.8261,0.0721,9.562%,"20,337,332"
CUPR,Cuprina Holdings (Cayman) Limited Class A Ordinary Shares,$0.968,0.155,19.065%,"20,328,000"
CLSD,"Clearside Biomedical, Inc. Common Stock",$3.88,-0.02,-0.513%,"20,308,001"
LPTX,"Leap Therapeutics, Inc. Common Stock",$0.4893,0.0108,2.257%,"20,276,362"
MTC,"MMTec, Inc. Common Shares",$0.802,0.0214,2.741%,"20,199,865"
FLDDW,"Fold Holdings, Inc. Warrant",$0.43,-0.0322,-6.967%,"20,119,670"
DAVEW,Dave Inc. Warrants,$1.475,0.065,4.61%,"20,103,746"
SATLW,Satellogic Inc. Warrant,$0.19,-0.04,-17.391%,"20,057,981"
CTRM,Castor Maritime Inc. Common Shares,$2.07,-0.01,-0.481%,"20,001,073"
ADGM,"Adagio Medical Holdings, Inc Common Stock",$1.30,-0.02,-1.515%,"19,996,035"
TGHL,The GrowHub Limited Class A Ordinary Shares,$0.789,0.023,3.003%,"19,961,550"
BATL,Battalion Oil Corporation Common Stock,$1.20,-0.09,-6.977%,"19,747,876"
MXC,Mexco Energy Corporation Common Stock,$9.60,0.41,4.461%,"19,641,600"
TOIIW,"The Oncology Institute, Inc. Warrant",$0.21,-0.02,-8.696%,"19,636,001"
HCAI,"Huachen AI Parking Management Technology Holding Co., Ltd. Class A Ordinary Shares",$0.5813,-0.0187,-3.117%,"19,610,156"
ALLR,"Allarity Therapeutics, Inc. Common Stock",$1.34,-0.05,-3.597%,"19,590,312"
LEXX,Lexaria Bioscience Corp. Common Stock,$1.00,0.0714,7.689%,"19,559,179"
ORBS,Eightco Holdings Inc. Common Stock,$6.42,UNCH,--,"19,547,256"
MI,NFT Limited Class A Ordinary Share,$3.8587,0.0587,1.545%,"19,544,894"
WIMI,WiMi Hologram Cloud Inc. Class B Ordinary Shares,$3.98,0.05,1.272%,"19,543,404"
CRIS,"Curis, Inc. Common Stock",$1.56,-0.05,-3.106%,"19,498,211"
EONR,EON Resources Inc. Class A Common Stock,$0.522,0.0185,3.674%,"19,471,308"
EHLD,Euroholdings Ltd. Common Stock ,$6.86,-0.2745,-3.848%,"19,321,979"
SNES,"SenesTech, Inc. Common Stock",$3.69,-0.07,-1.862%,"19,272,925"
ELPW,Elong Power Holding Limited Class A Ordinary Shares,$0.3315,-0.0075,-2.212%,"19,245,584"
ABTS,Abits Group Inc Ordinary Shares,$8.12,-0.7597,-8.555%,"19,245,529"
BTMWW,Bitcoin Depot Inc. Warrant,$0.282,-0.028,-9.032%,"19,199,019"
ANGH,Anghami Inc. Ordinary Shares,$2.87,0.02,0.702%,"19,196,606"
IPM,Intelligent Protection Management Corp. Common Stock ,$2.07,0.07,3.50%,"19,120,563"
WVVI,"Willamette Valley Vineyards, Inc. Common Stock",$3.83,0.12,3.235%,"19,014,146"
TRIB,Trinity Biotech plc American Depositary Shares,$1.02,0.02,2.00%,"19,004,659"
JL,J-Long Group Limited Class A Ordinary Shares,$5.045,-0.495,-8.935%,"18,977,782"
PPCB,"Propanc Biopharma, Inc. Common Stock",$1.48,-0.04,-2.632%,"18,953,986"
LIXT,"Lixte Biotechnology Holdings, Inc. Common Stock",$4.15,-0.18,-4.157%,"18,929,656"
PN,Skycorp Solar Group Limited Ordinary Shares,$0.7001,0.0287,4.275%,"18,902,700"
TMDE,TMD Energy Limited Ordinary Shares,$0.7925,-0.008,-0.999%,"18,675,263"
EDSA,"Edesa Biotech, Inc. Common Shares",$2.63,-0.11,-4.015%,"18,509,014"
TOMZ,"TOMI Environmental Solutions, Inc. Common Stock",$0.92,-0.0025,-0.271%,"18,469,189"
GTIM,Good Times Restaurants Inc. Common Stock,$1.75,-0.11,-5.914%,"18,461,639"
RENT,"Rent the Runway, Inc. Class A Common Stock",$4.50,-0.40,-8.163%,"18,436,640"
TRAW,"Traws Pharma, Inc. Common Stock",$2.60,-0.11,-4.059%,"18,365,955"
HOTH,"Hoth Therapeutics, Inc. Common Stock",$1.385,0.015,1.095%,"18,363,752"
GIGM,GigaMedia Limited Ordinary Shares,$1.66,0.0362,2.229%,"18,346,710"
SBCWW,SBC Medical Group Holdings Incorporated Warrants,$0.175,UNCH,--,"18,179,219"
CJMB,Callan JMB Inc. Common Stock,$4.05,-0.06,-1.46%,"18,148,329"
FBLG,"FibroBiologics, Inc. Common Stock",$0.4328,-0.0037,-0.848%,"18,129,621"
PRHI,"Presurance Holdings, Inc. Common Stock",$1.48,-0.03,-1.987%,"18,089,864"
HTCR,"Heartcore Enterprises, Inc. Common Stock",$0.7758,-0.0283,-3.519%,"18,084,495"
CXAI,CXApp Inc. Class A Common Stock,$0.7689,-0.0069,-0.889%,"18,019,351"
IRIX,IRIDEX Corporation Common Stock,$1.06,-0.035,-3.196%,"18,011,788"
PULM,"Pulmatrix, Inc. Common Stock",$4.93,0.09,1.86%,"18,005,765"
ZCMD,Zhongchao Inc. Class A Ordinary Shares,$0.707,-0.015,-2.078%,"17,949,954"
SCNX,"Scienture Holdings, Inc. Common Stock",$1.11,-0.46,-29.299%,"17,905,610"
HBIO,"Harvard Bioscience, Inc. Common Stock",$0.402,-0.0059,-1.446%,"17,901,542"
USGOW,U.S. GoldMining Inc. Warrant,$1.39,-0.26,-15.758%,"17,628,920"
CMBM,Cambium Networks Corporation Ordinary Shares,$0.6214,-0.028,-4.312%,"17,550,702"
MDRR,"Medalist Diversified REIT, Inc. Common Stock",$13.01,-0.37,-2.765%,"17,501,833"
COCH,"Envoy Medical, Inc. Class A Common Stock",$0.8101,-0.0399,-4.694%,"17,434,107"
BGLWW,Blue Gold Limited Warrant,$0.57,0.01,1.786%,"17,425,905"
NISN,"NiSun International Enterprise Development Group Co., Ltd. Class A Common Shares",$3.63,-0.2969,-7.561%,"17,418,040"
SEGG,"Lottery.com, Inc. Common Stock",$4.41,-0.07,-1.563%,"17,376,613"
ASBP,"Aspire Biopharma Holdings, Inc. Common Stock",$0.3474,0.0031,0.90%,"17,205,322"
NAII,"Natural Alternatives International, Inc. Common Stock",$2.78,0.055,2.018%,"17,171,443"
AMST,Amesite Inc. Common Stock,$3.73,0.22,6.268%,"17,056,219"
LMFA,"LM Funding America, Inc. Common Stock",$1.12,-0.01,-0.885%,"17,022,195"
BTCT,BTC Digital Ltd. Ordinary Shares,$2.64,0.05,1.931%,"16,985,866"
MWYN,"Marwynn Holdings, Inc. Common stock",$0.9952,-0.0348,-3.379%,"16,972,145"
MTEX,"Mannatech, Incorporated Common Stock",$8.91,-0.14,-1.547%,"16,937,286"
AIMD,"Ainos, Inc. Common Stock",$3.60,-0.09,-2.439%,"16,768,300"
WKHS,"Workhorse Group, Inc. Common Stock",$1.09,-0.01,-0.909%,"16,756,860"
ABP,"Abpro Holdings, Inc Common Stock",$0.2077,0.0077,3.85%,"16,650,617"
ICU,SeaStar Medical Holding Corporation Common Stock,$0.5949,-0.0189,-3.079%,"16,606,393"
EDTK,Skillful Craftsman Education Technology Limited Ordinary Share,$1.04,-0.03,-2.804%,"16,566,629"
CIIT,"Tianci International, Inc. Common Stock",$1.00,0.0079,0.796%,"16,531,803"
MCTR,CTRL Group Limited Ordinary Shares,$1.08,UNCH,--,"16,524,000"
RYDE,Ryde Group Ltd. Class A Ordinary Shares,$0.5599,-0.0401,-6.683%,"16,399,374"
ATHA,"Athira Pharma, Inc. Common Stock",$4.15,0.08,1.966%,"16,367,322"
SOPA,Society Pass Incorporated Common Stock,$3.04,0.39,14.717%,"16,300,234"
ANNAW,"AleAnna, Inc. Warrant",$0.20,UNCH,--,"16,263,952"
ELSE,"Electro-Sensors, Inc. Common Stock",$4.695,0.0384,0.825%,"16,193,154"
GPUS,"Hyperscale Data, Inc. Common Stock",$0.4979,0.0979,24.475%,"16,004,723"
PT,Pintec Technology Holdings Limited American Depositary Shares,$1.00,0.0499,5.252%,"15,947,960"
DTSS,Datasea Inc. Common Stock,$1.93,-0.0006,-0.031%,"15,935,655"
YHGJ,Yunhong Green CTI Ltd. Common Stock,$5.71,0.11,1.964%,"15,838,752"
MMA,Mixed Martial Arts Group Limited Ordinary Shares,$1.54,-0.01,-0.645%,"15,835,336"
CMMB,Chemomab Therapeutics Ltd. American Depositary Share,$3.05,-0.20,-6.154%,"15,832,782"
EFOI,"Energy Focus, Inc. Common Stock",$2.88,0.02,0.699%,"15,767,611"
INTJ,Intelligent Group Limited Class A Ordinary Shares ,$0.5122,-0.0278,-5.148%,"15,750,150"
WVVIP,"Willamette Valley Vineyards, Inc. Series A Redeemable Preferred Stock",$3.17,UNCH,--,"15,737,557"
IPST,"Heritage Distilling Holding Company, Inc. Common Stock",$0.599,-0.029,-4.618%,"15,717,177"
BLIN,"Bridgeline Digital, Inc. Common Stock",$1.295,-0.005,-0.385%,"15,685,128"
PCSA,"Processa Pharmaceuticals, Inc. Common Stock",$0.311,0.0008,0.258%,"15,658,585"
AIRI,Air Industries Group Common Stock,$3.28,-0.06,-1.796%,"15,652,009"
PRPH,"ProPhase Labs, Inc. Common Stock (DE)",$0.3757,-0.0108,-2.794%,"15,607,031"
AURE,Prestige Wealth Inc. Class A Ordinary Shares,$0.4919,-0.0527,-9.677%,"15,564,680"
PHGE,BiomX Inc. COmmon Stock,$0.585,0.005,0.862%,"15,522,324"
VSTD,Vestand Inc. Class A Common Stock,$1.09,-0.08,-6.838%,"15,505,228"
EHGO,Eshallgo Inc. Class A Ordinary Shares,$0.52,-0.018,-3.346%,"15,440,965"
TAIT,Taitron Components Incorporated Class A Common Stock,$2.552,-0.008,-0.313%,"15,366,051"
HCTI,"Healthcare Triangle, Inc. Common Stock",$2.63,-0.05,-1.866%,"15,337,710"
AIXI,XIAO-I Corporation American Depositary Shares,$1.23,0.01,0.82%,"15,326,213"
LPCN,Lipocine Inc. Common Stock,$2.82,-0.08,-2.759%,"15,281,713"
FIEE,"FiEE, Inc Common Stock",$2.45,-0.02,-0.81%,"15,249,753"
PASW,"Ping An Biomedical Co., Ltd. Ordinary Shares",$0.7425,-0.0075,-1.00%,"15,221,250"
PLAG,Planet Green Holdings Corp. Common Stock,$2.09,0.07,3.465%,"15,220,872"
TXMD,"TherapeuticsMD, Inc. Common Stock",$1.31,0.02,1.55%,"15,162,414"
PALI,"Palisade Bio, Inc. Common Stock",$1.66,-0.08,-4.598%,"15,137,792"
OSRH,"OSR Holdings, Inc. Common Stock",$0.699,0.0954,15.805%,"15,088,167"
SHMDW,SCHMID Group N.V. Warrants,$0.3501,-0.0299,-7.868%,"15,045,499"
MBRX,"Moleculin Biotech, Inc. Common Stock",$0.4959,0.0099,2.037%,"15,018,911"
PMNT,Perfect Moment Ltd. Common Stock,$0.477,-0.032,-6.287%,"14,976,284"
GTI,Graphjet Technology Class A Ordinary Shares,$4.65,-0.21,-4.321%,"14,926,788"
HIND,"Vyome Holdings, Inc. Common Stock",$5.52,0.03,0.546%,"14,867,226"
SMSI,"Smith Micro Software, Inc. Common Stock",$0.706,-0.0088,-1.231%,"14,822,411"
DLXY,Delixy Holdings Limited Ordinary Shares,$0.9062,-0.0019,-0.209%,"14,816,370"
HKPD,Hong Kong Pharma Digital Technology Holdings Limited Ordinary shares,$1.345,-0.055,-3.929%,"14,795,000"
HUBC,Hub Cyber Security Ltd. Ordinary Shares,$1.47,-0.12,-7.547%,"14,769,525"
IMRN,Immuron Limited American Depositary Shares,$2.20,0.05,2.326%,"14,752,098"
OP,OceanPal Inc. Common Stock,$2.20,0.08,3.774%,"14,731,424"
USEA,United Maritime Corporation Common Stock,$1.665,0.015,0.909%,"14,725,705"
ALUR,"Allurion Technologies, Inc. Common Stock",$1.89,-0.06,-3.077%,"14,671,467"
SRTAW,"Strata Critical Medical, Inc. Warrants",$0.1789,-0.0211,-10.55%,"14,615,344"
YMAT,"J-Star Holding Co., Ltd. Ordinary Shares",$0.8581,-0.0242,-2.743%,"14,598,758"
NCL,Northann Corp. Common Stock,$0.649,-0.0257,-3.809%,"14,586,112"
BANL,CBL International Limited Ordinary Shares,$0.5283,-0.0035,-0.658%,"14,528,250"
GOVX,"GeoVax Labs, Inc. Common Stock",$0.5726,0.0061,1.077%,"14,520,903"
LVLU,"Lulu's Fashion Lounge Holdings, Inc. Common Stock",$5.24,0.23,4.591%,"14,404,393"
SEED,Origin Agritech Limited Common Stock,$2.00,0.21,11.732%,"14,399,996"
CCTG,CCSC Technology International Holdings Limited Class A Ordinary Shares,$1.24,0.06,5.085%,"14,360,750"
