Symbol,Name,Last Sale,Net Change,% Change,Market Cap
TDTH,Trident Digital Tech Holdings Ltd American Depository Shares,$2.21,-0.24,-9.796%,"10,259,240"
PETZ,"TDH Holdings, Inc. Common Shares",$0.989,-0.021,-2.079%,"10,209,712"
CDT,CDT Equity Inc. Common Stock,$2.10,-0.16,-7.08%,"10,202,535"
BON,Bon Natural Life Limited Class A Ordinary Shares,$1.2499,-0.0501,-3.854%,"10,160,200"
ARBB,ARB IOT Group Limited Ordinary Shares,$5.75,1.10,23.656%,"10,150,222"
SFHG,Samfine Creation Holdings Group Limited Class A Ordinary Share,$2.50,-0.04,-1.575%,"10,150,000"
VVOS,"Vivos Therapeutics, Inc. Common Stock",$0.7445,-0.0627,-7.768%,"10,135,868"
MARPS,Marine Petroleum Trust Units of Beneficial Interest,$5.02,0.01,0.20%,"10,040,000"
CREG,Smart Powerr Corp. Common Stock,$0.435,-0.113,-20.62%,"9,987,221"
SINT,"SiNtx Technologies, Inc. Common Stock",$2.42,0.01,0.415%,"9,974,579"
ETS,Elite Express Holding Inc. Class A Common Stock,$0.5867,0.019,3.347%,"9,807,671"
BIAF,"bioAffinity Technologies, Inc. Common Stock",$2.18,-0.01,-0.457%,"9,807,112"
GNPX,"Genprex, Inc. Common Stock",$0.939,0.021,2.288%,"9,781,939"
AIXI,XIAO-I Corporation American Depositary Shares,$0.785,-0.0299,-3.669%,"9,781,364"
MBAI,Check-Cap Ltd. Ordinary Share,$1.39,-0.06,-4.138%,"9,758,498"
ELAB,PMGC Holdings Inc. Common Stock,$2.33,-0.18,-7.171%,"9,758,226"
GAUZ,Gauzy Ltd. Ordinary Shares,$0.5204,-0.1578,-23.267%,"9,753,385"
AWX,Avalon Holdings Corporation Common Stock,$2.50,0.01,0.402%,"9,748,578"
BOLT,"Bolt Biotherapeutics, Inc. Common Stock",$5.06,UNCH,--,"9,723,129"
INEO,INNEOVA Holdings Limited Class A Ordinary Shares,$0.60,0.0323,5.69%,"9,702,374"
KITT,"Nauticus Robotics, Inc. Common stock",$2.22,-0.14,-5.932%,"9,678,407"
MWG,Multi Ways Holdings Limited Class A Ordinary Shares,$1.88,-0.0065,-0.345%,"9,666,960"
MRM,MEDIROM Healthcare Technologies Inc. American Depositary Share,$1.22,UNCH,--,"9,640,379"
SQFTP,"Presidio Property Trust, Inc. 9.375% Series D Cumulative Redeemable Perpetual Preferred Stock, $0.01 par value per share",$6.68,0.17,2.611%,"9,630,409"
DTSS,Datasea Intelligent Technology Ltd. Class A Ordinary Shares,$0.9188,-0.0188,-2.005%,"9,598,844"
LIMN,"Liminatus Pharma, Inc. Class A Common Stock",$0.2131,0.0079,3.85%,"9,563,424"
HTOO,Fusion Fuel Green PLC Class A Ordinary Shares,$3.11,-0.055,-1.738%,"9,385,489"
WLDSW,Wearable Devices Ltd. Warrant,$2.65,UNCH,--,"9,357,351"
MSN,Emerson Radio Corporation Common Stock,$0.4403,0.0003,0.068%,"9,265,080"
CALC,"CalciMedica, Inc. Common Stock",$0.5853,-0.0033,-0.561%,"9,214,914"
NCNA,NuCana plc American Depositary Share,$2.21,-0.04,-1.778%,"9,197,956"
MTEX,"Mannatech, Incorporated Common Stock",$4.75,0.37,8.447%,"9,165,933"
RVYL,Ryvyl Inc. Common Stock,$7.16,0.09,1.273%,"9,163,117"
CETY,"Clean Energy Technologies, Inc. Common Stock",$0.7475,0.0865,13.086%,"9,094,164"
CCHH,CCH Holdings Ltd Ordinary Shares,$0.4701,-0.0099,-2.063%,"9,049,425"
XTLB,XTL Biopharmaceuticals Ltd. American Depositary Shares,$3.82,0.17,4.658%,"9,036,623"
YCBD,"cbdMD, Inc. Common Stock",$0.8559,-0.0141,-1.621%,"8,983,151"
TKLF,"Tokyo Lifestyle Co., Ltd. American Depositary Shares",$2.11,-0.13,-5.804%,"8,931,168"
VSEE,"VSee Health, Inc. Common Stock",$0.1888,-0.0021,-1.10%,"8,930,131"
DETX,"Liberty Defense Holdings, Ltd. Common Shares",$4.50,0.375,9.091%,"8,929,364"
CLWT,Euro Tech Holdings Company Limited Common Stock,$1.20,0.01,0.84%,"8,893,757"
YJ,Yunji Inc. American Depository Shares,$1.80,0.0899,5.257%,"8,865,972"
LOBO,LOBO TECHNOLOGIES LTD. Class A Ordinary Shares,$0.639,-0.0048,-0.746%,"8,844,998"
CLRO,"ClearOne, Inc. Common Stock",$3.27,-0.24,-6.838%,"8,748,597"
DKI,DarkIris Inc. Class A Ordinary Shares,$0.4331,-0.0668,-13.363%,"8,716,138"
MTR,Mesa Royalty Trust Common Stock,$4.66,-0.06,-1.271%,"8,684,329"
DTST,Data Storage Corporation Common Stock,$3.99,0.04,1.013%,"8,646,881"
MSS,Maison Solutions Inc. Class A Common Stock,$1.46,0.24,19.672%,"8,590,787"
ZCMD,Zhongchao Inc. Class A Ordinary Shares,$2.22,0.09,4.225%,"8,557,518"
TNON,"Tenon Medical, Inc. Common Stock",$0.756,-0.0263,-3.362%,"8,540,062"
SYNX,Silynxcom Ltd. Ordinary Shares,$1.28,0.01,0.787%,"8,492,083"
TGHL,The GrowHub Limited Class A Ordinary Shares,$0.335,-0.0342,-9.263%,"8,475,436"
IPDN,"Professional Diversity Network, Inc. Common Stock",$0.797,-0.013,-1.605%,"8,387,654"
BTCT,BTC Digital Ltd. Ordinary Shares,$1.30,0.07,5.691%,"8,364,252"
FTRK,FAST TRACK GROUP Ordinary shares,$0.38,0.0118,3.205%,"8,288,750"
ILAG,Intelligent Living Application Group Inc. Ordinary Shares,$3.98,0.22,5.851%,"8,266,253"
FLDDW,"Fold Holdings, Inc. Warrant",$0.164,-0.0009,-0.546%,"8,235,837"
TDIC,Dreamland Limited Class A Ordinary Shares,$1.11,-0.10,-8.264%,"8,214,000"
HKIT,Hitek Global Inc. Class A Ordinary Share,$0.85,0.1399,19.701%,"8,212,208"
GRDX,GridAI Technologies Corp. Common Stock,$2.43,-0.09,-3.571%,"8,169,424"
PMCB,"PharmaCyte  Biotech, Inc. Common Stock",$0.76,0.0047,0.622%,"8,159,093"
ACON,"Aclarion, Inc. Common Stock",$3.31,-0.11,-3.216%,"8,150,048"
ADVB,Advanced Biomed Inc. Common Stock,$5.96,0.69,13.093%,"8,132,635"
FTFT,Future FinTech Group Inc. Common Stock,$1.55,UNCH,--,"8,122,843"
NCL,Northann Corp. Common Stock,$0.151,-0.007,-4.43%,"8,113,696"
FBGL,FBS Global Limited Ordinary Shares,$0.6063,0.0289,5.005%,"8,108,225"
YHGJ,Yunhong Green CTI Ltd. Common Stock,$3.12,-0.08,-2.50%,"8,103,773"
ZOOZW,ZOOZ Strategy Ltd. Warrant,$0.05,-0.0018,-3.475%,"8,101,124"
IFBD,"Infobird Co., Ltd Ordinary Shares",$0.9829,UNCH,--,"8,048,549"
CELZ,"Creative Medical Technology Holdings, Inc. Common Stock",$2.17,-0.07,-3.125%,"8,021,770"
ORGN,"Origin Materials, Inc. Common Stock",$1.47,-1.19,-44.737%,"7,974,804"
SNES,"SenesTech, Inc. Common Stock",$1.50,-0.055,-3.537%,"7,898,616"
PCLA,PicoCELA Inc. American Depositary Shares,$1.90,-0.05,-2.564%,"7,892,230"
SOS,SOS Limited Class A Ordinary Shares,$1.16,-0.03,-2.521%,"7,880,894"
HWH,HWH International Inc. Common Stock,$1.05,-0.02,-1.869%,"7,850,220"
KXIN,Kaixin Holdings Ordinary Shares,$4.74,0.2126,4.696%,"7,838,837"
NXL,"Nexalin Technology, Inc. Common Stock",$0.3804,0.0001,0.026%,"7,829,258"
LCFY,Locafy Limited Ordinary Share,$4.34,-0.10,-2.252%,"7,807,899"
AGRZ,Agroz Inc. Ordinary Shares,$0.3817,0.0257,7.219%,"7,795,644"
BCAB,"BioAtla, Inc. Common Stock",$4.70,0.43,10.07%,"7,787,552"
OXBR,Oxbridge Re Holdings Limited Ordinary Shares,$0.96,-0.01,-1.031%,"7,777,319"
GRRRW,Gorilla Technology Group Inc. Warrant,$0.2801,-0.0299,-9.645%,"7,745,846"
CLIK,Click Holdings Limited Class A Ordinary Share,$2.37,-0.40,-14.44%,"7,733,388"
XPON,Expion360 Inc. Common Stock,$0.7094,0.0086,1.227%,"7,694,248"
XAIR,"Beyond Air, Inc. Common Stock",$0.577,0.063,12.257%,"7,612,179"
MTVA,MetaVia Inc. Common Stock,$1.47,0.03,2.083%,"7,591,624"
MLEC,Moolec Science SA Ordinary Shares,$10.45,0.08,0.771%,"7,587,933"
SILO,"Silo Pharma, Inc. Common Stock",$0.461,0.006,1.319%,"7,498,899"
EVGN,Evogene Ltd Ordinary Shares,$0.752,-0.014,-1.828%,"7,440,111"
ONCO,"Onconetix, Inc. Common Stock",$0.6469,0.0119,1.874%,"7,416,432"
SCKT,"Socket Mobile, Inc. Common Stock",$0.90,-0.002,-0.222%,"7,400,662"
CRE,Cre8 Enterprise Limited Class A Ordinary Shares,$3.67,1.26,52.282%,"7,391,325"
ACXP,"Acurx Pharmaceuticals, Inc. Common Stock",$2.13,-0.03,-1.389%,"7,374,963"
IQST,iQSTEL Inc. Common Stock,$1.45,0.03,2.113%,"7,352,577"
WBUY,WEBUY GLOBAL LTD. Class A Ordinary Shares,$1.34,0.03,2.29%,"7,344,679"
HXHX,Haoxin Holdings Limited Class A Ordinary Shares,$0.5299,-0.0503,-8.669%,"7,286,125"
SONM,"DNA X, Inc. Common Stock",$4.88,-0.01,-0.204%,"7,262,748"
TGL,Treasure Global Inc. Common Stock,$4.32,0.12,2.857%,"7,239,132"
FBLG,"FibroBiologics, Inc. Common Stock",$1.38,-0.08,-5.479%,"7,188,303"
FMFC,Kandal M Venture Limited Class A Ordinary Shares,$0.375,0.0035,0.942%,"7,170,000"
WFF,WF Holding Limited Ordinary Shares,$1.42,0.0598,4.396%,"7,153,986"
PCSA,"Processa Pharmaceuticals, Inc. Common Stock",$2.68,0.13,5.098%,"7,128,905"
CANF,"Can-Fite Biopharma Ltd American Depositary Shares, each representing two (2) Ordinary Shares",$3.32,0.39,13.311%,"7,113,256"
RNAZ,"TransCode Therapeutics, Inc. Common Stock",$7.74,-0.09,-1.149%,"7,097,332"
JCTC,Jewett-Cameron Trading Company Common Shares,$2.01,0.01,0.50%,"7,075,427"
WAFU,Wah Fu Education Group Limited Ordinary Shares,$1.60,-0.03,-1.84%,"7,056,894"
RAY,Raytech Holding Limited Ordinary Shares,$2.57,0.07,2.80%,"7,002,942"
NVNO,enVVeno Medical Corporation Common Stock,$10.68,0.18,1.714%,"7,000,964"
TULP,"Bloomia Holdings, Inc. Common Stock",$3.9439,0.0239,0.61%,"6,993,004"
POLA,"Polar Power, Inc. Common Stock",$1.91,0.06,3.243%,"6,952,704"
JXG,JX Luxventure Group Inc. Common Stock,$3.72,-0.06,-1.587%,"6,943,834"
OLB,"The OLB Group, Inc. Common Stock",$0.551,-0.0136,-2.409%,"6,890,668"
AKTX,Akari Therapeutics plc ADS,$5.99,0.52,9.506%,"6,856,082"
APM,Aptorum Group Limited Class A Ordinary Shares,$0.84,-0.0401,-4.556%,"6,840,756"
VS,Versus Systems Inc. Common Stock,$1.39,0.05,3.731%,"6,813,331"
XBIO,"Xenetic Biosciences, Inc. Common Stock",$2.96,-0.01,-0.337%,"6,781,526"
ENVB,"Enveric Biosciences, Inc. Common Stock",$3.41,-0.58,-14.536%,"6,770,674"
UGRO,"urban-gro, Inc. Common Stock",$6.00,UNCH,--,"6,768,840"
ONFO,Onfolio Holdings Inc. Common Stock,$1.15,-0.13,-10.156%,"6,742,697"
BMRA,"Biomerica, Inc. Common Stock",$2.16,-0.03,-1.37%,"6,674,981"
USGOW,U.S. GoldMining Inc. Warrant,$0.50,0.1517,43.554%,"6,661,247"
MSGY,Masonglory Limited Ordinary Shares,$0.4719,0.0114,2.476%,"6,606,600"
LUCY,"Innovative Eyewear, Inc. Common Stock",$1.0398,0.0086,0.834%,"6,551,427"
IOTR,iOThree Limited Ordinary Shares,$2.55,-0.10,-3.774%,"6,540,753"
HSCS,HeartSciences Inc. Common Stock,$2.04,0.05,2.513%,"6,496,788"
MIMI,Mint Incorporation Limited Class A Ordinary Shares,$0.258,-0.0341,-11.674%,"6,453,225"
RENX,RenX Enterprises Corp. Common Stock,$2.57,-0.14,-5.166%,"6,444,370"
GLE,Global Engine Group Holding Limited Class A Ordinary Shares,$0.3521,0.0071,2.058%,"6,443,430"
APVO,Aptevo Therapeutics Inc. Common Stock,$5.45,0.53,10.772%,"6,440,401"
AMBO,Ambow Education Holding Ltd. American Depository Shares (each representing twenty (20) Class A Ordinary Shares),$2.25,-0.03,-1.316%,"6,435,725"
GELS,Gelteq Limited Ordinary Shares,$0.60,-0.0579,-8.801%,"6,426,635"
BCTXL,BriaCell Therapeutics Corp. Warrant expiring 2031,$0.88,-0.165,-15.789%,"6,380,429"
CNSP,"CNS Pharmaceuticals, Inc. Common Stock",$7.84,5.5289,239.232%,"6,361,760"
GLXG,Galaxy Payroll Group Limited Class A Ordinary Shares,$1.06,0.04,3.922%,"6,319,206"
WCT,Wellchange Holdings Company Limited Class A Ordinary shares,$2.0513,0.1213,6.285%,"6,287,850"
LGCB,Linkage Global Inc. Class A Ordinary Shares,$0.5613,0.0113,2.055%,"6,265,524"
BNZI,"Banzai International, Inc. Class A Common Stock",$0.335,0.0344,11.444%,"6,194,855"
BRTX,"BioRestorative Therapies, Inc. Common Stock (NV)",$0.242,0.0087,3.729%,"6,165,717"
SUGP,SU Group Holdings Limited Class A Ordinary Shares,$4.20,-0.13,-3.002%,"6,152,042"
AMZE,"Amaze Holdings, Inc. Common Stock",$0.1364,-0.0051,-3.604%,"6,139,010"
CJMB,Callan JMB Inc. Common Stock,$1.09,-0.02,-1.802%,"6,133,831"
NDRA,ENDRA Life Sciences Inc. Common Stock,$4.94,-0.01,-0.202%,"6,129,310"
SXTC,"China SXT Pharmaceuticals, Inc. Class A Ordinary Shares",$2.07,UNCH,--,"6,123,219"
DAIC,"CID HoldCo, Inc. Common Stock",$0.2087,-0.0028,-1.324%,"6,113,516"
HCWC,Healthy Choice Wellness Corp. Class A Common Stock,$0.2686,0.0007,0.261%,"6,110,872"
JWEL,Jowell Global Ltd. Ordinary Shares,$2.5499,0.0637,2.562%,"6,058,896"
CLGN,CollPlant Biotechnologies Ltd Ordinary Shares,$0.418,0.0074,1.802%,"6,025,524"
TCRT,"Alaunos Therapeutics, Inc. Common Stock",$2.5301,-0.0799,-3.061%,"6,017,218"
ALP,Alpha Compute Corp Common Stock,$0.256,0.016,6.667%,"5,999,255"
ITOC,iTonic Holdings Ltd Class A Ordinary Shares,$0.351,-0.0017,-0.482%,"5,984,550"
CNEY,CN Energy Group Inc. Class A Ordinary Shares,$0.7282,0.0148,2.075%,"5,973,648"
ORKT,Orangekloud Technology Inc. Class A Ordinary Shares,$1.02,-0.02,-1.923%,"5,956,565"
DSS,"DSS, Inc. Common Stock",$0.593,0.0196,3.418%,"5,955,213"
SMTK,"SmartKem, Inc. Common Stock",$0.2798,0.0448,19.064%,"5,932,574"
MEGL,Magic Empire Global Limited Class A Ordinary Shares,$1.17,UNCH,--,"5,924,939"
DUO,Fangdd Network Group Ltd. Class A Ordinary Shares,$1.52,-0.03,-1.935%,"5,924,670"
MITQ,"Moving iMage Technologies, Inc. Common Stock",$0.593,-0.003,-0.503%,"5,897,453"
CAPS,Capstone Holding Corp. Common Stock,$0.408,-0.0141,-3.34%,"5,889,849"
DFSC,DEFSEC Technologies Inc. Common Stock,$2.95,UNCH,--,"5,881,197"
BYAH,"Park Ha Biological Technology Co., Ltd. Class A Ordinary Shares",$1.20,0.07,6.195%,"5,869,735"
SLE,"Super League Enterprise, Inc. Common Stock",$4.01,0.08,2.036%,"5,856,400"
CENN,Cenntro Inc. Common Stock,$3.98,-0.24,-5.687%,"5,831,552"
CDIO,Cardio Diagnostics Holdings Inc. Common stock,$1.97,0.09,4.787%,"5,830,154"
WNW,Meiwu Technology Company Limited Ordinary Shares,$4.38,0.11,2.576%,"5,827,463"
HYFM,"Hydrofarm Holdings Group, Inc. Common Stock",$1.22,0.02,1.667%,"5,812,827"
CRGOW,Freightos Limited Warrants,$0.1123,0.0008,0.717%,"5,804,057"
TWAV,"TaoWeave, Inc. Common Stock",$1.73,-0.04,-2.26%,"5,756,073"
BKYI,"BIO-key International, Inc. Common Stock",$5.29,-0.04,-0.75%,"5,740,771"
MGRX,"Mangoceuticals, Inc. Common Stock",$0.338,0.0202,6.356%,"5,734,988"
YAAS,Youxin Technology Ltd Class A Ordinary shares,$1.23,-0.05,-3.906%,"5,704,986"
MBIO,"Mustang Bio, Inc. Common Stock",$0.752,-0.0024,-0.318%,"5,698,263"
CODX,"Co-Diagnostics, Inc. Common Stock",$1.57,0.02,1.29%,"5,655,870"
CWD,CaliberCos Inc. Class A Common Stock,$0.80,-0.29,-26.606%,"5,642,450"
JCSE,JE Cleantech Holdings Limited Ordinary Shares,$1.07,-0.06,-5.31%,"5,628,478"
CTNT,Cheetah Net Supply Chain Service Inc Class A Common Stock,$2.86,-0.13,-4.348%,"5,603,724"
CUPR,Cuprina Holdings (Cayman) Limited Class A Ordinary Shares,$0.2612,0.009,3.569%,"5,602,740"
MTEN,Mingteng International Corporation Inc. Class A Ordinary Shares,$1.11,0.0299,2.768%,"5,593,136"
ANY,Sphere 3D Corp. Common Shares,$1.47,-0.10,-6.369%,"5,537,616"
AZI,Autozi Internet Technology (Global) Ltd. Class A Ordinary Shares,$1.21,-0.05,-3.968%,"5,506,023"
WAI,Top KingWin Ltd Class A Ordinary Shares,$2.3201,0.1101,4.982%,"5,469,000"
NWTG,"Newton Golf Company, Inc. Common Stock",$1.19,-0.02,-1.653%,"5,464,555"
XHLD,"TEN Holdings, Inc. Common Stock",$1.37,0.15,12.295%,"5,449,097"
IMRN,Immuron Limited American Depositary Shares,$0.8058,0.0138,1.742%,"5,403,291"
SBFM,Sunshine Biopharma Inc. Common Stock,$1.10,0.045,4.265%,"5,396,540"
AIHS,Senmiao Technology Limited Common Stock,$1.17,-0.0299,-2.492%,"5,332,262"
CYCU,"Cycurion, Inc. Common Stock",$0.967,-0.026,-2.618%,"5,328,158"
VSTD,Vestand Inc. Class A Common Stock,$0.3732,0.0099,2.725%,"5,308,763"
RDHL,Redhill Biopharma Ltd. American Depositary Shares,$1.04,-0.045,-4.147%,"5,296,019"
CHNR,"China Natural Resources, Inc. Common Stock",$4.29,0.16,3.874%,"5,290,518"
SNTG,Sentage Holdings Inc. Class A Ordinary Shares,$1.885,-0.0248,-1.299%,"5,288,038"
JDZG,JIADE LIMITED Class A Ordinary Shares,$1.22,0.03,2.521%,"5,264,052"
ASTLW,Algoma Steel Group Inc. Warrant,$0.05,-0.003,-5.66%,"5,246,690"
SOPA,Society Pass Incorporated Common Stock,$0.403,-0.004,-0.983%,"5,233,900"
DRMA,"Dermata Therapeutics, Inc. Common Stock",$1.30,-0.03,-2.256%,"5,228,786"
SOAR,"Volato Group, Inc. Class A Common Stock",$0.258,-0.003,-1.149%,"5,189,734"
SQFT,"Presidio Property Trust, Inc. Class A Common Stock",$3.59,0.14,4.058%,"5,175,624"
GURE,"Gulf Resources, Inc. (NV) Common Stock",$3.36,-0.15,-4.274%,"5,172,824"
NXGL,"NexGel, Inc Common Stock",$0.6095,0.0284,4.887%,"5,165,935"
BETRW,Better Home & Finance Holding Company Warrant,$0.2701,UNCH,--,"5,096,463"
ASTC,Astrotech Corporation (DE) Common Stock,$2.89,-0.08,-2.694%,"5,083,374"
CIIT,"Tianci International, Inc. Common Stock",$1.39,-0.06,-4.138%,"5,030,281"
EJH,E-Home Household Service Holdings Limited Ordinary Shares,$1.57,-0.05,-3.086%,"5,024,242"
MKZR,"MacKenzie Realty Capital, Inc. Common Stock",$2.55,-0.25,-8.929%,"5,014,320"
QUCY,Quantum Cyber N.V. Ordinary Shares,$0.40,-0.0106,-2.582%,"5,006,134"
INBS,Intelligent Bio Solutions Inc. Common Stock,$2.50,0.09,3.734%,"5,002,933"
GP,GreenPower Motor Company Inc. Common Shares,$0.9925,-0.0275,-2.696%,"4,991,571"
PGYWW,Pagaya Technologies Ltd. Warrants,$0.0598,0.0046,8.333%,"4,935,081"
BGLC,BioNexus Gene Lab Corp Common stock,$2.04,-0.0387,-1.862%,"4,931,321"
PHGE,BiomX Inc. COmmon Stock,$0.75,-0.0396,-5.015%,"4,907,637"
YDKG,Yueda Digital Holding Class A Ordinary Share,$0.8844,0.023,2.67%,"4,890,015"
FRSX,Foresight Autonomous Holdings Ltd. American Depositary Shares,$2.04,UNCH,--,"4,889,423"
SUNE,"SUNation Energy, Inc. Common Stock",$1.43,-0.09,-5.921%,"4,871,461"
YMAT,"J-Star Holding Co., Ltd. Class A Ordinary Shares",$0.242,-0.023,-8.679%,"4,852,225"
ASPSW,Altisource Portfolio Solutions S.A. Net Settle Stakeholder Warrants,$0.43,0.0299,7.473%,"4,849,948"
LCFYW,Locafy Limited Warrant,$2.69,UNCH,--,"4,839,458"
AQB,"AquaBounty Technologies, Inc. Common Stock",$0.9375,0.005,0.536%,"4,825,504"
EEIQ,EpicQuest Education Group International Limited Common Stock,$3.26,-0.02,-0.61%,"4,823,102"
STFS,Star Fashion Culture Holdings Limited Class A Ordinary Shares,$4.04,UNCH,--,"4,822,750"
INDP,"Indaptus Therapeutics, Inc. Common Stock",$2.15,0.01,0.467%,"4,820,997"
ARBEW,Arbe Robotics Ltd. Warrant,$0.0441,0.005,12.788%,"4,815,196"
SMX,SMX (Security Matters) Public Limited Company Ordinary Shares,$1.57,-0.02,-1.258%,"4,811,160"
SNYR,Synergy CHC Corp. Common Stock,$0.3221,0.0021,0.656%,"4,799,252"
PULM,"Pulmatrix, Inc. Common Stock",$1.31,0.02,1.55%,"4,784,493"
FFAIW,Faraday Future Intelligent Electric Inc. Warrant,$0.0154,0.0025,19.38%,"4,762,736"
RPGL,Republic Power Group Limited Class A Ordinary Shares,$1.52,-0.17,-10.059%,"4,721,543"
YYGH,YY Group Holding Limited Class A Ordinary Shares,$0.738,-0.1124,-13.217%,"4,694,954"
VSA,VisionSys AI Inc. American Depositary Shares,$0.7477,-0.0158,-2.069%,"4,647,007"
SHPH,"Shuttle Pharmaceuticals Holdings, Inc. Common Stock",$0.8269,0.1352,19.546%,"4,623,438"
COCHW,"Envoy Medical, Inc Warrant",$0.06,-0.0096,-13.793%,"4,612,867"
AMST,Amesite Inc. Common Stock,$0.9996,-0.0504,-4.80%,"4,570,884"
RBNE,Robin Energy Ltd. Common Stock,$1.63,0.01,0.617%,"4,523,030"
WALDW,Waldencast plc Warrant ,$0.0349,0.0044,14.426%,"4,476,270"
IZM,ICZOOM Group Inc. Class A Ordinary Shares,$0.372,-0.0084,-2.208%,"4,470,737"
EVGOW,EVgo Inc. Warrants,$0.014,0.0017,13.821%,"4,390,120"
NCRA,"Nocera, Inc. Common Stock",$0.257,0.034,15.247%,"4,388,396"
HTCR,"Heartcore Enterprises, Inc. Common Stock",$3.45,-0.11,-3.09%,"4,387,662"
WHLRP,"Wheeler Real Estate Investment Trust, Inc. Class B Preferred Stock",$7.25,UNCH,--,"4,381,712"
BAOS,Baosheng Media Group Holdings Limited Ordinary shares,$2.85,0.20,7.547%,"4,373,288"
HCTI,"Healthcare Triangle, Inc. Common Stock",$2.21,-0.09,-3.913%,"4,348,369"
GSUN,Golden Sun Technology Group Limited Class A Ordinary Shares,$0.4335,-0.1387,-24.24%,"4,347,515"
MTNB,"Matinas Biopharma Holdings, Inc. Common Stock",$0.67,-0.029,-4.149%,"4,292,148"
FABC,"Fabric.AI, Inc. Common Stock",$2.94,0.20,7.299%,"4,280,567"
JTAI,Jet.AI Inc. Common Stock,$7.18,0.15,2.134%,"4,279,625"
ESLAW,"Estrella Immunopharma, Inc. Warrant",$0.10,-0.0257,-20.446%,"4,266,523"
AMIX,"Autonomix Medical, Inc. Common Stock",$0.3728,0.0028,0.757%,"4,253,403"
SXTP,"60 Degrees Pharmaceuticals, Inc. Common Stock",$1.61,-0.05,-3.012%,"4,245,229"
BOXL,Boxlight Corporation Class A Common Stock,$1.06,-0.02,-1.852%,"4,241,809"
AIM,AIM ImmunoTech Inc. Common Stock,$0.5166,0.0013,0.252%,"4,226,830"
ALZN,"Alzamend Neuro, Inc. Common Stock",$1.11,-0.01,-0.893%,"4,223,263"
FEED,"ENvue Medical, Inc. Common Stock",$1.14,-0.05,-4.202%,"4,219,035"
XRTX,XORTX Therapeutics Inc. Common Shares,$2.98,0.20,7.194%,"4,149,483"
SPRC,SciSparc Ltd. Ordinary Shares,$7.235,-0.675,-8.534%,"4,147,413"
AZTR,Azitra Inc Common Stock,$0.2559,0.0086,3.478%,"4,143,645"
ATXG,Addentax Group Corp. Common Stock,$5.29,0.16,3.119%,"4,131,612"
EHGO,Eshallgo Inc. Class A Ordinary Shares,$2.0302,-0.1348,-6.226%,"4,106,250"
GBR,"New Concept Energy, Inc Common Stock",$0.794,-0.0019,-0.239%,"4,074,756"
RAYA,Erayak Power Solution Group Inc. Class A Ordinary Shares,$4.12,0.42,11.351%,"4,048,184"
WXM,WF International Limited Ordinary Shares,$0.4676,0.0444,10.491%,"4,031,034"
MNDR,Mobile-health Network Solutions Class A Ordinary Shares,$1.20,0.25,26.316%,"4,024,199"
REVB,"Revelation Biosciences, Inc. Common Stock",$1.08,-0.04,-3.571%,"4,018,054"
ISPC,iSpecimen Inc. Common Stock,$5.40,-0.22,-3.915%,"4,004,402"
TOIIW,"The Oncology Institute, Inc. Warrant",$0.04,-0.0138,-25.651%,"3,999,317"
LMFA,"LM Funding America, Inc. Common Stock",$0.2436,0.0011,0.454%,"3,950,407"
PPBT,Purple Biotech Ltd. American Depositary Shares,$4.22,0.02,0.476%,"3,922,304"
BFRGW,"Bullfrog AI Holdings, Inc. Warrants",$0.2111,-0.0489,-18.808%,"3,911,866"
VIVK,"Vivakor, Inc. Common Stock",$1.89,-0.23,-10.849%,"3,908,597"
EDHL,Everbright Digital Holding Limited Ordinary Shares,$2.335,-0.125,-5.081%,"3,890,694"
WLDS,Wearable Devices Ltd. Ordinary Share,$1.10,UNCH,--,"3,884,184"
GLMD,Galmed Pharmaceuticals Ltd. Ordinary Shares,$0.5884,0.0173,3.029%,"3,883,236"
ENSC,"Ensysce Biosciences, Inc. Common Stock",$0.417,0.028,7.198%,"3,868,851"
BEATW,"Heartbeam, Inc. Warrant",$0.0941,UNCH,--,"3,866,369"
LGHL,Lion Group Holding Ltd. American Depositary Share,$0.8282,0.0372,4.703%,"3,864,727"
EZRA,"Reliance Global Group, Inc. Common Stock",$0.1785,0.0085,5.00%,"3,793,663"
PMAX,Powell Max Limited Class A Ordinary Shares,$2.20,0.16,7.843%,"3,773,733"
OLOX,Olenox Industries Inc. Common Stock,$0.6033,-0.0163,-2.631%,"3,729,456"
ICON,Icon Energy Corp. Common stock,$1.16,0.03,2.655%,"3,728,320"
NCT,Intercont (Cayman) Limited Class A Ordinary shares,$3.05,0.04,1.329%,"3,719,085"
CHR,"Cheer Holding, Inc. Class A Ordinary Share",$1.80,-0.04,-2.174%,"3,711,749"
HIHO,Highway Holdings Limited Common Stock,$0.80,-0.0126,-1.551%,"3,681,460"
CDTG,CDT Environmental Technology Investment Holdings Limited ordinary shares,$0.272,-0.0095,-3.375%,"3,678,800"
SHFS,"SHF Holdings, Inc. Class A Common Stock",$0.8164,0.0342,4.372%,"3,678,279"
VIVS,"VivoSim Labs, Inc. Common Stock",$1.41,-0.03,-2.083%,"3,677,226"
GOVX,"GeoVax Labs, Inc. Common Stock",$1.27,0.115,9.957%,"3,673,564"
IPST,"IP Strategy Holdings, Inc. Common Stock",$6.70,1.20,21.818%,"3,648,465"
SNGX,"Soligenix, Inc. Common Stock",$0.345,UNCH,--,"3,555,597"
FCHL,Fitness Champs Holdings Limited Common Stock,$3.08,0.485,18.69%,"3,529,926"
ALBT,Avalon GloboCare Corp. Common Stock,$0.42,0.0001,0.024%,"3,495,916"
VEEAW,Veea Inc. Warrant,$0.0693,-0.0216,-23.762%,"3,493,244"
MI,NFT Limited Class A Ordinary Share,$0.2425,-0.0025,-1.02%,"3,472,214"
IVDA,"Iveda Solutions, Inc. Common Stock",$0.31,0.0072,2.378%,"3,453,319"
TRUG,"TruGolf Holdings, Inc. Class A Common Stock",$2.47,0.21,9.292%,"3,445,084"
ABTS,Abits Group Inc Ordinary Shares,$1.16,-0.11,-8.661%,"3,435,279"
VCIG,VCI Global Limited Ordinary Share,$0.902,-0.0387,-4.114%,"3,324,726"
NXTS,Nexentis Technologies Inc. Common Stock,$4.5499,-0.0951,-2.047%,"3,323,515"
SGLY,Singularity Future Technology Ltd. Common Stock,$0.455,-0.0101,-2.172%,"3,318,539"
DXST,Decent Holding Inc Class A Ordinary Shares,$1.82,-0.15,-7.614%,"3,303,487"
BTOG,Bit Origin Limited Class A Ordinary Shares,$2.23,0.01,0.45%,"3,293,358"
SCAGW,Scage Future Warrants,$0.0453,0.0012,2.721%,"3,289,218"
GNLN,"Greenlane Holdings, Inc. Class A Common Stock",$5.21,0.53,11.325%,"3,282,013"
VBIO,"Valion Bio, Inc. Common Stock",$1.045,0.125,13.587%,"3,280,354"
GRI,"GRI Bio, Inc. Common Stock",$2.26,0.08,3.67%,"3,265,766"
FLYE,"Fly-E Group, Inc. Common Stock",$1.985,-0.025,-1.244%,"3,240,286"
CLDI,"Calidi Biotherapeutics, Inc. Common Stock",$0.212,-0.0044,-2.033%,"3,228,469"
BLUWW,Blue Water Acquisition Corp. III Warrant.,$0.4451,0.0049,1.113%,"3,224,750"
MRNOW,Murano Global Investments PLC Warrants,$0.0406,-0.0115,-22.073%,"3,219,813"
ITP,"IT Tech Packaging, Inc. Common Stock",$0.1894,-0.0086,-4.343%,"3,213,251"
OCG,Oriental Culture Holding LTD Ordinary Shares,$1.65,-0.08,-4.624%,"3,199,124"
FUSEW,Fusemachines Inc. Warrants,$0.11,0.01,10.00%,"3,183,316"
AGMH,AGM Group Holdings Inc. Class A Ordinary Shares,$0.9049,-0.0041,-0.451%,"3,166,183"
AEMD,"Aethlon Medical, Inc. Common Stock",$2.40,0.10,4.348%,"3,156,264"
DRCT,"Direct Digital Holdings, Inc. Class A Common Stock",$4.24,0.25,6.266%,"3,152,177"
DCOY,Decoy Therapeutics Inc. Common Stock,$5.895,-0.005,-0.085%,"3,135,951"
GWAV,"Greenwave Technology Solutions, Inc. Common Stock",$3.74,0.11,3.03%,"3,102,820"
ARTL,"Artelo Biosciences, Inc. Common Stock",$3.30,-0.09,-2.655%,"3,095,839"
SVRE,SaverOne 2014 Ltd. American Depositary Shares,$4.77,-0.05,-1.037%,"3,021,700"
MYSZ,"My Size, Inc. Common Stock",$0.62,-0.001,-0.161%,"2,987,262"
IINNW,Inspira Technologies Oxy B.H.N. Ltd. Warrant,$0.068,UNCH,--,"2,986,356"
NCPL,Netcapital Inc. Common Stock,$0.3771,0.0031,0.829%,"2,959,443"
NUWE,"Nuwellis, Inc. Common Stock",$1.12,0.05,4.673%,"2,952,004"
BDMDW,Baird Medical Investment Holdings Ltd Warrant,$0.0715,UNCH,--,"2,930,026"
KWMWW,"K Wave Media, Ltd. Warrant",$0.0398,-0.0002,-0.50%,"2,915,105"
DFNSW,T3 Defense Inc. Warrants,$0.0758,UNCH,--,"2,867,024"
ASPSZ,Altisource Portfolio Solutions S.A. Cash Exercise Stakeholder Warrants,$0.252,0.0221,9.613%,"2,842,295"
MGN,Megan Holdings Limited Class A Ordinary Shares,$0.1708,-0.0091,-5.058%,"2,775,500"
HCWB,HCW Biologics Inc. Common Stock,$0.4102,-0.0418,-9.248%,"2,762,329"
PW,Power REIT (MD) Common Stock,$0.75,-0.01,-1.316%,"2,754,206"
GPACW,General Purpose Acquisition Corp. Warrant,$0.2751,-0.0001,-0.036%,"2,741,777"
VSME,VS Media Holdings Limited Class A Ordinary Shares,$0.99,-0.0072,-0.722%,"2,737,419"
RMCOW,Royalty Management Holding Corporation Warrant,$0.1801,UNCH,--,"2,728,462"
BIYA,Baiya International Group Inc. Ordinary Shares,$1.19,-0.25,-17.361%,"2,721,437"
RUBI,Rubico Inc. Common Stock,$3.54,0.03,0.855%,"2,717,962"
BNBX,BNB Plus Corp. Common Stock,$0.4988,0.0037,0.747%,"2,717,198"
