Symbol,Name,Last Sale,Net Change,% Change,Market Cap
LANV,Lanvin Group Holdings Limited Ordinary Shares,$2.10,-0.02,-0.943%,"293,529,188"
MIN,MFS Intermediate Income Trust Common Stock,$2.55,UNCH,--,"292,989,316"
AVTX,"Avalo Therapeutics, Inc. Common Stock",$15.80,-0.91,-5.446%,"292,501,561"
OPENZ,"Opendoor Technologies Inc  Series Z Warrants, each whole warrant exercisable to purchase one share of Common Stock at an exercise price of $17.00 per warrant",$0.305,UNCH,--,"292,289,272"
KELYA,"Kelly Services, Inc. Class A Common Stock",$8.53,-0.14,-1.615%,"291,824,334"
NKLR,Terra Innovatum Global N.V. Ordinary shares,$4.15,-0.15,-3.488%,"291,748,934"
OCCIO,"OFS Credit Company, Inc. 6.125% Series C Term Preferred Stock",$25.09,UNCH,--,"291,458,236"
OIA,Invesco Municipal Income Opportunities Trust Common Stock,$6.118,0.008,0.131%,"291,250,994"
BNED,"Barnes & Noble Education, Inc Common Stock",$8.49,0.44,5.466%,"291,174,050"
BKTI,BK Technologies Corporation Common Stock,$77.98,-0.40,-0.51%,"291,040,153"
NIU,Niu Technologies American Depositary Shares,$3.73,-0.12,-3.117%,"290,805,616"
NL,"NL Industries, Inc. Common Stock",$5.95,-0.01,-0.168%,"290,733,267"
PACK,Ranpak Holdings Corp Class A Common Stock,$3.43,0.19,5.864%,"290,594,327"
RMMZ,"RiverNorth Managed Duration Municipal Income Fund II, Inc. Common Stock",$14.71,0.03,0.204%,"290,369,928"
RM,Regional Management Corp. Common Stock,$30.88,-0.59,-1.875%,"290,177,168"
GTE,Gran Tierra Energy Inc. Common Stock,$8.21,0.05,0.613%,"289,722,567"
EM,Smart Share Global Limited American Depositary Shares,$1.14,0.01,0.885%,"289,068,952"
PALI,"Palisade Bio, Inc. Common Stock",$1.94,-0.09,-4.433%,"289,066,227"
MTRX,Matrix Service Company Common Stock,$10.27,-0.05,-0.484%,"288,878,719"
FSBW,"FS Bancorp, Inc. Common Stock",$38.29,-0.95,-2.421%,"287,881,910"
FHTX,Foghorn Therapeutics Inc. Common Stock,$4.90,-0.02,-0.407%,"287,631,205"
TTGT,"TechTarget, Inc. Common Stock",$3.97,-0.23,-5.476%,"287,001,836"
OCCIN,"OFS Credit Company, Inc. 5.25% Series E Term Preferred Stock Due 2026",$24.66,-0.06,-0.243%,"286,463,137"
COSO,"CoastalSouth Bancshares, Inc. Common Stock",$23.90,-0.01,-0.042%,"286,296,212"
OFLX,"Omega Flex, Inc. Common Stock",$28.345,0.115,0.407%,"286,123,557"
LAW,"CS Disco, Inc. Common Stock",$4.51,0.07,1.577%,"285,613,849"
TARA,"Protara Therapeutics, Inc.  Common Stock",$5.26,-0.06,-1.128%,"284,483,828"
RMM,"RiverNorth Managed Duration Municipal Income Fund, Inc. Common Stock",$14.41,0.17,1.194%,"284,448,039"
NUAI,"New Era Energy & Digital, Inc. Common Stock",$5.02,0.10,2.033%,"284,007,439"
CZFS,"Citizens Financial Services, Inc. Common Stock",$58.99,-0.27,-0.456%,"283,528,179"
RC,Ready Capital Corporation Common Stock,$1.74,-0.08,-4.396%,"283,409,075"
RILYP,"BRC Group Holdings, Inc. Depositary Shares, each representing a 1/1000th fractional interest in a share of Series A Cumulative Perpetual Preferred Stock",$9.06,-0.41,-4.329%,"282,841,150"
XPOF,"Xponential Fitness, Inc. Class A Common Stock",$5.75,-0.17,-2.872%,"282,037,500"
CAMP,CAMP4 Therapeutics Corporation Common Stock,$5.41,0.03,0.558%,"280,883,527"
FSTR,L.B. Foster Company Common Stock,$27.24,-0.42,-1.518%,"280,772,868"
CPZ,Calamos Long/Short Equity & Dynamic Income Trust Common Stock,$14.29,-0.06,-0.418%,"280,544,052"
CTEV,Claritev Corporation Class A Common Stock,$16.89,0.87,5.431%,"279,575,491"
TOI,"The Oncology Institute, Inc. Common Stock",$2.84,0.22,8.397%,"279,403,006"
ARDC,"Ares Dynamic Credit Allocation Fund, Inc. Common Shares",$12.16,-0.09,-0.735%,"278,645,658"
PINE,"Alpine Income Property Trust, Inc. Common Stock",$18.44,-0.14,-0.753%,"278,233,305"
JMSB,"John Marshall Bancorp, Inc. Common Stock",$19.60,-0.09,-0.457%,"277,840,584"
FUND,"Sprott Focus Trust, Inc. Common Stock",$9.3616,-0.2149,-2.244%,"277,417,507"
EOT,Eaton Vance Municipal Income Trust EATON VANCE NATIONAL MUNICIPAL OPPORTUNITIES TRUST,$17.74,-0.02,-0.113%,"277,186,099"
LITB,"LightInTheBox Holding Co., Ltd. American Depositary Shares, each representing twelve ordinary shares",$2.51,-0.07,-2.713%,"276,939,299"
USAU,U.S. Gold Corp. Common Stock,$16.72,-1.02,-5.75%,"275,899,445"
WAVE,Eco Wave Power Global AB (publ) American Depositary Shares,$5.89,0.38,6.897%,"275,262,341"
DBI,Designer Brands Inc. Class A Common Stock,$5.54,-0.22,-3.819%,"274,983,950"
EVC,Entravision Communications Corporation Common Stock,$2.99,-0.04,-1.32%,"274,970,626"
FGBIP,"First Guaranty Bancshares, Inc. 6.75% Series A Fixed-Rate Non-Cumulative Perpetual Preferred Stock",$17.8702,0.1202,0.677%,"274,360,233"
SHAZ,"SharonAI Holdings, Inc. Class A Common Stock",$22.85,3.09,15.638%,"273,480,339"
ATGL,Alpha Technology Group Limited Class A Ordinary Shares,$16.60,0.60,3.75%,"273,277,500"
SEG,Seaport Entertainment Group Inc. Common Stock,$21.28,-0.07,-0.328%,"272,304,200"
MMT,MFS Multimarket Income Trust Common Stock,$4.57,UNCH,--,"272,135,754"
NODK,"NI Holdings, Inc. Common Stock",$13.23,0.33,2.558%,"271,711,403"
TG,Tredegar Corporation Common Stock,$7.80,-0.06,-0.763%,"271,104,444"
ZH,"Zhihu Inc. American Depositary Shares, each representing three (3) Class A Ordinary Shares",$3.09,0.01,0.325%,"270,575,420"
PRE,Prenetics Global Limited Class A Ordinary Share,$20.72,-0.06,-0.289%,"270,064,086"
GCO,Genesco Inc. Common Stock,$25.01,-0.07,-0.279%,"269,926,327"
AMPY,Amplify Energy Corp. Common Stock,$6.54,0.48,7.921%,"269,873,460"
ACRE,Ares Commercial Real Estate Corporation Common Stock,$4.86,-0.10,-2.016%,"269,086,886"
BRT,BRT Apartments Corp. (MD) Common Stock,$14.12,-0.30,-2.08%,"268,567,963"
OEC,Orion S.A. Common Shares,$4.77,-0.07,-1.446%,"268,425,554"
XPER,Xperi Inc. Common Stock ,$5.70,0.04,0.707%,"267,727,866"
EXOD,"Exodus Movement, Inc. Class A Common Stock",$8.97,-0.99,-9.94%,"267,412,895"
ALMU,"Aeluma, Inc. Common Stock",$14.81,0.02,0.135%,"267,310,222"
MCR,MFS Charter Income Trust Common Stock,$6.065,-0.035,-0.574%,"266,910,825"
XWIN,"XMAX, Inc. Common Stock",$6.19,0.02,0.324%,"266,623,275"
GDEV,GDEV Inc. Ordinary Shares,$14.70,0.595,4.218%,"266,512,323"
OVLY,Oak Valley Bancorp (CA) Common Stock,$31.75,0.13,0.411%,"266,326,017"
VYGR,"Voyager Therapeutics, Inc. Common Stock",$4.455,-0.415,-8.522%,"265,515,216"
CCCC,"C4 Therapeutics, Inc. Common Stock",$2.72,-0.03,-1.091%,"265,412,636"
FCNCO,"First Citizens BancShares, Inc. 5.625% Non-Cumulative Perpetual Preferred Stock, Series C",$22.22,-0.05,-0.225%,"265,244,051"
FVCB,"FVCBankcorp, Inc. Common Stock",$14.66,0.04,0.274%,"264,976,773"
DAVA,Endava plc American Depositary Shares (each representing one Class A Ordinary Share),$4.86,-0.05,-1.018%,"264,032,151"
ANNA,"AleAnna, Inc. Class A Common Stock",$3.96,0.32,8.791%,"263,950,953"
BLFY,Blue Foundry Bancorp Common Stock,$12.71,-0.05,-0.392%,"263,875,170"
DSX,Diana Shipping inc. common stock,$2.27,-0.02,-0.873%,"262,793,044"
VERI,"Veritone, Inc. Common Stock",$2.86,-0.04,-1.379%,"262,565,226"
ACV,Virtus Diversified Income & Convertible Fund Common Shares of Beneficial Interest,$25.3184,-0.1616,-0.634%,"262,373,415"
NGEN,NervGen Pharma Corp. Common stock,$3.60,-0.27,-6.977%,"262,208,844"
NWFL,Norwood Financial Corp. Common Stock,$28.30,-0.19,-0.667%,"262,176,860"
FOSL,"Fossil Group, Inc. Common Stock",$4.77,-0.03,-0.625%,"260,635,610"
ALXO,ALX Oncology Holdings Inc. Common Stock,$1.98,-0.04,-1.98%,"260,584,390"
BKKT,"Bakkt, Inc. Class A Common Stock",$9.45,0.24,2.606%,"260,227,419"
TBRG,"TruBridge, Inc. Common Stock",$17.31,-0.25,-1.424%,"259,805,548"
OABI,"OmniAb, Inc. Common Stock",$1.79,-0.06,-3.243%,"259,160,938"
VPV,Invesco Pennsylvania Value Municipal Income Trust Common Stock (DE),$10.86,0.106,0.986%,"258,788,848"
CV,"CapsoVision, Inc. Common Stock",$5.52,0.16,2.985%,"258,574,602"
STRS,Stratus Properties Inc. Common Stock,$32.34,0.90,2.863%,"258,550,086"
WNEB,"Western New England Bancorp, Inc. Common Stock",$12.75,0.07,0.552%,"258,322,625"
ABEO,Abeona Therapeutics Inc. Common Stock,$4.76,-0.195,-3.935%,"257,950,878"
FBLA,"FB Bancorp, Inc. Common Stock",$12.97,UNCH,--,"257,292,375"
CHMG,Chemung Financial Corp Common Stock,$53.60,-0.36,-0.667%,"256,977,106"
AFRI,Forafric Global PLC Ordinary Shares,$9.55,-0.04,-0.417%,"256,910,204"
OVID,Ovid Therapeutics Inc. Common Stock,$1.97,-0.04,-1.99%,"256,463,175"
CADL,"Candel Therapeutics, Inc. Common Stock",$4.67,-0.31,-6.225%,"256,363,615"
TBCH,Turtle Beach Corporation Common Stock,$13.27,-0.09,-0.674%,"256,257,156"
ALLT,Allot Ltd. Ordinary Shares,$6.45,-0.05,-0.769%,"256,018,650"
CBUS,"Cibus, Inc. Class A Common Stock",$3.79,-0.12,-3.069%,"255,732,024"
KALA,"KALA BIO, Inc. Common Stock",$0.28,-0.0168,-5.66%,"255,172,463"
REFI,"Chicago Atlantic Real Estate Finance, Inc. Common Stock",$12.09,UNCH,--,"254,860,488"
SHIP,Seanergy Maritime Holdings Corp. Common Stock,$12.18,-0.50,-3.943%,"254,590,806"
ASUR,"Asure Software, Inc Common Stock",$8.95,0.01,0.112%,"253,941,518"
SCM,Stellus Capital Investment Corporation Common Stock,$8.77,0.05,0.573%,"253,867,418"
FCNCP,"First Citizens BancShares, Inc. Depositary Shares",$21.25,-0.07,-0.328%,"253,664,990"
SSSS,SuRo Capital Corp. Common Stock,$9.98,-0.13,-1.286%,"253,369,805"
LTRX,"Lantronix, Inc. Common Stock",$6.32,0.15,2.431%,"250,853,604"
SLP,"Simulations Plus, Inc. Common Stock",$12.44,0.11,0.892%,"250,623,517"
TLSI,"TriSalus Life Sciences, Inc. Common Stock",$4.08,-0.02,-0.488%,"250,130,263"
MPX,Marine Products Corporation Common Stock,$7.08,-0.04,-0.562%,"249,517,778"
AMBR,Amber International Holding Limited American Depositary Shares,$2.66,0.06,2.308%,"249,196,581"
AGL,"agilon health, inc. Common Stock",$0.60,-0.0049,-0.81%,"248,921,855"
DEFT,"Defi Technologies, Inc. Common Stock",$0.6438,0.0038,0.594%,"248,428,240"
RZLT,"Rezolute, Inc. Common Stock (NV)",$2.595,-0.425,-14.073%,"248,335,493"
ALDX,"Aldeyra Therapeutics, Inc. Common Stock",$4.125,-0.545,-11.67%,"248,253,976"
HDSN,"Hudson Technologies, Inc. Common Stock",$5.76,-0.04,-0.69%,"247,698,346"
FDBC,"Fidelity D & D Bancorp, Inc. Common Stock",$42.94,-0.41,-0.946%,"247,647,261"
PCYO,Pure Cycle Corporation Common Stock,$10.27,0.19,1.885%,"247,410,513"
OSS,"One Stop Systems, Inc. Common Stock",$10.08,-0.07,-0.69%,"247,116,149"
ENLV,Enlivex Ltd. Ordinary Shares,$1.04,-0.03,-2.804%,"246,876,758"
CLLS,Cellectis S.A. American Depositary Shares,$3.42,0.09,2.703%,"246,561,046"
OPTX,"Syntec Optics Holdings, Inc. Class A Common Stock",$6.65,-0.17,-2.493%,"245,519,503"
AIFU,AIFU Inc. Class A Ordinary Share,$1.9878,0.0178,0.904%,"245,392,141"
INV,"Innventure, Inc. Common Stock",$3.62,UNCH,--,"245,241,776"
LFCR,"Lifecore Biomedical, Inc. Common Stock",$6.54,-0.07,-1.059%,"245,029,942"
ARL,"American Realty Investors, Inc. Common Stock",$15.17,-0.28,-1.812%,"245,026,492"
EVI,"EVI Industries, Inc.  Common Stock",$19.03,-0.21,-1.091%,"244,766,695"
ATLN,Atlantic International Corp. Common Stock,$4.18,0.20,5.025%,"244,636,540"
CHRS,"Coherus Oncology, Inc. Common Stock",$1.63,-0.06,-3.55%,"244,320,540"
SPOK,"Spok Holdings, Inc. Common Stock",$11.78,-0.20,-1.669%,"244,203,558"
PESI,"Perma-Fix Environmental Services, Inc. Common Stock",$13.14,0.345,2.696%,"243,322,079"
HUMA,"Humacyte, Inc. Common Stock",$1.16,0.02,1.754%,"243,232,002"
ALEC,"Alector, Inc. Common Stock",$2.20,-0.03,-1.345%,"242,797,678"
FLXS,"Flexsteel Industries, Inc. Common Stock",$45.37,-0.61,-1.327%,"242,525,789"
ADV,Advantage Solutions Inc. Class A Common Stock,$0.74,0.0007,0.095%,"242,355,691"
AUDC,AudioCodes Ltd. Common Stock,$8.21,0.03,0.367%,"241,974,094"
TYGO,"Tigo Energy, Inc. Common Stock",$3.43,-0.18,-4.986%,"241,308,211"
JACK,Jack In The Box Inc. Common Stock,$12.66,-0.22,-1.708%,"240,995,963"
PLG,Platinum Group Metals Ltd. Ordinary Shares (Canada),$1.95,-0.26,-11.765%,"240,639,826"
DERM,Journey Medical Corporation Common Stock,$7.22,-0.54,-6.959%,"240,112,565"
EGAN,eGain Corporation Common Stock,$8.76,-0.23,-2.558%,"239,902,324"
RWAY,Runway Growth Finance Corp. Common Stock,$6.63,-0.53,-7.402%,"239,568,665"
LMNR,Limoneira Co Common Stock,$13.20,-0.58,-4.209%,"239,328,764"
NVCT,"Nuvectis Pharma, Inc. Common Stock",$9.03,0.01,0.111%,"239,220,069"
FTF,Franklin Limited Duration Income Trust Common Shares of Beneficial Interest,$5.92,-0.02,-0.337%,"239,199,814"
EDIT,"Editas Medicine, Inc. Common Stock",$2.44,-0.10,-3.937%,"238,807,678"
TENX,"Tenax Therapeutics, Inc. Common Stock",$13.84,-0.35,-2.467%,"238,014,964"
KDKRW,"Kodiak AI, Inc. Warrants",$1.30,-0.18,-12.162%,"237,321,999"
OBIO,"Orchestra BioMed Holdings, Inc. Ordinary Shares",$4.20,-0.18,-4.11%,"237,151,870"
AZ,A2Z Cust2Mate Solutions Corp. Common Shares,$5.32,0.20,3.906%,"236,979,443"
ATLO,Ames National Corporation Common Stock,$26.65,0.01,0.038%,"236,976,251"
NKSH,"National Bankshares, Inc. Common Stock",$37.09,0.09,0.243%,"236,114,977"
MITT,"TPG Mortgage Investment Trust, Inc. Common Stock",$7.44,0.01,0.135%,"236,111,800"
BUUU,BUUU Group Limited Class A Ordinary Share,$14.15,-0.40,-2.749%,"235,951,250"
RDIB,Reading International Inc Class B Common Stock,$10.38,-0.17,-1.611%,"235,805,159"
POWW,Outdoor Holding Company Common Stock,$2.01,-0.01,-0.495%,"235,750,331"
SENS,"Senseonics Holdings, Inc. Common Stock",$5.64,0.04,0.714%,"235,585,428"
FXNC,First National Corporation Common Stock,$26.14,-0.21,-0.797%,"235,542,756"
SVREW,SaverOne 2014 Ltd. Warrant,$0.0086,UNCH,--,"235,350,490"
ESCA,"Escalade, Incorporated Common Stock",$17.18,0.61,3.681%,"235,302,623"
SMWB,Similarweb Ltd. Ordinary Shares,$2.70,0.09,3.448%,"234,809,420"
TAYD,"Taylor Devices, Inc. Common Stock",$74.45,-2.15,-2.807%,"234,749,561"
STRZ,Starz Entertainment Corp. Common Shares,$14.02,-0.94,-6.283%,"234,569,265"
SLGL,Sol-Gel Technologies Ltd. Ordinary Shares,$83.97,-1.34,-1.571%,"233,920,435"
MYFW,"First Western Financial, Inc. Common Stock",$23.99,0.21,0.883%,"233,544,833"
NVA,Nova Minerals Limited American Depositary Shares,$6.21,-0.23,-3.571%,"233,407,098"
FUNC,First United Corporation Common Stock,$35.86,-0.27,-0.747%,"233,139,559"
NREF,"NexPoint Real Estate Finance, Inc. Common Stock",$13.15,-1.03,-7.264%,"233,042,038"
CFFI,C&F Financial Corporation Common Stock,$71.50,0.78,1.103%,"232,789,772"
HELP,Cybin Inc. Common Stock,$4.64,-0.49,-9.552%,"232,166,089"
JILL,"J. Jill, Inc. Common Stock",$15.31,-0.14,-0.906%,"231,416,054"
LCNB,LCNB Corporation Common Stock,$16.22,-0.22,-1.338%,"230,939,809"
CBNA,"Chain Bridge Bancorp, Inc. Class A Common Stock",$35.19,0.29,0.831%,"230,910,340"
KLC,"KinderCare Learning Companies, Inc. Common Stock",$1.95,-1.45,-42.647%,"230,721,180"
CIA,"Citizens, Inc. Class A Common Stock ($1.00 Par)",$4.58,-0.32,-6.531%,"230,359,564"
RDNW,"RideNow Group, Inc. Class B Common Stock",$6.05,-0.17,-2.733%,"230,308,387"
OSG,"Octave Specialty Group, Inc. Common Stock",$5.12,-0.08,-1.538%,"230,153,795"
RPAY,Repay Holdings Corporation Class A Common Stock,$2.67,-0.04,-1.476%,"229,302,222"
HWBK,"Hawthorn Bancshares, Inc. Common Stock",$33.17,0.65,1.999%,"228,933,038"
PRHIZ,"Presurance Holdings, Inc. 9.75% Senior Unsecured Notes due 2028",$18.725,0.6094,3.364%,"228,873,447"
SKYX,SKYX Platforms Corp. Common Stock,$1.74,-0.05,-2.793%,"228,836,288"
FNKO,"Funko, Inc. Class A Common Stock",$4.13,-0.17,-3.953%,"228,764,120"
SJT,San Juan Basin Royalty Trust Common Stock,$4.90,-0.12,-2.39%,"228,383,100"
PLX,"Protalix BioTherapeutics, Inc. (DE) Common Stock",$2.83,0.04,1.434%,"227,591,942"
PPIH,"Perma-Pipe International Holdings, Inc. Common Stock",$28.11,0.09,0.321%,"227,523,605"
MKTW,"MarketWise, Inc. Class A Common Stock",$14.15,-0.35,-2.414%,"227,259,980"
MINE,Mayfair Gold Corp. Common Shares,$3.40,-0.10,-2.857%,"227,111,823"
MASS,908 Devices Inc. Common Stock,$6.07,0.06,0.998%,"226,896,315"
BPRN,"Princeton Bancorp, Inc. Common Stock (PA)",$33.51,0.29,0.873%,"226,623,405"
LIEN,"Chicago Atlantic BDC, Inc. Common Stock",$9.93,-0.01,-0.101%,"226,608,459"
BRCC,BRC Inc. Class A Common Stock,$0.9097,0.0133,1.484%,"226,242,532"
BRR,"ProCap Financial, Inc. Common Stock",$2.71,0.02,0.743%,"226,075,720"
JAKK,"JAKKS Pacific, Inc. Common Stock",$19.71,-0.39,-1.94%,"225,569,341"
RGCO,RGC Resources Inc. Common Stock,$21.69,-0.21,-0.959%,"225,456,423"
GDC,GD Culture Group Limited Common Stock,$3.93,0.03,0.769%,"225,260,176"
CMRC,"Commerce.com, Inc. Series 1 Common Stock",$2.74,-0.05,-1.792%,"225,228,000"
LODE,Comstock Inc. Common Stock,$3.15,-0.17,-5.12%,"224,821,384"
GRRR,Gorilla Technology Group Inc. Ordinary shares,$11.00,-0.20,-1.786%,"222,444,662"
MFM,MFS Municipal Income Trust Common Stock,$5.39,-0.02,-0.37%,"222,001,331"
ACHV,"Achieve Life Sciences, Inc. Common Shares",$4.17,0.03,0.725%,"221,985,730"
SNFCA,Security National Financial Corporation Class A Common Stock,$8.54,-0.13,-1.499%,"221,916,759"
QTRX,Quanterix Corporation Common Stock,$4.72,-0.04,-0.84%,"221,556,682"
BNAI,Brand Engagement Network Inc. Common Stock,$38.30,0.93,2.489%,"221,317,086"
EICA,Eagle Point Income Company Inc. 5.00% Series A Term Preferred Stock due 2026,$24.8221,0.042,0.169%,"221,117,948"
VTN,Invesco Trust for Investment Grade New York Municipals Common Stock,$11.33,-0.03,-0.264%,"220,776,142"
MFIN,Medallion Financial Corp. Common Stock,$9.35,0.01,0.107%,"220,006,276"
FLYX,"flyExclusive, Inc. Class A Common Stock",$2.33,-0.02,-0.851%,"219,840,230"
FRAF,Franklin Financial Services Corporation Common Stock,$49.065,-0.315,-0.638%,"219,763,950"
BLZE,"Backblaze, Inc. Class A Common Stock",$3.64,-0.12,-3.191%,"218,764,000"
NXDT,NexPoint Diversified Real Estate Trust Common Stock,$4.46,-0.10,-2.193%,"218,631,024"
BYRN,"Byrna Technologies, Inc. Common Stock",$9.64,-0.11,-1.128%,"218,551,168"
CMTV,Community Bancorp. Common Stock,$38.98,1.05,2.768%,"218,467,776"
KROS,"Keros Therapeutics, Inc. Common Stock",$11.02,0.03,0.273%,"217,287,214"
SRZN,"Surrozen, Inc. Common Stock",$25.21,-0.69,-2.664%,"216,085,523"
FCCO,First Community Corporation Common Stock,$28.09,-0.04,-0.142%,"216,003,504"
ECC           ,Eagle Point Credit Company Inc. Common Stock,$3.56,-0.24,-6.316%,"215,958,585"
VTIX,Virtuix Holdings Inc. Class A Common Stock,$6.77,-0.10,-1.456%,"215,620,756"
KINS,"Kingstone Companies, Inc. Common Stock",$15.20,0.09,0.596%,"215,040,906"
GENC,"Gencor Industries, Inc. Common Stock",$14.67,-0.37,-2.46%,"215,028,488"
MRBK,Meridian Corporation Common Stock,$18.66,0.015,0.08%,"214,915,729"
IONR,ioneer Ltd American Depositary Shares,$3.22,-0.33,-9.296%,"214,758,676"
FINW,FinWise Bancorp Common Stock,$15.77,-0.04,-0.253%,"214,265,744"
HITI,High Tide Inc. Common Shares,$2.46,0.03,1.235%,"214,206,665"
RILY,"BRC Group Holdings, Inc. Common Stock",$6.86,-0.06,-0.867%,"214,160,076"
TWIN,"Twin Disc, Incorporated Common Stock",$14.82,-0.24,-1.594%,"213,728,972"
ELTX,"Elicio Therapeutics, Inc. Common Stock",$12.20,1.30,11.927%,"213,372,095"
ARQQ,Arqit Quantum Inc. Ordinary Shares,$13.63,-0.42,-2.989%,"213,334,838"
MDWD,MediWound Ltd. Ordinary Shares,$16.58,UNCH,--,"212,981,109"
HBB,Hamilton Beach Brands Holding Company Class A Common Stock ,$15.85,-0.78,-4.69%,"212,791,528"
HERE,Here Group Limited American Depositary Shares,$3.91,0.175,4.685%,"212,643,845"
HKD,AMTD Digital Inc. American Depositary Shares (every five of which represent two Class A Ordinary Shares),$1.68,0.02,1.205%,"211,955,471"
GORO,Gold Resource Corporation Common Stock,$1.31,-0.08,-5.755%,"211,913,047"
INBKZ,First Internet Bancorp 6.0% Fixed-to-Floating Rate Subordinated Notes Due 2029,$24.32,0.068,0.28%,"211,902,446"
CGEN,Compugen Ltd. Ordinary Shares,$2.24,0.03,1.357%,"211,801,244"
GWRS,"Global Water Resources, Inc. Common Stock",$7.36,0.20,2.793%,"211,650,445"
SABS,"SAB Biotherapeutics, Inc. Common Stock",$4.15,-0.44,-9.586%,"211,446,804"
IMPP,Imperial Petroleum Inc. Common Shares,$4.62,-0.04,-0.858%,"211,359,165"
KLTR,"Kaltura, Inc. Common Stock",$1.35,UNCH,--,"211,051,112"
FENC,Fennec Pharmaceuticals Inc. Common Stock,$7.52,-0.11,-1.442%,"211,026,240"
NIOBW,NioCorp Developments Ltd. Warrant,$1.68,-0.025,-1.466%,"210,539,569"
WW,"WW International, Inc.  Common Stock",$21.08,-1.68,-7.381%,"210,524,442"
CLW,Clearwater Paper Corporation Common Stock,$13.11,-0.43,-3.176%,"210,264,538"
CNTN,"Canton Strategic Holdings, Inc. Common Stock",$4.07,-0.125,-2.98%,"209,680,442"
FLWS,"1-800-FLOWERS.COM, Inc. Common Stock",$3.27,-0.01,-0.305%,"209,495,182"
LEE,"Lee Enterprises, Incorporated Common Stock",$9.42,0.50,5.605%,"209,406,025"
ESOA,Energy Services of America Corporation Common Stock,$12.56,-0.21,-1.644%,"209,237,530"
NTHI,"NeOnc Technologies Holdings, Inc. Common Stock",$8.65,-0.35,-3.889%,"209,048,079"
VABK,Virginia National Bankshares Corporation Common Stock,$38.71,0.40,1.044%,"208,768,411"
GPJA,"Georgia Power Company Series 2017A 5.00% Junior Subordinated Notes due October 1, 2077",$22.50,-0.19,-0.837%,"208,383,750"
PRLD,Prelude Therapeutics Incorporated Common Stock,$3.30,-0.07,-2.077%,"207,907,418"
SWKH,SWK Holdings Corporation Common Stock,$17.17,0.36,2.142%,"207,686,706"
OZ,"Belpointe PREP, LLC Class A Units",$53.19,1.066,2.045%,"206,971,705"
TPVG,TriplePoint Venture Growth BDC Corp. Common Stock,$5.09,-0.08,-1.547%,"206,099,928"
QSI,Quantum-Si Incorporated Class A Common Stock,$0.9496,-0.0264,-2.705%,"205,463,787"
OSUR,"OraSure Technologies, Inc. Common Stock",$2.97,-0.12,-3.883%,"205,304,734"
ETX           ,Eaton Vance Municipal Income 2028 Term Trust Common Shares of Beneficial Interest,$18.84,-0.065,-0.344%,"205,072,571"
EVO,Evotec SE American Depositary Shares,$2.31,-0.10,-4.149%,"204,880,879"
PEBK,"Peoples Bancorp of North Carolina, Inc. Common Stock",$37.45,0.05,0.134%,"204,532,801"
FT,Franklin Universal Trust Common Stock,$8.13,0.06,0.743%,"204,322,298"
AOMR,"Angel Oak Mortgage REIT, Inc. Common Stock",$8.20,-0.12,-1.442%,"204,300,105"
MRAM,"Everspin Technologies, Inc. Common Stock",$8.82,-0.11,-1.232%,"203,920,949"
NLOP,Net Lease Office Properties Common Shares of Beneficial Interest,$13.72,-0.18,-1.295%,"203,249,109"
UTMD,"Utah Medical Products, Inc. Common Stock",$63.28,0.64,1.022%,"202,728,364"
WALD,Waldencast plc Class A Ordinary Share,$1.58,0.12,8.219%,"202,305,117"
IMMR,Immersion Corporation Common Stock,$6.18,-0.05,-0.803%,"200,209,950"
CNDT,Conduent Incorporated Common Stock ,$1.29,0.04,3.20%,"199,574,834"
GALT,Galectin Therapeutics Inc. Common Stock,$3.09,-0.07,-2.215%,"199,220,927"
CXDO,"Crexendo, Inc. Common Stock",$6.39,-0.09,-1.389%,"199,065,133"
XYF,"X Financial American Depositary Shares, each representing six Class A Ordinary Shares",$4.71,0.01,0.213%,"198,806,246"
LZMH,LZ Technology Holdings Limited Class B Ordinary Shares,$1.3063,0.0263,2.055%,"198,649,041"
MPV,Barings Participation Investors Common Stock,$18.72,-0.01,-0.053%,"198,463,824"
TRVG,trivago N.V. American Depositary Shares,$2.81,UNCH,--,"198,441,284"
KRMD,"KORU Medical Systems, Inc. Common Stock (DE)",$4.28,-0.03,-0.696%,"198,260,963"
SGHT,"Sight Sciences, Inc. Common Stock",$3.67,0.05,1.381%,"198,201,961"
CVRX,"CVRx, Inc. Common Stock",$7.53,0.09,1.21%,"198,126,401"
ABOS,"Acumen Pharmaceuticals, Inc. Common Stock",$3.27,-0.03,-0.909%,"198,075,100"
TONX,TON Strategy Company Common Stock,$3.35,0.27,8.766%,"197,953,245"
KTWO,K2 Capital Acquisition Corporation Class A Ordinary Share,$9.875,0.005,0.051%,"197,906,455"
ALTG,Alta Equipment Group Inc. Class A Common Stock,$6.12,0.05,0.824%,"197,471,482"
AIRJ,AirJoule Technologies Corporation Class A Common Stock,$3.25,-0.15,-4.412%,"197,209,045"
DOMO,"Domo, Inc. Class B Common Stock",$4.71,0.08,1.728%,"196,870,897"
HRZN,Horizon Technology Finance Corporation Common Stock,$4.10,-0.22,-5.093%,"195,999,315"
RNAC,"Cartesian Therapeutics, Inc. Common Stock",$7.39,-0.73,-8.99%,"195,901,687"
ZNTL,"Zentalis Pharmaceuticals, Inc. Common Stock",$2.71,-0.04,-1.455%,"195,799,611"
CRNT,Ceragon Networks Ltd. Ordinary Shares,$2.20,UNCH,--,"195,445,974"
CAST,"FreeCast, Inc. Class A Common Stock",$4.77,-2.94,-38.132%,"194,890,084"
ADAG,Adagene Inc. American Depositary Shares,$4.13,0.57,16.011%,"194,652,145"
ELMD,"Electromed, Inc. Common Stock",$23.51,0.24,1.031%,"194,552,609"
ACB,Aurora Cannabis Inc. Common Shares,$3.43,-0.08,-2.279%,"194,513,324"
MPAA,"Motorcar Parts  of America, Inc. Common Stock",$10.12,-0.11,-1.075%,"194,414,854"
DIBS,"1stdibs.com, Inc. Common Stock",$5.37,-0.06,-1.105%,"194,351,598"
STFS,Star Fashion Culture Holdings Limited Class A Ordinary Shares,$4.07,0.062,1.547%,"194,342,500"
OVBC,Ohio Valley Banc Corp. Common Stock,$41.20,-0.38,-0.914%,"194,093,241"
INSG,Inseego Corp. Common Stock,$11.935,0.235,2.009%,"193,572,977"
HNNAZ,"Hennessy Advisors, Inc. 4.875% Notes due 2026",$24.81,-0.0053,-0.021%,"193,209,364"
OPBK,OP Bancorp Common Stock,$12.95,-0.02,-0.154%,"192,768,701"
CURI,CuriosityStream Inc. Class A Common Stock,$3.305,0.105,3.281%,"192,676,566"
OGI,Organigram Global Inc. Common Shares,$1.41,-0.03,-2.083%,"192,235,651"
MNTK,"Montauk Renewables, Inc. Common Stock",$1.35,-0.06,-4.255%,"192,160,538"
III,Information Services Group Inc. Common Stock,$4.02,0.01,0.249%,"191,650,851"
PRQR,ProQR Therapeutics N.V. Ordinary Shares,$1.82,0.10,5.814%,"191,486,799"
LFMD,"LifeMD, Inc. Common Stock",$3.98,0.045,1.144%,"190,935,899"
MGNX,"MacroGenics, Inc. Common Stock",$3.00,-0.12,-3.846%,"190,667,511"
ANIK,Anika Therapeutics Inc. Common Stock,$14.20,-0.10,-0.699%,"190,290,664"
MPTI,"M-tron Industries, Inc. Common Stock",$64.85,-1.85,-2.774%,"189,997,400"
ARCT,Arcturus Therapeutics Holdings Inc. Common Stock,$6.68,-0.32,-4.571%,"189,866,101"
OPRT,Oportun Financial Corporation Common Stock,$4.26,-0.32,-6.987%,"189,571,142"
PAYS,"Paysign, Inc. Common Stock",$3.44,-0.10,-2.825%,"189,347,535"
MNSBP,"MainStreet Bancshares, Inc. Depositary Shares",$24.55,-0.1811,-0.732%,"189,171,768"
SMHI,SEACOR Marine Holdings Inc. Common Stock ,$7.01,-0.37,-5.014%,"188,932,020"
LUCD,Lucid Diagnostics Inc. Common Stock,$1.37,-0.02,-1.439%,"188,625,713"
NIPG,NIP Group Inc. American Depositary Shares,$0.8401,-0.01,-1.176%,"188,482,952"
INFU,"InfuSystems Holdings, Inc. Common Stock",$9.31,-0.08,-0.852%,"188,203,130"
OMSE,OMS Energy Technologies Inc. Ordinary Shares,$4.42,-0.08,-1.778%,"187,623,272"
