Symbol,Name,Last Sale,Net Change,% Change,Market Cap
RMCO,Royalty Management Holding Corporation Class A Common Stock,$2.2351,0.0551,2.528%,"32,911,606"
RDI,Reading International Inc Class A Common Stock,$1.44,-0.01,-0.69%,"32,712,854"
VRAR,"The Glimpse Group, Inc. Common Stock",$1.55,0.08,5.442%,"32,652,309"
NVNI,Nvni Group Limited Ordinary Shares,$0.3532,-0.3935,-52.699%,"32,586,232"
FENG,"Phoenix New Media Limited American Depositary Shares, each representing 48 Class A ordinary shares.",$2.7129,-0.0271,-0.989%,"32,584,034"
MKDW,MKDWELL Tech Inc. Ordinary Share,$0.2262,0.0026,1.163%,"32,486,695"
GREE,Greenidge Generation Holdings Inc. Class A Common Stock,$2.07,0.17,8.947%,"32,443,973"
FEDU,"Four Seasons Education (Cayman) Inc. American Depositary Shares, each ADS representing 10 ordinary shares",$14.34,UNCH,--,"32,409,232"
GIFT,"Giftify, Inc. Common Stock",$1.06,UNCH,--,"32,374,695"
AMBR,Amber International Holding Limited American Depositary Shares,$3.41,0.21,6.563%,"32,320,427"
QRHC,Quest Resource Holding Corporation Common Stock,$1.56,-0.02,-1.266%,"32,311,038"
JBDI,JBDI Holdings Limited Ordinary Shares,$1.63,-0.01,-0.61%,"32,253,625"
DDC,DDC Enterprise Limited Class A Ordinary Shares,$7.89,-0.46,-5.509%,"31,955,676"
SWAG,"Stran & Company, Inc. Common Stock",$1.72,0.02,1.176%,"31,915,230"
BTTC,Black Titan Corporation Ordinary Shares,$23.98,17.98,299.667%,"31,899,011"
DAIO,Data I/O Corporation Common Stock,$3.3737,-0.0113,-0.334%,"31,671,159"
CENN,Cenntro Inc. Common Stock,$0.6082,0.0204,3.471%,"31,573,384"
DTST,Data Storage Corporation Common Stock,$4.345,0.015,0.346%,"31,555,284"
AERT,"Aeries Technology, Inc. Class A Ordinary Share",$0.669,0.0529,8.586%,"31,545,107"
EQS,"Equus Total Return, Inc. Common Stock",$2.32,0.05,2.203%,"31,519,921"
ARBEW,Arbe Robotics Ltd. Warrant,$0.2997,0.0285,10.509%,"31,517,407"
NRXS,"Neuraxis, Inc. Common Stock",$3.19,0.08,2.572%,"31,449,304"
XTIA,"XTI Aerospace, Inc. Common Stock",$1.55,0.08,5.442%,"31,392,640"
RNWWW,ReNew Energy Global plc Warrant,$0.0865,0.0042,5.103%,"31,379,531"
CRWS,Crown Crafts Inc Common Stock,$2.97,0.013,0.44%,"31,378,083"
OMH,Ohmyhome Limited Class A Ordinary Shares,$1.33,0.03,2.308%,"31,375,110"
ADGM,"Adagio Medical Holdings, Inc Common Stock",$2.01,0.03,1.515%,"30,916,946"
UONEK,"Urban One, Inc. Class D Common Stock",$0.6801,-0.0199,-2.843%,"30,860,189"
MBBC,"Marathon Bancorp, Inc. Common Stock",$10.45,0.02,0.192%,"30,709,394"
RCON,"Recon Technology, Ltd. Class A Ordinary Shares",$2.02,0.04,2.02%,"30,477,677"
BTCM,BIT Mining Limited ADS,$2.86,0.18,6.716%,"30,473,695"
ZCMD,Zhongchao Inc. Class A Ordinary Shares,$1.20,0.06,5.263%,"30,466,684"
AKTX,Akari Therapeutics plc ADS,$0.9337,-0.0464,-4.734%,"30,452,374"
SWVL,Swvl Holdings Corp Class A Common Shares,$3.0749,0.0149,0.487%,"30,436,947"
BMGL,Basel Medical Group Ltd Ordinary Shares,$1.64,-0.085,-4.928%,"30,266,200"
LPTX,"Leap Therapeutics, Inc. Common Stock",$0.73,0.2041,38.81%,"30,250,856"
FOXX,Foxx Development Holdings Inc. Common Stock,$4.43,-0.01,-0.225%,"30,038,045"
JFU,9F Inc. American Depositary Shares,$2.55,0.018,0.711%,"30,021,999"
EVAX,Evaxion A/S American Depositary Share,$4.74,0.30,6.757%,"29,940,551"
ITRM,Iterum Therapeutics plc Ordinary Share,$0.6697,0.0007,0.105%,"29,906,730"
RVSN,Rail Vision Ltd. Ordinary Share,$0.5714,-0.01,-1.72%,"29,706,051"
PXS,Pyxis Tankers Inc. Common Stock,$2.83,-0.05,-1.736%,"29,674,998"
NDLS,Noodles & Company Class A Common Stock,$0.6358,0.0115,1.842%,"29,527,532"
NRSN,NeuroSense Therapeutics Ltd. Ordinary Shares,$1.23,-0.01,-0.806%,"29,506,063"
CNF,"CNFinance Holdings Limited American Depositary Shares, each representing two hundred (200) Ordinary Shares",$4.285,0.275,6.858%,"29,387,456"
OESX,"Orion Energy Systems, Inc. Common Stock",$8.23,0.07,0.858%,"29,082,549"
CVKD,"Cadrenal Therapeutics, Inc. Common Stock",$14.19,0.13,0.925%,"29,044,858"
SYTA,"Siyata Mobile, Inc. Common Shares",$2.34,0.03,1.299%,"28,986,102"
DARE,"Dare Bioscience, Inc. Common Stock",$2.15,UNCH,--,"28,980,929"
IOBT,"IO Biotech, Inc. Common Stock",$0.435,0.0792,22.26%,"28,658,198"
IINN,Inspira Technologies Oxy B.H.N. Ltd. Ordinary Shares,$1.18,-0.01,-0.84%,"28,617,473"
BCG,"Binah Capital Group, Inc. Common Stock",$1.72,UNCH,--,"28,556,231"
KFFB,Kentucky First Federal Bancorp Common Stock,$3.53,-0.05,-1.397%,"28,546,104"
LNAI,Lunai Bioworks Inc. Common Stock,$1.23,-0.05,-3.906%,"28,511,704"
KZR,"Kezar Life Sciences, Inc. Common Stock",$3.89,-0.065,-1.643%,"28,486,882"
MCTR,CTRL Group Limited Ordinary Shares,$1.86,-0.04,-2.105%,"28,458,000"
PRZO,ParaZero Technologies Ltd. Ordinary Shares,$1.70,0.04,2.41%,"28,355,373"
MGIH,Millennium Group International Holdings Limited Ordinary Shares,$2.51,0.34,15.668%,"28,237,500"
BOSC,B.O.S. Better Online Solutions Common Stock,$4.765,-0.035,-0.729%,"28,225,759"
CLGN,CollPlant Biotechnologies Ltd Ordinary Shares,$2.46,-0.07,-2.767%,"28,178,100"
SIDU,"Sidus Space, Inc. Class A Common Stock",$1.11,0.02,1.835%,"28,135,706"
ELOG,Eastern International Ltd. Ordinary Shares,$2.33,0.01,0.431%,"27,999,610"
IZM,ICZOOM Group Inc. Class A Ordinary Shares,$2.3793,-0.0107,-0.448%,"27,913,936"
AUST,Austin Gold Corp. Common Shares,$2.10,0.23,12.299%,"27,870,675"
AENTW,Alliance Entertainment Holding Corporation Warrants,$0.546,-0.054,-9.00%,"27,822,724"
KIDZ,"Classover Holdings, Inc. Class B Common Stock",$1.13,-0.09,-7.377%,"27,818,890"
MOGU,MOGU Inc. American Depositary Shares (each  representing 25 Class A Ordinary Shares),$3.40,0.07,2.102%,"27,790,379"
KMRK,K-Tech Solutions Company Limited Class A Ordinary Shares,$1.42,-0.15,-9.554%,"27,690,000"
KLTO,"Klotho Neurosciences, Inc. Common Stock",$0.451,-0.0154,-3.302%,"27,679,870"
NINE,"Nine Energy Service, Inc. Common Stock",$0.6334,0.006,0.956%,"27,451,904"
HHS,"Harte Hanks, Inc. Common Stock",$3.67,-0.013,-0.353%,"27,212,294"
CASI,"CASI Pharmaceuticals, Inc. Ordinary Shares",$1.75,0.06,3.55%,"27,112,192"
BOLD,"Boundless Bio, Inc. Common Stock",$1.21,-0.02,-1.626%,"27,086,589"
RNTX,"Rein Therapeutics, Inc. Common Stock",$1.16,-0.02,-1.695%,"27,033,925"
SDST,Stardust Power Inc. Common Stock,$3.19,-0.04,-1.238%,"26,984,130"
NYC,American Strategic Investment Co. Class A Common Stock,$10.20,0.13,1.291%,"26,822,971"
JVA,"Coffee Holding Co., Inc. Common Stock",$4.69,0.02,0.428%,"26,773,329"
CLPS,CLPS Incorporation Common Stock,$0.96,-0.0372,-3.73%,"26,727,042"
LGPS,LogProstyle Inc. Common Shares,$1.13,0.01,0.893%,"26,726,884"
TOPS,"TOP Ships, Inc. Common Stock",$5.75,-0.08,-1.372%,"26,600,633"
XCUR,"Exicure, Inc. Common Stock",$4.18,0.08,1.951%,"26,408,375"
DRTSW,Alpha Tau Medical Ltd. Warrant,$0.3749,UNCH,--,"26,385,676"
STAI,ScanTech AI Systems Inc. Common stock,$0.4085,-0.0055,-1.329%,"26,343,196"
NTRP,"NextTrip, Inc. Common Stock",$3.34,0.02,0.602%,"26,207,654"
SBCWW,SBC Medical Group Holdings Incorporated Warrants,$0.25,0.0414,19.847%,"25,970,313"
CCM,Concord Medical Services Holdings Limited American Depositary Shares (Each represents thirty (30) Class A ordinary shares),$5.98,-0.16,-2.606%,"25,963,504"
CSAI,"Cloudastructure, Inc. Class A Common Stock",$1.43,0.12,9.16%,"25,795,305"
LIQT,"LiqTech International, Inc. Common Stock",$2.6801,-0.0299,-1.103%,"25,766,597"
ARKR,Ark Restaurants Corp. Common Stock,$7.14,0.02,0.281%,"25,747,961"
RVP,"Retractable Technologies, Inc. Common Stock",$0.86,0.021,2.503%,"25,745,957"
ORBS,Eightco Holdings Inc. Common Stock,$8.45,0.35,4.321%,"25,728,087"
FCUV,Focus Universal Inc. Common Stock,$3.48,-0.065,-1.834%,"25,705,733"
PASG,"Passage Bio, Inc. Common Stock",$8.05,-0.08,-0.984%,"25,588,616"
MIRA,"MIRA Pharmaceuticals, Inc. Common Stock",$1.34,0.02,1.515%,"25,552,882"
SPCB,"SuperCom, Ltd. Ordinary Shares (Israel)",$11.75,0.16,1.381%,"25,531,046"
SPWRW,"Complete Solaria, Inc. Warrants",$0.3041,0.0481,18.789%,"25,273,358"
NSYS,Nortech Systems Incorporated Common Stock,$9.07,-0.13,-1.413%,"25,270,235"
QTTB,Q32 Bio Inc. Common Stock,$2.07,-0.01,-0.481%,"25,249,063"
SAGT,SAGTEC GLOBAL LIMITED Ordinary shares,$2.01,-0.04,-1.951%,"25,225,500"
MBNKO,"Medallion Bank Fixed-Rate Reset Non-Cumulative Perpetual Preferred Stock, Series G, par value $1.00 per share",$25.09,UNCH,--,"25,090,000"
CAPT,Captivision Inc. Ordinary Shares,$0.8604,-0.0376,-4.187%,"25,087,235"
ZOOZ,ZOOZ Power Ltd. Ordinary Shares,$2.06,-0.01,-0.483%,"24,937,322"
NNVC,"NanoViricides, Inc. Common Stock",$1.43,-0.01,-0.694%,"24,926,330"
IQST,iQSTEL Inc. Common Stock,$6.89,-0.14,-1.991%,"24,854,070"
GFAI,"Guardforce AI Co., Limited Ordinary Shares",$1.18,0.05,4.425%,"24,807,763"
ENLV,Enlivex Therapeutics Ltd. Ordinary Shares,$1.04,0.01,0.971%,"24,803,932"
TRT,Trio-Tech International Common Stock,$5.75,-0.40,-6.504%,"24,798,629"
SJ,Scienjoy Holding Corporation Class A Ordinary Shares ,$0.5901,-0.0849,-12.578%,"24,786,205"
NTCL,NETCLASS TECHNOLOGY INC Class A Ordinary Shares,$1.39,0.002,0.144%,"24,783,700"
TAOX,Tao Synergies Inc. Common Stock,$7.09,0.74,11.654%,"24,723,872"
LIXT,"Lixte Biotechnology Holdings, Inc. Common Stock",$5.37,0.56,11.642%,"24,494,519"
XTKG,"X3 Holdings Co., Ltd. Ordinary Shares",$1.7715,0.0665,3.90%,"24,390,313"
PMN,ProMIS Neurosciences Inc. Common Shares (ON),$0.4682,0.0122,2.675%,"24,255,802"
ARBK,Argo Blockchain plc American Depositary Shares,$0.3381,-0.0269,-7.37%,"24,250,234"
TRSG,Tungray Technologies Inc Class A Ordinary Shares,$1.48,0.0065,0.441%,"24,203,158"
TLF,"Tandy Leather Factory, Inc. Common Stock",$3.00,-0.0012,-0.04%,"24,202,506"
GTEC,Greenland Technologies Holding Corporation Ordinary Shares,$1.39,0.04,2.963%,"24,177,974"
ANY,Sphere 3D Corp. Common Shares,$0.8536,0.1136,15.351%,"24,174,662"
PWM,Prestige Wealth Inc. Class A Ordinary Shares,$0.7638,0.0128,1.704%,"24,168,128"
XOS,"Xos, Inc. Common Stock",$2.78,0.09,3.346%,"24,159,821"
SGRP,"SPAR Group, Inc. Common Stock",$1.02,-0.01,-0.971%,"24,158,447"
JL,J-Long Group Limited Class A Ordinary Shares,$6.41,-0.09,-1.385%,"24,112,503"
VVOS,"Vivos Therapeutics, Inc. Common Stock",$3.20,0.01,0.313%,"24,015,382"
CREX,"Creative Realities, Inc. Common Stock",$2.28,-0.03,-1.299%,"23,983,165"
KAPA,"Kairos Pharma, Ltd. Common Stock",$1.15,0.02,1.77%,"23,855,330"
ZONE,CleanCore Solutions Inc. Class B Common Stock,$2.13,UNCH,--,"23,804,552"
BOF,BranchOut Food Inc. Common Stock,$2.02,-0.03,-1.463%,"23,802,640"
TOPP,Toppoint Holdings Inc. Common Stock,$1.36,0.02,1.493%,"23,800,000"
ABTS,Abits Group Inc Ordinary Shares,$10.04,-0.23,-2.24%,"23,796,196"
MTVA,MetaVia Inc. Common Stock,$0.9823,-0.0477,-4.631%,"23,769,508"
TBLAW,Taboola.com Ltd. Warrant,$0.08,UNCH,--,"23,737,511"
CMBM,Cambium Networks Corporation Ordinary Shares,$0.839,-0.0453,-5.123%,"23,696,555"
SNYR,Synergy CHC Corp. Common Stock,$2.48,-0.02,-0.80%,"23,693,186"
ALLR,"Allarity Therapeutics, Inc. Common Stock",$1.62,UNCH,--,"23,683,810"
REE,REE Automotive Ltd. Class A Ordinary Shares,$0.7603,-0.0085,-1.106%,"23,585,215"
WFF,WF Holding Limited Ordinary Shares,$0.9452,-0.0148,-1.542%,"23,582,740"
FLDDW,"Fold Holdings, Inc. Warrant",$0.504,0.004,0.80%,"23,582,125"
PPCB,"Propanc Biopharma, Inc. Common Stock",$1.84,0.14,8.235%,"23,564,414"
PSHG,Performance Shipping Inc. Common Shares,$1.89,-0.06,-3.077%,"23,496,779"
ZSPC,"zSpace, Inc. Common stock",$0.984,0.0874,9.748%,"23,469,156"
UTSI,UTStarcom Holdings Corp. Ordinary Shares,$2.47,-0.07,-2.756%,"23,391,530"
WXM,WF International Limited Ordinary Shares,$3.39,0.13,3.988%,"23,391,000"
MSAI,"MultiSensor AI Holdings, Inc. Common Stock",$0.675,0.0236,3.623%,"23,337,777"
CVV,CVD Equipment Corporation Common Stock,$3.39,0.11,3.354%,"23,329,431"
TC,Token Cat Limited American Depositary Shares,$13.72,0.0633,0.464%,"23,210,302"
GDTC,CytoMed Therapeutics Limited Ordinary Shares,$2.01,UNCH,--,"23,195,400"
BLBX,Blackboxstocks Inc. Common Stock,$6.12,0.03,0.493%,"23,192,309"
NWGL,Nature Wood Group Limited American Depositary Shares,$1.4001,-0.0364,-2.534%,"23,176,086"
NCRA,"Nocera, Inc. Common Stock",$1.61,0.06,3.871%,"23,131,738"
CUPR,Cuprina Holdings (Cayman) Limited Class A Ordinary Shares,$1.10,0.05,4.762%,"23,100,000"
MGRX,"Mangoceuticals, Inc. Common Stock",$2.19,0.08,3.791%,"23,073,382"
WIMI,WiMi Hologram Cloud Inc. Class B Ordinary Shares,$4.69,-0.02,-0.425%,"23,029,790"
ROLR,"High Roller Technologies, Inc. Common Stock",$2.71,-0.18,-6.228%,"22,986,692"
IPST,"Heritage Distilling Holding Company, Inc. Common Stock",$0.8717,0.0776,9.772%,"22,872,560"
NTRBW,Nutriband Inc. Warrant,$1.90,0.59,45.038%,"22,866,278"
MNDO,MIND C.T.I. Ltd. Ordinary Shares,$1.12,0.01,0.901%,"22,810,285"
AZI,Autozi Internet Technology (Global) Ltd. Class A Ordinary Shares,$0.2145,-0.0005,-0.233%,"22,732,967"
WKSP,"Worksport, Ltd. Common Stock",$3.42,-0.16,-4.469%,"22,715,770"
PRPH,"ProPhase Labs, Inc. Common Stock (DE)",$0.5468,0.0314,6.092%,"22,714,731"
CTXR,"Citius Pharmaceuticals, Inc. Common Stock",$1.33,-0.04,-2.92%,"22,626,214"
FBLG,"FibroBiologics, Inc. Common Stock",$0.54,0.0169,3.231%,"22,620,137"
CKX,"CKX Lands, Inc. Common Stock",$11.00,-0.05,-0.452%,"22,584,419"
JOB,GEE Group Inc. Common Stock,$0.2064,-0.0016,-0.769%,"22,582,894"
BCTX,BriaCell Therapeutics Corp. Common Shares,$12.83,0.26,2.068%,"22,518,048"
COHN,Cohen & Company Inc.,$11.0407,-0.2493,-2.208%,"22,477,353"
PFAI,Pinnacle Food Group Limited Class A Common Shares,$1.92,-0.0299,-1.533%,"22,464,000"
RYOJ,"rYojbaba Co., Ltd. Common Shares",$1.99,0.09,4.737%,"22,387,500"
PASW,"Ping An Biomedical Co., Ltd. Ordinary Shares",$1.09,0.1069,10.874%,"22,345,000"
BGI,Birks Group Inc. Common Stock,$1.14,-0.04,-3.39%,"22,337,943"
LSTA,"Lisata Therapeutics, Inc. Common Stock",$2.55,0.10,4.082%,"22,327,667"
SQFTP,"Presidio Property Trust, Inc. 9.375% Series D Cumulative Redeemable Perpetual Preferred Stock, $0.01 par value per share",$15.37,-0.0307,-0.199%,"22,303,223"
CURX,Curanex Pharmaceuticals Inc Common Stock,$0.80,0.0271,3.506%,"22,200,000"
GLBS,Globus Maritime Limited Common Stock,$1.075,0.025,2.381%,"22,125,974"
ELBM,Electra Battery Materials Corporation Common Stock,$1.23,-0.27,-18.00%,"22,093,473"
DXST,Decent Holding Inc Class A Ordinary Shares,$1.3547,0.0237,1.781%,"22,013,875"
GYRO,"Gyrodyne, LLC Common Stock",$10.00,UNCH,--,"21,993,080"
CING,Cingulate Inc. Common Stock,$4.06,-0.13,-3.103%,"21,974,843"
VSME,VS Media Holdings Limited Class A Ordinary Shares,$2.30,-0.14,-5.738%,"21,834,799"
GWH,"ESS Tech, Inc. Common Stock",$1.53,-0.02,-1.29%,"21,710,184"
NXPL,NextPlat Corp Common Stock,$0.8351,-0.0053,-0.631%,"21,681,744"
APUS,"Apimeds Pharmaceuticals US, Inc. Common Stock",$1.72,0.01,0.585%,"21,630,691"
YMAT,"J-Star Holding Co., Ltd. Ordinary Shares",$1.27,0.07,5.833%,"21,606,366"
HCAI,"Huachen AI Parking Management Technology Holding Co., Ltd. Class A Ordinary Shares",$0.639,0.059,10.172%,"21,556,665"
VSTD,Vestand Inc. Class A Common Stock,$1.51,0.03,2.027%,"21,479,720"
RLYB,Rallybio Corporation Common Stock,$0.5116,-0.0073,-1.407%,"21,377,959"
CLSD,"Clearside Biomedical, Inc. Common Stock",$4.07,-0.11,-2.632%,"21,302,465"
SHFS,"SHF Holdings, Inc. Class A Common Stock",$7.29,-0.12,-1.619%,"21,257,319"
CJMB,Callan JMB Inc. Common Stock,$4.73,-0.15,-3.074%,"21,195,456"
RENT,"Rent the Runway, Inc. Class A Common Stock",$5.15,0.15,3.00%,"21,099,710"
AFRIW,Forafric Global PLC Warrants,$0.7832,UNCH,--,"21,069,327"
CTRM,Castor Maritime Inc. Common Shares,$2.17,0.10,4.831%,"20,967,308"
RAY,Raytech Holding Limited Ordinary Shares,$0.48,-0.016,-3.226%,"20,927,080"
SABS,"SAB Biotherapeutics, Inc. Common Stock",$2.01,0.03,1.515%,"20,926,233"
HTCR,"Heartcore Enterprises, Inc. Common Stock",$0.8963,-0.0315,-3.395%,"20,893,443"
MSS,Maison Solutions Inc. Class A Common Stock,$1.06,0.061,6.106%,"20,871,905"
ASBP,"Aspire Biopharma Holdings, Inc. Common Stock",$0.42,0.2054,95.713%,"20,800,907"
ECXWW,ECARX Holdings Inc. Warrants,$0.0599,-0.0001,-0.167%,"20,709,229"
HOTH,"Hoth Therapeutics, Inc. Common Stock",$1.56,-0.04,-2.50%,"20,684,082"
MTC,"MMTec, Inc. Common Shares",$0.8199,-0.0296,-3.484%,"20,650,710"
SNES,"SenesTech, Inc. Common Stock",$3.94,-0.13,-3.194%,"20,578,679"
HXHX,Haoxin Holdings Limited Class A Ordinary Shares,$1.49,-0.05,-3.247%,"20,487,500"
HBIO,"Harvard Bioscience, Inc. Common Stock",$0.4593,0.0115,2.568%,"20,453,179"
HUDI,"Huadi International Group Co., Ltd. Ordinary Shares",$1.43,0.04,2.878%,"20,419,230"
HUBC,Hub Cyber Security Ltd. Ordinary Shares,$2.03,0.04,2.01%,"20,396,011"
BANL,CBL International Limited Ordinary Shares,$0.7399,-0.0101,-1.347%,"20,347,250"
TOMZ,"TOMI Environmental Solutions, Inc. Common Stock",$1.01,UNCH,--,"20,275,957"
LRE,"Lead Real Estate Co., Ltd American Depositary Shares",$1.484,-0.046,-3.007%,"20,244,580"
HWH,HWH International Inc. Common Stock,$3.12,0.36,13.043%,"20,206,368"
EHLD,Euroholdings Ltd. Common Stock ,$7.1506,0.0306,0.43%,"20,140,487"
EONR,EON Resources Inc. Class A Common Stock,$0.5398,-0.0439,-7.521%,"20,135,273"
CRIS,"Curis, Inc. Common Stock",$1.61,-0.06,-3.593%,"20,123,153"
SPPL,SIMPPLE LTD. Ordinary Shares,$5.6623,-0.2477,-4.191%,"20,043,353"
ANGH,Anghami Inc. Ordinary Shares,$2.99,0.04,1.356%,"19,999,252"
CRE,Cre8 Enterprise Limited Class A Ordinary Shares,$0.8319,-0.0381,-4.379%,"19,986,398"
BTMWW,Bitcoin Depot Inc. Warrant,$0.2929,-0.0121,-3.967%,"19,941,109"
RMSG,Real Messenger Corporation Ordinary Shares,$2.07,-0.1925,-8.508%,"19,812,552"
SYBX,"Synlogic, Inc. Common Stock",$1.69,-0.01,-0.588%,"19,771,173"
TRIB,Trinity Biotech plc American Depositary Shares,$1.06,0.04,3.922%,"19,749,940"
MDAIW,"Spectral AI, Inc. Warrants",$0.7368,-0.0022,-0.298%,"19,695,392"
OPI,Office Properties Income Trust Common Shares of Beneficial Interest,$0.2651,-0.0336,-11.249%,"19,611,088"
NXGL,"NexGel, Inc Common Stock",$2.4304,0.0054,0.223%,"19,607,446"
IRIX,IRIDEX Corporation Common Stock,$1.15,0.02,1.77%,"19,541,091"
USGOW,U.S. GoldMining Inc. Warrant,$1.54,-0.04,-2.532%,"19,531,321"
AYTU,"Aytu BioPharma, Inc.  Common Stock",$1.97,0.10,5.348%,"19,526,469"
DTCK,Davis Commodities Limited Class A Ordinary Shares,$0.7966,0.0086,1.091%,"19,517,198"
LEDS,SemiLEDS Corporation Common Stock,$2.37,0.19,8.716%,"19,487,095"
MWYN,"Marwynn Holdings, Inc. Common stock",$1.14,UNCH,--,"19,441,565"
TMDE,TMD Energy Limited Ordinary Shares,$0.8235,0.0023,0.28%,"19,405,778"
NISN,"NiSun International Enterprise Development Group Co., Ltd. Class A Common Shares",$4.04,0.14,3.59%,"19,385,366"
EDSA,"Edesa Biotech, Inc. Common Shares",$2.75,0.18,7.004%,"19,353,532"
TLPH,"Talphera, Inc. Common Stock",$0.9412,0.0077,0.825%,"19,315,923"
LMFA,"LM Funding America, Inc. Common Stock",$1.27,0.09,7.627%,"19,301,953"
ICU,SeaStar Medical Holding Corporation Common Stock,$0.685,0.061,9.776%,"19,121,498"
BATL,Battalion Oil Corporation Common Stock,$1.16,0.01,0.87%,"19,089,613"
ELPW,Elong Power Holding Limited Class A Ordinary Shares,$0.3282,-0.0001,-0.03%,"19,053,999"
GDHG,Golden Heaven Group Holdings Ltd. Class A Ordinary Shares,$7.47,-0.04,-0.533%,"18,914,526"
TBH,"Brag House Holdings, Inc. Common Stock",$1.74,0.19,12.258%,"18,831,303"
CXAI,CXApp Inc. Class A Common Stock,$0.7996,0.0552,7.415%,"18,738,813"
IPM,Intelligent Protection Management Corp. Common Stock ,$2.025,-0.015,-0.735%,"18,704,899"
BTCT,BTC Digital Ltd. Ordinary Shares,$2.89,0.06,2.12%,"18,594,376"
CLRB,"Cellectar Biosciences, Inc.  Common Stock",$5.80,0.03,0.52%,"18,513,832"
PN,Skycorp Solar Group Limited Ordinary Shares,$0.6835,-0.002,-0.292%,"18,454,500"
MXC,Mexco Energy Corporation Common Stock,$9.00,0.03,0.334%,"18,414,000"
EHGO,Eshallgo Inc. Class A Ordinary Shares,$0.62,0.002,0.324%,"18,410,381"
ASTLW,Algoma Steel Group Inc. Warrant,$0.175,-0.015,-7.895%,"18,363,415"
WVVI,"Willamette Valley Vineyards, Inc. Common Stock",$3.69,-0.06,-1.60%,"18,319,112"
NVNO,enVVeno Medical Corporation Common Stock,$0.9515,0.041,4.503%,"18,313,655"
HSDT,Solana Company Class A Common Stock (DE),$17.00,2.04,13.636%,"18,313,369"
ABP,"Abpro Holdings, Inc Common Stock",$0.2284,0.0039,1.737%,"18,310,067"
GIGM,GigaMedia Limited Ordinary Shares,$1.65,-0.03,-1.786%,"18,236,188"
CYCU,"Cycurion, Inc. Common Stock",$0.3508,-0.0387,-9.936%,"18,040,254"
MI,NFT Limited Class A Ordinary Share,$3.54,0.04,1.143%,"17,930,631"
COOT,Australian Oilseeds Holdings Limited Ordinary Shares,$0.6401,-0.0042,-0.652%,"17,857,854"
PULM,"Pulmatrix, Inc. Common Stock",$4.87,-0.0251,-0.513%,"17,786,628"
BURU,"Nuburu, Inc. Common Stock",$0.2212,0.0586,36.039%,"17,685,586"
FIEE,"FiEE, Inc Common Stock",$2.84,0.07,2.527%,"17,677,265"
MDRR,"Medalist Diversified REIT, Inc. Common Stock",$13.1269,-0.8731,-6.236%,"17,659,093"
SEGG,"Lottery.com, Inc. Common Stock",$4.46,0.028,0.632%,"17,573,627"
EDTK,Skillful Craftsman Education Technology Limited Ordinary Share,$1.1001,-0.0099,-0.892%,"17,523,989"
DKI,DarkIris Inc. Class A Ordinary Shares,$1.00,0.04,4.167%,"17,500,000"
MIGI,Mawson Infrastructure Group Inc. Common Stock,$0.8378,0.3162,60.621%,"17,464,864"
SAIH,SAIHEAT Limited Class A Ordinary Shares,$9.9514,0.6514,7.004%,"17,444,307"
SRTAW,"Strata Critical Medical, Inc. Warrants",$0.213,0.033,18.333%,"17,401,164"
LEXX,Lexaria Bioscience Corp. Common Stock,$0.8895,-0.0858,-8.797%,"17,397,890"
ABVEW,Above Food Ingredients Inc. Warrants,$0.3392,0.062,22.367%,"17,364,275"
ZDAI,"DirectBooking Technology Co., Ltd. Ordinary Shares",$0.6575,0.0074,1.138%,"17,358,000"
MDCXW,Medicus Pharma Ltd. Warrant,$1.075,0.295,37.821%,"17,131,486"
WKHS,"Workhorse Group, Inc. Common Stock",$1.11,-0.01,-0.893%,"17,064,325"
YHGJ,Yunhong Green CTI Ltd. Common Stock,$6.15,0.89,16.92%,"17,059,251"
SOHO,Sotherly Hotels Inc. Common Stock,$0.83,0.0201,2.482%,"17,007,116"
NAII,"Natural Alternatives International, Inc. Common Stock",$2.75,-0.15,-5.172%,"16,986,140"
DTSS,Datasea Inc. Common Stock,$2.05,0.01,0.49%,"16,926,473"
IPW,iPower Inc. Common Stock,$0.539,0.009,1.698%,"16,902,986"
GTIM,Good Times Restaurants Inc. Common Stock,$1.60,-0.05,-3.03%,"16,879,213"
MNTS,Momentus Inc. Class A Common Stock,$1.45,0.09,6.618%,"16,869,829"
HOVRW,New Horizon Aircraft Ltd. Warrant,$0.43,0.0176,4.268%,"16,860,580"
LPCN,Lipocine Inc. Common Stock,$3.09,0.12,4.04%,"16,744,855"
AIMD,"Ainos, Inc. Common Stock",$3.59,0.14,4.058%,"16,721,721"
MTEX,"Mannatech, Incorporated Common Stock",$8.75,-1.13,-11.437%,"16,633,138"
BLIN,"Bridgeline Digital, Inc. Common Stock",$1.37,0.05,3.788%,"16,593,533"
ELSE,"Electro-Sensors, Inc. Common Stock",$4.8046,UNCH,--,"16,571,166"
TKLF,"Tokyo Lifestyle Co., Ltd. American Depositary Shares",$3.91,0.06,1.558%,"16,550,174"
WCT,Wellchange Holdings Company Limited Class A Ordinary shares,$0.3574,-0.0081,-2.216%,"16,535,111"
ATHA,"Athira Pharma, Inc. Common Stock",$4.16,-0.04,-0.952%,"16,406,761"
IBIO,"iBio, Inc. Common Stock",$0.8339,0.0101,1.226%,"16,390,001"
SOND,Sonder Holdings Inc. Class A Common Stock,$1.23,-0.04,-3.15%,"16,369,432"
MTEK,Maris-Tech Ltd. Ordinary Shares,$2.05,0.10,5.128%,"16,366,308"
COCH,"Envoy Medical, Inc. Class A Common Stock",$0.7555,-0.018,-2.327%,"16,259,064"
AEVAW,"Aeva Technologies, Inc. Warrants",$0.2885,-0.0014,-0.483%,"16,250,541"
SMSI,"Smith Micro Software, Inc. Common Stock",$0.7703,0.0384,5.247%,"16,172,385"
OFAL,OFA Group Ordinary Shares,$1.16,0.02,1.754%,"16,151,389"
AGMH,AGM Group Holdings Inc. Class A Ordinary Shares,$7.99,-0.36,-4.311%,"16,110,069"
HCTI,"Healthcare Triangle, Inc. Common Stock",$2.76,-0.16,-5.479%,"16,095,848"
ALUR,"Allurion Technologies, Inc. Common Stock",$2.07,0.01,0.485%,"16,068,750"
MMA,Mixed Martial Arts Group Limited Ordinary Shares,$1.56,0.02,1.299%,"16,040,990"
NXL,"Nexalin Technology, Inc. Common Stock",$0.9194,0.0396,4.501%,"16,014,044"
WVVIP,"Willamette Valley Vineyards, Inc. Series A Redeemable Preferred Stock",$3.2212,0.0335,1.051%,"15,991,741"
ANNAW,"AleAnna, Inc. Warrant",$0.1965,-0.0135,-6.429%,"15,979,333"
AMS,American Shared Hospital Services Common Stock,$2.45,-0.03,-1.21%,"15,949,500"
IHT,InnSuites Hospitality Trust Shares of Beneficial Interest,$1.81,-0.01,-0.549%,"15,912,253"
MRM,MEDIROM Healthcare Technologies Inc. American Depositary Share,$2.00,-0.10,-4.762%,"15,803,900"
APM,Aptorum Group Limited Class A Ordinary Shares,$2.21,0.03,1.376%,"15,787,703"
DAVEW,Dave Inc. Warrants,$1.145,0.07,6.512%,"15,605,958"
GPUS,"Hyperscale Data, Inc. Common Stock",$0.484,-0.036,-6.923%,"15,557,915"
TAIT,Taitron Components Incorporated Class A Common Stock,$2.58,0.03,1.176%,"15,534,644"
PALI,"Palisade Bio, Inc. Common Stock",$1.70,0.39,29.771%,"15,502,558"
INVZW,Innoviz Technologies Ltd. Warrant,$0.0778,-0.0018,-2.261%,"15,479,240"
DLPN,"Dolphin Entertainment, Inc. Common Stock",$1.318,0.008,0.611%,"15,470,320"
AIXI,XIAO-I Corporation American Depositary Shares,$1.24,0.03,2.479%,"15,450,817"
NXTC,"NextCure, Inc. Common Stock",$5.7532,0.0632,1.111%,"15,396,196"
INTJ,Intelligent Group Limited Class A Ordinary Shares ,$0.50,UNCH,--,"15,375,000"
BNAI,Brand Engagement Network Inc. Common Stock,$0.355,0.026,7.903%,"15,261,236"
YYGH,YY Group Holding Limited Class A Ordinary Shares,$0.3699,-0.016,-4.146%,"15,201,984"
MSGM,Motorsport Games Inc. Class A Common Stock,$2.63,-0.1076,-3.93%,"15,197,324"
MBRX,"Moleculin Biotech, Inc. Common Stock",$0.50,-0.03,-5.66%,"15,143,084"
KITT,"Nauticus Robotics, Inc. Common stock",$3.22,0.18,5.921%,"15,122,424"
BIVI,BioVie Inc. Class A Common Stock,$2.00,0.01,0.503%,"15,068,450"
ETS,Elite Express Holding Inc. Class A Common Stock,$0.8902,-0.0033,-0.369%,"15,059,221"
CRGOW,Freightos Limited Warrants,$0.2998,0.0398,15.308%,"15,002,813"
HKPD,Hong Kong Pharma Digital Technology Holdings Limited Ordinary shares,$1.36,-0.08,-5.556%,"14,960,000"
USEA,United Maritime Corporation Common Stock,$1.6899,0.0299,1.801%,"14,945,927"
BFRG,"Bullfrog AI Holdings, Inc. Common Stock",$1.48,0.03,2.069%,"14,920,383"
ARTW,"Art's-Way Manufacturing Co., Inc. Common Stock",$2.92,0.31,11.877%,"14,915,605"
PT,Pintec Technology Holdings Limited American Depositary Shares,$0.9334,-0.0455,-4.648%,"14,885,826"
NERV,"Minerva Neurosciences, Inc Common Stock",$2.1059,0.0059,0.281%,"14,727,414"
BGLWW,Blue Gold Limited Warrant,$0.48,-0.07,-12.727%,"14,674,447"
ENFY,Enlightify Inc. Common Stock,$0.9299,0.0411,4.624%,"14,665,392"
