Symbol,Name,Last Sale,Net Change,% Change,Market Cap
ERAS,"Erasca, Inc. Common Stock",$10.05,0.24,2.446%,"2,851,303,640"
COTY,Coty Inc. Class A Common Stock,$3.26,0.12,3.822%,"2,851,253,624"
CALY,Callaway Golf Company Common Stock,$15.48,0.79,5.378%,"2,846,518,701"
CVBF,CVB Financial Corporation Common Stock,$20.80,1.04,5.263%,"2,845,628,614"
RHI,Robert Half Inc. Common Stock,$28.11,0.89,3.27%,"2,844,349,451"
CNK,"Cinemark Holdings Inc Cinemark Holdings, Inc. Common Stock",$24.18,-0.37,-1.507%,"2,840,567,310"
SUPN,"Supernus Pharmaceuticals, Inc. Common Stock",$49.52,-0.30,-0.602%,"2,839,444,612"
WDFC,WD-40 Company Common Stock,$210.25,3.75,1.816%,"2,835,494,996"
BKE,"Buckle, Inc. (The) Common Stock",$55.41,1.38,2.554%,"2,834,588,647"
CRGY,Crescent Energy Company Class A Common Stock,$8.63,0.43,5.244%,"2,833,935,167"
WBI,WaterBridge Infrastructure LLC Class A Shares Representing Limited Liability Company Interests,$22.91,1.02,4.66%,"2,828,354,050"
DYN,"Dyne Therapeutics, Inc. Common Stock",$17.50,0.92,5.549%,"2,827,890,205"
IRON,"Disc Medicine, Inc. Common Stock",$74.89,0.89,1.203%,"2,827,109,632"
CON,"Concentra Group Holdings Parent, Inc. Common Stock",$21.99,0.08,0.365%,"2,818,462,742"
BRSL,"Brightstar Lottery PLC Trading under the Legal Name to begin at the market open on July 21, 2025. Ordinary Shares",$13.95,0.03,0.216%,"2,818,341,308"
POWWP,Outdoor Holding Company 8.75% Series A Cumulative Redeemable Perpetual Preferred Stock,$24.02,-0.08,-0.332%,"2,813,002,065"
LFST,"LifeStance Health Group, Inc. Common Stock",$7.21,0.03,0.418%,"2,804,692,026"
MSGE,Madison Square Garden Entertainment Corp. Class A Common Stock,$59.34,0.69,1.176%,"2,802,729,493"
DBRG,"DigitalBridge Group, Inc.",$15.34,-0.01,-0.065%,"2,802,225,680"
INSP,"Inspire Medical Systems, Inc. Common Stock",$96.20,1.75,1.853%,"2,795,228,951"
NATL,NCR Atleos Corporation Common Stock,$37.82,0.64,1.721%,"2,795,054,424"
BTDR,Bitdeer Technologies Group Class A Ordinary Shares,$14.19,-0.38,-2.608%,"2,791,827,854"
PTEN,"Patterson-UTI Energy, Inc. Common Stock",$7.36,0.27,3.808%,"2,791,221,297"
ALMS,Alumis Inc. Common Stock,$26.68,0.62,2.379%,"2,785,215,992"
MH,"McGraw Hill, Inc. Common Stock",$14.57,0.57,4.071%,"2,782,892,132"
MGRC,McGrath RentCorp Common Stock,$112.91,4.08,3.749%,"2,778,902,192"
FTAIM,FTAI Aviation Ltd. 9.500% Fixed-Rate Reset Series D Cumulative Perpetual Redeemable Preferred Shares,$27.05,0.02,0.074%,"2,774,597,621"
PFS,"Provident Financial Services, Inc Common Stock",$21.19,1.33,6.697%,"2,767,888,317"
HCM,HUTCHMED (China) Limited American Depositary Shares,$15.85,0.23,1.472%,"2,764,777,854"
KWR,Quaker Houghton Common Stock,$159.19,8.96,5.964%,"2,760,360,172"
ABM,ABM Industries Incorporated Common Stock,$45.83,0.39,0.858%,"2,757,940,554"
TDC,Teradata Corporation Common Stock,$29.54,0.10,0.34%,"2,753,128,000"
BKV,BKV Corporation Common Stock,$28.40,1.30,4.797%,"2,751,161,051"
TR,"Tootsie Roll Industries, Inc. Common Stock",$37.62,-0.19,-0.503%,"2,745,757,021"
IMNM,"Immunome, Inc. Common Stock",$24.87,0.99,4.146%,"2,743,955,547"
LION,Lionsgate Studios Corp Common Shares,$9.47,-0.10,-1.045%,"2,743,736,604"
SUNC,"SunocoCorp LLC Common Units, representing limited liability company interests",$53.25,-1.23,-2.258%,"2,743,290,794"
PAX,Patria Investments Limited Class A Common Shares,$17.19,0.20,1.177%,"2,741,264,409"
CUBI,"Customers Bancorp, Inc Common Stock",$80.20,4.82,6.394%,"2,740,279,775"
DIOD,Diodes Incorporated Common Stock,$59.04,2.70,4.792%,"2,738,589,942"
AAP,Advance Auto Parts Inc.,$45.53,4.22,10.215%,"2,732,812,815"
GTM,ZoomInfo Technologies Inc Common Stock,$8.76,-0.025,-0.285%,"2,729,550,598"
FFBC,First Financial Bancorp. Common Stock,$27.68,1.26,4.769%,"2,727,301,930"
TOWN,TowneBank Common Stock,$36.53,1.35,3.837%,"2,725,771,065"
VNET,"VNET Group, Inc. American Depositary Shares",$10.12,0.64,6.751%,"2,722,542,118"
OLN,Olin Corporation Common Stock,$23.84,1.29,5.721%,"2,720,657,251"
NMFCZ,New Mountain Finance Corporation 8.250% Notes due 2028,$25.53,0.05,0.196%,"2,715,395,334"
ATHM,"Autohome Inc. American Depositary Shares, each representing four class A ordinary shares.",$22.91,0.22,0.97%,"2,713,545,969"
BRZE,"Braze, Inc. Class A Common Stock",$24.14,-0.07,-0.289%,"2,708,882,122"
ATRO,Astronics Corporation Common Stock,$76.03,1.86,2.508%,"2,708,882,070"
ZIM,ZIM Integrated Shipping Services Ltd. Ordinary Shares,$22.47,0.94,4.366%,"2,706,680,250"
PRK,Park National Corporation Common Stock,$168.24,8.01,4.999%,"2,705,006,799"
PHIN,PHINIA Inc. Common Stock,$70.34,2.71,4.007%,"2,704,057,689"
AVPT,"AvePoint, Inc. Class A Common Stock",$12.52,0.12,0.968%,"2,701,682,199"
AKR,Acadia Realty Trust Common Stock,$20.58,-0.27,-1.295%,"2,696,692,562"
RUM,Rumble Inc. Class A Common Stock,$6.19,0.44,7.652%,"2,691,798,398"
ADPT,Adaptive Biotechnologies Corporation Common Stock,$17.57,-0.30,-1.679%,"2,682,327,353"
GT,The Goodyear Tire & Rubber Company Common Stock,$9.37,0.40,4.459%,"2,681,327,717"
BATRA,"Atlanta Braves Holdings, Inc. Series A Common Stock",$42.52,0.05,0.118%,"2,675,499,566"
WB,Weibo Corporation American Depositary Share,$10.92,0.32,3.019%,"2,673,492,058"
TWST,Twist Bioscience Corporation Common Stock,$43.65,2.00,4.802%,"2,670,988,721"
WOR,"Worthington Enterprises, Inc. Common Shares",$53.81,1.32,2.515%,"2,666,101,524"
TENB,"Tenable Holdings, Inc. Common Stock",$22.33,0.47,2.15%,"2,664,957,460"
CWT,California Water Service Group Common Stock,$44.64,-0.05,-0.112%,"2,660,157,462"
CHEF,"The Chefs' Warehouse, Inc. Common Stock",$65.37,1.98,3.124%,"2,659,614,338"
APLS,"Apellis Pharmaceuticals, Inc. Common Stock",$20.95,0.48,2.345%,"2,650,703,317"
BTE,Baytex Energy Corp Common Shares,$3.44,0.09,2.687%,"2,643,010,480"
BLKB,"Blackbaud, Inc. Common Stock",$55.21,1.33,2.468%,"2,640,925,023"
SYRE,"Spyre Therapeutics, Inc. Common Stock",$33.99,0.26,0.771%,"2,637,356,499"
NCNO,"nCino, Inc. Common Stock",$22.94,-0.07,-0.304%,"2,630,873,166"
MFAO,"MFA Financial, Inc. 9.000% Senior Notes due 2029",$25.58,0.01,0.039%,"2,626,265,397"
SVM,Silvercorp Metals Inc. Common Shares,$11.92,-0.32,-2.614%,"2,626,110,505"
AAOI,"Applied Optoelectronics, Inc. Common Stock",$38.38,-0.88,-2.241%,"2,620,525,644"
UAA,"Under Armour, Inc. Class A Common Stock",$6.18,0.44,7.666%,"2,619,636,257"
DRVN,Driven Brands Holdings Inc. Common Stock,$15.92,0.60,3.916%,"2,618,111,151"
FTAIN,FTAI Aviation Ltd. 8.25% Fixed - Rate Reset Series C Cumulative Perpetual Redeemable Preferred Shares,$25.51,0.0359,0.141%,"2,616,635,317"
KMT,Kennametal Inc. Common Stock,$34.34,0.72,2.142%,"2,613,038,290"
MFAN,"MFA Financial, Inc. 8.875% Senior Notes due 2029",$25.45,0.03,0.118%,"2,612,918,466"
VC,Visteon Corporation Common Stock,$95.71,4.03,4.396%,"2,611,535,595"
FCPT,"Four Corners Property Trust, Inc. Common Stock",$24.60,-0.11,-0.445%,"2,609,617,520"
QUBT,Quantum Computing Inc. Common Stock,$11.64,-0.29,-2.431%,"2,608,795,259"
DXC,DXC Technology Company Common Stock ,$14.98,0.44,3.026%,"2,608,526,526"
CNXC,Concentrix Corporation Common Stock,$41.74,1.63,4.064%,"2,598,625,504"
IE,Ivanhoe Electric Inc. Common Stock,$17.95,-0.03,-0.167%,"2,597,630,247"
DKL,"Delek Logistics Partners, L.P. Common Units representing Limited Partner Interests",$48.43,0.67,1.403%,"2,590,055,820"
CMBT,CMB.TECH NV Ordinary Shares,$11.74,0.35,3.073%,"2,583,090,131"
VSH,"Vishay Intertechnology, Inc. Common Stock",$19.05,1.19,6.663%,"2,582,958,925"
UA,"Under Armour, Inc. Class C Common Stock",$6.09,0.46,8.171%,"2,581,486,215"
UPWK,Upwork Inc. Common Stock,$19.69,0.20,1.026%,"2,572,594,646"
CURB,Curbline Properties Corp. Common Stock,$24.41,-0.11,-0.449%,"2,572,035,809"
NSA,National Storage Affiliates Trust Common Shares of Beneficial Interest,$33.40,0.37,1.12%,"2,570,489,618"
AMBP,Ardagh Metal Packaging S.A. Ordinary Shares,$4.29,0.17,4.126%,"2,564,131,224"
USAR,"USA Rare Earth, Inc. Class A Common Stock",$19.33,0.13,0.677%,"2,563,903,384"
MLCO,Melco Resorts & Entertainment Limited American Depositary Shares,$6.02,-0.21,-3.371%,"2,561,591,035"
IHS,IHS Holding Limited Ordinary Shares,$7.68,0.20,2.674%,"2,560,826,396"
ETOR,eToro Group Ltd. Class A Common Shares,$30.56,-0.25,-0.811%,"2,557,993,873"
TRMK,Trustmark Corporation Common Stock,$42.64,2.25,5.571%,"2,556,619,993"
GDV,Gabelli Dividend & Income Trust Common Shares of Beneficial Interest,$28.33,0.35,1.251%,"2,555,039,950"
BELFB,Bel Fuse Inc. Class B Common Stock,$201.80,0.63,0.313%,"2,554,901,613"
RXO,"RXO, Inc. Common Stock",$15.53,0.89,6.079%,"2,548,657,372"
TGB,"Taseko Mines, Ltd. Common Stock",$7.06,-0.09,-1.259%,"2,544,500,079"
XRAY,DENTSPLY SIRONA Inc. Common Stock,$12.74,0.69,5.726%,"2,542,292,085"
HE,"Hawaiian Electric Industries, Inc. Common Stock",$14.72,0.63,4.471%,"2,540,973,407"
GSHD,"Goosehead Insurance, Inc. Class A Common Stock",$68.94,0.10,0.145%,"2,540,043,974"
ANDG,Andersen Group Inc. Class A Common Stock,$22.88,0.72,3.249%,"2,538,593,200"
ZGN,Ermenegildo Zegna N.V. Ordinary Shares,$10.05,0.49,5.126%,"2,538,427,784"
ASAN,"Asana, Inc. Class A Common Stock",$10.68,-0.07,-0.651%,"2,532,228,011"
MTRN,Materion Corporation,$149.12,3.55,2.439%,"2,531,740,422"
OXLC,Oxford Lane Capital Corp. Common Stock,$14.58,0.08,0.552%,"2,531,088,000"
ATEC,"Alphatec Holdings, Inc. Common Stock",$17.03,-0.12,-0.70%,"2,529,809,651"
TVTX,"Travere Therapeutics, Inc. Common Stock",$28.25,0.31,1.11%,"2,527,593,238"
BWNB,"Babcock & Wilcox Enterprises, Inc. 6.50% Senior Notes due 2026",$25.00,UNCH,--,"2,527,438,550"
POWI,"Power Integrations, Inc. Common Stock",$45.65,2.75,6.41%,"2,526,095,795"
CVI,CVR Energy Inc. Common Stock,$25.03,2.18,9.54%,"2,516,280,893"
WRD,WeRide Inc. American Depositary Shares,$8.84,0.36,4.245%,"2,515,235,520"
NSIT,"Insight Enterprises, Inc. Common Stock",$81.11,1.54,1.935%,"2,512,755,113"
DAVE,Dave Inc. Class A Common Stock,$186.00,0.73,0.394%,"2,511,759,252"
WVE,Wave Life Sciences Ltd. Ordinary Shares,$13.94,0.12,0.868%,"2,508,911,498"
FBNC,First Bancorp Common Stock,$60.50,2.75,4.762%,"2,508,652,405"
CTRI,"Centuri Holdings, Inc. Common Stock",$28.27,0.44,1.581%,"2,506,111,584"
DBD,Diebold Nixdorf Incorporated Common stock,$69.79,1.18,1.72%,"2,503,168,817"
WAFD,"WaFd, Inc. Common Stock",$32.61,1.17,3.721%,"2,501,219,675"
FORTY,Formula Systems (1985) Ltd. American Depositary Shares,$163.27,-6.74,-3.964%,"2,500,915,491"
FA,First Advantage Corporation Common Stock,$14.33,0.18,1.272%,"2,495,067,348"
NAMSW,NewAmsterdam Pharma Company N.V. Warrant,$22.00,1.18,5.668%,"2,494,597,688"
SBLK,Star Bulk Carriers Corp. Common Shares,$21.29,0.18,0.853%,"2,493,645,135"
OGN,Organon & Co. Common Stock ,$9.59,0.13,1.374%,"2,493,236,126"
BBAI,"BigBear.ai, Inc. Common Stock",$5.71,-0.23,-3.872%,"2,492,707,512"
GEO,Geo Group Inc (The) REIT,$17.89,0.14,0.789%,"2,490,238,785"
RCUS,"Arcus Biosciences, Inc. Common Stock",$22.95,1.00,4.556%,"2,477,992,651"
MLYS,"Mineralys Therapeutics, Inc. Common Stock",$31.31,-0.62,-1.942%,"2,477,872,022"
ATKR,Atkore Inc. Common Stock,$73.08,1.89,2.655%,"2,466,485,517"
BATRK,"Atlanta Braves Holdings, Inc. Series C Common Stock",$39.16,-0.23,-0.584%,"2,464,077,211"
BHC,Bausch Health Companies Inc. Common Stock,$6.65,-0.14,-2.062%,"2,463,937,558"
WSBCO,"WesBanco, Inc. Depositary Shares each representing 1/40th interest in a share of 7.375% Fixed-Rate Reset Non-Cumulative Perpetual Preferred Stock, Series B",$25.65,0.09,0.352%,"2,463,563,151"
ALRM,"Alarm.com Holdings, Inc. Common Stock",$49.27,UNCH,--,"2,457,571,834"
TIC,"TIC Solutions, Inc. Common Stock",$11.14,0.04,0.36%,"2,457,035,203"
PTON,"Peloton Interactive, Inc. Class A Common Stock",$5.86,UNCH,--,"2,448,345,926"
TLX,Telix Pharmaceuticals Limited American Depositary Shares,$7.31,-0.42,-5.433%,"2,446,835,985"
CBZ,"CBIZ, Inc. Common Stock",$44.97,-1.20,-2.599%,"2,446,432,037"
TGLS,Tecnoglass Inc. Ordinary Shares,$52.45,0.56,1.079%,"2,442,567,443"
OCUL,"Ocular Therapeutix, Inc. Common Stock",$11.42,-0.03,-0.262%,"2,433,002,130"
CC,Chemours Company (The) Common Stock,$16.19,0.93,6.094%,"2,426,750,703"
HOG,"Harley-Davidson, Inc. Common Stock",$20.54,0.44,2.189%,"2,426,633,866"
UE,Urban Edge Properties Common Shares of Beneficial Interest,$19.27,-0.03,-0.155%,"2,425,200,298"
BBT,Beacon Financial Corporation Common stock,$28.84,1.42,5.179%,"2,419,931,551"
NGVT,Ingevity Corporation Common Stock ,$67.06,2.05,3.153%,"2,411,747,986"
RXRX,"Recursion Pharmaceuticals, Inc. Class A Common Stock",$4.61,0.21,4.773%,"2,396,451,267"
CEPU,Central Puerto S.A. American Depositary Shares (each represents ten Common Shares),$15.77,0.49,3.207%,"2,387,613,104"
SDRL,Seadrill Limited Common Shares,$38.16,3.13,8.935%,"2,380,198,365"
CECO,CECO Environmental Corp. Common Stock,$66.58,0.41,0.62%,"2,372,979,844"
LC,LendingClub Corporation Common Stock,$20.56,0.64,3.213%,"2,370,597,606"
SAM,"Boston Beer Company, Inc. (The) Common Stock",$222.24,4.52,2.076%,"2,368,715,704"
BELFA,Bel Fuse Inc. Class A Common Stock,$187.00,3.76,2.052%,"2,367,525,281"
NBTB,NBT Bancorp Inc. Common Stock,$45.19,2.12,4.922%,"2,364,123,572"
MFICL,MidCap Financial Investment Corporation 8.00% Notes due 2028,$25.3001,0.0101,0.04%,"2,360,590,967"
SID,Companhia Siderurgica Nacional S.A. Common Stock,$1.78,0.08,4.706%,"2,360,447,226"
PTRN,Pattern Group Inc. Series A Common Stock,$13.36,-0.10,-0.743%,"2,354,364,971"
PLUS,ePlus inc. Common Stock,$88.90,3.04,3.541%,"2,350,416,076"
MBLY,Mobileye Global Inc. Class A Common Stock,$10.88,0.36,3.422%,"2,350,144,605"
OI,"O-I Glass, Inc. Common Stock",$15.25,0.37,2.487%,"2,342,316,278"
SLNO,"Soleno Therapeutics, Inc. Common Stock",$43.56,-0.17,-0.389%,"2,339,608,689"
SPNT,SiriusPoint Ltd. Common Shares,$20.01,0.18,0.908%,"2,337,460,946"
BUSEP,"First Busey Corporation Depositary Shares, Each Representing a 1/40thInterest in a Share of 8.25% Fixed-Rate Series B Non-Cumulative Perpetual Preferred Stock, $0.001 par value",$26.40,0.20,0.763%,"2,333,998,735"
GENI,Genius Sports Limited Ordinary Shares,$9.73,0.01,0.103%,"2,333,424,343"
LASR,"nLIGHT, Inc. Common Stock",$45.94,0.69,1.525%,"2,333,109,162"
XNET,Xunlei Limited American Depositary Shares,$7.48,0.04,0.538%,"2,332,715,276"
ALG,"Alamo Group, Inc. Common Stock",$191.95,3.27,1.733%,"2,325,556,405"
CIVI,"Civitas Resources, Inc. Common Stock",$27.22,0.74,2.795%,"2,321,952,532"
PK,Park Hotels & Resorts Inc. Common Stock ,$11.58,0.31,2.751%,"2,314,822,059"
LU,"Lufax Holding Ltd American Depositary Shares, each representing two (2) Ordinary Shares",$2.67,0.09,3.488%,"2,313,928,800"
FLO,"Flowers Foods, Inc. Common Stock",$10.95,-0.09,-0.815%,"2,312,401,564"
AAPG,Ascentage Pharma Group International American Depository Shares,$26.39,0.38,1.461%,"2,297,688,762"
NOG,"Northern Oil and Gas, Inc. Common Stock",$23.51,1.37,6.188%,"2,294,646,013"
GCMG,GCM Grosvenor Inc. Class A Common Stock,$11.77,0.14,1.204%,"2,285,691,981"
ALM,Almonty Industries Inc. Common Shares,$10.14,0.70,7.415%,"2,279,589,705"
SEZL,Sezzle Inc. Common Stock,$66.72,0.89,1.352%,"2,278,694,965"
IVT,InvenTrust Properties Corp. Common Stock,$29.35,0.32,1.102%,"2,278,128,803"
ADAMI,"Adamas Trust, Inc. 9.125% Senior Notes Due 2029",$25.12,-0.07,-0.278%,"2,275,355,759"
CSGS,"CSG Systems International, Inc. Common Stock",$79.76,0.22,0.277%,"2,274,769,318"
FRME,First Merchants Corporation Common Stock,$39.33,1.66,4.407%,"2,274,258,037"
HBNB,Hotel101 Global Holdings Corp. Class A Ordinary Shares,$9.70,-0.16,-1.623%,"2,271,278,261"
KMPR,Kemper Corporation,$38.77,0.26,0.675%,"2,269,861,762"
ADAMM,"Adamas Trust, Inc. 7.875% Series E Fixed-to-Floating Rate Cumulative Redeemable Preferred Stock",$25.1076,0.0276,0.11%,"2,267,557,216"
OMCL,"Omnicell, Inc. Common Stock ($0.001 par value)",$50.48,1.42,2.894%,"2,265,366,831"
HTH,Hilltop Holdings Inc.,$36.85,1.46,4.125%,"2,259,956,588"
BUSE,First Busey Corporation Class A Common Stock,$25.49,1.11,4.553%,"2,253,546,506"
BANR,Banner Corporation Common Stock,$66.03,1.85,2.883%,"2,250,693,958"
TPB,"Turning Point Brands, Inc. Common Stock",$118.01,0.49,0.417%,"2,250,540,034"
NVTS,Navitas Semiconductor Corporation Common Stock,$9.76,-0.10,-1.014%,"2,249,642,736"
HI,Hillenbrand Inc Common Stock,$31.82,UNCH,--,"2,243,526,981"
RNG,"RingCentral, Inc. Class A Common Stock",$25.90,0.09,0.349%,"2,242,026,119"
BB,BlackBerry Limited Common Stock,$3.80,-0.03,-0.783%,"2,242,000,000"
MESO,Mesoblast Limited American Depositary Shares,$17.36,0.53,3.149%,"2,240,832,602"
SRPT,"Sarepta Therapeutics, Inc. Common Stock (DE)",$21.37,0.33,1.568%,"2,239,302,186"
HLIO,"Helios Technologies, Inc. Common Stock",$67.51,3.03,4.699%,"2,236,504,630"
NHC,National HealthCare Corporation Common Stock,$143.79,6.01,4.362%,"2,230,938,229"
EVCM,EverCommerce Inc. Common Stock,$12.38,0.25,2.061%,"2,220,568,152"
WT,"WisdomTree, Inc. Common Stock",$15.77,0.60,3.955%,"2,219,076,812"
TRMD,TORM plc Class A Common Stock,$22.67,0.58,2.626%,"2,217,444,536"
PMTU,PennyMac Mortgage Investment Trust 8.50% Senior Notes due 2028,$25.43,0.02,0.079%,"2,212,832,240"
CHA,Chagee Holdings Limited American Depositary Shares,$11.90,-0.19,-1.572%,"2,210,454,631"
GLPG,Galapagos NV American Depositary Shares,$33.48,UNCH,--,"2,206,233,937"
GRND,Grindr Inc. Common Stock,$11.94,-0.11,-0.913%,"2,205,725,405"
NTB,Bank of N.T. Butterfield & Son Limited (The) Voting Ordinary Shares,$51.27,1.53,3.076%,"2,204,610,000"
HCI,"HCI Group, Inc. Common Stock",$170.10,-1.58,-0.92%,"2,204,502,294"
EPAC,Enerpac Tool Group Corp. Common Stock,$41.66,1.52,3.787%,"2,198,660,866"
TRN,"Trinity Industries, Inc. Common Stock",$27.40,0.78,2.93%,"2,196,946,330"
RARE,Ultragenyx Pharmaceutical Inc. Common Stock,$22.75,0.12,0.53%,"2,194,864,695"
PGNY,"Progyny, Inc. Common Stock",$25.45,0.07,0.276%,"2,194,086,594"
QFIN,"Qfin Holdings, Inc. American Depositary Shares",$16.29,-0.26,-1.571%,"2,192,634,000"
SAH,"Sonic Automotive, Inc. Common Stock",$64.00,1.62,2.597%,"2,187,051,776"
NOVTU,Novanta Inc. Tangible Equity Units,$61.11,2.87,4.928%,"2,186,217,767"
WD,"Walker & Dunlop, Inc Common Stock",$64.14,0.71,1.119%,"2,184,879,840"
ASGN,ASGN Incorporated Common Stock,$51.05,2.47,5.084%,"2,179,835,000"
HNI,HNI Corporation Common Stock,$47.53,1.02,2.193%,"2,178,359,835"
ADEA,Adeia Inc. Common Stock,$19.88,0.73,3.812%,"2,177,062,597"
NIC,Nicolet Bankshares Inc. Common Stock,$144.96,13.53,10.294%,"2,164,278,458"
BWLP,BW LPG Limited Common Shares,$14.28,0.05,0.351%,"2,163,968,966"
VVX,"V2X, Inc. Common Stock",$68.48,1.20,1.784%,"2,159,522,484"
KALU,Kaiser Aluminum Corporation Common Stock,$133.16,5.57,4.366%,"2,158,024,916"
EYE,"National Vision Holdings, Inc. Common Stock",$27.21,0.02,0.074%,"2,158,013,073"
SM,SM Energy Company Common Stock,$18.80,0.57,3.127%,"2,153,618,810"
DHT,"DHT Holdings, Inc.",$13.40,0.08,0.601%,"2,151,476,905"
NYAX,Nayax Ltd. Ordinary Shares,$58.46,0.52,0.897%,"2,146,988,397"
NEOG,Neogen Corporation Common Stock,$9.87,0.52,5.561%,"2,146,981,432"
EFSC,Enterprise Financial Services Corporation Common Stock,$57.89,2.82,5.121%,"2,142,561,522"
UCTT,"Ultra Clean Holdings, Inc. Common Stock",$47.20,2.94,6.643%,"2,142,270,554"
RVLV,"Revolve Group, Inc. Class A Common Stock",$30.03,1.30,4.525%,"2,142,167,047"
PLAB,"Photronics, Inc. Common Stock",$36.25,1.81,5.256%,"2,141,093,236"
TNK,Teekay Tankers Ltd.,$62.00,1.15,1.89%,"2,131,695,284"
TSLX,"Sixth Street Specialty Lending, Inc. Common Stock",$22.55,0.47,2.129%,"2,130,838,009"
VIA,"Via Transportation, Inc. Class A Common Stock",$26.23,1.49,6.023%,"2,124,389,209"
KN,Knowles Corporation Common Stock,$24.89,0.85,3.536%,"2,119,430,393"
HRMY,"Harmony Biosciences Holdings, Inc. Common Stock",$36.69,0.78,2.172%,"2,113,210,375"
DX,"Dynex Capital, Inc. Common Stock",$14.37,-0.20,-1.373%,"2,109,828,476"
NUVB,Nuvation Bio Inc. Class A Common Stock,$6.15,0.14,2.329%,"2,108,425,613"
MAZE,"Maze Therapeutics, Inc. Common Stock",$43.70,-0.64,-1.443%,"2,102,819,703"
BUR,Burford Capital Limited Ordinary Shares,$9.61,-0.08,-0.826%,"2,102,779,390"
SFB,Stifel Financial Corporation 5.20% Senior Notes due 2047,$20.58,0.06,0.292%,"2,102,728,695"
AVDL,Avadel Pharmaceuticals plc Ordinary Share,$21.51,0.01,0.047%,"2,100,594,843"
AORT,"Artivion, Inc. Common Stock",$44.31,0.80,1.839%,"2,099,183,547"
MTX,Minerals Technologies Inc. Common Stock,$67.39,1.45,2.199%,"2,098,141,016"
GNL,"Global Net Lease, Inc. Common Stock",$9.57,0.14,1.485%,"2,098,049,714"
APPN,Appian Corporation Class A Common Stock,$28.41,0.08,0.282%,"2,097,316,203"
UNFI,"United Natural Foods, Inc. Common Stock",$34.38,0.38,1.118%,"2,094,835,868"
SYBT,"Stock Yards Bancorp, Inc. Common Stock",$71.06,3.24,4.777%,"2,094,383,925"
PRKS,United Parks & Resorts Inc. Common Stock,$38.34,1.25,3.37%,"2,091,470,426"
ANDE,"Andersons, Inc. (The) Common Stock",$61.63,1.91,3.198%,"2,085,505,150"
VZLA,Vizsla Silver Corp. Common Shares,$6.06,-0.49,-7.481%,"2,085,210,810"
HUN,Huntsman Corporation Common Stock,$12.00,0.70,6.195%,"2,085,012,312"
PRDO,Perdoceo Education Corporation Common Stock,$32.40,0.79,2.499%,"2,084,048,222"
ZLAB,Zai Lab Limited American Depositary Shares,$18.84,-0.07,-0.37%,"2,083,586,438"
GEL,"Genesis Energy, L.P. Common Units",$16.97,0.13,0.772%,"2,078,219,476"
CXW,"CoreCivic, Inc. Common Stock",$19.86,-0.31,-1.537%,"2,077,051,248"
FIHL,Fidelis Insurance Holdings Limited Common Shares,$18.57,0.02,0.108%,"2,075,630,905"
UMBFO,"UMB Financial Corporation Depositary Shares Each Representing a 1/400th Interest in a Share of 7.750% Fixed-Rate Reset Non-Cumulative Perpetual Preferred Stock, Series B",$27.3208,0.2208,0.815%,"2,075,142,075"
ARR,"ARMOUR Residential REIT, Inc.",$18.45,-0.11,-0.593%,"2,064,522,454"
ADAML,"Adamas Trust, Inc. 6.875% Series F Fixed-to-Floating Rate Cumulative Redeemable Preferred Stock, $0.01 par value per share",$22.84,0.04,0.175%,"2,062,762,144"
ALKT,"Alkami Technology, Inc. Common Stock",$19.62,-0.11,-0.558%,"2,060,178,696"
ARCB,ArcBest Corporation Common Stock,$91.49,5.20,6.026%,"2,059,533,311"
DNTH,"Dianthus Therapeutics, Inc. Common Stock",$48.03,1.43,3.069%,"2,059,335,000"
NN,NextNav Inc. Common Stock,$15.26,-0.29,-1.865%,"2,057,491,883"
IRDM,Iridium Communications Inc Common Stock,$19.62,0.52,2.723%,"2,055,110,320"
MGNI,"Magnite, Inc. Common Stock",$14.29,-0.51,-3.446%,"2,052,728,048"
EFXT,Enerflex Ltd Common Shares,$16.85,0.63,3.884%,"2,052,359,976"
OSW,OneSpaWorld Holdings Limited Common Shares,$20.13,0.59,3.019%,"2,052,301,430"
PRGO,Perrigo Company plc Ordinary Shares,$14.91,-0.18,-1.193%,"2,051,973,974"
HWCPZ,Hancock Whitney Corporation 6.25% Subordinated Notes due 2060,$24.18,0.21,0.876%,"2,049,375,368"
PCT,"PureCycle Technologies, Inc. Common stock",$11.37,-0.08,-0.699%,"2,048,855,126"
CIMN,Chimera Investment Corporation 9.000% Senior Notes due 2029,$25.42,UNCH,--,"2,047,090,292"
UFPT,"UFP Technologies, Inc. Common Stock",$265.17,2.91,1.11%,"2,045,108,775"
SLDE,"Slide Insurance Holdings, Inc. Common Stock",$16.44,0.17,1.045%,"2,043,324,296"
VAC,Marriott Vacations Worldwide Corporation Common Stock,$58.96,1.36,2.361%,"2,040,840,909"
WS,"Worthington Steel, Inc. Common Shares",$40.05,0.55,1.392%,"2,034,765,682"
CCS,"Century Communities, Inc. Common Stock",$69.09,2.83,4.271%,"2,030,160,527"
WERN,"Werner Enterprises, Inc. Common Stock",$33.93,1.70,5.275%,"2,030,042,656"
ADUS,Addus HomeCare Corporation Common Stock,$109.74,1.07,0.985%,"2,028,354,160"
SLVM,Sylvamo Corporation Common Stock,$51.33,1.19,2.373%,"2,024,365,732"
TE,T1 Energy Inc. Common Stock,$7.82,-0.46,-5.556%,"2,021,357,064"
EXTR,"Extreme Networks, Inc. Common Stock",$15.11,0.09,0.599%,"2,020,486,218"
BGR,BlackRock Energy and Resources Trust,$14.86,0.08,0.541%,"2,014,810,843"
CENT,Central Garden & Pet Company Common Stock,$32.31,0.51,1.604%,"2,013,969,731"
STRA,"Strategic Education, Inc. Common Stock",$85.70,1.94,2.316%,"2,012,803,163"
IOSP,Innospec Inc. Common Stock,$81.15,1.90,2.397%,"2,010,700,779"
KSS,Kohl's Corporation Common Stock,$17.91,-0.11,-0.61%,"2,009,308,411"
JBLU,JetBlue Airways Corporation Common Stock,$5.52,0.36,6.977%,"2,007,683,174"
DXPE,"DXP Enterprises, Inc. Common Stock",$127.74,4.16,3.366%,"2,002,872,505"
SGRY,"Surgery Partners, Inc. Common Stock",$15.47,-0.16,-1.024%,"2,000,917,321"
NESR,National Energy Services Reunited Corp Ordinary Shares,$19.84,1.495,8.149%,"1,999,430,739"
QDEL,QuidelOrtho Corporation Common Stock,$29.42,-3.31,-10.113%,"1,998,545,907"
NTCT,"NetScout Systems, Inc. Common Stock",$27.66,0.71,2.635%,"1,996,876,995"
ADAMN,"Adamas Trust, Inc. 8.00% Series D Fixed-to-Floating Rate Cumulative Redeemable Preferred Stock",$22.10,UNCH,--,"1,995,930,096"
SEDG,"SolarEdge Technologies, Inc. Common Stock",$33.34,0.85,2.616%,"1,993,733,700"
FMC,FMC Corporation Common Stock,$15.91,0.52,3.379%,"1,987,478,266"
JSM,"Navient Corporation 6% Senior Notes due December 15, 2043",$19.98,0.38,1.939%,"1,986,632,139"
VECO,Veeco Instruments Inc. Common Stock,$32.99,1.67,5.332%,"1,984,761,205"
STC,Stewart Information Services Corporation Common Stock,$66.31,1.29,1.984%,"1,983,970,400"
OLMA,"Olema Pharmaceuticals, Inc. Common Stock",$26.29,-0.43,-1.609%,"1,976,262,258"
CMPR,Cimpress plc Ordinary Shares (Ireland),$80.09,3.73,4.885%,"1,975,963,181"
LMAT,"LeMaitre Vascular, Inc. Common Stock",$86.99,1.19,1.387%,"1,973,454,618"
IMAX,Imax Corporation Common Stock,$36.65,-0.96,-2.553%,"1,971,730,931"
ESTA,Establishment Labs Holdings Inc. Common Shares,$67.70,3.07,4.75%,"1,967,217,664"
HLMN,Hillman Solutions Corp. Common Stock,$9.95,0.28,2.896%,"1,963,031,898"
AAMI,Acadian Asset Management Inc. Common Stock,$54.92,0.93,1.723%,"1,961,144,870"
SBET,"SharpLink Gaming, Inc. Common Stock",$9.97,0.025,0.251%,"1,961,031,114"
SMPL,The Simply Good Foods Company Common Stock,$21.18,0.17,0.809%,"1,960,743,901"
PWP,Perella Weinberg Partners Class A Common Stock,$22.03,0.43,1.991%,"1,956,460,552"
NWN,Northwest Natural Holding Company Common Stock,$47.12,0.39,0.835%,"1,955,811,819"
ATRC,"AtriCure, Inc. Common Stock",$39.27,0.85,2.212%,"1,952,386,119"
USAS,"Americas Gold and Silver Corporation Common Shares, no par value",$7.13,0.20,2.886%,"1,950,979,069"
PAYO,Payoneer Global Inc. Common Stock,$5.47,0.13,2.434%,"1,949,728,463"
