Symbol,Name,Last Sale,Net Change,% Change,Market Cap
ARBK,Argo Blockchain plc American Depositary Shares,$0.188,0.0229,13.87%,"13,484,307"
LFWD,Lifeward Ltd. Ordinary Shares,$0.7597,0.0687,9.942%,"13,471,104"
AMS,American Shared Hospital Services Common Stock,$2.05,0.01,0.49%,"13,413,150"
TGL,Treasure Global Inc. Common Stock,$15.72,-4.06,-20.526%,"13,332,132"
LSH,Lakeside Holding Limited Common Stock,$0.764,-0.017,-2.177%,"13,314,655"
CASI,"CASI Pharmaceuticals, Inc. Ordinary Shares",$0.8569,-0.0731,-7.86%,"13,275,678"
FTRK,FAST TRACK GROUP Ordinary shares,$0.6078,-0.0092,-1.491%,"13,257,638"
AEVAW,"Aeva Technologies, Inc. Warrants",$0.2199,0.0043,1.994%,"13,211,572"
SRXH,"SRX Health Solutions, Inc. Common Stock",$0.48,0.0241,5.286%,"13,164,885"
RMCF,"Rocky Mountain Chocolate Factory, Inc. Common Stock",$1.67,0.06,3.727%,"13,026,848"
BLIN,"Bridgeline Digital, Inc. Common Stock",$1.07,0.03,2.885%,"12,959,913"
ENGS,Energys Group Limited Ordinary Shares,$0.9037,0.0237,2.693%,"12,911,939"
ICU,SeaStar Medical Holding Corporation Common Stock,$0.3564,0.0173,5.102%,"12,847,199"
TLIH,Ten-League International Holdings Limited Ordinary Shares,$0.4345,-0.0419,-8.795%,"12,776,187"
IPW,iPower Inc. Common Stock,$12.13,1.58,14.976%,"12,734,062"
DDC,DDC Enterprise Limited Class A Ordinary Shares,$3.13,0.04,1.294%,"12,676,966"
EKSO,"Ekso Bionics Holdings, Inc. Common Stock",$4.82,0.40,9.05%,"12,643,983"
GLBZ,Glen Burnie Bancorp Common Stock,$4.33,0.10,2.364%,"12,642,279"
BKYI,"BIO-key International, Inc. Common Stock",$0.742,-0.0272,-3.536%,"12,628,806"
EDSA,"Edesa Biotech, Inc. Common Shares",$1.79,0.05,2.874%,"12,597,390"
AKTX,Akari Therapeutics plc ADS,$0.351,0.011,3.235%,"12,554,419"
WATT,Energous Corporation Common Stock,$5.765,-0.205,-3.434%,"12,539,665"
ASBP,"Aspire Biopharma Holdings, Inc. Common Stock",$0.0905,-0.0005,-0.549%,"12,529,372"
BANL,CBL International Limited Ordinary Shares,$0.455,0.0119,2.686%,"12,512,500"
CUPR,Cuprina Holdings (Cayman) Limited Class A Ordinary Shares,$0.5935,-0.0422,-6.638%,"12,463,500"
NXGL,"NexGel, Inc Common Stock",$1.53,0.06,4.082%,"12,458,993"
VYNE,VYNE Therapeutics Inc. Common Stock,$0.3768,0.003,0.803%,"12,450,836"
BTCT,BTC Digital Ltd. Ordinary Shares,$1.93,0.03,1.579%,"12,417,697"
ARTW,"Art's-Way Manufacturing Co., Inc. Common Stock",$2.43,0.02,0.83%,"12,409,607"
ANNAW,"AleAnna, Inc. Warrant",$0.185,0.0015,0.817%,"12,331,042"
TDIC,Dreamland Limited Class A Ordinary Shares,$0.3976,0.0077,1.975%,"12,325,600"
IHT,InnSuites Hospitality Trust Shares of Beneficial Interest,$1.40,-0.07,-4.762%,"12,307,820"
SRTAW,"Strata Critical Medical, Inc. Warrants",$0.1425,0.0075,5.556%,"12,307,230"
LBGJ,Li Bang International Corporation Inc. Class A Ordinary Shares,$0.656,-0.0221,-3.259%,"12,298,688"
SEED,Origin Agritech Limited Common Stock,$1.70,0.14,8.974%,"12,239,997"
IMNN,"Imunon, Inc. Common Stock",$3.97,0.07,1.795%,"12,189,305"
EFOI,"Energy Focus, Inc. Common Stock",$2.12,0.105,5.211%,"12,167,560"
SYBX,"Synlogic, Inc. Common Stock",$1.04,UNCH,--,"12,166,876"
BTBD,"BT Brands, Inc. Common Stock",$1.55,-0.03,-1.899%,"12,159,307"
PFSA,"Profusa, Inc. Common Stock",$0.1846,-0.0138,-6.956%,"12,124,705"
OFAL,OFA Group Ordinary Shares,$0.8703,0.0203,2.388%,"12,117,719"
BLRX,BioLineRx Ltd. American Depositary Shares,$3.25,-0.07,-2.108%,"12,093,260"
GELS,Gelteq Limited Ordinary Shares,$1.12,-0.01,-0.885%,"11,996,386"
XPON,Expion360 Inc. Common Stock,$1.23,0.02,1.653%,"11,877,789"
GOVX,"GeoVax Labs, Inc. Common Stock",$0.398,-0.0143,-3.468%,"11,822,733"
NIVF,NewGenIvf Group Limited Class A Ordinary Shares,$1.79,0.33,22.603%,"11,795,703"
CWD,CaliberCos Inc. Class A Common Stock,$1.80,0.06,3.448%,"11,713,302"
MIMI,Mint Incorporation Limited Class A Ordinary Shares,$0.4681,-0.0313,-6.268%,"11,708,351"
MYNZ,Mainz Biomed N.V. Ordinary Shares,$1.06,-0.02,-1.852%,"11,698,975"
BIVI,BioVie Inc. Class A Common Stock,$1.55,-0.04,-2.516%,"11,687,490"
GNPX,"Genprex, Inc. Common Stock",$3.24,-0.15,-4.425%,"11,660,702"
ASTLW,Algoma Steel Group Inc. Warrant,$0.111,-0.0042,-3.646%,"11,647,652"
RVYL,Ryvyl Inc. Common Stock,$0.3212,0.0069,2.195%,"11,590,816"
FLDDW,"Fold Holdings, Inc. Warrant",$0.232,0.009,4.036%,"11,405,365"
AMBO,Ambow Education Holding Ltd. American Depository Shares (each representing twenty (20) Class A Ordinary Shares),$3.98,0.05,1.272%,"11,368,376"
TURB,"Turbo Energy, S.A. American Depositary Shares",$1.03,0.06,6.186%,"11,347,654"
IZM,ICZOOM Group Inc. Class A Ordinary Shares,$0.9401,0.0326,3.592%,"11,298,225"
BOLT,"Bolt Biotherapeutics, Inc. Common Stock",$5.87,0.50,9.311%,"11,267,119"
PRHI,"Presurance Holdings, Inc. Common Stock",$0.9186,-0.0214,-2.277%,"11,227,938"
YYGH,YY Group Holding Limited Class A Ordinary Shares,$0.2709,-0.0125,-4.411%,"11,133,326"
TOVX,"Theriva Biologics, Inc. Common Stock",$0.223,0.0018,0.814%,"11,133,097"
EDUC,Educational Development Corporation Common Stock,$1.29,-0.04,-3.008%,"11,072,329"
AMST,Amesite Inc. Common Stock,$2.42,-0.02,-0.82%,"11,065,965"
MYSE,"Myseum, Inc. Common Stock",$2.59,0.20,8.368%,"11,044,612"
MTEK,Maris-Tech Ltd. Ordinary Shares,$1.38,-0.05,-3.497%,"11,017,320"
HTCR,"Heartcore Enterprises, Inc. Common Stock",$0.431,-0.0026,-0.60%,"10,955,937"
GSIW,Garden Stage Limited Ordinary Shares,$0.1478,0.0009,0.613%,"10,941,833"
PAVM,PAVmed Inc. Common Stock,$0.368,0.0214,6.174%,"10,919,268"
FBGL,FBS Global Limited Ordinary Shares,$0.8078,0.0277,3.551%,"10,905,300"
CLDI,"Calidi Biotherapeutics, Inc. Common Stock",$1.52,0.05,3.401%,"10,894,936"
TGHL,The GrowHub Limited Class A Ordinary Shares,$0.4301,-0.0199,-4.422%,"10,881,448"
UHGWW,"United Homes Group, Inc. Warrant",$0.185,0.0375,25.424%,"10,880,523"
BRN,"Barnwell Industries, Inc. Common Stock",$1.0798,0.0098,0.916%,"10,877,402"
PPCB,"Propanc Biopharma, Inc. Common Stock",$0.81,-0.0264,-3.156%,"10,825,038"
APM,Aptorum Group Limited Class A Ordinary Shares,$1.32,-0.0047,-0.355%,"10,749,759"
ARBB,ARB IOT Group Limited Ordinary Shares,$6.07,-0.09,-1.461%,"10,715,104"
AWX,Avalon Holdings Corporation Common Stock,$2.74,0.03,1.107%,"10,684,441"
ERNA,Ernexa Therapeutics Inc. Common Stock,$1.36,0.06,4.615%,"10,674,489"
OXBR,Oxbridge Re Holdings Limited Ordinary Shares,$1.39,-0.04,-2.797%,"10,669,810"
NRSNW,NeuroSense Therapeutics Ltd. Warrant,$0.3598,0.0152,4.411%,"10,632,439"
AEHL,Antelope Enterprise Holdings Limited Class A Ordinary Shares,$3.11,0.11,3.667%,"10,632,431"
LMFA,"LM Funding America, Inc. Common Stock",$0.8656,-0.0244,-2.742%,"10,568,468"
PASW,"Ping An Biomedical Co., Ltd. Ordinary Shares",$0.5137,-0.0213,-3.981%,"10,530,850"
AIMD,"Ainos, Inc. Common Stock",$2.18,-0.02,-0.909%,"10,491,542"
MBAI,Check-Cap Ltd. Ordinary Share,$1.79,0.08,4.678%,"10,473,122"
REBN,"Reborn Coffee, Inc. Common Stock",$1.75,0.20,12.903%,"10,458,564"
MSS,Maison Solutions Inc. Class A Common Stock,$0.5294,0.0084,1.612%,"10,424,138"
JTAI,Jet.AI Inc. Common Stock,$1.67,0.06,3.727%,"10,416,218"
JXG,JX Luxventure Group Inc. Common Stock,$8.63,3.49,67.899%,"10,410,050"
JYD,Jayud Global Logistics Limited Class A Ordinary Shares,$3.80,-0.04,-1.042%,"10,388,702"
NAII,"Natural Alternatives International, Inc. Common Stock",$3.12,-0.08,-2.50%,"10,383,759"
UUU,"Universal Safety Products, Inc. Common Stock",$4.48,0.35,8.475%,"10,361,734"
CVR,Chicago Rivet & Machine Co. Common Stock,$10.72,0.71,7.093%,"10,356,935"
PETZ,"TDH Holdings, Inc. Common Shares",$1.0002,-0.0398,-3.827%,"10,325,333"
ETS,Elite Express Holding Inc. Class A Common Stock,$0.6176,0.0022,0.357%,"10,324,217"
DTSS,Datasea Inc. Common Stock,$1.20,-0.06,-4.762%,"10,284,856"
ILAG,Intelligent Living Application Group Inc. Ordinary Shares,$0.4944,0.0714,16.879%,"10,268,432"
SFHG,Samfine Creation Holdings Group Limited Class A Ordinary Share,$0.567,-0.002,-0.351%,"10,206,000"
GITS,"Global Interactive Technologies, Inc. Common Stock",$1.32,0.02,1.538%,"10,172,535"
IMRN,Immuron Limited American Depositary Shares,$1.51,0.04,2.721%,"10,125,303"
SNSE,"Sensei Biotherapeutics, Inc. Common Stock",$7.97,-0.27,-3.277%,"10,052,481"
CJET,"Chijet Motor Company, Inc. Class A Ordinary Shares",$0.87,0.04,4.819%,"10,034,398"
BTMWW,Bitcoin Depot Inc. Warrant,$0.1373,0.0123,9.84%,"10,003,271"
CRGOW,Freightos Limited Warrants,$0.1998,-0.0123,-5.799%,"9,998,539"
KLTOW,"Klotho Neurosciences, Inc. Warrant",$0.1377,0.0036,2.685%,"9,988,307"
SOS,SOS Limited Class A Ordinary Shares,$1.47,0.12,8.889%,"9,986,995"
ZKIN,"ZK International Group Co., Ltd Ordinary Share",$1.93,-0.09,-4.455%,"9,966,416"
TKLF,"Tokyo Lifestyle Co., Ltd. American Depositary Shares",$2.35,-0.05,-2.083%,"9,947,035"
TNON,"Tenon Medical, Inc. Common Stock",$1.15,0.04,3.604%,"9,896,601"
SCKT,"Socket Mobile, Inc. Common Stock",$1.23,-0.02,-1.60%,"9,811,048"
ATER,"Aterian, Inc. Common Stock",$0.975,0.055,5.978%,"9,776,370"
SOAR,"Volato Group, Inc. Class A Common Stock",$1.31,0.10,8.264%,"9,748,500"
DSS,"DSS, Inc. Common Stock",$1.07,0.0284,2.727%,"9,728,994"
DAVEW,Dave Inc. Warrants,$0.72,-0.0751,-9.445%,"9,722,939"
CLRO,"ClearOne, Inc. (DE) Common Stock",$5.60,0.14,2.564%,"9,711,800"
SMTK,"SmartKem, Inc. Common Stock",$1.58,0.02,1.282%,"9,693,242"
GIBO,GIBO Holdings Limited Class A Ordinary Shares,$2.58,0.02,0.781%,"9,688,767"
SLXN,Silexion Therapeutics Corp Ordinary Shares,$3.06,-0.01,-0.326%,"9,567,525"
GDHG,Golden Heaven Group Holdings Ltd. Class A Ordinary Shares,$3.765,-0.1762,-4.471%,"9,533,225"
PRSO,Peraso Inc. Common Stock,$1.04,0.0554,5.627%,"9,516,690"
BRTX,"BioRestorative Therapies, Inc. Common Stock (NV)",$1.07,-0.01,-0.926%,"9,497,579"
BAERW,"Bridger Aerospace Group Holdings, Inc. Warrant",$0.17,-0.02,-10.526%,"9,442,328"
SKYQ,Sky Quarry Inc. Common Stock,$0.379,0.0043,1.148%,"9,390,248"
BFRI,Biofrontera Inc. Common Stock,$0.803,-0.0203,-2.466%,"9,353,603"
IPDN,"Professional Diversity Network, Inc. Common Stock",$1.91,0.08,4.372%,"9,324,549"
BNZI,"Banzai International, Inc. Class A Common Stock",$1.27,0.06,4.959%,"9,303,625"
DTCK,Davis Commodities Limited Class A Ordinary Shares,$0.3789,0.0009,0.238%,"9,283,287"
ZOOZW,ZOOZ Strategy Ltd. Warrant,$0.0573,UNCH,--,"9,276,858"
VRME,"VerifyMe, Inc. Common Stock",$0.7454,-0.0091,-1.206%,"9,275,138"
FEBO,Fenbo Holdings Limited Class A Ordinary Shares,$0.836,0.0558,7.152%,"9,248,250"
XAIR,"Beyond Air, Inc. Common Stock",$1.15,0.01,0.877%,"9,210,911"
OLB,"The OLB Group, Inc. Common Stock",$1.05,-0.05,-4.545%,"9,206,539"
INLF,INLIF LIMITED Class A Ordinary Shares,$0.6347,0.0268,4.409%,"9,203,150"
BHAT,Blue Hat Interactive Entertainment Technology Ordinary Shares,$1.27,-0.02,-1.55%,"9,199,792"
MBIO,"Mustang Bio, Inc. Common Stock",$1.26,0.01,0.80%,"9,196,848"
ZDAI,"DirectBooking Technology Co., Ltd. Ordinary Shares",$0.3475,-0.0201,-5.468%,"9,174,000"
CRE,Cre8 Enterprise Limited Class A Ordinary Shares,$0.3807,-0.0054,-1.399%,"9,146,318"
BSLK,"Bolt Projects Holdings, Inc. Common Stock",$2.09,0.10,5.025%,"9,125,197"
GRRRW,Gorilla Technology Group Inc. Warrant,$0.4501,-0.0654,-12.687%,"9,102,031"
IINNW,Inspira Technologies Oxy B.H.N. Ltd. Warrant,$0.2731,-0.0224,-7.58%,"9,008,018"
CLWT,Euro Tech Holdings Company Limited Common Stock,$1.17,0.02,1.739%,"8,911,707"
TCRT,"Alaunos Therapeutics, Inc. Common Stock",$3.99,-0.10,-2.445%,"8,904,998"
GXAI,Gaxos.ai Inc. Common Stock,$1.25,0.07,5.932%,"8,904,316"
ACXP,"Acurx Pharmaceuticals, Inc. Common Stock",$4.24,-0.19,-4.289%,"8,841,939"
CPHI,"China Pharma Holdings, Inc. Common Stock",$1.75,0.01,0.575%,"8,788,504"
TVGNW,Tevogen Bio Holdings Inc. Warrant,$0.0442,-0.0001,-0.226%,"8,782,095"
HKPD,Hong Kong Pharma Digital Technology Holdings Limited Ordinary shares,$0.7946,0.0024,0.303%,"8,740,600"
NITO,"N2OFF, Inc. Common Stock",$3.22,0.335,11.612%,"8,735,483"
SOPA,Society Pass Incorporated Common Stock,$1.43,-0.03,-2.055%,"8,730,901"
KIDZ,"Classover Holdings, Inc. Class B Common Stock",$0.3109,UNCH,--,"8,714,071"
MSN,Emerson Radio Corporation Common Stock,$0.413,-0.0196,-4.531%,"8,690,615"
MTR,Mesa Royalty Trust Common Stock,$4.65,-0.08,-1.691%,"8,665,694"
OBLG,Oblong Inc. Common Stock,$2.70,0.26,10.656%,"8,659,467"
SSKN,"Strata Skin Sciences, Inc. Common Stock",$1.47,0.09,6.522%,"8,655,653"
EHGO,Eshallgo Inc. Class A Ordinary Shares,$0.2899,-0.0001,-0.034%,"8,608,338"
AEON,"AEON Biopharma, Inc. Class A Common Stock",$0.7236,-0.0365,-4.802%,"8,566,300"
FAT,FAT Brands Inc. Class A Common Stock,$0.4763,-0.0117,-2.398%,"8,544,500"
MWG,Multi Ways Holdings Limited Ordinary Shares,$0.256,0.005,1.992%,"8,532,480"
DEVS,DevvStream Corp. Common Stock,$1.66,-0.02,-1.19%,"8,526,827"
MARPS,Marine Petroleum Trust Units of Beneficial Interest,$4.23,-0.18,-4.082%,"8,460,000"
HCWC,Healthy Choice Wellness Corp. Class A Common Stock,$0.5602,-0.0167,-2.895%,"8,439,833"
LCFYW,Locafy Limited Warrant,$4.58,UNCH,--,"8,239,672"
RPGL,Republic Power Group Limited Class A Ordinary Shares,$0.5101,-0.0454,-8.173%,"8,212,610"
LOBO,LOBO TECHNOLOGIES LTD. Class A Ordinary Shares,$0.95,0.015,1.604%,"8,198,500"
NCL,Northann Corp. Common Stock,$0.3599,UNCH,--,"8,185,243"
NAAS,NaaS Technology Inc. American Depositary Shares,$3.50,-0.02,-0.568%,"8,174,380"
NCNA,NuCana plc American Depositary Share,$4.28,0.14,3.382%,"8,167,002"
FMFC,Kandal M Venture Limited Class A Ordinary Shares,$0.4257,-0.0384,-8.274%,"8,139,384"
JCTC,Jewett-Cameron Trading Company Common Shares,$2.31,0.12,5.479%,"8,126,855"
PTHL,Pheton Holdings Ltd Class A Ordinary Shares,$0.57,0.004,0.707%,"8,122,500"
ADXN,Addex Therapeutics Ltd American Depositary Shares,$7.585,-0.465,-5.776%,"8,109,184"
CJMB,Callan JMB Inc. Common Stock,$1.75,0.24,15.894%,"8,090,297"
GRDX,GridAI Technologies Corp. Common Stock,$2.403,0.013,0.544%,"8,078,653"
NWTG,"Newton Golf Company, Inc. Common Stock",$1.69,0.01,0.595%,"8,031,662"
ONMDW,OneMedNet Corp Warrant,$0.1574,-0.0275,-14.873%,"8,028,219"
HYFM,"Hydrofarm Holdings Group, Inc. Common Stock",$1.716,-0.024,-1.379%,"8,008,579"
INAB,"IN8bio, Inc. Common Stock",$1.72,-0.06,-3.371%,"7,971,161"
USGOW,U.S. GoldMining Inc. Warrant,$0.5999,-0.0601,-9.106%,"7,962,590"
AIXI,XIAO-I Corporation American Depositary Shares,$0.6372,-0.0117,-1.803%,"7,939,726"
INEO,INNEOVA Holdings Limited Class A Ordinary Shares,$0.804,0.0491,6.504%,"7,939,500"
ADVB,Advanced Biomed Inc. Common Stock,$0.3666,0.0046,1.271%,"7,933,224"
GLE,Global Engine Group Holding Limited Class A Ordinary Shares,$0.4314,-0.0216,-4.768%,"7,894,620"
ORKT,Orangekloud Technology Inc. Class A Ordinary Shares,$1.35,-0.98,-42.06%,"7,883,663"
AMZE,"Amaze Holdings, Inc. Common Stock",$0.3953,-0.0125,-3.065%,"7,882,999"
CAPS,Capstone Holding Corp. Common Stock,$0.9478,0.036,3.948%,"7,872,621"
LUCY,"Innovative Eyewear, Inc. Common Stock",$1.46,0.05,3.546%,"7,811,267"
LTCC,Canary Litecoin ETF Shares of Beneficial Interest,$21.055,0.4869,2.367%,"7,790,350"
TNMG,TNL Mediagene Ordinary Shares,$0.2745,0.0015,0.549%,"7,764,269"
XTLB,XTL Biopharmaceuticals Ltd. American Depositary Shares,$0.88,0.0267,3.129%,"7,756,190"
UCAR,U Power Limited Class A Ordinary Shares,$1.75,-0.06,-3.315%,"7,734,748"
RNAZ,"TransCode Therapeutics, Inc. Common Stock",$8.41,0.06,0.719%,"7,711,701"
BGLC,BioNexus Gene Lab Corp Common stock,$4.26,-0.02,-0.467%,"7,653,120"
XXII,"22nd Century Group, Inc. Common Stock",$1.09,-0.03,-2.679%,"7,616,146"
IFBD,"Infobird Co., Ltd Ordinary Shares",$0.93,-0.035,-3.627%,"7,615,374"
KPRX,"Kiora Pharmaceuticals, Inc.  Common Stock",$2.06,-0.01,-0.483%,"7,576,546"
DKI,DarkIris Inc. Class A Ordinary Shares,$0.4324,-0.0137,-3.071%,"7,567,000"
XHLD,"TEN Holdings, Inc. Common Stock",$2.54,UNCH,--,"7,550,991"
PMCB,"PharmaCyte  Biotech, Inc. Common Stock",$1.11,-0.04,-3.478%,"7,543,315"
BIAF,"bioAffinity Technologies, Inc. Common Stock",$1.66,0.01,0.606%,"7,467,857"
CIIT,"Tianci International, Inc. Common Stock",$0.4516,0.0139,3.176%,"7,465,762"
YJ,Yunji Inc. American Depository Shares,$1.5101,-0.0099,-0.651%,"7,438,058"
ASNS,"Actelis Networks, Inc. Common Stock",$3.05,0.25,8.929%,"7,406,211"
ADIL,"Adial Pharmaceuticals, Inc Common Stock",$0.308,0.0035,1.149%,"7,388,177"
MTEN,Mingteng International Corporation Inc. Class A Ordinary Shares,$1.08,-0.005,-0.461%,"7,386,768"
TALKW,"Talkspace, Inc. Warrant",$0.0445,-0.0014,-3.05%,"7,371,698"
INVZW,Innoviz Technologies Ltd. Warrant,$0.037,0.005,15.625%,"7,361,592"
SPRC,SciSparc Ltd. Ordinary Shares,$2.24,0.23,11.443%,"7,339,087"
LGCB,Linkage Global Inc. Class A Ordinary Shares,$2.05,-0.05,-2.381%,"7,339,000"
WAFU,Wah Fu Education Group Limited Ordinary Shares,$1.66,0.03,1.84%,"7,321,528"
ASTI,"Ascent Solar Technologies, Inc. Common Stock",$2.10,0.23,12.299%,"7,306,213"
BBGI,"Beasley Broadcast Group, Inc. Class A Common Stock",$4.05,-0.3867,-8.716%,"7,306,176"
DUO,Fangdd Network Group Ltd. Class A Ordinary Shares,$1.87,-0.04,-2.094%,"7,301,537"
BMRA,"Biomerica, Inc. Common Stock",$2.54,0.055,2.213%,"7,289,546"
IOTR,iOThree Limited Ordinary Shares,$2.84,-0.09,-3.072%,"7,284,603"
LGCL,Lucas GC Limited Ordinary Shares,$2.61,-0.16,-5.776%,"7,283,012"
ALBT,Avalon GloboCare Corp. Common Stock,$1.71,0.33,23.913%,"7,270,935"
PCLA,PicoCELA Inc. American Depositary Shares,$0.2938,-0.0052,-1.739%,"7,252,118"
SILO,"Silo Pharma, Inc. Common Stock",$0.4419,-0.0125,-2.751%,"7,242,609"
RELI,"Reliance Global Group, Inc. Common Stock",$0.7338,0.0273,3.864%,"7,239,377"
EDBL,Edible Garden AG Incorporated Common Stock,$1.41,0.17,13.71%,"7,228,584"
TPET,Trio Petroleum Corp. Common Stock,$0.85,-0.009,-1.048%,"7,174,722"
SOWG,Sow Good Inc. Common Stock,$0.5847,-0.0195,-3.227%,"7,147,138"
EVGN,Evogene Ltd Ordinary Shares,$1.09,-0.06,-5.217%,"7,100,902"
GLXG,Galaxy Payroll Group Limited Class A Ordinary Shares,$3.27,-0.06,-1.802%,"7,067,337"
HSCS,HeartSciences Inc. Common Stock,$2.66,-0.25,-8.591%,"7,042,914"
CDIO,Cardio Diagnostics Holdings Inc. Common stock,$3.85,0.27,7.542%,"7,030,296"
LYRA,"Lyra Therapeutics, Inc. Common Stock",$3.96,-0.01,-0.252%,"7,028,533"
INBS,Intelligent Bio Solutions Inc. Common Stock,$0.7403,0.0303,4.268%,"6,997,725"
FLGC,Flora Growth Corp. Common Stock,$9.37,0.17,1.848%,"6,997,610"
MITQ,"Moving iMage Technologies, Inc. Common Stock",$0.7033,-0.018,-2.495%,"6,990,614"
SEGG,"Lottery.com, Inc. Common Stock",$1.36,0.03,2.256%,"6,989,927"
FGL,Founder Group Limited Class A Ordinary Shares,$0.36,0.0188,5.51%,"6,989,504"
MEGL,Magic Empire Global Limited Class A Ordinary Shares,$1.37,-0.15,-9.868%,"6,937,749"
BYAH,"Park Ha Biological Technology Co., Ltd. Ordinary Shares",$0.2046,-0.0009,-0.438%,"6,930,703"
SNTG,Sentage Holdings Inc. Class A Ordinary Shares,$2.46,0.09,3.797%,"6,901,100"
GCLWW,GCL Global Holdings Ltd Warrants,$0.0546,UNCH,--,"6,896,975"
NCPL,Netcapital Inc. Common Stock,$1.40,0.7411,112.475%,"6,885,045"
PRPH,"ProPhase Labs, Inc. Common Stock (DE)",$0.149,0.011,7.971%,"6,880,674"
IVDA,"Iveda Solutions, Inc. Common Stock",$1.17,0.01,0.862%,"6,873,447"
HUBC,Hub Cyber Security Ltd. Ordinary Shares,$0.6823,-0.1762,-20.524%,"6,855,270"
ALZN,"Alzamend Neuro, Inc. Common Stock",$2.17,-0.08,-3.556%,"6,813,498"
GTBP,"GT Biopharma, Inc. Common Stock",$0.64,-0.0094,-1.447%,"6,807,126"
NVNO,enVVeno Medical Corporation Common Stock,$0.3364,0.0109,3.349%,"6,800,722"
HXHX,Haoxin Holdings Limited Class A Ordinary Shares,$0.4935,0.0223,4.733%,"6,785,625"
LCFY,Locafy Limited Ordinary Share,$3.77,-0.12,-3.085%,"6,782,437"
NDRA,ENDRA Life Sciences Inc. Common Stock,$5.80,0.32,5.839%,"6,765,358"
LIDRW,"AEye, Inc. Warrant",$0.15,0.0436,40.977%,"6,758,250"
CLIK,Click Holdings Limited Class A Ordinary Share,$5.90,-0.26,-4.221%,"6,757,866"
MKZR,"MacKenzie Realty Capital, Inc. Common Stock",$3.64,-0.11,-2.933%,"6,743,031"
IVP,"Inspire Veterinary Partners, Inc. Class A Common Stock",$0.079,-0.0049,-5.84%,"6,713,938"
VMAR,Vision Marine Technologies Inc. Common Shares,$0.54,-0.1381,-20.366%,"6,704,717"
FRSX,Foresight Autonomous Holdings Ltd. American Depositary Shares,$1.85,0.07,3.933%,"6,700,460"
ASTC,Astrotech Corporation (DE) Common Stock,$3.74,0.07,1.907%,"6,578,484"
AREB,"American Rebel Holdings, Inc. Common Stock",$1.07,-0.07,-6.14%,"6,566,558"
SBFM,Sunshine Biopharma Inc. Common Stock,$1.44,-0.01,-0.69%,"6,560,561"
CYCN,"Cyclerion Therapeutics, Inc. Common Stock",$1.66,-0.03,-1.775%,"6,516,021"
VS,Versus Systems Inc. Common Stock,$1.31,0.013,1.002%,"6,421,197"
MOVE,Movano Inc. Common Stock,$7.67,0.26,3.509%,"6,403,353"
LDWY,"Lendway, Inc. Common Stock (DE)",$3.60,0.04,1.124%,"6,370,556"
YDKG,Yueda Digital Holding Class A Ordinary Share,$1.14,-0.09,-7.317%,"6,318,135"
GURE,"Gulf Resources, Inc. (NV) Common Stock",$4.56,-0.95,-17.241%,"6,302,440"
SONM,"Sonim Technologies, Inc. Common Stock",$6.105,-0.25,-3.934%,"6,280,171"
REVB,"Revelation Biosciences, Inc. Common Stock",$1.06,0.005,0.474%,"6,279,585"
SKK,SKK Holdings Limited Ordinary Shares,$0.33,0.013,4.101%,"6,187,500"
SNOA,"Sonoma Pharmaceuticals, Inc. Common Stock",$3.62,0.115,3.281%,"6,157,895"
VIVS,"VivoSim Labs, Inc. Common Stock",$2.36,-0.03,-1.255%,"6,154,790"
NVVE,Nuvve Holding Corp. Common Stock,$0.1813,0.0078,4.496%,"6,085,517"
BQ,Boqii Holding Limited Class A Ordinary Shares,$2.10,-0.09,-4.11%,"6,047,189"
ILLRW,Triller Group Inc. Warrant,$0.0388,0.0193,98.974%,"6,020,201"
HPAIW,Helport AI Limited Warrants,$0.16,-0.01,-5.882%,"5,988,955"
AZI,Autozi Internet Technology (Global) Ltd. Class A Ordinary Shares,$0.0565,0.0042,8.031%,"5,987,938"
ULY,Urgent.ly Inc. Common Stock,$2.73,-0.10,-3.534%,"5,981,280"
VSTD,Vestand Inc. Class A Common Stock,$0.4186,0.0073,1.775%,"5,954,577"
MASK,3 E Network Technology Group Ltd Class A Ordinary Shares,$0.34,-0.0129,-3.655%,"5,925,556"
GWAV,"Greenwave Technology Solutions, Inc. Common Stock",$7.13,-0.31,-4.167%,"5,915,269"
JCSE,JE Cleantech Holdings Limited Ordinary Shares,$1.12,-0.01,-0.885%,"5,891,491"
POLA,"Polar Power, Inc. Common Stock",$2.21,-0.01,-0.45%,"5,875,674"
ATXG,Addentax Group Corp. Common Stock,$0.4998,0.0347,7.461%,"5,855,331"
APRE,"Aprea Therapeutics, Inc. Common stock",$0.9277,-0.1123,-10.798%,"5,854,411"
AGMH,AGM Group Holdings Inc. Class A Ordinary Shares,$2.89,0.11,3.957%,"5,827,046"
SQFT,"Presidio Property Trust, Inc. Class A Common Stock",$4.00,0.03,0.756%,"5,756,396"
AMIX,"Autonomix Medical, Inc. Common Stock",$0.8329,0.0122,1.487%,"5,753,405"
FFAIW,Faraday Future Intelligent Electric Inc. Warrant,$0.0339,0.0039,13.00%,"5,739,528"
IBG,Innovation Beverage Group Limited Ordinary Shares,$2.47,-0.16,-6.084%,"5,737,064"
MSAIW,"MultiSensor AI Holdings, Inc. Warrant",$0.109,-0.0109,-9.091%,"5,726,629"
EVTV,"Envirotech Vehicles, Inc. Common Stock",$1.183,-0.017,-1.417%,"5,713,316"
GV,Visionary Holdings Inc. Common Shares,$1.505,-0.035,-2.273%,"5,680,264"
LXEH,"Lixiang Education Holding Co., Ltd. American Depositary Shares",$0.295,-0.0077,-2.544%,"5,654,168"
CELZ,"Creative Medical Technology Holdings, Inc. Common Stock",$2.19,-0.03,-1.351%,"5,651,365"
XBIO,"Xenetic Biosciences, Inc. Common Stock",$2.463,0.023,0.943%,"5,642,871"
PTLE,PTL LTD Class A Ordinary Shares,$0.15,-0.0054,-3.475%,"5,623,125"
BAOS,Baosheng Media Group Holdings Limited Ordinary shares,$3.64,0.27,8.012%,"5,585,533"
HIHO,Highway Holdings Limited Common Stock,$1.21,-0.01,-0.82%,"5,568,208"
GIPR,Generation Income Properties Inc. Common Stock,$1.02,0.12,13.333%,"5,556,727"
JEM,707 Cayman Holdings Limited Ordinary Shares,$0.2509,0.0061,2.492%,"5,507,255"
YCBD,"cbdMD, Inc. Common Stock",$0.615,-0.0236,-3.696%,"5,481,470"
STAK,STAK Inc. Class A Ordinary Shares,$0.4148,-0.0164,-3.803%,"5,479,653"
SCAGW,Scage Future Warrants,$0.0748,0.015,25.084%,"5,431,203"
MTNB,"Matinas Biopharma Holdings, Inc. Common Stock",$0.8415,-0.053,-5.925%,"5,390,810"
SGN,"Signing Day Sports, Inc. Common Stock",$1.33,0.05,3.906%,"5,343,649"
RVSNW,Rail Vision Ltd. Warrant,$0.09,UNCH,--,"5,315,857"
KWMWW,"K Wave Media, Ltd. Warrant",$0.0701,0.0001,0.143%,"5,292,499"
MIGI,Mawson Infrastructure Group Inc. Common Stock,$4.60,0.30,6.977%,"5,258,991"
BLUWW,Blue Water Acquisition Corp. III Warrant.,$0.725,0.025,3.571%,"5,252,625"
RKDA,"Arcadia Biosciences, Inc. Common Stock",$3.81,-0.03,-0.781%,"5,231,587"
JWEL,Jowell Global Ltd. Ordinary Shares,$2.40,0.02,0.84%,"5,209,140"
MOBXW,"Mobix Labs, Inc Warrants",$0.095,UNCH,--,"5,199,762"
CNET,ZW Data Action Technologies Inc. Common Stock,$1.59,0.0264,1.688%,"5,196,866"
HCWB,HCW Biologics Inc. Common Stock,$1.92,-0.05,-2.538%,"5,187,085"
CDTG,CDT Environmental Technology Investment Holdings Limited ordinary shares,$0.42,-0.0037,-0.873%,"5,176,500"
RUBI,Rubico Inc. Common Stock,$2.52,-0.08,-3.077%,"5,161,303"
NAOV,"NanoVibronix, Inc. Common Stock",$4.74,0.30,6.757%,"5,157,954"
ENSC,"Ensysce Biosciences, Inc. Common Stock",$1.42,-0.18,-11.25%,"5,157,876"
XELB,"Xcel Brands, Inc. Common Stock",$1.07,0.03,2.885%,"5,143,250"
IMCC,IM Cannabis Corp. Common Shares,$1.66,0.11,7.097%,"5,121,850"
GCTK,"GlucoTrack, Inc. Common Stock",$5.62,0.016,0.286%,"5,118,067"
CHNR,"China Natural Resources, Inc. Common Stock",$4.125,-0.185,-4.292%,"5,087,037"
NCI,Neo-Concept International Group Holdings Limited Class A Ordinary Shares,$1.25,0.11,9.649%,"5,080,000"
BFRGW,"Bullfrog AI Holdings, Inc. Warrants",$0.3285,-0.0115,-3.382%,"5,009,561"
BOXL,Boxlight Corporation Class A Common Stock,$0.8735,0.0638,7.879%,"4,988,767"
ISPC,iSpecimen Inc. Common Stock,$0.509,0.029,6.042%,"4,973,453"
FCHL,Fitness Champs Holdings Limited Common Stock,$0.331,-0.0051,-1.517%,"4,965,000"
RAYA,Erayak Power Solution Group Inc. Class A Ordinary Shares,$5.54,0.93,20.174%,"4,958,139"
KXIN,Kaixin Holdings Ordinary Shares,$5.22,0.16,3.162%,"4,934,330"
ONFO,Onfolio Holdings Inc. Common Stock,$0.84,0.0109,1.315%,"4,929,233"
MSPR,"MSP Recovery, Inc. Class A Common Stock",$0.3456,0.0041,1.201%,"4,924,502"
OUSTZ,"Ouster, Inc. Warrants",$0.082,-0.0001,-0.122%,"4,920,428"
WALDW,Waldencast plc Warrant ,$0.04,-0.0069,-14.712%,"4,908,836"
VGASW,"Verde Clean Fuels, Inc. Warrant",$0.11,-0.0186,-14.463%,"4,900,458"
DFSC,DEFSEC Technologies Inc. Common Stock,$3.49,-0.21,-5.676%,"4,873,160"
SLRX,"Salarius Pharmaceuticals, Inc. Common Stock",$0.8308,0.0008,0.096%,"4,870,297"
GNLN,"Greenlane Holdings, Inc. Class A Common Stock",$3.21,0.10,3.215%,"4,819,979"
