Symbol,Name,Last Sale,Net Change,% Change,Market Cap
CHSCL,"CHS Inc Class B Cumulative Redeemable Preferred Stock, Series 4",$25.67,-0.05,-0.194%,"315,022,317"
PNNT,PennantPark Investment Corporation Common Stock,$4.82,0.05,1.048%,"314,727,173"
MEI,"Methode Electronics, Inc. Common Stock",$8.88,0.25,2.897%,"314,622,138"
NCMI,"National CineMedia, Inc. Common Stock",$3.37,-0.04,-1.173%,"314,355,012"
OPTX,"Syntec Optics Holdings, Inc. Class A Common Stock",$8.08,-0.54,-6.265%,"313,974,337"
GREEL,Greenidge Generation Holdings Inc. 8.50% Senior Notes due 2026,$20.00,0.05,0.251%,"313,468,340"
AZ,A2Z Cust2Mate Solutions Corp. Common Shares,$7.02,-0.39,-5.263%,"312,705,963"
ALCO,"Alico, Inc. Common Stock",$40.74,0.22,0.543%,"311,931,758"
LAW,"CS Disco, Inc. Common Stock",$4.86,0.20,4.292%,"311,693,213"
CHSCN,CHS Inc Preferred Class B Series 2 Reset Rate,$25.3489,0.0489,0.193%,"311,081,777"
TCI,"Transcontinental Realty Investors, Inc. Common Stock",$35.99,-0.27,-0.745%,"310,928,983"
ACIU,AC Immune SA Common Stock,$3.05,0.07,2.349%,"310,409,398"
ORBS,Eightco Holdings Inc. Common Stock,$0.824,0.0002,0.024%,"309,638,834"
DEFT,"Defi Technologies, Inc. Common Stock",$0.7974,0.0152,1.943%,"309,213,570"
GRABW,Grab Holdings Limited Warrant,$0.0754,0.0028,3.857%,"309,176,326"
WNC,Wabash National Corporation Common Stock,$7.60,-0.08,-1.042%,"309,122,149"
PDYN,Palladyne AI Corp. Common Stock,$6.52,0.18,2.839%,"308,032,347"
FBYDW,"Falcon's Beyond Global, Inc. Warrants",$2.54,UNCH,--,"307,955,218"
SWKHL,SWK Holdings Corporation 9.00% Senior Notes due 2027,$25.3501,-0.0099,-0.039%,"307,937,577"
PRLD,Prelude Therapeutics Incorporated Common Stock,$4.74,0.04,0.851%,"307,696,010"
CHSCM,"CHS Inc Class B Reset Rate Cumulative Redeemable Preferred Stock, Series 3",$25.0559,0.1459,0.586%,"307,486,080"
MPTI,"M-tron Industries, Inc. Common Stock",$71.09,3.67,5.443%,"307,180,103"
BRBS,"Blue Ridge Bankshares, Inc. Common Stock",$3.36,-0.06,-1.754%,"306,904,016"
VGZ,Vista Gold Corp Common Stock,$2.10,0.05,2.439%,"306,539,827"
SLP,"Simulations Plus, Inc. Common Stock",$15.15,0.24,1.61%,"306,113,052"
RXST,"RxSight, Inc. Common Stock",$7.38,-0.02,-0.27%,"305,506,974"
FGBIP,"First Guaranty Bancshares, Inc. 6.75% Series A Fixed-Rate Non-Cumulative Perpetual Preferred Stock",$19.30,0.57,3.043%,"304,813,257"
GLSI,"Greenwich LifeSciences, Inc. Common Stock",$21.98,-1.72,-7.257%,"304,522,767"
SBMT,Silver Bow Mining Corp. Common Shares,$10.62,-0.13,-1.209%,"304,436,403"
WEYS,"Weyco Group, Inc. Common Stock",$31.81,-1.23,-3.723%,"303,187,917"
RC,Ready Capital Corporation Common Stock,$1.86,-0.08,-4.124%,"302,954,529"
RILY,"BRC Group Holdings, Inc. Common Stock",$8.61,-0.37,-4.12%,"302,649,525"
COSO,"CoastalSouth Bancshares, Inc. Common Stock",$25.53,-0.08,-0.312%,"302,613,677"
FSBW,"FS Bancorp, Inc. Common Stock",$40.30,-0.49,-1.201%,"302,312,143"
SY,So-Young International Inc. American Depository Shares,$3.00,UNCH,--,"300,906,513"
XOMAP,XOMA Royalty Corporation 8.625% Series A Cumulative Perpetual Preferred Stock,$25.24,UNCH,--,"300,753,025"
EVTL,Vertical Aerospace Ltd. Ordinary Shares,$2.36,-0.07,-2.881%,"300,494,089"
BUUU,BUUU Group Limited Class A Ordinary Share,$18.01,0.01,0.056%,"300,316,750"
MLP,"Maui Land & Pineapple Company, Inc. Common Stock",$15.11,-0.35,-2.264%,"300,217,130"
XOMAO,XOMA Royalty Corporation Depositary Shares Rep Series B 8.375% Cumulative Preferred Stock,$25.19,-0.04,-0.159%,"300,157,239"
TARA,"Protara Therapeutics, Inc.  Common Stock",$5.45,0.13,2.444%,"300,079,725"
AMRN,Amarin Corporation plc,$14.24,0.17,1.208%,"298,600,112"
LEGO,Legato Merger Corp. IV Ordinary Shares,$9.85,-0.01,-0.101%,"298,524,305"
FCNCN,"First Citizens BancShares, Inc. Depositary Shares, each representing a 1/40th interest in a share of 6.625% Non-Cumulative Perpetual Preferred Stock, Series E",$25.20,0.0005,0.002%,"298,194,221"
GDC,GD Culture Group Limited Common Stock,$4.90,0.56,12.903%,"297,722,584"
PMM,Putnam Managed Municipal Income Trust Common Stock,$6.09,-0.07,-1.136%,"296,819,347"
KFS,"Kingsway Financial Services, Inc. Common Stock (DE)",$10.25,-0.45,-4.206%,"296,703,306"
JMSB,"John Marshall Bancorp, Inc. Common Stock",$21.02,-0.44,-2.05%,"296,639,684"
FUND,"Sprott Focus Trust, Inc. Common Stock",$10.01,-0.10,-0.989%,"296,631,906"
ISBA,Isabella Bank Corporation Common stock,$40.43,-0.56,-1.366%,"296,469,147"
SVREW,SaverOne 2014 Ltd. Warrant,$0.0108,-0.0028,-20.588%,"295,556,429"
SHMD,SCHMID Group N.V. Class A Ordinary Shares,$5.31,-1.06,-16.641%,"295,251,749"
MBI,MBIA Inc. Common Stock,$5.78,0.11,1.94%,"294,395,751"
ANGI,Angi Inc. Class A Common Stock,$7.26,-0.38,-4.974%,"294,196,595"
STRT,STRATTEC SECURITY CORPORATION Common Stock,$70.36,-2.24,-3.085%,"294,089,180"
EDIT,"Editas Medicine, Inc. Common Stock",$3.00,0.10,3.448%,"293,717,814"
RMMZ,"RiverNorth Managed Duration Municipal Income Fund II, Inc. Common Stock",$14.845,0.065,0.44%,"293,034,778"
RWAY,Runway Growth Finance Corp. Common Stock,$6.89,0.04,0.584%,"292,580,722"
AVNW,"Aviat Networks, Inc. Common Stock",$22.64,-0.48,-2.076%,"292,108,298"
ELDN,"Eledon Pharmaceuticals, Inc. Common Stock",$3.78,0.09,2.439%,"291,769,971"
OFLX,"Omega Flex, Inc. Common Stock",$28.89,-0.77,-2.596%,"291,624,963"
FLXS,"Flexsteel Industries, Inc. Common Stock",$54.44,-1.95,-3.458%,"291,555,108"
LENZ,"LENZ Therapeutics, Inc. Common Stock",$9.28,0.40,4.505%,"290,968,776"
CZFS,"Citizens Financial Services, Inc. Common Stock",$60.45,-0.87,-1.419%,"290,596,389"
ACRE,Ares Commercial Real Estate Corporation Common Stock,$5.24,-0.05,-0.945%,"290,126,601"
OIA,Invesco Municipal Income Opportunities Trust Common Stock,$6.08,-0.05,-0.816%,"289,441,981"
NL,"NL Industries, Inc. Common Stock",$5.90,-0.21,-3.437%,"288,290,131"
OCCIN,"OFS Credit Company, Inc. 5.25% Series E Term Preferred Stock Due 2026",$24.80,0.075,0.303%,"288,089,448"
SEG,Seaport Entertainment Group Inc. Common Stock,$22.49,0.20,0.897%,"287,914,956"
ARDC,"Ares Dynamic Credit Allocation Fund, Inc. Common Shares",$12.56,-0.11,-0.868%,"287,811,634"
SITC,SITE Centers Corp. Common Stock,$5.48,-0.08,-1.439%,"287,562,310"
KDKRW,"Kodiak AI, Inc. Warrants",$1.56,UNCH,--,"286,614,204"
MIN,MFS Intermediate Income Trust Common Stock,$2.49,-0.01,-0.40%,"286,095,450"
CIX,CompX International Inc. Common Stock,$23.21,-0.46,-1.943%,"286,018,153"
BZAI,"Blaize Holdings, Inc. Common Stock",$2.33,0.30,14.778%,"285,994,706"
IONR,ioneer Ltd American Depositary Shares,$3.77,-0.28,-6.914%,"285,870,961"
ESOA,Energy Services of America Corporation Common Stock,$17.15,0.31,1.841%,"285,702,519"
ZNTL,"Zentalis Pharmaceuticals, Inc. Common Stock",$4.00,-0.09,-2.20%,"284,745,392"
ACH,"Accendra Health, Inc. Common Stock",$3.71,-0.03,-0.802%,"283,584,672"
PRE,Prenetics Global Limited Class A Ordinary Share,$16.50,-0.52,-3.055%,"282,867,140"
SCM,Stellus Capital Investment Corporation Common Stock,$9.77,-0.06,-0.61%,"282,814,681"
GSIT,GSI Technology Common Stock,$7.81,-0.37,-4.523%,"282,614,245"
FVCB,"FVCBankcorp, Inc. Common Stock",$15.68,-0.10,-0.634%,"281,870,360"
JRVR,"James River Group Holdings, Inc. Common Stock",$6.13,-0.06,-0.969%,"281,787,420"
GDEV,GDEV Inc. Ordinary Shares,$15.525,-0.935,-5.68%,"281,786,342"
ZH,"Zhihu Inc. American Depositary Shares, each representing three (3) Class A Ordinary Shares",$3.19,-0.01,-0.313%,"281,310,284"
YDDL,One and One Green Technologies. Inc Class A Ordinary Shares,$5.01,0.19,3.942%,"280,726,998"
WNEB,"Western New England Bancorp, Inc. Common Stock",$13.85,-0.23,-1.634%,"280,585,377"
ACV,Virtus Diversified Income & Convertible Fund Common Shares of Beneficial Interest,$26.99,0.08,0.297%,"279,696,128"
FNRN,First Northern Community Bancorp Common stock,$17.04,UNCH,--,"279,620,606"
ARTV,"Artiva Biotherapeutics, Inc. Common Stock",$11.29,0.49,4.537%,"279,051,227"
ALEC,"Alector, Inc. Common Stock",$2.51,0.15,6.356%,"278,673,219"
BLZE,"Backblaze, Inc. Class A Common Stock",$4.64,0.19,4.27%,"278,468,352"
OVLY,Oak Valley Bancorp (CA) Common Stock,$33.06,-0.46,-1.372%,"278,148,921"
FCCO,First Community Corporation Common Stock,$29.61,-0.26,-0.87%,"277,861,572"
NERV,"Minerva Neurosciences, Inc Common Stock",$6.33,0.26,4.283%,"277,519,847"
NREF,"NexPoint Real Estate Finance, Inc. Common Stock",$14.85,-0.01,-0.067%,"277,501,698"
NBP,NovaBridge Biosciences American Depositary Shares,$2.40,0.02,0.84%,"276,916,061"
EVO,Evotec SE American Depositary Shares,$3.12,0.03,0.971%,"276,722,226"
DGXX,Digi Power X Inc. Subordinate Voting Shares,$3.95,0.19,5.053%,"275,739,424"
RMM,"RiverNorth Managed Duration Municipal Income Fund, Inc. Common Stock",$13.96,-0.205,-1.447%,"275,565,207"
MYFW,"First Western Financial, Inc. Common Stock",$28.32,-0.23,-0.806%,"275,524,374"
ESCA,"Escalade, Incorporated Common Stock",$19.91,1.70,9.336%,"274,858,307"
PCYO,Pure Cycle Corporation Common Stock,$11.40,-0.10,-0.87%,"274,784,551"
FHTX,Foghorn Therapeutics Inc. Common Stock,$4.68,-0.08,-1.681%,"274,781,155"
XYF,"X Financial American Depositary Shares, each representing six Class A Ordinary Shares",$5.00,0.19,3.95%,"273,914,200"
RCKY,"Rocky Brands, Inc. Common Stock",$36.29,-1.11,-2.968%,"273,654,289"
TLSI,"TriSalus Life Sciences, Inc. Common Stock",$4.45,0.06,1.367%,"273,293,880"
HBB,Hamilton Beach Brands Holding Company Class A Common Stock ,$20.12,-0.36,-1.758%,"273,174,693"
YSG,"Yatsen Holding Limited American Depositary Shares, each representing twenty (20) Class A Ordinary Shares",$2.91,-0.12,-3.96%,"273,148,320"
MPX,Marine Products Corporation Common Stock,$7.75,-0.22,-2.76%,"273,130,336"
MMT,MFS Multimarket Income Trust Common Stock,$4.58,-0.04,-0.866%,"272,731,237"
BRCC,BRC Inc. Class A Common Stock,$1.09,UNCH,--,"271,546,312"
MKTW,"MarketWise, Inc. Class A Common Stock",$16.76,-0.73,-4.174%,"270,668,603"
SI,"Shoulder Innovations, Inc. Common Stock",$13.03,-0.48,-3.553%,"270,085,175"
BRT,BRT Apartments Corp. (MD) Common Stock,$14.20,-0.17,-1.183%,"269,558,785"
RDNW,"RideNow Group, Inc. Class B Common Stock",$6.99,-0.25,-3.453%,"269,461,592"
CLLS,Cellectis S.A. American Depositary Shares,$3.70,-0.25,-6.329%,"268,586,678"
AFRI,Forafric Global PLC Ordinary Shares,$9.95,-0.25,-2.451%,"267,670,840"
LTRX,"Lantronix, Inc. Common Stock",$6.74,-0.34,-4.802%,"267,524,255"
FDBC,"Fidelity D & D Bancorp, Inc. Common Stock",$45.46,-0.45,-0.98%,"267,248,293"
SMRT,"SmartRent, Inc. Class A Common Stock",$1.39,0.03,2.206%,"267,238,542"
CHRS,"Coherus Oncology, Inc. Common Stock",$1.73,-0.07,-3.889%,"266,796,464"
NGEN,NervGen Pharma Corp. Common stock,$3.66,-0.12,-3.175%,"266,578,991"
CIA,"Citizens, Inc. Class A Common Stock ($1.00 Par)",$5.27,-0.11,-2.045%,"266,417,282"
CPZ,Calamos Long/Short Equity & Dynamic Income Trust Common Stock,$13.57,-0.1741,-1.267%,"266,408,873"
DUOT,"Duos Technologies Group, Inc. Common Stock",$9.08,0.05,0.554%,"266,004,130"
RDCM,Radcom Ltd. Ordinary Shares,$15.90,-0.16,-0.996%,"265,378,266"
EOT,Eaton Vance Municipal Income Trust EATON VANCE NATIONAL MUNICIPAL OPPORTUNITIES TRUST,$16.96,-0.12,-0.703%,"264,998,660"
MCR,MFS Charter Income Trust Common Stock,$6.02,-0.02,-0.331%,"264,930,448"
HELP,Cybin Inc. Common Stock,$5.29,0.14,2.718%,"264,689,356"
TII,Titan Mining Corporation Common Shares,$2.69,-0.02,-0.738%,"264,395,000"
NODK,"NI Holdings, Inc. Common Stock",$12.88,-0.02,-0.155%,"264,304,980"
ZEPP,"Zepp Health Corporation American depositary shares, each representing sixteen Class A ordinary shares",$18.01,-0.42,-2.279%,"264,116,308"
CNDT,Conduent Incorporated Common Stock ,$1.70,-0.05,-2.857%,"263,664,584"
JAKK,"JAKKS Pacific, Inc. Common Stock",$23.03,-1.03,-4.281%,"263,564,785"
USAU,U.S. Gold Corp. Common Stock,$15.95,-0.51,-3.098%,"263,193,550"
SMWB,Similarweb Ltd. Ordinary Shares,$3.02,-0.12,-3.822%,"262,638,685"
AUDC,AudioCodes Ltd. Common Stock,$10.14,-0.03,-0.295%,"262,495,235"
PPIH,"Perma-Pipe International Holdings, Inc. Common Stock",$32.29,-0.80,-2.418%,"262,300,485"
NXDT,NexPoint Diversified Real Estate Trust Common Stock,$5.22,-0.05,-0.949%,"262,146,260"
AMPY,Amplify Energy Corp. Common Stock,$6.32,0.11,1.771%,"260,936,602"
VPV,Invesco Pennsylvania Value Municipal Income Trust Common Stock (DE),$10.92,-0.155,-1.40%,"260,218,620"
HDSN,"Hudson Technologies, Inc. Common Stock",$6.18,-0.07,-1.12%,"259,985,110"
ECC           ,Eagle Point Credit Company Inc. Common Stock,$4.25,0.03,0.711%,"257,815,727"
JFIN,Jiayin Group Inc. American Depositary Shares,$4.92,0.14,2.929%,"257,461,366"
IKT,"Inhibikase Therapeutics, Inc. Common Stock",$1.94,0.03,1.571%,"256,143,314"
CXDO,"Crexendo, Inc. Common Stock",$8.17,0.63,8.355%,"254,516,767"
NUAI,"New Era Energy & Digital, Inc. Common Stock",$4.15,0.11,2.723%,"254,212,143"
OPRT,Oportun Financial Corporation Common Stock,$5.70,-0.03,-0.524%,"253,651,528"
REFI,"Chicago Atlantic Real Estate Finance, Inc. Common Stock",$11.96,-0.05,-0.416%,"253,638,447"
FCNCO,"First Citizens BancShares, Inc. 5.625% Non-Cumulative Perpetual Preferred Stock, Series C",$21.43,-0.32,-1.471%,"253,583,419"
SATLW,Satellogic Inc. Warrant,$1.77,0.0799,4.728%,"253,540,990"
FOSL,"Fossil Group, Inc. Common Stock",$4.34,0.02,0.463%,"253,262,714"
ALXO,ALX Oncology Holdings Inc. Common Stock,$1.88,0.19,11.243%,"252,972,644"
SNFCA,Security National Financial Corporation Class A Common Stock,$9.71,-0.17,-1.721%,"252,654,200"
ALTG,Alta Equipment Group Inc. Class A Common Stock,$7.76,-0.22,-2.757%,"252,449,639"
SGMT,Sagimet Biosciences Inc. Series A Common Stock,$7.90,0.29,3.811%,"252,437,430"
FRAF,Franklin Financial Services Corporation Common Stock,$56.12,-1.02,-1.785%,"252,086,999"
SVC,Service Properties Trust Common Stock,$1.50,-0.06,-3.846%,"252,081,855"
GLDG,GoldMining Inc. Common Shares,$1.17,0.01,0.862%,"250,379,902"
ATLO,Ames National Corporation Common Stock,$28.25,-0.66,-2.283%,"250,216,465"
REPL,"Replimune Group, Inc. Common Stock",$3.03,0.53,21.20%,"250,195,036"
FCNCP,"First Citizens BancShares, Inc. Depositary Shares",$21.13,-0.12,-0.565%,"250,033,488"
SIDU,"Sidus Space, Inc. Class A Common Stock",$3.09,-0.29,-8.58%,"249,872,399"
ANNA,"AleAnna, Inc. Class A Common Stock",$3.73,0.19,5.367%,"249,665,312"
CGEN,Compugen Ltd. Ordinary Shares,$2.64,-0.07,-2.583%,"249,622,895"
NIU,Niu Technologies American Depositary Shares,$3.18,0.10,3.247%,"249,426,760"
CMRC,"Commerce.com, Inc. Series 1 Common Stock",$3.03,-0.11,-3.503%,"249,418,177"
GENVR,Gen Digital Inc. Contingent Value Rights,$0.4103,0.0103,2.575%,"248,503,846"
CARL,"Carlsmed, Inc. Common Stock",$9.09,-0.39,-4.114%,"247,541,407"
HUHU,HUHUTECH International Group Inc. Ordinary Shares,$9.70,-0.29,-2.903%,"247,289,365"
MITT,"TPG Mortgage Investment Trust, Inc. Common Stock",$7.79,-0.03,-0.384%,"247,219,210"
FBLA,"FB Bancorp, Inc. Common Stock",$13.87,-0.15,-1.07%,"247,190,433"
FC,Franklin Covey Company Common Stock,$21.89,0.41,1.909%,"246,753,799"
NVCT,"Nuvectis Pharma, Inc. Common Stock",$8.89,0.35,4.098%,"245,968,840"
MASS,908 Devices Inc. Common Stock,$6.55,-0.26,-3.818%,"245,274,798"
LODE,Comstock Inc. Common Stock,$3.23,-0.09,-2.711%,"245,199,261"
EVI,"EVI Industries, Inc.  Common Stock",$19.05,0.80,4.384%,"245,023,938"
ASUR,"Asure Software, Inc Common Stock",$8.54,-0.65,-7.073%,"244,941,146"
BPRN,"Princeton Bancorp, Inc. Common Stock (PA)",$35.93,-0.18,-0.498%,"244,189,370"
AMTX,"Aemetis, Inc. (DE) Common Stock",$3.58,0.06,1.705%,"243,961,205"
ARCT,Arcturus Therapeutics Holdings Inc. Common Stock,$8.57,-0.06,-0.695%,"243,585,701"
PROF,Profound Medical Corp. Common Stock,$6.70,-0.16,-2.332%,"243,462,168"
FXNC,First National Corporation Common Stock,$26.85,-0.29,-1.069%,"242,749,964"
AREC,American Resources Corporation Class A Common Stock,$2.27,-0.01,-0.439%,"242,721,609"
AIRS,"AirSculpt Technologies, Inc. Common Stock",$3.44,0.12,3.614%,"242,677,143"
PLYX,"Polaryx Therapeutics, Inc. Common Stock",$5.12,0.24,4.918%,"242,397,681"
LFMD,"LifeMD, Inc. Common Stock",$5.09,0.09,1.80%,"242,282,305"
OSS,"One Stop Systems, Inc. Common Stock",$9.76,-0.27,-2.692%,"241,745,606"
OBIO,"Orchestra BioMed Holdings, Inc. Ordinary Shares",$4.02,0.05,1.259%,"240,720,474"
FUNC,First United Corporation Common Stock,$37.01,-0.24,-0.644%,"240,616,148"
ZIP,"ZipRecruiter, Inc. Class A Common Stock",$2.95,-0.14,-4.531%,"240,491,523"
EAF,GrafTech International Ltd. Common Stock,$9.23,0.69,8.08%,"239,872,461"
CFFI,C&F Financial Corporation Common Stock,$73.65,-2.36,-3.105%,"239,789,744"
CBNA,"Chain Bridge Bancorp, Inc. Class A Common Stock",$36.54,-1.21,-3.205%,"239,768,793"
FNKO,"Funko, Inc. Class A Common Stock",$4.28,-0.16,-3.604%,"239,366,443"
POWW,Outdoor Holding Company Common Stock,$2.04,-0.02,-0.971%,"239,268,993"
CNCK,Coincheck Group N.V. Ordinary Shares,$1.76,-0.01,-0.565%,"239,231,735"
PCTTW,"PureCycle Technologies, Inc. Warrant",$1.32,UNCH,--,"238,557,375"
FTF,Franklin Limited Duration Income Trust Common Shares of Beneficial Interest,$5.90,-0.02,-0.338%,"238,391,707"
NIOBW,NioCorp Developments Ltd. Warrant,$1.90,-0.10,-5.00%,"238,110,227"
RGCO,RGC Resources Inc. Common Stock,$22.85,-1.55,-6.352%,"237,514,028"
VLN,Valens Semiconductor Ltd. Ordinary Shares,$2.25,-0.09,-3.846%,"236,908,575"
STRS,Stratus Properties Inc. Common Stock,$29.65,-0.63,-2.081%,"236,681,866"
ASYS,"Amtech Systems, Inc. Common Stock",$16.48,-0.65,-3.795%,"236,600,015"
SILC,Silicom Ltd Ordinary Shares,$41.44,-0.77,-1.824%,"236,462,524"
CMT,Core Molding Technologies Inc Common Stock,$25.66,-0.95,-3.57%,"236,150,135"
EXOD,"Exodus Movement, Inc. Class A Common Stock",$7.92,-0.08,-1.00%,"236,123,886"
GPRO,"GoPro, Inc. Class A Common Stock",$1.44,-0.29,-16.763%,"235,574,243"
PESI,"Perma-Fix Environmental Services, Inc. Common Stock",$12.69,0.13,1.035%,"235,368,270"
VYGR,"Voyager Therapeutics, Inc. Common Stock",$3.88,0.12,3.191%,"234,417,522"
VENU,Venu Holding Corporation Common Stock,$3.88,-0.09,-2.267%,"234,147,594"
HWBK,"Hawthorn Bancshares, Inc. Common Stock",$33.96,0.46,1.373%,"233,977,948"
ACHV,"Achieve Life Sciences, Inc. Common Shares",$4.39,0.01,0.228%,"233,723,547"
TBCH,Turtle Beach Corporation Common Stock,$11.77,0.55,4.902%,"233,598,849"
NFE,New Fortress Energy Inc. Class A Common Stock,$0.8177,0.0849,11.586%,"232,678,834"
INTT,inTest Corporation Common Stock,$18.54,-0.11,-0.59%,"232,646,520"
FLWS,"1-800-FLOWERS.COM, Inc. Common Stock",$3.63,-0.09,-2.419%,"232,558,872"
SND,"Smart Sand, Inc. Common Stock",$5.40,0.01,0.186%,"232,122,677"
LNZA,"LanzaTech Global, Inc. Common Stock",$22.97,-1.81,-7.304%,"231,748,074"
KROS,"Keros Therapeutics, Inc. Common Stock",$11.71,0.22,1.915%,"231,715,571"
LMNR,Limoneira Co Common Stock,$12.79,0.03,0.235%,"231,586,957"
FENC,Fennec Pharmaceuticals Inc. Common Stock,$6.65,0.11,1.682%,"230,839,827"
VABK,Virginia National Bankshares Corporation Common Stock,$42.70,0.04,0.094%,"230,237,503"
HRTX,"Heron Therapeutics, Inc. Common Stock",$1.22,-0.05,-3.937%,"230,139,417"
CRNT,Ceragon Networks Ltd. Ordinary Shares,$2.53,0.03,1.20%,"229,918,696"
CMTV,Community Bancorp. Common Stock,$41.14,0.58,1.43%,"229,587,859"
SGHT,"Sight Sciences, Inc. Common Stock",$4.22,-0.23,-5.169%,"229,582,947"
JACK,Jack In The Box Inc. Common Stock,$12.05,-0.23,-1.873%,"229,383,993"
NKSH,"National Bankshares, Inc. Common Stock",$35.89,-0.51,-1.401%,"228,562,235"
CDXS,"Codexis, Inc. Common Stock",$2.51,-0.16,-5.993%,"228,150,383"
LOVE,The Lovesac Company Common Stock,$15.42,-0.34,-2.157%,"227,906,058"
IMPP,Imperial Petroleum Inc. Common Shares,$5.04,0.14,2.857%,"227,876,836"
AIRO,"AIRO Group Holdings, Inc. Common Stock",$7.24,-0.18,-2.426%,"227,613,886"
TPVG,TriplePoint Venture Growth BDC Corp. Common Stock,$5.61,0.05,0.899%,"227,155,323"
MIST,Milestone Pharmaceuticals Inc. Common Shares,$1.895,0.025,1.337%,"226,712,856"
DAVA,Endava plc American Depositary Shares (each representing one Class A Ordinary Share),$4.17,UNCH,--,"226,546,105"
LCNB,LCNB Corporation Common Stock,$15.86,-0.44,-2.699%,"225,814,141"
ARQQ,Arqit Quantum Inc. Ordinary Shares,$14.42,-0.10,-0.689%,"225,699,807"
SPOK,"Spok Holdings, Inc. Common Stock",$10.78,0.24,2.277%,"225,161,968"
KINS,"Kingstone Companies, Inc. Common Stock",$15.55,-0.70,-4.308%,"225,114,629"
AOMR,"Angel Oak Mortgage REIT, Inc. Common Stock",$9.03,-0.20,-2.167%,"224,979,262"
HKD,AMTD Digital Inc. American Depositary Shares (every five of which represent two Class A Ordinary Shares),$1.77,0.01,0.568%,"223,310,229"
ARL,"American Realty Investors, Inc. Common Stock",$13.80,-0.77,-5.285%,"222,898,193"
EICA,Eagle Point Income Company Inc. 5.00% Series A Term Preferred Stock due 2026,$24.93,UNCH,--,"222,079,132"
MDWD,MediWound Ltd. Ordinary Shares,$17.26,0.63,3.788%,"221,716,161"
MFM,MFS Municipal Income Trust Common Stock,$5.38,UNCH,--,"221,589,455"
VUZI,Vuzix Corporation Common Stock,$2.66,-0.18,-6.338%,"221,200,966"
PLG,Platinum Group Metals Ltd. Ordinary Shares (Canada),$1.74,-0.03,-1.695%,"220,677,029"
NVA,Nova Minerals Limited American Depositary Shares,$5.83,0.02,0.344%,"219,124,538"
RCMT,"RCM Technologies, Inc. Common Stock",$31.16,-0.10,-0.32%,"218,879,587"
INBKZ,First Internet Bancorp 6.0% Fixed-to-Floating Rate Subordinated Notes Due 2029,$25.10,0.15,0.601%,"218,698,659"
SLGL,Sol-Gel Technologies Ltd. Ordinary Shares,$77.70,2.09,2.764%,"218,327,598"
MVIS,"MicroVision, Inc. Common Stock",$0.666,0.0053,0.802%,"217,770,496"
VTN,Invesco Trust for Investment Grade New York Municipals Common Stock,$11.15,-0.08,-0.712%,"217,268,666"
TWIN,"Twin Disc, Incorporated Common Stock",$15.03,-0.68,-4.328%,"216,757,520"
MFIN,Medallion Financial Corp. Common Stock,$9.21,0.35,3.95%,"216,712,064"
FJET,"Starfighters Space, Inc. Common Stock",$4.90,-0.14,-2.778%,"216,452,463"
PRHIZ,"Presurance Holdings, Inc. 9.75% Senior Unsecured Notes due 2028",$17.705,UNCH,--,"216,406,108"
PEBK,"Peoples Bancorp of North Carolina, Inc. Common Stock",$39.62,-0.56,-1.394%,"216,384,234"
EGAN,eGain Corporation Common Stock,$7.88,0.15,1.94%,"215,802,547"
CPSS,"Consumer Portfolio Services, Inc. Common Stock",$9.91,0.42,4.426%,"215,644,325"
NKTX,"Nkarta, Inc. Common Stock",$3.02,0.09,3.072%,"215,298,594"
IMMR,Immersion Corporation Common Stock,$6.50,0.15,2.362%,"215,152,938"
FF,FutureFuel Corp.  Common shares,$4.90,0.03,0.616%,"214,931,184"
RDIB,Reading International Inc Class B Common Stock,$9.45,0.15,1.613%,"214,678,107"
OPBK,OP Bancorp Common Stock,$14.37,-0.30,-2.045%,"214,030,214"
MPAA,"Motorcar Parts  of America, Inc. Common Stock",$11.135,-0.105,-0.934%,"213,913,973"
INBK,First Internet Bancorp Common Stock,$24.54,0.82,3.457%,"213,906,885"
GORO,Gold Resource Corporation Common Stock,$1.32,-0.09,-6.383%,"213,653,681"
KLTR,"Kaltura, Inc. Common Stock",$1.42,-0.04,-2.74%,"213,532,134"
MRBK,Meridian Corporation Common Stock,$17.95,-0.73,-3.908%,"213,231,245"
UNCY,"Unicycive Therapeutics, Inc. Common Stock",$7.98,0.31,4.042%,"213,066,215"
PED,Pedevco Corp. Common Stock,$16.01,0.41,2.628%,"212,942,942"
LIEN,"Chicago Atlantic BDC, Inc. Common Stock",$9.33,0.08,0.865%,"212,919,519"
LUCD,Lucid Diagnostics Inc. Common Stock,$1.09,UNCH,--,"212,826,231"
HITI,High Tide Inc. Common Shares,$2.42,-0.03,-1.224%,"212,712,816"
AP,Ampco-Pittsburgh Corporation Common Stock,$10.45,-0.02,-0.191%,"212,410,765"
GENC,"Gencor Industries, Inc. Common Stock",$14.49,-0.32,-2.161%,"212,390,102"
RELL,"Richardson Electronics, Ltd. Common Stock",$14.59,0.11,0.76%,"212,385,492"
OSUR,"OraSure Technologies, Inc. Common Stock",$2.95,UNCH,--,"212,298,555"
AIRJ,AirJoule Technologies Corporation Class A Common Stock,$3.10,-0.04,-1.274%,"212,265,494"
SJT,San Juan Basin Royalty Trust Common Stock,$4.55,0.19,4.358%,"212,070,022"
RMAX,"RE/MAX Holdings, Inc. Class A Common Stock",$10.52,-0.26,-2.412%,"211,898,616"
ELMD,"Electromed, Inc. Common Stock",$25.56,-0.04,-0.156%,"211,517,000"
CNTX,Context Therapeutics Inc. Common Stock,$2.30,0.03,1.322%,"211,322,107"
QSI,Quantum-Si Incorporated Class A Common Stock,$0.9715,0.0133,1.388%,"210,202,263"
INFU,"InfuSystems Holdings, Inc. Common Stock",$10.39,0.02,0.193%,"209,815,639"
KPTI,Karyopharm Therapeutics Inc. Common Stock,$9.30,0.53,6.043%,"209,652,839"
SENS,"Senseonics Holdings, Inc. Common Stock",$5.01,-0.09,-1.765%,"209,395,285"
FATE,"Fate Therapeutics, Inc. Common Stock",$1.80,0.27,17.647%,"209,307,047"
LPRO,Open Lending Corporation Common Stock,$1.77,UNCH,--,"209,244,235"
FLYX,"flyExclusive, Inc. Class A Common Stock",$2.19,0.03,1.389%,"208,316,654"
ETX           ,Eaton Vance Municipal Income 2028 Term Trust Common Shares of Beneficial Interest,$19.11,0.36,1.92%,"208,011,509"
OVBC,Ohio Valley Banc Corp. Common Stock,$44.10,-0.77,-1.716%,"207,755,144"
ATGL,Alpha Technology Group Limited Class A Ordinary Shares,$12.5992,UNCH,--,"207,414,330"
AMBR,Amber International Holding Limited American Depositary Shares,$2.21,-0.07,-3.07%,"207,039,264"
VERI,"Veritone, Inc. Common Stock",$2.22,0.05,2.304%,"206,340,409"
ANTA,Antalpha Platform Holding Company Class A Ordinary Shares,$8.60,-0.52,-5.702%,"206,335,638"
CLW,Clearwater Paper Corporation Common Stock,$12.79,-0.53,-3.979%,"206,241,986"
CVRX,"CVRx, Inc. Common Stock",$7.795,-0.175,-2.196%,"206,028,982"
UTMD,"Utah Medical Products, Inc. Common Stock",$64.65,-1.12,-1.703%,"205,911,866"
WHWK,"Whitehawk Therapeutics, Inc. Common Stock",$4.16,0.17,4.261%,"205,621,216"
ENLV,Enlivex Ltd. Ordinary Shares,$0.8522,0.0362,4.436%,"205,421,723"
HUMA,"Humacyte, Inc. Common Stock",$0.9248,0.0695,8.126%,"205,323,271"
SPCE,"Virgin Galactic Holdings, Inc. Common Stock",$2.52,-0.13,-4.906%,"205,149,962"
GPJA,"Georgia Power Company Series 2017A 5.00% Junior Subordinated Notes due October 1, 2077",$22.11,-0.1628,-0.731%,"204,771,765"
SMHI,SEACOR Marine Holdings Inc. Common Stock ,$7.56,-0.09,-1.176%,"204,590,814"
FT,Franklin Universal Trust Common Stock,$8.14,-0.09,-1.094%,"204,573,617"
OABI,"OmniAb, Inc. Common Stock",$1.41,0.01,0.714%,"204,411,336"
RYDE,Ryde Group Ltd. Class A Ordinary Shares,$1.23,-0.07,-5.385%,"204,362,416"
OZ,"Belpointe PREP, LLC Class A Units",$51.05,0.575,1.139%,"204,005,193"
KGEI,Kolibri Global Energy Inc. Common stock,$5.74,-0.09,-1.544%,"203,622,516"
RNAC,"Cartesian Therapeutics, Inc. Common Stock",$6.93,0.71,11.415%,"203,613,892"
