Symbol,Name,Last Sale,Net Change,% Change,Market Cap
CPK,Chesapeake Utilities Corporation Common Stock,$126.48,-0.46,-0.362%,"3,034,159,455"
BSM,"Black Stone Minerals, L.P. Common units representing limited partner interests",$14.24,UNCH,--,"3,025,978,811"
SA,"Seabridge Gold, Inc. Ordinary Shares (Canada)",$28.16,0.09,0.321%,"3,023,628,833"
SBCF,Seacoast Banking Corporation of Florida Common Stock,$30.92,-0.39,-1.246%,"3,019,566,932"
KBH,KB Home Common Stock,$48.09,-3.35,-6.512%,"3,012,754,150"
AVEX,AEVEX Corp. Class A Common Stock,$26.87,-1.02,-3.657%,"3,004,779,210"
WHR,Whirlpool Corporation Common Stock,$53.07,-3.50,-6.187%,"3,000,585,761"
DHT,"DHT Holdings, Inc.",$18.59,-0.28,-1.484%,"2,993,764,032"
HG,"Hamilton Insurance Group, Ltd. Class B Common Shares",$30.01,-1.57,-4.972%,"2,991,479,958"
APAM,Artisan Partners Asset Management Inc. Class A Common Stock,$36.85,-0.70,-1.864%,"2,986,978,530"
EXTR,"Extreme Networks, Inc. Common Stock",$22.84,0.55,2.467%,"2,986,971,530"
SLG,SL Green Realty Corp Common Stock,$41.99,-0.86,-2.007%,"2,986,177,048"
LXP,LXP Industrial Trust Common Stock (Maryland REIT),$50.62,-1.22,-2.353%,"2,984,176,157"
BRZE,"Braze, Inc. Class A Common Stock",$24.17,0.61,2.589%,"2,982,501,429"
AWR,American States Water Company Common Stock,$76.07,0.86,1.143%,"2,981,376,822"
RUN,Sunrun Inc. Common Stock,$12.70,-0.36,-2.757%,"2,978,053,518"
BHE,"Benchmark Electronics, Inc. Common Stock",$82.97,-1.53,-1.811%,"2,976,717,677"
CLMT,"Calumet, Inc. Common Stock",$34.15,0.47,1.395%,"2,972,435,056"
ICUI,"ICU Medical, Inc. Common Stock",$118.67,-0.18,-0.151%,"2,965,846,684"
DNLI,Denali Therapeutics Inc. Common Stock,$18.67,0.37,2.022%,"2,962,471,548"
TTAM,Titan America SA Common Shares,$16.06,-0.73,-4.348%,"2,960,861,188"
BTDR,Bitdeer Technologies Group Class A Ordinary Shares,$12.16,0.32,2.703%,"2,958,694,020"
CAKE,Cheesecake Factory Incorporated (The) Common Stock,$59.29,-0.91,-1.512%,"2,952,968,095"
DK,"Delek US Holdings, Inc. Common Stock",$48.04,1.31,2.803%,"2,944,253,518"
MGEE,"MGE Energy, Inc",$80.11,-0.49,-0.608%,"2,944,229,877"
ARQT,"Arcutis Biotherapeutics, Inc. Common Stock",$23.49,0.14,0.60%,"2,937,970,619"
CRVL,CorVel Corp. Common Stock,$57.26,-0.27,-0.469%,"2,928,988,543"
DYN,"Dyne Therapeutics, Inc. Common Stock",$17.71,0.32,1.84%,"2,926,037,363"
POWWP,Outdoor Holding Company 8.75% Series A Cumulative Redeemable Perpetual Preferred Stock,$24.9001,0.0201,0.081%,"2,920,500,907"
PLAB,"Photronics, Inc. Common Stock",$49.48,-0.68,-1.356%,"2,917,657,175"
RXO,"RXO, Inc. Common Stock",$17.70,-1.89,-9.648%,"2,915,388,629"
CON,"Concentra Group Holdings Parent, Inc. Common Stock",$22.67,0.14,0.621%,"2,913,260,242"
SEZL,Sezzle Inc. Common Stock,$85.96,0.50,0.585%,"2,905,591,983"
PFS,"Provident Financial Services, Inc Common Stock",$22.25,-0.13,-0.581%,"2,899,479,469"
AKR,Acadia Realty Trust Common Stock,$21.71,0.20,0.93%,"2,898,657,131"
VC,Visteon Corporation Common Stock,$108.16,-2.69,-2.427%,"2,887,225,311"
NMRK,"Newmark Group, Inc. Class A Common Stock",$15.64,-0.40,-2.494%,"2,884,604,283"
ARX,Accelerant Holdings Class A Common Shares,$12.98,-0.11,-0.84%,"2,883,636,852"
YETI,"YETI Holdings, Inc. Common Stock",$38.08,-2.27,-5.626%,"2,882,413,887"
CURB,Curbline Properties Corp. Common Stock,$27.29,-0.20,-0.728%,"2,880,168,698"
IPAR,"Interparfums, Inc. Common Stock",$89.73,-2.00,-2.18%,"2,877,801,268"
AMPX,"Amprius Technologies, Inc. Common Stock",$20.38,-0.49,-2.348%,"2,869,647,903"
WU,Western Union Company (The) Common Stock,$9.18,-0.03,-0.326%,"2,868,154,255"
KYIV,Kyivstar Group Ltd. Common Shares,$12.39,0.10,0.814%,"2,860,400,301"
BANC,"Banc of California, Inc. Common Stock",$18.59,0.01,0.054%,"2,858,739,843"
DX,"Dynex Capital, Inc. Common Stock",$13.26,-0.31,-2.284%,"2,852,901,027"
ITGR,Integer Holdings Corporation Common Stock,$83.95,-0.08,-0.095%,"2,850,508,734"
NOG,"Northern Oil and Gas, Inc. Common Stock",$26.80,0.28,1.056%,"2,835,202,096"
PAGS,PagSeguro Digital Ltd. Class A Common Shares,$9.75,-0.12,-1.216%,"2,834,107,663"
DBRG,"DigitalBridge Group, Inc.",$15.54,-0.01,-0.064%,"2,834,066,816"
GPK,Graphic Packaging Holding Company,$9.56,-0.14,-1.443%,"2,828,653,784"
SUPN,"Supernus Pharmaceuticals, Inc. Common Stock",$48.63,0.78,1.63%,"2,822,471,632"
SBLK,Star Bulk Carriers Corp. Common Shares,$25.30,0.02,0.079%,"2,821,712,795"
BBAR,Banco BBVA Argentina S.A. ADS,$13.81,0.25,1.844%,"2,820,508,730"
LFST,"LifeStance Health Group, Inc. Common Stock",$7.27,-0.26,-3.453%,"2,819,507,212"
PATK,"Patrick Industries, Inc. Common Stock",$85.13,-3.81,-4.284%,"2,818,755,860"
NMIH,NMI Holdings Inc. Common Stock,$36.96,-0.25,-0.672%,"2,814,739,361"
FSM,Fortuna Mining Corp. Common Shares,$9.22,-0.26,-2.743%,"2,814,497,071"
ZIONP,"Zions Bancorporation, N.A. Depositary Shares (Each representing 1/40th Interest in a Share of Series A Floating-Rate Non-Cumulative Perpetual Preferred Stock)",$19.1143,0.0043,0.023%,"2,811,121,675"
CECO,CECO Environmental Corp. Common Stock,$78.17,3.87,5.209%,"2,804,194,833"
KMT,Kennametal Inc. Common Stock,$36.76,-1.71,-4.445%,"2,801,067,594"
FTAIM,FTAI Aviation Ltd. 9.500% Fixed-Rate Reset Series D Cumulative Perpetual Redeemable Preferred Shares,$27.305,0.025,0.092%,"2,800,964,921"
TXG,"10x Genomics, Inc. Class A Common Stock",$21.65,-0.78,-3.477%,"2,792,653,721"
GRBK,"Green Brick Partners, Inc. Common Stock",$64.70,-1.57,-2.369%,"2,792,276,792"
PSNY,Polestar Automotive Holding UK PLC Class A ADS,$19.15,0.69,3.738%,"2,790,059,212"
VISN,"Vistance Networks, Inc. Common Stock",$12.36,0.43,3.604%,"2,788,040,639"
XMTR,"Xometry, Inc. Class A Common Stock",$52.99,-0.68,-1.267%,"2,787,210,306"
STUB,"StubHub Holdings, Inc. Class A Common Stock",$7.44,-0.19,-2.49%,"2,781,422,915"
UNIT,Uniti Group Inc. Common Stock,$11.46,-0.31,-2.634%,"2,781,045,759"
TARS,"Tarsus Pharmaceuticals, Inc. Common Stock",$64.57,0.95,1.493%,"2,778,057,033"
FBK,FB Financial Corporation Common Stock,$53.53,-0.64,-1.181%,"2,775,186,784"
TDC,Teradata Corporation Common Stock,$29.32,1.36,4.864%,"2,771,631,651"
CALX,"Calix, Inc Common Stock",$43.44,-0.09,-0.207%,"2,770,703,069"
KALU,Kaiser Aluminum Corporation Common Stock,$169.42,-4.30,-2.475%,"2,768,425,469"
TNK,Teekay Tankers Ltd.,$79.70,-0.78,-0.969%,"2,761,115,483"
IHS,IHS Holding Limited Ordinary Shares,$8.21,0.01,0.122%,"2,754,629,233"
TRN,"Trinity Industries, Inc. Common Stock",$34.64,-1.58,-4.362%,"2,754,070,624"
FCPT,"Four Corners Property Trust, Inc. Common Stock",$25.08,-0.29,-1.143%,"2,752,509,861"
EEFT,"Euronet Worldwide, Inc. Common Stock",$72.48,-1.53,-2.067%,"2,751,783,218"
WDFC,WD-40 Company Common Stock,$204.27,-6.79,-3.217%,"2,748,534,967"
AEHR,Aehr Test Systems Common Stock,$85.61,-7.46,-8.015%,"2,748,428,405"
PHIN,PHINIA Inc. Common Stock,$74.23,0.21,0.284%,"2,748,036,020"
BKE,"Buckle, Inc. (The) Common Stock",$53.19,-2.08,-3.763%,"2,740,246,994"
CVBF,CVB Financial Corporation Common Stock,$20.17,-0.28,-1.369%,"2,738,781,030"
MGRC,McGrath RentCorp Common Stock,$111.47,2.09,1.911%,"2,737,900,502"
AEO,"American Eagle Outfitters, Inc. Common Stock",$16.40,-0.54,-3.188%,"2,733,464,490"
KN,Knowles Corporation Common Stock,$31.93,0.28,0.885%,"2,731,951,874"
SLNO,"Soleno Therapeutics, Inc. Common Stock",$52.90,0.03,0.057%,"2,730,929,914"
UE,Urban Edge Properties Common Shares of Beneficial Interest,$21.66,-0.19,-0.87%,"2,729,593,070"
DKL,"Delek Logistics Partners, L.P. Common Units representing Limited Partner Interests",$51.16,-2.79,-5.171%,"2,720,085,317"
TALO,"Talos Energy, Inc. Common Stock",$16.20,0.64,4.113%,"2,709,311,247"
ANDE,"Andersons, Inc. (The) Common Stock",$79.42,0.30,0.379%,"2,704,525,396"
RHI,Robert Half Inc. Common Stock,$26.37,-0.65,-2.406%,"2,700,162,057"
WRBY,Warby Parker Inc. Class A Common Stock,$21.99,-1.09,-4.723%,"2,698,508,040"
HIW,"Highwoods Properties, Inc. Common Stock",$24.46,-0.25,-1.012%,"2,697,270,169"
EXK,Endeavour Silver Corporation Ordinary Shares (Canada),$9.09,-0.11,-1.196%,"2,685,282,490"
NMFCZ,New Mountain Finance Corporation 8.250% Notes due 2028,$25.23,UNCH,--,"2,683,487,046"
SVM,Silvercorp Metals Inc. Common Shares,$12.17,-0.09,-0.734%,"2,680,767,549"
WAFD,"WaFd, Inc. Common Stock",$35.23,-0.23,-0.649%,"2,672,665,257"
DXPE,"DXP Enterprises, Inc. Common Stock",$172.15,3.25,1.924%,"2,669,239,461"
VCYT,"Veracyte, Inc. Common Stock",$33.45,0.36,1.088%,"2,669,037,583"
BCC,"Boise Cascade, L.L.C. Common Stock",$74.33,-3.80,-4.864%,"2,665,199,076"
SPNT,SiriusPoint Ltd. Common Shares,$22.77,-0.48,-2.065%,"2,663,851,940"
NHC,National HealthCare Corporation Common Stock,$170.61,-4.25,-2.431%,"2,661,353,238"
SHOO,"Steven Madden, Ltd. Common Stock",$36.42,-1.08,-2.88%,"2,660,129,183"
INFQ,"Infleqtion, Inc. Common Stock",$12.28,-0.13,-1.048%,"2,658,275,264"
DBD,Diebold Nixdorf Incorporated Common stock,$76.62,-1.24,-1.593%,"2,653,227,395"
IMNM,"Immunome, Inc. Common Stock",$23.33,0.60,2.64%,"2,639,397,533"
STNE,StoneCo Ltd. Class A Common Shares,$10.84,-0.25,-2.254%,"2,636,593,970"
WT,"WisdomTree, Inc. Common Stock",$17.28,0.66,3.971%,"2,634,118,860"
WRD,WeRide Inc. American Depositary Shares,$7.84,0.20,2.618%,"2,628,410,764"
GDV,Gabelli Dividend & Income Trust Common Shares of Beneficial Interest,$29.14,-0.27,-0.918%,"2,628,092,628"
KOD,Kodiak Sciences Inc Common Stock,$42.26,-1.70,-3.867%,"2,626,699,248"
WOR,"Worthington Enterprises, Inc. Common Shares",$53.31,-1.07,-1.968%,"2,625,677,110"
NYAX,Nayax Ltd. Ordinary Shares,$70.22,-1.36,-1.90%,"2,623,362,673"
PBH,Prestige Consumer Healthcare Inc. Common Stock,$55.31,0.22,0.399%,"2,617,198,956"
TRMK,Trustmark Corporation Common Stock,$44.34,-0.57,-1.269%,"2,610,379,115"
FTAIN,FTAI Aviation Ltd. 8.25% Fixed - Rate Reset Series C Cumulative Perpetual Redeemable Preferred Shares,$25.40,-0.02,-0.079%,"2,605,548,764"
HE,"Hawaiian Electric Industries, Inc. Common Stock",$15.06,-0.21,-1.375%,"2,599,892,497"
NGVT,Ingevity Corporation Common Stock ,$73.79,-2.13,-2.806%,"2,599,071,079"
LCII,LCI Industries,$106.79,-10.00,-8.562%,"2,593,339,299"
CALY,Callaway Golf Company Common Stock,$14.25,-0.91,-6.003%,"2,593,159,012"
UAA,"Under Armour, Inc. Class A Common Stock",$6.08,-0.21,-3.339%,"2,589,411,206"
ATRO,Astronics Corporation Common Stock,$72.10,0.89,1.25%,"2,586,539,626"
IRON,"Disc Medicine, Inc. Common Stock",$67.64,0.73,1.091%,"2,583,786,380"
HNI,HNI Corporation Common Stock,$35.88,-1.56,-4.167%,"2,583,105,539"
ARCB,ArcBest Corporation Common Stock,$115.72,-10.10,-8.027%,"2,580,070,323"
NKTR,Nektar Therapeutics  Common Stock,$86.89,0.43,0.497%,"2,578,864,528"
MFAO,"MFA Financial, Inc. 9.000% Senior Notes due 2029",$25.115,-0.03,-0.119%,"2,578,524,451"
TOWN,TowneBank Common Stock,$34.55,-0.48,-1.37%,"2,578,028,752"
CUBI,"Customers Bancorp, Inc Common Stock",$76.51,-0.57,-0.739%,"2,576,929,025"
CWT,California Water Service Group Common Stock,$43.05,0.69,1.629%,"2,576,682,929"
RGTIW,"Rigetti Computing, Inc. Warrants",$7.7499,0.2699,3.608%,"2,575,644,762"
CLDX,"Celldex Therapeutics, Inc.",$32.77,0.46,1.424%,"2,572,185,199"
HAE,Haemonetics Corporation Common Stock,$55.32,-3.94,-6.649%,"2,570,795,082"
VGNT,Versigent PLC Ordinary Shares,$36.17,-0.90,-2.428%,"2,569,773,896"
MFAN,"MFA Financial, Inc. 8.875% Senior Notes due 2029",$25.01,-0.04,-0.16%,"2,567,744,237"
PLBL,Polibeli Group Ltd Class A Ordinary Shares,$7.00,-0.04,-0.568%,"2,564,712,290"
CXT,"Crane NXT, Co. Common Stock",$44.49,-0.11,-0.247%,"2,559,833,943"
ERO,Ero Copper Corp. Common Shares,$24.46,-0.75,-2.975%,"2,550,602,358"
LMAT,"LeMaitre Vascular, Inc. Common Stock",$111.53,-0.51,-0.455%,"2,548,214,911"
VERA,"Vera Therapeutics, Inc. Class A Common Stock",$35.51,0.31,0.881%,"2,546,560,767"
ACHC,"Acadia Healthcare Company, Inc. Common Stock",$27.685,-0.165,-0.592%,"2,546,107,142"
DJT,Trump Media & Technology Group Corp. Common Stock,$9.20,-0.19,-2.023%,"2,545,928,098"
IDYA,"IDEAYA Biosciences, Inc. Common Stock",$28.90,0.71,2.519%,"2,539,180,588"
NTCT,"NetScout Systems, Inc. Common Stock",$35.11,1.13,3.325%,"2,535,656,489"
FRME,First Merchants Corporation Common Stock,$40.02,-0.40,-0.99%,"2,534,297,636"
ELVN,"Enliven Therapeutics, Inc. Common Stock",$41.61,-0.09,-0.216%,"2,533,618,545"
HOG,"Harley-Davidson, Inc. Common Stock",$23.21,-1.27,-5.188%,"2,532,118,624"
BWNB,"Babcock & Wilcox Enterprises, Inc. 6.50% Senior Notes due 2026",$25.00,UNCH,--,"2,527,438,550"
SEDG,"SolarEdge Technologies, Inc. Common Stock",$41.52,-1.39,-3.239%,"2,525,160,412"
UA,"Under Armour, Inc. Class C Common Stock",$5.91,-0.18,-2.956%,"2,517,009,906"
SGML,Sigma Lithium Corporation Common Shares,$22.57,0.60,2.731%,"2,514,365,236"
HUBG,"Hub Group, Inc. Class A Common Stock",$41.04,-2.14,-4.956%,"2,509,740,050"
FRSH,Freshworks Inc. Class A Common Stock,$8.98,0.23,2.629%,"2,505,017,786"
RLAY,"Relay Therapeutics, Inc. Common Stock",$13.09,0.37,2.909%,"2,504,634,984"
TGB,"Taseko Mines, Ltd. Common Stock",$6.85,-0.30,-4.196%,"2,497,216,478"
HTFL,"Heartflow, Inc. Common Stock",$28.95,0.28,0.977%,"2,496,635,291"
DNOW,DNOW Inc. Common Stock,$13.42,0.01,0.075%,"2,495,053,271"
ATKR,Atkore Inc. Common Stock,$73.67,-0.87,-1.167%,"2,486,409,575"
HUN,Huntsman Corporation Common Stock,$14.22,-0.41,-2.802%,"2,473,940,697"
CDLR,Cadeler A/S American Depositary Share (each representing four (4) Ordinary Shares),$28.13,-0.11,-0.39%,"2,468,109,209"
WSBCO,"WesBanco, Inc. Depositary Shares each representing 1/40th interest in a share of 7.375% Fixed-Rate Reset Non-Cumulative Perpetual Preferred Stock, Series B",$25.65,-0.3099,-1.194%,"2,467,031,364"
GEO,Geo Group Inc (The) REIT,$18.58,-0.17,-0.907%,"2,465,701,392"
NN,NextNav Inc. Common Stock,$18.12,-1.26,-6.502%,"2,464,830,857"
IVT,InvenTrust Properties Corp. Common Stock,$31.62,-0.53,-1.649%,"2,464,331,798"
ADMA,ADMA Biologics Inc Common Stock,$10.31,-0.21,-1.996%,"2,455,421,105"
TBBK,The Bancorp Inc Common Stock,$58.59,-0.62,-1.047%,"2,452,211,857"
MLYS,"Mineralys Therapeutics, Inc. Common Stock",$29.65,0.39,1.333%,"2,444,700,318"
RARE,Ultragenyx Pharmaceutical Inc. Common Stock,$24.81,0.04,0.161%,"2,439,006,941"
NESR,National Energy Services Reunited Corp Ordinary Shares,$24.11,-0.63,-2.546%,"2,430,215,766"
ICHR,Ichor Holdings Ordinary Shares,$69.72,5.30,8.227%,"2,422,401,251"
GRND,Grindr Inc. Common Stock,$13.65,-0.13,-0.943%,"2,419,035,255"
VNET,"VNET Group, Inc. American Depositary Shares",$8.47,0.13,1.559%,"2,411,338,216"
ROG,Rogers Corporation Common Stock,$135.00,0.56,0.417%,"2,409,552,225"
VAC,Marriott Vacations Worldwide Corporation Common Stock,$70.21,-2.54,-3.491%,"2,408,680,217"
PTRN,Pattern Group Inc. Series A Common Stock,$13.62,-0.17,-1.233%,"2,407,558,790"
AAMI,Acadian Asset Management Inc. Common Stock,$67.55,2.06,3.146%,"2,406,738,139"
ASH,Ashland Inc. Common Stock,$52.54,0.72,1.389%,"2,405,689,804"
MTX,Minerals Technologies Inc. Common Stock,$77.50,1.54,2.027%,"2,404,631,560"
HTO,H2O America Common Stock,$57.32,0.59,1.04%,"2,398,282,958"
AMSC,American Superconductor Corporation Common Stock,$50.30,-2.21,-4.209%,"2,394,897,936"
SAH,"Sonic Automotive, Inc. Common Stock",$75.59,-0.84,-1.099%,"2,388,954,146"
GRAL,"GRAIL, Inc. Common Stock ",$55.66,1.60,2.96%,"2,388,737,566"
KWR,Quaker Houghton Common Stock,$137.41,-5.02,-3.525%,"2,386,323,070"
TENB,"Tenable Holdings, Inc. Common Stock",$20.83,-0.40,-1.884%,"2,385,666,711"
BBT,Beacon Financial Corporation Common stock,$28.39,-0.32,-1.115%,"2,385,561,308"
ZLAB,Zai Lab Limited American Depositary Shares,$21.22,-0.32,-1.486%,"2,384,146,490"
OSW,OneSpaWorld Holdings Limited Common Shares,$23.48,-1.73,-6.862%,"2,383,568,584"
MFICL,MidCap Financial Investment Corporation 8.00% Notes due 2028,$25.50,0.05,0.196%,"2,379,242,361"
FBNC,First Bancorp Common Stock,$57.34,-0.45,-0.779%,"2,375,575,615"
DFTX,"Definium Therapeutics, Inc. Common Shares",$21.75,0.05,0.23%,"2,372,202,530"
AMR,"Alpha Metallurgical Resources, Inc. Common Stock",$184.87,2.50,1.371%,"2,362,427,663"
AMBP,Ardagh Metal Packaging S.A. Ordinary Shares,$3.94,UNCH,--,"2,354,936,369"
ABM,ABM Industries Incorporated Common Stock,$40.16,-0.83,-2.025%,"2,350,678,051"
LWLG,"Lightwave Logic, Inc. Common Stock",$15.79,-0.48,-2.95%,"2,350,043,416"
BCRX,"BioCryst Pharmaceuticals, Inc. Common Stock",$9.20,0.01,0.109%,"2,337,774,234"
MNR,Mach Natural Resources LP Common Units representing Limited Partner Interests,$13.88,0.10,0.726%,"2,334,876,528"
FIGS,"FIGS, Inc. Class A Common Stock",$13.97,-1.43,-9.286%,"2,333,615,158"
ALRM,"Alarm.com Holdings, Inc. Common Stock",$47.23,0.10,0.212%,"2,333,118,785"
SRPT,"Sarepta Therapeutics, Inc. Common Stock (DE)",$22.04,0.55,2.559%,"2,326,788,058"
GRDN,"Guardian Pharmacy Services, Inc. Class A Common Stock",$36.64,-0.73,-1.953%,"2,320,068,030"
ADPT,Adaptive Biotechnologies Corporation Common Stock,$14.50,0.23,1.612%,"2,316,529,701"
DRD,DRDGOLD Limited American Depositary Shares,$26.72,-0.06,-0.224%,"2,310,181,033"
MCW,"Mister Car Wash, Inc. Common Stock",$7.03,-0.02,-0.284%,"2,309,207,827"
HCM,HUTCHMED (China) Limited American Depositary Shares,$13.22,-0.08,-0.602%,"2,306,434,227"
RH,RH Common Stock,$122.35,-7.62,-5.863%,"2,304,410,374"
ADAMI,"Adamas Trust, Inc. 9.125% Senior Notes Due 2029",$25.40,0.02,0.079%,"2,300,718,005"
CMPR,Cimpress plc Ordinary Shares (Ireland),$94.68,0.93,0.992%,"2,299,321,979"
WTTR,"Select Water Solutions, Inc. Class A common stock",$16.61,0.19,1.157%,"2,293,252,923"
NBTB,NBT Bancorp Inc. Common Stock,$44.07,-0.14,-0.317%,"2,292,065,099"
ADAMM,"Adamas Trust, Inc. 7.875% Series E Fixed-to-Floating Rate Cumulative Redeemable Preferred Stock",$25.49,0.065,0.256%,"2,290,559,643"
CSGS,"CSG Systems International, Inc. Common Stock",$80.34,-0.06,-0.075%,"2,289,845,538"
BRSL,"Brightstar Lottery PLC Trading under the Legal Name to begin at the market open on July 21, 2025. Ordinary Shares",$12.38,-0.42,-3.281%,"2,284,110,000"
BGR,BlackRock Energy and Resources Trust,$16.83,0.06,0.358%,"2,281,915,645"
AVPT,"AvePoint, Inc. Class A Common Stock",$10.53,0.32,3.134%,"2,274,045,237"
FLNC,"Fluence Energy, Inc. Class A Common Stock",$12.33,0.14,1.148%,"2,267,921,916"
AXGN,"Axogen, Inc. Common Stock",$42.63,-0.65,-1.502%,"2,266,970,637"
FLOC,Flowco Holdings Inc. Class A Common Stock,$25.08,-0.30,-1.182%,"2,265,667,108"
PLUS,ePlus inc. Common Stock,$85.59,0.38,0.446%,"2,258,939,296"
NEXT,NextDecade Corporation Common Stock,$8.52,0.69,8.812%,"2,257,626,814"
TMC,TMC the metals company Inc. Common Stock,$5.19,-0.21,-3.889%,"2,248,246,691"
PENN,"PENN Entertainment, Inc. Common Stock",$16.79,-0.48,-2.779%,"2,247,230,199"
DAC,Danaos Corporation Common Stock,$123.35,3.58,2.989%,"2,245,398,641"
DRVN,Driven Brands Holdings Inc. Common Stock,$13.65,-0.38,-2.708%,"2,244,800,076"
XRAY,DENTSPLY SIRONA Inc. Common Stock,$11.20,-0.61,-5.165%,"2,243,589,622"
BUSE,First Busey Corporation Class A Common Stock,$26.23,-0.38,-1.428%,"2,242,782,432"
VRRM,Verra Mobility Corporation Class A Common Stock,$14.74,-0.15,-1.007%,"2,239,101,574"
GCMG,GCM Grosvenor Inc. Class A Common Stock,$11.06,0.12,1.097%,"2,223,989,051"
NWN,Northwest Natural Holding Company Common Stock,$52.85,-0.01,-0.019%,"2,223,928,529"
PK,Park Hotels & Resorts Inc. Common Stock ,$11.04,-0.31,-2.731%,"2,223,438,767"
CENT,Central Garden & Pet Company Common Stock,$35.675,-1.055,-2.872%,"2,221,390,886"
MLCO,Melco Resorts & Entertainment Limited American Depositary Shares,$5.46,UNCH,--,"2,221,084,347"
PMTU,PennyMac Mortgage Investment Trust 8.50% Senior Notes due 2028,$25.455,-0.045,-0.176%,"2,219,463,782"
CPRI,Capri Holdings Limited Ordinary Shares,$18.61,-1.02,-5.196%,"2,217,602,308"
BUSEP,"First Busey Corporation Depositary Shares, Each Representing a 1/40thInterest in a Share of 8.25% Fixed-Rate Series B Non-Cumulative Perpetual Preferred Stock, $0.001 par value",$25.933,-0.007,-0.027%,"2,217,387,602"
PAHC,Phibro Animal Health Corporation Class A Common Stock,$54.68,-0.21,-0.383%,"2,216,438,271"
AESI,Atlas Energy Solutions Inc. Common Stock,$17.75,0.62,3.619%,"2,216,391,966"
LCID,"Lucid Group, Inc. Common Stock",$6.69,0.15,2.294%,"2,208,667,876"
SOC,Sable Offshore Corp. Common Stock,$14.50,0.40,2.837%,"2,203,455,235"
BANR,Banner Corporation Common Stock,$64.79,-1.08,-1.64%,"2,194,586,641"
AGRO,Adecoagro S.A. Common Shares,$15.18,1.28,9.209%,"2,190,602,514"
NTB,Bank of N.T. Butterfield & Son Limited (The) Voting Ordinary Shares,$54.76,-0.87,-1.564%,"2,190,400,000"
PBI,Pitney Bowes Inc. Common Stock,$15.26,-0.27,-1.739%,"2,190,392,627"
COHU,"Cohu, Inc. Common Stock",$46.69,1.10,2.413%,"2,189,923,901"
HURN,Huron Consulting Group Inc. Common Stock,$132.10,0.81,0.617%,"2,189,783,655"
HTH,Hilltop Holdings Inc.,$37.40,-0.63,-1.657%,"2,189,029,368"
PTON,"Peloton Interactive, Inc. Class A Common Stock",$5.14,-0.22,-4.104%,"2,187,013,923"
FA,First Advantage Corporation Common Stock,$12.66,-0.31,-2.39%,"2,182,674,418"
NSIT,"Insight Enterprises, Inc. Common Stock",$70.48,-2.29,-3.147%,"2,174,796,567"
CTOS,"Custom Truck One Source, Inc. Common Stock",$9.55,-0.55,-5.446%,"2,171,983,441"
MH,"McGraw Hill, Inc. Common Stock",$11.36,-0.41,-3.483%,"2,169,777,256"
ADAML,"Adamas Trust, Inc. 6.875% Series F Fixed-to-Floating Rate Cumulative Redeemable Preferred Stock, $0.01 par value per share",$24.14,-0.055,-0.227%,"2,169,247,147"
HLIO,"Helios Technologies, Inc. Common Stock",$65.49,-1.35,-2.02%,"2,168,184,830"
EOSE,"Eos Energy Enterprises, Inc. Class A Common Stock",$6.38,-0.07,-1.085%,"2,165,748,573"
CEPU,Central Puerto S.A. American Depositary Shares (each represents ten Common Shares),$14.29,0.29,2.071%,"2,163,177,644"
ECO,Okeanis Eco Tankers Corp. Common Stock,$55.39,0.28,0.508%,"2,162,683,440"
LPL,"LG Display Co, Ltd AMERICAN DEPOSITORY SHARES",$4.32,-0.01,-0.231%,"2,160,000,000"
AERO,"Grupo Aeromexico, S.A.B. de C.V. American Depositary Shares (each representing ten (10) Common Shares)",$14.80,-0.12,-0.804%,"2,159,370,453"
VERX,"Vertex, Inc. Class A Common Stock",$13.34,0.15,1.137%,"2,157,582,052"
SAM,"Boston Beer Company, Inc. (The) Common Stock",$207.17,-7.13,-3.327%,"2,157,352,779"
SPSC,"SPS Commerce, Inc. Common Stock",$58.54,-0.38,-0.645%,"2,149,161,575"
ARR,"ARMOUR Residential REIT, Inc.",$17.29,-0.44,-2.482%,"2,144,757,346"
QUBT,Quantum Computing Inc. Common Stock,$9.50,0.29,3.149%,"2,142,460,302"
EFSC,Enterprise Financial Services Corporation Common Stock,$58.12,-0.77,-1.308%,"2,141,201,942"
DGII,Digi International Inc. Common Stock,$56.92,-0.59,-1.026%,"2,140,827,227"
OCUL,"Ocular Therapeutix, Inc. Common Stock",$9.77,0.34,3.606%,"2,138,712,587"
COTY,Coty Inc. Class A Common Stock,$2.42,-0.05,-2.024%,"2,129,615,389"
STOK,"Stoke Therapeutics, Inc. Common Stock",$34.18,1.10,3.325%,"2,128,425,583"
ATHM,"Autohome Inc. American Depositary Shares, each representing four class A ordinary shares.",$18.42,-0.18,-0.968%,"2,121,448,181"
CHA,Chagee Holdings Limited American Depositary Shares,$11.12,0.16,1.46%,"2,121,288,185"
VVX,"V2X, Inc. Common Stock",$67.82,0.08,0.118%,"2,120,740,420"
ADAMN,"Adamas Trust, Inc. 8.00% Series D Fixed-to-Floating Rate Cumulative Redeemable Preferred Stock",$23.60,-0.15,-0.632%,"2,120,722,149"
PRDO,Perdoceo Education Corporation Common Stock,$33.82,0.18,0.535%,"2,120,561,517"
CDNL,Cardinal Infrastructure Group Inc. Class A Common Stock,$49.45,-5.24,-9.581%,"2,119,766,178"
WLYB,"John Wiley & Sons, Inc. Common Stock",$41.20,UNCH,--,"2,114,507,435"
SLDE,"Slide Insurance Holdings, Inc. Common Stock",$18.43,-0.19,-1.02%,"2,111,326,904"
MBIN,Merchants Bancorp Common Stock,$45.91,-0.69,-1.481%,"2,109,181,886"
SYBT,"Stock Yards Bancorp, Inc. Common Stock",$71.17,-0.69,-0.96%,"2,100,325,626"
DRH,Diamondrock Hospitality Company Common Stock,$10.23,-0.24,-2.292%,"2,091,938,746"
TYRA,"Tyra Biosciences, Inc. Common Stock",$35.14,1.10,3.231%,"2,090,311,228"
STC,Stewart Information Services Corporation Common Stock,$68.20,-0.90,-1.302%,"2,080,286,527"
MCRI,"Monarch Casino & Resort, Inc. Common Stock",$117.09,-0.53,-0.451%,"2,078,290,828"
NMM,Navios Maritime Partners LP Common Units Representing Limited Partner Interests,$71.18,-0.09,-0.126%,"2,076,200,092"
GEL,"Genesis Energy, L.P. Common Units",$16.91,-0.16,-0.937%,"2,070,871,617"
THR,"Thermon Group Holdings, Inc. Common Stock",$63.04,2.52,4.164%,"2,070,761,371"
PUMP,ProPetro Holding Corp. Common Stock,$16.85,0.23,1.384%,"2,066,096,046"
BHC,Bausch Health Companies Inc. Common Stock,$5.53,-0.12,-2.124%,"2,065,320,311"
MESO,Mesoblast Limited American Depositary Shares,$16.00,0.26,1.652%,"2,065,283,504"
ESTA,Establishment Labs Holdings Inc. Common Shares,$70.24,0.01,0.014%,"2,064,003,173"
WLY,"John Wiley & Sons, Inc. Common Stock",$40.18,-0.75,-1.832%,"2,062,157,979"
WERN,"Werner Enterprises, Inc. Common Stock",$34.39,-1.52,-4.233%,"2,061,684,455"
EVCM,EverCommerce Inc. Common Stock,$11.64,-0.47,-3.881%,"2,060,515,896"
VET,Vermilion Energy Inc. Common (Canada),$13.50,0.30,2.273%,"2,060,093,304"
SFB,Stifel Financial Corporation 5.20% Senior Notes due 2047,$20.12,-0.0018,-0.009%,"2,055,728,929"
AAPG,Ascentage Pharma Group International American Depository Shares,$22.02,-1.32,-5.656%,"2,055,138,667"
XPRO,Expro Group Holdings N.V. Common Stock,$18.06,0.02,0.111%,"2,054,606,032"
NEXA,Nexa Resources S.A. Common Shares,$15.51,0.01,0.065%,"2,054,122,857"
DCO,Ducommun Incorporated Common Stock,$137.01,-4.23,-2.995%,"2,053,361,608"
TIC,"TIC Solutions, Inc. Common Stock",$9.28,-0.10,-1.066%,"2,052,303,478"
WB,Weibo Corporation American Depositary Share,$8.35,-0.01,-0.12%,"2,051,365,976"
AUPH,Aurinia Pharmaceuticals Inc Ordinary Shares,$15.77,0.42,2.736%,"2,049,127,369"
BW,"Babcock & Wilcox Enterprises, Inc. Common Stock",$15.08,1.01,7.178%,"2,046,986,510"
PAX,Patria Investments Limited Class A Common Shares,$12.68,-0.01,-0.079%,"2,046,473,980"
UTI,Universal Technical Institute Inc Common Stock,$37.07,0.18,0.488%,"2,039,610,157"
SEM,Select Medical Holdings Corporation Common Stock,$16.44,UNCH,--,"2,038,836,192"
BRBR,"BellRing Brands, Inc. Common Stock ",$17.36,0.16,0.93%,"2,035,798,919"
CIMN,Chimera Investment Corporation 9.000% Senior Notes due 2029,$25.20,-0.05,-0.198%,"2,029,373,539"
FORTY,Formula Systems (1985) Ltd. American Depositary Shares,$132.48,UNCH,--,"2,029,284,524"
