Symbol,Name,Last Sale,Net Change,% Change,Market Cap
VNTG,Vantage Corp Class A Ordinary Shares,$0.92,0.0049,0.535%,"29,198,500"
TC,Token Cat Limited American Depositary Shares,$17.2295,-0.1704,-0.979%,"29,147,369"
UFG,Uni-Fuels Holdings Limited Class A Ordinary Shares,$0.8975,-0.0225,-2.446%,"29,092,463"
RECT,Rectitude Holdings Ltd Ordinary Shares,$2.00,0.04,2.041%,"29,000,000"
SCYX,"SCYNEXIS, Inc. Common Stock",$0.6901,0.0119,1.755%,"28,960,087"
ZGM,Zenta Group Company Limited Ordinary Shares,$2.50,0.21,9.17%,"28,959,598"
BLBX,Blackboxstocks Inc. Common Stock,$6.98,0.60,9.404%,"28,911,809"
NVNI,Nvni Group Limited Ordinary Shares,$2.88,0.03,1.053%,"28,894,084"
LITM,Snow Lake Resources Ltd. Common Shares,$3.30,0.27,8.911%,"28,868,951"
KPLT,"Katapult Holdings, Inc. Common Stock",$6.20,-0.01,-0.161%,"28,788,671"
CYN,Cyngn Inc. Common Stock,$3.59,-0.03,-0.829%,"28,628,024"
APVO,Aptevo Therapeutics Inc. Common Stock,$1.38,0.10,7.813%,"28,583,555"
NRSN,NeuroSense Therapeutics Ltd. Ordinary Shares,$1.19,0.02,1.709%,"28,546,516"
INTZ,Intrusion Inc. Common Stock,$1.42,0.04,2.899%,"28,546,173"
SJ,Scienjoy Holding Corporation Class A Ordinary Shares ,$0.678,-0.0027,-0.397%,"28,478,304"
LIVE,Live Ventures Incorporated Common Stock,$9.25,0.03,0.325%,"28,412,818"
MYND,"Mynd.ai, Inc. American Depositary Shares",$0.62,0.01,1.639%,"28,301,625"
KTCC,Key Tronic Corporation Common Stock,$2.60,-0.12,-4.412%,"28,234,099"
LIMN,"Liminatus Pharma, Inc. Class A Common Stock",$1.04,0.0639,6.546%,"28,147,218"
BTOC,Armlogi Holding Corp. Common Stock,$0.6178,0.0323,5.517%,"28,074,734"
PASG,"Passage Bio, Inc. Common Stock",$8.83,-0.16,-1.78%,"28,068,009"
GLBS,Globus Maritime Limited Common Stock,$1.36,0.02,1.493%,"27,991,929"
HHS,"Harte Hanks, Inc. Common Stock",$3.7701,0.4401,13.216%,"27,954,515"
REE,REE Automotive Ltd. Class A Ordinary Shares,$0.8948,0.0848,10.469%,"27,757,530"
SWVL,Swvl Holdings Corp Class A Common Shares,$2.80,0.11,4.089%,"27,715,845"
TOPS,"TOP Ships, Inc. Common Stock",$5.99,0.14,2.393%,"27,710,920"
IBIO,"iBio, Inc. Common Stock",$1.23,0.03,2.50%,"27,659,389"
LNAI,Lunai Bioworks Inc. Common Stock,$1.18,-0.11,-8.527%,"27,650,221"
BOSC,B.O.S. Better Online Solutions Common Stock,$4.66,-0.05,-1.062%,"27,603,785"
LESL,"Leslie's, Inc. Common Stock",$2.97,UNCH,--,"27,562,833"
RLYB,Rallybio Corporation Common Stock,$0.6511,0.0081,1.26%,"27,504,921"
QVCGP,"QVC Group, Inc. 8.0% Fixed Rate Cumulative Redeemable Preferred Stock",$3.40,-0.22,-6.077%,"27,432,791"
PSHG,Performance Shipping Inc. Common Shares,$2.20,0.12,5.769%,"27,350,748"
PFAI,Pinnacle Food Group Limited Class A Common Shares,$2.33,-0.02,-0.851%,"27,261,000"
CLPS,CLPS Incorporation Common Stock,$0.9151,-0.0299,-3.164%,"27,218,233"
TBHC,"The Brand House Collective, Inc. Common Stock",$1.21,UNCH,--,"27,178,273"
STAI,ScanTech AI Systems Inc. Common stock,$0.4198,0.0261,6.629%,"27,071,906"
DAIO,Data I/O Corporation Common Stock,$2.88,0.08,2.857%,"27,048,623"
AERT,"Aeries Technology, Inc. Class A Ordinary Share",$0.5531,-0.0143,-2.52%,"27,021,042"
LGPS,LogProstyle Inc. Common Shares,$1.14,0.04,3.636%,"26,963,405"
QTTB,Q32 Bio Inc. Common Stock,$2.19,0.13,6.311%,"26,946,531"
COOT,Australian Oilseeds Holdings Limited Ordinary Shares,$0.9647,0.1343,16.173%,"26,913,720"
XOS,"Xos, Inc. Common Stock",$2.36,0.06,2.609%,"26,748,693"
XCUR,"Exicure, Inc. Common Stock",$4.18,0.32,8.29%,"26,642,772"
NIXX,"Nixxy, Inc. Common Stock",$1.07,-0.02,-1.835%,"26,616,868"
UG,"United-Guardian, Inc. Common Stock",$5.79,0.11,1.937%,"26,601,107"
BEAT,"Heartbeam, Inc. Common Stock",$0.77,0.1663,27.547%,"26,521,544"
DXST,Decent Holding Inc Class A Ordinary Shares,$1.62,0.01,0.621%,"26,325,000"
DARE,"Dare Bioscience, Inc. Common Stock",$1.84,0.03,1.657%,"26,292,181"
BOLD,"Boundless Bio, Inc. Common Stock",$1.17,0.06,5.405%,"26,191,165"
VRAR,"The Glimpse Group, Inc. Common Stock",$1.24,0.05,4.202%,"26,134,867"
ELUT,Elutia Inc. Class A Common Stock,$0.612,-0.061,-9.064%,"26,133,125"
CREG,Smart Powerr Corp. Common Stock,$1.25,-0.021,-1.652%,"26,011,404"
TBLAW,Taboola.com Ltd. Warrant,$0.09,UNCH,--,"25,940,103"
MOBBW,Mobilicom Limited Warrants,$2.58,-0.12,-4.444%,"25,644,346"
AFRIW,Forafric Global PLC Warrants,$0.95,UNCH,--,"25,556,512"
HUMAW,"Humacyte, Inc. Warrant",$0.1358,-0.014,-9.346%,"25,431,445"
FENG,"Phoenix New Media Limited American Depositary Shares, each representing 48 Class A ordinary shares.",$2.1164,0.0264,1.263%,"25,419,606"
VEEA,Veea Inc. Common Stock,$0.506,0.029,6.08%,"25,381,301"
ARKR,Ark Restaurants Corp. Common Stock,$7.00,0.03,0.43%,"25,243,099"
CING,Cingulate Inc. Common Stock,$3.73,0.06,1.635%,"25,203,871"
EQS,"Equus Total Return, Inc. Common Stock",$1.80,-0.088,-4.661%,"25,140,053"
SONN,"Sonnet BioTherapeutics Holdings, Inc. Common Stock",$3.72,-0.435,-10.469%,"25,126,189"
MOBX,"Mobix Labs, Inc. Class A Common Stock",$0.4588,-0.0162,-3.411%,"25,112,114"
MODD,"Modular Medical, Inc. Common Stock",$0.3943,0.0015,0.382%,"25,077,303"
MBNKO,"Medallion Bank Fixed-Rate Reset Non-Cumulative Perpetual Preferred Stock, Series G, par value $1.00 per share",$25.0641,0.0541,0.216%,"25,064,100"
CLGN,CollPlant Biotechnologies Ltd Ordinary Shares,$2.1878,-0.0422,-1.892%,"25,060,181"
SPWRW,SunPower Inc. Warrants,$0.30,UNCH,--,"24,932,612"
RVP,"Retractable Technologies, Inc. Common Stock",$0.828,0.006,0.73%,"24,787,968"
LEE,"Lee Enterprises, Incorporated Common Stock",$3.95,UNCH,--,"24,738,720"
MLSS,"Milestone Scientific, Inc. Common Stock",$0.314,0.0111,3.665%,"24,689,479"
GREE,Greenidge Generation Holdings Inc. Class A Common Stock,$1.56,-0.01,-0.637%,"24,646,435"
SIDU,"Sidus Space, Inc. Class A Common Stock",$0.699,0.0049,0.706%,"24,637,991"
CTXR,"Citius Pharmaceuticals, Inc. Common Stock",$1.44,0.04,2.857%,"24,497,555"
FCUV,Focus Universal Inc. Common Stock,$3.31,0.23,7.468%,"24,449,994"
ELOG,Eastern International Ltd. Ordinary Shares,$2.03,-0.0699,-3.329%,"24,394,510"
LIXT,"Lixte Biotechnology Holdings, Inc. Common Stock",$4.27,0.06,1.425%,"24,356,934"
SCNX,"Scienture Holdings, Inc. Common Stock",$0.5991,0.0072,1.216%,"24,341,921"
NEUP,Neuphoria Therapeutics Inc. Common Stock,$4.52,0.16,3.67%,"24,305,527"
PLAG,Planet Green Holdings Corp. Common Stock,$2.59,0.09,3.60%,"24,301,229"
ITRM,Iterum Therapeutics plc Ordinary Share,$0.46,-0.0091,-1.94%,"24,282,332"
MNDO,MIND C.T.I. Ltd. Ordinary Shares,$1.19,-0.01,-0.833%,"24,235,928"
CVV,CVD Equipment Corporation Common Stock,$3.4899,0.1799,5.435%,"24,210,616"
PRZO,ParaZero Technologies Ltd. Ordinary Shares,$1.45,0.03,2.113%,"24,185,465"
COCH,"Envoy Medical, Inc. Class A Common Stock",$0.8392,0.0405,5.071%,"24,157,640"
BTOG,Bit Origin Limited Class A Ordinary Shares,$0.2725,0.0095,3.612%,"24,146,367"
AQMS,"Aqua Metals, Inc. Common Stock",$8.10,0.49,6.439%,"24,132,030"
DRTSW,Alpha Tau Medical Ltd. Warrant,$0.3425,0.0025,0.735%,"24,105,345"
WETH,Wetouch Technology Inc. Common Stock,$2.0187,-0.0413,-2.005%,"24,086,188"
TOPP,Toppoint Holdings Inc. Common Stock,$1.24,0.07,5.983%,"24,056,000"
INTS,"Intensity Therapeutics, Inc. Common stock",$0.3993,0.003,0.757%,"23,983,941"
RDGT,"Ridgetech, Inc. Ordinary Shares",$4.07,0.23,5.99%,"23,829,887"
FTFT,Future FinTech Group Inc. Common Stock,$1.18,-0.0501,-4.073%,"23,780,907"
AUST,Austin Gold Corp. Common Shares,$1.73,-0.01,-0.575%,"23,688,892"
CAPT,Captivision Inc. Ordinary Shares,$0.8124,0.0034,0.42%,"23,687,668"
UTSI,UTStarcom Holdings Corp. Ordinary Shares,$2.50,0.01,0.402%,"23,675,638"
GLTO,"Galecto, Inc. Common Stock",$17.78,0.39,2.243%,"23,597,829"
ENLV,Enlivex Therapeutics Ltd. Ordinary Shares,$0.9699,0.0699,7.767%,"23,561,619"
CISO,"CISO Global, Inc. Common Stock",$0.5315,0.0064,1.219%,"23,410,631"
NWGL,Nature Wood Group Limited American Depositary Shares,$1.41,0.33,30.556%,"23,339,963"
AIFF,"Firefly Neuroscience, Inc. Common Stock",$1.73,0.05,2.976%,"23,324,744"
PMAX,Powell Max Limited Class A Ordinary Shares,$1.84,0.19,11.515%,"23,000,000"
XTKG,"X3 Holdings Co., Ltd. Ordinary Shares",$1.67,-0.31,-15.657%,"22,992,844"
NCT,Intercont (Cayman) Limited Ordinary shares,$0.7766,-0.0224,-2.804%,"22,766,395"
EDHL,Everbright Digital Holding Limited Ordinary Shares,$0.8581,0.0307,3.71%,"22,739,650"
AHT,Ashford Hospitality Trust Inc Common Stock,$3.54,-0.07,-1.939%,"22,696,823"
CODX,"Co-Diagnostics, Inc. Common Stock",$0.3706,-0.0027,-0.723%,"22,566,791"
SQFTP,"Presidio Property Trust, Inc. 9.375% Series D Cumulative Redeemable Perpetual Preferred Stock, $0.01 par value per share",$15.67,0.0753,0.483%,"22,550,681"
CSAI,"Cloudastructure, Inc. Class A Common Stock",$1.15,0.02,1.77%,"22,517,589"
COSM,Cosmos Health Inc. Common Stock,$0.6417,0.0083,1.31%,"22,408,113"
BMGL,Basel Medical Group Ltd Ordinary Shares,$1.19,0.015,1.277%,"22,355,043"
AYTU,"Aytu BioPharma, Inc.  Common Stock",$2.19,0.09,4.286%,"22,312,176"
RSVRW,"Reservoir Media, Inc. Warrant",$0.34,-0.01,-2.857%,"22,299,996"
EBON,Ebang International Holdings Inc. Class A Ordinary Shares,$3.40,UNCH,--,"22,249,389"
BGI,Birks Group Inc. Common Stock,$1.1271,-0.0029,-0.257%,"22,085,172"
JL,J-Long Group Limited Class A Ordinary Shares,$5.87,0.3726,6.778%,"22,081,185"
TLF,"Tandy Leather Factory, Inc. Common Stock",$2.7301,0.0401,1.491%,"22,025,087"
NNVC,"NanoViricides, Inc. Common Stock",$1.22,-0.04,-3.175%,"21,956,340"
TIRX,TIAN RUIXIANG Holdings Ltd Class A Ordinary Shares,$0.90,0.0763,9.263%,"21,925,288"
IDAI,T Stamp Inc. Class A Common Stock,$4.18,0.19,4.762%,"21,919,218"
MOGU,MOGU Inc. American Depositary Shares (each  representing 25 Class A Ordinary Shares),$2.6725,0.0425,1.616%,"21,844,056"
MSW,Ming Shing Group Holdings Limited Ordinary Shares,$1.68,0.1509,9.869%,"21,798,000"
WKSP,"Worksport, Ltd. Common Stock",$2.63,0.20,8.23%,"21,709,043"
TRAW,"Traws Pharma, Inc. Common Stock",$2.70,0.14,5.469%,"21,575,341"
LEXX,Lexaria Bioscience Corp. Common Stock,$1.09,-0.03,-2.679%,"21,319,505"
SGRP,"SPAR Group, Inc. Common Stock",$0.8894,0.0094,1.068%,"21,301,122"
WKHS,"Workhorse Group, Inc. Common Stock",$0.888,0.0198,2.281%,"21,279,006"
TRSG,Tungray Technologies Inc Class A Ordinary Shares,$1.30,-0.03,-2.256%,"21,259,531"
JVA,"Coffee Holding Co., Inc. Common Stock",$3.72,0.05,1.362%,"21,235,988"
GDTC,CytoMed Therapeutics Limited Ordinary Shares,$1.84,-0.0607,-3.194%,"21,233,600"
EONR,EON Resources Inc. Class A Common Stock,$0.4249,-0.0039,-0.91%,"21,231,549"
KMRK,K-Tech Solutions Company Limited Class A Ordinary Shares,$1.0879,0.0279,2.632%,"21,214,050"
NYC,American Strategic Investment Co. Class A Common Stock,$7.90,0.40,5.333%,"21,116,250"
ALLR,"Allarity Therapeutics, Inc. Common Stock",$1.33,0.08,6.40%,"21,029,808"
GYRO,"Gyrodyne, LLC Common Stock",$9.50,-0.07,-0.731%,"20,893,426"
SBDS,"Solo Brands, Inc. Class A Common Stock",$8.4248,0.0248,0.295%,"20,852,669"
JOB,GEE Group Inc. Common Stock,$0.1902,0.0082,4.505%,"20,810,399"
SELX,Semilux International Ltd. Ordinary Shares,$0.555,0.005,0.909%,"20,772,736"
MRKR,"Marker Therapeutics, Inc. Common Stock",$1.24,0.02,1.639%,"20,674,677"
RMSG,Real Messenger Corporation Ordinary Shares,$2.15,0.08,3.865%,"20,578,254"
SNYR,Synergy CHC Corp. Common Stock,$2.14,-0.04,-1.835%,"20,444,927"
POAI,Predictive Oncology Inc. Common Stock,$6.005,0.105,1.78%,"20,378,064"
SATLW,Satellogic Inc. Warrant,$0.1501,0.0207,15.997%,"20,333,620"
VVOS,"Vivos Therapeutics, Inc. Common Stock",$2.26,0.02,0.893%,"20,313,120"
EHLD,Euroholdings Ltd. Common Stock ,$7.2047,0.0947,1.332%,"20,292,866"
MI,NFT Limited Class A Ordinary Share,$3.99,0.085,2.177%,"20,209,949"
NXL,"Nexalin Technology, Inc. Common Stock",$1.08,UNCH,--,"20,144,094"
SPCB,"SuperCom, Ltd. Ordinary Shares (Israel)",$9.27,-0.07,-0.749%,"20,142,366"
RVSN,Rail Vision Ltd. Ordinary Share,$0.3874,0.0169,4.561%,"20,140,224"
NINE,"Nine Energy Service, Inc. Common Stock",$0.4625,0.014,3.122%,"20,054,619"
OMH,Ohmyhome Limited Class A Ordinary Shares,$0.85,0.0576,7.269%,"20,051,762"
WNW,Meiwu Technology Company Limited Ordinary Shares,$1.28,-0.20,-13.514%,"20,023,492"
ARBEW,Arbe Robotics Ltd. Warrant,$0.1898,-0.0096,-4.814%,"19,959,973"
RENT,"Rent the Runway, Inc. Class A Common Stock",$4.87,-0.07,-1.417%,"19,952,541"
MDCXW,Medicus Pharma Ltd. Warrant,$0.9504,UNCH,--,"19,930,954"
RBOT,Vicarious Surgical Inc. Class A Common Stock,$3.01,0.32,11.896%,"19,710,272"
TXMD,"TherapeuticsMD, Inc. Common Stock",$1.70,0.05,3.03%,"19,676,415"
DLPN,"Dolphin Entertainment, Inc. Common Stock",$1.62,-0.01,-0.613%,"19,638,324"
CVKD,"Cadrenal Therapeutics, Inc. Common Stock",$9.3876,0.0076,0.081%,"19,487,203"
TRIB,Trinity Biotech plc American Depositary Shares,$1.045,0.0651,6.644%,"19,470,460"
CKX,"CKX Lands, Inc. Common Stock",$9.4752,0.0452,0.479%,"19,453,808"
SVREW,SaverOne 2014 Ltd. Warrant,$0.0153,-0.0047,-23.50%,"19,327,388"
ANGH,Anghami Inc. Ordinary Shares,$2.8712,0.0012,0.042%,"19,204,633"
ONEG,OneConstruction Group Limited Ordinary Shares,$1.20,0.07,6.195%,"19,200,000"
FBLG,"FibroBiologics, Inc. Common Stock",$0.274,0.0019,0.698%,"19,142,366"
WETO,Webus International Limited Ordinary Shares,$0.87,0.0097,1.128%,"19,140,000"
NSYS,Nortech Systems Incorporated Common Stock,$6.86,0.05,0.734%,"19,112,879"
LPCN,Lipocine Inc. Common Stock,$3.44,0.16,4.878%,"19,098,643"
OSRH,"OSR Holdings, Inc. Common Stock",$0.7439,0.0649,9.558%,"19,097,987"
NTCL,NETCLASS TECHNOLOGY INC Class A Ordinary Shares,$1.07,-0.1294,-10.789%,"19,078,100"
HUDI,"Huadi International Group Co., Ltd. Ordinary Shares",$1.335,0.045,3.488%,"19,062,708"
CTRM,Castor Maritime Inc. Common Shares,$1.9672,-0.0028,-0.142%,"19,007,783"
VIVK,"Vivakor, Inc. Common Stock",$0.1226,-0.0069,-5.328%,"18,879,946"
HOVRW,New Horizon Aircraft Ltd. Warrant,$0.4349,-0.0151,-3.356%,"18,855,172"
MTVA,MetaVia Inc. Common Stock,$0.778,0.0278,3.706%,"18,839,105"
BNGO,"Bionano Genomics, Inc. Common Stock",$1.85,0.04,2.21%,"18,825,600"
HOTH,"Hoth Therapeutics, Inc. Common Stock",$1.21,0.01,0.833%,"18,772,318"
EVOK,"Evoke Pharma, Inc. Common Stock",$10.88,0.04,0.369%,"18,739,810"
YYAI,AiRWA Inc. Common Stock,$0.9872,-0.0928,-8.593%,"18,738,363"
TBH,"Brag House Holdings, Inc. Common Stock",$0.9444,0.0051,0.543%,"18,698,261"
GFAI,"Guardforce AI Co., Limited Ordinary Shares",$0.888,0.118,15.325%,"18,668,893"
GTEC,Greenland Technologies Holding Corporation Ordinary Shares,$1.07,0.03,2.885%,"18,611,822"
SGBX,Safe & Green Holdings Corp. Common Stock,$3.26,-0.64,-16.41%,"18,544,689"
ABP,"Abpro Holdings, Inc Common Stock",$6.80,-0.01,-0.147%,"18,470,690"
OABIW,"OmniAb, Inc. Warrant",$0.1276,0.0296,30.204%,"18,368,709"
NCEL,NewcelX Ltd. Ordinary Shares,$4.01,0.18,4.70%,"18,279,096"
MXC,Mexco Energy Corporation Common Stock,$8.93,UNCH,--,"18,270,780"
BATL,Battalion Oil Corporation Common Stock,$1.11,-0.01,-0.893%,"18,266,785"
QNRX,"Quoin Pharmaceuticals, Ltd. American Depositary Shares",$21.75,1.03,4.971%,"18,247,750"
LSTA,"Lisata Therapeutics, Inc. Common Stock",$2.06,0.01,0.488%,"18,170,710"
LIQT,"LiqTech International, Inc. Common Stock",$1.88,-0.05,-2.591%,"18,098,880"
CGTL,Creative Global Technology Holdings Limited Class A Ordinary Shares,$0.8428,0.0078,0.934%,"18,067,525"
IQST,iQSTEL Inc. Common Stock,$4.19,0.10,2.445%,"18,014,381"
MTEX,"Mannatech, Incorporated Common Stock",$9.4171,-0.2829,-2.916%,"17,901,248"
ANY,Sphere 3D Corp. Common Shares,$0.5261,0.0192,3.788%,"17,744,914"
CRIS,"Curis, Inc. Common Stock",$1.37,0.12,9.60%,"17,712,529"
BNAI,Brand Engagement Network Inc. Common Stock,$0.3943,0.0163,4.312%,"17,696,497"
TMDE,TMD Energy Limited Ordinary Shares,$0.7497,0.0272,3.765%,"17,666,681"
EJH,E-Home Household Service Holdings Limited Ordinary Shares,$0.883,0.0498,5.977%,"17,663,407"
KZIA,Kazia Therapeutics Limited American Depositary Shares,$10.55,0.59,5.924%,"17,624,587"
LRE,"Lead Real Estate Co., Ltd American Depositary Shares",$1.29,0.07,5.738%,"17,598,051"
VSEE,"VSee Health, Inc. Common Stock",$0.56,0.02,3.704%,"17,555,103"
JBDI,JBDI Holdings Limited Ordinary Shares,$0.92,0.0992,12.086%,"17,506,739"
AKTX,Akari Therapeutics plc ADS,$0.4864,0.0404,9.058%,"17,383,805"
MWYN,"Marwynn Holdings, Inc. Common stock",$0.8607,0.0607,7.588%,"17,381,668"
KAPA,"Kairos Pharma, Ltd. Common Stock",$0.8337,0.0937,12.662%,"17,358,762"
ELWS,"Earlyworks Co., Ltd. American Depositary Shares",$5.66,0.55,10.763%,"17,266,226"
ROLR,"High Roller Technologies, Inc. Common Stock",$2.03,0.19,10.326%,"17,249,947"
FATBP,FAT Brands Inc. 8.25% Series B Cumulative Preferred Stock,$0.9605,-0.0495,-4.901%,"17,230,722"
AUID,authID Inc. Common Stock,$1.28,-0.03,-2.29%,"17,207,987"
ATHA,"Athira Pharma, Inc. Common Stock",$4.35,-0.17,-3.761%,"17,155,908"
ASTLW,Algoma Steel Group Inc. Warrant,$0.163,0.0138,9.249%,"17,104,210"
PLRZ,Polyrizon Ltd. Ordinary Shares,$3.21,0.078,2.49%,"17,103,946"
SYBX,"Synlogic, Inc. Common Stock",$1.46,-0.19,-11.515%,"17,080,422"
BCTX,BriaCell Therapeutics Corp. Common Shares,$9.73,-0.56,-5.442%,"17,077,211"
NISN,"NiSun International Enterprise Development Group Co., Ltd. Class A Common Shares",$3.55,-0.12,-3.27%,"17,034,171"
ADGM,"Adagio Medical Holdings, Inc Common Stock",$0.8021,-0.0379,-4.512%,"16,988,187"
ZCMD,Zhongchao Inc. Class A Ordinary Shares,$0.666,0.0199,3.08%,"16,909,009"
NTRBW,Nutriband Inc. Warrant,$1.40,UNCH,--,"16,848,836"
CCM,Concord Medical Services Holdings Limited American Depositary Shares (Each represents thirty (30) Class A ordinary shares),$3.87,-0.12,-3.008%,"16,802,468"
ENGS,Energys Group Limited Ordinary Shares,$1.17,-0.09,-7.143%,"16,716,796"
MNTS,Momentus Inc. Class A Common Stock,$0.6891,0.0138,2.044%,"16,640,843"
LEDS,SemiLEDS Corporation Common Stock,$2.02,-0.386,-16.043%,"16,609,254"
APLM,Apollomics Inc. Class A Ordinary Shares,$15.05,-0.19,-1.247%,"16,605,387"
VBIX,Viewbix Inc. Common Stock,$1.5546,0.0046,0.297%,"16,588,191"
GIGM,GigaMedia Limited Ordinary Shares,$1.50,-0.005,-0.332%,"16,578,353"
PMNT,Perfect Moment Ltd. Common Stock,$0.47,0.0099,2.152%,"16,554,309"
IPM,Intelligent Protection Management Corp. Common Stock ,$1.82,UNCH,--,"16,536,027"
IRIX,IRIDEX Corporation Common Stock,$0.96,0.0099,1.042%,"16,502,382"
ARBK,Argo Blockchain plc American Depositary Shares,$0.23,-0.0132,-5.428%,"16,496,758"
EDTK,Skillful Craftsman Education Technology Limited Ordinary Share,$1.03,UNCH,--,"16,407,335"
FIEE,"FiEE, Inc Common Stock",$2.605,0.145,5.894%,"16,400,978"
WVVIP,"Willamette Valley Vineyards, Inc. Series A Redeemable Preferred Stock",$3.295,0.005,0.152%,"16,358,123"
MMA,Mixed Martial Arts Group Limited Ordinary Shares,$1.25,-0.09,-6.716%,"16,301,511"
HCTI,"Healthcare Triangle, Inc. Common Stock",$2.24,-0.11,-4.681%,"16,265,411"
PULM,"Pulmatrix, Inc. Common Stock",$4.45,-0.04,-0.891%,"16,252,668"
INTJ,Intelligent Group Limited Class A Ordinary Shares ,$0.5284,0.0483,10.06%,"16,248,300"
MSGM,Motorsport Games Inc. Class A Common Stock,$2.79,-0.04,-1.413%,"16,121,876"
MRM,MEDIROM Healthcare Technologies Inc. American Depositary Share,$2.03,0.035,1.754%,"16,040,959"
SNGX,"Soligenix, Inc. Common Stock",$1.59,0.12,8.163%,"16,036,947"
SINT,"SiNtx Technologies, Inc. Common Stock",$4.15,0.265,6.821%,"15,985,617"
TOMZ,"TOMI Environmental Solutions, Inc. Common Stock",$0.79,-0.04,-4.819%,"15,977,912"
DLXY,Delixy Holdings Limited Ordinary Shares,$0.9738,0.0638,7.011%,"15,921,630"
NXPL,NextPlat Corp Common Stock,$0.6037,-0.0183,-2.942%,"15,880,321"
AURE,Aurelion Inc. Class A Ordinary Shares,$0.4996,0.0026,0.523%,"15,808,323"
CASI,"CASI Pharmaceuticals, Inc. Ordinary Shares",$1.02,0.01,0.99%,"15,802,535"
SLAI,SOLAI Limited American Depositary Shares (each representing one hundred (100) Class A Ordinary Shares),$1.48,0.02,1.37%,"15,769,604"
TPST,"Tempest Therapeutics, Inc. Common Stock",$3.20,-0.01,-0.312%,"15,766,915"
ELSE,"Electro-Sensors, Inc. Common Stock",$4.53,-0.08,-1.735%,"15,766,760"
AGAE,Allied Gaming & Entertainment Inc. Common Stock,$0.4114,0.0114,2.85%,"15,639,137"
PT,Pintec Technology Holdings Limited American Depositary Shares,$0.98,0.02,2.083%,"15,629,001"
NCRA,"Nocera, Inc. Common Stock",$1.0861,-0.0139,-1.264%,"15,611,185"
VWAVW,"VisionWave Holdings, Inc. Warrant",$1.075,0.045,4.369%,"15,610,175"
DFLIW,Dragonfly Energy Holdings Corp. Warrant,$0.1292,0.0232,21.887%,"15,605,687"
MGRX,"Mangoceuticals, Inc. Common Stock",$1.11,0.04,3.738%,"15,436,293"
USEA,United Maritime Corporation Common Stock,$1.74,0.06,3.571%,"15,389,025"
BCDA,"BioCardia, Inc. Common Stock",$1.45,0.02,1.399%,"15,388,464"
RYDE,Ryde Group Ltd. Class A Ordinary Shares,$0.5251,0.0051,0.981%,"15,380,088"
WFF,WF Holding Limited Ordinary Shares,$0.613,0.0034,0.558%,"15,294,350"
CLRB,"Cellectar Biosciences, Inc.  Common Stock",$3.59,0.14,4.058%,"15,222,081"
MCTR,CTRL Group Limited Ordinary Shares,$0.9936,0.0033,0.333%,"15,202,080"
SNES,"SenesTech, Inc. Common Stock",$2.91,0.10,3.559%,"15,198,974"
MGIH,Millennium Group International Holdings Limited Ordinary Shares,$1.35,0.02,1.504%,"15,187,500"
LSH,Lakeside Holding Limited Common Stock,$0.8691,-0.0439,-4.808%,"15,146,292"
MDRR,"Medalist Diversified REIT, Inc. Common Stock",$13.58,-0.3993,-2.856%,"15,106,460"
WIMI,WiMi Hologram Cloud Inc. Class B Ordinary Shares,$3.06,0.15,5.155%,"15,025,833"
CWD,CaliberCos Inc. Class A Common Stock,$2.30,0.03,1.322%,"14,966,997"
QCLS,"Q/C Technologies, Inc. Common Stock",$3.58,-0.03,-0.831%,"14,917,001"
CENN,Cenntro Inc. Common Stock,$0.1676,0.0014,0.842%,"14,734,190"
ELPW,Elong Power Holding Limited Class A Ordinary Shares,$0.2189,0.0043,2.004%,"14,678,580"
PCSA,"Processa Pharmaceuticals, Inc. Common Stock",$0.259,0.0076,3.023%,"14,670,854"
NXGL,"NexGel, Inc Common Stock",$1.80,-0.02,-1.099%,"14,657,639"
COCP,"Cocrystal Pharma, Inc. Common Stock",$1.06,0.05,4.95%,"14,611,109"
LVLU,"Lulu's Fashion Lounge Holdings, Inc. Common Stock",$5.23,-0.13,-2.425%,"14,496,755"
TOIIW,"The Oncology Institute, Inc. Warrant",$0.147,0.0003,0.204%,"14,462,057"
FMSTW,Foremost Clean Energy Ltd. Warrant,$1.00,0.0108,1.092%,"14,435,380"
TURB,"Turbo Energy, S.A. American Depositary Shares",$1.31,-0.13,-9.028%,"14,432,453"
SBCWW,SBC Medical Group Holdings Incorporated Warrants,$0.14,0.023,19.658%,"14,360,772"
AIRI,Air Industries Group Common Stock,$2.99,0.04,1.356%,"14,279,573"
ALUR,"Allurion Technologies, Inc. Common Stock",$1.54,-0.07,-4.348%,"14,264,382"
LGVN,Longeveron Inc. Class A Common Stock,$0.6637,0.0162,2.502%,"14,158,633"
CABR,"Caring Brands, Inc. Common Stock",$1.03,-0.01,-0.962%,"14,149,033"
AMS,American Shared Hospital Services Common Stock,$2.14,0.03,1.422%,"14,002,020"
FGI,FGI Industries Ltd. Ordinary Shares,$7.28,0.50,7.375%,"13,978,619"
CUPR,Cuprina Holdings (Cayman) Limited Class A Ordinary Shares,$0.6618,0.0096,1.472%,"13,897,800"
MBRX,"Moleculin Biotech, Inc. Common Stock",$0.2727,-0.0073,-2.607%,"13,883,287"
YHC,LQR House Inc. Common Stock,$0.98,0.1385,16.459%,"13,833,912"
CURX,Curanex Pharmaceuticals Inc Common Stock,$0.4873,0.0135,2.849%,"13,810,478"
YHGJ,Yunhong Green CTI Ltd. Common Stock,$4.915,0.065,1.34%,"13,633,537"
GTIM,Good Times Restaurants Inc. Common Stock,$1.29,0.03,2.381%,"13,608,865"
WATT,Energous Corporation Common Stock,$6.255,0.175,2.878%,"13,605,482"
TGHL,The GrowHub Limited Class A Ordinary Shares,$0.5377,0.0037,0.693%,"13,603,708"
CMMB,Chemomab Therapeutics Ltd. American Depositary Share,$2.62,0.09,3.557%,"13,600,619"
EEIQ,EpicQuest Education Group International Limited Common Stock,$0.3238,0.0172,5.61%,"13,486,300"
AIXC,"AIxCrypto Holdings, Inc. Common Stock",$2.60,0.05,1.961%,"13,416,996"
MDAIW,"Spectral AI, Inc. Warrants",$0.437,0.0002,0.046%,"13,411,047"
PSIG,PS International Group Ltd. Ordinary Shares,$4.07,-0.0253,-0.618%,"13,393,829"
DAVEW,Dave Inc. Warrants,$0.99,0.025,2.591%,"13,369,041"
RVYL,Ryvyl Inc. Common Stock,$0.37,0.04,12.121%,"13,351,812"
LBGJ,Li Bang International Corporation Inc. Class A Ordinary Shares,$0.7109,0.01,1.427%,"13,327,953"
CJET,"Chijet Motor Company, Inc. Class A Ordinary Shares",$1.15,-0.04,-3.361%,"13,263,860"
EFOI,"Energy Focus, Inc. Common Stock",$2.31,-0.07,-2.941%,"13,258,049"
WVVI,"Willamette Valley Vineyards, Inc. Common Stock",$2.67,-0.03,-1.111%,"13,255,292"
CXAI,CXApp Inc. Class A Common Stock,$0.462,0.001,0.217%,"13,226,744"
DDC,DDC Enterprise Limited Class A Ordinary Shares,$3.26,-0.39,-10.685%,"13,203,486"
ABTS,Abits Group Inc Ordinary Shares,$5.57,-0.28,-4.786%,"13,201,674"
RMCF,"Rocky Mountain Chocolate Factory, Inc. Common Stock",$1.69,UNCH,--,"13,182,859"
MIMI,Mint Incorporation Limited Class A Ordinary Shares,$0.5264,0.0074,1.426%,"13,166,580"
SMSI,"Smith Micro Software, Inc. Common Stock",$0.606,0.0039,0.648%,"13,080,941"
GRNQ,Greenpro Capital Corp. Common Stock,$1.56,-0.16,-9.302%,"13,066,268"
BLRX,BioLineRx Ltd. American Depositary Shares,$3.47,0.025,0.726%,"12,911,880"
SAIH,SAIHEAT Limited Class A Ordinary Shares,$7.3419,0.0819,1.128%,"12,869,984"
HCAI,"Huachen AI Parking Management Technology Holding Co., Ltd. Class A Ordinary Shares",$0.3795,0.0139,3.802%,"12,802,433"
BRN,"Barnwell Industries, Inc. Common Stock",$1.27,0.12,10.435%,"12,793,388"
GLBZ,Glen Burnie Bancorp Common Stock,$4.375,0.055,1.273%,"12,773,666"
VYNE,VYNE Therapeutics Inc. Common Stock,$0.3854,0.0094,2.50%,"12,735,011"
RDZNW,"Roadzen, Inc. Warrants",$0.1602,0.0002,0.125%,"12,687,050"
IMNN,"Imunon, Inc. Common Stock",$4.12,0.26,6.736%,"12,649,858"
MVO,MV Oil Trust Units of Beneficial Interests,$1.09,0.01,0.926%,"12,535,000"
OFAL,OFA Group Ordinary Shares,$0.90,0.1246,16.069%,"12,531,250"
SPPL,SIMPPLE LTD. Ordinary Shares,$3.53,-0.32,-8.312%,"12,495,459"
YMAT,"J-Star Holding Co., Ltd. Ordinary Shares",$0.7325,-0.0375,-4.87%,"12,461,940"
EKSO,"Ekso Bionics Holdings, Inc. Common Stock",$4.73,0.26,5.817%,"12,407,892"
ZSPC,"zSpace, Inc. Common stock",$0.4251,0.036,9.252%,"12,349,183"
EDSA,"Edesa Biotech, Inc. Common Shares",$1.75,0.04,2.339%,"12,315,884"
ANNAW,"AleAnna, Inc. Warrant",$0.1846,-0.0054,-2.842%,"12,304,380"
FLDDW,"Fold Holdings, Inc. Warrant",$0.25,0.0325,14.943%,"12,290,264"
DTCK,Davis Commodities Limited Class A Ordinary Shares,$0.501,0.021,4.375%,"12,274,813"
GOVX,"GeoVax Labs, Inc. Common Stock",$0.4111,0.0111,2.775%,"12,211,873"
PRHI,"Presurance Holdings, Inc. Common Stock",$0.995,0.0938,10.408%,"12,161,767"
