Symbol,Name,Last Sale,Net Change,% Change,Market Cap
NVDA,NVIDIA Corporation Common Stock,$184.97,-0.58,-0.313%,"4,494,771,000,000"
AAPL,Apple Inc. Common Stock,$277.18,-0.71,-0.255%,"4,095,709,524,540"
GOOG,Alphabet Inc. Class C Capital Stock,$317.75,3.30,1.049%,"3,834,289,250,000"
GOOGL,Alphabet Inc. Class A Common Stock,$317.08,3.36,1.071%,"3,826,204,360,000"
MSFT,Microsoft Corporation Common Stock,$492.02,1.00,0.204%,"3,656,878,453,813"
AMZN,"Amazon.com, Inc. Common Stock",$227.92,1.03,0.454%,"2,436,514,033,227"
AVGO,Broadcom Inc. Common Stock,$406.29,5.19,1.294%,"1,918,649,684,788"
META,"Meta Platforms, Inc. Class A Common Stock",$656.96,-9.84,-1.476%,"1,655,885,810,125"
TSM,Taiwan Semiconductor Manufacturing Company Ltd.,$303.41,1.54,0.51%,"1,573,650,118,470"
TSLA,"Tesla, Inc. Common Stock",$445.17,5.59,1.272%,"1,480,554,918,573"
BRK/B,Berkshire Hathaway Inc.,$491.43,-5.80,-1.166%,"1,084,247,597,051"
BRK/A,Berkshire Hathaway Inc.,"$736,300.00","-8,820.00",-1.184%,"1,083,004,526,200"
LLY,Eli Lilly and Company Common Stock,$982.22,-15.37,-1.541%,"928,574,833,801"
WMT,Walmart Inc. Common Stock,$115.06,1.50,1.321%,"917,047,410,878"
JPM,JP Morgan Chase & Co. Common Stock,$300.51,-14.70,-4.664%,"818,067,042,270"
ORCL,Oracle Corporation Common Stock,$221.53,0.99,0.449%,"629,524,902,420"
V,Visa Inc.,$326.50,-0.34,-0.104%,"628,749,250,701"
XOM,Exxon Mobil Corporation Common Stock,$118.25,2.27,1.957%,"498,679,833,856"
MA,Mastercard Incorporated Common Stock,$537.55,-2.89,-0.535%,"482,717,668,092"
JNJ,Johnson & Johnson Common Stock,$199.96,-1.66,-0.823%,"481,762,648,596"
ASML,ASML Holding N.V. New York Registry Shares,"$1,111.44",-8.25,-0.737%,"437,111,257,757"
PLTR,Palantir Technologies Inc. Class A Common Stock,$181.84,0.35,0.193%,"433,404,063,702"
NFLX,"Netflix, Inc. Common Stock",$96.71,-0.08,-0.083%,"409,791,540,211"
ABBV,AbbVie Inc. Common Stock,$222.99,-0.13,-0.058%,"394,109,099,090"
COST,Costco Wholesale Corporation Common Stock,$888.44,0.92,0.104%,"393,738,107,125"
BAC,Bank of America Corporation Common Stock,$53.54,-0.36,-0.668%,"390,975,611,747"
AMD,"Advanced Micro Devices, Inc. Common Stock",$221.62,0.51,0.231%,"360,806,566,095"
BABA,Alibaba Group Holding Limited American Depositary Shares each representing eight Ordinary share,$155.96,-2.17,-1.372%,"360,155,225,205"
HD,"Home Depot, Inc. (The) Common Stock",$345.27,-4.64,-1.326%,"343,720,250,426"
PG,Procter & Gamble Company (The) Common Stock,$139.63,1.29,0.932%,"326,278,105,447"
CSCO,"Cisco Systems, Inc. Common Stock (DE)",$79.51,0.65,0.824%,"314,151,528,704"
KO,Coca-Cola Company (The) Common Stock,$70.09,-0.16,-0.228%,"301,499,763,946"
GE,GE Aerospace Common Stock,$285.31,-1.88,-0.655%,"300,948,956,947"
SAP,SAP  SE ADS,$244.13,1.15,0.473%,"299,914,738,158"
CVX,Chevron Corporation Common Stock,$148.49,-0.22,-0.148%,"298,987,821,939"
UNH,UnitedHealth Group Incorporated Common Stock (DE),$323.60,-0.02,-0.006%,"293,129,377,432"
IBM,International Business Machines Corporation Common Stock,$310.48,1.30,0.42%,"290,216,586,759"
MS,Morgan Stanley Common Stock,$178.83,2.00,1.131%,"284,216,184,086"
MU,"Micron Technology, Inc. Common Stock",$252.42,5.50,2.227%,"283,332,876,555"
WFC,Wells Fargo & Company Common Stock,$88.89,-1.17,-1.299%,"279,033,224,938"
AZN,AstraZeneca PLC American Depositary Shares,$89.82,-1.46,-1.599%,"278,572,395,107"
CAT,"Caterpillar, Inc. Common Stock",$594.36,-2.14,-0.359%,"278,148,352,679"
GS,"Goldman Sachs Group, Inc. (The) Common Stock",$876.58,9.89,1.141%,"262,911,334,172"
NVS,Novartis AG Common Stock,$131.01,0.84,0.645%,"258,756,442,380"
TM,Toyota Motor Corporation Common Stock,$196.34,1.13,0.579%,"256,202,687,104"
AXP,American Express Company Common Stock,$363.91,1.63,0.45%,"250,680,005,043"
APP,Applovin Corporation Class A Common Stock,$724.62,34.86,5.054%,"244,888,952,100"
CRM,"Salesforce, Inc. Common Stock",$261.02,1.49,0.574%,"244,575,740,000"
HSBC,"HSBC Holdings, plc. Common Stock",$70.79,-0.23,-0.324%,"243,167,045,938"
MRK,"Merck & Company, Inc. Common Stock (new)",$96.89,-2.04,-2.062%,"240,483,163,513"
PM,Philip Morris International Inc Common Stock,$150.37,2.08,1.403%,"234,071,768,687"
RTX,RTX Corporation Common Stock,$171.93,0.41,0.239%,"230,518,919,988"
CCZ,Comcast Holdings ZONES,$62.75,UNCH,--,"228,654,380,189"
RY,Royal Bank Of Canada Common Stock,$163.20,-0.19,-0.116%,"228,514,596,278"
TMUS,"T-Mobile US, Inc. Common Stock",$201.35,-3.09,-1.511%,"225,211,309,145"
MCD,McDonald's Corporation Common Stock,$310.79,1.00,0.323%,"221,330,450,437"
AMAT,"Applied Materials, Inc. Common Stock",$267.14,-1.02,-0.38%,"212,815,057,949"
TMO,Thermo Fisher Scientific Inc Common Stock,$563.07,-5.14,-0.905%,"211,549,936,781"
ABT,Abbott Laboratories Common Stock,$121.25,-0.84,-0.688%,"210,838,223,574"
SHEL,Shell PLC American Depositary Shares (each representing two (2) Ordinary Shares) ,$72.55,-0.15,-0.206%,"210,809,712,051"
LRCX,Lam Research Corporation Common Stock,$165.81,3.07,1.886%,"208,262,334,300"
SHOP,Shopify Inc. Class A Subordinate Voting Shares,$159.89,1.48,0.934%,"208,061,827,404"
NVO,Novo Nordisk A/S Common Stock,$46.36,-0.41,-0.877%,"206,997,400,000"
ISRG,"Intuitive Surgical, Inc. Common Stock",$558.13,-8.76,-1.545%,"197,854,893,223"
PEP,"PepsiCo, Inc. Common Stock",$144.64,-0.99,-0.68%,"197,772,075,246"
C,"Citigroup, Inc. Common Stock",$109.43,0.51,0.468%,"195,799,395,779"
DIS,Walt Disney Company (The) Common Stock,$107.02,-0.61,-0.567%,"191,061,612,299"
QCOM,QUALCOMM Incorporated Common Stock,$176.00,0.69,0.394%,"188,496,000,000"
MUFG,"Mitsubishi UFJ Financial Group, Inc. Common Stock",$15.61,-0.31,-1.947%,"188,376,967,461"
UBER,"Uber Technologies, Inc. Common Stock",$89.07,-3.50,-3.781%,"185,072,352,036"
INTU,Intuit Inc. Common Stock,$655.75,-0.49,-0.075%,"182,560,800,000"
LIN,Linde plc Ordinary Shares,$390.38,1.00,0.257%,"182,287,523,293"
HDB,HDFC Bank Limited Common Stock,$35.17,0.01,0.028%,"180,000,992,251"
NOW,"ServiceNow, Inc. Common Stock",$854.91,1.39,0.163%,"177,821,280,000"
ACN,Accenture plc Class A Ordinary Shares (Ireland),$269.53,3.03,1.137%,"177,397,031,238"
INTC,Intel Corporation Common Stock,$40.50,0.20,0.496%,"177,268,500,000"
T,AT&T Inc.,$24.51,-0.33,-1.329%,"173,762,407,122"
TJX,"TJX Companies, Inc. (The) Common Stock",$153.68,-0.04,-0.026%,"170,656,583,160"
GEV,GE Vernova Inc. Common Stock,$625.30,3.40,0.547%,"169,656,683,013"
APH,Amphenol Corporation Common Stock,$138.58,-1.48,-1.057%,"169,629,612,299"
VZ,Verizon Communications Inc. Common Stock,$40.14,-1.16,-2.809%,"169,247,319,128"
AMGN,Amgen Inc. Common Stock,$313.85,-7.38,-2.297%,"169,002,158,593"
BKNG,Booking Holdings Inc. Common Stock,"$5,195.76",18.37,0.355%,"167,479,166,624"
SCHW,Charles Schwab Corporation (The) Common Stock,$94.16,-0.12,-0.127%,"167,316,366,263"
PDD,PDD Holdings Inc. American Depositary Shares,$117.14,-0.48,-0.408%,"166,297,386,559"
BLK,"BlackRock, Inc. Common Stock","$1,071.31",9.29,0.875%,"166,214,720,321"
SONY,Sony Group Corporation American Depositary Shares ,$27.56,0.01,0.036%,"166,049,063,250"
NEE,"NextEra Energy, Inc. Common Stock",$79.64,-0.91,-1.13%,"165,859,035,234"
ANET,"Arista Networks, Inc. Common Stock",$130.04,0.93,0.72%,"163,757,430,503"
TXN,Texas Instruments Incorporated Common Stock,$179.52,-1.42,-0.785%,"163,116,004,550"
SAN,"Banco Santander, S.A. Sponsored ADR (Spain)",$11.01,UNCH,--,"162,058,650,030"
KLAC,KLA Corporation Common Stock,"$1,225.61",1.02,0.083%,"161,035,763,376"
TBB,AT&T Inc. 5.350% Global Notes due 2066,$22.30,0.09,0.405%,"159,453,596,204"
DHR,Danaher Corporation Common Stock,$223.23,-1.25,-0.557%,"157,678,412,948"
UL,Unilever PLC American Depositary Shares (each representing One Ordinary Share),$64.04,8.74,15.805%,"157,020,861,637"
BA,Boeing Company (The) Common Stock,$200.37,-5.90,-2.86%,"152,300,328,923"
TD,Toronto Dominion Bank (The) Common Stock,$89.14,1.01,1.146%,"152,180,164,560"
ARM,Arm Holdings plc American Depositary Shares,$141.93,2.15,1.538%,"150,341,339,378"
BHP,BHP Group Limited American Depositary Shares (Each representing two Ordinary Shares),$59.01,0.67,1.148%,"149,853,333,258"
SPGI,S&P Global Inc. Common Stock,$490.73,-1.37,-0.278%,"148,593,044,000"
GILD,"Gilead Sciences, Inc. Common Stock",$119.36,-1.83,-1.51%,"148,087,519,801"
COF,Capital One Financial Corporation Common Stock,$230.81,0.22,0.095%,"146,733,673,370"
ADBE,Adobe Inc. Common Stock,$344.32,5.20,1.533%,"144,132,352,000"
PFE,"Pfizer, Inc. Common Stock",$25.33,-0.44,-1.707%,"144,018,972,292"
TTE,TotalEnergies SE Ordinary Shares,$65.54,-0.14,-0.213%,"142,999,222,634"
UNP,Union Pacific Corporation Common Stock,$231.56,-3.88,-1.648%,"137,352,335,457"
BSX,Boston Scientific Corporation Common Stock,$92.53,-1.31,-1.396%,"137,170,361,869"
LOW,"Lowe's Companies, Inc. Common Stock",$242.67,-2.15,-0.878%,"136,126,090,070"
PANW,"Palo Alto Networks, Inc. Common Stock",$195.00,-0.35,-0.179%,"135,915,000,000"
ADI,"Analog Devices, Inc. Common Stock",$276.24,-2.89,-1.035%,"135,262,047,755"
WELL,Welltower Inc. Common Stock,$195.80,-5.08,-2.529%,"134,383,030,819"
SYK,Stryker Corporation Common Stock,$349.23,-4.37,-1.236%,"133,553,810,591"
ETN,"Eaton Corporation, PLC Ordinary Shares",$341.76,-1.63,-0.475%,"132,739,584,000"
PGR,Progressive Corporation (The) Common Stock,$226.35,3.19,1.429%,"132,731,014,369"
UBS,UBS Group AG Registered Ordinary Shares,$41.29,0.28,0.683%,"131,088,534,614"
CRWD,"CrowdStrike Holdings, Inc. Class A Common Stock",$517.98,2.79,0.542%,"130,581,949,951"
MDT,Medtronic plc. Ordinary Shares,$99.62,-1.64,-1.62%,"127,714,255,401"
BBVA,Banco Bilbao Vizcaya Argentaria S.A. Common Stock,$21.89,0.05,0.229%,"126,158,318,829"
DE,Deere & Company Common Stock,$462.86,-3.49,-0.748%,"125,124,662,381"
BTI,"British American Tobacco  Industries, p.l.c. Common Stock ADR",$57.29,-0.12,-0.209%,"124,997,904,289"
HOOD,"Robinhood Markets, Inc. Class A Common Stock",$135.71,-0.72,-0.528%,"122,028,921,412"
KKR,KKR & Co. Inc. Common Stock,$135.78,5.54,4.254%,"121,027,966,010"
SMFG,Sumitomo Mitsui Financial Group Inc Unsponsored American Depositary Shares (Japan),$18.66,-0.12,-0.639%,"120,806,253,738"
HON,Honeywell International Inc. Common Stock,$190.17,-1.82,-0.948%,"120,736,500,345"
SPOT,Spotify Technology S.A. Ordinary Shares,$589.67,17.32,3.026%,"120,200,932,655"
CB,Chubb Limited  Common Stock,$301.22,3.99,1.342%,"118,545,389,748"
PLD,"Prologis, Inc. Common Stock",$127.45,0.78,0.616%,"118,384,099,150"
SNY,Sanofi ADS,$47.83,-0.61,-1.259%,"117,447,165,171"
COP,ConocoPhillips Common Stock,$93.43,0.55,0.592%,"115,453,156,098"
BX,Blackstone Inc. Common Stock,$156.02,4.65,3.072%,"115,213,104,893"
SCCO,Southern Copper Corporation Common Stock,$140.40,-0.64,-0.454%,"114,031,732,932"
CEG,Constellation Energy Corporation Common Stock ,$359.15,1.48,0.414%,"112,158,982,232"
HCA,"HCA Healthcare, Inc. Common Stock",$488.50,3.35,0.691%,"111,472,720,150"
VRTX,Vertex Pharmaceuticals Incorporated Common Stock,$437.01,-5.03,-1.138%,"110,877,666,335"
PH,Parker-Hannifin Corporation Common Stock,$862.93,-16.74,-1.903%,"108,890,288,168"
BUD,Anheuser-Busch Inbev SA Sponsored ADR (Belgium),$60.44,-0.07,-0.116%,"108,622,678,730"
IBN,ICICI Bank Limited Common Stock,$30.37,0.01,0.033%,"108,353,167,490"
LMT,Lockheed Martin Corporation Common Stock,$466.89,1.51,0.324%,"108,037,316,974"
MELI,"MercadoLibre, Inc. Common Stock","$2,074.48",-13.88,-0.665%,"105,170,290,115"
BN,Brookfield Corporation Class A Limited Voting Shares,$46.70,0.26,0.56%,"104,857,240,562"
ADP,"Automatic Data Processing, Inc. Common Stock",$258.23,-0.46,-0.178%,"104,440,799,163"
ENB,Enbridge Inc Common Stock,$47.54,-0.65,-1.349%,"103,697,842,642"
BMY,Bristol-Myers Squibb Company Common Stock,$50.65,-1.02,-1.974%,"103,110,890,818"
NEM,Newmont Corporation,$94.09,5.09,5.719%,"102,676,933,882"
CVS,CVS Health Corporation Common Stock,$78.24,1.71,2.234%,"99,320,397,626"
CVNA,Carvana Co. Class A Common Stock,$456.33,8.35,1.864%,"99,271,243,863"
DASH,"DoorDash, Inc. Class A Common Stock",$229.99,4.56,2.023%,"99,125,349,385"
MCK,McKesson Corporation Common Stock,$795.01,-2.92,-0.366%,"98,125,421,017"
MO,"Altria Group, Inc.",$58.18,0.07,0.12%,"97,665,110,895"
CMCSA,Comcast Corporation Class A Common Stock,$26.79,0.14,0.525%,"97,619,933,789"
CME,CME Group Inc. Class A Common Stock,$270.12,-0.30,-0.111%,"97,404,366,288"
GSK,GSK plc American Depositary Shares (Each representing two Ordinary Shares),$47.27,-1.20,-2.476%,"96,403,031,428"
SO,Southern Company (The) Common Stock,$85.49,-0.07,-0.082%,"94,133,453,028"
NKE,"Nike, Inc. Common Stock",$63.33,-0.21,-0.331%,"93,614,492,319"
SBUX,Starbucks Corporation Common Stock,$82.28,-1.13,-1.355%,"93,560,588,000"
RIO,Rio Tinto Plc Common Stock,$74.40,1.38,1.89%,"93,319,349,054"
DELL,Dell Technologies Inc. Class C Common Stock ,$138.22,-2.19,-1.56%,"92,935,416,655"
BP,BP p.l.c. Common Stock,$35.55,-0.23,-0.643%,"92,740,011,820"
MFG,"Mizuho Financial Group, Inc. Sponosred ADR (Japan)",$7.26,-0.02,-0.275%,"91,216,332,669"
CDNS,"Cadence Design Systems, Inc. Common Stock",$335.07,-2.22,-0.658%,"91,206,389,070"
RACE,Ferrari N.V. Common Shares,$375.35,-7.63,-1.992%,"90,976,283,521"
GD,General Dynamics Corporation Common Stock,$334.27,-1.74,-0.518%,"90,293,160,147"
ICE,Intercontinental Exchange Inc. Common Stock,$158.01,0.98,0.624%,"90,093,918,216"
BMO,Bank Of Montreal Common Stock,$126.50,-0.07,-0.055%,"89,676,568,394"
DUK,Duke Energy Corporation (Holding Company) Common Stock,$115.24,0.02,0.017%,"89,617,679,454"
BNS,Bank Nova Scotia Halifax Pfd 3 Ordinary Shares,$72.13,0.43,0.60%,"89,555,165,400"
MMC,"Marsh & McLennan Companies, Inc. Common Stock",$181.26,-0.34,-0.187%,"88,801,029,141"
TT,Trane Technologies plc,$399.00,1.73,0.435%,"88,473,862,596"
BAM,Brookfield Asset Management Inc Class A Limited Voting Shares,$54.45,1.26,2.369%,"87,704,789,624"
MMM,3M Company Common Stock,$165.09,1.13,0.689%,"87,699,943,174"
MCO,Moody's Corporation Common Stock,$486.37,-0.76,-0.156%,"86,768,408,000"
NTES,"NetEase, Inc. American Depositary Shares",$136.76,-0.10,-0.073%,"86,596,197,320"
SNPS,"Synopsys, Inc. Common Stock",$465.85,0.10,0.021%,"86,531,019,317"
WM,"Waste Management, Inc. Common Stock",$209.31,-0.92,-0.438%,"84,324,102,445"
AMT,American Tower Corporation (REIT) Common Stock,$179.55,-3.65,-1.992%,"84,055,726,160"
CM,Canadian Imperial Bank of Commerce Common Stock,$90.49,0.27,0.299%,"83,747,774,338"
ING,"ING Group, N.V. Common Stock",$26.59,UNCH,--,"83,689,131,290"
AEM,Agnico Eagle Mines Limited Common Stock,$166.28,1.56,0.947%,"83,591,353,758"
APO,"Apollo Global Management, Inc. (New) Common Stock",$143.89,6.51,4.739%,"83,517,004,029"
CRH,CRH PLC Ordinary Shares,$123.69,-2.85,-2.252%,"82,790,594,344"
NVAWW,Nova Minerals Limited Warrant,$40.98,UNCH,--,"82,398,878,793"
UPS,"United Parcel Service, Inc. Common Stock",$96.97,1.42,1.486%,"82,267,951,535"
BK,The Bank of New York Mellon Corporation Common Stock,$115.93,1.49,1.302%,"80,843,683,945"
BCS,Barclays PLC Common Stock,$23.14,-0.12,-0.516%,"80,446,743,053"
NU,Nu Holdings Ltd. Class A Ordinary Shares,$16.68,0.06,0.361%,"80,375,226,115"
USB,U.S. Bancorp Common Stock,$51.57,0.16,0.311%,"80,162,164,835"
SHW,Sherwin-Williams Company (The) Common Stock,$321.14,-5.99,-1.831%,"79,608,522,765"
ORLY,"O'Reilly Automotive, Inc. Common Stock",$94.25,-3.86,-3.934%,"79,556,810,671"
PBR,Petroleo Brasileiro S.A. Petrobras ADS,$12.32,0.08,0.654%,"79,394,593,814"
PNC,"PNC Financial Services Group, Inc. (The) Common Stock",$202.15,4.50,2.277%,"79,274,830,870"
NOC,Northrop Grumman Corporation Common Stock,$550.63,-2.93,-0.529%,"78,585,950,492"
GLW,Corning Incorporated Common Stock,$91.11,2.84,3.217%,"78,114,105,680"
ABNB,"Airbnb, Inc. Class A Common Stock",$125.39,3.38,2.77%,"77,183,783,905"
HWM,Howmet Aerospace Inc. Common Stock,$191.36,-2.28,-1.177%,"76,938,634,456"
SNOW,Snowflake Inc. Common Stock,$222.60,-2.71,-1.203%,"76,173,720,000"
SE,"Sea Limited American Depositary Shares, each representing one Class A Ordinary Share",$128.66,0.38,0.296%,"76,169,284,708"
MAR,Marriott International Class A Common Stock,$283.84,-3.98,-1.383%,"76,168,973,493"
EMR,Emerson Electric Company Common Stock,$135.25,-0.68,-0.50%,"75,983,450,000"
MRVL,"Marvell Technology, Inc. Common Stock",$88.90,-3.10,-3.37%,"75,396,090,000"
WMB,"Williams Companies, Inc. (The) Common Stock",$61.55,-0.40,-0.646%,"75,166,021,264"
COIN,"Coinbase Global, Inc. Class A Common Stock",$277.36,3.16,1.152%,"74,788,408,251"
AON,Aon plc Class A Ordinary Shares (Ireland),$346.19,2.80,0.815%,"74,408,439,390"
SATA,"Strive, Inc. Variable Rate Series A Perpetual Preferred Stock",$91.15,0.08,0.088%,"74,331,331,052"
NGG,"National Grid Transco, PLC National Grid PLC (NEW) American Depositary Shares",$74.89,-0.44,-0.584%,"74,314,019,288"
ITUB,Itau Unibanco Banco Holding SA American Depositary Shares (Each repstg 500 Preferred shares),$7.60,0.03,0.396%,"74,298,394,314"
TDG,Transdigm Group Incorporated Common Stock,"$1,318.02",-29.15,-2.164%,"74,229,020,084"
LYG,Lloyds Banking Group Plc American Depositary Shares,$4.99,-0.09,-1.772%,"73,956,859,431"
INFY,Infosys Limited American Depositary Shares,$17.75,0.03,0.169%,"73,737,286,324"
CTAS,Cintas Corporation Common Stock,$183.15,0.17,0.093%,"73,601,882,076"
ELV,"Elevance Health, Inc. Common Stock",$329.81,-0.80,-0.242%,"73,296,566,425"
NET,"Cloudflare, Inc. Class A Common Stock",$208.93,3.07,1.491%,"73,184,243,803"
REGN,"Regeneron Pharmaceuticals, Inc. Common Stock",$692.58,-10.68,-1.519%,"72,789,786,777"
EQIX,"Equinix, Inc. Common Stock REIT",$740.67,0.74,0.10%,"72,723,482,392"
DB,Deutsche Bank AG Common Stock,$37.15,0.52,1.42%,"72,261,421,798"
RELX,RELX PLC PLC American Depositary Shares (Each representing One Ordinary Share),$39.54,0.06,0.152%,"72,120,070,152"
GM,General Motors Company Common Stock,$77.16,1.45,1.915%,"71,979,578,139"
MNST,Monster Beverage Corporation,$73.57,-0.37,-0.50%,"71,879,450,861"
ECL,Ecolab Inc. Common Stock,$253.29,-3.86,-1.501%,"71,740,758,548"
ITW,Illinois Tool Works Inc. Common Stock,$246.63,-1.50,-0.605%,"71,547,363,000"
JCI,Johnson Controls International plc Ordinary Share,$115.77,0.79,0.687%,"70,751,174,779"
CNQ,Canadian Natural Resources Limited Common Stock,$33.73,-0.34,-0.998%,"70,263,199,110"
CI,The Cigna Group Common Stock,$262.71,-0.83,-0.315%,"70,176,623,121"
WBD,"Warner Bros. Discovery, Inc. Series A Common Stock ",$28.26,1.03,3.783%,"70,027,559,624"
EPD,Enterprise Products Partners L.P. Common Stock,$32.33,-0.38,-1.162%,"69,940,169,547"
MDLZ,"Mondelez International, Inc. Class A Common Stock",$54.11,-0.65,-1.187%,"69,821,298,002"
RBLX,Roblox Corporation Class A Common Stock,$99.00,1.36,1.393%,"69,490,625,292"
TEL,TE Connectivity plc Ordinary Shares,$236.20,2.22,0.949%,"69,487,499,905"
CMI,Cummins Inc. Common Stock,$500.16,-7.54,-1.485%,"69,040,212,300"
B,Barrick Mining Corporation Common Shares,$40.91,0.89,2.224%,"69,032,922,076"
PWR,"Quanta Services, Inc. Common Stock",$457.96,-5.13,-1.108%,"68,289,111,611"
VRT,"Vertiv Holdings, LLC Class A Common Stock",$178.38,-7.23,-3.895%,"68,201,508,273"
CSX,CSX Corporation Common Stock,$36.37,0.02,0.055%,"67,725,921,090"
RCL,Royal Caribbean Cruises Ltd. Common Stock,$248.32,-4.09,-1.62%,"67,720,085,207"
EQNR,Equinor ASA,$22.98,-0.11,-0.476%,"67,669,967,649"
CP,Canadian Pacific Kansas City Limited Common Shares,$73.08,-1.04,-1.403%,"65,832,747,604"
COR,"Cencora, Inc. Common Stock",$337.29,-0.53,-0.157%,"65,432,048,727"
NWG,"NatWest Group plc American Depositary Shares, (each representing two (2) Ordinary Shares)",$16.33,-0.19,-1.15%,"65,418,420,077"
NSC,Norfolk Southern Corporation Common Stock,$289.53,-3.47,-1.184%,"64,966,657,220"
FDX,FedEx Corporation Common Stock,$275.13,-1.51,-0.546%,"64,918,425,985"
RSG,"Republic Services, Inc. Common Stock",$209.32,-2.12,-1.003%,"64,797,852,543"
AMX,"America Movil, S.A.B. de C.V. American Depositary Shares (each representing the right to receive twenty (20) Series B Shares",$21.27,-0.18,-0.839%,"64,596,990,000"
FCX,"Freeport-McMoRan, Inc. Common Stock",$44.80,-0.20,-0.444%,"64,329,693,568"
ADSK,"Autodesk, Inc. Common Stock",$300.75,-0.64,-0.212%,"63,759,000,000"
HLT,Hilton Worldwide Holdings Inc. Common Stock ,$269.25,-0.57,-0.211%,"62,583,168,446"
TRV,"The Travelers Companies, Inc. Common Stock",$279.16,-0.71,-0.254%,"62,270,383,490"
AEP,"American Electric Power Company, Inc. Common Stock",$116.07,0.34,0.294%,"62,128,278,424"
FTNT,"Fortinet, Inc. Common Stock",$83.50,-0.03,-0.036%,"62,094,616,517"
CL,Colgate-Palmolive Company Common Stock,$76.98,0.87,1.143%,"62,050,879,235"
MSI,"Motorola Solutions, Inc. Common Stock",$371.33,-0.08,-0.022%,"61,846,867,407"
AJG,Arthur J. Gallagher & Co. Common Stock,$239.91,2.06,0.866%,"61,608,888,000"
E,ENI S.p.A. Common Stock,$37.46,0.21,0.564%,"61,518,507,552"
TFC,Truist Financial Corporation Common Stock,$47.92,0.22,0.461%,"61,301,483,223"
KMI,"Kinder Morgan, Inc. Common Stock",$27.32,0.03,0.11%,"60,780,453,855"
STX,Seagate Technology Holdings PLC Ordinary Shares (Ireland),$282.86,-2.55,-0.893%,"60,407,047,843"
CNI,Canadian National Railway Company Common Stock,$97.71,-0.54,-0.55%,"60,140,505,000"
EOG,"EOG Resources, Inc. Common Stock",$109.39,-1.23,-1.112%,"59,354,845,211"
MFC,Manulife Financial Corporation Common Stock,$35.22,0.28,0.801%,"59,345,233,687"
SPG,"Simon Property Group, Inc. Common Stock",$181.05,0.98,0.544%,"59,107,404,363"
WDAY,"Workday, Inc. Class A Common Stock",$222.25,1.25,0.566%,"58,451,750,000"
AZO,"AutoZone, Inc. Common Stock","$3,496.77",-270.19,-7.173%,"58,160,596,999"
WDC,Western Digital Corporation Common Stock,$169.54,-0.24,-0.141%,"57,965,604,101"
SRE,DBA Sempra Common Stock,$88.32,0.16,0.181%,"57,644,831,935"
ARES,Ares Management Corporation Class A Common Stock,$176.20,11.94,7.269%,"57,594,337,887"
ROST,"Ross Stores, Inc. Common Stock",$177.02,-0.765,-0.43%,"57,571,553,607"
NXPI,NXP Semiconductors N.V. Common Stock,$228.05,-0.96,-0.419%,"57,394,363,112"
MPC,Marathon Petroleum Corporation Common Stock,$190.73,1.07,0.564%,"57,333,910,820"
ET,Energy Transfer LP Common Units ,$16.67,-0.13,-0.774%,"57,234,558,856"
TRI,Thomson Reuters Corporation Common Shares,$128.65,-1.04,-0.802%,"57,228,985,953"
SLB,SLB Limited Common Shares,$38.30,0.06,0.157%,"57,217,275,221"
PCAR,PACCAR Inc. Common Stock,$108.91,-0.81,-0.738%,"57,200,006,739"
PYPL,"PayPal Holdings, Inc. Common Stock",$60.78,-0.34,-0.556%,"56,868,925,703"
AFL,AFLAC Incorporated Common Stock,$108.02,-0.04,-0.037%,"56,614,785,314"
PSX,Phillips 66 Common Stock,$139.88,0.82,0.59%,"56,360,608,364"
TRP,TC Energy Corporation Common Stock,$54.13,-0.52,-0.952%,"56,349,330,000"
MPLX,MPLX LP Common Units Representing Limited Partner Interests,$55.20,-0.35,-0.63%,"56,141,996,390"
DLR,"Digital Realty Trust, Inc. Common Stock",$162.76,-1.02,-0.623%,"55,908,312,604"
VST,Vistra Corp. Common Stock,$164.81,-1.31,-0.789%,"55,841,829,007"
IDXX,"IDEXX Laboratories, Inc. Common Stock",$699.06,-7.59,-1.074%,"55,820,870,750"
ALNY,"Alnylam Pharmaceuticals, Inc. Common Stock",$415.21,-14.81,-3.444%,"54,854,978,372"
VALE,VALE S.A.  American Depositary Shares Each Representing one common share,$12.80,-0.01,-0.078%,"54,640,368,474"
MSTR,Strategy Inc Common Stock Class A,$188.99,5.30,2.885%,"54,306,982,378"
ARGX,argenx SE American Depositary Shares,$889.41,-11.35,-1.26%,"54,245,878,124"
SOMN,Southern Company (The) 2025 Series A Corporate Units,$49.25,0.23,0.469%,"54,229,413,518"
BDX,"Becton, Dickinson and Company Common Stock",$188.82,-0.68,-0.359%,"53,892,730,800"
BRKRP,"Bruker Corporation 6.375% Mandatory Convertible Preferred Stock, Series A",$352.63,-20.07,-5.385%,"53,579,005,609"
DDOG,"Datadog, Inc. Class A Common Stock",$152.57,-1.71,-1.108%,"53,501,836,175"
VLO,Valero Energy Corporation Common Stock,$175.32,1.76,1.014%,"53,474,272,377"
RKT,"Rocket Companies, Inc. Class A Common Stock",$18.99,0.18,0.957%,"53,473,751,328"
ALL,Allstate Corporation (The) Common Stock,$201.05,0.18,0.09%,"52,611,107,393"
SU,Suncor Energy  Inc. Common Stock,$43.79,-0.24,-0.545%,"52,603,468,224"
O,Realty Income Corporation Common Stock,$57.05,-0.27,-0.471%,"52,480,623,893"
F,Ford Motor Company Common Stock,$13.08,-0.06,-0.457%,"52,117,241,243"
LHX,"L3Harris Technologies, Inc. Common Stock",$277.37,-4.28,-1.52%,"51,882,848,172"
NDAQ,"Nasdaq, Inc. Common Stock",$90.72,0.92,1.024%,"51,800,705,682"
APD,"Air Products and Chemicals, Inc. Common Stock",$230.76,-5.29,-2.241%,"51,364,924,013"
MET,"MetLife, Inc. Common Stock",$77.82,-0.26,-0.333%,"51,274,948,670"
ZTS,Zoetis Inc. Class A Common Stock,$115.75,-2.41,-2.04%,"51,010,239,521"
EA,Electronic Arts Inc. Common Stock,$203.82,0.29,0.142%,"50,833,637,827"
URI,"United Rentals, Inc. Common Stock",$789.90,4.86,0.619%,"50,261,453,115"
D,"Dominion Energy, Inc. Common Stock",$58.46,0.02,0.034%,"49,919,770,173"
WPM,Wheaton Precious Metals Corp Common Shares (Canada),$109.27,4.31,4.106%,"49,610,955,202"
CPNG,"Coupang, Inc. Class A Common Stock",$26.93,-0.40,-1.464%,"49,191,618,198"
EW,Edwards Lifesciences Corporation Common Stock,$83.28,-1.04,-1.233%,"48,327,384,000"
FER,Ferrovial SE Ordinary Shares,$66.45,-0.23,-0.345%,"47,856,365,813"
ELVR,Elevra Lithium Limited American Depository Shares,$41.35,1.51,3.79%,"47,731,529,001"
DEO,Diageo plc Common Stock,$85.40,-2.54,-2.888%,"47,533,908,583"
ROP,"Roper Technologies, Inc. Common Stock",$440.635,-6.075,-1.36%,"47,428,818,968"
OKE,"ONEOK, Inc. Common Stock",$74.96,0.03,0.04%,"47,167,197,513"
BKR,Baker Hughes Company Class A Common Stock,$47.69,0.30,0.633%,"47,059,246,433"
CAH,"Cardinal Health, Inc. Common Stock",$198.00,-0.88,-0.442%,"47,043,818,316"
PSA,Public Storage Common Stock,$264.71,-4.84,-1.796%,"46,446,814,436"
CBRE,CBRE Group Inc Common Stock Class A,$156.02,0.63,0.405%,"46,430,459,392"
FAST,Fastenal Company Common Stock,$40.34,-0.46,-1.127%,"46,311,760,985"
MPWR,"Monolithic Power Systems, Inc. Common Stock",$962.95,-20.63,-2.097%,"46,132,045,650"
TTWO,"Take-Two Interactive Software, Inc. Common Stock",$248.73,1.45,0.586%,"45,960,038,883"
TCOM,Trip.com Group Limited American Depositary Shares,$70.12,-0.03,-0.043%,"45,807,342,676"
