Symbol,Name,Last Sale,Net Change,% Change,Market Cap
LAES,SEALSQ Corp Ordinary Shares,$4.31,0.32,8.02%,"450,433,363"
KIDS,OrthoPediatrics Corp. Common Stock,$17.93,-0.49,-2.66%,"449,569,684"
ADCT,ADC Therapeutics SA Common Shares,$3.98,-0.02,-0.50%,"447,747,592"
AGL,"agilon health, inc. Common Stock",$1.08,0.08,8.00%,"447,577,001"
ZH,"Zhihu Inc. American Depositary Shares, each representing three (3) Class A Ordinary Shares",$5.11,0.03,0.591%,"447,456,440"
SLDB,Solid Biosciences Inc. Common Stock,$5.74,-0.13,-2.215%,"446,968,468"
MITK,"Mitek Systems, Inc. Common Stock",$9.79,0.02,0.205%,"446,884,610"
GUT,Gabelli Utility Trust (The) Common Stock,$6.04,-0.01,-0.165%,"443,330,135"
AII,"American Integrity Insurance Group, Inc. Common Stock",$22.61,0.35,1.572%,"442,522,129"
VHI,"Valhi, Inc. Common Stock",$15.61,-0.10,-0.637%,"441,798,794"
RMNI,"Rimini Street, Inc. (DE) Common Stock",$4.76,0.09,1.927%,"440,385,680"
ETB,Eaton Vance Tax-Managed Buy-Write Income Fund Eaton Vance Tax-Managed Buy-Write Income Fund Common Shares of Beneficial Interest,$14.99,-0.03,-0.20%,"440,277,256"
GMRE,Global Medical REIT Inc. Common Stock,$32.79,-0.80,-2.382%,"439,628,941"
SBC,SBC Medical Group Holdings Incorporated Common Stock,$4.23,-0.06,-1.399%,"439,417,692"
SVC,Service Properties Trust Common Stock,$2.63,-0.04,-1.498%,"438,843,983"
NOA,North American Construction Group Ltd. Common Shares (no par),$14.54,-0.07,-0.479%,"438,773,304"
WOW,"WideOpenWest, Inc. Common Stock",$5.11,-0.05,-0.969%,"438,274,327"
NLOP,Net Lease Office Properties Common Shares of Beneficial Interest,$29.51,-0.02,-0.068%,"437,163,353"
BSVN,Bank7 Corp. Common stock,$46.25,0.13,0.282%,"437,107,779"
EVN,Eaton Vance Municipal Income Trust Common Stock,$11.01,-0.07,-0.632%,"436,735,465"
QSG,QuantaSing Group Limited American Depositary Shares,$8.54,-0.20,-2.288%,"436,505,046"
GRVY,"GRAVITY Co., Ltd. American Depository Shares",$62.70,-0.84,-1.322%,"435,696,030"
SWBI,"Smith & Wesson Brands, Inc. Common Stock",$9.82,-0.09,-0.908%,"435,436,289"
ALLT,Allot Ltd. Ordinary Shares,$10.97,0.48,4.576%,"435,430,170"
YORW,York Water Company (The) Common Stock,$30.18,0.23,0.768%,"435,231,122"
PERI,Perion Network Ltd. Ordinary Shares,$9.66,0.21,2.222%,"435,059,159"
CNDT,Conduent Incorporated Common Stock ,$2.75,-0.06,-2.135%,"434,428,561"
ATXS,"Astria Therapeutics, Inc. Common Stock",$7.69,0.15,1.989%,"433,984,335"
CBLL,"CeriBell, Inc. Common Stock",$11.81,0.25,2.163%,"433,001,462"
VPG,"Vishay Precision Group, Inc. Common Stock",$32.48,-0.25,-0.764%,"431,304,648"
PNNT,PennantPark Investment Corporation Common Stock,$6.59,0.01,0.152%,"430,301,259"
CARE,"Carter Bankshares, Inc. Common Stock",$18.98,-0.34,-1.76%,"430,273,449"
CCRN,"Cross Country Healthcare, Inc. Common Stock $0.0001 Par Value",$13.13,-0.64,-4.648%,"430,164,994"
KOPN,Kopin Corporation Common Stock,$2.64,0.14,5.60%,"429,807,449"
PACB,"Pacific Biosciences of California, Inc. Common Stock",$1.43,0.05,3.623%,"429,529,974"
KRRO,"Korro Bio, Inc. Common Stock",$45.72,1.815,4.134%,"429,352,085"
UPXI,"Upexi, Inc. Common Stock",$7.29,0.76,11.639%,"429,299,031"
JOUT,Johnson Outdoors Inc. Class A Common Stock,$41.38,0.33,0.804%,"429,204,243"
AUTL,Autolus Therapeutics plc American Depositary Share,$1.61,-0.06,-3.593%,"428,487,672"
MOV,Movado Group Inc. Common Stock,$19.35,0.32,1.682%,"428,364,456"
GLRE,"Greenlight Capital Re, Ltd. Class A Ordinary Shares",$12.52,0.02,0.16%,"428,160,876"
SRDX,"Surmodics, Inc. Common Stock",$29.90,-0.01,-0.033%,"427,498,928"
CMCO,Columbus McKinnon Corporation Common Stock,$14.88,0.07,0.473%,"427,432,896"
SRTA,"Strata Critical Medical, Inc. Class A Common Stock",$5.23,0.07,1.357%,"427,268,014"
SPIR,"Spire Global, Inc. Class A Common Stock",$13.11,1.82,16.12%,"427,176,030"
TONX,TON Strategy Company Common Stock,$7.08,0.26,3.812%,"427,075,094"
ETHZ,ETHZilla Corporation Common Stock,$2.58,0.20,8.403%,"426,927,190"
CHCT,Community Healthcare Trust Incorporated Common Stock,$15.04,-0.34,-2.211%,"426,635,830"
ADUR,Aduro Clean Technologies Inc. Common Stock,$13.70,0.66,5.061%,"425,671,563"
TRC,Tejon Ranch Co Common Stock,$15.78,-0.13,-0.817%,"424,386,610"
KRNY,Kearny Financial Corp Common Stock,$6.54,-0.02,-0.305%,"423,429,180"
HBCP,"Home Bancorp, Inc. Common Stock",$54.05,-0.16,-0.295%,"422,927,792"
DVS,Dolly Varden Silver Corporation Common Shares,$4.85,-0.30,-5.825%,"422,751,002"
RRBI,"Red River Bancshares, Inc. Common Stock",$63.30,-1.18,-1.83%,"422,629,350"
MSB,Mesabi Trust Common Stock,$32.21,0.61,1.93%,"422,595,522"
KDK,"Kodiak AI, Inc. Common Stock ",$6.83,0.87,14.597%,"422,501,833"
COFS,"ChoiceOne Financial Services, Inc. Common Stock",$28.10,-0.33,-1.161%,"421,921,500"
INVZ,Innoviz Technologies Ltd. Ordinary shares,$2.12,0.14,7.071%,"421,799,349"
CYH,"Community Health Systems, Inc. Common Stock",$3.01,-0.12,-3.834%,"421,758,539"
ATEX,Anterix Inc. Common Stock,$22.48,0.83,3.834%,"421,270,479"
DIN,"Dine Brands Global, Inc. Common Stock",$27.34,0.71,2.666%,"420,470,691"
KFS,"Kingsway Financial Services, Inc. Common Stock (DE)",$14.56,0.32,2.247%,"420,396,922"
MAMA,"Mama's Creations, Inc. Common Stock",$10.38,-0.10,-0.954%,"420,375,759"
ECC           ,Eagle Point Credit Company Inc. Common Stock,$6.89,0.12,1.773%,"417,964,790"
OPAL,OPAL Fuels Inc. Class A Common Stock,$2.41,-0.12,-4.743%,"417,882,466"
IMXI,"International Money Express, Inc. Common Stock",$14.02,0.09,0.646%,"416,170,437"
ENGN,enGene Holdings Inc. Common Stock,$8.14,0.54,7.105%,"416,001,269"
SD,"SandRidge Energy, Inc. Common Stock",$11.30,-0.40,-3.419%,"415,296,165"
MCI,Barings Corporate Investors Common Stock,$20.48,-0.3422,-1.643%,"414,960,005"
HDSN,"Hudson Technologies, Inc. Common Stock",$9.50,-0.22,-2.263%,"414,849,515"
GBLI,"Global Indemnity Group, LLC Class A Common Stock (DE)",$29.0144,-0.0355,-0.122%,"414,799,379"
SDHY,PGIM Short Duration High Yield Opportunities Fund Common Shares,$16.79,0.01,0.06%,"414,260,610"
PDYN,Palladyne AI Corp. Common Stock,$9.87,0.64,6.934%,"414,035,386"
FBIZ,"First Business Financial Services, Inc. Common Stock",$49.685,-0.335,-0.67%,"413,551,607"
JELD,"JELD-WEN Holding, Inc. Common Stock",$4.83,-0.08,-1.629%,"412,497,403"
ALMS,Alumis Inc. Common Stock,$3.96,-0.10,-2.463%,"412,094,636"
NMG,Nouveau Monde Graphite Inc. Common Shares,$2.70,-0.01,-0.369%,"411,481,904"
BOC,Boston Omaha Corporation Class A Common Stock,$13.07,-0.13,-0.985%,"411,096,382"
EHAB,"Enhabit, Inc. Common Stock",$8.09,-0.06,-0.736%,"410,085,190"
HNST,"The Honest Company, Inc. Common Stock",$3.67,0.12,3.38%,"408,359,032"
ESEA,Euroseas Ltd. Common Stock (Marshall Islands),$58.28,-2.44,-4.018%,"408,345,347"
AMBC,"Ambac Financial Group, Inc. Common Stock",$8.80,0.67,8.241%,"408,335,277"
OEC,Orion S.A. Common Shares,$7.25,-0.08,-1.091%,"407,085,369"
DDT,Dillard's Capital Trust I,$26.07,-0.0212,-0.081%,"407,030,024"
ATGL,Alpha Technology Group Limited Class A Ordinary Shares,$24.72,UNCH,--,"406,953,000"
EGY,"VAALCO Energy, Inc.  Common Stock",$3.90,-0.15,-3.704%,"406,607,187"
MAGN,Magnera Corporation Common Stock,$11.41,-0.12,-1.041%,"406,196,000"
IHRT,"iHeartMedia, Inc. Class A Common Stock",$2.70,-0.16,-5.594%,"405,384,153"
FDMT,"4D Molecular Therapeutics, Inc. Common Stock",$8.67,-0.06,-0.687%,"404,910,389"
ALVOW,Alvotech Warrant,$1.34,0.01,0.752%,"404,419,607"
EOLS,"Evolus, Inc. Common Stock",$6.24,0.09,1.463%,"403,637,015"
MVIS,"MicroVision, Inc. Common Stock",$1.34,0.06,4.688%,"403,292,945"
PKE,Park Aerospace Corp. Common Stock,$20.30,0.01,0.049%,"403,073,511"
NCMI,"National CineMedia, Inc. Common Stock",$4.30,-0.16,-3.587%,"402,953,516"
GNE,Genie Energy Ltd. Class B Common Stock Stock,$15.00,0.02,0.134%,"400,633,650"
HQL,abrdn Life Sciences Investors Shares of Beneficial Interest,$15.57,-0.19,-1.206%,"399,831,933"
WAVE,Eco Wave Power Global AB (publ) American Depositary Shares,$8.54,0.11,1.305%,"399,107,028"
SGU,Star Group L.P. Common Stock,$11.85,0.14,1.196%,"398,236,124"
SAJ,Saratoga Investment Corp 8.00% Notes due 2027,$25.39,0.0236,0.093%,"397,813,846"
TTGT,"TechTarget, Inc. Common Stock",$5.56,UNCH,--,"397,478,840"
SAZ,Saratoga Investment Corp 8.50% Notes due 2028,$25.35,0.04,0.158%,"397,187,121"
FRBA,First Bank Common Stock,$15.80,-0.17,-1.064%,"397,123,567"
DRUG,Bright Minds Biosciences Inc. Common Stock,$56.00,-1.95,-3.365%,"396,739,784"
SAY,Saratoga Investment Corp 8.125% Notes due 2027,$25.3031,-0.0755,-0.297%,"396,452,286"
TCI,"Transcontinental Realty Investors, Inc. Common Stock",$45.86,-0.27,-0.585%,"396,199,032"
VSTA,Vasta Platform Limited Class A Ordinary Shares,$4.94,-0.02,-0.403%,"396,197,994"
SY,So-Young International Inc. American Depository Shares,$3.93,0.12,3.15%,"395,739,002"
TMCI,"Treace Medical Concepts, Inc. Common Stock",$6.26,-0.06,-0.949%,"395,463,769"
SMC,Summit Midstream Corporation Common Stock,$21.01,-0.07,-0.332%,"394,280,614"
VBNK,VersaBank Common Shares,$12.25,-0.02,-0.163%,"394,053,639"
CWBC,Community West Bancshares Common Stock,$20.55,-0.14,-0.677%,"393,131,939"
VKI,Invesco Advantage Municipal Income Trust II Common Shares of Beneficial Interest (DE),$8.85,0.03,0.34%,"392,993,277"
LCTX,"Lineage Cell Therapeutics, Inc. Common Stock",$1.72,0.03,1.775%,"392,772,819"
WNC,Wabash National Corporation Common Stock,$9.58,-0.22,-2.245%,"392,188,176"
MLAB,"Mesa Laboratories, Inc. Common Stock",$71.24,0.77,1.093%,"391,923,583"
KMDA,Kamada Ltd. Ordinary Shares,$6.80,-0.04,-0.585%,"391,034,211"
LND,Brasilagro Brazilian Agric Real Estate Co Sponsored ADR (Brazil),$3.808,-0.072,-1.856%,"391,018,555"
LWAY,"Lifeway Foods, Inc. Common Stock",$25.65,-0.76,-2.878%,"390,560,238"
SAT,Saratoga Investment Corp 6.00% Notes due 2027,$24.8894,-0.0106,-0.043%,"389,970,380"
XPOF,"Xponential Fitness, Inc. Class A Common Stock",$7.98,0.15,1.916%,"389,703,300"
EVI,"EVI Industries, Inc.  Common Stock",$30.52,-0.73,-2.336%,"389,496,026"
CDZI,"CADIZ, Inc. Common Stock",$4.745,0.355,8.087%,"389,180,269"
CMRC,"Commerce.com, Inc. Series 1 Common Stock",$4.82,-0.08,-1.633%,"389,143,086"
CIVB,"Civista Bancshares, Inc. Common Stock",$20.14,-0.04,-0.198%,"388,961,383"
BSRR,Sierra Bancorp Common Stock,$28.61,-0.06,-0.209%,"388,817,711"
LEO,"BNY Mellon Strategic Municipals, Inc. Common Stock",$6.24,-0.04,-0.637%,"388,694,929"
LAW,"CS Disco, Inc. Common Stock",$6.29,0.05,0.801%,"388,356,211"
BRBS,"Blue Ridge Bankshares, Inc. Common Stock",$4.21,-0.06,-1.405%,"387,850,287"
IPI,"Intrepid Potash, Inc Common Stock",$28.98,-0.28,-0.957%,"385,899,158"
WRN,Western Copper and Gold Corporation Common Stock,$1.91,-0.07,-3.535%,"385,147,600"
HSHP,Himalaya Shipping Ltd. Common Shares,$8.27,-0.02,-0.241%,"384,968,500"
SAR,Saratoga Investment Corp New,$24.49,0.39,1.618%,"383,712,528"
DHIL,"Diamond Hill Investment Group, Inc. Class A Common Stock",$140.74,1.26,0.903%,"383,538,737"
DDD,3D Systems Corporation Common Stock,$2.99,0.12,4.181%,"383,475,142"
BMRC,Bank of Marin Bancorp Common Stock,$23.69,-0.43,-1.783%,"382,008,381"
ATLCZ,Atlanticus Holdings Corporation 9.25% Senior Notes due 2029,$25.24,-0.03,-0.119%,"381,766,333"
RM,Regional Management Corp. Common Stock,$38.92,0.10,0.258%,"381,379,649"
RILYZ,"B. Riley Financial, Inc. 5.25% Senior Notes due 2028",$12.465,0.365,3.017%,"380,145,928"
BRCC,BRC Inc. Class A Common Stock,$1.53,-0.03,-1.923%,"379,784,327"
PSTL,"Postal Realty Trust, Inc. Class A Common Stock",$15.44,-0.13,-0.835%,"379,518,381"
TACO,Berto Acquisition Corp. Ordinary Shares,$10.41,0.01,0.096%,"379,363,635"
ATLCL,Atlanticus Holdings Corporation 6.125% Senior Notes due 2026,$25.05,-0.06,-0.239%,"378,892,497"
PUBM,"PubMatic, Inc. Class A Common Stock",$8.28,0.02,0.242%,"378,586,705"
GRRR,Gorilla Technology Group Inc. Ordinary shares,$18.71,0.16,0.863%,"378,358,148"
SOR,"Source Capital, Inc. Cmn Shs of BI",$45.28,0.2499,0.555%,"377,838,190"
TITN,Titan Machinery Inc. Common Stock,$16.13,0.10,0.624%,"377,006,119"
HLLY,Holley Inc. Common Stock,$3.10,-0.01,-0.322%,"376,939,574"
NIU,Niu Technologies American Depositary Shares,$4.82,0.01,0.208%,"375,786,345"
ELVR,Elevra Lithium Limited American Depository Shares,$24.14,0.835,3.583%,"374,062,118"
AURA,"Aura Biosciences, Inc. Common Stock",$6.02,-0.13,-2.114%,"373,961,635"
OMI,"Owens & Minor, Inc. Common Stock",$4.84,-0.18,-3.586%,"373,861,739"
ATLCP,"Atlanticus Holdings Corporation 7.625% Series B Cumulative Perpetual Preferred Stock, no par value per share",$24.7132,0.0432,0.175%,"373,798,246"
DCTH,"Delcath Systems, Inc. Common Stock",$10.65,-0.10,-0.93%,"372,550,344"
SCM,Stellus Capital Investment Corporation Common Stock,$13.10,0.14,1.08%,"372,251,539"
GCBC,"Greene County Bancorp, Inc. Common Stock",$21.86,-0.54,-2.411%,"372,206,460"
ILPT,Industrial Logistics Properties Trust Common Shares of Beneficial Interest,$5.59,0.04,0.721%,"370,818,234"
SATL,Satellogic Inc. Class A Common Stock,$3.51,0.18,5.405%,"370,544,814"
RWAY,Runway Growth Finance Corp. Common Stock,$10.23,0.21,2.096%,"370,496,145"
JACK,Jack In The Box Inc. Common Stock,$19.57,-1.18,-5.687%,"369,530,838"
OIS,"Oil States International, Inc. Common Stock",$6.09,-0.05,-0.814%,"369,009,245"
TE,T1 Energy Inc. Common Stock,$2.36,-0.03,-1.255%,"368,013,897"
ASLE,AerSale Corporation Common Stock,$7.79,-0.20,-2.503%,"367,544,017"
PPT,Putnam Premier Income Trust Common Stock,$3.69,0.01,0.272%,"367,259,290"
LXFR,Luxfer Holdings PLC Ordinary Shares,$13.71,-0.01,-0.073%,"366,935,496"
VALU,"Value Line, Inc. Common Stock",$38.99,0.10,0.257%,"366,812,812"
LRMR,"Larimar Therapeutics, Inc. Common Stock",$4.28,0.13,3.133%,"366,326,878"
MBI,MBIA Inc. Common Stock,$7.25,0.03,0.416%,"366,043,372"
ACCO,Acco Brands Corporation Common Stock,$4.06,-0.01,-0.246%,"365,938,076"
MTW,"Manitowoc Company, Inc. (The) Common Stock",$10.31,0.16,1.576%,"365,583,393"
BZAI,"Blaize Holdings, Inc. Common Stock",$3.56,0.13,3.79%,"365,327,876"
LPTH,"LightPath Technologies, Inc. Class A Common Stock",$8.17,0.49,6.38%,"364,955,640"
CRESW,Cresud S.A.C.I.F. y A. Warrant,$0.6116,0.0002,0.033%,"364,730,914"
CAPR,"Capricor Therapeutics, Inc. Common Stock",$7.97,0.15,1.918%,"364,364,291"
CHSCP,CHS Inc. 8%  Cumulative Redeemable Preferred Stock,$29.67,-0.135,-0.453%,"364,110,329"
KTF,DWS Municipal Income Trust,$9.21,-0.01,-0.108%,"363,803,639"
BBCP,"Concrete Pumping Holdings, Inc. Common Stock",$7.06,0.10,1.437%,"363,409,617"
REPL,"Replimune Group, Inc. Common Stock",$4.65,0.44,10.451%,"362,959,684"
ZIP,"ZipRecruiter, Inc. Class A Common Stock",$4.16,-0.02,-0.478%,"362,412,195"
DMAC,DiaMedica Therapeutics Inc. Common Stock,$7.00,0.14,2.041%,"361,822,391"
LXEO,"Lexeo Therapeutics, Inc. Common Stock",$6.70,0.06,0.904%,"361,808,134"
CGC,Canopy Growth Corporation Common Shares,$1.36,-0.02,-1.449%,"361,780,482"
MSBI,"Midland States Bancorp, Inc. Common Stock",$16.79,-0.02,-0.119%,"361,716,288"
ANPA,Rich Sparkle Holdings Limited Ordinary Shares,$28.90,-1.15,-3.827%,"361,250,000"
BNTC,Benitec Biopharma Inc. Common Stock,$13.72,-0.29,-2.07%,"360,156,435"
BGS,"B&G Foods, Inc. Common Stock",$4.50,UNCH,--,"360,016,871"
MTRX,Matrix Service Company Common Stock,$12.77,-0.12,-0.931%,"358,435,192"
API,"Agora, Inc. American Depositary Shares",$3.83,0.09,2.406%,"358,146,138"
SLQT,"SelectQuote, Inc. Common Stock",$2.07,0.11,5.612%,"357,730,631"
LSAK,"Lesaka Technologies, Inc. Common Stock",$4.25,0.07,1.675%,"355,610,662"
SENS,"Senseonics Holdings, Inc. Common Stock",$0.436,0.0231,5.595%,"355,200,877"
SUIG,Sui Group Holdings Limited Common Stock,$4.32,0.16,3.846%,"354,717,999"
HYLN,Hyliion Holdings Corp. Class A Common Stock,$2.02,-0.03,-1.463%,"354,382,005"
CARL,"Carlsmed, Inc. Common Stock",$13.33,0.01,0.075%,"354,326,516"
SFST,"Southern First Bancshares, Inc. Common Stock",$43.31,-0.375,-0.858%,"354,306,767"
MLP,"Maui Land & Pineapple Company, Inc. Common Stock",$17.83,-0.02,-0.112%,"352,013,785"
TVRD,"Tvardi Therapeutics, Inc. Common Stock",$37.37,-0.45,-1.19%,"350,434,671"
RXST,"RxSight, Inc. Common Stock",$8.56,-0.45,-4.994%,"350,240,643"
EDIT,"Editas Medicine, Inc. Common Stock",$3.89,0.34,9.577%,"349,789,438"
PMO,Putnam Municipal Opportunities Trust Common Stock,$10.29,-0.16,-1.531%,"349,670,324"
MCFT,"MasterCraft Boat Holdings, Inc. Common Stock",$21.43,-0.15,-0.695%,"349,445,209"
GBAB,Guggenheim Taxable Municipal Bond & Investment Grade Debt Trust Common Shares of Beneficial Interest,$15.60,-0.07,-0.447%,"349,391,718"
FEIM,"Frequency Electronics, Inc. Common Stock",$35.69,1.44,4.204%,"347,951,482"
CMDB,Costamare Bulkers Holdings Limited Common Stock,$14.36,0.11,0.772%,"347,565,778"
HVT,"Haverty Furniture Companies, Inc. Common Stock",$21.36,-0.10,-0.466%,"347,459,425"
THM,"International Tower Hill Mines, Ltd. Ordinary Shares (Canada)",$1.67,-0.10,-5.65%,"347,168,740"
ALT,"Altimmune, Inc. Common Stock",$3.93,0.06,1.55%,"346,851,004"
DH,Definitive Healthcare Corp. Class A Common Stock,$3.33,-0.23,-6.461%,"346,607,079"
RCKT,"Rocket Pharmaceuticals, Inc. Common Stock",$3.21,0.05,1.582%,"346,371,426"
AMRN,Amarin Corporation plc,$16.74,0.10,0.601%,"346,229,670"
MTLS,Materialise NV American Depositary Shares,$5.85,0.45,8.333%,"345,543,038"
ZUMZ,Zumiez Inc. Common Stock,$20.13,-0.17,-0.837%,"345,300,539"
PDLB,"Ponce Financial Group, Inc. Common Stock",$14.38,-0.23,-1.574%,"345,136,178"
NPCE,"Neuropace, Inc. Common Stock",$10.43,0.29,2.86%,"345,040,024"
GPRO,"GoPro, Inc. Class A Common Stock",$2.18,-0.03,-1.357%,"344,839,147"
EVO,Evotec SE American Depositary Shares,$3.88,0.12,3.191%,"344,128,921"
TMQ,Trilogy Metals Inc. Common Stock,$2.09,-0.19,-8.333%,"343,410,847"
EFT,Eaton Vance Floating Rate Income Trust Common Shares of Beneficial Interest,$11.80,0.08,0.683%,"343,266,897"
WTBA,West Bancorporation Common Stock,$20.23,0.05,0.248%,"342,712,081"
DSGN,"Design Therapeutics, Inc. Common Stock",$6.015,-0.775,-11.414%,"342,542,978"
AENT,Alliance Entertainment Holding Corporation Class A Common Stock,$6.71,-0.21,-3.035%,"341,923,953"
ANNX,"Annexon, Inc. Common Stock",$3.11,0.08,2.64%,"341,747,398"
DFDV,DeFi Development Corp. Common Stock,$16.22,0.99,6.50%,"341,350,695"
NNDM,Nano Dimension Ltd. American Depositary Shares,$1.57,0.04,2.614%,"341,135,057"
ALTS,ALT5 Sigma Corporation Common Stock,$2.78,0.15,5.703%,"340,854,065"
PAYS,"Paysign, Inc. Common Stock",$6.25,0.15,2.459%,"340,324,300"
BWFG,"Bankwell Financial Group, Inc. Common Stock",$43.18,-0.33,-0.758%,"340,147,989"
USCB,"USCB Financial Holdings, Inc. Class A Common Stock",$16.93,-0.35,-2.025%,"339,927,058"
EM,Smart Share Global Limited American Depositary Shares,$1.34,UNCH,--,"339,782,803"
AMCX,AMC Networks Inc. Class A Common Stock,$7.83,-0.44,-5.32%,"339,695,256"
CGEM,"Cullinan Therapeutics, Inc. Common Stock",$5.75,-0.25,-4.167%,"339,677,748"
ZEUS,"Olympic Steel, Inc. Common Stock",$30.30,-0.32,-1.045%,"339,287,916"
FLYX,"flyExclusive, Inc. Class A Common Stock",$4.22,0.10,2.427%,"338,146,853"
FMAO,"Farmers & Merchants Bancorp, Inc. Common Stock",$24.56,-0.90,-3.535%,"337,062,324"
IMAB,I-MAB American Depositary Shares,$4.13,0.27,6.995%,"336,599,481"
DBVT,DBV Technologies S.A. American Depositary Shares,$12.25,2.18,21.648%,"335,585,553"
NGS,"Natural Gas Services Group, Inc. Common Stock",$26.74,-1.34,-4.772%,"335,381,476"
ASTL,Algoma Steel Group Inc. Common Shares,$3.19,-0.21,-6.176%,"334,738,828"
LAND,Gladstone Land Corporation Common Stock,$9.25,-0.08,-0.857%,"334,708,087"
CUB,Lionheart Holdings Class A Ordinary Shares,$10.524,0.014,0.133%,"334,332,494"
BNED,"Barnes & Noble Education, Inc Common Stock",$9.80,0.22,2.296%,"333,727,701"
AARD,"Aardvark Therapeutics, Inc. Common Stock",$15.37,0.66,4.487%,"333,481,245"
RXT,"Rackspace Technology, Inc. Common Stock",$1.39,UNCH,--,"332,711,341"
SPOK,"Spok Holdings, Inc. Common Stock",$16.13,-0.43,-2.597%,"332,131,604"
ORN,"Orion Group Holdings, Inc. Common",$8.35,-0.01,-0.12%,"331,789,296"
PBFS,"Pioneer Bancorp, Inc. Common Stock",$13.10,-0.04,-0.304%,"331,362,260"
CLW,Clearwater Paper Corporation Common Stock,$20.51,0.05,0.244%,"330,295,993"
MVBF,MVB Financial Corp. Common Stock,$25.93,0.48,1.886%,"330,123,257"
ARTNA,Artesian Resources Corporation Class A Common Stock,$32.00,0.22,0.692%,"329,939,232"
PANL,Pangaea Logistics Solutions Ltd. Common Shares,$5.05,0.01,0.198%,"329,471,651"
CHSCO,CHS Inc. Class B Cumulative Redeemable Preferred Stock,$26.84,0.05,0.187%,"329,380,561"
OBT,"Orange County Bancorp, Inc. Common Stock",$24.63,-0.47,-1.873%,"329,128,523"
TKNO,"Alpha Teknova, Inc. Common Stock",$6.15,-0.22,-3.454%,"329,118,277"
GPRK,Geopark Ltd Common Shares,$6.41,-0.04,-0.62%,"328,495,110"
LFMD,"LifeMD, Inc. Common Stock",$6.92,0.17,2.519%,"328,128,360"
FINS,Angel Oak Financial Strategies Income Term Trust Common Shares of Beneficial Interest,$13.09,-0.06,-0.456%,"328,069,931"
EAF,GrafTech International Ltd. Common Stock,$12.69,-0.23,-1.78%,"327,594,177"
BNC,CEA Industries Inc. Common Stock,$7.60,-0.26,-3.308%,"327,431,423"
OPRX,OptimizeRx Corporation Common Stock,$17.60,-1.38,-7.271%,"326,744,581"
CLDT,Chatham Lodging Trust (REIT) Common Shares of Beneficial Interest,$6.66,0.05,0.756%,"326,197,236"
ANNA,"AleAnna, Inc. Class A Common Stock",$4.01,-0.19,-4.524%,"326,092,246"
GCO,Genesco Inc. Common Stock,$29.98,0.15,0.503%,"323,646,842"
OOMA,"Ooma, Inc. Common Stock",$11.71,-0.10,-0.847%,"323,196,000"
NVEC,NVE Corporation Common Stock,$66.58,1.35,2.07%,"322,058,512"
TOI,"The Oncology Institute, Inc. Common Stock",$3.44,-0.04,-1.149%,"321,656,398"
XOMAP,XOMA Royalty Corporation 8.625% Series A Cumulative Perpetual Preferred Stock,$26.58,UNCH,--,"321,291,571"
GFR,Greenfire Resources Ltd. Common Shares,$4.57,-0.14,-2.972%,"321,056,210"
ACB,Aurora Cannabis Inc. Common Shares,$5.68,-0.05,-0.873%,"320,658,425"
ARDC,"Ares Dynamic Credit Allocation Fund, Inc. Common Shares",$13.98,-0.07,-0.498%,"320,350,847"
ALEC,"Alector, Inc. Common Stock",$3.16,0.16,5.333%,"319,830,960"
VFF,"Village Farms International, Inc. Common Shares",$2.83,-0.10,-3.413%,"318,782,998"
RFMZ,"RiverNorth Flexible Municipal Income Fund II, Inc. Common Stock",$13.09,0.03,0.23%,"318,764,486"
ALDX,"Aldeyra Therapeutics, Inc. Common Stock",$5.32,0.08,1.527%,"318,644,528"
CHSCL,"CHS Inc Class B Cumulative Redeemable Preferred Stock, Series 4",$25.93,0.05,0.193%,"318,213,038"
MREO,Mereo BioPharma Group plc American Depositary Shares,$2.05,UNCH,--,"318,048,494"
CDRO,"Codere Online Luxembourg, S.A. Ordinary Shares",$6.94,0.23,3.428%,"316,747,249"
MASS,908 Devices Inc. Common Stock,$8.75,-0.24,-2.67%,"315,749,858"
INV,"Innventure, Inc. Common Stock",$5.63,-0.59,-9.486%,"315,423,869"
CPZ,Calamos Long/Short Equity & Dynamic Income Trust Common Stock,$16.02,-0.10,-0.62%,"314,507,748"
RBB,RBB Bancorp Common Stock,$18.22,-0.10,-0.546%,"314,310,068"
ACIU,AC Immune SA Common Stock,$3.13,0.09,2.961%,"314,284,480"
MG,Mistras Group Inc Common Stock,$9.96,-0.27,-2.639%,"314,118,978"
HITI,High Tide Inc. Common Shares,$3.60,-0.01,-0.277%,"313,473,168"
SNWV,"SANUWAVE Health, Inc. Common Stock",$36.57,-0.86,-2.298%,"313,331,943"
OFSSH,OFS Capital Corporation 4.95% Notes due 2028,$23.38,UNCH,--,"313,247,064"
HTLM,HomesToLife Ltd Ordinary Shares,$3.49,0.03,0.867%,"313,009,375"
SLP,"Simulations Plus, Inc. Common Stock",$15.55,0.07,0.452%,"312,976,561"
GCL,GCL Global Holdings Ltd Ordinary Shares,$2.47,0.05,2.066%,"312,006,016"
QSI,Quantum-Si Incorporated Class A Common Stock,$1.54,0.08,5.479%,"311,842,605"
TCMD,"Tactile Systems Technology, Inc. Common Stock",$13.97,0.14,1.012%,"311,421,266"
XOMAO,XOMA Royalty Corporation Depositary Shares Rep Series B 8.375% Cumulative Preferred Stock,$25.75,0.13,0.507%,"311,258,764"
XPER,Xperi Inc. Common Stock ,$6.72,0.15,2.283%,"310,868,275"
LBRX,LB Pharmaceuticals Inc Common Stock,$15.46,-0.30,-1.904%,"310,748,118"
DRTS,Alpha Tau Medical Ltd. Ordinary Shares,$4.40,0.03,0.686%,"309,674,508"
CTGO,"Contango ORE, Inc. Common Stock",$24.43,-0.59,-2.358%,"309,516,154"
MPAA,"Motorcar Parts  of America, Inc. Common Stock",$15.99,-0.66,-3.964%,"309,440,639"
CHSCN,CHS Inc Preferred Class B Series 2 Reset Rate,$25.19,0.03,0.119%,"309,131,756"
ACTG,Acacia Research Corporation (Acacia Tech) Common Stock,$3.20,-0.07,-2.141%,"308,623,978"
SWKHL,SWK Holdings Corporation 9.00% Senior Notes due 2027,$25.39,0.0001,0.00%,"308,422,257"
NC,"NACCO Industries, Inc. Common Stock",$41.35,-0.65,-1.548%,"308,125,852"
SLSN,"Solesence, Inc. Common Stock",$4.36,1.12,34.568%,"307,301,280"
TBRG,"TruBridge, Inc. Common Stock",$20.46,0.14,0.689%,"307,138,195"
CHSCM,"CHS Inc Class B Reset Rate Cumulative Redeemable Preferred Stock, Series 3",$24.96,0.03,0.12%,"306,309,195"
MIN,MFS Intermediate Income Trust Common Stock,$2.665,-0.005,-0.187%,"306,202,560"
OFLX,"Omega Flex, Inc. Common Stock",$30.31,-0.55,-1.782%,"305,958,900"
MPX,Marine Products Corporation Common Stock,$8.73,-0.15,-1.689%,"305,515,517"
QUAD,"Quad Graphics, Inc Class A Common Stock",$6.05,-0.05,-0.82%,"305,362,467"
ONIT,Onity Group Inc. Common Stock,$37.87,-1.34,-3.417%,"305,051,257"
VNDA,Vanda Pharmaceuticals Inc. Common Stock,$5.16,0.06,1.176%,"304,899,911"
TBCH,Turtle Beach Corporation Common Stock,$15.39,-0.195,-1.251%,"304,824,128"
LYEL,"Lyell Immunopharma, Inc. Common Stock",$15.81,-0.74,-4.471%,"303,729,104"
EFTY,"Etoiles Capital Group Co., Ltd. Class A Ordinary Shares",$15.25,-0.74,-4.628%,"303,475,000"
SEG,Seaport Entertainment Group Inc. Common Stock,$23.79,0.53,2.279%,"302,896,112"
CZNC,Citizens & Northern Corp Common Stock,$19.52,-0.16,-0.813%,"302,851,687"
PLTS,Platinum Analytics Cayman Limited Class A Ordinary Shares,$17.02,0.82,5.062%,"302,260,035"
PKOH,Park-Ohio Holdings Corp. Common Stock,$20.99,-0.38,-1.778%,"302,155,080"
BCML,BayCom Corp Common Stock,$27.66,-0.45,-1.601%,"302,150,206"
ARQ,"Arq, Inc. Common Stock",$7.07,UNCH,--,"301,827,074"
FET,"Forum Energy Technologies, Inc. Common Stock",$25.35,-1.27,-4.771%,"301,748,047"
SCPH,scPharmaceuticals Inc. Common Stock,$5.66,UNCH,--,"301,668,355"
CTNM,"Contineum Therapeutics, Inc. Class A Common Stock",$10.75,-0.26,-2.361%,"301,450,371"
THH,TryHard Holdings Limited Ordinary Shares,$6.04,0.03,0.499%,"300,897,700"
NL,"NL Industries, Inc. Common Stock",$6.15,-0.02,-0.324%,"300,505,814"
