Symbol,Name,Last Sale,Net Change,% Change,Market Cap
GRBK,"Green Brick Partners, Inc. Common Stock",$63.15,-1.03,-1.605%,"2,751,135,939"
SUPN,"Supernus Pharmaceuticals, Inc. Common Stock",$49.00,-0.51,-1.03%,"2,747,581,312"
VCYT,"Veracyte, Inc. Common Stock",$34.80,-0.13,-0.372%,"2,737,771,262"
WOR,"Worthington Enterprises, Inc. Common Shares",$55.04,-0.66,-1.185%,"2,733,564,682"
VIAV,Viavi Solutions Inc. Common Stock,$12.27,-0.39,-3.081%,"2,731,982,286"
CIVI,"Civitas Resources, Inc. Common Stock",$29.48,-3.46,-10.504%,"2,731,617,065"
ABM,ABM Industries Incorporated Common Stock,$44.45,-0.53,-1.178%,"2,721,846,633"
RXO,"RXO, Inc. Common Stock",$16.59,-1.07,-6.059%,"2,720,548,295"
FSM,Fortuna Mining Corp. Common Shares,$8.85,-0.10,-1.117%,"2,716,595,876"
JOE,St. Joe Company (The) Common Stock,$46.89,-0.49,-1.034%,"2,715,316,201"
WRBY,Warby Parker Inc. Class A Common Stock,$22.26,-1.48,-6.234%,"2,714,795,809"
TPH,"Tri Pointe Homes, Inc. Common Stock",$31.02,-0.59,-1.866%,"2,714,451,971"
ELPC,Companhia Paranaense de Energia (COPEL) American Depositary Shares (each representing four (4) Common Shares),$8.35,0.07,0.845%,"2,708,997,806"
BATRA,"Atlanta Braves Holdings, Inc. Series A Common Stock",$43.09,-0.38,-0.874%,"2,704,121,697"
BHF,"Brighthouse Financial, Inc. Common Stock",$47.28,-1.03,-2.132%,"2,702,164,101"
STNG,Scorpio Tankers Inc. Common Shares,$54.11,-1.42,-2.557%,"2,700,984,088"
TTAM,Titan America SA Common Shares,$14.65,-0.20,-1.347%,"2,700,910,112"
BCC,"Boise Cascade, L.L.C. Common Stock",$72.32,-1.57,-2.125%,"2,700,246,047"
BKE,"Buckle, Inc. (The) Common Stock",$52.73,-1.21,-2.243%,"2,697,488,889"
NMFCZ,New Mountain Finance Corporation 8.250% Notes due 2028,$25.33,-0.01,-0.039%,"2,694,123,142"
BSM,"Black Stone Minerals, L.P. Common units representing limited partner interests",$12.69,-0.47,-3.571%,"2,688,414,202"
COLM,Columbia Sportswear Company Common Stock,$48.96,-2.43,-4.729%,"2,681,542,480"
APLE,"Apple Hospitality REIT, Inc. Common Shares",$11.31,-0.16,-1.395%,"2,680,355,147"
BBAI,"BigBear.ai, Inc. Common Stock",$7.22,-0.27,-3.605%,"2,676,477,090"
SFNC,Simmons First National Corporation Class A Common Stock,$18.45,-0.61,-3.20%,"2,669,732,435"
WHD,"Cactus, Inc. Class A Common Stock",$33.40,-2.55,-7.093%,"2,666,467,958"
REVG,"REV Group, Inc. Common Stock",$54.64,-2.08,-3.667%,"2,666,340,915"
BEAM,Beam Therapeutics Inc. Common Stock,$26.32,-1.55,-5.562%,"2,662,584,524"
FLO,"Flowers Foods, Inc. Common Stock",$12.60,0.08,0.639%,"2,660,845,635"
DAVE,Dave Inc. Class A Common Stock,$195.07,-11.60,-5.613%,"2,658,737,386"
INOD,Innodata Inc. Common Stock,$83.28,-8.45,-9.212%,"2,652,103,400"
BB,BlackBerry Limited Common Stock,$4.48,-0.37,-7.629%,"2,644,817,656"
XNET,Xunlei Limited American Depositary Shares,$8.48,-1.54,-15.369%,"2,644,575,607"
NTLA,"Intellia Therapeutics, Inc. Common Stock",$24.52,-0.94,-3.692%,"2,632,145,645"
SEZL,Sezzle Inc. Common Stock,$77.35,-4.34,-5.313%,"2,631,715,018"
HCM,HUTCHMED (China) Limited American Depositary Shares,$15.08,-0.94,-5.868%,"2,630,401,369"
SBCF,Seacoast Banking Corporation of Florida Common Stock,$29.91,-1.39,-4.441%,"2,627,734,526"
SXI,Standex International Corporation Common Stock,$217.17,-2.88,-1.309%,"2,620,864,459"
FTAIN,FTAI Aviation Ltd. 8.25% Fixed - Rate Reset Series C Cumulative Perpetual Redeemable Preferred Shares,$25.48,-0.2232,-0.868%,"2,613,498,837"
YETI,"YETI Holdings, Inc. Common Stock",$32.11,-1.06,-3.196%,"2,608,109,801"
LXP,LXP Industrial Trust Common Stock (Maryland REIT),$8.81,-0.16,-1.784%,"2,605,876,378"
CON,"Concentra Group Holdings Parent, Inc. Common Stock",$20.31,-0.56,-2.683%,"2,603,152,035"
GTX,Garrett Motion Inc. Common Stock,$12.91,-0.11,-0.845%,"2,602,339,176"
ENVA,"Enova International, Inc. Common Stock",$104.01,-3.99,-3.694%,"2,601,561,878"
WDFC,WD-40 Company Common Stock,$192.14,-0.58,-0.301%,"2,600,396,629"
MFAO,"MFA Financial, Inc. 9.000% Senior Notes due 2029",$25.32,-0.09,-0.354%,"2,599,571,535"
SM,SM Energy Company Common Stock,$22.60,-1.73,-7.111%,"2,597,959,767"
CAKE,Cheesecake Factory Incorporated (The) Common Stock,$52.08,-1.58,-2.944%,"2,594,127,038"
SBET,"SharpLink Gaming, Inc. Common Stock",$15.315,-1.635,-9.646%,"2,586,193,878"
MFAN,"MFA Financial, Inc. 8.875% Senior Notes due 2029",$25.17,-0.04,-0.159%,"2,584,171,229"
DNN,Denison Mines Corp Ordinary Shares (Canada),$2.88,0.05,1.767%,"2,582,072,283"
IAC,IAC Inc. Common Stock,$32.15,-1.26,-3.771%,"2,577,056,263"
EXTR,"Extreme Networks, Inc. Common Stock",$19.48,-1.44,-6.883%,"2,575,443,125"
GSHD,"Goosehead Insurance, Inc. Class A Common Stock",$68.57,-0.68,-0.982%,"2,575,356,791"
WU,Western Union Company (The) Common Stock,$7.93,-0.14,-1.735%,"2,561,130,538"
BLTE,"Belite Bio, Inc American Depositary Shares",$79.28,0.78,0.994%,"2,559,298,171"
FOLD,"Amicus Therapeutics, Inc. Common Stock",$8.30,0.03,0.363%,"2,558,386,804"
OLN,Olin Corporation Common Stock,$22.28,-2.57,-10.342%,"2,554,213,400"
AMSC,American Superconductor Corporation Common Stock,$56.24,-3.555,-5.945%,"2,539,850,478"
SGRY,"Surgery Partners, Inc. Common Stock",$19.74,-0.58,-2.854%,"2,530,853,753"
BWSN,"Babcock & Wilcox Enterprises, Inc. 8.125% Senior Notes due 2026",$25.02,0.02,0.08%,"2,529,460,501"
GLOB,Globant S.A. Common Shares,$57.34,-2.14,-3.598%,"2,525,572,296"
BFH,"Bread Financial Holdings, Inc. Common Stock",$54.08,-1.73,-3.10%,"2,522,422,614"
BATRK,"Atlanta Braves Holdings, Inc. Series C Common Stock",$40.19,-0.42,-1.034%,"2,522,131,609"
KEN,Kenon Holdings Ltd. Ordinary Shares,$48.18,-1.16,-2.351%,"2,512,598,660"
HURN,Huron Consulting Group Inc. Common Stock,$145.01,-2.49,-1.688%,"2,509,671,684"
SA,"Seabridge Gold, Inc. Ordinary Shares (Canada)",$24.55,0.61,2.548%,"2,507,268,521"
GEO,Geo Group Inc (The) REIT,$17.69,-0.56,-3.068%,"2,503,747,339"
UNFI,"United Natural Foods, Inc. Common Stock",$41.20,-1.28,-3.013%,"2,498,878,921"
FCPT,"Four Corners Property Trust, Inc. Common Stock",$23.90,-0.04,-0.167%,"2,496,697,057"
OGN,Organon & Co. Common Stock ,$9.60,-0.32,-3.226%,"2,495,669,558"
MGNI,"Magnite, Inc. Common Stock",$17.50,-1.05,-5.66%,"2,491,987,838"
CPRX,"Catalyst Pharmaceuticals, Inc. Common Stock",$20.36,-0.46,-2.209%,"2,491,880,964"
ALRM,"Alarm.com Holdings, Inc. Common Stock",$49.88,-2.35,-4.499%,"2,489,262,996"
ACLS,"Axcelis Technologies, Inc. Common Stock",$79.19,-5.42,-6.406%,"2,488,059,523"
AKR,Acadia Realty Trust Common Stock,$18.99,-0.58,-2.964%,"2,487,938,370"
CVBF,CVB Financial Corporation Common Stock,$18.05,-0.66,-3.528%,"2,487,607,662"
ALVO,Alvotech Ordinary Shares,$8.24,-0.06,-0.723%,"2,486,878,778"
DRD,DRDGOLD Limited American Depositary Shares,$28.76,0.73,2.604%,"2,486,557,130"
BOH,Bank of Hawaii Corporation Common Stock,$62.50,-2.15,-3.326%,"2,485,469,250"
PRK,Park National Corporation Common Stock,$154.46,-4.24,-2.672%,"2,482,380,258"
FA,First Advantage Corporation Common Stock,$14.26,-0.24,-1.655%,"2,481,105,386"
ATS,ATS Corporation Common Shares,$25.39,-0.96,-3.643%,"2,479,415,941"
AI,"C3.ai, Inc. Class A Common Stock",$17.91,-1.01,-5.338%,"2,468,888,055"
TIC,"TIC Solutions, Inc. Common Stock",$12.26,-1.07,-8.027%,"2,459,230,433"
WSBCO,"WesBanco, Inc. Depositary Shares each representing 1/40th interest in a share of 7.375% Fixed-Rate Reset Non-Cumulative Perpetual Preferred Stock, Series B",$25.57,-0.01,-0.039%,"2,454,459,774"
ALKT,"Alkami Technology, Inc. Common Stock",$23.53,-0.03,-0.127%,"2,449,076,237"
MTRN,Materion Corporation,$118.10,-7.24,-5.776%,"2,447,848,898"
XMTR,"Xometry, Inc. Class A Common Stock",$48.16,-3.61,-6.973%,"2,446,352,120"
BUR,Burford Capital Limited Ordinary Shares,$11.18,-0.37,-3.203%,"2,446,313,587"
PCT,"PureCycle Technologies, Inc. Common stock",$13.58,-0.92,-6.345%,"2,445,664,217"
CMPO,"CompoSecure, Inc. Class A Common Stock",$19.55,-0.75,-3.695%,"2,435,963,958"
BANC,"Banc of California, Inc. Common Stock",$16.48,-1.12,-6.364%,"2,435,387,571"
IRON,"Disc Medicine, Inc. Common Stock",$69.90,-0.85,-1.201%,"2,430,114,112"
WSBCP,"WesBanco, Inc. Depositary Shares, Each Representing a 1/40th Interest in a Share of 6.75% Fixed-Rate Reset Non-Cumulative Perpetual Preferred Stock, Series A",$25.30,0.005,0.02%,"2,428,542,522"
MEOH,Methanex Corporation Common Stock,$35.99,-1.82,-4.814%,"2,425,553,680"
TOWN,TowneBank Common Stock,$32.48,-1.20,-3.563%,"2,423,570,878"
AEO,"American Eagle Outfitters, Inc. Common Stock",$14.31,-0.84,-5.545%,"2,423,238,829"
SAH,"Sonic Automotive, Inc. Common Stock",$70.70,-1.77,-2.442%,"2,414,414,403"
CLVT,Clarivate Plc Ordinary Shares,$3.59,-0.02,-0.554%,"2,413,266,440"
PFS,"Provident Financial Services, Inc Common Stock",$18.47,-0.76,-3.952%,"2,412,628,106"
SMPL,The Simply Good Foods Company Common Stock,$23.99,-0.59,-2.40%,"2,411,990,489"
UE,Urban Edge Properties Common Shares of Beneficial Interest,$19.15,-0.41,-2.096%,"2,408,899,546"
ARQT,"Arcutis Biotherapeutics, Inc. Common Stock",$20.05,-0.66,-3.187%,"2,404,096,814"
SPNS,Sapiens International Corporation N.V. Common Shares (Cayman Islands),$43.01,0.03,0.07%,"2,403,709,547"
SYNA,Synaptics Incorporated Common Stock $0.001 Par Value,$62.02,-5.15,-7.667%,"2,397,472,533"
GDV,Gabelli Dividend & Income Trust Common Shares of Beneficial Interest,$26.53,-0.53,-1.959%,"2,392,700,666"
RNG,"RingCentral, Inc. Class A Common Stock",$26.39,-1.51,-5.412%,"2,389,422,381"
FLNC,"Fluence Energy, Inc. Class A Common Stock",$13.09,-1.81,-12.148%,"2,389,005,883"
HCI,"HCI Group, Inc. Common Stock",$184.24,-2.51,-1.344%,"2,387,712,447"
HBI,Hanesbrands Inc. Common Stock,$6.74,-0.13,-1.892%,"2,384,147,870"
GRAL,"GRAIL, Inc. Common Stock ",$66.13,-5.00,-7.029%,"2,383,840,948"
DAN,Dana Incorporated Common Stock ,$18.13,-0.24,-1.306%,"2,377,815,366"
COCO,"The Vita Coco Company, Inc. Common Stock",$41.80,-0.97,-2.268%,"2,375,200,606"
TDW,Tidewater Inc. Common Stock,$47.98,-3.10,-6.069%,"2,374,642,857"
MFICL,MidCap Financial Investment Corporation 8.00% Notes due 2028,$25.4425,0.0325,0.128%,"2,373,877,403"
ENVX,Enovix Corporation Common Stock,$12.07,-0.48,-3.825%,"2,372,962,157"
PENN,"PENN Entertainment, Inc. Common Stock",$16.24,-0.64,-3.791%,"2,371,116,555"
XRAY,DENTSPLY SIRONA Inc. Common Stock,$11.83,-0.39,-3.191%,"2,359,894,076"
AGIO,"Agios Pharmaceuticals, Inc. Common Stock",$40.61,-1.82,-4.289%,"2,359,502,646"
FRPT,"Freshpet, Inc. Common Stock",$48.35,-1.66,-3.319%,"2,358,506,860"
HAE,Haemonetics Corporation Common Stock,$48.85,-1.30,-2.592%,"2,353,458,956"
CURB,Curbline Properties Corp. Common Stock,$22.36,-0.20,-0.887%,"2,352,599,082"
DRVN,Driven Brands Holdings Inc. Common Stock,$14.30,-0.03,-0.209%,"2,349,203,299"
SAM,"Boston Beer Company, Inc. (The) Common Stock",$215.68,-10.86,-4.794%,"2,348,458,209"
ACMR,"ACM Research, Inc. Class A Common Stock",$36.59,-4.48,-10.908%,"2,348,381,509"
MESO,Mesoblast Limited American Depositary Shares,$18.32,-1.21,-6.196%,"2,347,098,292"
DXC,DXC Technology Company Common Stock ,$12.89,-0.69,-5.081%,"2,345,474,596"
PTRN,Pattern Group Inc. Series A Common Stock,$13.32,-0.70,-4.993%,"2,344,582,098"
SHOO,"Steven Madden, Ltd. Common Stock",$32.25,-1.745,-5.133%,"2,343,039,642"
FFBC,First Financial Bancorp. Common Stock,$24.39,-1.10,-4.315%,"2,335,438,987"
CHEF,"The Chefs' Warehouse, Inc. Common Stock",$57.10,0.98,1.746%,"2,327,547,772"
BWNB,"Babcock & Wilcox Enterprises, Inc. 6.50% Senior Notes due 2026",$23.00,-0.2201,-0.948%,"2,325,243,466"
BITF,Bitfarms Ltd. Common Stock,$4.20,0.03,0.719%,"2,320,918,375"
CGAU,Centerra Gold Inc. Common Shares,$11.35,0.16,1.43%,"2,319,100,009"
NSA,National Storage Affiliates Trust Common Shares of Beneficial Interest,$30.16,-0.61,-1.982%,"2,315,233,938"
ADPT,Adaptive Biotechnologies Corporation Common Stock,$15.17,-0.48,-3.067%,"2,309,995,291"
RXRX,"Recursion Pharmaceuticals, Inc. Class A Common Stock",$5.32,-0.59,-9.983%,"2,309,686,166"
DEI,"Douglas Emmett, Inc. Common Stock",$13.77,-0.67,-4.64%,"2,305,736,240"
MH,"McGraw Hill, Inc. Common Stock",$12.05,-0.41,-3.291%,"2,301,568,304"
IDYA,"IDEAYA Biosciences, Inc. Common Stock",$26.24,-0.55,-2.053%,"2,299,770,321"
GRND,Grindr Inc. Common Stock,$11.96,-0.38,-3.079%,"2,296,052,742"
PINC,"Premier, Inc. Class A Common Stock",$27.78,-0.11,-0.394%,"2,293,229,027"
VNET,"VNET Group, Inc. American Depositary Shares",$8.51,-1.07,-11.169%,"2,289,410,418"
DKL,"Delek Logistics Partners, L.P. Common Units representing Limited Partner Interests",$42.77,-0.63,-1.452%,"2,286,647,966"
BUSEP,"First Busey Corporation Depositary Shares, Each Representing a 1/40thInterest in a Share of 8.25% Fixed-Rate Series B Non-Cumulative Perpetual Preferred Stock, $0.001 par value",$25.61,-0.04,-0.156%,"2,280,977,955"
CPRI,Capri Holdings Limited Ordinary Shares,$19.11,-1.40,-6.826%,"2,275,008,369"
VTMX,"Corporacion Inmobiliaria Vesta, S.A.B de C.V. American Depositary Shares, each representing ten (10) Common Shares",$25.70,-0.44,-1.683%,"2,273,130,151"
COGT,"Cogent Biosciences, Inc. Common Stock",$16.27,0.08,0.494%,"2,272,931,951"
TRMK,Trustmark Corporation Common Stock,$37.62,-1.74,-4.421%,"2,270,990,476"
VSCO,Victorias Secret & Co. Common Stock ,$28.25,-1.34,-4.529%,"2,264,646,701"
WAFD,"WaFd, Inc. Common Stock",$28.61,-0.30,-1.038%,"2,254,240,665"
ADAMM,"Adamas Trust, Inc. 7.875% Series E Fixed-to-Floating Rate Cumulative Redeemable Preferred Stock",$24.9201,-0.0084,-0.034%,"2,250,633,513"
FORTY,Formula Systems (1985) Ltd. American Depositary Shares,$146.825,-3.175,-2.117%,"2,249,016,457"
PRDO,Perdoceo Education Corporation Common Stock,$34.62,-0.18,-0.517%,"2,248,685,981"
DNLI,Denali Therapeutics Inc. Common Stock,$15.37,-0.80,-4.947%,"2,247,282,713"
GLPG,Galapagos NV American Depositary Shares,$34.10,0.08,0.235%,"2,247,090,121"
ADAMI,"Adamas Trust, Inc. 9.125% Senior Notes Due 2029",$24.8068,0.0668,0.27%,"2,246,986,275"
DIOD,Diodes Incorporated Common Stock,$48.37,-4.12,-7.849%,"2,246,435,092"
TVTX,"Travere Therapeutics, Inc. Common Stock",$25.16,-0.91,-3.491%,"2,242,729,013"
ZGN,Ermenegildo Zegna N.V. Ordinary Shares,$8.87,-0.84,-8.651%,"2,240,383,527"
ACHC,"Acadia Healthcare Company, Inc. Common Stock",$24.26,-0.92,-3.654%,"2,240,328,322"
BHC,Bausch Health Companies Inc. Common Stock,$6.05,-0.34,-5.321%,"2,237,231,430"
SFB,Stifel Financial Corporation 5.20% Senior Notes due 2047,$21.87,0.04,0.183%,"2,234,532,389"
GCMG,GCM Grosvenor Inc. Class A Common Stock,$11.45,-0.13,-1.123%,"2,231,446,418"
IBRX,"ImmunityBio, Inc. Common Stock",$2.36,-0.08,-3.279%,"2,230,801,057"
UPWK,Upwork Inc. Common Stock,$16.80,-0.625,-3.587%,"2,227,790,527"
OII,"Oceaneering International, Inc. Common Stock",$22.20,-1.28,-5.451%,"2,224,608,631"
INSP,"Inspire Medical Systems, Inc. Common Stock",$75.17,-4.97,-6.202%,"2,223,101,334"
EXK,Endeavour Silver Corporation Ordinary Shares (Canada),$7.66,0.07,0.922%,"2,222,711,584"
PGY,Pagaya Technologies Ltd. Class A Ordinary Shares,$27.19,-3.13,-10.323%,"2,218,933,103"
PMTU,PennyMac Mortgage Investment Trust 8.50% Senior Notes due 2028,$25.50,0.24,0.95%,"2,218,923,402"
MQ,"Marqeta, Inc. Class A Common Stock",$4.94,-0.12,-2.372%,"2,214,269,795"
ALG,"Alamo Group, Inc. Common Stock",$182.55,-2.94,-1.585%,"2,210,846,621"
ERO,Ero Copper Corp. Common Shares,$21.34,-1.22,-5.408%,"2,210,227,888"
BULLW,Webull Corporation Warrants,$4.77,-0.35,-6.836%,"2,201,122,424"
ETNB,"89bio, Inc. Common Stock",$14.80,-0.07,-0.471%,"2,194,962,100"
TRN,"Trinity Industries, Inc. Common Stock",$27.15,-0.66,-2.373%,"2,194,734,297"
ABR,Arbor Realty Trust Common Stock,$11.39,-0.13,-1.128%,"2,190,313,105"
KWR,Quaker Houghton Common Stock,$125.67,-2.42,-1.889%,"2,185,981,770"
LUNR,"Intuitive Machines, Inc. Class A Common Stock",$12.23,-0.51,-4.003%,"2,185,730,789"
PAX,Patria Investments Limited Class A Common Shares,$13.80,-0.22,-1.569%,"2,181,440,410"
VICR,Vicor Corporation Common Stock,$48.56,-4.06,-7.716%,"2,181,279,460"
WBTN,WEBTOON Entertainment Inc. Common stock,$16.70,-0.28,-1.649%,"2,181,158,209"
DFH,"Dream Finders Homes, Inc. Class A Common Stock",$23.44,-0.10,-0.425%,"2,177,146,673"
HP,"Helmerich & Payne, Inc. Common Stock",$21.85,-1.38,-5.941%,"2,172,760,351"
ASH,Ashland Inc. Common Stock,$47.51,-0.99,-2.041%,"2,171,490,065"
AMBP,Ardagh Metal Packaging S.A. Ordinary Shares,$3.63,-0.04,-1.09%,"2,169,649,497"
VAC,Marriott Vacations Worldwide Corporation Common Stock,$62.49,-2.36,-3.639%,"2,162,310,163"
SRPT,"Sarepta Therapeutics, Inc. Common Stock (DE)",$22.11,-1.02,-4.41%,"2,160,444,114"
IQ,"iQIYI, Inc. American Depositary Shares",$2.24,-0.11,-4.681%,"2,157,027,820"
SPNT,SiriusPoint Ltd. Common Shares,$18.45,-0.05,-0.27%,"2,154,213,495"
NOG,"Northern Oil and Gas, Inc. Common Stock",$22.04,-1.60,-6.768%,"2,150,986,791"
INSW,"International Seaways, Inc. Common Stock ",$43.50,-1.21,-2.706%,"2,147,433,006"
IHS,IHS Holding Limited Ordinary Shares,$6.43,-0.28,-4.173%,"2,144,025,225"
SII,Sprott Inc. Common Shares,$82.71,-0.07,-0.085%,"2,133,918,000"
SPHR,Sphere Entertainment Co. Class A Common Stock,$58.97,-0.18,-0.304%,"2,122,885,620"
IVT,InvenTrust Properties Corp. Common Stock,$27.24,-0.29,-1.053%,"2,113,998,227"
MRX,Marex Group plc Ordinary Shares,$30.07,-1.45,-4.60%,"2,113,646,942"
BANR,Banner Corporation Common Stock,$61.04,-1.84,-2.926%,"2,111,038,002"
APPN,Appian Corporation Class A Common Stock,$28.51,-1.33,-4.457%,"2,110,651,094"
PAYO,Payoneer Global Inc. Common Stock,$5.85,-0.21,-3.465%,"2,107,845,927"
SKE,Skeena Resources Limited Common Shares,$18.30,0.33,1.836%,"2,105,154,298"
PK,Park Hotels & Resorts Inc. Common Stock ,$10.48,-0.27,-2.512%,"2,095,093,438"
AMR,"Alpha Metallurgical Resources, Inc. Common Stock",$160.02,-7.42,-4.431%,"2,088,872,756"
FRME,First Merchants Corporation Common Stock,$36.18,-1.12,-3.003%,"2,088,756,025"
OSW,OneSpaWorld Holdings Limited Common Shares,$20.32,-0.78,-3.697%,"2,086,807,815"
EPAC,Enerpac Tool Group Corp. Common Stock,$38.64,-0.35,-0.898%,"2,084,138,354"
SEDG,"SolarEdge Technologies, Inc. Common Stock",$35.06,-3.55,-9.195%,"2,081,680,243"
ADUS,Addus HomeCare Corporation Common Stock,$112.91,-1.47,-1.285%,"2,078,361,355"
ATKR,Atkore Inc. Common Stock,$61.61,-1.81,-2.854%,"2,073,530,326"
PTEN,"Patterson-UTI Energy, Inc. Common Stock",$5.37,-0.34,-5.954%,"2,068,349,486"
CCOI,"Cogent Communications Holdings, Inc.",$42.05,-1.61,-3.688%,"2,068,132,913"
AVDX,"AvidXchange Holdings, Inc. Common Stock",$9.95,-0.01,-0.10%,"2,066,602,592"
HWCPZ,Hancock Whitney Corporation 6.25% Subordinated Notes due 2060,$24.36,0.19,0.786%,"2,064,631,264"
UMBFO,"UMB Financial Corporation Depositary Shares Each Representing a 1/400th Interest in a Share of 7.750% Fixed-Rate Reset Non-Cumulative Perpetual Preferred Stock, Series B",$27.17,-0.08,-0.294%,"2,062,970,688"
LCII,LCI Industries,$84.90,-2.35,-2.693%,"2,058,339,627"
NBTB,NBT Bancorp Inc. Common Stock,$39.27,-1.48,-3.632%,"2,057,515,718"
CRGY,Crescent Energy Company Class A Common Stock,$8.08,-0.88,-9.821%,"2,057,290,638"
OCUL,"Ocular Therapeutix, Inc. Common Stock",$11.78,-0.16,-1.34%,"2,049,663,703"
FIHL,Fidelis Insurance Holdings Limited Common Shares,$18.32,0.01,0.055%,"2,047,687,570"
AAUC,Allied Gold Corporation Common Shares,$17.74,0.04,0.226%,"2,047,196,000"
USARW,"USA Rare Earth, Inc. Warrant",$21.00,1.57,8.08%,"2,045,968,827"
CIMN,Chimera Investment Corporation 9.000% Senior Notes due 2029,$25.38,-0.0001,0.00%,"2,043,869,064"
BKD,Brookdale Senior Living Inc. Common Stock,$8.59,-0.29,-3.266%,"2,040,042,983"
FBNC,First Bancorp Common Stock,$49.19,-1.17,-2.323%,"2,039,536,341"
ARMN,Aris Mining Corporation Common Shares,$10.07,-0.18,-1.756%,"2,038,168,000"
UAA,"Under Armour, Inc. Class A Common Stock",$4.75,-0.06,-1.247%,"2,036,896,335"
EFSC,Enterprise Financial Services Corporation Common Stock,$54.98,-1.85,-3.255%,"2,033,595,622"
FUN,Six Flags Entertainment Corporation Common Stock New,$20.06,-1.07,-5.064%,"2,031,664,002"
DBRG,"DigitalBridge Group, Inc.",$11.14,-0.49,-4.213%,"2,028,857,149"
NWL,Newell Brands Inc. Common Stock,$4.84,-0.14,-2.811%,"2,028,444,000"
HUBG,"Hub Group, Inc. Class A Common Stock",$33.12,-1.98,-5.641%,"2,027,592,523"
EYE,"National Vision Holdings, Inc. Common Stock",$25.56,-1.82,-6.647%,"2,024,259,549"
CMBT,CMB.TECH NV Ordinary Shares,$9.20,0.12,1.322%,"2,024,227,360"
ONDS,Ondas Holdings Inc. Common Stock,$9.22,-1.27,-12.107%,"2,020,699,622"
CUBI,"Customers Bancorp, Inc Common Stock",$63.79,-1.28,-1.967%,"2,017,262,427"
HTH,Hilltop Holdings Inc.,$32.01,-0.47,-1.447%,"2,016,686,306"
PHIN,PHINIA Inc. Common Stock,$51.78,-0.84,-1.596%,"2,014,473,716"
AMRC,"Ameresco, Inc. Class A Common Stock",$38.18,-1.35,-3.415%,"2,012,225,701"
DBD,Diebold Nixdorf Incorporated Common stock,$54.90,-3.79,-6.458%,"2,011,181,566"
CSTM,Constellium SE Ordinary Shares (France),$14.41,-0.59,-3.933%,"2,010,757,321"
ARDT,"Ardent Health, Inc. Common Stock",$14.05,-0.29,-2.022%,"2,010,645,580"
DJTWW,Trump Media & Technology Group Corp. Warrants,$7.2495,-0.6605,-8.35%,"2,008,600,087"
BBT,Beacon Financial Corporation Common stock,$23.82,-0.08,-0.335%,"2,007,364,804"
ADAML,"Adamas Trust, Inc. 6.875% Series F Fixed-to-Floating Rate Cumulative Redeemable Preferred Stock, $0.01 par value per share",$22.18,0.0176,0.079%,"2,003,164,165"
WWW,"Wolverine World Wide, Inc. Common Stock",$24.64,-1.05,-4.087%,"2,002,107,209"
BUSE,First Busey Corporation Class A Common Stock,$22.46,-0.83,-3.564%,"2,000,420,339"
DYN,"Dyne Therapeutics, Inc. Common Stock",$14.05,-0.63,-4.292%,"1,998,805,547"
LQDA,Liquidia Corporation Common Stock,$23.19,-1.06,-4.371%,"1,996,460,818"
SONO,"Sonos, Inc. Common Stock",$16.51,-1.22,-6.881%,"1,995,733,373"
ADAMN,"Adamas Trust, Inc. 8.00% Series D Fixed-to-Floating Rate Cumulative Redeemable Preferred Stock",$22.08,-0.01,-0.045%,"1,994,132,767"
KLIC,"Kulicke and Soffa Industries, Inc. Common Stock",$38.18,-2.70,-6.605%,"1,990,916,183"
ASGN,ASGN Incorporated Common Stock,$45.41,-2.17,-4.561%,"1,988,958,000"
VSH,"Vishay Intertechnology, Inc. Common Stock",$14.66,-1.23,-7.741%,"1,987,688,004"
MSGE,Madison Square Garden Entertainment Corp. Class A Common Stock,$41.77,-0.11,-0.263%,"1,982,398,269"
SKWD,"Skyward Specialty Insurance Group, Inc. Common Stock",$48.93,0.30,0.617%,"1,981,012,078"
EVTC,"Evertec, Inc. Common Stock",$30.89,-0.95,-2.984%,"1,976,404,134"
JSM,"Navient Corporation 6% Senior Notes due December 15, 2043",$19.87,-0.05,-0.251%,"1,975,694,725"
HNI,HNI Corporation Common Stock,$43.10,-1.19,-2.687%,"1,974,162,572"
PSIX,"Power Solutions International, Inc. Common Stock",$85.72,-5.46,-5.988%,"1,974,118,399"
UA,"Under Armour, Inc. Class C Common Stock",$4.59,-0.11,-2.34%,"1,968,285,090"
SBLK,Star Bulk Carriers Corp. Common Shares,$16.79,-0.90,-5.088%,"1,966,571,245"
TSLX,"Sixth Street Specialty Lending, Inc. Common Stock",$20.86,-0.19,-0.903%,"1,965,853,659"
SLDE,"Slide Insurance Holdings, Inc. Common Stock",$15.66,-0.10,-0.635%,"1,965,289,801"
LFST,"LifeStance Health Group, Inc. Common Stock",$5.05,-0.31,-5.784%,"1,964,128,790"
SYBT,"Stock Yards Bancorp, Inc. Common Stock",$66.63,-2.41,-3.491%,"1,963,808,111"
CSAN,Cosan S.A. ADS,$4.22,-0.13,-2.989%,"1,960,870,467"
GRABW,Grab Holdings Limited Warrant,$0.4811,-0.0189,-3.78%,"1,960,067,825"
OZKAP,Bank OZK 4.625% Series A Non-Cumulative Perpetual Preferred Stock,$17.30,-0.23,-1.312%,"1,957,255,084"
CELC,Celcuity Inc. Common Stock,$46.07,-3.40,-6.873%,"1,954,598,576"
EVCM,EverCommerce Inc. Common Stock,$10.78,-0.37,-3.318%,"1,954,184,968"
GT,The Goodyear Tire & Rubber Company Common Stock,$6.83,-0.30,-4.208%,"1,953,697,335"
LBRT,Liberty Energy Inc. Class A common stock,$12.05,-0.51,-4.061%,"1,951,566,547"
IRDM,Iridium Communications Inc Common Stock,$18.38,-1.34,-6.795%,"1,950,373,813"
WLYB,"John Wiley & Sons, Inc. Common Stock",$36.65,0.45,1.243%,"1,949,872,321"
ANIP,"ANI Pharmaceuticals, Inc.",$89.79,-0.99,-1.091%,"1,948,410,316"
LMAT,"LeMaitre Vascular, Inc. Common Stock",$86.05,-1.27,-1.454%,"1,947,958,768"
PNFPP,"Pinnacle Financial Partners, Inc. Depositary shares of Pinnacle Financial Partners, Inc., each representing a 1/40th Interest in a share of its 6.75% Fixed-Rate Non-Cumulative Perpetual Preferred Stock, Series B",$25.1089,-0.1511,-0.598%,"1,947,545,414"
ATEC,"Alphatec Holdings, Inc. Common Stock",$13.14,-0.62,-4.506%,"1,944,506,804"
DK,"Delek US Holdings, Inc. Common Stock",$32.31,-2.05,-5.966%,"1,943,524,270"
POWI,"Power Integrations, Inc. Common Stock",$34.64,-2.87,-7.651%,"1,943,150,960"
TRMD,TORM plc Class A Common Stock,$19.85,-0.66,-3.218%,"1,941,608,912"
VITL,"Vital Farms, Inc. Common Stock",$43.40,-0.28,-0.641%,"1,939,371,532"
PACS,"PACS Group, Inc. Common Stock",$12.72,-0.38,-2.901%,"1,938,524,604"
WLY,"John Wiley & Sons, Inc. Common Stock",$36.39,0.19,0.525%,"1,936,039,666"
SMA,"SmartStop Self Storage REIT, Inc. Common Stock",$34.91,-0.48,-1.356%,"1,935,429,426"
TDC,Teradata Corporation Common Stock,$20.42,-1.30,-5.985%,"1,929,690,000"
NGVT,Ingevity Corporation Common Stock ,$52.85,-1.15,-2.13%,"1,927,243,162"
CXW,"CoreCivic, Inc. Common Stock",$17.99,-0.32,-1.748%,"1,926,008,465"
SID,Companhia Siderurgica Nacional S.A. Common Stock,$1.45,-0.13,-8.228%,"1,922,836,223"
VERA,"Vera Therapeutics, Inc. Class A Common Stock",$30.09,-0.44,-1.441%,"1,920,454,080"
WT,"WisdomTree, Inc. Common Stock",$13.04,-0.28,-2.102%,"1,918,276,858"
PRGS,Progress Software Corporation Common Stock (DE),$44.65,-1.76,-3.792%,"1,915,823,134"
IE,Ivanhoe Electric Inc. Common Stock,$14.41,-0.53,-3.548%,"1,913,896,328"
KN,Knowles Corporation Common Stock,$22.27,-1.20,-5.113%,"1,912,716,986"
NIC,Nicolet Bankshares Inc. Common Stock,$128.59,-3.00,-2.28%,"1,910,447,228"
YELP,Yelp Inc. Common Stock,$30.27,-0.91,-2.919%,"1,908,846,027"
SVV,"Savers Value Village, Inc. Common Stock",$12.27,-0.62,-4.81%,"1,908,671,924"
FRA,Blackrock Floating Rate Income Strategies Fund Inc  Common Stock,$12.81,-0.12,-0.928%,"1,905,647,254"
NNE,Nano Nuclear Energy Inc. Common Stock,$45.83,-1.58,-3.333%,"1,905,642,244"
CERT,"Certara, Inc. Common Stock",$11.86,-1.08,-8.346%,"1,904,995,659"
AORT,"Artivion, Inc. Common Stock",$40.20,-0.15,-0.372%,"1,896,783,052"
BWLP,BW LPG Limited Common Shares,$12.51,-0.68,-5.155%,"1,895,745,922"
