Symbol,Name,Last Sale,Net Change,% Change,Market Cap
GREEL,Greenidge Generation Holdings Inc. 8.50% Senior Notes due 2026,$18.98,-0.0099,-0.052%,"297,481,455"
CARL,"Carlsmed, Inc. Common Stock",$11.18,0.23,2.10%,"297,308,711"
GASS,"StealthGas, Inc. Common Stock",$8.04,0.18,2.29%,"297,308,579"
NWFL,Norwood Financial Corp. Common Stock,$32.08,0.56,1.777%,"297,195,536"
CAMP,CAMP4 Therapeutics Corporation Common Stock,$4.06,0.21,5.455%,"297,175,654"
NL,"NL Industries, Inc. Common Stock",$6.08,-0.22,-3.492%,"297,085,423"
OWLT,"Owlet, Inc. Class A Common Stock",$10.77,-0.16,-1.464%,"297,043,137"
NIOBW,NioCorp Developments Ltd. Warrant,$2.37,-0.09,-3.659%,"297,011,178"
ARMP,"Armata Pharmaceuticals, Inc. Common Stock",$8.15,UNCH,--,"296,716,276"
NLOP,Net Lease Office Properties Common Shares of Beneficial Interest,$20.00,0.20,1.01%,"296,281,500"
RMMZ,"RiverNorth Managed Duration Municipal Income Fund II, Inc. Common Stock",$14.99,-0.12,-0.794%,"295,897,024"
EXOD,"Exodus Movement, Inc. Class A Common Stock",$10.09,-1.18,-10.47%,"295,885,063"
TBRG,"TruBridge, Inc. Common Stock",$19.69,0.19,0.974%,"295,526,934"
MIN,MFS Intermediate Income Trust Common Stock,$2.57,-0.02,-0.772%,"295,287,271"
PHOE,Phoenix Asia Holdings Limited Ordinary Shares,$13.67,3.03,28.477%,"295,272,000"
BLFY,Blue Foundry Bancorp Common Stock,$14.18,0.05,0.354%,"294,394,171"
ASPN,"Aspen Aerogels, Inc. Common Stock",$3.56,0.03,0.85%,"294,223,608"
EM,Smart Share Global Limited American Depositary Shares,$1.16,UNCH,--,"294,140,337"
CPZ,Calamos Long/Short Equity & Dynamic Income Trust Common Stock,$14.91,0.05,0.336%,"292,716,013"
FVCB,"FVCBankcorp, Inc. Common Stock",$16.19,0.43,2.728%,"292,631,239"
GLDG,GoldMining Inc. Common Shares,$1.46,-0.04,-2.667%,"292,329,274"
ACIU,AC Immune SA Common Stock,$2.91,-0.08,-2.676%,"292,194,197"
PUBM,"PubMatic, Inc. Class A Common Stock",$6.29,-0.25,-3.823%,"291,949,105"
BMM,Blue Moon Metals Inc. Common Shares,$3.60,-0.25,-6.494%,"291,035,743"
LITB,"LightInTheBox Holding Co., Ltd. American Depositary Shares, each representing twelve ordinary shares",$2.63,-0.0195,-0.736%,"290,179,425"
OCCIO,"OFS Credit Company, Inc. 6.125% Series C Term Preferred Stock",$24.96,-0.04,-0.16%,"289,948,090"
FUND,"Sprott Focus Trust, Inc. Common Stock",$9.78,UNCH,--,"289,816,187"
WNEB,"Western New England Bancorp, Inc. Common Stock",$14.08,0.03,0.214%,"288,526,881"
ACRE,Ares Commercial Real Estate Corporation Common Stock,$5.21,0.04,0.774%,"288,465,571"
ALMU,"Aeluma, Inc. Common Stock",$15.98,1.55,10.742%,"288,427,910"
BYRN,"Byrna Technologies, Inc. Common Stock",$12.64,0.13,1.039%,"286,565,017"
OCCIN,"OFS Credit Company, Inc. 5.25% Series E Term Preferred Stock Due 2026",$24.66,0.0999,0.407%,"286,463,137"
AIRO,"AIRO Group Holdings, Inc. Common Stock",$9.15,-0.05,-0.543%,"286,430,081"
VFSWW,VinFast Auto Ltd. Warrant,$0.122,-0.005,-3.937%,"285,420,546"
BRT,BRT Apartments Corp. (MD) Common Stock,$15.00,0.50,3.448%,"285,305,910"
PDYN,Palladyne AI Corp. Common Stock,$6.38,-0.34,-5.06%,"285,246,119"
CABA,"Cabaletta Bio, Inc. Common Stock",$2.96,0.16,5.714%,"284,945,004"
JMSB,"John Marshall Bancorp, Inc. Common Stock",$20.10,0.10,0.50%,"284,928,354"
EOLS,"Evolus, Inc. Common Stock",$4.39,0.09,2.093%,"284,558,852"
CHMG,Chemung Financial Corp Common Stock,$59.24,-0.20,-0.336%,"284,017,235"
RMM,"RiverNorth Managed Duration Municipal Income Fund, Inc. Common Stock",$14.37,-0.20,-1.373%,"283,658,454"
PRE,Prenetics Global Limited Class A Ordinary Share,$21.74,-0.23,-1.047%,"283,358,747"
SGHT,"Sight Sciences, Inc. Common Stock",$5.35,-0.01,-0.187%,"282,863,761"
SPOK,"Spok Holdings, Inc. Common Stock",$13.73,0.01,0.073%,"282,812,860"
OVLY,Oak Valley Bancorp (CA) Common Stock,$33.69,0.08,0.238%,"282,599,165"
RC,Ready Capital Corporation Common Stock,$1.74,0.05,2.959%,"282,099,720"
MBCN,Middlefield Banc Corp. Common Stock,$34.87,0.04,0.115%,"281,989,715"
SKYX,SKYX Platforms Corp. Common Stock,$2.14,UNCH,--,"281,442,331"
GDEV,GDEV Inc. Ordinary Shares,$15.52,0.62,4.161%,"281,378,997"
MMT,MFS Multimarket Income Trust Common Stock,$4.715,-0.075,-1.566%,"280,770,258"
CLLS,Cellectis S.A. American Depositary Shares,$3.88,0.15,4.021%,"279,724,227"
NERV,"Minerva Neurosciences, Inc Common Stock",$6.45,0.18,2.871%,"279,119,867"
DSX,Diana Shipping inc. common stock,$2.41,0.02,0.837%,"279,000,545"
AVTX,"Avalo Therapeutics, Inc. Common Stock",$15.07,0.81,5.68%,"278,987,248"
RMNI,"Rimini Street, Inc. (DE) Common Stock",$3.04,0.01,0.33%,"278,926,080"
ATGL,Alpha Technology Group Limited Class A Ordinary Shares,$16.91,-0.49,-2.816%,"278,380,875"
ACV,Virtus Diversified Income & Convertible Fund Common Shares of Beneficial Interest,$26.85,0.01,0.037%,"278,245,315"
VERI,"Veritone, Inc. Common Stock",$3.03,-0.16,-5.016%,"278,172,250"
DEFT,"Defi Technologies, Inc. Common Stock",$0.7196,-0.0429,-5.626%,"277,677,791"
NODK,"NI Holdings, Inc. Common Stock",$13.46,0.15,1.127%,"277,353,355"
PAMT,PAMT CORP Common Stock,$13.24,1.43,12.108%,"277,060,505"
ARL,"American Realty Investors, Inc. Common Stock",$17.15,UNCH,--,"277,007,537"
DAVA,Endava plc American Depositary Shares (each representing one Class A Ordinary Share),$5.09,-0.01,-0.196%,"276,527,499"
FCNCO,"First Citizens BancShares, Inc. 5.625% Non-Cumulative Perpetual Preferred Stock, Series C",$22.75,0.35,1.563%,"276,165,867"
MCR,MFS Charter Income Trust Common Stock,$6.27,-0.05,-0.791%,"275,932,543"
IONR,ioneer Ltd American Depositary Shares,$4.13,-0.19,-4.398%,"275,451,345"
RDIB,Reading International Inc Class B Common Stock,$12.09,-0.01,-0.083%,"274,651,673"
MPX,Marine Products Corporation Common Stock,$7.84,-0.14,-1.754%,"274,392,427"
PCYO,Pure Cycle Corporation Common Stock,$11.39,0.20,1.787%,"274,391,991"
EOT,Eaton Vance Municipal Income Trust EATON VANCE NATIONAL MUNICIPAL OPPORTUNITIES TRUST,$17.54,-0.13,-0.736%,"274,061,114"
PNRG,PrimeEnergy Resources Corporation Common Stock,$167.50,-4.41,-2.565%,"273,862,500"
STRO,"Sutro Biopharma, Inc. Common Stock",$16.635,0.475,2.939%,"273,350,828"
ABEO,Abeona Therapeutics Inc. Common Stock,$5.04,0.03,0.599%,"273,124,459"
PLG,Platinum Group Metals Ltd. Ordinary Shares (Canada),$2.21,-0.07,-3.07%,"272,725,136"
NRC,National Research Corporation Common Stock (Delaware),$12.03,-0.05,-0.414%,"272,568,775"
CCCC,"C4 Therapeutics, Inc. Common Stock",$1.83,-0.06,-3.175%,"271,920,657"
FGBIP,"First Guaranty Bancshares, Inc. 6.75% Series A Fixed-Rate Non-Cumulative Perpetual Preferred Stock",$17.694,-0.126,-0.707%,"271,655,044"
AARD,"Aardvark Therapeutics, Inc. Common Stock",$12.45,0.35,2.893%,"271,077,236"
XFOR,"X4 Pharmaceuticals, Inc. Common Stock",$3.10,-0.31,-9.091%,"271,053,733"
MITT,"TPG Mortgage Investment Trust, Inc. Common Stock",$8.53,-0.11,-1.273%,"270,780,150"
FBLA,"FB Bancorp, Inc. Common Stock",$13.63,0.18,1.338%,"270,385,125"
VYGR,"Voyager Therapeutics, Inc. Common Stock",$3.41,0.02,0.59%,"269,809,167"
XWIN,"XMAX, Inc. Common Stock",$6.26,0.06,0.968%,"269,629,011"
DERM,Journey Medical Corporation Common Stock,$8.10,0.37,4.787%,"269,378,363"
CCRN,"Cross Country Healthcare, Inc. Common Stock $0.0001 Par Value",$8.22,0.14,1.733%,"269,286,805"
NGNE,Neurogene Inc. Common Stock ,$17.38,UNCH,--,"269,212,724"
SI,"Shoulder Innovations, Inc. Common Stock",$13.06,UNCH,--,"269,057,993"
QTRX,Quanterix Corporation Common Stock,$5.76,0.02,0.348%,"269,054,191"
EGAN,eGain Corporation Common Stock,$9.81,-0.18,-1.802%,"268,657,739"
PESI,"Perma-Fix Environmental Services, Inc. Common Stock",$14.50,-0.34,-2.291%,"268,506,099"
IRD,"Opus Genetics, Inc. Common Stock",$3.89,0.25,6.868%,"268,270,769"
LFCR,"Lifecore Biomedical, Inc. Common Stock",$7.16,0.08,1.13%,"268,259,080"
CLYM,"Climb Bio, Inc. Common Stock",$5.61,-0.06,-1.058%,"267,846,280"
TAYD,"Taylor Devices, Inc. Common Stock",$84.71,6.36,8.117%,"267,100,541"
RLMD,"Relmada Therapeutics, Inc. Common Stock",$3.64,-0.08,-2.151%,"266,934,384"
FDBC,"Fidelity D & D Bancorp, Inc. Common Stock",$46.09,-0.34,-0.732%,"265,814,212"
CLW,Clearwater Paper Corporation Common Stock,$16.56,-1.03,-5.856%,"265,594,861"
MINE,Mayfair Gold Corp. Common Shares,$3.97,-0.02,-0.501%,"265,186,452"
NREF,"NexPoint Real Estate Finance, Inc. Common Stock",$14.96,-0.12,-0.796%,"265,118,547"
NIU,Niu Technologies American Depositary Shares,$3.40,-0.03,-0.875%,"265,077,505"
BUUU,BUUU Group Limited Class A Ordinary Share,$15.88,2.2551,16.551%,"264,799,000"
SHIP,Seanergy Maritime Holdings Corp. Common Stock,$12.66,1.15,9.991%,"264,623,941"
USAU,U.S. Gold Corp. Common Stock,$16.08,-0.07,-0.433%,"264,598,346"
FCNCP,"First Citizens BancShares, Inc. Depositary Shares",$21.79,0.40,1.87%,"264,512,275"
AFRI,Forafric Global PLC Ordinary Shares,$9.82,-0.02,-0.203%,"264,173,633"
DDD,3D Systems Corporation Common Stock,$2.05,-0.03,-1.442%,"263,912,929"
GWRS,"Global Water Resources, Inc. Common Stock",$9.15,-0.04,-0.435%,"263,064,925"
BNED,"Barnes & Noble Education, Inc Common Stock",$7.72,0.02,0.26%,"262,895,699"
RPAY,Repay Holdings Corporation Class A Common Stock,$3.05,0.02,0.66%,"262,489,811"
BKKT,"Bakkt, Inc. Class A Common Stock",$10.26,-0.51,-4.735%,"261,931,223"
TOI,"The Oncology Institute, Inc. Common Stock",$2.66,0.15,5.976%,"261,694,364"
EVI,"EVI Industries, Inc.  Common Stock",$20.33,-0.61,-2.913%,"261,487,489"
ENLV,Enlivex Therapeutics Ltd. Ordinary Shares,$1.10,-0.01,-0.901%,"261,119,648"
REI,"Ring Energy, Inc. Common Stock",$1.26,-0.01,-0.787%,"261,101,203"
VPV,Invesco Pennsylvania Value Municipal Income Trust Common Stock (DE),$10.94,-0.12,-1.085%,"260,695,211"
PPIH,"Perma-Pipe International Holdings, Inc. Common Stock",$32.20,-0.03,-0.093%,"260,628,249"
TWIN,"Twin Disc, Incorporated Common Stock",$18.07,0.07,0.389%,"260,599,360"
EVC,Entravision Communications Corporation Common Stock,$2.86,-0.05,-1.718%,"260,192,184"
LRMR,"Larimar Therapeutics, Inc. Common Stock",$3.03,-0.12,-3.81%,"259,338,888"
ARQQ,Arqit Quantum Inc. Ordinary Shares,$16.53,-0.47,-2.765%,"258,725,229"
SJT,San Juan Basin Royalty Trust Common Stock,$5.55,-0.14,-2.46%,"258,678,818"
SEG,Seaport Entertainment Group Inc. Common Stock,$20.27,-0.01,-0.049%,"258,139,889"
JILL,"J. Jill, Inc. Common Stock",$17.07,0.71,4.34%,"258,019,076"
GORO,Gold Resource Corporation Common Stock,$1.59,-0.09,-5.357%,"257,207,439"
CBIO,"Crescent Biopharma, Inc. Common Stock",$9.33,0.39,4.362%,"257,104,636"
RCKY,"Rocky Brands, Inc. Common Stock",$33.92,0.81,2.446%,"254,185,863"
HBB,Hamilton Beach Brands Holding Company Class A Common Stock ,$18.86,-0.21,-1.101%,"253,537,847"
PALI,"Palisade Bio, Inc. Common Stock",$1.70,-0.03,-1.734%,"253,305,457"
STTK,"Shattuck Labs, Inc. Common Stock",$4.00,0.14,3.627%,"253,119,372"
ECC           ,Eagle Point Credit Company Inc. Common Stock,$4.17,-0.30,-6.711%,"252,962,725"
LMNR,Limoneira Co Common Stock,$13.96,-0.305,-2.138%,"252,942,873"
FXNC,First National Corporation Common Stock,$28.07,-0.14,-0.496%,"252,933,633"
OSG,"Octave Specialty Group, Inc. Common Stock",$5.77,0.01,0.174%,"252,795,442"
AZ,A2Z Cust2Mate Solutions Corp. Common Shares,$5.88,-0.17,-2.81%,"251,826,653"
CFFI,C&F Financial Corporation Common Stock,$77.54,-0.38,-0.488%,"251,092,509"
FTF,Franklin Limited Duration Income Trust Common Shares of Beneficial Interest,$6.20,0.01,0.162%,"250,513,319"
REFI,"Chicago Atlantic Real Estate Finance, Inc. Common Stock",$11.88,-0.08,-0.669%,"250,433,631"
RAIL,"FreightCar America, Inc. Common Stock",$13.12,-0.12,-0.906%,"250,317,871"
MYFW,"First Western Financial, Inc. Common Stock",$25.72,-0.27,-1.039%,"249,862,367"
LCNB,LCNB Corporation Common Stock,$17.59,0.31,1.794%,"249,543,086"
VHUB,"VenHub Global, Inc. Common Stock",$3.33,0.89,36.475%,"249,413,190"
MRAM,"Everspin Technologies, Inc. Common Stock",$10.91,-0.12,-1.088%,"249,364,568"
XPER,Xperi Inc. Common Stock ,$5.37,-0.09,-1.648%,"248,821,017"
ATLO,Ames National Corporation Common Stock,$27.96,0.19,0.684%,"248,624,989"
OABI,"OmniAb, Inc. Common Stock",$1.71,0.01,0.588%,"246,163,734"
MNTK,"Montauk Renewables, Inc. Common Stock",$1.73,0.02,1.17%,"246,103,947"
NVA,Nova Minerals Limited American Depositary Shares,$6.54,-0.52,-7.365%,"245,810,373"
AENT,Alliance Entertainment Holding Corporation Class A Common Stock,$4.82,-0.68,-12.364%,"245,614,523"
FUNC,First United Corporation Common Stock,$37.68,0.06,0.159%,"244,803,493"
MASS,908 Devices Inc. Common Stock,$6.76,0.27,4.16%,"244,664,531"
BPRN,"Princeton Bancorp, Inc. Common Stock (PA)",$36.10,0.37,1.036%,"244,139,210"
SLP,"Simulations Plus, Inc. Common Stock",$12.10,-0.19,-1.546%,"243,773,679"
HNST,"The Honest Company, Inc. Common Stock",$2.18,0.05,2.347%,"243,703,669"
FENC,Fennec Pharmaceuticals Inc. Common Stock,$8.68,0.26,3.088%,"243,578,160"
NKSH,"National Bankshares, Inc. Common Stock",$38.21,0.07,0.184%,"243,244,898"
SRI,"Stoneridge, Inc. Common Stock",$8.68,-0.14,-1.587%,"243,186,961"
MFIN,Medallion Financial Corp. Common Stock,$10.41,0.14,1.363%,"242,338,918"
ORBS,Eightco Holdings Inc. Common Stock,$1.22,-0.01,-0.813%,"241,354,570"
PLX,"Protalix BioTherapeutics, Inc. (DE) Common Stock",$2.98,0.01,0.337%,"239,655,119"
HUMA,"Humacyte, Inc. Common Stock",$1.14,0.13,12.871%,"239,038,346"
GRRR,Gorilla Technology Group Inc. Ordinary shares,$11.80,-0.74,-5.901%,"238,622,456"
TLSI,"TriSalus Life Sciences, Inc. Common Stock",$4.77,-0.10,-2.053%,"238,329,763"
HWBK,"Hawthorn Bancshares, Inc. Common Stock",$34.52,0.04,0.116%,"238,106,740"
GSIT,GSI Technology Common Stock,$6.57,0.43,7.003%,"237,743,354"
RDNW,"RideNow Group, Inc. Class B Common Stock",$6.24,0.02,0.322%,"237,541,212"
SNFCA,Security National Financial Corporation Class A Common Stock,$9.12,-0.08,-0.87%,"236,988,389"
STRS,Stratus Properties Inc. Common Stock,$29.59,0.19,0.646%,"236,564,534"
CMRC,"Commerce.com, Inc. Series 1 Common Stock",$2.91,0.14,5.054%,"236,476,337"
NVCT,"Nuvectis Pharma, Inc. Common Stock",$8.92,0.16,1.826%,"236,305,982"
ESOA,Energy Services of America Corporation Common Stock,$14.17,-0.04,-0.281%,"236,058,583"
KDKRW,"Kodiak AI, Inc. Warrants",$1.30,-0.01,-0.763%,"235,569,610"
TYGO,"Tigo Energy, Inc. Common Stock",$3.34,-0.10,-2.907%,"234,976,508"
SSSS,SuRo Capital Corp. Common Stock,$9.34,-0.14,-1.477%,"234,612,310"
WAVE,Eco Wave Power Global AB (publ) American Depositary Shares,$5.02,-0.03,-0.594%,"234,603,897"
SLN,Silence Therapeutics Plc American Depository Share,$5.01,0.56,12.584%,"234,468,000"
MRBK,Meridian Corporation Common Stock,$20.27,-0.02,-0.099%,"233,458,833"
FINW,FinWise Bancorp Common Stock,$17.16,-0.20,-1.152%,"233,151,564"
WALD,Waldencast plc Class A Ordinary Share,$1.82,0.02,1.111%,"233,035,008"
FCCO,First Community Corporation Common Stock,$30.245,0.325,1.086%,"232,574,795"
BLZE,"Backblaze, Inc. Class A Common Stock",$4.03,-0.26,-6.061%,"232,531,000"
CBNA,"Chain Bridge Bancorp, Inc. Class A Common Stock",$35.42,0.27,0.768%,"232,419,558"
POWW,Outdoor Holding Company Common Stock,$1.98,0.09,4.762%,"232,231,670"
VELO,"Velo3D, Inc. Common stock",$9.42,-1.75,-15.667%,"231,898,075"
LIEN,"Chicago Atlantic BDC, Inc. Common Stock",$10.15,-0.10,-0.976%,"231,628,989"
VTN,Invesco Trust for Investment Grade New York Municipals Common Stock,$11.87,-0.20,-1.657%,"231,298,571"
MKTW,"MarketWise, Inc. Class A Common Stock",$14.40,0.09,0.629%,"230,821,646"
MVIS,"MicroVision, Inc. Common Stock",$0.7552,0.0037,0.492%,"230,636,018"
NXDT,NexPoint Diversified Real Estate Trust Common Stock,$4.68,-0.07,-1.474%,"229,415,514"
RGCO,RGC Resources Inc. Common Stock,$22.04,0.18,0.823%,"229,094,493"
TSSI,"TSS, Inc. Common Stock",$7.94,-0.20,-2.457%,"229,029,594"
MFM,MFS Municipal Income Trust Common Stock,$5.56,0.015,0.271%,"229,003,228"
NUAI,"New Era Energy & Digital, Inc. Common Stock",$4.265,-0.655,-13.313%,"228,704,351"
CV,"CapsoVision, Inc. Common Stock",$4.88,0.05,1.035%,"228,594,938"
VENU,Venu Holding Corporation Common Stock,$5.33,-0.02,-0.374%,"228,377,399"
AOMR,"Angel Oak Mortgage REIT, Inc. Common Stock",$9.14,0.02,0.219%,"227,714,280"
SND,"Smart Sand, Inc. Common Stock",$5.22,-0.14,-2.612%,"227,298,594"
TBCH,Turtle Beach Corporation Common Stock,$11.76,-0.05,-0.423%,"227,097,525"
TPVG,TriplePoint Venture Growth BDC Corp. Common Stock,$5.62,-0.03,-0.531%,"227,046,859"
KINS,"Kingstone Companies, Inc. Common Stock",$16.04,0.33,2.101%,"226,924,745"
INSE,"Inspired Entertainment, Inc. Common Stock",$8.40,0.14,1.695%,"226,185,691"
PRHIZ,"Presurance Holdings, Inc. 9.75% Senior Unsecured Notes due 2028",$18.50,UNCH,--,"226,123,299"
AIFU,AIFU Inc. Class A Ordinary Share,$1.831,0.101,5.838%,"226,035,320"
ACHV,"Achieve Life Sciences, Inc. Common Shares",$4.24,0.04,0.952%,"225,712,109"
ANPA,Rich Sparkle Holdings Limited Ordinary Shares,$18.03,-13.10,-42.082%,"225,375,000"
NTHI,"NeOnc Technologies Holdings, Inc. Common Stock",$9.26,-0.98,-9.57%,"223,790,198"
FRAF,Franklin Financial Services Corporation Common Stock,$49.96,0.84,1.71%,"223,772,689"
KLTR,"Kaltura, Inc. Common Stock",$1.43,-0.03,-2.055%,"223,557,845"
AHMA,Ambitions Enterprise Management Co. L.L.C Class A Ordinary Shares,$7.53,0.53,7.571%,"222,135,000"
OPRT,Oportun Financial Corporation Common Stock,$5.03,0.07,1.411%,"221,968,971"
GENC,"Gencor Industries, Inc. Common Stock",$15.08,-0.10,-0.659%,"221,038,146"
ENGNW,enGene Holdings Inc. Warrants,$3.295,UNCH,--,"220,714,458"
EICA,Eagle Point Income Company Inc. 5.00% Series A Term Preferred Stock due 2026,$24.77,0.05,0.202%,"220,653,835"
WW,"WW International, Inc.  Common Stock",$22.06,-1.16,-4.996%,"220,311,632"
HERE,Here Group Limited American Depositary Shares,$4.05,UNCH,--,"220,257,691"
CBUS,"Cibus, Inc. Class A Common Stock",$3.26,0.96,41.739%,"219,970,026"
ALTG,Alta Equipment Group Inc. Class A Common Stock,$6.82,0.18,2.711%,"219,844,630"
III,Information Services Group Inc. Common Stock,$4.59,-0.15,-3.165%,"219,788,037"
DOUG,Douglas Elliman Inc. Common Stock,$2.46,-0.04,-1.60%,"218,494,666"
FLYX,"flyExclusive, Inc. Class A Common Stock",$2.34,-0.11,-4.49%,"218,486,682"
FLWS,"1-800-FLOWERS.COM, Inc. Common Stock",$3.41,-0.15,-4.213%,"218,464,395"
PEBK,"Peoples Bancorp of North Carolina, Inc. Common Stock",$39.98,0.76,1.938%,"218,268,451"
HRTX,"Heron Therapeutics, Inc. Common Stock",$1.19,0.04,3.478%,"218,201,401"
XYF,"X Financial American Depositary Shares, each representing six Class A Ordinary Shares",$5.16,UNCH,--,"217,800,473"
GPJA,"Georgia Power Company Series 2017A 5.00% Junior Subordinated Notes due October 1, 2077",$23.44,0.035,0.15%,"217,089,560"
VABK,Virginia National Bankshares Corporation Common Stock,$40.21,0.31,0.777%,"216,858,119"
OBIO,"Orchestra BioMed Holdings, Inc. Ordinary Shares",$3.84,0.01,0.261%,"216,824,567"
KRMD,"KORU Medical Systems, Inc. Common Stock (DE)",$4.67,UNCH,--,"216,326,799"
PSNYW,Polestar Automotive Holding UK PLC Class C-1 ADS (ADW),$2.80,-0.20,-6.667%,"215,578,362"
ANTA,Antalpha Platform Holding Company Class A Ordinary Shares,$9.08,UNCH,--,"215,131,305"
ALEC,"Alector, Inc. Common Stock",$1.97,0.10,5.348%,"215,028,400"
LTRX,"Lantronix, Inc. Common Stock",$5.41,-0.07,-1.277%,"214,733,861"
CNTX,Context Therapeutics Inc. Common Stock,$2.33,0.03,1.304%,"214,078,482"
INBKZ,First Internet Bancorp 6.0% Fixed-to-Floating Rate Subordinated Notes Due 2029,$24.4699,0.1699,0.699%,"213,208,539"
TRVG,trivago N.V. American Depositary Shares,$3.03,0.13,4.483%,"213,031,134"
LANV,Lanvin Group Holdings Limited Ordinary Shares,$1.52,0.07,4.828%,"212,459,222"
VUZI,Vuzix Corporation Common Stock,$2.64,0.11,4.348%,"211,533,923"
INV,"Innventure, Inc. Common Stock",$3.12,0.10,3.311%,"211,368,603"
PLBY,"Playboy, Inc. Common Stock",$1.96,-0.03,-1.508%,"211,204,449"
CNDT,Conduent Incorporated Common Stock ,$1.38,-0.155,-10.098%,"210,987,498"
OPBK,OP Bancorp Common Stock,$14.15,0.10,0.712%,"210,631,438"
EFSI,Eagle Financial Services Inc Common Stock,$39.12,0.30,0.773%,"210,322,656"
ARCT,Arcturus Therapeutics Holdings Inc. Common Stock,$7.40,0.19,2.635%,"210,265,665"
SRZN,"Surrozen, Inc. Common Stock",$24.53,0.05,0.204%,"210,256,957"
ELMD,"Electromed, Inc. Common Stock",$25.34,1.08,4.452%,"209,696,431"
UTMD,"Utah Medical Products, Inc. Common Stock",$65.36,1.26,1.966%,"209,392,002"
FOSL,"Fossil Group, Inc. Common Stock",$3.83,0.03,0.789%,"209,273,456"
AMPY,Amplify Energy Corp. Common Stock,$5.17,-0.25,-4.613%,"209,260,904"
SWKH,SWK Holdings Corporation Common Stock,$17.19,0.19,1.118%,"207,928,624"
FT,Franklin Universal Trust Common Stock,$8.26,UNCH,--,"207,589,444"
AUDC,AudioCodes Ltd. Common Stock,$7.03,-0.30,-4.093%,"207,195,844"
RILY,"BRC Group Holdings, Inc. Common Stock",$6.63,-0.19,-2.786%,"206,979,782"
HITI,High Tide Inc. Common Shares,$2.37,0.06,2.597%,"206,369,836"
SNBR,Sleep Number Corporation Common Stock,$9.03,-0.39,-4.14%,"205,793,700"
SLGL,Sol-Gel Technologies Ltd. Ordinary Shares,$73.80,6.60,9.821%,"205,589,236"
BRR,"ProCap Financial, Inc. Common Stock",$2.46,-0.06,-2.381%,"205,220,027"
SNWV,"SANUWAVE Health, Inc. Common Stock",$23.915,-0.975,-3.917%,"205,098,962"
MPV,Barings Participation Investors Common Stock,$19.28,0.06,0.312%,"204,400,776"
FNKO,"Funko, Inc. Class A Common Stock",$3.69,0.10,2.786%,"204,392,155"
HKD,AMTD Digital Inc. American Depositary Shares (every five of which represent two Class A Ordinary Shares),$1.62,0.03,1.887%,"204,385,633"
AMBR,Amber International Holding Limited American Depositary Shares,$2.18,-0.25,-10.288%,"204,228,777"
ACB,Aurora Cannabis Inc. Common Shares,$3.60,0.05,1.408%,"204,153,926"
ETX           ,Eaton Vance Municipal Income 2028 Term Trust Common Shares of Beneficial Interest,$18.75,-0.07,-0.372%,"204,092,925"
PAL,"Proficient Auto Logistics, Inc. Common Stock",$7.33,0.275,3.898%,"203,994,171"
BHR,Braemar Hotels & Resorts Inc. Common Stock,$2.99,UNCH,--,"203,976,102"
CFBK,CF Bankshares Inc. Common Stock,$32.01,0.20,0.629%,"203,810,071"
OVBC,Ohio Valley Banc Corp. Common Stock,$43.25,0.30,0.698%,"203,750,793"
OPTX,"Syntec Optics Holdings, Inc. Class A Common Stock",$5.51,-0.55,-9.076%,"203,430,445"
ONEW,OneWater Marine Inc. Class A Common Stock,$12.23,0.25,2.087%,"203,182,420"
OSS,"One Stop Systems, Inc. Common Stock",$8.28,-0.42,-4.828%,"202,988,265"
QSI,Quantum-Si Incorporated Class A Common Stock,$0.9388,-0.0518,-5.229%,"202,301,698"
TFSA,"Terra Income Fund 6, LLC 7.00% Notes due 2026",$23.86,-1.15,-4.598%,"201,351,892"
FC,Franklin Covey Company Common Stock,$17.42,-0.34,-1.914%,"201,245,456"
WTF,Waton Financial Limited Ordinary Shares,$4.16,0.43,11.528%,"200,667,884"
PROF,Profound Medical Corp. Common Stock,$6.68,0.08,1.212%,"200,665,924"
RENT,"Rent the Runway, Inc. Class A Common Stock",$5.98,0.01,0.168%,"200,608,686"
RICK,"RCI Hospitality Holdings, Inc. Common Stock",$22.89,0.15,0.66%,"199,611,352"
TCX,Tucows Inc. Class A Common Stock,$17.97,-0.77,-4.109%,"199,537,424"
MDWD,MediWound Ltd. Ordinary Shares,$17.72,0.45,2.606%,"199,381,294"
BMEZ,BlackRock Health Sciences Term Trust Common Shares of Beneficial Interest,$14.92,-0.05,-0.334%,"198,928,629"
ASUR,"Asure Software, Inc Common Stock",$7.15,-0.28,-3.769%,"198,511,721"
AIRJ,AirJoule Technologies Corporation Class A Common Stock,$3.27,0.05,1.553%,"198,422,639"
OZ,"Belpointe PREP, LLC Class A Units",$50.89,0.69,1.375%,"198,021,998"
SDA,SunCar Technology Group Inc. Class A Ordinary Shares,$2.01,-0.02,-0.985%,"197,995,167"
LODE,Comstock Inc. Common Stock,$2.77,0.01,0.362%,"197,700,074"
JAKK,"JAKKS Pacific, Inc. Common Stock",$17.52,0.12,0.69%,"197,442,148"
OSUR,"OraSure Technologies, Inc. Common Stock",$2.75,UNCH,--,"197,267,208"
CRNT,Ceragon Networks Ltd. Ordinary Shares,$2.22,-0.04,-1.77%,"197,222,755"
LOVE,The Lovesac Company Common Stock,$13.46,0.13,0.975%,"196,746,247"
MPAA,"Motorcar Parts  of America, Inc. Common Stock",$10.24,0.20,1.992%,"196,720,169"
ALTO,"Alto Ingredients, Inc. Common Stock",$2.54,-0.14,-5.224%,"196,449,920"
HNNAZ,"Hennessy Advisors, Inc. 4.875% Notes due 2026",$25.1554,0.0409,0.163%,"195,899,187"
CHRS,"Coherus Oncology, Inc. Common Stock",$1.61,UNCH,--,"194,602,331"
STXS,"Stereotaxis, Inc. Common Stock",$2.08,0.09,4.523%,"194,115,507"
NIPG,NIP Group Inc. American Depositary Shares,$0.865,0.015,1.765%,"194,069,460"
ESCA,"Escalade, Incorporated Common Stock",$14.04,-0.005,-0.036%,"193,804,580"
HTLM,HomesToLife Ltd Ordinary Shares,$2.16,-0.35,-13.944%,"193,725,000"
SMHI,SEACOR Marine Holdings Inc. Common Stock ,$7.18,-0.04,-0.554%,"193,689,540"
BGM,BGM Group Ltd. Class A Ordinary Shares,$1.05,-0.05,-4.545%,"193,157,928"
UBFO,United Security Bancshares Common Stock,$10.97,UNCH,--,"192,807,107"
ADV,Advantage Solutions Inc. Class A Common Stock,$0.59,0.01,1.724%,"192,500,430"
RDCM,Radcom Ltd. Ordinary Shares,$12.08,0.02,0.166%,"192,260,641"
ELME,Elme Communities Common Stock,$2.18,UNCH,--,"192,191,331"
GTE,Gran Tierra Energy Inc. Common Stock,$5.44,-0.13,-2.334%,"191,972,078"
MOLN,Molecular Partners AG American Depositary Shares,$4.75,0.145,3.149%,"191,724,701"
IMMR,Immersion Corporation Common Stock,$5.91,-0.25,-4.058%,"191,462,913"
OMSE,OMS Energy Technologies Inc. Ordinary Shares,$4.51,0.05,1.121%,"191,443,655"
CAN,Canaan Inc. American Depositary Shares,$0.455,-0.0356,-7.256%,"191,219,919"
MNSBP,"MainStreet Bancshares, Inc. Depositary Shares",$24.80,UNCH,--,"191,098,161"
EARN,Ellington Credit Company Common Shares of Beneficial Interest,$5.08,-0.14,-2.682%,"190,800,711"
INVZ,Innoviz Technologies Ltd. Ordinary shares,$0.9391,-0.0144,-1.51%,"189,059,785"
LAW,"CS Disco, Inc. Common Stock",$3.02,-0.69,-18.598%,"188,724,614"
CURI,CuriosityStream Inc. Class A Common Stock,$3.23,-0.02,-0.615%,"188,304,178"
PLYX,"Polaryx Therapeutics, Inc. Common Stock",$3.96,1.55,64.315%,"187,479,456"
VIASP,"Via Renewables, Inc. 8.75% Series A Fixed-to-Floating Rate Cumulative Redeemable Perpetual Preferred Stock",$25.5999,-0.0051,-0.02%,"187,476,490"
FLX,BingEx Limited American Depositary Shares,$2.62,-0.19,-6.762%,"186,360,364"
OVID,Ovid Therapeutics Inc. Common Stock,$1.43,0.01,0.704%,"186,163,625"
TNXP,Tonix Pharmaceuticals Holding Corp. Common Stock,$15.24,0.10,0.661%,"185,517,191"
CXDO,"Crexendo, Inc. Common Stock",$6.03,-0.26,-4.134%,"185,308,219"
PZG,Paramount Gold Nevada Corp. Common Stock,$2.21,0.01,0.455%,"185,227,265"
