Symbol,Name,Last Sale,Net Change,% Change,Market Cap
AWR,American States Water Company Common Stock,$74.88,-0.01,-0.013%,"2,898,936,219"
WOR,"Worthington Enterprises, Inc. Common Shares",$58.34,-0.61,-1.035%,"2,890,547,536"
MGRC,McGrath RentCorp Common Stock,$116.98,-0.66,-0.561%,"2,879,071,636"
AMBP,Ardagh Metal Packaging S.A. Ordinary Shares,$4.81,-0.05,-1.029%,"2,874,935,009"
GBTG,"Global Business Travel Group, Inc. Class A Common Stock",$5.49,0.45,8.929%,"2,874,158,470"
SBLK,Star Bulk Carriers Corp. Common Shares,$24.53,0.73,3.067%,"2,873,138,335"
TGB,"Taseko Mines, Ltd. Common Stock",$7.97,-0.32,-3.86%,"2,872,473,885"
SHOO,"Steven Madden, Ltd. Common Stock",$39.43,0.24,0.612%,"2,864,902,456"
PHIN,PHINIA Inc. Common Stock,$75.51,-0.23,-0.304%,"2,862,973,883"
AERO,"Grupo Aeromexico, S.A.B. de C.V. American Depositary Shares (each representing ten (10) Common Shares)",$19.62,1.62,9.00%,"2,862,624,885"
XMTR,"Xometry, Inc. Class A Common Stock",$55.83,0.41,0.74%,"2,861,156,634"
LXP,LXP Industrial Trust Common Stock (Maryland REIT),$48.38,0.72,1.511%,"2,858,147,002"
CWK,Cushman & Wakefield Ltd. Common Shares,$12.33,-0.56,-4.344%,"2,855,684,077"
CURB,Curbline Properties Corp. Common Stock,$27.07,0.87,3.321%,"2,852,310,109"
POWWP,Outdoor Holding Company 8.75% Series A Cumulative Redeemable Perpetual Preferred Stock,$24.30,-0.01,-0.041%,"2,850,115,945"
VCYT,"Veracyte, Inc. Common Stock",$36.03,0.26,0.727%,"2,848,141,703"
VC,Visteon Corporation Common Stock,$104.26,-0.68,-0.648%,"2,844,830,228"
DRD,DRDGOLD Limited American Depositary Shares,$32.90,-2.75,-7.714%,"2,844,496,856"
MARA,"MARA Holdings, Inc. Common Stock",$7.51,-0.41,-5.177%,"2,840,164,491"
HE,"Hawaiian Electric Industries, Inc. Common Stock",$16.44,-0.38,-2.259%,"2,837,880,625"
AMBA,"Ambarella, Inc. Ordinary Shares",$65.79,-0.42,-0.634%,"2,832,291,474"
PRK,Park National Corporation Common Stock,$175.92,1.31,0.75%,"2,828,487,851"
CVBF,CVB Financial Corporation Common Stock,$20.80,0.25,1.217%,"2,824,488,181"
DBRG,"DigitalBridge Group, Inc.",$15.41,UNCH,--,"2,815,012,889"
CECO,CECO Environmental Corp. Common Stock,$78.93,-0.21,-0.265%,"2,813,146,577"
SLG,SL Green Realty Corp Common Stock,$39.54,-1.01,-2.491%,"2,808,363,532"
FTAIM,FTAI Aviation Ltd. 9.500% Fixed-Rate Reset Series D Cumulative Perpetual Redeemable Preferred Shares,$27.26,0.058,0.213%,"2,796,137,936"
HYMC,Hycroft Mining Holding Corporation Class A Common Stock,$33.60,-1.95,-5.485%,"2,789,652,902"
BEAM,Beam Therapeutics Inc. Common Stock,$27.49,-0.43,-1.54%,"2,789,546,211"
SYRE,"Spyre Therapeutics, Inc. Common Stock",$35.95,-0.68,-1.856%,"2,789,437,074"
LASR,"nLIGHT, Inc. Common Stock",$50.89,-1.39,-2.659%,"2,786,811,056"
CHEF,"The Chefs' Warehouse, Inc. Common Stock",$68.47,0.03,0.044%,"2,785,739,540"
TRN,"Trinity Industries, Inc. Common Stock",$34.74,-0.34,-0.969%,"2,785,471,369"
DRVN,Driven Brands Holdings Inc. Common Stock,$16.91,0.07,0.416%,"2,780,920,826"
ALMS,Alumis Inc. Common Stock,$26.58,0.04,0.151%,"2,774,776,652"
DJT,Trump Media & Technology Group Corp. Common Stock,$9.91,-1.07,-9.745%,"2,774,776,573"
CTRI,"Centuri Holdings, Inc. Common Stock",$31.29,0.28,0.903%,"2,773,832,029"
CWT,California Water Service Group Common Stock,$46.49,-0.07,-0.15%,"2,770,401,443"
ETOR,eToro Group Ltd. Class A Common Shares,$33.07,5.61,20.43%,"2,768,090,883"
ASH,Ashland Inc. Common Stock,$60.23,-0.70,-1.149%,"2,756,268,810"
BKE,"Buckle, Inc. (The) Common Stock",$53.87,0.42,0.786%,"2,755,807,443"
FCPT,"Four Corners Property Trust, Inc. Common Stock",$25.06,0.69,2.831%,"2,750,210,753"
ATRO,Astronics Corporation Common Stock,$76.97,0.03,0.039%,"2,742,373,443"
LFST,"LifeStance Health Group, Inc. Common Stock",$7.04,0.01,0.142%,"2,738,561,978"
BELFA,Bel Fuse Inc. Class A Common Stock,$216.04,0.78,0.362%,"2,735,188,031"
RELY,"Remitly Global, Inc. Common Stock",$13.08,0.32,2.508%,"2,734,320,777"
APLS,"Apellis Pharmaceuticals, Inc. Common Stock",$21.57,-0.13,-0.599%,"2,729,148,952"
NGVT,Ingevity Corporation Common Stock ,$75.81,-0.76,-0.993%,"2,726,433,266"
BATRK,"Atlanta Braves Holdings, Inc. Series C Common Stock",$43.30,0.12,0.278%,"2,724,579,756"
OLN,Olin Corporation Common Stock,$23.87,-2.01,-7.767%,"2,724,080,897"
TOWN,TowneBank Common Stock,$36.50,0.29,0.801%,"2,723,532,545"
HAE,Haemonetics Corporation Common Stock,$58.59,0.83,1.437%,"2,722,756,397"
PRVA,"Privia Health Group, Inc. Common Stock",$22.08,-0.31,-1.385%,"2,715,873,760"
BRSL,"Brightstar Lottery PLC Trading under the Legal Name to begin at the market open on July 21, 2025. Ordinary Shares",$13.42,-0.03,-0.223%,"2,711,264,542"
NP,Neptune Insurance Holdings Inc. Class A Common Stock,$19.39,0.50,2.647%,"2,707,231,800"
IHS,IHS Holding Limited Ordinary Shares,$8.10,-0.19,-2.292%,"2,700,871,590"
VRDN,"Viridian Therapeutics, Inc. Common Stock",$28.29,0.39,1.398%,"2,700,054,406"
IDYA,"IDEAYA Biosciences, Inc. Common Stock",$30.76,0.49,1.619%,"2,696,618,710"
LU,"Lufax Holding Ltd American Depositary Shares, each representing two (2) Ordinary Shares",$3.11,0.42,15.613%,"2,695,250,400"
AKR,Acadia Realty Trust Common Stock,$20.54,-0.05,-0.243%,"2,691,451,177"
TRMK,Trustmark Corporation Common Stock,$44.82,0.09,0.201%,"2,687,328,989"
WRBY,Warby Parker Inc. Class A Common Stock,$21.96,-0.50,-2.226%,"2,682,739,293"
NMFCZ,New Mountain Finance Corporation 8.250% Notes due 2028,$25.20,0.09,0.358%,"2,680,296,217"
ABM,ABM Industries Incorporated Common Stock,$44.29,-0.22,-0.494%,"2,665,267,011"
TARS,"Tarsus Pharmaceuticals, Inc. Common Stock",$62.78,2.00,3.291%,"2,664,954,812"
IAC,IAC Inc. Common Stock,$34.27,-0.04,-0.117%,"2,653,630,418"
SDRL,Seadrill Limited Common Shares,$42.50,-0.16,-0.375%,"2,650,902,268"
CARG,"CarGurus, Inc. Class A Common Stock ",$27.73,0.39,1.426%,"2,646,917,347"
UE,Urban Edge Properties Common Shares of Beneficial Interest,$21.00,0.23,1.107%,"2,645,077,827"
MH,"McGraw Hill, Inc. Common Stock",$13.84,0.17,1.244%,"2,643,461,023"
BTE,Baytex Energy Corp Common Shares,$3.44,-0.03,-0.865%,"2,643,010,480"
FSLY,"Fastly, Inc. Class A Common Stock",$17.66,-0.60,-3.286%,"2,638,404,000"
NMRK,"Newmark Group, Inc. Class A Common Stock",$14.62,-0.20,-1.35%,"2,637,629,390"
TENB,"Tenable Holdings, Inc. Common Stock",$22.10,-0.45,-1.996%,"2,637,508,279"
FTAIN,FTAI Aviation Ltd. 8.25% Fixed - Rate Reset Series C Cumulative Perpetual Redeemable Preferred Shares,$25.68,0.055,0.215%,"2,634,072,714"
GDV,Gabelli Dividend & Income Trust Common Shares of Beneficial Interest,$29.18,0.10,0.344%,"2,631,700,167"
WGS,GeneDx Holdings Corp. Class A Common Stock,$91.03,0.88,0.976%,"2,631,184,828"
NAMSW,NewAmsterdam Pharma Company N.V. Warrant,$23.18,UNCH,--,"2,628,398,837"
NSA,National Storage Affiliates Trust Common Shares of Beneficial Interest,$34.07,0.60,1.793%,"2,622,053,332"
BOBS,"Bob's Discount Furniture, Inc. Common Stock",$20.09,0.01,0.05%,"2,619,074,235"
TBBK,The Bancorp Inc Common Stock,$59.57,1.00,1.707%,"2,616,173,040"
DHT,"DHT Holdings, Inc.",$16.27,0.36,2.263%,"2,612,278,302"
MFAO,"MFA Financial, Inc. 9.000% Senior Notes due 2029",$25.28,0.07,0.278%,"2,595,464,787"
HCM,HUTCHMED (China) Limited American Depositary Shares,$14.87,0.11,0.745%,"2,593,832,599"
MFAN,"MFA Financial, Inc. 8.875% Senior Notes due 2029",$25.24,0.17,0.678%,"2,591,358,038"
NSIT,"Insight Enterprises, Inc. Common Stock",$83.00,-2.11,-2.479%,"2,572,709,666"
TVTX,"Travere Therapeutics, Inc. Common Stock",$28.75,0.93,3.343%,"2,572,329,401"
BBT,Beacon Financial Corporation Common stock,$30.59,-0.09,-0.293%,"2,566,772,058"
NHC,National HealthCare Corporation Common Stock,$164.96,-4.73,-2.787%,"2,559,396,135"
BWLP,BW LPG Limited Common Shares,$16.79,0.06,0.359%,"2,544,330,458"
POWI,"Power Integrations, Inc. Common Stock",$45.73,-1.48,-3.135%,"2,538,197,920"
GT,The Goodyear Tire & Rubber Company Common Stock,$8.86,-0.58,-6.144%,"2,536,148,819"
PLUG,"Plug Power, Inc. Common Stock",$1.82,-0.07,-3.704%,"2,535,066,838"
VSH,"Vishay Intertechnology, Inc. Common Stock",$18.69,-0.19,-1.006%,"2,534,147,103"
CRVL,CorVel Corp. Common Stock,$49.50,0.30,0.61%,"2,532,045,632"
FBNC,First Bancorp Common Stock,$61.06,0.13,0.213%,"2,531,872,989"
ALG,"Alamo Group, Inc. Common Stock",$208.90,-1.94,-0.92%,"2,530,912,909"
TPB,"Turning Point Brands, Inc. Common Stock",$132.62,0.85,0.645%,"2,529,163,793"
CUBI,"Customers Bancorp, Inc Common Stock",$73.96,1.23,1.691%,"2,527,070,975"
TRMD,TORM plc Class A Common Stock,$25.82,-0.07,-0.27%,"2,525,558,797"
UCTT,"Ultra Clean Holdings, Inc. Common Stock",$55.60,0.21,0.379%,"2,523,522,093"
HIW,"Highwoods Properties, Inc. Common Stock",$22.95,-0.17,-0.735%,"2,522,918,653"
BWNB,"Babcock & Wilcox Enterprises, Inc. 6.50% Senior Notes due 2026",$24.89,0.09,0.363%,"2,516,317,820"
RHI,Robert Half Inc. Common Stock,$24.81,0.04,0.161%,"2,510,434,361"
RNG,"RingCentral, Inc. Class A Common Stock",$29.00,-1.19,-3.942%,"2,510,376,735"
RUM,Rumble Inc. Class A Common Stock,$5.77,-0.19,-3.188%,"2,509,156,181"
WAFD,"WaFd, Inc. Common Stock",$33.04,0.16,0.487%,"2,506,524,555"
IMNM,"Immunome, Inc. Common Stock",$22.69,0.53,2.392%,"2,503,431,900"
CLMT,"Calumet, Inc. Common Stock",$28.73,0.12,0.419%,"2,492,451,642"
NOG,"Northern Oil and Gas, Inc. Common Stock",$25.52,-0.44,-1.695%,"2,490,827,999"
TGLS,Tecnoglass Inc. Ordinary Shares,$53.43,0.47,0.887%,"2,488,205,500"
SM,SM Energy Company Common Stock,$21.68,0.22,1.025%,"2,483,534,883"
ATHM,"Autohome Inc. American Depositary Shares, each representing four class A ordinary shares.",$20.96,-0.04,-0.19%,"2,482,580,686"
XRAY,DENTSPLY SIRONA Inc. Common Stock,$12.44,-0.51,-3.938%,"2,482,426,494"
NAVN,"Navan, Inc. Class A Common Stock",$9.97,-0.47,-4.502%,"2,478,981,328"
IRON,"Disc Medicine, Inc. Common Stock",$65.57,9.62,17.194%,"2,475,278,122"
WSBCO,"WesBanco, Inc. Depositary Shares each representing 1/40th interest in a share of 7.375% Fixed-Rate Reset Non-Cumulative Perpetual Preferred Stock, Series B",$25.73,0.02,0.078%,"2,471,246,778"
SAM,"Boston Beer Company, Inc. (The) Common Stock",$231.71,-15.86,-6.406%,"2,469,650,449"
IRDM,Iridium Communications Inc Common Stock,$23.53,0.36,1.554%,"2,469,632,539"
DYN,"Dyne Therapeutics, Inc. Common Stock",$15.28,-0.26,-1.673%,"2,469,152,133"
BWIN,"The Baldwin Insurance Group, Inc. Class A Common Stock",$17.31,0.81,4.909%,"2,468,113,219"
CALY,Callaway Golf Company Common Stock,$13.42,0.83,6.593%,"2,467,718,409"
TNK,Teekay Tankers Ltd.,$71.61,1.06,1.502%,"2,462,108,053"
FRME,First Merchants Corporation Common Stock,$42.54,0.49,1.165%,"2,459,876,351"
HLIO,"Helios Technologies, Inc. Common Stock",$74.08,-1.57,-2.075%,"2,454,158,836"
SPNT,SiriusPoint Ltd. Common Shares,$20.99,0.48,2.34%,"2,451,939,294"
HUBG,"Hub Group, Inc. Class A Common Stock",$39.86,0.20,0.504%,"2,437,578,909"
WB,Weibo Corporation American Depositary Share,$9.95,-0.06,-0.599%,"2,436,011,536"
NESR,National Energy Services Reunited Corp Ordinary Shares,$24.17,3.34,16.035%,"2,435,798,435"
RXO,"RXO, Inc. Common Stock",$14.83,1.32,9.771%,"2,434,996,442"
CPRI,Capri Holdings Limited Ordinary Shares,$20.38,-0.04,-0.196%,"2,428,140,006"
IVT,InvenTrust Properties Corp. Common Stock,$31.08,0.38,1.238%,"2,414,892,410"
TMC,TMC the metals company Inc. Common Stock,$5.83,-0.26,-4.269%,"2,410,658,622"
ADPT,Adaptive Biotechnologies Corporation Common Stock,$15.79,-0.25,-1.559%,"2,410,583,319"
HOG,"Harley-Davidson, Inc. Common Stock",$20.35,-0.07,-0.343%,"2,404,186,912"
CENT,Central Garden & Pet Company Common Stock,$38.61,0.66,1.739%,"2,404,145,820"
ANDG,Andersen Group Inc. Class A Common Stock,$21.63,0.92,4.442%,"2,399,902,575"
UNFI,"United Natural Foods, Inc. Common Stock",$39.34,-0.96,-2.382%,"2,397,057,681"
LION,Lionsgate Studios Corp Common Shares,$8.26,0.17,2.101%,"2,396,946,619"
MLCO,Melco Resorts & Entertainment Limited American Depositary Shares,$5.62,0.09,1.627%,"2,391,385,651"
NBTB,NBT Bancorp Inc. Common Stock,$45.71,-0.11,-0.24%,"2,391,327,472"
NEOG,Neogen Corporation Common Stock,$10.99,0.05,0.457%,"2,390,610,531"
HTH,Hilltop Holdings Inc.,$38.94,-0.33,-0.84%,"2,388,133,231"
DAVE,Dave Inc. Class A Common Stock,$176.61,-0.67,-0.378%,"2,384,955,922"
OSW,OneSpaWorld Holdings Limited Common Shares,$23.38,0.68,2.996%,"2,383,646,668"
CLSK,"CleanSpark, Inc. Common Stock",$9.28,-0.57,-5.787%,"2,373,387,033"
MFICL,MidCap Financial Investment Corporation 8.00% Notes due 2028,$25.4201,-0.0399,-0.157%,"2,371,787,402"
ARCB,ArcBest Corporation Common Stock,$104.98,0.58,0.556%,"2,363,206,985"
TXG,"10x Genomics, Inc. Class A Common Stock",$18.62,0.50,2.759%,"2,356,417,810"
NIC,Nicolet Bankshares Inc. Common Stock,$157.68,2.49,1.604%,"2,354,190,309"
BUSE,First Busey Corporation Class A Common Stock,$26.54,-0.01,-0.038%,"2,346,376,001"
DXPE,"DXP Enterprises, Inc. Common Stock",$148.99,0.44,0.296%,"2,336,057,417"
AMR,"Alpha Metallurgical Resources, Inc. Common Stock",$181.41,-4.11,-2.215%,"2,332,574,134"
WT,"WisdomTree, Inc. Common Stock",$16.56,0.20,1.222%,"2,330,241,725"
ARX,Accelerant Holdings Class A Common Shares,$10.48,-0.19,-1.781%,"2,324,674,061"
EFXT,Enerflex Ltd Common Shares,$19.02,0.07,0.369%,"2,316,669,837"
KN,Knowles Corporation Common Stock,$27.14,-0.15,-0.55%,"2,304,556,162"
WS,"Worthington Steel, Inc. Common Shares",$45.34,-1.56,-3.326%,"2,303,527,491"
CDLR,Cadeler A/S American Depositary Share (each representing four (4) Ordinary Shares),$26.23,0.33,1.274%,"2,301,404,357"
BUSEP,"First Busey Corporation Depositary Shares, Each Representing a 1/40thInterest in a Share of 8.25% Fixed-Rate Series B Non-Cumulative Perpetual Preferred Stock, $0.001 par value",$26.00,0.25,0.971%,"2,298,635,118"
CEPU,Central Puerto S.A. American Depositary Shares (each represents ten Common Shares),$15.18,-0.37,-2.379%,"2,298,285,791"
ADAMM,"Adamas Trust, Inc. 7.875% Series E Fixed-to-Floating Rate Cumulative Redeemable Preferred Stock",$25.44,0.08,0.315%,"2,297,577,450"
ADAMI,"Adamas Trust, Inc. 9.125% Senior Notes Due 2029",$25.364,0.084,0.332%,"2,297,457,144"
PK,Park Hotels & Resorts Inc. Common Stock ,$11.47,0.27,2.411%,"2,292,833,249"
HNI,HNI Corporation Common Stock,$50.02,-0.01,-0.02%,"2,292,479,675"
SVM,Silvercorp Metals Inc. Common Shares,$10.40,-0.58,-5.282%,"2,290,877,774"
PLAB,"Photronics, Inc. Common Stock",$38.62,-0.18,-0.464%,"2,281,076,435"
KALU,Kaiser Aluminum Corporation Common Stock,$140.57,0.16,0.114%,"2,278,113,265"
GCMG,GCM Grosvenor Inc. Class A Common Stock,$11.71,-0.33,-2.741%,"2,274,040,195"
NOVTU,Novanta Inc. Tangible Equity Units,$63.55,0.22,0.347%,"2,273,509,067"
CSGS,"CSG Systems International, Inc. Common Stock",$79.69,0.03,0.038%,"2,272,772,905"
NTB,Bank of N.T. Butterfield & Son Limited (The) Voting Ordinary Shares,$52.84,0.10,0.19%,"2,272,120,000"
DXC,DXC Technology Company Common Stock ,$13.38,-0.01,-0.075%,"2,271,388,305"
MTX,Minerals Technologies Inc. Common Stock,$72.89,-0.08,-0.11%,"2,269,379,710"
ANDE,"Andersons, Inc. (The) Common Stock",$67.01,-2.02,-2.926%,"2,267,559,632"
EFSC,Enterprise Financial Services Corporation Common Stock,$61.26,0.47,0.773%,"2,267,288,285"
WVE,Wave Life Sciences Ltd. Ordinary Shares,$12.59,-0.09,-0.71%,"2,265,939,437"
ALRM,"Alarm.com Holdings, Inc. Common Stock",$45.41,-0.97,-2.091%,"2,265,036,269"
SPSC,"SPS Commerce, Inc. Common Stock",$60.06,-1.86,-3.004%,"2,264,808,186"
BLKB,"Blackbaud, Inc. Common Stock",$47.34,-1.74,-3.545%,"2,264,470,034"
CVI,CVR Energy Inc. Common Stock,$22.52,-0.65,-2.805%,"2,263,949,089"
MAZE,"Maze Therapeutics, Inc. Common Stock",$46.97,0.96,2.087%,"2,260,170,285"
EPAC,Enerpac Tool Group Corp. Common Stock,$42.80,-0.22,-0.511%,"2,258,825,854"
AGYS,"Agilysys, Inc. Common Stock (DE)",$80.19,-1.31,-1.607%,"2,254,000,327"
COTY,Coty Inc. Class A Common Stock,$2.56,0.05,1.992%,"2,252,816,279"
PMTU,PennyMac Mortgage Investment Trust 8.50% Senior Notes due 2028,$25.82,0.02,0.078%,"2,246,768,715"
JBLU,JetBlue Airways Corporation Common Stock,$6.07,0.16,2.707%,"2,246,626,385"
AVPT,"AvePoint, Inc. Class A Common Stock",$10.41,-0.15,-1.42%,"2,246,366,748"
HURN,Huron Consulting Group Inc. Common Stock,$130.21,4.855,3.873%,"2,245,011,548"
ATKR,Atkore Inc. Common Stock,$66.48,-0.18,-0.27%,"2,243,742,481"
MNR,Mach Natural Resources LP Common Units representing Limited Partner Interests,$13.31,0.21,1.603%,"2,241,707,614"
GLPG,Galapagos NV American Depositary Shares,$33.93,0.01,0.029%,"2,235,887,619"
IE,Ivanhoe Electric Inc. Common Stock,$15.44,-0.35,-2.217%,"2,234,396,157"
OI,"O-I Glass, Inc. Common Stock",$14.64,-0.15,-1.014%,"2,230,573,956"
FIHL,Fidelis Insurance Holdings Limited Common Shares,$19.95,0.30,1.527%,"2,229,878,113"
SID,Companhia Siderurgica Nacional S.A. Common Stock,$1.68,-0.01,-0.592%,"2,227,837,831"
BL,"BlackLine, Inc. Common Stock",$37.34,-1.27,-3.289%,"2,221,232,183"
SEDG,"SolarEdge Technologies, Inc. Common Stock",$37.13,1.60,4.503%,"2,220,375,894"
BHC,Bausch Health Companies Inc. Common Stock,$5.99,UNCH,--,"2,219,396,387"
ZLAB,Zai Lab Limited American Depositary Shares,$20.04,0.01,0.05%,"2,216,298,950"
MLYS,"Mineralys Therapeutics, Inc. Common Stock",$27.94,0.34,1.232%,"2,211,170,371"
EYE,"National Vision Holdings, Inc. Common Stock",$27.76,-0.46,-1.63%,"2,201,633,330"
KSS,Kohl's Corporation Common Stock,$19.56,-0.29,-1.461%,"2,194,420,576"
BANR,Banner Corporation Common Stock,$64.34,0.14,0.218%,"2,193,088,736"
WRD,WeRide Inc. American Depositary Shares,$7.68,0.11,1.453%,"2,185,181,990"
PAX,Patria Investments Limited Class A Common Shares,$13.69,-0.22,-1.582%,"2,183,124,477"
AAPG,Ascentage Pharma Group International American Depository Shares,$25.00,1.18,4.954%,"2,176,666,125"
PLUS,ePlus inc. Common Stock,$82.41,-1.47,-1.753%,"2,175,010,952"
MESO,Mesoblast Limited American Depositary Shares,$16.85,0.18,1.08%,"2,175,001,690"
MBIN,Merchants Bancorp Common Stock,$47.24,-0.39,-0.819%,"2,167,807,603"
SEZL,Sezzle Inc. Common Stock,$63.40,-0.66,-1.03%,"2,165,306,667"
PARR,"Par Pacific Holdings, Inc.  Common Stock",$43.03,0.17,0.397%,"2,164,023,580"
GEL,"Genesis Energy, L.P. Common Units",$17.66,0.12,0.684%,"2,162,719,856"
PSIX,"Power Solutions International, Inc. Common Stock",$93.83,-4.94,-5.002%,"2,161,930,462"
ESTA,Establishment Labs Holdings Inc. Common Shares,$74.34,-0.26,-0.349%,"2,160,161,907"
GNL,"Global Net Lease, Inc. Common Stock",$9.84,-0.01,-0.102%,"2,157,242,339"
NN,NextNav Inc. Common Stock,$15.99,-0.10,-0.622%,"2,155,917,117"
TLX,Telix Pharmaceuticals Limited American Depositary Shares,$6.42,-0.12,-1.835%,"2,148,931,194"
TALO,"Talos Energy, Inc. Common Stock",$12.63,-0.49,-3.735%,"2,146,958,190"
HUN,Huntsman Corporation Common Stock,$12.35,-0.86,-6.51%,"2,145,825,171"
SLDE,"Slide Insurance Holdings, Inc. Common Stock",$17.18,0.31,1.838%,"2,135,298,747"
GLOB,Globant S.A. Common Shares,$48.46,-0.94,-1.903%,"2,134,447,741"
IOSP,Innospec Inc. Common Stock,$86.14,-0.44,-0.508%,"2,134,340,913"
CENTA,Central Garden & Pet Company Class A Common Stock Nonvoting,$34.26,0.28,0.824%,"2,133,282,460"
CCS,"Century Communities, Inc. Common Stock",$73.43,-1.41,-1.884%,"2,133,179,316"
SFB,Stifel Financial Corporation 5.20% Senior Notes due 2047,$20.85,0.15,0.725%,"2,130,315,515"
DNTH,"Dianthus Therapeutics, Inc. Common Stock",$49.21,1.81,3.819%,"2,127,008,259"
HRMY,"Harmony Biosciences Holdings, Inc. Common Stock",$36.92,0.91,2.527%,"2,126,457,537"
ADAML,"Adamas Trust, Inc. 6.875% Series F Fixed-to-Floating Rate Cumulative Redeemable Preferred Stock, $0.01 par value per share",$23.54,0.07,0.298%,"2,125,981,650"
WD,"Walker & Dunlop, Inc Common Stock",$62.26,0.40,0.647%,"2,120,839,084"
BRBR,"BellRing Brands, Inc. Common Stock ",$18.08,0.21,1.175%,"2,120,232,976"
PAHC,Phibro Animal Health Corporation Class A Common Stock,$52.29,0.03,0.057%,"2,119,560,300"
NTCT,"NetScout Systems, Inc. Common Stock",$29.32,-0.47,-1.578%,"2,117,500,662"
QFIN,"Qfin Holdings, Inc. American Depositary Shares",$15.73,0.18,1.158%,"2,117,258,000"
NYAX,Nayax Ltd. Ordinary Shares,$57.49,0.64,1.126%,"2,111,364,402"
VVX,"V2X, Inc. Common Stock",$66.89,1.33,2.029%,"2,109,381,702"
DK,"Delek US Holdings, Inc. Common Stock",$35.01,0.55,1.596%,"2,102,404,871"
BUR,Burford Capital Limited Ordinary Shares,$9.60,0.21,2.236%,"2,100,591,274"
ADUS,Addus HomeCare Corporation Common Stock,$113.26,-0.54,-0.475%,"2,093,415,273"
ALGT,Allegiant Travel Company Common Stock,$114.04,2.74,2.462%,"2,088,479,979"
NWN,Northwest Natural Holding Company Common Stock,$50.20,-0.15,-0.298%,"2,083,653,508"
RCUS,"Arcus Biosciences, Inc. Common Stock",$19.24,0.32,1.691%,"2,077,410,833"
HCI,"HCI Group, Inc. Common Stock",$160.00,2.04,1.291%,"2,073,605,920"
BHE,"Benchmark Electronics, Inc. Common Stock",$58.06,-1.17,-1.975%,"2,071,518,966"
STC,Stewart Information Services Corporation Common Stock,$69.20,-0.19,-0.274%,"2,070,438,119"
UMBFO,"UMB Financial Corporation Depositary Shares Each Representing a 1/400th Interest in a Share of 7.750% Fixed-Rate Reset Non-Cumulative Perpetual Preferred Stock, Series B",$27.25,0.27,1.001%,"2,069,764,485"
HWCPZ,Hancock Whitney Corporation 6.25% Subordinated Notes due 2060,$24.41,0.105,0.432%,"2,068,869,013"
SLNO,"Soleno Therapeutics, Inc. Common Stock",$38.50,1.26,3.383%,"2,067,835,963"
GRDN,"Guardian Pharmacy Services, Inc. Class A Common Stock",$32.65,-0.81,-2.421%,"2,067,418,700"
VECO,Veeco Instruments Inc. Common Stock,$34.35,0.74,2.202%,"2,066,582,219"
TIC,"TIC Solutions, Inc. Common Stock",$9.34,-0.02,-0.214%,"2,066,098,467"
FRSH,Freshworks Inc. Class A Common Stock,$7.29,0.05,0.691%,"2,055,574,079"
ADEA,Adeia Inc. Common Stock,$18.73,-0.07,-0.372%,"2,051,125,877"
SYBT,"Stock Yards Bancorp, Inc. Common Stock",$69.59,-0.14,-0.201%,"2,051,057,942"
CMRE,Costamare Inc. Common Stock $0.0001 par value,$17.09,0.15,0.885%,"2,050,141,847"
PRDO,Perdoceo Education Corporation Common Stock,$31.79,0.36,1.145%,"2,044,811,512"
ADAMN,"Adamas Trust, Inc. 8.00% Series D Fixed-to-Floating Rate Cumulative Redeemable Preferred Stock",$22.59,0.18,0.803%,"2,040,183,750"
FLO,"Flowers Foods, Inc. Common Stock",$9.66,-0.70,-6.757%,"2,039,981,654"
CYD,China Yuchai International Limited Common Stock,$54.37,0.76,1.418%,"2,039,871,167"
RGTIW,"Rigetti Computing, Inc. Warrants",$6.18,-0.085,-1.357%,"2,039,561,162"
IMAX,Imax Corporation Common Stock,$37.86,1.78,4.933%,"2,036,827,641"
CIMN,Chimera Investment Corporation 9.000% Senior Notes due 2029,$25.27,0.05,0.198%,"2,035,010,688"
DRH,Diamondrock Hospitality Company Common Stock,$9.99,0.12,1.216%,"2,034,994,788"
CASH,"Pathward Financial, Inc. Common Stock",$93.37,0.92,0.995%,"2,032,075,268"
ADNT,Adient plc Ordinary Shares ,$25.92,-1.17,-4.319%,"2,030,308,494"
GEO,Geo Group Inc (The) REIT,$14.58,0.37,2.604%,"2,029,495,890"
SEM,Select Medical Holdings Corporation Common Stock,$16.38,UNCH,--,"2,028,132,141"
HG,"Hamilton Insurance Group, Ltd. Class B Common Shares",$31.41,0.50,1.618%,"2,027,131,419"
LMAT,"LeMaitre Vascular, Inc. Common Stock",$89.25,1.59,1.814%,"2,024,724,965"
GTY,Getty Realty Corporation Common Stock,$33.83,0.59,1.775%,"2,023,593,244"
WERN,"Werner Enterprises, Inc. Common Stock",$33.74,0.53,1.596%,"2,018,674,896"
BB,BlackBerry Limited Common Stock,$3.42,-0.04,-1.156%,"2,017,800,000"
SGRY,"Surgery Partners, Inc. Common Stock",$15.60,0.14,0.906%,"2,017,731,752"
NUVB,Nuvation Bio Inc. Class A Common Stock,$5.88,0.11,1.906%,"2,015,860,586"
BGR,BlackRock Energy and Resources Trust,$14.85,-0.11,-0.735%,"2,013,454,981"
ATEC,"Alphatec Holdings, Inc. Common Stock",$13.50,0.14,1.048%,"2,005,427,498"
DAC,Danaos Corporation Common Stock,$107.31,-0.74,-0.685%,"2,003,403,656"
RNW,ReNew Energy Global plc Class A Ordinary Shares,$5.51,0.16,2.991%,"1,998,857,983"
RVT,"Royce Small-Cap Trust, Inc. Common Stock",$18.47,0.10,0.544%,"1,993,960,526"
VAC,Marriott Vacations Worldwide Corporation Common Stock,$57.59,3.64,6.747%,"1,993,419,742"
SAH,"Sonic Automotive, Inc. Common Stock",$58.28,-1.83,-3.044%,"1,991,584,024"
UNIT,Uniti Group Inc. Common Stock,$8.33,-0.03,-0.359%,"1,991,172,587"
NTST,NetSTREIT Corp. Common Stock,$20.50,0.30,1.485%,"1,990,014,376"
ARR,"ARMOUR Residential REIT, Inc.",$17.78,-0.52,-2.842%,"1,989,550,636"
PRGO,Perrigo Company plc Ordinary Shares,$14.44,-0.10,-0.688%,"1,987,290,690"
USAS,"Americas Gold and Silver Corporation Common Shares, no par value",$7.26,-0.27,-3.586%,"1,986,550,918"
PDO,PIMCO Dynamic Income Opportunities Fund Common Shares of Beneficial Interest,$14.09,UNCH,--,"1,983,646,757"
GTM,ZoomInfo Technologies Inc Common Stock,$6.49,0.13,2.044%,"1,981,362,240"
TNET,"TriNet Group, Inc. Common Stock",$41.76,1.94,4.872%,"1,975,214,007"
STEL,"Stellar Bancorp, Inc. Common Stock",$38.51,0.02,0.052%,"1,971,230,394"
MCW,"Mister Car Wash, Inc. Common Stock",$6.01,0.04,0.67%,"1,968,685,910"
VERX,"Vertex, Inc. Class A Common Stock",$12.34,-0.41,-3.216%,"1,968,575,076"
CHA,Chagee Holdings Limited American Depositary Shares,$10.59,0.28,2.716%,"1,967,118,869"
MAAS,Maase Inc. Class A Ordinary Shares,$6.14,UNCH,--,"1,963,658,107"
TILE,"Interface, Inc. Common Stock",$33.55,0.15,0.449%,"1,959,005,200"
NWL,Newell Brands Inc. Common Stock,$4.67,-0.03,-0.638%,"1,957,664,000"
CNXC,Concentrix Corporation Common Stock,$31.78,1.395,4.591%,"1,957,562,321"
CXW,"CoreCivic, Inc. Common Stock",$18.69,-0.23,-1.216%,"1,954,687,202"
FLOC,Flowco Holdings Inc. Class A Common Stock,$21.80,-0.02,-0.092%,"1,954,648,059"
JSM,"Navient Corporation 6% Senior Notes due December 15, 2043",$19.64,0.11,0.563%,"1,952,825,586"
HTO,H2O America Common Stock,$54.52,-0.37,-0.674%,"1,952,093,452"
DFH,"Dream Finders Homes, Inc. Class A Common Stock",$20.99,-0.06,-0.285%,"1,946,921,531"
RARE,Ultragenyx Pharmaceutical Inc. Common Stock,$20.18,-0.34,-1.657%,"1,946,917,342"
NOMD,Nomad Foods Limited Ordinary Shares,$12.68,-0.22,-1.705%,"1,945,149,748"
INTA,"Intapp, Inc. Common Stock",$24.00,0.77,3.315%,"1,929,498,936"
FDP,"Fresh Del Monte Produce, Inc. Common Stock",$40.32,-0.13,-0.321%,"1,926,279,009"
GRND,Grindr Inc. Common Stock,$10.42,0.34,3.373%,"1,924,929,541"
CLBK,"Columbia Financial, Inc. Common Stock",$18.38,-0.03,-0.163%,"1,917,279,410"
OZKAP,Bank OZK 4.625% Series A Non-Cumulative Perpetual Preferred Stock,$16.92,0.22,1.317%,"1,914,263,353"
