Symbol,Name,Last Sale,Net Change,% Change,Market Cap
RLYB,Rallybio Corporation Common Stock,$0.6492,0.0136,2.14%,"27,424,658"
LEE,"Lee Enterprises, Incorporated Common Stock",$4.35,0.10,2.353%,"27,243,906"
QVCGP,"QVC Group, Inc. 8.0% Fixed Rate Cumulative Redeemable Preferred Stock",$3.37,-0.33,-8.919%,"27,190,737"
TOPP,Toppoint Holdings Inc. Common Stock,$1.40,0.33,30.841%,"27,160,000"
NTZ,"Natuzzi, S.p.A.",$2.46,-0.0799,-3.146%,"27,095,938"
TBLAW,Taboola.com Ltd. Warrant,$0.094,0.009,10.588%,"27,092,996"
MFI,mF International Limited Class A Ordinary Shares,$16.26,2.48,17.997%,"26,934,023"
NIXX,"Nixxy, Inc. Common Stock",$1.08,-0.05,-4.425%,"26,865,624"
DXST,Decent Holding Inc Class A Ordinary Shares,$1.65,-0.0002,-0.012%,"26,812,500"
RDGT,"Ridgetech, Inc. Ordinary Shares",$4.57,0.27,6.279%,"26,757,391"
CLPS,CLPS Incorporation Common Stock,$0.898,-0.018,-1.965%,"26,709,620"
TBHC,"The Brand House Collective, Inc. Common Stock",$1.18,-0.15,-11.278%,"26,504,432"
LGPS,LogProstyle Inc. Common Shares,$1.12,0.1587,16.509%,"26,490,363"
ELUT,Elutia Inc. Class A Common Stock,$0.62,0.0201,3.351%,"26,474,735"
SWVL,Swvl Holdings Corp Class A Common Shares,$2.67,0.01,0.376%,"26,429,038"
MKDW,MKDWELL Tech Inc. Ordinary Share,$0.184,-0.0018,-0.969%,"26,425,959"
NERV,"Minerva Neurosciences, Inc Common Stock",$3.77,-0.01,-0.265%,"26,365,141"
IBIO,"iBio, Inc. Common Stock",$1.17,0.06,5.405%,"26,310,150"
DAIO,Data I/O Corporation Common Stock,$2.80,0.15,5.66%,"26,297,272"
HUMAW,"Humacyte, Inc. Warrant",$0.14,UNCH,--,"26,217,985"
SHMDW,SCHMID Group N.V. Warrants,$0.61,-0.02,-3.175%,"26,214,666"
UG,"United-Guardian, Inc. Common Stock",$5.685,0.065,1.157%,"26,118,704"
CYN,Cyngn Inc. Common Stock,$3.27,-0.07,-2.096%,"26,076,223"
XOS,"Xos, Inc. Common Stock",$2.29,-0.01,-0.435%,"25,955,300"
BTOC,Armlogi Holding Corp. Common Stock,$0.5696,0.0206,3.752%,"25,884,378"
CREG,Smart Powerr Corp. Common Stock,$1.24,-0.07,-5.344%,"25,803,313"
PLAG,Planet Green Holdings Corp. Common Stock,$2.75,0.20,7.843%,"25,802,464"
ABVEW,Above Food Ingredients Inc. Warrants,$0.5029,-0.0876,-14.835%,"25,744,380"
CLGN,CollPlant Biotechnologies Ltd Ordinary Shares,$2.24,0.02,0.901%,"25,658,107"
MODD,"Modular Medical, Inc. Common Stock",$0.40,-0.0144,-3.475%,"25,439,820"
STAI,ScanTech AI Systems Inc. Common stock,$0.3926,-0.0104,-2.581%,"25,317,842"
GLBS,Globus Maritime Limited Common Stock,$1.23,0.02,1.653%,"25,316,230"
LNAI,Lunai Bioworks Inc. Common Stock,$1.08,-0.19,-14.961%,"25,306,982"
DARE,"Dare Bioscience, Inc. Common Stock",$1.77,-0.02,-1.117%,"25,291,935"
FENG,"Phoenix New Media Limited American Depositary Shares, each representing 48 Class A ordinary shares.",$2.10,0.02,0.962%,"25,222,630"
ARKR,Ark Restaurants Corp. Common Stock,$6.98,UNCH,--,"25,170,976"
MBNKO,"Medallion Bank Fixed-Rate Reset Non-Cumulative Perpetual Preferred Stock, Series G, par value $1.00 per share",$25.04,-0.04,-0.159%,"25,040,000"
QTTB,Q32 Bio Inc. Common Stock,$2.03,-0.01,-0.49%,"24,977,835"
NRSN,NeuroSense Therapeutics Ltd. Ordinary Shares,$1.04,-0.02,-1.887%,"24,948,216"
CING,Cingulate Inc. Common Stock,$3.69,0.16,4.533%,"24,933,588"
SPWRW,SunPower Inc. Warrants,$0.30,-0.021,-6.542%,"24,932,612"
NCT,Intercont (Cayman) Limited Ordinary shares,$0.85,UNCH,--,"24,918,150"
BOLD,"Boundless Bio, Inc. Common Stock",$1.11,UNCH,--,"24,848,028"
MNDO,MIND C.T.I. Ltd. Ordinary Shares,$1.22,0.07,6.087%,"24,846,918"
MOBX,"Mobix Labs, Inc. Class A Common Stock",$0.4524,-0.0018,-0.396%,"24,761,815"
PSHG,Performance Shipping Inc. Common Shares,$1.99,-0.24,-10.762%,"24,739,994"
EQS,"Equus Total Return, Inc. Common Stock",$1.77,-0.08,-4.324%,"24,721,052"
ELOG,Eastern International Ltd. Ordinary Shares,$2.05,0.11,5.67%,"24,634,850"
RVP,"Retractable Technologies, Inc. Common Stock",$0.8221,0.0021,0.256%,"24,611,338"
SIDU,"Sidus Space, Inc. Class A Common Stock",$0.696,-0.0456,-6.149%,"24,532,248"
APUS,"Apimeds Pharmaceuticals US, Inc. Common Stock",$1.95,-0.08,-3.941%,"24,523,167"
NEUP,Neuphoria Therapeutics Inc. Common Stock,$4.56,0.13,2.935%,"24,520,620"
IINN,Inspira Technologies Oxy B.H.N. Ltd. Ordinary Shares,$1.01,0.0465,4.826%,"24,494,617"
SCNX,"Scienture Holdings, Inc. Common Stock",$0.6003,0.0067,1.129%,"24,390,678"
MLSS,"Milestone Scientific, Inc. Common Stock",$0.31,-0.0009,-0.289%,"24,374,963"
XCUR,"Exicure, Inc. Common Stock",$3.82,-0.30,-7.282%,"24,348,180"
HHS,"Harte Hanks, Inc. Common Stock",$3.25,0.10,3.175%,"24,098,081"
WETH,Wetouch Technology Inc. Common Stock,$2.01,-0.06,-2.899%,"23,982,383"
LIMN,"Liminatus Pharma, Inc. Class A Common Stock",$0.8851,0.0423,5.019%,"23,954,907"
AFRIW,Forafric Global PLC Warrants,$0.89,-0.0586,-6.178%,"23,942,417"
DRTSW,Alpha Tau Medical Ltd. Warrant,$0.34,0.0209,6.55%,"23,929,394"
FTFT,Future FinTech Group Inc. Common Stock,$1.18,0.03,2.609%,"23,780,907"
UTSI,UTStarcom Holdings Corp. Ordinary Shares,$2.51,-0.08,-3.089%,"23,770,340"
INTS,"Intensity Therapeutics, Inc. Common stock",$0.3955,-0.0257,-6.102%,"23,755,694"
GREE,Greenidge Generation Holdings Inc. Class A Common Stock,$1.50,0.07,4.895%,"23,698,496"
VRAR,"The Glimpse Group, Inc. Common Stock",$1.12,-0.03,-2.609%,"23,605,687"
VEEA,Veea Inc. Common Stock,$0.4689,0.0021,0.45%,"23,520,340"
ENLV,Enlivex Therapeutics Ltd. Ordinary Shares,$0.98,-0.04,-3.922%,"23,372,936"
LITM,Snow Lake Resources Ltd. Common Shares,$2.67,0.03,1.136%,"23,357,606"
LIXT,"Lixte Biotechnology Holdings, Inc. Common Stock",$4.09,-0.38,-8.501%,"23,330,178"
EBON,Ebang International Holdings Inc. Class A Ordinary Shares,$3.5601,-0.0338,-0.94%,"23,297,074"
CISO,"CISO Global, Inc. Common Stock",$0.5277,-0.0248,-4.489%,"23,243,255"
REE,REE Automotive Ltd. Class A Ordinary Shares,$0.748,-0.0034,-0.452%,"23,203,657"
ITRM,Iterum Therapeutics plc Ordinary Share,$0.4383,0.0183,4.357%,"23,136,840"
COCH,"Envoy Medical, Inc. Class A Common Stock",$0.7989,0.0302,3.929%,"22,997,544"
FCUV,Focus Universal Inc. Common Stock,$3.09,-0.03,-0.962%,"22,824,918"
CVV,CVD Equipment Corporation Common Stock,$3.29,0.1215,3.835%,"22,823,842"
SELX,Semilux International Ltd. Ordinary Shares,$0.60,0.019,3.27%,"22,457,012"
SQFTP,"Presidio Property Trust, Inc. 9.375% Series D Cumulative Redeemable Perpetual Preferred Stock, $0.01 par value per share",$15.5966,0.0954,0.615%,"22,445,051"
ZYXI,"Zynex, Inc. Common Stock",$0.7374,0.0074,1.014%,"22,408,579"
COOT,Australian Oilseeds Holdings Limited Ordinary Shares,$0.802,0.022,2.821%,"22,374,627"
WKHS,"Workhorse Group, Inc. Common Stock",$0.9329,-0.0611,-6.147%,"22,354,938"
WNW,Meiwu Technology Company Limited Ordinary Shares,$1.4226,0.0526,3.839%,"22,254,234"
PRZO,ParaZero Technologies Ltd. Ordinary Shares,$1.33,-0.03,-2.206%,"22,183,909"
SGRP,"SPAR Group, Inc. Common Stock",$0.9246,0.0189,2.087%,"22,144,162"
TLF,"Tandy Leather Factory, Inc. Common Stock",$2.74,0.10,3.788%,"22,104,955"
GLTO,"Galecto, Inc. Common Stock",$16.58,0.27,1.655%,"22,005,175"
BTOG,Bit Origin Limited Class A Ordinary Shares,$0.2481,-0.0089,-3.463%,"21,984,270"
COSM,Cosmos Health Inc. Common Stock,$0.628,-0.0609,-8.84%,"21,929,710"
MSW,Ming Shing Group Holdings Limited Ordinary Shares,$1.69,-0.0332,-1.927%,"21,927,750"
GDTC,CytoMed Therapeutics Limited Ordinary Shares,$1.90,-0.01,-0.524%,"21,926,000"
CAPT,Captivision Inc. Ordinary Shares,$0.7496,-0.0034,-0.452%,"21,856,568"
AIFF,"Firefly Neuroscience, Inc. Common Stock",$1.62,0.01,0.621%,"21,841,668"
BMGL,Basel Medical Group Ltd Ordinary Shares,$1.16,0.01,0.87%,"21,791,470"
AUST,Austin Gold Corp. Common Shares,$1.59,0.08,5.298%,"21,771,872"
TRSG,Tungray Technologies Inc Class A Ordinary Shares,$1.33,0.0454,3.534%,"21,750,135"
MOGU,MOGU Inc. American Depositary Shares (each  representing 25 Class A Ordinary Shares),$2.64,0.09,3.529%,"21,578,412"
AYTU,"Aytu BioPharma, Inc.  Common Stock",$2.115,0.055,2.67%,"21,548,060"
KZIA,Kazia Therapeutics Limited American Depositary Shares,$12.79,4.34,51.361%,"21,366,680"
EDHL,Everbright Digital Holding Limited Ordinary Shares,$0.8042,0.0342,4.442%,"21,311,300"
VIVK,"Vivakor, Inc. Common Stock",$0.1378,-0.0056,-3.905%,"21,220,690"
NTCL,NETCLASS TECHNOLOGY INC Class A Ordinary Shares,$1.19,-0.001,-0.084%,"21,217,700"
AQMS,"Aqua Metals, Inc. Common Stock",$7.11,0.01,0.141%,"21,182,560"
BGI,Birks Group Inc. Common Stock,$1.08,-0.01,-0.917%,"21,162,262"
LEXX,Lexaria Bioscience Corp. Common Stock,$1.08,0.02,1.887%,"21,123,913"
NNVC,"NanoViricides, Inc. Common Stock",$1.17,-0.07,-5.645%,"21,056,490"
TRAW,"Traws Pharma, Inc. Common Stock",$2.63,0.20,8.23%,"21,015,980"
OSRH,"OSR Holdings, Inc. Common Stock",$0.8165,0.1668,25.673%,"20,961,831"
JVA,"Coffee Holding Co., Inc. Common Stock",$3.64,0.11,3.116%,"20,779,300"
CSAI,"Cloudastructure, Inc. Class A Common Stock",$1.06,-0.04,-3.636%,"20,755,343"
CTXR,"Citius Pharmaceuticals, Inc. Common Stock",$1.22,0.08,7.018%,"20,754,873"
ECXWW,ECARX Holdings Inc. Warrants,$0.06,-0.014,-18.919%,"20,743,802"
CKX,"CKX Lands, Inc. Common Stock",$10.10,-0.10,-0.98%,"20,736,603"
KMRK,K-Tech Solutions Company Limited Class A Ordinary Shares,$1.06,0.06,6.00%,"20,670,000"
CVKD,"Cadrenal Therapeutics, Inc. Common Stock",$9.92,-0.12,-1.195%,"20,592,382"
JOB,GEE Group Inc. Common Stock,$0.188,0.0008,0.427%,"20,569,690"
IDAI,T Stamp Inc. Class A Common Stock,$3.92,-0.03,-0.759%,"20,555,821"
SNYR,Synergy CHC Corp. Common Stock,$2.15,0.02,0.939%,"20,540,464"
AHT,Ashford Hospitality Trust Inc Common Stock,$3.20,0.01,0.313%,"20,516,902"
EHLD,Euroholdings Ltd. Common Stock ,$7.25,-0.145,-1.961%,"20,420,459"
GYRO,"Gyrodyne, LLC Common Stock",$9.25,-0.14,-1.491%,"20,343,599"
POAI,Predictive Oncology Inc. Common Stock,$5.98,-0.27,-4.32%,"20,293,226"
APVO,Aptevo Therapeutics Inc. Common Stock,$1.20,0.02,1.695%,"20,220,593"
NYC,American Strategic Investment Co. Class A Common Stock,$7.5366,-0.1234,-1.611%,"20,144,902"
LIQT,"LiqTech International, Inc. Common Stock",$2.09,0.11,5.556%,"20,120,564"
BEAT,"Heartbeam, Inc. Common Stock",$0.5826,-0.0774,-11.727%,"20,066,820"
EONR,EON Resources Inc. Class A Common Stock,$0.4011,-0.0306,-7.088%,"20,042,303"
MDCXW,Medicus Pharma Ltd. Warrant,$0.9504,-0.0347,-3.522%,"19,930,954"
RENT,"Rent the Runway, Inc. Class A Common Stock",$4.86,0.17,3.625%,"19,911,571"
PMAX,Powell Max Limited Class A Ordinary Shares,$1.59,-0.07,-4.217%,"19,875,000"
TIRX,TIAN RUIXIANG Holdings Ltd Class A Ordinary Shares,$0.8135,0.0535,7.039%,"19,818,024"
SBDS,"Solo Brands, Inc. Class A Common Stock",$8.00,0.20,2.564%,"19,801,224"
CODX,"Co-Diagnostics, Inc. Common Stock",$0.325,-0.0087,-2.607%,"19,790,089"
VVOS,"Vivos Therapeutics, Inc. Common Stock",$2.20,0.05,2.326%,"19,773,833"
NXL,"Nexalin Technology, Inc. Common Stock",$1.06,-0.03,-2.752%,"19,771,055"
DLPN,"Dolphin Entertainment, Inc. Common Stock",$1.62,-0.07,-4.142%,"19,638,324"
SYBX,"Synlogic, Inc. Common Stock",$1.67,0.03,1.829%,"19,537,195"
ANGH,Anghami Inc. Ordinary Shares,$2.8999,-0.0001,-0.003%,"19,396,599"
NSYS,Nortech Systems Incorporated Common Stock,$6.95,-0.2169,-3.026%,"19,363,631"
OMH,Ohmyhome Limited Class A Ordinary Shares,$0.82,0.0482,6.245%,"19,344,053"
SVREW,SaverOne 2014 Ltd. Warrant,$0.0151,-0.0048,-24.121%,"19,074,743"
JL,J-Long Group Limited Class A Ordinary Shares,$5.05,0.21,4.339%,"18,996,590"
VSEE,"VSee Health, Inc. Common Stock",$0.6059,-0.0441,-6.785%,"18,993,994"
GTEC,Greenland Technologies Holding Corporation Ordinary Shares,$1.09,0.02,1.869%,"18,959,706"
CTRM,Castor Maritime Inc. Common Shares,$1.96,0.02,1.031%,"18,938,214"
TBH,"Brag House Holdings, Inc. Common Stock",$0.956,0.0099,1.046%,"18,927,930"
WETO,Webus International Limited Ordinary Shares,$0.86,UNCH,--,"18,920,000"
YYAI,AiRWA Inc. Common Stock,$0.9887,0.0566,6.072%,"18,766,835"
BATL,Battalion Oil Corporation Common Stock,$1.14,0.01,0.885%,"18,760,482"
TXMD,"TherapeuticsMD, Inc. Common Stock",$1.62,-0.02,-1.22%,"18,750,466"
ABP,"Abpro Holdings, Inc Common Stock",$6.89,-0.02,-0.289%,"18,715,155"
QNRX,"Quoin Pharmaceuticals, Ltd. American Depositary Shares",$22.30,2.71,13.834%,"18,709,187"
SPCB,"SuperCom, Ltd. Ordinary Shares (Israel)",$8.60,0.18,2.138%,"18,686,553"
ALLR,"Allarity Therapeutics, Inc. Common Stock",$1.18,0.01,0.855%,"18,658,025"
ARBEW,Arbe Robotics Ltd. Warrant,$0.1771,0.0098,5.858%,"18,624,401"
EVOK,"Evoke Pharma, Inc. Common Stock",$10.80,0.07,0.652%,"18,602,017"
NINE,"Nine Energy Service, Inc. Common Stock",$0.4284,0.0201,4.923%,"18,575,998"
WKSP,"Worksport, Ltd. Common Stock",$2.24,0.13,6.161%,"18,489,831"
FATBP,FAT Brands Inc. 8.25% Series B Cumulative Preferred Stock,$1.0301,-0.0749,-6.778%,"18,479,299"
IQST,iQSTEL Inc. Common Stock,$4.29,0.08,1.90%,"18,444,319"
MTEX,"Mannatech, Incorporated Common Stock",$9.69,-0.15,-1.524%,"18,420,012"
RSVRW,"Reservoir Media, Inc. Warrant",$0.28,0.02,7.692%,"18,364,702"
MRKR,"Marker Therapeutics, Inc. Common Stock",$1.10,-0.03,-2.655%,"18,340,440"
MBRX,"Moleculin Biotech, Inc. Common Stock",$0.3591,-0.007,-1.912%,"18,281,952"
MXC,Mexco Energy Corporation Common Stock,$8.9169,0.3718,4.351%,"18,243,977"
LEDS,SemiLEDS Corporation Common Stock,$2.21,0.025,1.144%,"18,171,511"
LSTA,"Lisata Therapeutics, Inc. Common Stock",$2.06,0.10,5.102%,"18,170,710"
LPCN,Lipocine Inc. Common Stock,$3.27,0.02,0.615%,"18,154,814"
HOTH,"Hoth Therapeutics, Inc. Common Stock",$1.17,0.03,2.632%,"18,151,745"
SGBX,Safe & Green Holdings Corp. Common Stock,$3.19,0.13,4.248%,"18,146,490"
RVSN,Rail Vision Ltd. Ordinary Share,$0.3461,-0.016,-4.419%,"17,993,112"
MOBBW,Mobilicom Limited Warrants,$1.81,-0.1095,-5.705%,"17,990,801"
ADGM,"Adagio Medical Holdings, Inc Common Stock",$0.8475,0.0485,6.07%,"17,949,742"
APLM,Apollomics Inc. Class A Ordinary Shares,$16.14,-0.85,-5.003%,"17,808,037"
CGTL,Creative Global Technology Holdings Limited Class A Ordinary Shares,$0.8282,-0.0048,-0.576%,"17,754,538"
ATHA,"Athira Pharma, Inc. Common Stock",$4.49,0.075,1.699%,"17,708,053"
BNGO,"Bionano Genomics, Inc. Common Stock",$1.74,0.06,3.571%,"17,706,240"
RMSG,Real Messenger Corporation Ordinary Shares,$1.84,0.10,5.747%,"17,611,157"
HOVRW,New Horizon Aircraft Ltd. Warrant,$0.406,0.016,4.103%,"17,602,207"
SATLW,Satellogic Inc. Warrant,$0.1294,0.0196,17.851%,"17,529,450"
CASI,"CASI Pharmaceuticals, Inc. Ordinary Shares",$1.13,-0.065,-5.439%,"17,506,730"
ONEG,OneConstruction Group Limited Ordinary Shares,$1.09,-0.03,-2.679%,"17,440,000"
HUDI,"Huadi International Group Co., Ltd. Ordinary Shares",$1.22,-0.02,-1.613%,"17,420,602"
NWGL,Nature Wood Group Limited American Depositary Shares,$1.05,-0.04,-3.67%,"17,380,823"
NISN,"NiSun International Enterprise Development Group Co., Ltd. Class A Common Shares",$3.61,-0.0381,-1.044%,"17,322,072"
CCM,Concord Medical Services Holdings Limited American Depositary Shares (Each represents thirty (30) Class A ordinary shares),$3.98,-0.02,-0.50%,"17,280,058"
MTVA,MetaVia Inc. Common Stock,$0.7134,-0.0358,-4.778%,"17,274,830"
ENGS,Energys Group Limited Ordinary Shares,$1.20,-0.04,-3.226%,"17,145,432"
ELWS,"Earlyworks Co., Ltd. American Depositary Shares",$5.68,-0.16,-2.74%,"17,127,358"
PMN,ProMIS Neurosciences Inc. Common Shares (ON),$0.317,-0.0091,-2.791%,"17,058,122"
MI,NFT Limited Class A Ordinary Share,$3.35,0.26,8.414%,"16,968,253"
BCTX,BriaCell Therapeutics Corp. Common Shares,$9.65,1.15,13.529%,"16,936,802"
EJH,E-Home Household Service Holdings Limited Ordinary Shares,$0.8462,0.0512,6.44%,"16,927,265"
IPM,Intelligent Protection Management Corp. Common Stock ,$1.86,0.03,1.639%,"16,899,456"
NTRBW,Nutriband Inc. Warrant,$1.40,UNCH,--,"16,848,836"
VWAVW,"VisionWave Holdings, Inc. Warrant",$1.16,-0.09,-7.20%,"16,844,468"
GIGM,GigaMedia Limited Ordinary Shares,$1.52,0.0089,0.589%,"16,799,397"
BNAI,Brand Engagement Network Inc. Common Stock,$0.373,-0.0167,-4.285%,"16,740,537"
ROLR,"High Roller Technologies, Inc. Common Stock",$1.964,-0.096,-4.66%,"16,689,112"
AUID,authID Inc. Common Stock,$1.24,0.08,6.897%,"16,670,238"
VBIX,Viewbix Inc. Common Stock,$1.56,-0.07,-4.294%,"16,645,812"
LRE,"Lead Real Estate Co., Ltd American Depositary Shares",$1.22,-0.02,-1.613%,"16,643,118"
TRIB,Trinity Biotech plc American Depositary Shares,$0.89,0.005,0.565%,"16,582,497"
NXPL,NextPlat Corp Common Stock,$0.6264,0.0277,4.627%,"16,477,444"
WVVIP,"Willamette Valley Vineyards, Inc. Series A Redeemable Preferred Stock",$3.30,0.05,1.538%,"16,382,946"
TOMZ,"TOMI Environmental Solutions, Inc. Common Stock",$0.81,0.0282,3.607%,"16,382,416"
ARBK,Argo Blockchain plc American Depositary Shares,$0.2275,-0.0218,-8.744%,"16,317,445"
DFLIW,Dragonfly Energy Holdings Corp. Warrant,$0.135,0.0151,12.594%,"16,306,252"
RBOT,Vicarious Surgical Inc. Class A Common Stock,$2.49,-0.10,-3.861%,"16,305,175"
EDTK,Skillful Craftsman Education Technology Limited Ordinary Share,$1.02,UNCH,--,"16,248,040"
MSGM,Motorsport Games Inc. Class A Common Stock,$2.78,0.04,1.46%,"16,064,091"
ELSE,"Electro-Sensors, Inc. Common Stock",$4.60,0.0102,0.222%,"16,010,397"
NCEL,NewcelX Ltd. Ordinary Shares,$3.50,0.15,4.478%,"15,954,323"
AKTX,Akari Therapeutics plc ADS,$0.446,0.0039,0.882%,"15,939,920"
IRIX,IRIDEX Corporation Common Stock,$0.9229,0.0069,0.753%,"15,864,633"
PMNT,Perfect Moment Ltd. Common Stock,$0.4501,-0.0339,-7.004%,"15,853,392"
PULM,"Pulmatrix, Inc. Common Stock",$4.32,-0.18,-4.00%,"15,777,871"
MGIH,Millennium Group International Holdings Limited Ordinary Shares,$1.40,-0.02,-1.408%,"15,750,000"
ANY,Sphere 3D Corp. Common Shares,$0.4651,0.0011,0.237%,"15,687,435"
INTJ,Intelligent Group Limited Class A Ordinary Shares ,$0.51,-0.007,-1.354%,"15,682,500"
AURE,Prestige Wealth Inc. Class A Ordinary Shares,$0.495,-0.0456,-8.435%,"15,662,770"
MMA,Mixed Martial Arts Group Limited Ordinary Shares,$1.20,UNCH,--,"15,649,451"
TMDE,TMD Energy Limited Ordinary Shares,$0.6634,0.0278,4.374%,"15,633,021"
ZCMD,Zhongchao Inc. Class A Ordinary Shares,$0.615,0.055,9.821%,"15,614,175"
MCTR,CTRL Group Limited Ordinary Shares,$1.02,UNCH,--,"15,606,000"
MRM,MEDIROM Healthcare Technologies Inc. American Depositary Share,$1.97,-0.045,-2.233%,"15,566,842"
JBDI,JBDI Holdings Limited Ordinary Shares,$0.8083,-0.1217,-13.086%,"15,381,192"
FIEE,"FiEE, Inc Common Stock",$2.44,0.15,6.55%,"15,362,145"
TURB,"Turbo Energy, S.A. American Depositary Shares",$1.39,0.03,2.206%,"15,313,825"
PT,Pintec Technology Holdings Limited American Depositary Shares,$0.96,-0.04,-4.00%,"15,310,042"
MGRX,"Mangoceuticals, Inc. Common Stock",$1.10,-0.05,-4.348%,"15,297,227"
KAPA,"Kairos Pharma, Ltd. Common Stock",$0.734,0.006,0.824%,"15,282,873"
QCLS,"Q/C Technologies, Inc. Common Stock",$3.66,-0.07,-1.877%,"15,250,342"
BCDA,"BioCardia, Inc. Common Stock",$1.43,0.05,3.623%,"15,176,210"
MNTS,Momentus Inc. Class A Common Stock,$0.624,0.0123,2.011%,"15,068,765"
SNES,"SenesTech, Inc. Common Stock",$2.88,0.10,3.597%,"15,042,283"
GFAI,"Guardforce AI Co., Limited Ordinary Shares",$0.714,0.075,11.737%,"15,010,799"
LSH,Lakeside Holding Limited Common Stock,$0.8601,UNCH,--,"14,989,443"
LVLU,"Lulu's Fashion Lounge Holdings, Inc. Common Stock",$5.406,-0.099,-1.798%,"14,984,599"
AMBR,Amber International Holding Limited American Depositary Shares,$1.58,0.22,16.176%,"14,975,447"
WFF,WF Holding Limited Ordinary Shares,$0.60,-0.01,-1.639%,"14,970,000"
MDRR,"Medalist Diversified REIT, Inc. Common Stock",$13.36,UNCH,--,"14,861,731"
CABR,"Caring Brands, Inc. Common Stock",$1.08,0.08,8.00%,"14,835,879"
HCTI,"Healthcare Triangle, Inc. Common Stock",$2.04,UNCH,--,"14,813,142"
SLAI,SOLAI Limited American Depositary Shares (each representing one hundred (100) Class A Ordinary Shares),$1.39,-0.03,-2.113%,"14,810,642"
CENN,Cenntro Inc. Common Stock,$0.1681,0.0054,3.319%,"14,778,147"
AGAE,Allied Gaming & Entertainment Inc. Common Stock,$0.3876,-0.0212,-5.186%,"14,734,393"
DLXY,Delixy Holdings Limited Ordinary Shares,$0.9001,-0.0649,-6.725%,"14,716,635"
NXGL,"NexGel, Inc Common Stock",$1.80,0.22,13.924%,"14,657,639"
CRIS,"Curis, Inc. Common Stock",$1.13,UNCH,--,"14,609,604"
NCRA,"Nocera, Inc. Common Stock",$1.01,UNCH,--,"14,517,353"
GRNQ,Greenpro Capital Corp. Common Stock,$1.73,0.025,1.466%,"14,490,156"
TOIIW,"The Oncology Institute, Inc. Warrant",$0.1467,UNCH,--,"14,432,543"
RUBI,Rubico Inc. Common Stock,$0.2355,0.0828,54.224%,"14,315,594"
RYDE,Ryde Group Ltd. Class A Ordinary Shares,$0.486,-0.01,-2.016%,"14,234,855"
SNGX,"Soligenix, Inc. Common Stock",$1.41,-0.02,-1.399%,"14,221,443"
TPST,"Tempest Therapeutics, Inc. Common Stock",$3.20,-0.97,-23.261%,"14,208,515"
AMS,American Shared Hospital Services Common Stock,$2.17,0.10,4.831%,"14,198,310"
WIMI,WiMi Hologram Cloud Inc. Class B Ordinary Shares,$2.88,-0.01,-0.346%,"14,141,961"
OABIW,"OmniAb, Inc. Warrant",$0.098,-0.03,-23.438%,"14,107,629"
USEA,United Maritime Corporation Common Stock,$1.59,0.01,0.633%,"14,062,385"
AIRI,Air Industries Group Common Stock,$2.94,0.09,3.158%,"14,040,784"
MWYN,"Marwynn Holdings, Inc. Common stock",$0.8211,0.0593,7.784%,"14,003,043"
CUPR,Cuprina Holdings (Cayman) Limited Class A Ordinary Shares,$0.6668,-0.0225,-3.264%,"14,002,800"
FBLG,"FibroBiologics, Inc. Common Stock",$0.268,0.008,3.077%,"13,790,229"
PCSA,"Processa Pharmaceuticals, Inc. Common Stock",$0.2422,-0.0204,-7.768%,"13,719,231"
TGHL,The GrowHub Limited Class A Ordinary Shares,$0.54,0.0094,1.772%,"13,661,897"
SPPL,SIMPPLE LTD. Ordinary Shares,$3.855,0.145,3.908%,"13,645,890"
GTIM,Good Times Restaurants Inc. Common Stock,$1.29,0.05,4.032%,"13,608,865"
YHGJ,Yunhong Green CTI Ltd. Common Stock,$4.8893,-0.1307,-2.604%,"13,562,248"
WVVI,"Willamette Valley Vineyards, Inc. Common Stock",$2.73,0.151,5.855%,"13,553,164"
CWD,CaliberCos Inc. Class A Common Stock,$2.25,0.01,0.446%,"13,474,816"
SINT,"SiNtx Technologies, Inc. Common Stock",$3.65,0.11,3.107%,"13,446,560"
PSIG,PS International Group Ltd. Ordinary Shares,$4.08,-0.08,-1.923%,"13,426,737"
RMCF,"Rocky Mountain Chocolate Factory, Inc. Common Stock",$1.72,0.11,6.832%,"13,416,874"
ABTS,Abits Group Inc Ordinary Shares,$5.63,-0.33,-5.537%,"13,343,883"
ALUR,"Allurion Technologies, Inc. Common Stock",$1.44,0.31,27.434%,"13,338,124"
SMSI,"Smith Micro Software, Inc. Common Stock",$0.6129,0.0133,2.218%,"13,229,883"
CXAI,CXApp Inc. Class A Common Stock,$0.462,0.021,4.762%,"13,226,744"
BLRX,BioLineRx Ltd. American Depositary Shares,$3.55,0.05,1.429%,"13,209,561"
CURX,Curanex Pharmaceuticals Inc Common Stock,$0.4647,-0.0013,-0.279%,"13,169,975"
DTCK,Davis Commodities Limited Class A Ordinary Shares,$0.537,0.057,11.875%,"13,156,836"
EFOI,"Energy Focus, Inc. Common Stock",$2.29,-0.06,-2.553%,"13,143,260"
GLBZ,Glen Burnie Bancorp Common Stock,$4.50,0.012,0.267%,"13,138,628"
FMSTW,Foremost Clean Energy Ltd. Warrant,$0.91,-0.08,-8.081%,"13,136,196"
ASTLW,Algoma Steel Group Inc. Warrant,$0.125,0.015,13.636%,"13,116,725"
CLRB,"Cellectar Biosciences, Inc.  Common Stock",$3.07,0.17,5.862%,"13,017,211"
COCP,"Cocrystal Pharma, Inc. Common Stock",$0.9417,-0.0173,-1.804%,"12,980,454"
LGVN,Longeveron Inc. Class A Common Stock,$0.605,-0.0201,-3.215%,"12,906,393"
ELPW,Elong Power Holding Limited Class A Ordinary Shares,$0.2209,0.0048,2.221%,"12,824,583"
YMAT,"J-Star Holding Co., Ltd. Ordinary Shares",$0.7518,-0.0323,-4.119%,"12,790,288"
WATT,Energous Corporation Common Stock,$5.88,-0.13,-2.163%,"12,789,806"
SAIH,SAIHEAT Limited Class A Ordinary Shares,$7.26,UNCH,--,"12,726,417"
SRTAW,"Strata Critical Medical, Inc. Warrants",$0.147,-0.0055,-3.607%,"12,695,879"
HCAI,"Huachen AI Parking Management Technology Holding Co., Ltd. Class A Ordinary Shares",$0.3757,-0.0243,-6.075%,"12,674,240"
RDZNW,"Roadzen, Inc. Warrants",$0.16,0.008,5.263%,"12,671,211"
ANNAW,"AleAnna, Inc. Warrant",$0.19,0.01,5.556%,"12,664,313"
VYNE,VYNE Therapeutics Inc. Common Stock,$0.3832,0.0182,4.986%,"12,662,315"
AIXC,"AIxCrypto Holdings, Inc. Common Stock",$2.44,-0.18,-6.87%,"12,591,335"
LBGJ,Li Bang International Corporation Inc. Class A Ordinary Shares,$0.6702,0.0051,0.767%,"12,564,910"
CMMB,Chemomab Therapeutics Ltd. American Depositary Share,$2.42,0.01,0.415%,"12,562,404"
FGI,FGI Industries Ltd. Ordinary Shares,$6.49,0.93,16.727%,"12,461,709"
HTCR,"Heartcore Enterprises, Inc. Common Stock",$0.4877,-0.0223,-4.373%,"12,397,240"
MDAIW,"Spectral AI, Inc. Warrants",$0.40,-0.0139,-3.358%,"12,275,558"
BGLWW,Blue Gold Limited Warrant,$0.40,0.0475,13.475%,"12,228,706"
BRN,"Barnwell Industries, Inc. Common Stock",$1.21,0.11,10.00%,"12,188,976"
NAII,"Natural Alternatives International, Inc. Common Stock",$3.64,-0.04,-1.087%,"12,114,386"
DDC,DDC Enterprise Limited Class A Ordinary Shares,$2.99,-0.03,-0.993%,"12,109,946"
KITT,"Nauticus Robotics, Inc. Common stock",$0.8821,-0.0229,-2.53%,"12,094,133"
ZKIN,"ZK International Group Co., Ltd Ordinary Share",$2.34,-0.09,-3.704%,"12,083,634"
MVO,MV Oil Trust Units of Beneficial Interests,$1.05,0.02,1.942%,"12,075,000"
CETY,"Clean Energy Technologies, Inc. Common Stock",$2.32,1.25,116.822%,"12,024,609"
SBCWW,SBC Medical Group Holdings Incorporated Warrants,$0.117,-0.0014,-1.182%,"12,001,502"
DAVEW,Dave Inc. Warrants,$0.8801,-0.0299,-3.286%,"11,884,943"
JYD,Jayud Global Logistics Limited Class A Ordinary Shares,$4.34,0.45,11.568%,"11,864,991"
EDSA,"Edesa Biotech, Inc. Common Shares",$1.68,-0.0553,-3.187%,"11,823,249"
ZOOZW,ZOOZ Strategy Ltd. Warrant,$0.073,-0.0035,-4.575%,"11,818,684"
IZM,ICZOOM Group Inc. Class A Ordinary Shares,$0.98,0.0103,1.062%,"11,777,748"
ARTW,"Art's-Way Manufacturing Co., Inc. Common Stock",$2.30,0.04,1.77%,"11,745,718"
BLIN,"Bridgeline Digital, Inc. Common Stock",$0.9692,0.0243,2.572%,"11,739,016"
BANL,CBL International Limited Ordinary Shares,$0.4247,-0.0071,-1.644%,"11,679,250"
GELS,Gelteq Limited Ordinary Shares,$1.09,0.03,2.83%,"11,675,054"
IMRN,Immuron Limited American Depositary Shares,$1.74,0.07,4.192%,"11,667,568"
IMNN,"Imunon, Inc. Common Stock",$3.80,0.05,1.333%,"11,667,345"
BFRG,"Bullfrog AI Holdings, Inc. Common Stock",$1.01,0.1345,15.363%,"11,523,842"
CJMB,Callan JMB Inc. Common Stock,$2.49,-0.475,-16.02%,"11,511,337"
MIMI,Mint Incorporation Limited Class A Ordinary Shares,$0.46,-0.0942,-16.997%,"11,505,750"
GSIW,Garden Stage Limited Ordinary Shares,$0.1554,0.0033,2.17%,"11,504,471"
EKSO,"Ekso Bionics Holdings, Inc. Common Stock",$4.38,0.16,3.791%,"11,489,761"
