Symbol,Name,Last Sale,Net Change,% Change,Market Cap
NVDA,NVIDIA Corporation Common Stock,$215.20,3.70,1.749%,"5,229,360,000,000"
GOOGL,Alphabet Inc. Class A Common Stock,$400.80,2.81,0.706%,"4,856,092,800,000"
GOOG,Alphabet Inc. Class C Capital Stock,$397.05,1.75,0.443%,"4,810,657,800,000"
AAPL,Apple Inc. Common Stock,$293.32,5.88,2.046%,"4,308,095,261,920"
MSFT,Microsoft Corporation Common Stock,$415.12,-5.65,-1.343%,"3,083,691,814,324"
AMZN,"Amazon.com, Inc. Common Stock",$272.68,1.51,0.557%,"2,933,248,601,008"
TSM,Taiwan Semiconductor Manufacturing Company Ltd.,$411.68,-2.47,-0.596%,"2,135,180,338,879"
AVGO,Broadcom Inc. Common Stock,$430.00,17.44,4.227%,"2,035,907,319,120"
TSLA,"Tesla, Inc. Common Stock",$428.35,16.56,4.021%,"1,608,764,320,143"
META,"Meta Platforms, Inc. Class A Common Stock",$609.63,-7.18,-1.164%,"1,547,498,998,818"
BRK/A,Berkshire Hathaway Inc.,"$717,386.810000000056","1,136.81",0.159%,"1,055,185,606,772"
BRK/B,Berkshire Hathaway Inc.,$475.94,0.86,0.181%,"1,050,071,833,914"
WMT,Walmart Inc. Common Stock,$130.43,0.4775,0.367%,"1,039,840,458,205"
LLY,Eli Lilly and Company Common Stock,$948.45,-26.51,-2.719%,"893,194,636,521"
MU,"Micron Technology, Inc. Common Stock",$746.81,100.18,15.493%,"842,203,066,627"
JPM,JP Morgan Chase & Co. Common Stock,$302.10,-4.17,-1.362%,"809,480,399,378"
AMD,"Advanced Micro Devices, Inc. Common Stock",$455.19,46.73,11.441%,"742,233,104,866"
INTC,Intel Corporation Common Stock,$124.92,15.30,13.957%,"627,847,920,000"
ASML,ASML Holding N.V. New York Registry Shares,"$1,592.02",75.42,4.973%,"613,592,631,033"
V,Visa Inc.,$318.79,-2.49,-0.775%,"603,937,440,012"
XOM,Exxon Mobil Corporation Common Stock,$144.57,-2.01,-1.371%,"599,235,011,210"
AZN,AstraZeneca PLC Ordinary Shares,$182.85,0.33,0.181%,"567,100,450,293"
ORCL,Oracle Corporation Common Stock,$195.95,1.36,0.699%,"563,561,213,700"
JNJ,Johnson & Johnson Common Stock,$221.32,-1.19,-0.535%,"532,765,260,022"
COST,Costco Wholesale Corporation Common Stock,"$1,008.79",-3.27,-0.323%,"447,552,245,827"
MA,Mastercard Incorporated Common Stock,$495.48,-5.46,-1.09%,"437,798,128,475"
CAT,"Caterpillar, Inc. Common Stock",$897.45,1.76,0.196%,"413,398,698,984"
CSCO,"Cisco Systems, Inc. Common Stock (DE)",$96.57,4.41,4.785%,"381,441,171,066"
NFLX,"Netflix, Inc. Common Stock",$87.49,-0.76,-0.861%,"368,402,763,215"
LRCX,Lam Research Corporation Common Stock,$294.05,7.53,2.628%,"367,730,402,550"
BAC,Bank of America Corporation Common Stock,$51.31,-1.44,-2.73%,"364,126,066,303"
CVX,Chevron Corporation Common Stock,$181.62,-0.88,-0.482%,"361,838,903,407"
ABBV,AbbVie Inc. Common Stock,$201.55,-1.16,-0.572%,"356,494,057,084"
AMAT,"Applied Materials, Inc. Common Stock",$435.44,24.80,6.039%,"345,569,480,486"
UNH,UnitedHealth Group Incorporated Common Stock (DE),$379.98,10.24,2.77%,"345,076,710,632"
PG,Procter & Gamble Company (The) Common Stock,$146.42,0.36,0.246%,"340,953,462,359"
KO,Coca-Cola Company (The) Common Stock,$78.42,-0.01,-0.013%,"337,531,668,614"
PLTR,Palantir Technologies Inc. Class A Common Stock,$137.80,0.75,0.547%,"330,349,590,431"
BABA,Alibaba Group Holding Limited American Depositary Shares each representing eight Ordinary share,$140.06,-0.94,-0.667%,"323,437,681,728"
HD,"Home Depot, Inc. (The) Common Stock",$317.45,-5.19,-1.609%,"316,188,980,032"
GE,GE Aerospace Common Stock,$297.15,-5.48,-1.811%,"310,027,659,380"
HSBC,"HSBC Holdings, plc. Common Stock",$90.16,1.19,1.338%,"309,703,925,156"
MS,Morgan Stanley Common Stock,$193.09,2.92,1.535%,"304,557,925,315"
GEV,GE Vernova Inc. Common Stock,"$1,040.15",-5.48,-0.524%,"279,509,102,799"
NVS,Novartis AG Common Stock,$146.03,0.64,0.44%,"278,647,389,684"
GS,"Goldman Sachs Group, Inc. (The) Common Stock",$936.48,10.61,1.146%,"276,268,549,618"
MRK,"Merck & Company, Inc. Common Stock (new)",$111.38,-0.92,-0.819%,"275,089,043,343"
PM,Philip Morris International Inc Common Stock,$170.99,-0.12,-0.07%,"266,497,977,078"
TXN,Texas Instruments Incorporated Common Stock,$287.80,2.56,0.897%,"261,924,705,250"
RY,Royal Bank Of Canada Common Stock,$181.68,0.33,0.182%,"253,720,618,397"
TM,Toyota Motor Corporation Common Stock,$187.53,-1.47,-0.778%,"244,706,579,977"
KLAC,KLA Corporation Common Stock,"$1,869.19",105.94,6.008%,"244,167,655,978"
SHEL,Shell PLC American Depositary Shares (each representing two (2) Ordinary Shares) ,$83.97,-0.27,-0.321%,"243,992,991,329"
RTX,RTX Corporation Common Stock,$176.09,-0.69,-0.39%,"237,137,484,837"
WFC,Wells Fargo & Company Common Stock,$75.64,-3.52,-4.447%,"231,472,733,326"
SNDK,Sandisk Corporation Common Stock,"$1,562.34",222.38,16.596%,"231,366,552,514"
CCZ,Comcast Holdings ZONES,$64.70,-1.10,-1.672%,"231,226,249,109"
QCOM,QUALCOMM Incorporated Common Stock,$219.09,16.54,8.166%,"230,920,860,000"
LIN,Linde plc Ordinary Shares,$493.16,-0.69,-0.14%,"228,135,588,653"
ARM,Arm Holdings plc American Depositary Shares,$213.27,-0.04,-0.019%,"225,909,233,067"
C,"Citigroup, Inc. Common Stock",$125.55,-3.54,-2.742%,"219,404,525,976"
IBM,International Business Machines Corporation Common Stock,$229.76,-1.55,-0.67%,"215,948,041,933"
AXP,American Express Company Common Stock,$316.03,-2.66,-0.835%,"215,635,625,781"
BHP,BHP Group Limited American Depositary Shares (Each representing two Ordinary Shares),$84.72,2.17,2.629%,"215,142,762,135"
SAP,SAP  SE ADS,$173.70,-1.01,-0.578%,"213,391,185,098"
MUFG,"Mitsubishi UFJ Financial Group, Inc. Common Stock",$17.95,-0.05,-0.278%,"213,025,411,014"
PEP,"PepsiCo, Inc. Common Stock",$154.62,-1.67,-1.069%,"211,329,716,865"
TMUS,"T-Mobile US, Inc. Common Stock",$193.63,-0.57,-0.294%,"209,547,299,353"
NVO,Novo Nordisk A/S Common Stock,$46.07,0.27,0.59%,"205,702,550,000"
ADI,"Analog Devices, Inc. Common Stock",$416.52,8.00,1.958%,"203,346,795,474"
VZ,Verizon Communications Inc. Common Stock,$47.22,0.13,0.276%,"197,169,891,730"
MCD,McDonald's Corporation Common Stock,$275.75,-7.95,-2.802%,"196,010,719,248"
NEE,"NextEra Energy, Inc. Common Stock",$93.10,-0.22,-0.236%,"194,145,289,554"
TTE,TotalEnergies SE Ordinary Shares,$88.48,-0.25,-0.282%,"193,051,132,418"
DIS,Walt Disney Company (The) Common Stock,$108.02,-0.64,-0.589%,"187,577,964,020"
BA,Boeing Company (The) Common Stock,$237.36,6.33,2.74%,"187,111,441,286"
SAN,"Banco Santander, S.A. Sponsored ADR (Spain)",$12.28,0.10,0.821%,"180,752,063,794"
TD,Toronto Dominion Bank (The) Common Stock,$107.46,-0.24,-0.223%,"179,332,437,305"
AMGN,Amgen Inc. Common Stock,$331.70,2.61,0.793%,"179,021,234,486"
ANET,"Arista Networks, Inc. Common Stock",$141.77,0.02,0.014%,"178,517,151,610"
STX,Seagate Technology Holdings PLC Ordinary Shares (Ireland),$782.64,16.20,2.114%,"175,490,578,299"
T,AT&T Inc.,$25.16,-0.10,-0.396%,"174,820,205,089"
TMO,Thermo Fisher Scientific Inc Common Stock,$465.00,-9.46,-1.994%,"172,803,981,225"
PANW,"Palo Alto Networks, Inc. Common Stock",$207.88,11.35,5.775%,"169,630,080,000"
TJX,"TJX Companies, Inc. (The) Common Stock",$153.36,-1.12,-0.725%,"169,587,675,374"
DELL,Dell Technologies Inc. Class C Common Stock ,$260.46,30.19,13.111%,"169,186,556,032"
BLK,"BlackRock, Inc. Common Stock","$1,084.83",17.09,1.601%,"168,402,488,287"
CRM,"Salesforce, Inc. Common Stock",$181.82,-4.52,-2.426%,"167,819,860,000"
WDC,Western Digital Corporation Common Stock,$480.00,16.09,3.468%,"165,447,422,880"
GILD,"Gilead Sciences, Inc. Common Stock",$131.33,-2.73,-2.036%,"163,035,757,942"
GLW,Corning Incorporated Common Stock,$186.94,4.54,2.489%,"160,887,635,006"
ISRG,"Intuitive Surgical, Inc. Common Stock",$450.06,-3.43,-0.756%,"159,394,528,671"
APH,Amphenol Corporation Common Stock,$128.03,-8.59,-6.288%,"157,506,915,993"
APP,Applovin Corporation Class A Common Stock,$468.55,-30.32,-6.078%,"157,404,687,000"
UNP,Union Pacific Corporation Common Stock,$264.65,-0.24,-0.091%,"157,126,201,820"
ETN,"Eaton Corporation, PLC Ordinary Shares",$401.51,2.36,0.591%,"155,906,333,000"
DE,Deere & Company Common Stock,$574.84,-5.70,-0.982%,"155,268,469,985"
TBB,AT&T Inc. 5.350% Global Notes due 2066,$21.69,0.02,0.092%,"155,091,861,061"
SCHW,Charles Schwab Corporation (The) Common Stock,$88.61,-0.89,-0.994%,"154,012,991,467"
UBER,"Uber Technologies, Inc. Common Stock",$75.45,-1.28,-1.668%,"153,585,945,531"
SCCO,Southern Copper Corporation Common Stock,$185.29,5.75,3.203%,"153,061,591,447"
WELL,Welltower Inc. Common Stock,$214.63,1.68,0.789%,"151,510,418,404"
MRVL,"Marvell Technology, Inc. Common Stock",$170.13,10.12,6.325%,"148,771,581,222"
ABT,Abbott Laboratories Common Stock,$84.32,-2.69,-3.092%,"146,869,624,013"
PFE,"Pfizer, Inc. Common Stock",$25.68,-0.80,-3.021%,"146,361,726,260"
SHOP,Shopify Inc. Class A Subordinate Voting Shares,$110.41,-1.33,-1.19%,"143,986,936,693"
BUD,Anheuser-Busch Inbev SA Sponsored ADR (Belgium),$79.89,-0.36,-0.449%,"143,578,307,521"
PDD,PDD Holdings Inc. American Depositary Shares,$98.78,-2.73,-2.689%,"140,603,102,516"
UBS,UBS Group AG Registered Ordinary Shares,$45.23,0.82,1.846%,"139,837,554,409"
SMFG,Sumitomo Mitsui Financial Group Inc Unsponsored American Depositary Shares (Japan),$21.43,-0.05,-0.233%,"138,739,443,601"
COP,ConocoPhillips Common Stock,$113.87,-1.01,-0.879%,"138,727,138,577"
HON,Honeywell International Inc. Common Stock,$213.12,-2.95,-1.365%,"135,044,152,721"
PLD,"Prologis, Inc. Common Stock",$144.09,1.80,1.265%,"134,340,582,420"
CRWD,"CrowdStrike Holdings, Inc. Class A Common Stock",$527.77,22.05,4.36%,"134,336,739,688"
RIO,Rio Tinto Plc Common Stock,$105.38,2.27,2.202%,"132,358,366,889"
PBR,Petroleo Brasileiro S.A. Petrobras ADS,$20.33,-0.04,-0.196%,"131,013,968,526"
VRT,"Vertiv Holdings, LLC Class A Common Stock",$339.97,-0.04,-0.012%,"130,585,474,176"
UL,Unilever PLC American Depositary Shares (each representing One Ordinary Share),$58.40,-0.33,-0.562%,"130,385,615,360"
BKNG,Booking Holdings Inc. Common Stock,$165.93,-5.35,-3.124%,"128,575,578,885"
LOW,"Lowe's Companies, Inc. Common Stock",$229.20,-1.68,-0.728%,"128,366,537,927"
HDB,HDFC Bank Limited Common Stock,$25.02,-0.65,-2.532%,"128,053,023,205"
BBVA,Banco Bilbao Vizcaya Argentaria S.A. Common Stock,$22.28,0.41,1.875%,"127,195,822,636"
BTI,"British American Tobacco  Industries, p.l.c. Common Stock ADR",$58.28,0.20,0.344%,"127,157,930,913"
NEM,Newmont Corporation,$116.51,3.02,2.661%,"124,380,572,534"
SPGI,S&P Global Inc. Common Stock,$420.12,-8.56,-1.997%,"124,355,520,000"
CB,Chubb Limited  Common Stock,$319.64,-1.64,-0.51%,"123,975,604,282"
SONY,Sony Group Corporation American Depositary Shares ,$20.15,0.26,1.307%,"121,403,796,244"
DHR,Danaher Corporation Common Stock,$171.16,-4.50,-2.562%,"121,142,020,517"
COF,Capital One Financial Corporation Common Stock,$189.48,-3.11,-1.615%,"120,167,440,269"
ACN,Accenture plc Class A Ordinary Shares (Ireland),$180.42,0.23,0.128%,"120,004,926,857"
SBUX,Starbucks Corporation Common Stock,$104.93,0.67,0.643%,"119,588,721,000"
ENB,Enbridge Inc Common Stock,$53.59,-0.40,-0.741%,"116,951,430,934"
LMT,Lockheed Martin Corporation Common Stock,$506.51,-5.90,-1.151%,"116,782,773,088"
CVS,CVS Health Corporation Common Stock,$90.55,3.19,3.652%,"115,535,217,649"
BMY,Bristol-Myers Squibb Company Common Stock,$56.16,-0.09,-0.16%,"114,682,721,232"
MO,"Altria Group, Inc.",$68.12,-0.92,-1.333%,"113,752,990,928"
PGR,Progressive Corporation (The) Common Stock,$194.00,-1.75,-0.894%,"113,361,274,016"
BP,BP p.l.c. Common Stock,$43.34,-0.47,-1.073%,"113,061,944,086"
PWR,"Quanta Services, Inc. Common Stock",$745.00,-5.73,-0.763%,"111,794,811,005"
PH,Parker-Hannifin Corporation Common Stock,$878.83,-8.02,-0.904%,"110,808,501,245"
INTU,Intuit Inc. Common Stock,$396.31,-10.47,-2.574%,"109,599,530,500"
SYK,Stryker Corporation Common Stock,$285.47,-8.76,-2.977%,"109,330,514,704"
MFG,"Mizuho Financial Group, Inc. Sponosred ADR (Japan)",$8.69,0.03,0.346%,"109,183,186,074"
VRTX,Vertex Pharmaceuticals Incorporated Common Stock,$429.82,4.82,1.134%,"109,090,644,335"
HWM,Howmet Aerospace Inc. Common Stock,$270.56,-1.98,-0.726%,"108,417,059,982"
BMO,Bank Of Montreal Common Stock,$152.90,0.42,0.275%,"107,782,254,698"
EQIX,"Equinix, Inc. Common Stock REIT","$1,072.08",5.32,0.499%,"105,733,083,796"
SNY,Sanofi ADS,$43.31,0.13,0.301%,"105,626,775,056"
BN,Brookfield Corporation Class A Limited Voting Shares,$47.08,0.57,1.226%,"105,324,026,682"
SO,Southern Company (The) Common Stock,$91.80,-0.63,-0.682%,"103,579,759,935"
TT,Trane Technologies plc,$466.17,-3.64,-0.775%,"103,049,431,713"
GSK,GSK plc American Depositary Shares (Each representing two Ordinary Shares),$50.41,-0.09,-0.178%,"102,806,786,847"
ADBE,Adobe Inc. Common Stock,$253.04,-3.47,-1.353%,"102,278,768,000"
CME,CME Group Inc. Class A Common Stock,$281.25,-5.60,-1.952%,"101,913,566,344"
CM,Canadian Imperial Bank of Commerce Common Stock,$110.01,-0.50,-0.452%,"101,267,976,473"
CDNS,"Cadence Design Systems, Inc. Common Stock",$362.70,5.80,1.625%,"100,038,463,200"
SNPS,"Synopsys, Inc. Common Stock",$516.48,11.29,2.235%,"98,937,955,705"
MDT,Medtronic plc. Ordinary Shares,$76.15,-1.81,-2.322%,"97,767,840,009"
DUK,Duke Energy Corporation (Holding Company) Common Stock,$124.17,-0.70,-0.561%,"96,802,462,265"
AEM,Agnico Eagle Mines Limited Common Stock,$193.21,5.44,2.897%,"96,612,001,351"
HCA,"HCA Healthcare, Inc. Common Stock",$435.19,6.17,1.438%,"96,542,462,562"
BNS,Bank Nova Scotia Halifax Pfd 3 Ordinary Shares,$77.53,-0.56,-0.717%,"95,554,448,856"
CEG,Constellation Energy Corporation Common Stock ,$303.63,-7.65,-2.458%,"95,130,219,657"
IBN,ICICI Bank Limited Common Stock,$26.49,-0.25,-0.935%,"94,510,220,836"
NOW,"ServiceNow, Inc. Common Stock",$91.18,-2.41,-2.575%,"94,006,580,000"
CMI,Cummins Inc. Common Stock,$679.55,-3.33,-0.488%,"93,770,470,480"
GD,General Dynamics Corporation Common Stock,$346.53,-1.23,-0.354%,"93,712,172,701"
MAR,Marriott International Class A Common Stock,$353.18,1.13,0.321%,"93,129,547,871"
CNQ,Canadian Natural Resources Limited Common Stock,$44.53,-0.21,-0.469%,"92,888,333,160"
ITUB,Itau Unibanco Banco Holding SA American Depositary Shares (Each repstg 500 Preferred shares),$8.37,0.19,2.323%,"92,292,010,316"
BX,Blackstone Inc. Common Stock,$123.77,1.44,1.177%,"91,859,709,818"
EQNR,Equinor ASA,$36.69,-0.22,-0.596%,"91,734,944,091"
KKR,KKR & Co. Inc. Common Stock,$102.52,2.18,2.173%,"91,401,797,653"
CMCSA,Comcast Corporation Class A Common Stock,$25.40,-0.84,-3.201%,"90,775,065,338"
FDX,FedEx Corporation Common Stock,$378.58,2.65,0.705%,"90,331,745,686"
MCK,McKesson Corporation Common Stock,$736.09,-18.67,-2.474%,"90,161,791,487"
BK,The Bank of New York Mellon Corporation Common Stock,$130.50,-0.19,-0.145%,"89,572,465,373"
FCX,"Freeport-McMoRan, Inc. Common Stock",$61.65,1.04,1.716%,"88,623,767,408"
ICE,Intercontinental Exchange Inc. Common Stock,$155.82,-0.29,-0.186%,"88,118,156,971"
WMB,"Williams Companies, Inc. (The) Common Stock",$71.96,-0.99,-1.357%,"88,006,955,149"
ING,"ING Group, N.V. Common Stock",$30.12,0.34,1.142%,"87,421,423,163"
PNC,"PNC Financial Services Group, Inc. (The) Common Stock",$216.85,-2.44,-1.113%,"87,079,290,449"
WM,"Waste Management, Inc. Common Stock",$215.37,-6.08,-2.746%,"86,487,369,708"
NGG,"National Grid Transco, PLC National Grid PLC (NEW) American Depositary Shares",$86.89,0.98,1.141%,"86,221,727,012"
USB,U.S. Bancorp Common Stock,$55.53,0.22,0.398%,"86,199,204,840"
SPOT,Spotify Technology S.A. Ordinary Shares,$417.83,-9.60,-2.246%,"86,003,004,756"
ADP,"Automatic Data Processing, Inc. Common Stock",$212.995,-1.095,-0.511%,"85,761,236,310"
UPS,"United Parcel Service, Inc. Common Stock",$100.78,0.68,0.679%,"85,663,632,798"
JCI,Johnson Controls International plc Ordinary Share,$139.52,0.27,0.194%,"85,123,328,931"
MNST,Monster Beverage Corporation,$86.29,10.32,13.584%,"84,383,510,638"
ABNB,"Airbnb, Inc. Class A Common Stock",$141.49,1.03,0.733%,"84,119,377,905"
E,ENI S.p.A. Common Stock,$53.43,0.84,1.597%,"84,065,830,021"
FTNT,"Fortinet, Inc. Common Stock",$114.07,6.10,5.65%,"83,510,880,501"
CSX,CSX Corporation Common Stock,$44.83,0.37,0.832%,"83,300,364,914"
MELI,"MercadoLibre, Inc. Common Stock","$1,632.52",-237.49,-12.70%,"82,764,163,559"
BCS,Barclays PLC Common Stock,$23.71,0.42,1.803%,"82,428,361,184"
AMT,American Tower Corporation (REIT) Common Stock,$176.53,-3.24,-1.802%,"82,244,103,471"
ELV,"Elevance Health, Inc. Common Stock",$378.07,5.15,1.381%,"82,102,581,007"
AMX,"America Movil, S.A.B. de C.V. American Depositary Shares (each representing the right to receive twenty (20) Series B Shares",$27.21,0.46,1.72%,"81,895,297,500"
BAM,Brookfield Asset Management Inc Class A Limited Voting Shares,$49.76,0.97,1.988%,"81,516,274,389"
LYG,Lloyds Banking Group Plc American Depositary Shares,$5.43,0.14,2.647%,"80,478,105,553"
EPD,Enterprise Products Partners L.P. Common Stock,$37.19,-0.54,-1.431%,"80,395,879,801"
BSX,Boston Scientific Corporation Common Stock,$53.93,-2.64,-4.667%,"80,159,134,803"
SLB,SLB Limited Common Shares,$53.27,0.27,0.509%,"79,641,721,601"
RACE,Ferrari N.V. Common Shares,$339.69,2.23,0.661%,"79,468,618,754"
EMR,Emerson Electric Company Common Stock,$141.31,0.22,0.156%,"79,147,731,000"
MDLZ,"Mondelez International, Inc. Class A Common Stock",$61.55,0.24,0.391%,"79,008,643,097"
MCO,Moody's Corporation Common Stock,$451.32,-5.78,-1.264%,"78,845,604,000"
MRSH,Marsh Common Stock,$163.25,-2.78,-1.674%,"78,652,952,288"
MPWR,"Monolithic Power Systems, Inc. Common Stock","$1,600.84",24.88,1.579%,"78,649,269,200"
SHW,Sherwin-Williams Company (The) Common Stock,$316.82,-3.39,-1.059%,"78,139,097,445"
NOC,Northrop Grumman Corporation Common Stock,$549.52,-2.75,-0.498%,"78,050,235,732"
ORLY,"O'Reilly Automotive, Inc. Common Stock",$92.96,-1.62,-1.713%,"77,779,582,917"
CIEN,Ciena Corporation Common Stock,$548.11,9.35,1.735%,"77,501,891,823"
APO,"Apollo Global Management, Inc. (New) Common Stock",$133.20,5.41,4.234%,"76,792,356,774"
CP,Canadian Pacific Kansas City Limited Common Shares,$86.04,0.82,0.962%,"76,380,840,200"
ASX,"ASE Technology Holding Co., Ltd. American Depositary Shares (each representing Two Common Shares) ",$34.23,0.89,2.669%,"76,226,745,616"
CI,The Cigna Group Common Stock,$288.06,4.02,1.415%,"76,201,204,296"
CRH,CRH PLC Ordinary Shares,$113.76,1.13,1.003%,"76,144,053,784"
SU,Suncor Energy  Inc. Common Stock,$64.01,0.27,0.424%,"75,974,169,717"
REGN,"Regeneron Pharmaceuticals, Inc. Common Stock",$714.89,5.79,0.817%,"74,948,375,586"
MMM,3M Company Common Stock,$143.29,-0.46,-0.32%,"74,735,372,829"
NXPI,NXP Semiconductors N.V. Common Stock,$294.75,4.53,1.561%,"74,415,850,535"
BE,Bloom Energy Corporation Class A Common Stock,$261.03,2.39,0.924%,"74,248,382,864"
NTES,"NetEase, Inc. American Depositary Shares",$115.91,-1.20,-1.025%,"73,965,428,651"
RCL,Royal Caribbean Cruises Ltd. Common Stock,$275.24,-5.63,-2.004%,"73,817,985,745"
NOK,Nokia Corporation Sponsored American Depositary Shares,$12.82,0.47,3.806%,"73,615,512,903"
ITW,Illinois Tool Works Inc. Common Stock,$254.76,-0.77,-0.301%,"73,390,770,642"
ROST,"Ross Stores, Inc. Common Stock",$225.81,1.33,0.592%,"72,744,273,300"
B,Barrick Mining Corporation Common Shares,$43.13,1.29,3.083%,"72,264,675,567"
HLT,Hilton Worldwide Holdings Inc. Common Stock ,$316.78,-3.52,-1.099%,"72,114,451,282"
ECL,Ecolab Inc. Common Stock,$254.22,-2.33,-0.908%,"71,797,770,301"
VLO,Valero Energy Corporation Common Stock,$241.06,4.71,1.993%,"71,578,616,429"
MPC,Marathon Petroleum Corporation Common Stock,$244.87,2.61,1.077%,"71,486,523,812"
DASH,"DoorDash, Inc. Class A Common Stock",$163.93,-7.42,-4.33%,"71,427,370,097"
DDOG,"Datadog, Inc. Class A Common Stock",$200.16,11.43,6.056%,"71,245,395,356"
GM,General Motors Company Common Stock,$78.80,0.39,0.497%,"71,051,217,366"
VALE,VALE S.A.  American Depositary Shares Each Representing one common share,$16.63,0.44,2.718%,"71,002,023,690"
AEP,"American Electric Power Company, Inc. Common Stock",$130.16,-0.65,-0.497%,"70,820,700,943"
LITE,Lumentum Holdings Inc. Common Stock,$903.80,11.22,1.257%,"70,315,640,000"
NSC,Norfolk Southern Corporation Common Stock,$312.01,-1.38,-0.44%,"70,075,574,252"
CL,Colgate-Palmolive Company Common Stock,$87.55,0.19,0.217%,"70,056,574,091"
KMI,"Kinder Morgan, Inc. Common Stock",$31.41,-0.11,-0.349%,"69,881,777,027"
HOOD,"Robinhood Markets, Inc. Class A Common Stock",$77.03,0.75,0.983%,"69,365,904,541"
EOG,"EOG Resources, Inc. Common Stock",$130.03,-0.86,-0.657%,"69,257,687,756"
NET,"Cloudflare, Inc. Class A Common Stock",$196.13,-60.66,-23.622%,"69,033,895,847"
PSX,Phillips 66 Common Stock,$171.56,3.25,1.931%,"68,784,412,031"
FIX,"Comfort Systems USA, Inc. Common Stock","$1,952.37",10.35,0.533%,"68,728,156,545"
DLR,"Digital Realty Trust, Inc. Common Stock",$195.31,0.53,0.272%,"68,633,119,532"
WBD,"Warner Bros. Discovery, Inc. Series A Common Stock ",$27.11,-0.01,-0.037%,"67,968,475,991"
TDG,Transdigm Group Incorporated Common Stock,"$1,215.08",-26.90,-2.166%,"67,963,778,032"
CNI,Canadian National Railway Company Common Stock,$111.64,0.80,0.722%,"67,720,824,000"
MFC,Manulife Financial Corporation Common Stock,$40.02,0.46,1.163%,"67,103,256,581"
NU,Nu Holdings Ltd. Class A Ordinary Shares,$13.80,-0.46,-3.226%,"67,008,296,122"
AON,Aon plc Class A Ordinary Shares (Ireland),$312.79,-0.80,-0.255%,"66,804,733,878"
CTAS,Cintas Corporation Common Stock,$166.97,-3.07,-1.805%,"66,802,546,259"
ET,Energy Transfer LP Common Units ,$19.34,-0.58,-2.912%,"66,535,683,881"
APD,"Air Products and Chemicals, Inc. Common Stock",$295.41,0.42,0.142%,"65,782,101,451"
MSTR,Strategy Inc Common Stock Class A,$187.59,7.75,4.309%,"65,740,516,308"
SPG,"Simon Property Group, Inc. Common Stock",$202.12,0.72,0.357%,"65,658,315,354"
COHR,Coherent Corp. Common Stock,$335.26,16.07,5.035%,"65,590,038,758"
NKE,"Nike, Inc. Common Stock",$44.14,-0.27,-0.608%,"65,366,353,637"
NWG,"NatWest Group plc American Depositary Shares, (each representing two (2) Ordinary Shares)",$15.83,0.46,2.993%,"65,117,035,515"
TRP,TC Energy Corporation Common Stock,$64.75,-0.35,-0.538%,"64,750,000,000"
MSI,"Motorola Solutions, Inc. Common Stock",$383.99,-49.21,-11.36%,"63,820,524,588"
BKR,Baker Hughes Company Class A Common Stock,$63.89,0.36,0.567%,"63,383,269,051"
TRV,"The Travelers Companies, Inc. Common Stock",$298.04,-0.90,-0.301%,"63,376,624,302"
WPM,Wheaton Precious Metals Corp Common Shares (Canada),$138.85,7.29,5.541%,"63,043,031,618"
CRWV,"CoreWeave, Inc. Class A Common Stock",$114.15,-14.69,-11.402%,"61,979,688,986"
RSG,"Republic Services, Inc. Common Stock",$200.02,-1.53,-0.759%,"61,797,417,524"
KEYS,Keysight Technologies Inc. Common Stock,$360.30,5.24,1.476%,"61,792,348,949"
IMO,Imperial Oil Limited Common Stock,$126.98,1.14,0.906%,"61,406,639,140"
RELX,RELX PLC PLC American Depositary Shares (Each representing One Ordinary Share),$33.58,-0.58,-1.698%,"61,249,164,282"
TFC,Truist Financial Corporation Common Stock,$49.11,-0.63,-1.267%,"61,185,131,195"
RKLB,Rocket Lab Corporation Common Stock,$105.47,26.89,34.22%,"60,726,177,131"
DB,Deutsche Bank AG Common Stock,$32.07,0.59,1.874%,"60,336,498,000"
TEL,TE Connectivity plc Ordinary Shares,$206.20,-3.86,-1.838%,"60,188,913,754"
PCAR,PACCAR Inc. Common Stock,$114.31,0.26,0.228%,"60,159,778,837"
SRE,DBA Sempra Common Stock,$91.53,-0.04,-0.044%,"59,799,528,851"
URI,"United Rentals, Inc. Common Stock",$937.00,-7.12,-0.754%,"58,699,823,909"
GWW,"W.W. Grainger, Inc. Common Stock","$1,233.71",-0.39,-0.032%,"58,391,475,794"
O,Realty Income Corporation Common Stock,$61.92,0.13,0.21%,"57,737,343,257"
AZO,"AutoZone, Inc. Common Stock","$3,496.19",-58.69,-1.651%,"57,606,093,316"
AFL,AFLAC Incorporated Common Stock,$113.10,-0.50,-0.44%,"57,566,192,642"
SOMN,Southern Company (The) 2025 Series A Corporate Units,$50.51,0.11,0.218%,"56,991,434,361"
TGT,Target Corporation Common Stock,$125.25,-0.63,-0.50%,"56,885,574,937"
TER,"Teradyne, Inc. Common Stock",$359.77,5.66,1.598%,"56,319,173,623"
CARR,Carrier Global Corporation Common Stock ,$66.83,-0.39,-0.58%,"55,859,446,634"
LHX,"L3Harris Technologies, Inc. Common Stock",$299.64,-1.54,-0.511%,"55,821,419,118"
ALL,Allstate Corporation (The) Common Stock,$213.15,-0.52,-0.243%,"54,869,271,230"
MPLX,MPLX LP Common Units Representing Limited Partner Interests,$54.00,-2.27,-4.034%,"54,795,620,826"
PSA,Public Storage Common Stock,$311.04,1.71,0.553%,"54,601,749,458"
D,"Dominion Energy, Inc. Common Stock",$61.89,0.28,0.454%,"54,429,494,892"
CTVA,"Corteva, Inc. Common Stock ",$81.13,2.06,2.605%,"54,261,366,600"
AU,AngloGold Ashanti PLC Ordinary Shares,$107.03,6.80,6.784%,"53,892,500,376"
OKE,"ONEOK, Inc. Common Stock",$85.16,-0.71,-0.827%,"53,653,597,676"
MCHP,Microchip Technology Incorporated Common Stock,$99.09,-2.49,-2.451%,"53,621,112,533"
CVE,Cenovus Energy Inc Common Stock,$28.40,-0.06,-0.211%,"53,381,596,200"
INFY,Infosys Limited American Depositary Shares,$12.83,0.26,2.068%,"53,298,556,819"
TRGP,"Targa Resources, Inc. Common Stock",$248.12,-4.32,-1.711%,"53,296,664,548"
AME,"AMETEK, Inc.",$232.40,-2.33,-0.993%,"53,266,777,665"
SE,"Sea Limited American Depositary Shares, each representing one Class A Ordinary Share",$86.73,-1.91,-2.155%,"53,120,782,593"
FANG,"Diamondback Energy, Inc. Common Stock",$188.70,-1.75,-0.919%,"53,083,819,144"
COIN,"Coinbase Global, Inc. Class A Common Stock",$201.16,8.20,4.25%,"52,987,779,692"
OXY,Occidental Petroleum Corporation Common Stock,$53.03,-0.91,-1.687%,"52,745,478,194"
SNOW,Snowflake Inc. Common Stock,$152.45,-1.27,-0.826%,"52,701,965,000"
STM,STMicroelectronics N.V. Common Stock,$59.17,3.27,5.85%,"52,588,411,554"
FLEX,Flex Ltd. Ordinary Shares,$142.17,9.16,6.887%,"52,272,201,775"
BRKRP,"Bruker Corporation 6.375% Mandatory Convertible Preferred Stock, Series A",$342.89,5.28,1.564%,"52,195,791,446"
MDLN,Medline Inc. Class A Common Stock,$39.52,-2.34,-5.59%,"51,916,956,241"
ABEV,Ambev S.A. American Depositary Shares (Each representing 1 Common Share),$3.29,0.01,0.305%,"51,855,791,507"
NUE,Nucor Corporation Common Stock,$227.50,0.80,0.353%,"51,809,859,010"
TAK,Takeda Pharmaceutical Company Limited American Depositary Shares (each representing 1/2 of a share of Common Stock),$16.46,-0.18,-1.082%,"51,804,546,346"
