Symbol,Name,Last Sale,Net Change,% Change,Market Cap
BGIN,Bgin Blockchain Limited Class A Ordinary Shares,$4.09,0.15,3.807%,"462,725,999"
CMCL,Caledonia Mining Corporation Plc Common Shares,$23.92,0.57,2.441%,"461,967,630"
FPI,Farmland Partners Inc. Common Stock,$10.58,UNCH,--,"461,469,987"
RPD,"Rapid7, Inc. Common Stock",$6.90,0.19,2.832%,"461,131,264"
SKBL,Skyline Builders Group Holding Limited Class A Ordinary Shares,$3.31,-0.04,-1.194%,"460,770,569"
GUT,Gabelli Utility Trust (The) Common Stock,$6.25,0.08,1.297%,"458,743,931"
EPRX,Eupraxia Pharmaceuticals Inc. Common Stock,$7.45,-0.02,-0.268%,"458,198,691"
CTEV,Claritev Corporation Class A Common Stock,$27.00,2.79,11.524%,"458,106,840"
CMCO,Columbus McKinnon Corporation Common Stock,$15.93,0.13,0.823%,"457,818,100"
CGC,Canopy Growth Corporation Common Shares,$1.11,-0.02,-1.77%,"457,809,543"
LXEO,"Lexeo Therapeutics, Inc. Common Stock",$5.83,0.01,0.172%,"457,775,022"
ELMT,The Elmet Group Co. Common Stock,$15.71,0.36,2.345%,"457,512,496"
BLW,Blackrock Limited Duration Income Trust,$12.81,0.02,0.156%,"457,461,151"
KIDS,OrthoPediatrics Corp. Common Stock,$17.81,0.24,1.366%,"457,449,743"
AIOT,"PowerFleet, Inc. Common Stock",$3.41,0.01,0.294%,"457,442,215"
ADUR,Aduro Clean Technologies Inc. Common Stock,$13.50,0.37,2.818%,"457,281,491"
CAL,"Caleres, Inc. Common Stock",$13.50,0.23,1.733%,"456,870,227"
GRVY,"GRAVITY Co., Ltd. American Depository Shares",$65.46,4.85,8.002%,"454,874,994"
ZURA,Zura Bio Limited Class A Ordinary Shares,$4.79,0.25,5.507%,"454,478,601"
ETB,Eaton Vance Tax-Managed Buy-Write Income Fund Eaton Vance Tax-Managed Buy-Write Income Fund Common Shares of Beneficial Interest,$15.47,0.13,0.847%,"454,375,527"
REA,"Rare Earths Americas, Inc. Common Stock",$23.43,0.74,3.261%,"454,337,198"
OSPN,OneSpan Inc. Common Stock,$12.23,0.08,0.658%,"453,400,956"
FLGT,"Fulgent Genetics, Inc. Common Stock",$15.96,0.85,5.625%,"453,273,943"
GLAD,Gladstone Capital Corporation Common Stock,$19.97,-0.02,-0.10%,"451,183,588"
LYEL,"Lyell Immunopharma, Inc. Common Stock",$19.33,-0.73,-3.639%,"451,047,902"
ACTG,Acacia Research Corporation (Acacia Tech) Common Stock,$4.66,-0.045,-0.956%,"450,105,355"
ITIC,Investors Title Company Common Stock,$238.30,-3.20,-1.325%,"449,909,447"
XRN,Chiron Real Estate Inc. Common Stock,$33.99,1.69,5.232%,"449,851,872"
NPWR,NET Power Inc. Class A Common Stock,$2.00,-0.05,-2.439%,"449,523,362"
BLZE,"Backblaze, Inc. Class A Common Stock",$7.48,-0.02,-0.267%,"448,800,000"
FBIOP,"Fortress Biotech, Inc. 9.375% Series A Cumulative Redeemable Perpetual Preferred Stock",$13.501,0.011,0.082%,"448,490,691"
MCFT,"MasterCraft Boat Holdings, Inc. Common Stock",$27.38,1.81,7.079%,"445,880,672"
ADCT,ADC Therapeutics SA Common Shares,$3.50,-0.25,-6.667%,"445,169,053"
ENTA,"Enanta Pharmaceuticals, Inc. Common Stock",$15.34,0.25,1.657%,"445,156,737"
GTN,"Gray Media, Inc. Common Stock",$4.33,-0.09,-2.036%,"445,045,579"
GEVO,"Gevo, Inc. Common Stock",$1.83,-0.20,-9.852%,"444,474,779"
CRNC,Cerence Inc. Common Stock,$9.87,-0.67,-6.357%,"444,328,469"
PKOH,Park-Ohio Holdings Corp. Common Stock,$30.82,-0.02,-0.065%,"443,756,068"
FSTR,L.B. Foster Company Common Stock,$42.30,1.94,4.807%,"442,402,164"
TTGT,"TechTarget, Inc. Common Stock",$6.10,-0.37,-5.719%,"441,026,602"
SPT,"Sprout Social, Inc Class A Common Stock",$7.40,0.60,8.824%,"440,746,198"
BTQ,BTQ Technologies Corp. Common Stock,$3.11,-0.09,-2.813%,"439,476,992"
ALMU,"Aeluma, Inc. Common Stock",$24.41,0.44,1.836%,"439,451,985"
HYLN,Hyliion Holdings Corp. Class A Common Stock,$2.46,-0.01,-0.405%,"438,660,199"
PSNYW,Polestar Automotive Holding UK PLC Class C-1 ADS (ADW),$3.01,0.01,0.333%,"438,541,944"
PACB,"Pacific Biosciences of California, Inc. Common Stock",$1.41,-0.24,-14.545%,"437,786,810"
NVEC,NVE Corporation Common Stock,$90.21,1.62,1.829%,"436,360,745"
REAX,"The Real Brokerage, Inc. Common Shares",$2.04,-0.19,-8.52%,"435,536,326"
PERI,Perion Network Ltd. Ordinary Shares,$11.06,0.28,2.597%,"434,993,328"
AVIR,"Atea Pharmaceuticals, Inc. Common Stock",$5.43,-0.11,-1.986%,"434,547,148"
ECX,ECARX Holdings Inc. Class A Ordinary shares,$1.14,-0.04,-3.39%,"434,408,382"
MAGN,Magnera Corporation Common Stock,$12.08,0.33,2.809%,"433,672,000"
NINE,"Nine Energy Service, Inc. Common Stock",$10.01,0.16,1.624%,"433,540,878"
IBEX,IBEX Limited Common Shares,$32.33,-0.43,-1.313%,"432,870,120"
ZUMZ,Zumiez Inc. Common Stock,$25.08,0.05,0.20%,"432,773,508"
PDLB,"Ponce Financial Group, Inc. Common Stock",$17.84,-0.10,-0.557%,"430,957,865"
MGRD,"Affiliated Managers Group, Inc. 4.200% Junior Subordinated Notes due 2061",$15.15,0.07,0.464%,"430,442,754"
BGS,"B&G Foods, Inc. Common Stock",$5.35,-0.07,-1.292%,"430,199,273"
BBNX,"Beta Bionics, Inc. Common Stock",$9.65,-0.85,-8.095%,"430,020,357"
VSTM,"Verastem, Inc. Common Stock",$4.89,-0.77,-13.604%,"429,551,776"
OEC,Orion S.A. Common Shares,$7.61,0.45,6.285%,"429,117,619"
CATX,"Perspective Therapeutics, Inc. Common Stock",$3.76,0.16,4.444%,"428,706,759"
MNPR,Monopar Therapeutics Inc. Common Stock,$63.575,1.145,1.834%,"425,874,811"
KREF,KKR Real Estate Finance Trust Inc. Common Stock,$6.61,0.03,0.456%,"425,025,756"
SGU,Star Group L.P. Common Stock,$12.94,-0.51,-3.792%,"424,871,093"
TOYO,"TOYO Co., Ltd Ordinary Shares",$11.25,0.41,3.782%,"424,788,716"
CCRN,"Cross Country Healthcare, Inc. Common Stock $0.0001 Par Value",$13.18,0.09,0.688%,"424,385,548"
NATR,"Nature's Sunshine Products, Inc. Common Stock",$24.23,-0.32,-1.303%,"424,209,342"
IVVD,"Invivyd, Inc. Common Stock",$1.50,0.07,4.895%,"424,205,795"
LXFR,Luxfer Holdings PLC Ordinary Shares,$15.57,0.05,0.322%,"424,075,061"
BMRC,Bank of Marin Bancorp Common Stock,$26.12,0.05,0.192%,"422,875,147"
NRC,NRC Health Common Stock,$18.75,0.02,0.107%,"422,563,050"
BNTC,Benitec Biopharma Inc. Common Stock,$12.28,0.14,1.153%,"421,871,222"
EVN,Eaton Vance Municipal Income Trust Common Stock,$10.63,0.03,0.283%,"421,661,943"
MGPI,"MGP Ingredients, Inc.",$19.70,0.61,3.195%,"421,013,369"
LOCO,"El Pollo Loco Holdings, Inc. Common Stock",$14.00,0.49,3.627%,"420,802,018"
CBAN,"Colony Bankcorp, Inc. Common Stock",$19.85,0.05,0.253%,"420,270,453"
EOLS,"Evolus, Inc. Common Stock",$6.36,-0.03,-0.469%,"418,836,216"
NOA,North American Construction Group Ltd. Common Shares (no par),$14.68,0.19,1.311%,"418,634,918"
AUTL,Autolus Therapeutics plc American Depositary Share,$1.57,-0.04,-2.484%,"417,844,959"
XFOR,"X4 Pharmaceuticals, Inc. Common Stock",$4.43,0.14,3.263%,"417,836,253"
GRRR,Gorilla Technology Group Inc. Ordinary shares,$15.10,-0.25,-1.629%,"417,573,271"
ABAT,American Battery Technology Company Common Stock,$3.17,0.08,2.589%,"417,518,307"
BWFG,"Bankwell Financial Group, Inc. Common Stock",$52.36,0.45,0.867%,"417,475,705"
ASPN,"Aspen Aerogels, Inc. Common Stock",$5.04,-0.08,-1.563%,"417,441,039"
LAND,Gladstone Land Corporation Common Stock,$9.73,-0.02,-0.205%,"416,799,855"
LSAK,"Lesaka Technologies, Inc. Common Stock",$4.86,-0.11,-2.213%,"416,678,044"
BSVN,Bank7 Corp. Common stock,$43.76,-0.19,-0.432%,"416,566,100"
GBFH,GBank Financial Holdings Inc. Common Stock,$29.16,-0.26,-0.884%,"415,175,531"
NATH,"Nathan's Famous, Inc. Common Stock",$101.40,-0.08,-0.079%,"415,172,667"
PRTC,PureTech Health plc American Depositary Shares,$17.14,0.17,1.002%,"414,246,445"
IPSC,"Century Therapeutics, Inc. Common Stock",$2.29,-0.02,-0.866%,"413,011,111"
LRMR,"Larimar Therapeutics, Inc. Common Stock",$3.97,-0.03,-0.75%,"412,415,260"
VREX,Varex Imaging Corporation Common Stock,$9.83,-2.00,-16.906%,"411,877,000"
FVRR,"Fiverr International Ltd. Ordinary Shares, no par value",$11.45,-0.30,-2.553%,"411,635,836"
NEWT,"NewtekOne, Inc. Common Stock",$14.27,0.60,4.389%,"411,425,377"
RBB,RBB Bancorp Common Stock,$24.05,-0.14,-0.579%,"410,633,524"
ROMA,Roma Green Finance Limited Class A Ordinary Shares,$6.89,0.42,6.491%,"410,399,894"
TRX,TRX Gold Corporation Common Stock,$1.26,0.03,2.439%,"410,360,409"
WTBA,West Bancorporation Common Stock,$24.09,-0.02,-0.083%,"410,206,953"
VHI,"Valhi, Inc. Common Stock",$14.49,0.21,1.471%,"410,100,226"
VOXR,Vox Royalty Corp. Common Stock,$5.95,0.125,2.146%,"409,958,635"
SOHU,Sohu.com Limited American Depositary Shares,$15.69,-0.11,-0.696%,"409,022,955"
CDRO,"Codere Online Luxembourg, S.A. Ordinary Shares",$9.00,-0.29,-3.122%,"408,520,611"
ATNI,"ATN International, Inc. Common Stock",$26.55,0.84,3.267%,"408,361,647"
DDT,Dillard's Capital Trust I,$26.11,0.03,0.115%,"407,761,724"
BXC,Bluelinx Holdings Inc. Common Stock,$52.39,-0.57,-1.076%,"407,719,674"
JLHL,Julong Holding Limited Class A Ordinary Shares,$19.00,-0.06,-0.315%,"407,524,008"
FVR,"FrontView REIT, Inc. Common Stock",$18.17,-0.09,-0.493%,"407,155,559"
NKLR,Terra Innovatum Global N.V. Ordinary shares,$5.78,-0.14,-2.365%,"406,339,479"
GCBC,"Greene County Bancorp, Inc. Common Stock",$23.86,-0.13,-0.542%,"406,260,116"
AVBC,"Avidia Bancorp, Inc. Common Stock",$20.21,0.09,0.447%,"405,741,013"
FRPH,"FRP Holdings, Inc. Common Stock",$21.14,-0.12,-0.564%,"405,250,312"
MYGN,"Myriad Genetics, Inc. Common Stock",$4.29,0.20,4.89%,"405,182,821"
LEO,"BNY Mellon Strategic Municipals, Inc. Common Stock",$6.50,0.06,0.932%,"404,890,551"
DVLT,Datavault AI Inc. Common Stock,$0.5422,0.0279,5.425%,"404,736,622"
SSP,E.W. Scripps Company (The) Class A Common Stock,$4.535,-0.145,-3.098%,"403,745,794"
SAJ,Saratoga Investment Corp 8.00% Notes due 2027,$25.70,0.05,0.195%,"402,670,967"
YEXT,"Yext, Inc. Common Stock",$4.02,-0.10,-2.427%,"402,538,399"
SAZ,Saratoga Investment Corp 8.50% Notes due 2028,$25.69,0.03,0.117%,"402,514,285"
BBCP,"Concrete Pumping Holdings, Inc. Common Stock",$7.95,-0.09,-1.119%,"401,558,523"
VKI,Invesco Advantage Municipal Income Trust II Common Shares of Beneficial Interest (DE),$9.04,0.06,0.668%,"401,430,421"
NHP,"National Healthcare Properties, Inc. Class A Common Stock",$14.12,0.54,3.976%,"401,180,024"
HNST,"The Honest Company, Inc. Common Stock",$3.64,-0.09,-2.413%,"400,686,159"
FTW,Presidio Production Company Class A Common Stock,$11.00,0.38,3.578%,"400,422,748"
TOI,"The Oncology Institute, Inc. Common Stock",$4.00,-0.07,-1.72%,"399,931,732"
SAY,Saratoga Investment Corp 8.125% Notes due 2027,$25.521,-0.029,-0.114%,"399,866,371"
SVREW,SaverOne 2014 Ltd. Warrant,$0.0146,0.0031,26.957%,"399,548,506"
CBK,"Commercial Bancgroup, Inc. Common Stock",$29.11,UNCH,--,"398,748,402"
FWDI,"Forward Industries, Inc. Common Stock",$4.79,0.12,2.57%,"398,235,987"
LAB,Standard BioTools Inc. Common Stock,$1.02,0.02,2.00%,"398,175,481"
CDZI,"CADIZ, Inc. Common Stock",$4.75,-0.04,-0.835%,"397,581,109"
SDHY,PGIM Short Duration High Yield Opportunities Fund Common Shares,$16.08,0.04,0.249%,"396,742,740"
GENVR,Gen Digital Inc. Contingent Value Rights,$0.655,0.205,45.556%,"396,709,772"
OPAL,OPAL Fuels Inc. Class A Common Stock,$2.27,-0.07,-2.991%,"396,697,439"
GBLI,"Global Indemnity Group, LLC Class A Common Stock ",$27.69,0.39,1.429%,"396,630,286"
RCKT,"Rocket Pharmaceuticals, Inc. Common Stock",$3.63,-0.04,-1.09%,"396,115,898"
DCTH,"Delcath Systems, Inc. Common Stock",$11.48,0.24,2.135%,"395,538,337"
XWIN,"XMAX, Inc. Common Stock",$8.34,0.09,1.091%,"393,699,933"
SAT,Saratoga Investment Corp 6.00% Notes due 2027,$25.11,0.03,0.12%,"393,426,769"
CYH,"Community Health Systems, Inc. Common Stock",$2.79,-0.11,-3.793%,"393,157,626"
CAN,Canaan Inc. American Depositary Shares,$0.5095,-0.0055,-1.068%,"392,299,624"
BBBY,"Bed Bath & Beyond, Inc. Common Stock",$5.30,-0.06,-1.119%,"391,874,024"
ISTR,Investar Holding Corporation Common Stock,$28.47,UNCH,--,"391,298,086"
LND,Brasilagro Brazilian Agric Real Estate Co Sponsored ADR (Brazil),$3.81,-0.03,-0.781%,"391,223,922"
LWAY,"Lifeway Foods, Inc. Common Stock",$25.60,-0.04,-0.156%,"391,216,333"
OSS,"One Stop Systems, Inc. Common Stock",$15.68,0.58,3.841%,"388,378,187"
SOR,"Source Capital, Inc. Cmn Shs of BI",$46.50,0.05,0.108%,"388,018,460"
CZNC,Citizens & Northern Corp Common Stock,$21.63,-0.15,-0.689%,"387,398,556"
RLGT,"Radiant Logistics, Inc. Common Stock",$8.27,-0.04,-0.481%,"387,255,519"
PNRG,PrimeEnergy Resources Corporation Common Stock,$239.05,11.05,4.846%,"386,782,900"
AMCX,AMC Global Media Inc. Class A Common Stock,$8.80,0.24,2.804%,"386,563,866"
AII,"American Integrity Insurance Group, Inc. Common Stock",$19.73,0.06,0.305%,"386,339,897"
BYND,"Beyond Meat, Inc. Common Stock",$0.8331,-0.0597,-6.687%,"386,193,153"
TBRG,"TruBridge, Inc. Common Stock",$25.83,0.05,0.194%,"385,043,290"
FUFU,BitFuFu Inc. Class A Ordinary Shares,$2.31,0.03,1.316%,"384,969,811"
ATLCZ,Atlanticus Holdings Corporation 9.25% Senior Notes due 2029,$25.44,-0.005,-0.02%,"384,791,423"
QUAD,"Quad Graphics, Inc Class A Common Stock",$7.46,-0.20,-2.611%,"384,634,042"
CLPT,"ClearPoint Neuro, Inc. Common Stock",$12.82,1.14,9.76%,"384,420,725"
FMAO,"Farmers & Merchants Bancorp, Inc. Common Stock",$27.85,0.18,0.651%,"383,444,036"
VITL,"Vital Farms, Inc. Common Stock",$8.94,-0.58,-6.092%,"383,065,179"
RZLVW,Rezolve AI PLC Warrants,$0.9547,-0.0103,-1.067%,"382,254,019"
ALLT,Allot Ltd. Ordinary Shares,$7.81,0.16,2.092%,"382,089,403"
MSB,Mesabi Trust Common Stock,$29.11,0.41,1.429%,"381,923,491"
FRBA,First Bank Common Stock,$15.18,-0.15,-0.978%,"381,540,238"
GNE,Genie Energy Ltd. Class B Common Stock Stock,$14.44,-0.24,-1.635%,"381,223,480"
PBYI,Puma Biotechnology Inc Common Stock,$7.49,0.23,3.168%,"381,178,646"
NC,"NACCO Industries, Inc. Common Stock",$50.37,-1.74,-3.339%,"379,820,526"
ISSC,"Innovative Solutions and Support, Inc. Common Stock",$21.36,0.45,2.152%,"379,745,406"
GCO,Genesco Inc. Common Stock,$34.89,1.14,3.378%,"378,843,435"
ATLCL,Atlanticus Holdings Corporation 6.125% Senior Notes due 2026,$25.03,0.03,0.12%,"378,589,988"
TACO,Berto Acquisition Corp. Ordinary Shares,$10.37,-0.01,-0.096%,"377,905,946"
VNDA,Vanda Pharmaceuticals Inc. Common Stock,$6.28,-0.11,-1.721%,"377,648,189"
XPER,Xperi Inc. Common Stock ,$8.03,0.31,4.016%,"377,167,502"
YDES,YD Bio Limited Ordinary Shares,$5.31,0.0185,0.35%,"376,114,447"
RNGR,"Ranger Energy Services, Inc. Class A Common Stock",$15.82,-0.03,-0.189%,"375,908,876"
AUNA,Auna SA Class A Ordinary Shares,$5.07,UNCH,--,"375,245,733"
CLMB,"Climb Global Solutions, Inc. Common Stock",$20.12,-0.14,-0.691%,"374,175,664"
SNDL,SNDL Inc. Common Shares,$1.435,-0.015,-1.034%,"373,530,500"
KNOP,KNOT Offshore Partners LP Common Units representing Limited Partner Interests,$11.08,0.04,0.362%,"372,956,589"
ACCO,Acco Brands Corporation Common Stock,$4.04,-0.02,-0.493%,"372,721,488"
RMNI,"Rimini Street, Inc. (DE) Common Stock",$4.02,0.08,2.03%,"372,091,200"
SOPH,SOPHiA GENETICS SA Ordinary Shares,$5.15,-0.25,-4.63%,"369,093,815"
GASS,"StealthGas, Inc. Common Stock",$9.90,0.10,1.02%,"368,138,291"
PBFS,"Pioneer Bancorp, Inc. Common Stock",$14.59,-0.30,-2.015%,"365,870,527"
XRX,Xerox Holdings Corporation Common Stock,$2.78,0.41,17.30%,"363,557,983"
CION,CION Investment Corporation Common Stock,$7.29,-0.10,-1.353%,"362,963,341"
PLBC,Plumas Bancorp,$52.03,0.07,0.135%,"362,552,116"
WAVE,Eco Wave Power Global AB (publ) American Depositary Shares,$7.7501,-0.4599,-5.602%,"362,063,809"
API,"Agora, Inc. American Depositary Shares",$4.28,0.30,7.538%,"361,873,080"
AENT,Alliance Entertainment Holding Corporation Class A Common Stock,$7.09,-0.22,-3.01%,"361,287,753"
SVCO,"Silvaco Group, Inc. Common Stock",$11.49,-0.57,-4.726%,"361,256,010"
BNED,"Barnes & Noble Education, Inc Common Stock",$10.52,-0.17,-1.59%,"360,795,172"
DDD,3D Systems Corporation Common Stock,$2.47,0.07,2.917%,"360,765,678"
SAR,Saratoga Investment Corp New,$22.15,-0.19,-0.85%,"360,330,618"
DIN,"Dine Brands Global, Inc. Common Stock",$28.38,0.09,0.318%,"360,005,267"
SHIP,Seanergy Maritime Holdings Corp. Common Stock,$16.61,0.40,2.468%,"359,908,769"
TG,Tredegar Corporation Common Stock,$10.35,0.15,1.471%,"359,734,743"
PKBK,"Parke Bancorp, Inc. Common Stock",$30.66,-0.20,-0.648%,"359,670,927"
KTF,DWS Municipal Income Trust,$9.10,-0.0101,-0.111%,"359,458,536"
FRST,Primis Financial Corp. Common Stock,$14.46,-0.03,-0.207%,"358,204,161"
PLAY,"Dave & Buster's Entertainment, Inc. Common Stock",$10.31,-0.16,-1.528%,"358,163,266"
EVTL,Vertical Aerospace Ltd. Ordinary Shares,$2.81,0.13,4.851%,"357,791,691"
HVT,"Haverty Furniture Companies, Inc. Common Stock",$22.20,0.45,2.069%,"357,316,837"
IRD,"Opus Genetics, Inc. Common Stock",$4.99,-0.37,-6.903%,"356,298,335"
ATLCP,"Atlanticus Holdings Corporation 7.625% Series B Cumulative Perpetual Preferred Stock, no par value per share",$23.89,0.2311,0.977%,"356,246,677"
PMO,Putnam Municipal Opportunities Trust Common Stock,$10.47,0.05,0.48%,"355,787,006"
CV,"CapsoVision, Inc. Common Stock",$7.12,-0.07,-0.974%,"354,930,063"
CABO,"Cable One, Inc. Common Stock",$62.39,1.62,2.666%,"353,929,299"
LE,"Lands' End, Inc. Common Stock",$11.53,-0.03,-0.26%,"353,739,132"
DBI,Designer Brands Inc. Class A Common Stock,$6.97,-0.01,-0.143%,"353,422,353"
TCPC,BlackRock TCP Capital Corp. Common Stock,$4.19,-0.17,-3.899%,"352,919,979"
VELO,"Velo3D, Inc. Common stock",$13.46,1.23,10.057%,"352,878,424"
QUIK,QuickLogic Corporation Common Stock,$19.89,2.33,13.269%,"352,459,452"
NUS,"Nu Skin Enterprises, Inc. Common Stock",$7.16,0.14,1.994%,"352,105,415"
BKTI,BK Technologies Corporation Common Stock,$93.88,-0.04,-0.043%,"351,500,896"
PPT,Putnam Premier Income Trust Common Stock,$3.53,0.02,0.57%,"351,334,768"
OPENL,"Opendoor Technologies Inc  Series A Warrants, each whole warrant exercisable to purchase one share of Common Stock at an exercise price of $13.00 per warrant",$0.364,-0.0414,-10.212%,"351,152,405"
PCB,PCB Bancorp Common Stock,$24.67,-0.18,-0.724%,"351,089,205"
MPTI,"M-tron Industries, Inc. Common Stock",$81.20,4.54,5.922%,"350,865,444"
USNA,"USANA Health Sciences, Inc. Common Stock",$18.96,-0.50,-2.569%,"349,943,488"
GETY,"Getty Images Holdings, Inc. Class A Common Stock",$0.8362,0.0022,0.264%,"349,335,608"
BOC,Boston Omaha Corporation Class A Common Stock,$11.36,0.15,1.338%,"348,366,646"
MCI,Barings Corporate Investors Common Stock,$17.19,-0.25,-1.433%,"348,298,950"
TSSI,"TSS, Inc. Common Stock",$12.02,-3.82,-24.116%,"346,901,623"
TLS,Telos Corporation Common Stock,$4.48,0.06,1.357%,"346,106,925"
ALTO,"Alto Ingredients, Inc. Common Stock",$4.46,-0.08,-1.762%,"345,608,375"
VMD,"Viemed Healthcare, Inc. Common Shares",$8.94,-0.27,-2.932%,"345,107,521"
HTT,"High Templar Tech Limited American depositary shares, each representing one Class A ordinary share",$2.22,-0.04,-1.77%,"344,729,379"
SSSS,SuRo Capital Corp. Common Stock,$13.22,-0.23,-1.71%,"344,648,150"
LX,LexinFintech Holdings Ltd. American Depositary Shares,$2.09,0.03,1.456%,"344,407,493"
SIGA,SIGA Technologies Inc. Common Stock,$4.80,0.07,1.48%,"344,275,666"
ULH,"Universal Logistics Holdings, Inc. Common Stock",$13.04,-0.38,-2.832%,"343,604,756"
USCB,"USCB Financial Holdings, Inc. Class A Common Stock",$18.82,0.46,2.505%,"343,604,268"
CUB,Lionheart Holdings Class A Ordinary Shares,$10.81,0.01,0.093%,"343,418,307"
PAYS,"Paysign, Inc. Common Stock",$6.22,-0.49,-7.303%,"343,253,151"
SES,SES AI Corporation Class A Common Stock,$0.9292,0.0082,0.89%,"343,138,102"
MTRX,Matrix Service Company Common Stock,$12.18,0.02,0.164%,"342,603,973"
HLLY,Holley Inc. Common Stock,$2.82,0.29,11.462%,"342,527,346"
NCMI,"National CineMedia, Inc. Common Stock",$3.67,-0.04,-1.078%,"342,339,138"
CHSCP,CHS Inc. 8%  Cumulative Redeemable Preferred Stock,$27.845,0.095,0.342%,"341,713,924"
KFS,"Kingsway Financial Services, Inc. Common Stock (DE)",$11.80,1.10,10.28%,"341,570,635"
LCTX,"Lineage Cell Therapeutics, Inc. Common Stock",$1.37,UNCH,--,"341,538,664"
MEI,"Methode Electronics, Inc. Common Stock",$9.63,0.38,4.108%,"341,194,954"
CVEO,Civeo Corporation (Canada) Common Shares,$31.16,-0.13,-0.415%,"340,993,103"
PPHC,"Public Policy Holding Company, Inc. Common Stock",$13.55,0.08,0.594%,"340,576,255"
NAUT,"Nautilus Biotechnology, Inc. Common Stock",$2.68,-0.20,-6.944%,"340,571,331"
DMAC,DiaMedica Therapeutics Inc. Common Stock,$6.32,-0.21,-3.216%,"340,542,740"
WSBF,"Waterstone Financial, Inc. Common Stock (MD)",$18.72,0.16,0.862%,"339,987,642"
CMTG,"Claros Mortgage Trust, Inc. Common Stock",$2.42,-0.10,-3.968%,"339,329,409"
NECB,"NorthEast Community Bancorp, Inc. Common Stock",$24.46,-0.05,-0.204%,"337,924,855"
LVWR,"LiveWire Group, Inc. Common Stock",$1.65,-0.02,-1.198%,"337,857,020"
IMRX,Immuneering Corporation Class A Common Stock,$5.22,UNCH,--,"337,719,525"
ELLO,Ellomay Capital Ltd Ordinary Shares (Israel),$24.50,UNCH,--,"337,689,135"
KELYA,"Kelly Services, Inc. Class A Common Stock",$9.87,0.17,1.753%,"337,668,768"
OPENZ,"Opendoor Technologies Inc  Series Z Warrants, each whole warrant exercisable to purchase one share of Common Stock at an exercise price of $17.00 per warrant",$0.35,-0.0348,-9.044%,"337,646,543"
BCML,BayCom Corp Common Stock,$30.94,0.46,1.509%,"337,534,268"
REI,"Ring Energy, Inc. Common Stock",$1.61,-0.04,-2.424%,"337,148,780"
SLP,"Simulations Plus, Inc. Common Stock",$16.68,0.62,3.861%,"337,027,440"
SRZN,"Surrozen, Inc. Common Stock",$28.96,-1.79,-5.821%,"336,236,344"
REPL,"Replimune Group, Inc. Common Stock",$4.07,0.73,21.856%,"336,070,559"
BCYC,Bicycle Therapeutics plc American Depositary Shares,$4.81,-0.08,-1.636%,"335,791,992"
ABEO,Abeona Therapeutics Inc. Common Stock,$5.90,0.13,2.253%,"335,606,886"
SWMR,"Swarmer, Inc Common Stock",$27.14,-0.58,-2.092%,"335,140,434"
MVBF,MVB Financial Corp. Common Stock,$26.06,-0.33,-1.25%,"334,868,420"
DSX,Diana Shipping inc. common stock,$2.71,0.02,0.743%,"334,792,741"
BLND,"Blend Labs, Inc. Class A Common Stock",$1.38,-0.24,-14.815%,"334,619,883"
NMRA,"Neumora Therapeutics, Inc. Common Stock",$1.83,-0.11,-5.67%,"334,319,179"
MKTW,"MarketWise, Inc. Class A Common Stock",$20.68,4.05,24.354%,"333,975,341"
SHMD,SCHMID Group N.V. Class A Ordinary Shares,$6.00,0.33,5.82%,"333,617,796"
STRZ,Starz Entertainment Corp. Common Shares,$19.79,-0.31,-1.542%,"332,255,873"
NAGE,"Niagen Bioscience, Inc. Common Stock",$4.17,-0.02,-0.477%,"332,116,844"
NWFL,Norwood Financial Corp. Common Stock,$30.49,-0.18,-0.587%,"332,041,161"
ARTNA,Artesian Resources Corporation Class A Common Stock,$32.04,0.36,1.136%,"330,600,959"
AVBH,"Avidbank Holdings, Inc. Common stock",$30.09,0.18,0.602%,"329,640,975"
CMPX,"Compass Therapeutics, Inc. Common Stock",$1.83,0.02,1.105%,"329,560,884"
NNDM,Nano Dimension Ltd. American Depositary Shares,$1.58,-0.27,-14.595%,"328,618,333"
VGZ,Vista Gold Corp Common Stock,$2.25,UNCH,--,"328,435,529"
ONIT,Onity Group Inc. Common Stock,$38.91,0.60,1.566%,"328,094,451"
NMG,Nouveau Monde Graphite Inc. Common Shares,$2.04,-0.02,-0.971%,"328,086,140"
CHMG,Chemung Financial Corp Common Stock,$68.00,-0.90,-1.306%,"327,721,920"
FNLC,"First Bancorp, Inc  (ME) Common Stock",$29.04,-0.11,-0.377%,"327,290,064"
ORBS,Eightco Holdings Inc. Common Stock,$0.8709,0.0536,6.558%,"327,262,695"
GDEV,GDEV Inc. Ordinary Shares,$17.98,1.0705,6.331%,"326,345,792"
SLN,Silence Therapeutics Plc American Depository Share,$6.97,0.02,0.288%,"326,196,000"
SBC,SBC Medical Group Holdings Incorporated Common Stock,$3.18,-0.03,-0.935%,"326,194,679"
VALU,"Value Line, Inc. Common Stock",$34.74,0.06,0.173%,"326,112,648"
PTLO,Portillo's Inc. Class A Common Stock,$4.30,-0.06,-1.376%,"325,963,667"
ATOM,Atomera Incorporated Common Stock,$8.41,0.31,3.827%,"325,605,765"
RM,Regional Management Corp. Common Stock,$35.34,0.37,1.058%,"325,415,844"
OTLY,Oatly Group AB American Depositary Shares,$10.41,-0.36,-3.343%,"325,052,250"
FINS,Angel Oak Financial Strategies Income Term Trust Common Shares of Beneficial Interest,$12.965,0.105,0.816%,"324,937,102"
BRCC,BRC Inc. Class A Common Stock,$1.30,0.05,4.00%,"324,352,981"
TYGO,"Tigo Energy, Inc. Common Stock",$4.27,-0.08,-1.839%,"324,139,090"
WEYS,"Weyco Group, Inc. Common Stock",$33.98,-0.28,-0.817%,"323,870,652"
FGBIP,"First Guaranty Bancshares, Inc. 6.75% Series A Fixed-Rate Non-Cumulative Perpetual Preferred Stock",$20.50,0.35,1.737%,"323,765,377"
TSBK,"Timberland Bancorp, Inc. Common Stock",$41.01,-0.13,-0.316%,"323,336,209"
GTE,Gran Tierra Energy Inc. Common Stock,$9.15,0.39,4.452%,"322,983,782"
CHSCO,CHS Inc. Class B Cumulative Redeemable Preferred Stock,$26.23,0.09,0.344%,"321,894,639"
RFMZ,"RiverNorth Flexible Municipal Income Fund II, Inc. Common Stock",$13.20,0.072,0.548%,"321,443,179"
EU,enCore Energy Corp. Common Shares,$1.655,-0.215,-11.497%,"321,427,733"
FWRD,Forward Air Corporation Common Stock,$9.87,-7.46,-43.047%,"320,268,787"
GBAB,Guggenheim Taxable Municipal Bond & Investment Grade Debt Trust Common Shares of Beneficial Interest,$14.29,0.08,0.563%,"320,051,772"
EFT,Eaton Vance Floating Rate Income Trust Common Shares of Beneficial Interest,$11.00,0.01,0.091%,"319,994,565"
PINE,"Alpine Income Property Trust, Inc. Common Stock",$19.36,-0.28,-1.426%,"319,918,366"
MTLS,Materialise NV American Depositary Shares,$5.41,-0.03,-0.551%,"319,553,476"
AZ,A2Z Cust2Mate Solutions Corp. Common Shares,$7.14,0.21,3.03%,"318,051,364"
OFSSH,OFS Capital Corporation 4.95% Notes due 2028,$23.7375,-0.0125,-0.053%,"318,036,877"
SUPX,SuperX AI Technology Limited Ordinary Shares,$7.35,-0.11,-1.475%,"317,641,532"
RPAY,Repay Holdings Corporation Class A Common Stock,$3.54,0.05,1.433%,"317,442,696"
EWCZ,"European Wax Center, Inc. Class A Common Stock",$5.82,0.02,0.345%,"317,405,782"
CHSCL,"CHS Inc Class B Cumulative Redeemable Preferred Stock, Series 4",$25.84,0.12,0.467%,"317,108,558"
GLSI,"Greenwich LifeSciences, Inc. Common Stock",$22.86,-0.76,-3.218%,"316,714,762"
AMRN,Amarin Corporation plc,$15.05,0.21,1.415%,"315,585,090"
PRLD,Prelude Therapeutics Incorporated Common Stock,$4.86,-0.29,-5.631%,"315,485,782"
LENZ,"LENZ Therapeutics, Inc. Common Stock",$10.06,0.34,3.498%,"315,425,204"
ZNTL,"Zentalis Pharmaceuticals, Inc. Common Stock",$4.41,0.18,4.255%,"313,931,795"
ISBA,Isabella Bank Corporation Common stock,$42.77,1.23,2.961%,"313,613,634"
IONR,ioneer Ltd American Depositary Shares,$4.13,0.12,2.993%,"313,168,983"
ALCO,"Alico, Inc. Common Stock",$40.68,-0.62,-1.501%,"311,472,359"
AKBA,"Akebia Therapeutics, Inc. Common Stock",$1.16,-0.02,-1.695%,"311,170,050"
