Symbol,Name,Last Sale,Net Change,% Change,Market Cap
SSP,E.W. Scripps Company (The) Class A Common Stock,$3.51,0.04,1.153%,"311,695,476"
PMM,Putnam Managed Municipal Income Trust Common Stock,$6.38,0.03,0.472%,"310,953,601"
EWCZ,"European Wax Center, Inc. Class A Common Stock",$5.715,-0.005,-0.087%,"310,669,235"
ALMU,"Aeluma, Inc. Common Stock",$17.21,-0.54,-3.042%,"310,628,556"
TSBK,"Timberland Bancorp, Inc. Common Stock",$39.315,1.475,3.898%,"309,972,277"
BYRN,"Byrna Technologies, Inc. Common Stock",$13.655,0.845,6.596%,"309,576,369"
USAU,U.S. Gold Corp. Common Stock,$18.785,0.835,4.652%,"309,109,448"
AVTX,"Avalo Therapeutics, Inc. Common Stock",$16.67,0.47,2.901%,"308,607,659"
PPHC,"Public Policy Holding Company, Inc. Common Stock",$12.27,-0.03,-0.244%,"308,403,738"
CHSCM,"CHS Inc Class B Reset Rate Cumulative Redeemable Preferred Stock, Series 3",$25.125,0.025,0.10%,"308,334,075"
HDSN,"Hudson Technologies, Inc. Common Stock",$7.16,0.04,0.562%,"307,902,805"
FSBW,"FS Bancorp, Inc. Common Stock",$40.9313,0.1513,0.371%,"307,740,424"
NGNE,Neurogene Inc. Common Stock ,$19.86,0.96,5.079%,"307,627,428"
TOYO,"TOYO Co., Ltd Ordinary Shares",$8.14,-0.30,-3.555%,"307,480,336"
RM,Regional Management Corp. Common Stock,$32.625,0.795,2.498%,"306,574,809"
SMRT,"SmartRent, Inc. Class A Common Stock",$1.62,0.04,2.532%,"306,505,170"
RILYP,"BRC Group Holdings, Inc. Depositary Shares, each representing a 1/1000th fractional interest in a share of Series A Cumulative Perpetual Preferred Stock",$9.816,-0.084,-0.848%,"306,442,465"
FCNCN,"First Citizens BancShares, Inc. Depositary Shares, each representing a 1/40th interest in a share of 6.625% Non-Cumulative Perpetual Preferred Stock, Series E",$25.20,0.03,0.119%,"305,906,807"
WEYS,"Weyco Group, Inc. Common Stock",$31.96,0.46,1.46%,"305,166,480"
COSO,"CoastalSouth Bancshares, Inc. Common Stock",$25.415,0.155,0.614%,"304,444,277"
JRVR,"James River Group Holdings, Inc. Common Stock",$6.62,-0.05,-0.75%,"304,293,854"
SOPH,SOPHiA GENETICS SA Ordinary Shares,$4.545,0.005,0.11%,"303,747,218"
OIA,Invesco Municipal Income Opportunities Trust Common Stock,$6.3799,0.0199,0.313%,"303,718,897"
PUBM,"PubMatic, Inc. Class A Common Stock",$6.54,0.14,2.188%,"303,552,805"
SCM,Stellus Capital Investment Corporation Common Stock,$10.48,0.03,0.287%,"303,367,222"
TARA,"Protara Therapeutics, Inc.  Common Stock",$5.875,0.405,7.404%,"303,330,592"
FJET,"Starfighters Space, Inc. Common Stock",$6.90,-0.25,-3.497%,"303,223,757"
NGEN,NervGen Pharma Corp. Common stock,$4.16,0.01,0.241%,"302,996,886"
XFOR,"X4 Pharmaceuticals, Inc. Common Stock",$3.455,0.065,1.917%,"302,093,757"
PNRG,PrimeEnergy Resources Corporation Common Stock,$184.715,0.995,0.542%,"302,009,025"
CLLS,Cellectis S.A. American Depositary Shares,$4.185,0.205,5.151%,"301,712,859"
EVO,Evotec SE American Depositary Shares,$3.40,0.06,1.796%,"301,556,271"
NL,"NL Industries, Inc. Common Stock",$6.17,-0.07,-1.122%,"301,483,069"
TBRG,"TruBridge, Inc. Common Stock",$20.085,0.465,2.37%,"301,455,484"
TYGO,"Tigo Energy, Inc. Common Stock",$4.27,0.73,20.621%,"300,404,099"
PINE,"Alpine Income Property Trust, Inc. Common Stock",$19.785,-0.195,-0.976%,"298,527,437"
FUND,"Sprott Focus Trust, Inc. Common Stock",$10.07,0.01,0.099%,"298,409,919"
DSX,Diana Shipping inc. common stock,$2.575,0.025,0.98%,"298,102,242"
GETY,"Getty Images Holdings, Inc. Class A Common Stock",$0.7153,0.0245,3.547%,"297,464,787"
ZH,"Zhihu Inc. American Depositary Shares, each representing three (3) Class A Ordinary Shares",$3.385,-0.035,-1.023%,"296,407,054"
LITB,"LightInTheBox Holding Co., Ltd. American Depositary Shares, each representing twelve ordinary shares",$2.68,-0.11,-3.943%,"295,696,144"
MIN,MFS Intermediate Income Trust Common Stock,$2.57,UNCH,--,"295,287,271"
CZFS,"Citizens Financial Services, Inc. Common Stock",$61.29,0.85,1.406%,"294,582,846"
ARDC,"Ares Dynamic Credit Allocation Fund, Inc. Common Shares",$12.835,-0.065,-0.504%,"294,113,242"
NRC,National Research Corporation Common Stock (Delaware),$12.975,0.485,3.883%,"293,980,037"
QTRX,Quanterix Corporation Common Stock,$6.29,0.59,10.351%,"293,810,913"
SEG,Seaport Entertainment Group Inc. Common Stock,$23.04,0.92,4.159%,"293,416,036"
RMMZ,"RiverNorth Managed Duration Municipal Income Fund II, Inc. Common Stock",$14.85,0.055,0.372%,"293,133,476"
RWAY,Runway Growth Finance Corp. Common Stock,$8.0877,-0.0123,-0.152%,"292,241,251"
TLS,Telos Corporation Common Stock,$3.96,0.08,2.062%,"292,067,143"
SHIP,Seanergy Maritime Holdings Corp. Common Stock,$13.97,-0.21,-1.481%,"292,006,039"
EM,Smart Share Global Limited American Depositary Shares,$1.15,0.01,0.877%,"291,604,644"
CPZ,Calamos Long/Short Equity & Dynamic Income Trust Common Stock,$14.815,-0.055,-0.37%,"290,850,954"
CCRN,"Cross Country Healthcare, Inc. Common Stock $0.0001 Par Value",$8.875,0.135,1.545%,"290,744,574"
OCCIO,"OFS Credit Company, Inc. 6.125% Series C Term Preferred Stock",$24.995,0.0249,0.10%,"290,354,667"
DERM,Journey Medical Corporation Common Stock,$8.725,0.025,0.287%,"290,163,730"
GDEV,GDEV Inc. Ordinary Shares,$16.00,0.01,0.063%,"290,081,440"
EOLS,"Evolus, Inc. Common Stock",$4.465,0.165,3.837%,"289,420,336"
HRZN,Horizon Technology Finance Corporation Common Stock,$6.295,0.005,0.079%,"289,352,388"
CIX,CompX International Inc. Common Stock,$23.41,UNCH,--,"288,482,764"
ABEO,Abeona Therapeutics Inc. Common Stock,$5.305,-0.095,-1.759%,"287,485,170"
VFSWW,VinFast Auto Ltd. Warrant,$0.1225,-0.0274,-18.279%,"286,590,303"
GCO,Genesco Inc. Common Stock,$26.515,-0.085,-0.32%,"286,169,395"
OCCIN,"OFS Credit Company, Inc. 5.25% Series E Term Preferred Stock Due 2026",$24.60,0.05,0.204%,"285,766,146"
CADL,"Candel Therapeutics, Inc. Common Stock",$5.20,0.11,2.161%,"285,458,415"
ACV,Virtus Diversified Income & Convertible Fund Common Shares of Beneficial Interest,$27.54,0.32,1.176%,"285,395,753"
BLFY,Blue Foundry Bancorp Common Stock,$13.74,0.09,0.659%,"285,259,232"
SPOK,"Spok Holdings, Inc. Common Stock",$13.839,0.029,0.21%,"285,058,061"
PALI,"Palisade Bio, Inc. Common Stock",$1.91,0.12,6.704%,"284,596,131"
FVCB,"FVCBankcorp, Inc. Common Stock",$15.70,0.33,2.147%,"283,774,580"
AMRN,Amarin Corporation plc,$13.60,-1.92,-12.371%,"282,780,502"
CIA,"Citizens, Inc. Class A Common Stock ($1.00 Par)",$5.62,UNCH,--,"282,668,286"
NIU,Niu Technologies American Depositary Shares,$3.625,-0.105,-2.815%,"282,619,399"
JMSB,"John Marshall Bancorp, Inc. Common Stock",$19.935,0.355,1.813%,"282,589,390"
BNED,"Barnes & Noble Education, Inc Common Stock",$8.295,0.105,1.282%,"282,476,661"
ACIU,AC Immune SA Common Stock,$2.81,0.09,3.309%,"282,153,159"
RMM,"RiverNorth Managed Duration Municipal Income Fund, Inc. Common Stock",$14.29,0.095,0.669%,"282,079,284"
FNKO,"Funko, Inc. Class A Common Stock",$5.085,0.005,0.098%,"281,662,360"
FCNCO,"First Citizens BancShares, Inc. 5.625% Non-Cumulative Perpetual Preferred Stock, Series C",$23.20,0.07,0.303%,"281,628,489"
MBCN,Middlefield Banc Corp. Common Stock,$34.705,0.605,1.774%,"280,655,379"
NODK,"NI Holdings, Inc. Common Stock",$13.62,0.37,2.792%,"280,650,274"
ACRE,Ares Commercial Real Estate Corporation Common Stock,$5.065,0.045,0.896%,"280,437,259"
ARL,"American Realty Investors, Inc. Common Stock",$17.35,-0.04,-0.23%,"280,237,946"
TOI,"The Oncology Institute, Inc. Common Stock",$2.845,0.265,10.271%,"279,894,912"
RAIL,"FreightCar America, Inc. Common Stock",$14.67,0.34,2.373%,"279,890,485"
NVA,Nova Minerals Limited American Depositary Shares,$7.435,0.165,2.27%,"279,449,561"
BRT,BRT Apartments Corp. (MD) Common Stock,$14.69,0.15,1.032%,"279,409,588"
FLXS,"Flexsteel Industries, Inc. Common Stock",$52.1966,-0.8334,-1.572%,"279,017,447"
NWFL,Norwood Financial Corp. Common Stock,$30.11,0.97,3.329%,"278,945,062"
MMT,MFS Multimarket Income Trust Common Stock,$4.675,-0.005,-0.107%,"278,388,326"
DEFT,"Defi Technologies, Inc. Common Stock",$0.7206,0.0803,12.541%,"278,063,669"
OVLY,Oak Valley Bancorp (CA) Common Stock,$33.11,0.17,0.516%,"277,733,997"
GSIT,GSI Technology Common Stock,$7.67,0.90,13.294%,"277,548,177"
LFCR,"Lifecore Biomedical, Inc. Common Stock",$7.39,0.17,2.355%,"276,876,341"
ATGL,Alpha Technology Group Limited Class A Ordinary Shares,$16.80,0.21,1.266%,"276,570,000"
RDIB,Reading International Inc Class B Common Stock,$12.16,-0.24,-1.935%,"276,241,882"
BKKT,"Bakkt, Inc. Class A Common Stock",$10.82,0.72,7.129%,"276,227,664"
IONR,ioneer Ltd American Depositary Shares,$4.14,0.24,6.154%,"276,118,298"
VERI,"Veritone, Inc. Common Stock",$2.995,0.175,6.206%,"274,959,039"
SKYX,SKYX Platforms Corp. Common Stock,$2.0903,0.0703,3.48%,"274,906,030"
FGBIP,"First Guaranty Bancshares, Inc. 6.75% Series A Fixed-Rate Non-Cumulative Perpetual Preferred Stock",$17.85,-0.095,-0.529%,"274,050,104"
EVC,Entravision Communications Corporation Common Stock,$3.005,0.005,0.167%,"273,383,745"
MCR,MFS Charter Income Trust Common Stock,$6.21,-0.01,-0.161%,"273,292,040"
NERV,"Minerva Neurosciences, Inc Common Stock",$6.30,0.05,0.80%,"272,628,707"
WNEB,"Western New England Bancorp, Inc. Common Stock",$13.30,0.03,0.226%,"272,543,148"
AARD,"Aardvark Therapeutics, Inc. Common Stock",$12.51,-0.17,-1.341%,"272,383,633"
SGHT,"Sight Sciences, Inc. Common Stock",$5.14,-0.11,-2.095%,"271,760,697"
SI,"Shoulder Innovations, Inc. Common Stock",$13.165,-0.065,-0.491%,"271,221,170"
EOT,Eaton Vance Municipal Income Trust EATON VANCE NATIONAL MUNICIPAL OPPORTUNITIES TRUST,$17.34,-0.027,-0.155%,"270,936,130"
MPX,Marine Products Corporation Common Stock,$7.74,-0.08,-1.023%,"270,892,523"
PPIH,"Perma-Pipe International Holdings, Inc. Common Stock",$33.38,-0.45,-1.33%,"270,179,222"
CHMG,Chemung Financial Corp Common Stock,$56.26,0.10,0.178%,"269,730,075"
TLSI,"TriSalus Life Sciences, Inc. Common Stock",$5.38,0.06,1.128%,"269,298,536"
NUAI,"New Era Energy & Digital, Inc. Common Stock",$5.02,-0.02,-0.397%,"269,190,116"
AFRI,Forafric Global PLC Ordinary Shares,$10.00,0.08,0.806%,"269,015,920"
ALLT,Allot Ltd. Ordinary Shares,$6.77,-3.04,-30.989%,"268,720,351"
FCNCP,"First Citizens BancShares, Inc. Depositary Shares",$22.0099,-0.0001,0.00%,"267,181,676"
REI,"Ring Energy, Inc. Common Stock",$1.285,-0.015,-1.154%,"266,281,782"
ARQQ,Arqit Quantum Inc. Ordinary Shares,$16.99,0.60,3.661%,"265,925,084"
DDD,3D Systems Corporation Common Stock,$2.065,0.035,1.724%,"265,843,999"
XWIN,"XMAX, Inc. Common Stock",$6.17,0.02,0.325%,"265,752,556"
TAYD,"Taylor Devices, Inc. Common Stock",$84.225,-4.215,-4.766%,"265,571,279"
FDBC,"Fidelity D & D Bancorp, Inc. Common Stock",$45.97,-0.02,-0.043%,"265,122,137"
RC,Ready Capital Corporation Common Stock,$1.635,-0.025,-1.506%,"265,076,461"
BNR,Burning Rock Biotech Limited American Depositary Shares,$24.51,-3.12,-11.292%,"263,889,268"
FBLA,"FB Bancorp, Inc. Common Stock",$13.3001,0.1801,1.373%,"263,840,734"
ENLV,Enlivex Ltd. Ordinary Shares,$1.1101,-0.0399,-3.47%,"263,517,201"
ALEC,"Alector, Inc. Common Stock",$2.405,0.215,9.817%,"262,509,290"
HBB,Hamilton Beach Brands Holding Company Class A Common Stock ,$19.515,0.265,1.377%,"262,343,111"
MRAM,"Everspin Technologies, Inc. Common Stock",$11.47,0.40,3.613%,"262,164,216"
EGAN,eGain Corporation Common Stock,$9.57,0.09,0.949%,"262,085,073"
AENT,Alliance Entertainment Holding Corporation Class A Common Stock,$5.14,0.01,0.195%,"261,920,882"
STTK,"Shattuck Labs, Inc. Common Stock",$4.135,-0.145,-3.388%,"261,662,151"
AMBR,Amber International Holding Limited American Depositary Shares,$2.79,0.23,8.984%,"261,375,361"
EVI,"EVI Industries, Inc.  Common Stock",$20.30,-0.53,-2.544%,"261,101,625"
FOSL,"Fossil Group, Inc. Common Stock",$4.775,-0.105,-2.152%,"260,908,812"
MVIS,"MicroVision, Inc. Common Stock",$0.8543,-0.0178,-2.041%,"260,900,887"
HERE,Here Group Limited American Depositary Shares,$4.795,0.235,5.154%,"260,774,229"
JILL,"J. Jill, Inc. Common Stock",$17.2225,0.1625,0.953%,"260,324,167"
PCYO,Pure Cycle Corporation Common Stock,$10.795,0.105,0.982%,"260,058,081"
MINE,Mayfair Gold Corp. Common Shares,$3.89,-0.04,-1.018%,"259,842,645"
GWRS,"Global Water Resources, Inc. Common Stock",$9.0055,0.0255,0.284%,"258,910,511"
NREF,"NexPoint Real Estate Finance, Inc. Common Stock",$14.605,-0.105,-0.714%,"258,827,298"
DAVA,Endava plc American Depositary Shares (each representing one Class A Ordinary Share),$4.76,0.22,4.846%,"258,599,390"
TWIN,"Twin Disc, Incorporated Common Stock",$17.905,0.365,2.081%,"258,219,786"
SJT,San Juan Basin Royalty Trust Common Stock,$5.54,0.13,2.403%,"258,212,730"
LMNR,Limoneira Co Common Stock,$14.23,0.07,0.494%,"257,835,035"
OABI,"OmniAb, Inc. Common Stock",$1.785,0.055,3.179%,"256,960,389"
HNST,"The Honest Company, Inc. Common Stock",$2.295,0.035,1.549%,"256,559,597"
SLGL,Sol-Gel Technologies Ltd. Ordinary Shares,$91.99,4.36,4.975%,"256,262,246"
XPER,Xperi Inc. Common Stock ,$5.53,0.14,2.597%,"256,234,679"
VPV,Invesco Pennsylvania Value Municipal Income Trust Common Stock (DE),$10.73,0.02,0.187%,"255,691,007"
REFI,"Chicago Atlantic Real Estate Finance, Inc. Common Stock",$12.12,0.02,0.165%,"255,492,897"
OPTX,"Syntec Optics Holdings, Inc. Class A Common Stock",$6.92,0.53,8.294%,"255,487,964"
CBUS,"Cibus, Inc. Class A Common Stock",$3.77,0.08,2.168%,"254,382,514"
CD,Chaince Digital Holdings Inc. Ordinary Shares,$3.99,-0.28,-6.557%,"254,109,386"
MITT,"TPG Mortgage Investment Trust, Inc. Common Stock",$8.00,-0.01,-0.125%,"253,955,592"
RPAY,Repay Holdings Corporation Class A Common Stock,$2.95,0.05,1.724%,"253,883,587"
ESOA,Energy Services of America Corporation Common Stock,$15.21,0.97,6.812%,"253,383,983"
SLN,Silence Therapeutics Plc American Depository Share,$5.41,0.08,1.501%,"253,188,000"
NIOBW,NioCorp Developments Ltd. Warrant,$2.02,0.06,3.061%,"253,148,767"
JAKK,"JAKKS Pacific, Inc. Common Stock",$22.45,-0.43,-1.879%,"253,000,926"
HUMA,"Humacyte, Inc. Common Stock",$1.201,0.081,7.232%,"251,828,995"
POWW,Outdoor Holding Company Common Stock,$2.145,0.025,1.179%,"251,584,309"
PSNYW,Polestar Automotive Holding UK PLC Class C-1 ADS (ADW),$3.2599,-0.0301,-0.915%,"250,987,107"
CHRS,"Coherus Oncology, Inc. Common Stock",$1.675,0.005,0.299%,"250,363,947"
ORBS,Eightco Holdings Inc. Common Stock,$1.265,0.055,4.545%,"250,256,993"
BUUU,BUUU Group Limited Class A Ordinary Share,$15.00,-0.66,-4.215%,"250,125,000"
TTGT,"TechTarget, Inc. Common Stock",$3.465,-0.11,-3.077%,"250,027,144"
TSSI,"TSS, Inc. Common Stock",$8.66,0.21,2.485%,"249,798,020"
FENC,Fennec Pharmaceuticals Inc. Common Stock,$8.885,-0.025,-0.281%,"249,330,870"
MYFW,"First Western Financial, Inc. Common Stock",$25.49,0.24,0.95%,"247,627,983"
ATLO,Ames National Corporation Common Stock,$27.80,0.29,1.054%,"247,202,243"
ECC           ,Eagle Point Credit Company Inc. Common Stock,$4.075,0.125,3.165%,"247,199,785"
VUZI,Vuzix Corporation Common Stock,$3.085,0.005,0.162%,"247,190,209"
VELO,"Velo3D, Inc. Common stock",$10.04,0.36,3.719%,"247,161,005"
FTF,Franklin Limited Duration Income Trust Common Shares of Beneficial Interest,$6.0907,0.0007,0.011%,"246,097,011"
OPRT,Oportun Financial Corporation Common Stock,$5.57,0.43,8.366%,"245,798,641"
PESI,"Perma-Fix Environmental Services, Inc. Common Stock",$13.25,0.25,1.923%,"245,359,022"
FXNC,First National Corporation Common Stock,$27.19,0.56,2.103%,"245,004,114"
ACHV,"Achieve Life Sciences, Inc. Common Shares",$4.60,0.21,4.784%,"244,876,345"
LCNB,LCNB Corporation Common Stock,$17.26,0.03,0.174%,"244,861,493"
MASS,908 Devices Inc. Common Stock,$6.76,-0.03,-0.442%,"244,664,531"
CFFI,C&F Financial Corporation Common Stock,$75.50,1.06,1.424%,"244,486,516"
PLX,"Protalix BioTherapeutics, Inc. (DE) Common Stock",$3.035,0.035,1.167%,"244,078,284"
OSG,"Octave Specialty Group, Inc. Common Stock",$5.56,0.47,9.234%,"243,594,915"
CV,"CapsoVision, Inc. Common Stock",$5.20,0.25,5.051%,"243,584,770"
RDNW,"RideNow Group, Inc. Class B Common Stock",$6.37,0.02,0.315%,"242,489,988"
NKSH,"National Bankshares, Inc. Common Stock",$38.03,0.38,1.009%,"242,099,018"
SSSS,SuRo Capital Corp. Common Stock,$9.625,0.455,4.962%,"241,771,251"
OBIO,"Orchestra BioMed Holdings, Inc. Ordinary Shares",$4.265,0.145,3.519%,"240,822,078"
AZ,A2Z Cust2Mate Solutions Corp. Common Shares,$5.61,0.22,4.082%,"240,263,184"
IRD,"Opus Genetics, Inc. Common Stock",$3.475,-0.165,-4.533%,"239,650,623"
SLP,"Simulations Plus, Inc. Common Stock",$11.845,0.255,2.20%,"238,636,299"
NVCT,"Nuvectis Pharma, Inc. Common Stock",$9.0001,0.3001,3.449%,"238,427,967"
AIFU,AIFU Inc. Class A Ordinary Share,$1.93,0.13,7.222%,"238,256,782"
LTRX,"Lantronix, Inc. Common Stock",$6.00,0.01,0.167%,"238,152,156"
HWBK,"Hawthorn Bancshares, Inc. Common Stock",$34.47,UNCH,--,"237,761,858"
CNDT,Conduent Incorporated Common Stock ,$1.535,0.025,1.656%,"237,478,582"
ARCT,Arcturus Therapeutics Holdings Inc. Common Stock,$8.35,0.17,2.078%,"237,259,230"
NXDT,NexPoint Diversified Real Estate Trust Common Stock,$4.835,0.155,3.312%,"237,013,678"
SDA,SunCar Technology Group Inc. Class A Ordinary Shares,$2.40,0.05,2.128%,"236,412,139"
WTF,Waton Financial Limited Ordinary Shares,$4.90,0.25,5.376%,"236,363,613"
GRRR,Gorilla Technology Group Inc. Ordinary shares,$11.66,0.19,1.656%,"235,791,342"
KINS,"Kingstone Companies, Inc. Common Stock",$16.665,0.355,2.177%,"235,766,888"
FRAF,Franklin Financial Services Corporation Common Stock,$52.62,0.835,1.612%,"235,686,927"
MFIN,Medallion Financial Corp. Common Stock,$10.1215,0.0315,0.312%,"235,622,801"
KDKRW,"Kodiak AI, Inc. Warrants",$1.30,0.13,11.111%,"235,569,610"
STRS,Stratus Properties Inc. Common Stock,$29.46,UNCH,--,"235,525,217"
TBCH,Turtle Beach Corporation Common Stock,$12.15,0.33,2.792%,"234,628,820"
NTHI,"NeOnc Technologies Holdings, Inc. Common Stock",$9.69,-0.01,-0.103%,"234,182,184"
GORO,Gold Resource Corporation Common Stock,$1.445,-0.095,-6.169%,"233,751,415"
BPRN,"Princeton Bancorp, Inc. Common Stock (PA)",$34.5125,0.3625,1.061%,"233,403,171"
FUNC,First United Corporation Common Stock,$35.92,0.09,0.251%,"233,368,935"
FINW,FinWise Bancorp Common Stock,$17.155,0.635,3.844%,"233,083,630"
GENC,"Gencor Industries, Inc. Common Stock",$15.88,0.38,2.452%,"232,764,308"
BRR,"ProCap Financial, Inc. Common Stock",$2.7763,0.1763,6.781%,"231,606,650"
SNFCA,Security National Financial Corporation Class A Common Stock,$8.90,0.17,1.947%,"231,271,564"
CTEV,Claritev Corporation Class A Common Stock,$13.99,0.42,3.095%,"231,193,760"
PLBY,"Playboy, Inc. Common Stock",$2.145,-0.105,-4.667%,"231,139,563"
FCCO,First Community Corporation Common Stock,$30.00,0.57,1.937%,"230,690,820"
CBNA,"Chain Bridge Bancorp, Inc. Class A Common Stock",$35.145,-0.125,-0.354%,"230,615,058"
KRMD,"KORU Medical Systems, Inc. Common Stock (DE)",$4.97,0.20,4.193%,"230,223,595"
MRBK,Meridian Corporation Common Stock,$19.96,0.40,2.045%,"229,888,422"
MKTW,"MarketWise, Inc. Class A Common Stock",$14.30,0.44,3.175%,"229,218,718"
CLW,Clearwater Paper Corporation Common Stock,$14.29,-0.09,-0.626%,"229,189,951"
VTN,Invesco Trust for Investment Grade New York Municipals Common Stock,$11.7599,0.0199,0.17%,"229,153,164"
LIEN,"Chicago Atlantic BDC, Inc. Common Stock",$10.04,0.02,0.20%,"229,118,724"
CMRC,"Commerce.com, Inc. Series 1 Common Stock",$2.815,0.015,0.536%,"228,756,319"
GDC,GD Culture Group Limited Common Stock,$3.9908,0.6608,19.844%,"228,745,117"
MNTK,"Montauk Renewables, Inc. Common Stock",$1.605,0.065,4.221%,"228,321,870"
LANV,Lanvin Group Holdings Limited Ordinary Shares,$1.63,UNCH,--,"227,834,561"
MFM,MFS Municipal Income Trust Common Stock,$5.53,-0.02,-0.36%,"227,767,599"
SRZN,"Surrozen, Inc. Common Stock",$26.56,-0.44,-1.63%,"227,656,942"
INV,"Innventure, Inc. Common Stock",$3.36,0.08,2.439%,"227,627,726"
VENU,Venu Holding Corporation Common Stock,$5.305,-0.085,-1.577%,"227,306,210"
WAVE,Eco Wave Power Global AB (publ) American Depositary Shares,$4.845,0.075,1.572%,"226,425,474"
PRHIZ,"Presurance Holdings, Inc. 9.75% Senior Unsecured Notes due 2028",$18.50,UNCH,--,"226,123,299"
OSS,"One Stop Systems, Inc. Common Stock",$9.22,0.02,0.217%,"226,032,827"
III,Information Services Group Inc. Common Stock,$4.72,0.10,2.165%,"226,012,971"
CAN,Canaan Inc. American Depositary Shares,$0.5371,0.0394,7.916%,"225,723,558"
SRI,"Stoneridge, Inc. Common Stock",$8.055,0.105,1.321%,"225,676,379"
CNTX,Context Therapeutics Inc. Common Stock,$2.455,-0.025,-1.008%,"225,563,380"
RILY,"BRC Group Holdings, Inc. Common Stock",$7.22,0.25,3.587%,"225,398,797"
HITI,High Tide Inc. Common Shares,$2.58,0.02,0.781%,"224,655,770"
WALD,Waldencast plc Class A Ordinary Share,$1.75,-0.01,-0.568%,"224,072,123"
SND,"Smart Sand, Inc. Common Stock",$5.14,-0.18,-3.383%,"223,815,091"
TPVG,TriplePoint Venture Growth BDC Corp. Common Stock,$5.54,-0.04,-0.717%,"223,814,875"
BLZE,"Backblaze, Inc. Class A Common Stock",$3.875,0.115,3.059%,"223,587,500"
RGCO,RGC Resources Inc. Common Stock,$21.43,0.16,0.752%,"222,753,856"
INSG,Inseego Corp. Common Stock,$13.73,0.18,1.328%,"222,685,964"
SMWB,Similarweb Ltd. Ordinary Shares,$2.685,0.045,1.705%,"222,397,014"
LODE,Comstock Inc. Common Stock,$3.115,-0.015,-0.479%,"222,323,369"
AMPY,Amplify Energy Corp. Common Stock,$5.475,0.015,0.275%,"221,606,084"
ENGNW,enGene Holdings Inc. Warrants,$3.30,0.03,0.917%,"221,065,238"
WW,"WW International, Inc.  Common Stock",$22.135,1.515,7.347%,"221,060,651"
EICA,Eagle Point Income Company Inc. 5.00% Series A Term Preferred Stock due 2026,$24.78,UNCH,--,"220,742,916"
ASPN,"Aspen Aerogels, Inc. Common Stock",$2.665,-0.895,-25.14%,"220,254,471"
INSE,"Inspired Entertainment, Inc. Common Stock",$8.17,0.13,1.617%,"219,992,512"
HKD,AMTD Digital Inc. American Depositary Shares (every five of which represent two Class A Ordinary Shares),$1.74,0.05,2.959%,"219,525,310"
PROF,Profound Medical Corp. Common Stock,$7.295,0.145,2.028%,"219,140,407"
SMHI,SEACOR Marine Holdings Inc. Common Stock ,$8.105,0.145,1.822%,"218,642,579"
ZIP,"ZipRecruiter, Inc. Class A Common Stock",$2.55,0.04,1.594%,"218,176,569"
ACB,Aurora Cannabis Inc. Common Shares,$3.845,0.055,1.451%,"218,047,735"
PRE,Prenetics Global Limited Class A Ordinary Share,$16.72,0.82,5.157%,"217,928,162"
QSI,Quantum-Si Incorporated Class A Common Stock,$1.01,0.0798,8.579%,"217,644,562"
GPJA,"Georgia Power Company Series 2017A 5.00% Junior Subordinated Notes due October 1, 2077",$23.42,UNCH,--,"216,904,330"
PEBK,"Peoples Bancorp of North Carolina, Inc. Common Stock",$39.36,0.97,2.527%,"214,883,598"
RENT,"Rent the Runway, Inc. Class A Common Stock",$6.39,-0.04,-0.622%,"214,362,793"
VABK,Virginia National Bankshares Corporation Common Stock,$39.7434,0.0034,0.009%,"214,341,681"
XYF,"X Financial American Depositary Shares, each representing six Class A Ordinary Shares",$5.07,-0.04,-0.783%,"214,001,628"
ALTG,Alta Equipment Group Inc. Class A Common Stock,$6.63,-0.28,-4.052%,"213,719,926"
PAMT,PAMT CORP Common Stock,$10.21,-0.04,-0.39%,"213,654,664"
AUDC,AudioCodes Ltd. Common Stock,$7.245,-0.07,-0.957%,"213,532,559"
UTMD,"Utah Medical Products, Inc. Common Stock",$66.52,-0.20,-0.30%,"213,108,261"
FLWS,"1-800-FLOWERS.COM, Inc. Common Stock",$3.325,0.015,0.453%,"213,018,802"
NAMM,Namib Minerals Ordinary Shares,$3.9575,0.4475,12.749%,"212,428,425"
INBKZ,First Internet Bancorp 6.0% Fixed-to-Floating Rate Subordinated Notes Due 2029,$24.36,0.01,0.041%,"212,250,970"
PZG,Paramount Gold Nevada Corp. Common Stock,$2.525,-0.145,-5.431%,"211,628,436"
ANTA,Antalpha Platform Holding Company Class A Ordinary Shares,$8.9107,0.2207,2.54%,"211,120,101"
OVID,Ovid Therapeutics Inc. Common Stock,$1.6216,0.1116,7.391%,"211,106,947"
GTE,Gran Tierra Energy Inc. Common Stock,$5.97,-0.21,-3.398%,"210,675,240"
PAL,"Proficient Auto Logistics, Inc. Common Stock",$7.54,0.07,0.937%,"209,838,479"
BHR,Braemar Hotels & Resorts Inc. Common Stock,$3.075,0.005,0.163%,"209,774,753"
RNAC,"Cartesian Therapeutics, Inc. Common Stock",$8.04,0.49,6.49%,"209,068,992"
FT,Franklin Universal Trust Common Stock,$8.27,0.02,0.242%,"207,840,763"
AGL,"agilon health, inc. Common Stock",$0.50,0.106,26.904%,"207,434,880"
TCX,Tucows Inc. Class A Common Stock,$18.675,0.185,1.001%,"207,365,687"
MPAA,"Motorcar Parts  of America, Inc. Common Stock",$10.79,0.14,1.315%,"207,286,194"
KLTR,"Kaltura, Inc. Common Stock",$1.325,0.095,7.724%,"207,142,758"
TRVG,trivago N.V. American Depositary Shares,$2.944,0.064,2.222%,"206,984,706"
GALT,Galectin Therapeutics Inc. Common Stock,$3.21,0.05,1.582%,"206,957,662"
OVBC,Ohio Valley Banc Corp. Common Stock,$43.845,0.335,0.77%,"206,553,839"
EDIT,"Editas Medicine, Inc. Common Stock",$2.115,0.005,0.237%,"206,463,466"
STXS,"Stereotaxis, Inc. Common Stock",$2.21,0.11,5.238%,"206,247,726"
AOMR,"Angel Oak Mortgage REIT, Inc. Common Stock",$8.27,-0.07,-0.839%,"206,039,069"
ETX           ,Eaton Vance Municipal Income 2028 Term Trust Common Shares of Beneficial Interest,$18.86,0.11,0.587%,"205,290,270"
TFSA,"Terra Income Fund 6, LLC 7.00% Notes due 2026",$24.25,-0.27,-1.101%,"204,643,058"
FLYX,"flyExclusive, Inc. Class A Common Stock",$2.185,0.015,0.691%,"204,014,274"
MOLN,Molecular Partners AG American Depositary Shares,$5.0501,0.0301,0.60%,"203,837,666"
ASUR,"Asure Software, Inc Common Stock",$7.335,0.345,4.936%,"203,648,038"
SNWV,"SANUWAVE Health, Inc. Common Stock",$23.72,UNCH,--,"203,426,610"
AHMA,Ambitions Enterprise Management Co. L.L.C Class A Ordinary Shares,$6.8809,-0.1191,-1.701%,"202,986,550"
FOA,Finance of America Companies Inc. Class A Common Stock,$20.00,0.71,3.681%,"202,961,740"
ATLX,Atlas Lithium Corporation Common Stock,$5.70,0.55,10.68%,"202,595,642"
SWKH,SWK Holdings Corporation Common Stock,$16.72,0.06,0.36%,"202,243,548"
CRNT,Ceragon Networks Ltd. Ordinary Shares,$2.27,-0.02,-0.873%,"201,664,709"
BMEZ,BlackRock Health Sciences Term Trust Common Shares of Beneficial Interest,$15.1234,0.0434,0.288%,"201,640,564"
OPBK,OP Bancorp Common Stock,$13.53,0.25,1.883%,"201,402,357"
OSUR,"OraSure Technologies, Inc. Common Stock",$2.805,-0.015,-0.532%,"201,212,552"
SGMT,Sagimet Biosciences Inc. Series A Common Stock,$6.18,0.26,4.392%,"200,983,482"
MPV,Barings Participation Investors Common Stock,$18.952,-0.018,-0.095%,"200,923,418"
NLOP,Net Lease Office Properties Common Shares of Beneficial Interest,$13.555,0.165,1.232%,"200,804,787"
