Symbol,Name,Last Sale,Net Change,% Change,Market Cap
RAIN,"Rain Enhancement Technologies Holdco, Inc. Class A Common Stock",$3.50,-0.045,-1.269%,"28,660,916"
PTN,"Palatin Technologies, Inc. Common Stock",$16.81,-0.39,-2.267%,"28,621,967"
SAFX,"XCF Global, Inc. Class A Common Stock",$0.1373,-0.0296,-17.735%,"28,602,823"
NVNI,Nvni Group Limited Ordinary Shares,$2.85,-0.07,-2.397%,"28,593,104"
AMOD,"Alpha Modus Holdings, Inc. Class A Common Stock",$0.68,-0.0096,-1.392%,"28,532,771"
TBHC,"The Brand House Collective, Inc. Common Stock",$1.27,0.01,0.794%,"28,525,956"
ORIO,Orion Digital Corp. Common Shares,$1.19,0.02,1.709%,"28,522,575"
CREG,Smart Powerr Corp. Common Stock,$1.37,-0.01,-0.725%,"28,508,499"
SER,"Serina Therapeutics, Inc. Common Stock",$2.67,0.21,8.537%,"28,473,051"
PLUR,Pluri Inc. Common Stock,$3.07,-0.1668,-5.153%,"28,409,464"
HOWL,"Werewolf Therapeutics, Inc. Common Stock",$0.5843,0.0129,2.258%,"28,362,039"
KITT,"Nauticus Robotics, Inc. Common stock",$1.01,0.12,13.483%,"28,336,077"
FOXX,Foxx Development Holdings Inc. Common Stock,$4.12,0.03,0.733%,"28,331,234"
VNTG,Vantage Corp Class A Ordinary Shares,$0.891,-0.019,-2.088%,"28,278,113"
CLPS,CLPS Incorporation Common Stock,$0.9488,0.0088,0.936%,"28,220,587"
BOLD,"Boundless Bio, Inc. Common Stock",$1.26,0.02,1.613%,"28,205,870"
DTCX,"Datacentrex, Inc. Common Stock",$1.70,-0.20,-10.526%,"28,120,281"
AYTU,"Aytu BioPharma, Inc.  Common Stock",$2.75,0.12,4.563%,"28,017,572"
JUNS,"Jupiter Neurosciences, Inc. Common Stock",$0.8101,-0.115,-12.431%,"27,888,790"
AFRIW,Forafric Global PLC Warrants,$1.03,UNCH,--,"27,708,640"
VTGN,"Vistagen Therapeutics, Inc. Common Stock",$0.7015,0.0159,2.319%,"27,706,059"
RYDE,Ryde Group Ltd. Class A Ordinary Shares,$0.313,0.01,3.30%,"27,640,350"
AHT,Ashford Hospitality Trust Inc Common Stock,$4.29,0.32,8.06%,"27,505,472"
SCYX,"SCYNEXIS, Inc. Common Stock",$0.6535,-0.0073,-1.105%,"27,424,165"
CCEL,"Cryo-Cell International, Inc. Common Stock",$3.39,-0.015,-0.441%,"27,306,959"
FEDU,"Four Seasons Education (Cayman) Inc. American Depositary Shares, each ADS representing 10 ordinary shares",$12.07,UNCH,--,"27,278,900"
QNTM,Quantum Biopharma Ltd. Class B Subordinate Voting Shares,$7.01,-0.42,-5.653%,"26,938,974"
CVV,CVD Equipment Corporation Common Stock,$3.86,-0.41,-9.602%,"26,778,125"
NYC,American Strategic Investment Co. Class A Common Stock,$10.00,0.52,5.485%,"26,729,430"
PSHG,Performance Shipping Inc. Common Shares,$2.15,0.04,1.896%,"26,729,140"
SPWRW,SunPower Inc. Warrants,$0.248,-0.042,-14.483%,"26,690,075"
DSY,Big Tree Cloud Holdings Limited Ordinary Shares,$0.28,-0.0065,-2.269%,"26,610,484"
BBLGW,Bone Biologics Corp Warrants,$14.70,UNCH,--,"26,390,322"
KMRK,K-Tech Solutions Company Limited Class A Ordinary Shares,$1.25,-0.10,-7.407%,"26,375,000"
SPHL,Springview Holdings Ltd Class A Ordinary Shares,$2.25,-0.13,-5.462%,"26,217,459"
HUMAW,"Humacyte, Inc. Warrant",$0.1249,-0.0039,-3.028%,"26,189,377"
GREE,Greenidge Generation Holdings Inc. Class A Common Stock,$1.65,0.03,1.852%,"26,068,345"
BNAI,Brand Engagement Network Inc. Common Stock,$5.80,2.19,60.665%,"26,030,864"
YYAI,AiRWA Inc. Common Stock,$1.37,0.11,8.73%,"26,004,703"
NOTE,"FiscalNote Holdings, Inc. Class A common stock",$1.65,0.08,5.096%,"25,921,327"
ZJYL,JIN MEDICAL INTERNATIONAL LTD. Ordinary Shares,$0.165,-0.0758,-31.478%,"25,830,272"
RECT,Rectitude Holdings Ltd Ordinary Shares,$1.78,0.05,2.89%,"25,810,000"
EPOW,"Sunrise New Energy Co., Ltd Class A Ordinary Shares",$0.948,0.013,1.39%,"25,583,629"
INTS,"Intensity Therapeutics, Inc. Common stock",$0.425,0.0071,1.699%,"25,527,610"
VEEA,Veea Inc. Common Stock,$0.505,-0.0382,-7.032%,"25,331,140"
BRLS,Borealis Foods Inc. Class A Common Shares,$1.18,-0.18,-13.235%,"25,326,701"
WCT,Wellchange Holdings Company Limited Class A Ordinary shares,$0.1647,-0.0005,-0.303%,"25,242,746"
RDI,Reading International Inc Class A Common Stock,$1.11,0.02,1.835%,"25,216,159"
HBIO,"Harvard Bioscience, Inc. Common Stock",$0.565,-0.0266,-4.496%,"25,187,511"
XOS,"Xos, Inc. Common Stock",$2.22,-0.04,-1.77%,"25,161,906"
BAFN,BayFirst Financial Corp. Common Stock,$6.12,-0.08,-1.29%,"25,153,218"
SAGT,SAGTEC GLOBAL LIMITED Class A Ordinary shares,$2.00,0.16,8.696%,"25,100,000"
MBNKO,"Medallion Bank Fixed-Rate Reset Non-Cumulative Perpetual Preferred Stock, Series G, par value $1.00 per share",$25.06,-0.05,-0.199%,"25,060,000"
MNDO,MIND C.T.I. Ltd. Ordinary Shares,$1.23,UNCH,--,"25,050,581"
PRZO,ParaZero Technologies Ltd. Ordinary Shares,$1.50,0.12,8.696%,"25,019,447"
TOPS,"TOP Ships, Inc. Common Stock",$5.402,0.192,3.685%,"24,990,716"
MKDW,MKDWELL Tech Inc. Ordinary Share,$0.173,0.005,2.976%,"24,846,146"
NNVC,"NanoViricides, Inc. Common Stock",$1.15,-0.05,-4.167%,"24,803,693"
TXMD,"TherapeuticsMD, Inc. Common Stock",$2.14,0.04,1.905%,"24,769,135"
SWVL,Swvl Holdings Corp Class A Common Shares,$2.50,-0.07,-2.724%,"24,746,290"
ADGM,"Adagio Medical Holdings, Inc Common Stock",$0.8789,-0.0031,-0.351%,"24,460,960"
PFAI,Pinnacle Food Group Limited Class A Common Shares,$2.08,-0.06,-2.804%,"24,336,000"
AUST,Austin Gold Corp. Common Shares,$1.7706,0.0006,0.034%,"24,244,828"
ANGH,Anghami Inc. Ordinary Shares,$3.61,-0.05,-1.366%,"24,146,254"
CHOW,ChowChow Cloud International Holdings Limited Ordinary Shares,$0.6878,-0.0485,-6.587%,"24,141,780"
WNW,Meiwu Technology Company Limited Ordinary Shares,$1.54,-0.02,-1.282%,"24,090,764"
PLRZ,Polyrizon Ltd. Ordinary Shares,$15.10,1.27,9.183%,"24,068,585"
BTOC,Armlogi Holding Corp. Common Stock,$0.5271,-0.0034,-0.641%,"23,953,047"
PLAG,Planet Green Holdings Corp. Common Stock,$2.55,-0.05,-1.923%,"23,925,921"
NINE,"Nine Energy Service, Inc. Common Stock",$0.55,0.0761,16.058%,"23,848,736"
REE,REE Automotive Ltd. Class A Ordinary Shares,$0.768,-0.0158,-2.016%,"23,824,076"
NIXX,"Nixxy, Inc. Common Stock",$0.9556,0.027,2.908%,"23,771,102"
ASTI,"Ascent Solar Technologies, Inc. Common Stock",$5.23,0.11,2.148%,"23,729,634"
UTSI,UTStarcom Holdings Corp. Ordinary Shares,$2.50,0.10,4.167%,"23,675,638"
ARKR,Ark Restaurants Corp. Common Stock,$6.4832,-0.0368,-0.564%,"23,379,437"
AGPU,Axe Compute Inc. Common Stock,$6.8601,-0.3499,-4.853%,"23,279,859"
EVGOW,EVgo Inc. Warrants,$0.0748,0.0048,6.857%,"23,037,108"
TLF,"Tandy Leather Factory, Inc. Common Stock",$2.85,0.07,2.518%,"22,992,381"
HUIZ,Huize Holding Limited American Depositary Shares,$2.26,0.05,2.262%,"22,800,182"
MLSS,"Milestone Scientific, Inc. Common Stock",$0.2895,0.0027,0.941%,"22,763,070"
COOT,Australian Oilseeds Holdings Limited Ordinary Shares,$0.815,0.005,0.617%,"22,737,308"
BAERW,"Bridger Aerospace Group Holdings, Inc. Warrant",$0.4089,-0.0131,-3.104%,"22,711,575"
IRIX,IRIDEX Corporation Common Stock,$1.32,-0.06,-4.348%,"22,690,775"
JOB,GEE Group Inc. Common Stock,$0.2061,-0.0005,-0.242%,"22,672,179"
FBLG,"FibroBiologics, Inc. Common Stock",$0.3402,0.0018,0.532%,"22,630,009"
EBON,Ebang International Holdings Inc. Class A Ordinary Shares,$3.4562,0.0462,1.355%,"22,617,159"
HHS,"Harte Hanks, Inc. Common Stock",$3.04,0.04,1.333%,"22,540,974"
MVO,MV Oil Trust Units of Beneficial Interests,$1.96,-0.44,-18.333%,"22,540,000"
OPTXW,"Syntec Optics Holdings, Inc. Warrant",$0.61,0.10,19.608%,"22,521,338"
NSYS,Nortech Systems Incorporated Common Stock,$8.08,0.175,2.214%,"22,511,963"
FENG,"Phoenix New Media Limited American Depositary Shares, each representing 48 Class A ordinary shares.",$1.87,-0.04,-2.094%,"22,460,151"
AIIOW,Robo.ai Inc. Warrant,$0.0606,-0.0017,-2.729%,"22,443,115"
JVA,"Coffee Holding Co., Inc. Common Stock",$3.92,0.05,1.292%,"22,377,708"
LGPS,LogProstyle Inc. Common Shares,$0.945,0.01,1.07%,"22,351,244"
VRAR,"The Glimpse Group, Inc. Common Stock",$1.06,-0.01,-0.935%,"22,341,096"
JL,J-Long Group Limited Class A Ordinary Shares,$5.93,-0.3158,-5.056%,"22,306,887"
GTEC,Greenland Technologies Holding Corporation Ordinary Shares,$1.28,0.25,24.272%,"22,264,609"
IDAI,T Stamp Inc. Class A Common Stock,$4.24,-0.02,-0.469%,"22,233,848"
MXC,Mexco Energy Corporation Common Stock,$10.80,-0.09,-0.826%,"22,096,800"
TJGC,TJGC Group Limited Ordinary Shares,$1.44,UNCH,--,"22,032,000"
KLTO,"Klotho Neurosciences, Inc. Common Stock",$0.3019,-0.0194,-6.038%,"21,898,836"
APLM,Apollomics Inc. Class A Ordinary Shares,$19.82,-0.89,-4.297%,"21,868,357"
YHC,LQR House Inc. Common Stock,$1.02,-0.09,-8.108%,"21,799,089"
NEUP,Neuphoria Therapeutics Inc. Common Stock,$4.04,-0.13,-3.118%,"21,724,409"
FIEE,"FiEE, Inc Common Stock",$3.44,-0.02,-0.578%,"21,658,106"
ALUR,"Allurion Technologies, Inc. Common Stock",$1.755,0.035,2.035%,"21,569,361"
RVP,"Retractable Technologies, Inc. Common Stock",$0.72,-0.02,-2.703%,"21,554,754"
PIII,P3 Health Partners Inc. Class A Common Stock,$2.98,-0.06,-1.974%,"21,472,655"
CETX,Cemtrex Inc. Common Stock,$2.495,0.185,8.009%,"21,458,377"
NCEW,New Century Logistics (BVI) Limited Ordinary Shares,$7.95,0.55,7.432%,"21,365,625"
CLGN,CollPlant Biotechnologies Ltd Ordinary Shares,$1.67,0.03,1.829%,"21,336,563"
EONR,EON Resources Inc. Class A Common Stock,$0.4256,0.0006,0.141%,"21,266,527"
EKSO,"Ekso Bionics Holdings, Inc. Common Stock",$8.10,-0.12,-1.46%,"21,248,187"
CISO,"CISO Global, Inc. Common Stock",$0.4796,0.0143,3.073%,"21,124,626"
SLAI,SOLAI Limited American Depositary Shares (each representing one hundred (100) Class A Ordinary Shares),$1.13,-0.01,-0.877%,"21,106,745"
SCNX,"Scienture Holdings, Inc. Common Stock",$0.5151,-0.0243,-4.505%,"20,928,933"
NOTV,"Inotiv, Inc. Common Stock",$0.608,0.0099,1.655%,"20,895,289"
WETH,Wetouch Technology Inc. Common Stock,$1.75,UNCH,--,"20,880,185"
APUS,"Apimeds Pharmaceuticals US, Inc. Common Stock",$1.66,-0.05,-2.924%,"20,876,132"
FATBB,FAT Brands Inc. Class B Common Stock,$1.16,0.01,0.87%,"20,809,617"
CYN,Cyngn Inc. Common Stock,$2.60,0.04,1.563%,"20,733,388"
MYND,"Mynd.ai, Inc. American Depositary Shares",$0.4501,-0.0119,-2.576%,"20,546,067"
SQFTP,"Presidio Property Trust, Inc. 9.375% Series D Cumulative Redeemable Perpetual Preferred Stock, $0.01 par value per share",$14.27,-0.11,-0.765%,"20,535,943"
BATL,Battalion Oil Corporation Common Stock,$1.24,0.03,2.479%,"20,406,138"
SGRP,"SPAR Group, Inc. Common Stock",$0.8488,-0.0308,-3.502%,"20,328,752"
LRE,"Lead Real Estate Co., Ltd American Depositary Shares",$1.49,-0.08,-5.096%,"20,326,431"
KTTA,Pasithea Therapeutics Corp. Common Stock,$0.88,0.0045,0.514%,"20,320,135"
LIMN,"Liminatus Pharma, Inc. Class A Common Stock",$0.75,-0.0089,-1.173%,"20,298,475"
CTRM,Castor Maritime Inc. Common Shares,$2.10,-0.05,-2.326%,"20,290,943"
ELAB,PMGC Holdings Inc. Common Stock,$3.56,-0.46,-11.443%,"20,210,551"
VBIX,Viewbix Inc. Common Stock,$1.89,0.13,7.386%,"20,167,041"
HCTI,"Healthcare Triangle, Inc. Common Stock",$0.4441,-0.0281,-5.951%,"20,138,597"
MSGM,Motorsport Games Inc. Class A Common Stock,$3.48,0.16,4.819%,"20,109,006"
NTRBW,Nutriband Inc. Warrant,$1.65,UNCH,--,"20,088,557"
IZM,ICZOOM Group Inc. Class A Ordinary Shares,$1.67,0.27,19.286%,"20,070,244"
BCAB,"BioAtla, Inc. Common Stock",$0.339,0.0308,9.994%,"19,930,518"
GYRO,"Gyrodyne, LLC Common Stock",$9.0606,UNCH,--,"19,927,050"
QCLS,"Q/C Technologies, Inc. Common Stock",$4.77,0.26,5.765%,"19,875,445"
COCH,"Envoy Medical, Inc. Class A Common Stock",$0.6853,UNCH,--,"19,829,128"
MWYN,"Marwynn Holdings, Inc. Common stock",$0.981,0.006,0.615%,"19,811,103"
NWGL,CL Workshop Group Limited American Depositary Shares,$1.19,-0.03,-2.459%,"19,698,266"
CVKD,"Cadrenal Therapeutics, Inc. Common Stock",$8.40,-0.27,-3.114%,"19,640,267"
DLPN,"Dolphin Entertainment, Inc. Common Stock",$1.62,-0.04,-2.41%,"19,638,324"
TSE,Trinseo PLC Ordinary Shares ,$0.541,-0.0449,-7.663%,"19,472,532"
EQS,"Equus Total Return, Inc. Common Stock",$1.39,-0.04,-2.797%,"19,413,707"
EHLD,Euroholdings Ltd. Common Stock ,$6.87,-0.01,-0.145%,"19,350,145"
NCT,Intercont (Cayman) Limited Ordinary shares,$0.2133,0.0011,0.518%,"19,154,697"
ALLR,"Allarity Therapeutics, Inc. Common Stock",$1.21,UNCH,--,"19,120,537"
RVSN,Rail Vision Ltd. Ordinary Share,$0.3232,-0.0308,-8.701%,"19,089,832"
FATBP,FAT Brands Inc. 8.25% Series B Cumulative Preferred Stock,$1.06,-0.07,-6.195%,"19,015,685"
CKX,"CKX Lands, Inc. Common Stock",$9.25,0.02,0.217%,"18,991,443"
TRSG,Tungray Technologies Inc Class A Ordinary Shares,$1.16,-0.0688,-5.599%,"18,970,043"
TOMZ,"TOMI Environmental Solutions, Inc. Common Stock",$0.78,UNCH,--,"18,929,214"
OSRH,"OSR Holdings, Inc. Common Stock",$0.7341,-0.0078,-1.051%,"18,846,394"
VVOS,"Vivos Therapeutics, Inc. Common Stock",$2.09,0.14,7.179%,"18,785,142"
VYNE,VYNE Therapeutics Inc. Common Stock,$0.5666,0.0012,0.212%,"18,722,515"
ELOG,Eastern International Ltd. Ordinary Shares,$1.54,0.05,3.356%,"18,506,180"
ELWS,"Earlyworks Co., Ltd. American Depositary Shares",$6.06,-0.02,-0.329%,"18,486,454"
LSTA,"Lisata Therapeutics, Inc. Common Stock",$2.08,-0.05,-2.347%,"18,347,125"
LGCB,Linkage Global Inc. Class A Ordinary Shares,$1.63,-0.04,-2.395%,"18,199,801"
GAUZ,Gauzy Ltd. Ordinary Shares,$0.97,-0.07,-6.731%,"18,179,830"
WKSP,"Worksport, Ltd. Common Stock",$2.20,-0.10,-4.348%,"18,159,656"
HUDI,"Huadi International Group Co., Ltd. Ordinary Shares",$1.27,0.08,6.723%,"18,134,561"
NXPL,NextPlat Corp Common Stock,$0.6874,0.0174,2.597%,"18,082,048"
CCM,Concord Medical Services Holdings Limited American Depositary Shares (Each represents thirty (30) Class A ordinary shares),$4.14,-0.56,-11.915%,"17,974,733"
CTXR,"Citius Pharmaceuticals, Inc. Common Stock",$0.8628,0.0056,0.653%,"17,914,245"
BGI,Birks Group Inc. Common Stock,$0.9142,0.0014,0.153%,"17,913,463"
KAPA,"Kairos Pharma, Ltd. Common Stock",$0.86,0.0399,4.865%,"17,906,364"
TC,Token Cat Limited American Depositary Shares,$8.97,0.32,3.699%,"17,830,378"
IMG,CIMG Inc. Common Stock,$1.15,0.03,2.679%,"17,806,079"
LIQT,"LiqTech International, Inc. Common Stock",$1.845,0.025,1.374%,"17,761,933"
TMDE,TMD Energy Limited Ordinary Shares,$0.7535,-0.0606,-7.444%,"17,756,228"
KALA,"KALA BIO, Inc. Common Stock",$0.6327,0.0236,3.875%,"17,620,521"
PMN,ProMIS Neurosciences Inc. Common Shares (ON),$8.14,-0.02,-0.245%,"17,520,894"
SNYR,Synergy CHC Corp. Common Stock,$1.82,UNCH,--,"17,387,741"
FTRK,FAST TRACK GROUP Ordinary shares,$0.797,0.026,3.372%,"17,384,563"
LEXX,Lexaria Bioscience Corp. Common Stock,$0.782,-0.027,-3.337%,"17,380,612"
BTOG,Bit Origin Limited Class A Ordinary Shares,$0.1957,0.0054,2.838%,"17,341,079"
RENX,RenX Enterprises Corp. Common Stock,$0.1732,-0.0091,-4.992%,"17,311,834"
ECXWW,ECARX Holdings Inc. Warrants,$0.05,-0.005,-9.091%,"17,286,501"
ITRM,Iterum Therapeutics plc Ordinary Share,$0.326,-0.01,-2.976%,"17,224,276"
MDCXW,Medicus Pharma Ltd. Warrant,$0.82,0.0028,0.343%,"17,196,320"
HUBC,Hub Cyber Security Ltd. Ordinary Shares,$0.3495,-0.1868,-34.831%,"17,053,783"
HIND,"Vyome Holdings, Inc. Common Stock",$3.02,-0.09,-2.894%,"17,046,372"
CLIK,Click Holdings Limited Class A Ordinary Share,$5.22,0.18,3.571%,"17,033,032"
CSAI,"Cloudastructure, Inc. Class A Common Stock",$0.8679,-0.0421,-4.626%,"16,993,926"
RDZNW,"Roadzen, Inc. Warrants",$0.21,-0.0255,-10.828%,"16,694,491"
COSM,Cosmos Health Inc. Common Stock,$0.4458,-0.0218,-4.662%,"16,687,418"
IPM,Intelligent Protection Management Corp. Common Stock ,$1.82,UNCH,--,"16,536,027"
SOPA,Society Pass Incorporated Common Stock,$2.69,0.27,11.157%,"16,423,862"
MOGU,MOGU Inc. American Depositary Shares (each  representing 25 Class A Ordinary Shares),$2.00,UNCH,--,"16,347,282"
LEDS,SemiLEDS Corporation Common Stock,$1.9769,0.0369,1.902%,"16,262,282"
GIGM,GigaMedia Limited Ordinary Shares,$1.47,UNCH,--,"16,246,785"
HOTH,"Hoth Therapeutics, Inc. Common Stock",$1.045,-0.005,-0.476%,"16,212,456"
MSAI,"MultiSensor AI Holdings, Inc. Common Stock",$0.3052,-0.0085,-2.71%,"16,137,281"
AIRI,Air Industries Group Common Stock,$3.36,0.02,0.599%,"16,046,611"
TBLAW,Taboola.com Ltd. Warrant,$0.0555,-0.0244,-30.538%,"15,996,397"
COCP,"Cocrystal Pharma, Inc. Common Stock",$1.16,0.07,6.422%,"15,989,515"
CLRB,"Cellectar Biosciences, Inc.  Common Stock",$3.745,-0.295,-7.302%,"15,879,302"
USEA,United Maritime Corporation Common Stock,$1.79,0.09,5.294%,"15,831,238"
NAII,"Natural Alternatives International, Inc. Common Stock",$4.75,0.21,4.626%,"15,808,608"
CASI,"CASI Pharmaceuticals, Inc. Ordinary Shares",$1.02,-0.02,-1.923%,"15,802,535"
BNGO,"Bionano Genomics, Inc. Common Stock",$1.55,-0.03,-1.899%,"15,772,800"
WETO,Webus International Limited Ordinary Shares,$0.712,-0.0255,-3.458%,"15,664,000"
RMCF,"Rocky Mountain Chocolate Factory, Inc. Common Stock",$1.99,-0.15,-7.009%,"15,523,011"
PT,Pintec Technology Holdings Limited American Depositary Shares,$0.9675,-0.0086,-0.881%,"15,429,651"
IPST,"Heritage Distilling Holding Company, Inc. Common Stock",$1.61,-0.08,-4.734%,"15,390,507"
EDTK,Skillful Craftsman Education Technology Limited Ordinary Share,$0.965,0.015,1.579%,"15,371,920"
WVVIP,"Willamette Valley Vineyards, Inc. Series A Redeemable Preferred Stock",$3.0916,0.0056,0.181%,"15,348,338"
TOPP,Toppoint Holdings Inc. Common Stock,$0.7895,0.0595,8.151%,"15,316,300"
FTEL,Fitell Corporation Class A Ordinary Shares,$3.02,-0.05,-1.629%,"15,208,131"
HOVRW,New Horizon Aircraft Ltd. Warrant,$0.3499,-0.0401,-10.282%,"15,169,981"
ELSE,"Electro-Sensors, Inc. Common Stock",$4.3501,-0.0249,-0.569%,"15,140,614"
SNSE,"Sensei Biotherapeutics, Inc. Common Stock",$11.98,0.22,1.871%,"15,110,254"
MGIH,Millennium Group International Holdings Limited Ordinary Shares,$1.34,0.02,1.515%,"15,075,000"
BCDA,"BioCardia, Inc. Common Stock",$1.42,0.03,2.158%,"15,070,082"
XAIR,"Beyond Air, Inc. Common Stock",$1.88,-0.31,-14.155%,"15,057,837"
EVTV,"Envirotech Vehicles, Inc. Common Stock",$3.10,-0.42,-11.932%,"14,971,497"
INBS,Intelligent Bio Solutions Inc. Common Stock,$15.60,-1.07,-6.419%,"14,968,715"
SBDS,"Solo Brands, Inc. Class A Common Stock",$6.02,-0.11,-1.794%,"14,900,421"
PMNT,Perfect Moment Ltd. Common Stock,$0.4226,-0.0078,-1.812%,"14,884,789"
LSH,Lakeside Holding Limited Common Stock,$0.854,0.0278,3.365%,"14,883,135"
BMGL,Basel Medical Group Ltd Ordinary Shares,$0.79,0.0622,8.546%,"14,840,743"
SINT,"SiNtx Technologies, Inc. Common Stock",$3.69,-0.095,-2.51%,"14,832,416"
DLXY,Delixy Holdings Limited Ordinary Shares,$0.904,0.074,8.916%,"14,780,400"
CETY,"Clean Energy Technologies, Inc. Common Stock",$0.9167,0.1457,18.898%,"14,768,846"
INTJ,Intelligent Group Limited Class A Ordinary Shares ,$0.4802,-0.0127,-2.577%,"14,766,150"
GRNQ,Greenpro Capital Corp. Common Stock,$1.76,0.05,2.924%,"14,741,431"
BNKK,"Bonk, Inc. Common Stock",$2.78,0.10,3.731%,"14,732,115"
SAIH,SAIHEAT Limited Class A Ordinary Shares,$8.40,-0.70,-7.692%,"14,724,780"
ENGS,Energys Group Limited Ordinary Shares,$1.03,UNCH,--,"14,716,496"
UHGWW,"United Homes Group, Inc. Warrant",$0.25,-0.08,-24.242%,"14,703,410"
WVVI,"Willamette Valley Vineyards, Inc. Common Stock",$2.933,0.083,2.912%,"14,560,964"
MTEX,"Mannatech, Incorporated Common Stock",$7.6001,0.0101,0.133%,"14,447,258"
BRN,"Barnwell Industries, Inc. Common Stock",$1.15,0.01,0.877%,"14,418,774"
MDRR,"Medalist Diversified REIT, Inc. Common Stock",$12.96,-0.08,-0.613%,"14,416,769"
APLT,"Applied Therapeutics, Inc. Common Stock",$0.0999,-0.0008,-0.794%,"14,415,637"
MSW,Ming Shing Group Holdings Limited Ordinary Shares,$1.11,0.128,13.035%,"14,402,250"
LESL,"Leslie's, Inc. Common Stock",$1.54,-0.15,-8.876%,"14,307,079"
YCBD,"cbdMD, Inc. Common Stock",$1.07,0.03,2.885%,"14,233,357"
ZSPC,"zSpace, Inc. Common stock",$0.489,-0.002,-0.407%,"14,205,483"
CVR,Chicago Rivet & Machine Co. Common Stock,$14.66,0.707,5.067%,"14,163,495"
BON,Bon Natural Life Limited Class A Ordinary Shares,$1.74,0.02,1.163%,"14,144,129"
TRAW,"Traws Pharma, Inc. Common Stock",$1.77,0.16,9.938%,"14,143,835"
SMSI,"Smith Micro Software, Inc. Common Stock",$0.561,0.009,1.63%,"14,140,755"
SFHG,Samfine Creation Holdings Group Limited Class A Ordinary Share,$0.783,0.0038,0.488%,"14,094,000"
NXGL,"NexGel, Inc Common Stock",$1.73,0.06,3.593%,"14,087,620"
TLIH,Ten-League International Holdings Limited Ordinary Shares,$0.479,-0.001,-0.208%,"14,084,680"
AGAE,Allied Gaming & Entertainment Inc. Common Stock,$0.3728,0.0372,11.085%,"14,057,144"
AIFF,"Firefly Neuroscience, Inc. Common Stock",$1.04,-0.01,-0.952%,"14,032,645"
ZCMD,Zhongchao Inc. Class A Ordinary Shares,$0.5497,-0.0189,-3.324%,"13,956,280"
MRM,MEDIROM Healthcare Technologies Inc. American Depositary Share,$1.765,-0.035,-1.944%,"13,946,942"
FTFT,Future FinTech Group Inc. Common Stock,$0.6918,0.0234,3.501%,"13,942,061"
VSEE,"VSee Health, Inc. Common Stock",$0.42,0.0061,1.474%,"13,941,119"
AMS,American Shared Hospital Services Common Stock,$2.13,UNCH,--,"13,936,590"
SNGX,"Soligenix, Inc. Common Stock",$1.38,0.01,0.73%,"13,918,859"
MDAIW,"Spectral AI, Inc. Warrants",$0.4499,0.0179,4.144%,"13,806,934"
LBGJ,Li Bang International Corporation Inc. Class A Ordinary Shares,$0.7362,-0.0338,-4.39%,"13,802,278"
SPPL,SIMPPLE LTD. Ordinary Shares,$3.10,UNCH,--,"13,794,566"
WIMI,WiMi Hologram Cloud Inc. Class B Ordinary Shares,$2.80,-0.02,-0.709%,"13,749,128"
FEBO,Fenbo Holdings Limited Class A Ordinary Shares,$1.24,-0.01,-0.80%,"13,717,500"
NXL,"Nexalin Technology, Inc. Common Stock",$0.7352,0.0552,8.118%,"13,712,906"
MMA,Mixed Martial Arts Group Limited Ordinary Shares,$1.05,UNCH,--,"13,693,269"
TOIIW,"The Oncology Institute, Inc. Warrant",$0.1388,-0.0146,-9.518%,"13,655,330"
UUU,"Universal Safety Products, Inc. Common Stock",$5.835,0.325,5.898%,"13,495,696"
MWG,Multi Ways Holdings Limited Class A Ordinary Shares,$0.2621,-0.0027,-1.02%,"13,453,593"
WLDSW,Wearable Devices Ltd. Warrant,$1.30,UNCH,--,"13,413,928"
AEON,"AEON Biopharma, Inc. Class A Common Stock",$1.1075,0.0175,1.606%,"13,407,286"
CENN,Cenntro Inc. Common Stock,$0.1525,-0.0025,-1.613%,"13,406,707"
AUID,authID Inc. Common Stock,$0.9925,-0.0075,-0.75%,"13,342,912"
JBDI,JBDI Holdings Limited Ordinary Shares,$0.70,0.0272,4.043%,"13,320,345"
VRME,"VerifyMe, Inc. Common Stock",$1.07,-0.03,-2.727%,"13,314,191"
ADXN,Addex Therapeutics Ltd American Depositary Shares,$8.21,-0.59,-6.705%,"13,290,898"
SYBX,"Synlogic, Inc. Common Stock",$1.13,0.01,0.893%,"13,219,778"
SRXH,"SRX Health Solutions, Inc. Common Stock",$0.1898,-0.0123,-6.086%,"13,201,653"
EFOI,"Energy Focus, Inc. Common Stock",$2.30,0.03,1.322%,"13,200,655"
ABTS,Abits Group Inc Ordinary Shares,$5.53,0.03,0.545%,"13,106,869"
MTVA,MetaVia Inc. Common Stock,$5.42,-2.33,-30.065%,"13,064,558"
BNZI,"Banzai International, Inc. Class A Common Stock",$1.40,-0.11,-7.285%,"13,052,178"
TRIB,Trinity Biotech plc American Depositary Shares,$0.70,-0.0036,-0.512%,"13,042,413"
MNTS,Momentus Inc. Class A Common Stock,$9.32,-0.18,-1.895%,"13,021,708"
GRDX,GridAI Technologies Corp. Common Stock,$3.87,-0.08,-2.025%,"13,010,565"
NCRA,"Nocera, Inc. Common Stock",$0.90,-0.0012,-0.133%,"12,936,255"
TKLF,"Tokyo Lifestyle Co., Ltd. American Depositary Shares",$3.04,-0.0796,-2.552%,"12,867,654"
GFAI,"Guardforce AI Co., Limited Ordinary Shares",$0.606,-0.0148,-2.384%,"12,740,258"
IQST,iQSTEL Inc. Common Stock,$2.91,0.25,9.398%,"12,730,732"
WLDS,Wearable Devices Ltd. Ordinary Share,$1.23,0.09,7.895%,"12,691,639"
ZDAI,"DirectBooking Technology Co., Ltd. Ordinary Shares",$0.48,0.085,21.519%,"12,672,000"
TPST,"Tempest Therapeutics, Inc. Common Stock",$2.55,-0.18,-6.593%,"12,564,261"
TIRX,TIAN RUIXIANG Holdings Ltd Class A Ordinary Shares,$0.5133,0.0506,10.936%,"12,504,723"
GELS,Gelteq Limited Ordinary Shares,$1.16,0.3269,39.239%,"12,424,828"
BOLT,"Bolt Biotherapeutics, Inc. Common Stock",$6.45,0.46,7.679%,"12,380,394"
FLYE,"Fly-E Group, Inc. Common Stock",$7.58,-0.34,-4.293%,"12,373,486"
EDUC,Educational Development Corporation Common Stock,$1.44,UNCH,--,"12,359,809"
GTIM,Good Times Restaurants Inc. Common Stock,$1.17,0.03,2.632%,"12,352,738"
TURB,"Turbo Energy, S.A. American Depositary Shares",$1.12,-0.04,-3.448%,"12,339,197"
MOBX,"Mobix Labs, Inc. Class A Common Stock",$0.2254,-0.0146,-6.083%,"12,337,120"
ARTW,"Art's-Way Manufacturing Co., Inc. Common Stock",$2.41,0.05,2.119%,"12,307,470"
CABR,"Caring Brands, Inc. Common Stock",$0.895,-0.0351,-3.774%,"12,294,548"
AKTX,Akari Therapeutics plc ADS,$0.2675,-0.0116,-4.156%,"12,246,511"
EDSA,"Edesa Biotech, Inc. Common Shares",$1.45,-0.03,-2.027%,"12,084,043"
PHIO,Phio Pharmaceuticals Corp. Common Stock,$1.12,-0.06,-5.085%,"12,056,159"
LFWD,Lifeward Ltd. Ordinary Shares,$0.6554,-0.032,-4.655%,"11,989,741"
RMSG,Real Messenger Corporation Ordinary Shares,$1.25,0.0599,5.033%,"11,964,101"
DAIC,"CID HoldCo, Inc. Common Stock",$0.4306,-0.0121,-2.733%,"11,959,192"
SOS,SOS Limited Class A Ordinary Shares,$1.76,-0.01,-0.565%,"11,957,218"
AEVAW,"Aeva Technologies, Inc. Warrants",$0.1989,0.0241,13.787%,"11,949,894"
TAOP,Taoping Inc. Ordinary Shares ,$1.29,-0.06,-4.444%,"11,917,906"
IHT,InnSuites Hospitality Trust Shares of Beneficial Interest,$1.293,-0.017,-1.298%,"11,901,850"
MTEK,Maris-Tech Ltd. Ordinary Shares,$1.49,0.04,2.759%,"11,895,512"
LGVN,Longeveron Inc. Class A Common Stock,$0.5576,0.0094,1.715%,"11,895,214"
FBGL,FBS Global Limited Ordinary Shares,$0.88,0.0454,5.44%,"11,880,000"
CLRO,"ClearOne, Inc. (DE) Common Stock",$6.82,-0.17,-2.432%,"11,827,585"
IMNN,"Imunon, Inc. Common Stock",$3.65,-0.15,-3.947%,"11,777,539"
BTBD,"BT Brands, Inc. Common Stock",$1.50,0.03,2.041%,"11,767,071"
CRIS,"Curis, Inc. Common Stock",$0.9045,0.0081,0.904%,"11,694,148"
AZI,Autozi Internet Technology (Global) Ltd. Class A Ordinary Shares,$3.62,0.60,19.868%,"11,670,232"
ARBEW,Arbe Robotics Ltd. Warrant,$0.1101,-0.0196,-15.112%,"11,578,467"
FGI,FGI Industries Ltd. Ordinary Shares,$6.02,0.11,1.861%,"11,559,243"
ASTLW,Algoma Steel Group Inc. Warrant,$0.1099,0.0049,4.667%,"11,532,225"
WKHS,"Workhorse Group, Inc. Common Stock",$5.31,-0.04,-0.748%,"11,521,468"
JFBR,Jeffs' Brands Ltd Ordinary Shares,$0.59,-0.0403,-6.394%,"11,400,635"
WHLRP,"Wheeler Real Estate Investment Trust, Inc. Class B Preferred Stock",$5.8899,-0.6301,-9.664%,"11,247,194"
SRTAW,"Strata Critical Medical, Inc. Warrants",$0.13,UNCH,--,"11,227,648"
WATT,Energous Corporation Common Stock,$5.16,-0.03,-0.578%,"11,223,707"
NCEL,NewcelX Ltd. Ordinary Shares,$2.46,-0.01,-0.405%,"11,213,610"
