Symbol,Name,Last Sale,Net Change,% Change,Market Cap
NATH,"Nathan's Famous, Inc. Common Stock",$107.36,2.89,2.766%,"439,049,794"
KIDS,OrthoPediatrics Corp. Common Stock,$17.51,1.21,7.423%,"439,038,771"
BOC,Boston Omaha Corporation Class A Common Stock,$13.95,0.13,0.941%,"438,775,404"
ARKO,ARKO Corp. Common Stock,$3.89,0.02,0.517%,"438,567,706"
AROW,Arrow Financial Corporation Common Stock,$26.60,0.51,1.955%,"438,076,092"
CDZI,"CADIZ, Inc. Common Stock",$5.34,0.08,1.521%,"437,981,588"
ELVR,Elevra Lithium Limited American Depository Shares,$28.235,2.025,7.726%,"437,516,318"
XOMA,XOMA Royalty Corporation Common Stock,$36.17,-0.26,-0.714%,"437,212,796"
DDL,Dingdong (Cayman) Limited American Depositary Shares (each two representing three Ordinary Shares),$1.85,0.03,1.648%,"437,021,217"
IMXI,"International Money Express, Inc. Common Stock",$14.71,0.21,1.448%,"436,652,434"
UMAC,"Unusual Machines, Inc. Common Stock",$14.32,0.95,7.105%,"435,869,096"
RAPT,"RAPT Therapeutics, Inc. Common Stock",$26.35,-0.44,-1.642%,"435,770,872"
SD,"SandRidge Energy, Inc. Common Stock",$11.84,0.50,4.409%,"435,142,176"
VPG,"Vishay Precision Group, Inc. Common Stock",$32.75,2.00,6.504%,"434,890,001"
PERI,Perion Network Ltd. Ordinary Shares,$9.65,0.44,4.777%,"434,608,787"
KELYA,"Kelly Services, Inc. Class A Common Stock",$12.31,-0.13,-1.045%,"433,949,473"
INVZ,Innoviz Technologies Ltd. Ordinary shares,$2.18,0.09,4.306%,"433,737,066"
IONR,ioneer Ltd American Depositary Shares,$7.41,1.24,20.097%,"433,142,021"
OCSAW,Oculis Holding AG Warrants,$9.92,-0.29,-2.84%,"433,131,028"
NLOP,Net Lease Office Properties Common Shares of Beneficial Interest,$29.15,0.55,1.923%,"431,830,286"
SBC,SBC Medical Group Holdings Incorporated Common Stock,$4.15,UNCH,--,"431,107,192"
OTLY,Oatly Group AB American Depositary Shares,$14.39,0.69,5.036%,"430,663,805"
GLRE,"Greenlight Capital Re, Ltd. Class A Ordinary Shares",$12.59,0.14,1.124%,"430,554,746"
CARE,"Carter Bankshares, Inc. Common Stock",$18.99,0.28,1.497%,"430,500,148"
PACK,Ranpak Holdings Corp Class A Common Stock,$5.10,0.08,1.594%,"430,243,936"
RRBI,"Red River Bancshares, Inc. Common Stock",$64.385,2.635,4.267%,"429,873,470"
CRESW,Cresud S.A.C.I.F. y A. Warrant,$0.72,0.058,8.761%,"429,375,830"
KRRO,"Korro Bio, Inc. Common Stock",$45.71,2.74,6.377%,"429,258,176"
SOHU,Sohu.com Limited American Depositary Shares,$14.27,0.02,0.14%,"429,033,258"
PNNT,PennantPark Investment Corporation Common Stock,$6.56,0.18,2.821%,"428,342,377"
OPAL,OPAL Fuels Inc. Class A Common Stock,$2.47,-0.03,-1.20%,"428,286,179"
JOUT,Johnson Outdoors Inc. Class A Common Stock,$41.27,0.25,0.609%,"428,063,294"
PSNYW,Polestar Automotive Holding UK PLC Class C-1 ADS (ADW),$0.2028,-0.0072,-3.429%,"427,979,907"
CAL,"Caleres, Inc. Common Stock",$12.63,0.77,6.492%,"427,435,675"
RILYT,"B. Riley Financial, Inc. 6.00% Senior Notes Due 2028",$13.98,0.025,0.179%,"426,348,983"
THM,"International Tower Hill Mines, Ltd. Ordinary Shares (Canada)",$2.05,0.08,4.061%,"426,165,220"
PRTC,PureTech Health plc American Depositary Shares,$17.6261,-0.3739,-2.077%,"425,994,706"
KRNY,Kearny Financial Corp Common Stock,$6.56,0.06,0.923%,"424,724,071"
CMCO,Columbus McKinnon Corporation Common Stock,$14.76,0.40,2.786%,"423,985,856"
ENGN,enGene Holdings Inc. Common Stock,$8.29,-0.10,-1.192%,"423,667,140"
DVS,Dolly Varden Silver Corporation Common Shares,$4.86,0.36,8.00%,"423,622,653"
WEST,Westrock Coffee Company Common Stock,$4.47,0.02,0.449%,"423,345,059"
AREC,American Resources Corporation Class A Common Stock,$4.98,0.90,22.059%,"421,352,422"
QSI,Quantum-Si Incorporated Class A Common Stock,$2.08,0.41,24.551%,"421,190,012"
PKE,Park Aerospace Corp. Common Stock,$21.20,1.49,7.56%,"420,943,766"
TRC,Tejon Ranch Co Common Stock,$15.61,0.07,0.45%,"419,814,638"
GMRE,Global Medical REIT Inc. Common Stock,$31.29,0.49,1.591%,"419,517,828"
HYLN,Hyliion Holdings Corp. Class A Common Stock,$2.38,0.12,5.31%,"417,539,194"
GRVY,"GRAVITY Co., Ltd. American Depository Shares",$60.01,0.47,0.789%,"417,003,489"
SDHY,PGIM Short Duration High Yield Opportunities Fund Common Shares,$16.89,0.13,0.776%,"416,727,916"
GBLI,"Global Indemnity Group, LLC Class A Common Stock (DE)",$29.1327,-0.5473,-1.844%,"416,490,635"
SPIR,"Spire Global, Inc. Class A Common Stock",$12.78,0.59,4.84%,"416,423,316"
GNE,Genie Energy Ltd. Class B Common Stock Stock,$15.56,0.30,1.966%,"415,590,640"
HQL,abrdn Life Sciences Investors Shares of Beneficial Interest,$16.18,0.18,1.125%,"415,496,510"
BSVN,Bank7 Corp. Common stock,$43.95,0.35,0.803%,"415,370,527"
MVIS,"MicroVision, Inc. Common Stock",$1.38,0.12,9.524%,"415,331,540"
HNST,"The Honest Company, Inc. Common Stock",$3.73,0.01,0.269%,"415,035,201"
MITK,"Mitek Systems, Inc. Common Stock",$9.08,0.03,0.331%,"414,475,205"
HBCP,"Home Bancorp, Inc. Common Stock",$52.83,0.94,1.812%,"413,381,595"
XRX,Xerox Holdings Corporation Common Stock,$3.28,0.11,3.47%,"412,720,425"
MSB,Mesabi Trust Common Stock,$31.38,0.73,2.382%,"411,705,914"
NOA,North American Construction Group Ltd. Common Shares (no par),$13.62,0.17,1.264%,"411,010,481"
RMNI,"Rimini Street, Inc. (DE) Common Stock",$4.43,0.15,3.505%,"409,854,740"
CCRN,"Cross Country Healthcare, Inc. Common Stock $0.0001 Par Value",$12.50,0.91,7.852%,"409,524,938"
MCS,Marcus Corporation (The) Common Stock,$13.07,-0.45,-3.328%,"409,235,763"
COFS,"ChoiceOne Financial Services, Inc. Common Stock",$27.23,0.20,0.74%,"408,858,450"
FBIZ,"First Business Financial Services, Inc. Common Stock",$49.04,0.32,0.657%,"408,182,969"
CYH,"Community Health Systems, Inc. Common Stock",$2.91,0.01,0.345%,"407,746,628"
ECC           ,Eagle Point Credit Company Inc. Common Stock,$6.71,0.09,1.36%,"407,045,536"
RPAY,Repay Holdings Corporation Class A Common Stock,$4.73,0.14,3.05%,"407,002,149"
BNC,CEA Industries Inc. Common Stock,$9.44,UNCH,--,"406,704,294"
ESEA,Euroseas Ltd. Common Stock (Marshall Islands),$58.04,4.64,8.689%,"406,663,760"
DDT,Dillard's Capital Trust I,$26.02,0.12,0.463%,"406,249,375"
RZLVW,Rezolve AI PLC Warrants,$1.66,-0.06,-3.488%,"404,494,481"
MCI,Barings Corporate Investors Common Stock,$19.96,0.34,1.733%,"404,423,911"
DIN,"Dine Brands Global, Inc. Common Stock",$26.29,1.10,4.367%,"404,322,402"
LCTX,"Lineage Cell Therapeutics, Inc. Common Stock",$1.77,0.11,6.627%,"404,190,633"
ALLT,Allot Ltd. Ordinary Shares,$10.17,0.31,3.144%,"403,675,918"
EHAB,"Enhabit, Inc. Common Stock",$7.96,0.21,2.71%,"403,495,441"
PDYN,Palladyne AI Corp. Common Stock,$9.60,1.31,15.802%,"402,709,190"
LWAY,"Lifeway Foods, Inc. Common Stock",$26.44,0.46,1.771%,"402,589,189"
EGY,"VAALCO Energy, Inc.  Common Stock",$3.86,0.11,2.933%,"402,436,857"
SRTA,"Strata Critical Medical, Inc. Class A Common Stock",$4.92,0.21,4.459%,"401,942,377"
NVX,NOVONIX Limited American Depository Shares,$2.82,-0.12,-4.082%,"400,399,104"
NNDM,Nano Dimension Ltd. American Depositary Shares,$1.84,0.185,11.178%,"399,801,596"
SRDX,"Surmodics, Inc. Common Stock",$27.92,-0.71,-2.48%,"399,189,634"
DDD,3D Systems Corporation Common Stock,$3.11,0.22,7.612%,"398,865,449"
SAJ,Saratoga Investment Corp 8.00% Notes due 2027,$25.435,-0.095,-0.372%,"398,518,912"
SAY,Saratoga Investment Corp 8.125% Notes due 2027,$25.41,0.01,0.039%,"398,127,209"
VSTA,Vasta Platform Limited Class A Ordinary Shares,$4.96,0.04,0.813%,"397,802,034"
LPTH,"LightPath Technologies, Inc. Class A Common Stock",$8.90,0.93,11.669%,"397,564,896"
SAZ,Saratoga Investment Corp 8.50% Notes due 2028,$25.3499,0.0182,0.072%,"397,185,554"
DCTH,"Delcath Systems, Inc. Common Stock",$11.35,0.89,8.509%,"397,037,222"
CIVB,"Civista Bancshares, Inc. Common Stock",$20.55,0.22,1.082%,"396,879,663"
TTGT,"TechTarget, Inc. Common Stock",$5.55,UNCH,--,"396,763,950"
MOV,Movado Group Inc. Common Stock,$17.92,0.65,3.764%,"396,707,548"
ASTL,Algoma Steel Group Inc. Common Shares,$3.78,0.25,7.082%,"396,649,772"
AMRN,Amarin Corporation plc,$19.17,0.94,5.156%,"396,488,816"
KMDA,Kamada Ltd. Ordinary Shares,$6.88,0.08,1.176%,"395,634,613"
VKI,Invesco Advantage Municipal Income Trust II Common Shares of Beneficial Interest (DE),$8.88,0.10,1.139%,"394,325,458"
ZH,"Zhihu Inc. American Depositary Shares, each representing three (3) Class A Ordinary Shares",$4.50,0.03,0.671%,"394,041,875"
BNTC,Benitec Biopharma Inc. Common Stock,$15.00,0.08,0.536%,"393,757,035"
SGU,Star Group L.P. Common Stock,$11.69,-0.11,-0.932%,"392,859,097"
VHI,"Valhi, Inc. Common Stock",$13.85,0.09,0.654%,"391,986,758"
IHRT,"iHeartMedia, Inc. Class A Common Stock",$2.61,0.02,0.772%,"391,871,348"
LEO,"BNY Mellon Strategic Municipals, Inc. Common Stock",$6.29,0.02,0.319%,"391,809,472"
NCMI,"National CineMedia, Inc. Common Stock",$4.18,0.03,0.723%,"391,708,302"
ATEX,Anterix Inc. Common Stock,$20.90,-0.08,-0.381%,"391,661,611"
TCI,"Transcontinental Realty Investors, Inc. Common Stock",$45.33,1.13,2.557%,"391,620,194"
THH,TryHard Holdings Limited Ordinary Shares,$7.86,0.35,4.66%,"391,565,550"
CNDT,Conduent Incorporated Common Stock ,$2.47,-0.01,-0.403%,"390,195,834"
SMLR,"Semler Scientific, Inc. Common Stock",$26.33,-0.47,-1.754%,"389,807,567"
VFF,"Village Farms International, Inc. Common Shares",$3.46,0.15,4.532%,"389,748,825"
HSHP,Himalaya Shipping Ltd. Common Shares,$8.37,0.46,5.815%,"389,623,500"
HDSN,"Hudson Technologies, Inc. Common Stock",$8.92,0.12,1.364%,"389,521,860"
CWBC,Community West Bancshares Common Stock,$20.30,0.45,2.267%,"388,349,312"
EOLS,"Evolus, Inc. Common Stock",$6.00,-0.14,-2.28%,"388,112,514"
SAT,Saratoga Investment Corp 6.00% Notes due 2027,$24.74,0.08,0.324%,"387,629,561"
FRBA,First Bank Common Stock,$15.36,0.19,1.252%,"386,064,430"
ATLCZ,Atlanticus Holdings Corporation 9.25% Senior Notes due 2029,$25.52,0.07,0.275%,"386,001,458"
CHCT,Community Healthcare Trust Incorporated Common Stock,$13.56,0.25,1.878%,"384,653,049"
TACO,Berto Acquisition Corp. Ordinary Shares,$10.55,0.109,1.044%,"384,465,548"
OEC,Orion S.A. Common Shares,$6.84,0.25,3.794%,"384,063,989"
LAW,"CS Disco, Inc. Common Stock",$6.22,0.14,2.303%,"384,034,282"
SVC,Service Properties Trust Common Stock,$2.30,0.03,1.322%,"383,779,909"
WAVE,Eco Wave Power Global AB (publ) American Depositary Shares,$8.20,0.10,1.235%,"383,217,521"
VBNK,VersaBank Common Shares,$11.91,-0.03,-0.251%,"383,116,640"
SMC,Summit Midstream Corporation Common Stock,$20.41,0.30,1.492%,"383,020,816"
IPI,"Intrepid Potash, Inc Common Stock",$28.68,1.08,3.913%,"381,904,343"
UPXI,"Upexi, Inc. Common Stock",$6.48,0.13,2.047%,"381,599,139"
AMBC,"Ambac Financial Group, Inc. Common Stock",$8.22,0.14,1.733%,"381,422,270"
NIOBW,NioCorp Developments Ltd. Warrant,$4.90,0.76,18.357%,"381,009,736"
SOR,"Source Capital, Inc. Cmn Shs of BI",$45.635,0.295,0.651%,"380,800,482"
AURA,"Aura Biosciences, Inc. Common Stock",$6.13,0.21,3.547%,"380,794,821"
RM,Regional Management Corp. Common Stock,$38.84,1.03,2.724%,"380,595,723"
BSRR,Sierra Bancorp Common Stock,$27.99,0.37,1.34%,"380,391,741"
TMCI,"Treace Medical Concepts, Inc. Common Stock",$6.00,0.12,2.041%,"379,038,756"
GRRR,Gorilla Technology Group Inc. Ordinary shares,$18.70,0.62,3.429%,"378,155,925"
BRBS,"Blue Ridge Bankshares, Inc. Common Stock",$4.10,-0.02,-0.485%,"377,716,432"
ATLCL,Atlanticus Holdings Corporation 6.125% Senior Notes due 2026,$24.95,-0.01,-0.04%,"377,379,953"
DHIL,"Diamond Hill Investment Group, Inc. Class A Common Stock",$138.19,2.24,1.648%,"376,589,584"
VALU,"Value Line, Inc. Common Stock",$40.00,1.55,4.031%,"376,314,760"
EGAN,eGain Corporation Common Stock,$14.00,1.21,9.461%,"376,138,938"
MLAB,"Mesa Laboratories, Inc. Common Stock",$68.315,0.585,0.864%,"375,831,830"
USNA,"USANA Health Sciences, Inc. Common Stock",$20.53,0.27,1.333%,"375,120,793"
PUBM,"PubMatic, Inc. Class A Common Stock",$8.20,0.21,2.628%,"374,928,862"
LND,Brasilagro Brazilian Agric Real Estate Co Sponsored ADR (Brazil),$3.65,-0.04,-1.084%,"374,794,571"
GCBC,"Greene County Bancorp, Inc. Common Stock",$22.01,0.51,2.372%,"374,760,484"
RCKT,"Rocket Pharmaceuticals, Inc. Common Stock",$3.47,0.05,1.462%,"374,426,432"
WTI,"W&T Offshore, Inc. Common Stock",$2.52,0.45,21.739%,"373,814,356"
QSG,QuantaSing Group Limited American Depositary Shares,$7.31,0.21,2.958%,"373,636,052"
BMRC,Bank of Marin Bancorp Common Stock,$23.15,0.26,1.136%,"373,300,718"
JELD,"JELD-WEN Holding, Inc. Common Stock",$4.36,0.14,3.318%,"372,357,904"
DSGN,"Design Therapeutics, Inc. Common Stock",$6.49,-0.26,-3.852%,"369,593,338"
ZIP,"ZipRecruiter, Inc. Class A Common Stock",$4.24,0.39,10.13%,"369,381,660"
TOI,"The Oncology Institute, Inc. Common Stock",$3.95,0.16,4.222%,"369,343,830"
AGL,"agilon health, inc. Common Stock",$0.8911,-0.0555,-5.863%,"369,292,468"
CMRC,"Commerce.com, Inc. Series 1 Common Stock",$4.56,-0.08,-1.724%,"368,151,965"
PPT,Putnam Premier Income Trust Common Stock,$3.68,0.01,0.272%,"366,264,008"
FEIM,"Frequency Electronics, Inc. Common Stock",$37.44,1.92,5.405%,"365,012,706"
KTF,DWS Municipal Income Trust,$9.24,0.03,0.326%,"364,988,667"
DMAC,DiaMedica Therapeutics Inc. Common Stock,$7.06,0.42,6.325%,"364,923,726"
CGC,Canopy Growth Corporation Common Shares,$1.37,UNCH,--,"364,440,632"
PSTL,"Postal Realty Trust, Inc. Class A Common Stock",$14.82,0.03,0.203%,"364,278,653"
MTW,"Manitowoc Company, Inc. (The) Common Stock",$10.27,0.27,2.70%,"364,165,029"
ATLCP,"Atlanticus Holdings Corporation 7.625% Series B Cumulative Perpetual Preferred Stock, no par value per share",$24.056,-0.0759,-0.315%,"363,857,801"
LRMR,"Larimar Therapeutics, Inc. Common Stock",$4.25,-0.11,-2.523%,"363,759,166"
EVI,"EVI Industries, Inc.  Common Stock",$28.50,0.60,2.151%,"363,716,801"
MAGN,Magnera Corporation Common Stock,$10.21,0.27,2.716%,"363,476,000"
XPOF,"Xponential Fitness, Inc. Class A Common Stock",$7.40,-0.19,-2.503%,"361,379,000"
NIU,Niu Technologies American Depositary Shares,$4.625,-0.095,-2.013%,"360,583,371"
BW,"Babcock & Wilcox Enterprises, Inc. Common Stock",$3.55,0.32,9.907%,"358,896,274"
TITN,Titan Machinery Inc. Common Stock,$15.35,0.07,0.458%,"358,775,197"
CATX,"Perspective Therapeutics, Inc. Common Stock",$4.83,-0.03,-0.617%,"358,690,242"
ASLE,AerSale Corporation Common Stock,$7.58,0.18,2.432%,"357,635,899"
RILYZ,"B. Riley Financial, Inc. 5.25% Senior Notes due 2028",$11.71,0.26,2.271%,"357,120,643"
OIS,"Oil States International, Inc. Common Stock",$5.89,0.31,5.556%,"356,890,714"
SATL,Satellogic Inc. Class A Common Stock,$3.375,-0.015,-0.442%,"356,293,090"
REPL,"Replimune Group, Inc. Common Stock",$4.56,0.03,0.662%,"355,934,658"
CADL,"Candel Therapeutics, Inc. Common Stock",$6.47,0.28,4.523%,"355,171,291"
CHSCP,CHS Inc. 8%  Cumulative Redeemable Preferred Stock,$28.934,0.134,0.465%,"355,078,135"
OMI,"Owens & Minor, Inc. Common Stock",$4.59,0.08,1.774%,"354,550,699"
PMO,Putnam Municipal Opportunities Trust Common Stock,$10.42,0.07,0.676%,"354,087,928"
HLLY,Holley Inc. Common Stock,$2.91,-0.06,-2.02%,"353,836,826"
LXFR,Luxfer Holdings PLC Ordinary Shares,$13.20,0.63,5.012%,"353,285,816"
ALT,"Altimmune, Inc. Common Stock",$4.00,0.08,2.041%,"353,029,012"
MTRX,Matrix Service Company Common Stock,$12.57,0.30,2.445%,"352,821,485"
SAR,Saratoga Investment Corp New,$21.87,0.28,1.297%,"352,193,343"
ZUMZ,Zumiez Inc. Common Stock,$20.51,1.35,7.046%,"351,818,880"
RWAY,Runway Growth Finance Corp. Common Stock,$9.69,0.09,0.938%,"350,939,164"
EVO,Evotec SE American Depositary Shares,$3.95,0.08,2.067%,"350,337,433"
CARL,"Carlsmed, Inc. Common Stock",$13.13,0.01,0.076%,"349,010,289"
WNC,Wabash National Corporation Common Stock,$8.52,-0.14,-1.617%,"348,793,660"
ACIU,AC Immune SA Common Stock,$3.47,-0.08,-2.254%,"348,424,008"
SY,So-Young International Inc. American Depository Shares,$3.46,0.09,2.671%,"348,411,437"
LSAK,"Lesaka Technologies, Inc. Common Stock",$4.16,0.04,0.971%,"348,080,084"
MTLS,Materialise NV American Depositary Shares,$5.89,0.10,1.727%,"347,905,726"
OPRX,OptimizeRx Corporation Common Stock,$18.73,0.65,3.595%,"347,723,068"
SCM,Stellus Capital Investment Corporation Common Stock,$12.22,0.18,1.495%,"347,245,329"
NPCE,"Neuropace, Inc. Common Stock",$10.48,0.20,1.946%,"346,694,099"
ACCO,Acco Brands Corporation Common Stock,$3.83,0.10,2.681%,"345,207,594"
MSBI,"Midland States Bancorp, Inc. Common Stock",$16.02,0.12,0.755%,"345,127,751"
SFST,"Southern First Bancshares, Inc. Common Stock",$42.18,0.68,1.639%,"345,062,559"
BBCP,"Concrete Pumping Holdings, Inc. Common Stock",$6.70,0.21,3.236%,"344,878,815"
GBAB,Guggenheim Taxable Municipal Bond & Investment Grade Debt Trust Common Shares of Beneficial Interest,$15.38,-0.15,-0.966%,"344,464,399"
GLDG,GoldMining Inc. Common Shares,$1.73,0.02,1.17%,"344,362,045"
TOYO,"TOYO Co., Ltd Ordinary Shares",$7.38,0.33,4.681%,"343,876,583"
ILPT,Industrial Logistics Properties Trust Common Shares of Beneficial Interest,$5.18,-0.05,-0.956%,"343,620,475"
EFT,Eaton Vance Floating Rate Income Trust Common Shares of Beneficial Interest,$11.79,0.03,0.255%,"342,975,993"
SENS,"Senseonics Holdings, Inc. Common Stock",$0.4192,-0.0008,-0.19%,"341,514,237"
NVEC,NVE Corporation Common Stock,$70.50,3.25,4.833%,"341,020,203"
MBI,MBIA Inc. Common Stock,$6.75,-0.04,-0.589%,"340,799,002"
PDLB,"Ponce Financial Group, Inc. Common Stock",$14.17,-0.08,-0.561%,"340,095,941"
DFDV,DeFi Development Corp. Common Stock,$16.15,0.44,2.801%,"339,877,541"
USBC,"USBC, Inc. Common Stock",$0.882,-0.008,-0.899%,"338,894,503"
USCB,"USCB Financial Holdings, Inc. Class A Common Stock",$16.87,0.43,2.616%,"338,722,355"
ANNA,"AleAnna, Inc. Class A Common Stock",$4.165,0.075,1.834%,"338,696,809"
ARTNA,Artesian Resources Corporation Class A Common Stock,$32.72,-0.78,-2.328%,"337,362,865"
JACK,Jack In The Box Inc. Common Stock,$17.78,0.44,2.537%,"335,731,134"
CUB,Lionheart Holdings Class A Ordinary Shares,$10.56,UNCH,--,"335,476,163"
LAND,Gladstone Land Corporation Common Stock,$9.27,0.26,2.886%,"335,431,780"
BRCC,BRC Inc. Class A Common Stock,$1.35,0.02,1.504%,"335,103,818"
ORN,"Orion Group Holdings, Inc. Common",$8.43,0.25,3.056%,"334,968,115"
EM,Smart Share Global Limited American Depositary Shares,$1.32,-0.01,-0.752%,"334,711,418"
CTNM,"Contineum Therapeutics, Inc. Class A Common Stock",$11.93,0.05,0.421%,"334,539,807"
API,"Agora, Inc. American Depositary Shares",$3.57,0.07,2.00%,"333,833,345"
AMCX,AMC Networks Inc. Class A Common Stock,$7.69,0.17,2.261%,"333,621,522"
BGS,"B&G Foods, Inc. Common Stock",$4.17,0.05,1.214%,"333,615,633"
MVBF,MVB Financial Corp. Common Stock,$26.15,-0.20,-0.759%,"332,924,149"
FLYX,"flyExclusive, Inc. Class A Common Stock",$4.15,0.25,6.41%,"332,537,782"
MLP,"Maui Land & Pineapple Company, Inc. Common Stock",$16.84,0.38,2.309%,"332,468,432"
BWFG,"Bankwell Financial Group, Inc. Common Stock",$42.16,0.45,1.079%,"332,112,997"
ATGL,Alpha Technology Group Limited Class A Ordinary Shares,$20.10,0.08,0.40%,"330,896,250"
FMAO,"Farmers & Merchants Bancorp, Inc. Common Stock",$24.10,0.76,3.256%,"330,749,268"
PBFS,"Pioneer Bancorp, Inc. Common Stock",$13.07,0.06,0.461%,"330,603,415"
ANNX,"Annexon, Inc. Common Stock",$3.005,-0.095,-3.065%,"330,209,302"
WTBA,West Bancorporation Common Stock,$19.49,0.26,1.352%,"330,175,900"
ACTG,Acacia Research Corporation (Acacia Tech) Common Stock,$3.41,0.05,1.488%,"328,877,426"
FCEL,"FuelCell Energy, Inc. Common Stock",$10.17,0.91,9.827%,"328,444,991"
NGS,"Natural Gas Services Group, Inc. Common Stock",$26.18,0.50,1.947%,"328,357,781"
SLQT,"SelectQuote, Inc. Common Stock",$1.90,0.03,1.604%,"328,351,787"
BNED,"Barnes & Noble Education, Inc Common Stock",$9.64,0.53,5.818%,"328,279,085"
FINS,Angel Oak Financial Strategies Income Term Trust Common Shares of Beneficial Interest,$13.09,-0.06,-0.456%,"328,069,931"
ETHZ,ETHZilla Corporation Common Stock,$1.98,UNCH,--,"327,641,797"
GPRO,"GoPro, Inc. Class A Common Stock",$2.07,0.09,4.545%,"327,439,007"
HVT,"Haverty Furniture Companies, Inc. Common Stock",$20.12,0.13,0.65%,"327,288,559"
AENT,Alliance Entertainment Holding Corporation Class A Common Stock,$6.42,-0.04,-0.619%,"327,146,315"
CMDB,Costamare Bulkers Holdings Limited Common Stock,$13.51,0.08,0.596%,"326,992,595"
GALT,Galectin Therapeutics Inc. Common Stock,$5.10,0.38,8.051%,"326,707,336"
CHSCO,CHS Inc. Class B Cumulative Redeemable Preferred Stock,$26.60,0.12,0.453%,"326,435,280"
MCFT,"MasterCraft Boat Holdings, Inc. Common Stock",$20.01,0.51,2.615%,"326,290,184"
CBK,"Commercial Bancgroup, Inc. Common Stock",$24.75,0.40,1.643%,"326,062,019"
GPRK,Geopark Ltd Common Shares,$6.35,0.04,0.634%,"325,420,272"
CTGO,"Contango ORE, Inc. Common Stock",$25.68,1.24,5.074%,"325,353,042"
GFR,Greenfire Resources Ltd. Common Shares,$4.62,0.06,1.316%,"324,568,860"
AIRJ,AirJoule Technologies Corporation Class A Common Stock,$5.36,0.49,10.062%,"323,956,218"
LYEL,"Lyell Immunopharma, Inc. Common Stock",$16.83,0.32,1.938%,"323,324,530"
BGL,Blue Gold Limited Class A Ordinary Shares,$10.57,0.74,7.528%,"323,143,545"
SPOK,"Spok Holdings, Inc. Common Stock",$15.69,0.07,0.448%,"323,071,598"
LBRX,LB Pharmaceuticals Inc Common Stock,$16.07,0.63,4.08%,"323,009,202"
PLG,Platinum Group Metals Ltd. Ordinary Shares (Canada),$2.99,0.34,12.83%,"322,861,836"
TNYA,"Tenaya Therapeutics, Inc. Common Stock",$1.98,-0.12,-5.714%,"322,692,682"
RFMZ,"RiverNorth Flexible Municipal Income Fund II, Inc. Common Stock",$13.18,-0.04,-0.303%,"320,956,144"
RXT,"Rackspace Technology, Inc. Common Stock",$1.34,0.01,0.752%,"320,743,307"
EDIT,"Editas Medicine, Inc. Common Stock",$3.56,-0.16,-4.301%,"320,115,784"
FET,"Forum Energy Technologies, Inc. Common Stock",$26.84,1.58,6.255%,"319,483,928"
OBT,"Orange County Bancorp, Inc. Common Stock",$23.87,0.37,1.574%,"318,972,709"
TCMD,"Tactile Systems Technology, Inc. Common Stock",$14.30,0.08,0.563%,"318,777,674"
CLLS,Cellectis S.A. American Depositary Shares,$4.42,0.38,9.406%,"318,654,919"
AARD,"Aardvark Therapeutics, Inc. Common Stock",$14.63,-1.63,-10.025%,"317,425,545"
XOMAP,XOMA Royalty Corporation 8.625% Series A Cumulative Perpetual Preferred Stock,$26.1901,0.009,0.034%,"316,578,569"
ALDX,"Aldeyra Therapeutics, Inc. Common Stock",$5.25,-0.14,-2.597%,"314,451,837"
CHSCL,"CHS Inc Class B Cumulative Redeemable Preferred Stock, Series 4",$25.5615,0.0415,0.163%,"313,690,805"
ZEUS,"Olympic Steel, Inc. Common Stock",$27.92,0.72,2.647%,"312,637,578"
ANPA,Rich Sparkle Holdings Limited Ordinary Shares,$25.00,1.09,4.559%,"312,500,000"
ARDC,"Ares Dynamic Credit Allocation Fund, Inc. Common Shares",$13.61,0.14,1.039%,"311,872,320"
DH,Definitive Healthcare Corp. Class A Common Stock,$2.99,0.12,4.181%,"311,217,768"
SLP,"Simulations Plus, Inc. Common Stock",$15.43,0.67,4.539%,"310,561,307"
MREO,Mereo BioPharma Group plc American Depositary Shares,$2.00,0.04,2.041%,"310,291,214"
OOMA,"Ooma, Inc. Common Stock",$11.24,0.23,2.089%,"310,224,000"
CPZ,Calamos Long/Short Equity & Dynamic Income Trust Common Stock,$15.775,-0.015,-0.095%,"309,697,860"
RXST,"RxSight, Inc. Common Stock",$7.565,0.055,0.732%,"309,529,260"
VNDA,Vanda Pharmaceuticals Inc. Common Stock,$5.23,-0.08,-1.507%,"309,036,150"
CHSCN,CHS Inc Preferred Class B Series 2 Reset Rate,$25.15,0.10,0.399%,"308,640,875"
PANL,Pangaea Logistics Solutions Ltd. Common Shares,$4.73,0.17,3.728%,"308,594,239"
CLDT,Chatham Lodging Trust (REIT) Common Shares of Beneficial Interest,$6.30,0.07,1.124%,"308,564,953"
SWKHL,SWK Holdings Corporation 9.00% Senior Notes due 2027,$25.3801,0.0201,0.079%,"308,301,998"
ARQ,"Arq, Inc. Common Stock",$7.21,0.48,7.132%,"307,803,848"
ALEC,"Alector, Inc. Common Stock",$3.04,0.02,0.662%,"307,685,480"
CAPR,"Capricor Therapeutics, Inc. Common Stock",$6.72,-0.37,-5.219%,"307,218,072"
SUIG,Sui Group Holdings Limited Common Stock,$3.74,0.03,0.809%,"307,093,824"
CHSCM,"CHS Inc Class B Reset Rate Cumulative Redeemable Preferred Stock, Series 3",$25.00,0.12,0.482%,"306,800,075"
SEG,Seaport Entertainment Group Inc. Common Stock,$24.09,0.04,0.166%,"306,715,735"
CLW,Clearwater Paper Corporation Common Stock,$19.04,0.32,1.709%,"306,622,902"
DPRO,Draganfly Inc. Common Shares,$13.77,1.76,14.654%,"306,194,347"
XOMAO,XOMA Royalty Corporation Depositary Shares Rep Series B 8.375% Cumulative Preferred Stock,$25.33,0.04,0.158%,"306,181,922"
NC,"NACCO Industries, Inc. Common Stock",$41.02,1.13,2.833%,"305,666,806"
HYMC,Hycroft Mining Holding Corporation Class A Common Stock,$7.80,0.35,4.698%,"305,468,249"
ELVA,Electrovaya Inc. Common Shares,$7.61,0.97,14.608%,"305,213,623"
ACB,Aurora Cannabis Inc. Common Shares,$5.40,0.10,1.887%,"304,851,319"
GEOS,Geospace Technologies Corporation Common Stock (Texas),$23.755,1.105,4.879%,"304,555,776"
MIN,MFS Intermediate Income Trust Common Stock,$2.65,-0.01,-0.376%,"304,479,093"
BCML,BayCom Corp Common Stock,$27.69,0.36,1.317%,"302,477,918"
CZNC,Citizens & Northern Corp Common Stock,$19.46,0.19,0.986%,"301,920,791"
NMRA,"Neumora Therapeutics, Inc. Common Stock",$1.86,-0.03,-1.587%,"301,218,494"
TECX,"Tectonic Therapeutic, Inc. Common Stock",$16.09,0.07,0.437%,"301,078,140"
MPX,Marine Products Corporation Common Stock,$8.59,0.33,3.995%,"300,616,070"
MG,Mistras Group Inc Common Stock,$9.53,0.14,1.491%,"300,557,617"
CDRO,"Codere Online Luxembourg, S.A. Ordinary Shares",$6.58,-0.02,-0.303%,"300,316,556"
XPER,Xperi Inc. Common Stock ,$6.49,0.20,3.18%,"300,228,438"
RBB,RBB Bancorp Common Stock,$17.39,0.12,0.695%,"299,991,882"
KYTX,"Kyverna Therapeutics, Inc. Common Stock",$6.93,0.30,4.525%,"299,692,472"
CERS,Cerus Corporation Common Stock,$1.56,-0.04,-2.50%,"299,050,119"
PMM,Putnam Managed Municipal Income Trust Common Stock,$6.13,0.02,0.327%,"298,768,899"
CTRN,"Citi Trends, Inc. Common Stock",$35.965,1.035,2.963%,"298,722,125"
GCO,Genesco Inc. Common Stock,$27.61,1.46,5.583%,"298,061,684"
MNTK,"Montauk Renewables, Inc. Common Stock",$2.095,0.075,3.713%,"298,027,613"
ALTS,ALT5 Sigma Corporation Common Stock,$2.43,-0.205,-7.78%,"297,940,784"
PAYS,"Paysign, Inc. Common Stock",$5.47,0.12,2.243%,"297,851,827"
MPAA,"Motorcar Parts  of America, Inc. Common Stock",$15.38,0.57,3.849%,"297,635,836"
RMMZ,"RiverNorth Managed Duration Municipal Income Fund II, Inc. Common Stock",$15.0599,0.0899,0.601%,"297,276,824"
TBRG,"TruBridge, Inc. Common Stock",$19.79,0.02,0.101%,"297,080,395"
HTLM,HomesToLife Ltd Ordinary Shares,$3.31,-0.002,-0.06%,"296,865,625"
