Symbol,Name,Last Sale,Net Change,% Change,Market Cap
MIN,MFS Intermediate Income Trust Common Stock,$2.67,UNCH,--,"306,777,049"
ANNX,"Annexon, Inc. Common Stock",$2.79,-0.03,-1.064%,"306,583,678"
QSI,Quantum-Si Incorporated Class A Common Stock,$1.51,-0.10,-6.211%,"305,767,749"
CTGO,"Contango ORE, Inc. Common Stock",$24.07,-0.68,-2.747%,"304,955,130"
CTNM,"Contineum Therapeutics, Inc. Class A Common Stock",$10.86,0.36,3.429%,"304,534,980"
TBCH,Turtle Beach Corporation Common Stock,$15.36,-0.19,-1.222%,"304,229,929"
PAYS,"Paysign, Inc. Common Stock",$5.58,-0.06,-1.064%,"303,841,535"
EGHT,8x8 Inc Common Stock,$2.22,-0.09,-3.896%,"302,738,831"
MG,Mistras Group Inc Common Stock,$9.58,-0.09,-0.931%,"302,134,519"
TCMD,"Tactile Systems Technology, Inc. Common Stock",$13.55,-0.39,-2.798%,"302,058,565"
LBRX,LB Pharmaceuticals Inc Common Stock,$14.95,-0.05,-0.333%,"300,497,048"
FLWS,"1-800-FLOWERS.COM, Inc. Common Stock",$4.72,-0.13,-2.68%,"300,281,208"
PCB,PCB Bancorp Common Stock,$20.915,-0.055,-0.262%,"300,121,926"
CURI,CuriosityStream Inc. Class A Common Stock,$5.18,-0.03,-0.576%,"300,076,017"
PMM,Putnam Managed Municipal Income Trust Common Stock,$6.15,0.05,0.82%,"299,743,675"
PLBC,Plumas Bancorp,$43.10,-0.04,-0.093%,"299,421,044"
SCPH,scPharmaceuticals Inc. Common Stock,$5.61,-0.02,-0.355%,"299,003,441"
SEG,Seaport Entertainment Group Inc. Common Stock,$23.48,-0.04,-0.17%,"298,949,168"
XPER,Xperi Inc. Common Stock ,$6.46,-0.01,-0.155%,"298,840,634"
SNWV,"SANUWAVE Health, Inc. Common Stock",$34.83,-1.09,-3.035%,"298,423,614"
OMER,Omeros Corporation Common Stock,$4.38,0.18,4.286%,"298,084,518"
CAPR,"Capricor Therapeutics, Inc. Common Stock",$6.52,0.33,5.331%,"298,074,677"
OCSAW,Oculis Holding AG Warrants,$6.82,UNCH,--,"297,777,582"
LANV,Lanvin Group Holdings Limited Ordinary Shares,$2.13,0.01,0.472%,"297,722,463"
CIX,CompX International Inc. Common Stock,$24.14,-0.31,-1.268%,"297,478,596"
LOCO,"El Pollo Loco Holdings, Inc. Common Stock",$9.91,-0.13,-1.295%,"297,254,939"
BRT,BRT Apartments Corp. (MD) Common Stock,$15.71,-0.11,-0.695%,"296,962,972"
WSBF,"Waterstone Financial, Inc. Common Stock (MD)",$15.88,-0.28,-1.733%,"296,625,140"
MASS,908 Devices Inc. Common Stock,$8.22,0.66,8.73%,"296,624,438"
ALEC,"Alector, Inc. Common Stock",$2.93,-0.23,-7.278%,"296,552,124"
ALDX,"Aldeyra Therapeutics, Inc. Common Stock",$4.95,-0.06,-1.198%,"296,483,161"
CIA,"Citizens, Inc. Class A Common Stock ($1.00 Par)",$5.89,0.12,2.08%,"295,945,212"
PKOH,Park-Ohio Holdings Corp. Common Stock,$20.55,-0.11,-0.532%,"295,821,196"
SLP,"Simulations Plus, Inc. Common Stock",$14.68,-0.16,-1.078%,"295,465,975"
GALT,Galectin Therapeutics Inc. Common Stock,$4.61,-0.14,-2.947%,"295,317,808"
AZ,A2Z Cust2Mate Solutions Corp. Common Shares,$8.19,-0.21,-2.50%,"294,994,783"
LFMD,"LifeMD, Inc. Common Stock",$6.22,-0.18,-2.813%,"294,936,184"
RMMZ,"RiverNorth Managed Duration Municipal Income Fund II, Inc. Common Stock",$14.94,0.01,0.067%,"294,910,042"
FNLC,"First Bancorp, Inc  (ME) Common Stock",$26.30,-0.19,-0.717%,"294,838,464"
CZFS,"Citizens Financial Services, Inc. Common Stock",$61.33,0.73,1.205%,"294,832,568"
MNTK,"Montauk Renewables, Inc. Common Stock",$2.07,0.03,1.471%,"294,471,197"
TTSH,"Tile Shop Holdings, Inc. Common Stock",$6.55,-0.13,-1.946%,"293,187,399"
DRTS,Alpha Tau Medical Ltd. Ordinary Shares,$4.16,0.10,2.463%,"292,783,171"
WTI,"W&T Offshore, Inc. Common Stock",$1.97,0.01,0.51%,"292,227,889"
ACIU,AC Immune SA Common Stock,$2.91,0.18,6.593%,"292,194,197"
OCFT,"OneConnect Financial Technology Co., Ltd. American Depositary Shares, each representing thirty ordinary shares",$7.48,0.03,0.403%,"291,715,175"
OCCIO,"OFS Credit Company, Inc. 6.125% Series C Term Preferred Stock",$25.05,UNCH,--,"290,993,576"
LUD,Luda Technology Group Limited Ordinary Shares,$12.81,-1.91,-12.976%,"290,658,900"
FEIM,"Frequency Electronics, Inc. Common Stock",$29.81,0.56,1.915%,"290,625,769"
IMRX,Immuneering Corporation Class A Common Stock,$8.00,-1.23,-13.326%,"290,551,016"
EDIT,"Editas Medicine, Inc. Common Stock",$3.23,-0.14,-4.154%,"290,442,130"
WOLF,"Wolfspeed, Inc. Common Stock",$1.85,-0.37,-16.667%,"289,473,198"
CERS,Cerus Corporation Common Stock,$1.51,-0.03,-1.948%,"289,465,179"
WTF,Waton Financial Limited Ordinary Shares,$6.00,-0.67,-10.045%,"289,424,832"
FCNCP,"First Citizens BancShares, Inc. Depositary Shares",$22.39,0.24,1.084%,"289,305,578"
CADL,"Candel Therapeutics, Inc. Common Stock",$5.27,-0.16,-2.947%,"289,297,172"
HTLM,HomesToLife Ltd Ordinary Shares,$3.22,-0.135,-4.024%,"288,793,750"
FCNCO,"First Citizens BancShares, Inc. 5.625% Non-Cumulative Perpetual Preferred Stock, Series C",$22.29,0.01,0.045%,"288,013,459"
AVNW,"Aviat Networks, Inc. Common Stock",$22.43,-0.38,-1.666%,"287,088,456"
IMAB,I-MAB American Depositary Shares,$3.52,-0.04,-1.124%,"286,883,819"
ALMU,"Aeluma, Inc. Common Stock",$18.03,-1.12,-5.849%,"286,548,753"
NATR,"Nature's Sunshine Products, Inc. Common Stock",$16.24,-0.18,-1.096%,"286,401,364"
NL,"NL Industries, Inc. Common Stock",$5.86,-0.23,-3.777%,"286,335,621"
RLGT,"Radiant Logistics, Inc. Common Stock",$6.07,-0.04,-0.655%,"286,159,090"
BKTI,BK Technologies Corporation Common Stock,$76.63,-2.18,-2.766%,"286,110,672"
NECB,"NorthEast Community Bancorp, Inc. Common Stock",$20.38,-0.48,-2.301%,"285,845,804"
VNDA,Vanda Pharmaceuticals Inc. Common Stock,$4.83,-0.07,-1.429%,"285,400,498"
WEYS,"Weyco Group, Inc. Common Stock",$29.91,0.03,0.10%,"285,322,826"
PNRG,PrimeEnergy Resources Corporation Common Stock,$172.35,-2.29,-1.311%,"284,205,150"
CVEO,Civeo Corporation (Canada) Common Shares,$22.58,UNCH,--,"283,418,944"
SJT,San Juan Basin Royalty Trust Common Stock,$6.08,0.17,2.876%,"283,381,480"
FSTR,L.B. Foster Company Common Stock,$26.71,-0.15,-0.558%,"283,064,113"
OPRT,Oportun Financial Corporation Common Stock,$6.43,-0.07,-1.077%,"282,980,436"
OIA,Invesco Municipal Income Opportunities Trust Common Stock,$5.94,-0.08,-1.329%,"282,777,199"
OCCIN,"OFS Credit Company, Inc. 5.25% Series E Term Preferred Stock Due 2026",$24.34,-0.03,-0.123%,"282,745,853"
MMT,MFS Multimarket Income Trust Common Stock,$4.74,-0.025,-0.525%,"282,258,966"
FGBIP,"First Guaranty Bancshares, Inc. 6.75% Series A Fixed-Rate Non-Cumulative Perpetual Preferred Stock",$18.65,0.23,1.249%,"281,991,208"
NODK,"NI Holdings, Inc. Common Stock",$13.63,-0.22,-1.588%,"281,804,843"
AUDC,AudioCodes Ltd. Common Stock,$9.56,-0.32,-3.239%,"281,762,769"
ANTA,Antalpha Platform Holding Company Class A Ordinary Shares,$11.88,-0.10,-0.835%,"281,471,355"
BWAY,BrainsWay Ltd. American Depositary Shares,$14.91,UNCH,--,"281,340,189"
WW,"WW International, Inc.  Common Stock",$28.13,0.07,0.249%,"280,932,285"
GAMB,Gambling.com Group Limited Ordinary Shares,$8.07,-0.25,-3.005%,"280,536,595"
CIO,"City Office REIT, Inc. Common Stock",$6.95,UNCH,--,"280,527,298"
UIS,Unisys Corporation New Common Stock,$3.93,-0.09,-2.239%,"280,181,580"
BW,"Babcock & Wilcox Enterprises, Inc. Common Stock",$2.77,-0.33,-10.645%,"280,040,191"
MCR,MFS Charter Income Trust Common Stock,$6.36,-0.06,-0.935%,"279,893,297"
ACB,Aurora Cannabis Inc. Common Shares,$4.95,-0.23,-4.44%,"279,447,043"
FINW,FinWise Bancorp Common Stock,$20.64,-0.15,-0.722%,"279,036,907"
LPTH,"LightPath Technologies, Inc. Class A Common Stock",$6.50,-0.36,-5.248%,"278,843,084"
STRT,STRATTEC SECURITY CORPORATION Common Stock,$66.99,-1.79,-2.603%,"278,767,765"
SMRT,"SmartRent, Inc. Class A Common Stock",$1.48,-0.05,-3.268%,"278,344,515"
SMTI,Sanara MedTech Inc. Common Stock,$31.24,-1.33,-4.084%,"278,109,445"
BBOT,"BridgeBio Oncology Therapeutics, Inc. Common Stock  ",$11.82,0.44,3.866%,"277,876,380"
III,Information Services Group Inc. Common Stock,$5.76,0.05,0.876%,"277,605,901"
REFI,"Chicago Atlantic Real Estate Finance, Inc. Common Stock",$13.17,-0.16,-1.20%,"277,552,811"
AVBH,"Avidbank Holdings, Inc. Common stock",$25.37,0.06,0.237%,"277,446,827"
TOYO,"TOYO Co., Ltd Ordinary Shares",$5.93,0.08,1.368%,"276,312,756"
RMM,"RiverNorth Managed Duration Municipal Income Fund, Inc. Common Stock",$13.99,-0.05,-0.356%,"276,157,396"
LPRO,Open Lending Corporation Common Stock,$2.33,-0.15,-6.048%,"275,341,871"
NMRA,"Neumora Therapeutics, Inc. Common Stock",$1.70,-0.13,-7.104%,"275,307,226"
TG,Tredegar Corporation Common Stock,$7.89,-0.09,-1.128%,"275,302,630"
TECX,"Tectonic Therapeutic, Inc. Common Stock",$14.71,-0.28,-1.868%,"275,255,403"
DENN,Denny's Corporation Common Stock,$5.34,-0.03,-0.559%,"275,004,628"
MEC,"Mayville Engineering Company, Inc. Common Stock",$13.53,-0.09,-0.661%,"274,900,172"
AARD,"Aardvark Therapeutics, Inc. Common Stock",$12.67,0.50,4.108%,"274,899,634"
ABEO,Abeona Therapeutics Inc. Common Stock,$5.36,-0.19,-3.423%,"274,852,969"
KYTX,"Kyverna Therapeutics, Inc. Common Stock",$6.35,-0.09,-1.398%,"274,609,985"
MREO,Mereo BioPharma Group plc American Depositary Shares,$1.77,-0.03,-1.667%,"274,607,724"
DOUG,Douglas Elliman Inc. Common Stock,$3.09,0.29,10.357%,"274,108,032"
COSO,"CoastalSouth Bancshares, Inc. Common Stock",$22.87,-0.09,-0.392%,"273,957,923"
FVR,"FrontView REIT, Inc. Common Stock",$13.37,-0.16,-1.183%,"273,536,629"
LNKB,"LINKBANCORP, Inc. Common Stock",$7.30,-0.08,-1.084%,"273,380,058"
GWRS,"Global Water Resources, Inc. Common Stock",$9.94,-0.06,-0.60%,"273,084,373"
FBIOP,"Fortress Biotech, Inc. 9.375% Series A Cumulative Redeemable Perpetual Preferred Stock",$9.11,0.03,0.33%,"271,065,800"
TSBK,"Timberland Bancorp, Inc. Common Stock",$34.27,-0.13,-0.378%,"270,638,381"
LMNR,Limoneira Co Common Stock,$14.98,UNCH,--,"270,363,444"
JILL,"J. Jill, Inc. Common Stock",$17.66,-0.13,-0.731%,"268,921,553"
MKTW,"MarketWise, Inc. Class A Common Stock",$16.40,-0.11,-0.666%,"268,494,732"
IONR,ioneer Ltd American Depositary Shares,$4.59,0.18,4.082%,"268,302,547"
EB,"Eventbrite, Inc. Class A Common Stock",$2.78,-0.06,-2.113%,"268,270,231"
ALLO,"Allogene Therapeutics, Inc. Common Stock",$1.20,-0.03,-2.439%,"266,257,235"
ARL,"American Realty Investors, Inc. Common Stock",$16.43,UNCH,--,"265,378,066"
FHTX,Foghorn Therapeutics Inc. Common Stock,$4.69,-0.22,-4.481%,"265,125,555"
STXS,"Stereotaxis, Inc. Common Stock",$2.92,-0.01,-0.341%,"264,709,005"
ELVA,Electrovaya Inc. Common Shares,$6.60,-0.84,-11.29%,"264,705,639"
HRZN,Horizon Technology Finance Corporation Common Stock,$6.22,UNCH,--,"264,634,372"
VMD,"Viemed Healthcare, Inc. Common Shares",$6.68,-0.10,-1.475%,"264,561,433"
MEI,"Methode Electronics, Inc. Common Stock",$7.51,-0.24,-3.097%,"264,480,736"
FRST,Primis Financial Corp. Common Stock,$10.71,0.02,0.187%,"263,928,511"
PCYO,Pure Cycle Corporation Common Stock,$10.96,-0.02,-0.182%,"263,854,383"
COE,"51Talk Online Education Group American depositary shares, each representing 60 Class A ordinary shares",$44.99,-0.13,-0.288%,"263,617,780"
JBIO,"Jade Biosciences, Inc. Common Stock",$8.06,-0.06,-0.739%,"262,971,444"
FMFC,Kandal M Venture Limited Class A Ordinary Shares,$13.73,0.13,0.956%,"262,517,600"
RICK,"RCI Hospitality Holdings, Inc. Common Stock",$30.06,-0.73,-2.371%,"262,137,058"
PKBK,"Parke Bancorp, Inc. Common Stock",$22.07,0.145,0.661%,"261,467,638"
OM,"Outset Medical, Inc. Common Stock",$14.71,-0.08,-0.541%,"261,340,699"
ACRE,Ares Commercial Real Estate Corporation Common Stock,$4.75,-0.03,-0.628%,"261,275,427"
ISBA,Isabella Bank Corporation Common stock,$35.48,0.085,0.24%,"261,129,642"
WILC,"G. Willi-Food International,  Ltd. Ordinary Shares",$18.82,0.62,3.407%,"260,977,260"
ONEW,OneWater Marine Inc. Class A Common Stock,$15.92,0.15,0.951%,"260,617,166"
EOT,Eaton Vance Municipal Income Trust EATON VANCE NATIONAL MUNICIPAL OPPORTUNITIES TRUST,$16.62,0.01,0.06%,"259,686,187"
PTNM,Pitanium Limited Class A Ordinary shares,$11.38,2.77,32.172%,"258,895,000"
FTF,Franklin Limited Duration Income Trust Common Shares of Beneficial Interest,$6.36,-0.03,-0.469%,"256,978,179"
CTRN,"Citi Trends, Inc. Common Stock",$30.85,-0.53,-1.689%,"256,237,385"
LOVE,The Lovesac Company Common Stock,$17.53,-0.23,-1.295%,"256,118,717"
GEOS,Geospace Technologies Corporation Common Stock (Texas),$19.97,-0.445,-2.18%,"256,029,419"
ALCO,"Alico, Inc. Common Stock",$33.485,0.025,0.075%,"256,004,880"
FDBC,"Fidelity D & D Bancorp, Inc. Common Stock",$44.29,0.40,0.911%,"255,433,806"
CHMG,Chemung Financial Corp Common Stock,$53.315,0.255,0.481%,"255,428,913"
HUMA,"Humacyte, Inc. Common Stock",$1.61,-0.07,-4.167%,"254,979,199"
LFCR,"Lifecore Biomedical, Inc. Common Stock",$6.81,-0.245,-3.473%,"254,747,928"
EFTY,"Etoiles Capital Group Co., Ltd. Class A Ordinary Shares",$12.80,0.98,8.291%,"254,720,000"
PAMT,PAMT CORP Common Stock,$12.17,0.01,0.082%,"254,669,663"
SI,"Shoulder Innovations, Inc. Common Stock",$12.50,-0.39,-3.026%,"254,499,500"
FCEL,"FuelCell Energy, Inc. Common Stock",$7.88,-0.79,-9.112%,"254,488,351"
JRVR,"James River Group Holdings, Ltd. Common Shares",$5.54,-0.23,-3.986%,"254,377,150"
CRMT,America's Car-Mart Inc Common Stock,$30.69,-1.17,-3.672%,"254,057,774"
FOA,Finance of America Companies Inc. Class A Common Stock,$22.93,-0.73,-3.085%,"254,047,982"
VGZ,Vista Gold Corp Common Stock,$2.02,0.02,1.00%,"252,865,802"
CHPT,"ChargePoint Holdings, Inc. Common Stock",$10.82,-0.30,-2.698%,"252,682,273"
RDIB,Reading International Inc Class B Common Stock,$11.11,-0.34,-2.969%,"252,388,759"
GASS,"StealthGas, Inc. Common Stock",$6.82,-0.02,-0.292%,"252,194,591"
HYMC,Hycroft Mining Holding Corporation Class A Common Stock,$6.43,0.30,4.894%,"251,815,492"
ONTF,"ON24, Inc. Common Stock",$5.95,UNCH,--,"251,722,426"
PLG,Platinum Group Metals Ltd. Ordinary Shares (Canada),$2.33,0.23,10.952%,"251,594,675"
LIEN,"Chicago Atlantic BDC, Inc. Common Stock",$11.01,-0.075,-0.677%,"251,254,696"
WNEB,"Western New England Bancorp, Inc. Common Stock",$12.23,0.04,0.328%,"250,616,744"
NREF,"NexPoint Real Estate Finance, Inc. Common Stock",$14.14,0.05,0.355%,"250,586,648"
MBCN,Middlefield Banc Corp. Common Stock,$30.98,0.62,2.042%,"250,355,359"
HKD,AMTD Digital Inc. American Depositary Shares (every five of which represent two Class A Ordinary Shares),$1.98,-0.02,-1.00%,"249,804,663"
VPV,Invesco Pennsylvania Value Municipal Income Trust Common Stock (DE),$10.48,-0.05,-0.475%,"249,733,621"
OZ,"Belpointe PREP, LLC Class A Units",$64.195,0.395,0.619%,"249,508,183"
UFG,Uni-Fuels Holdings Limited Class A Ordinary Shares,$7.69,0.14,1.854%,"249,271,350"
NGNE,Neurogene Inc. Common Stock ,$17.405,0.155,0.899%,"248,402,698"
SSP,E.W. Scripps Company (The) Class A Common Stock,$2.81,-0.07,-2.431%,"248,216,101"
FLXS,"Flexsteel Industries, Inc. Common Stock",$46.76,-1.14,-2.38%,"246,704,030"
GHI,Greystone Housing Impact Investors LP Beneficial Unit Certificates representing assignments of limited partnership interests,$10.46,-0.08,-0.759%,"246,672,458"
WALD,Waldencast plc Class A Ordinary Share,$2.01,-0.01,-0.495%,"246,669,031"
INSE,"Inspired Entertainment, Inc. Common Stock",$9.16,-0.44,-4.583%,"246,591,835"
ACV,Virtus Diversified Income & Convertible Fund Common Shares of Beneficial Interest,$23.75,-0.38,-1.575%,"246,120,158"
FUNC,First United Corporation Common Stock,$37.89,0.32,0.852%,"246,080,811"
SKIN,The Beauty Health Company Class A Common Stock,$1.94,-0.11,-5.366%,"246,041,270"
RNAC,"Cartesian Therapeutics, Inc. Common Stock",$9.46,-0.61,-6.058%,"245,979,317"
SOHON,Sotherly Hotels Inc. 8.25% Series D Cumulative Redeemable Perpetual Preferred Stock,$11.97,-0.27,-2.206%,"245,271,297"
NRDY,Nerdy Inc. Class A Common Stock,$1.32,-0.03,-2.222%,"245,254,449"
FUND,"Sprott Focus Trust, Inc. Common Stock",$8.257,-0.003,-0.036%,"244,684,280"
OVLY,Oak Valley Bancorp (CA) Common Stock,$29.18,0.40,1.39%,"244,544,799"
QTRX,Quanterix Corporation Common Stock,$5.26,-0.04,-0.755%,"244,410,713"
IMMP,Immutep Limited American Depositary Shares,$1.68,-0.01,-0.592%,"244,367,399"
LYEL,"Lyell Immunopharma, Inc. Common Stock",$12.72,-0.73,-5.428%,"244,366,489"
KLTR,"Kaltura, Inc. Common Stock",$1.58,-0.02,-1.25%,"244,096,562"
MFIN,Medallion Financial Corp. Common Stock,$10.50,-0.11,-1.037%,"244,089,227"
DBVT,DBV Technologies S.A. American Depositary Shares,$8.89,-0.47,-5.021%,"243,539,230"
FBLA,"FB Bancorp, Inc. Common Stock",$12.25,-0.06,-0.487%,"243,009,375"
TNYA,"Tenaya Therapeutics, Inc. Common Stock",$1.49,-0.07,-4.487%,"242,834,392"
MITT,"AG Mortgage Investment Trust, Inc. Common Stock",$7.65,-0.17,-2.174%,"242,753,097"
TGEN,Tecogen Inc. Common Stock,$8.17,-0.38,-4.444%,"242,573,820"
TRVG,trivago N.V. American Depositary Shares,$3.45,0.02,0.583%,"242,560,202"
SDA,SunCar Technology Group Inc. Class A Ordinary Shares,$2.46,0.01,0.408%,"242,322,443"
FC,Franklin Covey Company Common Stock,$19.10,-0.40,-2.051%,"241,458,800"
FENC,Fennec Pharmaceuticals Inc. Common Stock,$8.70,0.30,3.571%,"241,277,100"
NNOX,NANO-X IMAGING LTD Ordinary Shares,$3.77,-0.19,-4.798%,"240,382,744"
BTM,Bitcoin Depot Inc. Class A Common Stock,$3.53,-0.04,-1.12%,"240,328,147"
SOHOB,Sotherly Hotels Inc. 8.0% Series B Cumulative Redeemable Perpetual Preferred Stock,$11.72,-0.1925,-1.616%,"240,148,672"
FVCB,"FVCBankcorp, Inc. Common Stock",$13.30,UNCH,--,"240,087,437"
NWFL,Norwood Financial Corp. Common Stock,$25.90,-0.35,-1.333%,"239,874,793"
CLLS,Cellectis S.A. American Depositary Shares,$3.32,-0.15,-4.323%,"239,351,658"
MGRM,Monogram Technologies Inc. Common Stock,$5.89,-0.01,-0.169%,"239,324,642"
ATNI,"ATN International, Inc. Common Stock",$15.65,-0.20,-1.262%,"238,778,169"
EGAN,eGain Corporation Common Stock,$8.88,-0.28,-3.057%,"238,579,555"
TLSI,"TriSalus Life Sciences, Inc. Common Stock",$4.76,-0.08,-1.653%,"237,368,248"
TPVG,TriplePoint Venture Growth BDC Corp. Common Stock,$5.88,-0.04,-0.676%,"237,103,597"
CATX,"Perspective Therapeutics, Inc. Common Stock",$3.19,-0.07,-2.147%,"236,898,938"
PBYI,Puma Biotechnology Inc Common Stock,$4.70,-0.02,-0.424%,"236,742,398"
SOHOO,Sotherly Hotels Inc. 7.875% Series C Cumulative Redeemable Perpetual Preferred Stock,$11.55,0.27,2.394%,"236,665,287"
AMPY,Amplify Energy Corp. Common Stock,$5.84,1.04,21.667%,"236,321,750"
HUSA,Houston American Energy Corporation Common Stock,$6.98,0.18,2.647%,"236,220,071"
STRZ,Starz Entertainment Corp. Common Shares,$14.12,-0.69,-4.659%,"236,111,957"
BZUN,Baozun Inc. American Depositary Shares,$4.08,-0.07,-1.687%,"235,610,408"
RGCO,RGC Resources Inc. Common Stock,$22.80,0.08,0.352%,"235,421,719"
FGNX,FG Nexus Inc. Common Stock ,$6.65,0.45,7.258%,"235,113,177"
OGI,Organigram Global Inc. Common Shares,$1.75,-0.06,-3.315%,"234,538,792"
SLN,Silence Therapeutics Plc American Depository Share,$5.00,-0.14,-2.724%,"234,000,000"
AREC,American Resources Corporation Class A Common Stock,$2.76,-0.13,-4.498%,"233,520,619"
OSUR,"OraSure Technologies, Inc. Common Stock",$3.19,-0.04,-1.238%,"233,306,989"
AFRI,Forafric Global PLC Ordinary Shares,$8.66,-0.07,-0.802%,"232,967,787"
XGN,Exagen Inc. Common Stock,$10.57,-0.21,-1.948%,"232,578,485"
UHG,"United Homes Group, Inc Class A Common Stock",$3.95,-0.11,-2.709%,"232,271,293"
SGMT,Sagimet Biosciences Inc. Series A Common Stock,$7.14,-0.14,-1.923%,"232,204,217"
VIOT,"Viomi Technology Co., Ltd American Depositary Shares",$3.40,-0.13,-3.683%,"231,906,204"
VOR,Vor Biopharma Inc. Common Stock,$33.81,-0.88,-2.537%,"231,298,741"
AVIR,"Atea Pharmaceuticals, Inc. Common Stock",$2.91,0.01,0.345%,"230,930,479"
TLSA,Tiziana Life Sciences Ltd. Common Shares,$2.07,0.10,5.076%,"230,727,617"
TWNP,Twin Hospitality Group Inc. Class A Common Stock,$4.0243,-0.0057,-0.141%,"230,696,442"
LITB,"LightInTheBox Holding Co., Ltd. American Depositary Shares, each representing twelve ordinary shares",$2.09,0.06,2.956%,"230,598,858"
DOYU,DouYu International Holdings Limited ADS,$7.63,-0.02,-0.261%,"230,264,694"
SOPH,SOPHiA GENETICS SA Ordinary Shares,$3.43,-0.35,-9.259%,"229,230,574"
ISTR,Investar Holding Corporation Common Stock,$23.30,-0.03,-0.129%,"228,986,598"
GLDG,GoldMining Inc. Common Shares,$1.15,-0.03,-2.542%,"228,911,186"
ALTG,Alta Equipment Group Inc. Class A Common Stock,$7.14,-0.24,-3.252%,"228,822,313"
INGN,"Inogen, Inc Common Stock",$8.46,0.03,0.356%,"228,761,699"
IMMR,Immersion Corporation Common Stock,$7.06,-0.13,-1.808%,"228,718,810"
SLND,"Southland Holdings, Inc. Common Stock",$4.22,-0.31,-6.843%,"228,357,012"
SLSN,"Solesence, Inc. Common Stock",$3.23,-0.20,-5.831%,"227,656,682"
REI,"Ring Energy, Inc. Common Stock",$1.10,0.02,1.852%,"227,199,247"
SRG,Seritage Growth Properties Class A Common Stock,$4.03,-0.05,-1.225%,"226,988,166"
VYGR,"Voyager Therapeutics, Inc. Common Stock",$4.09,-0.16,-3.765%,"226,867,417"
SNFCA,Security National Financial Corporation Class A Common Stock,$8.73,-0.10,-1.133%,"226,827,068"
FSFG,"First Savings Financial Group, Inc. Common Stock",$32.46,4.78,17.269%,"226,459,073"
CNFRZ,"Conifer Holdings, Inc. 9.75% Senior Unsecured Notes due 2028",$18.51,UNCH,--,"226,245,527"
VUZI,Vuzix Corporation Common Stock,$2.92,-0.22,-7.006%,"225,837,741"
SLNHP,"Soluna Holdings, Inc 9.0% Series A Cumulative Perpetual Preferred Stock ",$7.49,-0.58,-7.187%,"225,793,225"
RDCM,Radcom Ltd. Ordinary Shares,$14.16,-0.81,-5.411%,"225,365,123"
YMT,Yimutian Inc. American Depositary Shares,$1.97,-0.04,-1.99%,"225,322,830"
PVBC,"Provident Bancorp, Inc. (MD) Common Stock",$12.66,0.01,0.079%,"225,146,048"
AOMR,"Angel Oak Mortgage REIT, Inc. Common Stock",$9.47,-0.09,-0.941%,"225,056,463"
VNTG,Vantage Corp Class A Ordinary Shares,$7.09,0.22,3.202%,"225,018,875"
FLX,BingEx Limited American Depositary Shares,$3.15,-0.06,-1.869%,"224,059,217"
USAU,U.S. Gold Corp. Common Stock,$15.60,0.48,3.175%,"223,829,502"
NXXT,"NextNRG, Inc. Common Stock",$1.80,-0.13,-6.736%,"223,560,317"
CFFI,C&F Financial Corporation Common Stock,$68.73,-0.22,-0.319%,"222,568,428"
FCCO,First Community Corporation Common Stock,$28.91,-0.12,-0.413%,"222,195,148"
ASUR,"Asure Software, Inc Common Stock",$8.10,-0.05,-0.613%,"222,142,573"
ELLO,Ellomay Capital Ltd Ordinary Shares (Israel),$17.28,-0.22,-1.257%,"222,092,669"
FFAI,Faraday Future Intelligent Electric Inc. Class A Common Stock,$1.51,-0.14,-8.485%,"221,711,440"
LCNB,LCNB Corporation Common Stock,$15.62,-0.14,-0.888%,"221,427,417"
REKR,"Rekor Systems, Inc. Common Stock",$1.75,-0.04,-2.235%,"221,084,560"
FNKO,"Funko, Inc. Class A Common Stock",$3.98,-0.20,-4.785%,"220,354,332"
EICA,Eagle Point Income Company Inc. 5.00% Series A Term Preferred Stock due 2026,$24.6799,0.0099,0.04%,"219,851,215"
RCKY,"Rocky Brands, Inc. Common Stock",$29.42,0.07,0.239%,"219,718,592"
MYFW,"First Western Financial, Inc. Common Stock",$22.595,-0.185,-0.812%,"219,576,448"
GHG,"GreenTree Hospitality Group Ltd. American depositary shares, each representing one Class A ordinary share",$2.16,-0.01,-0.461%,"219,292,901"
ZJK,"ZJK Industrial Co., Ltd. Ordinary Shares",$3.57,-0.09,-2.459%,"219,131,059"
AXTI,AXT Inc Common Stock,$4.75,-0.08,-1.656%,"219,093,441"
MFM,MFS Municipal Income Trust Common Stock,$5.30,-0.02,-0.376%,"218,294,444"
GPJA,"Georgia Power Company Series 2017A 5.00% Junior Subordinated Notes due October 1, 2077",$23.57,-0.18,-0.758%,"218,293,555"
PRQR,ProQR Therapeutics N.V. Ordinary Shares,$2.07,-0.03,-1.429%,"217,789,931"
BPRN,"Princeton Bancorp, Inc. Common Stock (PA)",$32.20,-0.75,-2.276%,"217,283,121"
BTCS,BTCS Inc. Common Stock,$4.52,-0.33,-6.804%,"217,198,557"
SRI,"Stoneridge, Inc. Common Stock",$7.75,-0.28,-3.487%,"217,050,329"
EWCZ,"European Wax Center, Inc. Class A Common Stock",$3.93,-0.24,-5.755%,"217,019,571"
BYND,"Beyond Meat, Inc. Common Stock",$2.83,-0.07,-2.414%,"216,908,522"
CDXS,"Codexis, Inc. Common Stock",$2.40,-0.08,-3.226%,"216,641,914"
FRAF,Franklin Financial Services Corporation Common Stock,$48.27,-0.14,-0.289%,"216,087,944"
HWBK,"Hawthorn Bancshares, Inc. Common Stock",$31.20,-0.16,-0.51%,"215,466,202"
INBKZ,First Internet Bancorp 6.0% Fixed-to-Floating Rate Subordinated Notes Due 2029,$24.6523,0.0023,0.009%,"214,797,807"
EVC,Entravision Communications Corporation Common Stock,$2.36,-0.04,-1.667%,"214,704,040"
LVRO,Lavoro Limited Class A Ordinary Shares,$1.84,0.03,1.657%,"214,559,325"
MIMI,Mint Incorporation Limited Class A Ordinary Shares,$8.56,0.69,8.767%,"214,107,000"
EARN,Ellington Credit Company Common Shares of Beneficial Interest,$5.69,0.04,0.708%,"213,711,820"
SSSS,SuRo Capital Corp. Common Stock,$8.94,-0.09,-0.997%,"213,559,677"
BRLT,"Brilliant Earth Group, Inc. Class A Common Stock",$2.14,-0.05,-2.283%,"213,471,632"
BMNR,"BitMine Immersion Technologies, Inc. Common Stock",$49.57,-2.35,-4.526%,"213,317,853"
MDXH,MDxHealth SA Ordinary Shares,$4.30,-0.08,-1.826%,"212,838,536"
CV,"CapsoVision, Inc. Common Stock",$4.55,0.03,0.664%,"212,822,005"
EFSI,Eagle Financial Services Inc Common Stock,$39.49,-0.10,-0.253%,"212,311,904"
TRDA,"Entrada Therapeutics, Inc. Common Stock",$5.58,0.43,8.35%,"212,246,901"
FRGE,"Forge Global Holdings, Inc. Common Stock",$15.59,-0.47,-2.927%,"212,045,234"
INSG,Inseego Corp. Common Stock,$14.09,-0.10,-0.705%,"211,954,743"
OPBK,OP Bancorp Common Stock,$14.23,-0.12,-0.836%,"211,822,287"
GENC,"Gencor Industries, Inc. Common Stock",$14.45,-0.37,-2.497%,"211,803,794"
CBNA,"Chain Bridge Bancorp, Inc. Class A Common Stock",$32.21,0.64,2.027%,"211,356,126"
CABA,"Cabaletta Bio, Inc. Common Stock",$2.31,-0.16,-6.478%,"211,284,688"
CCRD,CoreCard Corporation Common Stock,$27.06,-0.28,-1.024%,"210,861,857"
MPV,Barings Participation Investors Common Stock,$19.88,0.42,2.158%,"210,761,796"
TFSA,"Terra Income Fund 6, LLC 7.00% Notes due 2026",$24.95,UNCH,--,"210,550,281"
VTN,Invesco Trust for Investment Grade New York Municipals Common Stock,$10.80,-0.02,-0.185%,"210,448,573"
PLTS,Platinum Analytics Cayman Limited Class A Ordinary Shares,$11.85,-0.20,-1.66%,"210,445,442"
ETX           ,Eaton Vance Municipal Income 2028 Term Trust Common Shares of Beneficial Interest,$19.33,-0.02,-0.103%,"210,406,199"
TNXP,Tonix Pharmaceuticals Holding Corp. Common Stock,$24.00,-0.70,-2.834%,"210,381,504"
ATLN,Atlantic International Corp. Common Stock,$3.60,-0.60,-14.286%,"210,151,757"
KINS,"Kingstone Companies, Inc. Common Stock",$14.85,0.24,1.643%,"209,987,969"
CRNT,Ceragon Networks Ltd. Ordinary Shares,$2.36,-0.11,-4.453%,"209,660,226"
FXNC,First National Corporation Common Stock,$23.30,-0.16,-0.682%,"209,446,915"
