Symbol,Name,Last Sale,Net Change,% Change,Market Cap
UFG,Uni-Fuels Holdings Limited Class A Ordinary Shares,$0.785,-0.035,-4.268%,"25,485,025"
CELU,Celularity Inc. Class A Common Stock,$0.8799,-0.0276,-3.041%,"25,469,551"
RCON,"Recon Technology, Ltd. Class A Ordinary Shares",$0.8301,-0.0099,-1.179%,"25,423,826"
JVA,"Coffee Holding Co., Inc. Common Stock",$4.44,0.18,4.225%,"25,346,180"
DFLI,Dragonfly Energy Holdings Corp. Common Stock (NV),$2.07,UNCH,--,"25,147,981"
JL,J-Long Group Limited Class A Ordinary Shares,$6.68,0.125,1.907%,"25,128,163"
EVLVW,"Evolv Technologies Holdings, Inc. Warrant",$0.14,0.001,0.719%,"25,109,779"
UONEK,"Urban One, Inc. Class D Common Stock",$5.70,-0.025,-0.437%,"24,954,674"
CCM,Concord Medical Services Holdings Limited American Depositary Shares (Each represents thirty (30) Class A ordinary shares),$5.74,0.60,11.673%,"24,921,490"
VNTG,Vantage Corp Class A Ordinary Shares,$0.7851,-0.015,-1.875%,"24,917,111"
UTSI,UTStarcom Holdings Corp. Ordinary Shares,$2.61,0.11,4.40%,"24,779,627"
EFOI,"Energy Focus, Inc. Common Stock",$3.93,0.09,2.344%,"24,772,492"
CPOP,"Pop Culture Group Co., Ltd Class A Ordinary Shares",$0.3021,-0.0115,-3.667%,"24,753,784"
PDC,Perpetuals.com Ltd American Depositary Shares,$8.09,0.05,0.622%,"24,679,111"
VWAVW,"VisionWave Holdings, Inc. Warrant",$1.03,0.0102,1.00%,"24,562,551"
CLIR,ClearSign Technologies Corporation Common Stock (DE),$4.54,-0.29,-6.004%,"24,557,464"
ICMB,"Investcorp Credit Management BDC, Inc. Common Stock",$1.69,0.02,1.198%,"24,390,878"
MRKR,"Marker Therapeutics, Inc. Common Stock",$1.46,0.02,1.389%,"24,342,765"
VTGN,"Vistagen Therapeutics, Inc. Common Stock",$0.6105,0.0237,4.039%,"24,188,204"
ZKIN,"ZK International Group Co., Ltd Ordinary Share",$1.40,-0.05,-3.448%,"24,181,231"
QRHC,Quest Resource Holding Corporation Common Stock,$1.15,0.07,6.481%,"24,103,714"
RDI,Reading International Inc Class A Common Stock,$1.06,-0.02,-1.852%,"24,080,296"
TMDE,TMD Energy Limited Ordinary Shares,$1.02,-0.03,-2.857%,"24,036,300"
EHLD,Euroholdings Ltd. Common Stock ,$8.51,0.01,0.118%,"23,969,394"
ALLR,"Allarity Therapeutics, Inc. Common Stock",$1.55,0.05,3.333%,"23,964,122"
SDST,Stardust Power Inc. Common Stock,$2.40,0.02,0.84%,"23,919,535"
FEDU,"Four Seasons Education (Cayman) Inc. American Depositary Shares, each ADS representing 10 ordinary shares",$10.50,UNCH,--,"23,730,609"
CHAI,"Core AI Holdings, Inc. Common Shares",$1.19,-0.12,-9.16%,"23,707,683"
RMCF,"Rocky Mountain Chocolate Factory, Inc. Common Stock",$2.54,UNCH,--,"23,705,368"
ORIO,Orion Digital Corp. Common Shares,$0.99,-0.04,-3.883%,"23,704,115"
MVO,MV Oil Trust Units of Beneficial Interests,$2.06,-0.16,-7.207%,"23,690,000"
AEON,"AEON Biopharma, Inc. Class A Common Stock",$0.90,-0.01,-1.099%,"23,676,490"
YSXT,"YSX Tech. Co., Ltd Class A Ordinary Shares",$1.01,-0.02,-1.942%,"23,671,875"
SLGB,Smart Logistics Global Limited Ordinary Shares,$0.55,-0.038,-6.463%,"23,650,000"
LTRN,Lantern Pharma Inc. Common Stock,$2.10,0.06,2.941%,"23,634,864"
RYOJ,"rYojbaba Co., Ltd. Common Shares",$2.02,-0.02,-0.98%,"23,331,000"
ZBAO,Zhibao Technology Inc. Class A Ordinary Shares,$0.6802,0.0601,9.692%,"23,168,763"
OTLK,"Outlook Therapeutics, Inc. Common Stock",$0.2213,0.0056,2.596%,"23,151,127"
TXMD,"TherapeuticsMD, Inc. Common Stock",$1.98,-0.03,-1.493%,"22,917,237"
MSW,Ming Shing Group Holdings Limited Ordinary Shares,$1.76,-0.17,-8.808%,"22,836,000"
KWM,"K Wave Media, Ltd. Ordinary Shares",$0.31,-0.0039,-1.242%,"22,705,588"
LIQT,"LiqTech International, Inc. Common Stock",$2.27,-0.0373,-1.617%,"22,581,599"
CRIS,"Curis, Inc. Common Stock",$0.561,-0.016,-2.773%,"22,428,047"
ONEG,OneConstruction Group Limited Ordinary Shares,$1.40,0.11,8.527%,"22,400,000"
CKX,"CKX Lands, Inc. Common Stock",$10.86,0.1399,1.305%,"22,296,981"
XOS,"Xos, Inc. Common Stock",$1.84,-0.01,-0.541%,"22,183,428"
CYN,Cyngn Inc. Common Stock,$1.63,-0.05,-2.976%,"22,181,498"
NTCL,NETCLASS TECHNOLOGY INC Class A Ordinary Shares,$0.37,-0.0091,-2.40%,"22,178,874"
TRAW,"Traws Pharma, Inc. Common Stock",$2.18,0.48,28.235%,"22,142,820"
ANNAW,"AleAnna, Inc. Warrant",$0.33,0.01,3.125%,"22,088,352"
VYNE,VYNE Therapeutics Inc. Common Stock,$0.6606,-0.0129,-1.915%,"22,032,898"
FLUX,"Flux Power Holdings, Inc. Common Stock",$1.03,-0.27,-20.769%,"21,980,339"
AFRIW,Forafric Global PLC Warrants,$0.81,0.0375,4.854%,"21,790,290"
GWH,"ESS Tech, Inc. Common Stock",$0.7801,-0.3399,-30.348%,"21,782,725"
SMSI,"Smith Micro Software, Inc. Common Stock",$0.8474,0.0048,0.57%,"21,657,348"
ADGM,"Adagio Medical Holdings, Inc Common Stock",$0.975,0.022,2.308%,"21,655,198"
PSHG,Performance Shipping Inc. Common Shares,$1.73,-0.08,-4.42%,"21,506,422"
XCUR,"Exicure, Inc. Common Stock",$3.37,0.02,0.597%,"21,480,094"
CPHI,"China Pharma Holdings, Inc. Common Stock",$0.53,0.0039,0.741%,"21,476,661"
NYC,American Strategic Investment Co. Class A Common Stock,$7.96,-0.1681,-2.068%,"21,435,810"
LHAI,Linkhome Holdings Inc. Common stock,$1.32,-0.02,-1.493%,"21,423,600"
USEA,United Maritime Corporation Common Stock,$2.34,0.06,2.632%,"21,349,329"
LSH,Lakeside Holding Limited Common Stock,$0.617,0.0055,0.899%,"21,241,804"
WETH,Wetouch Technology Inc. Common Stock,$1.78,-0.01,-0.559%,"21,238,131"
GRDX,GridAI Technologies Corp. Common Stock,$3.42,0.57,20.00%,"21,204,174"
NCI,Neo-Concept International Group Holdings Limited Class A Ordinary Shares,$1.12,0.01,0.901%,"21,183,700"
CNF,"CNFinance Holdings Limited American Depositary Shares, each representing two hundred (200) Ordinary Shares",$3.05,-0.05,-1.613%,"20,917,559"
HHS,"Harte Hanks, Inc. Common Stock",$2.82,0.04,1.439%,"20,909,719"
MOBX,"Mobix Labs, Inc. Class A Common Stock",$2.00,-0.14,-6.542%,"20,888,710"
QNCX,"Quince Therapeutics, Inc. Common Stock",$1.28,-0.02,-1.538%,"20,865,016"
RVP,"Retractable Technologies, Inc. Common Stock",$0.6969,-0.008,-1.135%,"20,863,206"
AUID,authID Inc. Common Stock,$1.29,0.05,4.032%,"20,810,908"
SBCWW,SBC Medical Group Holdings Incorporated Warrants,$0.2025,-0.0075,-3.571%,"20,771,831"
BAERW,"Bridger Aerospace Group Holdings, Inc. Warrant",$0.36,-0.02,-5.263%,"20,749,551"
SAIH,SAIHEAT Limited Class A Ordinary Shares,$11.30,0.15,1.345%,"20,705,668"
TRSG,Tungray Technologies Inc Class A Ordinary Shares,$1.263,-0.037,-2.846%,"20,654,452"
TC,Token Cat Limited American Depositary Shares,$10.3294,0.7794,8.161%,"20,532,564"
GRAN,Grande Group Limited Class A Ordinary Shares,$0.9001,-0.1099,-10.881%,"20,477,275"
MODD,"Modular Medical, Inc. Common Stock",$3.78,-0.17,-4.304%,"20,454,249"
SNAL,"Snail, Inc. Class A Common Stock",$0.4797,-0.0323,-6.309%,"20,445,774"
FENG,"Phoenix New Media Limited American Depositary Shares, each representing 48 Class A ordinary shares.",$1.70,-0.0264,-1.529%,"20,418,319"
GREE,Greenidge Generation Holdings Inc. Class A Common Stock,$1.21,-0.01,-0.82%,"20,336,614"
OMH,Ohmyhome Limited Class A Ordinary Shares,$0.8801,-0.0299,-3.286%,"20,331,305"
REBN,"Reborn Coffee, Inc. Common Stock",$2.44,-0.01,-0.408%,"20,040,830"
ACCL,Acco Group Holdings Limited Class A Ordinary Shares,$1.44,-0.04,-2.703%,"20,016,000"
MNDO,MIND C.T.I. Ltd. Ordinary Shares,$0.99,-0.02,-1.98%,"19,983,314"
AHT,Ashford Hospitality Trust Inc Common Stock,$3.08,-0.03,-0.965%,"19,947,592"
RECT,Rectitude Holdings Ltd Ordinary Shares,$1.37,-0.03,-2.143%,"19,865,000"
COCP,"Cocrystal Pharma, Inc. Common Stock",$1.44,0.05,3.597%,"19,851,493"
KTTA,Pasithea Therapeutics Corp. Common Stock,$0.7953,-0.0447,-5.321%,"19,834,741"
TLF,"Tandy Leather Factory, Inc. Common Stock",$2.43,-0.02,-0.816%,"19,788,873"
LGVN,Longeveron Inc. Class A Common Stock,$0.8452,-0.0066,-0.775%,"19,665,906"
RDZNW,"Roadzen, Inc. Warrants",$0.245,0.0244,11.061%,"19,525,440"
TOPP,Toppoint Holdings Inc. Common Stock,$0.9899,-0.0101,-1.01%,"19,501,030"
ICCM,IceCure Medical Ltd. Ordinary Shares,$0.24,-0.01,-4.00%,"19,483,211"
SAGT,SAGTEC GLOBAL LIMITED Class A Ordinary shares,$1.55,-0.09,-5.488%,"19,452,500"
CTRM,Castor Maritime Inc. Common Shares,$2.01,-0.01,-0.495%,"19,421,332"
ECXWW,ECARX Holdings Inc. Warrants,$0.0505,UNCH,--,"19,243,529"
EPOW,E-Power Inc. Class A Ordinary Shares,$0.7125,-0.0628,-8.10%,"19,228,202"
FOFO,"Hang Feng Technology Innovation Co., Ltd. Ordinary Shares",$2.52,-0.10,-3.817%,"19,079,117"
IINN,Inspira Technologies Oxy B.H.N. Ltd. Ordinary Shares,$0.4339,-0.0161,-3.578%,"19,055,585"
APUS,"Apimeds Pharmaceuticals US, Inc. Common Stock",$1.5135,0.0635,4.379%,"19,033,750"
HOVRW,New Horizon Aircraft Ltd. Warrant,$0.42,0.0125,3.067%,"19,010,606"
PASW,"Ping An Biomedical Co., Ltd. Ordinary Shares",$0.152,0.002,1.333%,"18,931,600"
MXC,Mexco Energy Corporation Common Stock,$9.2484,-0.1416,-1.508%,"18,922,226"
OSRH,"OSR Holdings, Inc. Common Stock",$0.5705,-0.1206,-17.45%,"18,897,673"
BNKK,"Bonk, Inc. Common Stock",$2.40,-0.10,-4.00%,"18,884,299"
AUST,Austin Gold Corp. Common Shares,$1.37,0.04,3.008%,"18,759,411"
CVKD,"Cadrenal Therapeutics, Inc. Common Stock",$6.09,0.07,1.163%,"18,746,524"
MOGU,MOGU Inc. American Depositary Shares (each  representing 25 Class A Ordinary Shares),$2.29,0.06,2.691%,"18,717,638"
MRNO,Murano Global Investments PLC Ordinary Shares,$0.236,0.0145,6.546%,"18,716,154"
JF,J and Friends Holdings Limited American Depositary Shares,$1.02,UNCH,--,"18,706,957"
YHC,LQR House Inc. Common Stock,$0.8701,0.0301,3.583%,"18,595,478"
NTRBW,Nutriband Inc. Warrant,$1.525,UNCH,--,"18,537,874"
NXPL,NextPlat Corp Common Stock,$6.77,-0.21,-3.009%,"18,336,592"
MDRR,"Medalist Diversified, Inc. Common Stock",$11.1501,UNCH,--,"18,157,938"
TPET,Trio Petroleum Corp. Common Stock,$0.457,-0.0137,-2.911%,"18,132,367"
SEGG,Sports Entertainment Gaming Global Corporation Common Stock,$1.43,0.04,2.878%,"18,080,129"
DFNS,T3 Defense Inc. Common Stock,$0.4778,0.0328,7.371%,"18,072,086"
EQS,"Equus Total Return, Inc. Common Stock",$1.29,0.1601,14.169%,"18,017,038"
NCEL,NewcelX Ltd. Ordinary Shares,$3.36,0.12,3.704%,"17,959,818"
ICU,SeaStar Medical Holding Corporation Common Stock,$4.49,-0.37,-7.613%,"17,946,539"
IRIX,IRIDEX Corporation Common Stock,$1.03,UNCH,--,"17,917,211"
VNRX,VolitionRX Limited Common Stock,$2.25,-0.17,-7.025%,"17,829,140"
DLPN,"Dolphin Entertainment, Inc. Common Stock",$1.43,-0.01,-0.694%,"17,760,094"
LRE,"Lead Real Estate Co., Ltd American Depositary Shares",$1.30,-0.0004,-0.031%,"17,734,470"
LPCN,Lipocine Inc. Common Stock,$2.37,-0.02,-0.837%,"17,716,023"
COOT,Australian Oilseeds Holdings Limited Ordinary Shares,$0.6348,-0.0151,-2.323%,"17,709,992"
ZDAI,"DirectBooking Technology Co., Ltd. Class A Ordinary Shares",$2.18,-0.02,-0.909%,"17,535,375"
LFWD,Lifeward Ltd. Ordinary Shares,$6.30,-0.46,-6.805%,"17,505,086"
COSM,Cosmos Health Inc. Common Stock,$0.3323,-0.0177,-5.057%,"17,484,664"
SWVL,Swvl Holdings Corp Class A Common Shares,$1.75,-0.09,-4.891%,"17,437,602"
GRNQ,Greenpro Capital Corp. Common Stock,$2.02,-0.23,-10.222%,"17,424,142"
THH,TryHard Holdings Limited Ordinary Shares,$0.3231,-0.0019,-0.585%,"17,333,103"
PRHI,"Presurance Holdings, Inc. Common Stock",$0.66,-0.0051,-0.767%,"17,307,101"
LEDS,SemiLEDS Corporation Common Stock,$2.08,0.05,2.463%,"17,175,918"
HUDI,"Huadi International Group Co., Ltd. Ordinary Shares",$1.20,-0.01,-0.826%,"17,159,018"
BNCWZ,CEA Industries Inc. Warrant,$0.40,-0.0208,-4.943%,"17,158,336"
HUIZ,Huize Holding Limited American Depositary Shares,$1.69,0.13,8.333%,"17,079,268"
AIIO,Robo.ai Inc. Class B Ordinary Shares,$0.86,0.2708,45.961%,"17,013,835"
AGAE,Allied Gaming & Entertainment Inc. Common Stock,$0.45,-0.07,-13.462%,"16,968,119"
NIXX,"Nixxy, Inc. Common Stock",$0.6294,-0.0298,-4.521%,"16,926,093"
TOMZ,"TOMI Environmental Solutions, Inc. Common Stock",$0.824,0.115,16.22%,"16,925,404"
DFDVW,DeFi Development Corp. Warrant,$0.5725,0.013,2.324%,"16,887,258"
MGIH,Millennium Group International Holdings Limited Ordinary Shares,$1.50,0.03,2.041%,"16,875,000"
EPSM,Epsium Enterprise Limited Class A Ordinary Shares,$1.25,-0.05,-3.846%,"16,797,543"
SGRP,"SPAR Group, Inc. Common Stock",$0.6673,-0.0154,-2.256%,"16,769,243"
LGPS,LogProstyle Inc. Common Shares,$0.7078,-0.0122,-1.694%,"16,740,963"
IPM,Intelligent Protection Management Corp. Common Stock ,$1.84,-0.02,-1.075%,"16,717,741"
MDCXW,Medicus Pharma Ltd. Warrant,$0.4228,-0.0672,-13.714%,"16,642,300"
BESS,Bimergen Energy Corporation Common Stock,$2.35,0.03,1.293%,"16,620,547"
ZJYL,JIN MEDICAL INTERNATIONAL LTD. Class A Ordinary Shares,$2.12,-0.08,-3.636%,"16,593,993"
UUU,"Universal Safety Products, Inc. Common Stock",$6.08,-0.07,-1.138%,"16,524,145"
NAII,"Natural Alternatives International, Inc. Common Stock",$2.67,-0.07,-2.555%,"16,491,997"
YMT,Yimutian Inc. American Depositary Shares,$0.1441,0.0005,0.348%,"16,481,736"
GYRO,"Gyrodyne, LLC Common Stock",$7.48,-0.08,-1.058%,"16,450,824"
DOGZ,Dogness (International) Corporation Class A Common Stock,$1.13,0.01,0.893%,"16,397,044"
FAMI,"Farmmi, Inc. Class A Ordinary Shares",$1.18,0.02,1.724%,"16,301,945"
SCNX,"Scienture Holdings, Inc. Common Stock",$0.40,-0.0249,-5.86%,"16,252,326"
TOVX,"Theriva Biologics, Inc. Common Stock",$0.354,-0.006,-1.667%,"16,246,004"
AQMS,"Aqua Metals, Inc. Common Stock",$4.83,-0.31,-6.031%,"16,183,417"
TURB,"Turbo Energy, S.A. American Depositary Shares",$1.33,-0.16,-10.738%,"15,982,796"
MWYN,"Marwynn Holdings, Inc. Common stock",$0.7904,0.0103,1.32%,"15,961,973"
EDTK,Skillful Craftsman Education Technology Limited Ordinary Share,$1.00,UNCH,--,"15,929,451"
GIGM,GigaMedia Limited Ordinary Shares,$1.44,0.01,0.699%,"15,915,218"
GFAI,"Guardforce AI Co., Limited Ordinary Shares",$0.509,0.0365,7.725%,"15,906,463"
PMI,"Picard Medical, Inc. Common Stock",$0.2083,-0.0126,-5.704%,"15,700,712"
INTZ,Intrusion Inc. Common Stock,$0.7703,-0.03,-3.749%,"15,690,292"
RVSN,Rail Vision Ltd. Ordinary Share,$7.15,0.20,2.878%,"15,674,130"
BRN,"Barnwell Industries, Inc. Common Stock",$1.10,-0.01,-0.901%,"15,656,585"
INAB,"IN8bio, Inc. Common Stock",$1.58,-0.02,-1.25%,"15,558,401"
HUMAW,"Humacyte, Inc. Warrant",$0.07,UNCH,--,"15,541,338"
EBON,Ebang International Holdings Inc. Class A Ordinary Shares,$2.3399,-0.0601,-2.504%,"15,312,161"
SLAI,SOLAI Limited American Depositary Shares (each representing one hundred (100) Class A Ordinary Shares),$0.77,-0.04,-4.938%,"15,233,192"
LZMH,LZ Technology Holdings Limited Class B Ordinary Shares,$0.0958,0.0001,0.104%,"15,138,316"
LEXX,Lexaria Bioscience Corp. Common Stock,$0.6098,-0.0309,-4.823%,"15,115,385"
INTJ,Intelligent Group Limited Class A Ordinary Shares ,$9.80,-0.20,-2.00%,"15,067,480"
NWGL,CL Workshop Group Limited American Depositary Shares,$0.91,0.008,0.887%,"15,063,380"
LESL,"Leslie's, Inc. Common Stock",$1.61,0.18,12.587%,"14,999,686"
CHOW,ChowChow Cloud International Holdings Limited Ordinary Shares,$0.4266,0.0036,0.851%,"14,973,660"
PRZO,ParaZero Technologies Ltd. Ordinary Shares,$0.6361,-0.0159,-2.439%,"14,901,855"
GNTA,Genenta Science S.p.A. American Depositary Shares,$0.6261,-0.0141,-2.202%,"14,770,338"
TBH,"Brag House Holdings, Inc. Common Stock",$0.6279,-0.0221,-3.40%,"14,753,217"
WIMI,WiMi Hologram Cloud Inc. Class B Ordinary Shares,$1.60,-0.02,-1.235%,"14,708,043"
SKYQ,Sky Quarry Inc. Common Stock,$3.91,-0.06,-1.511%,"14,691,626"
MYND,"Mynd.ai, Inc. American Depositary Shares",$0.3217,0.0085,2.714%,"14,684,891"
WVVI,"Willamette Valley Vineyards, Inc. Common Stock",$2.94,0.043,1.484%,"14,639,815"
HKPD,"Cellyan Biotechnology Co., Ltd Class A Ordinary Shares",$0.6224,-0.0176,-2.75%,"14,626,391"
AIRI,Air Industries Group Common Stock,$3.04,-0.04,-1.299%,"14,534,404"
REE,REE Automotive Ltd. Class A Ordinary Shares,$0.4675,0.0345,7.968%,"14,502,286"
HIND,"Vyome Holdings, Inc. Common Stock",$2.06,-0.04,-1.905%,"14,458,168"
CVM,Cel-Sci Corporation Common Stock,$1.70,0.10,6.25%,"14,437,721"
MMA,Mixed Martial Arts Group Limited Ordinary Shares,$0.545,-0.0009,-0.165%,"14,433,530"
AKAN,Akanda Corp. Common Shares,$27.00,-10.19,-27.40%,"14,429,286"
AIDX,"20/20 Biolabs, Inc. Common Stock",$1.37,-0.01,-0.725%,"14,357,722"
BNGO,"Bionano Genomics, Inc. Common Stock",$1.29,-0.04,-3.008%,"14,308,183"
STAK,STAK Inc. Class A Ordinary Shares,$1.08,0.01,0.935%,"14,267,177"
BMGL,Basel Medical Group Ltd Ordinary Shares,$0.759,-0.001,-0.132%,"14,258,384"
SVRN,OceanPal Inc. Common Stock,$8.27,0.05,0.608%,"14,183,248"
FMSTW,Foremost Clean Energy Ltd. Warrant,$0.865,-0.115,-11.735%,"14,084,287"
CTXR,"Citius Pharmaceuticals, Inc. Common Stock",$0.64,-0.0141,-2.156%,"14,005,466"
HCAI,"Huachen AI Parking Management Technology Holding Co., Ltd. Class A Ordinary Shares",$12.00,-2.50,-17.241%,"13,950,000"
WVVIP,"Willamette Valley Vineyards, Inc. Series A Redeemable Preferred Stock",$2.80,-0.065,-2.269%,"13,942,681"
SURG,"SurgePays, Inc. Common Stock",$0.555,-0.0029,-0.52%,"13,942,652"
BANL,CBL International Limited Class B Ordinary Shares,$0.5054,0.0081,1.629%,"13,898,665"
BFRI,Biofrontera Inc. Common Stock,$1.15,0.01,0.877%,"13,808,692"
CSAI,"Cloudastructure, Inc. Class A Common Stock",$0.562,-0.02,-3.436%,"13,777,867"
XELB,"Xcel Brands, Inc. Common Stock",$2.2899,-0.1401,-5.765%,"13,771,621"
NVNI,Nvni Group Limited Ordinary Shares,$1.16,-0.04,-3.333%,"13,562,874"
CISO,"CISO Global, Inc. Common Stock",$0.2982,0.0172,6.121%,"13,512,437"
PASG,"Passage Bio, Inc. Common Stock",$4.21,0.13,3.186%,"13,504,880"
SEED,Origin Agritech Limited Common Stock,$1.13,-0.01,-0.877%,"13,474,514"
CYCN,"Cyclerion Therapeutics, Inc. Common Stock",$3.10,-0.05,-1.587%,"13,423,973"
AMS,American Shared Hospital Services Common Stock,$2.03,0.02,0.995%,"13,402,060"
ZSTK,ZeroStack Corp. Common Stock,$5.50,-0.06,-1.079%,"13,367,591"
GTBP,"GT Biopharma, Inc. Common Stock",$0.3752,-0.0143,-3.671%,"13,365,515"
BLRX,BioLineRx Ltd. American Depositary Shares,$3.07,-0.03,-0.968%,"13,358,666"
GTIM,Good Times Restaurants Inc. Common Stock,$1.26,-0.02,-1.563%,"13,302,949"
INTS,"Intensity Therapeutics, Inc. Common stock",$5.09,-0.02,-0.391%,"13,269,513"
RMSG,Real Messenger Corporation Ordinary Shares,$1.38,-0.41,-22.905%,"13,208,368"
MDCX,Medicus Pharma Ltd. Common Stock  ,$0.335,0.021,6.688%,"13,186,307"
MBRX,"Moleculin Biotech, Inc. Common Stock",$2.47,-0.02,-0.803%,"13,180,785"
SKK,SKK Holdings Limited Class A Ordinary Shares,$5.38,-0.17,-3.063%,"13,173,893"
ARTW,"Art's-Way Manufacturing Co., Inc. Common Stock",$2.54,-0.01,-0.392%,"13,160,720"
BGI,Birks Group Inc. Common Stock,$0.67,-0.0019,-0.283%,"13,128,440"
CLRB,"Cellectar Biosciences, Inc.  Common Stock",$3.10,-0.20,-6.061%,"13,048,387"
GXAI,Gaxos.ai Inc. Common Stock,$1.26,0.04,3.279%,"12,877,117"
BTOC,Armlogi Holding Corp. Common Stock,$0.283,-0.0045,-1.565%,"12,860,391"
BLIN,"Bridgeline Digital, Inc. Common Stock",$1.02,0.01,0.99%,"12,851,877"
HOTH,"Hoth Therapeutics, Inc. Common Stock",$0.6701,-0.0239,-3.444%,"12,817,434"
CMMB,Chemomab Therapeutics Ltd. American Depositary Share,$1.77,0.03,1.724%,"12,730,313"
PRSO,Peraso Inc. Common Stock,$0.9914,0.0494,5.244%,"12,505,411"
IDAI,T Stamp Inc. Class A Common Stock,$2.39,-0.0999,-4.012%,"12,438,463"
PHIO,Phio Pharmaceuticals Corp. Common Stock,$1.07,-0.07,-6.14%,"12,430,458"
EDUC,Educational Development Corporation Common Stock,$1.46,UNCH,--,"12,426,591"
TAOP,Taoping Inc. Ordinary Shares ,$1.2882,-0.0068,-0.525%,"12,370,844"
AIMD,"Ainos, Inc. Common Stock",$1.70,-0.045,-2.579%,"12,352,219"
FGI,FGI Industries Ltd. Ordinary Shares,$6.40,-0.38,-5.605%,"12,334,886"
TRIB,Trinity Biotech plc American Depositary Shares,$0.6069,0.0149,2.517%,"12,290,252"
OBAI,"Our Bond, Inc. Common Stock",$0.5941,0.0521,9.613%,"12,281,939"
BFRG,"Bullfrog AI Holdings, Inc. Common Stock",$0.66,0.0103,1.585%,"12,230,371"
FEBO,Fenbo Holdings Limited Class A Ordinary Shares,$1.10,-0.01,-0.901%,"12,168,750"
BCDA,"BioCardia, Inc. Common Stock",$1.11,0.02,1.835%,"12,143,813"
APRE,"Aprea Therapeutics, Inc. Common stock",$0.9799,0.0992,11.264%,"12,133,882"
PBM,Psyence Biomedical Ltd. Common Shares,$5.59,-0.43,-7.143%,"12,120,998"
JUNS,"Jupiter Neurosciences, Inc. Common Stock",$0.3328,-0.0112,-3.256%,"12,074,401"
TOPS,"TOP Ships, Inc. Common Stock",$2.18,-0.02,-0.909%,"11,991,788"
GTEC,Greenland Technologies Holding Corporation Class A Ordinary Shares,$0.63,0.0112,1.81%,"11,990,884"
KAPA,"Kairos Pharma, Ltd. Common Stock",$0.56,0.0054,0.974%,"11,990,271"
LNAI,Lunai Bioworks Inc. Common Stock,$0.33,-0.003,-0.901%,"11,969,469"
MSAI,"MultiSensor AI Holdings, Inc. Common Stock",$5.945,0.1551,2.679%,"11,963,082"
STFS,Star Fashion Culture Holdings Limited Class A Ordinary Shares,$10.01,2.01,25.125%,"11,949,438"
QSIAW,Quantum-Si Incorporated Warrant,$0.0551,-0.0129,-18.971%,"11,921,919"
AIRE,reAlpha Tech Corp. Common Stock,$2.22,-0.355,-13.786%,"11,909,749"
ATER,"Aterian, Inc. Common Stock",$1.10,-0.12,-9.836%,"11,906,182"
UBXG,U-BX Technology Ltd. Class A Ordinary Shares,$0.391,-0.005,-1.263%,"11,841,100"
PMNT,Perfect Moment Ltd. Common Stock,$0.2522,0.006,2.437%,"11,820,866"
AMOD,"Alpha Modus Holdings, Inc. Class A Common Stock",$0.2316,0.0016,0.696%,"11,787,353"
JBDI,JBDI Holdings Limited Ordinary Shares,$0.6139,0.0338,5.827%,"11,681,942"
XWEL,"XWELL, Inc. Common Stock",$1.47,0.20,15.748%,"11,652,346"
SDAWW,SunCar Technology Group Inc. Warrant,$0.11,-0.04,-26.667%,"11,621,271"
RGNT,Regentis Biomaterials Ltd. Ordinary Shares,$2.22,-0.06,-2.632%,"11,498,219"
TLIH,Ten-League International Holdings Limited Ordinary Shares,$3.90,0.03,0.775%,"11,467,697"
GITS,"Global Interactive Technologies, Inc. Common Stock",$1.52,0.01,0.662%,"11,430,950"
RAIN,"Rain Enhancement Technologies Holdco, Inc. Class A Common Stock",$1.27,-0.19,-13.014%,"11,426,648"
LHSW,Lianhe Sowell International Group Ltd Class A Ordinary Shares,$0.2193,-0.0128,-5.515%,"11,403,600"
MTEK,Maris-Tech Ltd. Ordinary Shares,$1.17,-0.01,-0.847%,"11,347,392"
BIVI,BioVie Inc. Class A Common Stock,$1.47,-0.07,-4.545%,"11,089,049"
ADXN,Addex Therapeutics Ltd American Depositary Shares,$6.84,-0.17,-2.425%,"11,073,050"
CVR,Chicago Rivet & Machine Co. Common Stock,$11.40,0.498,4.568%,"11,013,905"
MTEX,"Mannatech, Incorporated Common Stock",$5.70,1.03,22.056%,"10,999,119"
RVPH,"Reviva Pharmaceuticals Holdings, Inc. Common Stock ",$0.856,-0.0064,-0.742%,"10,965,683"
GCDT,Green Circle Decarbonize Technology Limited Ordinary Shares,$0.8721,0.0149,1.738%,"10,901,250"
KPRX,"Kiora Pharmaceuticals, Inc.  Common Stock",$2.45,UNCH,--,"10,859,478"
IMNN,"Imunon, Inc. Common Stock",$2.72,-0.01,-0.366%,"10,834,690"
BGLWW,Blue Gold Limited Warrant,$0.31,0.0106,3.54%,"10,750,023"
QNRX,"Quoin Pharmaceuticals, Ltd. American Depositary Shares",$5.93,-0.44,-6.907%,"10,695,508"
GGRP,"The Glimpse Group, Inc. Common Stock",$0.5064,0.0013,0.257%,"10,673,143"
WGRX,"Wellgistics Health, Inc. Common Stock",$0.0842,-0.0041,-4.643%,"10,664,214"
IHT,InnSuites Hospitality Trust Shares of Beneficial Interest,$1.14,0.02,1.786%,"10,493,511"
NOTV,"Inotiv, Inc. Common Stock",$0.3041,0.0099,3.365%,"10,459,511"
WKSP,"Worksport, Ltd. Common Stock",$1.06,-0.02,-1.852%,"10,403,757"
SFHG,Samfine Creation Holdings Group Limited Class A Ordinary Share,$2.55,0.05,2.00%,"10,353,000"
CETY,"Clean Energy Technologies, Inc. Common Stock",$0.8501,-0.1599,-15.832%,"10,342,407"
NAMMW,Namib Minerals Warrants,$0.1893,0.0183,10.702%,"10,313,567"
MBAI,Check-Cap Ltd. Ordinary Share,$1.45,-0.04,-2.685%,"10,179,728"
YMAT,"J-Star Holding Co., Ltd. Class A Ordinary Shares",$0.5069,0.2664,110.769%,"10,163,607"
MVSTW,"Microvast Holdings, Inc. Warrants",$0.0306,-0.0019,-5.846%,"10,160,208"
VRME,"VerifyMe, Inc. Common Stock",$0.7726,0.0001,0.013%,"10,135,790"
PETZ,"TDH Holdings, Inc. Common Shares",$0.97,UNCH,--,"10,013,570"
CXAI,CXApp Inc. Class A Common Stock,$0.145,-0.009,-5.844%,"10,007,238"
GVH,Globavend Holdings Limited Ordinary Shares,$4.37,0.28,6.846%,"9,993,399"
DSY,Big Tree Cloud Holdings Limited Class A Ordinary Shares,$2.10,-0.05,-2.326%,"9,978,931"
AWX,Avalon Holdings Corporation Common Stock,$2.5499,0.0199,0.787%,"9,943,159"
CALC,"CalciMedica, Inc. Common Stock",$0.629,-0.0064,-1.007%,"9,902,923"
ELOG,Eastern International Ltd. Ordinary Shares,$0.8213,-0.0517,-5.922%,"9,869,562"
DTSS,Datasea Intelligent Technology Ltd. Class A Ordinary Shares,$0.94,0.0451,5.04%,"9,820,324"
MARPS,Marine Petroleum Trust Units of Beneficial Interest,$4.91,0.06,1.237%,"9,820,000"
BON,Bon Natural Life Limited Class A Ordinary Shares,$1.20,-0.0197,-1.615%,"9,754,572"
CDT,CDT Equity Inc. Common Stock,$2.005,-0.075,-3.606%,"9,740,992"
GDC,GD Culture Group Limited Common Stock,$0.16,0.009,5.96%,"9,721,554"
SINT,"SiNtx Technologies, Inc. Common Stock",$2.35,-0.04,-1.674%,"9,686,058"
KITT,"Nauticus Robotics, Inc. Common stock",$2.22,-0.03,-1.333%,"9,678,407"
SQFTP,"Presidio Property Trust, Inc. 9.375% Series D Cumulative Redeemable Perpetual Preferred Stock, $0.01 par value per share",$6.60,0.14,2.167%,"9,515,075"
MWG,Multi Ways Holdings Limited Class A Ordinary Shares,$1.8316,-0.0184,-0.995%,"9,418,087"
OABIW,"OmniAb, Inc. Warrant",$0.0649,-0.0101,-13.467%,"9,408,720"
MIMI,Mint Incorporation Limited Class A Ordinary Shares,$2.90,0.20,7.407%,"9,283,625"
INEO,INNEOVA Holdings Limited Class A Ordinary Shares,$0.573,0.0038,0.668%,"9,265,768"
YJ,Yunji Inc. American Depository Shares,$1.88,UNCH,--,"9,260,015"
MYSE,"Myseum.AI, Inc. Common Stock",$1.82,-0.12,-6.186%,"9,247,919"
DTST,Data Storage Corporation Common Stock,$4.26,0.12,2.899%,"9,232,008"
GDTC,CytoMed Therapeutics Limited Ordinary Shares,$0.78,0.0568,7.854%,"9,226,179"
ETS,Elite Express Holding Inc. Class A Common Stock,$0.551,0.0078,1.436%,"9,210,886"
GAUZ,Gauzy Ltd. Ordinary Shares,$0.4901,0.0501,11.386%,"9,185,500"
RSVRW,"Reservoir Media, Inc. Warrant",$0.14,-0.0304,-17.84%,"9,184,031"
ELPW,Elong Power Holding Limited Class A Ordinary Shares,$6.43,-0.66,-9.309%,"9,177,565"
CURX,Curanex Pharmaceuticals Inc Common Stock,$0.323,0.0074,2.345%,"9,161,834"
BIAF,"bioAffinity Technologies, Inc. Common Stock",$2.03,-0.09,-4.245%,"9,132,310"
RAY,Raytech Holding Limited Ordinary Shares,$3.35,0.08,2.446%,"9,128,348"
CODX,"Co-Diagnostics, Inc. Common Stock",$2.53,0.60,31.088%,"9,114,236"
SNES,"SenesTech, Inc. Common Stock",$1.73,-0.24,-12.183%,"9,109,737"
DAVEW,Dave Inc. Warrants,$0.7106,0.0106,1.514%,"9,105,179"
