Symbol,Name,Last Sale,Net Change,% Change,Market Cap
OCSAW,Oculis Holding AG Warrants,$10.26,0.01,0.098%,"447,976,245"
ADUR,Aduro Clean Technologies Inc. Common Stock,$14.36,-0.76,-5.026%,"447,938,746"
JOUT,Johnson Outdoors Inc. Class A Common Stock,$43.17,1.46,3.50%,"447,770,594"
KELYA,"Kelly Services, Inc. Class A Common Stock",$12.68,0.27,2.176%,"446,992,634"
TATT,TAT Technologies Ltd. Ordinary Shares,$40.82,0.10,0.246%,"446,585,414"
NOA,North American Construction Group Ltd. Common Shares (no par),$14.79,-0.04,-0.27%,"446,317,549"
HELE,Helen of Troy Limited Common Stock,$19.36,0.23,1.202%,"445,837,936"
FFIC,Flushing Financial Corporation Common Stock,$13.18,-0.23,-1.715%,"445,199,813"
ETB,Eaton Vance Tax-Managed Buy-Write Income Fund Eaton Vance Tax-Managed Buy-Write Income Fund Common Shares of Beneficial Interest,$15.14,0.05,0.331%,"444,682,966"
PRTC,PureTech Health plc American Depositary Shares,$18.36,0.18,0.99%,"443,731,897"
PTLO,Portillo's Inc. Class A Common Stock,$5.88,0.22,3.887%,"443,045,740"
AROW,Arrow Financial Corporation Common Stock,$26.895,0.075,0.28%,"442,934,454"
PACK,Ranpak Holdings Corp Class A Common Stock,$5.25,-0.25,-4.545%,"442,898,169"
MITK,"Mitek Systems, Inc. Common Stock",$9.69,0.39,4.194%,"442,319,905"
WOW,"WideOpenWest, Inc. Common Stock",$5.15,-0.02,-0.387%,"441,705,046"
CYH,"Community Health Systems, Inc. Common Stock",$3.15,-0.04,-1.254%,"441,375,215"
EOLS,"Evolus, Inc. Common Stock",$6.79,0.10,1.495%,"439,213,995"
TMCI,"Treace Medical Concepts, Inc. Common Stock",$6.95,0.15,2.206%,"439,053,226"
SWBI,"Smith & Wesson Brands, Inc. Common Stock",$9.89,-0.09,-0.902%,"438,540,214"
AII,"American Integrity Insurance Group, Inc. Common Stock",$22.39,-0.30,-1.322%,"438,216,296"
EVN,Eaton Vance Municipal Income Trust Common Stock,$11.04,UNCH,--,"437,925,480"
DDI,"DoubleDown Interactive Co., Ltd. American Depository Shares",$8.83,0.03,0.341%,"437,556,875"
DBVT,DBV Technologies S.A. American Depositary Shares,$15.97,-0.34,-2.085%,"437,493,982"
LZM,Lifezone Metals Limited Ordinary Shares,$5.41,-0.35,-6.076%,"437,369,135"
PERI,Perion Network Ltd. Ordinary Shares,$9.71,-0.03,-0.308%,"437,311,018"
IMXI,"International Money Express, Inc. Common Stock",$14.73,0.01,0.068%,"437,246,115"
NLOP,Net Lease Office Properties Common Shares of Beneficial Interest,$29.46,0.07,0.238%,"436,422,650"
TSSI,"TSS, Inc. Common Stock",$17.19,0.30,1.776%,"436,011,354"
BOC,Boston Omaha Corporation Class A Common Stock,$13.85,-0.14,-1.001%,"435,630,061"
TBN,Tamboran Resources Corporation Common stock,$24.44,-0.61,-2.435%,"435,539,326"
GLAD,Gladstone Capital Corporation Common Stock,$19.50,0.39,2.041%,"435,432,114"
DDL,Dingdong (Cayman) Limited American Depositary Shares (each two representing three Ordinary Shares),$1.84,-0.12,-6.122%,"434,658,940"
KRNY,Kearny Financial Corp Common Stock,$6.71,UNCH,--,"434,435,749"
ENGN,enGene Holdings Inc. Common Stock,$8.50,-0.83,-8.896%,"434,399,360"
MLAB,"Mesa Laboratories, Inc. Common Stock",$78.92,2.48,3.244%,"434,174,750"
AUTL,Autolus Therapeutics plc American Depositary Share,$1.63,-0.07,-4.118%,"433,810,500"
DDD,3D Systems Corporation Common Stock,$3.38,-0.40,-10.582%,"433,493,639"
RRBI,"Red River Bancshares, Inc. Common Stock",$64.85,0.20,0.309%,"432,978,094"
EBF,"Ennis, Inc. Common Stock",$16.87,-0.32,-1.862%,"432,373,899"
HBCP,"Home Bancorp, Inc. Common Stock",$55.25,1.28,2.372%,"432,317,493"
CAL,"Caleres, Inc. Common Stock",$12.77,0.24,1.915%,"432,173,680"
HQL,abrdn Life Sciences Investors Shares of Beneficial Interest,$16.82,-0.02,-0.119%,"431,931,478"
CCRN,"Cross Country Healthcare, Inc. Common Stock $0.0001 Par Value",$13.16,0.02,0.152%,"431,147,854"
CARE,"Carter Bankshares, Inc. Common Stock",$19.01,-0.01,-0.053%,"430,953,544"
EHAB,"Enhabit, Inc. Common Stock",$8.50,0.10,1.19%,"430,868,247"
DIN,"Dine Brands Global, Inc. Common Stock",$28.01,0.31,1.119%,"430,774,837"
MCS,Marcus Corporation (The) Common Stock,$13.74,0.60,4.566%,"430,214,184"
RCKT,"Rocket Pharmaceuticals, Inc. Common Stock",$3.98,-0.02,-0.50%,"429,457,407"
SOHU,Sohu.com Limited American Depositary Shares,$14.26,-0.345,-2.362%,"428,732,604"
WRN,Western Copper and Gold Corporation Common Stock,$2.12,-0.13,-5.778%,"427,493,671"
KELYB,"Kelly Services, Inc. Class B Common Stock",$12.10,UNCH,--,"426,546,599"
TRC,Tejon Ranch Co Common Stock,$15.80,0.01,0.063%,"424,924,489"
GUT,Gabelli Utility Trust (The) Common Stock,$5.78,-0.08,-1.365%,"424,246,388"
PNNT,PennantPark Investment Corporation Common Stock,$6.49,0.04,0.62%,"423,771,650"
GMRE,Global Medical REIT Inc. Common Stock,$31.59,-0.31,-0.972%,"423,540,050"
CVGW,"Calavo Growers, Inc. Common Stock",$23.70,-0.09,-0.378%,"423,123,755"
KFS,"Kingsway Financial Services, Inc. Common Stock (DE)",$14.65,-0.06,-0.408%,"422,995,530"
XOMA,XOMA Royalty Corporation Common Stock,$34.81,-0.18,-0.514%,"420,773,498"
THH,TryHard Holdings Limited Ordinary Shares,$8.42,0.20,2.433%,"419,463,350"
TTGT,"TechTarget, Inc. Common Stock",$5.86,0.31,5.586%,"418,925,540"
VHI,"Valhi, Inc. Common Stock",$14.79,-0.07,-0.471%,"418,590,913"
IMAB,I-MAB American Depositary Shares,$5.13,-0.09,-1.724%,"418,100,566"
INVZ,Innoviz Technologies Ltd. Ordinary shares,$2.10,-0.11,-4.977%,"417,820,110"
GNE,Genie Energy Ltd. Class B Common Stock Stock,$15.63,-0.18,-1.139%,"417,460,263"
MAMA,"Mama's Creations, Inc. Common Stock",$10.30,-0.17,-1.624%,"417,135,868"
ISOU,IsoEnergy Ltd. Common Shares,$8.66,-0.07,-0.802%,"416,351,817"
BNTC,Benitec Biopharma Inc. Common Stock,$15.86,-0.37,-2.28%,"416,332,438"
GLRE,"Greenlight Capital Re, Ltd. Class A Ordinary Shares",$12.15,-0.17,-1.38%,"415,507,559"
GBLI,"Global Indemnity Group, LLC Class A Common Stock (DE)",$29.0563,0.0063,0.022%,"415,398,395"
SD,"SandRidge Energy, Inc. Common Stock",$11.28,-0.11,-0.966%,"414,561,127"
FBIZ,"First Business Financial Services, Inc. Common Stock",$49.80,-0.03,-0.06%,"414,508,806"
RMNI,"Rimini Street, Inc. (DE) Common Stock",$4.48,0.07,1.587%,"414,480,640"
COFS,"ChoiceOne Financial Services, Inc. Common Stock",$27.56,0.13,0.474%,"413,813,400"
ELVR,Elevra Lithium Limited American Depository Shares,$26.64,-2.70,-9.202%,"412,800,946"
MOV,Movado Group Inc. Common Stock,$18.64,-0.29,-1.532%,"412,646,691"
AMRN,Amarin Corporation plc,$19.94,-0.31,-1.531%,"412,414,553"
MCI,Barings Corporate Investors Common Stock,$20.27,0.02,0.099%,"410,705,044"
EVTL,Vertical Aerospace Ltd. Ordinary Shares,$4.85,-0.08,-1.623%,"410,080,697"
LWAY,"Lifeway Foods, Inc. Common Stock",$26.90,-0.24,-0.884%,"409,593,388"
GRVY,"GRAVITY Co., Ltd. American Depository Shares",$58.83,0.76,1.309%,"408,803,787"
SDHY,PGIM Short Duration High Yield Opportunities Fund Common Shares,$16.55,-0.06,-0.361%,"408,339,077"
SRTA,"Strata Critical Medical, Inc. Class A Common Stock",$4.99,-0.22,-4.223%,"407,661,069"
JELD,"JELD-WEN Holding, Inc. Common Stock",$4.77,0.06,1.274%,"407,373,212"
NCMI,"National CineMedia, Inc. Common Stock",$4.34,0.02,0.463%,"406,701,921"
RILYT,"B. Riley Financial, Inc. 6.00% Senior Notes Due 2028",$13.30,-0.16,-1.189%,"405,610,978"
DDT,Dillard's Capital Trust I,$25.915,0.025,0.097%,"404,610,014"
CNDT,Conduent Incorporated Common Stock ,$2.56,0.07,2.811%,"404,413,496"
BGIN,Bgin Blockchain Limited Class A Ordinary Shares,$4.96,-1.04,-17.333%,"404,116,000"
XRX,Xerox Holdings Corporation Common Stock,$3.21,0.02,0.627%,"403,912,368"
MTW,"Manitowoc Company, Inc. (The) Common Stock",$11.36,0.15,1.338%,"402,815,456"
BSVN,Bank7 Corp. Common stock,$42.61,-0.44,-1.022%,"402,706,215"
CWBC,Community West Bancshares Common Stock,$21.05,0.02,0.095%,"402,697,193"
SRDX,"Surmodics, Inc. Common Stock",$28.10,-0.03,-0.107%,"401,763,206"
CIVB,"Civista Bancshares, Inc. Common Stock",$20.78,-0.14,-0.669%,"401,321,626"
SBC,SBC Medical Group Holdings Incorporated Common Stock,$3.86,-0.29,-6.988%,"400,981,629"
GDEV,GDEV Inc. Ordinary Shares,$22.10,1.05,4.988%,"400,674,989"
CMRC,"Commerce.com, Inc. Series 1 Common Stock",$4.95,0.10,2.062%,"399,638,646"
SGU,Star Group L.P. Common Stock,$11.87,-0.12,-1.001%,"398,908,253"
VSTA,Vasta Platform Limited Class A Ordinary Shares,$4.97,0.01,0.202%,"398,604,054"
KMDA,Kamada Ltd. Ordinary Shares,$6.93,-0.15,-2.119%,"398,509,865"
SAZ,Saratoga Investment Corp 8.50% Notes due 2028,$25.43,-0.0177,-0.07%,"398,440,571"
TOI,"The Oncology Institute, Inc. Common Stock",$4.26,0.02,0.472%,"398,330,307"
SAY,Saratoga Investment Corp 8.125% Notes due 2027,$25.42,-0.032,-0.126%,"398,283,890"
DCTH,"Delcath Systems, Inc. Common Stock",$11.385,-0.035,-0.306%,"398,261,565"
SMC,Summit Midstream Corporation Common Stock,$21.22,0.15,0.712%,"398,221,544"
SAJ,Saratoga Investment Corp 8.00% Notes due 2027,$25.413,0.0129,0.051%,"398,174,213"
CHCT,Community Healthcare Trust Incorporated Common Stock,$14.03,0.07,0.501%,"397,985,418"
OBE,Obsidian Energy Ltd. Common Shares,$5.63,-0.09,-1.573%,"397,021,390"
RM,Regional Management Corp. Common Stock,$40.48,0.64,1.606%,"396,666,192"
BRBS,"Blue Ridge Bankshares, Inc. Common Stock",$4.30,-0.04,-0.922%,"396,141,624"
HNST,"The Honest Company, Inc. Common Stock",$3.56,-0.05,-1.385%,"396,119,388"
VKI,Invesco Advantage Municipal Income Trust II Common Shares of Beneficial Interest (DE),$8.92,0.08,0.905%,"396,101,698"
EGAN,eGain Corporation Common Stock,$14.72,0.83,5.976%,"395,483,226"
CDZI,"CADIZ, Inc. Common Stock",$4.82,-0.33,-6.408%,"395,331,696"
ZIP,"ZipRecruiter, Inc. Class A Common Stock",$4.52,0.05,1.119%,"393,774,788"
LEO,"BNY Mellon Strategic Municipals, Inc. Common Stock",$6.32,UNCH,--,"393,678,197"
CRESW,Cresud S.A.C.I.F. y A. Warrant,$0.66,-0.0236,-3.452%,"393,594,511"
HDSN,"Hudson Technologies, Inc. Common Stock",$9.00,0.03,0.334%,"393,015,330"
PKE,Park Aerospace Corp. Common Stock,$19.71,-0.37,-1.843%,"392,343,771"
SAT,Saratoga Investment Corp 6.00% Notes due 2027,$24.9468,0.1048,0.422%,"390,869,730"
OMI,"Owens & Minor, Inc. Common Stock",$5.06,0.12,2.429%,"390,855,455"
FRBA,First Bank Common Stock,$15.53,0.07,0.453%,"390,337,279"
AGL,"agilon health, inc. Common Stock",$0.9405,-0.0494,-4.99%,"389,764,972"
KRRO,"Korro Bio, Inc. Common Stock",$41.44,-4.91,-10.593%,"389,159,020"
NNDM,Nano Dimension Ltd. American Depositary Shares,$1.79,-0.06,-3.243%,"388,937,422"
SPIR,"Spire Global, Inc. Class A Common Stock",$11.89,-0.30,-2.461%,"387,423,570"
PUBM,"PubMatic, Inc. Class A Common Stock",$8.47,0.15,1.803%,"387,274,081"
EGY,"VAALCO Energy, Inc.  Common Stock",$3.69,-0.08,-2.122%,"384,712,954"
ALLT,Allot Ltd. Ordinary Shares,$9.69,-0.13,-1.324%,"384,623,368"
USNA,"USANA Health Sciences, Inc. Common Stock",$21.03,0.35,1.692%,"384,256,711"
ATLCZ,Atlanticus Holdings Corporation 9.25% Senior Notes due 2029,$25.3999,-0.0201,-0.079%,"384,184,892"
LND,Brasilagro Brazilian Agric Real Estate Co Sponsored ADR (Brazil),$3.74,UNCH,--,"384,036,081"
AMBC,"Ambac Financial Group, Inc. Common Stock",$8.26,-0.07,-0.84%,"383,278,339"
RPAY,Repay Holdings Corporation Class A Common Stock,$4.45,-0.06,-1.33%,"382,908,999"
ILPT,Industrial Logistics Properties Trust Common Shares of Beneficial Interest,$5.77,0.13,2.305%,"382,758,714"
TACO,Berto Acquisition Corp. Ordinary Shares,$10.50,UNCH,--,"382,643,436"
ESEA,Euroseas Ltd. Common Stock (Marshall Islands),$54.48,-0.605,-1.098%,"381,720,222"
ATEX,Anterix Inc. Common Stock,$20.35,-0.40,-1.928%,"381,354,727"
THM,"International Tower Hill Mines, Ltd. Ordinary Shares (Canada)",$1.83,-0.29,-13.679%,"380,430,416"
AURA,"Aura Biosciences, Inc. Common Stock",$6.12,0.06,0.99%,"380,173,623"
VBNK,VersaBank Common Shares,$11.80,-0.14,-1.173%,"379,578,199"
UMAC,"Unusual Machines, Inc. Common Stock",$12.47,-0.29,-2.273%,"379,559,191"
BMRC,Bank of Marin Bancorp Common Stock,$23.52,0.22,0.944%,"379,267,080"
ZH,"Zhihu Inc. American Depositary Shares, each representing three (3) Class A Ordinary Shares",$4.33,-0.03,-0.688%,"379,155,848"
PHOE,Phoenix Asia Holdings Limited Ordinary Shares,$17.50,0.59,3.489%,"378,000,000"
SOR,"Source Capital, Inc. Cmn Shs of BI",$45.29,-0.05,-0.11%,"377,921,635"
GCBC,"Greene County Bancorp, Inc. Common Stock",$22.19,-0.24,-1.07%,"377,825,313"
HYLN,Hyliion Holdings Corp. Class A Common Stock,$2.15,0.02,0.939%,"377,188,767"
SVC,Service Properties Trust Common Stock,$2.26,-0.07,-3.004%,"377,105,476"
WNC,Wabash National Corporation Common Stock,$9.21,0.18,1.993%,"377,041,034"
LCTX,"Lineage Cell Therapeutics, Inc. Common Stock",$1.65,0.01,0.61%,"376,787,879"
WAVE,Eco Wave Power Global AB (publ) American Depositary Shares,$8.06,UNCH,--,"376,674,783"
ATLCL,Atlanticus Holdings Corporation 6.125% Senior Notes due 2026,$24.85,0.0548,0.221%,"375,867,408"
DHIL,"Diamond Hill Investment Group, Inc. Class A Common Stock",$137.90,0.91,0.664%,"375,799,288"
MTRX,Matrix Service Company Common Stock,$13.36,0.22,1.674%,"374,995,628"
CARL,"Carlsmed, Inc. Common Stock",$14.10,-0.29,-2.015%,"374,793,989"
LAW,"CS Disco, Inc. Common Stock",$6.06,0.01,0.165%,"374,155,587"
OIS,"Oil States International, Inc. Common Stock",$6.17,0.23,3.872%,"373,856,657"
QSG,QuantaSing Group Limited American Depositary Shares,$7.31,0.14,1.953%,"373,636,052"
PSTL,"Postal Realty Trust, Inc. Class A Common Stock",$15.19,-0.06,-0.393%,"373,373,329"
SLNHP,"Soluna Holdings, Inc 9.0% Series A Cumulative Perpetual Preferred Stock ",$12.32,0.67,5.751%,"371,398,203"
LPTH,"LightPath Technologies, Inc. Class A Common Stock",$8.30,-0.43,-4.926%,"370,762,768"
TCI,"Transcontinental Realty Investors, Inc. Common Stock",$42.88,-2.11,-4.69%,"370,453,870"
DVS,Dolly Varden Silver Corporation Common Shares,$4.24,-0.46,-9.787%,"369,580,257"
VALU,"Value Line, Inc. Common Stock",$39.28,1.08,2.827%,"369,541,094"
OPRX,OptimizeRx Corporation Common Stock,$19.84,-0.46,-2.266%,"368,330,255"
HSHP,Himalaya Shipping Ltd. Common Shares,$7.91,-0.11,-1.372%,"368,210,500"
TITN,Titan Machinery Inc. Common Stock,$15.74,0.24,1.548%,"367,890,658"
LRMR,"Larimar Therapeutics, Inc. Common Stock",$4.29,-0.06,-1.379%,"367,182,782"
NEWP,New Pacific Metals Corp. Common Shares,$2.13,-0.39,-15.476%,"366,689,049"
REKR,"Rekor Systems, Inc. Common Stock",$2.90,-0.15,-4.918%,"366,368,699"
GRRR,Gorilla Technology Group Inc. Ordinary shares,$18.08,0.85,4.933%,"365,618,135"
KTF,DWS Municipal Income Trust,$9.25,0.04,0.434%,"365,383,677"
AIIO,Robo.ai Inc. Class B Ordinary Shares,$1.25,-0.05,-3.846%,"365,249,616"
BSRR,Sierra Bancorp Common Stock,$26.87,-0.08,-0.297%,"365,170,636"
CGC,Canopy Growth Corporation Common Shares,$1.37,-0.02,-1.439%,"364,440,632"
ATLCP,"Atlanticus Holdings Corporation 7.625% Series B Cumulative Perpetual Preferred Stock, no par value per share",$24.08,-0.08,-0.331%,"364,220,812"
ZUMZ,Zumiez Inc. Common Stock,$21.20,0.84,4.126%,"363,654,815"
IPI,"Intrepid Potash, Inc Common Stock",$27.28,-0.64,-2.292%,"363,261,871"
SAR,Saratoga Investment Corp New,$22.55,0.62,2.827%,"363,144,027"
MTLS,Materialise NV American Depositary Shares,$6.14,-0.11,-1.76%,"362,672,522"
PDYN,Palladyne AI Corp. Common Stock,$8.64,-0.23,-2.593%,"362,438,271"
BGS,"B&G Foods, Inc. Common Stock",$4.53,-0.02,-0.44%,"362,416,983"
PPT,Putnam Premier Income Trust Common Stock,$3.64,-0.01,-0.274%,"362,282,877"
ASLE,AerSale Corporation Common Stock,$7.67,0.17,2.267%,"361,882,235"
RXT,"Rackspace Technology, Inc. Common Stock",$1.51,0.02,1.342%,"361,434,622"
MVIS,"MicroVision, Inc. Common Stock",$1.20,0.01,0.84%,"361,157,861"
RWAY,Runway Growth Finance Corp. Common Stock,$9.95,0.07,0.709%,"360,355,488"
ECC           ,Eagle Point Credit Company Inc. Common Stock,$5.93,0.08,1.368%,"359,728,767"
ACCO,Acco Brands Corporation Common Stock,$3.99,0.07,1.786%,"359,628,799"
CHSCP,CHS Inc. 8%  Cumulative Redeemable Preferred Stock,$29.1696,0.3396,1.178%,"357,969,419"
AREC,American Resources Corporation Class A Common Stock,$4.23,-0.50,-10.571%,"357,895,732"
MSBI,"Midland States Bancorp, Inc. Common Stock",$16.58,0.13,0.79%,"357,192,142"
NPCE,"Neuropace, Inc. Common Stock",$10.79,0.05,0.466%,"356,949,363"
ALT,"Altimmune, Inc. Common Stock",$4.04,0.04,1.00%,"356,559,302"
RXST,"RxSight, Inc. Common Stock",$8.71,0.18,2.11%,"356,378,038"
EVO,Evotec SE American Depositary Shares,$4.01,0.09,2.296%,"355,659,014"
TECX,"Tectonic Therapeutic, Inc. Common Stock",$18.99,-0.06,-0.315%,"355,343,311"
NVEC,NVE Corporation Common Stock,$73.25,-0.30,-0.408%,"354,322,410"
LSAK,"Lesaka Technologies, Inc. Common Stock",$4.23,0.07,1.683%,"353,937,200"
HLLY,Holley Inc. Common Stock,$2.91,-0.05,-1.689%,"353,836,826"
PMO,Putnam Municipal Opportunities Trust Common Stock,$10.41,0.05,0.483%,"353,748,112"
LXFR,Luxfer Holdings PLC Ordinary Shares,$13.21,0.04,0.304%,"353,553,457"
MAGN,Magnera Corporation Common Stock,$9.91,0.26,2.694%,"352,796,000"
VFF,"Village Farms International, Inc. Common Shares",$3.13,-0.19,-5.723%,"352,576,249"
MBI,MBIA Inc. Common Stock,$6.96,0.02,0.288%,"351,401,637"
FEIM,"Frequency Electronics, Inc. Common Stock",$36.01,-0.71,-1.934%,"351,071,249"
USCB,"USCB Financial Holdings, Inc. Class A Common Stock",$17.46,UNCH,--,"350,568,602"
PDLB,"Ponce Financial Group, Inc. Common Stock",$14.595,0.065,0.447%,"350,296,419"
ATGL,Alpha Technology Group Limited Class A Ordinary Shares,$21.25,0.20,0.95%,"349,828,125"
SCM,Stellus Capital Investment Corporation Common Stock,$12.30,0.17,1.401%,"349,518,620"
EDIT,"Editas Medicine, Inc. Common Stock",$3.88,-0.26,-6.28%,"348,890,236"
MCFT,"MasterCraft Boat Holdings, Inc. Common Stock",$21.37,0.31,1.472%,"348,466,828"
SMLR,"Semler Scientific, Inc. Common Stock",$23.51,-0.14,-0.592%,"348,058,332"
GBAB,Guggenheim Taxable Municipal Bond & Investment Grade Debt Trust Common Shares of Beneficial Interest,$15.54,0.11,0.713%,"348,047,904"
GPRO,"GoPro, Inc. Class A Common Stock",$2.20,0.06,2.804%,"348,002,809"
ORN,"Orion Group Holdings, Inc. Common",$8.73,0.16,1.867%,"346,888,689"
SLN,Silence Therapeutics Plc American Depository Share,$7.40,0.21,2.921%,"346,320,000"
SFST,"Southern First Bancshares, Inc. Common Stock",$42.25,0.05,0.118%,"345,635,209"
BRCC,BRC Inc. Class A Common Stock,$1.39,-0.02,-1.418%,"345,032,820"
ANNX,"Annexon, Inc. Common Stock",$3.13,-0.03,-0.949%,"343,945,130"
TOYO,"TOYO Co., Ltd Ordinary Shares",$7.38,-0.37,-4.774%,"343,876,583"
ACTG,Acacia Research Corporation (Acacia Tech) Common Stock,$3.56,0.01,0.282%,"343,344,175"
BBCP,"Concrete Pumping Holdings, Inc. Common Stock",$6.67,-0.04,-0.596%,"343,334,582"
XPOF,"Xponential Fitness, Inc. Class A Common Stock",$7.02,0.19,2.782%,"342,821,700"
BW,"Babcock & Wilcox Enterprises, Inc. Common Stock",$3.39,-0.22,-6.094%,"342,720,667"
JACK,Jack In The Box Inc. Common Stock,$18.15,0.89,5.156%,"342,717,665"
DMAC,DiaMedica Therapeutics Inc. Common Stock,$6.62,-0.15,-2.216%,"342,180,604"
SLQT,"SelectQuote, Inc. Common Stock",$1.98,UNCH,--,"342,177,125"
ARTNA,Artesian Resources Corporation Class A Common Stock,$33.16,-0.74,-2.183%,"341,899,529"
NGS,"Natural Gas Services Group, Inc. Common Stock",$27.25,0.03,0.11%,"341,778,057"
GALT,Galectin Therapeutics Inc. Common Stock,$5.30,0.21,4.126%,"339,519,389"
FET,"Forum Energy Technologies, Inc. Common Stock",$28.48,0.07,0.246%,"339,005,300"
API,"Agora, Inc. American Depositary Shares",$3.61,0.07,1.977%,"337,573,775"
BWFG,"Bankwell Financial Group, Inc. Common Stock",$42.67,0.26,0.613%,"336,130,493"
FMAO,"Farmers & Merchants Bancorp, Inc. Common Stock",$24.48,-0.36,-1.449%,"335,964,401"
EFT,Eaton Vance Floating Rate Income Trust Common Shares of Beneficial Interest,$11.52,0.03,0.261%,"335,121,581"
CUB,Lionheart Holdings Class A Ordinary Shares,$10.53,-0.03,-0.284%,"334,523,105"
WTBA,West Bancorporation Common Stock,$19.66,-0.07,-0.355%,"333,055,833"
LYEL,"Lyell Immunopharma, Inc. Common Stock",$17.32,-0.72,-3.991%,"332,738,019"
EVI,"EVI Industries, Inc.  Common Stock",$26.03,-0.50,-1.885%,"332,194,678"
EM,Smart Share Global Limited American Depositary Shares,$1.31,UNCH,--,"332,175,725"
PBFS,"Pioneer Bancorp, Inc. Common Stock",$13.13,0.08,0.613%,"332,121,105"
RILYZ,"B. Riley Financial, Inc. 5.25% Senior Notes due 2028",$10.89,-0.41,-3.628%,"332,113,049"
CBK,"Commercial Bancgroup, Inc. Common Stock",$25.16,0.62,2.526%,"331,463,451"
MREO,Mereo BioPharma Group plc American Depositary Shares,$2.13,-0.11,-4.911%,"330,460,143"
SPOK,"Spok Holdings, Inc. Common Stock",$16.04,0.11,0.691%,"330,278,421"
HVT,"Haverty Furniture Companies, Inc. Common Stock",$20.29,0.10,0.495%,"330,053,920"
ALDX,"Aldeyra Therapeutics, Inc. Common Stock",$5.51,0.07,1.287%,"330,024,690"
VERI,"Veritone, Inc. Common Stock",$5.97,-0.13,-2.131%,"329,972,706"
TCMD,"Tactile Systems Technology, Inc. Common Stock",$14.76,0.15,1.027%,"329,032,060"
GFR,Greenfire Resources Ltd. Common Shares,$4.68,-0.09,-1.887%,"328,784,040"
USBC,"USBC, Inc. Common Stock",$0.855,-0.014,-1.611%,"328,520,181"
CHSCO,CHS Inc. Class B Cumulative Redeemable Preferred Stock,$26.70,0.12,0.451%,"327,662,480"
FLWS,"1-800-FLOWERS.COM, Inc. Common Stock",$5.15,0.61,13.436%,"327,637,335"
JBIO,"Jade Biosciences, Inc. Common Stock",$10.03,0.03,0.30%,"327,246,102"
NC,"NACCO Industries, Inc. Common Stock",$43.84,-1.11,-2.469%,"326,680,468"
NIU,Niu Technologies American Depositary Shares,$4.19,-0.09,-2.103%,"326,669,043"
FINS,Angel Oak Financial Strategies Income Term Trust Common Shares of Beneficial Interest,$13.02,0.02,0.154%,"326,315,547"
OBT,"Orange County Bancorp, Inc. Common Stock",$24.39,-0.21,-0.854%,"325,921,424"
ALEC,"Alector, Inc. Common Stock",$3.21,-0.10,-3.021%,"324,891,576"
MVBF,MVB Financial Corp. Common Stock,$25.49,-0.18,-0.701%,"324,521,474"
RBB,RBB Bancorp Common Stock,$18.80,1.19,6.758%,"324,315,548"
ZEUS,"Olympic Steel, Inc. Common Stock",$28.95,0.59,2.08%,"324,171,128"
XOMAP,XOMA Royalty Corporation 8.625% Series A Cumulative Perpetual Preferred Stock,$26.775,UNCH,--,"323,648,676"
LAND,Gladstone Land Corporation Common Stock,$8.92,-0.16,-1.762%,"322,767,149"
BNC,CEA Industries Inc. Common Stock,$7.49,-0.10,-1.318%,"322,692,284"
COE,"51Talk Online Education Group American depositary shares, each representing 60 Class A ordinary shares",$54.97,-0.59,-1.062%,"322,095,341"
AMCX,AMC Networks Inc. Class A Common Stock,$7.42,0.22,3.056%,"321,907,892"
LBRX,LB Pharmaceuticals Inc Common Stock,$16.00,UNCH,--,"321,602,192"
ANPA,Rich Sparkle Holdings Limited Ordinary Shares,$25.70,0.31,1.221%,"321,250,000"
GCO,Genesco Inc. Common Stock,$29.74,0.24,0.814%,"321,055,940"
DSGN,"Design Therapeutics, Inc. Common Stock",$5.63,-0.20,-3.431%,"320,617,949"
TBCH,Turtle Beach Corporation Common Stock,$16.18,0.01,0.062%,"320,471,370"
MEC,"Mayville Engineering Company, Inc. Common Stock",$15.72,2.71,20.83%,"319,396,209"
BNED,"Barnes & Noble Education, Inc Common Stock",$9.35,-0.14,-1.475%,"318,403,469"
CLW,Clearwater Paper Corporation Common Stock,$19.77,0.13,0.662%,"318,378,927"
RFMZ,"RiverNorth Flexible Municipal Income Fund II, Inc. Common Stock",$13.05,0.14,1.084%,"317,790,416"
MPAA,"Motorcar Parts  of America, Inc. Common Stock",$16.42,0.72,4.586%,"317,762,057"
CLDT,Chatham Lodging Trust (REIT) Common Shares of Beneficial Interest,$6.47,0.05,0.779%,"316,891,309"
RZLVW,Rezolve AI PLC Warrants,$1.30,-0.01,-0.763%,"316,772,786"
MASS,908 Devices Inc. Common Stock,$8.77,-0.22,-2.447%,"316,471,571"
ANNA,"AleAnna, Inc. Class A Common Stock",$3.89,-0.292,-6.982%,"316,333,874"
GSIT,GSI Technology Common Stock,$10.86,-2.11,-16.268%,"315,924,198"
OEC,Orion S.A. Common Shares,$5.62,-0.18,-3.103%,"315,561,348"
OFSSH,OFS Capital Corporation 4.95% Notes due 2028,$23.55,UNCH,--,"315,524,737"
MLP,"Maui Land & Pineapple Company, Inc. Common Stock",$15.97,-0.07,-0.436%,"315,292,213"
CERS,Cerus Corporation Common Stock,$1.64,0.01,0.613%,"314,386,022"
XPER,Xperi Inc. Common Stock ,$6.78,0.05,0.743%,"313,643,885"
CHSCL,"CHS Inc Class B Cumulative Redeemable Preferred Stock, Series 4",$25.52,0.015,0.059%,"313,181,517"
SLP,"Simulations Plus, Inc. Common Stock",$15.56,-0.49,-3.053%,"313,177,832"
PANL,Pangaea Logistics Solutions Ltd. Common Shares,$4.80,-0.06,-1.235%,"313,161,173"
WTI,"W&T Offshore, Inc. Common Stock",$2.11,-0.05,-2.315%,"312,995,353"
VNDA,Vanda Pharmaceuticals Inc. Common Stock,$5.29,-0.04,-0.75%,"312,581,498"
OOMA,"Ooma, Inc. Common Stock",$11.29,0.14,1.256%,"311,604,000"
FLYX,"flyExclusive, Inc. Class A Common Stock",$3.88,-0.04,-1.02%,"310,902,794"
SENS,"Senseonics Holdings, Inc. Common Stock",$7.63,-0.84,-9.917%,"310,800,771"
IONR,ioneer Ltd American Depositary Shares,$5.31,-0.45,-7.813%,"310,389,221"
PRQR,ProQR Therapeutics N.V. Ordinary Shares,$2.95,-0.10,-3.279%,"310,376,955"
CHSCN,CHS Inc Preferred Class B Series 2 Reset Rate,$25.2901,-0.0199,-0.079%,"310,360,183"
CTNM,"Contineum Therapeutics, Inc. Class A Common Stock",$11.06,-0.03,-0.271%,"310,143,359"
SWKHL,SWK Holdings Corporation 9.00% Senior Notes due 2027,$25.53,0.05,0.196%,"310,122,892"
DH,Definitive Healthcare Corp. Class A Common Stock,$2.97,-0.07,-2.303%,"309,136,044"
KYTX,"Kyverna Therapeutics, Inc. Common Stock",$7.14,-0.36,-4.80%,"308,774,062"
SEG,Seaport Entertainment Group Inc. Common Stock,$24.21,-0.33,-1.345%,"308,243,584"
PAYS,"Paysign, Inc. Common Stock",$5.66,0.03,0.533%,"308,197,686"
SY,So-Young International Inc. American Depository Shares,$3.06,-0.09,-2.857%,"308,132,658"
AIRJ,AirJoule Technologies Corporation Class A Common Stock,$5.09,-0.46,-8.288%,"307,637,528"
CPZ,Calamos Long/Short Equity & Dynamic Income Trust Common Stock,$15.66,UNCH,--,"307,440,158"
CHSCM,"CHS Inc Class B Reset Rate Cumulative Redeemable Preferred Stock, Series 3",$25.05,UNCH,--,"307,413,675"
XOMAO,XOMA Royalty Corporation Depositary Shares Rep Series B 8.375% Cumulative Preferred Stock,$25.42,-0.05,-0.196%,"307,269,817"
BWAY,BrainsWay Ltd. American Depositary Shares,$16.28,0.405,2.551%,"307,191,032"
GEOS,Geospace Technologies Corporation Common Stock (Texas),$23.92,1.34,5.934%,"306,671,192"
MPX,Marine Products Corporation Common Stock,$8.75,0.15,1.744%,"306,215,438"
CMDB,Costamare Bulkers Holdings Limited Common Stock,$12.65,-0.33,-2.542%,"306,177,374"
LANV,Lanvin Group Holdings Limited Ordinary Shares,$2.19,0.055,2.576%,"306,109,011"
GPRK,Geopark Ltd Common Shares,$5.97,-0.03,-0.50%,"305,946,303"
VUZI,Vuzix Corporation Common Stock,$3.95,-0.13,-3.186%,"305,499,683"
