Symbol,Name,Last Sale,Net Change,% Change,Market Cap
PLUR,Pluri Inc. Common Stock,$4.09,-0.05,-1.208%,"33,357,827"
BOLD,"Boundless Bio, Inc. Common Stock",$1.49,0.09,6.429%,"33,354,560"
OESX,"Orion Energy Systems, Inc. Common Stock",$9.43,-0.26,-2.683%,"33,323,017"
FEDU,"Four Seasons Education (Cayman) Inc. American Depositary Shares, each ADS representing 10 ordinary shares",$14.73,0.74,5.289%,"33,290,654"
CVU,"CPI Aerostructures, Inc. Common Stock",$2.54,0.02,0.794%,"33,098,087"
POCI,"Precision Optics Corporation, Inc. Common stock",$4.29,-0.005,-0.116%,"33,096,067"
ANTX,"AN2 Therapeutics, Inc. Common Stock",$1.21,-0.01,-0.82%,"33,064,660"
UFG,Uni-Fuels Holdings Limited Class A Ordinary Shares,$1.02,-0.02,-1.923%,"33,063,300"
BOF,BranchOut Food Inc. Common Stock,$2.80,0.705,33.652%,"32,993,758"
MODD,"Modular Medical, Inc. Common Stock",$0.5965,-0.0112,-1.843%,"32,971,297"
TENX,"Tenax Therapeutics, Inc. Common Stock",$7.22,0.52,7.761%,"32,941,250"
PYPD,PolyPid Ltd. Ordinary Shares,$3.22,0.02,0.625%,"32,814,711"
ITRM,Iterum Therapeutics plc Ordinary Share,$0.7339,-0.0161,-2.147%,"32,773,703"
SCYX,"SCYNEXIS, Inc. Common Stock",$0.78,0.01,1.299%,"32,701,454"
SELX,Semilux International Ltd. Ordinary Shares,$0.8724,-0.0391,-4.29%,"32,652,496"
SWAG,"Stran & Company, Inc. Common Stock",$1.755,-0.04,-2.228%,"32,564,667"
WETO,Webus International Limited Ordinary Shares,$1.48,-0.11,-6.918%,"32,560,000"
NUAIW,"New Era Energy & Digital, Inc. Warrants",$1.25,-0.14,-10.072%,"32,474,419"
KFFB,Kentucky First Federal Bancorp Common Stock,$4.00,0.10,2.564%,"32,346,860"
BNKK,"Bonk, Inc. Common Stock",$0.2231,-0.0222,-9.05%,"32,319,897"
BCG,"Binah Capital Group, Inc. Common Stock",$1.94,-0.35,-15.284%,"32,208,772"
LIMN,"Liminatus Pharma, Inc. Class A Common Stock",$1.19,-0.02,-1.653%,"32,206,913"
TRT,Trio-Tech International Common Stock,$7.44,0.06,0.813%,"32,087,269"
BTAI,"BioXcel Therapeutics, Inc. Common Stock",$2.20,-0.09,-3.93%,"32,024,835"
RVP,"Retractable Technologies, Inc. Common Stock",$1.06,0.08,8.163%,"31,733,389"
FOXX,Foxx Development Holdings Inc. Common Stock,$4.68,0.40,9.346%,"31,733,194"
COSM,Cosmos Health Inc. Common Stock,$1.05,0.01,0.962%,"31,724,570"
NCT,Intercont (Cayman) Limited Ordinary shares,$1.18,-0.02,-1.667%,"31,712,501"
TBLAW,Taboola.com Ltd. Warrant,$0.1066,0.0232,27.818%,"31,630,234"
DTST,Data Storage Corporation Common Stock,$4.35,0.05,1.163%,"31,591,597"
MBBC,"Marathon Bancorp, Inc. Common Stock",$10.74,0.21,1.994%,"31,561,617"
NXTC,"NextCure, Inc. Common Stock",$11.79,0.97,8.965%,"31,551,337"
AIFF,"Firefly Neuroscience, Inc. Common Stock",$2.35,-0.08,-3.292%,"31,473,357"
VNTG,Vantage Corp Class A Ordinary Shares,$0.99,-0.01,-1.00%,"31,420,125"
RDI,Reading International Inc Class A Common Stock,$1.38,UNCH,--,"31,349,819"
SABS,"SAB Biotherapeutics, Inc. Common Stock",$3.00,UNCH,--,"31,233,183"
ZBAO,Zhibao Technology Inc. Class A Ordinary Shares,$0.9895,-0.0105,-1.05%,"31,192,765"
SIDU,"Sidus Space, Inc. Class A Common Stock",$1.23,-0.04,-3.15%,"31,177,404"
AHT,Ashford Hospitality Trust Inc Common Stock,$5.07,UNCH,--,"31,090,219"
DDC,DDC Enterprise Limited Class A Ordinary Shares,$7.675,-0.47,-5.77%,"31,084,894"
MKDW,MKDWELL Tech Inc. Ordinary Share,$0.2138,0.0009,0.423%,"30,705,815"
CREX,"Creative Realities, Inc. Common Stock",$2.90,0.03,1.045%,"30,504,903"
MYND,"Mynd.ai, Inc. American Depositary Shares",$0.6682,-0.0618,-8.466%,"30,501,848"
EBON,Ebang International Holdings Inc. Class A Ordinary Shares,$4.66,0.20,4.484%,"30,494,751"
SWVL,Swvl Holdings Corp Class A Common Shares,$3.08,-0.02,-0.645%,"30,487,429"
CRWS,Crown Crafts Inc Common Stock,$2.875,0.005,0.174%,"30,374,407"
KLXE,"KLX Energy Services Holdings, Inc. Common Stock",$1.70,-0.03,-1.734%,"30,328,777"
BTOC,Armlogi Holding Corp. Common Stock,$0.6642,0.0083,1.265%,"30,182,895"
WGRX,"Wellgistics Health, Inc. Common Stock",$0.3588,-0.0707,-16.461%,"30,162,199"
IMA,"ImageneBio, Inc. Common Stock",$7.48,-0.10,-1.319%,"30,080,887"
FCUV,Focus Universal Inc. Common Stock,$4.06,-0.18,-4.245%,"29,990,022"
NTRBW,Nutriband Inc. Warrant,$2.49,UNCH,--,"29,966,859"
BMGL,Basel Medical Group Ltd Ordinary Shares,$1.62,-0.02,-1.22%,"29,897,100"
NRSN,NeuroSense Therapeutics Ltd. Ordinary Shares,$1.245,-0.005,-0.40%,"29,865,893"
RNTX,"Rein Therapeutics, Inc. Common Stock",$1.28,UNCH,--,"29,830,538"
MIGI,Mawson Infrastructure Group Inc. Common Stock,$1.43,-0.25,-14.881%,"29,809,926"
APLM,Apollomics Inc. Class A Ordinary Shares,$26.93,-3.17,-10.532%,"29,713,162"
GDTC,CytoMed Therapeutics Limited Ordinary Shares,$2.57,-0.12,-4.461%,"29,657,800"
ELBM,Electra Battery Materials Corporation Common Stock,$1.65,-0.43,-20.673%,"29,637,585"
XTIA,"XTI Aerospace, Inc. Common Stock",$1.46,-0.04,-2.667%,"29,569,841"
LNAI,Lunai Bioworks Inc. Common Stock,$1.27,0.06,4.959%,"29,438,914"
ASTLW,Algoma Steel Group Inc. Warrant,$0.28,0.08,40.00%,"29,381,465"
XCUR,"Exicure, Inc. Common Stock",$4.65,-0.07,-1.483%,"29,377,737"
BOSC,B.O.S. Better Online Solutions Common Stock,$4.90,-0.085,-1.705%,"29,025,439"
MGRX,"Mangoceuticals, Inc. Common Stock",$2.74,0.34,14.167%,"28,868,067"
TAOX,Tao Synergies Inc. Common Stock,$8.27,-0.75,-8.315%,"28,838,706"
CVV,CVD Equipment Corporation Common Stock,$4.19,-0.41,-8.913%,"28,834,901"
AUST,Austin Gold Corp. Common Shares,$2.17,-0.2375,-9.865%,"28,799,698"
DARE,"Dare Bioscience, Inc. Common Stock",$2.13,0.08,3.902%,"28,711,339"
PXS,Pyxis Tankers Inc. Common Stock,$2.73,-0.08,-2.847%,"28,626,411"
CTXR,"Citius Pharmaceuticals, Inc. Common Stock",$1.68,-0.13,-7.182%,"28,580,481"
ZSPC,"zSpace, Inc. Common stock",$1.19,-0.02,-1.653%,"28,382,414"
DAIO,Data I/O Corporation Common Stock,$3.01,-0.095,-3.06%,"28,256,866"
AGAE,Allied Gaming & Entertainment Inc. Common Stock,$0.7402,0.0216,3.006%,"28,141,576"
UONEK,"Urban One, Inc. Class D Common Stock",$0.62,-0.02,-3.125%,"28,133,094"
CLPS,CLPS Incorporation Common Stock,$0.945,-0.005,-0.526%,"28,107,562"
OMH,Ohmyhome Limited Class A Ordinary Shares,$1.19,0.03,2.586%,"28,072,467"
EPOW,"Sunrise New Energy Co., Ltd Class A Ordinary Shares",$1.04,-0.04,-3.704%,"28,066,428"
TC,Token Cat Limited American Depositary Shares,$16.55,-0.55,-3.216%,"27,997,850"
PASG,"Passage Bio, Inc. Common Stock",$8.75,0.21,2.459%,"27,813,713"
ELOG,Eastern International Ltd. Ordinary Shares,$2.31,0.01,0.435%,"27,759,270"
ECXWW,ECARX Holdings Inc. Warrants,$0.08,0.0098,13.96%,"27,658,402"
MIRA,"MIRA Pharmaceuticals, Inc. Common Stock",$1.45,-0.06,-3.974%,"27,650,507"
FENG,"Phoenix New Media Limited American Depositary Shares, each representing 48 Class A ordinary shares.",$2.30,-0.02,-0.862%,"27,624,785"
IINN,Inspira Technologies Oxy B.H.N. Ltd. Ordinary Shares,$1.13,UNCH,--,"27,404,868"
TOPS,"TOP Ships, Inc. Common Stock",$5.88,0.02,0.341%,"27,202,038"
NSYS,Nortech Systems Incorporated Common Stock,$9.7501,-0.0243,-0.249%,"27,165,085"
CLGN,CollPlant Biotechnologies Ltd Ordinary Shares,$2.37,-0.12,-4.819%,"27,147,193"
CVKD,"Cadrenal Therapeutics, Inc. Common Stock",$13.205,0.29,2.245%,"27,028,707"
AERT,"Aeries Technology, Inc. Class A Ordinary Share",$0.5701,0.0141,2.536%,"26,881,713"
XTKG,"X3 Holdings Co., Ltd. Ordinary Shares",$1.95,0.15,8.333%,"26,847,932"
NXL,"Nexalin Technology, Inc. Common Stock",$1.54,-0.14,-8.333%,"26,823,611"
EDHL,Everbright Digital Holding Limited Ordinary Shares,$1.01,-0.19,-15.833%,"26,765,000"
QRHC,Quest Resource Holding Corporation Common Stock,$1.29,0.05,4.032%,"26,718,743"
RVSN,Rail Vision Ltd. Ordinary Share,$0.5131,-0.0253,-4.699%,"26,675,139"
NTRP,"NextTrip, Inc. Common Stock",$3.18,-0.17,-5.075%,"26,605,378"
HHS,"Harte Hanks, Inc. Common Stock",$3.58,0.08,2.286%,"26,544,963"
CASI,"CASI Pharmaceuticals, Inc. Ordinary Shares",$1.71,-0.07,-3.933%,"26,492,485"
ARBEW,Arbe Robotics Ltd. Warrant,$0.25,-0.0267,-9.649%,"26,290,797"
SONN,"Sonnet BioTherapeutics Holdings, Inc. Common Stock",$3.89,-0.12,-2.993%,"26,274,429"
LGPS,LogProstyle Inc. Common Shares,$1.11,0.0188,1.723%,"26,253,842"
ENLV,Enlivex Therapeutics Ltd. Ordinary Shares,$1.095,0.035,3.302%,"26,115,679"
SLAI,SOLAI Limited American Depositary Shares (each representing one hundred (100) Class A Ordinary Shares),$2.44,-0.26,-9.63%,"25,998,537"
SPWRW,SunPower Inc. Warrants,$0.312,-0.022,-6.587%,"25,929,917"
NNVC,"NanoViricides, Inc. Common Stock",$1.48,-0.04,-2.632%,"25,797,880"
CSAI,"Cloudastructure, Inc. Class A Common Stock",$1.43,-0.16,-10.063%,"25,795,305"
NYC,American Strategic Investment Co. Class A Common Stock,$9.79,-0.06,-0.609%,"25,744,792"
LEE,"Lee Enterprises, Incorporated Common Stock",$4.11,0.04,0.983%,"25,740,794"
ARKR,Ark Restaurants Corp. Common Stock,$7.13,0.03,0.423%,"25,711,899"
TOPP,Toppoint Holdings Inc. Common Stock,$1.46,-0.02,-1.351%,"25,550,000"
EQS,"Equus Total Return, Inc. Common Stock",$1.88,-0.10,-5.051%,"25,542,005"
SGRP,"SPAR Group, Inc. Common Stock",$1.07,-0.005,-0.465%,"25,342,685"
GLBS,Globus Maritime Limited Common Stock,$1.2235,-0.0165,-1.331%,"25,182,445"
MSW,Ming Shing Group Holdings Limited Ordinary Shares,$1.94,-0.35,-15.284%,"25,171,500"
XOS,"Xos, Inc. Common Stock",$2.89,0.05,1.761%,"25,115,785"
ROLR,"High Roller Technologies, Inc. Common Stock",$2.955,-0.185,-5.892%,"25,064,824"
MBNKO,"Medallion Bank Fixed-Rate Reset Non-Cumulative Perpetual Preferred Stock, Series G, par value $1.00 per share",$24.9977,-0.0828,-0.33%,"24,997,700"
MOGU,MOGU Inc. American Depositary Shares (each  representing 25 Class A Ordinary Shares),$3.05,0.02,0.66%,"24,929,605"
NWGL,Nature Wood Group Limited American Depositary Shares,$1.50,0.018,1.215%,"24,829,748"
LIQT,"LiqTech International, Inc. Common Stock",$2.57,0.10,4.049%,"24,708,091"
PRZO,ParaZero Technologies Ltd. Ordinary Shares,$1.48,-0.07,-4.516%,"24,685,854"
NINE,"Nine Energy Service, Inc. Common Stock",$0.5669,-0.01,-1.733%,"24,569,758"
AKTX,Akari Therapeutics plc ADS,$0.7526,-0.0174,-2.26%,"24,545,847"
TLF,"Tandy Leather Factory, Inc. Common Stock",$3.0342,-0.0158,-0.518%,"24,478,415"
SAGT,SAGTEC GLOBAL LIMITED Ordinary shares,$1.95,0.0102,0.526%,"24,472,500"
DRTSW,Alpha Tau Medical Ltd. Warrant,$0.3448,0.0397,13.012%,"24,267,221"
PSHG,Performance Shipping Inc. Common Shares,$1.9501,-0.0399,-2.005%,"24,243,951"
CAPT,Captivision Inc. Ordinary Shares,$0.8302,-0.0182,-2.145%,"24,206,674"
JVA,"Coffee Holding Co., Inc. Common Stock",$4.24,0.03,0.713%,"24,204,460"
TRSG,Tungray Technologies Inc Class A Ordinary Shares,$1.48,0.025,1.718%,"24,203,158"
MTVA,MetaVia Inc. Common Stock,$1.00,-0.02,-1.961%,"24,197,809"
SNYR,Synergy CHC Corp. Common Stock,$2.53,0.005,0.198%,"24,170,871"
APUS,"Apimeds Pharmaceuticals US, Inc. Common Stock",$1.90,0.08,4.396%,"23,894,368"
UTSI,UTStarcom Holdings Corp. Ordinary Shares,$2.51,0.02,0.803%,"23,770,340"
MCTR,CTRL Group Limited Ordinary Shares,$1.55,0.07,4.73%,"23,715,000"
WXM,WF International Limited Ordinary Shares,$3.435,0.155,4.726%,"23,701,500"
PMN,ProMIS Neurosciences Inc. Common Shares (ON),$0.4403,-0.0096,-2.134%,"23,693,032"
KAPA,"Kairos Pharma, Ltd. Common Stock",$1.14,-0.03,-2.564%,"23,647,892"
RLYB,Rallybio Corporation Common Stock,$0.56,0.0081,1.468%,"23,400,424"
AYTU,"Aytu BioPharma, Inc.  Common Stock",$2.36,-0.02,-0.84%,"23,392,115"
SLMT,Brera Holdings PLC Class B Ordinary Shares,$9.61,-2.20,-18.628%,"23,205,344"
TLPH,"Talphera, Inc. Common Stock",$1.13,-0.02,-1.739%,"23,190,600"
BURU,"Nuburu, Inc. Common Stock",$0.2896,-0.0505,-14.849%,"23,154,365"
BGI,Birks Group Inc. Common Stock,$1.18,0.02,1.724%,"23,121,731"
SPCB,"SuperCom, Ltd. Ordinary Shares (Israel)",$10.62,0.05,0.473%,"23,075,720"
JL,J-Long Group Limited Class A Ordinary Shares,$6.13,-0.4199,-6.411%,"23,059,227"
NCRA,"Nocera, Inc. Common Stock",$1.60,0.01,0.629%,"22,988,062"
CCM,Concord Medical Services Holdings Limited American Depositary Shares (Each represents thirty (30) Class A ordinary shares),$5.29,-0.20,-3.643%,"22,967,715"
MSAI,"MultiSensor AI Holdings, Inc. Common Stock",$0.6625,0.1125,20.455%,"22,905,596"
KMRK,K-Tech Solutions Company Limited Class A Ordinary Shares,$1.16,-0.11,-8.661%,"22,620,000"
RMSG,Real Messenger Corporation Ordinary Shares,$2.36,0.12,5.357%,"22,588,223"
ORBS,Eightco Holdings Inc. Common Stock,$7.41,-1.34,-15.314%,"22,561,553"
ANY,Sphere 3D Corp. Common Shares,$0.7949,-0.0892,-10.089%,"22,512,229"
JOB,GEE Group Inc. Common Stock,$0.2057,0.0043,2.135%,"22,506,304"
BQ,Boqii Holding Limited Class A Ordinary Shares,$7.80,-0.45,-5.455%,"22,460,989"
NXGL,"NexGel, Inc Common Stock",$2.78,0.20,7.752%,"22,427,872"
COHN,Cohen & Company Inc.,$11.01,0.12,1.102%,"22,414,852"
BCTX,BriaCell Therapeutics Corp. Common Shares,$12.77,0.63,5.189%,"22,412,742"
MNDO,MIND C.T.I. Ltd. Ordinary Shares,$1.10,0.06,5.769%,"22,402,959"
LSH,Lakeside Holding Limited Common Stock,$1.282,-0.018,-1.385%,"22,342,131"
IZM,ICZOOM Group Inc. Class A Ordinary Shares,$1.90,-0.15,-7.317%,"22,290,791"
GFAI,"Guardforce AI Co., Limited Ordinary Shares",$1.06,UNCH,--,"22,284,940"
TIRX,TIAN RUIXIANG Holdings Ltd Class A Ordinary Shares,$0.9083,0.0278,3.157%,"22,127,488"
GYRO,"Gyrodyne, LLC Common Stock",$10.0451,0.0451,0.451%,"22,092,269"
SQFTP,"Presidio Property Trust, Inc. 9.375% Series D Cumulative Redeemable Perpetual Preferred Stock, $0.01 par value per share",$15.22,-0.165,-1.072%,"22,085,559"
ADGM,"Adagio Medical Holdings, Inc Common Stock",$1.43,-0.02,-1.379%,"21,995,638"
IBIO,"iBio, Inc. Common Stock",$1.11,0.217,24.30%,"21,816,646"
CKX,"CKX Lands, Inc. Common Stock",$10.60,-0.10,-0.935%,"21,763,167"
SJ,Scienjoy Holding Corporation Class A Ordinary Shares ,$0.5171,-0.0269,-4.945%,"21,719,957"
ALLR,"Allarity Therapeutics, Inc. Common Stock",$1.48,-0.03,-1.987%,"21,637,061"
AFRIW,Forafric Global PLC Warrants,$0.80,0.05,6.667%,"21,521,274"
WKSP,"Worksport, Ltd. Common Stock",$3.24,-0.11,-3.284%,"21,520,203"
IQST,iQSTEL Inc. Common Stock,$5.96,-0.12,-1.974%,"21,499,311"
HOVRW,New Horizon Aircraft Ltd. Warrant,$0.5246,-0.0416,-7.347%,"21,491,584"
MTC,"MMTec, Inc. Common Shares",$0.85,-0.06,-6.593%,"21,408,834"
LRE,"Lead Real Estate Co., Ltd American Depositary Shares",$1.565,0.135,9.441%,"21,349,574"
LEDS,SemiLEDS Corporation Common Stock,$2.59,0.15,6.148%,"21,296,024"
DXST,Decent Holding Inc Class A Ordinary Shares,$1.3101,-0.0599,-4.372%,"21,289,125"
PRPH,"ProPhase Labs, Inc. Common Stock (DE)",$0.5109,-0.0181,-3.422%,"21,223,402"
KIDZ,"Classover Holdings, Inc. Class B Common Stock",$0.8611,-0.0155,-1.768%,"21,198,979"
SATLW,Satellogic Inc. Warrant,$0.20,-0.02,-9.091%,"21,113,665"
BNAI,Brand Engagement Network Inc. Common Stock,$0.4694,-0.0456,-8.854%,"21,067,045"
TRAW,"Traws Pharma, Inc. Common Stock",$2.98,-0.09,-2.932%,"21,050,210"
GTEC,Greenland Technologies Holding Corporation Ordinary Shares,$1.21,-0.02,-1.626%,"21,047,013"
LSTA,"Lisata Therapeutics, Inc. Common Stock",$2.40,-0.05,-2.041%,"21,014,275"
FLDDW,"Fold Holdings, Inc. Warrant",$0.449,0.009,2.045%,"21,008,679"
CING,Cingulate Inc. Common Stock,$3.85,0.04,1.05%,"20,838,214"
SYBX,"Synlogic, Inc. Common Stock",$1.78,0.05,2.89%,"20,824,076"
FEMY,Femasys Inc. Common Stock,$0.6386,0.0373,6.203%,"20,802,655"
TGHL,The GrowHub Limited Class A Ordinary Shares,$0.8201,0.044,5.669%,"20,748,374"
VVOS,"Vivos Therapeutics, Inc. Common Stock",$2.76,-0.09,-3.158%,"20,713,267"
LIXT,"Lixte Biotechnology Holdings, Inc. Common Stock",$4.53,0.20,4.619%,"20,662,974"
BANL,CBL International Limited Ordinary Shares,$0.7498,0.0168,2.292%,"20,619,500"
OABIW,"OmniAb, Inc. Warrant",$0.168,UNCH,--,"20,613,817"
CLSD,"Clearside Biomedical, Inc. Common Stock",$3.925,-0.165,-4.034%,"20,543,532"
SPPL,SIMPPLE LTD. Ordinary Shares,$5.80,-0.20,-3.333%,"20,530,782"
NTCL,NETCLASS TECHNOLOGY INC Class A Ordinary Shares,$1.15,-0.03,-2.542%,"20,504,500"
PPCB,"Propanc Biopharma, Inc. Common Stock",$1.59,-0.05,-3.049%,"20,362,728"
WETH,Wetouch Technology Inc. Common Stock,$1.70,-0.02,-1.163%,"20,283,608"
MDAIW,"Spectral AI, Inc. Warrants",$0.7582,-0.0888,-10.484%,"20,267,435"
AMBR,Amber International Holding Limited American Depositary Shares,$2.13,-0.02,-0.93%,"20,188,419"
LPTX,"Leap Therapeutics, Inc. Common Stock",$0.4856,-0.037,-7.08%,"20,123,035"
MI,NFT Limited Class A Ordinary Share,$3.97,0.07,1.795%,"20,108,646"
CTRM,Castor Maritime Inc. Common Shares,$2.08,-0.025,-1.188%,"20,097,696"
HCAI,"Huachen AI Parking Management Technology Holding Co., Ltd. Class A Ordinary Shares",$0.595,-0.0021,-0.352%,"20,072,325"
MRM,MEDIROM Healthcare Technologies Inc. American Depositary Share,$2.54,0.11,4.527%,"20,070,953"
DTCK,Davis Commodities Limited Class A Ordinary Shares,$0.8175,0.0372,4.767%,"20,029,261"
RPGL,Republic Power Group Limited Class A Ordinary Shares,$1.24,-0.27,-17.881%,"19,964,000"
CUPR,Cuprina Holdings (Cayman) Limited Class A Ordinary Shares,$0.95,0.01,1.064%,"19,950,000"
MGIH,Millennium Group International Holdings Limited Ordinary Shares,$1.77,-0.21,-10.606%,"19,912,500"
CRIS,"Curis, Inc. Common Stock",$1.58,UNCH,--,"19,748,188"
ELPW,Elong Power Holding Limited Class A Ordinary Shares,$0.3401,-0.0078,-2.242%,"19,744,866"
SNES,"SenesTech, Inc. Common Stock",$3.73,-0.31,-7.673%,"19,481,846"
ANGH,Anghami Inc. Ordinary Shares,$2.91,-0.04,-1.356%,"19,464,155"
IPM,Intelligent Protection Management Corp. Common Stock ,$2.10,0.15,7.692%,"19,397,673"
WVVI,"Willamette Valley Vineyards, Inc. Common Stock",$3.90,0.1045,2.753%,"19,361,663"
WFF,WF Holding Limited Ordinary Shares,$0.776,-0.0652,-7.751%,"19,361,200"
HTCR,"Heartcore Enterprises, Inc. Common Stock",$0.83,0.1244,17.63%,"19,347,939"
EHLD,Euroholdings Ltd. Common Stock ,$6.8519,-0.3154,-4.401%,"19,299,164"
HUDI,"Huadi International Group Co., Ltd. Ordinary Shares",$1.35,0.01,0.746%,"19,276,896"
SEGG,"Lottery.com, Inc. Common Stock",$4.88,0.47,10.658%,"19,228,542"
NXPL,NextPlat Corp Common Stock,$0.74,-0.0099,-1.32%,"19,212,658"
HOTH,"Hoth Therapeutics, Inc. Common Stock",$1.44,0.05,3.597%,"19,092,999"
EDSA,"Edesa Biotech, Inc. Common Shares",$2.71,0.29,11.983%,"19,072,026"
ZCMD,Zhongchao Inc. Class A Ordinary Shares,$0.7449,0.0469,6.719%,"18,912,194"
WIMI,WiMi Hologram Cloud Inc. Class B Ordinary Shares,$3.85,-0.09,-2.284%,"18,905,052"
EONR,EON Resources Inc. Class A Common Stock,$0.5056,0.0394,8.451%,"18,859,566"
TMDE,TMD Energy Limited Ordinary Shares,$0.80,0.0159,2.028%,"18,852,000"
RENT,"Rent the Runway, Inc. Class A Common Stock",$4.60,-0.07,-1.499%,"18,846,343"
AZI,Autozi Internet Technology (Global) Ltd. Class A Ordinary Shares,$0.1777,0.0022,1.254%,"18,832,859"
BTMWW,Bitcoin Depot Inc. Warrant,$0.2733,0.0058,2.168%,"18,606,709"
PN,Skycorp Solar Group Limited Ordinary Shares,$0.6889,-0.012,-1.712%,"18,600,300"
COCH,"Envoy Medical, Inc. Class A Common Stock",$0.8592,0.0162,1.922%,"18,490,785"
VWAVW,"VisionWave Holdings, Inc. Warrant",$1.27,-0.20,-13.605%,"18,441,788"
BATL,Battalion Oil Corporation Common Stock,$1.12,-0.01,-0.885%,"18,431,351"
MTEX,"Mannatech, Incorporated Common Stock",$9.68,0.23,2.434%,"18,401,002"
MXC,Mexco Energy Corporation Common Stock,$8.99,-0.21,-2.283%,"18,393,540"
TDIC,Dreamland Limited Class A Ordinary Shares,$0.593,-0.0069,-1.15%,"18,383,000"
IRIX,IRIDEX Corporation Common Stock,$1.08,0.02,1.887%,"18,351,633"
DLPN,"Dolphin Entertainment, Inc. Common Stock",$1.56,0.07,4.698%,"18,310,849"
HBIO,"Harvard Bioscience, Inc. Common Stock",$0.41,0.012,3.015%,"18,257,791"
CJMB,Callan JMB Inc. Common Stock,$4.07,-0.1241,-2.959%,"18,237,951"
BGLWW,Blue Gold Limited Warrant,$0.595,-0.025,-4.032%,"18,190,200"
TOMZ,"TOMI Environmental Solutions, Inc. Common Stock",$0.9061,0.0136,1.524%,"18,190,143"
MDRR,"Medalist Diversified REIT, Inc. Common Stock",$13.50,UNCH,--,"18,161,010"
SOHO,Sotherly Hotels Inc. Common Stock,$0.8848,0.0108,1.236%,"18,129,995"
NISN,"NiSun International Enterprise Development Group Co., Ltd. Class A Common Shares",$3.77,0.14,3.857%,"18,089,810"
PULM,"Pulmatrix, Inc. Common Stock",$4.9419,-0.0681,-1.359%,"18,049,227"
CXAI,CXApp Inc. Class A Common Stock,$0.7689,-0.0168,-2.138%,"18,019,351"
IPW,iPower Inc. Common Stock,$0.5685,-0.0513,-8.277%,"17,904,160"
TRIB,Trinity Biotech plc American Depositary Shares,$0.9601,-0.0699,-6.786%,"17,888,601"
RAY,Raytech Holding Limited Ordinary Shares,$0.41,-0.02,-4.651%,"17,875,214"
GIGM,GigaMedia Limited Ordinary Shares,$1.6118,-0.0382,-2.315%,"17,813,992"
LEXX,Lexaria Bioscience Corp. Common Stock,$0.9068,-0.0362,-3.839%,"17,736,264"
PRHI,"Presurance Holdings, Inc. Common Stock",$1.45,-0.03,-2.027%,"17,723,177"
AENTW,Alliance Entertainment Holding Corporation Warrants,$0.347,UNCH,--,"17,682,207"
CMBM,Cambium Networks Corporation Ordinary Shares,$0.6256,-0.0468,-6.96%,"17,669,326"
CMMB,Chemomab Therapeutics Ltd. American Depositary Share,$3.39,-0.01,-0.294%,"17,597,748"
ICU,SeaStar Medical Holding Corporation Common Stock,$0.63,0.001,0.159%,"17,586,195"
FBLG,"FibroBiologics, Inc. Common Stock",$0.418,0.0077,1.877%,"17,509,661"
AURE,Prestige Wealth Inc. Class A Ordinary Shares,$0.5493,0.0443,8.772%,"17,380,928"
VSTD,Vestand Inc. Class A Common Stock,$1.22,-0.09,-6.87%,"17,354,476"
USGOW,U.S. GoldMining Inc. Warrant,$1.36,-0.29,-17.576%,"17,248,439"
WKHS,"Workhorse Group, Inc. Common Stock",$1.12,0.02,1.818%,"17,218,058"
EHGO,Eshallgo Inc. Class A Ordinary Shares,$0.5792,-0.0008,-0.138%,"17,198,859"
YMAT,"J-Star Holding Co., Ltd. Ordinary Shares",$1.01,0.05,5.208%,"17,183,016"
MWYN,"Marwynn Holdings, Inc. Common stock",$0.999,-0.031,-3.01%,"17,036,950"
AIMD,"Ainos, Inc. Common Stock",$3.635,-0.305,-7.741%,"16,931,325"
RYDE,Ryde Group Ltd. Class A Ordinary Shares,$0.575,0.0395,7.376%,"16,841,650"
ATHA,"Athira Pharma, Inc. Common Stock",$4.26,0.59,16.076%,"16,801,155"
INVZW,Innoviz Technologies Ltd. Warrant,$0.0844,0.0044,5.50%,"16,792,389"
HXHX,Haoxin Holdings Limited Class A Ordinary Shares,$1.21,-0.09,-6.923%,"16,637,500"
DAVEW,Dave Inc. Warrants,$1.2199,0.1394,12.901%,"16,626,820"
AQMS,"Aqua Metals, Inc. Common Stock",$11.79,-0.51,-4.146%,"16,576,799"
EDTK,Skillful Craftsman Education Technology Limited Ordinary Share,$1.04,UNCH,--,"16,566,629"
LMFA,"LM Funding America, Inc. Common Stock",$1.08,-0.04,-3.571%,"16,414,259"
BTCT,BTC Digital Ltd. Ordinary Shares,$2.55,-0.03,-1.163%,"16,406,802"
HUBC,Hub Cyber Security Ltd. Ordinary Shares,$1.63,0.06,3.822%,"16,377,092"
MMA,Mixed Martial Arts Group Limited Ordinary Shares,$1.58,0.02,1.282%,"16,246,644"
NAII,"Natural Alternatives International, Inc. Common Stock",$2.63,-0.0662,-2.455%,"16,244,926"
CURX,Curanex Pharmaceuticals Inc Common Stock,$0.5839,-0.0031,-0.528%,"16,203,225"
HCTI,"Healthcare Triangle, Inc. Common Stock",$2.77,0.13,4.924%,"16,154,166"
PALI,"Palisade Bio, Inc. Common Stock",$1.77,-0.09,-4.839%,"16,140,899"
DTSS,Datasea Inc. Common Stock,$1.95,0.01,0.515%,"16,100,791"
MSN,Emerson Radio Corporation Common Stock,$0.7647,0.2847,59.313%,"16,091,316"
VSEE,"VSee Health, Inc. Common Stock",$0.9452,0.4569,93.57%,"16,089,847"
ABP,"Abpro Holdings, Inc Common Stock",$0.2006,-0.022,-9.883%,"16,081,433"
ELSE,"Electro-Sensors, Inc. Common Stock",$4.65,-0.05,-1.064%,"16,037,948"
GTIM,Good Times Restaurants Inc. Common Stock,$1.52,UNCH,--,"16,035,252"
BLIN,"Bridgeline Digital, Inc. Common Stock",$1.32,0.04,3.125%,"15,987,930"
ABTS,Abits Group Inc Ordinary Shares,$6.74,0.40,6.309%,"15,974,737"
WVVIP,"Willamette Valley Vineyards, Inc. Series A Redeemable Preferred Stock",$3.21,0.0494,1.563%,"15,936,138"
LPCN,Lipocine Inc. Common Stock,$2.93,0.01,0.342%,"15,877,808"
IPST,"Heritage Distilling Holding Company, Inc. Common Stock",$0.605,-0.063,-9.431%,"15,874,611"
AIXI,XIAO-I Corporation American Depositary Shares,$1.271,-0.009,-0.703%,"15,837,087"
GTI,Graphjet Technology Class A Ordinary Shares,$4.91,-0.20,-3.914%,"15,761,404"
PLAG,Planet Green Holdings Corp. Common Stock,$2.16,-0.36,-14.286%,"15,730,662"
ASBP,"Aspire Biopharma Holdings, Inc. Common Stock",$0.317,0.002,0.635%,"15,699,732"
VRME,"VerifyMe, Inc. Common Stock",$1.27,-0.16,-11.189%,"15,651,056"
INTJ,Intelligent Group Limited Class A Ordinary Shares ,$0.5061,0.0059,1.18%,"15,562,575"
PHGE,BiomX Inc. COmmon Stock,$0.586,-0.0078,-1.314%,"15,548,858"
SRTAW,"Strata Critical Medical, Inc. Warrants",$0.19,-0.001,-0.524%,"15,522,165"
ALUR,"Allurion Technologies, Inc. Common Stock",$1.99,-0.03,-1.485%,"15,447,735"
SOPA,Society Pass Incorporated Common Stock,$2.88,-0.49,-14.54%,"15,442,327"
SAIH,SAIHEAT Limited Class A Ordinary Shares,$8.79,-0.11,-1.236%,"15,408,431"
FIEE,"FiEE, Inc Common Stock",$2.47,-0.01,-0.403%,"15,374,241"
AIRI,Air Industries Group Common Stock,$3.22,UNCH,--,"15,365,692"
MSS,Maison Solutions Inc. Class A Common Stock,$0.78,0.0801,11.444%,"15,358,571"
EFOI,"Energy Focus, Inc. Common Stock",$2.80,-0.01,-0.356%,"15,329,622"
ANNAW,"AleAnna, Inc. Warrant",$0.188,0.0031,1.677%,"15,288,115"
AMST,Amesite Inc. Common Stock,$3.34,UNCH,--,"15,272,861"
PASW,"Ping An Biomedical Co., Ltd. Ordinary Shares",$0.7415,-0.0328,-4.236%,"15,200,750"
IMRN,Immuron Limited American Depositary Shares,$2.265,-0.085,-3.617%,"15,187,955"
PT,Pintec Technology Holdings Limited American Depositary Shares,$0.95,0.034,3.712%,"15,150,562"
AMS,American Shared Hospital Services Common Stock,$2.32,-0.06,-2.521%,"15,103,200"
PCSA,"Processa Pharmaceuticals, Inc. Common Stock",$0.2999,-0.0186,-5.84%,"15,099,710"
SMSI,"Smith Micro Software, Inc. Common Stock",$0.715,0.0053,0.747%,"15,011,366"
TAIT,Taitron Components Incorporated Class A Common Stock,$2.49,0.038,1.55%,"14,992,738"
MTEK,Maris-Tech Ltd. Ordinary Shares,$1.87,-0.09,-4.592%,"14,929,267"
JYD,Jayud Global Logistics Limited Class A Ordinary Shares,$5.43,0.10,1.876%,"14,844,909"
MNTS,Momentus Inc. Class A Common Stock,$1.27,-0.05,-3.788%,"14,775,644"
PMNT,Perfect Moment Ltd. Common Stock,$0.4689,-0.0042,-0.888%,"14,721,970"
GOVX,"GeoVax Labs, Inc. Common Stock",$0.5789,-0.0187,-3.129%,"14,680,668"
TKLF,"Tokyo Lifestyle Co., Ltd. American Depositary Shares",$3.465,0.325,10.35%,"14,666,586"
HIND,"Vyome Holdings, Inc. Common Stock",$5.44,0.02,0.369%,"14,651,759"
MBRX,"Moleculin Biotech, Inc. Common Stock",$0.481,-0.0236,-4.677%,"14,567,647"
ZONE,CleanCore Solutions Inc. Class B Common Stock,$1.30,-0.08,-5.797%,"14,528,600"
