Symbol,Name,Last Sale,Net Change,% Change,Market Cap
EONR,EON Resources Inc. Class A Common Stock,$0.42,-0.0215,-4.87%,"15,666,570"
IBIO,"iBio, Inc. Common Stock",$0.7967,-0.0301,-3.641%,"15,658,849"
FLYE,"Fly-E Group, Inc. Common Stock",$0.8279,-0.0536,-6.081%,"15,644,851"
YYGH,YY Group Holding Limited Class A Ordinary Shares,$0.3768,-0.0091,-2.358%,"15,485,557"
NXTC,"NextCure, Inc. Common Stock",$5.78,0.0344,0.599%,"15,467,916"
KITT,"Nauticus Robotics, Inc. Common stock",$3.29,-0.10,-2.95%,"15,451,172"
ANNAW,"AleAnna, Inc. Warrant",$0.19,-0.0346,-15.405%,"15,450,755"
ALUR,"Allurion Technologies, Inc. Common Stock",$1.99,-0.12,-5.687%,"15,447,735"
IPW,iPower Inc. Common Stock,$0.4925,-0.0232,-4.499%,"15,444,750"
MMA,Mixed Martial Arts Group Limited Ordinary Shares,$1.50,0.06,4.167%,"15,424,029"
CNFR,"Conifer Holdings, Inc. Common Stock",$1.25,0.09,7.759%,"15,278,601"
AGMH,AGM Group Holdings Inc. Class A Ordinary Shares,$7.56,-0.28,-3.571%,"15,243,069"
ABVEW,Above Food Ingredients Inc. Warrants,$0.297,0.0234,8.553%,"15,203,979"
DLPN,"Dolphin Entertainment, Inc. Common Stock",$1.29,-0.0291,-2.206%,"15,141,664"
NERV,"Minerva Neurosciences, Inc Common Stock",$2.165,-0.025,-1.142%,"15,140,724"
PMNT,Perfect Moment Ltd. Common Stock,$0.4816,-0.0023,-0.475%,"15,120,709"
SMSI,"Smith Micro Software, Inc. Common Stock",$0.7195,-0.0344,-4.563%,"15,105,843"
USEA,United Maritime Corporation Common Stock,$1.70,-0.05,-2.857%,"15,035,254"
WETH,Wetouch Technology Inc. Common Stock,$1.26,-0.045,-3.448%,"15,033,733"
ATHA,"Athira Pharma, Inc. Common Stock",$3.81,-0.26,-6.388%,"15,026,385"
INTJ,Intelligent Group Limited Class A Ordinary Shares ,$0.488,-0.0111,-2.224%,"15,006,000"
ARQQW,Arqit Quantum Inc. Warrants,$1.20,-0.15,-11.111%,"15,004,811"
PT,Pintec Technology Holdings Limited American Depositary Shares,$0.9391,-0.0403,-4.115%,"14,976,729"
HSDT,"Helius Medical Technologies, Inc. Class A Common Stock (DE)",$13.88,-1.34,-8.804%,"14,952,327"
ETS,Elite Express Holding Inc. Class A Common Stock,$0.88,-0.0623,-6.611%,"14,886,671"
HCTI,"Healthcare Triangle, Inc. Common Stock",$2.55,UNCH,--,"14,871,164"
AIRI,Air Industries Group Common Stock,$3.11,0.05,1.634%,"14,840,777"
FPAY,"FlexShopper, Inc. Common Stock",$0.6901,-0.0149,-2.113%,"14,810,574"
TAIT,Taitron Components Incorporated Class A Common Stock,$2.45,-0.08,-3.162%,"14,751,891"
UUU,"Universal Safety Products, Inc. Common Stock",$6.33,-0.80,-11.22%,"14,640,575"
OXBR,Oxbridge Re Holdings Limited Ordinary Shares,$1.94,-0.09,-4.433%,"14,619,689"
HIND,"Vyome Holdings, Inc. Common Stock",$5.41,-0.05,-0.916%,"14,570,959"
LPCN,Lipocine Inc. Common Stock,$2.68,-0.08,-2.899%,"14,523,046"
CODX,"Co-Diagnostics, Inc. Common Stock",$0.3752,-0.0384,-9.284%,"14,454,048"
MNTS,Momentus Inc. Class A Common Stock,$1.24,-0.06,-4.615%,"14,426,613"
BFRG,"Bullfrog AI Holdings, Inc. Common Stock",$1.43,-0.02,-1.379%,"14,416,316"
AMST,Amesite Inc. Common Stock,$3.14,-0.11,-3.385%,"14,358,319"
LPTX,"Leap Therapeutics, Inc. Common Stock",$0.3461,0.0388,12.626%,"14,342,221"
CCTG,CCSC Technology International Holdings Limited Class A Ordinary Shares,$1.23,-0.03,-2.381%,"14,244,938"
ATON,AlphaTON Capital Corp. Common Stock,$6.25,0.23,3.821%,"14,241,388"
ORKT,Orangekloud Technology Inc. Class A Ordinary Shares,$0.6096,-0.0224,-3.544%,"14,239,646"
BLRX,BioLineRx Ltd. American Depositary Shares,$3.79,0.01,0.265%,"14,102,601"
HYFM,"Hydrofarm Holdings Group, Inc. Common Stock",$3.00,-0.07,-2.28%,"13,977,060"
LCFYW,Locafy Limited Warrant,$10.00,UNCH,--,"13,821,850"
PHGE,BiomX Inc. COmmon Stock,$0.52,-0.01,-1.887%,"13,797,622"
SOS,SOS Limited Class A Ordinary Shares,$2.03,-0.10,-4.695%,"13,791,564"
BHAT,Blue Hat Interactive Entertainment Technology Ordinary Shares,$1.90,-0.02,-1.042%,"13,763,469"
ILAG,Intelligent Living Application Group Inc. Ordinary Shares,$0.659,-0.011,-1.642%,"13,687,089"
CWD,CaliberCos Inc. Class A Common Stock,$5.66,-0.34,-5.667%,"13,669,115"
GLE,Global Engine Group Holding Limited Class A Ordinary Shares,$0.7462,-0.0031,-0.414%,"13,655,460"
JYD,Jayud Global Logistics Limited Class A Ordinary Shares,$0.1455,-0.0077,-5.026%,"13,653,181"
FTRK,FAST TRACK GROUP Ordinary shares,$0.6225,-0.0113,-1.783%,"13,578,281"
BIVI,BioVie Inc. Class A Common Stock,$1.80,-0.06,-3.226%,"13,561,605"
ARTW,"Art's-Way Manufacturing Co., Inc. Common Stock",$2.65,-0.05,-1.852%,"13,536,423"
THAR,"Tharimmune, Inc. Common Stock",$2.91,-0.05,-1.689%,"13,488,580"
SCNX,"Scienture Holdings, Inc. Common Stock",$0.8324,-0.0258,-3.006%,"13,427,594"
DUO,Fangdd Network Group Ltd. Class A Ordinary Shares,$3.43,-0.44,-11.37%,"13,392,658"
REBN,"Reborn Coffee, Inc. Common Stock",$2.47,-0.02,-0.803%,"13,361,999"
MBRX,"Moleculin Biotech, Inc. Common Stock",$0.4397,0.014,3.289%,"13,316,828"
TRAW,"Traws Pharma, Inc. Common Stock",$1.88,0.02,1.075%,"13,279,999"
CHEK,Check-Cap Ltd. Ordinary Share,$2.26,0.11,5.116%,"13,223,048"
ZKIN,"ZK International Group Co., Ltd Ordinary Share",$2.55,0.22,9.442%,"13,168,062"
FGI,FGI Industries Ltd. Ordinary Shares,$6.86,-0.14,-2.00%,"13,159,613"
IMNN,"Imunon, Inc. Common Stock",$5.19,0.06,1.17%,"13,085,064"
GLBZ,Glen Burnie Bancorp Common Stock,$4.50,-0.12,-2.597%,"13,053,065"
FLGC,Flora Growth Corp. Common Stock,$22.53,-0.01,-0.044%,"13,037,728"
CMMB,Chemomab Therapeutics Ltd. American Depositary Share,$2.50,-0.10,-3.846%,"12,977,690"
LVLU,"Lulu's Fashion Lounge Holdings, Inc. Common Stock",$4.72,-0.175,-3.575%,"12,974,950"
NCL,Northann Corp. Common Stock,$0.1358,-0.0391,-22.356%,"12,964,011"
OSRH,"OSR Holdings, Inc. Common Stock",$0.6001,-0.06,-9.09%,"12,953,375"
SFHG,Samfine Creation Holdings Group Limited Class A Ordinary Share,$0.7184,0.0085,1.197%,"12,931,200"
ATCH,"AtlasClear Holdings, Inc. Common Stock",$0.8251,0.1551,23.149%,"12,869,049"
COCP,"Cocrystal Pharma, Inc. Common Stock",$1.25,-0.08,-6.015%,"12,823,583"
GTI,Graphjet Technology Class A Ordinary Shares,$3.99,UNCH,--,"12,808,147"
NCEW,New Century Logistics (BVI) Limited Ordinary Shares,$0.5951,-0.0257,-4.14%,"12,794,650"
CGTL,Creative Global Technology Holdings Limited Class A Ordinary Shares,$0.5967,-0.0134,-2.196%,"12,791,756"
APM,Aptorum Group Limited Class A Ordinary Shares,$1.79,0.02,1.13%,"12,787,325"
INHD,Inno Holdings Inc. Common Stock,$1.65,0.05,3.125%,"12,784,995"
PLAG,Planet Green Holdings Corp. Common Stock,$1.75,-0.10,-5.405%,"12,744,750"
GELS,Gelteq Limited Ordinary Shares,$1.35,-0.10,-6.897%,"12,741,401"
BRN,"Barnwell Industries, Inc. Common Stock",$1.26,-0.06,-4.545%,"12,692,653"
RMCF,"Rocky Mountain Chocolate Factory, Inc. Common Stock",$1.62,-0.03,-1.818%,"12,626,157"
PHIO,Phio Pharmaceuticals Corp. Common Stock,$2.20,-0.03,-1.345%,"12,598,850"
BNAI,Brand Engagement Network Inc. Common Stock,$0.2929,0.0018,0.618%,"12,591,595"
ZBAI,ATIF Holdings Limited Ordinary Shares,$9.57,-0.19,-1.947%,"12,568,980"
STI,"Solidion Technology, Inc. Common Stock",$4.52,-0.18,-3.83%,"12,539,859"
SINT,"SiNtx Technologies, Inc. Common Stock",$4.54,-0.37,-7.536%,"12,525,247"
MITQ,"Moving iMage Technologies, Inc. Common Stock",$1.26,-0.12,-8.696%,"12,516,436"
NBY,"NovaBay Pharmaceuticals, Inc. Common Stock",$2.14,-0.02,-0.926%,"12,462,284"
MDCXW,Medicus Pharma Ltd. Warrant,$0.78,UNCH,--,"12,430,287"
LGCL,Lucas GC Limited Ordinary Shares,$0.1563,-0.0236,-13.118%,"12,420,701"
GXAI,Gaxos.ai Inc. Common Stock,$1.74,-0.12,-6.452%,"12,394,808"
CRGOW,Freightos Limited Warrants,$0.2475,-0.0225,-8.333%,"12,385,578"
PSIG,PS International Group Ltd. Ordinary Shares,$0.4757,-0.0142,-2.899%,"12,357,228"
MHUA,"Meihua International Medical Technologies Co., Ltd. Ordinary Shares",$0.3869,-0.013,-3.251%,"12,343,839"
GRRRW,Gorilla Technology Group Inc. Warrant,$0.61,-0.005,-0.813%,"12,335,568"
GPUS,"Hyperscale Data, Inc. Common Stock",$0.3829,-0.0197,-4.893%,"12,308,111"
PHH,"Park Ha Biological Technology Co., Ltd. Ordinary Shares",$0.4664,-0.0136,-2.833%,"12,301,022"
LFWD,Lifeward Ltd. Ordinary Shares,$0.7819,-0.0314,-3.861%,"12,279,444"
TXMD,"TherapeuticsMD, Inc. Common Stock",$1.06,-0.02,-1.852%,"12,268,824"
EKSO,"Ekso Bionics Holdings, Inc. Common Stock",$4.69,0.03,0.644%,"12,249,286"
LBGJ,Li Bang International Corporation Inc. Ordinary Shares,$0.66,-0.685,-50.929%,"12,223,200"
JZXN,"Jiuzi Holdings, Inc. Ordinary Shares",$1.11,0.02,1.835%,"12,222,642"
XAIR,"Beyond Air, Inc. Common Stock",$2.33,-0.13,-5.285%,"12,177,076"
HOVRW,New Horizon Aircraft Ltd. Warrant,$0.3105,0.0055,1.803%,"12,174,907"
DSS,"DSS, Inc. Common Stock",$1.335,0.0201,1.529%,"12,138,512"
LGVN,Longeveron Inc. Class A Common Stock,$0.7936,-0.0024,-0.302%,"12,045,717"
IPDN,"Professional Diversity Network, Inc. Common Stock",$4.80,0.46,10.599%,"11,998,478"
WATT,Energous Corporation Common Stock,$8.20,0.11,1.36%,"11,933,944"
JCTC,Jewett-Cameron Trading Company Common Shares,$3.3899,-0.0401,-1.169%,"11,926,072"
ATXG,Addentax Group Corp. Common Stock,$1.00,-0.02,-1.961%,"11,715,348"
PCLA,PicoCELA Inc. American Depositary Shares,$0.4741,-0.0089,-1.843%,"11,702,618"
VRME,"VerifyMe, Inc. Common Stock",$0.9492,-0.0403,-4.073%,"11,697,624"
EDUC,Educational Development Corporation Common Stock,$1.36,-0.01,-0.73%,"11,673,153"
INTS,"Intensity Therapeutics, Inc. Common stock",$0.248,-0.002,-0.80%,"11,670,316"
NCPL,Netcapital Inc. Common Stock,$2.37,-0.04,-1.66%,"11,655,397"
GRNQ,Greenpro Capital Corp. Common Stock,$1.405,-0.012,-0.847%,"11,627,517"
MBIO,"Mustang Bio, Inc. Common Stock",$1.60,-0.02,-1.235%,"11,583,434"
BRTX,"BioRestorative Therapies, Inc. Common Stock (NV)",$1.45,UNCH,--,"11,568,270"
ETHZW,ETHZilla Corporation Warrant,$0.0696,-0.0105,-13.109%,"11,517,106"
INBS,Intelligent Bio Solutions Inc. Common Stock,$1.28,-0.08,-5.882%,"11,493,315"
CARV,"Carver Bancorp, Inc. Common Stock",$2.262,-0.058,-2.50%,"11,483,335"
GSIW,Garden Stage Limited Ordinary Shares,$0.155,-0.0081,-4.966%,"11,474,858"
MRM,MEDIROM Healthcare Technologies Inc. American Depositary Share,$1.45,-0.11,-7.051%,"11,457,828"
MRKR,"Marker Therapeutics, Inc. Common Stock",$0.8816,-0.0334,-3.65%,"11,406,943"
JTAI,Jet.AI Inc. Common Stock,$3.48,-0.15,-4.132%,"11,349,171"
BEATW,"Heartbeam, Inc. Warrant",$0.3299,0.0386,13.251%,"11,319,393"
INLF,INLIF LIMITED Class A Ordinary Shares,$0.778,-0.0379,-4.645%,"11,281,000"
TOIIW,"The Oncology Institute, Inc. Warrant",$0.1206,0.0131,12.186%,"11,276,675"
PETZ,"TDH Holdings, Inc. Common Shares",$1.09,-0.05,-4.386%,"11,252,362"
CARM,"Carisma Therapeutics, Inc. Common Stock",$0.269,-0.013,-4.61%,"11,240,998"
FEMY,Femasys Inc. Common Stock,$0.345,-0.0083,-2.349%,"11,238,515"
OLB,"The OLB Group, Inc. Common Stock",$1.27,-0.02,-1.55%,"11,135,528"
XHLD,"TEN Holdings, Inc. Common Stock",$0.315,-0.0084,-2.597%,"11,081,318"
SONM,"Sonim Technologies, Inc. Common Stock",$0.6239,-0.0385,-5.812%,"11,067,303"
SNSE,"Sensei Biotherapeutics, Inc. Common Stock",$8.77,-0.25,-2.772%,"11,061,513"
BURU,"Nuburu, Inc. Common Stock",$0.138,-0.0055,-3.833%,"11,033,503"
BTBD,"BT Brands, Inc. Common Stock",$1.79,-0.08,-4.278%,"11,016,956"
IMRN,Immuron Limited American Depositary Shares,$1.93,0.01,0.521%,"10,991,271"
AMBO,Ambow Education Holding Ltd. American Depository Shares (each representing twenty (20) Class A Ordinary Shares),$3.7816,-0.0684,-1.777%,"10,801,671"
PTHL,Pheton Holdings Ltd Class A Ordinary Shares,$0.7579,-0.1048,-12.148%,"10,800,075"
BGLC,BioNexus Gene Lab Corp Common stock,$6.00,0.31,5.448%,"10,779,582"
TVGNW,Tevogen Bio Holdings Inc. Warrant,$0.0544,0.0044,8.80%,"10,700,756"
BOLT,"Bolt Biotherapeutics, Inc. Common Stock",$5.5306,-0.2394,-4.149%,"10,615,660"
VSEE,"VSee Health, Inc. Common Stock",$0.6399,-0.0401,-5.897%,"10,508,879"
FCHL,Fitness Champs Holdings Limited Common Stock,$0.70,0.0045,0.647%,"10,500,000"
XTLB,XTL Biopharmaceuticals Ltd. American Depositary Shares,$1.19,-0.01,-0.833%,"10,488,484"
ATER,"Aterian, Inc. Common Stock",$1.05,0.01,0.962%,"10,484,359"
LYRA,"Lyra Therapeutics, Inc. Common Stock",$6.36,-0.14,-2.154%,"10,458,727"
BBGI,"Beasley Broadcast Group, Inc. Class A Common Stock",$5.79,-1.01,-14.853%,"10,445,125"
BNZI,"Banzai International, Inc. Class A Common Stock",$3.02,0.25,9.025%,"10,443,350"
AEHL,Antelope Enterprise Holdings Limited Class A Ordinary Shares,$3.05,-0.23,-7.012%,"10,427,303"
CLWT,Euro Tech Holdings Company Limited Common Stock,$1.36,-0.0548,-3.873%,"10,358,908"
POAI,Predictive Oncology Inc. Common Stock,$0.9503,-0.2297,-19.466%,"10,351,075"
MRNOW,Murano Global Investments PLC Warrants,$0.13,-0.0004,-0.307%,"10,309,746"
TNON,"Tenon Medical, Inc. Common Stock",$1.16,-0.03,-2.521%,"10,299,895"
IFBD,"Infobird Co., Ltd Ordinary Shares",$1.2556,-0.0344,-2.667%,"10,281,574"
BFRI,Biofrontera Inc. Common Stock,$0.9601,0.0002,0.021%,"10,242,771"
AWX,Avalon Holdings Corporation Common Stock,$2.626,0.056,2.179%,"10,239,906"
LSH,Lakeside Holding Limited Common Stock,$1.36,0.07,5.426%,"10,200,000"
INEO,INNEOVA Holdings Limited Ordinary Shares,$1.03,0.105,11.351%,"10,171,250"
ADVB,Advanced Biomed Inc. Common Stock,$0.47,-0.0166,-3.411%,"10,170,800"
MTR,Mesa Royalty Trust Common Stock,$5.45,UNCH,--,"10,156,566"
SPHL,Springview Holdings Ltd Class A Ordinary Shares,$0.47,-0.0099,-2.063%,"10,105,000"
LCFY,Locafy Limited Ordinary Share,$7.31,0.22,3.103%,"10,103,772"
VS,Versus Systems Inc. Common Stock,$2.06,-0.06,-2.83%,"10,097,455"
NVNIW,Nvni Group Limited Warrants,$0.1089,0.0042,4.011%,"10,047,114"
TALKW,"Talkspace, Inc. Warrant",$0.0599,-0.0111,-15.634%,"10,031,281"
MWG,Multi Ways Holdings Limited Ordinary Shares,$0.2995,0.0026,0.876%,"9,982,335"
KZIA,Kazia Therapeutics Limited American Depositary Shares,$7.33,-0.55,-6.98%,"9,966,051"
CIIT,"Tianci International, Inc. Common Stock",$0.6001,-0.0598,-9.062%,"9,920,735"
HSCS,HeartSciences Inc. Common Stock,$3.74,0.05,1.355%,"9,902,443"
PFSA,"Profusa, Inc. Common Stock",$0.3017,-0.0094,-3.022%,"9,892,404"
CVR,Chicago Rivet & Machine Co. Common Stock,$10.15,-0.95,-8.559%,"9,806,240"
DWTX,"Dogwood Therapeutics, Inc. Common Stock",$5.11,-0.04,-0.777%,"9,765,864"
YJ,Yunji Inc. American Depository Shares,$1.98,0.03,1.538%,"9,752,569"
RYDE,Ryde Group Ltd. Class A Ordinary Shares,$0.3325,-0.0274,-7.613%,"9,738,867"
PCSA,"Processa Pharmaceuticals, Inc. Common Stock",$0.193,-0.0173,-8.226%,"9,717,386"
JEM,707 Cayman Holdings Limited Ordinary Shares,$0.442,0.0146,3.416%,"9,701,900"
ADXN,Addex Therapeutics Ltd American Depositary Shares,$9.0351,-0.2049,-2.218%,"9,659,498"
PDYNW,Palladyne AI Corp Warrants,$0.2298,-0.0196,-7.859%,"9,639,851"
MTNB,"Matinas Biopharma Holdings, Inc. Common Stock",$1.88,-0.04,-2.083%,"9,563,532"
IOTR,iOThree Limited Ordinary Shares,$0.372,-0.0047,-1.248%,"9,541,800"
TPET,Trio Petroleum Corp. Common Stock,$1.13,0.04,3.67%,"9,538,159"
CDTG,CDT Environmental Technology Investment Holdings Limited ordinary shares,$0.771,-0.0449,-5.503%,"9,502,575"
INAB,"IN8bio, Inc. Common Stock",$2.09,UNCH,--,"9,488,009"
SNTG,Sentage Holdings Inc. Class A Ordinary Shares,$3.38,0.15,4.644%,"9,481,999"
SOWG,Sow Good Inc. Common Stock,$0.7752,-0.0483,-5.865%,"9,475,734"
EPIX,ESSA Pharma Inc. Common Stock,$0.2002,-0.0007,-0.348%,"9,471,140"
GIBO,GIBO Holdings Limited Class A Ordinary Shares,$2.52,-0.06,-2.326%,"9,463,447"
PAVM,PAVmed Inc. Common Stock,$0.4301,-0.0097,-2.206%,"9,433,346"
SKYQ,Sky Quarry Inc. Common Stock,$0.419,-0.0235,-5.311%,"9,417,620"
CHR,"Cheer Holding, Inc. Class A Ordinary Share",$0.7759,-0.0591,-7.078%,"9,415,987"
GP,GreenPower Motor Company Inc. Common Shares,$3.09,-0.07,-2.215%,"9,412,848"
LUCY,"Innovative Eyewear, Inc. Common Stock",$2.05,-0.03,-1.442%,"9,377,934"
MSN,Emerson Radio Corporation Common Stock,$0.4454,-0.005,-1.11%,"9,372,397"
QLGN,"Qualigen Therapeutics, Inc. Common Stock",$5.52,1.38,33.333%,"9,358,884"
MIGI,Mawson Infrastructure Group Inc. Common Stock,$0.4487,0.0412,10.11%,"9,353,646"
NRSNW,NeuroSense Therapeutics Ltd. Warrant,$0.389,-0.031,-7.381%,"9,331,592"
HCWC,Healthy Choice Wellness Corp. Class A Common Stock,$0.674,0.0064,0.959%,"9,300,582"
GLXG,Galaxy Payroll Group Limited Class A Ordinary Shares,$4.29,-0.6415,-13.008%,"9,272,835"
LDWY,"Lendway, Inc. Common Stock (DE)",$5.23,0.20,3.976%,"9,255,003"
FBGL,FBS Global Limited Ordinary Shares,$0.684,0.014,2.09%,"9,234,000"
RVYL,Ryvyl Inc. Common Stock,$0.2941,0.0017,0.581%,"9,217,685"
ALBT,Avalon GloboCare Corp. Common Stock,$2.40,-0.12,-4.762%,"9,204,262"
IMG,CIMG Inc. Common Stock,$0.2512,-0.0139,-5.243%,"9,143,031"
MARPS,Marine Petroleum Trust Units of Beneficial Interest,$4.57,-0.1495,-3.168%,"9,140,000"
RETO,"ReTo Eco-Solutions, Inc. Class A Shares",$1.19,-0.07,-5.556%,"9,120,016"
CYCN,"Cyclerion Therapeutics, Inc. Common Stock",$2.73,-0.52,-16.00%,"9,111,200"
UCAR,U Power Limited Class A Ordinary Shares,$2.06,-0.0099,-0.478%,"9,104,903"
SOAR,"Volato Group, Inc. Class A Common Stock",$1.62,-0.09,-5.263%,"9,089,815"
AEON,"AEON Biopharma, Inc. Class A Common Stock",$0.7787,-0.0039,-0.498%,"9,067,016"
SMTK,"SmartKem, Inc. Common Stock",$1.99,0.08,4.188%,"9,043,535"
ADN,"Advent Technologies Holdings, Inc. Class A Common Stock",$3.38,0.19,5.956%,"9,025,567"
DHAI,"DIH Holdings US, Inc. Class A Common Stock",$0.19,-0.0159,-7.722%,"8,993,898"
VIVS,"VivoSim Labs, Inc. Common Stock",$3.45,-0.09,-2.542%,"8,969,300"
NAAS,NaaS Technology Inc. American Depositary Shares,$3.83,-0.13,-3.283%,"8,945,107"
EPWK,EPWK Holdings Ltd. Class A Ordinary Shares,$0.4082,-0.0004,-0.098%,"8,942,618"
CLRO,"ClearOne, Inc. (DE) Common Stock",$5.14,-0.35,-6.375%,"8,914,040"
GORV,"Lazydays Holdings, Inc. Common Stock",$2.37,-0.04,-1.66%,"8,853,502"
GCLWW,GCL Global Holdings Ltd Warrants,$0.07,0.008,12.903%,"8,842,276"
VCIG,VCI Global Limited Ordinary Share,$7.38,-0.67,-8.323%,"8,831,631"
KPRX,"Kiora Pharmaceuticals, Inc.  Common Stock",$2.572,-0.058,-2.205%,"8,830,939"
POLA,"Polar Power, Inc. Common Stock",$3.50,0.04,1.156%,"8,790,362"
HCWB,HCW Biologics Inc. Common Stock,$4.08,-0.06,-1.449%,"8,778,557"
MYSE,"Myseum, Inc. Common Stock",$2.08,-0.06,-2.804%,"8,755,404"
KLTOW,"Klotho Neurosciences, Inc. Warrant",$0.1426,-0.0224,-13.576%,"8,751,994"
SQFT,"Presidio Property Trust, Inc. Class A Common Stock",$6.02,-0.18,-2.903%,"8,735,550"
ERNA,Ernexa Therapeutics Inc. Common Stock,$1.12,-0.01,-0.885%,"8,591,396"
GITS,"Global Interactive Technologies, Inc. Common Stock",$2.42,0.095,4.086%,"8,588,157"
LIDRW,"AEye, Inc. Warrant",$0.2149,-0.0051,-2.318%,"8,583,777"
OP,OceanPal Inc. Common Stock,$1.28,-0.08,-5.882%,"8,571,011"
DEVS,DevvStream Corp. Common Stock,$2.42,UNCH,--,"8,570,849"
LGCB,Linkage Global Inc. Class A Ordinary Shares,$2.39,-0.05,-2.049%,"8,556,200"
IDAI,T Stamp Inc. Class A Common Stock,$3.36,0.02,0.599%,"8,542,094"
NWTG,"Newton Golf Company, Inc. Common Stock",$1.85,-0.05,-2.632%,"8,529,281"
IINNW,Inspira Technologies Oxy B.H.N. Ltd. Warrant,$0.35,0.004,1.156%,"8,488,234"
AMPGW,"Amplitech Group, Inc. Warrants",$0.41,-0.0098,-2.334%,"8,435,174"
APRE,"Aprea Therapeutics, Inc. Common stock",$1.4448,0.0248,1.746%,"8,416,337"
YHC,LQR House Inc. Common Stock,$0.81,-0.0628,-7.195%,"8,406,248"
MKZR,"MacKenzie Realty Capital, Inc. Common Stock",$5.01,-0.43,-7.904%,"8,397,251"
CELZ,"Creative Medical Technology Holdings, Inc. Common Stock",$3.25,0.14,4.502%,"8,386,729"
QCLS,"Q/C Technologies, Inc. Common Stock",$4.70,4.70,--,"8,300,938"
ASTC,Astrotech Corporation (DE) Common Stock,$4.90,-0.24,-4.669%,"8,300,370"
XELB,"Xcel Brands, Inc. Common Stock",$1.74,0.12,7.407%,"8,286,506"
RNAZ,"TransCode Therapeutics, Inc. Common Stock",$9.92,-0.49,-4.707%,"8,270,135"
BETRW,Better Home & Finance Holding Company Warrant,$0.537,-0.063,-10.50%,"8,211,461"
FTEL,Fitell Corporation Class A Ordinary Shares,$6.25,-0.40,-6.015%,"8,211,169"
GURE,"Gulf Resources, Inc. (NV) Common Stock",$0.6151,-0.05,-7.518%,"8,209,505"
LRHC,La Rosa Holdings Corp. Common Stock,$6.705,-0.215,-3.107%,"8,206,370"
BCDA,"BioCardia, Inc. Common Stock",$1.41,-0.07,-4.73%,"8,179,726"
SSKN,"Strata Skin Sciences, Inc. Common Stock",$1.96,-0.17,-7.981%,"8,175,476"
BSLK,"Bolt Projects Holdings, Inc. Common Stock",$3.96,-0.12,-2.941%,"8,164,645"
SCKT,"Socket Mobile, Inc. Common Stock",$1.02,-0.02,-1.923%,"8,120,691"
FRSX,Foresight Autonomous Holdings Ltd. American Depositary Shares,$2.24,-0.08,-3.448%,"8,112,989"
DRCT,"Direct Digital Holdings, Inc. Class A Common Stock",$0.3598,-0.0028,-0.772%,"8,101,756"
VYNE,VYNE Therapeutics Inc. Common Stock,$0.316,-0.0068,-2.107%,"8,049,204"
WAFU,Wah Fu Education Group Limited Ordinary Shares,$1.82,-0.04,-2.151%,"8,027,217"
STAK,STAK Inc. Class A Ordinary Shares,$0.7123,-0.0562,-7.313%,"8,013,375"
SUGP,SU Group Holdings Limited Ordinary Shares,$5.785,0.115,2.028%,"8,010,779"
BNGO,"Bionano Genomics, Inc. Common Stock",$1.71,-0.05,-2.841%,"8,004,510"
CREV,Carbon Revolution Public Limited Ordinary Shares,$4.21,-0.02,-0.473%,"7,936,625"
SEED,Origin Agritech Limited Common Stock,$1.10,-0.0099,-0.892%,"7,919,998"
IBO,"Impact BioMedical, Inc. Common Stock",$0.6479,-0.0196,-2.936%,"7,894,928"
BMRA,"Biomerica, Inc. Common Stock",$2.80,-0.11,-3.78%,"7,883,148"
EVOK,"Evoke Pharma, Inc. Common Stock",$5.01,-0.05,-0.988%,"7,807,910"
AIM,AIM ImmunoTech Inc. Common Stock,$2.88,0.13,4.727%,"7,801,021"
MEGL,Magic Empire Global Limited Class A Ordinary Shares,$1.54,-0.015,-0.965%,"7,798,637"
NAMMW,Namib Minerals Warrants,$0.145,-0.0049,-3.269%,"7,783,227"
GV,Visionary Holdings Inc. Common Shares,$2.06,-0.07,-3.286%,"7,774,980"
SYNX,Silynxcom Ltd. Ordinary Shares,$1.47,-0.07,-4.545%,"7,771,864"
CNEY,CN Energy Group Inc. Class A Ordinary Shares,$2.58,-0.0534,-2.028%,"7,765,800"
SKK,SKK Holdings Limited Ordinary Shares,$0.4132,-0.0017,-0.41%,"7,747,500"
NCI,Neo-Concept International Group Holdings Limited Class A Ordinary Shares,$1.895,0.029,1.554%,"7,701,280"
AREB,"American Rebel Holdings, Inc. Common Stock",$1.03,-0.04,-3.738%,"7,674,288"
NCNA,NuCana plc American Depositary Share,$3.98,-0.17,-4.096%,"7,594,548"
HIHO,Highway Holdings Limited Common Stock,$1.645,-0.005,-0.303%,"7,570,002"
HPAIW,Helport AI Limited Warrants,$0.2038,-0.0158,-7.195%,"7,567,699"
KXIN,Kaixin Holdings Ordinary Shares,$0.69,-0.0529,-7.121%,"7,557,794"
RDGT,"Ridgetech, Inc. Ordinary Shares",$1.28,-0.09,-6.569%,"7,494,412"
ENTO,"Entero Therapeutics, Inc. Common Stock",$4.71,-0.30,-5.988%,"7,482,193"
FEBO,Fenbo Holdings Limited Ordinary Shares,$0.673,0.0205,3.142%,"7,445,063"
NLSP,NLS Pharmaceutics Ltd. Ordinary Shares,$2.06,-0.08,-3.738%,"7,411,140"
ALZN,"Alzamend Neuro, Inc. Common Stock",$2.36,-0.02,-0.84%,"7,410,072"
SGN,"Signing Day Sports, Inc. Common Stock",$1.87,-0.06,-3.109%,"7,382,350"
ISPC,iSpecimen Inc. Common Stock,$1.33,-0.095,-6.667%,"7,367,329"
TNMG,TNL Mediagene Ordinary Shares,$0.26,-0.0189,-6.777%,"7,354,135"
ARTL,"Artelo Biosciences, Inc. Common Stock",$5.56,-0.14,-2.456%,"7,347,829"
ADIL,"Adial Pharmaceuticals, Inc Common Stock",$0.3347,-0.013,-3.739%,"7,305,904"
ELWS,"Earlyworks Co., Ltd. American Depositary Shares",$2.42,-0.27,-10.037%,"7,297,220"
PRSO,Peraso Inc. Common Stock,$1.18,0.03,2.609%,"7,281,827"
XXII,"22nd Century Group, Inc. Common Stock",$1.98,0.47,31.126%,"7,267,443"
EVGN,Evogene Ltd Ordinary Shares,$1.11,-0.055,-4.721%,"7,231,194"
EVTV,"Envirotech Vehicles, Inc. Common Stock",$2.03,-0.04,-1.932%,"7,167,008"
CDIO,Cardio Diagnostics Holdings Inc. Common stock,$4.06,-0.21,-4.918%,"7,158,304"
CAPS,Capstone Holding Corp. Common Stock,$1.28,-0.01,-0.775%,"7,143,942"
FTFT,Future FinTech Group Inc. Common Stock,$2.07,-0.07,-3.271%,"7,143,094"
PALI,"Palisade Bio, Inc. Common Stock",$0.773,0.0886,12.946%,"7,049,104"
NUAIW,"New Era Energy & Digital, Inc. Warrants",$0.271,0.0922,51.566%,"7,040,454"
BIYA,Baiya International Group Inc. Ordinary Shares,$0.559,-0.031,-5.254%,"6,998,680"
SILO,"Silo Pharma, Inc. Common Stock",$0.7414,-0.0554,-6.953%,"6,969,996"
PTLE,PTL LTD Class A Ordinary Shares,$0.1855,-0.0056,-2.93%,"6,953,931"
SNGX,"Soligenix, Inc. Common Stock",$1.62,-0.21,-11.475%,"6,942,623"
SBFM,Sunshine Biopharma Inc. Common Stock,$1.52,-0.04,-2.564%,"6,925,036"
AQMS,"Aqua Metals, Inc. Common Stock",$4.92,-0.95,-16.184%,"6,917,545"
FFAIW,Faraday Future Intelligent Electric Inc. Warrant,$0.0467,-0.0043,-8.431%,"6,856,903"
BOXL,Boxlight Corporation Class A Common Stock,$2.54,-0.39,-13.311%,"6,747,807"
ENSC,"Ensysce Biosciences, Inc. Common Stock",$2.26,0.03,1.345%,"6,708,683"
SNOA,"Sonoma Pharmaceuticals, Inc. Common Stock",$4.06,-0.02,-0.49%,"6,671,656"
KWMWW,"K Wave Media, Ltd. Warrant",$0.105,-0.005,-4.545%,"6,632,010"
ORIS,Oriental Rise Holdings Limited Ordinary Shares,$0.301,0.0314,11.647%,"6,625,763"
PMCB,"PharmaCyte  Biotech, Inc. Common Stock",$0.971,-0.099,-9.252%,"6,598,701"
MASK,3 E Network Technology Group Ltd Class A Ordinary Shares,$0.5882,-0.027,-4.389%,"6,587,840"
WHLR,"Wheeler Real Estate Investment Trust, Inc. Common Stock",$6.95,0.34,5.144%,"6,581,608"
LNKS,Linkers Industries Limited Class A Ordinary Shares,$0.4869,0.0281,6.125%,"6,548,805"
STSS,Sharps Technology Inc. Common Stock,$6.36,-0.23,-3.49%,"6,507,641"
CERO,"CERo Therapeutics Holdings, Inc. Common Stock",$5.38,-0.05,-0.921%,"6,485,063"
QH,Quhuo Limited American Depository Shares,$6.48,0.185,2.939%,"6,458,039"
OBLG,Oblong Inc. Common Stock,$2.73,-0.19,-6.507%,"6,416,338"
AQB,"AquaBounty Technologies, Inc. Common Stock",$1.65,-0.04,-2.367%,"6,398,197"
ACXP,"Acurx Pharmaceuticals, Inc. Common Stock",$4.02,-0.13,-3.133%,"6,370,796"
CPHI,"China Pharma Holdings, Inc. Common Stock",$1.95,-0.046,-2.305%,"6,360,904"
CANF,Can-Fite Biopharma Ltd Sponsored ADR (Israel),$0.6101,-0.0075,-1.214%,"6,316,419"
LVROW,Lavoro Limited Warrant,$0.0537,0.0185,52.557%,"6,261,867"
RIME,"Algorhythm Holdings, Inc. Common Stock",$2.49,-0.02,-0.797%,"6,261,282"
JCSE,JE Cleantech Holdings Limited Ordinary Shares,$1.19,-0.0226,-1.864%,"6,259,709"
BNRG,Brenmiller Energy Ltd Ordinary Shares,$2.29,0.02,0.881%,"6,242,201"
ILLRW,Triller Group Inc. Warrant,$0.0401,0.0002,0.501%,"6,221,909"
GNPX,"Genprex, Inc. Common Stock",$0.1852,-0.022,-10.618%,"6,198,048"
VEEE,Twin Vee PowerCats Co. Common Stock,$2.76,0.03,1.099%,"6,174,945"
UGRO,"urban-gro, Inc. Common Stock",$0.485,-0.0101,-2.04%,"6,157,830"
