Symbol,Name,Last Sale,Net Change,% Change,Market Cap
WEYS,"Weyco Group, Inc. Common Stock",$31.83,1.22,3.986%,"303,925,190"
RLMD,"Relmada Therapeutics, Inc. Common Stock",$4.14,-0.03,-0.719%,"303,601,195"
KELYA,"Kelly Services, Inc. Class A Common Stock",$8.59,UNCH,--,"303,562,062"
NCRA,"Nocera, Inc. Common Stock",$0.965,0.0859,9.771%,"303,370,540"
FBYDW,"Falcon's Beyond Global, Inc. Warrants",$2.15,-0.27,-11.157%,"303,179,752"
EPRX,Eupraxia Pharmaceuticals Inc. Common Stock,$5.97,-0.03,-0.50%,"302,370,536"
LZM,Lifezone Metals Limited Ordinary Shares,$3.74,-0.05,-1.319%,"302,358,699"
MIN,MFS Intermediate Income Trust Common Stock,$2.63,-0.01,-0.379%,"302,181,138"
RPAY,Repay Holdings Corporation Class A Common Stock,$3.51,0.10,2.933%,"302,078,438"
USBC,"USBC, Inc. Common Stock",$0.7861,-0.0278,-3.416%,"302,046,450"
ZH,"Zhihu Inc. American Depositary Shares, each representing three (3) Class A Ordinary Shares",$3.44,-0.05,-1.433%,"301,223,122"
PMM,Putnam Managed Municipal Income Trust Common Stock,$6.18,-0.02,-0.323%,"301,205,840"
CBK,"Commercial Bancgroup, Inc. Common Stock",$24.57,-0.18,-0.727%,"300,728,053"
AIRO,"AIRO Group Holdings, Inc. Common Stock",$9.60,-0.11,-1.133%,"300,516,806"
FLYX,"flyExclusive, Inc. Class A Common Stock",$3.72,0.21,5.983%,"300,158,125"
IONR,ioneer Ltd American Depositary Shares,$4.50,0.04,0.897%,"300,128,585"
RNGR,"Ranger Energy Services, Inc. Class A Common Stock",$13.86,0.09,0.654%,"299,565,702"
FRST,Primis Financial Corp. Common Stock,$12.15,-0.08,-0.654%,"299,429,278"
BZAI,"Blaize Holdings, Inc. Common Stock",$2.47,0.05,2.066%,"299,206,266"
WSBF,"Waterstone Financial, Inc. Common Stock (MD)",$16.21,0.15,0.934%,"299,186,641"
LANV,Lanvin Group Holdings Limited Ordinary Shares,$2.14,-0.01,-0.465%,"299,120,221"
MCFT,"MasterCraft Boat Holdings, Inc. Common Stock",$18.36,-0.08,-0.434%,"299,062,331"
GPRO,"GoPro, Inc. Class A Common Stock",$1.87,-0.01,-0.532%,"298,691,874"
AARD,"Aardvark Therapeutics, Inc. Common Stock",$13.69,-0.13,-0.941%,"298,076,094"
DRTS,Alpha Tau Medical Ltd. Ordinary Shares,$4.23,0.34,8.74%,"297,709,811"
HRZN,Horizon Technology Finance Corporation Common Stock,$6.69,-0.04,-0.594%,"296,924,223"
TARA,"Protara Therapeutics, Inc.  Common Stock",$5.74,0.02,0.35%,"296,360,442"
LNKB,"LINKBANCORP, Inc. Common Stock",$7.90,-0.11,-1.373%,"295,899,619"
GRRR,Gorilla Technology Group Inc. Ordinary shares,$14.61,-0.30,-2.012%,"295,446,956"
BBOT,"BridgeBio Oncology Therapeutics, Inc. Common Stock  ",$12.53,-0.61,-4.642%,"294,567,770"
RILYZ,"B. Riley Financial, Inc. 5.25% Senior Notes due 2028",$9.65,-0.27,-2.722%,"294,296,687"
EGHT,8x8 Inc Common Stock,$2.12,0.08,3.922%,"293,917,570"
EVC,Entravision Communications Corporation Common Stock,$3.23,0.22,7.309%,"293,853,410"
AMRN,Amarin Corporation plc,$14.12,-0.80,-5.362%,"293,592,698"
CZFS,"Citizens Financial Services, Inc. Common Stock",$61.03,2.43,4.147%,"293,333,188"
OIA,Invesco Municipal Income Opportunities Trust Common Stock,$6.16,UNCH,--,"293,250,428"
FNLC,"First Bancorp, Inc  (ME) Common Stock",$26.13,0.03,0.115%,"293,160,832"
RMMZ,"RiverNorth Managed Duration Municipal Income Fund II, Inc. Common Stock",$14.84,-0.01,-0.067%,"292,936,080"
XYF,"X Financial American Depositary Shares, each representing six Class A Ordinary Shares",$6.94,0.27,4.048%,"292,933,194"
ACTU,"Actuate Therapeutics, Inc. Common stock",$7.45,-0.04,-0.534%,"292,172,372"
OOMA,"Ooma, Inc. Common Stock",$10.58,-1.87,-15.02%,"292,008,000"
OCCIO,"OFS Credit Company, Inc. 6.125% Series C Term Preferred Stock",$25.03,0.0199,0.08%,"290,761,245"
CPZ,Calamos Long/Short Equity & Dynamic Income Trust Common Stock,$14.80,-0.03,-0.202%,"290,556,471"
SLN,Silence Therapeutics Plc American Depository Share,$6.20,-0.71,-10.275%,"290,160,000"
MPX,Marine Products Corporation Common Stock,$8.28,0.18,2.222%,"289,792,002"
III,Information Services Group Inc. Common Stock,$6.04,0.10,1.684%,"289,219,988"
MBCN,Middlefield Banc Corp. Common Stock,$35.76,-0.01,-0.028%,"289,187,043"
AVBH,"Avidbank Holdings, Inc. Common stock",$26.35,0.22,0.842%,"288,553,633"
BLZE,"Backblaze, Inc. Class A Common Stock",$5.00,UNCH,--,"288,500,000"
MVIS,"MicroVision, Inc. Common Stock",$0.9445,0.0173,1.866%,"288,447,721"
ELLO,Ellomay Capital Ltd Ordinary Shares (Israel),$22.43,1.02,4.764%,"288,283,482"
HERE,Here Group Limited American Depositary Shares,$5.30,0.13,2.515%,"288,238,460"
ALDX,"Aldeyra Therapeutics, Inc. Common Stock",$4.79,-0.16,-3.232%,"288,179,683"
ADV,Advantage Solutions Inc. Class A Common Stock,$0.8818,0.0184,2.131%,"287,706,575"
JRVR,"James River Group Holdings, Inc. Common Stock",$6.25,0.24,3.993%,"287,286,494"
CYBN,Cybin Inc. Common Shares,$5.75,-0.16,-2.707%,"286,891,253"
SENS,"Senseonics Holdings, Inc. Common Stock",$7.02,0.34,5.09%,"286,826,389"
OABI,"OmniAb, Inc. Common Stock",$1.99,UNCH,--,"286,471,246"
CURI,CuriosityStream Inc. Class A Common Stock,$4.91,0.14,2.935%,"286,245,669"
PAYS,"Paysign, Inc. Common Stock",$5.19,0.06,1.17%,"285,672,589"
ACRE,Ares Commercial Real Estate Corporation Common Stock,$5.19,0.06,1.17%,"285,587,291"
AFRI,Forafric Global PLC Ordinary Shares,$10.60,0.10,0.952%,"285,156,875"
XPER,Xperi Inc. Common Stock ,$6.15,0.09,1.485%,"284,962,618"
PLG,Platinum Group Metals Ltd. Ordinary Shares (Canada),$2.53,0.15,6.303%,"284,804,916"
TTSH,"Tile Shop Holdings, Inc. Common Stock",$6.36,-0.14,-2.154%,"284,387,406"
LFCR,"Lifecore Biomedical, Inc. Common Stock",$7.59,0.08,1.065%,"284,369,612"
CLW,Clearwater Paper Corporation Common Stock,$17.72,0.02,0.113%,"284,199,332"
ABEO,Abeona Therapeutics Inc. Common Stock,$5.24,0.11,2.144%,"283,962,732"
JMSB,"John Marshall Bancorp, Inc. Common Stock",$20.03,0.03,0.15%,"283,936,066"
OCCIN,"OFS Credit Company, Inc. 5.25% Series E Term Preferred Stock Due 2026",$24.43,UNCH,--,"283,791,339"
SJT,San Juan Basin Royalty Trust Common Stock,$6.08,0.10,1.672%,"283,381,480"
OFLX,"Omega Flex, Inc. Common Stock",$28.07,0.77,2.821%,"283,347,619"
PALI,"Palisade Bio, Inc. Common Stock",$1.90,0.09,4.972%,"283,106,099"
ANPA,Rich Sparkle Holdings Limited Ordinary Shares,$22.50,0.90,4.167%,"281,250,000"
CIO,"City Office REIT, Inc. Common Stock",$6.96,0.01,0.144%,"280,930,934"
YDDL,One and One Green Technologies. Inc Class A Ordinary Shares,$5.14,0.03,0.587%,"280,130,000"
CCHH,CCH Holdings Ltd Ordinary Shares,$14.55,1.51,11.58%,"280,087,500"
MMT,MFS Multimarket Income Trust Common Stock,$4.70,0.01,0.213%,"279,877,034"
NODK,"NI Holdings, Inc. Common Stock",$13.57,0.26,1.953%,"279,619,987"
SKYX,SKYX Platforms Corp. Common Stock,$2.45,0.03,1.24%,"278,685,961"
PKBK,"Parke Bancorp, Inc. Common Stock",$24.02,0.16,0.671%,"278,525,183"
PBYI,Puma Biotechnology Inc Common Stock,$5.52,0.12,2.222%,"278,158,911"
MCR,MFS Charter Income Trust Common Stock,$6.32,0.01,0.158%,"278,132,962"
TSBK,"Timberland Bancorp, Inc. Common Stock",$35.195,0.785,2.281%,"277,943,327"
TBCH,Turtle Beach Corporation Common Stock,$14.39,-0.01,-0.069%,"277,885,491"
ALCO,"Alico, Inc. Common Stock",$36.14,-0.58,-1.58%,"276,711,186"
PCYO,Pure Cycle Corporation Common Stock,$11.48,0.03,0.262%,"276,445,345"
COSO,"CoastalSouth Bancshares, Inc. Common Stock",$23.04,0.19,0.832%,"275,994,340"
BRT,BRT Apartments Corp. (MD) Common Stock,$14.50,-0.04,-0.275%,"275,795,713"
OEC,Orion S.A. Common Shares,$4.91,0.16,3.368%,"275,695,056"
RMM,"RiverNorth Managed Duration Municipal Income Fund, Inc. Common Stock",$13.96,-0.02,-0.143%,"275,565,207"
GLDG,GoldMining Inc. Common Shares,$1.37,0.04,3.008%,"274,308,976"
FSTR,L.B. Foster Company Common Stock,$26.28,-0.64,-2.377%,"273,128,277"
ACV,Virtus Diversified Income & Convertible Fund Common Shares of Beneficial Interest,$26.34,0.10,0.381%,"272,960,208"
AGL,"agilon health, inc. Common Stock",$0.6583,-0.0358,-5.158%,"272,919,070"
ASPN,"Aspen Aerogels, Inc. Common Stock",$3.30,0.01,0.304%,"272,735,367"
RDIB,Reading International Inc Class B Common Stock,$12.00,0.59,5.171%,"272,607,120"
TPVG,TriplePoint Venture Growth BDC Corp. Common Stock,$6.72,0.04,0.599%,"271,486,636"
SPOK,"Spok Holdings, Inc. Common Stock",$13.18,0.17,1.307%,"271,483,867"
AVNW,"Aviat Networks, Inc. Common Stock",$21.14,0.11,0.523%,"271,384,074"
SLS,"SELLAS Life Sciences Group, Inc. Common Stock",$1.90,0.08,4.396%,"270,640,254"
REFI,"Chicago Atlantic Real Estate Finance, Inc. Common Stock",$12.81,0.14,1.105%,"269,974,567"
AUDC,AudioCodes Ltd. Common Stock,$9.13,0.23,2.584%,"269,089,339"
EGAN,eGain Corporation Common Stock,$9.93,0.37,3.87%,"268,617,989"
PAL,"Proficient Auto Logistics, Inc. Common Stock",$9.65,0.29,3.098%,"268,559,857"
WTI,"W&T Offshore, Inc. Common Stock",$1.80,-0.01,-0.552%,"267,799,003"
SEG,Seaport Entertainment Group Inc. Common Stock,$21.00,0.08,0.382%,"267,436,491"
NREF,"NexPoint Real Estate Finance, Inc. Common Stock",$15.09,0.29,1.959%,"267,422,385"
NWFL,Norwood Financial Corp. Common Stock,$28.81,-0.09,-0.311%,"266,901,602"
KRMD,"KORU Medical Systems, Inc. Common Stock (DE)",$5.76,0.03,0.524%,"266,818,493"
CIX,CompX International Inc. Common Stock,$21.60,UNCH,--,"266,178,031"
PESI,"Perma-Fix Environmental Services, Inc. Common Stock",$14.37,0.19,1.34%,"266,098,803"
NRDY,Nerdy Inc. Class A Common Stock,$1.42,0.11,8.397%,"266,014,348"
TG,Tredegar Corporation Common Stock,$7.61,0.01,0.132%,"265,670,374"
CHMG,Chemung Financial Corp Common Stock,$55.38,1.90,3.553%,"265,511,048"
AZ,A2Z Cust2Mate Solutions Corp. Common Shares,$6.18,0.01,0.162%,"264,674,951"
VMD,"Viemed Healthcare, Inc. Common Shares",$6.96,0.12,1.754%,"264,604,633"
LZMH,LZ Technology Holdings Limited Class B Ordinary Shares,$1.74,0.01,0.578%,"264,601,800"
BRY,Berry Corporation (bry) Common Stock,$3.40,0.02,0.592%,"263,864,120"
WALD,Waldencast plc Class A Ordinary Share,$2.15,-0.04,-1.826%,"263,849,959"
MKTW,"MarketWise, Inc. Class A Common Stock",$16.45,0.25,1.543%,"263,681,672"
FCNCO,"First Citizens BancShares, Inc. 5.625% Non-Cumulative Perpetual Preferred Stock, Series C",$21.18,-0.73,-3.332%,"263,384,991"
NL,"NL Industries, Inc. Common Stock",$5.37,-0.08,-1.468%,"262,392,882"
MITT,"AG Mortgage Investment Trust, Inc. Common Stock",$8.24,UNCH,--,"261,574,260"
EVI,"EVI Industries, Inc.  Common Stock",$20.36,0.08,0.394%,"261,512,371"
BKTI,BK Technologies Corporation Common Stock,$70.00,3.02,4.509%,"261,256,870"
RXT,"Rackspace Technology, Inc. Common Stock",$1.07,0.03,2.885%,"260,643,568"
LMNR,Limoneira Co Common Stock,$14.44,0.46,3.29%,"260,617,365"
CCRN,"Cross Country Healthcare, Inc. Common Stock $0.0001 Par Value",$7.95,-0.19,-2.334%,"260,441,618"
ACB,Aurora Cannabis Inc. Common Shares,$4.59,0.12,2.685%,"260,270,369"
THRY,"Thryv Holdings, Inc. Common Stock",$5.96,0.12,2.055%,"259,718,270"
WNEB,"Western New England Bancorp, Inc. Common Stock",$12.66,0.02,0.158%,"259,428,290"
OPRX,OptimizeRx Corporation Common Stock,$13.91,-0.10,-0.714%,"259,291,469"
FCNCP,"First Citizens BancShares, Inc. Depositary Shares",$20.85,-0.34,-1.605%,"259,281,259"
ISTR,Investar Holding Corporation Common Stock,$26.38,0.21,0.802%,"258,799,275"
FUND,"Sprott Focus Trust, Inc. Common Stock",$8.73,0.05,0.576%,"258,700,953"
INVZ,Innoviz Technologies Ltd. Ordinary shares,$1.30,UNCH,--,"258,650,544"
EOT,Eaton Vance Municipal Income Trust EATON VANCE NATIONAL MUNICIPAL OPPORTUNITIES TRUST,$16.55,-0.005,-0.03%,"258,592,443"
HTLM,HomesToLife Ltd Ordinary Shares,$2.88,-0.17,-5.574%,"258,300,000"
FBLA,"FB Bancorp, Inc. Common Stock",$13.02,-0.02,-0.153%,"258,284,250"
KLTR,"Kaltura, Inc. Common Stock",$1.65,0.08,5.096%,"257,951,359"
NAUT,"Nautilus Biotechnology, Inc. Common Stock",$2.04,0.01,0.493%,"257,662,449"
EVO,Evotec SE American Depositary Shares,$2.90,-0.11,-3.654%,"257,209,761"
XWIN,"XMAX, Inc. Common Stock",$6.14,0.43,7.531%,"257,092,404"
FDBC,"Fidelity D & D Bancorp, Inc. Common Stock",$44.51,1.01,2.322%,"256,701,900"
PLBY,"Playboy, Inc. Common Stock",$2.38,-0.09,-3.644%,"256,462,545"
ONTF,"ON24, Inc. Common Stock",$6.06,UNCH,--,"256,231,314"
SATL,Satellogic Inc. Class A Common Stock,$1.89,0.14,8.00%,"256,032,923"
CVEO,Civeo Corporation (Canada) Common Shares,$22.22,0.07,0.316%,"255,868,255"
ACIU,AC Immune SA Common Stock,$2.54,-0.24,-8.633%,"255,042,358"
MPAA,"Motorcar Parts  of America, Inc. Common Stock",$12.98,-0.24,-1.815%,"253,863,035"
FUNC,First United Corporation Common Stock,$38.98,0.19,0.49%,"253,249,474"
SNWV,"SANUWAVE Health, Inc. Common Stock",$29.48,-0.40,-1.339%,"252,825,315"
GCO,Genesco Inc. Common Stock,$23.41,-0.15,-0.637%,"252,720,899"
TSSI,"TSS, Inc. Common Stock",$8.74,-0.05,-0.569%,"252,105,623"
NIU,Niu Technologies American Depositary Shares,$3.23,-0.03,-0.92%,"251,823,630"
FBRX,"Forte Biosciences, Inc. Common Stock",$20.09,0.35,1.773%,"251,666,124"
GSIT,GSI Technology Common Stock,$7.14,0.28,4.082%,"251,625,759"
JILL,"J. Jill, Inc. Common Stock",$16.49,0.21,1.29%,"251,105,119"
CCCC,"C4 Therapeutics, Inc. Common Stock",$2.59,0.05,1.969%,"251,008,343"
GASS,"StealthGas, Inc. Common Stock",$6.76,-0.13,-1.887%,"249,975,870"
DGXX,Digi Power X Inc. Subordinate Voting Shares,$4.00,0.11,2.828%,"249,678,292"
PINE,"Alpine Income Property Trust, Inc. Common Stock",$17.61,0.16,0.917%,"249,439,698"
WW,"WW International, Inc.  Common Stock",$24.97,0.61,2.504%,"249,373,592"
ACHV,"Achieve Life Sciences, Inc. Common Shares",$4.68,-0.01,-0.213%,"249,135,064"
MNTK,"Montauk Renewables, Inc. Common Stock",$1.75,0.04,2.339%,"248,949,080"
BLFY,Blue Foundry Bancorp Common Stock,$11.99,-0.07,-0.58%,"248,927,088"
GREEL,Greenidge Generation Holdings Inc. 8.50% Senior Notes due 2026,$15.85,-0.75,-4.518%,"248,423,659"
VPV,Invesco Pennsylvania Value Municipal Income Trust Common Stock (DE),$10.415,UNCH,--,"248,184,701"
TRAK,"ReposiTrak, Inc. Common Stock",$13.57,0.02,0.148%,"248,174,334"
ARL,"American Realty Investors, Inc. Common Stock",$15.33,UNCH,--,"247,610,819"
TKNO,"Alpha Teknova, Inc. Common Stock",$4.62,0.04,0.873%,"247,304,784"
FHTX,Foghorn Therapeutics Inc. Common Stock,$4.37,-0.08,-1.798%,"247,129,133"
REKR,"Rekor Systems, Inc. Common Stock",$1.95,0.10,5.405%,"247,045,104"
FTF,Franklin Limited Duration Income Trust Common Shares of Beneficial Interest,$6.11,UNCH,--,"246,876,835"
INSE,"Inspired Entertainment, Inc. Common Stock",$9.12,0.08,0.885%,"245,573,036"
USAU,U.S. Gold Corp. Common Stock,$17.10,0.46,2.764%,"245,522,570"
AVIR,"Atea Pharmaceuticals, Inc. Common Stock",$3.14,-0.06,-1.875%,"245,318,139"
DH,Definitive Healthcare Corp. Class A Common Stock,$2.37,-0.08,-3.265%,"244,829,027"
ZURA,Zura Bio Limited Class A Ordinary Shares,$3.76,-0.01,-0.265%,"244,487,638"
PRQR,ProQR Therapeutics N.V. Ordinary Shares,$2.32,0.20,9.434%,"244,093,063"
HRTX,"Heron Therapeutics, Inc. Common Stock",$1.33,-0.02,-1.481%,"243,872,154"
BGIN,Bgin Blockchain Limited Class A Ordinary Shares,$2.99,0.06,2.048%,"243,610,250"
VGZ,Vista Gold Corp Common Stock,$1.93,0.11,6.044%,"243,583,578"
OPRT,Oportun Financial Corporation Common Stock,$5.51,0.09,1.661%,"243,150,900"
LIEN,"Chicago Atlantic BDC, Inc. Common Stock",$10.64,-0.05,-0.468%,"242,811,078"
DOUG,Douglas Elliman Inc. Common Stock,$2.73,0.09,3.409%,"242,475,788"
CIA,"Citizens, Inc. Class A Common Stock ($1.00 Par)",$4.82,0.10,2.119%,"242,430,807"
GWRS,"Global Water Resources, Inc. Common Stock",$8.42,0.04,0.477%,"242,077,231"
NNOX,NANO-X IMAGING LTD Ordinary Shares,$3.58,-0.15,-4.021%,"241,966,941"
MEI,"Methode Electronics, Inc. Common Stock",$6.82,-0.13,-1.871%,"241,484,258"
MYFW,"First Western Financial, Inc. Common Stock",$24.85,0.29,1.181%,"241,410,568"
VUZI,Vuzix Corporation Common Stock,$3.01,0.10,3.436%,"241,180,723"
SLQT,"SelectQuote, Inc. Common Stock",$1.37,0.02,1.481%,"241,081,289"
KDKRW,"Kodiak AI, Inc. Warrants",$1.33,0.18,15.652%,"241,005,831"
TRX,TRX Gold Corporation Common Stock,$0.8459,0.0159,1.916%,"240,964,677"
ANTA,Antalpha Platform Holding Company Class A Ordinary Shares,$10.17,-0.0403,-0.395%,"240,956,539"
SPCE,"Virgin Galactic Holdings, Inc. Common Stock",$3.81,-0.74,-16.264%,"240,792,933"
CABA,"Cabaletta Bio, Inc. Common Stock",$2.50,0.02,0.806%,"240,663,010"
SSSS,SuRo Capital Corp. Common Stock,$9.56,0.12,1.271%,"240,138,510"
LUD,Luda Technology Group Limited Ordinary Shares,$10.56,-0.42,-3.825%,"239,606,400"
MFIN,Medallion Financial Corp. Common Stock,$10.28,0.20,1.984%,"239,312,592"
FINW,FinWise Bancorp Common Stock,$17.61,-0.18,-1.012%,"239,265,679"
RICK,"RCI Hospitality Holdings, Inc. Common Stock",$27.37,2.21,8.784%,"238,679,018"
ELMD,"Electromed, Inc. Common Stock",$28.56,0.41,1.456%,"238,205,765"
EDIT,"Editas Medicine, Inc. Common Stock",$2.44,0.02,0.826%,"238,189,530"
FBIOP,"Fortress Biotech, Inc. 9.375% Series A Cumulative Redeemable Perpetual Preferred Stock",$7.67,-0.05,-0.648%,"238,060,977"
HUMA,"Humacyte, Inc. Common Stock",$1.27,-0.02,-1.55%,"237,834,578"
MASS,908 Devices Inc. Common Stock,$6.56,-0.12,-1.796%,"237,425,936"
OBIO,"Orchestra BioMed Holdings, Inc. Ordinary Shares",$4.20,-0.19,-4.328%,"237,151,870"
FRAF,Franklin Financial Services Corporation Common Stock,$52.87,-0.48,-0.90%,"236,806,686"
OVLY,Oak Valley Bancorp (CA) Common Stock,$28.20,0.54,1.952%,"236,547,832"
OZ,"Belpointe PREP, LLC Class A Units",$60.675,1.175,1.975%,"236,097,164"
AREC,American Resources Corporation Class A Common Stock,$2.79,-0.02,-0.712%,"236,058,887"
VOR,Vor Biopharma Inc. Common Stock,$10.72,2.36,28.23%,"234,881,954"
FVCB,"FVCBankcorp, Inc. Common Stock",$12.99,0.03,0.231%,"234,791,834"
TNYA,"Tenaya Therapeutics, Inc. Common Stock",$1.41,0.02,1.439%,"234,773,298"
POWW,Outdoor Holding Company Common Stock,$2.00,0.07,3.627%,"234,221,654"
LCNB,LCNB Corporation Common Stock,$16.51,0.33,2.04%,"234,221,509"
LHAI,Linkhome Holdings Inc. Common stock,$14.40,0.27,1.911%,"233,712,000"
HWBK,"Hawthorn Bancshares, Inc. Common Stock",$33.85,0.11,0.326%,"233,485,317"
FGBIP,"First Guaranty Bancshares, Inc. 6.75% Series A Fixed-Rate Non-Cumulative Perpetual Preferred Stock",$15.1509,-0.0991,-0.65%,"232,610,965"
LTRX,"Lantronix, Inc. Common Stock",$5.91,0.10,1.721%,"232,609,385"
ASUR,"Asure Software, Inc Common Stock",$8.36,0.23,2.829%,"232,106,012"
TNXP,Tonix Pharmaceuticals Holding Corp. Common Stock,$19.60,-0.29,-1.458%,"230,820,223"
PPIH,"Perma-Pipe International Holdings, Inc. Common Stock",$28.51,0.75,2.702%,"230,761,223"
PRHIZ,"Presurance Holdings, Inc. 9.75% Senior Unsecured Notes due 2028",$18.80,0.40,2.174%,"229,790,163"
FLX,BingEx Limited American Depositary Shares,$3.222,-0.318,-8.983%,"229,180,570"
DIBS,"1stdibs.com, Inc. Common Stock",$6.24,0.28,4.698%,"228,473,532"
RGCO,RGC Resources Inc. Common Stock,$22.06,0.12,0.547%,"228,332,714"
NBY,"NovaBay Pharmaceuticals, Inc. Common Stock",$1.81,0.26,16.774%,"228,079,456"
CRMT,America's Car-Mart Inc Common Stock,$27.53,1.97,7.707%,"227,898,681"
DDD,3D Systems Corporation Common Stock,$1.77,-0.36,-16.901%,"227,866,285"
TWIN,"Twin Disc, Incorporated Common Stock",$15.805,0.255,1.64%,"227,402,830"
VTN,Invesco Trust for Investment Grade New York Municipals Common Stock,$11.64,0.03,0.258%,"226,816,796"
BPRN,"Princeton Bancorp, Inc. Common Stock (PA)",$33.40,0.08,0.24%,"225,879,491"
TCX,Tucows Inc. Class A Common Stock,$20.34,-0.31,-1.501%,"225,853,712"
IMMR,Immersion Corporation Common Stock,$6.97,-0.07,-0.994%,"225,803,131"
JELD,"JELD-WEN Holding, Inc. Common Stock",$2.64,0.03,1.149%,"225,534,434"
FCCO,First Community Corporation Common Stock,$29.24,-0.12,-0.409%,"224,846,653"
CFFI,C&F Financial Corporation Common Stock,$69.39,0.25,0.362%,"224,700,918"
MIST,Milestone Pharmaceuticals Inc. Common Shares,$2.63,-0.03,-1.128%,"223,995,375"
CHPT,"ChargePoint Holdings, Inc. Common Stock",$9.47,-0.03,-0.316%,"223,994,753"
MFM,MFS Municipal Income Trust Common Stock,$5.43,0.01,0.185%,"223,648,836"
PDYN,Palladyne AI Corp. Common Stock,$5.31,-0.16,-2.925%,"223,218,647"
SNFCA,Security National Financial Corporation Class A Common Stock,$8.57,0.04,0.469%,"222,696,326"
STXS,"Stereotaxis, Inc. Common Stock",$2.38,0.02,0.847%,"222,112,936"
HYPD,"Hyperion DeFi, Inc. Common Stock",$3.76,0.04,1.075%,"221,626,906"
IMMX,"Immix Biopharma, Inc. Common Stock",$6.60,0.45,7.317%,"221,613,962"
FXNC,First National Corporation Common Stock,$24.58,0.18,0.738%,"221,485,882"
DERM,Journey Medical Corporation Common Stock,$8.13,-0.07,-0.854%,"220,614,908"
CVRX,"CVRx, Inc. Common Stock",$8.41,-0.60,-6.659%,"220,427,017"
FSFG,"First Savings Financial Group, Inc. Common Stock",$31.56,-0.15,-0.473%,"220,180,170"
DSX,Diana Shipping inc. common stock,$1.90,UNCH,--,"219,958,936"
IMPP,Imperial Petroleum Inc. Common Shares,$4.80,0.14,3.004%,"219,593,938"
EICA,Eagle Point Income Company Inc. 5.00% Series A Term Preferred Stock due 2026,$24.63,0.04,0.163%,"219,406,700"
EWCZ,"European Wax Center, Inc. Class A Common Stock",$4.03,0.04,1.003%,"219,072,094"
OGI,Organigram Global Inc. Common Shares,$1.63,UNCH,--,"218,456,132"
VABK,Virginia National Bankshares Corporation Common Stock,$40.48,0.25,0.621%,"218,314,267"
RDCM,Radcom Ltd. Ordinary Shares,$13.70,-0.27,-1.933%,"218,043,939"
FOSL,"Fossil Group, Inc. Common Stock",$3.99,0.24,6.40%,"218,015,950"
RCKY,"Rocky Brands, Inc. Common Stock",$29.07,0.27,0.938%,"217,841,481"
HITI,High Tide Inc. Common Shares,$2.50,0.02,0.806%,"217,689,700"
AOMR,"Angel Oak Mortgage REIT, Inc. Common Stock",$8.73,0.01,0.115%,"217,499,526"
MRAM,"Everspin Technologies, Inc. Common Stock",$9.51,0.34,3.708%,"217,365,448"
GDC,GD Culture Group Limited Common Stock,$3.88,0.25,6.887%,"217,220,935"
AMPY,Amplify Energy Corp. Common Stock,$5.36,0.14,2.682%,"216,951,344"
ETHZ,ETHZilla Corporation Common Stock,$11.24,0.54,5.047%,"216,945,747"
COE,"51Talk Online Education Group American depositary shares, each representing 60 Class A ordinary shares",$37.00,0.79,2.182%,"216,800,575"
CBNA,"Chain Bridge Bancorp, Inc. Class A Common Stock",$33.03,0.24,0.732%,"216,736,816"
RDNW,"RideNow Group, Inc. Class B Common Stock",$5.68,0.24,4.412%,"216,223,411"
SLDPW,"Solid Power, Inc. Warrant",$1.1299,-0.0201,-1.748%,"215,837,532"
ELVA,Electrovaya Inc. Common Shares,$5.38,0.05,0.938%,"215,775,203"
FLXS,"Flexsteel Industries, Inc. Common Stock",$40.37,0.33,0.824%,"215,593,805"
PROF,Profound Medical Corp. Common Stock,$7.17,0.39,5.752%,"215,385,431"
ANNA,"AleAnna, Inc. Class A Common Stock",$3.23,-0.04,-1.223%,"215,293,328"
INBKZ,First Internet Bancorp 6.0% Fixed-to-Floating Rate Subordinated Notes Due 2029,$24.70,0.10,0.407%,"215,213,422"
QNCX,"Quince Therapeutics, Inc. Common Stock",$3.86,-0.04,-1.026%,"214,930,551"
FENC,Fennec Pharmaceuticals Inc. Common Stock,$7.64,0.10,1.326%,"214,393,680"
DOYU,DouYu International Holdings Limited ADS,$7.10,0.03,0.424%,"214,269,899"
NUAI,"New Era Energy & Digital, Inc. Common Stock",$4.00,-0.36,-8.257%,"213,796,684"
SHIP,Seanergy Maritime Holdings Corp. Common Stock,$10.22,-0.21,-2.013%,"213,622,170"
HUHU,HUHUTECH International Group Inc. Ordinary Shares,$10.075,0.175,1.768%,"213,322,136"
OCG,Oriental Culture Holding LTD Ordinary Shares,$10.27,7.65,291.985%,"212,937,430"
TII,Titan Mining Corporation Common Shares,$2.32,0.02,0.87%,"212,256,269"
KINS,"Kingstone Companies, Inc. Common Stock",$14.97,-0.05,-0.333%,"211,786,997"
SMTI,Sanara MedTech Inc. Common Stock,$23.63,1.87,8.594%,"211,149,575"
CXDO,"Crexendo, Inc. Common Stock",$6.86,0.02,0.292%,"210,814,989"
TFSA,"Terra Income Fund 6, LLC 7.00% Notes due 2026",$24.94,0.59,2.423%,"210,465,892"
ICG,Intchains Group Limited American Depositary Shares,$1.75,-0.07,-3.846%,"209,909,870"
GPJA,"Georgia Power Company Series 2017A 5.00% Junior Subordinated Notes due October 1, 2077",$22.66,0.17,0.756%,"209,865,590"
AHMA,Ambitions Enterprise Management Co. L.L.C Class A Ordinary Shares,$7.09,-0.15,-2.072%,"209,155,000"
AREN,"The Arena Group Holdings, Inc. Common Stock",$4.40,0.22,5.263%,"208,849,296"
DUOT,"Duos Technologies Group, Inc. Common Stock",$10.22,0.29,2.92%,"208,644,243"
MPV,Barings Participation Investors Common Stock,$19.65,0.12,0.614%,"208,323,405"
SLMT,Brera Holdings PLC Class B Ordinary Shares,$2.54,0.15,6.276%,"208,266,703"
HBB,Hamilton Beach Brands Holding Company Class A Common Stock ,$15.49,-0.24,-1.526%,"208,234,424"
SHMD,SCHMID Group N.V. Class A Ordinary Shares,$4.84,0.15,3.198%,"207,998,332"
MDWD,MediWound Ltd. Ordinary Shares,$18.47,-0.04,-0.216%,"207,820,118"
ETX           ,Eaton Vance Municipal Income 2028 Term Trust Common Shares of Beneficial Interest,$19.04,-0.03,-0.157%,"207,249,562"
PCTTW,"PureCycle Technologies, Inc. Warrant",$1.15,0.02,1.77%,"207,228,091"
EFSI,Eagle Financial Services Inc Common Stock,$38.50,0.39,1.023%,"206,989,321"
OPBK,OP Bancorp Common Stock,$13.86,0.11,0.80%,"206,314,610"
NAKA,"Kindly MD, Inc. Common Stock",$0.4681,0.0158,3.493%,"205,894,201"
RNAC,"Cartesian Therapeutics, Inc. Common Stock",$7.90,1.18,17.56%,"205,428,487"
SWKH,SWK Holdings Corporation Common Stock,$16.98,UNCH,--,"205,388,484"
ARCT,Arcturus Therapeutics Holdings Inc. Common Stock,$7.20,-0.25,-3.356%,"204,570,266"
SGMT,Sagimet Biosciences Inc. Series A Common Stock,$6.28,0.09,1.454%,"204,235,642"
TRVG,trivago N.V. American Depositary Shares,$2.90,-0.02,-0.685%,"203,891,185"
LOVE,The Lovesac Company Common Stock,$13.95,0.21,1.528%,"203,813,811"
BMEZ,BlackRock Health Sciences Term Trust Common Shares of Beneficial Interest,$15.21,-0.20,-1.298%,"202,795,204"
TGEN,Tecogen Inc. Common Stock,$6.79,-0.06,-0.876%,"202,657,592"
PAMT,PAMT CORP Common Stock,$9.66,0.31,3.316%,"202,145,353"
GEOS,Geospace Technologies Corporation Common Stock (Texas),$15.76,-0.16,-1.005%,"202,054,264"
SLND,"Southland Holdings, Inc. Common Stock",$3.73,0.44,13.374%,"201,841,624"
ATLO,Ames National Corporation Common Stock,$22.69,0.56,2.531%,"201,763,269"
GANX,"Gain Therapeutics, Inc. Common Stock",$4.05,0.06,1.504%,"201,599,616"
OMSE,OMS Energy Technologies Inc. Ordinary Shares,$4.74,-0.04,-0.837%,"201,206,857"
PMTS,CPI Card Group Inc. Common Stock,$17.66,0.70,4.127%,"201,103,921"
EARN,Ellington Credit Company Common Shares of Beneficial Interest,$5.35,0.07,1.326%,"200,941,693"
UIS,Unisys Corporation New Common Stock,$2.80,0.02,0.719%,"199,657,097"
FT,Franklin Universal Trust Common Stock,$7.93,-0.03,-0.377%,"199,295,919"
DMRC,Digimarc Corporation Common Stock,$9.15,0.23,2.578%,"199,076,431"
