Symbol,Name,Last Sale,Net Change,% Change,Market Cap
FBIZ,"First Business Financial Services, Inc. Common Stock",$52.22,-0.31,-0.59%,"434,692,753"
BAND,Bandwidth Inc. Class A Common Stock,$14.24,-0.02,-0.14%,"434,627,313"
HBCP,"Home Bancorp, Inc. Common Stock",$55.47,-0.29,-0.52%,"434,227,148"
SIGA,SIGA Technologies Inc. Common Stock,$6.06,0.02,0.331%,"433,964,490"
CWBC,Community West Bancshares Common Stock,$22.65,-0.07,-0.308%,"433,938,394"
VENU,Venu Holding Corporation Common Stock,$10.12,0.18,1.811%,"433,617,125"
ETON,"Eton Pharmaceuticals, Inc. Common Stock",$16.15,-0.04,-0.247%,"433,103,190"
CARL,"Carlsmed, Inc. Common Stock",$16.28,0.07,0.432%,"432,932,542"
TITN,Titan Machinery Inc. Common Stock,$18.52,-0.18,-0.963%,"432,867,534"
EVN,Eaton Vance Municipal Income Trust Common Stock,$10.90,-0.01,-0.092%,"432,372,077"
CGC,Canopy Growth Corporation Common Shares,$1.17,-0.04,-3.306%,"431,095,193"
ANRO,"Alto Neuroscience, Inc. Common Stock",$13.85,0.34,2.517%,"430,268,740"
FTK,"Flotek Industries, Inc. Common Stock",$14.29,0.26,1.853%,"429,526,291"
MSB,Mesabi Trust Common Stock,$32.66,0.71,2.222%,"428,499,527"
TLS,Telos Corporation Common Stock,$5.78,0.03,0.522%,"426,300,022"
JOUT,Johnson Outdoors Inc. Class A Common Stock,$40.99,-0.12,-0.292%,"425,159,060"
CAN,Canaan Inc. American Depositary Shares,$1.01,0.09,9.783%,"424,466,195"
NEXN,Nexxen International Ltd. Ordinary Shares,$6.47,0.01,0.155%,"424,190,475"
FPI,Farmland Partners Inc. Common Stock,$9.84,0.07,0.716%,"424,079,941"
CNCK,Coincheck Group N.V. Ordinary Shares,$3.24,0.09,2.857%,"423,839,064"
SLDB,Solid Biosciences Inc. Common Stock,$5.43,0.07,1.306%,"423,052,598"
MCI,Barings Corporate Investors Common Stock,$20.85,-0.14,-0.667%,"422,456,841"
ESEA,Euroseas Ltd. Common Stock (Marshall Islands),$60.29,0.42,0.702%,"422,428,637"
NOA,North American Construction Group Ltd. Common Shares (no par),$14.35,0.21,1.485%,"422,381,244"
WEST,Westrock Coffee Company Common Stock,$4.35,0.08,1.874%,"421,188,359"
TATT,TAT Technologies Ltd. Ordinary Shares,$38.42,0.18,0.471%,"420,328,554"
AKBA,"Akebia Therapeutics, Inc. Common Stock",$1.58,-0.01,-0.629%,"419,278,269"
AURA,"Aura Biosciences, Inc. Common Stock",$6.60,0.22,3.448%,"419,121,575"
BSRR,Sierra Bancorp Common Stock,$31.06,-0.05,-0.161%,"418,765,145"
HSHP,Himalaya Shipping Ltd. Common Shares,$8.99,-0.04,-0.443%,"418,484,500"
PUBM,"PubMatic, Inc. Class A Common Stock",$9.01,-0.09,-0.989%,"418,197,366"
GPRK,Geopark Ltd Common Shares,$8.16,0.10,1.241%,"418,177,862"
OPAL,OPAL Fuels Inc. Class A Common Stock,$2.41,0.03,1.261%,"417,882,466"
PACK,Ranpak Holdings Corp Class A Common Stock,$4.94,0.07,1.437%,"416,816,798"
CEP,"Cantor Equity Partners, Inc. Class A Ordinary Shares",$14.47,0.32,2.261%,"415,815,332"
SFST,"Southern First Bancshares, Inc. Common Stock",$50.76,-0.20,-0.392%,"415,682,625"
CCSI,"Consensus Cloud Solutions, Inc. Common Stock",$21.84,-0.28,-1.266%,"415,086,126"
BYRN,"Byrna Technologies, Inc. Common Stock",$18.25,0.46,2.586%,"414,740,649"
BBBY,"Bed Bath & Beyond, Inc. Common Stock",$6.02,0.18,3.082%,"414,450,362"
AII,"American Integrity Insurance Group, Inc. Common Stock",$21.14,0.15,0.715%,"413,853,637"
ADUR,Aduro Clean Technologies Inc. Common Stock,$13.26,0.85,6.849%,"413,625,890"
ASIX,AdvanSix Inc. Common Stock ,$15.39,0.30,1.988%,"413,437,499"
OBE,Obsidian Energy Ltd. Common Shares,$6.15,0.17,2.843%,"412,764,765"
ENGN,enGene Holdings Inc. Common Stock,$8.07,-0.18,-2.182%,"412,423,862"
CLPT,"ClearPoint Neuro, Inc. Common Stock",$14.46,0.02,0.139%,"411,001,034"
RC,Ready Capital Corporation Common Stock,$2.53,-0.01,-0.394%,"410,179,478"
ATGL,Alpha Technology Group Limited Class A Ordinary Shares,$24.8934,UNCH,--,"409,807,598"
DVS,Dolly Varden Silver Corporation Common Shares,$4.46,0.56,14.359%,"409,725,839"
ENTA,"Enanta Pharmaceuticals, Inc. Common Stock",$14.12,0.18,1.291%,"407,539,926"
SOR,"Source Capital, Inc. Cmn Shs of BI",$48.7399,1.0199,2.137%,"406,709,267"
IVA,Inventiva S.A. American Depository Shares,$4.25,-0.35,-7.609%,"406,565,162"
ZIP,"ZipRecruiter, Inc. Class A Common Stock",$4.75,0.07,1.496%,"406,407,335"
CLFD,"Clearfield, Inc. Common Stock",$29.36,0.89,3.126%,"406,315,859"
DDL,Dingdong (Cayman) Limited American Depositary Shares (each two representing three Ordinary Shares),$1.72,UNCH,--,"406,311,618"
CARE,"Carter Bankshares, Inc. Common Stock",$18.37,0.03,0.164%,"405,738,998"
SDHY,PGIM Short Duration High Yield Opportunities Fund Common Shares,$16.43,0.09,0.551%,"405,378,310"
LCTX,"Lineage Cell Therapeutics, Inc. Common Stock",$1.76,0.05,2.924%,"405,376,465"
PSTL,"Postal Realty Trust, Inc. Class A Common Stock",$15.54,0.01,0.064%,"405,013,363"
MITK,"Mitek Systems, Inc. Common Stock",$8.86,0.05,0.568%,"404,432,854"
NCMI,"National CineMedia, Inc. Common Stock",$4.31,UNCH,--,"404,412,330"
DDT,Dillard's Capital Trust I,$25.88,UNCH,--,"404,063,560"
PRTC,PureTech Health plc American Depositary Shares,$16.70,0.70,4.375%,"403,612,347"
THM,"International Tower Hill Mines, Ltd. Ordinary Shares (Canada)",$1.94,0.16,8.989%,"403,297,818"
SGU,Star Group L.P. Common Stock,$12.00,-0.05,-0.415%,"403,277,088"
VFSWW,VinFast Auto Ltd. Warrant,$0.172,UNCH,--,"402,275,780"
GBLI,"Global Indemnity Group, LLC Class A Common Stock ",$28.02,-0.26,-0.919%,"401,357,191"
TECX,"Tectonic Therapeutic, Inc. Common Stock",$21.44,0.05,0.234%,"401,277,043"
VERI,"Veritone, Inc. Common Stock",$4.36,0.06,1.395%,"400,274,260"
BMBL,Bumble Inc. Class A Common Stock,$3.55,0.02,0.567%,"400,223,432"
MTW,"Manitowoc Company, Inc. (The) Common Stock",$11.28,-0.04,-0.353%,"400,112,226"
GRVY,"GRAVITY Co., Ltd. American Depository Shares",$57.46,0.03,0.052%,"399,283,794"
ORN,"Orion Group Holdings, Inc. Common",$10.00,0.10,1.01%,"399,009,780"
CMDB,Costamare Bulkers Holdings Limited Common Stock,$16.47,0.05,0.305%,"398,635,680"
XOMA,XOMA Royalty Corporation Common Stock,$32.13,-0.16,-0.496%,"397,869,099"
TCI,"Transcontinental Realty Investors, Inc. Common Stock",$45.98,0.36,0.789%,"397,235,750"
SAZ,Saratoga Investment Corp 8.50% Notes due 2028,$25.3401,-0.0299,-0.118%,"397,032,006"
VSTA,Vasta Platform Limited Class A Ordinary Shares,$4.95,0.01,0.202%,"397,000,014"
PNNT,PennantPark Investment Corporation Common Stock,$6.07,0.01,0.165%,"396,347,291"
CAL,"Caleres, Inc. Common Stock",$11.71,-0.09,-0.763%,"396,300,218"
BRBS,"Blue Ridge Bankshares, Inc. Common Stock",$4.33,0.01,0.231%,"396,145,902"
SAY,Saratoga Investment Corp 8.125% Notes due 2027,$25.2699,0.0099,0.039%,"395,932,104"
ULH,"Universal Logistics Holdings, Inc. Common Stock",$15.02,-0.10,-0.661%,"395,477,471"
FRBA,First Bank Common Stock,$15.715,-0.195,-1.226%,"394,987,143"
SAJ,Saratoga Investment Corp 8.00% Notes due 2027,$25.18,-0.05,-0.198%,"394,523,539"
OSG,"Octave Specialty Group, Inc. Common Stock",$8.99,-0.02,-0.222%,"393,870,195"
PTLO,Portillo's Inc. Class A Common Stock,$5.22,0.01,0.192%,"393,455,668"
WOK,WORK Medical Technology Group LTD Class A Ordinary Shares,$6.09,0.90,17.341%,"393,364,927"
TRDA,"Entrada Therapeutics, Inc. Common Stock",$10.27,0.19,1.885%,"392,511,513"
BSVN,Bank7 Corp. Common stock,$41.43,-0.57,-1.357%,"391,653,948"
BOC,Boston Omaha Corporation Class A Common Stock,$12.43,0.02,0.161%,"390,966,185"
NGS,"Natural Gas Services Group, Inc. Common Stock",$30.97,-0.27,-0.864%,"389,259,359"
VBNK,VersaBank Common Shares,$12.10,0.09,0.749%,"389,228,492"
YRD,"Yiren Digital Ltd. American Depositary Shares, each representing two ordinary shares",$4.50,0.09,2.041%,"388,829,178"
VKI,Invesco Advantage Municipal Income Trust II Common Shares of Beneficial Interest (DE),$8.75,0.02,0.229%,"388,552,675"
AMCX,AMC Networks Inc. Class A Common Stock,$8.92,0.18,2.059%,"388,258,779"
GCBC,"Greene County Bancorp, Inc. Common Stock",$22.80,0.21,0.93%,"388,211,678"
SAT,Saratoga Investment Corp 6.00% Notes due 2027,$24.75,-0.08,-0.322%,"387,786,242"
LEO,"BNY Mellon Strategic Municipals, Inc. Common Stock",$6.22,0.01,0.161%,"387,449,112"
OCGN,"Ocugen, Inc. Common Stock",$1.24,0.06,5.085%,"387,276,939"
ZEPP,"Zepp Health Corporation American depositary shares, each representing sixteen Class A ordinary shares",$26.95,-2.35,-8.02%,"387,219,271"
HVT,"Haverty Furniture Companies, Inc. Common Stock",$23.80,-0.35,-1.449%,"387,150,483"
GCO,Genesco Inc. Common Stock,$35.85,0.58,1.644%,"387,015,986"
SWBI,"Smith & Wesson Brands, Inc. Common Stock",$8.71,-0.03,-0.343%,"386,216,913"
SITC,SITE Centers Corp. Common Stock,$7.36,-0.01,-0.136%,"386,122,822"
PKE,Park Aerospace Corp. Common Stock,$19.39,-0.21,-1.071%,"385,973,908"
KMDA,Kamada Ltd. Ordinary Shares,$6.70,-0.10,-1.471%,"385,283,708"
LND,Brasilagro Brazilian Agric Real Estate Co Sponsored ADR (Brazil),$3.75,0.14,3.878%,"385,062,915"
NRC,National Research Corporation Common Stock (Delaware),$16.99,-0.28,-1.621%,"384,949,583"
ATEX,Anterix Inc. Common Stock,$20.56,0.07,0.342%,"384,813,810"
NNDM,Nano Dimension Ltd. American Depositary Shares,$1.77,0.05,2.907%,"384,591,753"
GNE,Genie Energy Ltd. Class B Common Stock Stock,$14.48,0.15,1.047%,"383,646,934"
ATLCZ,Atlanticus Holdings Corporation 9.25% Senior Notes due 2029,$25.35,-0.11,-0.432%,"383,430,132"
PDLB,"Ponce Financial Group, Inc. Common Stock",$15.94,-0.03,-0.188%,"382,577,933"
MBI,MBIA Inc. Common Stock,$7.55,0.01,0.133%,"381,226,876"
JFIN,Jiayin Group Inc. American Depositary Shares,$7.13,-0.07,-0.972%,"380,524,863"
EVTL,Vertical Aerospace Ltd. Ordinary Shares,$4.50,0.11,2.506%,"380,487,245"
ECC           ,Eagle Point Credit Company Inc. Common Stock,$6.27,0.10,1.621%,"380,354,025"
ALLT,Allot Ltd. Ordinary Shares,$9.58,0.14,1.483%,"380,257,158"
BKKT,"Bakkt Holdings, Inc. Class A Common Stock",$15.77,0.88,5.91%,"379,086,104"
MG,Mistras Group Inc Common Stock,$11.99,0.13,1.096%,"378,262,354"
LWAY,"Lifeway Foods, Inc. Common Stock",$24.785,0.345,1.412%,"377,444,891"
TTGT,"TechTarget, Inc. Common Stock",$5.23,0.10,1.949%,"377,385,848"
NATH,"Nathan's Famous, Inc. Common Stock",$92.26,0.53,0.578%,"377,298,193"
ATLCL,Atlanticus Holdings Corporation 6.125% Senior Notes due 2026,$24.93,0.09,0.362%,"377,077,444"
KFS,"Kingsway Financial Services, Inc. Common Stock (DE)",$13.00,0.06,0.464%,"376,429,976"
WTBA,West Bancorporation Common Stock,$22.22,-0.20,-0.892%,"376,424,243"
OIS,"Oil States International, Inc. Common Stock",$6.30,0.12,1.942%,"376,397,060"
CTRN,"Citi Trends, Inc. Common Stock",$45.29,0.30,0.667%,"376,174,754"
SSP,E.W. Scripps Company (The) Class A Common Stock,$4.23,-0.19,-4.299%,"375,633,010"
AUTL,Autolus Therapeutics plc American Depositary Share,$1.41,0.04,2.92%,"375,262,033"
SRTA,"Strata Critical Medical, Inc. Class A Common Stock",$4.34,0.04,0.93%,"374,830,723"
NMRA,"Neumora Therapeutics, Inc. Common Stock",$2.24,-0.05,-2.183%,"374,279,615"
SAR,Saratoga Investment Corp New,$23.23,UNCH,--,"374,094,712"
EGY,"VAALCO Energy, Inc.  Common Stock",$3.58,0.15,4.373%,"373,244,546"
CMRC,"Commerce.com, Inc. Series 1 Common Stock",$4.59,-0.01,-0.217%,"372,998,758"
JACK,Jack In The Box Inc. Common Stock,$19.71,0.25,1.285%,"372,456,401"
EAF,GrafTech International Ltd. Common Stock,$14.42,0.26,1.836%,"372,325,986"
RILYT,"B. Riley Financial, Inc. 6.00% Senior Notes Due 2028",$12.17,0.32,2.70%,"371,149,293"
TACO,Berto Acquisition Corp. Ordinary Shares,$10.17,UNCH,--,"370,617,499"
RCKT,"Rocket Pharmaceuticals, Inc. Common Stock",$3.42,0.13,3.951%,"370,120,020"
OTLY,Oatly Group AB American Depositary Shares,$12.35,0.22,1.814%,"369,610,701"
RM,Regional Management Corp. Common Stock,$38.04,-1.08,-2.761%,"369,475,102"
GALT,Galectin Therapeutics Inc. Common Stock,$5.73,-0.03,-0.521%,"369,429,098"
ILPT,Industrial Logistics Properties Trust Common Shares of Beneficial Interest,$5.54,0.02,0.362%,"369,292,162"
CRMLW,Critical Metals Corp. Warrants,$3.45,0.3875,12.653%,"368,806,049"
BGS,"B&G Foods, Inc. Common Stock",$4.61,0.10,2.217%,"368,694,201"
SBC,SBC Medical Group Holdings Incorporated Common Stock,$3.57,-0.07,-1.923%,"366,199,687"
CVGW,"Calavo Growers, Inc. Common Stock",$20.49,0.19,0.936%,"365,814,588"
CLLS,Cellectis S.A. American Depositary Shares,$5.07,0.03,0.595%,"365,515,936"
PMN,ProMIS Neurosciences Inc. Common Shares (ON),$6.76,-0.4775,-6.598%,"363,763,104"
ATLCP,"Atlanticus Holdings Corporation 7.625% Series B Cumulative Perpetual Preferred Stock, no par value per share",$23.99,0.005,0.021%,"363,245,305"
OWLT,"Owlet, Inc. Class A Common Stock",$13.16,-0.11,-0.829%,"362,960,788"
USNA,"USANA Health Sciences, Inc. Common Stock",$19.85,-0.18,-0.899%,"362,875,011"
CTGO,"Contango ORE, Inc. Common Stock",$24.22,1.15,4.985%,"362,429,243"
OBT,"Orange County Bancorp, Inc. Common Stock",$27.11,-0.19,-0.696%,"362,372,321"
PPT,Putnam Premier Income Trust Common Stock,$3.64,0.04,1.111%,"362,282,877"
BWFG,"Bankwell Financial Group, Inc. Common Stock",$45.90,-0.08,-0.174%,"361,574,634"
ACTG,Acacia Research Corporation (Acacia Tech) Common Stock,$3.74,0.04,1.081%,"360,761,814"
KTF,DWS Municipal Income Trust,$9.12,0.02,0.22%,"360,248,555"
NATR,"Nature's Sunshine Products, Inc. Common Stock",$20.58,0.15,0.734%,"360,058,687"
NC,"NACCO Industries, Inc. Common Stock",$48.24,0.26,0.542%,"359,868,229"
SOHOO,Sotherly Hotels Inc. 7.875% Series C Cumulative Redeemable Perpetual Preferred Stock,$17.56,0.01,0.057%,"359,813,198"
INV,"Innventure, Inc. Common Stock",$5.75,0.55,10.577%,"359,213,833"
ONIT,Onity Group Inc. Common Stock,$44.55,0.05,0.112%,"359,022,837"
CZNC,Citizens & Northern Corp Common Stock,$20.16,-0.03,-0.149%,"358,885,760"
VHI,"Valhi, Inc. Common Stock",$12.68,0.02,0.158%,"358,873,075"
FET,"Forum Energy Technologies, Inc. Common Stock",$31.40,0.92,3.018%,"357,267,881"
ARQQ,Arqit Quantum Inc. Ordinary Shares,$28.51,0.94,3.41%,"356,489,297"
MTLS,Materialise NV American Depositary Shares,$6.03,0.01,0.166%,"356,175,132"
XRX,Xerox Holdings Corporation Common Stock,$2.78,0.12,4.511%,"355,951,231"
ELE,Elemental Royalty Corporation Common Stock,$14.30,0.06,0.421%,"354,170,116"
WILC,"G. Willi-Food International,  Ltd. Ordinary Shares",$25.53,0.43,1.713%,"354,024,944"
PMO,Putnam Municipal Opportunities Trust Common Stock,$10.37,0.01,0.097%,"352,388,850"
DAVA,Endava plc American Depositary Shares (each representing one Class A Ordinary Share),$6.46,0.12,1.893%,"350,956,315"
SOHOB,Sotherly Hotels Inc. 8.0% Series B Cumulative Redeemable Perpetual Preferred Stock,$17.1099,0.0398,0.233%,"350,590,423"
MSBI,"Midland States Bancorp, Inc. Common Stock",$16.26,0.11,0.681%,"350,430,983"
SCM,Stellus Capital Investment Corporation Common Stock,$12.10,-0.14,-1.144%,"350,261,773"
EM,Smart Share Global Limited American Depositary Shares,$1.38,0.03,2.222%,"349,925,573"
RMNI,"Rimini Street, Inc. (DE) Common Stock",$3.81,-0.02,-0.522%,"349,575,120"
VALU,"Value Line, Inc. Common Stock",$37.11,0.01,0.027%,"349,126,019"
NFE,New Fortress Energy Inc. Class A Common Stock,$1.22,UNCH,--,"347,154,429"
LAND,Gladstone Land Corporation Common Stock,$9.31,0.01,0.108%,"346,954,215"
MEC,"Mayville Engineering Company, Inc. Common Stock",$16.99,0.12,0.711%,"345,209,106"
AVTX,"Avalo Therapeutics, Inc. Common Stock",$19.00,0.45,2.426%,"344,545,392"
GBAB,Guggenheim Taxable Municipal Bond & Investment Grade Debt Trust Common Shares of Beneficial Interest,$15.33,0.06,0.393%,"343,344,554"
TLSI,"TriSalus Life Sciences, Inc. Common Stock",$6.87,0.40,6.182%,"343,254,817"
DCTH,"Delcath Systems, Inc. Common Stock",$9.70,0.06,0.622%,"342,543,065"
AUNA,Auna SA Class A Ordinary Shares,$4.63,-0.15,-3.138%,"342,482,484"
AVXL,Anavex Life Sciences Corp. Common Stock,$3.83,-0.03,-0.777%,"342,203,250"
SLP,"Simulations Plus, Inc. Common Stock",$17.00,-0.29,-1.677%,"342,160,870"
WNC,Wabash National Corporation Common Stock,$8.44,-0.19,-2.202%,"341,960,416"
AENT,Alliance Entertainment Holding Corporation Class A Common Stock,$6.70,0.10,1.515%,"341,414,379"
CHSCP,CHS Inc. 8%  Cumulative Redeemable Preferred Stock,$27.75,-0.07,-0.252%,"340,548,083"
MVBF,MVB Financial Corp. Common Stock,$27.06,0.06,0.222%,"340,532,078"
BIOA,"BioAge Labs, Inc. Common Stock",$9.49,0.14,1.497%,"340,264,301"
IPI,"Intrepid Potash, Inc Common Stock",$25.30,0.32,1.281%,"339,701,380"
QTRX,Quanterix Corporation Common Stock,$7.26,-0.12,-1.626%,"339,120,386"
CERS,Cerus Corporation Common Stock,$1.76,UNCH,--,"338,074,002"
KNOP,KNOT Offshore Partners LP Common Units representing Limited Partner Interests,$9.92,0.06,0.609%,"337,727,204"
RBB,RBB Bancorp Common Stock,$19.81,-0.23,-1.148%,"337,699,030"
API,"Agora, Inc. American Depositary Shares",$3.61,0.07,1.977%,"337,573,775"
FMAO,"Farmers & Merchants Bancorp, Inc. Common Stock",$24.50,-0.57,-2.274%,"336,873,628"
CCRN,"Cross Country Healthcare, Inc. Common Stock $0.0001 Par Value",$10.26,-0.41,-3.843%,"336,117,108"
KYTX,"Kyverna Therapeutics, Inc. Common Stock",$7.67,-0.01,-0.13%,"335,916,624"
CUB,Lionheart Holdings Class A Ordinary Shares,$10.57,-0.035,-0.33%,"335,793,848"
LXFR,Luxfer Holdings PLC Ordinary Shares,$12.50,-0.04,-0.319%,"334,018,875"
LPTH,"LightPath Technologies, Inc. Class A Common Stock",$7.35,0.43,6.214%,"333,887,891"
PBFS,"Pioneer Bancorp, Inc. Common Stock",$13.30,-0.09,-0.672%,"333,571,275"
EFT,Eaton Vance Floating Rate Income Trust Common Shares of Beneficial Interest,$11.42,0.08,0.705%,"332,212,539"
RWAY,Runway Growth Finance Corp. Common Stock,$9.19,0.04,0.437%,"332,071,800"
AMRN,Amarin Corporation plc,$15.97,-0.17,-1.053%,"332,059,163"
FINS,Angel Oak Financial Strategies Income Term Trust Common Shares of Beneficial Interest,$13.22,0.12,0.916%,"331,328,074"
FVR,"FrontView REIT, Inc. Common Stock",$15.28,-0.08,-0.521%,"330,868,062"
HYLN,Hyliion Holdings Corp. Class A Common Stock,$1.88,0.03,1.622%,"330,831,549"
RLMD,"Relmada Therapeutics, Inc. Common Stock",$4.51,0.32,7.637%,"330,734,635"
BWAY,BrainsWay Ltd. American Depositary Shares,$17.49,1.66,10.486%,"330,022,798"
ALDX,"Aldeyra Therapeutics, Inc. Common Stock",$5.48,-0.11,-1.968%,"329,691,996"
XOMAP,XOMA Royalty Corporation 8.625% Series A Cumulative Perpetual Preferred Stock,$26.62,UNCH,--,"329,638,202"
TBRG,"TruBridge, Inc. Common Stock",$21.96,-0.55,-2.443%,"329,597,333"
CHOW,ChowChow Cloud International Holdings Limited Ordinary Shares,$9.39,0.38,4.218%,"329,589,000"
SMLR,"Semler Scientific, Inc. Common Stock",$21.72,1.04,5.029%,"329,272,919"
CLDT,Chatham Lodging Trust (REIT) Common Shares of Beneficial Interest,$6.78,-0.05,-0.732%,"328,938,480"
SOPH,SOPHiA GENETICS SA Ordinary Shares,$4.92,-0.01,-0.203%,"328,808,869"
MTRX,Matrix Service Company Common Stock,$11.69,0.07,0.602%,"328,775,721"
ALLO,"Allogene Therapeutics, Inc. Common Stock",$1.46,0.04,2.817%,"328,106,010"
NKLR,Terra Innovatum Global N.V. Ordinary shares,$4.66,0.32,7.373%,"327,602,418"
VOXR,Vox Royalty Corp. Common Stock,$4.79,0.17,3.68%,"327,008,146"
LOCO,"El Pollo Loco Holdings, Inc. Common Stock",$10.91,-0.04,-0.365%,"326,808,341"
NGNE,Neurogene Inc. Common Stock ,$21.08,0.09,0.429%,"326,524,984"
CDRO,"Codere Online Luxembourg, S.A. Ordinary Shares",$7.14,0.14,2.00%,"325,875,412"
SMRT,"SmartRent, Inc. Class A Common Stock",$1.72,-0.02,-1.149%,"325,425,242"
ARTNA,Artesian Resources Corporation Class A Common Stock,$31.50,-0.03,-0.095%,"324,864,068"
XPOF,"Xponential Fitness, Inc. Class A Common Stock",$6.64,0.05,0.759%,"324,742,480"
BBCP,"Concrete Pumping Holdings, Inc. Common Stock",$6.29,UNCH,--,"323,774,291"
PYXS,"Pyxis Oncology, Inc. Common Stock",$5.19,-0.09,-1.705%,"323,151,276"
ZH,"Zhihu Inc. American Depositary Shares, each representing three (3) Class A Ordinary Shares",$3.69,0.03,0.82%,"323,114,337"
CTNM,"Contineum Therapeutics, Inc. Class A Common Stock",$11.07,0.31,2.881%,"323,050,397"
UMAC,"Unusual Machines, Inc. Common Stock",$8.75,0.24,2.82%,"322,661,054"
CHSCO,CHS Inc. Class B Cumulative Redeemable Preferred Stock,$26.29,-0.08,-0.303%,"322,630,959"
USCB,"USCB Financial Holdings, Inc. Class A Common Stock",$17.79,-0.09,-0.503%,"322,183,749"
ATNI,"ATN International, Inc. Common Stock",$21.09,0.18,0.861%,"321,778,376"
GFR,Greenfire Resources Ltd. Common Shares,$4.57,-0.15,-3.178%,"321,074,490"
FCEL,"FuelCell Energy, Inc. Common Stock",$6.71,0.49,7.878%,"319,906,249"
DHIL,"Diamond Hill Investment Group, Inc. Class A Common Stock",$118.00,-0.40,-0.338%,"319,224,928"
WAVE,Eco Wave Power Global AB (publ) American Depositary Shares,$6.82,-0.194,-2.766%,"318,724,816"
BNED,"Barnes & Noble Education, Inc Common Stock",$9.35,0.13,1.41%,"318,403,469"
XFOR,"X4 Pharmaceuticals, Inc. Common Stock",$3.64,UNCH,--,"318,269,544"
SI,"Shoulder Innovations, Inc. Common Stock",$15.44,-0.64,-3.98%,"318,090,001"
BCML,BayCom Corp Common Stock,$29.18,-0.36,-1.219%,"317,996,724"
AVBC,"Avidia Bancorp, Inc. Common Stock",$15.83,-0.17,-1.063%,"317,807,038"
DENN,Denny's Corporation Common Stock,$6.17,UNCH,--,"317,748,793"
VNDA,Vanda Pharmaceuticals Inc. Common Stock,$5.36,0.06,1.132%,"316,757,937"
OFSSH,OFS Capital Corporation 4.95% Notes due 2028,$23.60,UNCH,--,"316,194,641"
LZM,Lifezone Metals Limited Ordinary Shares,$3.91,0.16,4.267%,"316,102,277"
BRCC,BRC Inc. Class A Common Stock,$1.27,-0.01,-0.781%,"315,594,848"
SLN,Silence Therapeutics Plc American Depository Share,$6.74,-0.10,-1.462%,"315,432,000"
XOMAO,XOMA Royalty Corporation Depositary Shares Rep Series B 8.375% Cumulative Preferred Stock,$25.47,0.0501,0.197%,"315,397,633"
EPRX,Eupraxia Pharmaceuticals Inc. Common Stock,$6.21,-0.02,-0.321%,"314,526,136"
PALI,"Palisade Bio, Inc. Common Stock",$2.11,-0.12,-5.381%,"314,396,773"
SOHON,Sotherly Hotels Inc. 8.25% Series D Cumulative Redeemable Perpetual Preferred Stock,$15.33,UNCH,--,"314,119,380"
STRT,STRATTEC SECURITY CORPORATION Common Stock,$75.00,-0.25,-0.332%,"313,895,325"
CHSCL,"CHS Inc Class B Cumulative Redeemable Preferred Stock, Series 4",$25.51,-0.02,-0.078%,"313,058,797"
NBP,NovaBridge Biosciences American Depositary Shares,$3.84,-0.02,-0.518%,"312,964,166"
MLP,"Maui Land & Pineapple Company, Inc. Common Stock",$15.85,0.08,0.507%,"312,906,088"
ARDC,"Ares Dynamic Credit Allocation Fund, Inc. Common Shares",$13.63,0.05,0.368%,"312,330,619"
SWKHL,SWK Holdings Corporation 9.00% Senior Notes due 2027,$25.70,UNCH,--,"312,187,949"
GDEV,GDEV Inc. Ordinary Shares,$17.21,-1.29,-6.973%,"312,018,849"
LSAK,"Lesaka Technologies, Inc. Common Stock",$3.71,-0.06,-1.592%,"311,960,540"
USBC,"USBC, Inc. Common Stock",$0.81,0.0001,0.012%,"311,229,645"
KELYB,"Kelly Services, Inc. Class B Common Stock",$8.80,UNCH,--,"310,983,253"
RFMZ,"RiverNorth Flexible Municipal Income Fund II, Inc. Common Stock",$12.77,0.01,0.078%,"310,971,924"
OOMA,"Ooma, Inc. Common Stock",$11.24,-0.03,-0.266%,"310,224,000"
BNC,CEA Industries Inc. Common Stock,$7.20,1.23,20.603%,"310,198,190"
ACCO,Acco Brands Corporation Common Stock,$3.44,0.01,0.292%,"310,068,298"
ADV,Advantage Solutions Inc. Class A Common Stock,$0.9496,0.0099,1.054%,"309,827,810"
PCB,PCB Bancorp Common Stock,$21.72,-0.35,-1.586%,"309,743,577"
NVEC,NVE Corporation Common Stock,$63.94,1.27,2.026%,"309,288,394"
WALD,Waldencast plc Class A Ordinary Share,$2.52,-0.11,-4.183%,"309,256,696"
TOI,"The Oncology Institute, Inc. Common Stock",$3.14,0.02,0.641%,"308,917,408"
NEWT,"NewtekOne, Inc. Common Stock",$10.68,0.18,1.714%,"308,516,311"
PKOH,Park-Ohio Holdings Corp. Common Stock,$21.41,0.75,3.63%,"308,394,072"
CYBN,Cybin Inc. Common Shares,$6.18,0.15,2.488%,"308,345,730"
CHSCN,CHS Inc Preferred Class B Series 2 Reset Rate,$25.11,UNCH,--,"308,149,995"
ISBA,Isabella Bank Corporation Common stock,$42.00,0.28,0.671%,"308,074,032"
FSBW,"FS Bancorp, Inc. Common Stock",$40.95,0.31,0.763%,"307,881,019"
ACRS,"Aclaris Therapeutics, Inc. Common Stock",$2.83,-0.05,-1.736%,"306,617,026"
CHSCM,"CHS Inc Class B Reset Rate Cumulative Redeemable Preferred Stock, Series 3",$24.92,-0.0399,-0.16%,"305,818,315"
MIN,MFS Intermediate Income Trust Common Stock,$2.66,UNCH,--,"305,628,071"
KELYA,"Kelly Services, Inc. Class A Common Stock",$8.64,0.03,0.348%,"305,329,012"
ASLE,AerSale Corporation Common Stock,$6.47,0.01,0.155%,"305,287,021"
PHOE,Phoenix Asia Holdings Limited Ordinary Shares,$14.12,UNCH,--,"304,992,000"
RILYZ,"B. Riley Financial, Inc. 5.25% Senior Notes due 2028",$9.98,0.32,3.313%,"304,360,719"
QSI,Quantum-Si Incorporated Class A Common Stock,$1.41,0.06,4.444%,"303,840,428"
LRMR,"Larimar Therapeutics, Inc. Common Stock",$3.54,0.01,0.283%,"302,989,988"
XRPC,Canary XRP ETF Shares of Beneficial Interest,$23.2237,-0.5463,-2.298%,"302,837,048"
NNOX,NANO-X IMAGING LTD Ordinary Shares,$4.48,-0.07,-1.538%,"302,796,619"
CBK,"Commercial Bancgroup, Inc. Common Stock",$24.73,0.03,0.121%,"302,686,396"
PLBC,Plumas Bancorp,$43.41,-0.02,-0.046%,"301,938,863"
MCFT,"MasterCraft Boat Holdings, Inc. Common Stock",$18.48,-0.25,-1.335%,"301,016,987"
HNST,"The Honest Company, Inc. Common Stock",$2.69,UNCH,--,"300,716,913"
OBIO,"Orchestra BioMed Holdings, Inc. Ordinary Shares",$5.32,0.08,1.527%,"300,392,369"
ACIU,AC Immune SA Common Stock,$2.99,0.06,2.048%,"300,227,027"
PNRG,PrimeEnergy Resources Corporation Common Stock,$183.61,9.39,5.39%,"300,202,350"
CIA,"Citizens, Inc. Class A Common Stock ($1.00 Par)",$5.96,-0.01,-0.168%,"299,769,214"
AZ,A2Z Cust2Mate Solutions Corp. Common Shares,$6.99,0.03,0.431%,"299,365,357"
ELA,Envela Corporation Common Stock,$11.53,-0.11,-0.945%,"299,358,878"
CBAN,"Colony Bankcorp, Inc. Common Stock",$17.15,0.15,0.882%,"299,003,939"
IMMP,Immutep Limited American Depositary Shares,$2.03,0.14,7.407%,"298,799,829"
PMM,Putnam Managed Municipal Income Trust Common Stock,$6.12,0.04,0.658%,"298,281,511"
SY,So-Young International Inc. American Depository Shares,$2.95,0.075,2.609%,"297,055,994"
NECB,"NorthEast Community Bancorp, Inc. Common Stock",$21.16,-0.16,-0.75%,"296,816,398"
CNDT,Conduent Incorporated Common Stock ,$1.94,0.02,1.042%,"296,605,613"
HRZN,Horizon Technology Finance Corporation Common Stock,$6.68,0.02,0.30%,"296,480,391"
HDSN,"Hudson Technologies, Inc. Common Stock",$6.80,-0.05,-0.73%,"296,467,774"
MPX,Marine Products Corporation Common Stock,$8.47,0.06,0.713%,"296,441,818"
LFCR,"Lifecore Biomedical, Inc. Common Stock",$7.90,0.07,0.894%,"295,984,181"
EVO,Evotec SE American Depositary Shares,$3.33,0.07,2.147%,"295,347,760"
