Symbol,Name,Last Sale,Net Change,% Change,Market Cap
CIVB,"Civista Bancshares, Inc. Common Stock",$23.44,1.00,4.456%,"452,693,884"
OBE,Obsidian Energy Ltd. Common Shares,$6.73,0.33,5.156%,"451,692,174"
SBC,SBC Medical Group Holdings Incorporated Common Stock,$4.40,0.11,2.564%,"451,338,549"
ELVA,Electrovaya Inc. Common Shares,$10.71,0.10,0.943%,"450,986,533"
OSPN,OneSpan Inc. Common Stock,$11.85,0.30,2.597%,"450,621,408"
TCI,"Transcontinental Realty Investors, Inc. Common Stock",$51.99,0.65,1.266%,"449,158,039"
OPAL,OPAL Fuels Inc. Class A Common Stock,$2.59,0.06,2.372%,"449,093,604"
ATEX,Anterix Inc. Common Stock,$23.95,-1.20,-4.771%,"448,263,169"
KMDA,Kamada Ltd. Ordinary Shares,$7.79,-0.02,-0.256%,"447,964,191"
PTLO,Portillo's Inc. Class A Common Stock,$5.94,0.20,3.484%,"447,725,415"
ETB,Eaton Vance Tax-Managed Buy-Write Income Fund Eaton Vance Tax-Managed Buy-Write Income Fund Common Shares of Beneficial Interest,$15.24,0.18,1.195%,"447,620,106"
GUT,Gabelli Utility Trust (The) Common Stock,$6.09,UNCH,--,"447,000,087"
ORN,"Orion Group Holdings, Inc. Common",$11.18,0.45,4.194%,"446,092,934"
MGRD,"Affiliated Managers Group, Inc. 4.200% Junior Subordinated Notes due 2061",$15.70,0.08,0.512%,"446,069,389"
FCEL,"FuelCell Energy, Inc. Common Stock",$9.35,0.71,8.218%,"445,771,002"
CTNM,"Contineum Therapeutics, Inc. Class A Common Stock",$12.20,0.35,2.954%,"445,659,278"
BMRC,Bank of Marin Bancorp Common Stock,$27.67,1.31,4.97%,"445,339,962"
ADUR,Aduro Clean Technologies Inc. Common Stock,$13.35,-0.45,-3.261%,"444,274,276"
ADCT,ADC Therapeutics SA Common Shares,$3.57,0.05,1.42%,"442,241,286"
HSHP,Himalaya Shipping Ltd. Common Shares,$9.50,0.23,2.481%,"442,225,000"
HELE,Helen of Troy Limited Common Stock,$19.14,0.03,0.157%,"441,600,051"
TRC,Tejon Ranch Co Common Stock,$16.41,0.24,1.484%,"441,329,802"
AREC,American Resources Corporation Class A Common Stock,$4.35,0.85,24.286%,"441,060,890"
NFE,New Fortress Energy Inc. Class A Common Stock,$1.55,0.20,14.815%,"441,056,857"
COFS,"ChoiceOne Financial Services, Inc. Common Stock",$29.34,1.23,4.376%,"440,796,297"
HVT,"Haverty Furniture Companies, Inc. Common Stock",$27.07,1.39,5.413%,"440,343,007"
FDMT,"4D Molecular Therapeutics, Inc. Common Stock",$7.69,0.07,0.919%,"439,368,727"
ASTL,Algoma Steel Group Inc. Common Shares,$4.18,0.13,3.21%,"438,623,292"
DDI,"DoubleDown Interactive Co., Ltd. American Depository Shares",$8.83,0.11,1.261%,"437,556,875"
BWAY,BrainsWay Ltd. American Depositary Shares,$23.18,1.05,4.745%,"437,388,705"
TROO,"TROOPS, Inc. Ordinary Shares ",$3.885,0.205,5.571%,"437,101,995"
HQL,abrdn Life Sciences Investors Shares of Beneficial Interest,$17.00,0.35,2.102%,"436,553,812"
NBP,NovaBridge Biosciences American Depositary Shares,$3.79,-0.13,-3.316%,"435,826,032"
ANGO,"AngioDynamics, Inc. Common Stock",$10.57,0.21,2.027%,"435,667,770"
EB,"Eventbrite, Inc. Class A Common Stock",$4.46,UNCH,--,"435,631,196"
FRBA,First Bank Common Stock,$17.32,0.66,3.962%,"435,327,860"
NGS,"Natural Gas Services Group, Inc. Common Stock",$34.63,0.64,1.883%,"435,261,596"
DVLT,Datavault AI Inc. Common Stock,$0.7462,0.0349,4.907%,"433,822,901"
TRDA,"Entrada Therapeutics, Inc. Common Stock",$11.30,0.68,6.403%,"431,877,322"
GRVY,"GRAVITY Co., Ltd. American Depository Shares",$61.76,0.67,1.097%,"429,164,064"
ZUMZ,Zumiez Inc. Common Stock,$25.27,-0.11,-0.433%,"428,315,836"
PSFE,Paysafe Limited Common Shares,$7.15,0.24,3.473%,"428,201,374"
CLFD,"Clearfield, Inc. Common Stock",$30.85,0.90,3.005%,"427,171,250"
PURR,Hyperliquid Strategies Inc Common Stock,$3.36,-0.12,-3.448%,"426,805,892"
EVN,Eaton Vance Municipal Income Trust Common Stock,$10.75,-0.07,-0.647%,"426,422,002"
VSTM,"Verastem, Inc. Common Stock",$6.36,-0.29,-4.361%,"424,695,398"
BYND,"Beyond Meat, Inc. Common Stock",$0.9359,0.0099,1.069%,"424,602,142"
EVH,"Evolent Health, Inc Class A Common Stock",$3.80,-0.14,-3.553%,"424,083,253"
NATR,"Nature's Sunshine Products, Inc. Common Stock",$24.23,0.315,1.317%,"423,917,491"
VELO,"Velo3D, Inc. Common stock",$17.22,-1.97,-10.266%,"423,915,589"
BSVN,Bank7 Corp. Common stock,$44.79,1.26,2.895%,"423,417,338"
MCI,Barings Corporate Investors Common Stock,$20.79,0.38,1.862%,"421,241,138"
CGC,Canopy Growth Corporation Common Shares,$1.14,-0.01,-0.87%,"420,041,470"
API,"Agora, Inc. American Depositary Shares",$4.48,-0.02,-0.444%,"418,928,120"
PRTC,PureTech Health plc American Depositary Shares,$17.31,-0.825,-4.549%,"418,355,073"
ASMB,"Assembly Biosciences, Inc. Common Stock",$26.35,-0.45,-1.679%,"416,781,639"
IMMP,Immutep Limited American Depositary Shares,$2.83,0.02,0.712%,"416,553,456"
BAND,Bandwidth Inc. Class A Common Stock,$13.62,0.40,3.026%,"415,703,933"
NKLR,Terra Innovatum Global N.V. Ordinary shares,$5.91,-0.01,-0.169%,"415,478,603"
GBLI,"Global Indemnity Group, LLC Class A Common Stock ",$29.005,0.205,0.712%,"415,466,286"
PERI,Perion Network Ltd. Ordinary Shares,$9.22,0.02,0.217%,"415,242,800"
DMAC,DiaMedica Therapeutics Inc. Common Stock,$7.97,0.55,7.412%,"415,057,189"
WNC,Wabash National Corporation Common Stock,$10.18,0.44,4.517%,"412,459,365"
GCO,Genesco Inc. Common Stock,$38.20,1.60,4.372%,"412,282,515"
NATH,"Nathan's Famous, Inc. Common Stock",$100.79,8.06,8.692%,"412,181,713"
SLP,"Simulations Plus, Inc. Common Stock",$20.43,0.17,0.839%,"411,594,732"
TLS,Telos Corporation Common Stock,$5.58,0.18,3.333%,"411,549,156"
YSG,"Yatsen Holding Limited American Depositary Shares, each representing twenty (20) Class A Ordinary Shares",$4.38,-0.01,-0.228%,"411,055,440"
ZURA,Zura Bio Limited Class A Ordinary Shares,$6.32,1.31,26.148%,"410,947,307"
SGU,Star Group L.P. Common Stock,$12.46,0.06,0.484%,"410,887,377"
BNTC,Benitec Biopharma Inc. Common Stock,$12.12,0.49,4.213%,"410,410,179"
AQST,"Aquestive Therapeutics, Inc. Common Stock",$3.36,-0.12,-3.448%,"409,930,460"
CCSI,"Consensus Cloud Solutions, Inc. Common Stock",$21.555,0.715,3.431%,"409,669,480"
ALLT,Allot Ltd. Ordinary Shares,$10.32,0.01,0.097%,"409,629,840"
ONIT,Onity Group Inc. Common Stock,$50.82,0.14,0.276%,"409,551,977"
VHI,"Valhi, Inc. Common Stock",$14.46,1.14,8.559%,"409,251,157"
NEXN,Nexxen International Ltd. Ordinary Shares,$6.24,0.14,2.295%,"409,111,061"
RXST,"RxSight, Inc. Common Stock",$9.95,0.29,3.002%,"409,110,568"
SDHY,PGIM Short Duration High Yield Opportunities Fund Common Shares,$16.57,0.13,0.791%,"408,832,538"
DDT,Dillard's Capital Trust I,$26.17,UNCH,--,"408,591,320"
LXFR,Luxfer Holdings PLC Ordinary Shares,$15.27,0.44,2.967%,"408,037,458"
OBT,"Orange County Bancorp, Inc. Common Stock",$30.49,1.35,4.633%,"407,551,903"
GPRK,Geopark Ltd Common Shares,$7.94,0.49,6.577%,"406,903,459"
SNDL,SNDL Inc. Common Shares,$1.58,UNCH,--,"406,850,000"
ETON,"Eton Pharmaceuticals, Inc. Common Stock",$15.17,-0.19,-1.237%,"406,822,006"
CMTG,"Claros Mortgage Trust, Inc. Common Stock",$2.90,0.13,4.693%,"406,634,416"
USNA,"USANA Health Sciences, Inc. Common Stock",$22.24,0.27,1.229%,"406,566,260"
TRON,Tron Inc. Common Stock,$1.58,0.10,6.757%,"406,242,332"
WILC,"G. Willi-Food International,  Ltd. Ordinary Shares",$29.28,0.07,0.24%,"406,026,258"
BMBL,Bumble Inc. Class A Common Stock,$3.59,0.07,1.989%,"404,732,992"
BRBS,"Blue Ridge Bankshares, Inc. Common Stock",$4.42,0.05,1.144%,"404,379,882"
CODI,D/B/A Compass Diversified Holdings Shares of Beneficial Interest,$5.37,0.13,2.481%,"404,017,137"
LND,Brasilagro Brazilian Agric Real Estate Co Sponsored ADR (Brazil),$3.93,0.12,3.15%,"403,545,935"
SAJ,Saratoga Investment Corp 8.00% Notes due 2027,$25.6625,0.1749,0.686%,"402,083,412"
VKI,Invesco Advantage Municipal Income Trust II Common Shares of Beneficial Interest (DE),$9.05,-0.07,-0.768%,"401,874,481"
CD,Chaince Digital Holdings Inc. Ordinary Shares,$6.30,1.08,20.69%,"401,225,347"
BGIN,Bgin Blockchain Limited Class A Ordinary Shares,$3.546,0.186,5.536%,"401,180,047"
PDLB,"Ponce Financial Group, Inc. Common Stock",$16.69,0.57,3.536%,"400,578,776"
SPIR,"Spire Global, Inc. Class A Common Stock",$11.57,-0.24,-2.032%,"400,409,758"
JACK,Jack In The Box Inc. Common Stock,$21.17,0.50,2.419%,"400,045,764"
LAW,"CS Disco, Inc. Common Stock",$6.40,0.13,2.073%,"399,946,202"
RCKT,"Rocket Pharmaceuticals, Inc. Common Stock",$3.69,0.05,1.374%,"399,340,021"
SAZ,Saratoga Investment Corp 8.50% Notes due 2028,$25.48,0.02,0.079%,"399,223,978"
NEWT,"NewtekOne, Inc. Common Stock",$13.82,0.28,2.068%,"399,222,417"
MTRX,Matrix Service Company Common Stock,$14.19,0.63,4.646%,"399,087,038"
IONR,ioneer Ltd American Depositary Shares,$5.98,0.39,6.977%,"398,837,541"
WTBA,West Bancorporation Common Stock,$23.54,1.17,5.23%,"398,786,079"
SUPX,SuperX AI Technology Limited Ordinary Shares,$12.65,-0.89,-6.573%,"398,553,784"
CLPT,"ClearPoint Neuro, Inc. Common Stock",$14.01,0.11,0.791%,"398,210,545"
LEO,"BNY Mellon Strategic Municipals, Inc. Common Stock",$6.39,-0.01,-0.156%,"398,038,557"
SAY,Saratoga Investment Corp 8.125% Notes due 2027,$25.35,-0.0001,0.00%,"397,187,121"
CZNC,Citizens & Northern Corp Common Stock,$22.28,0.86,4.015%,"396,625,730"
ILPT,Industrial Logistics Properties Trust Common Shares of Beneficial Interest,$5.95,0.28,4.938%,"396,622,448"
VOR,Vor Biopharma Inc. Common Stock,$18.08,0.48,2.727%,"396,144,190"
AGL,"agilon health, inc. Common Stock",$0.9531,-0.0236,-2.416%,"395,137,727"
VFF,"Village Farms International, Inc. Common Shares",$3.42,-0.15,-4.202%,"395,070,760"
SOR,"Source Capital, Inc. Cmn Shs of BI",$47.31,0.29,0.617%,"394,777,491"
FBRX,"Forte Biosciences, Inc. Common Stock",$31.50,1.09,3.584%,"394,598,453"
ISSC,"Innovative Solutions and Support, Inc. Common Stock",$22.12,0.71,3.316%,"392,682,070"
VSTA,Vasta Platform Limited Class A Ordinary Shares,$4.89,-0.05,-1.012%,"392,187,892"
GCBC,"Greene County Bancorp, Inc. Common Stock",$23.03,1.02,4.634%,"392,127,849"
BKKT,"Bakkt Holdings, Inc. Class A Common Stock",$16.31,0.15,0.928%,"392,066,859"
AUTL,Autolus Therapeutics plc American Depositary Share,$1.47,0.05,3.521%,"391,230,630"
SAT,Saratoga Investment Corp 6.00% Notes due 2027,$24.9499,0.0199,0.08%,"390,918,302"
KFS,"Kingsway Financial Services, Inc. Common Stock (DE)",$13.50,0.38,2.896%,"390,908,052"
FBIOP,"Fortress Biotech, Inc. 9.375% Series A Cumulative Redeemable Perpetual Preferred Stock",$12.35,0.15,1.23%,"390,728,522"
ARQQ,Arqit Quantum Inc. Ordinary Shares,$24.96,-0.19,-0.755%,"390,670,401"
PNNT,PennantPark Investment Corporation Common Stock,$5.96,0.05,0.846%,"389,164,720"
XPOF,"Xponential Fitness, Inc. Class A Common Stock",$7.94,0.14,1.795%,"388,321,580"
LSAK,"Lesaka Technologies, Inc. Common Stock",$4.61,0.02,0.436%,"387,638,299"
ATLCZ,Atlanticus Holdings Corporation 9.25% Senior Notes due 2029,$25.62,0.12,0.471%,"387,514,003"
BWFG,"Bankwell Financial Group, Inc. Common Stock",$49.10,2.00,4.246%,"386,782,451"
ACTG,Acacia Research Corporation (Acacia Tech) Common Stock,$4.00,0.07,1.781%,"385,841,512"
BOC,Boston Omaha Corporation Class A Common Stock,$12.24,0.03,0.246%,"384,990,032"
TTGT,"TechTarget, Inc. Common Stock",$5.33,-0.01,-0.187%,"384,601,639"
GNE,Genie Energy Ltd. Class B Common Stock Stock,$14.51,0.35,2.472%,"384,441,783"
AII,"American Integrity Insurance Group, Inc. Common Stock",$19.63,0.82,4.359%,"384,292,663"
DBI,Designer Brands Inc. Class A Common Stock,$7.74,0.24,3.20%,"384,183,352"
CTRN,"Citi Trends, Inc. Common Stock",$46.03,0.34,0.744%,"384,132,318"
AENT,Alliance Entertainment Holding Corporation Class A Common Stock,$7.53,-0.12,-1.569%,"383,708,996"
VENU,Venu Holding Corporation Common Stock,$8.95,0.55,6.548%,"383,485,501"
LCTX,"Lineage Cell Therapeutics, Inc. Common Stock",$1.66,0.01,0.606%,"382,343,711"
AIRO,"AIRO Group Holdings, Inc. Common Stock",$12.17,-0.56,-4.399%,"380,967,660"
RBB,RBB Bancorp Common Stock,$22.33,1.09,5.132%,"380,657,210"
HYLN,Hyliion Holdings Corp. Class A Common Stock,$2.16,0.09,4.348%,"380,104,332"
NGEN,NervGen Pharma Corp. Common stock,$5.21,-0.03,-0.573%,"379,474,466"
RC,Ready Capital Corporation Common Stock,$2.34,-0.09,-3.704%,"379,375,486"
TITN,Titan Machinery Inc. Common Stock,$16.21,0.68,4.379%,"378,830,521"
CBIO,"Crescent Biopharma, Inc. Common Stock",$13.72,-0.26,-1.86%,"378,078,843"
SAR,Saratoga Investment Corp New,$23.35,0.25,1.082%,"377,897,754"
OWLT,"Owlet, Inc. Class A Common Stock",$13.70,0.30,2.239%,"377,854,316"
SCM,Stellus Capital Investment Corporation Common Stock,$13.04,0.15,1.164%,"377,472,192"
HELP,Cybin Inc. Common Stock,$7.55,-0.13,-1.693%,"376,700,689"
ATLCP,"Atlanticus Holdings Corporation 7.625% Series B Cumulative Perpetual Preferred Stock, no par value per share",$24.68,0.12,0.489%,"373,692,960"
ATLCL,Atlanticus Holdings Corporation 6.125% Senior Notes due 2026,$24.68,0.06,0.244%,"373,296,081"
RILYL,"BRC Group Holdings, Inc. Depositary Shares each representing 1/1000th in a share of 7.375% Series B Cumulative Perpetual Preferred Stock, par value $0.0001",$12.16,0.48,4.11%,"372,060,323"
PEPG,PepGen Inc. Common Stock,$5.41,-0.54,-9.076%,"371,927,892"
NC,"NACCO Industries, Inc. Common Stock",$49.80,3.29,7.074%,"371,505,759"
TACO,Berto Acquisition Corp. Ordinary Shares,$10.19,0.01,0.098%,"371,346,344"
ISBA,Isabella Bank Corporation Common stock,$50.58,0.57,1.14%,"371,009,156"
MEC,"Mayville Engineering Company, Inc. Common Stock",$18.23,0.50,2.82%,"370,403,885"
CMDB,Costamare Bulkers Holdings Limited Common Stock,$15.30,0.10,0.658%,"370,317,299"
CNCK,Coincheck Group N.V. Ordinary Shares,$2.72,-0.04,-1.449%,"369,721,772"
USCB,"USCB Financial Holdings, Inc. Class A Common Stock",$20.38,1.09,5.651%,"369,089,646"
VERI,"Veritone, Inc. Common Stock",$4.01,-0.09,-2.195%,"368,142,152"
FMAO,"Farmers & Merchants Bancorp, Inc. Common Stock",$26.77,1.46,5.768%,"368,086,001"
ESEA,Euroseas Ltd. Common Stock (Marshall Islands),$52.51,-0.14,-0.266%,"367,917,196"
MRAM,"Everspin Technologies, Inc. Common Stock",$16.08,1.41,9.611%,"367,532,745"
LAND,Gladstone Land Corporation Common Stock,$9.86,0.03,0.305%,"367,450,973"
GFR,Greenfire Resources Ltd. Common Shares,$5.23,0.34,6.953%,"367,444,110"
ELA,Envela Corporation Common Stock,$14.13,1.35,10.563%,"366,863,916"
DEFT,"Defi Technologies, Inc. Common Stock",$0.9503,0.0194,2.084%,"366,699,840"
JFIN,Jiayin Group Inc. American Depositary Shares,$6.87,0.15,2.232%,"366,648,781"
NUAI,"New Era Energy & Digital, Inc. Common Stock",$6.85,1.36,24.772%,"366,126,821"
NVA,Nova Minerals Limited American Depositary Shares,$9.74,0.48,5.184%,"366,084,562"
KNOP,KNOT Offshore Partners LP Common Units representing Limited Partner Interests,$10.75,0.32,3.068%,"365,984,621"
SHMD,SCHMID Group N.V. Class A Ordinary Shares,$8.49,-0.70,-7.617%,"365,600,005"
DCTH,"Delcath Systems, Inc. Common Stock",$10.34,0.15,1.472%,"365,143,844"
AUNA,Auna SA Class A Ordinary Shares,$4.93,0.30,6.479%,"364,883,917"
SOHOO,Sotherly Hotels Inc. 7.875% Series C Cumulative Redeemable Perpetual Preferred Stock,$17.7972,UNCH,--,"364,673,544"
RM,Regional Management Corp. Common Stock,$37.49,1.32,3.649%,"364,133,059"
AKBA,"Akebia Therapeutics, Inc. Common Stock",$1.37,0.03,2.239%,"363,551,410"
PPT,Putnam Premier Income Trust Common Stock,$3.65,0.03,0.829%,"363,278,160"
ACCO,Acco Brands Corporation Common Stock,$4.03,0.10,2.545%,"363,248,616"
ENTA,"Enanta Pharmaceuticals, Inc. Common Stock",$12.57,0.08,0.641%,"362,802,895"
MCFT,"MasterCraft Boat Holdings, Inc. Common Stock",$22.27,0.90,4.212%,"362,751,531"
SOPH,SOPHiA GENETICS SA Ordinary Shares,$5.42,0.20,3.831%,"362,224,405"
BYRN,"Byrna Technologies, Inc. Common Stock",$15.83,-0.11,-0.69%,"359,744,902"
ALLO,"Allogene Therapeutics, Inc. Common Stock",$1.60,0.03,1.911%,"359,568,230"
DAVA,Endava plc American Depositary Shares (each representing one Class A Ordinary Share),$6.60,0.17,2.644%,"358,562,180"
PMO,Putnam Municipal Opportunities Trust Common Stock,$10.55,0.04,0.381%,"358,505,532"
SVC,Service Properties Trust Common Stock,$2.13,0.05,2.404%,"358,023,612"
KELYA,"Kelly Services, Inc. Class A Common Stock",$10.12,0.39,4.008%,"357,630,741"
NCMI,"National CineMedia, Inc. Common Stock",$3.81,0.03,0.794%,"357,496,746"
MVBF,MVB Financial Corp. Common Stock,$28.35,1.39,5.156%,"356,765,869"
ASLE,AerSale Corporation Common Stock,$7.55,0.26,3.567%,"356,246,833"
KTF,DWS Municipal Income Trust,$8.98,-0.12,-1.319%,"354,718,423"
SOHOB,Sotherly Hotels Inc. 8.0% Series B Cumulative Redeemable Perpetual Preferred Stock,$17.285,0.015,0.087%,"354,178,310"
CLDT,Chatham Lodging Trust (REIT) Common Shares of Beneficial Interest,$7.27,0.38,5.515%,"352,711,320"
TECX,"Tectonic Therapeutic, Inc. Common Stock",$18.84,-0.26,-1.361%,"352,614,715"
CARL,"Carlsmed, Inc. Common Stock",$13.23,0.55,4.338%,"351,824,173"
FVR,"FrontView REIT, Inc. Common Stock",$16.21,0.23,1.439%,"351,005,974"
OEC,Orion S.A. Common Shares,$6.24,0.39,6.667%,"350,374,165"
ATNI,"ATN International, Inc. Common Stock",$22.94,1.01,4.606%,"350,004,550"
VALU,"Value Line, Inc. Common Stock",$37.25,-0.03,-0.08%,"349,772,769"
AURA,"Aura Biosciences, Inc. Common Stock",$5.48,0.51,10.262%,"347,997,914"
PBFS,"Pioneer Bancorp, Inc. Common Stock",$13.87,0.46,3.43%,"347,867,187"
CDRO,"Codere Online Luxembourg, S.A. Ordinary Shares",$7.61,-0.02,-0.262%,"347,326,595"
PBYI,Puma Biotechnology Inc Common Stock,$6.89,0.29,4.394%,"347,194,727"
PUBM,"PubMatic, Inc. Class A Common Stock",$7.46,-0.075,-0.995%,"346,254,423"
ELLO,Ellomay Capital Ltd Ordinary Shares (Israel),$26.94,-0.26,-0.956%,"346,248,640"
YDDL,One and One Green Technologies. Inc Class A Ordinary Shares,$6.35,0.76,13.596%,"346,075,000"
CADL,"Candel Therapeutics, Inc. Common Stock",$6.30,0.38,6.419%,"345,859,309"
FRST,Primis Financial Corp. Common Stock,$14.02,0.56,4.16%,"345,514,278"
PLBC,Plumas Bancorp,$49.60,5.07,11.386%,"344,993,494"
AARD,"Aardvark Therapeutics, Inc. Common Stock",$15.82,0.30,1.933%,"344,453,163"
AVBC,"Avidia Bancorp, Inc. Common Stock",$17.13,0.37,2.208%,"343,906,163"
FHTX,Foghorn Therapeutics Inc. Common Stock,$6.08,0.51,9.156%,"343,831,837"
ATGL,Alpha Technology Group Limited Class A Ordinary Shares,$20.85,0.43,2.106%,"343,243,125"
CHSCP,CHS Inc. 8%  Cumulative Redeemable Preferred Stock,$27.85,UNCH,--,"341,775,284"
ACIU,AC Immune SA Common Stock,$3.40,0.08,2.41%,"341,395,282"
STRT,STRATTEC SECURITY CORPORATION Common Stock,$81.47,1.63,2.042%,"340,974,028"
VOXR,Vox Royalty Corp. Common Stock,$4.99,-0.03,-0.598%,"340,661,931"
ECC           ,Eagle Point Credit Company Inc. Common Stock,$5.61,-0.07,-1.232%,"340,316,760"
LWAY,"Lifeway Foods, Inc. Common Stock",$22.31,0.07,0.315%,"339,753,703"
CUB,Lionheart Holdings Class A Ordinary Shares,$10.67,UNCH,--,"338,970,706"
EFT,Eaton Vance Floating Rate Income Trust Common Shares of Beneficial Interest,$11.65,0.19,1.658%,"338,903,335"
ONTF,"ON24, Inc. Common Stock",$8.01,0.02,0.25%,"338,681,984"
PKOH,Park-Ohio Holdings Corp. Common Stock,$23.51,1.07,4.768%,"338,642,907"
ARTNA,Artesian Resources Corporation Class A Common Stock,$32.83,0.02,0.061%,"338,580,550"
MLP,"Maui Land & Pineapple Company, Inc. Common Stock",$17.15,0.37,2.205%,"338,570,309"
RWAY,Runway Growth Finance Corp. Common Stock,$9.36,0.14,1.518%,"338,214,586"
AMCX,AMC Networks Inc. Class A Common Stock,$7.77,-0.09,-1.145%,"338,202,995"
RILYP,"BRC Group Holdings, Inc. Depositary Shares, each representing a 1/1000th fractional interest in a share of Series A Cumulative Perpetual Preferred Stock",$11.05,0.48,4.541%,"338,097,579"
XOMA,XOMA Royalty Corporation Common Stock,$27.27,1.16,4.443%,"337,687,219"
RMNI,"Rimini Street, Inc. (DE) Common Stock",$3.68,-0.03,-0.809%,"337,647,360"
SGHT,"Sight Sciences, Inc. Common Stock",$6.38,0.14,2.244%,"337,321,644"
DDD,3D Systems Corporation Common Stock,$2.62,0.05,1.946%,"337,293,597"
BGS,"B&G Foods, Inc. Common Stock",$4.21,-0.04,-0.941%,"336,703,381"
CBAN,"Colony Bankcorp, Inc. Common Stock",$19.30,0.86,4.664%,"336,488,398"
GBAB,Guggenheim Taxable Municipal Bond & Investment Grade Debt Trust Common Shares of Beneficial Interest,$15.01,-0.02,-0.133%,"336,177,544"
WSBF,"Waterstone Financial, Inc. Common Stock (MD)",$18.20,0.78,4.478%,"335,915,908"
MBI,MBIA Inc. Common Stock,$6.65,0.01,0.151%,"335,782,613"
IKT,"Inhibikase Therapeutics, Inc. Common Stock",$1.75,0.10,6.061%,"334,530,196"
BNR,Burning Rock Biotech Limited American Depositary Shares,$31.06,0.54,1.769%,"334,410,472"
OFLX,"Omega Flex, Inc. Common Stock",$33.085,1.065,3.326%,"333,970,643"
NECB,"NorthEast Community Bancorp, Inc. Common Stock",$23.80,0.74,3.209%,"333,848,312"
ZH,"Zhihu Inc. American Depositary Shares, each representing three (3) Class A Ordinary Shares",$3.81,0.10,2.695%,"333,622,120"
FJET,"Starfighters Space, Inc. Common Stock",$10.39,0.23,2.264%,"333,533,858"
ALMU,"Aeluma, Inc. Common Stock",$18.65,-1.90,-9.246%,"333,049,145"
MPX,Marine Products Corporation Common Stock,$9.50,0.38,4.167%,"332,490,823"
EVI,"EVI Industries, Inc.  Common Stock",$25.86,0.95,3.814%,"332,156,675"
FINS,Angel Oak Financial Strategies Income Term Trust Common Shares of Beneficial Interest,$13.24,0.08,0.608%,"331,829,327"
YRD,"Yiren Digital Ltd. American Depositary Shares, each representing two ordinary shares",$3.84,-0.09,-2.29%,"331,800,899"
GDEV,GDEV Inc. Ordinary Shares,$18.30,2.81,18.141%,"331,780,647"
TOI,"The Oncology Institute, Inc. Common Stock",$3.37,-0.07,-2.035%,"331,545,116"
OOMA,"Ooma, Inc. Common Stock",$12.00,0.39,3.359%,"331,200,000"
NVEC,NVE Corporation Common Stock,$68.45,0.20,0.293%,"331,104,013"
LOCO,"El Pollo Loco Holdings, Inc. Common Stock",$11.04,0.16,1.471%,"330,702,482"
LNKB,"LINKBANCORP, Inc. Common Stock",$8.80,0.29,3.408%,"329,609,702"
TSSI,"TSS, Inc. Common Stock",$11.42,0.30,2.698%,"329,410,323"
CAMP,CAMP4 Therapeutics Corporation Common Stock,$4.50,0.06,1.351%,"329,381,883"
QTRX,Quanterix Corporation Common Stock,$7.05,0.03,0.427%,"329,311,119"
GLDG,GoldMining Inc. Common Shares,$1.64,0.04,2.50%,"328,369,869"
ZEPP,"Zepp Health Corporation American depositary shares, each representing sixteen Class A ordinary shares",$22.84,-0.25,-1.083%,"328,166,536"
XFOR,"X4 Pharmaceuticals, Inc. Common Stock",$3.75,0.08,2.18%,"327,887,580"
FSBW,"FS Bancorp, Inc. Common Stock",$43.43,1.84,4.424%,"326,526,805"
MTLS,Materialise NV American Depositary Shares,$5.52,-0.07,-1.252%,"326,050,867"
XOMAP,XOMA Royalty Corporation 8.625% Series A Cumulative Perpetual Preferred Stock,$26.33,UNCH,--,"326,047,102"
NMRA,"Neumora Therapeutics, Inc. Common Stock",$1.95,0.08,4.278%,"325,823,772"
PLG,Platinum Group Metals Ltd. Ordinary Shares (Canada),$2.64,UNCH,--,"325,789,303"
SMRT,"SmartRent, Inc. Class A Common Stock",$1.72,UNCH,--,"325,425,242"
BCML,BayCom Corp Common Stock,$29.83,1.23,4.301%,"325,080,270"
OTLY,Oatly Group AB American Depositary Shares,$10.86,0.52,5.029%,"325,017,993"
PCB,PCB Bancorp Common Stock,$22.78,1.10,5.074%,"324,859,976"
RNGR,"Ranger Energy Services, Inc. Class A Common Stock",$15.03,0.81,5.696%,"324,853,716"
SITC,SITE Centers Corp. Common Stock,$6.18,-0.04,-0.643%,"324,217,261"
CZFS,"Citizens Financial Services, Inc. Common Stock",$67.25,3.75,5.906%,"323,228,853"
CHSCO,CHS Inc. Class B Cumulative Redeemable Preferred Stock,$26.29,0.09,0.344%,"322,630,959"
OFSSH,OFS Capital Corporation 4.95% Notes due 2028,$24.05,UNCH,--,"322,223,776"
CAN,Canaan Inc. American Depositary Shares,$0.7583,0.0328,4.521%,"318,685,857"
VFSWW,VinFast Auto Ltd. Warrant,$0.136,-0.009,-6.207%,"318,173,724"
BKTI,BK Technologies Corporation Common Stock,$85.20,-2.19,-2.506%,"317,986,933"
AMRN,Amarin Corporation plc,$15.29,-0.22,-1.418%,"317,920,138"
EOLS,"Evolus, Inc. Common Stock",$4.90,-0.16,-3.162%,"317,616,942"
AGCC,Agencia Comercial Spirits Ltd Class A Ordinary Shares,$9.31,0.76,8.889%,"317,601,340"
GREEL,Greenidge Generation Holdings Inc. 8.50% Senior Notes due 2026,$20.20,0.8954,4.638%,"316,603,023"
HDSN,"Hudson Technologies, Inc. Common Stock",$7.35,0.12,1.66%,"316,073,410"
QUAD,"Quad Graphics, Inc Class A Common Stock",$6.21,0.20,3.328%,"315,973,339"
LFCR,"Lifecore Biomedical, Inc. Common Stock",$8.43,0.18,2.182%,"315,841,347"
RFMZ,"RiverNorth Flexible Municipal Income Fund II, Inc. Common Stock",$12.95,UNCH,--,"315,355,240"
CHSCL,"CHS Inc Class B Cumulative Redeemable Preferred Stock, Series 4",$25.68,0.09,0.352%,"315,145,037"
CCCC,"C4 Therapeutics, Inc. Common Stock",$2.12,-0.06,-2.752%,"315,011,909"
SOHON,Sotherly Hotels Inc. 8.25% Series D Cumulative Redeemable Perpetual Preferred Stock,$15.36,-0.01,-0.065%,"314,734,095"
XOMAO,XOMA Royalty Corporation Depositary Shares Rep Series B 8.375% Cumulative Preferred Stock,$25.40,0.05,0.197%,"314,530,816"
JRVR,"James River Group Holdings, Inc. Common Stock",$6.83,0.16,2.399%,"313,946,680"
CBK,"Commercial Bancgroup, Inc. Common Stock",$25.60,0.21,0.827%,"313,334,886"
IMRX,Immuneering Corporation Class A Common Stock,$4.85,0.07,1.464%,"313,164,340"
ALCO,"Alico, Inc. Common Stock",$40.84,1.41,3.576%,"312,697,423"
SWKHL,SWK Holdings Corporation 9.00% Senior Notes due 2027,$25.6399,UNCH,--,"311,457,891"
CHSCN,CHS Inc Preferred Class B Series 2 Reset Rate,$25.32,0.02,0.079%,"310,727,116"
RLGT,"Radiant Logistics, Inc. Common Stock",$6.63,0.31,4.905%,"310,459,987"
ALTS,ALT5 Sigma Corporation Common Stock,$2.46,-0.03,-1.205%,"310,449,956"
EVO,Evotec SE American Depositary Shares,$3.50,0.11,3.245%,"310,425,574"
FNLC,"First Bancorp, Inc  (ME) Common Stock",$27.64,1.01,3.793%,"310,102,005"
ARDC,"Ares Dynamic Credit Allocation Fund, Inc. Common Shares",$13.52,0.03,0.222%,"309,809,975"
SY,So-Young International Inc. American Depository Shares,$3.07,0.39,14.552%,"309,139,627"
GLSI,"Greenwich LifeSciences, Inc. Common Stock",$22.30,1.01,4.744%,"308,956,220"
NL,"NL Industries, Inc. Common Stock",$6.29,0.20,3.284%,"307,346,597"
FSTR,L.B. Foster Company Common Stock,$29.56,1.53,5.458%,"307,217,346"
BNED,"Barnes & Noble Education, Inc Common Stock",$9.02,0.31,3.559%,"307,165,700"
CHSCM,"CHS Inc Class B Reset Rate Cumulative Redeemable Preferred Stock, Series 3",$24.94,-0.01,-0.04%,"306,063,755"
PKBK,"Parke Bancorp, Inc. Common Stock",$26.36,0.93,3.657%,"305,658,777"
BBCP,"Concrete Pumping Holdings, Inc. Common Stock",$6.00,-0.09,-1.478%,"305,132,430"
WEYS,"Weyco Group, Inc. Common Stock",$31.95,1.41,4.617%,"305,070,997"
