Symbol,Name,Last Sale,Net Change,% Change,Market Cap
ZSPC,"zSpace, Inc. Common stock",$1.32,0.085,6.883%,"31,483,014"
KZR,"Kezar Life Sciences, Inc. Common Stock",$4.29,0.07,1.659%,"31,416,125"
MSW,Ming Shing Group Holdings Limited Ordinary Shares,$2.42,0.1199,5.213%,"31,399,500"
KLXE,"KLX Energy Services Holdings, Inc. Common Stock",$1.76,0.02,1.149%,"31,399,204"
TDIC,Dreamland Limited Class A Ordinary Shares,$1.01,-0.15,-12.931%,"31,310,000"
VRAR,"The Glimpse Group, Inc. Common Stock",$1.48,0.02,1.37%,"31,177,689"
AGAE,Allied Gaming & Entertainment Inc. Common Stock,$0.8174,-0.0183,-2.19%,"31,076,634"
SWVL,Swvl Holdings Corp Class A Common Shares,$3.1304,0.1104,3.656%,"30,986,314"
IMA,"ImageneBio, Inc. Common Stock",$7.69,-0.27,-3.392%,"30,925,404"
NTZ,"Natuzzi, S.p.A.",$2.80,UNCH,--,"30,840,905"
EQS,"Equus Total Return, Inc. Common Stock",$2.27,0.186,8.925%,"30,840,613"
COSM,Cosmos Health Inc. Common Stock,$1.02,-0.05,-4.673%,"30,818,154"
RNTX,"Rein Therapeutics, Inc. Common Stock",$1.32,0.02,1.538%,"30,762,743"
MKDW,MKDWELL Tech Inc. Ordinary Share,$0.2141,-0.0018,-0.834%,"30,748,901"
AKTX,Akari Therapeutics plc ADS,$0.9419,0.0119,1.28%,"30,719,815"
ORBS,Eightco Holdings Inc. Common Stock,$10.08,0.24,2.439%,"30,691,020"
BTCM,BIT Mining Limited ADS,$2.88,0.22,8.271%,"30,686,797"
CLPS,CLPS Incorporation Common Stock,$1.10,0.1195,12.188%,"30,624,736"
CVU,"CPI Aerostructures, Inc. Common Stock",$2.35,-0.05,-2.083%,"30,622,246"
ZBAO,Zhibao Technology Inc. Class A Ordinary Shares,$0.97,-0.02,-2.02%,"30,578,052"
EBON,Ebang International Holdings Inc. Class A Ordinary Shares,$4.65,0.21,4.73%,"30,429,312"
ECXWW,ECARX Holdings Inc. Warrants,$0.088,UNCH,--,"30,424,242"
PRPO,"Precipio, Inc.  Common Stock",$18.75,-0.288,-1.513%,"30,367,200"
PXS,Pyxis Tankers Inc. Common Stock,$2.89,0.06,2.12%,"30,304,150"
NRXS,"Neuraxis, Inc. Common Stock",$3.07,0.09,3.02%,"30,266,258"
OMH,Ohmyhome Limited Class A Ordinary Shares,$1.278,-0.002,-0.156%,"30,148,414"
CRWS,Crown Crafts Inc Common Stock,$2.85,-0.0007,-0.025%,"30,110,281"
KFFB,Kentucky First Federal Bancorp Common Stock,$3.7163,0.0263,0.713%,"30,052,659"
UONEK,"Urban One, Inc. Class D Common Stock",$0.6616,-0.0185,-2.72%,"30,020,734"
AERT,"Aeries Technology, Inc. Class A Ordinary Share",$0.6366,-0.0034,-0.531%,"30,017,362"
NDLS,Noodles & Company Class A Common Stock,$0.6461,-0.0034,-0.523%,"30,005,880"
CNF,"CNFinance Holdings Limited American Depositary Shares, each representing two hundred (200) Ordinary Shares",$4.36,0.39,9.824%,"29,901,822"
PRZO,ParaZero Technologies Ltd. Ordinary Shares,$1.79,0.14,8.485%,"29,856,539"
TIRX,TIAN RUIXIANG Holdings Ltd Class A Ordinary Shares,$1.22,-0.04,-3.175%,"29,720,946"
RCON,"Recon Technology, Ltd. Class A Ordinary Shares",$1.96,-0.04,-2.00%,"29,572,400"
XTIA,"XTI Aerospace, Inc. Common Stock",$1.46,0.03,2.098%,"29,569,841"
SONN,"Sonnet BioTherapeutics Holdings, Inc. Common Stock",$4.37,-0.04,-0.907%,"29,516,518"
DTST,Data Storage Corporation Common Stock,$4.06,0.07,1.754%,"29,485,490"
FEDU,"Four Seasons Education (Cayman) Inc. American Depositary Shares, each ADS representing 10 ordinary shares",$13.00,-0.35,-2.622%,"29,380,754"
ADGM,"Adagio Medical Holdings, Inc Common Stock",$1.91,-0.11,-5.446%,"29,378,789"
CASI,"CASI Pharmaceuticals, Inc. Ordinary Shares",$1.89,-0.09,-4.545%,"29,281,167"
NRSN,NeuroSense Therapeutics Ltd. Ordinary Shares,$1.22,0.03,2.521%,"29,266,176"
QRHC,Quest Resource Holding Corporation Common Stock,$1.41,0.08,6.015%,"29,204,208"
LEE,"Lee Enterprises, Incorporated Common Stock",$4.65,0.32,7.39%,"29,122,797"
BOLD,"Boundless Bio, Inc. Common Stock",$1.30,0.03,2.362%,"29,101,294"
SPWRW,"Complete Solaria, Inc. Warrants",$0.3488,0.0187,5.665%,"28,988,317"
RVP,"Retractable Technologies, Inc. Common Stock",$0.9677,-0.007,-0.718%,"28,970,189"
DAIO,Data I/O Corporation Common Stock,$3.08,0.03,0.984%,"28,914,002"
CVKD,"Cadrenal Therapeutics, Inc. Common Stock",$13.99,0.37,2.717%,"28,635,487"
DARE,"Dare Bioscience, Inc. Common Stock",$2.12,UNCH,--,"28,576,544"
BOSC,B.O.S. Better Online Solutions Common Stock,$4.76,0.03,0.634%,"28,196,141"
IINN,Inspira Technologies Oxy B.H.N. Ltd. Ordinary Shares,$1.16,0.03,2.655%,"28,132,431"
BMGL,Basel Medical Group Ltd Ordinary Shares,$1.52,-0.12,-7.317%,"28,051,600"
FENG,"Phoenix New Media Limited American Depositary Shares, each representing 48 Class A ordinary shares.",$2.32,-0.20,-7.937%,"27,865,000"
IZM,ICZOOM Group Inc. Class A Ordinary Shares,$2.37,0.03,1.282%,"27,804,828"
CVV,CVD Equipment Corporation Common Stock,$4.03,0.87,27.532%,"27,733,807"
FOXX,Foxx Development Holdings Inc. Common Stock,$4.09,-0.15,-3.538%,"27,732,642"
LIQT,"LiqTech International, Inc. Common Stock",$2.879,0.199,7.425%,"27,678,830"
PASG,"Passage Bio, Inc. Common Stock",$8.69,0.219,2.585%,"27,622,990"
BQ,Boqii Holding Limited Class A Ordinary Shares,$9.58,-0.73,-7.081%,"27,586,702"
CREX,"Creative Realities, Inc. Common Stock",$2.59,-0.15,-5.474%,"27,244,034"
TOPS,"TOP Ships, Inc. Common Stock",$5.85,0.02,0.343%,"27,063,252"
NSYS,Nortech Systems Incorporated Common Stock,$9.685,0.39,4.196%,"26,983,708"
LNAI,Lunai Bioworks Inc. Common Stock,$1.16,0.03,2.655%,"26,889,087"
MOGU,MOGU Inc. American Depositary Shares (each  representing 25 Class A Ordinary Shares),$3.27,-0.05,-1.506%,"26,727,806"
MGRX,"Mangoceuticals, Inc. Common Stock",$2.53,0.33,15.00%,"26,655,551"
NTRP,"NextTrip, Inc. Common Stock",$3.38,-0.34,-9.14%,"26,521,518"
HHS,"Harte Hanks, Inc. Common Stock",$3.57,-0.06,-1.653%,"26,470,815"
MTEN,Mingteng International Corporation Inc. Class A Ordinary Shares,$3.86,-0.43,-10.023%,"26,400,856"
ENLV,Enlivex Therapeutics Ltd. Ordinary Shares,$1.10,-0.05,-4.348%,"26,234,929"
KMRK,K-Tech Solutions Company Limited Class A Ordinary Shares,$1.33,0.07,5.556%,"25,935,000"
PMN,ProMIS Neurosciences Inc. Common Shares (ON),$0.48,-0.01,-2.041%,"25,829,333"
MGIH,Millennium Group International Holdings Limited Ordinary Shares,$2.29,0.10,4.566%,"25,762,500"
CLGN,CollPlant Biotechnologies Ltd Ordinary Shares,$2.24,0.04,1.818%,"25,658,107"
CCM,Concord Medical Services Holdings Limited American Depositary Shares (Each represents thirty (30) Class A ordinary shares),$5.90,-0.07,-1.173%,"25,616,166"
NINE,"Nine Energy Service, Inc. Common Stock",$0.5898,0.0207,3.637%,"25,562,256"
AURE,Prestige Wealth Inc. Class A Ordinary Shares,$0.7966,0.7966,--,"25,205,985"
ANY,Sphere 3D Corp. Common Shares,$0.89,0.0287,3.332%,"25,205,540"
JVA,"Coffee Holding Co., Inc. Common Stock",$4.41,0.21,5.00%,"25,174,922"
KAPA,"Kairos Pharma, Ltd. Common Stock",$1.21,0.05,4.31%,"25,099,956"
NYC,American Strategic Investment Co. Class A Common Stock,$9.51,-0.14,-1.451%,"25,008,476"
MBNKO,"Medallion Bank Fixed-Rate Reset Non-Cumulative Perpetual Preferred Stock, Series G, par value $1.00 per share",$25.00,0.035,0.14%,"25,000,000"
LPTX,"Leap Therapeutics, Inc. Common Stock",$0.6031,-0.0354,-5.544%,"24,992,180"
TC,Token Cat Limited American Depositary Shares,$14.74,0.24,1.655%,"24,935,850"
CSAI,"Cloudastructure, Inc. Class A Common Stock",$1.37,0.09,7.031%,"24,712,985"
SGRP,"SPAR Group, Inc. Common Stock",$1.04,-0.03,-2.804%,"24,632,142"
LGPS,LogProstyle Inc. Common Shares,$1.04,0.05,5.051%,"24,598,194"
HOVRW,New Horizon Aircraft Ltd. Warrant,$0.5998,0.1891,46.043%,"24,572,344"
ROLR,"High Roller Technologies, Inc. Common Stock",$2.89,-0.0212,-0.728%,"24,513,483"
MIRA,"MIRA Pharmaceuticals, Inc. Common Stock",$1.285,0.025,1.984%,"24,504,070"
BOF,BranchOut Food Inc. Common Stock,$2.06,0.02,0.98%,"24,273,979"
CAPT,Captivision Inc. Ordinary Shares,$0.8315,-0.1309,-13.601%,"24,244,579"
TLF,"Tandy Leather Factory, Inc. Common Stock",$3.00,0.01,0.334%,"24,202,506"
ARKR,Ark Restaurants Corp. Common Stock,$6.71,-0.43,-6.022%,"24,197,313"
WKSP,"Worksport, Ltd. Common Stock",$3.64,0.23,6.745%,"24,177,018"
XOS,"Xos, Inc. Common Stock",$2.78,0.03,1.091%,"24,159,821"
NCRA,"Nocera, Inc. Common Stock",$1.68,-0.02,-1.176%,"24,137,466"
SABS,"SAB Biotherapeutics, Inc. Common Stock",$2.31,0.02,0.873%,"24,049,551"
TLPH,"Talphera, Inc. Common Stock",$1.17,-0.06,-4.878%,"24,011,506"
MTVA,MetaVia Inc. Common Stock,$0.9909,0.0131,1.34%,"23,977,609"
MCTR,CTRL Group Limited Ordinary Shares,$1.56,-0.04,-2.50%,"23,868,000"
SAGT,SAGTEC GLOBAL LIMITED Ordinary shares,$1.90,0.0102,0.54%,"23,845,000"
VVOS,"Vivos Therapeutics, Inc. Common Stock",$3.17,0.05,1.603%,"23,790,238"
FCUV,Focus Universal Inc. Common Stock,$3.22,-0.23,-6.667%,"23,785,190"
PSHG,Performance Shipping Inc. Common Shares,$1.91,0.07,3.804%,"23,745,422"
NNVC,"NanoViricides, Inc. Common Stock",$1.36,-0.01,-0.73%,"23,706,160"
WXM,WF International Limited Ordinary Shares,$3.435,0.085,2.537%,"23,701,500"
SPCB,"SuperCom, Ltd. Ordinary Shares (Israel)",$10.90,0.59,5.723%,"23,684,120"
NWGL,Nature Wood Group Limited American Depositary Shares,$1.43,-0.10,-6.536%,"23,671,026"
DRTSW,Alpha Tau Medical Ltd. Warrant,$0.3363,-0.025,-6.919%,"23,668,986"
USGOW,U.S. GoldMining Inc. Warrant,$1.8522,0.0822,4.644%,"23,490,852"
ZOOZ,ZOOZ Power Ltd. Ordinary Shares,$1.94,-0.10,-4.902%,"23,484,662"
NTRBW,Nutriband Inc. Warrant,$1.95,0.10,5.405%,"23,468,022"
GLBS,Globus Maritime Limited Common Stock,$1.1401,0.0101,0.894%,"23,465,881"
PPCB,"Propanc Biopharma, Inc. Common Stock",$1.83,0.10,5.78%,"23,436,347"
NXL,"Nexalin Technology, Inc. Common Stock",$1.34,0.06,4.688%,"23,340,025"
GFAI,"Guardforce AI Co., Limited Ordinary Shares",$1.11,0.05,4.717%,"23,336,116"
AENTW,Alliance Entertainment Holding Corporation Warrants,$0.4573,-0.0127,-2.702%,"23,302,805"
PFAI,Pinnacle Food Group Limited Class A Common Shares,$1.99,0.0699,3.64%,"23,283,000"
AYTU,"Aytu BioPharma, Inc.  Common Stock",$2.34,-0.02,-0.847%,"23,193,876"
AMBR,Amber International Holding Limited American Depositary Shares,$2.44,-0.20,-7.576%,"23,126,640"
NTCL,NETCLASS TECHNOLOGY INC Class A Ordinary Shares,$1.29,0.02,1.575%,"23,000,700"
KIDZ,"Classover Holdings, Inc. Class B Common Stock",$0.9342,-0.0516,-5.234%,"22,998,591"
BNAI,Brand Engagement Network Inc. Common Stock,$0.5338,-0.0363,-6.367%,"22,947,741"
NXPL,NextPlat Corp Common Stock,$0.875,0.003,0.344%,"22,717,670"
APUS,"Apimeds Pharmaceuticals US, Inc. Common Stock",$1.79,-0.09,-4.787%,"22,511,010"
CUPR,Cuprina Holdings (Cayman) Limited Class A Ordinary Shares,$1.07,0.11,11.458%,"22,470,000"
AZI,Autozi Internet Technology (Global) Ltd. Class A Ordinary Shares,$0.2116,0.0001,0.047%,"22,425,622"
TOPP,Toppoint Holdings Inc. Common Stock,$1.28,-0.04,-3.03%,"22,400,000"
ALLR,"Allarity Therapeutics, Inc. Common Stock",$1.53,-0.08,-4.969%,"22,368,043"
CMBM,Cambium Networks Corporation Ordinary Shares,$0.7917,0.0247,3.22%,"22,360,623"
UTSI,UTStarcom Holdings Corp. Ordinary Shares,$2.36,-0.11,-4.453%,"22,349,802"
GDTC,CytoMed Therapeutics Limited Ordinary Shares,$1.93,-0.13,-6.311%,"22,272,200"
PCSA,"Processa Pharmaceuticals, Inc. Common Stock",$0.4411,0.0623,16.447%,"22,209,010"
MNDO,MIND C.T.I. Ltd. Ordinary Shares,$1.09,0.03,2.83%,"22,199,295"
JOB,GEE Group Inc. Common Stock,$0.2026,-0.0014,-0.686%,"22,167,123"
CTXR,"Citius Pharmaceuticals, Inc. Common Stock",$1.30,0.07,5.691%,"22,115,848"
ELPW,Elong Power Holding Limited Class A Ordinary Shares,$0.3803,0.0232,6.497%,"22,078,719"
RLYB,Rallybio Corporation Common Stock,$0.5281,0.0172,3.367%,"22,067,435"
COHN,Cohen & Company Inc.,$10.81,-0.19,-1.727%,"22,007,679"
GYRO,"Gyrodyne, LLC Common Stock",$10.00,UNCH,--,"21,993,080"
CING,Cingulate Inc. Common Stock,$4.05,-0.06,-1.46%,"21,920,718"
CKX,"CKX Lands, Inc. Common Stock",$10.63,-0.33,-3.011%,"21,824,761"
GTEC,Greenland Technologies Holding Corporation Ordinary Shares,$1.25,0.03,2.459%,"21,742,783"
IQST,iQSTEL Inc. Common Stock,$6.02,-0.04,-0.66%,"21,715,747"
RYOJ,"rYojbaba Co., Ltd. Common Shares",$1.93,-0.01,-0.515%,"21,712,500"
WFF,WF Holding Limited Ordinary Shares,$0.87,-0.0222,-2.488%,"21,706,500"
SQFTP,"Presidio Property Trust, Inc. 9.375% Series D Cumulative Redeemable Perpetual Preferred Stock, $0.01 par value per share",$14.90,UNCH,--,"21,621,211"
TRSG,Tungray Technologies Inc Class A Ordinary Shares,$1.32,-0.06,-4.348%,"21,586,600"
SNES,"SenesTech, Inc. Common Stock",$4.11,0.27,7.031%,"21,466,592"
DXST,Decent Holding Inc Class A Ordinary Shares,$1.32,UNCH,--,"21,450,000"
SJ,Scienjoy Holding Corporation Class A Ordinary Shares ,$0.51,0.0095,1.898%,"21,421,733"
SNYR,Synergy CHC Corp. Common Stock,$2.23,UNCH,--,"21,304,760"
LSTA,"Lisata Therapeutics, Inc. Common Stock",$2.43,0.06,2.532%,"21,276,954"
PRPH,"ProPhase Labs, Inc. Common Stock (DE)",$0.5108,-0.0153,-2.908%,"21,219,248"
MTC,"MMTec, Inc. Common Shares",$0.8405,-0.0071,-0.838%,"21,169,559"
BTMWW,Bitcoin Depot Inc. Warrant,$0.3102,-0.0237,-7.098%,"21,118,921"
BGI,Birks Group Inc. Common Stock,$1.075,-0.045,-4.018%,"21,064,289"
FLDDW,"Fold Holdings, Inc. Warrant",$0.45,0.0082,1.856%,"21,055,469"
ZONE,CleanCore Solutions Inc. Class B Common Stock,$1.86,-0.14,-7.00%,"20,787,074"
CLSD,"Clearside Biomedical, Inc. Common Stock",$3.96,-0.02,-0.503%,"20,726,723"
WIMI,WiMi Hologram Cloud Inc. Class B Ordinary Shares,$4.20,0.24,6.061%,"20,623,693"
LRE,"Lead Real Estate Co., Ltd American Depositary Shares",$1.51,0.045,3.072%,"20,599,269"
NXGL,"NexGel, Inc Common Stock",$2.55,-0.02,-0.778%,"20,572,329"
TRAW,"Traws Pharma, Inc. Common Stock",$2.90,-0.11,-3.654%,"20,485,104"
RAY,Raytech Holding Limited Ordinary Shares,$0.468,-0.0095,-1.99%,"20,403,903"
HOTH,"Hoth Therapeutics, Inc. Common Stock",$1.53,-0.05,-3.165%,"20,286,311"
HCAI,"Huachen AI Parking Management Technology Holding Co., Ltd. Class A Ordinary Shares",$0.5994,0.005,0.841%,"20,220,759"
ASTLW,Algoma Steel Group Inc. Warrant,$0.1926,-0.0174,-8.286%,"20,210,250"
CTRM,Castor Maritime Inc. Common Shares,$2.09,0.0065,0.312%,"20,194,320"
TRIB,Trinity Biotech plc American Depositary Shares,$1.08,0.03,2.857%,"20,122,581"
PN,Skycorp Solar Group Limited Ordinary Shares,$0.7443,0.0392,5.559%,"20,096,100"
MWYN,"Marwynn Holdings, Inc. Common stock",$1.17,0.03,2.632%,"19,953,185"
CXAI,CXApp Inc. Class A Common Stock,$0.85,0.019,2.286%,"19,919,949"
MDAIW,"Spectral AI, Inc. Warrants",$0.7422,0.0222,3.083%,"19,839,739"
JL,J-Long Group Limited Class A Ordinary Shares,$5.27,0.09,1.737%,"19,824,164"
SPPL,SIMPPLE LTD. Ordinary Shares,$5.60,0.01,0.179%,"19,822,824"
BCTX,BriaCell Therapeutics Corp. Common Shares,$11.285,-1.115,-8.992%,"19,806,405"
LIXT,"Lixte Biotechnology Holdings, Inc. Common Stock",$4.34,-0.43,-9.015%,"19,796,315"
EHLD,Euroholdings Ltd. Common Stock ,$7.00,UNCH,--,"19,716,305"
TOMZ,"TOMI Environmental Solutions, Inc. Common Stock",$0.98,0.0086,0.885%,"19,673,701"
BANL,CBL International Limited Ordinary Shares,$0.7115,0.0015,0.211%,"19,566,250"
HUDI,"Huadi International Group Co., Ltd. Ordinary Shares",$1.37,0.01,0.735%,"19,562,479"
ANGH,Anghami Inc. Ordinary Shares,$2.92,0.04,1.389%,"19,531,042"
SOAR,"Volato Group, Inc. Class A Common Stock",$3.46,0.97,38.956%,"19,414,050"
MI,NFT Limited Class A Ordinary Share,$3.822,0.002,0.052%,"19,359,003"
GTI,Graphjet Technology Class A Ordinary Shares,$6.03,2.16,55.814%,"19,356,674"
RENT,"Rent the Runway, Inc. Class A Common Stock",$4.72,0.11,2.386%,"19,337,986"
COCH,"Envoy Medical, Inc. Class A Common Stock",$0.8984,0.0134,1.514%,"19,334,405"
WETH,Wetouch Technology Inc. Common Stock,$1.62,0.05,3.185%,"19,329,085"
HTCR,"Heartcore Enterprises, Inc. Common Stock",$0.8255,-0.0013,-0.157%,"19,243,041"
XTKG,"X3 Holdings Co., Ltd. Ordinary Shares",$1.3954,0.1304,10.308%,"19,212,104"
LMFA,"LM Funding America, Inc. Common Stock",$1.26,0.08,6.78%,"19,149,969"
MTEX,"Mannatech, Incorporated Common Stock",$10.06,1.06,11.778%,"19,123,356"
YMAT,"J-Star Holding Co., Ltd. Ordinary Shares",$1.12,-0.03,-2.609%,"19,054,433"
CJMB,Callan JMB Inc. Common Stock,$4.24,-0.04,-0.935%,"18,999,733"
PRHI,"Presurance Holdings, Inc. Common Stock",$1.55,-0.07,-4.321%,"18,945,466"
PASW,"Ping An Biomedical Co., Ltd. Ordinary Shares",$0.9213,-0.0274,-2.888%,"18,886,650"
GDHG,Golden Heaven Group Holdings Ltd. Class A Ordinary Shares,$7.45,0.03,0.404%,"18,863,884"
ABTS,Abits Group Inc Ordinary Shares,$7.93,-0.42,-5.03%,"18,795,202"
DTCK,Davis Commodities Limited Class A Ordinary Shares,$0.7669,0.0207,2.774%,"18,789,529"
HBIO,"Harvard Bioscience, Inc. Common Stock",$0.4217,0.0021,0.50%,"18,778,806"
BATL,Battalion Oil Corporation Common Stock,$1.13,-0.02,-1.739%,"18,595,916"
TMDE,TMD Energy Limited Ordinary Shares,$0.784,-0.0175,-2.183%,"18,474,960"
IPM,Intelligent Protection Management Corp. Common Stock ,$2.00,-0.09,-4.306%,"18,473,974"
MXC,Mexco Energy Corporation Common Stock,$9.015,-0.1778,-1.934%,"18,444,690"
COOT,Australian Oilseeds Holdings Limited Ordinary Shares,$0.66,-0.0401,-5.728%,"18,413,035"
MIGI,Mawson Infrastructure Group Inc. Common Stock,$0.8813,0.081,10.121%,"18,371,670"
FBLG,"FibroBiologics, Inc. Common Stock",$0.4383,-0.0134,-2.967%,"18,360,011"
AIMD,"Ainos, Inc. Common Stock",$3.94,0.17,4.509%,"18,351,972"
MSAI,"MultiSensor AI Holdings, Inc. Common Stock",$0.5301,-0.0023,-0.432%,"18,327,934"
SEGG,"Lottery.com, Inc. Common Stock",$4.65,0.925,24.832%,"18,322,279"
ZCMD,Zhongchao Inc. Class A Ordinary Shares,$0.7193,-0.0277,-3.708%,"18,262,238"
CURX,Curanex Pharmaceuticals Inc Common Stock,$0.658,-0.0404,-5.785%,"18,259,500"
NAMMW,Namib Minerals Warrants,$0.34,0.1699,99.882%,"18,250,326"
NISN,"NiSun International Enterprise Development Group Co., Ltd. Class A Common Shares",$3.80,-0.061,-1.58%,"18,233,760"
LEDS,SemiLEDS Corporation Common Stock,$2.21,0.01,0.455%,"18,171,511"
MDRR,"Medalist Diversified REIT, Inc. Common Stock",$13.50,UNCH,--,"18,161,010"
SOHO,Sotherly Hotels Inc. Common Stock,$0.8862,0.0942,11.894%,"18,158,682"
SYBX,"Synlogic, Inc. Common Stock",$1.55,-0.13,-7.738%,"18,133,324"
CRIS,"Curis, Inc. Common Stock",$1.45,-0.07,-4.605%,"18,123,337"
VSTD,Vestand Inc. Class A Common Stock,$1.27,-0.01,-0.781%,"18,065,725"
IPST,"Heritage Distilling Holding Company, Inc. Common Stock",$0.6848,0.023,3.475%,"17,968,486"
IPW,iPower Inc. Common Stock,$0.57,0.0296,5.477%,"17,951,401"
GIGM,GigaMedia Limited Ordinary Shares,$1.62,UNCH,--,"17,904,621"
PULM,"Pulmatrix, Inc. Common Stock",$4.90,0.13,2.725%,"17,896,197"
BTCT,BTC Digital Ltd. Ordinary Shares,$2.78,0.08,2.963%,"17,886,631"
EDSA,"Edesa Biotech, Inc. Common Shares",$2.5384,0.0484,1.944%,"17,864,366"
IRIX,IRIDEX Corporation Common Stock,$1.045,0.005,0.481%,"17,756,904"
AFRIW,Forafric Global PLC Warrants,$0.66,-0.001,-0.151%,"17,755,051"
NERV,"Minerva Neurosciences, Inc Common Stock",$2.53,0.18,7.66%,"17,693,317"
LEXX,Lexaria Bioscience Corp. Common Stock,$0.903,0.0463,5.404%,"17,661,939"
CMMB,Chemomab Therapeutics Ltd. American Depositary Share,$3.36,0.08,2.439%,"17,442,015"
FEMY,Femasys Inc. Common Stock,$0.5326,-0.0799,-13.045%,"17,349,662"
NCL,Northann Corp. Common Stock,$0.7719,-0.0479,-5.843%,"17,348,259"
HSDT,Solana Company Class A Common Stock (DE),$16.07,1.37,9.32%,"17,311,520"
HXHX,Haoxin Holdings Limited Class A Ordinary Shares,$1.255,0.035,2.869%,"17,256,250"
RMSG,Real Messenger Corporation Ordinary Shares,$1.80,-0.22,-10.891%,"17,228,306"
WCT,Wellchange Holdings Company Limited Class A Ordinary shares,$0.372,0.0046,1.252%,"17,210,580"
EONR,EON Resources Inc. Class A Common Stock,$0.461,-0.0239,-4.929%,"17,195,926"
SRTAW,"Strata Critical Medical, Inc. Warrants",$0.2101,0.0335,18.969%,"17,164,247"
NXTC,"NextCure, Inc. Common Stock",$6.35,-0.30,-4.511%,"16,993,299"
YHGJ,Yunhong Green CTI Ltd. Common Stock,$6.12,-3.20,-34.335%,"16,976,035"
EHGO,Eshallgo Inc. Class A Ordinary Shares,$0.5705,-0.0295,-4.917%,"16,940,520"
FIEE,"FiEE, Inc Common Stock",$2.7183,0.0363,1.353%,"16,919,757"
WKHS,"Workhorse Group, Inc. Common Stock",$1.10,0.06,5.769%,"16,910,593"
HWH,HWH International Inc. Common Stock,$2.61,0.05,1.953%,"16,903,404"
GLTO,"Galecto, Inc. Common Stock",$12.75,0.09,0.711%,"16,888,140"
PALI,"Palisade Bio, Inc. Common Stock",$1.85,-0.15,-7.50%,"16,870,431"
LPCN,Lipocine Inc. Common Stock,$3.11,0.01,0.323%,"16,853,236"
OFAL,OFA Group Ordinary Shares,$1.21,0.07,6.14%,"16,847,569"
BGLWW,Blue Gold Limited Warrant,$0.55,-0.0564,-9.301%,"16,814,470"
NAII,"Natural Alternatives International, Inc. Common Stock",$2.72,0.06,2.256%,"16,800,836"
HCTI,"Healthcare Triangle, Inc. Common Stock",$2.87,0.09,3.237%,"16,737,349"
SMSI,"Smith Micro Software, Inc. Common Stock",$0.797,0.0218,2.812%,"16,732,949"
WVVI,"Willamette Valley Vineyards, Inc. Common Stock",$3.37,-0.373,-9.965%,"16,730,463"
EDTK,Skillful Craftsman Education Technology Limited Ordinary Share,$1.05,UNCH,--,"16,725,924"
BLIN,"Bridgeline Digital, Inc. Common Stock",$1.38,0.01,0.73%,"16,714,654"
GTIM,Good Times Restaurants Inc. Common Stock,$1.58,-0.01,-0.629%,"16,668,223"
MNTS,Momentus Inc. Class A Common Stock,$1.43,0.06,4.38%,"16,637,142"
HUBC,Hub Cyber Security Ltd. Ordinary Shares,$1.65,0.16,10.738%,"16,578,038"
MMA,Mixed Martial Arts Group Limited Ordinary Shares,$1.61,0.03,1.899%,"16,555,124"
DTSS,Datasea Inc. Common Stock,$2.00,0.03,1.523%,"16,513,632"
SAIH,SAIHEAT Limited Class A Ordinary Shares,$9.41,0.19,2.061%,"16,495,260"
MRM,MEDIROM Healthcare Technologies Inc. American Depositary Share,$2.08,-0.06,-2.804%,"16,436,056"
MSS,Maison Solutions Inc. Class A Common Stock,$0.8341,0.0316,3.938%,"16,423,826"
ELSE,"Electro-Sensors, Inc. Common Stock",$4.75,0.01,0.211%,"16,382,850"
DLPN,"Dolphin Entertainment, Inc. Common Stock",$1.39,0.02,1.46%,"16,315,436"
INTJ,Intelligent Group Limited Class A Ordinary Shares ,$0.53,0.0493,10.256%,"16,297,500"
PMNT,Perfect Moment Ltd. Common Stock,$0.5124,-0.0006,-0.117%,"16,087,732"
PHGE,BiomX Inc. COmmon Stock,$0.605,0.0207,3.543%,"16,053,002"
AMST,Amesite Inc. Common Stock,$3.51,0.10,2.933%,"16,050,223"
IBIO,"iBio, Inc. Common Stock",$0.8086,0.0173,2.186%,"15,892,739"
JYD,Jayud Global Logistics Limited Class A Ordinary Shares,$5.80,-0.865,-12.978%,"15,856,440"
ASBP,"Aspire Biopharma Holdings, Inc. Common Stock",$0.3171,-0.0131,-3.967%,"15,704,685"
WVVIP,"Willamette Valley Vineyards, Inc. Series A Redeemable Preferred Stock",$3.1606,-0.0124,-0.391%,"15,690,890"
PSIG,PS International Group Ltd. Ordinary Shares,$4.75,1.086,29.64%,"15,631,618"
CRE,Cre8 Enterprise Limited Class A Ordinary Shares,$0.65,-0.0121,-1.828%,"15,616,250"
CLRB,"Cellectar Biosciences, Inc.  Common Stock",$4.89,0.25,5.388%,"15,609,076"
ALUR,"Allurion Technologies, Inc. Common Stock",$2.01,0.01,0.50%,"15,602,989"
AIRI,Air Industries Group Common Stock,$3.26,0.10,3.165%,"15,556,570"
RYDE,Ryde Group Ltd. Class A Ordinary Shares,$0.529,0.019,3.725%,"15,494,318"
MTEK,Maris-Tech Ltd. Ordinary Shares,$1.93,-0.01,-0.515%,"15,408,280"
AMS,American Shared Hospital Services Common Stock,$2.34,0.04,1.739%,"15,233,400"
INVZW,Innoviz Technologies Ltd. Warrant,$0.0765,-0.0001,-0.131%,"15,220,590"
ICU,SeaStar Medical Holding Corporation Common Stock,$0.545,-0.0266,-4.654%,"15,213,455"
TKLF,"Tokyo Lifestyle Co., Ltd. American Depositary Shares",$3.59,-0.045,-1.238%,"15,195,684"
LVLU,"Lulu's Fashion Lounge Holdings, Inc. Common Stock",$5.52,0.27,5.143%,"15,174,094"
EFOI,"Energy Focus, Inc. Common Stock",$2.76,-0.02,-0.719%,"15,110,627"
ANNAW,"AleAnna, Inc. Warrant",$0.1849,-0.0051,-2.684%,"15,036,024"
BFRG,"Bullfrog AI Holdings, Inc. Common Stock",$1.49,0.17,12.879%,"15,021,197"
AIXI,XIAO-I Corporation American Depositary Shares,$1.20,0.10,9.091%,"14,952,403"
PLAG,Planet Green Holdings Corp. Common Stock,$2.05,-0.01,-0.485%,"14,929,564"
ZDAI,"DirectBooking Technology Co., Ltd. Ordinary Shares",$0.5651,0.0035,0.623%,"14,918,640"
ATON,AlphaTON Capital Corp. Common Stock,$6.54,0.24,3.81%,"14,902,188"
SNSE,"Sensei Biotherapeutics, Inc. Common Stock",$11.79,0.53,4.707%,"14,870,609"
CODX,"Co-Diagnostics, Inc. Common Stock",$0.3847,0.0057,1.504%,"14,820,022"
ARTW,"Art's-Way Manufacturing Co., Inc. Common Stock",$2.89,-0.10,-3.344%,"14,762,363"
ABP,"Abpro Holdings, Inc Common Stock",$0.184,UNCH,--,"14,750,667"
ATHA,"Athira Pharma, Inc. Common Stock",$3.74,-0.06,-1.579%,"14,750,309"
MDCXW,Medicus Pharma Ltd. Warrant,$0.9225,0.0225,2.50%,"14,701,205"
BIVI,BioVie Inc. Class A Common Stock,$1.95,0.12,6.557%,"14,691,739"
TAIT,Taitron Components Incorporated Class A Common Stock,$2.44,-0.01,-0.408%,"14,691,679"
AEVAW,"Aeva Technologies, Inc. Warrants",$0.26,-0.0157,-5.695%,"14,645,201"
USEA,United Maritime Corporation Common Stock,$1.65,0.04,2.484%,"14,593,041"
SOPA,Society Pass Incorporated Common Stock,$2.72,-0.38,-12.258%,"14,584,420"
HYFM,"Hydrofarm Holdings Group, Inc. Common Stock",$3.1059,-0.1741,-5.308%,"14,470,450"
GXAI,Gaxos.ai Inc. Common Stock,$2.03,0.21,11.538%,"14,460,610"
BLRX,BioLineRx Ltd. American Depositary Shares,$3.85,-0.06,-1.535%,"14,325,862"
KITT,"Nauticus Robotics, Inc. Common stock",$3.05,0.10,3.39%,"14,324,035"
AMBO,Ambow Education Holding Ltd. American Depository Shares (each representing twenty (20) Class A Ordinary Shares),$5.00,-0.75,-13.043%,"14,281,880"
NUAIW,"New Era Energy & Digital, Inc. Warrants",$0.549,-0.0498,-8.317%,"14,262,765"
NVNO,enVVeno Medical Corporation Common Stock,$0.741,-0.0008,-0.108%,"14,262,131"
DLXY,Delixy Holdings Limited Ordinary Shares,$0.8688,0.0167,1.96%,"14,204,880"
MBRX,"Moleculin Biotech, Inc. Common Stock",$0.4675,-0.0065,-1.371%,"14,158,784"
GRRRW,Gorilla Technology Group Inc. Warrant,$0.70,-0.0145,-2.029%,"14,155,569"
CCTG,CCSC Technology International Holdings Limited Class A Ordinary Shares,$1.22,0.03,2.521%,"14,129,125"
INTS,"Intensity Therapeutics, Inc. Common stock",$0.30,-0.0047,-1.543%,"14,117,318"
GOVX,"GeoVax Labs, Inc. Common Stock",$0.5559,0.0005,0.09%,"14,097,398"
YYGH,YY Group Holding Limited Class A Ordinary Shares,$0.3399,0.0036,1.07%,"13,969,057"
IMRN,Immuron Limited American Depositary Shares,$2.08,0.01,0.483%,"13,947,438"
AQMS,"Aqua Metals, Inc. Common Stock",$9.91,4.25,75.088%,"13,933,510"
AEHL,Antelope Enterprise Holdings Limited Class A Ordinary Shares,$4.06,0.11,2.785%,"13,880,279"
PT,Pintec Technology Holdings Limited American Depositary Shares,$0.8694,0.0336,4.02%,"13,865,156"
GPUS,"Hyperscale Data, Inc. Common Stock",$0.43,-0.0499,-10.398%,"13,822,114"
