Symbol,Name,Last Sale,Net Change,% Change,Market Cap
RAY,Raytech Holding Limited Ordinary Shares,$4.045,-0.0551,-1.344%,"11,022,140"
BANL,CBL International Limited Class B Ordinary Shares,$0.40,-0.0081,-1.985%,"11,000,000"
SFHG,Samfine Creation Holdings Group Limited Class A Ordinary Share,$0.61,0.0092,1.531%,"10,980,000"
INTJ,Intelligent Group Limited Class A Ordinary Shares ,$7.13,0.04,0.564%,"10,962,375"
BLIN,"Bridgeline Digital, Inc. Common Stock",$0.87,0.0105,1.222%,"10,961,895"
MBAI,Check-Cap Ltd. Ordinary Share,$1.5006,-0.0594,-3.808%,"10,936,912"
CABR,"Caring Brands, Inc. Common Stock",$0.7948,0.0497,6.67%,"10,918,108"
MRM,MEDIROM Healthcare Technologies Inc. American Depositary Share,$1.36,0.03,2.256%,"10,746,652"
EDSA,"Edesa Biotech, Inc. Common Shares",$1.28,-0.23,-15.232%,"10,685,646"
INHD,Inno Holdings Inc. Common Stock,$1.265,0.165,15.00%,"10,642,728"
BFRI,Biofrontera Inc. Common Stock,$0.9004,0.0508,5.979%,"10,488,150"
REBN,"Reborn Coffee, Inc. Common Stock",$1.7514,-0.0386,-2.156%,"10,466,930"
IMNN,"Imunon, Inc. Common Stock",$3.24,0.10,3.185%,"10,454,583"
ATON,AlphaTON Capital Corp. Common Stock,$0.4459,0.0459,11.475%,"10,449,483"
LNAI,Lunai Bioworks Inc. Common Stock,$0.4309,-0.0042,-0.965%,"10,422,332"
LHSW,Lianhe Sowell International Group Ltd Class A Ordinary Shares,$0.20,0.0074,3.842%,"10,400,000"
EFOI,"Energy Focus, Inc. Common Stock",$1.7895,-0.0305,-1.676%,"10,270,683"
BLRX,BioLineRx Ltd. American Depositary Shares,$2.76,0.01,0.364%,"10,269,968"
AWX,Avalon Holdings Corporation Common Stock,$2.62,0.01,0.383%,"10,216,509"
CENN,Cenntro Inc. Common Stock,$0.1162,0.0014,1.22%,"10,215,471"
GXAI,Gaxos.ai Inc. Common Stock,$1.1801,-0.0199,-1.658%,"10,195,064"
YCBD,"cbdMD, Inc. Common Stock",$0.967,0.0334,3.578%,"10,149,207"
CCHH,CCH Holdings Ltd Ordinary Shares,$0.5268,-0.0076,-1.422%,"10,140,900"
WETO,Webus International Limited Ordinary Shares,$0.46,0.029,6.729%,"10,120,000"
CLRO,"ClearOne, Inc. (DE) Common Stock",$4.50,-0.15,-3.226%,"10,070,604"
BTBD,"BT Brands, Inc. Common Stock",$1.2701,-0.0299,-2.30%,"9,963,571"
IPDN,"Professional Diversity Network, Inc. Common Stock",$2.04,-0.05,-2.392%,"9,959,205"
APRE,"Aprea Therapeutics, Inc. Common stock",$0.8656,0.0657,8.214%,"9,912,088"
OLB,"The OLB Group, Inc. Common Stock",$0.7362,-0.0739,-9.122%,"9,890,416"
NXL,"Nexalin Technology, Inc. Common Stock",$0.5282,-0.0356,-6.314%,"9,851,954"
IHT,InnSuites Hospitality Trust Shares of Beneficial Interest,$1.07,-0.03,-2.727%,"9,849,172"
YMAT,"J-Star Holding Co., Ltd. Class A Ordinary Shares",$0.5782,-0.0311,-5.104%,"9,836,851"
WFF,WF Holding Limited Ordinary Shares,$0.39,0.02,5.405%,"9,730,500"
BIVI,BioVie Inc. Class A Common Stock,$1.2889,0.0389,3.112%,"9,722,909"
GAUZ,Gauzy Ltd. Ordinary Shares,$0.5186,0.0061,1.19%,"9,719,649"
LESL,"Leslie's, Inc. Common Stock",$1.04,0.096,10.169%,"9,689,238"
XAIR,"Beyond Air, Inc. Common Stock",$0.9162,-0.0588,-6.031%,"9,646,985"
GSIW,Garden Stage Limited Class A Ordinary Shares,$0.13,0.0017,1.325%,"9,624,075"
AIFF,"Firefly Neuroscience, Inc. Common Stock",$0.6753,0.0185,2.817%,"9,598,770"
MKDW,MKDWELL Tech Inc. Ordinary Share,$2.70,0.35,14.894%,"9,581,495"
DTSS,Datasea Inc. Common Stock,$0.9151,0.0151,1.678%,"9,560,190"
BOLT,"Bolt Biotherapeutics, Inc. Common Stock",$4.98,-0.11,-2.161%,"9,558,816"
CURX,Curanex Pharmaceuticals Inc Common Stock,$0.3361,0.0335,11.071%,"9,525,347"
ZSPC,"zSpace, Inc. Common stock",$0.285,-0.0056,-1.927%,"9,491,350"
BGLWW,Blue Gold Limited Warrant,$0.27,0.0099,3.806%,"9,489,882"
PGYWW,Pagaya Technologies Ltd. Warrants,$0.1151,-0.0148,-11.393%,"9,486,897"
WIMI,WiMi Hologram Cloud Inc. Class B Ordinary Shares,$1.90,0.17,9.827%,"9,329,766"
NXGL,"NexGel, Inc Common Stock",$1.139,-0.041,-3.475%,"9,275,028"
TNON,"Tenon Medical, Inc. Common Stock",$0.834,-0.0084,-0.997%,"9,262,774"
LFWD,Lifeward Ltd. Ordinary Shares,$6.02,1.01,20.16%,"9,177,376"
GRDX,GridAI Technologies Corp. Common Stock,$2.71,0.35,14.831%,"9,110,757"
MTR,Mesa Royalty Trust Common Stock,$4.88,0.0457,0.945%,"9,094,319"
MIMI,Mint Incorporation Limited Class A Ordinary Shares,$0.363,0.033,10.00%,"9,079,538"
RNAZ,"TransCode Therapeutics, Inc. Common Stock",$9.89,-0.01,-0.101%,"9,068,814"
MARPS,Marine Petroleum Trust Units of Beneficial Interest,$4.515,0.035,0.781%,"9,030,000"
NOTV,"Inotiv, Inc. Common Stock",$0.2625,-0.0026,-0.981%,"9,028,680"
TSE,Trinseo PLC Ordinary Shares ,$0.2508,-0.0122,-4.639%,"9,027,192"
CLWT,Euro Tech Holdings Company Limited Common Stock,$1.19,-0.05,-4.032%,"8,979,641"
ICU,SeaStar Medical Holding Corporation Common Stock,$2.49,0.11,4.622%,"8,975,735"
AGPU,Axe Compute Inc. Common Stock,$2.64,0.43,19.457%,"8,958,882"
WLDS,Wearable Devices Ltd. Ordinary Share,$0.8681,0.0551,6.777%,"8,957,408"
PRSO,Peraso Inc. Common Stock,$0.8622,0.0022,0.256%,"8,955,594"
SKYQ,Sky Quarry Inc. Common Stock,$0.3506,0.0071,2.067%,"8,932,011"
IQST,iQSTEL Inc. Common Stock,$1.94,0.03,1.571%,"8,902,243"
TOIIW,"The Oncology Institute, Inc. Warrant",$0.0899,0.0147,19.548%,"8,844,482"
HSCS,HeartSciences Inc. Common Stock,$2.78,-0.03,-1.068%,"8,835,415"
CDIO,Cardio Diagnostics Holdings Inc. Common stock,$4.825,1.515,45.77%,"8,810,696"
PRHI,"Presurance Holdings, Inc. Common Stock",$0.72,0.003,0.418%,"8,800,474"
CWD,CaliberCos Inc. Class A Common Stock,$1.34,0.13,10.744%,"8,755,987"
EVTV,"Envirotech Vehicles, Inc. Common Stock",$1.81,0.04,2.26%,"8,741,422"
BTCT,BTC Digital Ltd. Ordinary Shares,$1.35,0.08,6.299%,"8,685,954"
ITOC,iTonic Holdings Ltd Class A Ordinary Shares,$0.3514,-0.0086,-2.389%,"8,685,905"
TVGNW,Tevogen Bio Holdings Inc. Warrant,$0.0429,-0.0005,-1.152%,"8,640,801"
LCFY,Locafy Limited Ordinary Share,$4.79,0.38,8.617%,"8,617,473"
HTOO,Fusion Fuel Green PLC Class A Ordinary Shares,$3.56,0.22,6.587%,"8,605,043"
INEO,INNEOVA Holdings Limited Class A Ordinary Shares,$0.5301,0.0302,6.041%,"8,572,048"
SOS,SOS Limited Class A Ordinary Shares,$1.2552,0.0252,2.049%,"8,527,671"
OXBR,Oxbridge Re Holdings Limited Ordinary Shares,$1.11,-0.02,-1.77%,"8,520,495"
BFRG,"Bullfrog AI Holdings, Inc. Common Stock",$0.5559,0.0109,2.00%,"8,477,367"
ARBB,ARB IOT Group Limited Ordinary Shares,$4.7952,0.1252,2.681%,"8,464,756"
TNMG,TNL Mediagene Ordinary Shares,$3.31,0.19,6.09%,"8,459,675"
DKI,DarkIris Inc. Class A Ordinary Shares,$0.4201,0.0024,0.575%,"8,454,513"
AMST,Amesite Inc. Common Stock,$1.8356,0.0356,1.978%,"8,393,672"
SQFTP,"Presidio Property Trust, Inc. 9.375% Series D Cumulative Redeemable Perpetual Preferred Stock, $0.01 par value per share",$5.83,0.03,0.517%,"8,389,947"
TGHL,The GrowHub Limited Class A Ordinary Shares,$0.331,-0.0123,-3.583%,"8,374,237"
FMFC,Kandal M Venture Limited Class A Ordinary Shares,$0.4361,0.0567,14.945%,"8,338,232"
DSS,"DSS, Inc. Common Stock",$0.915,0.0248,2.786%,"8,319,654"
CUPR,Cuprina Holdings (Cayman) Limited Class A Ordinary Shares,$0.3957,-0.0043,-1.075%,"8,309,700"
MSN,Emerson Radio Corporation Common Stock,$0.3944,0.0088,2.282%,"8,299,222"
MGRX,"Mangoceuticals, Inc. Common Stock",$0.5056,-0.0179,-3.419%,"8,235,616"
DAIC,"CID HoldCo, Inc. Common Stock",$0.2809,0.014,5.245%,"8,222,876"
AGRZ,Agroz Inc. Ordinary Shares,$0.4013,0.0003,0.075%,"8,195,945"
IFBD,"Infobird Co., Ltd Ordinary Shares",$0.995,0.0278,2.874%,"8,147,631"
ALZN,"Alzamend Neuro, Inc. Common Stock",$2.13,0.04,1.914%,"8,097,417"
IMG,CIMG Inc. Common Stock,$0.5195,0.0434,9.116%,"8,043,703"
TURB,"Turbo Energy, S.A. American Depositary Shares",$0.73,0.0403,5.843%,"8,042,512"
CALC,"CalciMedica, Inc. Common Stock",$0.5578,-0.0322,-5.458%,"8,037,581"
BBGI,"Beasley Broadcast Group, Inc. Class A Common Stock",$4.455,0.145,3.364%,"8,036,793"
HWH,HWH International Inc. Common Stock,$1.24,-0.26,-17.333%,"8,030,736"
YHGJ,Yunhong Green CTI Ltd. Common Stock,$2.89,0.2275,8.545%,"8,016,464"
CRGOW,Freightos Limited Warrants,$0.16,-0.0298,-15.701%,"8,006,838"
AIIOW,Robo.ai Inc. Warrant,$0.0216,0.0039,22.034%,"7,999,526"
ETS,Elite Express Holding Inc. Class A Common Stock,$0.4739,-0.0306,-6.065%,"7,922,031"
XWEL,"XWELL, Inc. Common Stock",$1.3701,0.9921,262.46%,"7,900,960"
IINNW,Inspira Technologies Oxy B.H.N. Ltd. Warrant,$0.1824,0.0322,21.438%,"7,892,783"
SUGP,SU Group Holdings Limited Ordinary Shares,$5.35,0.11,2.099%,"7,836,530"
CYCU,"Cycurion, Inc. Common Stock",$1.86,0.08,4.494%,"7,790,028"
WKHS,"Workhorse Group, Inc. Common Stock",$3.59,0.21,6.213%,"7,789,467"
HCAI,"Huachen AI Parking Management Technology Holding Co., Ltd. Class A Ordinary Shares",$0.223,0.0018,0.814%,"7,782,143"
MKZR,"MacKenzie Realty Capital, Inc. Common Stock",$3.9502,0.3302,9.122%,"7,767,673"
INLF,INLIF LIMITED Class A Ordinary Shares,$0.41,0.0307,8.094%,"7,749,000"
NWTG,"Newton Golf Company, Inc. Common Stock",$1.62,0.01,0.621%,"7,698,990"
CLGN,CollPlant Biotechnologies Ltd Ordinary Shares,$0.60,-0.019,-3.069%,"7,681,804"
JYD,Jayud Global Logistics Limited Class A Ordinary Shares,$2.80,0.16,6.061%,"7,654,833"
TGL,Treasure Global Inc. Common Stock,$4.56,0.34,8.057%,"7,641,306"
VCIG,VCI Global Limited Ordinary Share,$0.2378,-0.0543,-18.59%,"7,637,741"
HKPD,"Cellyan Biotechnology Co., Ltd Class A Ordinary Shares",$0.69,-0.0049,-0.705%,"7,590,000"
GELS,Gelteq Limited Ordinary Shares,$0.706,-0.014,-1.944%,"7,562,008"
MSGY,Masonglory Limited Ordinary Shares,$0.5398,0.0016,0.297%,"7,557,200"
MBIO,"Mustang Bio, Inc. Common Stock",$1.0334,0.0234,2.317%,"7,542,875"
KPRX,"Kiora Pharmaceuticals, Inc.  Common Stock",$2.04,0.03,1.493%,"7,502,987"
MYSE,"Myseum, Inc. Common Stock",$1.7585,0.0485,2.836%,"7,498,823"
RSVRW,"Reservoir Media, Inc. Warrant",$0.114,0.0146,14.688%,"7,478,425"
FTFT,Future FinTech Group Inc. Common Stock,$1.48,-0.025,-1.661%,"7,471,525"
QNCX,"Quince Therapeutics, Inc. Common Stock",$0.134,-0.0052,-3.736%,"7,461,320"
HTCR,"Heartcore Enterprises, Inc. Common Stock",$0.2935,-0.0065,-2.167%,"7,460,713"
WAFU,Wah Fu Education Group Limited Ordinary Shares,$1.68,-0.065,-3.725%,"7,409,739"
CJMB,Callan JMB Inc. Common Stock,$1.60,0.11,7.383%,"7,396,843"
LIMN,"Liminatus Pharma, Inc. Class A Common Stock",$0.2376,0.0053,2.282%,"7,380,957"
CMMB,Chemomab Therapeutics Ltd. American Depositary Share,$1.4206,-0.1294,-8.348%,"7,374,443"
PHGE,BiomX Inc. COmmon Stock,$4.60,0.13,2.908%,"7,331,034"
GLE,Global Engine Group Holding Limited Class A Ordinary Shares,$0.40,0.0214,5.652%,"7,320,000"
PMCB,"PharmaCyte  Biotech, Inc. Common Stock",$0.7205,0.0155,2.199%,"7,301,662"
SCKT,"Socket Mobile, Inc. Common Stock",$0.9068,-0.0782,-7.939%,"7,233,056"
NVNO,enVVeno Medical Corporation Common Stock,$11.00,-0.50,-4.348%,"7,211,666"
JXG,JX Luxventure Group Inc. Common Stock,$3.81,0.38,11.079%,"7,111,830"
BCTXL,BriaCell Therapeutics Corp. Warrant expiring 2031,$0.98,UNCH,--,"7,105,477"
ASBP,"Aspire Biopharma Holdings, Inc. Common Stock",$1.41,0.03,2.174%,"7,084,040"
TOVX,"Theriva Biologics, Inc. Common Stock",$0.1973,0.0013,0.663%,"7,041,311"
MBRX,"Moleculin Biotech, Inc. Common Stock",$2.605,0.155,6.327%,"7,016,648"
CHR,"Cheer Holding, Inc. Class A Ordinary Share",$1.35,-0.02,-1.46%,"7,001,369"
HXHX,Haoxin Holdings Limited Class A Ordinary Shares,$0.509,-0.01,-1.927%,"6,998,750"
RMSG,Real Messenger Corporation Ordinary Shares,$0.73,0.0783,12.015%,"6,987,035"
TCRT,"Alaunos Therapeutics, Inc. Common Stock",$3.1284,0.2784,9.768%,"6,982,054"
MSS,Maison Solutions Inc. Class A Common Stock,$0.2751,0.0034,1.251%,"6,940,677"
LOBO,LOBO TECHNOLOGIES LTD. Class A Ordinary Shares,$0.5501,0.0001,0.018%,"6,913,940"
GURE,"Gulf Resources, Inc. (NV) Common Stock",$4.49,-1.01,-18.364%,"6,912,494"
MNTS,Momentus Inc. Class A Common Stock,$4.94,0.12,2.49%,"6,902,064"
RENX,RenX Enterprises Corp. Common Stock,$0.1486,0.0051,3.554%,"6,889,244"
TULP,"Bloomia Holdings, Inc. Common Stock",$3.851,-0.019,-0.491%,"6,828,281"
OFAL,OFA Group Class A Ordinary Shares,$0.48,0.0098,2.084%,"6,827,333"
UCAR,U Power Limited Class A Ordinary Shares,$1.37,-0.12,-8.054%,"6,810,934"
IVF,"INVO Fertility, Inc. Common Stock",$0.9748,-0.0239,-2.393%,"6,785,675"
XPON,Expion360 Inc. Common Stock,$0.6951,0.0112,1.638%,"6,712,399"
YJ,Yunji Inc. American Depository Shares,$1.36,0.0099,0.733%,"6,698,734"
KLTOW,"Klotho Neurosciences, Inc. Warrant",$0.0898,0.0023,2.629%,"6,603,598"
BMRA,"Biomerica, Inc. Common Stock",$2.18,0.08,3.81%,"6,583,746"
CXAI,CXApp Inc. Class A Common Stock,$0.2059,0.0259,14.389%,"6,567,372"
GP,GreenPower Motor Company Inc. Common Shares,$1.2944,0.0644,5.236%,"6,509,914"
INBS,Intelligent Bio Solutions Inc. Common Stock,$4.05,-0.09,-2.174%,"6,495,321"
BOXL,Boxlight Corporation Class A Common Stock,$1.55,-0.10,-6.061%,"6,458,334"
ABTS,Abits Group Inc Ordinary Shares,$2.7137,-0.0963,-3.427%,"6,431,846"
HYFM,"Hydrofarm Holdings Group, Inc. Common Stock",$1.375,0.075,5.769%,"6,417,131"
JCTC,Jewett-Cameron Trading Company Common Shares,$1.81,0.01,0.556%,"6,371,405"
ORKT,Orangekloud Technology Inc. Class A Ordinary Shares,$1.09,0.02,1.869%,"6,365,328"
BKYI,"BIO-key International, Inc. Common Stock",$0.5849,0.0334,6.056%,"6,338,338"
CELZ,"Creative Medical Technology Holdings, Inc. Common Stock",$1.81,UNCH,--,"6,325,349"
LUCY,"Innovative Eyewear, Inc. Common Stock",$1.175,0.055,4.911%,"6,286,465"
CAPS,Capstone Holding Corp. Common Stock,$0.6879,-0.0061,-0.879%,"6,251,548"
EZRA,"Reliance Global Group, Inc. Common Stock",$0.3446,0.0538,18.501%,"6,251,444"
RVYL,Ryvyl Inc. Common Stock,$6.01,UNCH,--,"6,235,922"
AMBO,Ambow Education Holding Ltd. American Depository Shares (each representing twenty (20) Class A Ordinary Shares),$2.145,0.103,5.044%,"6,135,391"
ZCMD,Zhongchao Inc. Class A Ordinary Shares,$0.2397,0.0109,4.764%,"6,085,720"
SILO,"Silo Pharma, Inc. Common Stock",$0.3702,0.0215,6.166%,"6,067,467"
AMPGZ,"Amplitech Group, Inc. Series B Right",$0.24,0.005,2.128%,"6,043,512"
HCWC,Healthy Choice Wellness Corp. Class A Common Stock,$0.3321,0.058,21.16%,"6,032,846"
GRRRW,Gorilla Technology Group Inc. Warrant,$0.294,-0.016,-5.161%,"5,945,339"
SOWG,Sow Good Inc. Common Stock,$0.4455,0.0306,7.375%,"5,937,833"
YAAS,Youxin Technology Ltd Class A Ordinary shares,$1.2714,0.0114,0.905%,"5,897,007"
IPST,"IP Strategy Holdings, Inc. Common Stock",$0.6166,0.0466,8.175%,"5,894,277"
WTO,UTime Limited Class A Ordinary Shares,$3.48,0.11,3.264%,"5,889,723"
MITQ,"Moving iMage Technologies, Inc. Common Stock",$0.5918,0.0006,0.101%,"5,885,519"
NCT,Intercont (Cayman) Limited Class A Ordinary shares,$0.20,0.0145,7.817%,"5,863,094"
EHGO,Eshallgo Inc. Class A Ordinary Shares,$0.1971,-0.0067,-3.288%,"5,852,720"
AIHS,Senmiao Technology Limited Common Stock,$1.28,UNCH,--,"5,833,586"
ATER,"Aterian, Inc. Common Stock",$0.5814,0.0164,2.903%,"5,829,725"
NTCL,NETCLASS TECHNOLOGY INC Class A Ordinary Shares,$0.2632,-0.0041,-1.534%,"5,788,303"
ILAG,Intelligent Living Application Group Inc. Ordinary Shares,$2.7837,-0.1163,-4.01%,"5,782,992"
NCRA,"Nocera, Inc. Common Stock",$0.402,0.0369,10.107%,"5,778,194"
EVGN,Evogene Ltd Ordinary Shares,$0.88,0.0417,4.974%,"5,732,838"
NRSNW,NeuroSense Therapeutics Ltd. Warrant,$0.1716,UNCH,--,"5,682,163"
SONM,"DNA X, Inc. Common Stock",$5.5102,-0.0198,-0.358%,"5,668,304"
CNEY,CN Energy Group Inc. Class A Ordinary Shares,$1.005,0.005,0.50%,"5,651,875"
TDIC,Dreamland Limited Class A Ordinary Shares,$0.1812,-0.006,-3.205%,"5,617,200"
APM,Aptorum Group Limited Class A Ordinary Shares,$0.7851,-0.0241,-2.978%,"5,608,564"
JTAI,Jet.AI Inc. Common Stock,$0.1232,0.0103,9.123%,"5,602,920"
CLDI,"Calidi Biotherapeutics, Inc. Common Stock",$0.7813,0.0209,2.749%,"5,600,140"
TBH,"Brag House Holdings, Inc. Common Stock",$0.2669,0.0117,4.585%,"5,591,919"
OLOX,Olenox Industries Inc. Common Stock,$0.9001,-0.0049,-0.541%,"5,564,203"
LCFYW,Locafy Limited Warrant,$3.08,UNCH,--,"5,541,089"
IOTR,iOThree Limited Ordinary Shares,$2.16,0.07,3.349%,"5,540,402"
SOPA,Society Pass Incorporated Common Stock,$0.7228,0.0135,1.903%,"5,497,273"
APVO,Aptevo Therapeutics Inc. Common Stock,$7.155,0.275,3.997%,"5,489,058"
QH,Quhuo Limited American Depository Shares,$1.055,0.045,4.455%,"5,484,313"
ADVB,Advanced Biomed Inc. Common Stock,$4.01,0.29,7.796%,"5,471,789"
SNTG,Sentage Holdings Inc. Class A Ordinary Shares,$1.95,-0.03,-1.515%,"5,470,384"
SDAWW,SunCar Technology Group Inc. Warrant,$0.0555,UNCH,--,"5,467,031"
WHLRP,"Wheeler Real Estate Investment Trust, Inc. Class B Preferred Stock",$6.8999,0.5599,8.831%,"5,456,020"
IMRN,Immuron Limited American Depositary Shares,$0.8122,0.0872,12.028%,"5,446,206"
MYNZ,Mainz Biomed N.V. Ordinary Shares,$0.60,-0.012,-1.961%,"5,436,085"
ANY,Sphere 3D Corp. Common Shares,$1.61,0.305,23.372%,"5,430,396"
SXTC,"China SXT Pharmaceuticals, Inc. Ordinary Shares",$2.3401,0.0801,3.544%,"5,430,307"
SYNX,Silynxcom Ltd. Ordinary Shares,$1.025,0.045,4.592%,"5,419,157"
FLDDW,"Fold Holdings, Inc. Warrant",$0.11,0.0078,7.632%,"5,407,716"
XBIO,"Xenetic Biosciences, Inc. Common Stock",$2.35,-0.01,-0.424%,"5,383,982"
MOBXW,"Mobix Labs, Inc Warrants",$0.0521,-0.0077,-12.876%,"5,370,318"
WORX,SCWorx Corp. Common Stock,$0.3379,0.0139,4.29%,"5,347,887"
ZOOZW,ZOOZ Strategy Ltd. Warrant,$0.033,0.001,3.125%,"5,342,693"
SBFM,Sunshine Biopharma Inc. Common Stock,$1.17,UNCH,--,"5,330,456"
NAAS,NaaS Technology Inc. American Depositary Shares,$2.26,0.07,3.196%,"5,278,314"
GIBO,GIBO Holdings Limited Class A Ordinary Shares,$1.39,-0.03,-2.113%,"5,219,917"
VIVS,"VivoSim Labs, Inc. Common Stock",$2.00,0.06,3.093%,"5,215,924"
TIRX,TIAN RUIXIANG Holdings Ltd Class A Ordinary Shares,$0.0699,-0.0001,-0.143%,"5,205,144"
SLXN,Silexion Therapeutics Corp Ordinary Shares,$1.56,0.06,4.00%,"5,196,025"
FCUV,Focus Universal Inc. Common Stock,$5.26,0.075,1.446%,"5,189,116"
SOAR,"Volato Group, Inc. Class A Common Stock",$0.3301,0.031,10.364%,"5,152,975"
NIVF,NewGenIvf Group Limited Class A Ordinary Shares,$0.7803,-0.0317,-3.904%,"5,142,004"
GV,Visionary Holdings Inc. Common Shares,$0.915,0.025,2.809%,"5,130,723"
KWMWW,"K Wave Media, Ltd. Warrant",$0.07,0.01,16.667%,"5,127,068"
FGL,Founder Group Limited Class A Ordinary Shares,$12.322,0.722,6.224%,"5,113,975"
JCSE,JE Cleantech Holdings Limited Ordinary Shares,$0.9634,0.0281,3.004%,"5,067,734"
FFAIW,Faraday Future Intelligent Electric Inc. Warrant,$0.0246,-0.0005,-1.992%,"5,052,434"
CYCN,"Cyclerion Therapeutics, Inc. Common Stock",$1.28,-0.04,-3.03%,"5,024,402"
LMFA,"LM Funding America, Inc. Common Stock",$0.3554,0.0392,12.397%,"5,019,491"
ASTC,Astrotech Corporation (DE) Common Stock,$2.844,0.074,2.671%,"5,002,462"
RDHL,Redhill Biopharma Ltd. American Depositary Shares,$0.97,-0.02,-2.02%,"4,959,498"
SNOA,"Sonoma Pharmaceuticals, Inc. Common Stock",$2.865,0.025,0.88%,"4,958,206"
YDKG,Yueda Digital Holding Class A Ordinary Share,$0.89,0.0244,2.819%,"4,932,579"
ASPSW,Altisource Portfolio Solutions S.A. Net Settle Stakeholder Warrants,$0.4425,0.0525,13.462%,"4,864,645"
AGMH,AGM Group Holdings Inc. Class A Ordinary Shares,$1.39,0.08,6.107%,"4,863,514"
GLXG,Galaxy Payroll Group Limited Class A Ordinary Shares,$2.25,0.07,3.211%,"4,862,846"
MEGL,Magic Empire Global Limited Class A Ordinary Shares,$0.96,-0.04,-4.00%,"4,861,488"
BIAF,"bioAffinity Technologies, Inc. Common Stock",$1.07,-0.04,-3.604%,"4,813,619"
CTNT,Cheetah Net Supply Chain Service Inc Class A Common Stock,$1.465,0.055,3.901%,"4,797,270"
AEHL,Antelope Enterprise Holdings Limited Class A Ordinary Shares,$0.5165,-0.0404,-7.254%,"4,777,045"
TPET,Trio Petroleum Corp. Common Stock,$0.3876,-0.0151,-3.75%,"4,767,771"
MRNOW,Murano Global Investments PLC Warrants,$0.06,0.0009,1.523%,"4,758,344"
PCSA,"Processa Pharmaceuticals, Inc. Common Stock",$2.10,0.16,8.247%,"4,758,115"
GNPX,"Genprex, Inc. Common Stock",$2.05,-0.17,-7.658%,"4,753,733"
LGCL,Lucas GC Limited Ordinary Shares,$1.70,0.01,0.592%,"4,743,724"
DAVEW,Dave Inc. Warrants,$0.35,0.03,9.375%,"4,726,429"
JWEL,Jowell Global Ltd. Ordinary Shares,$2.1705,-0.1195,-5.218%,"4,711,016"
RUBI,Rubico Inc. Common Stock,$1.16,-0.01,-0.855%,"4,709,512"
SUNE,"SUNation Energy, Inc. Common Stock",$1.365,-0.125,-8.389%,"4,650,028"
WALDW,Waldencast plc Warrant ,$0.0361,-0.0033,-8.376%,"4,622,288"
BGLC,BioNexus Gene Lab Corp Common stock,$2.57,0.04,1.581%,"4,617,023"
AMIX,"Autonomix Medical, Inc. Common Stock",$0.4028,0.0296,7.931%,"4,595,684"
STAK,STAK Inc. Class A Ordinary Shares,$0.3477,-0.0085,-2.386%,"4,593,238"
XHLD,"TEN Holdings, Inc. Common Stock",$1.5441,0.0141,0.922%,"4,590,348"
CASI,"CASI Pharmaceuticals, Inc. Ordinary Shares",$0.2957,-0.5043,-63.038%,"4,581,186"
STFS,Star Fashion Culture Holdings Limited Class A Ordinary Shares,$0.0948,-0.0058,-5.765%,"4,526,700"
DUO,Fangdd Network Group Ltd. Class A Ordinary Shares,$1.16,0.09,8.411%,"4,521,458"
VSME,VS Media Holdings Limited Class A Ordinary Shares,$1.6399,0.4299,35.529%,"4,510,847"
EDHL,Everbright Digital Holding Limited Ordinary Shares,$2.704,0.174,6.877%,"4,505,540"
INDP,"Indaptus Therapeutics, Inc. Common Stock",$2.00,-0.01,-0.498%,"4,484,648"
ELPW,Elong Power Holding Limited Class A Ordinary Shares,$0.36,-0.0582,-13.917%,"4,476,497"
NCPL,Netcapital Inc. Common Stock,$0.57,0.033,6.145%,"4,473,302"
BNBX,BNB Plus Corp. Common Stock,$0.82,0.08,10.811%,"4,466,925"
HCTI,"Healthcare Triangle, Inc. Common Stock",$5.8733,0.0033,0.056%,"4,445,994"
LXEH,"Lixiang Education Holding Co., Ltd. American Depositary Shares",$0.2316,0.0038,1.668%,"4,439,001"
DXST,Decent Holding Inc Class A Ordinary Shares,$0.15,-0.0133,-8.145%,"4,437,500"
BEATW,"Heartbeam, Inc. Warrant",$0.1102,-0.0215,-16.325%,"4,420,938"
DCOY,Decoy Therapeutics Inc. Common Stock,$0.69,-0.018,-2.542%,"4,405,082"
NDRA,ENDRA Life Sciences Inc. Common Stock,$3.7401,-0.1199,-3.106%,"4,362,606"
HIHO,Highway Holdings Limited Common Stock,$0.94,0.0205,2.229%,"4,325,716"
CHNR,"China Natural Resources, Inc. Common Stock",$3.50,0.0205,0.589%,"4,316,274"
ASPSZ,Altisource Portfolio Solutions S.A. Cash Exercise Stakeholder Warrants,$0.3925,0.0775,24.603%,"4,314,968"
POLA,"Polar Power, Inc. Common Stock",$1.61,0.09,5.921%,"4,280,468"
ULY,Urgent.ly Inc. Common Stock,$1.9503,-0.0197,-1.00%,"4,273,000"
BDMDW,Baird Medical Investment Holdings Ltd Warrant,$0.1149,0.01,9.533%,"4,253,127"
CRE,Cre8 Enterprise Limited Class A Ordinary Shares,$2.1102,-0.0748,-3.423%,"4,249,854"
ATXG,Addentax Group Corp. Common Stock,$0.362,0.0115,3.281%,"4,240,956"
NCNA,NuCana plc American Depositary Share,$2.2043,0.0643,3.005%,"4,206,197"
SBLX,"StableX Technologies, Inc. Common Stock",$2.85,0.48,20.253%,"4,149,529"
AIM,AIM ImmunoTech Inc. Common Stock,$1.04,-0.03,-2.804%,"4,142,885"
GBR,"New Concept Energy, Inc Common Stock",$0.8035,-0.0065,-0.802%,"4,123,509"
SQFT,"Presidio Property Trust, Inc. Class A Common Stock",$2.86,0.02,0.704%,"4,115,823"
ONMDW,OneMedNet Corp Warrant,$0.08,UNCH,--,"4,080,416"
WXM,WF International Limited Ordinary Shares,$0.4725,0.0325,7.386%,"4,073,275"
JDZG,JIADE LIMITED Class A Ordinary Shares,$0.1736,-0.0159,-8.391%,"4,056,891"
BAOS,Baosheng Media Group Holdings Limited Ordinary shares,$2.63,0.07,2.734%,"4,035,701"
SKK,SKK Holdings Limited Ordinary Shares,$0.215,-0.0115,-5.077%,"4,031,250"
NCL,Northann Corp. Common Stock,$0.1772,-0.0028,-1.556%,"4,030,078"
VAVX,VanEck Avalanche ETF Common Shares of Beneficial Interest,$20.08,2.80,16.204%,"4,017,908"
DEVS,DevvStream Corp. Common Stock,$0.915,-0.035,-3.684%,"4,007,711"
MEHA,"Functional Brands, Inc. Common Stock",$0.2449,0.0219,9.821%,"3,997,631"
VS,Versus Systems Inc. Common Stock,$0.8144,-0.0541,-6.229%,"3,991,926"
MTNB,"Matinas Biopharma Holdings, Inc. Common Stock",$0.6198,-0.0052,-0.832%,"3,970,557"
BTOG,Bit Origin Limited Class A Ordinary Shares,$2.68,0.14,5.512%,"3,957,937"
ACXP,"Acurx Pharmaceuticals, Inc. Common Stock",$1.54,-0.05,-3.145%,"3,921,944"
TRUG,"TruGolf Holdings, Inc. Class A Common Stock",$0.77,-0.015,-1.911%,"3,894,232"
SDOT,Sadot Group Inc. Common Stock,$2.10,-0.17,-7.489%,"3,883,068"
MIGI,Mawson Infrastructure Group Inc. Common Stock,$3.39,0.20,6.27%,"3,875,648"
ELAB,PMGC Holdings Inc. Common Stock,$1.1864,-0.0436,-3.545%,"3,854,334"
DFSC,DEFSEC Technologies Inc. Common Stock,$1.90,0.0001,0.005%,"3,787,889"
RMCOW,Royalty Management Holding Corporation Warrant,$0.25,0.0006,0.241%,"3,785,184"
AMPGR,"Amplitech Group, Inc. Series A Right",$0.15,-0.0593,-28.333%,"3,777,195"
VEEE,Twin Vee PowerCats Co. Common Stock,$0.4362,-0.0318,-6.795%,"3,760,174"
WAI,Top KingWin Ltd Class A Ordinary Shares,$2.27,0.05,2.252%,"3,759,399"
BYAH,"Park Ha Biological Technology Co., Ltd. Class A Ordinary Shares",$1.7642,-0.0658,-3.596%,"3,696,648"
EEIQ,EpicQuest Education Group International Limited Common Stock,$2.498,-0.402,-13.862%,"3,695,739"
TBLAW,Taboola.com Ltd. Warrant,$0.0126,-0.0029,-18.71%,"3,631,614"
BLUWW,Blue Water Acquisition Corp. III Warrant.,$0.50,-0.02,-3.846%,"3,622,500"
REVB,"Revelation Biosciences, Inc. Common Stock",$1.38,0.03,2.222%,"3,619,903"
GCLWW,GCL Global Holdings Ltd Warrants,$0.0286,UNCH,--,"3,612,701"
PDYNW,Palladyne AI Corp Warrants,$0.0807,0.0008,1.001%,"3,608,050"
FLYE,"Fly-E Group, Inc. Common Stock",$2.20,0.01,0.457%,"3,591,249"
GLMD,Galmed Pharmaceuticals Ltd. Ordinary Shares,$0.6524,0.0774,13.461%,"3,574,650"
SHPH,"Shuttle Pharmaceuticals Holdings, Inc. Common Stock",$1.09,0.04,3.81%,"3,547,320"
DRMA,"Dermata Therapeutics, Inc. Common Stock",$1.2499,0.0399,3.298%,"3,543,895"
GRI,"GRI Bio, Inc. Common Stock",$2.44,0.04,1.667%,"3,525,871"
FRSX,Foresight Autonomous Holdings Ltd. American Depositary Shares,$0.8029,-0.007,-0.864%,"3,511,191"
ITP,"IT Tech Packaging, Inc. Common Stock",$0.2058,0.0092,4.68%,"3,491,483"
PPCB,"Propanc Biopharma, Inc. Common Stock",$0.2196,0.0096,4.571%,"3,482,698"
BQ,Boqii Holding Limited Class A Ordinary Shares,$1.245,0.115,10.177%,"3,473,172"
SLE,"Super League Enterprise, Inc. Common Stock",$3.57,0.215,6.408%,"3,418,885"
ICON,Icon Energy Corp. Common stock,$1.3573,-0.0427,-3.05%,"3,404,746"
ZEOWW,Zeo Energy Corporation Warrants,$0.059,UNCH,--,"3,396,090"
AQB,"AquaBounty Technologies, Inc. Common Stock",$0.8756,-0.0087,-0.984%,"3,395,310"
RKDA,"Arcadia Biosciences, Inc. Common Stock",$1.95,0.085,4.558%,"3,373,274"
ENVB,"Enveric Biosciences, Inc. Common Stock",$2.42,0.22,10.00%,"3,364,611"
IVDA,"Iveda Solutions, Inc. Common Stock",$0.301,0.0035,1.176%,"3,353,062"
