Symbol,Name,Last Sale,Net Change,% Change,Market Cap
CWT,California Water Service Group Common Stock,$45.70,0.31,0.683%,"2,723,324,284"
FRPT,"Freshpet, Inc. Common Stock",$55.79,2.17,4.047%,"2,723,017,121"
PLUG,"Plug Power, Inc. Common Stock",$1.95,-0.01,-0.51%,"2,716,143,041"
HP,"Helmerich & Payne, Inc. Common Stock",$27.58,0.83,3.103%,"2,715,206,127"
CON,"Concentra Group Holdings Parent, Inc. Common Stock",$21.16,0.64,3.119%,"2,712,081,474"
HWKN,"Hawkins, Inc. Common Stock",$129.73,3.55,2.813%,"2,710,090,705"
SFNC,Simmons First National Corporation Class A Common Stock,$18.72,0.58,3.197%,"2,709,113,491"
MEOH,Methanex Corporation Common Stock,$35.02,0.48,1.39%,"2,708,429,990"
RELY,"Remitly Global, Inc. Common Stock",$12.95,0.46,3.683%,"2,707,144,806"
AKR,Acadia Realty Trust Common Stock,$20.64,0.50,2.483%,"2,704,554,639"
BATRA,"Atlanta Braves Holdings, Inc. Series A Common Stock",$42.96,0.75,1.777%,"2,703,185,827"
BBAI,"BigBear.ai, Inc. Common Stock",$6.19,-0.08,-1.276%,"2,702,252,101"
NUVB,Nuvation Bio Inc. Class A Common Stock,$7.88,0.47,6.343%,"2,701,527,452"
BLKB,"Blackbaud, Inc. Common Stock",$56.41,1.53,2.788%,"2,698,326,037"
NMFCZ,New Mountain Finance Corporation 8.250% Notes due 2028,$25.21,0.07,0.278%,"2,681,359,827"
HSAI,"Hesai Group American Depositary Share, each ADS represents one Class B ordinary share",$20.22,2.00,10.977%,"2,678,496,166"
CBZ,"CBIZ, Inc. Common Stock",$49.22,-1.00,-1.991%,"2,677,638,089"
DXCM,"DexCom, Inc. Common Stock",$61.69,-0.52,-0.836%,"2,674,961,003"
BKD,Brookdale Senior Living Inc. Common Stock,$11.25,UNCH,--,"2,673,623,160"
SLNO,"Soleno Therapeutics, Inc. Common Stock",$49.77,3.86,8.408%,"2,673,147,944"
MANU,Manchester United Ltd. Class A Ordinary Shares,$15.49,0.22,1.441%,"2,670,923,026"
KAR,"OPENLANE, Inc. Common Stock",$25.10,0.47,1.908%,"2,667,205,994"
ZGN,Ermenegildo Zegna N.V. Ordinary Shares,$10.54,0.22,2.132%,"2,662,191,925"
IAC,IAC Inc. Common Stock,$34.37,1.15,3.462%,"2,661,373,722"
BOH,Bank of Hawaii Corporation Common Stock,$66.88,1.67,2.561%,"2,660,826,953"
ARMN,Aris Mining Corporation Common Shares,$13.12,0.33,2.58%,"2,659,424,000"
INSW,"International Seaways, Inc. Common Stock ",$53.84,-0.64,-1.175%,"2,659,401,549"
CENX,Century Aluminum Company Common Stock,$28.48,0.67,2.409%,"2,658,379,277"
APLS,"Apellis Pharmaceuticals, Inc. Common Stock",$21.00,0.87,4.322%,"2,657,029,578"
TDC,Teradata Corporation Common Stock,$28.50,0.83,3.00%,"2,656,200,000"
TERN,"Terns Pharmaceuticals, Inc. Common Stock",$29.345,1.305,4.654%,"2,643,391,173"
SUPN,"Supernus Pharmaceuticals, Inc. Common Stock",$46.08,0.93,2.06%,"2,642,197,248"
NSIT,"Insight Enterprises, Inc. Common Stock",$85.22,1.41,1.682%,"2,640,081,256"
WDFC,WD-40 Company Common Stock,$195.09,2.00,1.036%,"2,639,145,330"
FTAIN,FTAI Aviation Ltd. 8.25% Fixed - Rate Reset Series C Cumulative Perpetual Redeemable Preferred Shares,$25.6757,-0.0343,-0.133%,"2,633,631,650"
ABM,ABM Industries Incorporated Common Stock,$42.94,0.92,2.189%,"2,629,383,451"
DAN,Dana Incorporated Common Stock ,$22.45,0.54,2.465%,"2,622,998,867"
QFIN,"Qfin Holdings, Inc. American Depositary Shares",$19.48,1.32,7.269%,"2,622,008,000"
RCUS,"Arcus Biosciences, Inc. Common Stock",$24.28,1.10,4.745%,"2,621,597,454"
ALRM,"Alarm.com Holdings, Inc. Common Stock",$52.49,-0.14,-0.266%,"2,618,184,403"
SA,"Seabridge Gold, Inc. Ordinary Shares (Canada)",$25.17,0.15,0.60%,"2,613,709,055"
GSHD,"Goosehead Insurance, Inc. Class A Common Stock",$70.66,0.12,0.17%,"2,603,416,118"
QUBT,Quantum Computing Inc. Common Stock,$11.60,0.11,0.957%,"2,599,830,326"
SYNA,Synaptics Incorporated Common Stock $0.001 Par Value,$66.54,1.03,1.572%,"2,594,399,457"
TDW,Tidewater Inc. Common Stock,$52.19,-1.25,-2.339%,"2,586,701,164"
OCUL,"Ocular Therapeutix, Inc. Common Stock",$12.13,0.03,0.248%,"2,584,265,835"
LFST,"LifeStance Health Group, Inc. Common Stock",$6.63,0.14,2.157%,"2,579,071,863"
IPAR,"Interparfums, Inc. Common Stock",$80.31,0.74,0.93%,"2,575,118,306"
UPWK,Upwork Inc. Common Stock,$19.69,1.14,6.146%,"2,572,594,646"
REVG,"REV Group, Inc. Common Stock",$52.60,0.53,1.018%,"2,566,792,316"
MGRC,McGrath RentCorp Common Stock,$104.23,4.56,4.575%,"2,565,273,009"
ACLS,"Axcelis Technologies, Inc. Common Stock",$82.75,3.86,4.893%,"2,565,178,256"
MFAO,"MFA Financial, Inc. 9.000% Senior Notes due 2029",$24.97,0.02,0.08%,"2,563,637,489"
MFAN,"MFA Financial, Inc. 8.875% Senior Notes due 2029",$24.87,0.04,0.161%,"2,553,370,619"
FCPT,"Four Corners Property Trust, Inc. Common Stock",$24.03,0.07,0.292%,"2,549,150,772"
EWTX,"Edgewise Therapeutics, Inc. Common Stock",$24.06,0.58,2.47%,"2,547,194,522"
BWSN,"Babcock & Wilcox Enterprises, Inc. 8.125% Senior Notes due 2026",$25.1734,0.0334,0.133%,"2,544,968,864"
PFS,"Provident Financial Services, Inc Common Stock",$19.45,0.66,3.513%,"2,540,605,369"
PRK,Park National Corporation Common Stock,$157.75,2.86,1.846%,"2,536,345,831"
CHEF,"The Chefs' Warehouse, Inc. Common Stock",$62.14,2.56,4.297%,"2,528,200,015"
TOWN,TowneBank Common Stock,$33.80,0.93,2.829%,"2,522,065,754"
CURB,Curbline Properties Corp. Common Stock,$23.93,0.45,1.917%,"2,521,459,112"
KSS,Kohl's Corporation Common Stock,$22.42,6.69,42.53%,"2,512,714,393"
BEAM,Beam Therapeutics Inc. Common Stock,$24.69,1.07,4.53%,"2,505,416,367"
ITGR,Integer Holdings Corporation Common Stock,$71.43,0.21,0.295%,"2,502,794,769"
CGAU,Centerra Gold Inc. Common Shares,$12.36,0.10,0.816%,"2,493,396,174"
WAFD,"WaFd, Inc. Common Stock",$32.48,1.16,3.704%,"2,491,248,545"
HCM,HUTCHMED (China) Limited American Depositary Shares,$14.26,0.04,0.281%,"2,487,368,934"
FFBC,First Financial Bancorp. Common Stock,$25.23,0.93,3.827%,"2,485,904,180"
WSBCO,"WesBanco, Inc. Depositary Shares each representing 1/40th interest in a share of 7.375% Fixed-Rate Reset Non-Cumulative Perpetual Preferred Stock, Series B",$25.78,0.08,0.311%,"2,476,049,046"
BWNB,"Babcock & Wilcox Enterprises, Inc. 6.50% Senior Notes due 2026",$24.49,-0.04,-0.163%,"2,475,878,804"
OXLC,Oxford Lane Capital Corp. Common Stock,$14.23,0.29,2.08%,"2,470,328,000"
ATS,ATS Corporation Common Shares,$25.06,0.71,2.916%,"2,457,279,075"
OII,"Oceaneering International, Inc. Common Stock",$24.57,0.36,1.487%,"2,451,476,934"
DKL,"Delek Logistics Partners, L.P. Common Units representing Limited Partner Interests",$45.82,0.89,1.981%,"2,450,471,974"
WB,Weibo Corporation American Depositary Share,$10.00,0.08,0.806%,"2,448,252,800"
RNG,"RingCentral, Inc. Class A Common Stock",$28.27,0.76,2.763%,"2,447,184,493"
BATRK,"Atlanta Braves Holdings, Inc. Series C Common Stock",$38.89,0.84,2.208%,"2,447,087,915"
CMPO,"CompoSecure, Inc. Class A Common Stock",$19.54,0.50,2.626%,"2,446,317,452"
SPNT,SiriusPoint Ltd. Common Shares,$20.92,0.50,2.449%,"2,443,762,269"
WRBY,Warby Parker Inc. Class A Common Stock,$19.99,1.22,6.50%,"2,442,074,612"
FA,First Advantage Corporation Common Stock,$14.02,0.41,3.012%,"2,441,091,711"
ERO,Ero Copper Corp. Common Shares,$23.47,0.51,2.221%,"2,438,304,261"
GDV,Gabelli Dividend & Income Trust Common Shares of Beneficial Interest,$27.02,0.28,1.047%,"2,436,893,027"
BTE,Baytex Energy Corp Common Shares,$3.17,-0.07,-2.16%,"2,435,564,890"
MBLY,Mobileye Global Inc. Class A Common Stock,$11.25,0.03,0.267%,"2,430,066,803"
DRD,DRDGOLD Limited American Depositary Shares,$28.06,0.23,0.826%,"2,426,035,920"
UE,Urban Edge Properties Common Shares of Beneficial Interest,$19.24,0.31,1.638%,"2,421,424,688"
CLVT,Clarivate Plc Ordinary Shares,$3.66,0.20,5.78%,"2,420,852,353"
KWR,Quaker Houghton Common Stock,$139.28,3.13,2.299%,"2,415,120,075"
TXG,"10x Genomics, Inc. Class A Common Stock",$19.07,-1.06,-5.266%,"2,413,366,683"
SPNS,Sapiens International Corporation N.V. Common Shares (Cayman Islands),$43.15,0.14,0.326%,"2,411,533,759"
GT,The Goodyear Tire & Rubber Company Common Stock,$8.42,0.28,3.44%,"2,409,474,854"
VNET,"VNET Group, Inc. American Depositary Shares",$8.94,0.05,0.562%,"2,405,091,555"
MRX,Marex Group plc Ordinary Shares,$34.21,1.71,5.262%,"2,404,651,210"
PLUS,ePlus inc. Common Stock,$90.67,0.02,0.022%,"2,397,212,887"
CIVI,"Civitas Resources, Inc. Common Stock",$28.01,-0.01,-0.036%,"2,389,342,044"
DRVN,Driven Brands Holdings Inc. Common Stock,$14.46,0.34,2.408%,"2,378,007,992"
KMPR,Kemper Corporation,$40.57,1.40,3.574%,"2,375,246,110"
GENI,Genius Sports Limited Ordinary Shares,$9.90,0.76,8.315%,"2,374,193,319"
MFICL,MidCap Financial Investment Corporation 8.00% Notes due 2028,$25.43,-0.06,-0.235%,"2,372,711,107"
CUBI,"Customers Bancorp, Inc Common Stock",$69.33,1.40,2.061%,"2,368,872,778"
ASH,Ashland Inc. Common Stock,$51.79,1.67,3.332%,"2,367,741,072"
BB,BlackBerry Limited Common Stock,$4.00,-0.15,-3.614%,"2,361,444,336"
TRMK,Trustmark Corporation Common Stock,$39.20,0.77,2.004%,"2,350,363,596"
ZIM,ZIM Integrated Shipping Services Ltd. Ordinary Shares,$19.51,2.34,13.628%,"2,350,126,020"
BTDR,Bitdeer Technologies Group Class A Ordinary Shares,$11.92,0.40,3.472%,"2,345,214,096"
HUBG,"Hub Group, Inc. Class A Common Stock",$38.32,1.15,3.094%,"2,343,402,503"
CAKE,Cheesecake Factory Incorporated (The) Common Stock,$47.00,2.00,4.444%,"2,342,559,430"
HBI,Hanesbrands Inc. Common Stock,$6.62,0.06,0.915%,"2,342,170,279"
BHC,Bausch Health Companies Inc. Common Stock,$6.32,0.21,3.437%,"2,341,666,972"
CRGY,Crescent Energy Company Class A Common Stock,$9.19,0.03,0.328%,"2,340,064,321"
PINC,"Premier, Inc. Class A Common Stock",$28.26,0.09,0.319%,"2,336,662,161"
EXTR,"Extreme Networks, Inc. Common Stock",$17.47,0.39,2.283%,"2,336,061,828"
GRND,Grindr Inc. Common Stock,$12.61,0.45,3.701%,"2,329,497,266"
SBLK,Star Bulk Carriers Corp. Common Shares,$19.86,0.11,0.557%,"2,326,152,766"
OLN,Olin Corporation Common Stock,$20.30,0.49,2.473%,"2,316,667,039"
MSGE,Madison Square Garden Entertainment Corp. Class A Common Stock,$48.95,1.74,3.686%,"2,311,992,058"
MENS,Jyong Biotech Ltd. Ordinary Shares,$30.36,-5.04,-14.237%,"2,308,199,970"
PGNY,"Progyny, Inc. Common Stock",$26.77,0.44,1.671%,"2,307,885,978"
ODD,ODDITY Tech Ltd. Class A Ordinary Shares,$41.29,-0.48,-1.149%,"2,305,150,135"
DGNX,Diginex Limited Ordinary Shares,$11.38,-0.42,-3.559%,"2,298,192,184"
EXK,Endeavour Silver Corporation Ordinary Shares (Canada),$7.81,0.16,2.092%,"2,297,526,267"
DK,"Delek US Holdings, Inc. Common Stock",$38.24,0.19,0.499%,"2,296,371,387"
BKV,BKV Corporation Common Stock,$25.52,-0.38,-1.467%,"2,296,036,340"
DBD,Diebold Nixdorf Incorporated Common stock,$64.00,0.65,1.026%,"2,295,497,984"
FORTY,Formula Systems (1985) Ltd. American Depositary Shares,$149.75,UNCH,--,"2,293,820,633"
SKE,Skeena Resources Limited Common Shares,$18.87,0.22,1.18%,"2,285,031,231"
ADAMI,"Adamas Trust, Inc. 9.125% Senior Notes Due 2029",$25.22,0.1323,0.527%,"2,284,413,704"
PTRN,Pattern Group Inc. Series A Common Stock,$14.78,0.39,2.71%,"2,283,841,264"
KLIC,"Kulicke and Soffa Industries, Inc. Common Stock",$43.56,2.01,4.838%,"2,280,932,280"
PAX,Patria Investments Limited Class A Common Shares,$14.42,0.03,0.208%,"2,279,447,153"
HCI,"HCI Group, Inc. Common Stock",$175.60,1.07,0.613%,"2,275,782,497"
RXRX,"Recursion Pharmaceuticals, Inc. Class A Common Stock",$4.37,0.04,0.924%,"2,275,210,504"
FLO,"Flowers Foods, Inc. Common Stock",$10.77,0.37,3.558%,"2,274,389,483"
DXC,DXC Technology Company Common Stock ,$13.06,0.29,2.271%,"2,274,189,348"
SII,Sprott Inc. Common Shares,$87.83,0.86,0.989%,"2,266,014,000"
SYRE,"Spyre Therapeutics, Inc. Common Stock",$29.20,2.23,8.268%,"2,265,690,196"
ALKT,"Alkami Technology, Inc. Common Stock",$21.56,0.15,0.701%,"2,263,886,477"
PARR,"Par Pacific Holdings, Inc.  Common Stock",$45.00,0.39,0.874%,"2,263,096,935"
WRD,WeRide Inc. American Depositary Shares,$7.92,-0.34,-4.116%,"2,253,468,928"
EYE,"National Vision Holdings, Inc. Common Stock",$28.40,0.41,1.465%,"2,252,391,447"
NSA,National Storage Affiliates Trust Common Shares of Beneficial Interest,$29.26,0.67,2.343%,"2,251,872,042"
TGLS,Tecnoglass Inc. Ordinary Shares,$48.35,1.81,3.889%,"2,251,632,714"
UNFI,"United Natural Foods, Inc. Common Stock",$37.07,1.52,4.276%,"2,248,384,505"
ADAMM,"Adamas Trust, Inc. 7.875% Series E Fixed-to-Floating Rate Cumulative Redeemable Preferred Stock",$24.87,-0.03,-0.12%,"2,245,954,389"
BUSEP,"First Busey Corporation Depositary Shares, Each Representing a 1/40thInterest in a Share of 8.25% Fixed-Rate Series B Non-Cumulative Perpetual Preferred Stock, $0.001 par value",$25.40,0.03,0.118%,"2,245,589,692"
TMC,TMC the metals company Inc. Common Stock,$5.43,0.09,1.685%,"2,245,261,804"
AMBP,Ardagh Metal Packaging S.A. Ordinary Shares,$3.75,0.03,0.806%,"2,241,373,448"
IHS,IHS Holding Limited Ordinary Shares,$6.72,0.02,0.299%,"2,240,723,097"
AVDL,Avadel Pharmaceuticals plc Ordinary Share,$22.93,0.01,0.044%,"2,239,267,306"
HI,Hillenbrand Inc Common Stock,$31.74,0.02,0.063%,"2,237,886,435"
CMBT,CMB.TECH NV Ordinary Shares,$10.15,UNCH,--,"2,233,250,837"
CSGS,"CSG Systems International, Inc. Common Stock",$78.22,0.40,0.514%,"2,230,848,245"
ADUS,Addus HomeCare Corporation Common Stock,$120.49,4.59,3.96%,"2,227,049,323"
CNXC,Concentrix Corporation Common Stock,$35.74,0.39,1.103%,"2,225,080,870"
SONO,"Sonos, Inc. Common Stock",$18.48,0.84,4.762%,"2,222,047,230"
PMTU,PennyMac Mortgage Investment Trust 8.50% Senior Notes due 2028,$25.4999,-0.0001,0.00%,"2,218,914,700"
CSTM,Constellium SE Ordinary Shares (France),$16.10,0.56,3.604%,"2,218,608,642"
LU,"Lufax Holding Ltd American Depositary Shares, each representing two (2) Ordinary Shares",$2.56,0.05,1.992%,"2,218,598,400"
AORT,"Artivion, Inc. Common Stock",$46.83,1.02,2.227%,"2,218,568,393"
DNN,Denison Mines Corp Ordinary Shares (Canada),$2.47,0.15,6.466%,"2,216,307,636"
NBTB,NBT Bancorp Inc. Common Stock,$42.35,1.21,2.941%,"2,215,548,424"
XRAY,DENTSPLY SIRONA Inc. Common Stock,$11.09,0.36,3.355%,"2,213,031,336"
BANR,Banner Corporation Common Stock,$64.69,2.33,3.736%,"2,205,018,812"
ZLAB,Zai Lab Limited American Depositary Shares,$19.90,-0.03,-0.151%,"2,200,815,824"
IVT,InvenTrust Properties Corp. Common Stock,$28.29,0.24,0.856%,"2,195,852,260"
ATKR,Atkore Inc. Common Stock,$65.10,2.63,4.21%,"2,190,988,869"
WD,"Walker & Dunlop, Inc Common Stock",$64.25,3.20,5.242%,"2,188,626,906"
CSAN,Cosan S.A. ADS,$4.71,0.01,0.213%,"2,188,554,478"
SGRY,"Surgery Partners, Inc. Common Stock",$16.89,0.60,3.683%,"2,184,582,647"
SFB,Stifel Financial Corporation 5.20% Senior Notes due 2047,$21.31,0.01,0.047%,"2,177,315,282"
GEO,Geo Group Inc (The) REIT,$15.61,0.32,2.093%,"2,172,869,057"
BBT,Beacon Financial Corporation Common stock,$25.88,0.90,3.603%,"2,171,561,323"
AAUC,Allied Gold Corporation Common Shares,$17.47,0.51,3.007%,"2,166,280,000"
PTEN,"Patterson-UTI Energy, Inc. Common Stock",$5.71,0.12,2.147%,"2,165,471,957"
PK,Park Hotels & Resorts Inc. Common Stock ,$10.83,0.32,3.045%,"2,164,898,351"
STC,Stewart Information Services Corporation Common Stock,$77.17,1.99,2.647%,"2,162,627,746"
XNET,Xunlei Limited American Depositary Shares,$6.92,-0.08,-1.143%,"2,158,073,491"
FRME,First Merchants Corporation Common Stock,$37.21,0.66,1.806%,"2,151,668,994"
VCEL,Vericel Corporation Common Stock,$42.54,3.66,9.414%,"2,151,419,066"
MODG,Topgolf Callaway Brands Corp. Common Stock,$11.69,0.56,5.031%,"2,149,599,717"
ACMR,"ACM Research, Inc. Class A Common Stock",$33.10,1.09,3.405%,"2,147,410,528"
CENT,Central Garden & Pet Company Common Stock,$34.15,2.72,8.654%,"2,147,047,143"
AUPH,Aurinia Pharmaceuticals Inc Ordinary Shares,$16.28,0.17,1.055%,"2,146,364,301"
SAH,"Sonic Automotive, Inc. Common Stock",$62.79,2.05,3.375%,"2,145,702,828"
SOUNW,"SoundHound AI, Inc. Warrant",$5.10,-0.25,-4.673%,"2,142,488,891"
CEPU,Central Puerto S.A. American Depositary Shares (each represents ten Common Shares),$14.15,0.29,2.092%,"2,142,341,498"
NHC,National HealthCare Corporation Common Stock,$137.95,5.83,4.413%,"2,140,329,151"
ZBIO,"Zenas BioPharma, Inc. Common Stock",$39.86,1.61,4.209%,"2,139,651,557"
FBNC,First Bancorp Common Stock,$51.56,1.81,3.638%,"2,137,952,363"
IQ,"iQIYI, Inc. American Depositary Shares",$2.22,0.02,0.909%,"2,137,768,643"
HTH,Hilltop Holdings Inc.,$34.85,1.11,3.29%,"2,137,299,514"
RXO,"RXO, Inc. Common Stock",$13.00,0.84,6.908%,"2,133,454,336"
MGNI,"Magnite, Inc. Common Stock",$14.84,0.10,0.678%,"2,131,734,376"
NOG,"Northern Oil and Gas, Inc. Common Stock",$21.81,0.03,0.138%,"2,128,720,950"
TIC,"TIC Solutions, Inc. Common Stock",$9.62,0.27,2.888%,"2,121,784,439"
SM,SM Energy Company Common Stock,$18.50,0.07,0.38%,"2,119,252,552"
BUSE,First Busey Corporation Class A Common Stock,$23.97,0.76,3.274%,"2,119,164,761"
OSW,OneSpaWorld Holdings Limited Common Shares,$20.77,0.93,4.688%,"2,117,550,953"
MD,"Pediatrix Medical Group, Inc. Common Stock",$24.65,0.82,3.441%,"2,116,877,565"
KMT,Kennametal Inc. Common Stock,$27.80,0.68,2.507%,"2,115,389,181"
TRN,"Trinity Industries, Inc. Common Stock",$26.38,0.76,2.966%,"2,115,162,197"
FIHL,Fidelis Insurance Holdings Limited Common Shares,$18.90,0.06,0.318%,"2,112,516,107"
PHIN,PHINIA Inc. Common Stock,$54.91,1.19,2.215%,"2,110,887,229"
SLDE,"Slide Insurance Holdings, Inc. Common Stock",$16.90,-0.19,-1.112%,"2,100,497,603"
DIOD,Diodes Incorporated Common Stock,$45.19,-0.24,-0.528%,"2,096,153,108"
SEDG,"SolarEdge Technologies, Inc. Common Stock",$34.99,0.54,1.567%,"2,092,403,784"
DHT,"DHT Holdings, Inc.",$13.03,-0.29,-2.177%,"2,092,070,453"
JANX,"Janux Therapeutics, Inc. Common Stock",$34.74,3.21,10.181%,"2,089,534,815"
MQ,"Marqeta, Inc. Class A Common Stock",$4.73,-0.04,-0.839%,"2,081,669,438"
LION,Lionsgate Studios Corp Common Shares,$7.18,0.06,0.843%,"2,080,256,475"
TRMD,TORM plc Class A Common Stock,$21.26,-0.46,-2.118%,"2,079,526,724"
GCMG,GCM Grosvenor Inc. Class A Common Stock,$10.68,0.24,2.299%,"2,074,017,872"
GPCR,Structure Therapeutics Inc. American Depositary Shares,$34.17,-1.13,-3.201%,"2,073,354,959"
BUR,Burford Capital Limited Ordinary Shares,$9.42,0.29,3.176%,"2,061,205,187"
MESO,Mesoblast Limited American Depositary Shares,$16.06,0.44,2.817%,"2,057,554,507"
SID,Companhia Siderurgica Nacional S.A. Common Stock,$1.55,0.06,4.027%,"2,055,445,618"
DQ,"DAQO New Energy Corp. American Depositary Shares, each representing five ordinary shares",$30.65,-0.08,-0.26%,"2,055,288,315"
GLPG,Galapagos NV American Depositary Shares,$31.12,0.07,0.225%,"2,050,716,850"
MTRN,Materion Corporation,$120.74,2.93,2.487%,"2,049,908,386"
EFSC,Enterprise Financial Services Corporation Common Stock,$55.36,1.56,2.90%,"2,048,923,922"
IBRX,"ImmunityBio, Inc. Common Stock",$2.08,-0.07,-3.256%,"2,048,727,572"
UMBFO,"UMB Financial Corporation Depositary Shares Each Representing a 1/400th Interest in a Share of 7.750% Fixed-Rate Reset Non-Cumulative Perpetual Preferred Stock, Series B",$26.8934,0.2734,1.027%,"2,042,679,053"
AMR,"Alpha Metallurgical Resources, Inc. Common Stock",$158.78,5.43,3.541%,"2,041,597,051"
DEI,"Douglas Emmett, Inc. Common Stock",$12.18,0.49,4.192%,"2,039,687,879"
TNK,Teekay Tankers Ltd.,$59.27,-1.72,-2.82%,"2,037,831,927"
TSLX,"Sixth Street Specialty Lending, Inc. Common Stock",$21.56,0.34,1.602%,"2,037,289,023"
HRMY,"Harmony Biosciences Holdings, Inc. Common Stock",$35.34,0.07,0.198%,"2,035,455,292"
SAM,"Boston Beer Company, Inc. (The) Common Stock",$190.96,-1.57,-0.815%,"2,035,321,953"
PAYO,Payoneer Global Inc. Common Stock,$5.70,0.19,3.448%,"2,031,709,733"
SRPT,"Sarepta Therapeutics, Inc. Common Stock (DE)",$19.35,0.44,2.327%,"2,027,632,068"
NWN,Northwest Natural Holding Company Common Stock,$48.85,0.36,0.742%,"2,027,619,002"
HE,"Hawaiian Electric Industries, Inc. Common Stock",$11.73,0.25,2.178%,"2,024,838,183"
DX,"Dynex Capital, Inc. Common Stock",$13.79,0.26,1.922%,"2,024,671,864"
ADAML,"Adamas Trust, Inc. 6.875% Series F Fixed-to-Floating Rate Cumulative Redeemable Preferred Stock, $0.01 par value per share",$22.34,0.10,0.45%,"2,017,475,716"
OI,"O-I Glass, Inc. Common Stock",$13.13,0.49,3.877%,"2,016,695,916"
EPAC,Enerpac Tool Group Corp. Common Stock,$38.04,0.77,2.066%,"2,015,418,010"
CIMN,Chimera Investment Corporation 9.000% Senior Notes due 2029,$25.0222,0.0422,0.169%,"2,015,055,181"
ADAMN,"Adamas Trust, Inc. 8.00% Series D Fixed-to-Floating Rate Cumulative Redeemable Preferred Stock",$22.25,0.1294,0.585%,"2,009,348,016"
LC,LendingClub Corporation Common Stock,$17.41,0.61,3.631%,"2,007,398,070"
ESTA,Establishment Labs Holdings Inc. Common Shares,$69.00,-0.14,-0.202%,"2,004,992,892"
NTB,Bank of N.T. Butterfield & Son Limited (The) Voting Ordinary Shares,$46.52,0.57,1.24%,"2,000,360,000"
SKWD,"Skyward Specialty Insurance Group, Inc. Common Stock",$49.29,0.74,1.524%,"1,995,622,221"
ALG,"Alamo Group, Inc. Common Stock",$163.64,3.76,2.352%,"1,982,568,638"
HWCPZ,Hancock Whitney Corporation 6.25% Subordinated Notes due 2060,$23.35,-0.10,-0.426%,"1,979,028,736"
SYBT,"Stock Yards Bancorp, Inc. Common Stock",$67.05,1.41,2.148%,"1,976,195,359"
SION,"Sionna Therapeutics, Inc. Common Stock",$44.28,-0.10,-0.225%,"1,976,162,733"
SMPL,The Simply Good Foods Company Common Stock,$19.74,-0.44,-2.18%,"1,971,193,979"
PGY,Pagaya Technologies Ltd. Class A Ordinary Shares,$23.86,0.39,1.662%,"1,966,614,856"
ZYME,Zymeworks Inc. Common Stock,$26.18,1.19,4.762%,"1,959,220,460"
AI,"C3.ai, Inc. Class A Common Stock",$14.18,0.66,4.882%,"1,954,708,689"
SBET,"SharpLink Gaming, Inc. Common Stock",$9.93,-0.15,-1.488%,"1,953,163,387"
OGN,Organon & Co. Common Stock ,$7.51,0.45,6.374%,"1,952,471,669"
ASGN,ASGN Incorporated Common Stock,$45.60,1.04,2.334%,"1,947,120,000"
CENTA,Central Garden & Pet Company Class A Common Stock Nonvoting,$30.93,2.34,8.185%,"1,944,602,288"
PENN,"PENN Entertainment, Inc. Common Stock",$14.57,0.86,6.273%,"1,941,452,092"
TALO,"Talos Energy, Inc. Common Stock",$11.41,0.16,1.422%,"1,939,571,889"
IMAX,Imax Corporation Common Stock,$36.03,0.03,0.083%,"1,938,375,592"
NTCT,"NetScout Systems, Inc. Common Stock",$26.84,0.45,1.705%,"1,937,678,183"
JSM,"Navient Corporation 6% Senior Notes due December 15, 2043",$19.42,0.1399,0.726%,"1,930,950,758"
GEL,"Genesis Energy, L.P. Common Units",$15.75,0.66,4.374%,"1,928,813,009"
PNFPP,"Pinnacle Financial Partners, Inc. Depositary shares of Pinnacle Financial Partners, Inc., each representing a 1/40th Interest in a share of its 6.75% Fixed-Rate Non-Cumulative Perpetual Preferred Stock, Series B",$24.86,-0.0778,-0.312%,"1,928,525,861"
AVAH,Aveanna Healthcare Holdings Inc. Common Stock,$9.23,0.19,2.102%,"1,928,252,065"
SEM,Select Medical Holdings Corporation Common Stock,$15.57,1.56,11.135%,"1,927,839,892"
WLYB,"John Wiley & Sons, Inc. Common Stock",$36.11,2.68,8.017%,"1,921,142,961"
PRKS,United Parks & Resorts Inc. Common Stock,$35.21,1.48,4.388%,"1,920,727,013"
SEZL,Sezzle Inc. Common Stock,$56.21,2.78,5.203%,"1,919,745,863"
WLY,"John Wiley & Sons, Inc. Common Stock",$36.07,1.04,2.969%,"1,919,014,860"
IMCR,Immunocore Holdings plc American Depositary Shares,$39.87,1.18,3.05%,"1,917,282,355"
HBNB,Hotel101 Global Holdings Corp. Class A Ordinary Shares,$8.18,0.35,4.47%,"1,915,366,616"
ATRC,"AtriCure, Inc. Common Stock",$38.48,0.74,1.961%,"1,913,109,698"
QDEL,QuidelOrtho Corporation Common Stock,$28.135,1.555,5.85%,"1,911,253,878"
KN,Knowles Corporation Common Stock,$22.43,0.59,2.701%,"1,909,956,758"
BELFB,Bel Fuse Inc. Class B Common Stock,$150.84,4.96,3.40%,"1,909,719,323"
UAA,"Under Armour, Inc. Class A Common Stock",$4.50,0.10,2.273%,"1,907,502,129"
EVTC,"Evertec, Inc. Common Stock",$29.80,0.85,2.936%,"1,906,718,462"
WBTN,WEBTOON Entertainment Inc. Common stock,$14.55,0.27,1.891%,"1,902,640,586"
TWST,Twist Bioscience Corporation Common Stock,$31.11,1.78,6.069%,"1,902,315,089"
MNR,Mach Natural Resources LP Common Units representing Limited Partner Interests,$11.29,-0.22,-1.911%,"1,901,493,536"
SLVM,Sylvamo Corporation Common Stock,$48.03,2.22,4.846%,"1,894,219,484"
LMAT,"LeMaitre Vascular, Inc. Common Stock",$83.49,-0.79,-0.937%,"1,894,053,639"
HNI,HNI Corporation Common Stock,$41.28,0.91,2.254%,"1,891,914,454"
VAC,Marriott Vacations Worldwide Corporation Common Stock,$54.62,2.50,4.797%,"1,890,616,188"
DNTH,"Dianthus Therapeutics, Inc. Common Stock",$44.09,0.41,0.939%,"1,890,403,501"
CCS,"Century Communities, Inc. Common Stock",$64.14,4.11,6.847%,"1,884,708,296"
RAMP,"LiveRamp Holdings, Inc. Common Stock",$29.61,0.89,3.099%,"1,884,642,271"
CTRI,"Centuri Holdings, Inc. Common Stock",$21.25,0.73,3.558%,"1,883,794,523"
TPB,"Turning Point Brands, Inc. Common Stock",$98.76,1.92,1.983%,"1,883,427,961"
VERA,"Vera Therapeutics, Inc. Class A Common Stock",$29.43,0.19,0.65%,"1,881,402,982"
PDO,PIMCO Dynamic Income Opportunities Fund Common Shares of Beneficial Interest,$13.88,0.06,0.434%,"1,881,330,525"
NIC,Nicolet Bankshares Inc. Common Stock,$126.76,4.15,3.385%,"1,875,911,099"
NGVT,Ingevity Corporation Common Stock ,$52.16,1.20,2.355%,"1,875,883,909"
ABLLL,"Abacus Global Management, Inc. 9.875% Fixed Rate Senior Notes due 2028",$25.1102,0.028,0.112%,"1,874,510,253"
EXPI,"eXp World Holdings, Inc. Common Stock",$11.80,0.07,0.597%,"1,874,273,343"
BWLP,BW LPG Limited Common Shares,$12.35,-0.04,-0.323%,"1,871,499,771"
ANIP,"ANI Pharmaceuticals, Inc.",$83.22,2.24,2.766%,"1,868,968,741"
AGM,Federal Agricultural Mortgage Corporation Common Stock,$171.35,3.95,2.36%,"1,868,524,286"
OZKAP,Bank OZK 4.625% Series A Non-Cumulative Perpetual Preferred Stock,$16.50,0.17,1.041%,"1,866,746,178"
NN,NextNav Inc. Common Stock,$13.84,0.88,6.79%,"1,866,034,578"
HMN,Horace Mann Educators Corporation Common Stock,$45.85,0.62,1.371%,"1,865,405,783"
TY,Tri Continental Corporation Common Stock,$34.31,0.35,1.031%,"1,864,780,580"
SCS,Steelcase Inc. Common Stock,$16.24,0.27,1.691%,"1,863,403,097"
DRH,Diamondrock Hospitality Company Common Stock,$9.13,0.29,3.281%,"1,859,810,052"
SDRL,Seadrill Limited Common Shares,$29.81,-0.30,-0.996%,"1,859,374,038"
GRDN,"Guardian Pharmacy Services, Inc. Class A Common Stock",$29.36,0.68,2.371%,"1,859,093,814"
NOMD,Nomad Foods Limited Ordinary Shares,$12.09,0.06,0.499%,"1,854,641,992"
POWI,"Power Integrations, Inc. Common Stock",$33.51,0.29,0.873%,"1,854,314,789"
CXW,"CoreCivic, Inc. Common Stock",$17.72,0.38,2.191%,"1,853,240,087"
IOSP,Innospec Inc. Common Stock,$74.53,3.48,4.898%,"1,846,673,186"
