Symbol,Name,Last Sale,Net Change,% Change,Market Cap
FTAIM,FTAI Aviation Ltd. 9.500% Fixed-Rate Reset Series D Cumulative Perpetual Redeemable Preferred Shares,$27.09,0.20,0.744%,"2,778,700,538"
BBAI,"BigBear.ai, Inc. Common Stock",$6.34,0.32,5.316%,"2,767,734,786"
RNW,ReNew Energy Global plc Class A Ordinary Shares,$7.61,0.02,0.264%,"2,760,673,186"
EWTX,"Edgewise Therapeutics, Inc. Common Stock",$26.04,0.52,2.038%,"2,756,814,021"
KSS,Kohl's Corporation Common Stock,$24.59,0.49,2.033%,"2,755,916,455"
VTMX,"Corporacion Inmobiliaria Vesta, S.A.B de C.V. American Depositary Shares, each representing ten (10) Common Shares",$31.15,-0.17,-0.543%,"2,755,175,261"
MEOH,Methanex Corporation Common Stock,$35.61,0.91,2.622%,"2,754,060,307"
NUVB,Nuvation Bio Inc. Class A Common Stock,$8.03,0.02,0.25%,"2,752,952,467"
DXCM,"DexCom, Inc. Common Stock",$63.47,0.94,1.503%,"2,752,144,186"
LCII,LCI Industries,$113.67,-2.05,-1.772%,"2,750,587,797"
HP,"Helmerich & Payne, Inc. Common Stock",$27.90,0.17,0.613%,"2,746,709,607"
HTFL,"Heartflow, Inc. Common Stock",$32.25,0.82,2.609%,"2,746,368,688"
MANU,Manchester United Ltd. Class A Ordinary Shares,$15.90,0.28,1.793%,"2,741,618,858"
BATRA,"Atlanta Braves Holdings, Inc. Series A Common Stock",$43.57,0.28,0.647%,"2,741,569,052"
NATL,NCR Atleos Corporation Common Stock,$37.07,0.15,0.406%,"2,739,626,322"
RHI,Robert Half Inc. Common Stock,$27.04,-0.23,-0.843%,"2,736,080,013"
WOR,"Worthington Enterprises, Inc. Common Shares",$54.86,-0.56,-1.01%,"2,724,624,972"
HWKN,"Hawkins, Inc. Common Stock",$130.02,-1.02,-0.778%,"2,716,148,875"
IAC,IAC Inc. Common Stock,$35.07,0.45,1.30%,"2,715,576,853"
SLNO,"Soleno Therapeutics, Inc. Common Stock",$50.45,0.90,1.816%,"2,709,670,761"
AERO,"Grupo Aeromexico, S.A.B. de C.V. American Depositary Shares (each representing ten (10) Common Shares)",$18.54,-0.06,-0.323%,"2,705,049,203"
CWT,California Water Service Group Common Stock,$45.37,-0.13,-0.286%,"2,703,659,141"
KAR,"OPENLANE, Inc. Common Stock",$25.44,0.24,0.952%,"2,703,335,477"
BLKB,"Blackbaud, Inc. Common Stock",$56.38,-0.48,-0.844%,"2,696,891,012"
AKR,Acadia Realty Trust Common Stock,$20.57,0.08,0.39%,"2,695,382,216"
ZGN,Ermenegildo Zegna N.V. Ordinary Shares,$10.67,-0.04,-0.373%,"2,695,027,309"
APLS,"Apellis Pharmaceuticals, Inc. Common Stock",$21.30,-0.29,-1.343%,"2,694,987,143"
CVBF,CVB Financial Corporation Common Stock,$19.68,-0.26,-1.304%,"2,692,402,458"
SFNC,Simmons First National Corporation Class A Common Stock,$18.55,-0.08,-0.429%,"2,684,511,499"
NSIT,"Insight Enterprises, Inc. Common Stock",$86.57,-0.20,-0.23%,"2,681,903,712"
CGAU,Centerra Gold Inc. Common Shares,$13.28,0.35,2.707%,"2,678,988,769"
NMFCZ,New Mountain Finance Corporation 8.250% Notes due 2028,$25.18,-0.07,-0.277%,"2,678,168,998"
TDW,Tidewater Inc. Common Stock,$54.02,1.36,2.583%,"2,677,401,741"
SYNA,Synaptics Incorporated Common Stock $0.001 Par Value,$68.51,0.77,1.137%,"2,671,209,901"
TDC,Teradata Corporation Common Stock,$28.64,0.38,1.345%,"2,669,248,000"
CBZ,"CBIZ, Inc. Common Stock",$48.70,-0.30,-0.612%,"2,649,349,349"
WDFC,WD-40 Company Common Stock,$195.80,-1.23,-0.624%,"2,648,750,093"
FTAIN,FTAI Aviation Ltd. 8.25% Fixed - Rate Reset Series C Cumulative Perpetual Redeemable Preferred Shares,$25.79,0.10,0.389%,"2,645,355,736"
BKD,Brookdale Senior Living Inc. Common Stock,$11.13,0.01,0.09%,"2,645,104,513"
BTDR,Bitdeer Technologies Group Class A Ordinary Shares,$13.41,0.74,5.841%,"2,638,365,858"
GSHD,"Goosehead Insurance, Inc. Class A Common Stock",$71.55,-0.20,-0.279%,"2,636,207,519"
ERO,Ero Copper Corp. Common Shares,$25.37,1.19,4.921%,"2,635,695,744"
CON,"Concentra Group Holdings Parent, Inc. Common Stock",$20.56,-0.27,-1.296%,"2,635,179,353"
ABM,ABM Industries Incorporated Common Stock,$43.00,0.02,0.047%,"2,633,057,485"
QFIN,"Qfin Holdings, Inc. American Depositary Shares",$19.53,-0.20,-1.014%,"2,628,738,000"
QUBT,Quantum Computing Inc. Common Stock,$11.70,0.24,2.094%,"2,622,242,657"
DAN,Dana Incorporated Common Stock ,$22.41,-0.07,-0.311%,"2,618,325,372"
AAUC,Allied Gold Corporation Common Shares,$21.11,1.90,9.891%,"2,617,640,000"
INSW,"International Seaways, Inc. Common Stock ",$52.97,-0.12,-0.226%,"2,616,428,307"
SUPN,"Supernus Pharmaceuticals, Inc. Common Stock",$45.59,-0.67,-1.448%,"2,614,100,967"
DRD,DRDGOLD Limited American Depositary Shares,$30.18,0.76,2.583%,"2,609,328,727"
BOH,Bank of Hawaii Corporation Common Stock,$65.54,-0.86,-1.295%,"2,607,514,930"
IPAR,"Interparfums, Inc. Common Stock",$81.27,0.35,0.433%,"2,605,900,445"
OXLC,Oxford Lane Capital Corp. Common Stock,$14.99,0.19,1.284%,"2,602,264,000"
REVG,"REV Group, Inc. Common Stock",$53.27,0.35,0.661%,"2,599,487,199"
ALRM,"Alarm.com Holdings, Inc. Common Stock",$51.96,0.25,0.483%,"2,591,748,173"
OCUL,"Ocular Therapeutix, Inc. Common Stock",$12.15,0.01,0.082%,"2,588,526,785"
UPWK,Upwork Inc. Common Stock,$19.74,0.16,0.817%,"2,579,127,390"
MFAO,"MFA Financial, Inc. 9.000% Senior Notes due 2029",$25.07,0.0201,0.08%,"2,573,904,359"
BEAM,Beam Therapeutics Inc. Common Stock,$25.33,0.30,1.199%,"2,570,360,332"
ACLS,"Axcelis Technologies, Inc. Common Stock",$82.77,0.64,0.779%,"2,565,798,238"
MFAN,"MFA Financial, Inc. 8.875% Senior Notes due 2029",$24.97,0.06,0.241%,"2,563,637,489"
GENVR,Gen Digital Inc. Contingent Value Rights,$4.14,-0.53,-11.349%,"2,553,204,683"
MBLY,Mobileye Global Inc. Class A Common Stock,$11.82,0.38,3.322%,"2,553,190,187"
FCPT,"Four Corners Property Trust, Inc. Common Stock",$24.04,0.03,0.125%,"2,550,211,593"
HSAI,"Hesai Group American Depositary Share, each ADS represents one Class B ordinary share",$19.23,0.50,2.67%,"2,547,353,179"
BWSN,"Babcock & Wilcox Enterprises, Inc. 8.125% Senior Notes due 2026",$25.16,0.0099,0.039%,"2,543,614,157"
MGRC,McGrath RentCorp Common Stock,$103.08,-0.80,-0.77%,"2,536,969,604"
TERN,"Terns Pharmaceuticals, Inc. Common Stock",$28.11,-0.64,-2.226%,"2,532,142,644"
ITGR,Integer Holdings Corporation Common Stock,$72.18,0.14,0.194%,"2,529,073,589"
LFST,"LifeStance Health Group, Inc. Common Stock",$6.50,-0.06,-0.915%,"2,528,501,827"
CURB,Curbline Properties Corp. Common Stock,$23.94,0.02,0.084%,"2,522,512,793"
SKE,Skeena Resources Limited Common Shares,$20.83,1.26,6.438%,"2,522,374,168"
HCM,HUTCHMED (China) Limited American Depositary Shares,$14.42,0.10,0.698%,"2,515,277,702"
CIVI,"Civitas Resources, Inc. Common Stock",$29.37,0.92,3.234%,"2,505,354,367"
PFS,"Provident Financial Services, Inc Common Stock",$19.18,-0.07,-0.364%,"2,505,337,325"
BATRK,"Atlanta Braves Holdings, Inc. Series C Common Stock",$39.80,0.46,1.169%,"2,504,348,136"
TOWN,TowneBank Common Stock,$33.55,-0.11,-0.327%,"2,503,411,422"
ATS,ATS Corporation Common Shares,$25.51,-0.11,-0.429%,"2,501,404,198"
CHEF,"The Chefs' Warehouse, Inc. Common Stock",$61.32,-0.67,-1.081%,"2,494,837,865"
CMPO,"CompoSecure, Inc. Class A Common Stock",$19.87,0.40,2.054%,"2,487,631,922"
CLVT,Clarivate Plc Ordinary Shares,$3.76,0.01,0.267%,"2,486,995,859"
BKV,BKV Corporation Common Stock,$27.61,1.22,4.623%,"2,484,073,798"
GT,The Goodyear Tire & Rubber Company Common Stock,$8.66,0.22,2.607%,"2,478,153,472"
WSBCO,"WesBanco, Inc. Depositary Shares each representing 1/40th interest in a share of 7.375% Fixed-Rate Reset Non-Cumulative Perpetual Preferred Stock, Series B",$25.78,0.01,0.039%,"2,476,049,046"
BTE,Baytex Energy Corp Common Shares,$3.22,0.06,1.899%,"2,473,980,740"
FBYD,"Falcon's Beyond Global, Inc. Class A Common Stock",$20.42,3.94,23.908%,"2,472,085,877"
GDV,Gabelli Dividend & Income Trust Common Shares of Beneficial Interest,$27.40,0.26,0.958%,"2,471,164,653"
PRK,Park National Corporation Common Stock,$153.55,-1.34,-0.865%,"2,468,817,130"
BWNB,"Babcock & Wilcox Enterprises, Inc. 6.50% Senior Notes due 2026",$24.32,-0.17,-0.694%,"2,458,692,221"
ZIM,ZIM Integrated Shipping Services Ltd. Ordinary Shares,$20.41,0.71,3.604%,"2,458,537,779"
DKL,"Delek Logistics Partners, L.P. Common Units representing Limited Partner Interests",$45.84,-0.49,-1.058%,"2,451,541,582"
FFBC,First Financial Bancorp. Common Stock,$24.88,-0.18,-0.718%,"2,451,418,787"
MRX,Marex Group plc Ordinary Shares,$34.79,0.01,0.029%,"2,445,419,924"
RNG,"RingCentral, Inc. Class A Common Stock",$28.24,0.32,1.146%,"2,444,587,552"
OII,"Oceaneering International, Inc. Common Stock",$24.40,-0.06,-0.245%,"2,434,515,148"
WB,Weibo Corporation American Depositary Share,$9.94,0.08,0.811%,"2,433,563,283"
SPNT,SiriusPoint Ltd. Common Shares,$20.80,-0.13,-0.621%,"2,429,744,512"
WAFD,"WaFd, Inc. Common Stock",$31.66,-0.61,-1.89%,"2,428,353,723"
WRBY,Warby Parker Inc. Class A Common Stock,$19.81,0.15,0.763%,"2,420,084,946"
UE,Urban Edge Properties Common Shares of Beneficial Interest,$19.22,-0.01,-0.052%,"2,418,907,614"
ASH,Ashland Inc. Common Stock,$52.90,0.36,0.685%,"2,418,488,178"
SPNS,Sapiens International Corporation N.V. Common Shares (Cayman Islands),$43.27,0.12,0.278%,"2,418,240,226"
FA,First Advantage Corporation Common Stock,$13.88,0.06,0.434%,"2,416,715,617"
ODD,ODDITY Tech Ltd. Class A Ordinary Shares,$43.26,0.22,0.511%,"2,415,131,869"
GENI,Genius Sports Limited Ordinary Shares,$10.07,0.21,2.13%,"2,414,962,295"
RXRX,"Recursion Pharmaceuticals, Inc. Class A Common Stock",$4.63,0.22,4.989%,"2,410,577,720"
BB,BlackBerry Limited Common Stock,$4.08,0.01,0.246%,"2,408,673,223"
OLN,Olin Corporation Common Stock,$21.10,0.33,1.589%,"2,407,964,262"
CEPU,Central Puerto S.A. American Depositary Shares (each represents ten Common Shares),$15.90,1.03,6.927%,"2,407,295,393"
CMBT,CMB.TECH NV Ordinary Shares,$10.94,0.81,7.996%,"2,407,070,360"
VNET,"VNET Group, Inc. American Depositary Shares",$8.94,0.03,0.337%,"2,405,091,555"
DRVN,Driven Brands Holdings Inc. Common Stock,$14.61,-0.06,-0.409%,"2,402,676,125"
CRGY,Crescent Energy Company Class A Common Stock,$9.43,0.18,1.946%,"2,401,175,903"
KWR,Quaker Houghton Common Stock,$137.85,-0.80,-0.577%,"2,390,323,825"
KMPR,Kemper Corporation,$40.72,-0.37,-0.90%,"2,384,028,139"
PAX,Patria Investments Limited Class A Common Shares,$15.07,0.33,2.239%,"2,382,196,157"
TXG,"10x Genomics, Inc. Class A Common Stock",$18.81,0.06,0.32%,"2,380,462,889"
MFICL,MidCap Financial Investment Corporation 8.00% Notes due 2028,$25.49,0.01,0.039%,"2,378,309,325"
CAKE,Cheesecake Factory Incorporated (The) Common Stock,$47.66,-0.08,-0.168%,"2,375,454,945"
GRND,Grindr Inc. Common Stock,$12.83,-0.11,-0.85%,"2,370,138,772"
PLUS,ePlus inc. Common Stock,$89.60,-0.39,-0.433%,"2,368,923,290"
MODG,Topgolf Callaway Brands Corp. Common Stock,$12.88,0.16,1.258%,"2,368,421,245"
IHS,IHS Holding Limited Ordinary Shares,$7.10,0.23,3.348%,"2,367,430,653"
SII,Sprott Inc. Common Shares,$91.59,1.37,1.519%,"2,363,022,000"
KLIC,"Kulicke and Soffa Industries, Inc. Common Stock",$45.11,0.15,0.334%,"2,362,094,930"
HUBG,"Hub Group, Inc. Class A Common Stock",$38.57,-0.21,-0.542%,"2,358,690,881"
CUBI,"Customers Bancorp, Inc Common Stock",$68.90,-0.05,-0.073%,"2,354,180,505"
BHC,Bausch Health Companies Inc. Common Stock,$6.35,0.10,1.60%,"2,352,782,480"
WRD,WeRide Inc. American Depositary Shares,$8.24,0.20,2.488%,"2,344,518,177"
EXTR,"Extreme Networks, Inc. Common Stock",$17.50,0.02,0.114%,"2,340,073,383"
MSGE,Madison Square Garden Entertainment Corp. Class A Common Stock,$49.47,0.51,1.042%,"2,336,552,545"
DGNX,Diginex Limited Ordinary Shares,$11.55,0.07,0.61%,"2,332,523,701"
TRMK,Trustmark Corporation Common Stock,$38.90,-0.19,-0.486%,"2,332,376,120"
SBLK,Star Bulk Carriers Corp. Common Shares,$19.90,0.16,0.811%,"2,330,837,867"
SYRE,"Spyre Therapeutics, Inc. Common Stock",$30.00,0.25,0.84%,"2,327,763,900"
IBRX,"ImmunityBio, Inc. Common Stock",$2.36,0.23,10.798%,"2,324,517,822"
DK,"Delek US Holdings, Inc. Common Stock",$38.67,-0.22,-0.566%,"2,322,193,555"
TGLS,Tecnoglass Inc. Ordinary Shares,$49.78,0.70,1.426%,"2,318,227,022"
CSTM,Constellium SE Ordinary Shares (France),$16.81,0.20,1.204%,"2,316,447,905"
DBD,Diebold Nixdorf Incorporated Common stock,$64.52,-0.14,-0.217%,"2,314,148,905"
HCI,"HCI Group, Inc. Common Stock",$177.75,1.25,0.708%,"2,303,646,577"
DXC,DXC Technology Company Common Stock ,$13.20,0.09,0.686%,"2,298,568,100"
ADAMI,"Adamas Trust, Inc. 9.125% Senior Notes Due 2029",$25.36,0.10,0.396%,"2,297,094,827"
DNN,Denison Mines Corp Ordinary Shares (Canada),$2.56,UNCH,--,"2,297,063,785"
PARR,"Par Pacific Holdings, Inc.  Common Stock",$45.65,0.90,2.011%,"2,295,786,113"
FORTY,Formula Systems (1985) Ltd. American Depositary Shares,$149.75,UNCH,--,"2,293,820,633"
HBI,Hanesbrands Inc. Common Stock,$6.47,-0.12,-1.821%,"2,289,099,956"
EYE,"National Vision Holdings, Inc. Common Stock",$28.85,-0.16,-0.552%,"2,288,080,748"
PGNY,"Progyny, Inc. Common Stock",$26.37,-0.33,-1.236%,"2,273,401,316"
CSAN,Cosan S.A. ADS,$4.89,-0.08,-1.61%,"2,272,193,503"
NSA,National Storage Affiliates Trust Common Shares of Beneficial Interest,$29.45,-0.02,-0.068%,"2,266,494,588"
FLO,"Flowers Foods, Inc. Common Stock",$10.73,-0.11,-1.015%,"2,265,942,354"
UNFI,"United Natural Foods, Inc. Common Stock",$37.31,-0.32,-0.85%,"2,262,941,081"
XRAY,DENTSPLY SIRONA Inc. Common Stock,$11.34,0.05,0.443%,"2,262,919,328"
ZLAB,Zai Lab Limited American Depositary Shares,$20.41,0.44,2.203%,"2,257,218,642"
XNET,Xunlei Limited American Depositary Shares,$7.23,0.22,3.138%,"2,254,750,193"
CNXC,Concentrix Corporation Common Stock,$36.21,0.70,1.971%,"2,254,341,866"
ATKR,Atkore Inc. Common Stock,$66.95,0.06,0.09%,"2,253,251,994"
BUSEP,"First Busey Corporation Depositary Shares, Each Representing a 1/40thInterest in a Share of 8.25% Fixed-Rate Series B Non-Cumulative Perpetual Preferred Stock, $0.001 par value",$25.45,UNCH,--,"2,250,010,144"
PTRN,Pattern Group Inc. Series A Common Stock,$14.54,-0.18,-1.223%,"2,246,755,885"
CSGS,"CSG Systems International, Inc. Common Stock",$78.77,0.27,0.344%,"2,246,534,342"
HI,Hillenbrand Inc Common Stock,$31.84,0.17,0.537%,"2,244,937,117"
PMTU,PennyMac Mortgage Investment Trust 8.50% Senior Notes due 2028,$25.79,0.2581,1.011%,"2,244,158,217"
ADAMM,"Adamas Trust, Inc. 7.875% Series E Fixed-to-Floating Rate Cumulative Redeemable Preferred Stock",$24.84,-0.06,-0.241%,"2,243,245,156"
AMBP,Ardagh Metal Packaging S.A. Ordinary Shares,$3.75,UNCH,--,"2,241,373,448"
ALKT,"Alkami Technology, Inc. Common Stock",$21.32,0.34,1.621%,"2,238,685,515"
SRPT,"Sarepta Therapeutics, Inc. Common Stock (DE)",$21.34,0.39,1.862%,"2,236,158,571"
SONO,"Sonos, Inc. Common Stock",$18.56,-0.07,-0.376%,"2,231,666,483"
SOUNW,"SoundHound AI, Inc. Warrant",$5.31,0.10,1.919%,"2,230,709,022"
ADUS,Addus HomeCare Corporation Common Stock,$120.20,-0.72,-0.595%,"2,221,689,174"
IVT,InvenTrust Properties Corp. Common Stock,$28.54,UNCH,--,"2,215,257,105"
AORT,"Artivion, Inc. Common Stock",$46.66,0.13,0.279%,"2,210,514,654"
SGRY,"Surgery Partners, Inc. Common Stock",$17.07,0.01,0.059%,"2,207,864,168"
MESO,Mesoblast Limited American Depositary Shares,$17.23,-0.14,-0.806%,"2,207,451,068"
PTEN,"Patterson-UTI Energy, Inc. Common Stock",$5.81,0.13,2.289%,"2,203,396,159"
WD,"Walker & Dunlop, Inc Common Stock",$64.64,-0.46,-0.707%,"2,201,911,956"
GEO,Geo Group Inc (The) REIT,$15.76,0.18,1.155%,"2,193,748,644"
SFB,Stifel Financial Corporation 5.20% Senior Notes due 2047,$21.43,0.0515,0.241%,"2,189,576,091"
NOG,"Northern Oil and Gas, Inc. Common Stock",$22.39,0.41,1.865%,"2,185,330,677"
SEDG,"SolarEdge Technologies, Inc. Common Stock",$36.53,1.06,2.988%,"2,184,495,863"
SM,SM Energy Company Common Stock,$19.05,0.32,1.708%,"2,182,257,358"
GPCR,Structure Therapeutics Inc. American Depositary Shares,$35.81,1.59,4.646%,"2,172,866,288"
RXO,"RXO, Inc. Common Stock",$13.22,0.21,1.614%,"2,169,558,948"
NBTB,NBT Bancorp Inc. Common Stock,$41.46,-0.68,-1.614%,"2,168,987,902"
ACMR,"ACM Research, Inc. Class A Common Stock",$33.41,0.54,1.643%,"2,167,522,228"
LU,"Lufax Holding Ltd American Depositary Shares, each representing two (2) Ordinary Shares",$2.50,-0.02,-0.794%,"2,166,600,000"
PK,Park Hotels & Resorts Inc. Common Stock ,$10.82,-0.01,-0.092%,"2,162,899,368"
LION,Lionsgate Studios Corp Common Shares,$7.46,0.13,1.774%,"2,161,380,682"
CIFRW,Cipher Mining Inc. Warrant,$5.47,0.34,6.628%,"2,161,153,535"
VERA,"Vera Therapeutics, Inc. Class A Common Stock",$33.75,0.42,1.26%,"2,157,572,228"
SAH,"Sonic Automotive, Inc. Common Stock",$63.03,0.16,0.254%,"2,153,904,273"
CENT,Central Garden & Pet Company Common Stock,$34.16,-0.05,-0.146%,"2,147,675,854"
STC,Stewart Information Services Corporation Common Stock,$76.63,0.23,0.301%,"2,147,494,676"
BBT,Beacon Financial Corporation Common stock,$25.59,-0.01,-0.039%,"2,147,227,753"
TIC,"TIC Solutions, Inc. Common Stock",$9.72,0.19,1.994%,"2,143,840,410"
DIOD,Diodes Incorporated Common Stock,$46.21,0.10,0.217%,"2,143,466,146"
BANR,Banner Corporation Common Stock,$62.81,-1.02,-1.598%,"2,140,937,263"
GCMG,GCM Grosvenor Inc. Class A Common Stock,$10.98,0.08,0.734%,"2,132,276,801"
FRME,First Merchants Corporation Common Stock,$36.84,-0.29,-0.781%,"2,130,273,737"
FIHL,Fidelis Insurance Holdings Limited Common Shares,$19.04,UNCH,--,"2,128,164,375"
TRN,"Trinity Industries, Inc. Common Stock",$26.52,0.05,0.189%,"2,126,387,470"
AUPH,Aurinia Pharmaceuticals Inc Ordinary Shares,$16.12,-0.25,-1.527%,"2,125,269,811"
DQ,"DAQO New Energy Corp. American Depositary Shares, each representing five ordinary shares",$31.68,0.17,0.54%,"2,124,356,731"
FBNC,First Bancorp Common Stock,$51.01,-0.38,-0.739%,"2,115,146,432"
NHC,National HealthCare Corporation Common Stock,$136.29,-0.89,-0.649%,"2,114,573,831"
MGNI,"Magnite, Inc. Common Stock",$14.69,0.015,0.102%,"2,110,187,196"
SEZL,Sezzle Inc. Common Stock,$61.75,2.91,4.946%,"2,108,954,049"
IQ,"iQIYI, Inc. American Depositary Shares",$2.19,0.04,1.86%,"2,108,879,877"
MQ,"Marqeta, Inc. Class A Common Stock",$4.79,0.06,1.268%,"2,108,075,393"
KMT,Kennametal Inc. Common Stock,$27.68,0.02,0.072%,"2,106,258,004"
HTH,Hilltop Holdings Inc.,$34.32,-0.30,-0.867%,"2,104,795,390"
SLDE,"Slide Insurance Holdings, Inc. Common Stock",$16.89,UNCH,--,"2,099,254,705"
AVDL,Avadel Pharmaceuticals plc Ordinary Share,$21.49,0.09,0.421%,"2,098,641,709"
SID,Companhia Siderurgica Nacional S.A. Common Stock,$1.58,-0.03,-1.863%,"2,095,228,436"
TRMD,TORM plc Class A Common Stock,$21.41,0.28,1.325%,"2,094,198,832"
BUR,Burford Capital Limited Ordinary Shares,$9.57,0.04,0.42%,"2,094,026,926"
DHT,"DHT Holdings, Inc.",$13.03,0.01,0.077%,"2,092,070,453"
SBET,"SharpLink Gaming, Inc. Common Stock",$10.62,0.37,3.61%,"2,088,881,688"
LC,LendingClub Corporation Common Stock,$18.10,0.47,2.666%,"2,086,956,064"
ZBIO,"Zenas BioPharma, Inc. Common Stock",$38.83,-1.70,-4.194%,"2,084,362,016"
OSW,OneSpaWorld Holdings Limited Common Shares,$20.42,0.03,0.147%,"2,081,867,620"
BUSE,First Busey Corporation Class A Common Stock,$23.54,-0.22,-0.926%,"2,081,148,872"
BITF,Bitfarms Ltd. Common Stock,$3.48,0.38,12.258%,"2,080,773,731"
PHIN,PHINIA Inc. Common Stock,$54.09,-0.13,-0.24%,"2,079,364,237"
SAM,"Boston Beer Company, Inc. (The) Common Stock",$194.80,-0.52,-0.266%,"2,076,250,086"
MTRN,Materion Corporation,$122.19,1.40,1.159%,"2,074,526,302"
IE,Ivanhoe Electric Inc. Common Stock,$14.31,1.35,10.417%,"2,070,868,459"
OI,"O-I Glass, Inc. Common Stock",$13.48,0.03,0.223%,"2,070,453,995"
MD,"Pediatrix Medical Group, Inc. Common Stock",$24.09,-0.36,-1.472%,"2,068,786,229"
MENS,Jyong Biotech Ltd. Ordinary Shares,$27.20,-2.81,-9.364%,"2,067,952,542"
GLPG,Galapagos NV American Depositary Shares,$31.32,0.19,0.61%,"2,063,896,264"
TSLX,"Sixth Street Specialty Lending, Inc. Common Stock",$21.82,0.14,0.646%,"2,061,857,444"
PAYO,Payoneer Global Inc. Common Stock,$5.78,0.04,0.697%,"2,060,224,957"
DX,"Dynex Capital, Inc. Common Stock",$14.01,0.08,0.574%,"2,056,972,647"
PGY,Pagaya Technologies Ltd. Class A Ordinary Shares,$24.95,0.91,3.785%,"2,056,456,021"
NWN,Northwest Natural Holding Company Common Stock,$49.47,0.28,0.569%,"2,053,353,368"
JANX,"Janux Therapeutics, Inc. Common Stock",$34.09,-0.60,-1.73%,"2,050,438,741"
AMR,"Alpha Metallurgical Resources, Inc. Common Stock",$159.21,-1.34,-0.835%,"2,047,126,001"
DEI,"Douglas Emmett, Inc. Common Stock",$12.19,-0.07,-0.571%,"2,041,362,499"
VCEL,Vericel Corporation Common Stock,$40.25,-0.12,-0.297%,"2,035,604,547"
HRMY,"Harmony Biosciences Holdings, Inc. Common Stock",$35.29,-0.27,-0.759%,"2,032,575,474"
ADAML,"Adamas Trust, Inc. 6.875% Series F Fixed-to-Floating Rate Cumulative Redeemable Preferred Stock, $0.01 par value per share",$22.50,0.14,0.626%,"2,031,924,960"
UMBFO,"UMB Financial Corporation Depositary Shares Each Representing a 1/400th Interest in a Share of 7.750% Fixed-Rate Reset Non-Cumulative Perpetual Preferred Stock, Series B",$26.73,-0.045,-0.168%,"2,030,268,062"
HE,"Hawaiian Electric Industries, Inc. Common Stock",$11.76,-0.03,-0.254%,"2,030,016,798"
EFSC,Enterprise Financial Services Corporation Common Stock,$54.61,-0.40,-0.727%,"2,021,165,740"
CIMN,Chimera Investment Corporation 9.000% Senior Notes due 2029,$25.05,0.035,0.14%,"2,017,293,935"
ESTA,Establishment Labs Holdings Inc. Common Shares,$69.29,1.28,1.882%,"2,013,419,674"
ADAMN,"Adamas Trust, Inc. 8.00% Series D Fixed-to-Floating Rate Cumulative Redeemable Preferred Stock",$22.24,UNCH,--,"2,008,444,938"
EPAC,Enerpac Tool Group Corp. Common Stock,$37.87,0.06,0.159%,"2,006,411,147"
OGN,Organon & Co. Common Stock ,$7.71,-0.03,-0.388%,"2,004,468,252"
ZYME,Zymeworks Inc. Common Stock,$26.71,-0.62,-2.269%,"1,998,883,823"
NTB,Bank of N.T. Butterfield & Son Limited (The) Voting Ordinary Shares,$46.44,-0.07,-0.151%,"1,996,920,000"
HWCPZ,Hancock Whitney Corporation 6.25% Subordinated Notes due 2060,$23.55,0.06,0.255%,"1,995,979,732"
IMAX,Imax Corporation Common Stock,$37.10,0.22,0.597%,"1,995,940,451"
CTRI,"Centuri Holdings, Inc. Common Stock",$22.49,0.78,3.593%,"1,993,719,473"
AI,"C3.ai, Inc. Class A Common Stock",$14.45,0.29,2.048%,"1,991,928,107"
MNR,Mach Natural Resources LP Common Units representing Limited Partner Interests,$11.82,0.18,1.546%,"1,990,757,626"
TNK,Teekay Tankers Ltd.,$57.67,-0.44,-0.757%,"1,982,820,436"
SKWD,"Skyward Specialty Insurance Group, Inc. Common Stock",$48.96,-0.04,-0.082%,"1,982,261,390"
PENN,"PENN Entertainment, Inc. Common Stock",$14.84,0.11,0.747%,"1,977,429,584"
PRKS,United Parks & Resorts Inc. Common Stock,$36.09,0.80,2.267%,"1,968,731,551"
JSM,"Navient Corporation 6% Senior Notes due December 15, 2043",$19.78,0.16,0.815%,"1,966,745,932"
UAA,"Under Armour, Inc. Class A Common Stock",$4.62,UNCH,--,"1,958,368,852"
TWST,Twist Bioscience Corporation Common Stock,$32.01,0.31,0.978%,"1,957,348,312"
AVAH,Aveanna Healthcare Holdings Inc. Common Stock,$9.34,0.07,0.755%,"1,951,232,317"
SYBT,"Stock Yards Bancorp, Inc. Common Stock",$66.17,0.08,0.121%,"1,950,258,716"
BELFB,Bel Fuse Inc. Class B Common Stock,$154.03,1.34,0.878%,"1,950,106,519"
TALO,"Talos Energy, Inc. Common Stock",$11.46,0.13,1.147%,"1,948,071,327"
CENTA,Central Garden & Pet Company Class A Common Stock Nonvoting,$30.94,-0.04,-0.129%,"1,945,230,999"
SION,"Sionna Therapeutics, Inc. Common Stock",$43.57,-0.22,-0.502%,"1,944,476,293"
OLMA,"Olema Pharmaceuticals, Inc. Common Stock",$28.32,0.20,0.711%,"1,944,449,019"
ATRO,Astronics Corporation Common Stock,$54.57,-0.06,-0.11%,"1,944,281,133"
ALG,"Alamo Group, Inc. Common Stock",$160.37,-0.57,-0.354%,"1,942,951,188"
NTCT,"NetScout Systems, Inc. Common Stock",$26.88,0.15,0.561%,"1,940,565,930"
PNFPP,"Pinnacle Financial Partners, Inc. Depositary shares of Pinnacle Financial Partners, Inc., each representing a 1/40th Interest in a share of its 6.75% Fixed-Rate Non-Cumulative Perpetual Preferred Stock, Series B",$25.00,-0.03,-0.12%,"1,939,386,425"
WLY,"John Wiley & Sons, Inc. Common Stock",$36.36,0.35,0.972%,"1,934,443,591"
BWLP,BW LPG Limited Common Shares,$12.69,0.42,3.423%,"1,923,022,842"
ASGN,ASGN Incorporated Common Stock,$45.01,-0.27,-0.596%,"1,921,927,000"
CCS,"Century Communities, Inc. Common Stock",$65.29,0.02,0.031%,"1,918,500,229"
SEM,Select Medical Holdings Corporation Common Stock,$15.49,0.08,0.519%,"1,917,934,485"
CC,Chemours Company (The) Common Stock,$12.79,0.32,2.566%,"1,917,118,066"
NN,NextNav Inc. Common Stock,$14.21,0.24,1.718%,"1,915,921,340"
WLYB,"John Wiley & Sons, Inc. Common Stock",$36.00,-0.45,-1.235%,"1,915,290,684"
KN,Knowles Corporation Common Stock,$22.48,0.03,0.134%,"1,914,214,352"
TPB,"Turning Point Brands, Inc. Common Stock",$100.16,0.60,0.603%,"1,910,127,021"
GEL,"Genesis Energy, L.P. Common Units",$15.59,0.18,1.168%,"1,909,218,718"
ANIP,"ANI Pharmaceuticals, Inc.",$84.85,0.49,0.581%,"1,905,575,555"
SDRL,Seadrill Limited Common Shares,$30.52,0.20,0.66%,"1,903,659,699"
TGB,"Taseko Mines, Ltd. Common Stock",$5.28,0.24,4.762%,"1,902,968,897"
HNI,HNI Corporation Common Stock,$41.52,0.39,0.948%,"1,902,913,957"
IMCR,Immunocore Holdings plc American Depositary Shares,$39.50,-0.63,-1.57%,"1,899,489,667"
VAC,Marriott Vacations Worldwide Corporation Common Stock,$54.60,-0.27,-0.492%,"1,889,923,909"
PDO,PIMCO Dynamic Income Opportunities Fund Common Shares of Beneficial Interest,$13.94,0.05,0.36%,"1,889,463,077"
ABLLL,"Abacus Global Management, Inc. 9.875% Fixed Rate Senior Notes due 2028",$25.30,0.03,0.119%,"1,888,679,079"
CXW,"CoreCivic, Inc. Common Stock",$18.05,0.17,0.951%,"1,887,753,023"
DNTH,"Dianthus Therapeutics, Inc. Common Stock",$43.98,-0.05,-0.114%,"1,885,687,140"
BGR,BlackRock Energy and Resources Trust,$13.90,0.23,1.683%,"1,884,648,097"
LMAT,"LeMaitre Vascular, Inc. Common Stock",$82.95,-0.42,-0.504%,"1,881,803,202"
NOVTU,Novanta Inc. Tangible Equity Units,$52.55,0.45,0.864%,"1,879,982,714"
NVTS,Navitas Semiconductor Corporation Common Stock,$8.74,0.40,4.796%,"1,878,568,040"
NGVT,Ingevity Corporation Common Stock ,$52.23,0.06,0.115%,"1,878,401,391"
UA,"Under Armour, Inc. Class C Common Stock",$4.43,0.02,0.454%,"1,877,829,874"
NOMD,Nomad Foods Limited Ordinary Shares,$12.23,0.06,0.493%,"1,876,118,409"
AGM,Federal Agricultural Mortgage Corporation Common Stock,$171.76,-0.93,-0.539%,"1,872,995,222"
SCS,Steelcase Inc. Common Stock,$16.29,0.09,0.556%,"1,869,140,175"
SLVM,Sylvamo Corporation Common Stock,$47.37,-0.49,-1.024%,"1,868,190,234"
TY,Tri Continental Corporation Common Stock,$34.34,0.04,0.117%,"1,866,411,108"
