Symbol,Name,Last Sale,Net Change,% Change,Market Cap
SBET,"SharpLink Gaming, Inc. Common Stock",$16.31,-1.27,-7.224%,"2,754,216,268"
HCM,HUTCHMED (China) Limited American Depositary Shares,$15.79,-0.09,-0.567%,"2,754,128,022"
AWR,American States Water Company Common Stock,$71.51,-0.32,-0.445%,"2,753,781,307"
FORM,"FormFactor, Inc. FormFactor, Inc. Common Stock",$35.60,-0.73,-2.009%,"2,745,266,018"
GTX,Garrett Motion Inc. Common Stock,$13.58,-0.10,-0.731%,"2,737,394,733"
VIAV,Viavi Solutions Inc. Common Stock,$12.29,-0.02,-0.162%,"2,736,435,394"
BULLW,Webull Corporation Warrants,$5.93,0.5026,9.26%,"2,736,405,865"
RNG,"RingCentral, Inc. Class A Common Stock",$30.22,-0.45,-1.467%,"2,736,200,998"
FTAIM,FTAI Aviation Ltd. 9.500% Fixed-Rate Reset Series D Cumulative Perpetual Redeemable Preferred Shares,$26.666,0.216,0.817%,"2,735,147,566"
IMVT,"Immunovant, Inc. Common Stock",$15.67,0.21,1.358%,"2,731,544,898"
EOSE,"Eos Energy Enterprises, Inc. Class A Common Stock",$10.49,-0.16,-1.502%,"2,725,864,327"
PLUG,"Plug Power, Inc. Common Stock",$2.36,-0.04,-1.667%,"2,725,424,151"
AUGO,Aura Minerals Inc. Common Shares,$32.89,-1.70,-4.915%,"2,717,696,490"
TTAM,Titan America SA Common Shares,$14.70,-0.18,-1.21%,"2,710,128,236"
CAKE,Cheesecake Factory Incorporated (The) Common Stock,$54.30,-0.63,-1.147%,"2,704,706,186"
LXP,LXP Industrial Trust Common Stock (Maryland REIT),$9.14,-0.10,-1.082%,"2,703,485,822"
WDFC,WD-40 Company Common Stock,$199.39,-2.75,-1.36%,"2,698,517,143"
CWT,California Water Service Group Common Stock,$45.29,-0.47,-1.027%,"2,698,430,510"
FLO,"Flowers Foods, Inc. Common Stock",$12.76,-0.29,-2.222%,"2,694,634,151"
CVBF,CVB Financial Corporation Common Stock,$19.53,-0.06,-0.306%,"2,691,577,708"
NMFCZ,New Mountain Finance Corporation 8.250% Notes due 2028,$25.30,-0.02,-0.079%,"2,690,932,313"
SYNA,Synaptics Incorporated Common Stock $0.001 Par Value,$69.37,-1.51,-2.13%,"2,681,597,382"
RARE,Ultragenyx Pharmaceutical Inc. Common Stock,$27.82,-0.94,-3.268%,"2,681,059,108"
SBCF,Seacoast Banking Corporation of Florida Common Stock,$30.50,0.01,0.033%,"2,679,568,808"
TMC,TMC the metals company Inc. Common Stock,$6.56,0.40,6.494%,"2,665,937,562"
DGNX,Diginex Limited Ordinary Shares,$13.20,-2.55,-16.19%,"2,665,741,373"
PRK,Park National Corporation Common Stock,$165.78,-0.36,-0.217%,"2,664,307,906"
DRVN,Driven Brands Holdings Inc. Common Stock,$16.16,-0.06,-0.37%,"2,654,764,008"
TOWN,TowneBank Common Stock,$35.49,-0.25,-0.699%,"2,648,169,042"
BBAI,"BigBear.ai, Inc. Common Stock",$7.14,-0.45,-5.929%,"2,646,820,834"
SUPN,"Supernus Pharmaceuticals, Inc. Common Stock",$47.18,0.08,0.17%,"2,645,528,292"
BUR,Burford Capital Limited Ordinary Shares,$12.09,-0.24,-1.946%,"2,645,432,135"
CON,"Concentra Group Holdings Parent, Inc. Common Stock",$20.58,-0.09,-0.435%,"2,637,758,192"
ALKT,"Alkami Technology, Inc. Common Stock",$25.32,0.03,0.119%,"2,635,385,054"
XNET,Xunlei Limited American Depositary Shares,$8.44,0.41,5.106%,"2,632,101,194"
KNSA,"Kiniksa Pharmaceuticals International, plc Class A Ordinary Shares",$35.51,-0.58,-1.607%,"2,631,563,291"
OGN,Organon & Co. Common Stock ,$10.12,-0.29,-2.786%,"2,630,851,659"
AKR,Acadia Realty Trust Common Stock,$20.08,0.16,0.803%,"2,630,742,626"
WOR,"Worthington Enterprises, Inc. Common Shares",$52.79,-0.50,-0.938%,"2,630,167,942"
NOG,"Northern Oil and Gas, Inc. Common Stock",$26.94,0.02,0.074%,"2,629,200,733"
FSM,Fortuna Mining Corp. Common Shares,$8.56,0.14,1.663%,"2,627,577,480"
WBTN,WEBTOON Entertainment Inc. Common stock,$20.05,0.03,0.15%,"2,618,695,934"
OLN,Olin Corporation Common Stock,$22.84,-0.62,-2.643%,"2,618,412,659"
AMSC,American Superconductor Corporation Common Stock,$57.955,-1.655,-2.776%,"2,617,301,466"
FTAIN,FTAI Aviation Ltd. 8.25% Fixed - Rate Reset Series C Cumulative Perpetual Redeemable Preferred Shares,$25.50,0.07,0.275%,"2,615,550,249"
MANU,Manchester United Ltd. Class A Ordinary Shares,$15.15,-0.07,-0.46%,"2,612,297,214"
BOH,Bank of Hawaii Corporation Common Stock,$65.64,-0.48,-0.726%,"2,610,339,225"
IQ,"iQIYI, Inc. American Depositary Shares",$2.69,-0.01,-0.37%,"2,590,359,301"
METC,"Ramaco Resources, Inc. Class A Common Stock",$32.98,-0.35,-1.05%,"2,590,124,668"
FA,First Advantage Corporation Common Stock,$14.88,-0.19,-1.261%,"2,588,979,533"
DEI,"Douglas Emmett, Inc. Common Stock",$15.45,-0.37,-2.339%,"2,587,046,108"
DAN,Dana Incorporated Common Stock ,$19.70,-0.13,-0.656%,"2,583,726,570"
MFAO,"MFA Financial, Inc. 9.000% Senior Notes due 2029",$25.16,-0.1187,-0.47%,"2,583,144,542"
VCYT,"Veracyte, Inc. Common Stock",$32.82,0.14,0.428%,"2,582,001,518"
SEI,"Solaris Energy Infrastructure, Inc. Class A Common Stock",$38.20,0.80,2.139%,"2,581,666,131"
MFAN,"MFA Financial, Inc. 8.875% Senior Notes due 2029",$25.1399,-0.0501,-0.199%,"2,581,080,901"
MEOH,Methanex Corporation Common Stock,$38.27,-0.86,-2.198%,"2,579,214,763"
BATRK,"Atlanta Braves Holdings, Inc. Series C Common Stock",$41.06,-0.06,-0.146%,"2,576,728,635"
ATS,ATS Corporation Common Shares,$26.28,-0.85,-3.133%,"2,566,327,331"
FOLD,"Amicus Therapeutics, Inc. Common Stock",$8.32,-0.03,-0.359%,"2,564,551,592"
DNN,Denison Mines Corp Ordinary Shares (Canada),$2.86,0.11,4.00%,"2,564,141,225"
ALRM,"Alarm.com Holdings, Inc. Common Stock",$51.29,-0.67,-1.289%,"2,559,629,091"
UPWK,Upwork Inc. Common Stock,$19.30,-0.62,-3.112%,"2,559,306,975"
SAH,"Sonic Automotive, Inc. Common Stock",$74.94,-3.60,-4.584%,"2,559,210,967"
FCPT,"Four Corners Property Trust, Inc. Common Stock",$24.44,0.01,0.041%,"2,553,107,785"
MLYS,"Mineralys Therapeutics, Inc. Common Stock",$38.51,-0.36,-0.926%,"2,553,027,536"
PFS,"Provident Financial Services, Inc Common Stock",$19.54,-0.02,-0.102%,"2,552,395,950"
WU,Western Union Company (The) Common Stock,$7.88,-0.28,-3.431%,"2,544,982,174"
MH,"McGraw Hill, Inc. Common Stock",$13.29,-0.55,-3.974%,"2,538,410,188"
OII,"Oceaneering International, Inc. Common Stock",$25.33,0.15,0.596%,"2,538,258,407"
CMPO,"CompoSecure, Inc. Class A Common Stock",$20.31,0.27,1.347%,"2,530,661,278"
PSIX,"Power Solutions International, Inc. Common Stock",$109.59,-1.28,-1.155%,"2,523,840,823"
BWSN,"Babcock & Wilcox Enterprises, Inc. 8.125% Senior Notes due 2026",$24.95,-0.078,-0.312%,"2,522,383,673"
UE,Urban Edge Properties Common Shares of Beneficial Interest,$19.97,0.02,0.10%,"2,512,048,247"
SMPL,The Simply Good Foods Company Common Stock,$24.78,-0.52,-2.055%,"2,491,418,271"
HURN,Huron Consulting Group Inc. Common Stock,$142.85,-0.29,-0.203%,"2,472,288,808"
FFBC,First Financial Bancorp. Common Stock,$25.81,-0.15,-0.578%,"2,471,409,604"
XRAY,DENTSPLY SIRONA Inc. Common Stock,$12.37,-0.50,-3.885%,"2,467,615,361"
GLOB,Globant S.A. Common Shares,$55.99,-2.05,-3.532%,"2,466,110,792"
DIOD,Diodes Incorporated Common Stock,$52.98,-2.01,-3.655%,"2,460,536,100"
CLVT,Clarivate Plc Ordinary Shares,$3.66,-0.17,-4.439%,"2,460,321,774"
DKL,"Delek Logistics Partners, L.P. Common Units representing Limited Partner Interests",$46.00,-0.37,-0.798%,"2,459,336,134"
BANC,"Banc of California, Inc. Common Stock",$16.61,-0.10,-0.598%,"2,454,598,759"
ALVO,Alvotech Ordinary Shares,$8.12,-0.46,-5.361%,"2,450,662,097"
VTMX,"Corporacion Inmobiliaria Vesta, S.A.B de C.V. American Depositary Shares, each representing ten (10) Common Shares",$27.66,-0.13,-0.468%,"2,446,489,493"
MTRN,Materion Corporation,$117.99,-0.70,-0.59%,"2,445,568,937"
ACMR,"ACM Research, Inc. Class A Common Stock",$37.96,-0.73,-1.887%,"2,436,309,431"
SXI,Standex International Corporation Common Stock,$201.74,-0.73,-0.361%,"2,434,651,176"
VAC,Marriott Vacations Worldwide Corporation Common Stock,$70.32,-2.32,-3.194%,"2,433,247,730"
CHEF,"The Chefs' Warehouse, Inc. Common Stock",$59.64,0.20,0.336%,"2,431,084,923"
RXO,"RXO, Inc. Common Stock",$14.81,-0.50,-3.266%,"2,428,651,010"
WAFD,"WaFd, Inc. Common Stock",$30.81,-0.23,-0.741%,"2,427,583,184"
TRMK,Trustmark Corporation Common Stock,$40.16,-0.21,-0.52%,"2,424,321,572"
CENX,Century Aluminum Company Common Stock,$25.96,0.11,0.426%,"2,423,083,581"
GDV,Gabelli Dividend & Income Trust Common Shares of Beneficial Interest,$26.86,-0.41,-1.503%,"2,422,462,868"
WSBCP,"WesBanco, Inc. Depositary Shares, Each Representing a 1/40th Interest in a Share of 6.75% Fixed-Rate Reset Non-Cumulative Perpetual Preferred Stock, Series A",$25.235,0.005,0.02%,"2,422,303,183"
GCMG,GCM Grosvenor Inc. Class A Common Stock,$12.39,-0.11,-0.88%,"2,414,639,399"
DXC,DXC Technology Company Common Stock ,$13.27,-0.67,-4.806%,"2,414,619,697"
CRGY,Crescent Energy Company Class A Common Stock,$9.46,-0.12,-1.253%,"2,408,659,584"
SPNS,Sapiens International Corporation N.V. Common Shares (Cayman Islands),$43.00,0.05,0.116%,"2,403,150,675"
FRPT,"Freshpet, Inc. Common Stock",$49.25,-0.15,-0.304%,"2,402,408,745"
DFH,"Dream Finders Homes, Inc. Class A Common Stock",$25.86,-0.93,-3.471%,"2,401,920,348"
MQ,"Marqeta, Inc. Class A Common Stock",$5.35,-0.15,-2.727%,"2,398,045,223"
BHC,Bausch Health Companies Inc. Common Stock,$6.46,-0.19,-2.857%,"2,388,845,461"
AI,"C3.ai, Inc. Class A Common Stock",$17.28,-0.86,-4.741%,"2,382,042,747"
PRDO,Perdoceo Education Corporation Common Stock,$36.58,0.71,1.979%,"2,375,994,604"
SHOO,"Steven Madden, Ltd. Common Stock",$32.70,-0.12,-0.366%,"2,375,733,218"
MRX,Marex Group plc Ordinary Shares,$33.75,0.68,2.056%,"2,372,317,403"
PCT,"PureCycle Technologies, Inc. Common stock",$13.10,-0.39,-2.891%,"2,359,219,531"
DJTWW,Trump Media & Technology Group Corp. Warrants,$8.50,UNCH,--,"2,355,072,866"
CURB,Curbline Properties Corp. Common Stock,$22.38,0.02,0.089%,"2,354,703,375"
MFICL,MidCap Financial Investment Corporation 8.00% Notes due 2028,$25.21,-0.0375,-0.149%,"2,352,184,311"
VICR,Vicor Corporation Common Stock,$52.135,-0.675,-1.278%,"2,341,865,829"
CPRX,"Catalyst Pharmaceuticals, Inc. Common Stock",$19.13,-0.57,-2.893%,"2,341,340,021"
INSW,"International Seaways, Inc. Common Stock ",$47.40,-0.13,-0.274%,"2,339,961,482"
HCI,"HCI Group, Inc. Common Stock",$180.43,0.62,0.345%,"2,338,335,631"
TARS,"Tarsus Pharmaceuticals, Inc. Common Stock",$55.39,0.13,0.235%,"2,338,239,331"
PAX,Patria Investments Limited Class A Common Shares,$14.79,0.02,0.135%,"2,337,935,048"
BEAM,Beam Therapeutics Inc. Common Stock,$23.09,-0.50,-2.12%,"2,335,831,180"
SAM,"Boston Beer Company, Inc. (The) Common Stock",$214.46,-6.21,-2.814%,"2,335,174,089"
APPN,Appian Corporation Class A Common Stock,$31.47,-0.99,-3.05%,"2,329,785,687"
ALG,"Alamo Group, Inc. Common Stock",$192.30,-1.81,-0.932%,"2,328,927,993"
IBRX,"ImmunityBio, Inc. Common Stock",$2.46,-0.04,-1.60%,"2,325,326,525"
ZGN,Ermenegildo Zegna N.V. Ordinary Shares,$9.13,-0.37,-3.895%,"2,306,054,295"
PAYO,Payoneer Global Inc. Common Stock,$6.39,-0.08,-1.236%,"2,302,416,320"
CPRI,Capri Holdings Limited Ordinary Shares,$19.33,-0.88,-4.354%,"2,301,198,942"
HBI,Hanesbrands Inc. Common Stock,$6.50,-0.02,-0.307%,"2,299,252,397"
ABR,Arbor Realty Trust Common Stock,$11.95,-0.03,-0.25%,"2,298,001,897"
BWLP,BW LPG Limited Common Shares,$15.16,-0.50,-3.193%,"2,297,322,796"
HAE,Haemonetics Corporation Common Stock,$47.67,-2.94,-5.809%,"2,296,609,794"
AMBP,Ardagh Metal Packaging S.A. Ordinary Shares,$3.84,-0.08,-2.041%,"2,295,166,410"
CC,Chemours Company (The) Common Stock,$15.33,-1.03,-6.296%,"2,294,874,939"
PINC,"Premier, Inc. Class A Common Stock",$27.79,UNCH,--,"2,294,054,523"
LCII,LCI Industries,$94.60,-2.01,-2.081%,"2,293,509,172"
CXW,"CoreCivic, Inc. Common Stock",$21.38,-0.16,-0.743%,"2,288,941,688"
NSA,National Storage Affiliates Trust Common Shares of Beneficial Interest,$29.80,0.06,0.202%,"2,287,598,520"
DRD,DRDGOLD Limited American Depositary Shares,$26.45,0.19,0.724%,"2,286,837,138"
INSP,"Inspire Medical Systems, Inc. Common Stock",$77.32,-0.51,-0.655%,"2,286,686,113"
ADAMM,"Adamas Trust, Inc. 7.875% Series E Fixed-to-Floating Rate Cumulative Redeemable Preferred Stock",$25.2298,0.0698,0.277%,"2,278,603,754"
ATEC,"Alphatec Holdings, Inc. Common Stock",$15.39,0.18,1.183%,"2,277,470,297"
BUSEP,"First Busey Corporation Depositary Shares, Each Representing a 1/40thInterest in a Share of 8.25% Fixed-Rate Series B Non-Cumulative Perpetual Preferred Stock, $0.001 par value",$25.50,-0.015,-0.059%,"2,271,180,705"
BWNB,"Babcock & Wilcox Enterprises, Inc. 6.50% Senior Notes due 2026",$22.4501,-0.0499,-0.222%,"2,269,649,928"
WWW,"Wolverine World Wide, Inc. Common Stock",$27.91,-0.44,-1.552%,"2,267,808,936"
SBLK,Star Bulk Carriers Corp. Common Shares,$19.36,-0.51,-2.567%,"2,267,589,000"
BLTE,"Belite Bio, Inc American Depositary Shares",$70.01,0.21,0.301%,"2,260,046,228"
PTRN,Pattern Group Inc. Series A Common Stock,$12.83,-0.63,-4.681%,"2,258,332,456"
PK,Park Hotels & Resorts Inc. Common Stock ,$11.29,-0.27,-2.336%,"2,257,023,370"
BANR,Banner Corporation Common Stock,$65.22,-0.27,-0.412%,"2,255,601,220"
GT,The Goodyear Tire & Rubber Company Common Stock,$7.88,-0.24,-2.956%,"2,254,046,121"
IDYA,"IDEAYA Biosciences, Inc. Common Stock",$25.69,0.02,0.078%,"2,251,566,293"
SEDG,"SolarEdge Technologies, Inc. Common Stock",$37.90,0.43,1.148%,"2,250,304,655"
FRME,First Merchants Corporation Common Stock,$38.96,-0.57,-1.442%,"2,249,251,927"
IVT,InvenTrust Properties Corp. Common Stock,$28.98,-0.08,-0.275%,"2,249,033,356"
ADAMI,"Adamas Trust, Inc. 9.125% Senior Notes Due 2029",$24.8225,-0.0573,-0.23%,"2,248,408,373"
KWR,Quaker Houghton Common Stock,$129.25,-3.88,-2.914%,"2,248,254,506"
TRN,"Trinity Industries, Inc. Common Stock",$27.80,-0.02,-0.072%,"2,247,278,580"
PHIN,PHINIA Inc. Common Stock,$57.65,-0.25,-0.432%,"2,242,842,984"
IHS,IHS Holding Limited Ordinary Shares,$6.71,-0.02,-0.297%,"2,237,388,687"
APGE,"Apogee Therapeutics, Inc. Common Stock",$37.52,-0.90,-2.343%,"2,236,057,266"
NBTB,NBT Bancorp Inc. Common Stock,$42.55,-0.23,-0.538%,"2,229,368,317"
POWI,"Power Integrations, Inc. Common Stock",$39.62,-1.19,-2.916%,"2,222,506,959"
COCO,"The Vita Coco Company, Inc. Common Stock",$39.01,-1.29,-3.201%,"2,216,664,489"
EXK,Endeavour Silver Corporation Ordinary Shares (Canada),$7.63,0.23,3.108%,"2,214,006,447"
OSW,OneSpaWorld Holdings Limited Common Shares,$21.53,0.15,0.702%,"2,211,071,470"
CELC,Celcuity Inc. Common Stock,$51.94,-2.04,-3.779%,"2,203,643,369"
SA,"Seabridge Gold, Inc. Ordinary Shares (Canada)",$21.57,0.37,1.745%,"2,202,923,910"
PMTU,PennyMac Mortgage Investment Trust 8.50% Senior Notes due 2028,$25.2955,0.0105,0.042%,"2,201,128,506"
ACHC,"Acadia Healthcare Company, Inc. Common Stock",$23.77,-0.82,-3.335%,"2,195,078,492"
FBNC,First Bancorp Common Stock,$52.91,-0.37,-0.694%,"2,193,776,536"
TVTX,"Travere Therapeutics, Inc. Common Stock",$24.605,0.195,0.799%,"2,193,257,049"
ASH,Ashland Inc. Common Stock,$47.89,-1.41,-2.86%,"2,188,858,329"
INOD,Innodata Inc. Common Stock,$68.62,-0.805,-1.16%,"2,185,246,582"
HTZ,"Hertz Global Holdings, Inc Common Stock",$7.03,0.06,0.861%,"2,184,826,866"
ETNB,"89bio, Inc. Common Stock",$14.70,UNCH,--,"2,180,131,275"
HP,"Helmerich & Payne, Inc. Common Stock",$21.91,-0.29,-1.306%,"2,178,726,741"
KEN,Kenon Holdings Ltd. Ordinary Shares,$41.77,-0.52,-1.23%,"2,178,315,608"
IRON,"Disc Medicine, Inc. Common Stock",$62.50,0.11,0.176%,"2,172,848,813"
EYE,"National Vision Holdings, Inc. Common Stock",$27.40,-0.98,-3.453%,"2,169,980,894"
EFSC,Enterprise Financial Services Corporation Common Stock,$58.62,-0.31,-0.526%,"2,168,231,636"
SFB,Stifel Financial Corporation 5.20% Senior Notes due 2047,$21.16,-0.34,-1.581%,"2,161,989,271"
CSAN,Cosan S.A. ADS,$4.65,-0.34,-6.814%,"2,160,674,803"
EVTC,"Evertec, Inc. Common Stock",$33.77,-0.07,-0.207%,"2,160,672,309"
NWL,Newell Brands Inc. Common Stock,$5.15,-0.31,-5.678%,"2,158,365,000"
DBRG,"DigitalBridge Group, Inc.",$11.85,-0.42,-3.423%,"2,158,164,921"
TSLX,"Sixth Street Specialty Lending, Inc. Common Stock",$22.88,0.23,1.015%,"2,156,219,162"
GLPG,Galapagos NV American Depositary Shares,$32.66,-0.38,-1.15%,"2,152,198,339"
CDTX,"Cidara Therapeutics, Inc. Common Stock",$84.76,-3.82,-4.312%,"2,149,348,403"
EPAC,Enerpac Tool Group Corp. Common Stock,$39.71,-0.75,-1.854%,"2,141,851,295"
FLNC,"Fluence Energy, Inc. Class A Common Stock",$11.73,0.55,4.919%,"2,140,797,480"
KLIC,"Kulicke and Soffa Industries, Inc. Common Stock",$41.05,-0.45,-1.084%,"2,140,573,842"
AMR,"Alpha Metallurgical Resources, Inc. Common Stock",$163.98,-1.69,-1.02%,"2,140,565,896"
BUSE,First Busey Corporation Class A Common Stock,$23.99,-0.13,-0.539%,"2,136,691,181"
FUN,Six Flags Entertainment Corporation Common Stock New,$21.06,-1.05,-4.749%,"2,132,943,364"
PRCH,"Porch Group, Inc. Common Stock",$17.39,-0.43,-2.413%,"2,131,685,242"
HTH,Hilltop Holdings Inc.,$33.82,-0.15,-0.442%,"2,130,719,489"
OCUL,"Ocular Therapeutix, Inc. Common Stock",$12.24,-0.32,-2.548%,"2,129,701,505"
WLYB,"John Wiley & Sons, Inc. Common Stock",$40.02,-0.27,-0.67%,"2,129,164,810"
ADUS,Addus HomeCare Corporation Common Stock,$115.59,-1.24,-1.061%,"2,127,692,756"
AGIO,"Agios Pharmaceuticals, Inc. Common Stock",$36.61,-0.71,-1.902%,"2,127,096,574"
MSGE,Madison Square Garden Entertainment Corp. Class A Common Stock,$44.80,-0.36,-0.797%,"2,126,201,638"
CMBT,CMB.TECH NV Ordinary Shares,$9.64,-0.41,-4.08%,"2,121,038,233"
HUBG,"Hub Group, Inc. Class A Common Stock",$34.63,UNCH,--,"2,120,034,090"
PTEN,"Patterson-UTI Energy, Inc. Common Stock",$5.50,-0.02,-0.362%,"2,118,421,261"
NN,NextNav Inc. Common Stock,$15.89,-0.30,-1.853%,"2,115,444,710"
CUBI,"Customers Bancorp, Inc Common Stock",$66.83,1.00,1.519%,"2,113,397,837"
WLY,"John Wiley & Sons, Inc. Common Stock",$39.69,-0.42,-1.047%,"2,111,607,979"
TRMD,TORM plc Class A Common Stock,$21.53,-0.47,-2.136%,"2,105,936,518"
UMBFO,"UMB Financial Corporation Depositary Shares Each Representing a 1/400th Interest in a Share of 7.750% Fixed-Rate Reset Non-Cumulative Perpetual Preferred Stock, Series B",$27.58,-0.02,-0.072%,"2,094,101,273"
CENT,Central Garden & Pet Company Common Stock,$33.28,-0.44,-1.305%,"2,092,349,309"
SYBT,"Stock Yards Bancorp, Inc. Common Stock",$70.95,-0.19,-0.267%,"2,091,132,905"
MESO,Mesoblast Limited American Depositary Shares,$16.31,0.05,0.308%,"2,089,583,687"
CSTM,Constellium SE Ordinary Shares (France),$14.96,0.02,0.134%,"2,087,503,784"
SPHR,Sphere Entertainment Co. Class A Common Stock,$57.79,-1.34,-2.266%,"2,080,406,308"
WT,"WisdomTree, Inc. Common Stock",$14.14,-0.21,-1.463%,"2,080,094,691"
EVCM,EverCommerce Inc. Common Stock,$11.47,-0.20,-1.714%,"2,079,267,308"
SKE,Skeena Resources Limited Common Shares,$18.06,0.26,1.461%,"2,077,545,717"
SPNT,SiriusPoint Ltd. Common Shares,$17.77,0.18,1.023%,"2,074,817,008"
DQ,"DAQO New Energy Corp. American Depositary Shares, each representing five ordinary shares",$30.92,2.52,8.873%,"2,073,393,628"
ASGN,ASGN Incorporated Common Stock,$47.33,-1.83,-3.723%,"2,073,054,000"
AVDX,"AvidXchange Holdings, Inc. Common Stock",$9.96,0.03,0.302%,"2,068,679,580"
FORTY,Formula Systems (1985) Ltd. American Depositary Shares,$135.01,UNCH,--,"2,068,038,222"
TDC,Teradata Corporation Common Stock,$21.88,-0.54,-2.409%,"2,067,660,000"
STC,Stewart Information Services Corporation Common Stock,$73.76,-0.42,-0.566%,"2,065,171,056"
SVV,"Savers Value Village, Inc. Common Stock",$13.27,0.07,0.53%,"2,064,227,908"
DBD,Diebold Nixdorf Incorporated Common stock,$56.27,-0.38,-0.671%,"2,061,369,521"
HWCPZ,Hancock Whitney Corporation 6.25% Subordinated Notes due 2060,$24.32,-0.11,-0.45%,"2,061,241,065"
PRCT,PROCEPT BioRobotics Corporation Common Stock,$37.02,-0.63,-1.673%,"2,059,642,536"
HNI,HNI Corporation Common Stock,$44.84,0.28,0.628%,"2,053,861,942"
ADAML,"Adamas Trust, Inc. 6.875% Series F Fixed-to-Floating Rate Cumulative Redeemable Preferred Stock, $0.01 par value per share",$22.74,-0.01,-0.044%,"2,053,739,996"
VSCO,Victorias Secret & Co. Common Stock ,$25.59,-0.06,-0.234%,"2,051,409,171"
PSNY,Polestar Automotive Holding UK PLC Class A ADS,$0.972,-0.0153,-1.55%,"2,051,264,644"
LFST,"LifeStance Health Group, Inc. Common Stock",$5.26,-0.15,-2.773%,"2,045,805,432"
UAA,"Under Armour, Inc. Class A Common Stock",$4.77,-0.07,-1.446%,"2,045,472,740"
PPTA,Perpetua Resources Corp. Common Shares,$19.00,0.14,0.742%,"2,043,827,378"
BBT,Beacon Financial Corporation Common stock,$24.20,-0.21,-0.86%,"2,039,388,256"
ATKR,Atkore Inc. Common Stock,$60.52,-0.52,-0.852%,"2,036,845,566"
GEL,"Genesis Energy, L.P. Common Units",$16.63,0.07,0.423%,"2,036,581,608"
CIMN,Chimera Investment Corporation 9.000% Senior Notes due 2029,$25.17,-0.03,-0.119%,"2,026,957,618"
CGAU,Centerra Gold Inc. Common Shares,$9.92,0.14,1.431%,"2,026,913,841"
ANIP,"ANI Pharmaceuticals, Inc.",$93.37,-1.62,-1.705%,"2,026,095,013"
ENVX,Enovix Corporation Common Stock,$10.29,-0.02,-0.194%,"2,023,014,134"
DK,"Delek US Holdings, Inc. Common Stock",$33.59,0.87,2.659%,"2,020,519,351"
VSH,"Vishay Intertechnology, Inc. Common Stock",$14.90,-0.33,-2.167%,"2,020,228,599"
SII,Sprott Inc. Common Shares,$78.24,1.05,1.36%,"2,018,592,000"
LION,Lionsgate Studios Corp Common Shares,$6.97,0.14,2.05%,"2,017,940,795"
SMA,"SmartStop Self Storage REIT, Inc. Common Stock",$36.31,-0.14,-0.384%,"2,013,046,189"
RXRX,"Recursion Pharmaceuticals, Inc. Class A Common Stock",$4.63,-0.25,-5.123%,"2,010,121,607"
ADNT,Adient plc Ordinary Shares ,$24.71,0.39,1.604%,"2,007,586,881"
ARQT,"Arcutis Biotherapeutics, Inc. Common Stock",$16.73,-0.57,-3.295%,"2,006,011,955"
STRA,"Strategic Education, Inc. Common Stock",$83.93,0.38,0.455%,"2,005,961,243"
SOC,Sable Offshore Corp. Common Stock,$20.15,-1.61,-7.399%,"2,005,071,088"
LBRT,Liberty Energy Inc. Class A common stock,$12.37,-0.15,-1.198%,"2,003,392,380"
SID,Companhia Siderurgica Nacional S.A. Common Stock,$1.51,-0.02,-1.307%,"2,002,401,860"
CHA,Chagee Holdings Limited American Depositary Shares,$16.92,-0.05,-0.295%,"2,001,226,282"
ADPT,Adaptive Biotechnologies Corporation Common Stock,$13.13,0.31,2.418%,"1,999,356,504"
UA,"Under Armour, Inc. Class C Common Stock",$4.66,-0.08,-1.688%,"1,998,302,509"
GRABW,Grab Holdings Limited Warrant,$0.49,-0.015,-2.97%,"1,996,327,654"
DHT,"DHT Holdings, Inc.",$12.41,-0.17,-1.351%,"1,992,524,507"
KLG,WK Kellogg Co Common Stock,$23.00,UNCH,--,"1,987,577,062"
KN,Knowles Corporation Common Stock,$23.13,-0.23,-0.985%,"1,986,580,327"
OFG,OFG Bancorp Common Stock,$44.60,0.25,0.564%,"1,985,555,205"
BKD,Brookdale Senior Living Inc. Common Stock,$8.36,-0.14,-1.647%,"1,985,420,179"
PBI,Pitney Bowes Inc. Common Stock,$11.53,-0.46,-3.837%,"1,984,578,144"
ADAMN,"Adamas Trust, Inc. 8.00% Series D Fixed-to-Floating Rate Cumulative Redeemable Preferred Stock",$21.96,-0.02,-0.091%,"1,983,295,089"
NGVT,Ingevity Corporation Common Stock ,$54.36,-0.95,-1.718%,"1,982,307,253"
NOMD,Nomad Foods Limited Ordinary Shares,$12.91,-0.29,-2.197%,"1,980,432,433"
TRIP,"TripAdvisor, Inc. Common Stock",$17.04,0.07,0.412%,"1,978,916,391"
OI,"O-I Glass, Inc. Common Stock",$12.83,-0.41,-3.097%,"1,976,759,887"
YELP,Yelp Inc. Common Stock,$31.30,-0.14,-0.445%,"1,973,798,502"
BKV,BKV Corporation Common Stock,$23.30,0.34,1.481%,"1,973,771,426"
TIGR,UP Fintech Holding Ltd American Depositary Share representing fifteen Class A Ordinary Shares,$10.56,0.32,3.125%,"1,973,620,683"
NIC,Nicolet Bankshares Inc. Common Stock,$132.60,2.16,1.656%,"1,970,023,349"
DNLI,Denali Therapeutics Inc. Common Stock,$13.43,-0.05,-0.371%,"1,963,630,894"
OZKAP,Bank OZK 4.625% Series A Non-Cumulative Perpetual Preferred Stock,$17.34,-0.07,-0.402%,"1,961,780,529"
CCOI,"Cogent Communications Holdings, Inc.",$39.86,-0.81,-1.992%,"1,960,422,781"
SDRL,Seadrill Limited Common Shares,$31.39,-0.82,-2.546%,"1,953,254,772"
AAUC,Allied Gold Corporation Common Shares,$16.89,-0.02,-0.118%,"1,949,106,000"
FIHL,Fidelis Insurance Holdings Limited Common Shares,$17.39,-0.15,-0.855%,"1,943,738,365"
JSM,"Navient Corporation 6% Senior Notes due December 15, 2043",$19.5295,-0.0205,-0.105%,"1,941,838,457"
DV,"DoubleVerify Holdings, Inc. Common Stock",$11.86,-0.35,-2.867%,"1,940,632,575"
PNFPP,"Pinnacle Financial Partners, Inc. Depositary shares of Pinnacle Financial Partners, Inc., each representing a 1/40th Interest in a share of its 6.75% Fixed-Rate Non-Cumulative Perpetual Preferred Stock, Series B",$25.00,-0.0399,-0.159%,"1,939,098,700"
AGM,Federal Agricultural Mortgage Corporation Common Stock,$177.30,-1.19,-0.667%,"1,938,584,371"
FRA,Blackrock Floating Rate Income Strategies Fund Inc  Common Stock,$13.02,-0.02,-0.153%,"1,936,887,372"
AFGB,"American Financial Group, Inc. 5.875% Subordinated Debentures due 2059",$23.2223,-0.0077,-0.033%,"1,936,611,610"
PACS,"PACS Group, Inc. Common Stock",$12.69,-0.34,-2.609%,"1,933,952,612"
FIVN,"Five9, Inc. Common Stock",$25.02,-0.80,-3.098%,"1,933,112,504"
LQDA,Liquidia Corporation Common Stock,$22.45,0.51,2.325%,"1,932,753,142"
FINV,FinVolution Group American Depositary Shares,$7.62,-0.07,-0.91%,"1,931,013,621"
IOSP,Innospec Inc. Common Stock,$77.59,-1.01,-1.285%,"1,926,804,962"
PARR,"Par Pacific Holdings, Inc.  Common Stock",$37.84,0.52,1.393%,"1,922,827,756"
HE,"Hawaiian Electric Industries, Inc. Common Stock",$11.13,-0.21,-1.852%,"1,921,169,924"
LMAT,"LeMaitre Vascular, Inc. Common Stock",$84.66,-3.14,-3.576%,"1,916,492,613"
SCS,Steelcase Inc. Common Stock,$16.70,0.02,0.12%,"1,915,623,617"
LZ,"LegalZoom.com, Inc. Common Stock",$10.60,0.03,0.284%,"1,910,643,364"
LC,LendingClub Corporation Common Stock,$16.64,-0.06,-0.359%,"1,909,276,046"
AORT,"Artivion, Inc. Common Stock",$40.43,-0.48,-1.173%,"1,907,635,293"
CXM,"Sprinklr, Inc. Class A Common Stock",$7.81,-0.10,-1.264%,"1,906,555,113"
MTX,Minerals Technologies Inc. Common Stock,$60.74,-0.89,-1.444%,"1,905,785,286"
COUR,"Coursera, Inc. Common Stock",$11.62,-0.18,-1.525%,"1,902,194,000"
NTB,Bank of N.T. Butterfield & Son Limited (The) Voting Ordinary Shares,$44.20,-0.36,-0.808%,"1,900,600,000"
ERO,Ero Copper Corp. Common Shares,$18.35,-0.37,-1.976%,"1,900,547,411"
ARMN,Aris Mining Corporation Common Shares,$9.39,0.03,0.321%,"1,900,536,000"
NHC,National HealthCare Corporation Common Stock,$122.28,-2.53,-2.027%,"1,895,451,397"
CENTA,Central Garden & Pet Company Class A Common Stock Nonvoting,$30.11,-0.31,-1.019%,"1,893,048,008"
SKWD,"Skyward Specialty Insurance Group, Inc. Common Stock",$46.73,-1.15,-2.402%,"1,891,941,435"
