Symbol,Name,Last Sale,Net Change,% Change,Market Cap
NMIH,NMI Holdings Inc. Common Stock,$35.94,-0.98,-2.654%,"2,788,013,873"
CAKE,Cheesecake Factory Incorporated (The) Common Stock,$55.91,-0.24,-0.427%,"2,784,900,974"
ABM,ABM Industries Incorporated Common Stock,$45.44,-0.25,-0.547%,"2,782,468,189"
BSM,"Black Stone Minerals, L.P. Common units representing limited partner interests",$13.13,0.18,1.39%,"2,781,629,509"
TPH,"Tri Pointe Homes, Inc. Common Stock",$32.36,-0.77,-2.324%,"2,781,455,163"
FTAIM,FTAI Aviation Ltd. 9.500% Fixed-Rate Reset Series D Cumulative Perpetual Redeemable Preferred Shares,$27.035,0.185,0.689%,"2,772,996,117"
APLE,"Apple Hospitality REIT, Inc. Common Shares",$11.70,0.03,0.257%,"2,772,781,187"
WBI,WaterBridge Infrastructure LLC Class A Shares Representing Limited Liability Company Interests,$24.26,-0.27,-1.101%,"2,765,640,000"
SBCF,Seacoast Banking Corporation of Florida Common Stock,$31.42,-0.02,-0.064%,"2,760,395,145"
GLOB,Globant S.A. Common Shares,$62.64,2.86,4.784%,"2,759,013,753"
PLBL,Polibeli Group Ltd Class A Ordinary Shares,$7.42,-0.185,-2.433%,"2,758,830,200"
OLN,Olin Corporation Common Stock,$24.02,-0.04,-0.166%,"2,753,689,671"
USAC,"USA Compression Partners, LP Common Units Representing Limited Partner Interests",$22.41,-0.62,-2.692%,"2,749,347,252"
GRND,Grindr Inc. Common Stock,$14.32,-0.74,-4.914%,"2,749,120,005"
RNG,"RingCentral, Inc. Class A Common Stock",$30.31,0.34,1.134%,"2,744,349,843"
EXTR,"Extreme Networks, Inc. Common Stock",$20.74,-0.15,-0.718%,"2,742,027,228"
MTRN,Materion Corporation,$132.19,-2.20,-1.637%,"2,739,891,158"
RNW,ReNew Energy Global plc Class A Ordinary Shares,$7.55,-0.03,-0.396%,"2,738,907,037"
FOLD,"Amicus Therapeutics, Inc. Common Stock",$8.88,0.21,2.422%,"2,737,165,641"
RXRX,"Recursion Pharmaceuticals, Inc. Class A Common Stock",$6.30,0.26,4.305%,"2,735,154,671"
LBRT,Liberty Energy Inc. Class A common stock,$16.88,0.48,2.927%,"2,734,002,150"
BCC,"Boise Cascade, L.L.C. Common Stock",$73.02,-0.07,-0.096%,"2,726,382,278"
ACMR,"ACM Research, Inc. Class A Common Stock",$42.43,0.71,1.702%,"2,723,198,345"
FRPT,"Freshpet, Inc. Common Stock",$55.82,1.70,3.141%,"2,722,892,511"
NMFCZ,New Mountain Finance Corporation 8.250% Notes due 2028,$25.58,0.06,0.235%,"2,720,713,382"
FLO,"Flowers Foods, Inc. Common Stock",$12.85,0.31,2.472%,"2,713,640,191"
FUN,Six Flags Entertainment Corporation Common Stock New,$26.74,1.03,4.006%,"2,708,210,140"
OXLC,Oxford Lane Capital Corp. Common Stock,$15.60,0.14,0.906%,"2,708,160,000"
BEAM,Beam Therapeutics Inc. Common Stock,$26.73,-1.23,-4.399%,"2,704,060,955"
IAC,IAC Inc. Common Stock,$33.65,-0.29,-0.854%,"2,697,292,169"
VNET,"VNET Group, Inc. American Depositary Shares",$10.02,0.40,4.158%,"2,695,639,528"
GSHD,"Goosehead Insurance, Inc. Class A Common Stock",$73.00,-0.905,-1.225%,"2,689,631,710"
MLYS,"Mineralys Therapeutics, Inc. Common Stock",$40.56,0.66,1.654%,"2,688,932,663"
CPRI,Capri Holdings Limited Ordinary Shares,$22.54,0.27,1.212%,"2,683,343,205"
BATRA,"Atlanta Braves Holdings, Inc. Series A Common Stock",$42.66,0.02,0.047%,"2,677,136,960"
BHF,"Brighthouse Financial, Inc. Common Stock",$46.81,0.17,0.364%,"2,675,302,487"
PPTA,Perpetua Resources Corp. Common Shares,$24.84,1.54,6.609%,"2,672,035,372"
CON,"Concentra Group Holdings Parent, Inc. Common Stock",$20.79,-0.12,-0.574%,"2,664,674,092"
KEN,Kenon Holdings Ltd. Ordinary Shares,$51.0085,1.1985,2.406%,"2,660,105,619"
HURN,Huron Consulting Group Inc. Common Stock,$153.64,0.57,0.372%,"2,659,030,119"
FTAIN,FTAI Aviation Ltd. 8.25% Fixed - Rate Reset Series C Cumulative Perpetual Redeemable Preferred Shares,$25.88,0.0602,0.233%,"2,654,527,076"
TVTX,"Travere Therapeutics, Inc. Common Stock",$29.77,1.71,6.094%,"2,653,658,295"
ATS,ATS Corporation Common Shares,$27.16,0.09,0.332%,"2,652,262,189"
CIVI,"Civitas Resources, Inc. Common Stock",$28.58,0.04,0.14%,"2,648,223,057"
ZGN,Ermenegildo Zegna N.V. Ordinary Shares,$10.48,0.04,0.383%,"2,647,037,132"
WDFC,WD-40 Company Common Stock,$195.38,-7.13,-3.521%,"2,644,246,348"
HCI,"HCI Group, Inc. Common Stock",$204.00,-2.40,-1.163%,"2,643,797,976"
VTMX,"Corporacion Inmobiliaria Vesta, S.A.B de C.V. American Depositary Shares, each representing ten (10) Common Shares",$29.79,1.02,3.545%,"2,634,885,105"
PENN,"PENN Entertainment, Inc. Common Stock",$18.04,0.32,1.806%,"2,633,925,041"
BBAI,"BigBear.ai, Inc. Common Stock",$7.10,0.05,0.709%,"2,631,992,706"
DIOD,Diodes Incorporated Common Stock,$56.63,-0.42,-0.736%,"2,630,052,083"
ODD,ODDITY Tech Ltd. Class A Ordinary Shares,$47.05,1.31,2.864%,"2,626,721,092"
MFAO,"MFA Financial, Inc. 9.000% Senior Notes due 2029",$25.575,0.035,0.137%,"2,625,752,054"
WRBY,Warby Parker Inc. Class A Common Stock,$21.50,0.24,1.129%,"2,622,107,363"
CPRX,"Catalyst Pharmaceuticals, Inc. Common Stock",$21.39,0.43,2.052%,"2,617,943,704"
ACLS,"Axcelis Technologies, Inc. Common Stock",$83.25,-0.06,-0.072%,"2,615,620,095"
CVBF,CVB Financial Corporation Common Stock,$18.96,-0.11,-0.577%,"2,613,021,677"
AMSC,American Superconductor Corporation Common Stock,$57.85,-1.73,-2.904%,"2,612,559,569"
XRAY,DENTSPLY SIRONA Inc. Common Stock,$13.09,-0.02,-0.153%,"2,611,243,740"
MFAN,"MFA Financial, Inc. 8.875% Senior Notes due 2029",$25.4001,0.1301,0.515%,"2,607,795,298"
ADPT,Adaptive Biotechnologies Corporation Common Stock,$17.12,-0.10,-0.581%,"2,606,929,425"
CURB,Curbline Properties Corp. Common Stock,$24.75,0.24,0.979%,"2,604,062,043"
AKR,Acadia Realty Trust Common Stock,$19.84,-0.05,-0.251%,"2,599,299,487"
DAN,Dana Incorporated Common Stock ,$19.79,-0.09,-0.453%,"2,595,530,397"
SEZL,Sezzle Inc. Common Stock,$76.28,-0.68,-0.884%,"2,595,309,910"
HCM,HUTCHMED (China) Limited American Depositary Shares,$14.86,0.10,0.678%,"2,592,026,813"
SFNC,Simmons First National Corporation Class A Common Stock,$17.90,0.03,0.168%,"2,590,146,916"
TR,"Tootsie Roll Industries, Inc. Common Stock",$35.38,-2.08,-5.553%,"2,582,266,969"
UE,Urban Edge Properties Common Shares of Beneficial Interest,$20.51,0.03,0.146%,"2,579,975,440"
SHOO,"Steven Madden, Ltd. Common Stock",$35.44,-0.19,-0.533%,"2,574,800,772"
ALRM,"Alarm.com Holdings, Inc. Common Stock",$51.50,-0.25,-0.483%,"2,570,109,148"
XMTR,"Xometry, Inc. Class A Common Stock",$50.43,0.66,1.326%,"2,561,659,830"
AUGO,Aura Minerals Inc. Common Shares,$30.84,-2.54,-7.609%,"2,548,305,252"
BOH,Bank of Hawaii Corporation Common Stock,$64.07,0.17,0.266%,"2,547,904,238"
FCPT,"Four Corners Property Trust, Inc. Common Stock",$24.34,-0.13,-0.531%,"2,542,661,354"
BANC,"Banc of California, Inc. Common Stock",$17.20,0.22,1.296%,"2,541,787,998"
CDTX,"Cidara Therapeutics, Inc. Common Stock",$99.98,6.86,7.367%,"2,535,297,939"
AI,"C3.ai, Inc. Class A Common Stock",$18.36,0.51,2.857%,"2,530,920,419"
PRK,Park National Corporation Common Stock,$157.31,-2.23,-1.398%,"2,528,183,597"
PTEN,"Patterson-UTI Energy, Inc. Common Stock",$6.56,-0.07,-1.056%,"2,526,698,813"
INOD,Innodata Inc. Common Stock,$79.34,2.69,3.509%,"2,526,631,649"
BWSN,"Babcock & Wilcox Enterprises, Inc. 8.125% Senior Notes due 2026",$24.99,0.005,0.02%,"2,526,427,575"
HP,"Helmerich & Payne, Inc. Common Stock",$25.40,-0.24,-0.936%,"2,525,771,758"
CMPO,"CompoSecure, Inc. Class A Common Stock",$20.22,-0.37,-1.797%,"2,519,447,122"
IBRX,"ImmunityBio, Inc. Common Stock",$2.66,0.19,7.692%,"2,514,377,462"
QUBT,Quantum Computing Inc. Common Stock,$15.72,0.19,1.223%,"2,513,363,700"
BITF,Bitfarms Ltd. Common Stock,$4.54,-0.07,-1.518%,"2,508,802,243"
AGIO,"Agios Pharmaceuticals, Inc. Common Stock",$43.08,-0.25,-0.577%,"2,503,013,395"
DRVN,Driven Brands Holdings Inc. Common Stock,$15.235,-0.065,-0.425%,"2,502,805,053"
DNN,Denison Mines Corp Ordinary Shares (Canada),$2.78,-0.03,-1.068%,"2,492,416,995"
TOWN,TowneBank Common Stock,$33.37,-0.33,-0.979%,"2,489,980,302"
CLVT,Clarivate Plc Ordinary Shares,$3.70,0.05,1.37%,"2,487,210,537"
PFS,"Provident Financial Services, Inc Common Stock",$18.99,UNCH,--,"2,480,552,665"
GDV,Gabelli Dividend & Income Trust Common Shares of Beneficial Interest,$27.44,0.19,0.697%,"2,474,772,193"
FA,First Advantage Corporation Common Stock,$14.22,-0.17,-1.181%,"2,474,145,763"
BATRK,"Atlanta Braves Holdings, Inc. Series C Common Stock",$39.42,0.01,0.025%,"2,473,810,102"
BUR,Burford Capital Limited Ordinary Shares,$11.29,0.60,5.613%,"2,470,382,862"
ALKT,"Alkami Technology, Inc. Common Stock",$23.73,-0.08,-0.336%,"2,469,892,865"
HAE,Haemonetics Corporation Common Stock,$51.21,-0.05,-0.098%,"2,467,157,280"
ITGR,Integer Holdings Corporation Common Stock,$70.20,-2.71,-3.717%,"2,459,697,505"
WSBCO,"WesBanco, Inc. Depositary Shares each representing 1/40th interest in a share of 7.375% Fixed-Rate Reset Non-Cumulative Perpetual Preferred Stock, Series B",$25.58,0.01,0.039%,"2,455,419,672"
ALVO,Alvotech Ordinary Shares,$8.13,-0.27,-3.214%,"2,453,680,154"
ATEC,"Alphatec Holdings, Inc. Common Stock",$16.58,0.47,2.917%,"2,453,570,990"
SPHR,Sphere Entertainment Co. Class A Common Stock,$68.04,0.80,1.19%,"2,449,400,333"
HBI,Hanesbrands Inc. Common Stock,$6.92,0.06,0.875%,"2,447,819,475"
DXC,DXC Technology Company Common Stock ,$13.43,-0.11,-0.812%,"2,443,733,423"
VAC,Marriott Vacations Worldwide Corporation Common Stock,$70.59,0.09,0.128%,"2,442,590,404"
FSM,Fortuna Mining Corp. Common Shares,$7.94,-0.22,-2.696%,"2,437,262,289"
WSBCP,"WesBanco, Inc. Depositary Shares, Each Representing a 1/40th Interest in a Share of 6.75% Fixed-Rate Reset Non-Cumulative Perpetual Preferred Stock, Series A",$25.35,UNCH,--,"2,433,342,013"
TIC,"TIC Solutions, Inc. Common Stock",$12.11,-0.35,-2.809%,"2,429,141,969"
DKL,"Delek Logistics Partners, L.P. Common Units representing Limited Partner Interests",$45.39,0.09,0.199%,"2,426,723,198"
SAM,"Boston Beer Company, Inc. (The) Common Stock",$227.52,-4.08,-1.762%,"2,424,991,887"
SM,SM Energy Company Common Stock,$21.09,0.30,1.443%,"2,424,379,269"
MH,"McGraw Hill, Inc. Common Stock",$12.67,-0.03,-0.236%,"2,419,989,246"
WBTN,WEBTOON Entertainment Inc. Common stock,$18.52,0.30,1.647%,"2,418,865,272"
SBET,"SharpLink Gaming, Inc. Common Stock",$14.31,0.39,2.802%,"2,416,482,820"
GEMI,"Gemini Space Station, Inc. Class A Common Stock",$20.33,0.57,2.885%,"2,414,859,793"
POWI,"Power Integrations, Inc. Common Stock",$43.04,0.03,0.07%,"2,414,353,849"
TDW,Tidewater Inc. Common Stock,$48.68,-0.63,-1.278%,"2,409,287,501"
NSA,National Storage Affiliates Trust Common Shares of Beneficial Interest,$31.36,-0.20,-0.634%,"2,407,351,999"
SPNS,Sapiens International Corporation N.V. Common Shares (Cayman Islands),$43.07,-0.03,-0.07%,"2,407,062,781"
PRDO,Perdoceo Education Corporation Common Stock,$37.03,0.15,0.407%,"2,405,223,624"
GEO,Geo Group Inc (The) REIT,$16.99,-0.28,-1.621%,"2,404,673,109"
INSW,"International Seaways, Inc. Common Stock ",$48.68,0.41,0.849%,"2,403,150,316"
ENVX,Enovix Corporation Common Stock,$12.17,-0.15,-1.218%,"2,392,622,158"
MFICL,MidCap Financial Investment Corporation 8.00% Notes due 2028,$25.52,0.02,0.078%,"2,381,108,433"
CHEF,"The Chefs' Warehouse, Inc. Common Stock",$58.33,-0.21,-0.359%,"2,377,685,841"
BWNB,"Babcock & Wilcox Enterprises, Inc. 6.50% Senior Notes due 2026",$23.4654,-0.0346,-0.147%,"2,372,294,262"
MEOH,Methanex Corporation Common Stock,$35.18,-0.52,-1.457%,"2,370,963,558"
DNLI,Denali Therapeutics Inc. Common Stock,$16.21,0.25,1.566%,"2,370,101,026"
PGY,Pagaya Technologies Ltd. Class A Ordinary Shares,$29.01,-0.03,-0.103%,"2,367,460,438"
UNFI,"United Natural Foods, Inc. Common Stock",$38.96,-0.58,-1.467%,"2,363,017,543"
SEDG,"SolarEdge Technologies, Inc. Common Stock",$39.74,0.04,0.101%,"2,359,554,274"
PAX,Patria Investments Limited Class A Common Shares,$14.91,0.18,1.222%,"2,356,904,095"
ARQT,"Arcutis Biotherapeutics, Inc. Common Stock",$19.64,-0.47,-2.337%,"2,354,935,732"
CSTM,Constellium SE Ordinary Shares (France),$16.85,-0.05,-0.296%,"2,351,232,538"
VSH,"Vishay Intertechnology, Inc. Common Stock",$17.34,0.50,2.969%,"2,351,057,980"
PCT,"PureCycle Technologies, Inc. Common stock",$12.99,-0.11,-0.84%,"2,339,409,291"
TRMK,Trustmark Corporation Common Stock,$38.73,-0.01,-0.026%,"2,337,997,372"
WAFD,"WaFd, Inc. Common Stock",$29.62,0.05,0.169%,"2,333,820,639"
COCO,"The Vita Coco Company, Inc. Common Stock",$40.98,1.315,3.315%,"2,328,605,761"
AAOI,"Applied Optoelectronics, Inc. Common Stock",$37.22,3.21,9.438%,"2,320,810,148"
DBRG,"DigitalBridge Group, Inc.",$12.74,0.28,2.247%,"2,320,254,944"
PINC,"Premier, Inc. Class A Common Stock",$28.10,-0.02,-0.071%,"2,319,644,912"
KWR,Quaker Houghton Common Stock,$133.15,-0.59,-0.441%,"2,316,093,520"
ASH,Ashland Inc. Common Stock,$50.67,0.15,0.297%,"2,315,920,892"
OII,"Oceaneering International, Inc. Common Stock",$23.20,-0.39,-1.653%,"2,314,784,895"
INSP,"Inspire Medical Systems, Inc. Common Stock",$78.20,0.68,0.877%,"2,312,711,511"
ATKR,Atkore Inc. Common Stock,$68.55,0.22,0.322%,"2,307,101,183"
FFBC,First Financial Bancorp. Common Stock,$24.03,-0.06,-0.249%,"2,300,967,563"
APPN,Appian Corporation Class A Common Stock,$31.08,-0.54,-1.708%,"2,300,913,224"
SRPT,"Sarepta Therapeutics, Inc. Common Stock (DE)",$23.50,0.69,3.025%,"2,296,265,793"
ABR,Arbor Realty Trust Common Stock,$11.93,0.11,0.931%,"2,294,155,869"
BHC,Bausch Health Companies Inc. Common Stock,$6.20,UNCH,--,"2,292,699,978"
BUSEP,"First Busey Corporation Depositary Shares, Each Representing a 1/40thInterest in a Share of 8.25% Fixed-Rate Series B Non-Cumulative Perpetual Preferred Stock, $0.001 par value",$25.70,0.10,0.391%,"2,288,993,887"
SA,"Seabridge Gold, Inc. Ordinary Shares (Canada)",$22.39,-1.15,-4.885%,"2,286,669,743"
LUNR,"Intuitive Machines, Inc. Class A Common Stock",$12.79,-0.02,-0.156%,"2,285,813,311"
IHS,IHS Holding Limited Ordinary Shares,$6.84,0.06,0.885%,"2,280,736,009"
GCMG,GCM Grosvenor Inc. Class A Common Stock,$11.70,-0.01,-0.085%,"2,280,167,955"
TRN,"Trinity Industries, Inc. Common Stock",$28.20,-0.07,-0.248%,"2,279,613,524"
DK,"Delek US Holdings, Inc. Common Stock",$37.85,0.45,1.203%,"2,276,768,605"
EXK,Endeavour Silver Corporation Ordinary Shares (Canada),$7.82,-0.27,-3.337%,"2,269,138,980"
ADAMI,"Adamas Trust, Inc. 9.125% Senior Notes Due 2029",$25.0395,-0.01,-0.04%,"2,268,064,113"
FORTY,Formula Systems (1985) Ltd. American Depositary Shares,$148.00,6.25,4.409%,"2,267,014,716"
COGT,"Cogent Biosciences, Inc. Common Stock",$16.20,1.07,7.072%,"2,263,152,895"
ADAMM,"Adamas Trust, Inc. 7.875% Series E Fixed-to-Floating Rate Cumulative Redeemable Preferred Stock",$25.0164,0.0862,0.346%,"2,259,330,749"
PK,Park Hotels & Resorts Inc. Common Stock ,$11.28,0.23,2.081%,"2,255,024,235"
SFB,Stifel Financial Corporation 5.20% Senior Notes due 2047,$22.06,0.05,0.227%,"2,253,945,336"
AMBP,Ardagh Metal Packaging S.A. Ordinary Shares,$3.77,-0.02,-0.528%,"2,253,327,439"
IVT,InvenTrust Properties Corp. Common Stock,$28.92,0.03,0.104%,"2,244,376,972"
PMTU,PennyMac Mortgage Investment Trust 8.50% Senior Notes due 2028,$25.7899,0.2498,0.978%,"2,244,149,515"
ALG,"Alamo Group, Inc. Common Stock",$185.02,-3.08,-1.637%,"2,240,760,568"
METC,"Ramaco Resources, Inc. Class A Common Stock",$33.97,-0.90,-2.581%,"2,238,526,321"
ADUS,Addus HomeCare Corporation Common Stock,$121.46,-0.17,-0.14%,"2,235,743,249"
LCII,LCI Industries,$92.06,0.02,0.022%,"2,231,928,693"
DEI,"Douglas Emmett, Inc. Common Stock",$13.32,-0.03,-0.225%,"2,230,385,382"
PAYO,Payoneer Global Inc. Common Stock,$6.19,0.12,1.977%,"2,230,353,211"
SAH,"Sonic Automotive, Inc. Common Stock",$64.86,0.53,0.824%,"2,216,440,284"
EPAC,Enerpac Tool Group Corp. Common Stock,$41.81,-0.66,-1.554%,"2,215,158,438"
SID,Companhia Siderurgica Nacional S.A. Common Stock,$1.67,0.04,2.454%,"2,214,576,891"
HI,Hillenbrand Inc Common Stock,$31.41,0.04,0.128%,"2,213,841,096"
CGAU,Centerra Gold Inc. Common Shares,$10.83,-0.33,-2.957%,"2,212,850,493"
HUBG,"Hub Group, Inc. Class A Common Stock",$36.12,0.50,1.404%,"2,211,251,266"
ETNB,"89bio, Inc. Common Stock",$14.83,0.04,0.27%,"2,199,411,348"
AMRC,"Ameresco, Inc. Class A Common Stock",$41.55,-0.92,-2.166%,"2,189,837,031"
OSW,OneSpaWorld Holdings Limited Common Shares,$21.32,0.09,0.424%,"2,189,505,050"
EVCM,EverCommerce Inc. Common Stock,$12.04,0.26,2.207%,"2,182,596,198"
CUBI,"Customers Bancorp, Inc Common Stock",$68.90,-1.21,-1.726%,"2,178,858,461"
IQ,"iQIYI, Inc. American Depositary Shares",$2.26,0.08,3.67%,"2,176,286,996"
CCOI,"Cogent Communications Holdings, Inc.",$44.14,1.18,2.747%,"2,170,924,775"
MRX,Marex Group plc Ordinary Shares,$30.83,0.25,0.818%,"2,167,068,015"
ARDT,"Ardent Health, Inc. Common Stock",$15.14,-0.07,-0.46%,"2,166,631,608"
SPNT,SiriusPoint Ltd. Common Shares,$18.51,0.15,0.817%,"2,161,219,067"
BULLW,Webull Corporation Warrants,$4.68,0.04,0.862%,"2,159,591,813"
BANR,Banner Corporation Common Stock,$62.42,-0.77,-1.219%,"2,158,764,615"
TSLX,"Sixth Street Specialty Lending, Inc. Common Stock",$22.89,0.41,1.824%,"2,157,161,566"
MQ,"Marqeta, Inc. Class A Common Stock",$4.81,0.09,1.907%,"2,155,999,537"
DFH,"Dream Finders Homes, Inc. Class A Common Stock",$23.19,-0.02,-0.086%,"2,153,926,252"
NOG,"Northern Oil and Gas, Inc. Common Stock",$22.07,0.52,2.413%,"2,153,914,632"
DBD,Diebold Nixdorf Incorporated Common stock,$58.70,-0.03,-0.051%,"2,150,389,033"
AMR,"Alpha Metallurgical Resources, Inc. Common Stock",$164.46,0.15,0.091%,"2,146,831,731"
MSGE,Madison Square Garden Entertainment Corp. Class A Common Stock,$45.19,-0.56,-1.224%,"2,144,710,983"
OUST,"Ouster, Inc. Common Stock",$37.08,1.28,3.575%,"2,143,937,568"
CRGY,Crescent Energy Company Class A Common Stock,$8.42,0.04,0.477%,"2,143,859,799"
MESO,Mesoblast Limited American Depositary Shares,$16.71,-0.10,-0.595%,"2,140,830,374"
PHIN,PHINIA Inc. Common Stock,$54.95,0.25,0.457%,"2,137,800,901"
UPWK,Upwork Inc. Common Stock,$16.12,0.12,0.75%,"2,137,618,053"
NBTB,NBT Bancorp Inc. Common Stock,$40.74,-0.18,-0.44%,"2,134,535,023"
NWL,Newell Brands Inc. Common Stock,$5.09,0.11,2.209%,"2,133,219,000"
SONO,"Sonos, Inc. Common Stock",$17.62,0.22,1.264%,"2,129,910,481"
KLIC,"Kulicke and Soffa Industries, Inc. Common Stock",$40.83,0.02,0.049%,"2,129,101,827"
ERO,Ero Copper Corp. Common Shares,$20.54,-0.25,-1.203%,"2,127,370,236"
FRME,First Merchants Corporation Common Stock,$36.75,-0.52,-1.395%,"2,121,663,458"
ACHC,"Acadia Healthcare Company, Inc. Common Stock",$22.95,-0.435,-1.86%,"2,119,354,286"
AORT,"Artivion, Inc. Common Stock",$44.74,1.34,3.088%,"2,110,996,859"
CSAN,Cosan S.A. ADS,$4.54,0.13,2.948%,"2,109,562,066"
USAR,"USA Rare Earth, Inc. Class A Common Stock",$21.60,-1.97,-8.358%,"2,104,425,079"
LC,LendingClub Corporation Common Stock,$18.33,-0.10,-0.543%,"2,103,186,895"
SVV,"Savers Value Village, Inc. Common Stock",$13.49,UNCH,--,"2,098,450,224"
SBLK,Star Bulk Carriers Corp. Common Shares,$17.91,0.40,2.284%,"2,097,754,080"
CC,Chemours Company (The) Common Stock,$14.00,-0.05,-0.356%,"2,095,776,200"
YELP,Yelp Inc. Common Stock,$32.99,-0.06,-0.182%,"2,080,371,008"
UAA,"Under Armour, Inc. Class A Common Stock",$4.85,0.04,0.832%,"2,079,778,363"
SMA,"SmartStop Self Storage REIT, Inc. Common Stock",$37.51,-0.36,-0.951%,"2,079,574,843"
HE,"Hawaiian Electric Industries, Inc. Common Stock",$12.04,0.18,1.518%,"2,078,246,710"
BKD,Brookdale Senior Living Inc. Common Stock,$8.75,-0.08,-0.906%,"2,078,041,455"
PARR,"Par Pacific Holdings, Inc.  Common Stock",$40.86,0.94,2.355%,"2,076,288,111"
STC,Stewart Information Services Corporation Common Stock,$74.14,-0.57,-0.763%,"2,075,810,495"
BUSE,First Busey Corporation Class A Common Stock,$23.20,-0.28,-1.193%,"2,066,329,112"
TWST,Twist Bioscience Corporation Common Stock,$34.18,0.07,0.205%,"2,063,136,417"
FBNC,First Bancorp Common Stock,$49.70,0.64,1.305%,"2,060,682,175"
HWCPZ,Hancock Whitney Corporation 6.25% Subordinated Notes due 2060,$24.30,0.05,0.206%,"2,059,545,965"
TRMD,TORM plc Class A Common Stock,$21.05,-0.10,-0.473%,"2,058,985,774"
HNI,HNI Corporation Common Stock,$44.95,-0.30,-0.663%,"2,058,900,408"
DRD,DRDGOLD Limited American Depositary Shares,$23.81,-1.34,-5.328%,"2,058,585,719"
SII,Sprott Inc. Common Shares,$79.75,-2.45,-2.981%,"2,057,550,000"
EYE,"National Vision Holdings, Inc. Common Stock",$25.95,0.48,1.885%,"2,055,146,139"
FIHL,Fidelis Insurance Holdings Limited Common Shares,$18.37,0.09,0.492%,"2,053,276,237"
UMBFO,"UMB Financial Corporation Depositary Shares Each Representing a 1/400th Interest in a Share of 7.750% Fixed-Rate Reset Non-Cumulative Perpetual Preferred Stock, Series B",$26.99,-0.05,-0.185%,"2,049,303,602"
CIMN,Chimera Investment Corporation 9.000% Senior Notes due 2029,$25.4368,0.0468,0.184%,"2,048,443,208"
GLPG,Galapagos NV American Depositary Shares,$31.045,-0.915,-2.863%,"2,045,774,569"
NGVT,Ingevity Corporation Common Stock ,$56.09,-1.08,-1.889%,"2,045,393,926"
DHT,"DHT Holdings, Inc.",$12.73,0.23,1.84%,"2,043,903,060"
PBI,Pitney Bowes Inc. Common Stock,$11.87,0.10,0.85%,"2,043,099,963"
SMPL,The Simply Good Foods Company Common Stock,$20.31,0.05,0.247%,"2,041,997,784"
LMAT,"LeMaitre Vascular, Inc. Common Stock",$90.12,0.91,1.02%,"2,040,093,483"
TNK,Teekay Tankers Ltd.,$59.31,0.53,0.902%,"2,039,207,214"
BBT,Beacon Financial Corporation Common stock,$24.19,-0.36,-1.466%,"2,038,545,534"
EFSC,Enterprise Financial Services Corporation Common Stock,$54.92,-0.45,-0.813%,"2,031,376,347"
CENT,Central Garden & Pet Company Common Stock,$32.27,0.26,0.812%,"2,028,849,526"
CHA,Chagee Holdings Limited American Depositary Shares,$17.13,-0.21,-1.211%,"2,026,064,197"
IE,Ivanhoe Electric Inc. Common Stock,$15.25,-0.63,-3.967%,"2,025,462,803"
KN,Knowles Corporation Common Stock,$23.57,-0.43,-1.792%,"2,024,370,873"
PRCT,PROCEPT BioRobotics Corporation Common Stock,$36.35,1.36,3.887%,"2,022,366,455"
GT,The Goodyear Tire & Rubber Company Common Stock,$7.07,-0.17,-2.348%,"2,022,348,486"
ASGN,ASGN Incorporated Common Stock,$46.17,-0.32,-0.688%,"2,022,246,000"
AAUC,Allied Gold Corporation Common Shares,$17.51,-0.60,-3.313%,"2,020,654,000"
TDC,Teradata Corporation Common Stock,$21.37,-0.02,-0.094%,"2,019,465,000"
WWW,"Wolverine World Wide, Inc. Common Stock",$24.85,-1.29,-4.935%,"2,019,170,622"
HTH,Hilltop Holdings Inc.,$32.91,-0.98,-2.892%,"2,018,322,153"
CMBT,CMB.TECH NV Ordinary Shares,$9.17,-0.16,-1.715%,"2,017,626,618"
ANIP,"ANI Pharmaceuticals, Inc.",$92.86,-1.38,-1.464%,"2,015,028,199"
PRCH,"Porch Group, Inc. Common Stock",$16.43,0.06,0.367%,"2,014,007,391"
ADAMN,"Adamas Trust, Inc. 8.00% Series D Fixed-to-Floating Rate Cumulative Redeemable Preferred Stock",$22.28,0.09,0.406%,"2,012,195,564"
AVAH,Aveanna Healthcare Holdings Inc. Common Stock,$9.63,0.20,2.121%,"2,011,672,072"
OCUL,"Ocular Therapeutix, Inc. Common Stock",$11.55,0.06,0.522%,"2,009,644,803"
CERT,"Certara, Inc. Common Stock",$12.51,-0.15,-1.185%,"2,009,400,986"
UA,"Under Armour, Inc. Class C Common Stock",$4.68,0.04,0.862%,"2,006,878,915"
ADAML,"Adamas Trust, Inc. 6.875% Series F Fixed-to-Floating Rate Cumulative Redeemable Preferred Stock, $0.01 par value per share",$22.2156,-0.0044,-0.02%,"2,006,379,343"
STRA,"Strategic Education, Inc. Common Stock",$83.94,-0.08,-0.095%,"2,006,200,248"
ARLO,"Arlo Technologies, Inc. Common Stock",$19.22,-0.22,-1.132%,"2,006,003,970"
QDEL,QuidelOrtho Corporation Common Stock,$29.48,-1.03,-3.376%,"2,001,705,738"
CEPU,Central Puerto S.A. American Depositary Shares (each represents ten Common Shares),$13.16,3.71,39.259%,"1,992,453,294"
DQ,"DAQO New Energy Corp. American Depositary Shares, each representing five ordinary shares",$29.69,3.66,14.061%,"1,990,913,868"
SYBT,"Stock Yards Bancorp, Inc. Common Stock",$67.50,-0.41,-0.604%,"1,989,449,910"
LFST,"LifeStance Health Group, Inc. Common Stock",$5.11,-0.09,-1.731%,"1,987,464,973"
CXW,"CoreCivic, Inc. Common Stock",$18.56,-0.22,-1.171%,"1,987,032,635"
ROCK,"Gibraltar Industries, Inc. Common Stock",$67.31,-0.85,-1.247%,"1,986,419,536"
RCUS,"Arcus Biosciences, Inc. Common Stock",$18.60,1.29,7.452%,"1,979,616,154"
OZKAP,Bank OZK 4.625% Series A Non-Cumulative Perpetual Preferred Stock,$17.49,0.01,0.057%,"1,978,750,949"
BELFB,Bel Fuse Inc. Class B Common Stock,$155.89,-1.11,-0.707%,"1,974,115,665"
PLUS,ePlus inc. Common Stock,$74.06,-0.33,-0.444%,"1,971,890,010"
WLYB,"John Wiley & Sons, Inc. Common Stock",$37.0501,UNCH,--,"1,971,158,649"
WLY,"John Wiley & Sons, Inc. Common Stock",$36.92,-0.29,-0.779%,"1,964,237,001"
PRGS,Progress Software Corporation Common Stock (DE),$45.72,-0.29,-0.63%,"1,961,734,238"
VOYG,"Voyager Technologies, Inc. Class A Common Stock",$33.25,-0.10,-0.30%,"1,960,740,530"
LQDA,Liquidia Corporation Common Stock,$22.76,0.38,1.698%,"1,959,441,493"
EVTC,"Evertec, Inc. Common Stock",$30.56,-0.47,-1.515%,"1,955,290,073"
TIGR,UP Fintech Holding Ltd American Depositary Share representing fifteen Class A Ordinary Shares,$10.46,0.18,1.751%,"1,954,931,093"
PNFPP,"Pinnacle Financial Partners, Inc. Depositary shares of Pinnacle Financial Partners, Inc., each representing a 1/40th Interest in a share of its 6.75% Fixed-Rate Non-Cumulative Perpetual Preferred Stock, Series B",$25.20,0.10,0.398%,"1,954,611,490"
CLOV,"Clover Health Investments, Corp. Class A Common Stock",$3.81,-0.01,-0.262%,"1,952,672,819"
SDRL,Seadrill Limited Common Shares,$31.34,-0.54,-1.694%,"1,950,143,503"
NWN,Northwest Natural Holding Company Common Stock,$47.53,-0.24,-0.502%,"1,945,803,530"
CSGS,"CSG Systems International, Inc. Common Stock",$67.62,0.20,0.297%,"1,945,319,073"
JSM,"Navient Corporation 6% Senior Notes due December 15, 2043",$19.545,-0.135,-0.686%,"1,943,379,638"
TRIP,"TripAdvisor, Inc. Common Stock",$16.72,0.10,0.602%,"1,941,753,642"
VERA,"Vera Therapeutics, Inc. Class A Common Stock",$30.41,1.19,4.073%,"1,940,877,653"
NTCT,"NetScout Systems, Inc. Common Stock",$26.98,0.13,0.484%,"1,939,194,758"
DV,"DoubleVerify Holdings, Inc. Common Stock",$11.84,-0.29,-2.391%,"1,937,360,007"
SLDE,"Slide Insurance Holdings, Inc. Common Stock",$15.39,-0.34,-2.161%,"1,931,405,494"
DXPE,"DXP Enterprises, Inc. Common Stock",$123.00,0.92,0.754%,"1,930,372,332"
ADEA,Adeia Inc. Common Stock,$17.64,0.54,3.158%,"1,929,262,069"
PACS,"PACS Group, Inc. Common Stock",$12.60,-0.06,-0.474%,"1,920,236,636"
BWLP,BW LPG Limited Common Shares,$12.66,0.25,2.015%,"1,918,476,688"
