Symbol,Name,Last Sale,Net Change,% Change,Market Cap
ORIO,Orion Digital Corp. Common Shares,$1.13,0.02,1.802%,"27,084,462"
LIXT,"Lixte Biotechnology Holdings, Inc. Common Stock",$3.16,0.12,3.947%,"26,948,723"
IGC,"IGC Pharma, Inc. Common Stock",$0.2806,0.0005,0.179%,"26,886,537"
BAFN,BayFirst Financial Corp. Common Stock,$6.53,0.43,7.049%,"26,838,320"
IRIX,IRIDEX Corporation Common Stock,$1.56,0.08,5.405%,"26,816,370"
WHLRD,"Wheeler Real Estate Investment Trust, Inc. Series D Cumulative Preferred Stock",$38.50,0.34,0.891%,"26,752,033"
AYTU,"Aytu BioPharma, Inc.  Common Stock",$2.61,-0.07,-2.612%,"26,591,223"
NOTE,"FiscalNote Holdings, Inc. Class A common stock",$1.69,0.12,7.643%,"26,549,723"
NXTT,Next Technology Holding Inc. Ordinary Shares,$6.50,-0.24,-3.561%,"26,536,614"
FIEE,"FiEE, Inc Common Stock",$4.20,0.5702,15.709%,"26,443,036"
HBIO,"Harvard Bioscience, Inc. Common Stock",$0.5924,0.0103,1.769%,"26,408,994"
DSY,Big Tree Cloud Holdings Limited Ordinary Shares,$0.2777,0.0017,0.616%,"26,391,898"
VEEA,Veea Inc. Common Stock,$0.5245,0.012,2.341%,"26,309,273"
USGOW,U.S. GoldMining Inc. Warrant,$1.95,1.1036,130.388%,"25,882,730"
RAIN,"Rain Enhancement Technologies Holdco, Inc. Class A Common Stock",$3.14,-0.08,-2.484%,"25,712,936"
BNKK,"Bonk, Inc. Common Stock",$4.84,0.86,21.608%,"25,648,718"
PSHG,Performance Shipping Inc. Common Shares,$2.06,0.01,0.488%,"25,610,245"
CLPS,CLPS Incorporation Common Stock,$0.86,UNCH,--,"25,579,369"
BAERW,"Bridger Aerospace Group Holdings, Inc. Warrant",$0.46,-0.0799,-14.799%,"25,549,828"
KITT,"Nauticus Robotics, Inc. Common stock",$0.9103,0.0093,1.032%,"25,538,942"
XOS,"Xos, Inc. Common Stock",$2.25,0.11,5.14%,"25,501,932"
PLRZ,Polyrizon Ltd. Ordinary Shares,$15.99,1.40,9.596%,"25,487,197"
NNVC,"NanoViricides, Inc. Common Stock",$1.18,0.05,4.425%,"25,450,746"
BRLS,Borealis Foods Inc. Class A Common Shares,$1.18,0.2001,20.42%,"25,326,701"
SURG,"SurgePays, Inc. Common Stock",$1.20,-0.67,-35.829%,"25,249,746"
PRZO,ParaZero Technologies Ltd. Ordinary Shares,$1.19,-0.05,-4.032%,"25,197,492"
CREG,Smart Powerr Corp. Common Stock,$1.21,-0.11,-8.333%,"25,179,039"
MBNKO,"Medallion Bank Fixed-Rate Reset Non-Cumulative Perpetual Preferred Stock, Series G, par value $1.00 per share",$25.05,UNCH,--,"25,050,000"
VTGN,"Vistagen Therapeutics, Inc. Common Stock",$0.6342,-0.011,-1.705%,"25,048,015"
RDI,Reading International Inc Class A Common Stock,$1.10,0.01,0.917%,"24,988,986"
INTZ,Intrusion Inc. Common Stock,$1.24,-0.06,-4.615%,"24,927,644"
LONA,"LeonaBio, Inc. Common Stock",$6.26,0.05,0.805%,"24,688,733"
ECXWW,ECARX Holdings Inc. Warrants,$0.0714,0.0017,2.439%,"24,685,124"
QNTM,Quantum Biopharma Ltd. Class B Subordinate Voting Shares,$6.42,-0.80,-11.08%,"24,671,643"
RECT,Rectitude Holdings Ltd Ordinary Shares,$1.70,-0.02,-1.163%,"24,650,000"
PFAI,Pinnacle Food Group Limited Class A Common Shares,$2.10,-0.01,-0.474%,"24,570,000"
MNDO,MIND C.T.I. Ltd. Ordinary Shares,$1.205,-0.005,-0.413%,"24,541,423"
ADGM,"Adagio Medical Holdings, Inc Common Stock",$0.88,0.009,1.033%,"24,491,575"
EPOW,"Sunrise New Energy Co., Ltd Class A Ordinary Shares",$0.904,-0.005,-0.55%,"24,396,203"
KLTO,"Klotho Neurosciences, Inc. Common Stock",$0.33,0.019,6.109%,"24,267,118"
AUST,Austin Gold Corp. Common Shares,$1.77,-0.03,-1.667%,"24,236,612"
WCT,Wellchange Holdings Company Limited Class A Ordinary shares,$0.1576,-0.0027,-1.684%,"24,154,564"
TOPS,"TOP Ships, Inc. Common Stock",$5.203,0.053,1.029%,"24,070,103"
CHOW,ChowChow Cloud International Holdings Limited Ordinary Shares,$0.68,-0.002,-0.293%,"23,868,000"
INTS,"Intensity Therapeutics, Inc. Common stock",$0.397,-0.0023,-0.576%,"23,845,791"
SAGT,SAGTEC GLOBAL LIMITED Class A Ordinary shares,$1.90,UNCH,--,"23,845,000"
ARKR,Ark Restaurants Corp. Common Stock,$6.60,0.10,1.538%,"23,800,636"
PLAG,Planet Green Holdings Corp. Common Stock,$2.53,-0.10,-3.802%,"23,738,266"
AFRIW,Forafric Global PLC Warrants,$0.8815,0.0381,4.517%,"23,713,753"
JOB,GEE Group Inc. Common Stock,$0.2149,0.0049,2.333%,"23,640,230"
WNW,Meiwu Technology Company Limited Ordinary Shares,$1.51,-0.02,-1.307%,"23,621,463"
SWVL,Swvl Holdings Corp Class A Common Shares,$2.37,-0.05,-2.066%,"23,459,483"
NIXX,"Nixxy, Inc. Common Stock",$0.94,0.0517,5.82%,"23,383,043"
NSYS,Nortech Systems Incorporated Common Stock,$8.35,-0.03,-0.358%,"23,264,219"
HYPD,"Hyperion DeFi, Inc. Common Stock",$2.83,-0.04,-1.394%,"23,128,625"
MTVA,MetaVia Inc. Common Stock,$2.88,-0.12,-4.00%,"23,125,113"
FENG,"Phoenix New Media Limited American Depositary Shares, each representing 48 Class A ordinary shares.",$1.8999,0.0049,0.259%,"22,819,273"
APUS,"Apimeds Pharmaceuticals US, Inc. Common Stock",$1.81,0.13,7.738%,"22,762,529"
GREE,Greenidge Generation Holdings Inc. Class A Common Stock,$1.44,-0.02,-1.37%,"22,750,556"
TLF,"Tandy Leather Factory, Inc. Common Stock",$2.80,-0.07,-2.439%,"22,589,006"
BTOC,Armlogi Holding Corp. Common Stock,$0.4953,-0.0022,-0.442%,"22,507,957"
HHS,"Harte Hanks, Inc. Common Stock",$3.03,-0.07,-2.258%,"22,466,826"
MKDW,MKDWELL Tech Inc. Ordinary Share,$0.1557,-0.0009,-0.575%,"22,361,532"
UTSI,UTStarcom Holdings Corp. Ordinary Shares,$2.36,-0.06,-2.479%,"22,349,802"
HUIZ,Huize Holding Limited American Depositary Shares,$2.21,-0.07,-3.07%,"22,295,753"
EBON,Ebang International Holdings Inc. Class A Ordinary Shares,$3.405,0.015,0.442%,"22,282,109"
REE,REE Automotive Ltd. Class A Ordinary Shares,$0.7168,-0.0088,-1.213%,"22,235,804"
YYAI,AiRWA Inc. Common Stock,$1.17,-0.085,-6.773%,"22,208,396"
VRAR,"The Glimpse Group, Inc. Common Stock",$1.05,-0.04,-3.67%,"22,130,331"
COOT,Australian Oilseeds Holdings Limited Ordinary Shares,$0.786,-0.0145,-1.811%,"21,928,251"
NEUP,Neuphoria Therapeutics Inc. Common Stock,$4.04,0.01,0.248%,"21,724,409"
FBLG,"FibroBiologics, Inc. Common Stock",$0.3265,0.004,1.24%,"21,718,689"
JVA,"Coffee Holding Co., Inc. Common Stock",$3.80,-0.02,-0.524%,"21,692,676"
IDAI,T Stamp Inc. Class A Common Stock,$4.11,0.22,5.656%,"21,552,150"
MYND,"Mynd.ai, Inc. American Depositary Shares",$0.47,0.0052,1.119%,"21,454,458"
APLM,Apollomics Inc. Class A Ordinary Shares,$19.365,-0.765,-3.80%,"21,366,334"
WETH,Wetouch Technology Inc. Common Stock,$1.79,-0.0572,-3.097%,"21,357,446"
YHC,LQR House Inc. Common Stock,$0.9974,0.0184,1.879%,"21,316,090"
SQFTP,"Presidio Property Trust, Inc. 9.375% Series D Cumulative Redeemable Perpetual Preferred Stock, $0.01 par value per share",$14.81,0.58,4.076%,"21,313,056"
CKX,"CKX Lands, Inc. Common Stock",$10.375,1.175,12.772%,"21,301,213"
RVP,"Retractable Technologies, Inc. Common Stock",$0.7101,-0.0116,-1.607%,"21,258,377"
NCEW,New Century Logistics (BVI) Limited Ordinary Shares,$7.91,0.12,1.54%,"21,258,125"
AGPU,Axe Compute Inc. Common Stock,$6.25,0.26,4.341%,"21,209,475"
TC,Token Cat Limited American Depositary Shares,$10.6499,0.0799,0.756%,"21,169,648"
MXC,Mexco Energy Corporation Common Stock,$10.29,0.02,0.195%,"21,053,340"
KTTA,Pasithea Therapeutics Corp. Common Stock,$0.9099,-0.0175,-1.887%,"21,010,557"
GTEC,Greenland Technologies Holding Corporation Ordinary Shares,$1.20,-0.24,-16.667%,"20,873,071"
MLSS,"Milestone Scientific, Inc. Common Stock",$0.2652,-0.0165,-5.857%,"20,852,388"
SCNX,"Scienture Holdings, Inc. Common Stock",$0.5099,0.0137,2.761%,"20,717,653"
EKSO,"Ekso Bionics Holdings, Inc. Common Stock",$7.85,-0.37,-4.501%,"20,592,379"
ACCL,Acco Group Holdings Limited Ordinary Shares,$1.48,-0.26,-14.943%,"20,572,000"
EVGOW,EVgo Inc. Warrants,$0.0667,-0.0026,-3.752%,"20,542,448"
LRE,"Lead Real Estate Co., Ltd American Depositary Shares",$1.49,-0.05,-3.247%,"20,326,431"
RVSN,Rail Vision Ltd. Ordinary Share,$0.344,-0.0171,-4.736%,"20,318,386"
BATL,Battalion Oil Corporation Common Stock,$1.23,UNCH,--,"20,241,572"
ASTI,"Ascent Solar Technologies, Inc. Common Stock",$4.45,-0.05,-1.111%,"20,190,607"
VBIX,Viewbix Inc. Common Stock,$1.89,UNCH,--,"20,167,041"
LGPS,LogProstyle Inc. Common Shares,$0.8518,-0.0482,-5.356%,"20,146,867"
FATBB,FAT Brands Inc. Class B Common Stock,$1.12,0.085,8.213%,"20,092,044"
AUID,authID Inc. Common Stock,$1.49,0.07,4.93%,"20,031,173"
CISO,"CISO Global, Inc. Common Stock",$0.4547,-0.0161,-3.42%,"20,027,872"
LEXX,Lexaria Bioscience Corp. Common Stock,$0.80,0.0643,8.74%,"19,909,957"
CTRM,Castor Maritime Inc. Common Shares,$2.06,0.08,4.04%,"19,904,449"
PDC,Perpetuals.com Ltd American Depositary Shares,$6.52,0.31,4.992%,"19,889,716"
GYRO,"Gyrodyne, LLC Common Stock",$9.02,0.32,3.678%,"19,837,758"
ZJYL,JIN MEDICAL INTERNATIONAL LTD. Ordinary Shares,$0.1266,-0.0054,-4.091%,"19,818,863"
NINE,"Nine Energy Service, Inc. Common Stock",$0.4567,0.0197,4.508%,"19,803,124"
SGRP,"SPAR Group, Inc. Common Stock",$0.8201,-0.0021,-0.255%,"19,641,388"
EONR,EON Resources Inc. Class A Common Stock,$0.392,0.0029,0.745%,"19,587,591"
NTRBW,Nutriband Inc. Warrant,$1.60,UNCH,--,"19,479,813"
COSM,Cosmos Health Inc. Common Stock,$0.52,0.0247,4.987%,"19,464,911"
TRAW,"Traws Pharma, Inc. Common Stock",$2.43,-0.15,-5.814%,"19,417,807"
EQS,"Equus Total Return, Inc. Common Stock",$1.39,-0.01,-0.714%,"19,413,707"
LIMN,"Liminatus Pharma, Inc. Class A Common Stock",$0.7155,-0.0145,-1.986%,"19,364,745"
MVO,MV Oil Trust Units of Beneficial Interests,$1.68,0.03,1.818%,"19,320,000"
TRSG,Tungray Technologies Inc Class A Ordinary Shares,$1.18,-0.0099,-0.832%,"19,297,112"
MSGM,Motorsport Games Inc. Class A Common Stock,$3.33,-0.04,-1.187%,"19,242,239"
VYNE,VYNE Therapeutics Inc. Common Stock,$0.5797,0.0058,1.011%,"19,155,386"
BCAB,"BioAtla, Inc. Common Stock",$0.30,-0.0206,-6.425%,"19,039,297"
FATBP,FAT Brands Inc. 8.25% Series B Cumulative Preferred Stock,$1.06,0.074,7.505%,"19,015,685"
NOTV,"Inotiv, Inc. Common Stock",$0.5527,0.0105,1.937%,"18,994,780"
COCH,"Envoy Medical, Inc. Class A Common Stock",$0.655,-0.0041,-0.622%,"18,952,399"
RMCF,"Rocky Mountain Chocolate Factory, Inc. Common Stock",$2.03,-0.07,-3.333%,"18,945,629"
EHLD,Euroholdings Ltd. Common Stock ,$6.7238,-0.0562,-0.829%,"18,938,356"
ALUR,"Allurion Technologies, Inc. Common Stock",$1.54,-0.06,-3.75%,"18,926,960"
DLPN,"Dolphin Entertainment, Inc. Common Stock",$1.56,UNCH,--,"18,910,978"
PIII,P3 Health Partners Inc. Class A Common Stock,$2.62,-0.28,-9.655%,"18,878,643"
TJGC,TJGC Group Limited Ordinary Shares,$1.23,0.02,1.653%,"18,819,000"
NXPL,NextPlat Corp Common Stock,$0.713,0.0075,1.063%,"18,755,456"
GAUZ,Gauzy Ltd. Ordinary Shares,$1.00,0.1079,12.095%,"18,742,093"
ANGH,Anghami Inc. Ordinary Shares,$2.80,-0.32,-10.256%,"18,728,396"
SLAI,SOLAI Limited American Depositary Shares (each representing one hundred (100) Class A Ordinary Shares),$1.00,-0.02,-1.961%,"18,678,535"
ALLR,"Allarity Therapeutics, Inc. Common Stock",$1.18,0.02,1.724%,"18,646,474"
NWGL,CL Workshop Group Limited American Depositary Shares,$1.1202,0.0002,0.018%,"18,542,855"
MWYN,"Marwynn Holdings, Inc. Common stock",$0.9148,-0.0119,-1.284%,"18,474,207"
TOMZ,"TOMI Environmental Solutions, Inc. Common Stock",$0.761,-0.0135,-1.743%,"18,468,118"
CCM,Concord Medical Services Holdings Limited American Depositary Shares (Each represents thirty (30) Class A ordinary shares),$4.25,0.20,4.938%,"18,452,323"
BGI,Birks Group Inc. Common Stock,$0.9332,-0.0006,-0.064%,"18,285,762"
CYN,Cyngn Inc. Common Stock,$2.275,0.045,2.018%,"18,141,715"
WKSP,"Worksport, Ltd. Common Stock",$2.19,UNCH,--,"18,077,112"
CETX,Cemtrex Inc. Common Stock,$2.10,-0.04,-1.869%,"18,061,159"
CLGN,CollPlant Biotechnologies Ltd Ordinary Shares,$1.41,-0.06,-4.082%,"18,014,703"
HUDI,"Huadi International Group Co., Ltd. Ordinary Shares",$1.255,-0.035,-2.713%,"17,920,373"
LGCB,Linkage Global Inc. Class A Ordinary Shares,$1.60,0.03,1.911%,"17,864,835"
OSRH,"OSR Holdings, Inc. Common Stock",$0.695,-0.0238,-3.311%,"17,842,588"
QCLS,"Q/C Technologies, Inc. Common Stock",$4.27,0.075,1.788%,"17,792,065"
PMN,ProMIS Neurosciences Inc. Common Shares (ON),$8.2512,0.0867,1.062%,"17,760,246"
KAPA,"Kairos Pharma, Ltd. Common Stock",$0.85,-0.0248,-2.835%,"17,698,150"
UHGWW,"United Homes Group, Inc. Warrant",$0.30,UNCH,--,"17,644,091"
SNYR,Synergy CHC Corp. Common Stock,$1.84,0.03,1.657%,"17,578,815"
HOVRW,New Horizon Aircraft Ltd. Warrant,$0.3961,0.046,13.139%,"17,528,514"
RDZNW,"Roadzen, Inc. Warrants",$0.22,UNCH,--,"17,489,467"
TSE,Trinseo PLC Ordinary Shares ,$0.4827,0.0023,0.479%,"17,374,105"
FEDU,"Four Seasons Education (Cayman) Inc. American Depositary Shares, each ADS representing 10 ordinary shares",$7.68,-3.32,-30.182%,"17,357,245"
VVOS,"Vivos Therapeutics, Inc. Common Stock",$1.83,-0.14,-7.107%,"17,271,152"
LIQT,"LiqTech International, Inc. Common Stock",$1.79,0.08,4.678%,"17,232,445"
FTRK,FAST TRACK GROUP Ordinary shares,$0.7833,-0.0508,-6.09%,"17,085,731"
AIIOW,Robo.ai Inc. Warrant,$0.0455,0.0015,3.409%,"16,850,854"
IZM,ICZOOM Group Inc. Class A Ordinary Shares,$1.40,-0.01,-0.709%,"16,825,354"
KALA,"KALA BIO, Inc. Common Stock",$0.6026,UNCH,--,"16,782,244"
MDCXW,Medicus Pharma Ltd. Warrant,$0.80,UNCH,--,"16,776,898"
ITRM,Iterum Therapeutics plc Ordinary Share,$0.317,-0.0124,-3.764%,"16,748,759"
ELOG,Eastern International Ltd. Ordinary Shares,$1.39,0.05,3.731%,"16,703,630"
GIGM,GigaMedia Limited Ordinary Shares,$1.51,0.04,2.721%,"16,688,875"
PN,Skycorp Solar Group Limited Ordinary Shares,$0.4279,-0.1139,-21.023%,"16,688,100"
TOPP,Toppoint Holdings Inc. Common Stock,$0.86,-0.14,-14.00%,"16,684,000"
CVKD,"Cadrenal Therapeutics, Inc. Common Stock",$7.11,-0.26,-3.528%,"16,624,083"
CTXR,"Citius Pharmaceuticals, Inc. Common Stock",$0.80,-0.0109,-1.344%,"16,610,334"
EDTK,Skillful Craftsman Education Technology Limited Ordinary Share,$1.04,0.0291,2.879%,"16,566,629"
AEON,"AEON Biopharma, Inc. Class A Common Stock",$1.36,0.16,13.333%,"16,464,027"
MSAI,"MultiSensor AI Holdings, Inc. Common Stock",$0.3112,0.0274,9.655%,"16,454,527"
JF,J and Friends Holdings Limited American Depositary Shares,$1.03,0.04,4.04%,"16,426,399"
HOTH,"Hoth Therapeutics, Inc. Common Stock",$1.05,-0.02,-1.869%,"16,290,028"
MGIH,Millennium Group International Holdings Limited Ordinary Shares,$1.445,0.035,2.482%,"16,256,250"
TMDE,TMD Energy Limited Ordinary Shares,$0.6886,-0.0118,-1.685%,"16,226,859"
RENX,RenX Enterprises Corp. Common Stock,$0.1621,0.0046,2.921%,"16,202,358"
CSAI,"Cloudastructure, Inc. Class A Common Stock",$0.8256,-0.0119,-1.421%,"16,165,671"
IMG,CIMG Inc. Common Stock,$1.04,-0.01,-0.952%,"16,102,889"
BNGO,"Bionano Genomics, Inc. Common Stock",$1.58,0.14,9.722%,"16,078,080"
IPM,Intelligent Protection Management Corp. Common Stock ,$1.76,-0.04,-2.222%,"15,990,883"
USEA,United Maritime Corporation Common Stock,$1.80,-0.03,-1.639%,"15,919,681"
AIRI,Air Industries Group Common Stock,$3.31,0.11,3.438%,"15,807,822"
MOGU,MOGU Inc. American Depositary Shares (each  representing 25 Class A Ordinary Shares),$1.93,-0.06,-3.015%,"15,775,127"
LEDS,SemiLEDS Corporation Common Stock,$1.90,-0.01,-0.524%,"15,629,691"
BNZI,"Banzai International, Inc. Class A Common Stock",$1.31,0.09,7.377%,"15,612,981"
SAIH,SAIHEAT Limited Class A Ordinary Shares,$8.90,0.40,4.706%,"15,601,255"
CLIK,Click Holdings Limited Class A Ordinary Share,$4.7699,-0.1411,-2.873%,"15,564,341"
CASI,"CASI Pharmaceuticals, Inc. Ordinary Shares",$1.00,0.01,1.01%,"15,492,681"
ELSE,"Electro-Sensors, Inc. Common Stock",$4.45,0.072,1.645%,"15,488,318"
WLDSW,Wearable Devices Ltd. Warrant,$1.50,UNCH,--,"15,477,609"
CLRB,"Cellectar Biosciences, Inc.  Common Stock",$3.65,0.15,4.286%,"15,476,489"
EVTV,"Envirotech Vehicles, Inc. Common Stock",$3.18,-0.50,-13.587%,"15,357,858"
OABIW,"OmniAb, Inc. Warrant",$0.106,UNCH,--,"15,259,272"
MOBX,"Mobix Labs, Inc. Class A Common Stock",$0.2292,0.0082,3.71%,"15,198,925"
WETO,Webus International Limited Ordinary Shares,$0.6901,0.0051,0.745%,"15,182,200"
LESL,"Leslie's, Inc. Common Stock",$1.63,0.06,3.822%,"15,143,207"
WVVIP,"Willamette Valley Vineyards, Inc. Series A Redeemable Preferred Stock",$3.05,-0.01,-0.327%,"15,141,813"
HIND,"Vyome Holdings, Inc. Common Stock",$2.68,-0.08,-2.899%,"15,127,244"
GRNQ,Greenpro Capital Corp. Common Stock,$1.80,-0.08,-4.255%,"15,076,463"
IOBT,"IO Biotech, Inc. Common Stock",$0.2076,-0.308,-59.736%,"14,936,580"
ZSPC,"zSpace, Inc. Common stock",$0.5111,0.0311,6.479%,"14,847,489"
SRTAW,"Strata Critical Medical, Inc. Warrants",$0.17,-0.0044,-2.523%,"14,682,309"
APLT,"Applied Therapeutics, Inc. Common Stock",$0.1014,0.0014,1.40%,"14,632,088"
IPST,"Heritage Distilling Holding Company, Inc. Common Stock",$1.53,-0.09,-5.556%,"14,625,761"
BMGL,Basel Medical Group Ltd Ordinary Shares,$0.7778,0.0181,2.383%,"14,611,556"
NAII,"Natural Alternatives International, Inc. Common Stock",$4.39,-0.44,-9.11%,"14,610,482"
XAIR,"Beyond Air, Inc. Common Stock",$1.82,-0.13,-6.667%,"14,577,268"
DLXY,Delixy Holdings Limited Ordinary Shares,$0.89,0.0729,8.922%,"14,551,500"
SMSI,"Smith Micro Software, Inc. Common Stock",$0.5746,0.0226,4.094%,"14,483,561"
WATT,Energous Corporation Common Stock,$6.65,0.35,5.556%,"14,464,661"
SINT,"SiNtx Technologies, Inc. Common Stock",$3.57,-0.02,-0.557%,"14,350,061"
COCP,"Cocrystal Pharma, Inc. Common Stock",$1.04,-0.01,-0.952%,"14,335,428"
SBDS,"Solo Brands, Inc. Class A Common Stock",$5.78,-0.99,-14.623%,"14,306,384"
CAPT,Captivision Inc. Ordinary Shares,$0.4411,0.0387,9.617%,"14,278,192"
JFBR,Jeffs' Brands Ltd Ordinary Shares,$0.735,-0.425,-36.638%,"14,202,486"
CABR,"Caring Brands, Inc. Common Stock",$1.03,0.152,17.312%,"14,149,033"
SNGX,"Soligenix, Inc. Common Stock",$1.40,0.02,1.449%,"14,120,582"
RMSG,Real Messenger Corporation Ordinary Shares,$1.47,-0.05,-3.289%,"14,069,783"
MTEX,"Mannatech, Incorporated Common Stock",$7.40,0.0299,0.406%,"14,066,882"
VRME,"VerifyMe, Inc. Common Stock",$1.13,-0.11,-8.871%,"14,060,781"
CETY,"Clean Energy Technologies, Inc. Common Stock",$0.8725,-0.0285,-3.163%,"14,056,745"
BON,Bon Natural Life Limited Class A Ordinary Shares,$1.71,0.05,3.012%,"13,900,265"
VSEE,"VSee Health, Inc. Common Stock",$0.4178,-0.0007,-0.167%,"13,868,094"
TAOP,Taoping Inc. Ordinary Shares ,$1.50,-0.09,-5.66%,"13,858,031"
AIFF,"Firefly Neuroscience, Inc. Common Stock",$1.02,0.0287,2.895%,"13,762,787"
ENGS,Energys Group Limited Ordinary Shares,$0.9559,-0.0341,-3.444%,"13,657,765"
YYGH,YY Group Holding Limited Class A Ordinary Shares,$0.2088,0.0043,2.103%,"13,621,314"
AMS,American Shared Hospital Services Common Stock,$2.08,-0.02,-0.952%,"13,609,440"
EFOI,"Energy Focus, Inc. Common Stock",$2.37,-0.10,-4.049%,"13,602,414"
BCDA,"BioCardia, Inc. Common Stock",$1.28,-0.02,-1.538%,"13,584,300"
JL,J-Long Group Limited Class A Ordinary Shares,$3.59,-1.32,-26.884%,"13,504,507"
MDAIW,"Spectral AI, Inc. Warrants",$0.44,-0.02,-4.348%,"13,503,114"
FEBO,Fenbo Holdings Limited Class A Ordinary Shares,$1.22,UNCH,--,"13,496,250"
MSW,Ming Shing Group Holdings Limited Ordinary Shares,$1.04,-0.09,-7.965%,"13,494,000"
MDRR,"Medalist Diversified REIT, Inc. Common Stock",$12.10,UNCH,--,"13,460,101"
ADXN,Addex Therapeutics Ltd American Depositary Shares,$8.30,0.07,0.851%,"13,436,596"
MRM,MEDIROM Healthcare Technologies Inc. American Depositary Share,$1.70,-0.01,-0.585%,"13,433,315"
BRN,"Barnwell Industries, Inc. Common Stock",$1.07,0.01,0.943%,"13,415,728"
SPPL,SIMPPLE LTD. Ordinary Shares,$3.00,UNCH,--,"13,349,580"
LBGJ,Li Bang International Corporation Inc. Class A Ordinary Shares,$0.7101,-0.0071,-0.99%,"13,312,955"
SOPA,Society Pass Incorporated Common Stock,$2.18,-0.06,-2.679%,"13,310,045"
IQST,iQSTEL Inc. Common Stock,$3.04,0.13,4.467%,"13,299,459"
PMNT,Perfect Moment Ltd. Common Stock,$0.375,-0.0095,-2.471%,"13,208,225"
WVVI,"Willamette Valley Vineyards, Inc. Common Stock",$2.66,-0.40,-13.072%,"13,205,647"
TRIB,Trinity Biotech plc American Depositary Shares,$0.7038,0.0069,0.99%,"13,168,332"
YHGJ,Yunhong Green CTI Ltd. Common Stock,$4.742,0.972,25.782%,"13,153,658"
WIMI,WiMi Hologram Cloud Inc. Class B Ordinary Shares,$2.66,0.05,1.916%,"13,061,672"
CENN,Cenntro Inc. Common Stock,$0.1473,-0.0021,-1.406%,"12,949,560"
CJMB,Callan JMB Inc. Common Stock,$2.80,-0.39,-12.226%,"12,944,476"
CVR,Chicago Rivet & Machine Co. Common Stock,$13.38,-0.62,-4.429%,"12,926,846"
NXGL,"NexGel, Inc Common Stock",$1.58,0.04,2.597%,"12,866,150"
TIRX,TIAN RUIXIANG Holdings Ltd Class A Ordinary Shares,$0.528,0.008,1.538%,"12,862,836"
TPST,"Tempest Therapeutics, Inc. Common Stock",$2.61,0.03,1.163%,"12,859,890"
MTEK,Maris-Tech Ltd. Ordinary Shares,$1.61,0.09,5.921%,"12,853,540"
MBRX,"Moleculin Biotech, Inc. Common Stock",$4.76,0.50,11.737%,"12,821,208"
LFWD,Lifeward Ltd. Ordinary Shares,$0.70,-0.0211,-2.926%,"12,805,643"
TOIIW,"The Oncology Institute, Inc. Warrant",$0.13,UNCH,--,"12,789,574"
GITS,"Global Interactive Technologies, Inc. Common Stock",$1.70,0.8413,97.974%,"12,784,615"
TLIH,Ten-League International Holdings Limited Ordinary Shares,$0.4338,-0.0184,-4.069%,"12,755,604"
AGAE,Allied Gaming & Entertainment Inc. Common Stock,$0.3371,-0.0121,-3.465%,"12,711,006"
RAY,Raytech Holding Limited Ordinary Shares,$4.66,-0.29,-5.859%,"12,697,941"
SFHG,Samfine Creation Holdings Group Limited Class A Ordinary Share,$0.7051,-0.0049,-0.69%,"12,691,800"
TKLF,"Tokyo Lifestyle Co., Ltd. American Depositary Shares",$2.99,-0.0477,-1.57%,"12,656,015"
ARTW,"Art's-Way Manufacturing Co., Inc. Common Stock",$2.47,-0.01,-0.403%,"12,613,880"
INTJ,Intelligent Group Limited Class A Ordinary Shares ,$0.41,-0.0029,-0.702%,"12,607,500"
GTIM,Good Times Restaurants Inc. Common Stock,$1.19,0.05,4.386%,"12,563,896"
ASTLW,Algoma Steel Group Inc. Warrant,$0.1187,-0.0112,-8.622%,"12,455,642"
ABTS,Abits Group Inc Ordinary Shares,$5.20,-0.4409,-7.816%,"12,324,723"
EDUC,Educational Development Corporation Common Stock,$1.44,0.06,4.348%,"12,256,364"
GDTC,CytoMed Therapeutics Limited Ordinary Shares,$1.0589,0.0089,0.848%,"12,219,706"
RSVRW,"Reservoir Media, Inc. Warrant",$0.185,UNCH,--,"12,133,821"
FGI,FGI Industries Ltd. Ordinary Shares,$6.285,-0.065,-1.024%,"12,068,080"
ZCMD,Zhongchao Inc. Class A Ordinary Shares,$0.4752,-0.0028,-0.586%,"12,064,807"
CLRO,"ClearOne, Inc. (DE) Common Stock",$6.94,0.07,1.019%,"12,035,695"
BOLT,"Bolt Biotherapeutics, Inc. Common Stock",$6.27,0.03,0.481%,"12,034,895"
FLYE,"Fly-E Group, Inc. Common Stock",$7.37,0.12,1.655%,"12,030,685"
TURB,"Turbo Energy, S.A. American Depositary Shares",$1.09,0.03,2.83%,"12,008,683"
INBS,Intelligent Bio Solutions Inc. Common Stock,$9.87,-3.94,-28.53%,"12,003,322"
EDSA,"Edesa Biotech, Inc. Common Shares",$1.44,-0.02,-1.37%,"12,000,705"
CRGOW,Freightos Limited Warrants,$0.2387,-0.0212,-8.157%,"11,945,202"
AKTX,Akari Therapeutics plc ADS,$0.2609,-0.003,-1.137%,"11,944,354"
SRXH,"SRX Health Solutions, Inc. Common Stock",$0.171,-0.0011,-0.639%,"11,894,008"
SNSE,"Sensei Biotherapeutics, Inc. Common Stock",$9.41,-0.20,-2.081%,"11,868,739"
MWG,Multi Ways Holdings Limited Class A Ordinary Shares,$0.2306,-0.0154,-6.26%,"11,836,698"
WLDS,Wearable Devices Ltd. Ordinary Share,$1.14,0.04,3.636%,"11,762,983"
CCHH,CCH Holdings Ltd Ordinary Shares,$0.6105,0.0376,6.563%,"11,752,125"
BFRI,Biofrontera Inc. Common Stock,$0.999,0.1652,19.813%,"11,636,675"
NXL,"Nexalin Technology, Inc. Common Stock",$0.6238,-0.0031,-0.494%,"11,635,080"
PRSO,Peraso Inc. Common Stock,$1.12,-0.09,-7.438%,"11,633,339"
HSCS,HeartSciences Inc. Common Stock,$3.66,0.02,0.549%,"11,632,238"
BTBD,"BT Brands, Inc. Common Stock",$1.48,-0.01,-0.671%,"11,610,177"
FBGL,FBS Global Limited Ordinary Shares,$0.859,-0.001,-0.116%,"11,596,500"
CRIS,"Curis, Inc. Common Stock",$0.895,-0.073,-7.541%,"11,571,323"
GELS,Gelteq Limited Ordinary Shares,$1.08,0.03,2.857%,"11,567,944"
GFAI,"Guardforce AI Co., Limited Ordinary Shares",$0.5487,-0.0213,-3.737%,"11,535,610"
DAIC,"CID HoldCo, Inc. Common Stock",$0.4151,-0.0099,-2.329%,"11,528,706"
LGVN,Longeveron Inc. Class A Common Stock,$0.533,0.002,0.377%,"11,370,426"
KXIN,Kaixin Holdings Ordinary Shares,$12.02,1.02,9.273%,"11,362,193"
SEGG,"Lottery.com, Inc. Common Stock",$2.21,0.39,21.429%,"11,358,631"
PETZ,"TDH Holdings, Inc. Common Shares",$1.10,0.02,1.852%,"11,355,595"
IHT,InnSuites Hospitality Trust Shares of Beneficial Interest,$1.23,0.01,0.82%,"11,321,946"
PAVM,PAVmed Inc. Common Stock,$12.05,5.86,94.669%,"11,280,969"
AMZE,"Amaze Holdings, Inc. Common Stock",$0.5632,0.1389,32.736%,"11,231,230"
IMNN,"Imunon, Inc. Common Stock",$3.48,0.02,0.578%,"11,228,996"
GRDX,GridAI Technologies Corp. Common Stock,$3.33,0.05,1.524%,"11,195,137"
PHIO,Phio Pharmaceuticals Corp. Common Stock,$1.04,-0.04,-3.704%,"11,195,005"
HCAI,"Huachen AI Parking Management Technology Holding Co., Ltd. Class A Ordinary Shares",$0.32,-0.004,-1.235%,"11,167,200"
TBLAW,Taboola.com Ltd. Warrant,$0.0384,-0.0037,-8.789%,"11,067,777"
NCEL,NewcelX Ltd. Ordinary Shares,$2.42,-0.06,-2.419%,"11,031,275"
SOS,SOS Limited Class A Ordinary Shares,$1.61,-0.05,-3.012%,"10,938,137"
JBDI,JBDI Holdings Limited Ordinary Shares,$0.5717,-0.047,-7.597%,"10,878,916"
REBN,"Reborn Coffee, Inc. Common Stock",$1.82,-0.05,-2.674%,"10,876,906"
WKHS,"Workhorse Group, Inc. Common Stock",$5.00,-0.06,-1.186%,"10,848,840"
UUU,"Universal Safety Products, Inc. Common Stock",$4.69,0.78,19.949%,"10,847,440"
AWX,Avalon Holdings Corporation Common Stock,$2.77,-0.006,-0.216%,"10,801,424"
INAB,"IN8bio, Inc. Common Stock",$2.33,-0.03,-1.271%,"10,798,143"
ARBEW,Arbe Robotics Ltd. Warrant,$0.1024,0.0034,3.434%,"10,780,602"
GSIW,Garden Stage Limited Ordinary Shares,$0.1455,0.0003,0.207%,"10,771,561"
BFRG,"Bullfrog AI Holdings, Inc. Common Stock",$0.7059,0.0235,3.444%,"10,764,837"
MYNZ,Mainz Biomed N.V. Ordinary Shares,$1.18,0.08,7.273%,"10,690,968"
HWH,HWH International Inc. Common Stock,$1.65,-0.057,-3.339%,"10,686,060"
SNES,"SenesTech, Inc. Common Stock",$2.04,-0.01,-0.488%,"10,654,951"
SXTC,"China SXT Pharmaceuticals, Inc. Ordinary Shares",$0.0914,-0.0045,-4.692%,"10,604,888"
BLRX,BioLineRx Ltd. American Depositary Shares,$2.85,0.02,0.707%,"10,604,859"
FTFT,Future FinTech Group Inc. Common Stock,$2.09,-0.29,-12.185%,"10,551,006"
NCRA,"Nocera, Inc. Common Stock",$0.73,-0.043,-5.563%,"10,492,740"
TNON,"Tenon Medical, Inc. Common Stock",$0.941,-0.03,-3.09%,"10,451,164"
ARBB,ARB IOT Group Limited Ordinary Shares,$5.90,-0.033,-0.556%,"10,415,010"
