Symbol,Name,Last Sale,Net Change,% Change,Market Cap
FTK,"Flotek Industries, Inc. Common Stock",$14.00,-0.14,-0.99%,"420,809,522"
ZEPP,"Zepp Health Corporation American depositary shares, each representing sixteen Class A ordinary shares",$29.28,0.29,1.00%,"420,696,855"
SFST,"Southern First Bancshares, Inc. Common Stock",$51.10,1.40,2.817%,"418,466,945"
BSRR,Sierra Bancorp Common Stock,$31.00,0.89,2.956%,"417,956,198"
PUBM,"PubMatic, Inc. Class A Common Stock",$8.98,0.32,3.695%,"416,804,922"
AKBA,"Akebia Therapeutics, Inc. Common Stock",$1.57,-0.02,-1.258%,"416,624,609"
FPI,Farmland Partners Inc. Common Stock,$9.66,0.08,0.835%,"416,322,381"
PEPG,PepGen Inc. Common Stock,$6.05,0.26,4.491%,"415,926,755"
DDL,Dingdong (Cayman) Limited American Depositary Shares (each two representing three Ordinary Shares),$1.76,0.01,0.571%,"415,760,726"
ULH,"Universal Logistics Holdings, Inc. Common Stock",$15.77,1.24,8.534%,"415,225,015"
ANRO,"Alto Neuroscience, Inc. Common Stock",$13.36,0.06,0.451%,"415,046,236"
CLPT,"ClearPoint Neuro, Inc. Common Stock",$14.60,0.20,1.389%,"414,980,297"
NOA,North American Construction Group Ltd. Common Shares (no par),$14.08,0.31,2.251%,"414,434,001"
ESEA,Euroseas Ltd. Common Stock (Marshall Islands),$58.97,0.52,0.89%,"413,179,910"
VENU,Venu Holding Corporation Common Stock,$9.63,0.28,2.995%,"412,621,829"
MITK,"Mitek Systems, Inc. Common Stock",$9.02,0.11,1.235%,"411,736,382"
CCSI,"Consensus Cloud Solutions, Inc. Common Stock",$21.62,0.52,2.464%,"410,904,856"
LBRX,LB Pharmaceuticals Inc Common Stock,$16.20,0.06,0.372%,"409,845,452"
OPAL,OPAL Fuels Inc. Class A Common Stock,$2.36,0.13,5.83%,"409,212,705"
AII,"American Integrity Insurance Group, Inc. Common Stock",$20.89,0.81,4.034%,"408,959,436"
RC,Ready Capital Corporation Common Stock,$2.52,0.03,1.205%,"408,558,216"
NRC,National Research Corporation Common Stock (Delaware),$18.02,0.70,4.042%,"408,286,726"
ASIX,AdvanSix Inc. Common Stock ,$15.17,0.53,3.62%,"407,527,411"
WEST,Westrock Coffee Company Common Stock,$4.20,0.18,4.478%,"406,664,622"
CEP,"Cantor Equity Partners, Inc. Class A Ordinary Shares",$14.15,0.10,0.712%,"406,619,692"
HSHP,Himalaya Shipping Ltd. Common Shares,$8.73,0.12,1.394%,"406,381,500"
SGU,Star Group L.P. Common Stock,$12.09,0.04,0.332%,"406,301,666"
GPRK,Geopark Ltd Common Shares,$7.92,0.32,4.211%,"405,878,513"
DDT,Dillard's Capital Trust I,$25.8936,-0.0564,-0.217%,"404,275,896"
CARE,"Carter Bankshares, Inc. Common Stock",$18.28,0.51,2.87%,"403,751,164"
SDHY,PGIM Short Duration High Yield Opportunities Fund Common Shares,$16.34,0.09,0.554%,"403,157,735"
FRBA,First Bank Common Stock,$16.03,0.51,3.286%,"402,904,480"
PSTL,"Postal Realty Trust, Inc. Class A Common Stock",$15.45,0.16,1.046%,"402,667,726"
MTW,"Manitowoc Company, Inc. (The) Common Stock",$11.35,0.23,2.068%,"402,595,192"
PACK,Ranpak Holdings Corp Class A Common Stock,$4.77,0.25,5.531%,"402,472,900"
VFSWW,VinFast Auto Ltd. Warrant,$0.172,-0.0011,-0.635%,"402,275,780"
BMBL,Bumble Inc. Class A Common Stock,$3.56,0.09,2.594%,"401,350,822"
SLDB,Solid Biosciences Inc. Common Stock,$5.15,0.24,4.888%,"401,237,731"
VSTA,Vasta Platform Limited Class A Ordinary Shares,$4.9999,0.0099,0.198%,"401,002,095"
LCTX,"Lineage Cell Therapeutics, Inc. Common Stock",$1.74,-0.01,-0.571%,"400,769,914"
NCMI,"National CineMedia, Inc. Common Stock",$4.26,0.10,2.404%,"399,720,771"
NMG,Nouveau Monde Graphite Inc. Common Shares,$2.62,0.13,5.221%,"399,361,897"
CMDB,Costamare Bulkers Holdings Limited Common Stock,$16.50,-0.74,-4.292%,"399,361,793"
STKL,"SunOpta, Inc. Common Stock",$3.37,0.02,0.597%,"398,391,010"
OBE,Obsidian Energy Ltd. Common Shares,$5.93,-0.25,-4.045%,"397,999,196"
MSB,Mesabi Trust Common Stock,$30.33,-1.79,-5.573%,"397,929,903"
BYRN,"Byrna Technologies, Inc. Common Stock",$17.51,0.17,0.98%,"397,923,768"
TECX,"Tectonic Therapeutic, Inc. Common Stock",$21.25,1.59,8.087%,"397,720,950"
BSVN,Bank7 Corp. Common stock,$42.07,0.96,2.335%,"397,704,117"
TCI,"Transcontinental Realty Investors, Inc. Common Stock",$46.00,UNCH,--,"397,408,536"
SAZ,Saratoga Investment Corp 8.50% Notes due 2028,$25.3512,-0.0188,-0.074%,"397,205,923"
JFIN,Jiayin Group Inc. American Depositary Shares,$7.41,0.19,2.632%,"395,468,336"
GRVY,"GRAVITY Co., Ltd. American Depository Shares",$56.90,-0.59,-1.026%,"395,392,410"
SAY,Saratoga Investment Corp 8.125% Notes due 2027,$25.235,0.02,0.079%,"395,385,286"
TATT,TAT Technologies Ltd. Ordinary Shares,$36.08,-3.45,-8.728%,"394,728,117"
XOMA,XOMA Royalty Corporation Common Stock,$31.845,0.045,0.142%,"394,339,915"
CAL,"Caleres, Inc. Common Stock",$11.65,1.05,9.906%,"394,269,645"
ENTA,"Enanta Pharmaceuticals, Inc. Common Stock",$13.66,0.01,0.073%,"394,263,130"
SAJ,Saratoga Investment Corp 8.00% Notes due 2027,$25.16,-0.07,-0.277%,"394,210,176"
ENGN,enGene Holdings Inc. Common Stock,$7.71,0.30,4.049%,"394,025,772"
PNNT,PennantPark Investment Corporation Common Stock,$6.03,-0.36,-5.634%,"393,735,447"
GBLI,"Global Indemnity Group, LLC Class A Common Stock ",$27.48,0.98,3.698%,"393,622,256"
ZIP,"ZipRecruiter, Inc. Class A Common Stock",$4.60,0.22,5.023%,"393,573,419"
HVT,"Haverty Furniture Companies, Inc. Common Stock",$24.18,1.05,4.54%,"393,331,877"
BRBS,"Blue Ridge Bankshares, Inc. Common Stock",$4.29,0.19,4.634%,"392,486,356"
CNCK,Coincheck Group N.V. Ordinary Shares,$3.00,-0.01,-0.332%,"392,443,578"
NGS,"Natural Gas Services Group, Inc. Common Stock",$31.21,0.34,1.101%,"392,275,900"
SOR,"Source Capital, Inc. Cmn Shs of BI",$47.01,0.32,0.685%,"392,274,146"
CARL,"Carlsmed, Inc. Common Stock",$14.75,0.86,6.192%,"392,245,393"
BBBY,"Bed Bath & Beyond, Inc. Common Stock",$5.68,0.05,0.888%,"391,042,866"
KMDA,Kamada Ltd. Ordinary Shares,$6.80,-0.03,-0.439%,"391,034,211"
GCBC,"Greene County Bancorp, Inc. Common Stock",$22.96,0.92,4.174%,"390,935,971"
PKE,Park Aerospace Corp. Common Stock,$19.62,0.65,3.426%,"390,552,247"
BOC,Boston Omaha Corporation Class A Common Stock,$12.38,0.12,0.979%,"389,393,513"
VKI,Invesco Advantage Municipal Income Trust II Common Shares of Beneficial Interest (DE),$8.76,UNCH,--,"388,996,735"
SSP,E.W. Scripps Company (The) Class A Common Stock,$4.38,-0.05,-1.129%,"388,953,329"
BYND,"Beyond Meat, Inc. Common Stock",$0.8571,-0.0054,-0.626%,"388,755,002"
AMCX,AMC Networks Inc. Class A Common Stock,$8.93,0.14,1.593%,"388,694,047"
TMCWW,TMC the metals company Inc. Warrants,$0.94,-0.035,-3.59%,"388,682,522"
SAT,Saratoga Investment Corp 6.00% Notes due 2027,$24.79,0.04,0.162%,"388,412,967"
AURA,"Aura Biosciences, Inc. Common Stock",$6.11,0.61,11.091%,"388,004,974"
SITC,SITE Centers Corp. Common Stock,$7.39,0.16,2.213%,"387,696,693"
VERI,"Veritone, Inc. Common Stock",$4.22,0.13,3.178%,"387,421,417"
CLFD,"Clearfield, Inc. Common Stock",$28.03,-1.35,-4.595%,"386,983,553"
LEO,"BNY Mellon Strategic Municipals, Inc. Common Stock",$6.21,UNCH,--,"386,826,203"
TRDA,"Entrada Therapeutics, Inc. Common Stock",$10.12,0.23,2.326%,"386,778,628"
PTLO,Portillo's Inc. Class A Common Stock,$5.13,0.21,4.268%,"386,671,949"
PRTC,PureTech Health plc American Depositary Shares,$15.99,0.22,1.395%,"386,452,780"
VBNK,VersaBank Common Shares,$12.01,0.39,3.356%,"386,333,404"
ADUR,Aduro Clean Technologies Inc. Common Stock,$12.38,-0.335,-2.635%,"386,175,604"
ORN,"Orion Group Holdings, Inc. Common",$9.67,0.37,3.978%,"385,842,457"
OSG,"Octave Specialty Group, Inc. Common Stock",$8.78,-0.15,-1.68%,"384,669,667"
ATLCZ,Atlanticus Holdings Corporation 9.25% Senior Notes due 2029,$25.405,0.015,0.059%,"384,262,032"
PDLB,"Ponce Financial Group, Inc. Common Stock",$16.01,0.53,3.424%,"384,258,011"
CAN,Canaan Inc. American Depositary Shares,$0.9131,-0.0469,-4.885%,"383,742,656"
ATEX,Anterix Inc. Common Stock,$20.50,0.36,1.787%,"383,690,813"
SWBI,"Smith & Wesson Brands, Inc. Common Stock",$8.64,0.05,0.582%,"383,112,988"
ALLT,Allot Ltd. Ordinary Shares,$9.65,-0.16,-1.631%,"383,035,655"
ASTL,Algoma Steel Group Inc. Common Shares,$3.64,0.20,5.814%,"381,959,039"
GNE,Genie Energy Ltd. Class B Common Stock Stock,$14.34,-0.05,-0.347%,"379,937,640"
MBI,MBIA Inc. Common Stock,$7.52,0.05,0.669%,"379,712,068"
NATH,"Nathan's Famous, Inc. Common Stock",$92.82,1.88,2.067%,"379,588,318"
WTBA,West Bancorporation Common Stock,$22.30,0.48,2.20%,"377,779,506"
CLLS,Cellectis S.A. American Depositary Shares,$5.24,-0.11,-2.056%,"377,771,895"
GCO,Genesco Inc. Common Stock,$34.90,2.30,7.055%,"376,760,333"
KFS,"Kingsway Financial Services, Inc. Common Stock (DE)",$12.99,0.21,1.643%,"376,140,414"
NMRA,"Neumora Therapeutics, Inc. Common Stock",$2.25,0.09,4.167%,"375,950,507"
ATLCL,Atlanticus Holdings Corporation 6.125% Senior Notes due 2026,$24.82,-0.02,-0.081%,"375,413,644"
CTRN,"Citi Trends, Inc. Common Stock",$45.17,1.34,3.057%,"375,178,045"
GDEV,GDEV Inc. Ordinary Shares,$20.65,0.4531,2.243%,"374,386,359"
MG,Mistras Group Inc Common Stock,$11.86,0.36,3.13%,"374,161,095"
TTGT,"TechTarget, Inc. Common Stock",$5.18,0.29,5.93%,"373,777,953"
SAR,Saratoga Investment Corp New,$23.04,0.31,1.364%,"371,034,962"
TACO,Berto Acquisition Corp. Ordinary Shares,$10.17,UNCH,--,"370,617,499"
AUTL,Autolus Therapeutics plc American Depositary Share,$1.39,0.15,12.097%,"369,939,168"
BKKT,"Bakkt Holdings, Inc. Class A Common Stock",$15.37,-0.23,-1.474%,"369,470,731"
GALT,Galectin Therapeutics Inc. Common Stock,$5.71,0.20,3.63%,"368,139,642"
CMRC,"Commerce.com, Inc. Series 1 Common Stock",$4.53,0.07,1.57%,"368,122,957"
OIS,"Oil States International, Inc. Common Stock",$6.16,UNCH,--,"368,032,680"
JACK,Jack In The Box Inc. Common Stock,$19.46,2.10,12.097%,"367,732,195"
LWAY,"Lifeway Foods, Inc. Common Stock",$24.12,1.05,4.551%,"367,317,764"
YRD,"Yiren Digital Ltd. American Depositary Shares, each representing two ordinary shares",$4.25,-0.35,-7.609%,"367,227,557"
OCGN,"Ocugen, Inc. Common Stock",$1.17,-0.02,-1.681%,"365,414,531"
SRTA,"Strata Critical Medical, Inc. Class A Common Stock",$4.23,-0.03,-0.704%,"365,330,405"
ILPT,Industrial Logistics Properties Trust Common Shares of Beneficial Interest,$5.48,0.09,1.67%,"365,292,608"
ATGL,Alpha Technology Group Limited Class A Ordinary Shares,$22.15,0.265,1.211%,"364,644,375"
ECC           ,Eagle Point Credit Company Inc. Common Stock,$6.01,0.06,1.008%,"364,581,769"
OBT,"Orange County Bancorp, Inc. Common Stock",$27.25,1.01,3.849%,"364,243,665"
RM,Regional Management Corp. Common Stock,$37.50,0.62,1.681%,"364,230,188"
OTLY,Oatly Group AB American Depositary Shares,$12.14,0.07,0.58%,"363,325,823"
NNDM,Nano Dimension Ltd. American Depositary Shares,$1.67,0.06,3.727%,"362,863,405"
ATLCP,"Atlanticus Holdings Corporation 7.625% Series B Cumulative Perpetual Preferred Stock, no par value per share",$23.94,-0.09,-0.375%,"362,488,228"
LND,Brasilagro Brazilian Agric Real Estate Co Sponsored ADR (Brazil),$3.53,UNCH,--,"362,472,557"
USNA,"USANA Health Sciences, Inc. Common Stock",$19.80,0.24,1.227%,"361,960,969"
NC,"NACCO Industries, Inc. Common Stock",$48.45,-0.10,-0.206%,"361,434,820"
PPT,Putnam Premier Income Trust Common Stock,$3.63,0.05,1.397%,"361,287,595"
GFR,Greenfire Resources Ltd. Common Shares,$5.14,-0.02,-0.388%,"361,120,980"
BWFG,"Bankwell Financial Group, Inc. Common Stock",$45.70,1.18,2.65%,"359,999,145"
EGY,"VAALCO Energy, Inc.  Common Stock",$3.45,-0.01,-0.289%,"359,690,973"
SOHOO,Sotherly Hotels Inc. 7.875% Series C Cumulative Redeemable Perpetual Preferred Stock,$17.55,0.10,0.573%,"359,608,293"
MTLS,Materialise NV American Depositary Shares,$6.08,0.18,3.051%,"359,128,491"
KTF,DWS Municipal Income Trust,$9.09,UNCH,--,"359,063,526"
VHI,"Valhi, Inc. Common Stock",$12.68,0.44,3.595%,"358,873,075"
EVTL,Vertical Aerospace Ltd. Ordinary Shares,$4.24,-0.06,-1.395%,"358,503,537"
CZNC,Citizens & Northern Corp Common Stock,$20.10,0.24,1.208%,"357,817,647"
OWLT,"Owlet, Inc. Class A Common Stock",$12.96,0.13,1.013%,"357,444,667"
ONIT,Onity Group Inc. Common Stock,$44.31,1.55,3.625%,"357,088,707"
NATR,"Nature's Sunshine Products, Inc. Common Stock",$20.41,-0.48,-2.298%,"357,084,441"
CCRN,"Cross Country Healthcare, Inc. Common Stock $0.0001 Par Value",$10.88,UNCH,--,"356,428,278"
SBC,SBC Medical Group Holdings Incorporated Common Stock,$3.47,0.13,3.892%,"355,941,992"
BGS,"B&G Foods, Inc. Common Stock",$4.45,0.08,1.831%,"355,897,873"
ACTG,Acacia Research Corporation (Acacia Tech) Common Stock,$3.68,0.08,2.222%,"354,974,191"
RMNI,"Rimini Street, Inc. (DE) Common Stock",$3.83,-0.03,-0.777%,"351,410,160"
PMO,Putnam Municipal Opportunities Trust Common Stock,$10.34,0.03,0.291%,"351,369,403"
MSBI,"Midland States Bancorp, Inc. Common Stock",$16.29,0.68,4.356%,"351,077,535"
VALU,"Value Line, Inc. Common Stock",$37.29,1.26,3.497%,"350,819,435"
SOHOB,Sotherly Hotels Inc. 8.0% Series B Cumulative Redeemable Perpetual Preferred Stock,$17.10,-0.06,-0.35%,"350,387,567"
XRX,Xerox Holdings Corporation Common Stock,$2.73,0.01,0.368%,"349,549,230"
RILYT,"B. Riley Financial, Inc. 6.00% Senior Notes Due 2028",$11.43,0.35,3.159%,"348,581,464"
SCM,Stellus Capital Investment Corporation Common Stock,$12.00,UNCH,--,"347,367,048"
THM,"International Tower Hill Mines, Ltd. Ordinary Shares (Canada)",$1.67,UNCH,--,"347,168,740"
WNC,Wabash National Corporation Common Stock,$8.55,0.13,1.544%,"346,417,246"
FMAO,"Farmers & Merchants Bancorp, Inc. Common Stock",$25.19,0.34,1.368%,"346,361,089"
DAVA,Endava plc American Depositary Shares (each representing one Class A Ordinary Share),$6.35,0.05,0.794%,"344,980,279"
FET,"Forum Energy Technologies, Inc. Common Stock",$30.32,-0.17,-0.558%,"344,979,687"
SLP,"Simulations Plus, Inc. Common Stock",$17.13,-0.05,-0.291%,"344,777,394"
AVTX,"Avalo Therapeutics, Inc. Common Stock",$18.99,0.99,5.50%,"344,364,052"
ANPA,Rich Sparkle Holdings Limited Ordinary Shares,$27.50,-1.00,-3.509%,"343,750,000"
AUNA,Auna SA Class A Ordinary Shares,$4.64,-0.10,-2.11%,"343,222,187"
DVS,Dolly Varden Silver Corporation Common Shares,$3.73,0.02,0.539%,"342,663,089"
LAND,Gladstone Land Corporation Common Stock,$9.19,0.09,0.989%,"342,482,195"
INV,"Innventure, Inc. Common Stock",$5.48,0.83,17.849%,"342,346,401"
CTGO,"Contango ORE, Inc. Common Stock",$22.86,1.18,5.443%,"342,078,137"
MEC,"Mayville Engineering Company, Inc. Common Stock",$16.80,0.74,4.608%,"341,348,616"
WILC,"G. Willi-Food International,  Ltd. Ordinary Shares",$24.61,0.11,0.449%,"341,267,288"
API,"Agora, Inc. American Depositary Shares",$3.64,-0.09,-2.413%,"340,379,097"
RBB,RBB Bancorp Common Stock,$19.95,0.48,2.465%,"340,085,595"
CERS,Cerus Corporation Common Stock,$1.77,0.08,4.734%,"339,994,877"
CRMLW,Critical Metals Corp. Warrants,$3.18,0.13,4.262%,"339,942,967"
EM,Smart Share Global Limited American Depositary Shares,$1.34,-0.02,-1.471%,"339,782,803"
MVBF,MVB Financial Corp. Common Stock,$26.96,0.91,3.493%,"339,273,645"
OCSAW,Oculis Holding AG Warrants,$7.77,-0.23,-2.875%,"339,256,864"
GBAB,Guggenheim Taxable Municipal Bond & Investment Grade Debt Trust Common Shares of Beneficial Interest,$15.14,0.02,0.132%,"339,089,142"
KNOP,KNOT Offshore Partners LP Common Units representing Limited Partner Interests,$9.96,-0.05,-0.50%,"339,089,007"
CHSCP,CHS Inc. 8%  Cumulative Redeemable Preferred Stock,$27.6178,0.0178,0.064%,"338,925,724"
TBRG,"TruBridge, Inc. Common Stock",$22.54,0.79,3.632%,"338,302,544"
CUB,Lionheart Holdings Class A Ordinary Shares,$10.64,-0.01,-0.094%,"338,017,649"
QTRX,Quanterix Corporation Common Stock,$7.23,0.21,2.991%,"337,719,062"
PBFS,"Pioneer Bancorp, Inc. Common Stock",$13.42,0.26,1.976%,"336,580,941"
IPI,"Intrepid Potash, Inc Common Stock",$25.03,0.33,1.336%,"336,076,108"
CVGW,"Calavo Growers, Inc. Common Stock",$18.81,0.27,1.456%,"335,821,006"
RCKT,"Rocket Pharmaceuticals, Inc. Common Stock",$3.10,0.07,2.31%,"335,488,907"
AENT,Alliance Entertainment Holding Corporation Class A Common Stock,$6.58,-0.37,-5.324%,"335,299,495"
EAF,GrafTech International Ltd. Common Stock,$12.89,0.33,2.627%,"332,821,218"
PYXS,"Pyxis Oncology, Inc. Common Stock",$5.34,0.19,3.689%,"332,490,908"
XFOR,"X4 Pharmaceuticals, Inc. Common Stock",$3.80,UNCH,--,"332,259,414"
LXFR,Luxfer Holdings PLC Ordinary Shares,$12.42,0.35,2.90%,"331,881,154"
CHOW,ChowChow Cloud International Holdings Limited Ordinary Shares,$9.42,0.92,10.824%,"330,642,000"
EFT,Eaton Vance Floating Rate Income Trust Common Shares of Beneficial Interest,$11.32,0.09,0.801%,"329,303,498"
FVR,"FrontView REIT, Inc. Common Stock",$15.20,0.61,4.181%,"329,135,769"
CLDT,Chatham Lodging Trust (REIT) Common Shares of Beneficial Interest,$6.78,0.14,2.108%,"328,938,480"
FINS,Angel Oak Financial Strategies Income Term Trust Common Shares of Beneficial Interest,$13.10,0.12,0.924%,"328,320,558"
XOMAP,XOMA Royalty Corporation 8.625% Series A Cumulative Perpetual Preferred Stock,$26.49,UNCH,--,"328,028,398"
AMRN,Amarin Corporation plc,$15.72,-0.28,-1.75%,"326,860,992"
DCTH,"Delcath Systems, Inc. Common Stock",$9.23,UNCH,--,"325,945,617"
WAVE,Eco Wave Power Global AB (publ) American Depositary Shares,$6.97,-0.21,-2.925%,"325,734,893"
USCB,"USCB Financial Holdings, Inc. Class A Common Stock",$17.97,-0.03,-0.167%,"325,443,618"
ARTNA,Artesian Resources Corporation Class A Common Stock,$31.53,0.41,1.317%,"325,173,462"
OOMA,"Ooma, Inc. Common Stock",$11.78,0.81,7.384%,"325,128,000"
ZH,"Zhihu Inc. American Depositary Shares, each representing three (3) Class A Ordinary Shares",$3.71,-0.31,-7.711%,"324,865,634"
RWAY,Runway Growth Finance Corp. Common Stock,$8.99,0.35,4.051%,"324,844,993"
ISBA,Isabella Bank Corporation Common stock,$44.23,0.99,2.29%,"324,431,296"
HYLN,Hyliion Holdings Corp. Class A Common Stock,$1.84,0.06,3.371%,"323,792,580"
KYTX,"Kyverna Therapeutics, Inc. Common Stock",$7.39,-0.10,-1.335%,"323,653,696"
ATNI,"ATN International, Inc. Common Stock",$21.18,0.76,3.722%,"323,151,541"
BIOA,"BioAge Labs, Inc. Common Stock",$9.00,-0.14,-1.532%,"322,695,333"
CHSCO,CHS Inc. Class B Cumulative Redeemable Preferred Stock,$26.29,UNCH,--,"322,630,959"
LOCO,"El Pollo Loco Holdings, Inc. Common Stock",$10.76,0.37,3.561%,"322,315,101"
BCML,BayCom Corp Common Stock,$29.55,0.79,2.747%,"322,028,897"
ARQQ,Arqit Quantum Inc. Ordinary Shares,$25.74,-0.55,-2.092%,"321,853,192"
MTRX,Matrix Service Company Common Stock,$11.43,0.15,1.33%,"321,463,344"
SOPH,SOPHiA GENETICS SA Ordinary Shares,$4.81,-0.05,-1.029%,"321,457,452"
NGNE,Neurogene Inc. Common Stock ,$20.74,0.30,1.468%,"321,258,452"
PALI,"Palisade Bio, Inc. Common Stock",$2.15,-0.13,-5.702%,"320,356,902"
DENN,Denny's Corporation Common Stock,$6.19,0.05,0.814%,"318,778,773"
NFE,New Fortress Energy Inc. Class A Common Stock,$1.12,-0.09,-7.438%,"318,699,148"
NBP,NovaBridge Biosciences American Depositary Shares,$3.90,-0.11,-2.743%,"317,854,232"
LSAK,"Lesaka Technologies, Inc. Common Stock",$3.78,-0.16,-4.061%,"317,846,588"
ALDX,"Aldeyra Therapeutics, Inc. Common Stock",$5.26,0.03,0.574%,"316,456,186"
OFSSH,OFS Capital Corporation 4.95% Notes due 2028,$23.6008,-0.0992,-0.419%,"316,205,359"
AVBC,"Avidia Bancorp, Inc. Common Stock",$15.74,0.20,1.287%,"316,000,175"
SMRT,"SmartRent, Inc. Class A Common Stock",$1.67,0.22,15.172%,"315,965,206"
DHIL,"Diamond Hill Investment Group, Inc. Class A Common Stock",$116.78,0.06,0.051%,"315,924,467"
PCB,PCB Bancorp Common Stock,$22.12,0.43,1.982%,"315,447,878"
SOHON,Sotherly Hotels Inc. 8.25% Series D Cumulative Redeemable Perpetual Preferred Stock,$15.36,0.02,0.13%,"314,734,095"
XOMAO,XOMA Royalty Corporation Depositary Shares Rep Series B 8.375% Cumulative Preferred Stock,$25.39,-0.05,-0.197%,"314,406,985"
TLSI,"TriSalus Life Sciences, Inc. Common Stock",$6.29,0.74,13.333%,"314,275,516"
WALD,Waldencast plc Class A Ordinary Share,$2.56,-0.32,-11.111%,"314,165,532"
LRMR,"Larimar Therapeutics, Inc. Common Stock",$3.67,0.01,0.273%,"314,116,739"
BBCP,"Concrete Pumping Holdings, Inc. Common Stock",$6.10,-0.03,-0.489%,"313,994,145"
LPTH,"LightPath Technologies, Inc. Class A Common Stock",$6.91,0.12,1.767%,"313,900,045"
STRT,STRATTEC SECURITY CORPORATION Common Stock,$75.00,1.42,1.93%,"313,895,325"
CHSCL,"CHS Inc Class B Cumulative Redeemable Preferred Stock, Series 4",$25.49,-0.015,-0.059%,"312,813,356"
CTNM,"Contineum Therapeutics, Inc. Class A Common Stock",$10.71,0.35,3.378%,"312,544,693"
RLMD,"Relmada Therapeutics, Inc. Common Stock",$4.26,-0.04,-0.93%,"312,401,230"
XPOF,"Xponential Fitness, Inc. Class A Common Stock",$6.37,0.44,7.42%,"311,537,590"
XYF,"X Financial American Depositary Shares, each representing six Class A Ordinary Shares",$7.38,0.02,0.272%,"311,505,328"
SWKHL,SWK Holdings Corporation 9.00% Senior Notes due 2027,$25.6401,0.0301,0.118%,"311,460,320"
KELYB,"Kelly Services, Inc. Class B Common Stock",$8.80,UNCH,--,"310,983,253"
ACCO,Acco Brands Corporation Common Stock,$3.45,0.10,2.985%,"310,969,659"
TOI,"The Oncology Institute, Inc. Common Stock",$3.16,0.12,3.947%,"310,885,034"
BNED,"Barnes & Noble Education, Inc Common Stock",$9.12,2.43,36.323%,"310,571,085"
EPRX,Eupraxia Pharmaceuticals Inc. Common Stock,$6.13,-0.07,-1.129%,"310,474,269"
UMAC,"Unusual Machines, Inc. Common Stock",$8.41,-0.08,-0.942%,"310,123,367"
SI,"Shoulder Innovations, Inc. Common Stock",$15.05,0.08,0.534%,"310,055,344"
RFMZ,"RiverNorth Flexible Municipal Income Fund II, Inc. Common Stock",$12.73,0.04,0.315%,"309,997,854"
ARDC,"Ares Dynamic Credit Allocation Fund, Inc. Common Shares",$13.52,0.10,0.745%,"309,809,975"
NKLR,Terra Innovatum Global N.V. Ordinary shares,$4.40,0.15,3.529%,"309,324,171"
FSBW,"FS Bancorp, Inc. Common Stock",$41.07,0.99,2.47%,"308,783,234"
CHSCN,CHS Inc Preferred Class B Series 2 Reset Rate,$25.13,0.02,0.08%,"308,395,435"
CDRO,"Codere Online Luxembourg, S.A. Ordinary Shares",$6.75,-0.105,-1.532%,"308,075,495"
SMLR,"Semler Scientific, Inc. Common Stock",$20.32,-0.555,-2.659%,"308,049,066"
CYBN,Cybin Inc. Common Shares,$6.17,0.28,4.754%,"307,846,788"
CHSCM,"CHS Inc Class B Reset Rate Cumulative Redeemable Preferred Stock, Series 3",$24.95,-0.03,-0.12%,"306,186,475"
ALLO,"Allogene Therapeutics, Inc. Common Stock",$1.36,0.01,0.741%,"305,632,996"
XRPC,Canary XRP ETF Shares of Beneficial Interest,$23.43,-0.52,-2.171%,"305,527,200"
MLP,"Maui Land & Pineapple Company, Inc. Common Stock",$15.47,0.47,3.133%,"305,404,238"
PHOE,Phoenix Asia Holdings Limited Ordinary Shares,$14.12,UNCH,--,"304,992,000"
MIN,MFS Intermediate Income Trust Common Stock,$2.65,UNCH,--,"304,479,093"
LZM,Lifezone Metals Limited Ordinary Shares,$3.75,-0.04,-1.055%,"303,167,145"
NEWT,"NewtekOne, Inc. Common Stock",$10.48,0.23,2.244%,"302,738,852"
MCFT,"MasterCraft Boat Holdings, Inc. Common Stock",$18.58,0.58,3.222%,"302,645,867"
OBIO,"Orchestra BioMed Holdings, Inc. Ordinary Shares",$5.35,0.51,10.537%,"302,086,311"
ASLE,AerSale Corporation Common Stock,$6.40,0.03,0.471%,"301,984,070"
FLYX,"flyExclusive, Inc. Class A Common Stock",$3.74,0.34,10.00%,"301,771,878"
MPX,Marine Products Corporation Common Stock,$8.62,0.22,2.619%,"301,691,673"
KELYA,"Kelly Services, Inc. Class A Common Stock",$8.53,0.12,1.427%,"301,441,721"
PLBC,Plumas Bancorp,$43.28,1.26,2.999%,"301,034,646"
BRCC,BRC Inc. Class A Common Stock,$1.21,0.02,1.681%,"300,684,855"
SNWV,"SANUWAVE Health, Inc. Common Stock",$35.03,1.26,3.731%,"300,423,025"
NVEC,NVE Corporation Common Stock,$62.07,1.96,3.261%,"300,242,894"
TOYO,"TOYO Co., Ltd Ordinary Shares",$6.44,-0.06,-0.923%,"300,076,585"
ELA,Envela Corporation Common Stock,$11.53,0.79,7.356%,"299,358,878"
VOXR,Vox Royalty Corp. Common Stock,$4.38,0.06,1.389%,"299,017,887"
ADV,Advantage Solutions Inc. Class A Common Stock,$0.9152,0.0049,0.538%,"298,604,057"
CBAN,"Colony Bankcorp, Inc. Common Stock",$17.12,0.38,2.27%,"298,480,900"
CBK,"Commercial Bancgroup, Inc. Common Stock",$24.34,-0.035,-0.144%,"297,912,935"
AVXL,Anavex Life Sciences Corp. Common Stock,$3.46,0.38,12.338%,"297,192,666"
SLN,Silence Therapeutics Plc American Depository Share,$6.35,0.05,0.794%,"297,180,000"
NECB,"NorthEast Community Bancorp, Inc. Common Stock",$21.17,0.80,3.927%,"296,956,671"
HDSN,"Hudson Technologies, Inc. Common Stock",$6.81,0.11,1.642%,"296,903,756"
PMM,Putnam Managed Municipal Income Trust Common Stock,$6.09,0.02,0.329%,"296,819,347"
LFCR,"Lifecore Biomedical, Inc. Common Stock",$7.90,0.39,5.193%,"295,984,181"
ACRS,"Aclaris Therapeutics, Inc. Common Stock",$2.73,-0.02,-0.727%,"295,782,502"
HRZN,Horizon Technology Finance Corporation Common Stock,$6.66,0.01,0.15%,"295,592,725"
VNDA,Vanda Pharmaceuticals Inc. Common Stock,$5.00,0.11,2.249%,"295,483,150"
HERE,Here Group Limited American Depositary Shares,$5.41,0.27,5.253%,"294,220,767"
MVIS,"MicroVision, Inc. Common Stock",$0.9631,-0.0169,-1.724%,"294,128,110"
HNST,"The Honest Company, Inc. Common Stock",$2.63,0.05,1.938%,"294,009,473"
CPZ,Calamos Long/Short Equity & Dynamic Income Trust Common Stock,$14.95,-0.01,-0.067%,"293,501,300"
CIA,"Citizens, Inc. Class A Common Stock ($1.00 Par)",$5.83,0.03,0.517%,"293,230,624"
TARA,"Protara Therapeutics, Inc.  Common Stock",$7.56,0.19,2.578%,"291,719,686"
RLGT,"Radiant Logistics, Inc. Common Stock",$6.22,0.23,3.84%,"291,633,284"
WSBF,"Waterstone Financial, Inc. Common Stock (MD)",$15.80,0.28,1.804%,"291,619,304"
ACIU,AC Immune SA Common Stock,$2.90,-0.18,-5.844%,"291,190,093"
QSI,Quantum-Si Incorporated Class A Common Stock,$1.35,UNCH,--,"290,911,048"
SVC,Service Properties Trust Common Stock,$1.73,0.09,5.488%,"290,789,131"
FNLC,"First Bancorp, Inc  (ME) Common Stock",$25.91,0.44,1.728%,"290,692,581"
BWAY,BrainsWay Ltd. American Depositary Shares,$15.40,0.375,2.496%,"290,586,111"
BBOT,"BridgeBio Oncology Therapeutics, Inc. Common Stock  ",$12.36,0.07,0.57%,"290,571,240"
CNDT,Conduent Incorporated Common Stock ,$1.90,0.08,4.396%,"290,490,033"
OCCIO,"OFS Credit Company, Inc. 6.125% Series C Term Preferred Stock",$24.928,UNCH,--,"289,576,361"
DH,Definitive Healthcare Corp. Class A Common Stock,$2.80,0.11,4.089%,"289,249,484"
SY,So-Young International Inc. American Depository Shares,$2.87,-0.27,-8.599%,"289,000,238"
ACRE,Ares Commercial Real Estate Corporation Common Stock,$5.25,0.27,5.422%,"288,888,878"
NNOX,NANO-X IMAGING LTD Ordinary Shares,$4.52,0.39,9.443%,"288,204,245"
WEYS,"Weyco Group, Inc. Common Stock",$30.16,0.74,2.515%,"287,979,382"
