Symbol,Name,Last Sale,Net Change,% Change,Market Cap
CLWT,Euro Tech Holdings Company Limited Common Stock,$1.2994,0.0174,1.357%,"9,805,165"
IHT,InnSuites Hospitality Trust Shares of Beneficial Interest,$1.0634,0.004,0.378%,"9,788,420"
FBGL,FBS Global Limited Ordinary Shares,$0.719,0.1061,17.311%,"9,706,500"
NAMMW,Namib Minerals Warrants,$0.18,UNCH,--,"9,661,937"
IMNN,"Imunon, Inc. Common Stock",$2.99,-0.15,-4.777%,"9,647,902"
MTR,Mesa Royalty Trust Common Stock,$5.15,-0.14,-2.647%,"9,597,489"
INHD,Inno Holdings Inc. Common Stock,$1.14,0.01,0.885%,"9,591,075"
BIAF,"bioAffinity Technologies, Inc. Common Stock",$2.12,1.05,98.131%,"9,537,263"
QNTM,Quantum Biopharma Ltd. Class B Subordinate Voting Shares,$2.48,-0.08,-3.125%,"9,530,479"
GAUZ,Gauzy Ltd. Ordinary Shares,$0.508,0.008,1.60%,"9,520,983"
CRGOW,Freightos Limited Warrants,$0.19,-0.0001,-0.053%,"9,508,120"
DTSS,Datasea Inc. Common Stock,$0.9101,0.0201,2.258%,"9,507,954"
CMMB,Chemomab Therapeutics Ltd. American Depositary Share,$1.83,-0.03,-1.613%,"9,499,669"
BGLWW,Blue Gold Limited Warrant,$0.27,0.01,3.846%,"9,489,882"
LHSW,Lianhe Sowell International Group Ltd Class A Ordinary Shares,$0.1819,0.0073,4.181%,"9,458,800"
WIMI,WiMi Hologram Cloud Inc. Class B Ordinary Shares,$1.92,UNCH,--,"9,427,974"
CENN,Cenntro Inc. Common Stock,$0.1071,-0.0044,-3.946%,"9,415,464"
PCLA,PicoCELA Inc. American Depositary Shares,$2.25,-0.06,-2.597%,"9,346,061"
SPPL,SIMPPLE LTD. Ordinary Shares,$2.0999,0.0299,1.444%,"9,344,261"
ICU,SeaStar Medical Holding Corporation Common Stock,$2.56,-0.08,-3.03%,"9,228,065"
CWD,CaliberCos Inc. Class A Common Stock,$1.41,0.01,0.714%,"9,213,390"
RIME,"Algorhythm Holdings, Inc. Common Stock",$1.60,0.03,1.911%,"9,212,963"
SQFTP,"Presidio Property Trust, Inc. 9.375% Series D Cumulative Redeemable Perpetual Preferred Stock, $0.01 par value per share",$6.38,0.1499,2.406%,"9,181,452"
ZNB,Zeta Network Group Class A Ordinary Shares,$5.805,-2.905,-33.352%,"9,176,527"
SKYQ,Sky Quarry Inc. Common Stock,$0.36,0.0108,3.093%,"9,171,489"
ITRM,Iterum Therapeutics plc Ordinary Share,$0.1725,0.0014,0.818%,"9,114,073"
XWEL,"XWELL, Inc. Common Stock",$1.58,0.06,3.947%,"9,111,391"
BFRG,"Bullfrog AI Holdings, Inc. Common Stock",$0.596,-0.014,-2.295%,"9,088,884"
HWH,HWH International Inc. Common Stock,$1.39,0.03,2.206%,"9,002,196"
TGHL,The GrowHub Limited Class A Ordinary Shares,$0.3555,0.0248,7.499%,"8,994,082"
RNAZ,"TransCode Therapeutics, Inc. Common Stock",$9.785,-0.015,-0.153%,"8,972,532"
ATON,AlphaTON Capital Corp. Common Stock,$0.382,-0.0137,-3.462%,"8,952,013"
PRHI,"Presurance Holdings, Inc. Common Stock",$0.7316,0.0661,9.932%,"8,942,260"
TNON,"Tenon Medical, Inc. Common Stock",$0.8031,-0.0021,-0.261%,"8,919,585"
YJ,Yunji Inc. American Depository Shares,$1.81,-0.07,-3.723%,"8,915,227"
USGOW,U.S. GoldMining Inc. Warrant,$0.67,-0.18,-21.176%,"8,893,041"
FMFC,Kandal M Venture Limited Class A Ordinary Shares,$0.4598,-0.013,-2.75%,"8,791,376"
TLIH,Ten-League International Holdings Limited Ordinary Shares,$0.2975,-0.0005,-0.168%,"8,747,792"
DSS,"DSS, Inc. Common Stock",$0.9503,0.0479,5.308%,"8,640,620"
XAIR,"Beyond Air, Inc. Common Stock",$0.82,0.0098,1.21%,"8,634,062"
ASTLW,Algoma Steel Group Inc. Warrant,$0.082,-0.018,-18.00%,"8,604,572"
BTCT,BTC Digital Ltd. Ordinary Shares,$1.32,0.07,5.60%,"8,492,933"
IQST,iQSTEL Inc. Common Stock,$1.85,-0.075,-3.896%,"8,489,252"
APRE,"Aprea Therapeutics, Inc. Common stock",$0.736,-0.029,-3.791%,"8,428,023"
XELB,"Xcel Brands, Inc. Common Stock",$1.42,-0.17,-10.692%,"8,369,217"
CJMB,Callan JMB Inc. Common Stock,$1.81,0.04,2.26%,"8,367,679"
GELS,Gelteq Limited Ordinary Shares,$0.78,UNCH,--,"8,354,626"
IFBD,"Infobird Co., Ltd Ordinary Shares",$1.02,UNCH,--,"8,352,345"
OLB,"The OLB Group, Inc. Common Stock",$0.6199,-0.0061,-0.974%,"8,327,994"
ARBB,ARB IOT Group Limited Ordinary Shares,$4.70,-0.2683,-5.40%,"8,296,703"
MIMI,Mint Incorporation Limited Class A Ordinary Shares,$0.3317,-0.0094,-2.756%,"8,296,646"
MI,NFT Limited Class A Ordinary Share,$0.571,-0.0672,-10.53%,"8,175,812"
HSCS,HeartSciences Inc. Common Stock,$2.568,0.028,1.102%,"8,161,636"
EJH,E-Home Household Service Holdings Limited Ordinary Shares,$0.1016,-0.0039,-3.697%,"8,128,392"
YHGJ,Yunhong Green CTI Ltd. Common Stock,$2.93,-0.05,-1.678%,"8,127,419"
CXAI,CXApp Inc. Class A Common Stock,$0.2534,0.0334,15.182%,"8,082,429"
TOVX,"Theriva Biologics, Inc. Common Stock",$0.1752,-0.0058,-3.204%,"8,040,395"
LCFY,Locafy Limited Ordinary Share,$4.455,-0.145,-3.152%,"8,014,790"
AMST,Amesite Inc. Common Stock,$1.75,0.03,1.744%,"8,002,248"
MSN,Emerson Radio Corporation Common Stock,$0.3794,0.0085,2.292%,"7,983,582"
JYD,Jayud Global Logistics Limited Class A Ordinary Shares,$2.91,-0.14,-4.59%,"7,955,559"
ITOC,iTonic Holdings Ltd Class A Ordinary Shares,$0.3194,-0.0056,-1.723%,"7,894,929"
NXL,"Nexalin Technology, Inc. Common Stock",$0.4222,0.0119,2.90%,"7,874,849"
DKI,DarkIris Inc. Class A Ordinary Shares,$0.3906,-0.0198,-4.825%,"7,860,825"
INEO,INNEOVA Holdings Limited Class A Ordinary Shares,$0.4856,-0.0054,-1.10%,"7,852,455"
ARBEW,Arbe Robotics Ltd. Warrant,$0.0652,-0.0075,-10.316%,"7,847,440"
CUPR,Cuprina Holdings (Cayman) Limited Class A Ordinary Shares,$0.3731,-0.0221,-5.592%,"7,835,100"
ALZN,"Alzamend Neuro, Inc. Common Stock",$2.04,-0.05,-2.392%,"7,761,672"
PULM,"Pulmatrix, Inc. Common Stock",$2.11,-0.05,-2.315%,"7,706,321"
MKDW,MKDWELL Tech Inc. Ordinary Share,$2.17,-0.21,-8.824%,"7,700,683"
KPRX,"Kiora Pharmaceuticals, Inc.  Common Stock",$2.09,-0.06,-2.791%,"7,686,884"
GRDX,GridAI Technologies Corp. Common Stock,$2.26,0.06,2.727%,"7,597,901"
CETX,Cemtrex Inc. Common Stock,$0.7525,-0.0149,-1.942%,"7,583,762"
ZSPC,"zSpace, Inc. Common stock",$0.2269,0.0348,18.116%,"7,556,447"
FGI,FGI Industries Ltd. Ordinary Shares,$3.93,-0.07,-1.75%,"7,546,150"
NWTG,"Newton Golf Company, Inc. Common Stock",$1.58,-0.02,-1.25%,"7,508,892"
BOLT,"Bolt Biotherapeutics, Inc. Common Stock",$3.91,-0.14,-3.457%,"7,505,014"
HTOO,Fusion Fuel Green PLC Class A Ordinary Shares,$3.10,-0.06,-1.899%,"7,493,156"
CLGN,CollPlant Biotechnologies Ltd Ordinary Shares,$0.585,-0.007,-1.182%,"7,489,759"
YCBD,"cbdMD, Inc. Common Stock",$0.71,-0.02,-2.74%,"7,451,848"
ADVB,Advanced Biomed Inc. Common Stock,$5.45,0.09,1.679%,"7,436,721"
MLEC,Moolec Science SA Ordinary Shares,$10.23,-1.18,-10.342%,"7,428,187"
OLOX,Olenox Industries Inc. Common Stock,$1.20,-0.15,-11.111%,"7,418,113"
SUGP,SU Group Holdings Limited Ordinary Shares,$5.06,-0.07,-1.365%,"7,411,746"
PMCB,"PharmaCyte  Biotech, Inc. Common Stock",$0.6902,-0.0048,-0.691%,"7,409,745"
WAFU,Wah Fu Education Group Limited Ordinary Shares,$1.68,-0.07,-4.00%,"7,409,739"
MKZR,"MacKenzie Realty Capital, Inc. Common Stock",$3.76,-0.01,-0.265%,"7,393,664"
TCRT,"Alaunos Therapeutics, Inc. Common Stock",$3.30,0.11,3.448%,"7,365,036"
GRMLW,Greenland Mines Ltd Warrant,$0.1001,-0.0381,-27.569%,"7,361,026"
CIIT,"Tianci International, Inc. Common Stock",$0.30,UNCH,--,"7,359,541"
IINNW,Inspira Technologies Oxy B.H.N. Ltd. Warrant,$0.17,UNCH,--,"7,356,212"
CRE,Cre8 Enterprise Limited Class A Ordinary Shares,$3.65,-0.32,-8.06%,"7,350,947"
MYSE,"Myseum, Inc. Common Stock",$1.72,-0.06,-3.371%,"7,334,646"
RENX,RenX Enterprises Corp. Common Stock,$0.1582,-0.014,-8.13%,"7,334,309"
BCTXL,BriaCell Therapeutics Corp. Warrant expiring 2031,$1.0101,-0.0599,-5.598%,"7,323,717"
ELPW,Elong Power Holding Limited Class A Ordinary Shares,$5.16,1.57,43.733%,"7,313,062"
SCKT,"Socket Mobile, Inc. Common Stock",$0.9133,-0.0065,-0.707%,"7,284,903"
SDAWW,SunCar Technology Group Inc. Warrant,$0.0735,0.0001,0.136%,"7,240,122"
LIMN,"Liminatus Pharma, Inc. Class A Common Stock",$0.233,-0.005,-2.101%,"7,238,059"
RDZNW,"Roadzen, Inc. Warrants",$0.0903,-0.0217,-19.375%,"7,196,519"
GURE,"Gulf Resources, Inc. (NV) Common Stock",$4.67,-0.10,-2.096%,"7,189,610"
WKHS,"Workhorse Group, Inc. Common Stock",$3.31,-0.05,-1.488%,"7,181,932"
TOIIW,"The Oncology Institute, Inc. Warrant",$0.0729,0.0378,107.692%,"7,172,000"
ETS,Elite Express Holding Inc. Class A Common Stock,$0.4289,0.0009,0.21%,"7,169,781"
GLE,Global Engine Group Holding Limited Class A Ordinary Shares,$0.3903,-0.0248,-5.974%,"7,142,490"
BRTX,"BioRestorative Therapies, Inc. Common Stock (NV)",$0.3029,-0.0051,-1.656%,"7,067,250"
EDHL,Everbright Digital Holding Limited Ordinary Shares,$4.24,0.7799,22.54%,"7,064,900"
AEHL,Antelope Enterprise Holdings Limited Class A Ordinary Shares,$1.86,-0.19,-9.268%,"7,030,080"
TULP,"Bloomia Holdings, Inc. Common Stock",$3.9626,0.0526,1.345%,"7,026,161"
BKYI,"BIO-key International, Inc. Common Stock",$0.648,-0.014,-2.115%,"7,022,128"
AIHS,Senmiao Technology Limited Common Stock,$1.54,0.19,14.074%,"7,018,533"
FTFT,Future FinTech Group Inc. Common Stock,$1.389,0.049,3.657%,"7,012,128"
PGYWW,Pagaya Technologies Ltd. Warrants,$0.0845,0.0075,9.74%,"6,973,484"
ZCMD,Zhongchao Inc. Class A Ordinary Shares,$1.81,-0.02,-1.093%,"6,958,073"
NVNO,enVVeno Medical Corporation Common Stock,$10.61,-0.40,-3.633%,"6,955,980"
DAIC,"CID HoldCo, Inc. Common Stock",$0.2366,-0.0014,-0.588%,"6,930,800"
JXG,JX Luxventure Group Inc. Common Stock,$3.712,-0.338,-8.346%,"6,928,901"
CYCU,"Cycurion, Inc. Common Stock",$1.65,-0.08,-4.624%,"6,910,509"
MBIO,"Mustang Bio, Inc. Common Stock",$0.942,-0.0028,-0.296%,"6,875,739"
BBGI,"Beasley Broadcast Group, Inc. Class A Common Stock",$3.79,-0.02,-0.525%,"6,837,137"
DAVEW,Dave Inc. Warrants,$0.4999,-0.0461,-8.443%,"6,778,443"
NXGL,"NexGel, Inc Common Stock",$0.831,-0.1245,-13.03%,"6,766,944"
HKPD,"Cellyan Biotechnology Co., Ltd Class A Ordinary Shares",$0.6101,-0.0318,-4.954%,"6,711,100"
PCSA,"Processa Pharmaceuticals, Inc. Common Stock",$2.95,0.19,6.884%,"6,684,019"
LOBO,LOBO TECHNOLOGIES LTD. Class A Ordinary Shares,$0.5299,-0.0122,-2.251%,"6,660,056"
AGPU,Axe Compute Inc. Common Stock,$1.95,0.165,9.244%,"6,617,356"
CELZ,"Creative Medical Technology Holdings, Inc. Common Stock",$1.88,-0.06,-3.093%,"6,569,976"
ABTS,Abits Group Inc Ordinary Shares,$2.76,-0.11,-3.833%,"6,541,186"
XPON,Expion360 Inc. Common Stock,$0.6742,-0.0081,-1.187%,"6,510,573"
FLDDW,"Fold Holdings, Inc. Warrant",$0.131,-0.004,-2.963%,"6,440,098"
TGL,Treasure Global Inc. Common Stock,$3.84,0.008,0.209%,"6,434,784"
XBIO,"Xenetic Biosciences, Inc. Common Stock",$2.8077,0.2427,9.462%,"6,432,598"
INBS,Intelligent Bio Solutions Inc. Common Stock,$4.00,-0.02,-0.498%,"6,415,132"
IZM,ICZOOM Group Inc. Class A Ordinary Shares,$0.53,-0.0161,-2.948%,"6,369,598"
NTCL,NETCLASS TECHNOLOGY INC Class A Ordinary Shares,$0.2888,0.0085,3.032%,"6,351,299"
HXHX,Haoxin Holdings Limited Class A Ordinary Shares,$0.459,0.0258,5.956%,"6,311,250"
NRSNW,NeuroSense Therapeutics Ltd. Warrant,$0.1899,-0.0181,-8.702%,"6,288,128"
HCAI,"Huachen AI Parking Management Technology Holding Co., Ltd. Class A Ordinary Shares",$0.18,-0.0044,-2.386%,"6,281,550"
MGRX,"Mangoceuticals, Inc. Common Stock",$0.3841,-0.0091,-2.314%,"6,256,527"
TNMG,TNL Mediagene Ordinary Shares,$2.44,-0.04,-1.613%,"6,237,628"
EVTV,"Envirotech Vehicles, Inc. Common Stock",$1.29,-0.01,-0.769%,"6,230,074"
HTCR,"Heartcore Enterprises, Inc. Common Stock",$0.245,-0.0006,-0.244%,"6,227,853"
JCTC,Jewett-Cameron Trading Company Common Shares,$1.75,-0.03,-1.685%,"6,160,198"
SOWG,Sow Good Inc. Common Stock,$0.4621,0.0871,23.227%,"6,159,086"
IPDN,"Professional Diversity Network, Inc. Common Stock",$1.26,0.01,0.80%,"6,151,273"
ORKT,Orangekloud Technology Inc. Class A Ordinary Shares,$1.04,-0.02,-1.887%,"6,073,340"
TDIC,Dreamland Limited Class A Ordinary Shares,$0.1633,0.0033,2.063%,"6,042,100"
OXBR,Oxbridge Re Holdings Limited Ordinary Shares,$0.7857,-0.0743,-8.64%,"6,031,129"
MSGY,Masonglory Limited Ordinary Shares,$0.4288,-0.0124,-2.811%,"6,003,200"
IVF,"INVO Fertility, Inc. Common Stock",$0.861,0.044,5.386%,"5,993,503"
LUCY,"Innovative Eyewear, Inc. Common Stock",$1.12,0.05,4.673%,"5,992,205"
BMRA,"Biomerica, Inc. Common Stock",$1.97,UNCH,--,"5,949,532"
QNCX,"Quince Therapeutics, Inc. Common Stock",$0.1065,UNCH,--,"5,930,079"
CODX,"Co-Diagnostics, Inc. Common Stock",$2.80,0.17,6.464%,"5,866,087"
ATER,"Aterian, Inc. Common Stock",$0.581,0.001,0.172%,"5,825,714"
BEATW,"Heartbeam, Inc. Warrant",$0.1451,UNCH,--,"5,821,035"
CAPS,Capstone Holding Corp. Common Stock,$0.6374,-0.0009,-0.141%,"5,792,610"
EHGO,Eshallgo Inc. Class A Ordinary Shares,$0.193,-0.009,-4.455%,"5,730,973"
RVYL,Ryvyl Inc. Common Stock,$5.52,-0.08,-1.429%,"5,727,502"
CYCN,"Cyclerion Therapeutics, Inc. Common Stock",$1.45,0.03,2.113%,"5,691,705"
MNTS,Momentus Inc. Class A Common Stock,$4.06,0.14,3.571%,"5,672,547"
APM,Aptorum Group Limited Class A Ordinary Shares,$0.7919,-0.0081,-1.013%,"5,657,141"
SYNX,Silynxcom Ltd. Ordinary Shares,$1.07,-0.16,-13.008%,"5,657,071"
OFAL,OFA Group Class A Ordinary Shares,$0.39,-0.0129,-3.202%,"5,653,885"
CNEY,CN Energy Group Inc. Class A Ordinary Shares,$1.00,-0.02,-1.961%,"5,623,756"
WLDS,Wearable Devices Ltd. Ordinary Share,$1.59,-0.02,-1.242%,"5,614,411"
YMAT,"J-Star Holding Co., Ltd. Class A Ordinary Shares",$0.3283,-0.0129,-3.781%,"5,585,331"
HYFM,"Hydrofarm Holdings Group, Inc. Common Stock",$1.19,-0.05,-4.032%,"5,553,735"
TBH,"Brag House Holdings, Inc. Common Stock",$0.265,0.019,7.724%,"5,552,111"
JCSE,JE Cleantech Holdings Limited Ordinary Shares,$1.05,0.01,0.962%,"5,523,273"
GIBO,GIBO Holdings Limited Class A Ordinary Shares,$1.47,0.01,0.685%,"5,520,344"
MEGL,Magic Empire Global Limited Class A Ordinary Shares,$1.09,0.01,0.926%,"5,519,815"
MITQ,"Moving iMage Technologies, Inc. Common Stock",$0.5521,-0.0179,-3.14%,"5,490,698"
ANY,Sphere 3D Corp. Common Shares,$1.62,0.02,1.25%,"5,464,126"
CDTG,CDT Environmental Technology Investment Holdings Limited ordinary shares,$0.4027,0.006,1.512%,"5,446,518"
BOXL,Boxlight Corporation Class A Common Stock,$1.30,0.01,0.775%,"5,416,667"
SNTG,Sentage Holdings Inc. Class A Ordinary Shares,$1.92,-0.0001,-0.005%,"5,386,224"
SLXN,Silexion Therapeutics Corp Ordinary Shares,$1.605,-0.0613,-3.679%,"5,345,910"
GP,GreenPower Motor Company Inc. Common Shares,$1.06,-0.02,-1.852%,"5,331,048"
JWEL,Jowell Global Ltd. Ordinary Shares,$2.45,-0.01,-0.407%,"5,317,664"
SILO,"Silo Pharma, Inc. Common Stock",$0.3224,-0.0208,-6.061%,"5,284,040"
ASBP,"Aspire Biopharma Holdings, Inc. Common Stock",$1.05,-0.075,-6.667%,"5,275,349"
MSS,Maison Solutions Inc. Class A Common Stock,$0.209,-0.033,-13.636%,"5,272,997"
IMRN,Immuron Limited American Depositary Shares,$0.783,-0.027,-3.333%,"5,250,406"
VS,Versus Systems Inc. Common Stock,$1.07,0.10,10.309%,"5,244,794"
IPST,"IP Strategy Holdings, Inc. Common Stock",$0.508,0.015,3.043%,"5,223,985"
HCWC,Healthy Choice Wellness Corp. Class A Common Stock,$0.287,-0.009,-3.041%,"5,213,570"
PMAX,Powell Max Limited Class A Ordinary Shares,$0.5921,-0.0043,-0.721%,"5,197,150"
CTNT,Cheetah Net Supply Chain Service Inc Class A Common Stock,$1.52,-0.05,-3.185%,"5,196,252"
EVGN,Evogene Ltd Ordinary Shares,$0.7974,-0.0116,-1.434%,"5,194,733"
CHR,"Cheer Holding, Inc. Class A Ordinary Share",$0.99,-0.05,-4.808%,"5,134,337"
SXTP,"60 Degrees Pharmaceuticals, Inc. Common Stock",$2.39,-0.52,-17.869%,"5,133,120"
CDIO,Cardio Diagnostics Holdings Inc. Common stock,$2.80,-1.76,-38.596%,"5,112,943"
WTO,UTime Limited Class A Ordinary Shares,$3.02,0.06,2.027%,"5,111,196"
GBR,"New Concept Energy, Inc Common Stock",$0.99,0.0045,0.457%,"5,080,615"
IOTR,iOThree Limited Ordinary Shares,$1.98,-0.0307,-1.527%,"5,078,702"
SOAR,"Volato Group, Inc. Class A Common Stock",$0.3246,-0.0196,-5.694%,"5,067,118"
SBFM,Sunshine Biopharma Inc. Common Stock,$1.10,-0.01,-0.901%,"5,011,540"
SKK,SKK Holdings Limited Class A Ordinary Shares,$0.2657,-0.0023,-0.858%,"4,981,875"
LCFYW,Locafy Limited Warrant,$2.75,UNCH,--,"4,947,401"
POLA,"Polar Power, Inc. Common Stock",$1.83,-0.51,-21.795%,"4,865,377"
AMIX,"Autonomix Medical, Inc. Common Stock",$0.425,0.003,0.711%,"4,848,971"
SOPA,Society Pass Incorporated Common Stock,$0.636,-0.0191,-2.916%,"4,837,114"
AMBO,Ambow Education Holding Ltd. American Depository Shares (each representing twenty (20) Class A Ordinary Shares),$1.689,0.059,3.62%,"4,831,084"
KXIN,Kaixin Holdings Ordinary Shares,$5.07,-0.312,-5.797%,"4,792,539"
MRNOW,Murano Global Investments PLC Warrants,$0.06,-0.001,-1.639%,"4,758,344"
BETRW,Better Home & Finance Holding Company Warrant,$0.302,-0.003,-0.984%,"4,740,385"
CANF,"Can-Fite Biopharma Ltd American Depositary Shares, each representing two (2) Ordinary Shares",$3.60,-0.12,-3.226%,"4,713,163"
DFSC,DEFSEC Technologies Inc. Common Stock,$2.36,-0.13,-5.221%,"4,704,957"
VIVS,"VivoSim Labs, Inc. Common Stock",$1.80,-0.06,-3.226%,"4,694,332"
HPAIW,Helport AI Limited Warrants,$0.125,UNCH,--,"4,678,871"
WALDW,Waldencast plc Warrant ,$0.0365,-0.0032,-8.06%,"4,673,504"
LMFA,"LM Funding America, Inc. Common Stock",$0.3309,-0.0577,-14.848%,"4,673,465"
REVB,"Revelation Biosciences, Inc. Common Stock",$1.2553,0.0253,2.057%,"4,670,243"
GNPX,"Genprex, Inc. Common Stock",$2.01,0.05,2.551%,"4,660,977"
YDKG,Yueda Digital Holding Class A Ordinary Share,$0.8373,0.0093,1.123%,"4,640,504"
VSTD,Vestand Inc. Class A Common Stock,$0.3253,-0.0547,-14.395%,"4,627,386"
ILAG,Intelligent Living Application Group Inc. Ordinary Shares,$2.20,-0.05,-2.222%,"4,570,386"
SONM,"DNA X, Inc. Common Stock",$4.43,0.34,8.313%,"4,557,110"
LNAI,Lunai Bioworks Inc. Common Stock,$0.1844,-0.0078,-4.058%,"4,460,148"
RDHL,Redhill Biopharma Ltd. American Depositary Shares,$0.87,-0.01,-1.136%,"4,448,210"
ULY,Urgent.ly Inc. Common Stock,$2.03,UNCH,--,"4,447,618"
ATPC,Agape ATP Corporation Common Stock,$4.44,-1.21,-21.416%,"4,442,398"
LGCL,Lucas GC Limited Ordinary Shares,$1.592,-0.068,-4.096%,"4,442,358"
ESLAW,"Estrella Immunopharma, Inc. Warrant",$0.116,0.04,52.632%,"4,404,629"
DUO,Fangdd Network Group Ltd. Class A Ordinary Shares,$1.13,-0.08,-6.612%,"4,404,524"
XHLD,"TEN Holdings, Inc. Common Stock",$1.48,-0.05,-3.268%,"4,399,790"
SXTC,"China SXT Pharmaceuticals, Inc. Ordinary Shares",$1.89,-0.24,-11.268%,"4,385,830"
ALBT,Avalon GloboCare Corp. Common Stock,$0.69,-0.0161,-2.28%,"4,322,671"
WXM,WF International Limited Ordinary Shares,$0.5001,0.0001,0.02%,"4,311,206"
GRRRW,Gorilla Technology Group Inc. Warrant,$0.2117,-0.0438,-17.143%,"4,281,049"
AMPGZ,"Amplitech Group, Inc. Series B Right",$0.17,UNCH,--,"4,280,821"
LXEH,"Lixiang Education Holding Co., Ltd. American Depositary Shares",$0.2229,-0.0031,-1.372%,"4,272,251"
NCT,Intercont (Cayman) Limited Class A Ordinary shares,$0.145,0.002,1.399%,"4,250,743"
SNOA,"Sonoma Pharmaceuticals, Inc. Common Stock",$2.455,0.005,0.204%,"4,248,655"
RBNE,Robin Energy Ltd. Common Stock,$1.50,-0.28,-15.73%,"4,208,619"
RMSG,Real Messenger Corporation Ordinary Shares,$0.4361,-0.0154,-3.411%,"4,174,036"
RMCOW,Royalty Management Holding Corporation Warrant,$0.2749,0.0149,5.731%,"4,162,188"
BNBX,BNB Plus Corp. Common Stock,$0.76,0.0119,1.591%,"4,140,076"
SUNE,"SUNation Energy, Inc. Common Stock",$1.21,-0.02,-1.626%,"4,122,003"
MTNB,"Matinas Biopharma Holdings, Inc. Common Stock",$0.6429,0.0049,0.768%,"4,118,540"
CHNR,"China Natural Resources, Inc. Common Stock",$3.3348,-0.0852,-2.491%,"4,112,545"
EZRA,"Reliance Global Group, Inc. Common Stock",$0.1935,-0.0214,-9.958%,"4,112,458"
BAOS,Baosheng Media Group Holdings Limited Ordinary shares,$2.68,UNCH,--,"4,112,425"
ASPSW,Altisource Portfolio Solutions S.A. Net Settle Stakeholder Warrants,$0.36,-0.02,-5.263%,"4,059,445"
AGMH,AGM Group Holdings Inc. Class A Ordinary Shares,$1.16,0.02,1.754%,"4,058,760"
GNLN,"Greenlane Holdings, Inc. Class A Common Stock",$0.823,-0.0521,-5.954%,"4,057,030"
DCOY,Decoy Therapeutics Inc. Common Stock,$7.62,0.13,1.736%,"4,053,840"
NDRA,ENDRA Life Sciences Inc. Common Stock,$3.47,0.20,6.116%,"4,047,550"
AMPGR,"Amplitech Group, Inc. Series A Right",$0.16,UNCH,--,"4,029,008"
ASTC,Astrotech Corporation (DE) Common Stock,$2.29,-0.02,-0.866%,"4,028,002"
EEIQ,EpicQuest Education Group International Limited Common Stock,$2.72,-0.05,-1.805%,"4,024,183"
BGLC,BioNexus Gene Lab Corp Common stock,$2.24,0.01,0.448%,"4,024,176"
SQFT,"Presidio Property Trust, Inc. Class A Common Stock",$2.79,0.02,0.722%,"4,015,086"
FCUV,Focus Universal Inc. Common Stock,$4.0679,-0.1321,-3.145%,"4,013,081"
VCIG,VCI Global Limited Ordinary Share,$1.95,-0.015,-0.763%,"3,997,356"
GSUN,Golden Sun Technology Group Limited Class A Ordinary Shares,$0.3982,-0.0618,-13.435%,"3,993,496"
SCAGW,Scage Future Warrants,$0.0549,0.0046,9.145%,"3,986,271"
INDP,"Indaptus Therapeutics, Inc. Common Stock",$1.77,-0.03,-1.667%,"3,968,913"
PDYNW,Palladyne AI Corp Warrants,$0.0853,0.0032,3.898%,"3,966,012"
DEVS,DevvStream Corp. Common Stock,$0.9049,0.0729,8.762%,"3,963,473"
SBLX,"StableX Technologies, Inc. Common Stock",$2.67,0.09,3.488%,"3,887,453"
BYAH,"Park Ha Biological Technology Co., Ltd. Class A Ordinary Shares",$1.20,0.05,4.348%,"3,864,629"
NCRA,"Nocera, Inc. Common Stock",$0.267,-0.153,-36.429%,"3,837,756"
SLE,"Super League Enterprise, Inc. Common Stock",$4.00,-0.365,-8.362%,"3,830,684"
TWAV,"TaoWeave, Inc. Common Stock",$1.19,0.06,5.31%,"3,816,580"
SDOT,Sadot Group Inc. Common Stock,$2.06,-0.08,-3.738%,"3,809,105"
OGEN,Oragenics Inc. Common Stock,$0.886,-0.0736,-7.67%,"3,778,956"
BTOG,Bit Origin Limited Class A Ordinary Shares,$2.552,-0.128,-4.776%,"3,768,901"
NIVF,NewGenIvf Group Limited Class A Ordinary Shares,$0.57,0.07,14.00%,"3,756,173"
ONMDW,OneMedNet Corp Warrant,$0.0734,UNCH,--,"3,743,782"
HIHO,Highway Holdings Limited Common Stock,$0.8108,-0.0128,-1.554%,"3,731,160"
ICON,Icon Energy Corp. Common stock,$1.16,-0.03,-2.521%,"3,728,320"
YYGH,YY Group Holding Limited Class A Ordinary Shares,$0.0502,-0.0252,-33.422%,"3,709,086"
PPBT,Purple Biotech Ltd. American Depositary Shares,$4.10,0.26,6.771%,"3,702,485"
BDMDW,Baird Medical Investment Holdings Ltd Warrant,$0.10,UNCH,--,"3,701,590"
GRI,"GRI Bio, Inc. Common Stock",$2.54,-0.38,-13.014%,"3,670,374"
NCNA,NuCana plc American Depositary Share,$1.91,-0.08,-4.02%,"3,644,620"
AQB,"AquaBounty Technologies, Inc. Common Stock",$0.937,-0.023,-2.396%,"3,633,400"
WAI,Top KingWin Ltd Class A Ordinary Shares,$2.16,-0.05,-2.262%,"3,577,226"
YAAS,Youxin Technology Ltd Class A Ordinary shares,$0.77,-0.02,-2.532%,"3,571,414"
NCPL,Netcapital Inc. Common Stock,$0.4521,-0.0129,-2.774%,"3,548,035"
ASNS,"Actelis Networks, Inc. Common Stock",$0.4036,-0.0502,-11.062%,"3,535,295"
AIOS,AIOS Tech Inc. Class A Common Shares,$0.7206,-0.015,-2.039%,"3,457,697"
MNYWW,MoneyHero Limited Warrants,$0.08,-0.0011,-1.356%,"3,456,322"
GLMD,Galmed Pharmaceuticals Ltd. Ordinary Shares,$0.63,-0.0208,-3.196%,"3,451,916"
KIDZ,"Classover Holdings, Inc. Class B Common Stock",$2.81,0.20,7.663%,"3,451,891"
AUUD,Auddia Inc. Common Stock,$0.8911,0.0262,3.029%,"3,436,392"
APVO,Aptevo Therapeutics Inc. Common Stock,$4.42,-0.15,-3.282%,"3,390,865"
DRMA,"Dermata Therapeutics, Inc. Common Stock",$1.19,-0.05,-4.032%,"3,374,058"
NCL,Northann Corp. Common Stock,$0.148,-0.008,-5.128%,"3,365,979"
BLUWW,Blue Water Acquisition Corp. III Warrant.,$0.461,-0.079,-14.63%,"3,339,945"
BQ,Boqii Holding Limited Class A Ordinary Shares,$1.19,-0.04,-3.252%,"3,319,738"
ORIS,Oriental Rise Holdings Limited Ordinary Shares,$0.6561,-0.0439,-6.271%,"3,317,776"
FCHL,Fitness Champs Holdings Limited Common Stock,$0.2203,0.0072,3.379%,"3,304,500"
IVDA,"Iveda Solutions, Inc. Common Stock",$0.296,-0.02,-6.329%,"3,297,363"
VEEE,Twin Vee PowerCats Co. Common Stock,$0.3819,-0.0134,-3.39%,"3,292,092"
TRUG,"TruGolf Holdings, Inc. Class A Common Stock",$0.6499,-0.0401,-5.812%,"3,286,833"
ZOOZW,ZOOZ Strategy Ltd. Warrant,$0.02,UNCH,--,"3,237,996"
ITP,"IT Tech Packaging, Inc. Common Stock",$0.1899,0.0029,1.551%,"3,221,733"
MSAIW,"MultiSensor AI Holdings, Inc. Warrant",$0.04,-0.0049,-10.913%,"3,205,335"
GWAV,"Greenwave Technology Solutions, Inc. Common Stock",$3.85,-0.06,-1.535%,"3,194,079"
DFNSW,T3 Defense Inc. Warrants,$0.1309,0.0125,10.557%,"3,193,674"
FLYE,"Fly-E Group, Inc. Common Stock",$1.94,0.02,1.042%,"3,166,829"
ONFO,Onfolio Holdings Inc. Common Stock,$0.54,-0.0102,-1.854%,"3,166,136"
SHPH,"Shuttle Pharmaceuticals Holdings, Inc. Common Stock",$0.94,0.0137,1.479%,"3,151,341"
MEHA,"Functional Brands, Inc. Common Stock",$0.193,0.0018,0.941%,"3,150,440"
GOVX,"GeoVax Labs, Inc. Common Stock",$1.72,-0.14,-7.527%,"3,133,112"
RKDA,"Arcadia Biosciences, Inc. Common Stock",$1.80,-0.12,-6.25%,"3,113,791"
GCLWW,GCL Global Holdings Ltd Warrants,$0.0246,-0.0082,-25.00%,"3,107,428"
ATXG,Addentax Group Corp. Common Stock,$0.2633,-0.0067,-2.481%,"3,084,651"
TRNR,Interactive Strength Inc. Common Stock,$1.50,-0.03,-1.961%,"3,051,578"
PW,Power REIT (MD) Common Stock,$0.8992,-0.0006,-0.067%,"3,047,983"
VSME,VS Media Holdings Limited Class A Ordinary Shares,$1.10,-0.04,-3.509%,"3,025,752"
CPHI,"China Pharma Holdings, Inc. Common Stock",$0.6023,-0.0316,-4.985%,"3,024,752"
CISS,C3is Inc. Common Stock,$1.12,0.01,0.901%,"3,014,191"
FRSX,Foresight Autonomous Holdings Ltd. American Depositary Shares,$2.05,-0.70,-25.455%,"2,988,310"
RUBI,Rubico Inc. Common Stock,$0.733,-0.0982,-11.814%,"2,975,924"
SGN,"Signing Day Sports, Inc. Common Stock",$0.6995,-0.1804,-20.502%,"2,960,830"
NUWE,"Nuwellis, Inc. Common Stock",$1.26,-0.02,-1.563%,"2,911,201"
AIM,AIM ImmunoTech Inc. Common Stock,$0.7286,0.0486,7.147%,"2,902,409"
BFRGW,"Bullfrog AI Holdings, Inc. Warrants",$0.1899,-0.025,-11.633%,"2,895,938"
MNDR,Mobile-health Network Solutions Class A Ordinary Shares,$0.8631,0.0031,0.36%,"2,894,405"
MIGI,Mawson Infrastructure Group Inc. Common Stock,$2.52,-0.11,-4.183%,"2,881,013"
ACON,"Aclarion, Inc. Common Stock",$3.33,UNCH,--,"2,845,055"
AMODW,"Alpha Modus Holdings, Inc. Warrant",$0.0675,0.0037,5.799%,"2,832,297"
SGLY,Singularity Future Technology Ltd. Common Stock,$0.3853,-0.0052,-1.332%,"2,810,182"
ADIL,"Adial Pharmaceuticals, Inc Common Stock",$1.96,0.09,4.813%,"2,798,821"
XRTX,XORTX Therapeutics Inc. Common Stock,$0.401,-0.049,-10.889%,"2,791,849"
IMCC,IM Cannabis Corp. Common Shares,$0.90,-0.02,-2.174%,"2,776,907"
AZTR,Azitra Inc Common Stock,$0.171,-0.009,-5.00%,"2,768,907"
ZEOWW,Zeo Energy Corporation Warrants,$0.0475,0.0032,7.223%,"2,734,140"
