Symbol,Name,Last Sale,Net Change,% Change,Market Cap
PGYWW,Pagaya Technologies Ltd. Warrants,$0.3525,-0.0014,-0.396%,"29,054,138"
NXTT,Next Technology Holding Inc. Ordinary Shares,$7.10,0.07,0.996%,"28,986,148"
ATCX,Atlas Critical Minerals Corporation Common Stock,$8.00,0.04,0.503%,"28,939,568"
VNTG,Vantage Corp Class A Ordinary Shares,$0.9108,0.0198,2.222%,"28,906,515"
PTN,"Palatin Technologies, Inc. Common Stock",$16.926,0.116,0.69%,"28,819,477"
SER,"Serina Therapeutics, Inc. Common Stock",$2.69,0.02,0.749%,"28,686,332"
RLYB,Rallybio Corporation Common Stock,$0.676,-0.0093,-1.357%,"28,556,791"
CVV,CVD Equipment Corporation Common Stock,$4.10,0.24,6.218%,"28,443,086"
MGN,Megan Holdings Limited Ordinary Shares,$1.745,-0.095,-5.163%,"28,356,250"
HUMAW,"Humacyte, Inc. Warrant",$0.1347,0.0098,7.846%,"28,244,268"
PLUR,Pluri Inc. Common Stock,$3.05,-0.02,-0.651%,"28,224,386"
MFI,mF International Limited Class A Ordinary Shares,$17.00,-1.22,-6.696%,"28,159,803"
AYTU,"Aytu BioPharma, Inc.  Common Stock",$2.76,0.01,0.364%,"28,119,454"
FOXX,Foxx Development Holdings Inc. Common Stock,$4.08,-0.04,-0.971%,"28,056,173"
BOLD,"Boundless Bio, Inc. Common Stock",$1.25,-0.01,-0.794%,"27,982,014"
SNTI,"Senti Biosciences, Inc. Common Stock",$1.06,-0.04,-3.636%,"27,868,288"
DARE,"Dare Bioscience, Inc. Common Stock",$1.95,-0.08,-3.941%,"27,863,997"
FATN,"FatPipe, Inc. Common Stock",$2.00,-0.10,-4.762%,"27,848,936"
IGC,"IGC Pharma, Inc. Common Stock",$0.2903,-0.0094,-3.136%,"27,815,972"
YYAI,AiRWA Inc. Common Stock,$1.46,0.09,6.569%,"27,713,041"
NVNI,Nvni Group Limited Ordinary Shares,$2.75,-0.10,-3.509%,"27,589,837"
IPWR,Ideal Power Inc. Common Stock,$3.23,-0.26,-7.45%,"27,544,542"
CCEL,"Cryo-Cell International, Inc. Common Stock",$3.415,0.025,0.737%,"27,508,337"
HYPD,"Hyperion DeFi, Inc. Common Stock",$3.35,-0.20,-5.634%,"27,378,408"
RYDE,Ryde Group Ltd. Class A Ordinary Shares,$0.3093,-0.0037,-1.182%,"27,313,611"
FEDU,"Four Seasons Education (Cayman) Inc. American Depositary Shares, each ADS representing 10 ordinary shares",$12.07,UNCH,--,"27,278,900"
RAIN,"Rain Enhancement Technologies Holdco, Inc. Class A Common Stock",$3.33,-0.17,-4.857%,"27,268,814"
KITT,"Nauticus Robotics, Inc. Common stock",$0.971,-0.039,-3.861%,"27,241,912"
DTCX,"Datacentrex, Inc. Common Stock",$1.64,-0.06,-3.529%,"27,127,801"
KMRK,K-Tech Solutions Company Limited Class A Ordinary Shares,$1.28,0.03,2.40%,"27,008,000"
DSY,Big Tree Cloud Holdings Limited Ordinary Shares,$0.284,0.004,1.429%,"26,990,634"
SCYX,"SCYNEXIS, Inc. Common Stock",$0.6421,-0.0114,-1.744%,"26,945,764"
SWVL,Swvl Holdings Corp Class A Common Shares,$2.72,0.22,8.80%,"26,923,964"
QNTM,Quantum Biopharma Ltd. Class B Subordinate Voting Shares,$6.96,-0.05,-0.713%,"26,746,828"
HOWL,"Werewolf Therapeutics, Inc. Common Stock",$0.5509,-0.0334,-5.716%,"26,740,796"
VTGN,"Vistagen Therapeutics, Inc. Common Stock",$0.671,-0.0305,-4.348%,"26,501,448"
NYC,American Strategic Investment Co. Class A Common Stock,$9.88,-0.12,-1.20%,"26,408,677"
PSHG,Performance Shipping Inc. Common Shares,$2.11,-0.04,-1.86%,"26,231,853"
BAERW,"Bridger Aerospace Group Holdings, Inc. Warrant",$0.47,0.0611,14.943%,"26,105,259"
TXMD,"TherapeuticsMD, Inc. Common Stock",$2.24,0.10,4.673%,"25,926,571"
NOTE,"FiscalNote Holdings, Inc. Class A common stock",$1.65,UNCH,--,"25,921,327"
ADGM,"Adagio Medical Holdings, Inc Common Stock",$0.9298,0.0509,5.791%,"25,877,575"
OPTXW,"Syntec Optics Holdings, Inc. Warrant",$0.70,0.09,14.754%,"25,844,158"
HBIO,"Harvard Bioscience, Inc. Common Stock",$0.5797,0.0147,2.602%,"25,842,832"
CLPS,CLPS Incorporation Common Stock,$0.8686,-0.0802,-8.453%,"25,835,162"
GTEC,Greenland Technologies Holding Corporation Ordinary Shares,$1.48,0.20,15.625%,"25,743,454"
BNAI,Brand Engagement Network Inc. Common Stock,$5.71,-0.09,-1.552%,"25,626,937"
SBCWW,SBC Medical Group Holdings Incorporated Warrants,$0.2495,-0.0405,-13.966%,"25,592,947"
VEEA,Veea Inc. Common Stock,$0.5099,0.0049,0.97%,"25,576,927"
MVO,MV Oil Trust Units of Beneficial Interests,$2.22,0.26,13.265%,"25,530,000"
RDI,Reading International Inc Class A Common Stock,$1.12,0.01,0.901%,"25,443,331"
XOS,"Xos, Inc. Common Stock",$2.24,0.02,0.901%,"25,388,590"
RECT,Rectitude Holdings Ltd Ordinary Shares,$1.75,-0.03,-1.685%,"25,375,000"
WCT,Wellchange Holdings Company Limited Class A Ordinary shares,$0.1651,0.0004,0.243%,"25,304,052"
CHOW,ChowChow Cloud International Holdings Limited Ordinary Shares,$0.717,0.0292,4.245%,"25,166,700"
EPOW,"Sunrise New Energy Co., Ltd Class A Ordinary Shares",$0.9316,-0.0164,-1.73%,"25,141,043"
INTS,"Intensity Therapeutics, Inc. Common stock",$0.4181,-0.0069,-1.624%,"25,113,162"
MBNKO,"Medallion Bank Fixed-Rate Reset Non-Cumulative Perpetual Preferred Stock, Series G, par value $1.00 per share",$25.05,-0.01,-0.04%,"25,050,000"
CUE,"Cue Biopharma, Inc. Common Stock",$0.277,-0.064,-18.768%,"25,008,043"
MNDO,MIND C.T.I. Ltd. Ordinary Shares,$1.225,-0.005,-0.407%,"24,948,749"
PFAI,Pinnacle Food Group Limited Class A Common Shares,$2.13,0.05,2.404%,"24,921,000"
SAGT,SAGTEC GLOBAL LIMITED Class A Ordinary shares,$1.98,-0.02,-1.00%,"24,849,000"
GREE,Greenidge Generation Holdings Inc. Class A Common Stock,$1.57,-0.08,-4.848%,"24,804,425"
BAFN,BayFirst Financial Corp. Common Stock,$6.03,-0.09,-1.471%,"24,783,318"
PLRZ,Polyrizon Ltd. Ordinary Shares,$15.54,0.44,2.914%,"24,769,921"
AFRIW,Forafric Global PLC Warrants,$0.9179,-0.1121,-10.883%,"24,692,971"
ANGH,Anghami Inc. Ordinary Shares,$3.69,0.08,2.216%,"24,681,351"
WNW,Meiwu Technology Company Limited Ordinary Shares,$1.57,0.03,1.948%,"24,560,064"
TOPS,"TOP Ships, Inc. Common Stock",$5.305,-0.097,-1.796%,"24,541,975"
NNVC,"NanoViricides, Inc. Common Stock",$1.13,-0.02,-1.739%,"24,372,325"
AGPU,Axe Compute Inc. Common Stock,$7.08,0.2199,3.205%,"24,026,093"
EVGOW,EVgo Inc. Warrants,$0.0777,0.0029,3.877%,"23,930,258"
PLAG,Planet Green Holdings Corp. Common Stock,$2.54,-0.01,-0.392%,"23,832,094"
MKDW,MKDWELL Tech Inc. Ordinary Share,$0.1659,-0.0071,-4.104%,"23,826,449"
PIII,P3 Health Partners Inc. Class A Common Stock,$3.30,0.32,10.738%,"23,778,444"
AUST,Austin Gold Corp. Common Shares,$1.73,-0.0406,-2.293%,"23,688,892"
UTSI,UTStarcom Holdings Corp. Ordinary Shares,$2.50,UNCH,--,"23,675,638"
BRLS,Borealis Foods Inc. Class A Common Shares,$1.0996,-0.0804,-6.814%,"23,601,051"
REE,REE Automotive Ltd. Class A Ordinary Shares,$0.7564,-0.0116,-1.51%,"23,464,233"
ARKR,Ark Restaurants Corp. Common Stock,$6.4832,UNCH,--,"23,379,437"
NSYS,Nortech Systems Incorporated Common Stock,$8.3814,0.3014,3.73%,"23,351,704"
ALUR,"Allurion Technologies, Inc. Common Stock",$1.89,0.135,7.692%,"23,228,542"
IRIX,IRIDEX Corporation Common Stock,$1.35,0.03,2.273%,"23,206,474"
VRAR,"The Glimpse Group, Inc. Common Stock",$1.10,0.04,3.774%,"23,184,157"
AUID,authID Inc. Common Stock,$1.71,0.7175,72.292%,"22,988,795"
MLSS,"Milestone Scientific, Inc. Common Stock",$0.2918,0.0023,0.794%,"22,943,917"
BTOC,Armlogi Holding Corp. Common Stock,$0.5047,-0.0224,-4.25%,"22,935,122"
TLF,"Tandy Leather Factory, Inc. Common Stock",$2.84,-0.01,-0.351%,"22,911,706"
HUIZ,Huize Holding Limited American Depositary Shares,$2.27,0.01,0.442%,"22,901,068"
JOB,GEE Group Inc. Common Stock,$0.208,0.0019,0.922%,"22,881,190"
FENG,"Phoenix New Media Limited American Depositary Shares, each representing 48 Class A ordinary shares.",$1.90,0.03,1.604%,"22,820,474"
CISO,"CISO Global, Inc. Common Stock",$0.5179,0.0383,7.986%,"22,811,601"
NIXX,"Nixxy, Inc. Common Stock",$0.9151,-0.0405,-4.238%,"22,763,641"
KLTO,"Klotho Neurosciences, Inc. Common Stock",$0.3132,0.0113,3.743%,"22,718,501"
RDZNW,"Roadzen, Inc. Warrants",$0.285,0.075,35.714%,"22,656,809"
COOT,Australian Oilseeds Holdings Limited Ordinary Shares,$0.81,-0.005,-0.613%,"22,597,816"
EBON,Ebang International Holdings Inc. Class A Ordinary Shares,$3.45,-0.0062,-0.179%,"22,576,586"
ZJYL,JIN MEDICAL INTERNATIONAL LTD. Ordinary Shares,$0.1442,-0.0208,-12.606%,"22,574,092"
HHS,"Harte Hanks, Inc. Common Stock",$3.04,UNCH,--,"22,540,974"
PRZO,ParaZero Technologies Ltd. Ordinary Shares,$1.35,-0.15,-10.00%,"22,517,502"
FBLG,"FibroBiologics, Inc. Common Stock",$0.3375,-0.0027,-0.794%,"22,450,406"
AIIOW,Robo.ai Inc. Warrant,$0.0606,UNCH,--,"22,443,115"
EKSO,"Ekso Bionics Holdings, Inc. Common Stock",$8.55,0.45,5.556%,"22,428,642"
ECXWW,ECARX Holdings Inc. Warrants,$0.0645,0.0145,29.00%,"22,299,587"
JVA,"Coffee Holding Co., Inc. Common Stock",$3.90,-0.02,-0.51%,"22,263,536"
FIEE,"FiEE, Inc Common Stock",$3.53,0.09,2.616%,"22,224,742"
APLM,Apollomics Inc. Class A Ordinary Shares,$20.14,0.32,1.615%,"22,221,429"
NEUP,Neuphoria Therapeutics Inc. Common Stock,$4.10,0.06,1.485%,"22,047,049"
ASTI,"Ascent Solar Technologies, Inc. Common Stock",$4.84,-0.39,-7.457%,"21,960,121"
LGPS,LogProstyle Inc. Common Shares,$0.9268,-0.0182,-1.926%,"21,920,776"
JL,J-Long Group Limited Class A Ordinary Shares,$5.79,-0.14,-2.361%,"21,780,249"
NINE,"Nine Energy Service, Inc. Common Stock",$0.5018,-0.0482,-8.764%,"21,758,720"
APUS,"Apimeds Pharmaceuticals US, Inc. Common Stock",$1.73,0.07,4.217%,"21,756,451"
IDAI,T Stamp Inc. Class A Common Stock,$4.14,-0.10,-2.358%,"21,709,464"
RVP,"Retractable Technologies, Inc. Common Stock",$0.712,-0.008,-1.111%,"21,315,257"
WETH,Wetouch Technology Inc. Common Stock,$1.78,0.03,1.714%,"21,238,131"
SCNX,"Scienture Holdings, Inc. Common Stock",$0.5227,0.0076,1.475%,"21,237,727"
LIMN,"Liminatus Pharma, Inc. Class A Common Stock",$0.779,0.029,3.867%,"21,083,349"
CETX,Cemtrex Inc. Common Stock,$2.45,-0.045,-1.804%,"21,071,352"
NCEW,New Century Logistics (BVI) Limited Ordinary Shares,$7.84,-0.11,-1.384%,"21,070,000"
ELAB,PMGC Holdings Inc. Common Stock,$3.71,0.15,4.213%,"21,062,119"
BNKK,"Bonk, Inc. Common Stock",$3.96,1.18,42.446%,"20,985,315"
BGI,Birks Group Inc. Common Stock,$1.07,0.1558,17.042%,"20,966,315"
LRE,"Lead Real Estate Co., Ltd American Depositary Shares",$1.53,0.04,2.685%,"20,872,107"
KTTA,Pasithea Therapeutics Corp. Common Stock,$0.8891,0.0091,1.034%,"20,530,263"
YHC,LQR House Inc. Common Stock,$0.9594,-0.0606,-5.941%,"20,503,967"
MXC,Mexco Energy Corporation Common Stock,$10.02,-0.78,-7.222%,"20,500,920"
QCLS,"Q/C Technologies, Inc. Common Stock",$4.92,0.15,3.145%,"20,500,459"
SQFTP,"Presidio Property Trust, Inc. 9.375% Series D Cumulative Redeemable Perpetual Preferred Stock, $0.01 par value per share",$14.2358,-0.0342,-0.24%,"20,486,726"
BATL,Battalion Oil Corporation Common Stock,$1.24,UNCH,--,"20,406,138"
HCTI,"Healthcare Triangle, Inc. Common Stock",$0.4498,0.0057,1.283%,"20,397,075"
CTRM,Castor Maritime Inc. Common Shares,$2.11,0.01,0.476%,"20,387,567"
FATBB,FAT Brands Inc. Class B Common Stock,$1.1344,-0.0256,-2.207%,"20,350,370"
COSM,Cosmos Health Inc. Common Stock,$0.5418,0.096,21.534%,"20,280,940"
TRSG,Tungray Technologies Inc Class A Ordinary Shares,$1.24,0.08,6.897%,"20,278,321"
CCM,Concord Medical Services Holdings Limited American Depositary Shares (Each represents thirty (30) Class A ordinary shares),$4.67,0.53,12.802%,"20,275,846"
MYND,"Mynd.ai, Inc. American Depositary Shares",$0.4426,-0.0075,-1.666%,"20,203,708"
VBIX,Viewbix Inc. Common Stock,$1.89,UNCH,--,"20,167,041"
SGRP,"SPAR Group, Inc. Common Stock",$0.8412,-0.0076,-0.895%,"20,146,732"
DLPN,"Dolphin Entertainment, Inc. Common Stock",$1.66,0.04,2.469%,"20,123,221"
OSRH,"OSR Holdings, Inc. Common Stock",$0.7818,0.0477,6.498%,"20,070,986"
CLGN,CollPlant Biotechnologies Ltd Ordinary Shares,$1.57,-0.10,-5.988%,"20,058,924"
SLAI,SOLAI Limited American Depositary Shares (each representing one hundred (100) Class A Ordinary Shares),$1.07,-0.06,-5.31%,"19,986,032"
GYRO,"Gyrodyne, LLC Common Stock",$9.0606,UNCH,--,"19,927,050"
RVSN,Rail Vision Ltd. Ordinary Share,$0.3357,0.0125,3.868%,"19,828,146"
TSE,Trinseo PLC Ordinary Shares ,$0.55,0.009,1.664%,"19,796,474"
ELWS,"Earlyworks Co., Ltd. American Depositary Shares",$6.485,0.425,7.013%,"19,782,946"
MSGM,Motorsport Games Inc. Class A Common Stock,$3.40,-0.08,-2.299%,"19,646,730"
NOTV,"Inotiv, Inc. Common Stock",$0.5675,-0.0405,-6.661%,"19,503,415"
EHLD,Euroholdings Ltd. Common Stock ,$6.92,0.05,0.728%,"19,490,976"
PT,Pintec Technology Holdings Limited American Depositary Shares,$1.22,0.2525,26.098%,"19,456,511"
COCH,"Envoy Medical, Inc. Class A Common Stock",$0.6712,-0.0141,-2.057%,"19,421,145"
CJMB,Callan JMB Inc. Common Stock,$4.20,3.08,275.00%,"19,416,713"
CYN,Cyngn Inc. Common Stock,$2.43,-0.17,-6.538%,"19,377,743"
NWGL,CL Workshop Group Limited American Depositary Shares,$1.1682,-0.0218,-1.832%,"19,337,407"
EQS,"Equus Total Return, Inc. Common Stock",$1.38,-0.01,-0.719%,"19,274,040"
VVOS,"Vivos Therapeutics, Inc. Common Stock",$2.14,0.05,2.392%,"19,234,547"
LSTA,"Lisata Therapeutics, Inc. Common Stock",$2.18,0.10,4.808%,"19,229,198"
EONR,EON Resources Inc. Class A Common Stock,$0.384,-0.0416,-9.774%,"19,187,844"
CVKD,"Cadrenal Therapeutics, Inc. Common Stock",$8.20,-0.20,-2.381%,"19,172,641"
TMDE,TMD Energy Limited Ordinary Shares,$0.8122,0.0587,7.79%,"19,139,493"
NXPL,NextPlat Corp Common Stock,$0.7203,0.0329,4.786%,"18,947,482"
MWYN,"Marwynn Holdings, Inc. Common stock",$0.9371,-0.0439,-4.475%,"18,924,551"
TOMZ,"TOMI Environmental Solutions, Inc. Common Stock",$0.779,-0.001,-0.128%,"18,904,946"
CKX,"CKX Lands, Inc. Common Stock",$9.1861,-0.0639,-0.691%,"18,860,248"
BCAB,"BioAtla, Inc. Common Stock",$0.3196,-0.0194,-5.723%,"18,789,951"
LGCB,Linkage Global Inc. Class A Ordinary Shares,$1.68,0.05,3.067%,"18,758,077"
VYNE,VYNE Therapeutics Inc. Common Stock,$0.567,0.0004,0.071%,"18,735,732"
ALLR,"Allarity Therapeutics, Inc. Common Stock",$1.18,-0.03,-2.479%,"18,646,474"
WKSP,"Worksport, Ltd. Common Stock",$2.25,0.05,2.273%,"18,572,375"
KAPA,"Kairos Pharma, Ltd. Common Stock",$0.89,0.03,3.488%,"18,531,004"
RMCF,"Rocky Mountain Chocolate Factory, Inc. Common Stock",$1.96,-0.03,-1.508%,"18,292,331"
IZM,ICZOOM Group Inc. Class A Ordinary Shares,$1.51,-0.16,-9.581%,"18,147,346"
HUDI,"Huadi International Group Co., Ltd. Ordinary Shares",$1.27,UNCH,--,"18,134,561"
CSAI,"Cloudastructure, Inc. Class A Common Stock",$0.9252,0.0573,6.602%,"18,115,890"
TC,Token Cat Limited American Depositary Shares,$9.00,0.03,0.334%,"17,890,011"
IMG,CIMG Inc. Common Stock,$1.15,UNCH,--,"17,806,079"
CTXR,"Citius Pharmaceuticals, Inc. Common Stock",$0.8565,-0.0063,-0.73%,"17,783,438"
PMN,ProMIS Neurosciences Inc. Common Shares (ON),$8.154,0.014,0.172%,"17,551,028"
VRME,"VerifyMe, Inc. Common Stock",$1.41,0.34,31.776%,"17,544,868"
UHGWW,"United Homes Group, Inc. Warrant",$0.2975,0.0475,19.00%,"17,497,057"
LIQT,"LiqTech International, Inc. Common Stock",$1.8148,-0.0302,-1.637%,"17,471,196"
HIND,"Vyome Holdings, Inc. Common Stock",$3.09,0.07,2.318%,"17,441,486"
SNYR,Synergy CHC Corp. Common Stock,$1.82,UNCH,--,"17,387,741"
MTEX,"Mannatech, Incorporated Common Stock",$9.132,1.5319,20.156%,"17,359,293"
HOVRW,New Horizon Aircraft Ltd. Warrant,$0.3976,0.0477,13.632%,"17,238,023"
MDCXW,Medicus Pharma Ltd. Warrant,$0.82,UNCH,--,"17,196,320"
ELOG,Eastern International Ltd. Ordinary Shares,$1.43,-0.11,-7.143%,"17,184,310"
FATBP,FAT Brands Inc. 8.25% Series B Cumulative Preferred Stock,$0.9521,-0.1079,-10.179%,"17,080,031"
ITRM,Iterum Therapeutics plc Ordinary Share,$0.322,-0.004,-1.227%,"17,012,935"
SBDS,"Solo Brands, Inc. Class A Common Stock",$6.85,0.83,13.787%,"16,954,798"
MGIH,Millennium Group International Holdings Limited Ordinary Shares,$1.50,0.16,11.94%,"16,875,000"
MOGU,MOGU Inc. American Depositary Shares (each  representing 25 Class A Ordinary Shares),$2.05,0.05,2.50%,"16,755,964"
HOTH,"Hoth Therapeutics, Inc. Common Stock",$1.08,0.035,3.349%,"16,755,457"
KALA,"KALA BIO, Inc. Common Stock",$0.6007,-0.032,-5.058%,"16,729,330"
GAUZ,Gauzy Ltd. Ordinary Shares,$0.891,-0.079,-8.144%,"16,699,205"
FTRK,FAST TRACK GROUP Ordinary shares,$0.7618,-0.0352,-4.417%,"16,616,763"
IPM,Intelligent Protection Management Corp. Common Stock ,$1.82,UNCH,--,"16,536,027"
FTEL,Fitell Corporation Class A Ordinary Shares,$3.27,0.25,8.278%,"16,467,082"
CLIK,Click Holdings Limited Class A Ordinary Share,$5.04,-0.18,-3.448%,"16,445,686"
ZSPC,"zSpace, Inc. Common stock",$0.5654,0.0764,15.624%,"16,424,908"
RENX,RenX Enterprises Corp. Common Stock,$0.1635,-0.0097,-5.60%,"16,342,292"
CETY,"Clean Energy Technologies, Inc. Common Stock",$1.01,0.0933,10.178%,"16,271,992"
GIGM,GigaMedia Limited Ordinary Shares,$1.47,UNCH,--,"16,246,785"
LEXX,Lexaria Bioscience Corp. Common Stock,$0.7309,-0.0511,-6.535%,"16,244,871"
LEDS,SemiLEDS Corporation Common Stock,$1.9724,-0.0045,-0.228%,"16,225,264"
CASI,"CASI Pharmaceuticals, Inc. Ordinary Shares",$1.04,0.02,1.961%,"16,112,388"
ZDAI,"DirectBooking Technology Co., Ltd. Ordinary Shares",$0.6071,0.1271,26.479%,"16,027,440"
LESL,"Leslie's, Inc. Common Stock",$1.72,0.18,11.688%,"15,979,335"
MSAI,"MultiSensor AI Holdings, Inc. Common Stock",$0.3011,-0.0041,-1.343%,"15,920,495"
TJGC,TJGC Group Limited Ordinary Shares,$1.0399,-0.4001,-27.785%,"15,910,470"
WETO,Webus International Limited Ordinary Shares,$0.72,0.0079,1.109%,"15,840,000"
AIRI,Air Industries Group Common Stock,$3.31,-0.05,-1.488%,"15,807,822"
SOPA,Society Pass Incorporated Common Stock,$2.57,-0.12,-4.461%,"15,691,199"
USEA,United Maritime Corporation Common Stock,$1.77,-0.02,-1.117%,"15,654,353"
EVTV,"Envirotech Vehicles, Inc. Common Stock",$3.23,0.13,4.194%,"15,599,333"
BMGL,Basel Medical Group Ltd Ordinary Shares,$0.83,0.04,5.063%,"15,592,173"
WLDSW,Wearable Devices Ltd. Warrant,$1.50,0.20,15.385%,"15,477,609"
CLRB,"Cellectar Biosciences, Inc.  Common Stock",$3.65,-0.095,-2.537%,"15,476,489"
BNGO,"Bionano Genomics, Inc. Common Stock",$1.52,-0.03,-1.935%,"15,467,520"
NAII,"Natural Alternatives International, Inc. Common Stock",$4.64,-0.11,-2.316%,"15,442,514"
EDTK,Skillful Craftsman Education Technology Limited Ordinary Share,$0.9621,-0.0029,-0.301%,"15,325,725"
COCP,"Cocrystal Pharma, Inc. Common Stock",$1.11,-0.05,-4.31%,"15,300,312"
SAIH,SAIHEAT Limited Class A Ordinary Shares,$8.7122,0.3122,3.717%,"15,272,051"
ELSE,"Electro-Sensors, Inc. Common Stock",$4.3785,0.0284,0.653%,"15,239,461"
LSH,Lakeside Holding Limited Common Stock,$0.8647,0.0107,1.253%,"15,069,610"
WVVIP,"Willamette Valley Vineyards, Inc. Series A Redeemable Preferred Stock",$3.03,-0.0616,-1.992%,"15,042,523"
IPST,"Heritage Distilling Holding Company, Inc. Common Stock",$1.57,-0.04,-2.484%,"15,008,134"
WVVI,"Willamette Valley Vineyards, Inc. Common Stock",$3.00,0.067,2.284%,"14,893,587"
BCDA,"BioCardia, Inc. Common Stock",$1.40,-0.02,-1.408%,"14,857,828"
HUBC,Hub Cyber Security Ltd. Ordinary Shares,$0.303,-0.0465,-13.305%,"14,784,824"
TOIIW,"The Oncology Institute, Inc. Warrant",$0.15,0.0112,8.069%,"14,757,201"
SINT,"SiNtx Technologies, Inc. Common Stock",$3.67,-0.02,-0.542%,"14,752,024"
ENGS,Energys Group Limited Ordinary Shares,$1.03,UNCH,--,"14,716,496"
VSEE,"VSee Health, Inc. Common Stock",$0.443,0.023,5.476%,"14,704,561"
APLT,"Applied Therapeutics, Inc. Common Stock",$0.1019,0.002,2.002%,"14,704,239"
SNSE,"Sensei Biotherapeutics, Inc. Common Stock",$11.61,-0.37,-3.088%,"14,643,577"
WSTNR,Westin Acquisition Corp Right,$0.20,0.0298,17.509%,"14,622,836"
SMSI,"Smith Micro Software, Inc. Common Stock",$0.58,0.019,3.387%,"14,619,675"
TOPP,Toppoint Holdings Inc. Common Stock,$0.7523,-0.0372,-4.712%,"14,594,620"
GRNQ,Greenpro Capital Corp. Common Stock,$1.73,-0.03,-1.705%,"14,490,156"
TLIH,Ten-League International Holdings Limited Ordinary Shares,$0.4911,0.0121,2.526%,"14,440,472"
BRN,"Barnwell Industries, Inc. Common Stock",$1.15,UNCH,--,"14,418,774"
FTFT,Future FinTech Group Inc. Common Stock,$0.7147,0.0229,3.31%,"14,403,571"
DLXY,Delixy Holdings Limited Ordinary Shares,$0.8687,-0.0353,-3.905%,"14,203,245"
NXGL,"NexGel, Inc Common Stock",$1.74,0.01,0.578%,"14,169,051"
BON,Bon Natural Life Limited Class A Ordinary Shares,$1.74,UNCH,--,"14,144,129"
WIMI,WiMi Hologram Cloud Inc. Class B Ordinary Shares,$2.88,0.08,2.857%,"14,141,961"
MDAIW,"Spectral AI, Inc. Warrants",$0.4601,0.0102,2.267%,"14,119,961"
MDRR,"Medalist Diversified REIT, Inc. Common Stock",$12.6648,-0.2952,-2.278%,"14,088,387"
BNZI,"Banzai International, Inc. Class A Common Stock",$1.51,0.11,7.857%,"14,077,706"
AMS,American Shared Hospital Services Common Stock,$2.15,0.02,0.939%,"14,067,450"
FEBO,Fenbo Holdings Limited Class A Ordinary Shares,$1.27,0.03,2.419%,"14,049,375"
AIFF,"Firefly Neuroscience, Inc. Common Stock",$1.04,UNCH,--,"14,032,645"
CVR,Chicago Rivet & Machine Co. Common Stock,$14.50,-0.16,-1.091%,"14,008,914"
EFOI,"Energy Focus, Inc. Common Stock",$2.44,0.14,6.087%,"14,004,173"
AEON,"AEON Biopharma, Inc. Class A Common Stock",$1.15,0.0425,3.837%,"13,921,787"
SFHG,Samfine Creation Holdings Group Limited Class A Ordinary Share,$0.7694,-0.0136,-1.737%,"13,849,200"
SPPL,SIMPPLE LTD. Ordinary Shares,$3.11,0.01,0.323%,"13,839,065"
INBS,Intelligent Bio Solutions Inc. Common Stock,$14.42,-1.18,-7.564%,"13,836,466"
MRM,MEDIROM Healthcare Technologies Inc. American Depositary Share,$1.75,-0.015,-0.85%,"13,828,413"
RMSG,Real Messenger Corporation Ordinary Shares,$1.44,0.19,15.20%,"13,782,645"
XAIR,"Beyond Air, Inc. Common Stock",$1.72,-0.16,-8.511%,"13,776,319"
TRAW,"Traws Pharma, Inc. Common Stock",$1.72,-0.05,-2.825%,"13,744,291"
PMNT,Perfect Moment Ltd. Common Stock,$0.3863,-0.0363,-8.59%,"13,606,233"
LBGJ,Li Bang International Corporation Inc. Class A Ordinary Shares,$0.7235,-0.0127,-1.725%,"13,564,178"
SNGX,"Soligenix, Inc. Common Stock",$1.34,-0.04,-2.899%,"13,515,414"
AGAE,Allied Gaming & Entertainment Inc. Common Stock,$0.3578,-0.015,-4.024%,"13,491,540"
YCBD,"cbdMD, Inc. Common Stock",$1.01,-0.06,-5.607%,"13,435,225"
CENN,Cenntro Inc. Common Stock,$0.1528,0.0003,0.197%,"13,433,081"
MMA,Mixed Martial Arts Group Limited Ordinary Shares,$1.03,-0.02,-1.905%,"13,432,445"
BOLT,"Bolt Biotherapeutics, Inc. Common Stock",$6.98,0.53,8.217%,"13,397,698"
SYBX,"Synlogic, Inc. Common Stock",$1.14,0.01,0.885%,"13,336,768"
GRDX,GridAI Technologies Corp. Common Stock,$3.96,0.09,2.326%,"13,313,136"
GELS,Gelteq Limited Ordinary Shares,$1.24,0.08,6.897%,"13,281,713"
SRXH,"SRX Health Solutions, Inc. Common Stock",$0.1903,0.0005,0.263%,"13,236,431"
TRIB,Trinity Biotech plc American Depositary Shares,$0.7099,0.0099,1.414%,"13,226,870"
LFWD,Lifeward Ltd. Ordinary Shares,$0.7225,0.0671,10.238%,"13,217,253"
INTJ,Intelligent Group Limited Class A Ordinary Shares ,$0.4292,-0.051,-10.621%,"13,197,900"
RSVRW,"Reservoir Media, Inc. Warrant",$0.20,-0.0938,-31.926%,"13,117,645"
ADXN,Addex Therapeutics Ltd American Depositary Shares,$8.10,-0.11,-1.34%,"13,112,823"
MSW,Ming Shing Group Holdings Limited Ordinary Shares,$1.01,-0.10,-9.009%,"13,104,750"
UUU,"Universal Safety Products, Inc. Common Stock",$5.66,-0.175,-2.999%,"13,090,940"
TKLF,"Tokyo Lifestyle Co., Ltd. American Depositary Shares",$3.085,0.045,1.48%,"13,058,129"
TPST,"Tempest Therapeutics, Inc. Common Stock",$2.65,0.10,3.922%,"13,056,977"
ABTS,Abits Group Inc Ordinary Shares,$5.50,-0.03,-0.542%,"13,035,765"
TAOP,Taoping Inc. Ordinary Shares ,$1.41,0.12,9.302%,"13,026,549"
NXL,"Nexalin Technology, Inc. Common Stock",$0.69,-0.0452,-6.148%,"12,869,838"
SRTAW,"Strata Critical Medical, Inc. Warrants",$0.149,0.019,14.615%,"12,868,612"
PTHL,Pheton Holdings Ltd Class A Ordinary Shares,$0.9023,0.4625,105.161%,"12,857,775"
JBDI,JBDI Holdings Limited Ordinary Shares,$0.67,-0.03,-4.286%,"12,749,473"
MNTS,Momentus Inc. Class A Common Stock,$9.11,-0.21,-2.253%,"12,728,301"
NCRA,"Nocera, Inc. Common Stock",$0.8825,-0.0175,-1.944%,"12,684,717"
MWG,Multi Ways Holdings Limited Class A Ordinary Shares,$0.2471,-0.015,-5.723%,"12,683,643"
TBLAW,Taboola.com Ltd. Warrant,$0.044,-0.0115,-20.721%,"12,681,828"
ARBEW,Arbe Robotics Ltd. Warrant,$0.12,0.0099,8.992%,"12,619,583"
GFAI,"Guardforce AI Co., Limited Ordinary Shares",$0.60,-0.006,-0.99%,"12,614,117"
ASTLW,Algoma Steel Group Inc. Warrant,$0.12,0.0101,9.19%,"12,592,056"
IQST,iQSTEL Inc. Common Stock,$2.84,-0.07,-2.405%,"12,424,494"
CABR,"Caring Brands, Inc. Common Stock",$0.90,0.005,0.559%,"12,363,233"
GTIM,Good Times Restaurants Inc. Common Stock,$1.17,UNCH,--,"12,352,738"
EDUC,Educational Development Corporation Common Stock,$1.45,0.01,0.694%,"12,341,478"
SXTC,"China SXT Pharmaceuticals, Inc. Ordinary Shares",$0.1061,0.0098,10.177%,"12,310,489"
CRIS,"Curis, Inc. Common Stock",$0.9499,0.0454,5.019%,"12,281,117"
HWH,HWH International Inc. Common Stock,$1.89,0.19,11.176%,"12,240,396"
AKTX,Akari Therapeutics plc ADS,$0.2673,-0.0002,-0.075%,"12,237,355"
PHIO,Phio Pharmaceuticals Corp. Common Stock,$1.13,0.01,0.893%,"12,163,804"
MOBX,"Mobix Labs, Inc. Class A Common Stock",$0.2221,-0.0033,-1.464%,"12,156,496"
FGI,FGI Industries Ltd. Ordinary Shares,$6.31,0.29,4.817%,"12,116,083"
CLRO,"ClearOne, Inc. (DE) Common Stock",$6.97,0.15,2.199%,"12,087,723"
ARTW,"Art's-Way Manufacturing Co., Inc. Common Stock",$2.365,-0.045,-1.867%,"12,077,662"
WLDS,Wearable Devices Ltd. Ordinary Share,$1.17,-0.06,-4.878%,"12,072,535"
ZCMD,Zhongchao Inc. Class A Ordinary Shares,$0.4741,-0.0756,-13.753%,"12,036,879"
LGVN,Longeveron Inc. Class A Common Stock,$0.564,0.0064,1.148%,"12,031,745"
MTEK,Maris-Tech Ltd. Ordinary Shares,$1.50,0.01,0.671%,"11,975,348"
SOS,SOS Limited Class A Ordinary Shares,$1.76,UNCH,--,"11,957,218"
FBGL,FBS Global Limited Ordinary Shares,$0.88,UNCH,--,"11,880,000"
FLYE,"Fly-E Group, Inc. Common Stock",$7.27,-0.31,-4.09%,"11,867,446"
BTBD,"BT Brands, Inc. Common Stock",$1.51,0.01,0.667%,"11,845,518"
EDSA,"Edesa Biotech, Inc. Common Shares",$1.42,-0.03,-2.069%,"11,834,029"
IHT,InnSuites Hospitality Trust Shares of Beneficial Interest,$1.28,-0.013,-1.005%,"11,782,188"
BFRG,"Bullfrog AI Holdings, Inc. Common Stock",$0.759,0.0758,11.095%,"11,574,602"
CAPT,Captivision Inc. Ordinary Shares,$0.3559,0.0166,4.892%,"11,520,309"
MBRX,"Moleculin Biotech, Inc. Common Stock",$4.27,0.13,3.14%,"11,501,377"
TURB,"Turbo Energy, S.A. American Depositary Shares",$1.03,-0.09,-8.036%,"11,347,654"
TIRX,TIAN RUIXIANG Holdings Ltd Class A Ordinary Shares,$0.4637,-0.0497,-9.681%,"11,296,396"
REBN,"Reborn Coffee, Inc. Common Stock",$1.88,0.10,5.618%,"11,235,485"
