Symbol,Name,Last Sale,Net Change,% Change,Market Cap
BLIN,"Bridgeline Digital, Inc. Common Stock",$1.37,-0.10,-6.803%,"16,593,533"
HWH,HWH International Inc. Common Stock,$2.56,-0.18,-6.569%,"16,579,584"
NERV,"Minerva Neurosciences, Inc Common Stock",$2.35,-0.22,-8.56%,"16,434,504"
NAII,"Natural Alternatives International, Inc. Common Stock",$2.66,-0.18,-6.338%,"16,430,229"
AMBO,Ambow Education Holding Ltd. American Depository Shares (each representing twenty (20) Class A Ordinary Shares),$5.75,UNCH,--,"16,424,162"
ASBP,"Aspire Biopharma Holdings, Inc. Common Stock",$0.3302,-0.0064,-1.901%,"16,353,475"
ELSE,"Electro-Sensors, Inc. Common Stock",$4.74,-0.0275,-0.577%,"16,348,360"
SMSI,"Smith Micro Software, Inc. Common Stock",$0.7752,-0.0693,-8.206%,"16,275,260"
DTSS,Datasea Inc. Common Stock,$1.97,-0.02,-1.005%,"16,265,928"
MMA,Mixed Martial Arts Group Limited Ordinary Shares,$1.58,-0.04,-2.469%,"16,246,644"
SOHO,Sotherly Hotels Inc. Common Stock,$0.792,-0.0131,-1.627%,"16,228,477"
HCTI,"Healthcare Triangle, Inc. Common Stock",$2.78,0.02,0.725%,"16,212,485"
SAIH,SAIHEAT Limited Class A Ordinary Shares,$9.22,-0.9501,-9.342%,"16,162,199"
PMNT,Perfect Moment Ltd. Common Stock,$0.513,-0.012,-2.286%,"16,106,570"
HOVRW,New Horizon Aircraft Ltd. Warrant,$0.4107,-0.119,-22.466%,"16,103,814"
DLPN,"Dolphin Entertainment, Inc. Common Stock",$1.37,-0.09,-6.164%,"16,080,682"
WKHS,"Workhorse Group, Inc. Common Stock",$1.04,-0.05,-4.587%,"15,988,197"
ICU,SeaStar Medical Holding Corporation Common Stock,$0.5716,-0.032,-5.302%,"15,955,983"
MNTS,Momentus Inc. Class A Common Stock,$1.37,-0.08,-5.517%,"15,939,080"
CRE,Cre8 Enterprise Limited Class A Ordinary Shares,$0.6621,-0.0179,-2.632%,"15,906,953"
OFAL,OFA Group Ordinary Shares,$1.14,0.02,1.786%,"15,872,917"
HSDT,Solana Company Class A Common Stock (DE),$14.70,-2.18,-12.915%,"15,835,678"
MSS,Maison Solutions Inc. Class A Common Stock,$0.8025,-0.0373,-4.442%,"15,801,607"
WVVIP,"Willamette Valley Vineyards, Inc. Series A Redeemable Preferred Stock",$3.173,UNCH,--,"15,752,451"
AMST,Amesite Inc. Common Stock,$3.41,-0.11,-3.125%,"15,592,951"
NUAIW,"New Era Energy & Digital, Inc. Warrants",$0.5988,0.0488,8.873%,"15,556,546"
IBIO,"iBio, Inc. Common Stock",$0.7913,-0.0627,-7.342%,"15,552,713"
AEVAW,"Aeva Technologies, Inc. Warrants",$0.2757,-0.0193,-6.542%,"15,529,546"
ALUR,"Allurion Technologies, Inc. Common Stock",$2.00,-0.11,-5.213%,"15,525,362"
PHGE,BiomX Inc. COmmon Stock,$0.5843,-0.0354,-5.712%,"15,503,751"
MTEK,Maris-Tech Ltd. Ordinary Shares,$1.94,-0.11,-5.366%,"15,488,116"
ANNAW,"AleAnna, Inc. Warrant",$0.19,-0.01,-5.00%,"15,450,755"
GPUS,"Hyperscale Data, Inc. Common Stock",$0.4799,-0.0501,-9.453%,"15,426,123"
TKLF,"Tokyo Lifestyle Co., Ltd. American Depositary Shares",$3.635,-0.137,-3.632%,"15,386,159"
HYFM,"Hydrofarm Holdings Group, Inc. Common Stock",$3.28,-0.10,-2.959%,"15,281,586"
ARTW,"Art's-Way Manufacturing Co., Inc. Common Stock",$2.99,-0.27,-8.282%,"15,273,171"
INVZW,Innoviz Technologies Ltd. Warrant,$0.0766,0.0035,4.788%,"15,240,486"
STI,"Solidion Technology, Inc. Common Stock",$5.49,0.10,1.855%,"15,230,934"
EFOI,"Energy Focus, Inc. Common Stock",$2.78,0.03,1.091%,"15,220,125"
AIRI,Air Industries Group Common Stock,$3.16,-0.08,-2.469%,"15,079,375"
PLAG,Planet Green Holdings Corp. Common Stock,$2.06,0.07,3.518%,"15,002,391"
ATHA,"Athira Pharma, Inc. Common Stock",$3.80,-0.12,-3.061%,"14,986,945"
AMS,American Shared Hospital Services Common Stock,$2.30,-0.13,-5.35%,"14,973,000"
HUBC,Hub Cyber Security Ltd. Ordinary Shares,$1.49,-0.11,-6.875%,"14,970,471"
RYDE,Ryde Group Ltd. Class A Ordinary Shares,$0.51,-0.0166,-3.152%,"14,937,811"
ZDAI,"DirectBooking Technology Co., Ltd. Ordinary Shares",$0.5616,-0.0447,-7.373%,"14,826,240"
CLRB,"Cellectar Biosciences, Inc.  Common Stock",$4.64,-0.13,-2.725%,"14,811,066"
INTJ,Intelligent Group Limited Class A Ordinary Shares ,$0.4807,-0.0193,-3.86%,"14,781,525"
TAIT,Taitron Components Incorporated Class A Common Stock,$2.45,-0.09,-3.543%,"14,751,891"
ABP,"Abpro Holdings, Inc Common Stock",$0.184,-0.0135,-6.835%,"14,750,667"
SEGG,"Lottery.com, Inc. Common Stock",$3.725,-0.275,-6.875%,"14,677,524"
CODX,"Co-Diagnostics, Inc. Common Stock",$0.379,-0.051,-11.86%,"14,600,438"
BLRX,BioLineRx Ltd. American Depositary Shares,$3.91,-0.27,-6.459%,"14,549,122"
GRRRW,Gorilla Technology Group Inc. Warrant,$0.7145,0.0133,1.897%,"14,448,792"
LVLU,"Lulu's Fashion Lounge Holdings, Inc. Common Stock",$5.25,-0.01,-0.19%,"14,431,883"
SRTAW,"Strata Critical Medical, Inc. Warrants",$0.1766,-0.009,-4.849%,"14,427,444"
SPHL,Springview Holdings Ltd Class A Ordinary Shares,$0.6702,0.0901,15.532%,"14,409,300"
MBRX,"Moleculin Biotech, Inc. Common Stock",$0.474,-0.0421,-8.157%,"14,355,644"
ATON,AlphaTON Capital Corp. Common Stock,$6.30,-2.05,-24.551%,"14,355,319"
MDCXW,Medicus Pharma Ltd. Warrant,$0.90,UNCH,--,"14,342,639"
INTS,"Intensity Therapeutics, Inc. Common stock",$0.3047,-0.0126,-3.971%,"14,338,489"
OXBR,Oxbridge Re Holdings Limited Ordinary Shares,$1.90,0.005,0.264%,"14,318,252"
NVNO,enVVeno Medical Corporation Common Stock,$0.7418,-0.1756,-19.141%,"14,277,529"
USEA,United Maritime Corporation Common Stock,$1.61,-0.11,-6.395%,"14,239,270"
SNSE,"Sensei Biotherapeutics, Inc. Common Stock",$11.26,-0.33,-2.847%,"14,202,125"
GOVX,"GeoVax Labs, Inc. Common Stock",$0.5554,-0.0446,-7.433%,"14,084,718"
TOIIW,"The Oncology Institute, Inc. Warrant",$0.15,-0.01,-6.25%,"14,025,715"
MSGM,Motorsport Games Inc. Class A Common Stock,$2.42,-0.15,-5.837%,"13,983,849"
SOAR,"Volato Group, Inc. Class A Common Stock",$2.49,0.30,13.699%,"13,971,383"
DLXY,Delixy Holdings Limited Ordinary Shares,$0.8521,-0.0173,-1.99%,"13,931,835"
IMRN,Immuron Limited American Depositary Shares,$2.07,-0.07,-3.271%,"13,880,383"
KITT,"Nauticus Robotics, Inc. Common stock",$2.95,-0.33,-10.061%,"13,854,395"
YYGH,YY Group Holding Limited Class A Ordinary Shares,$0.3363,-0.0287,-7.863%,"13,821,106"
THAR,"Tharimmune, Inc. Common Stock",$2.98,-0.18,-5.696%,"13,813,048"
BIVI,BioVie Inc. Class A Common Stock,$1.83,-0.12,-6.154%,"13,787,632"
CCTG,CCSC Technology International Holdings Limited Class A Ordinary Shares,$1.19,-0.38,-24.204%,"13,781,688"
TALKW,"Talkspace, Inc. Warrant",$0.082,0.012,17.143%,"13,732,304"
SOND,Sonder Holdings Inc. Class A Common Stock,$1.03,-0.06,-5.505%,"13,707,735"
AIXI,XIAO-I Corporation American Depositary Shares,$1.10,-0.08,-6.78%,"13,706,370"
HIND,"Vyome Holdings, Inc. Common Stock",$5.07,-0.43,-7.818%,"13,655,224"
GLBZ,Glen Burnie Bancorp Common Stock,$4.70,-0.05,-1.053%,"13,633,201"
AEHL,Antelope Enterprise Holdings Limited Class A Ordinary Shares,$3.95,-0.02,-0.504%,"13,504,213"
IHT,InnSuites Hospitality Trust Shares of Beneficial Interest,$1.53,-0.17,-10.00%,"13,450,689"
BRN,"Barnwell Industries, Inc. Common Stock",$1.33,-0.055,-3.971%,"13,397,800"
CARV,"Carver Bancorp, Inc. Common Stock",$2.63,-0.07,-2.593%,"13,351,534"
PT,Pintec Technology Holdings Limited American Depositary Shares,$0.8358,-0.0342,-3.931%,"13,329,305"
BFRG,"Bullfrog AI Holdings, Inc. Common Stock",$1.32,-0.11,-7.692%,"13,307,369"
XAIR,"Beyond Air, Inc. Common Stock",$2.54,-0.15,-5.576%,"13,274,581"
AEON,"AEON Biopharma, Inc. Class A Common Stock",$1.13,0.10,9.709%,"13,157,478"
DUO,Fangdd Network Group Ltd. Class A Ordinary Shares,$3.36,-0.20,-5.618%,"13,119,338"
HKPD,Hong Kong Pharma Digital Technology Holdings Limited Ordinary shares,$1.19,-0.115,-8.812%,"13,090,000"
MRKR,"Marker Therapeutics, Inc. Common Stock",$1.01,-0.04,-3.81%,"13,068,299"
DKI,DarkIris Inc. Class A Ordinary Shares,$0.7445,-0.0675,-8.313%,"13,028,750"
SOS,SOS Limited Class A Ordinary Shares,$1.91,-0.21,-9.906%,"12,976,299"
GXAI,Gaxos.ai Inc. Common Stock,$1.82,-0.12,-6.186%,"12,964,684"
BRTX,"BioRestorative Therapies, Inc. Common Stock (NV)",$1.62,-0.05,-2.994%,"12,924,550"
CYCU,"Cycurion, Inc. Common Stock",$0.2511,-0.0444,-15.025%,"12,913,078"
EKSO,"Ekso Bionics Holdings, Inc. Common Stock",$4.94,-0.40,-7.491%,"12,902,233"
ETS,Elite Express Holding Inc. Class A Common Stock,$0.7598,-0.0707,-8.513%,"12,853,287"
CRGOW,Freightos Limited Warrants,$0.255,-0.01,-3.774%,"12,760,898"
IMNN,"Imunon, Inc. Common Stock",$5.06,-0.14,-2.692%,"12,757,307"
LXEH,"Lixiang Education Holding Co., Ltd. American Depositary Shares",$0.665,0.0153,2.355%,"12,745,836"
KLTOW,"Klotho Neurosciences, Inc. Warrant",$0.2072,0.0172,9.053%,"12,716,783"
NCEW,New Century Logistics (BVI) Limited Ordinary Shares,$0.5898,-0.0128,-2.124%,"12,680,700"
DAVEW,Dave Inc. Warrants,$0.93,-0.09,-8.824%,"12,675,582"
SUGP,SU Group Holdings Limited Ordinary Shares,$9.15,-1.34,-12.774%,"12,670,463"
LYRA,"Lyra Therapeutics, Inc. Common Stock",$7.67,-0.30,-3.764%,"12,612,962"
PHIO,Phio Pharmaceuticals Corp. Common Stock,$2.202,-0.158,-6.695%,"12,610,304"
RMCF,"Rocky Mountain Chocolate Factory, Inc. Common Stock",$1.615,-0.055,-3.293%,"12,587,187"
GRNQ,Greenpro Capital Corp. Common Stock,$1.52,-0.10,-6.173%,"12,579,236"
JYD,Jayud Global Logistics Limited Class A Ordinary Shares,$0.1333,-0.0028,-2.057%,"12,508,378"
EDHL,Everbright Digital Holding Limited Ordinary Shares,$0.47,-0.042,-8.203%,"12,455,000"
VRME,"VerifyMe, Inc. Common Stock",$1.01,-0.03,-2.885%,"12,446,903"
MHUA,"Meihua International Medical Technologies Co., Ltd. Ordinary Shares",$0.3901,-0.0136,-3.369%,"12,445,933"
EDUC,Educational Development Corporation Common Stock,$1.45,-0.16,-9.938%,"12,445,641"
REBN,"Reborn Coffee, Inc. Common Stock",$2.30,-0.12,-4.959%,"12,442,347"
FLYE,"Fly-E Group, Inc. Common Stock",$0.6581,-0.022,-3.235%,"12,436,135"
GTI,Graphjet Technology Class A Ordinary Shares,$3.87,-0.18,-4.444%,"12,422,940"
ZKIN,"ZK International Group Co., Ltd Ordinary Share",$2.40,-0.22,-8.397%,"12,393,470"
LCFYW,Locafy Limited Warrant,$8.93,-0.39,-4.185%,"12,342,912"
VSME,VS Media Holdings Limited Class A Ordinary Shares,$1.30,UNCH,--,"12,341,408"
XTLB,XTL Biopharmaceuticals Ltd. American Depositary Shares,$1.40,-0.23,-14.11%,"12,339,393"
LGVN,Longeveron Inc. Class A Common Stock,$0.8126,-0.0723,-8.17%,"12,334,110"
GELS,Gelteq Limited Ordinary Shares,$1.30,-0.06,-4.412%,"12,269,498"
JCTC,Jewett-Cameron Trading Company Common Shares,$3.4694,-0.0106,-0.305%,"12,205,762"
ILAG,Intelligent Living Application Group Inc. Ordinary Shares,$0.5825,-0.0556,-8.713%,"12,098,224"
QNRX,"Quoin Pharmaceuticals, Ltd. American Depositary Shares",$20.50,12.34,151.225%,"12,057,424"
GLE,Global Engine Group Holding Limited Class A Ordinary Shares,$0.6585,-0.0169,-2.502%,"12,050,550"
TXMD,"TherapeuticsMD, Inc. Common Stock",$1.04,-0.02,-1.887%,"12,037,336"
BHAT,Blue Hat Interactive Entertainment Technology Ordinary Shares,$1.66,-0.12,-6.742%,"12,024,925"
MYSE,"Myseum, Inc. Common Stock",$2.85,-0.31,-9.81%,"11,996,588"
ARBB,ARB IOT Group Limited Ordinary Shares,$6.79,-0.45,-6.215%,"11,986,224"
OSRH,"OSR Holdings, Inc. Common Stock",$0.5548,-0.055,-9.019%,"11,975,558"
CENN,Cenntro Inc. Common Stock,$0.23,-0.0237,-9.342%,"11,939,951"
PSIG,PS International Group Ltd. Ordinary Shares,$0.458,0.0179,4.067%,"11,897,437"
TNMG,TNL Mediagene Ordinary Shares,$0.4206,-0.125,-22.911%,"11,896,727"
APM,Aptorum Group Limited Class A Ordinary Shares,$1.66,-0.71,-29.958%,"11,858,637"
ORKT,Orangekloud Technology Inc. Class A Ordinary Shares,$2.03,-0.20,-8.969%,"11,854,693"
ACXP,"Acurx Pharmaceuticals, Inc. Common Stock",$7.48,0.04,0.538%,"11,854,117"
COCP,"Cocrystal Pharma, Inc. Common Stock",$1.15,-0.07,-5.738%,"11,797,696"
RNAZ,"TransCode Therapeutics, Inc. Common Stock",$14.15,-0.63,-4.263%,"11,796,614"
SFHG,Samfine Creation Holdings Group Limited Class A Ordinary Share,$0.655,-0.0204,-3.02%,"11,790,000"
CPOP,"Pop Culture Group Co., Ltd Class A Ordinary Shares",$0.7881,-0.0419,-5.048%,"11,773,458"
DSS,"DSS, Inc. Common Stock",$1.292,-0.038,-2.857%,"11,747,533"
OLB,"The OLB Group, Inc. Common Stock",$1.3393,-0.0107,-0.793%,"11,743,159"
ATXG,Addentax Group Corp. Common Stock,$1.00,UNCH,--,"11,715,348"
PHH,"Park Ha Biological Technology Co., Ltd. Ordinary Shares",$0.4429,-0.0091,-2.013%,"11,681,223"
AGMH,AGM Group Holdings Inc. Class A Ordinary Shares,$5.79,-0.88,-13.193%,"11,674,255"
LFWD,Lifeward Ltd. Ordinary Shares,$0.7395,-0.0703,-8.681%,"11,613,568"
BNZI,"Banzai International, Inc. Class A Common Stock",$3.34,-0.36,-9.73%,"11,549,930"
KUKE,Kuke Music Holding Limited American Depositary Shares (each representing ten (10) Class A Ordinary Shares),$0.5665,-0.0408,-6.718%,"11,513,713"
POLA,"Polar Power, Inc. Common Stock",$4.58,-0.22,-4.583%,"11,502,817"
ZBAI,ATIF Holdings Limited Ordinary Shares,$8.75,-0.3051,-3.369%,"11,492,014"
ENFY,Enlightify Inc. Common Stock,$0.7276,-0.1225,-14.41%,"11,474,932"
SINT,"SiNtx Technologies, Inc. Common Stock",$4.14,-0.21,-4.828%,"11,421,701"
AMZE,"Amaze Holdings, Inc. Common Stock",$1.82,-0.12,-6.186%,"11,385,230"
NCPL,Netcapital Inc. Common Stock,$2.31,-0.17,-6.855%,"11,360,324"
SKYQ,Sky Quarry Inc. Common Stock,$0.505,-0.005,-0.98%,"11,350,593"
BTBD,"BT Brands, Inc. Common Stock",$1.84,-0.07,-3.665%,"11,324,692"
SCNX,"Scienture Holdings, Inc. Common Stock",$0.7011,-0.0628,-8.221%,"11,309,570"
PETZ,"TDH Holdings, Inc. Common Shares",$1.09,-0.07,-6.034%,"11,252,362"
VSEE,"VSee Health, Inc. Common Stock",$0.685,-0.0149,-2.129%,"11,249,543"
SONM,"Sonim Technologies, Inc. Common Stock",$0.6324,-0.073,-10.349%,"11,218,084"
BBGI,"Beasley Broadcast Group, Inc. Class A Common Stock",$6.20,0.02,0.324%,"11,184,763"
BOLT,"Bolt Biotherapeutics, Inc. Common Stock",$5.80,-0.12,-2.027%,"11,132,758"
MBIO,"Mustang Bio, Inc. Common Stock",$1.53,-0.24,-13.559%,"11,076,658"
CETY,"Clean Energy Technologies, Inc. Common Stock",$2.38,-0.26,-9.848%,"11,063,480"
RVYL,Ryvyl Inc. Common Stock,$0.3501,-0.045,-11.39%,"10,972,838"
YCBD,"cbdMD, Inc. Common Stock",$1.23,-0.22,-15.172%,"10,962,940"
MSN,Emerson Radio Corporation Common Stock,$0.5176,-0.1161,-18.321%,"10,891,677"
ARQQW,Arqit Quantum Inc. Warrants,$0.8611,-0.1789,-17.202%,"10,767,202"
CHEK,Check-Cap Ltd. Ordinary Share,$1.84,-0.21,-10.244%,"10,765,667"
CGTL,Creative Global Technology Holdings Limited Class A Ordinary Shares,$0.5021,-0.0125,-2.429%,"10,763,769"
PFSA,"Profusa, Inc. Common Stock",$0.3281,-0.0102,-3.015%,"10,758,031"
PAVM,PAVmed Inc. Common Stock,$0.4886,-0.0004,-0.082%,"10,716,422"
FTRK,FAST TRACK GROUP Ordinary shares,$0.4872,-0.0463,-8.679%,"10,627,050"
ADVB,Advanced Biomed Inc. Common Stock,$0.4901,0.0121,2.531%,"10,605,764"
POAI,Predictive Oncology Inc. Common Stock,$13.89,-0.38,-2.663%,"10,589,930"
GSIW,Garden Stage Limited Ordinary Shares,$0.1424,-0.0114,-7.412%,"10,542,064"
PCLA,PicoCELA Inc. American Depositary Shares,$0.4251,-0.0199,-4.472%,"10,493,109"
ATER,"Aterian, Inc. Common Stock",$1.05,-0.16,-13.223%,"10,484,359"
VS,Versus Systems Inc. Common Stock,$2.13,-0.22,-9.362%,"10,440,572"
WATT,Energous Corporation Common Stock,$7.15,-0.74,-9.379%,"10,405,817"
CLRO,"ClearOne, Inc. (DE) Common Stock",$5.93,-0.03,-0.503%,"10,284,097"
SHFS,"SHF Holdings, Inc. Class A Common Stock",$3.52,-0.81,-18.707%,"10,264,165"
DWTX,"Dogwood Therapeutics, Inc. Common Stock",$5.37,-0.23,-4.107%,"10,262,757"
BEATW,"Heartbeam, Inc. Warrant",$0.2991,0.0091,3.138%,"10,262,596"
AWX,Avalon Holdings Corporation Common Stock,$2.63,UNCH,--,"10,255,504"
BFRI,Biofrontera Inc. Common Stock,$0.96,-0.0799,-7.683%,"10,241,704"
CLWT,Euro Tech Holdings Company Limited Common Stock,$1.3423,0.0223,1.689%,"10,224,090"
NCNA,NuCana plc American Depositary Share,$5.33,-0.61,-10.269%,"10,170,589"
UUU,"Universal Safety Products, Inc. Common Stock",$4.38,-0.20,-4.367%,"10,130,445"
LSH,Lakeside Holding Limited Common Stock,$1.35,-0.06,-4.255%,"10,125,000"
TNON,"Tenon Medical, Inc. Common Stock",$1.14,-0.05,-4.202%,"10,122,311"
KWMWW,"K Wave Media, Ltd. Warrant",$0.16,0.0139,9.514%,"10,105,920"
INLF,INLIF LIMITED Class A Ordinary Shares,$0.6969,-0.0397,-5.39%,"10,105,050"
LBGJ,Li Bang International Corporation Inc. Ordinary Shares,$0.5455,-0.0133,-2.38%,"10,102,660"
ADXN,Addex Therapeutics Ltd American Depositary Shares,$9.44,0.52,5.83%,"10,092,380"
CIIT,"Tianci International, Inc. Common Stock",$0.6094,0.0088,1.465%,"10,074,481"
YJ,Yunji Inc. American Depository Shares,$2.0428,-0.2072,-9.209%,"10,061,893"
KALA,"KALA BIO, Inc. Common Stock",$1.43,-0.12,-7.742%,"10,040,087"
XHLD,"TEN Holdings, Inc. Common Stock",$0.285,-0.0342,-10.714%,"10,025,954"
PTHL,Pheton Holdings Ltd Class A Ordinary Shares,$0.70,-0.03,-4.11%,"9,975,000"
SEED,Origin Agritech Limited Common Stock,$1.38,-0.06,-4.167%,"9,935,997"
ERNA,Ernexa Therapeutics Inc. Common Stock,$1.295,-0.045,-3.358%,"9,933,801"
FLGC,Flora Growth Corp. Common Stock,$17.10,-1.92,-10.095%,"9,895,479"
MKZR,"MacKenzie Realty Capital, Inc. Common Stock",$5.53,0.03,0.545%,"9,784,141"
CWD,CaliberCos Inc. Class A Common Stock,$4.05,-0.17,-4.028%,"9,780,904"
OP,OceanPal Inc. Common Stock,$1.46,0.08,5.797%,"9,776,309"
XBIO,"Xenetic Biosciences, Inc. Common Stock",$6.33,-3.13,-33.087%,"9,761,740"
MARPS,Marine Petroleum Trust Units of Beneficial Interest,$4.87,0.26,5.64%,"9,740,000"
ONMDW,OneMedNet Corp Warrant,$0.2099,0.0703,50.358%,"9,675,476"
PDYNW,Palladyne AI Corp Warrants,$0.23,-0.0047,-2.003%,"9,648,241"
TVGNW,Tevogen Bio Holdings Inc. Warrant,$0.049,UNCH,--,"9,638,548"
INBS,Intelligent Bio Solutions Inc. Common Stock,$1.07,-0.06,-5.31%,"9,607,693"
GIBO,GIBO Holdings Limited Class A Ordinary Shares,$2.55,-0.28,-9.894%,"9,576,107"
VIVK,"Vivakor, Inc. Common Stock",$0.1991,-0.0164,-7.61%,"9,566,973"
PRSO,Peraso Inc. Common Stock,$1.55,-0.07,-4.321%,"9,565,112"
SMTK,"SmartKem, Inc. Common Stock",$2.10,0.01,0.478%,"9,543,429"
INAB,"IN8bio, Inc. Common Stock",$2.10,-0.23,-9.871%,"9,533,406"
KZIA,Kazia Therapeutics Limited American Depositary Shares,$6.98,-0.20,-2.786%,"9,490,183"
MTR,Mesa Royalty Trust Common Stock,$5.0772,-0.0258,-0.506%,"9,461,819"
XELB,"Xcel Brands, Inc. Common Stock",$1.98,-0.07,-3.415%,"9,429,473"
CVR,Chicago Rivet & Machine Co. Common Stock,$9.76,-0.24,-2.40%,"9,429,448"
VYNE,VYNE Therapeutics Inc. Common Stock,$0.37,-0.0429,-10.39%,"9,424,701"
LIDRW,"AEye, Inc. Warrant",$0.2344,-0.0106,-4.327%,"9,362,668"
FGI,FGI Industries Ltd. Ordinary Shares,$4.87,-0.82,-14.411%,"9,342,175"
SOWG,Sow Good Inc. Common Stock,$0.7642,-0.0068,-0.882%,"9,341,274"
BGLC,BioNexus Gene Lab Corp Common stock,$5.19,-0.19,-3.532%,"9,324,338"
GLXG,Galaxy Payroll Group Limited Class A Ordinary Shares,$4.30,-0.40,-8.511%,"9,294,450"
ETHZW,ETHZilla Corporation Warrant,$0.0561,-0.0071,-11.234%,"9,283,184"
KPRX,"Kiora Pharmaceuticals, Inc.  Common Stock",$2.70,-0.12,-4.255%,"9,270,426"
GORV,"Lazydays Holdings, Inc. Common Stock",$2.48,-0.17,-6.415%,"9,264,424"
MWG,Multi Ways Holdings Limited Ordinary Shares,$0.2775,-0.0089,-3.108%,"9,249,075"
HCWC,Healthy Choice Wellness Corp. Class A Common Stock,$0.67,0.0375,5.929%,"9,245,386"
HSCS,HeartSciences Inc. Common Stock,$3.49,-0.19,-5.163%,"9,240,515"
INEO,INNEOVA Holdings Limited Ordinary Shares,$0.9299,-0.0075,-0.80%,"9,182,763"
MITQ,"Moving iMage Technologies, Inc. Common Stock",$0.9192,0.0035,0.382%,"9,136,002"
NAMMW,Namib Minerals Warrants,$0.1701,-0.0574,-25.231%,"9,130,531"
BNGO,"Bionano Genomics, Inc. Common Stock",$1.95,-0.18,-8.451%,"9,127,950"
GP,GreenPower Motor Company Inc. Common Shares,$2.97,-0.14,-4.502%,"9,047,300"
MOBXW,"Mobix Labs, Inc Warrants",$0.165,-0.0125,-7.042%,"9,031,166"
UCAR,U Power Limited Class A Ordinary Shares,$2.04,UNCH,--,"9,016,506"
NAAS,NaaS Technology Inc. American Depositary Shares,$3.86,-0.12,-3.015%,"9,015,173"
IDAI,T Stamp Inc. Class A Common Stock,$3.54,-0.20,-5.348%,"8,999,707"
FBGL,FBS Global Limited Ordinary Shares,$0.663,-0.0666,-9.128%,"8,950,500"
STAK,STAK Inc. Class A Ordinary Shares,$0.795,-0.083,-9.453%,"8,943,750"
LDWY,"Lendway, Inc. Common Stock (DE)",$5.01,0.11,2.245%,"8,865,691"
DFLIW,Dragonfly Energy Holdings Corp. Warrant,$0.143,-0.012,-7.742%,"8,826,617"
LRHC,La Rosa Holdings Corp. Common Stock,$7.20,-0.12,-1.639%,"8,812,210"
BTTC,Black Titan Corporation Ordinary Shares,$6.62,-0.29,-4.197%,"8,806,149"
TPET,Trio Petroleum Corp. Common Stock,$1.04,-0.04,-3.704%,"8,778,483"
DHAI,"DIH Holdings US, Inc. Class A Common Stock",$0.1851,-0.0179,-8.818%,"8,761,950"
IOTR,iOThree Limited Ordinary Shares,$0.3414,-0.0286,-7.73%,"8,756,910"
JTAI,Jet.AI Inc. Common Stock,$2.68,-0.26,-8.844%,"8,740,166"
HCWB,HCW Biologics Inc. Common Stock,$4.06,-0.48,-10.573%,"8,735,524"
SYNX,Silynxcom Ltd. Ordinary Shares,$1.646,-0.024,-1.437%,"8,702,372"
MTNB,"Matinas Biopharma Holdings, Inc. Common Stock",$1.71,-0.15,-8.065%,"8,698,744"
BNKKW,"Bonk, Inc. Warrant",$0.06,0.06,--,"8,692,039"
ALBT,Avalon GloboCare Corp. Common Stock,$2.2601,-0.1399,-5.829%,"8,667,730"
CLIK,Click Holdings Limited Class A Ordinary Share,$7.56,-0.8341,-9.937%,"8,659,224"
CELZ,"Creative Medical Technology Holdings, Inc. Common Stock",$3.33,-0.1928,-5.473%,"8,593,172"
INHD,Inno Holdings Inc. Common Stock,$1.10,-0.19,-14.729%,"8,523,330"
IINNW,Inspira Technologies Oxy B.H.N. Ltd. Warrant,$0.3502,-0.0508,-12.668%,"8,493,084"
LUCY,"Innovative Eyewear, Inc. Common Stock",$1.85,-0.13,-6.566%,"8,463,014"
EVGN,Evogene Ltd Ordinary Shares,$1.29,-0.05,-3.731%,"8,403,820"
SNTG,Sentage Holdings Inc. Class A Ordinary Shares,$2.98,-0.17,-5.397%,"8,359,869"
ADIL,"Adial Pharmaceuticals, Inc Common Stock",$0.3814,-0.0378,-9.017%,"8,325,281"
ENTO,"Entero Therapeutics, Inc. Common Stock",$5.24,0.58,12.446%,"8,324,138"
YHC,LQR House Inc. Common Stock,$0.8007,-0.0433,-5.13%,"8,309,732"
WAFU,Wah Fu Education Group Limited Ordinary Shares,$1.88,-0.19,-9.179%,"8,291,851"
DEVS,DevvStream Corp. Common Stock,$2.34,-0.18,-7.143%,"8,287,515"
APRE,"Aprea Therapeutics, Inc. Common stock",$1.42,-0.057,-3.859%,"8,271,871"
IFBD,"Infobird Co., Ltd Ordinary Shares",$1.01,-0.05,-4.717%,"8,270,460"
NWTG,"Newton Golf Company, Inc. Common Stock",$1.79,-0.11,-5.789%,"8,252,655"
RETO,"ReTo Eco-Solutions, Inc. Class A Shares",$1.07,-0.08,-6.957%,"8,200,351"
SRXH,"SRX Health Solutions, Inc. Common Stock",$0.3299,-0.0349,-9.567%,"8,199,214"
SQFT,"Presidio Property Trust, Inc. Class A Common Stock",$5.65,0.10,1.802%,"8,198,647"
FRSX,Foresight Autonomous Holdings Ltd. American Depositary Shares,$2.26,-0.16,-6.612%,"8,185,426"
FEBO,Fenbo Holdings Limited Ordinary Shares,$0.739,-0.0101,-1.348%,"8,175,188"
SHMDW,SCHMID Group N.V. Warrants,$0.19,0.02,11.765%,"8,165,224"
ELWS,"Earlyworks Co., Ltd. American Depositary Shares",$2.70,-0.31,-10.299%,"8,141,526"
GCLWW,GCL Global Holdings Ltd Warrants,$0.0638,-0.0062,-8.857%,"8,059,103"
RDGT,"Ridgetech, Inc. Ordinary Shares",$1.37,0.02,1.481%,"8,021,362"
BMRA,"Biomerica, Inc. Common Stock",$2.83,-0.12,-4.068%,"7,967,610"
AQMS,"Aqua Metals, Inc. Common Stock",$5.66,-0.47,-7.667%,"7,957,988"
CREV,Carbon Revolution Public Limited Ordinary Shares,$4.21,-0.05,-1.174%,"7,936,625"
VIVS,"VivoSim Labs, Inc. Common Stock",$3.04,-0.285,-8.571%,"7,903,383"
AMPGW,"Amplitech Group, Inc. Warrants",$0.38,UNCH,--,"7,817,966"
CDTG,CDT Environmental Technology Investment Holdings Limited ordinary shares,$0.6341,-0.066,-9.427%,"7,815,283"
SKK,SKK Holdings Limited Ordinary Shares,$0.4151,-0.0039,-0.931%,"7,783,125"
CYCN,"Cyclerion Therapeutics, Inc. Common Stock",$2.33,-0.14,-5.668%,"7,776,226"
BCDA,"BioCardia, Inc. Common Stock",$1.34,-0.05,-3.597%,"7,773,640"
ASTC,Astrotech Corporation (DE) Common Stock,$4.40,-0.55,-11.111%,"7,739,393"
HIHO,Highway Holdings Limited Common Stock,$1.67,0.019,1.151%,"7,685,048"
NRSNW,NeuroSense Therapeutics Ltd. Warrant,$0.32,-0.0398,-11.062%,"7,676,374"
JEM,707 Cayman Holdings Limited Ordinary Shares,$0.3494,-0.0111,-3.079%,"7,669,330"
ADN,"Advent Technologies Holdings, Inc. Class A Common Stock",$2.87,-0.25,-8.013%,"7,663,721"
TCRT,"Alaunos Therapeutics, Inc. Common Stock",$3.48,-0.51,-12.782%,"7,638,395"
ILLRW,Triller Group Inc. Warrant,$0.049,0.0007,1.449%,"7,602,831"
LGCL,Lucas GC Limited Ordinary Shares,$0.0955,-0.0205,-17.672%,"7,589,104"
SCKT,"Socket Mobile, Inc. Common Stock",$0.95,-0.10,-9.524%,"7,563,389"
MEGL,Magic Empire Global Limited Class A Ordinary Shares,$1.49,-0.11,-6.875%,"7,545,435"
FCHL,Fitness Champs Holdings Limited Common Stock,$0.5013,-0.0277,-5.236%,"7,519,500"
FPAY,"FlexShopper, Inc. Common Stock",$0.3499,-0.0401,-10.282%,"7,509,375"
IBO,"Impact BioMedical, Inc. Common Stock",$0.6159,-0.009,-1.44%,"7,504,995"
DRCT,"Direct Digital Holdings, Inc. Class A Common Stock",$0.3328,-0.0227,-6.385%,"7,493,787"
IPDN,"Professional Diversity Network, Inc. Common Stock",$2.96,-0.13,-4.207%,"7,399,062"
BSLK,"Bolt Projects Holdings, Inc. Common Stock",$3.58,-0.22,-5.789%,"7,381,169"
CDIO,Cardio Diagnostics Holdings Inc. Common stock,$4.15,-0.40,-8.791%,"7,316,985"
GURE,"Gulf Resources, Inc. (NV) Common Stock",$0.548,0.0085,1.576%,"7,313,947"
NCI,Neo-Concept International Group Holdings Limited Class A Ordinary Shares,$1.78,-0.13,-6.806%,"7,233,920"
FTFT,Future FinTech Group Inc. Common Stock,$2.09,-0.15,-6.696%,"7,212,109"
GITS,"Global Interactive Technologies, Inc. Common Stock",$2.03,-0.08,-3.791%,"7,204,115"
BETRW,Better Home & Finance Holding Company Warrant,$0.4709,-0.0592,-11.168%,"7,200,702"
SNGX,"Soligenix, Inc. Common Stock",$1.68,-0.11,-6.145%,"7,199,758"
NBY,"NovaBay Pharmaceuticals, Inc. Common Stock",$1.23,-0.06,-4.651%,"7,162,901"
JCSE,JE Cleantech Holdings Limited Ordinary Shares,$1.36,0.04,3.03%,"7,153,954"
EVOK,"Evoke Pharma, Inc. Common Stock",$4.59,-0.26,-5.361%,"7,153,354"
AQB,"AquaBounty Technologies, Inc. Common Stock",$1.84,-0.09,-4.663%,"7,134,959"
GCTK,"GlucoTrack, Inc. Common Stock",$7.91,-0.18,-2.225%,"7,114,333"
SBFM,Sunshine Biopharma Inc. Common Stock,$1.55,-0.12,-7.186%,"7,061,715"
QLGN,"Qualigen Therapeutics, Inc. Common Stock",$4.16,-0.24,-5.455%,"7,053,072"
WAI,Top KingWin Ltd Class A Ordinary Shares,$4.25,1.19,38.889%,"7,038,523"
PTLE,PTL LTD Class A Ordinary Shares,$0.186,-0.0117,-5.918%,"6,972,675"
IBG,Innovation Beverage Group Limited Ordinary Shares,$2.97,-0.04,-1.329%,"6,898,413"
LOBO,LOBO EV TECHNOLOGIES LTD. Ordinary shares,$0.7979,0.0077,0.974%,"6,885,877"
LCFY,Locafy Limited Ordinary Share,$4.97,-0.43,-7.963%,"6,869,459"
