Symbol,Name,Last Sale,Net Change,% Change,Market Cap
NVDA,NVIDIA Corporation Common Stock,$183.14,-2.67,-1.437%,"4,450,302,000,000"
GOOG,Alphabet Inc. Class C Capital Stock,$336.31,-0.12,-0.036%,"4,058,252,770,000"
GOOGL,Alphabet Inc. Class A Common Stock,$335.84,-0.13,-0.039%,"4,052,581,280,000"
AAPL,Apple Inc. Common Stock,$259.96,-1.09,-0.418%,"3,820,872,842,960"
MSFT,Microsoft Corporation Common Stock,$459.38,-11.29,-2.399%,"3,414,285,647,154"
AMZN,"Amazon.com, Inc. Common Stock",$236.65,-5.95,-2.453%,"2,529,839,619,003"
TSM,Taiwan Semiconductor Manufacturing Company Ltd.,$327.11,-4.10,-1.238%,"1,696,571,274,027"
AVGO,Broadcom Inc. Common Stock,$339.89,-14.72,-4.151%,"1,611,511,551,542"
META,"Meta Platforms, Inc. Class A Common Stock",$615.52,-15.57,-2.467%,"1,551,435,146,505"
TSLA,"Tesla, Inc. Common Stock",$439.20,-8.00,-1.789%,"1,460,699,778,146"
BRK/A,Berkshire Hathaway Inc.,"$743,437.689999999944","1,137.69",0.153%,"1,093,503,168,841"
BRK/B,Berkshire Hathaway Inc.,$493.15,-2.09,-0.422%,"1,088,042,452,609"
LLY,Eli Lilly and Company Common Stock,"$1,073.29",-3.90,-0.362%,"1,014,670,932,551"
WMT,Walmart Inc. Common Stock,$120.04,-0.32,-0.266%,"956,738,842,359"
JPM,JP Morgan Chase & Co. Common Stock,$307.87,-3.03,-0.975%,"838,102,892,762"
V,Visa Inc.,$329.17,1.29,0.393%,"633,890,936,763"
ORCL,Oracle Corporation Common Stock,$193.61,-8.68,-4.291%,"556,266,699,300"
XOM,Exxon Mobil Corporation Common Stock,$130.20,3.66,2.892%,"549,074,962,943"
JNJ,Johnson & Johnson Common Stock,$218.55,4.90,2.293%,"526,551,444,542"
ASML,ASML Holding N.V. New York Registry Shares,"$1,263.72",-6.44,-0.507%,"497,000,502,638"
MA,Mastercard Incorporated Common Stock,$546.82,1.83,0.336%,"491,042,089,603"
PLTR,Palantir Technologies Inc. Class A Common Stock,$178.40,-0.56,-0.313%,"425,205,042,699"
COST,Costco Wholesale Corporation Common Stock,$950.98,9.05,0.961%,"422,110,932,473"
BABA,Alibaba Group Holding Limited American Depositary Shares each representing eight Ordinary share,$169.90,2.89,1.73%,"392,346,580,934"
ABBV,AbbVie Inc. Common Stock,$221.89,1.14,0.516%,"392,164,975,994"
BAC,Bank of America Corporation Common Stock,$52.48,-2.06,-3.777%,"383,234,966,464"
NFLX,"Netflix, Inc. Common Stock",$88.55,-1.77,-1.96%,"375,214,981,757"
MU,"Micron Technology, Inc. Common Stock",$333.35,-4.78,-1.414%,"375,188,512,154"
HD,"Home Depot, Inc. (The) Common Stock",$375.95,-3.79,-0.998%,"374,262,542,786"
AMD,"Advanced Micro Devices, Inc. Common Stock",$223.60,2.63,1.19%,"364,030,088,344"
PG,Procter & Gamble Company (The) Common Stock,$146.35,2.11,1.463%,"341,980,954,896"
CVX,Chevron Corporation Common Stock,$167.24,3.37,2.057%,"336,741,351,882"
GE,GE Aerospace Common Stock,$318.88,-8.35,-2.552%,"336,359,059,940"
KO,Coca-Cola Company (The) Common Stock,$71.44,0.20,0.281%,"307,306,935,887"
UNH,UnitedHealth Group Incorporated Common Stock (DE),$334.96,1.03,0.308%,"303,419,704,155"
CAT,"Caterpillar, Inc. Common Stock",$638.75,2.22,0.349%,"298,921,966,945"
AZN,AstraZeneca PLC American Depositary Shares,$96.34,1.83,1.936%,"298,793,860,439"
TM,Toyota Motor Corporation Common Stock,$227.30,-1.73,-0.755%,"296,602,173,672"
CSCO,"Cisco Systems, Inc. Common Stock (DE)",$74.41,-1.06,-1.405%,"294,000,946,433"
SAP,SAP  SE ADS,$238.88,-8.22,-3.327%,"293,465,090,940"
IBM,International Business Machines Corporation Common Stock,$309.03,5.87,1.936%,"288,861,220,710"
NVS,Novartis AG Common Stock,$146.16,4.55,3.213%,"288,679,044,488"
MS,Morgan Stanley Common Stock,$180.78,-1.98,-1.083%,"287,315,337,243"
HSBC,"HSBC Holdings, plc. Common Stock",$81.76,0.24,0.294%,"280,849,522,191"
WFC,Wells Fargo & Company Common Stock,$89.25,-4.31,-4.607%,"280,163,295,374"
GS,"Goldman Sachs Group, Inc. (The) Common Stock",$932.67,-5.48,-0.584%,"279,734,324,354"
MRK,"Merck & Company, Inc. Common Stock (new)",$111.01,2.75,2.54%,"275,529,321,721"
RTX,RTX Corporation Common Stock,$198.84,4.76,2.453%,"266,599,092,947"
PM,Philip Morris International Inc Common Stock,$171.08,5.23,3.153%,"266,309,757,179"
NVO,Novo Nordisk A/S Common Stock,$58.91,-0.73,-1.224%,"263,033,150,000"
LRCX,Lam Research Corporation Common Stock,$208.79,-5.59,-2.608%,"262,246,503,700"
AXP,American Express Company Common Stock,$358.26,0.26,0.073%,"246,787,993,204"
AMAT,"Applied Materials, Inc. Common Stock",$301.89,-2.98,-0.977%,"239,381,672,762"
RY,Royal Bank Of Canada Common Stock,$168.60,-0.34,-0.201%,"236,075,741,008"
TMO,Thermo Fisher Scientific Inc Common Stock,$621.83,14.75,2.43%,"233,626,542,328"
CCZ,Comcast Holdings ZONES,$63.18,1.02,1.641%,"230,221,254,826"
CRM,"Salesforce, Inc. Common Stock",$239.57,-1.49,-0.618%,"224,477,090,000"
MCD,McDonald's Corporation Common Stock,$308.13,-1.31,-0.423%,"219,436,119,866"
MUFG,"Mitsubishi UFJ Financial Group, Inc. Common Stock",$18.16,0.67,3.831%,"219,149,630,307"
ABT,Abbott Laboratories Common Stock,$125.00,0.70,0.563%,"217,358,993,375"
SHEL,Shell PLC American Depositary Shares (each representing two (2) Ordinary Shares) ,$74.35,1.17,1.599%,"216,040,001,254"
TMUS,"T-Mobile US, Inc. Common Stock",$192.02,2.35,1.239%,"214,775,642,325"
INTC,Intel Corporation Common Stock,$48.72,1.43,3.024%,"213,247,440,000"
APP,Applovin Corporation Class A Common Stock,$617.76,-50.87,-7.608%,"208,775,080,800"
LIN,Linde plc Ordinary Shares,$439.98,-2.92,-0.659%,"205,448,190,221"
SHOP,Shopify Inc. Class A Subordinate Voting Shares,$157.51,-9.93,-5.93%,"204,964,778,501"
DIS,Walt Disney Company (The) Common Stock,$113.53,0.55,0.487%,"202,683,842,686"
C,"Citigroup, Inc. Common Stock",$112.41,-3.89,-3.345%,"201,131,408,933"
PEP,"PepsiCo, Inc. Common Stock",$145.92,2.44,1.701%,"199,522,270,602"
ISRG,"Intuitive Surgical, Inc. Common Stock",$546.76,-15.06,-2.681%,"193,824,272,873"
ACN,Accenture plc Class A Ordinary Shares (Ireland),$288.54,11.74,4.241%,"190,561,205,669"
KLAC,KLA Corporation Common Stock,"$1,434.50",-7.32,-0.508%,"188,482,308,861"
BA,Boeing Company (The) Common Stock,$242.61,-1.94,-0.793%,"184,406,761,491"
SCHW,Charles Schwab Corporation (The) Common Stock,$101.92,0.74,0.731%,"181,105,395,598"
SAN,"Banco Santander, S.A. Sponsored ADR (Spain)",$12.22,0.03,0.246%,"179,868,910,388"
APH,Amphenol Corporation Common Stock,$146.75,-2.22,-1.49%,"179,630,145,799"
AMGN,Amgen Inc. Common Stock,$328.97,4.67,1.44%,"177,143,986,339"
QCOM,QUALCOMM Incorporated Common Stock,$164.54,-0.75,-0.454%,"176,222,340,000"
UBER,"Uber Technologies, Inc. Common Stock",$84.65,-0.76,-0.89%,"175,888,341,752"
TXN,Texas Instruments Incorporated Common Stock,$193.45,4.92,2.61%,"175,773,123,219"
GEV,GE Vernova Inc. Common Stock,$644.18,-7.91,-1.213%,"174,779,213,279"
TJX,"TJX Companies, Inc. (The) Common Stock",$155.13,-3.01,-1.903%,"172,266,760,447"
NEE,"NextEra Energy, Inc. Common Stock",$81.98,0.34,0.416%,"170,732,341,894"
BLK,"BlackRock, Inc. Common Stock","$1,091.85",2.31,0.212%,"169,401,519,992"
HDB,HDFC Bank Limited Common Stock,$32.92,-0.28,-0.843%,"168,485,432,610"
DHR,Danaher Corporation Common Stock,$237.95,2.39,1.015%,"168,075,878,516"
VZ,Verizon Communications Inc. Common Stock,$39.83,0.82,2.102%,"167,940,227,227"
BHP,BHP Group Limited American Depositary Shares (Each representing two Ordinary Shares),$66.02,2.03,3.172%,"167,654,923,940"
T,AT&T Inc.,$23.61,0.31,1.33%,"167,381,902,577"
BKNG,Booking Holdings Inc. Common Stock,"$5,187.02",-127.69,-2.403%,"167,197,443,081"
SPGI,S&P Global Inc. Common Stock,$545.00,2.84,0.524%,"165,026,000,000"
TBB,AT&T Inc. 5.350% Global Notes due 2066,$22.74,0.07,0.309%,"162,599,765,815"
TD,Toronto Dominion Bank (The) Common Stock,$93.76,-0.20,-0.213%,"160,067,447,040"
INTU,Intuit Inc. Common Stock,$566.60,-38.68,-6.39%,"157,741,440,000"
ANET,"Arista Networks, Inc. Common Stock",$125.09,-4.84,-3.725%,"157,523,969,406"
LOW,"Lowe's Companies, Inc. Common Stock",$274.95,0.70,0.255%,"154,233,603,102"
GILD,"Gilead Sciences, Inc. Common Stock",$124.07,2.31,1.897%,"153,931,120,826"
PDD,PDD Holdings Inc. American Depositary Shares,$107.85,-4.47,-3.98%,"153,108,870,927"
UBS,UBS Group AG Registered Ordinary Shares,$47.29,-0.07,-0.148%,"150,137,486,120"
COF,Capital One Financial Corporation Common Stock,$234.42,3.01,1.301%,"149,028,671,684"
SCCO,Southern Copper Corporation Common Stock,$180.26,5.89,3.378%,"146,405,699,276"
ADI,"Analog Devices, Inc. Common Stock",$297.99,1.78,0.601%,"145,912,024,365"
UL,Unilever PLC American Depositary Shares (each representing One Ordinary Share),$65.33,0.63,0.974%,"145,857,744,032"
PFE,"Pfizer, Inc. Common Stock",$25.58,0.43,1.71%,"145,440,399,180"
TTE,TotalEnergies SE Ordinary Shares,$66.53,0.73,1.109%,"145,159,265,820"
SONY,Sony Group Corporation American Depositary Shares ,$24.09,-0.32,-1.311%,"145,142,305,287"
BBVA,Banco Bilbao Vizcaya Argentaria S.A. Common Stock,$24.47,-0.20,-0.811%,"141,027,595,329"
NOW,"ServiceNow, Inc. Common Stock",$134.61,-3.58,-2.591%,"139,777,771,454"
BSX,Boston Scientific Corporation Common Stock,$93.74,-0.40,-0.425%,"138,964,116,736"
DE,Deere & Company Common Stock,$512.10,12.58,2.518%,"138,495,108,288"
SYK,Stryker Corporation Common Stock,$359.39,3.57,1.003%,"137,439,234,855"
HON,Honeywell International Inc. Common Stock,$213.04,2.76,1.313%,"135,256,370,792"
UNP,Union Pacific Corporation Common Stock,$227.14,-2.15,-0.938%,"134,730,564,327"
SMFG,Sumitomo Mitsui Financial Group Inc Unsponsored American Depositary Shares (Japan),$20.74,0.21,1.023%,"134,272,331,325"
PANW,"Palo Alto Networks, Inc. Common Stock",$190.93,0.08,0.042%,"133,078,210,000"
LMT,Lockheed Martin Corporation Common Stock,$572.70,14.40,2.579%,"132,521,517,769"
WELL,Welltower Inc. Common Stock,$188.71,0.46,0.244%,"129,516,964,995"
ETN,"Eaton Corporation, PLC Ordinary Shares",$331.14,-1.24,-0.373%,"128,614,776,000"
ADBE,Adobe Inc. Common Stock,$304.44,-5.49,-1.771%,"127,438,584,000"
MDT,Medtronic plc. Ordinary Shares,$98.74,2.32,2.406%,"126,586,082,898"
BTI,"British American Tobacco  Industries, p.l.c. Common Stock ADR",$57.44,0.82,1.448%,"125,325,181,051"
NEM,Newmont Corporation,$114.15,-0.48,-0.419%,"124,567,669,281"
COP,ConocoPhillips Common Stock,$100.34,3.88,4.022%,"123,991,969,205"
BUD,Anheuser-Busch Inbev SA Sponsored ADR (Belgium),$68.79,0.90,1.326%,"123,629,286,397"
PLD,"Prologis, Inc. Common Stock",$132.21,1.99,1.528%,"122,805,506,070"
PGR,Progressive Corporation (The) Common Stock,$205.50,0.44,0.215%,"120,504,631,998"
CEG,Constellation Energy Corporation Common Stock ,$330.38,-3.15,-0.944%,"119,715,002,161"
CB,Chubb Limited  Common Stock,$301.01,0.32,0.106%,"118,462,744,068"
PH,Parker-Hannifin Corporation Common Stock,$936.21,-2.14,-0.228%,"118,137,249,471"
KKR,KKR & Co. Inc. Common Stock,$132.08,2.00,1.538%,"117,729,958,393"
SNY,Sanofi ADS,$47.89,0.69,1.462%,"117,594,495,924"
BX,Blackstone Inc. Common Stock,$158.71,3.46,2.229%,"117,199,537,736"
CRWD,"CrowdStrike Holdings, Inc. Class A Common Stock",$460.70,-7.32,-1.564%,"116,141,751,308"
BMY,Bristol-Myers Squibb Company Common Stock,$57.02,1.10,1.967%,"116,078,637,600"
VRTX,Vertex Pharmaceuticals Incorporated Common Stock,$449.53,-5.14,-1.13%,"114,054,226,099"
ARM,Arm Holdings plc American Depositary Shares,$104.99,-2.85,-2.643%,"111,212,127,255"
IBN,ICICI Bank Limited Common Stock,$31.07,-0.15,-0.48%,"110,850,606,319"
HCA,"HCA Healthcare, Inc. Common Stock",$478.84,-0.48,-0.10%,"109,268,367,076"
SPOT,Spotify Technology S.A. Ordinary Shares,$528.92,-5.72,-1.07%,"107,817,384,808"
RIO,Rio Tinto Plc Common Stock,$85.88,2.29,2.74%,"107,718,624,957"
HOOD,"Robinhood Markets, Inc. Class A Common Stock",$119.67,-0.57,-0.474%,"107,605,931,953"
MELI,"MercadoLibre, Inc. Common Stock","$2,101.95",28.38,1.369%,"106,562,941,705"
BN,Brookfield Corporation Class A Limited Voting Shares,$47.27,-0.02,-0.042%,"106,137,082,684"
MFG,"Mizuho Financial Group, Inc. Sponosred ADR (Japan)",$8.39,0.18,2.192%,"105,413,916,129"
ADP,"Automatic Data Processing, Inc. Common Stock",$258.50,1.43,0.556%,"104,550,000,324"
SBUX,Starbucks Corporation Common Stock,$91.15,0.59,0.652%,"103,646,665,000"
GSK,GSK plc American Depositary Shares (Each representing two Ordinary Shares),$50.79,0.89,1.784%,"103,581,763,618"
CMCSA,Comcast Corporation Class A Common Stock,$28.42,0.27,0.959%,"103,559,481,832"
MO,"Altria Group, Inc.",$61.47,1.32,2.195%,"103,187,940,301"
MCK,McKesson Corporation Common Stock,$834.16,10.18,1.235%,"102,957,574,364"
ENB,Enbridge Inc Common Stock,$46.57,0.23,0.496%,"101,582,005,297"
CVS,CVS Health Corporation Common Stock,$79.33,-1.35,-1.673%,"100,704,079,035"
CVNA,Carvana Co. Class A Common Stock,$458.61,-9.94,-2.121%,"99,767,241,137"
CME,CME Group Inc. Class A Common Stock,$275.23,6.78,2.526%,"99,247,015,154"
AEM,Agnico Eagle Mines Limited Common Stock,$197.28,-1.80,-0.904%,"99,175,500,778"
GD,General Dynamics Corporation Common Stock,$366.00,2.70,0.743%,"98,864,081,772"
ICE,Intercontinental Exchange Inc. Common Stock,$172.94,6.25,3.749%,"98,606,684,490"
SO,Southern Company (The) Common Stock,$88.42,0.87,0.994%,"97,359,690,218"
NKE,"Nike, Inc. Common Stock",$65.57,-0.73,-1.101%,"97,068,739,669"
SNPS,"Synopsys, Inc. Common Stock",$505.34,-6.46,-1.262%,"96,680,742,220"
MCO,Moody's Corporation Common Stock,$535.98,1.08,0.202%,"95,618,832,000"
BMO,Bank Of Montreal Common Stock,$133.26,1.03,0.779%,"94,468,770,784"
BP,BP p.l.c. Common Stock,$35.82,0.46,1.301%,"93,444,366,340"
NOC,Northrop Grumman Corporation Common Stock,$653.14,27.64,4.419%,"93,216,184,560"
DUK,Duke Energy Corporation (Holding Company) Common Stock,$118.68,1.29,1.099%,"92,292,834,064"
ING,"ING Group, N.V. Common Stock",$29.19,0.16,0.551%,"91,872,348,340"
DASH,"DoorDash, Inc. Class A Common Stock",$213.13,-4.27,-1.964%,"91,858,714,354"
UPS,"United Parcel Service, Inc. Common Stock",$107.40,0.82,0.769%,"91,116,613,333"
BNS,Bank Nova Scotia Halifax Pfd 3 Ordinary Shares,$73.00,0.33,0.454%,"90,635,340,000"
MMM,3M Company Common Stock,$169.99,0.57,0.336%,"90,302,945,910"
BCS,Barclays PLC Common Stock,$25.89,0.11,0.427%,"90,007,181,402"
MRSH,Marsh,$183.27,0.57,0.312%,"89,785,747,603"
HWM,Howmet Aerospace Inc. Common Stock,$220.25,0.61,0.278%,"88,554,213,206"
WM,"Waste Management, Inc. Common Stock",$218.79,2.61,1.207%,"88,143,282,088"
NTES,"NetEase, Inc. American Depositary Shares",$139.00,-3.91,-2.736%,"88,014,561,476"
SHW,Sherwin-Williams Company (The) Common Stock,$354.35,-1.64,-0.461%,"87,841,066,332"
BK,The Bank of New York Mellon Corporation Common Stock,$124.59,1.66,1.35%,"86,882,727,359"
FCX,"Freeport-McMoRan, Inc. Common Stock",$60.35,1.01,1.702%,"86,658,415,331"
MAR,Marriott International Class A Common Stock,$319.68,-3.28,-1.016%,"85,786,701,826"
RACE,Ferrari N.V. Common Shares,$353.39,-6.70,-1.861%,"85,653,680,122"
TT,Trane Technologies plc,$385.84,-5.24,-1.34%,"85,555,777,303"
CDNS,"Cadence Design Systems, Inc. Common Stock",$313.17,-9.89,-3.061%,"85,245,187,170"
CM,Canadian Imperial Bank of Commerce Common Stock,$91.46,-0.18,-0.196%,"84,645,501,613"
B,Barrick Mining Corporation Common Shares,$49.95,0.24,0.483%,"84,287,324,804"
BAM,Brookfield Asset Management Inc Class A Limited Voting Shares,$51.92,-0.58,-1.105%,"83,629,617,581"
APO,"Apollo Global Management, Inc. (New) Common Stock",$144.06,0.82,0.572%,"83,615,675,866"
ITUB,Itau Unibanco Banco Holding SA American Depositary Shares (Each repstg 500 Preferred shares),$7.36,0.06,0.822%,"83,592,471,580"
PNC,"PNC Financial Services Group, Inc. (The) Common Stock",$212.32,-0.13,-0.061%,"83,263,082,316"
EMR,Emerson Electric Company Common Stock,$148.15,1.80,1.23%,"83,230,670,000"
USB,U.S. Bancorp Common Stock,$53.50,-0.55,-1.018%,"83,162,222,585"
AMT,American Tower Corporation (REIT) Common Stock,$177.48,3.52,2.023%,"83,086,662,650"
ELV,"Elevance Health, Inc. Common Stock",$372.84,2.16,0.583%,"82,859,500,397"
ABNB,"Airbnb, Inc. Class A Common Stock",$132.79,-7.28,-5.197%,"81,738,852,099"
CRH,CRH PLC Ordinary Shares,$121.89,-5.49,-4.31%,"81,585,783,366"
PBR,Petroleo Brasileiro S.A. Petrobras ADS,$12.66,0.36,2.927%,"81,585,678,383"
LYG,Lloyds Banking Group Plc American Depositary Shares,$5.47,UNCH,--,"81,070,946,110"
INFY,Infosys Limited American Depositary Shares,$19.35,1.83,10.445%,"80,384,027,626"
ORLY,"O'Reilly Automotive, Inc. Common Stock",$95.02,0.39,0.412%,"80,206,770,822"
TDG,Transdigm Group Incorporated Common Stock,"$1,423.84",41.86,3.029%,"80,188,652,643"
NU,Nu Holdings Ltd. Class A Ordinary Shares,$16.64,0.08,0.483%,"80,182,479,770"
SATA,"Strive, Inc. Variable Rate Series A Perpetual Preferred Stock",$98.04,1.07,1.103%,"79,950,013,124"
REGN,"Regeneron Pharmaceuticals, Inc. Common Stock",$754.14,-4.77,-0.629%,"79,259,709,781"
DELL,Dell Technologies Inc. Class C Common Stock ,$118.69,-0.97,-0.811%,"78,654,629,217"
EQIX,"Equinix, Inc. Common Stock REIT",$799.02,-2.29,-0.286%,"78,452,640,044"
ELVR,Elevra Lithium Limited American Depository Shares,$67.91,0.06,0.088%,"78,390,523,204"
NGG,"National Grid Transco, PLC National Grid PLC (NEW) American Depositary Shares",$78.88,0.80,1.025%,"78,273,332,106"
ECL,Ecolab Inc. Common Stock,$275.65,2.11,0.771%,"78,073,907,749"
CMI,Cummins Inc. Common Stock,$565.18,-2.26,-0.398%,"78,015,329,471"
CTAS,Cintas Corporation Common Stock,$194.23,1.51,0.784%,"77,670,565,943"
GLW,Corning Incorporated Common Stock,$90.21,0.33,0.367%,"77,342,481,323"
RELX,RELX PLC PLC American Depositary Shares (Each representing One Ordinary Share),$41.92,-0.27,-0.64%,"76,461,136,590"
DB,Deutsche Bank AG Common Stock,$39.19,0.06,0.153%,"76,352,030,563"
RCL,Royal Caribbean Cruises Ltd. Common Stock,$279.33,-12.39,-4.247%,"76,176,914,469"
MNST,Monster Beverage Corporation,$77.73,-0.70,-0.893%,"75,943,859,120"
GM,General Motors Company Common Stock,$81.23,-2.01,-2.415%,"75,776,323,643"
ITW,Illinois Tool Works Inc. Common Stock,$258.89,2.13,0.83%,"75,103,989,000"
AON,Aon plc Class A Ordinary Shares (Ireland),$346.00,1.41,0.409%,"74,367,601,690"
SE,"Sea Limited American Depositary Shares, each representing one Class A Ordinary Share",$125.25,-4.61,-3.55%,"74,150,496,734"
WMB,"Williams Companies, Inc. (The) Common Stock",$60.71,0.22,0.364%,"74,140,197,416"
MDLZ,"Mondelez International, Inc. Class A Common Stock",$57.23,1.29,2.306%,"73,847,216,497"
FDX,FedEx Corporation Common Stock,$313.55,3.89,1.256%,"73,722,758,957"
WDC,Western Digital Corporation Common Stock,$215.00,1.00,0.467%,"73,508,345,415"
EQNR,Equinor ASA,$24.95,0.44,1.795%,"73,471,091,943"
CI,The Cigna Group Common Stock,$271.00,-0.81,-0.298%,"72,391,096,136"
CNQ,Canadian Natural Resources Limited Common Stock,$34.62,1.47,4.434%,"72,117,164,340"
WBD,"Warner Bros. Discovery, Inc. Series A Common Stock ",$28.63,-0.23,-0.797%,"70,944,410,193"
SNOW,Snowflake Inc. Common Stock,$206.16,-3.23,-1.543%,"70,547,952,000"
EPD,Enterprise Products Partners L.P. Common Stock,$32.49,0.13,0.402%,"70,286,300,915"
SLB,SLB Limited Common Shares,$46.97,1.07,2.331%,"70,169,593,136"
TEL,TE Connectivity plc Ordinary Shares,$237.30,0.70,0.296%,"69,811,108,076"
HLT,Hilton Worldwide Holdings Inc. Common Stock ,$300.13,-0.49,-0.163%,"69,760,766,372"
COIN,"Coinbase Global, Inc. Class A Common Stock",$255.86,3.17,1.255%,"68,991,066,250"
MRVL,"Marvell Technology, Inc. Common Stock",$81.21,-1.84,-2.216%,"68,874,201,000"
JCI,Johnson Controls International plc Ordinary Share,$112.13,0.04,0.036%,"68,526,640,995"
NWG,"NatWest Group plc American Depositary Shares, (each representing two (2) Ordinary Shares)",$17.08,0.12,0.708%,"68,422,940,289"
CL,Colgate-Palmolive Company Common Stock,$84.55,1.59,1.917%,"68,152,790,846"
COR,"Cencora, Inc. Common Stock",$349.93,4.05,1.171%,"67,884,125,859"
CSX,CSX Corporation Common Stock,$36.18,0.55,1.544%,"67,372,115,068"
STX,Seagate Technology Holdings PLC Ordinary Shares (Ireland),$312.28,-6.16,-1.934%,"66,689,927,528"
AJG,Arthur J. Gallagher & Co. Common Stock,$256.98,-0.02,-0.008%,"65,992,464,000"
NET,"Cloudflare, Inc. Class A Common Stock",$188.39,-0.32,-0.17%,"65,989,468,674"
VRT,"Vertiv Holdings, LLC Class A Common Stock",$170.86,-1.86,-1.077%,"65,326,324,159"
RSG,"Republic Services, Inc. Common Stock",$210.98,1.33,0.634%,"65,311,728,117"
PWR,"Quanta Services, Inc. Common Stock",$437.07,-7.13,-1.605%,"65,174,080,731"
CP,Canadian Pacific Kansas City Limited Common Shares,$72.07,1.42,2.01%,"64,922,908,043"
MSI,"Motorola Solutions, Inc. Common Stock",$389.23,-1.77,-0.453%,"64,828,201,872"
NSC,Norfolk Southern Corporation Common Stock,$286.37,-1.83,-0.635%,"64,257,595,510"
LHX,"L3Harris Technologies, Inc. Common Stock",$342.85,1.61,0.472%,"64,131,068,594"
E,ENI S.p.A. Common Stock,$39.01,0.57,1.483%,"64,063,987,710"
RKT,"Rocket Companies, Inc. Class A Common Stock",$22.67,-0.09,-0.395%,"63,836,226,572"
TFC,Truist Financial Corporation Common Stock,$49.83,0.14,0.282%,"63,744,843,677"
AEP,"American Electric Power Company, Inc. Common Stock",$118.11,1.49,1.278%,"63,081,904,938"
MFC,Manulife Financial Corporation Common Stock,$37.33,0.54,1.468%,"62,900,555,751"
PCAR,PACCAR Inc. Common Stock,$119.00,-0.43,-0.36%,"62,499,318,721"
AMX,"America Movil, S.A.B. de C.V. American Depositary Shares (each representing the right to receive twenty (20) Series B Shares",$20.54,0.08,0.391%,"62,379,980,000"
VALE,VALE S.A.  American Depositary Shares Each Representing one common share,$14.61,0.50,3.544%,"62,366,858,078"
ROST,"Ross Stores, Inc. Common Stock",$191.83,-1.40,-0.725%,"62,046,440,538"
EOG,"EOG Resources, Inc. Common Stock",$110.74,2.70,2.499%,"62,016,891,096"
KMI,"Kinder Morgan, Inc. Common Stock",$27.53,0.15,0.548%,"61,247,653,537"
TRV,"The Travelers Companies, Inc. Common Stock",$272.74,1.54,0.568%,"60,838,316,353"
SPG,"Simon Property Group, Inc. Common Stock",$185.72,1.34,0.727%,"60,632,019,543"
NXPI,NXP Semiconductors N.V. Common Stock,$240.81,1.72,0.719%,"60,605,729,362"
WPM,Wheaton Precious Metals Corp Common Shares (Canada),$133.14,2.34,1.789%,"60,448,454,064"
CNI,Canadian National Railway Company Common Stock,$97.65,0.29,0.298%,"60,103,575,000"
ET,Energy Transfer LP Common Units ,$17.50,0.10,0.575%,"60,084,269,945"
SU,Suncor Energy  Inc. Common Stock,$49.65,1.52,3.158%,"59,642,891,010"
SRE,DBA Sempra Common Stock,$91.32,1.03,1.141%,"59,602,876,498"
APD,"Air Products and Chemicals, Inc. Common Stock",$267.25,1.07,0.402%,"59,487,241,907"
BDX,"Becton, Dickinson and Company Common Stock",$207.42,5.90,2.928%,"59,201,515,848"
URI,"United Rentals, Inc. Common Stock",$917.34,-22.83,-2.428%,"58,370,479,049"
RBLX,Roblox Corporation Class A Common Stock,$82.87,-1.93,-2.276%,"58,168,566,848"
AFL,AFLAC Incorporated Common Stock,$110.18,2.22,2.056%,"57,746,871,375"
AZO,"AutoZone, Inc. Common Stock","$3,472.66",-33.09,-0.944%,"57,534,409,274"
MDLN,Medline Inc. Class A Common Stock,$43.41,0.56,1.307%,"57,532,818,266"
VST,Vistra Corp. Common Stock,$168.97,-2.45,-1.429%,"57,251,343,045"
BRKRP,"Bruker Corporation 6.375% Mandatory Convertible Preferred Stock, Series A",$376.62,-9.89,-2.559%,"57,224,073,653"
NDAQ,"Nasdaq, Inc. Common Stock",$100.07,1.18,1.193%,"57,139,512,980"
PSX,Phillips 66 Common Stock,$141.39,3.69,2.68%,"56,969,019,278"
TRP,TC Energy Corporation Common Stock,$54.68,0.30,0.552%,"56,921,880,000"
VLO,Valero Energy Corporation Common Stock,$186.51,4.77,2.625%,"56,887,329,119"
SNDK,Sandisk Corporation Common Stock,$387.81,-2.00,-0.513%,"56,834,788,348"
FTNT,"Fortinet, Inc. Common Stock",$76.39,-1.94,-2.477%,"56,807,278,512"
IDXX,"IDEXX Laboratories, Inc. Common Stock",$710.48,-3.56,-0.499%,"56,732,772,938"
TRI,Thomson Reuters Corporation Common Shares,$127.27,0.74,0.585%,"56,615,103,320"
MPLX,MPLX LP Common Units Representing Limited Partner Interests,$55.46,0.69,1.26%,"56,406,433,330"
ARES,Ares Management Corporation Class A Common Stock,$169.92,0.71,0.42%,"55,541,599,851"
O,Realty Income Corporation Common Stock,$60.31,1.08,1.823%,"55,479,516,687"
ZTS,Zoetis Inc. Class A Common Stock,$125.84,1.22,0.979%,"55,456,834,050"
ADSK,"Autodesk, Inc. Common Stock",$261.28,-9.35,-3.455%,"55,391,360,000"
SOMN,Southern Company (The) 2025 Series A Corporate Units,$50.27,0.45,0.903%,"55,352,540,458"
F,Ford Motor Company Common Stock,$13.84,-0.14,-1.001%,"55,145,460,153"
DLR,"Digital Realty Trust, Inc. Common Stock",$159.26,-1.45,-0.902%,"54,706,057,172"
MPC,Marathon Petroleum Corporation Common Stock,$181.09,5.24,2.98%,"54,436,102,922"
PYPL,"PayPal Holdings, Inc. Common Stock",$57.66,1.10,1.945%,"53,949,691,610"
CMG,"Chipotle Mexican Grill, Inc. Common Stock",$40.59,1.18,2.994%,"53,671,264,020"
TAK,Takeda Pharmaceutical Company Limited American Depositary Shares (each representing 1/2 of a share of Common Stock),$16.47,0.46,2.873%,"51,836,019,339"
MET,"MetLife, Inc. Common Stock",$78.65,1.57,2.037%,"51,821,828,744"
BIDU,"Baidu, Inc. ADS",$150.50,1.15,0.77%,"51,737,519,848"
MSTR,Strategy Inc Common Stock Class A,$179.33,6.34,3.665%,"51,531,145,298"
D,"Dominion Energy, Inc. Common Stock",$60.25,1.23,2.084%,"51,448,274,939"
ALL,Allstate Corporation (The) Common Stock,$196.02,-1.63,-0.825%,"51,294,848,402"
WDAY,"Workday, Inc. Class A Common Stock",$193.99,-5.56,-2.786%,"51,019,370,000"
EA,Electronic Arts Inc. Common Stock,$204.20,-0.13,-0.064%,"50,928,411,560"
DEO,Diageo plc Common Stock,$91.37,1.44,1.601%,"50,856,829,359"
CAH,"Cardinal Health, Inc. Common Stock",$213.56,5.30,2.545%,"50,740,797,170"
PSA,Public Storage Common Stock,$287.77,7.94,2.837%,"50,492,991,539"
AU,AngloGold Ashanti PLC Ordinary Shares,$99.51,1.85,1.894%,"50,105,976,945"
GWW,"W.W. Grainger, Inc. Common Stock","$1,053.25",11.35,1.089%,"50,081,339,195"
TGT,Target Corporation Common Stock,$109.82,1.19,1.095%,"49,727,200,825"
AXON,"Axon Enterprise, Inc. Common Stock",$629.22,-12.29,-1.916%,"49,652,043,417"
FERG,Ferguson Enterprises Inc. Common Stock,$246.10,3.00,1.234%,"49,564,307,928"
BKR,Baker Hughes Company Class A Common Stock,$49.98,1.01,2.062%,"49,318,958,622"
IMO,Imperial Oil Limited Common Stock,$98.89,2.84,2.957%,"49,198,665,010"
HEI,Heico Corporation Common Stock,$352.29,-0.01,-0.003%,"49,093,923,579"
CBRE,CBRE Group Inc Common Stock Class A,$164.90,0.19,0.115%,"49,073,085,205"
RKLB,Rocket Lab Corporation Common Stock,$91.80,5.22,6.029%,"49,035,551,369"
ARGX,argenx SE American Depositary Shares,$799.33,-11.18,-1.379%,"48,751,821,726"
