Symbol,Name,Last Sale,Net Change,% Change,Market Cap
VTMX,"Corporacion Inmobiliaria Vesta, S.A.B de C.V. American Depositary Shares, each representing ten (10) Common Shares",$31.82,0.50,1.596%,"2,814,435,852"
TPH,"Tri Pointe Homes, Inc. Common Stock",$32.70,-0.34,-1.029%,"2,810,679,352"
HIW,"Highwoods Properties, Inc. Common Stock",$25.56,-0.08,-0.312%,"2,808,889,158"
ATHM,"Autohome Inc. American Depositary Shares, each representing four class A ordinary shares.",$23.65,0.06,0.254%,"2,801,194,333"
SXI,Standex International Corporation Common Stock,$231.06,-4.03,-1.714%,"2,799,753,789"
GRBK,"Green Brick Partners, Inc. Common Stock",$64.23,-0.24,-0.372%,"2,798,186,245"
LCII,LCI Industries,$115.48,0.20,0.173%,"2,794,386,195"
BKV,BKV Corporation Common Stock,$29.07,1.01,3.599%,"2,789,850,109"
AWR,American States Water Company Common Stock,$71.86,0.06,0.084%,"2,782,018,652"
AAP,Advance Auto Parts Inc.,$46.31,-4.77,-9.338%,"2,779,630,166"
WOR,"Worthington Enterprises, Inc. Common Shares",$55.89,0.71,1.287%,"2,775,779,980"
CPRX,"Catalyst Pharmaceuticals, Inc. Common Stock",$22.55,-0.61,-2.634%,"2,771,674,327"
AVNT,Avient Corporation Common Stock,$30.25,0.27,0.901%,"2,769,799,747"
ACLS,"Axcelis Technologies, Inc. Common Stock",$88.95,-2.19,-2.403%,"2,757,372,880"
CBZ,"CBIZ, Inc. Common Stock",$50.66,-0.39,-0.764%,"2,755,976,140"
DBRG,"DigitalBridge Group, Inc.",$15.08,0.08,0.533%,"2,754,730,329"
FTAIM,FTAI Aviation Ltd. 9.500% Fixed-Rate Reset Series D Cumulative Perpetual Redeemable Preferred Shares,$26.81,0.0926,0.347%,"2,749,980,119"
APLE,"Apple Hospitality REIT, Inc. Common Shares",$11.62,0.16,1.396%,"2,749,009,541"
RNW,ReNew Energy Global plc Class A Ordinary Shares,$7.57,0.01,0.132%,"2,746,162,420"
OII,"Oceaneering International, Inc. Common Stock",$27.51,0.47,1.738%,"2,744,816,055"
NATL,NCR Atleos Corporation Common Stock,$37.12,0.52,1.421%,"2,743,321,528"
NUVB,Nuvation Bio Inc. Class A Common Stock,$8.00,-0.58,-6.76%,"2,742,667,464"
UPWK,Upwork Inc. Common Stock,$20.98,1.10,5.533%,"2,741,139,445"
GSHD,"Goosehead Insurance, Inc. Class A Common Stock",$74.30,0.48,0.65%,"2,737,529,261"
ABM,ABM Industries Incorporated Common Stock,$44.66,0.40,0.904%,"2,734,705,751"
STNG,Scorpio Tankers Inc. Common Shares,$54.73,-0.84,-1.512%,"2,731,932,344"
NAMSW,NewAmsterdam Pharma Company N.V. Warrant,$24.09,-1.655,-6.428%,"2,731,584,468"
AAUC,Allied Gold Corporation Common Shares,$22.00,0.37,1.711%,"2,728,000,000"
SFNC,Simmons First National Corporation Class A Common Stock,$18.85,-0.02,-0.106%,"2,727,926,779"
VC,Visteon Corporation Common Stock,$99.91,0.15,0.15%,"2,726,136,467"
LRN,"Stride, Inc. Common Stock",$61.96,0.45,0.732%,"2,717,480,529"
REVG,"REV Group, Inc. Common Stock",$55.65,-0.13,-0.233%,"2,715,627,231"
TR,"Tootsie Roll Industries, Inc. Common Stock",$37.17,-0.06,-0.161%,"2,712,913,037"
RCUS,"Arcus Biosciences, Inc. Common Stock",$25.07,-0.73,-2.829%,"2,706,896,548"
RHI,Robert Half Inc. Common Stock,$26.66,-0.06,-0.225%,"2,697,629,184"
CGAU,Centerra Gold Inc. Common Shares,$13.37,0.29,2.217%,"2,697,144,566"
NMFCZ,New Mountain Finance Corporation 8.250% Notes due 2028,$25.33,0.02,0.079%,"2,694,123,142"
BOH,Bank of Hawaii Corporation Common Stock,$67.65,0.24,0.356%,"2,691,461,474"
WBI,WaterBridge Infrastructure LLC Class A Shares Representing Limited Liability Company Interests,$21.80,0.05,0.23%,"2,691,319,000"
BEAM,Beam Therapeutics Inc. Common Stock,$26.48,-0.62,-2.288%,"2,687,056,517"
CVBF,CVB Financial Corporation Common Stock,$19.64,0.03,0.153%,"2,686,930,096"
SLNO,"Soleno Therapeutics, Inc. Common Stock",$50.01,-1.17,-2.286%,"2,686,038,350"
MRX,Marex Group plc Ordinary Shares,$38.19,0.56,1.488%,"2,684,408,936"
BATRA,"Atlanta Braves Holdings, Inc. Series A Common Stock",$42.63,0.43,1.019%,"2,682,421,132"
TNET,"TriNet Group, Inc. Common Stock",$55.77,-0.59,-1.047%,"2,678,653,233"
BCC,"Boise Cascade, L.L.C. Common Stock",$72.00,0.19,0.265%,"2,667,101,256"
ATS,ATS Corporation Common Shares,$27.13,-0.02,-0.074%,"2,660,254,641"
AERO,"Grupo Aeromexico, S.A.B. de C.V. American Depositary Shares (each representing ten (10) Common Shares)",$18.23,0.48,2.704%,"2,659,819,146"
MANU,Manchester United Ltd. Class A Ordinary Shares,$15.41,-0.15,-0.964%,"2,657,128,717"
HSAI,"Hesai Group American Depositary Share, each ADS represents one Class B ordinary share",$20.03,-0.05,-0.249%,"2,653,327,310"
PFS,"Provident Financial Services, Inc Common Stock",$20.21,0.20,1.00%,"2,639,878,381"
FBYD,"Falcon's Beyond Global, Inc. Class A Common Stock",$18.70,-0.89,-4.543%,"2,636,958,771"
VIA,"Via Transportation, Inc. Class A Common Stock",$32.54,1.56,5.036%,"2,635,441,283"
BWIN,"The Baldwin Insurance Group, Inc. Class A Common Stock",$22.21,-0.57,-2.502%,"2,635,179,209"
DYN,"Dyne Therapeutics, Inc. Common Stock",$18.44,-3.76,-16.937%,"2,633,687,228"
ASH,Ashland Inc. Common Stock,$57.60,0.10,0.174%,"2,633,363,309"
DRD,DRDGOLD Limited American Depositary Shares,$30.45,1.20,4.103%,"2,632,672,622"
NSIT,"Insight Enterprises, Inc. Common Stock",$84.94,1.15,1.372%,"2,631,406,969"
DAVE,Dave Inc. Class A Common Stock,$194.69,-7.72,-3.814%,"2,629,109,725"
RNG,"RingCentral, Inc. Class A Common Stock",$30.36,0.77,2.602%,"2,628,104,747"
KSS,Kohl's Corporation Common Stock,$23.41,0.71,3.128%,"2,626,348,961"
IPAR,"Interparfums, Inc. Common Stock",$81.80,0.52,0.64%,"2,622,894,750"
DXC,DXC Technology Company Common Stock ,$15.04,0.68,4.735%,"2,618,974,563"
ALRM,"Alarm.com Holdings, Inc. Common Stock",$52.48,0.19,0.363%,"2,617,685,606"
AAPG,Ascentage Pharma Group International American Depository Shares,$30.06,-1.25,-3.992%,"2,617,223,349"
SYRE,"Spyre Therapeutics, Inc. Common Stock",$33.68,-0.95,-2.743%,"2,613,302,938"
EXK,Endeavour Silver Corporation Ordinary Shares (Canada),$8.86,0.38,4.481%,"2,606,412,641"
AKR,Acadia Realty Trust Common Stock,$19.88,0.27,1.377%,"2,604,968,325"
SUPN,"Supernus Pharmaceuticals, Inc. Common Stock",$45.42,-1.74,-3.69%,"2,604,353,277"
BB,BlackBerry Limited Common Stock,$4.41,UNCH,--,"2,603,492,380"
FTAIN,FTAI Aviation Ltd. 8.25% Fixed - Rate Reset Series C Cumulative Perpetual Redeemable Preferred Shares,$25.29,-0.09,-0.355%,"2,594,069,273"
QFIN,"Qfin Holdings, Inc. American Depositary Shares",$19.26,-0.03,-0.156%,"2,592,396,000"
FORTY,Formula Systems (1985) Ltd. American Depositary Shares,$168.90,UNCH,--,"2,587,153,956"
HOG,"Harley-Davidson, Inc. Common Stock",$21.87,-0.64,-2.843%,"2,583,762,544"
WDFC,WD-40 Company Common Stock,$190.76,3.24,1.728%,"2,580,569,805"
ZGN,Ermenegildo Zegna N.V. Ordinary Shares,$10.21,-0.31,-2.947%,"2,578,840,565"
GENI,Genius Sports Limited Ordinary Shares,$10.75,0.06,0.561%,"2,578,038,200"
MFAO,"MFA Financial, Inc. 9.000% Senior Notes due 2029",$25.08,-0.08,-0.318%,"2,574,931,046"
TOWN,TowneBank Common Stock,$34.39,0.07,0.204%,"2,566,089,979"
KLIC,"Kulicke and Soffa Industries, Inc. Common Stock",$49.00,0.47,0.968%,"2,565,787,000"
MFAN,"MFA Financial, Inc. 8.875% Senior Notes due 2029",$24.98,-0.09,-0.359%,"2,564,664,176"
FFBC,First Financial Bancorp. Common Stock,$26.02,-0.10,-0.383%,"2,563,742,638"
VNET,"VNET Group, Inc. American Depositary Shares",$9.52,0.19,2.036%,"2,561,126,578"
PRK,Park National Corporation Common Stock,$159.06,0.11,0.069%,"2,557,408,354"
CEPU,Central Puerto S.A. American Depositary Shares (each represents ten Common Shares),$16.85,0.03,0.178%,"2,551,127,508"
CIVI,"Civitas Resources, Inc. Common Stock",$29.83,0.33,1.119%,"2,544,593,830"
CMPO,"CompoSecure, Inc. Class A Common Stock",$20.31,-0.05,-0.246%,"2,542,717,883"
ERO,Ero Copper Corp. Common Shares,$24.42,0.08,0.329%,"2,537,000,003"
WRD,WeRide Inc. American Depositary Shares,$8.91,-0.33,-3.571%,"2,535,152,544"
HUBG,"Hub Group, Inc. Class A Common Stock",$41.40,0.22,0.534%,"2,531,755,314"
DAN,Dana Incorporated Common Stock ,$21.64,0.36,1.692%,"2,528,360,600"
MGRC,McGrath RentCorp Common Stock,$102.72,0.62,0.607%,"2,528,109,407"
OXLC,Oxford Lane Capital Corp. Common Stock,$14.55,-0.04,-0.274%,"2,525,880,000"
CWT,California Water Service Group Common Stock,$42.31,-1.29,-2.959%,"2,521,309,638"
LFST,"LifeStance Health Group, Inc. Common Stock",$6.48,0.07,1.092%,"2,520,721,821"
BHC,Bausch Health Companies Inc. Common Stock,$6.80,-0.02,-0.293%,"2,519,515,097"
BKD,Brookdale Senior Living Inc. Common Stock,$10.58,-0.11,-1.029%,"2,514,394,047"
CRGY,Crescent Energy Company Class A Common Stock,$9.86,-0.05,-0.505%,"2,510,667,487"
ITGR,Integer Holdings Corporation Common Stock,$71.60,2.47,3.573%,"2,508,751,302"
IHS,IHS Holding Limited Ordinary Shares,$7.52,0.04,0.535%,"2,507,475,846"
MSGE,Madison Square Garden Entertainment Corp. Class A Common Stock,$52.97,0.70,1.339%,"2,501,863,520"
PAX,Patria Investments Limited Class A Common Shares,$15.75,0.23,1.482%,"2,489,687,424"
SPNT,SiriusPoint Ltd. Common Shares,$21.31,-0.31,-1.434%,"2,489,319,978"
BWNB,"Babcock & Wilcox Enterprises, Inc. 6.50% Senior Notes due 2026",$24.60,-0.05,-0.203%,"2,486,999,533"
CON,"Concentra Group Holdings Parent, Inc. Common Stock",$19.40,0.12,0.622%,"2,486,501,919"
RXRX,"Recursion Pharmaceuticals, Inc. Class A Common Stock",$4.77,-0.05,-1.037%,"2,479,625,280"
GRND,Grindr Inc. Common Stock,$13.42,-0.09,-0.666%,"2,479,131,904"
ODD,ODDITY Tech Ltd. Class A Ordinary Shares,$44.35,1.38,3.212%,"2,475,984,706"
WSBCO,"WesBanco, Inc. Depositary Shares each representing 1/40th interest in a share of 7.375% Fixed-Rate Reset Non-Cumulative Perpetual Preferred Stock, Series B",$25.75,UNCH,--,"2,473,167,685"
MBLY,Mobileye Global Inc. Class A Common Stock,$11.44,0.13,1.149%,"2,471,107,931"
EWTX,"Edgewise Therapeutics, Inc. Common Stock",$23.34,-0.22,-0.934%,"2,470,969,250"
SII,Sprott Inc. Common Shares,$95.42,2.96,3.201%,"2,461,836,000"
DNN,Denison Mines Corp Ordinary Shares (Canada),$2.74,0.01,0.366%,"2,458,576,082"
WAFD,"WaFd, Inc. Common Stock",$31.99,-0.28,-0.868%,"2,453,665,054"
BATRK,"Atlanta Braves Holdings, Inc. Series C Common Stock",$38.97,0.32,0.828%,"2,452,121,780"
CHEF,"The Chefs' Warehouse, Inc. Common Stock",$60.26,1.17,1.98%,"2,451,711,183"
INSW,"International Seaways, Inc. Common Stock ",$49.52,-2.09,-4.05%,"2,446,017,175"
WB,Weibo Corporation American Depositary Share,$9.99,-0.25,-2.441%,"2,445,804,547"
GDV,Gabelli Dividend & Income Trust Common Shares of Beneficial Interest,$27.10,-0.09,-0.331%,"2,444,108,106"
FCPT,"Four Corners Property Trust, Inc. Common Stock",$23.00,0.11,0.481%,"2,439,886,299"
CURB,Curbline Properties Corp. Common Stock,$23.08,0.07,0.304%,"2,431,896,210"
DKL,"Delek Logistics Partners, L.P. Common Units representing Limited Partner Interests",$45.45,-0.28,-0.612%,"2,430,684,225"
SPNS,Sapiens International Corporation N.V. Common Shares (Cayman Islands),$43.42,0.14,0.323%,"2,426,623,310"
DRVN,Driven Brands Holdings Inc. Common Stock,$14.71,-0.27,-1.802%,"2,419,121,547"
EXTR,"Extreme Networks, Inc. Common Stock",$18.06,-0.09,-0.496%,"2,414,955,731"
TGLS,Tecnoglass Inc. Ordinary Shares,$51.65,0.53,1.037%,"2,405,311,886"
BTDR,Bitdeer Technologies Group Class A Ordinary Shares,$12.22,0.22,1.833%,"2,404,237,941"
MESO,Mesoblast Limited American Depositary Shares,$18.76,0.65,3.589%,"2,403,469,648"
ACMR,"ACM Research, Inc. Class A Common Stock",$37.04,0.50,1.368%,"2,403,023,745"
GT,The Goodyear Tire & Rubber Company Common Stock,$8.39,-0.15,-1.756%,"2,400,890,027"
PTEN,"Patterson-UTI Energy, Inc. Common Stock",$6.32,0.05,0.797%,"2,396,809,592"
UE,Urban Edge Properties Common Shares of Beneficial Interest,$19.04,0.18,0.954%,"2,396,253,953"
CSTM,Constellium SE Ordinary Shares (France),$17.38,-0.12,-0.686%,"2,394,994,919"
ZIM,ZIM Integrated Shipping Services Ltd. Ordinary Shares,$19.87,-0.21,-1.046%,"2,393,490,724"
HCM,HUTCHMED (China) Limited American Depositary Shares,$13.72,-0.32,-2.279%,"2,393,233,574"
CUBI,"Customers Bancorp, Inc Common Stock",$69.90,-1.07,-1.508%,"2,388,348,582"
DIOD,Diodes Incorporated Common Stock,$51.40,-0.90,-1.721%,"2,384,206,013"
RXO,"RXO, Inc. Common Stock",$14.51,0.39,2.762%,"2,381,263,263"
NOG,"Northern Oil and Gas, Inc. Common Stock",$24.36,0.23,0.953%,"2,377,608,544"
FA,First Advantage Corporation Common Stock,$13.64,-0.02,-0.146%,"2,374,928,027"
BTE,Baytex Energy Corp Common Shares,$3.09,-0.08,-2.524%,"2,374,099,530"
CNXC,Concentrix Corporation Common Stock,$38.11,-0.10,-0.262%,"2,372,631,000"
PLUS,ePlus inc. Common Stock,$89.62,0.34,0.381%,"2,369,452,067"
SEZL,Sezzle Inc. Common Stock,$69.31,1.61,2.378%,"2,367,151,500"
CAKE,Cheesecake Factory Incorporated (The) Common Stock,$47.47,0.65,1.388%,"2,365,985,024"
MFICL,MidCap Financial Investment Corporation 8.00% Notes due 2028,$25.2807,0.1457,0.58%,"2,358,780,877"
TRMK,Trustmark Corporation Common Stock,$39.25,0.14,0.358%,"2,353,361,509"
DBD,Diebold Nixdorf Incorporated Common stock,$65.60,0.22,0.336%,"2,352,885,434"
SBLK,Star Bulk Carriers Corp. Common Shares,$19.94,-0.10,-0.499%,"2,335,522,968"
KMPR,Kemper Corporation,$39.85,0.90,2.311%,"2,333,092,371"
ALKT,"Alkami Technology, Inc. Common Stock",$22.15,0.80,3.747%,"2,325,838,844"
OLN,Olin Corporation Common Stock,$20.36,0.26,1.294%,"2,323,514,330"
SRPT,"Sarepta Therapeutics, Inc. Common Stock (DE)",$22.17,0.31,1.418%,"2,323,131,936"
USAR,"USA Rare Earth, Inc. Class A Common Stock",$17.51,0.39,2.278%,"2,322,501,203"
AMBP,Ardagh Metal Packaging S.A. Ordinary Shares,$3.88,0.01,0.258%,"2,319,074,394"
GEO,Geo Group Inc (The) REIT,$16.65,-0.13,-0.775%,"2,317,634,196"
KWR,Quaker Houghton Common Stock,$133.59,1.14,0.861%,"2,316,455,276"
SONO,"Sonos, Inc. Common Stock",$19.16,0.13,0.683%,"2,303,810,873"
AMR,"Alpha Metallurgical Resources, Inc. Common Stock",$178.86,4.56,2.616%,"2,299,786,173"
ADAMI,"Adamas Trust, Inc. 9.125% Senior Notes Due 2029",$25.34,UNCH,--,"2,295,283,238"
HTFL,"Heartflow, Inc. Common Stock",$26.87,-1.08,-3.864%,"2,288,214,780"
EYE,"National Vision Holdings, Inc. Common Stock",$28.83,0.58,2.053%,"2,286,494,557"
CLVT,Clarivate Plc Ordinary Shares,$3.45,-0.26,-7.008%,"2,281,950,988"
SBET,"SharpLink Gaming, Inc. Common Stock",$11.60,0.54,4.882%,"2,281,641,016"
LU,"Lufax Holding Ltd American Depositary Shares, each representing two (2) Ordinary Shares",$2.63,-0.02,-0.755%,"2,279,263,200"
SM,SM Energy Company Common Stock,$19.89,0.22,1.118%,"2,278,482,879"
CTRI,"Centuri Holdings, Inc. Common Stock",$25.69,-0.16,-0.619%,"2,277,396,766"
ADPT,Adaptive Biotechnologies Corporation Common Stock,$14.86,-0.09,-0.602%,"2,268,604,694"
PMTU,PennyMac Mortgage Investment Trust 8.50% Senior Notes due 2028,$26.00,0.1999,0.775%,"2,262,431,704"
XNET,Xunlei Limited American Depositary Shares,$7.25,0.10,1.399%,"2,260,987,400"
TXG,"10x Genomics, Inc. Class A Common Stock",$17.84,0.37,2.118%,"2,257,706,430"
CSAN,Cosan S.A. ADS,$4.85,-0.08,-1.623%,"2,253,607,053"
BUSEP,"First Busey Corporation Depositary Shares, Each Representing a 1/40thInterest in a Share of 8.25% Fixed-Rate Series B Non-Cumulative Perpetual Preferred Stock, $0.001 par value",$25.48,-0.02,-0.078%,"2,252,662,416"
SLDE,"Slide Insurance Holdings, Inc. Common Stock",$18.12,1.55,9.354%,"2,252,131,158"
SGRY,"Surgery Partners, Inc. Common Stock",$17.41,0.69,4.127%,"2,251,840,372"
DQ,"DAQO New Energy Corp. American Depositary Shares, each representing five ordinary shares",$33.58,0.99,3.038%,"2,251,764,490"
HCI,"HCI Group, Inc. Common Stock",$173.66,3.76,2.213%,"2,250,640,025"
NSA,National Storage Affiliates Trust Common Shares of Beneficial Interest,$29.21,-0.32,-1.084%,"2,248,024,004"
ADAMM,"Adamas Trust, Inc. 7.875% Series E Fixed-to-Floating Rate Cumulative Redeemable Preferred Stock",$24.88,UNCH,--,"2,246,857,467"
CMBT,CMB.TECH NV Ordinary Shares,$10.21,-0.56,-5.20%,"2,246,452,320"
HI,Hillenbrand Inc Common Stock,$31.82,-0.08,-0.251%,"2,243,526,981"
FLO,"Flowers Foods, Inc. Common Stock",$10.59,-0.12,-1.12%,"2,236,377,403"
HRMY,"Harmony Biosciences Holdings, Inc. Common Stock",$38.82,-0.10,-0.257%,"2,235,890,618"
SAH,"Sonic Automotive, Inc. Common Stock",$65.29,1.51,2.368%,"2,231,134,538"
IE,Ivanhoe Electric Inc. Common Stock,$15.41,0.63,4.263%,"2,230,054,714"
TRN,"Trinity Industries, Inc. Common Stock",$27.79,0.32,1.165%,"2,228,216,734"
MGNI,"Magnite, Inc. Common Stock",$15.51,0.60,4.024%,"2,227,978,448"
IVT,InvenTrust Properties Corp. Common Stock,$28.60,0.51,1.816%,"2,219,914,268"
XRAY,DENTSPLY SIRONA Inc. Common Stock,$11.11,0.01,0.09%,"2,217,022,376"
WSHP,WeShop Holdings Limited Class A Ordinary Shares,$95.21,-24.79,-20.658%,"2,216,989,319"
LION,Lionsgate Studios Corp Common Shares,$7.65,0.29,3.94%,"2,216,429,252"
LC,LendingClub Corporation Common Stock,$19.21,0.08,0.418%,"2,214,940,662"
SID,Companhia Siderurgica Nacional S.A. Common Stock,$1.67,0.06,3.727%,"2,214,576,891"
NBTB,NBT Bancorp Inc. Common Stock,$42.30,0.02,0.047%,"2,212,932,664"
AI,"C3.ai, Inc. Class A Common Stock",$16.03,0.57,3.687%,"2,209,730,627"
NN,NextNav Inc. Common Stock,$16.36,0.25,1.552%,"2,205,803,880"
BANR,Banner Corporation Common Stock,$64.45,0.01,0.016%,"2,196,838,189"
IBRX,"ImmunityBio, Inc. Common Stock",$2.22,-0.04,-1.77%,"2,186,622,697"
CSGS,"CSG Systems International, Inc. Common Stock",$76.46,0.12,0.157%,"2,180,652,733"
OI,"O-I Glass, Inc. Common Stock",$14.16,0.03,0.212%,"2,174,898,262"
PARR,"Par Pacific Holdings, Inc.  Common Stock",$43.09,-0.04,-0.093%,"2,167,041,043"
MENS,Jyong Biotech Ltd. Ordinary Shares,$28.50,-0.51,-1.758%,"2,166,788,510"
GCMG,GCM Grosvenor Inc. Class A Common Stock,$11.14,0.21,1.921%,"2,163,348,230"
SFB,Stifel Financial Corporation 5.20% Senior Notes due 2047,$21.16,0.05,0.237%,"2,161,989,271"
SOUNW,"SoundHound AI, Inc. Warrant",$5.1399,-0.1051,-2.004%,"2,159,250,716"
BBT,Beacon Financial Corporation Common stock,$25.73,0.27,1.06%,"2,158,974,994"
DK,"Delek US Holdings, Inc. Common Stock",$35.94,0.31,0.87%,"2,158,252,815"
TIC,"TIC Solutions, Inc. Common Stock",$9.73,0.24,2.529%,"2,146,046,007"
FRME,First Merchants Corporation Common Stock,$37.09,-0.14,-0.376%,"2,144,729,992"
BUSE,First Busey Corporation Class A Common Stock,$24.24,-0.05,-0.206%,"2,143,035,202"
ATKR,Atkore Inc. Common Stock,$63.41,-0.36,-0.565%,"2,140,118,317"
PHIN,PHINIA Inc. Common Stock,$55.57,1.45,2.679%,"2,136,259,394"
PGNY,"Progyny, Inc. Common Stock",$24.72,0.02,0.081%,"2,131,152,087"
PK,Park Hotels & Resorts Inc. Common Stock ,$10.66,0.40,3.899%,"2,130,915,643"
TSLX,"Sixth Street Specialty Lending, Inc. Common Stock",$22.55,0.22,0.985%,"2,130,838,009"
WD,"Walker & Dunlop, Inc Common Stock",$62.34,-0.57,-0.906%,"2,123,564,223"
FBNC,First Bancorp Common Stock,$51.20,UNCH,--,"2,123,024,845"
NTB,Bank of N.T. Butterfield & Son Limited (The) Voting Ordinary Shares,$49.34,0.35,0.714%,"2,121,620,000"
MQ,"Marqeta, Inc. Class A Common Stock",$4.82,0.12,2.553%,"2,121,278,371"
BELFB,Bel Fuse Inc. Class B Common Stock,$167.43,-4.78,-2.776%,"2,119,758,063"
KMT,Kennametal Inc. Common Stock,$27.81,0.01,0.036%,"2,116,150,112"
HTH,Hilltop Holdings Inc.,$34.49,-0.14,-0.404%,"2,115,221,241"
MTRN,Materion Corporation,$124.51,1.27,1.031%,"2,113,914,967"
LUNR,"Intuitive Machines, Inc. Class A Common Stock",$11.66,0.03,0.258%,"2,101,354,100"
UNFI,"United Natural Foods, Inc. Common Stock",$34.47,-0.20,-0.577%,"2,100,319,732"
SAM,"Boston Beer Company, Inc. (The) Common Stock",$196.01,0.99,0.508%,"2,089,146,712"
MODG,Topgolf Callaway Brands Corp. Common Stock,$11.35,0.16,1.43%,"2,087,079,280"
GLPG,Galapagos NV American Depositary Shares,$31.63,0.14,0.445%,"2,084,324,356"
VSH,"Vishay Intertechnology, Inc. Common Stock",$15.35,0.07,0.458%,"2,081,281,863"
AVDL,Avadel Pharmaceuticals plc Ordinary Share,$21.31,-0.01,-0.047%,"2,081,063,510"
FIHL,Fidelis Insurance Holdings Limited Common Shares,$18.60,0.47,2.592%,"2,078,984,105"
NHC,National HealthCare Corporation Common Stock,$133.84,1.63,1.233%,"2,076,561,462"
AAOI,"Applied Optoelectronics, Inc. Common Stock",$30.38,2.54,9.124%,"2,074,298,308"
ADUS,Addus HomeCare Corporation Common Stock,$112.195,1.105,0.995%,"2,073,730,590"
HE,"Hawaiian Electric Industries, Inc. Common Stock",$12.00,0.10,0.84%,"2,071,445,712"
ZLAB,Zai Lab Limited American Depositary Shares,$18.70,-0.35,-1.837%,"2,068,103,312"
CIFRW,Cipher Mining Inc. Warrant,$5.23,0.03,0.577%,"2,066,331,442"
ESTA,Establishment Labs Holdings Inc. Common Shares,$71.01,-0.17,-0.239%,"2,063,399,207"
CECO,CECO Environmental Corp. Common Stock,$57.89,1.90,3.393%,"2,063,259,285"
SDRL,Seadrill Limited Common Shares,$33.03,1.52,4.824%,"2,060,218,868"
MNR,Mach Natural Resources LP Common Units representing Limited Partner Interests,$12.22,-0.08,-0.65%,"2,058,126,750"
CENT,Central Garden & Pet Company Common Stock,$32.93,0.11,0.335%,"2,052,616,009"
PAYO,Payoneer Global Inc. Common Stock,$5.75,0.10,1.77%,"2,049,531,748"
ZBIO,"Zenas BioPharma, Inc. Common Stock",$38.175,-1.19,-3.023%,"2,049,202,162"
AORT,"Artivion, Inc. Common Stock",$43.25,-0.82,-1.861%,"2,048,966,112"
AUPH,Aurinia Pharmaceuticals Inc Ordinary Shares,$15.53,-0.15,-0.957%,"2,047,483,881"
IMAX,Imax Corporation Common Stock,$38.05,-0.45,-1.169%,"2,047,049,439"
PGY,Pagaya Technologies Ltd. Class A Ordinary Shares,$24.83,0.06,0.242%,"2,046,565,250"
EFSC,Enterprise Financial Services Corporation Common Stock,$55.28,-0.40,-0.718%,"2,045,963,050"
ADAML,"Adamas Trust, Inc. 6.875% Series F Fixed-to-Floating Rate Cumulative Redeemable Preferred Stock, $0.01 par value per share",$22.5428,-0.0572,-0.253%,"2,035,790,133"
CIMN,Chimera Investment Corporation 9.000% Senior Notes due 2029,$25.26,0.02,0.079%,"2,034,205,381"
UMBFO,"UMB Financial Corporation Depositary Shares Each Representing a 1/400th Interest in a Share of 7.750% Fixed-Rate Reset Non-Cumulative Perpetual Preferred Stock, Series B",$26.75,0.06,0.225%,"2,031,787,155"
STC,Stewart Information Services Corporation Common Stock,$72.44,-0.73,-0.998%,"2,030,073,265"
RVLV,"Revolve Group, Inc. Class A Common Stock",$28.40,2.12,8.067%,"2,025,892,246"
TRMD,TORM plc Class A Common Stock,$20.67,-0.46,-2.177%,"2,021,816,434"
BUR,Burford Capital Limited Ordinary Shares,$9.23,0.24,2.67%,"2,019,630,985"
ADAMN,"Adamas Trust, Inc. 8.00% Series D Fixed-to-Floating Rate Cumulative Redeemable Preferred Stock",$22.357,-0.023,-0.103%,"2,019,010,948"
NGVT,Ingevity Corporation Common Stock ,$56.05,2.07,3.835%,"2,015,783,994"
TALO,"Talos Energy, Inc. Common Stock",$11.85,0.26,2.243%,"2,014,366,948"
POWI,"Power Integrations, Inc. Common Stock",$36.37,-0.87,-2.336%,"2,012,576,212"
DX,"Dynex Capital, Inc. Common Stock",$13.70,-0.22,-1.58%,"2,011,457,907"
DHT,"DHT Holdings, Inc.",$12.52,-0.27,-2.111%,"2,010,185,885"
KN,Knowles Corporation Common Stock,$23.47,0.05,0.213%,"1,998,514,717"
EPAC,Enerpac Tool Group Corp. Common Stock,$37.60,0.35,0.94%,"1,992,106,130"
CXM,"Sprinklr, Inc. Class A Common Stock",$8.06,0.32,4.134%,"1,988,290,256"
OSW,OneSpaWorld Holdings Limited Common Shares,$19.47,-0.48,-2.406%,"1,985,012,858"
HWCPZ,Hancock Whitney Corporation 6.25% Subordinated Notes due 2060,$23.37,-0.03,-0.128%,"1,980,723,836"
SYBT,"Stock Yards Bancorp, Inc. Common Stock",$67.17,-0.17,-0.252%,"1,979,732,174"
ATRC,"AtriCure, Inc. Common Stock",$39.72,0.78,2.003%,"1,974,758,763"
NTCT,"NetScout Systems, Inc. Common Stock",$27.34,0.35,1.297%,"1,973,775,020"
AGM,Federal Agricultural Mortgage Corporation Common Stock,$180.84,6.06,3.467%,"1,972,010,107"
NVTS,Navitas Semiconductor Corporation Common Stock,$9.17,-0.43,-4.479%,"1,970,991,868"
ALG,"Alamo Group, Inc. Common Stock",$162.44,-0.59,-0.362%,"1,968,030,124"
CXW,"CoreCivic, Inc. Common Stock",$18.78,0.20,1.076%,"1,964,099,821"
MAZE,"Maze Therapeutics, Inc. Common Stock",$40.76,-0.70,-1.688%,"1,961,348,537"
DEI,"Douglas Emmett, Inc. Common Stock",$11.70,-0.08,-0.679%,"1,959,306,090"
TPB,"Turning Point Brands, Inc. Common Stock",$102.56,1.09,1.074%,"1,955,896,838"
PRCT,PROCEPT BioRobotics Corporation Common Stock,$35.00,0.97,2.85%,"1,955,750,615"
IQ,"iQIYI, Inc. American Depositary Shares",$2.03,-0.04,-1.932%,"1,954,806,461"
JSM,"Navient Corporation 6% Senior Notes due December 15, 2043",$19.6301,-0.02,-0.102%,"1,951,841,219"
OMCL,"Omnicell, Inc. Common Stock ($0.001 par value)",$43.49,-0.06,-0.138%,"1,951,679,942"
PTRN,Pattern Group Inc. Series A Common Stock,$12.63,-0.22,-1.712%,"1,951,618,076"
VCEL,Vericel Corporation Common Stock,$38.38,1.08,2.895%,"1,941,031,118"
VECO,Veeco Instruments Inc. Common Stock,$32.26,0.12,0.373%,"1,940,842,573"
ENVX,Enovix Corporation Common Stock,$8.97,0.29,3.341%,"1,935,869,556"
PNFPP,"Pinnacle Financial Partners, Inc. Depositary shares of Pinnacle Financial Partners, Inc., each representing a 1/40th Interest in a share of its 6.75% Fixed-Rate Non-Cumulative Perpetual Preferred Stock, Series B",$24.95,0.04,0.161%,"1,935,507,652"
DGNX,Diginex Limited Ordinary Shares,$9.58,1.65,20.807%,"1,934,681,996"
PRKS,United Parks & Resorts Inc. Common Stock,$35.44,-0.01,-0.028%,"1,933,273,654"
ASGN,ASGN Incorporated Common Stock,$45.27,0.39,0.869%,"1,933,029,000"
NOVTU,Novanta Inc. Tangible Equity Units,$53.99,0.42,0.784%,"1,931,498,891"
ZYME,Zymeworks Inc. Common Stock,$25.805,-0.605,-2.291%,"1,931,156,760"
TWST,Twist Bioscience Corporation Common Stock,$31.58,-0.64,-1.986%,"1,931,054,661"
LASR,"nLIGHT, Inc. Common Stock",$37.90,0.95,2.571%,"1,924,789,665"
NWN,Northwest Natural Holding Company Common Stock,$46.07,-0.12,-0.26%,"1,912,229,425"
FIGS,"FIGS, Inc. Class A Common Stock",$11.61,0.18,1.575%,"1,909,829,895"
GEL,"Genesis Energy, L.P. Common Units",$15.58,-0.43,-2.686%,"1,907,994,074"
AVAH,Aveanna Healthcare Holdings Inc. Common Stock,$9.13,-0.07,-0.761%,"1,907,360,927"
SKWD,"Skyward Specialty Insurance Group, Inc. Common Stock",$47.00,0.24,0.513%,"1,902,906,155"
PRGS,Progress Software Corporation Common Stock (DE),$44.33,0.45,1.026%,"1,902,092,711"
ABTC,American Bitcoin Corp. Class A Common Stock,$2.05,0.03,1.485%,"1,901,590,238"
CMRE,Costamare Inc. Common Stock $0.0001 par value,$15.82,-0.04,-0.252%,"1,897,790,756"
SLVM,Sylvamo Corporation Common Stock,$48.06,-0.13,-0.27%,"1,895,402,631"
ATRO,Astronics Corporation Common Stock,$53.15,0.50,0.95%,"1,893,687,781"
ABLLL,"Abacus Global Management, Inc. 9.875% Fixed Rate Senior Notes due 2028",$25.3499,0.0199,0.079%,"1,892,404,181"
PCTTU,"PureCycle Technologies, Inc. Unit",$10.50,UNCH,--,"1,892,082,570"
