Symbol,Name,Last Sale,Net Change,% Change,Market Cap
KYIV,Kyivstar Group Ltd. Common Shares,$13.29,0.68,5.393%,"3,068,177,563"
BHE,"Benchmark Electronics, Inc. Common Stock",$85.51,1.73,2.065%,"3,067,845,348"
CAKE,Cheesecake Factory Incorporated (The) Common Stock,$61.65,0.85,1.398%,"3,063,102,629"
DHT,"DHT Holdings, Inc.",$19.00,-0.02,-0.105%,"3,059,791,103"
OLN,Olin Corporation Common Stock,$26.84,0.08,0.299%,"3,055,922,873"
VC,Visteon Corporation Common Stock,$114.35,2.00,1.78%,"3,052,461,301"
TTAM,Titan America SA Common Shares,$16.52,-0.23,-1.373%,"3,045,667,922"
JOYY,JOYY Inc. American Depositary Shares,$58.88,-0.12,-0.203%,"3,045,390,889"
BKV,BKV Corporation Common Stock,$27.80,-1.15,-3.972%,"3,040,946,368"
FSK,FS KKR Capital Corp. Common Stock,$10.84,-0.11,-1.005%,"3,035,920,134"
CPK,Chesapeake Utilities Corporation Common Stock,$126.42,-0.81,-0.637%,"3,034,681,886"
BBAR,Banco BBVA Argentina S.A. ADS,$14.83,-0.53,-3.451%,"3,028,830,157"
IPAR,"Interparfums, Inc. Common Stock",$94.48,0.57,0.607%,"3,025,795,789"
AWR,American States Water Company Common Stock,$77.20,0.36,0.469%,"3,025,672,812"
SBCF,Seacoast Banking Corporation of Florida Common Stock,$31.09,0.05,0.161%,"3,023,402,141"
HTGC,"Hercules Capital, Inc. Common Stock",$16.15,-0.25,-1.524%,"3,021,965,229"
KN,Knowles Corporation Common Stock,$35.28,1.47,4.348%,"3,018,580,085"
SDRL,Seadrill Limited Common Shares,$48.32,0.61,1.279%,"3,017,557,279"
CCC,CCC Intelligent Solutions Holdings Inc. Common Stock,$5.13,-0.08,-1.536%,"3,011,004,950"
ALMS,Alumis Inc. Common Stock,$23.66,-0.10,-0.421%,"3,009,536,219"
PLMR,"Palomar Holdings, Inc. Common stock",$113.36,-0.21,-0.185%,"3,005,526,603"
SHAK,"Shake Shack, Inc. Class A Common Stock",$70.14,0.90,1.30%,"3,000,655,412"
CRVL,CorVel Corp. Common Stock,$58.52,0.46,0.792%,"2,993,440,613"
SBLK,Star Bulk Carriers Corp. Common Shares,$26.83,0.02,0.075%,"2,992,353,925"
ITGR,Integer Holdings Corporation Common Stock,$88.12,0.20,0.227%,"2,992,100,413"
SUPN,"Supernus Pharmaceuticals, Inc. Common Stock",$51.53,-0.75,-1.435%,"2,990,786,823"
LFST,"LifeStance Health Group, Inc. Common Stock",$7.70,-1.15,-12.994%,"2,986,273,113"
EXPO,"Exponent, Inc. Common Stock",$61.42,-2.02,-3.184%,"2,985,914,383"
SVM,Silvercorp Metals Inc. Common Shares,$13.50,0.05,0.372%,"2,973,735,572"
TDC,Teradata Corporation Common Stock,$31.59,1.96,6.615%,"2,972,619,000"
ERO,Ero Copper Corp. Common Shares,$28.48,1.38,5.092%,"2,969,793,752"
SHOO,"Steven Madden, Ltd. Common Stock",$40.61,0.97,2.447%,"2,966,168,207"
VGNT,Versigent PLC Ordinary Shares,$41.83,2.83,7.256%,"2,965,481,798"
EXK,Endeavour Silver Corporation Ordinary Shares (Canada),$10.03,-0.12,-1.182%,"2,962,968,468"
PHIN,PHINIA Inc. Common Stock,$79.87,1.42,1.81%,"2,956,831,967"
NMIH,NMI Holdings Inc. Common Stock,$38.87,0.29,0.752%,"2,953,027,403"
KALU,Kaiser Aluminum Corporation Common Stock,$180.33,4.17,2.367%,"2,946,701,480"
NHC,National HealthCare Corporation Common Stock,$188.82,17.40,10.151%,"2,945,411,866"
CURB,Curbline Properties Corp. Common Stock,$27.88,0.32,1.161%,"2,942,436,911"
CECO,CECO Environmental Corp. Common Stock,$81.78,0.40,0.492%,"2,933,696,475"
PAGS,PagSeguro Digital Ltd. Class A Common Shares,$10.09,-0.03,-0.296%,"2,932,938,084"
ARX,Accelerant Holdings Class A Common Shares,$13.20,-0.36,-2.655%,"2,932,512,053"
BANC,"Banc of California, Inc. Common Stock",$19.04,-0.13,-0.678%,"2,927,940,108"
WT,"WisdomTree, Inc. Common Stock",$19.10,0.38,2.03%,"2,921,178,200"
POWWP,Outdoor Holding Company 8.75% Series A Cumulative Redeemable Perpetual Preferred Stock,$24.90,0.04,0.161%,"2,920,489,178"
PFS,"Provident Financial Services, Inc Common Stock",$22.40,-0.08,-0.356%,"2,919,026,522"
TRN,"Trinity Industries, Inc. Common Stock",$36.63,-0.01,-0.027%,"2,912,286,575"
DYN,"Dyne Therapeutics, Inc. Common Stock",$17.61,0.07,0.399%,"2,909,515,413"
AKR,Acadia Realty Trust Common Stock,$21.77,-0.17,-0.775%,"2,906,668,160"
PRVA,"Privia Health Group, Inc. Common Stock",$23.06,-0.93,-3.877%,"2,896,912,062"
GEO,Geo Group Inc (The) REIT,$21.76,0.54,2.545%,"2,887,710,565"
LCII,LCI Industries,$118.82,2.39,2.053%,"2,885,567,702"
DX,"Dynex Capital, Inc. Common Stock",$13.41,0.09,0.676%,"2,885,173,663"
STUB,"StubHub Holdings, Inc. Class A Common Stock",$7.71,0.04,0.522%,"2,882,361,650"
WK,Workiva Inc. Class A Common Stock,$51.29,-1.00,-1.912%,"2,878,360,743"
BWIN,"The Baldwin Insurance Group, Inc. Class A Common Stock",$20.18,-0.80,-3.813%,"2,877,014,673"
TNK,Teekay Tankers Ltd.,$83.03,1.76,2.166%,"2,876,479,530"
BTU,Peabody Energy Corporation Common Stock ,$23.59,-0.48,-1.994%,"2,874,064,744"
INTR,Inter & Co. Inc. Class A Common Shares,$6.48,-0.22,-3.284%,"2,859,764,376"
GRBK,"Green Brick Partners, Inc. Common Stock",$66.09,0.45,0.686%,"2,852,265,428"
DBRG,"DigitalBridge Group, Inc.",$15.63,-0.01,-0.064%,"2,850,480,331"
WU,Western Union Company (The) Common Stock,$9.07,0.02,0.221%,"2,833,786,393"
RGTIW,"Rigetti Computing, Inc. Warrants",$8.52,0.25,3.023%,"2,831,584,069"
BSM,"Black Stone Minerals, L.P. Common units representing limited partner interests",$13.30,-0.07,-0.524%,"2,826,241,102"
NTCT,"NetScout Systems, Inc. Common Stock",$39.09,0.80,2.089%,"2,823,093,482"
DK,"Delek US Holdings, Inc. Common Stock",$46.04,1.34,2.998%,"2,821,678,434"
ZIONP,"Zions Bancorporation, N.A. Depositary Shares (Each representing 1/40th Interest in a Share of Series A Floating-Rate Non-Cumulative Perpetual Preferred Stock)",$19.15,-0.0999,-0.519%,"2,816,372,039"
MGRC,McGrath RentCorp Common Stock,$114.64,0.31,0.271%,"2,815,761,313"
PTRN,Pattern Group Inc. Series A Common Stock,$15.92,-1.03,-6.077%,"2,814,121,582"
AVEX,AEVEX Corp. Class A Common Stock,$25.07,1.24,5.204%,"2,803,491,433"
HIW,"Highwoods Properties, Inc. Common Stock",$25.42,-0.15,-0.587%,"2,803,131,958"
WDFC,WD-40 Company Common Stock,$208.05,-1.71,-0.815%,"2,799,396,386"
AEO,"American Eagle Outfitters, Inc. Common Stock",$16.68,0.04,0.24%,"2,794,311,429"
CLMT,"Calumet, Inc. Common Stock",$32.08,-2.53,-7.31%,"2,792,261,101"
FBK,FB Financial Corporation Common Stock,$54.12,0.11,0.204%,"2,788,449,763"
TXG,"10x Genomics, Inc. Class A Common Stock",$21.60,-0.82,-3.657%,"2,786,204,174"
GPCR,Structure Therapeutics Inc. American Depositary Shares,$39.10,-0.05,-0.128%,"2,778,883,451"
INOD,Innodata Inc. Common Stock,$84.89,39.25,85.999%,"2,772,083,629"
UPST,"Upstart Holdings, Inc. Common stock",$28.96,-0.04,-0.138%,"2,771,807,038"
RHI,Robert Half Inc. Common Stock,$27.03,-0.37,-1.35%,"2,764,995,711"
IHS,IHS Holding Limited Ordinary Shares,$8.24,0.01,0.122%,"2,764,694,869"
FTAIM,FTAI Aviation Ltd. 9.500% Fixed-Rate Reset Series D Cumulative Perpetual Redeemable Preferred Shares,$26.95,-0.05,-0.185%,"2,764,611,095"
KD,"Kyndryl Holdings, Inc. Common Stock",$12.26,-0.38,-3.006%,"2,763,982,574"
AYA,Aya Gold & Silver Inc. Common Shares,$19.33,0.68,3.646%,"2,763,929,954"
FCPT,"Four Corners Property Trust, Inc. Common Stock",$25.17,-0.30,-1.178%,"2,762,387,288"
CVBF,CVB Financial Corporation Common Stock,$20.33,-0.18,-0.878%,"2,760,506,610"
CALX,"Calix, Inc Common Stock",$43.24,-0.28,-0.643%,"2,757,946,609"
FA,First Advantage Corporation Common Stock,$15.96,0.20,1.269%,"2,751,617,986"
KMT,Kennametal Inc. Common Stock,$36.10,-5.61,-13.45%,"2,751,184,718"
SPNT,SiriusPoint Ltd. Common Shares,$23.45,-0.04,-0.17%,"2,743,404,830"
UAA,"Under Armour, Inc. Class A Common Stock",$6.43,0.04,0.626%,"2,738,472,706"
UNIT,Uniti Group Inc. Common Stock,$11.28,0.16,1.439%,"2,737,364,412"
SLNO,"Soleno Therapeutics, Inc. Common Stock",$52.95,UNCH,--,"2,733,511,133"
TGB,"Taseko Mines, Ltd. Common Stock",$7.49,0.24,3.31%,"2,730,533,054"
UE,Urban Edge Properties Common Shares of Beneficial Interest,$21.61,-0.42,-1.906%,"2,723,292,070"
EOSE,"Eos Energy Enterprises, Inc. Class A Common Stock",$8.01,1.65,25.943%,"2,719,066,782"
DKL,"Delek Logistics Partners, L.P. Common Units representing Limited Partner Interests",$51.05,0.03,0.059%,"2,714,236,814"
PLBL,Polibeli Group Ltd Class A Ordinary Shares,$7.40,0.30,4.225%,"2,711,267,278"
MGEE,"MGE Energy, Inc",$73.65,-1.00,-1.34%,"2,707,110,480"
DBD,Diebold Nixdorf Incorporated Common stock,$78.01,-0.90,-1.141%,"2,701,360,860"
BKE,"Buckle, Inc. (The) Common Stock",$52.41,0.05,0.095%,"2,700,062,887"
ATRO,Astronics Corporation Common Stock,$75.08,-2.87,-3.682%,"2,693,445,147"
ARCB,ArcBest Corporation Common Stock,$120.97,-0.69,-0.567%,"2,693,249,467"
NN,NextNav Inc. Common Stock,$19.79,0.28,1.435%,"2,691,997,939"
NYAX,Nayax Ltd. Ordinary Shares,$72.00,-0.35,-0.484%,"2,689,862,040"
NMFCZ,New Mountain Finance Corporation 8.250% Notes due 2028,$25.24,-0.039,-0.154%,"2,684,550,656"
WOR,"Worthington Enterprises, Inc. Common Shares",$54.44,-1.23,-2.209%,"2,681,332,993"
BRZE,"Braze, Inc. Class A Common Stock",$21.72,-0.88,-3.894%,"2,680,179,191"
HOG,"Harley-Davidson, Inc. Common Stock",$25.42,1.78,7.53%,"2,675,920,237"
GRND,Grindr Inc. Common Stock,$15.09,1.28,9.269%,"2,674,230,183"
CLDX,"Celldex Therapeutics, Inc.",$33.97,0.65,1.951%,"2,666,375,686"
NGVT,Ingevity Corporation Common Stock ,$75.63,1.56,2.106%,"2,663,880,549"
UA,"Under Armour, Inc. Class C Common Stock",$6.25,0.03,0.482%,"2,661,812,506"
VAC,Marriott Vacations Worldwide Corporation Common Stock,$77.12,-0.03,-0.039%,"2,648,537,096"
ARQT,"Arcutis Biotherapeutics, Inc. Common Stock",$21.17,0.51,2.469%,"2,648,015,028"
GRAL,"GRAIL, Inc. Common Stock ",$61.64,-1.28,-2.034%,"2,645,378,793"
VISN,"Vistance Networks, Inc. Common Stock",$11.72,-0.18,-1.513%,"2,643,676,075"
KLRA,"Kailera Therapeutics, Inc. Common Stock",$21.47,-1.00,-4.45%,"2,639,710,156"
TARS,"Tarsus Pharmaceuticals, Inc. Common Stock",$61.21,-2.75,-4.30%,"2,633,496,530"
AMSC,American Superconductor Corporation Common Stock,$55.19,1.97,3.702%,"2,627,722,009"
WAFD,"WaFd, Inc. Common Stock",$35.55,-0.12,-0.336%,"2,626,735,464"
INFQ,"Infleqtion, Inc. Common Stock",$12.12,0.01,0.083%,"2,623,639,755"
GDV,Gabelli Dividend & Income Trust Common Shares of Beneficial Interest,$29.09,-0.02,-0.069%,"2,623,583,203"
HUN,Huntsman Corporation Common Stock,$14.96,0.22,1.493%,"2,623,222,716"
HUBG,"Hub Group, Inc. Class A Common Stock",$42.88,-0.13,-0.302%,"2,622,262,509"
TRMK,Trustmark Corporation Common Stock,$44.73,-0.19,-0.423%,"2,621,426,117"
STNE,StoneCo Ltd. Class A Common Shares,$10.77,-0.27,-2.446%,"2,619,567,994"
DRD,DRDGOLD Limited American Depositary Shares,$30.23,1.66,5.81%,"2,613,651,670"
EEFT,"Euronet Worldwide, Inc. Common Stock",$68.83,-2.75,-3.842%,"2,613,206,938"
TOWN,TowneBank Common Stock,$34.99,0.16,0.459%,"2,610,860,377"
FRPT,"Freshpet, Inc. Common Stock",$53.08,-2.79,-4.994%,"2,608,499,346"
IRON,"Disc Medicine, Inc. Common Stock",$68.26,0.73,1.081%,"2,607,469,815"
CXT,"Crane NXT, Co. Common Stock",$45.31,1.43,3.259%,"2,607,244,649"
FTAIN,FTAI Aviation Ltd. 8.25% Fixed - Rate Reset Series C Cumulative Perpetual Redeemable Preferred Shares,$25.41,0.0098,0.039%,"2,606,633,319"
CUBI,"Customers Bancorp, Inc Common Stock",$77.26,-0.65,-0.834%,"2,602,189,733"
CWT,California Water Service Group Common Stock,$43.47,-0.15,-0.344%,"2,601,821,299"
VERA,"Vera Therapeutics, Inc. Class A Common Stock",$36.19,0.31,0.864%,"2,595,326,222"
CDLR,Cadeler A/S American Depositary Share (each representing four (4) Ordinary Shares),$29.57,0.76,2.638%,"2,594,453,940"
MFAO,"MFA Financial, Inc. 9.000% Senior Notes due 2029",$25.22,0.04,0.159%,"2,589,304,664"
ICHR,Ichor Holdings Ordinary Shares,$74.42,3.19,4.478%,"2,586,118,070"
NSIT,"Insight Enterprises, Inc. Common Stock",$83.79,13.42,19.071%,"2,585,502,332"
MFAN,"MFA Financial, Inc. 8.875% Senior Notes due 2029",$25.12,UNCH,--,"2,579,037,794"
RARE,Ultragenyx Pharmaceutical Inc. Common Stock,$26.12,-0.01,-0.038%,"2,572,538,531"
SAH,"Sonic Automotive, Inc. Common Stock",$81.20,1.07,1.335%,"2,566,253,164"
KWR,Quaker Houghton Common Stock,$147.54,4.60,3.218%,"2,562,245,148"
HAE,Haemonetics Corporation Common Stock,$55.12,0.75,1.379%,"2,561,500,812"
HE,"Hawaiian Electric Industries, Inc. Common Stock",$14.83,-0.59,-3.826%,"2,560,186,304"
KOD,Kodiak Sciences Inc Common Stock,$41.01,-2.67,-6.113%,"2,549,004,642"
FRME,First Merchants Corporation Common Stock,$40.41,-0.10,-0.247%,"2,546,748,964"
HTFL,"Heartflow, Inc. Common Stock",$29.51,-0.47,-1.568%,"2,544,929,445"
WHR,Whirlpool Corporation Common Stock,$44.96,-3.25,-6.741%,"2,542,045,144"
IMNM,"Immunome, Inc. Common Stock",$22.44,0.25,1.127%,"2,538,708,986"
VNET,"VNET Group, Inc. American Depositary Shares",$8.90,-0.06,-0.67%,"2,533,755,623"
RH,RH Common Stock,$133.89,0.24,0.18%,"2,530,623,961"
BWNB,"Babcock & Wilcox Enterprises, Inc. 6.50% Senior Notes due 2026",$25.00,UNCH,--,"2,527,438,550"
OSW,OneSpaWorld Holdings Limited Common Shares,$24.82,0.24,0.976%,"2,519,598,478"
ASH,Ashland Inc. Common Stock,$55.01,0.55,1.01%,"2,518,785,613"
WRD,WeRide Inc. American Depositary Shares,$7.51,0.12,1.624%,"2,517,776,127"
SEDG,"SolarEdge Technologies, Inc. Common Stock",$41.30,2.69,6.967%,"2,511,780,468"
ROG,Rogers Corporation Common Stock,$140.66,3.40,2.477%,"2,510,574,933"
ATKR,Atkore Inc. Common Stock,$74.29,0.32,0.433%,"2,508,570,191"
TALO,"Talos Energy, Inc. Common Stock",$14.99,0.07,0.469%,"2,502,218,012"
IDYA,"IDEAYA Biosciences, Inc. Common Stock",$28.32,0.08,0.283%,"2,488,221,254"
BCC,"Boise Cascade, L.L.C. Common Stock",$70.67,-2.09,-2.872%,"2,486,858,643"
PBH,Prestige Consumer Healthcare Inc. Common Stock,$52.54,-2.05,-3.755%,"2,486,126,074"
ELVN,"Enliven Therapeutics, Inc. Common Stock",$40.75,0.46,1.142%,"2,481,253,441"
DGII,Digi International Inc. Common Stock,$65.78,3.75,6.045%,"2,480,050,650"
WSBCO,"WesBanco, Inc. Depositary Shares each representing 1/40th interest in a share of 7.375% Fixed-Rate Reset Non-Cumulative Perpetual Preferred Stock, Series B",$25.75,-0.09,-0.348%,"2,476,649,420"
NOG,"Northern Oil and Gas, Inc. Common Stock",$23.40,-0.53,-2.215%,"2,475,512,278"
LCID,"Lucid Group, Inc. Common Stock",$6.34,0.29,4.793%,"2,474,228,163"
DJT,Trump Media & Technology Group Corp. Common Stock,$8.93,-0.09,-0.998%,"2,471,210,643"
TMC,TMC the metals company Inc. Common Stock,$5.70,UNCH,--,"2,469,172,666"
LMAT,"LeMaitre Vascular, Inc. Common Stock",$107.94,0.03,0.028%,"2,466,508,768"
MTX,Minerals Technologies Inc. Common Stock,$79.51,1.70,2.185%,"2,465,504,440"
AVPT,"AvePoint, Inc. Class A Common Stock",$11.40,1.08,10.465%,"2,461,929,317"
DAC,Danaos Corporation Common Stock,$134.63,2.36,1.784%,"2,450,733,839"
LWLG,"Lightwave Logic, Inc. Common Stock",$16.43,1.605,10.826%,"2,445,295,334"
AAMI,Acadian Asset Management Inc. Common Stock,$68.63,2.10,3.156%,"2,445,217,446"
RLAY,"Relay Therapeutics, Inc. Common Stock",$12.76,0.25,1.998%,"2,444,639,465"
IVT,InvenTrust Properties Corp. Common Stock,$31.34,-0.32,-1.011%,"2,442,509,758"
FRSH,Freshworks Inc. Class A Common Stock,$8.83,-0.20,-2.215%,"2,440,913,695"
FBNC,First Bancorp Common Stock,$58.86,-0.32,-0.541%,"2,438,548,669"
MLYS,"Mineralys Therapeutics, Inc. Common Stock",$29.54,0.19,0.647%,"2,436,993,904"
ANDE,"Andersons, Inc. (The) Common Stock",$71.45,0.64,0.904%,"2,433,162,301"
BBT,Beacon Financial Corporation Common stock,$28.93,0.05,0.173%,"2,430,936,549"
NKTR,Nektar Therapeutics  Common Stock,$81.89,-1.48,-1.775%,"2,430,466,293"
DNOW,DNOW Inc. Common Stock,$13.07,0.02,0.153%,"2,429,981,092"
HTO,H2O America Common Stock,$57.97,0.81,1.417%,"2,425,479,119"
DXPE,"DXP Enterprises, Inc. Common Stock",$156.18,6.16,4.106%,"2,421,619,628"
PTON,"Peloton Interactive, Inc. Class A Common Stock",$5.69,0.03,0.53%,"2,421,032,922"
HNI,HNI Corporation Common Stock,$33.61,-1.09,-3.141%,"2,419,681,638"
SGML,Sigma Lithium Corporation Common Shares,$21.71,-1.94,-8.203%,"2,418,558,674"
VERX,"Vertex, Inc. Class A Common Stock",$14.93,0.26,1.772%,"2,414,745,130"
BRSL,"Brightstar Lottery PLC Trading under the Legal Name to begin at the market open on July 21, 2025. Ordinary Shares",$13.05,0.36,2.837%,"2,407,725,000"
TENB,"Tenable Holdings, Inc. Common Stock",$21.83,0.29,1.346%,"2,407,237,171"
DFTX,"Definium Therapeutics, Inc. Common Shares",$22.05,-1.15,-4.957%,"2,404,922,565"
AMBP,Ardagh Metal Packaging S.A. Ordinary Shares,$4.00,0.04,1.01%,"2,390,798,344"
PLUS,ePlus inc. Common Stock,$90.31,3.51,4.044%,"2,383,512,184"
AERO,"Grupo Aeromexico, S.A.B. de C.V. American Depositary Shares (each representing ten (10) Common Shares)",$16.31,-0.03,-0.184%,"2,379,684,601"
CENT,Central Garden & Pet Company Common Stock,$38.14,-0.39,-1.012%,"2,374,880,123"
TBBK,The Bancorp Inc Common Stock,$57.00,-2.50,-4.202%,"2,373,163,023"
MFICL,MidCap Financial Investment Corporation 8.00% Notes due 2028,$25.42,-0.13,-0.509%,"2,371,778,071"
NBTB,NBT Bancorp Inc. Common Stock,$45.59,0.52,1.154%,"2,371,119,761"
ABM,ABM Industries Incorporated Common Stock,$40.20,-0.56,-1.374%,"2,353,019,364"
AMR,"Alpha Metallurgical Resources, Inc. Common Stock",$184.11,-9.32,-4.818%,"2,352,715,730"
AMPX,"Amprius Technologies, Inc. Common Stock",$16.70,0.59,3.662%,"2,351,477,919"
ALRM,"Alarm.com Holdings, Inc. Common Stock",$47.60,0.60,1.277%,"2,351,396,446"
TMDX,"TransMedics Group, Inc. Common Stock",$67.84,-5.06,-6.941%,"2,344,612,202"
COHU,"Cohu, Inc. Common Stock",$49.54,2.06,4.339%,"2,337,066,690"
AESI,Atlas Energy Solutions Inc. Common Stock,$18.71,0.43,2.352%,"2,336,983,477"
NESR,National Energy Services Reunited Corp Ordinary Shares,$23.10,-0.25,-1.071%,"2,328,410,792"
WTTR,"Select Water Solutions, Inc. Class A common stock",$16.80,-0.02,-0.119%,"2,320,832,842"
CDNL,Cardinal Infrastructure Group Inc. Class A Common Stock,$54.09,2.79,5.439%,"2,318,668,403"
ACHC,"Acadia Healthcare Company, Inc. Common Stock",$25.18,0.72,2.944%,"2,315,729,740"
MCW,"Mister Car Wash, Inc. Common Stock",$7.04,UNCH,--,"2,315,417,562"
MNR,Mach Natural Resources LP Common Units representing Limited Partner Interests,$13.75,0.57,4.325%,"2,313,008,088"
ADAMI,"Adamas Trust, Inc. 9.125% Senior Notes Due 2029",$25.40,-0.06,-0.236%,"2,300,718,005"
ADAMM,"Adamas Trust, Inc. 7.875% Series E Fixed-to-Floating Rate Cumulative Redeemable Preferred Stock",$25.59,0.06,0.235%,"2,299,545,754"
CSGS,"CSG Systems International, Inc. Common Stock",$80.38,-0.01,-0.012%,"2,290,985,616"
HCM,HUTCHMED (China) Limited American Depositary Shares,$13.13,-0.18,-1.352%,"2,290,732,330"
GRDN,"Guardian Pharmacy Services, Inc. Class A Common Stock",$36.09,-0.18,-0.496%,"2,285,241,681"
GCMG,GCM Grosvenor Inc. Class A Common Stock,$11.36,0.20,1.792%,"2,284,314,251"
PK,Park Hotels & Resorts Inc. Common Stock ,$11.32,0.13,1.162%,"2,279,415,972"
BUSE,First Busey Corporation Class A Common Stock,$26.61,0.02,0.075%,"2,275,274,133"
PRDO,Perdoceo Education Corporation Common Stock,$36.04,1.60,4.646%,"2,259,758,636"
FORTY,Formula Systems (1985) Ltd. American Depositary Shares,$147.40,-0.80,-0.54%,"2,257,824,116"
HLIO,"Helios Technologies, Inc. Common Stock",$68.22,0.24,0.353%,"2,254,422,543"
NTB,Bank of N.T. Butterfield & Son Limited (The) Voting Ordinary Shares,$56.34,0.13,0.231%,"2,253,600,000"
BLBD,Blue Bird Corporation Common Stock,$71.02,0.18,0.254%,"2,247,540,751"
MH,"McGraw Hill, Inc. Common Stock",$11.76,-0.23,-1.918%,"2,246,177,863"
FUN,Six Flags Entertainment Corporation Common Stock New,$22.01,-0.75,-3.295%,"2,244,745,777"
PENG,"Penguin Solutions, Inc. Common Stock",$44.23,5.25,13.468%,"2,244,562,279"
FLOC,Flowco Holdings Inc. Class A Common Stock,$24.84,0.28,1.14%,"2,244,180,133"
PENN,"PENN Entertainment, Inc. Common Stock",$16.74,-0.03,-0.179%,"2,240,538,031"
AXGN,"Axogen, Inc. Common Stock",$42.06,-1.35,-3.11%,"2,236,659,277"
BANR,Banner Corporation Common Stock,$65.67,0.09,0.137%,"2,230,674,817"
BUSEP,"First Busey Corporation Depositary Shares, Each Representing a 1/40thInterest in a Share of 8.25% Fixed-Rate Series B Non-Cumulative Perpetual Preferred Stock, $0.001 par value",$25.99,0.02,0.077%,"2,222,261,357"
CMPR,Cimpress plc Ordinary Shares (Ireland),$91.67,-0.31,-0.337%,"2,221,355,690"
PMTU,PennyMac Mortgage Investment Trust 8.50% Senior Notes due 2028,$25.47,0.003,0.012%,"2,221,044,160"
ADPT,Adaptive Biotechnologies Corporation Common Stock,$13.81,-0.88,-5.99%,"2,210,213,054"
HTH,Hilltop Holdings Inc.,$37.76,-0.49,-1.281%,"2,210,100,239"
CPRI,Capri Holdings Limited Ordinary Shares,$18.53,-0.16,-0.856%,"2,208,069,358"
KEEL,Keel Infrastructure Corp. Common Stock,$3.97,-0.04,-0.998%,"2,207,168,477"
DRH,Diamondrock Hospitality Company Common Stock,$10.79,0.13,1.22%,"2,206,453,477"
CTOS,"Custom Truck One Source, Inc. Common Stock",$9.70,-0.07,-0.716%,"2,206,098,364"
DRVN,Driven Brands Holdings Inc. Common Stock,$13.41,-0.34,-2.473%,"2,205,331,063"
XRAY,DENTSPLY SIRONA Inc. Common Stock,$11.00,0.04,0.365%,"2,203,593,513"
NBTX,Nanobiotix S.A. American Depositary Shares,$45.49,2.88,6.759%,"2,202,173,993"
RDW,Redwire Corporation Common Stock,$11.07,1.87,20.326%,"2,202,030,319"
IE,Ivanhoe Electric Inc. Common Stock,$13.90,0.18,1.312%,"2,196,083,143"
LPL,"LG Display Co, Ltd AMERICAN DEPOSITORY SHARES",$4.39,0.07,1.62%,"2,195,000,000"
ECO,Okeanis Eco Tankers Corp. Common Stock,$56.20,-0.54,-0.952%,"2,194,309,611"
VVX,"V2X, Inc. Common Stock",$70.08,-5.32,-7.056%,"2,194,238,719"
BCRX,"BioCryst Pharmaceuticals, Inc. Common Stock",$8.62,-0.28,-3.146%,"2,190,882,129"
TIC,"TIC Solutions, Inc. Common Stock",$9.91,-0.10,-0.999%,"2,190,532,206"
ASTH,Astrana Health Inc. Common Stock,$39.30,3.22,8.925%,"2,189,541,808"
EFSC,Enterprise Financial Services Corporation Common Stock,$59.83,0.27,0.453%,"2,188,928,713"
ATHM,"Autohome Inc. American Depositary Shares, each representing four class A ordinary shares.",$19.00,-0.33,-1.707%,"2,188,247,309"
ARR,"ARMOUR Residential REIT, Inc.",$17.63,0.08,0.456%,"2,186,933,025"
NMM,Navios Maritime Partners LP Common Units Representing Limited Partner Interests,$74.97,3.40,4.751%,"2,186,747,976"
MLCO,Melco Resorts & Entertainment Limited American Depositary Shares,$5.37,-0.23,-4.107%,"2,184,473,067"
WERN,"Werner Enterprises, Inc. Common Stock",$36.42,0.04,0.11%,"2,183,383,188"
ADAML,"Adamas Trust, Inc. 6.875% Series F Fixed-to-Floating Rate Cumulative Redeemable Preferred Stock, $0.01 par value per share",$24.24,-0.06,-0.247%,"2,178,233,258"
COTY,Coty Inc. Class A Common Stock,$2.47,-0.03,-1.20%,"2,174,752,102"
VRRM,Verra Mobility Corporation Class A Common Stock,$14.30,-0.33,-2.256%,"2,172,265,138"
QUBT,Quantum Computing Inc. Common Stock,$9.60,-0.03,-0.312%,"2,165,012,515"
USAS,"Americas Gold and Silver Corporation Common Shares, no par value",$6.63,0.25,3.918%,"2,160,671,286"
THR,"Thermon Group Holdings, Inc. Common Stock",$65.66,0.34,0.521%,"2,156,824,106"
BHC,Bausch Health Companies Inc. Common Stock,$5.75,0.02,0.349%,"2,147,484,953"
BGR,BlackRock Energy and Resources Trust,$15.83,-0.11,-0.69%,"2,146,329,451"
NOVTU,Novanta Inc. Tangible Equity Units,$60.15,0.62,1.041%,"2,141,979,575"
CEPU,Central Puerto S.A. American Depositary Shares (each represents ten Common Shares),$14.11,-0.48,-3.29%,"2,135,929,780"
CENTA,Central Garden & Pet Company Class A Common Stock Nonvoting,$34.24,-0.50,-1.439%,"2,132,037,111"
MBIN,Merchants Bancorp Common Stock,$46.33,-0.46,-0.983%,"2,128,477,386"
WLYB,"John Wiley & Sons, Inc. Common Stock",$41.45,-0.41,-0.979%,"2,127,338,184"
PBI,Pitney Bowes Inc. Common Stock,$15.70,0.12,0.77%,"2,126,430,373"
SYBT,"Stock Yards Bancorp, Inc. Common Stock",$71.99,-0.27,-0.374%,"2,124,798,384"
CMRE,Costamare Inc. Common Stock $0.0001 par value,$17.62,0.23,1.323%,"2,124,773,934"
WLY,"John Wiley & Sons, Inc. Common Stock",$41.39,0.69,1.695%,"2,124,258,804"
NWN,Northwest Natural Holding Company Common Stock,$50.44,0.25,0.498%,"2,122,532,955"
STC,Stewart Information Services Corporation Common Stock,$69.73,-0.09,-0.129%,"2,121,680,498"
EVCM,EverCommerce Inc. Common Stock,$11.97,0.18,1.527%,"2,118,932,584"
SLDE,"Slide Insurance Holdings, Inc. Common Stock",$18.46,-0.41,-2.173%,"2,114,763,681"
OCUL,"Ocular Therapeutix, Inc. Common Stock",$9.65,-0.03,-0.31%,"2,112,967,455"
IMOS,ChipMOS TECHNOLOGIES INC. American Depositary Shares,$60.27,0.83,1.396%,"2,109,399,132"
ESTA,Establishment Labs Holdings Inc. Common Shares,$71.77,-0.26,-0.361%,"2,108,962,239"
SRPT,"Sarepta Therapeutics, Inc. Common Stock (DE)",$19.955,-0.845,-4.063%,"2,106,773,510"
ADAMN,"Adamas Trust, Inc. 8.00% Series D Fixed-to-Floating Rate Cumulative Redeemable Preferred Stock",$23.43,UNCH,--,"2,105,445,760"
MCRI,"Monarch Casino & Resort, Inc. Common Stock",$118.61,1.33,1.134%,"2,105,270,093"
WOLF,"Wolfspeed, Inc. Common Stock New",$46.60,1.44,3.189%,"2,101,129,273"
FLYW,Flywire Corporation Voting Common Stock,$17.23,-0.50,-2.82%,"2,094,212,769"
ZLAB,Zai Lab Limited American Depositary Shares,$18.60,-1.165,-5.894%,"2,089,779,676"
WB,Weibo Corporation American Depositary Share,$8.49,0.03,0.355%,"2,085,760,136"
SKWD,"Skyward Specialty Insurance Group, Inc. Common Stock",$46.69,1.18,2.593%,"2,079,715,705"
SPSC,"SPS Commerce, Inc. Common Stock",$56.47,-0.69,-1.207%,"2,073,166,282"
SFB,Stifel Financial Corporation 5.20% Senior Notes due 2047,$20.29,-0.035,-0.172%,"2,073,098,408"
NVCR,NovoCure Limited Ordinary Shares,$17.89,1.06,6.298%,"2,072,036,617"
DEI,"Douglas Emmett, Inc. Common Stock",$12.37,0.34,2.826%,"2,071,792,753"
EZPW,"EZCORP, Inc. Class A Non Voting Common Stock",$33.54,0.66,2.007%,"2,063,916,702"
PDFS,"PDF Solutions, Inc. Common Stock",$51.63,3.93,8.239%,"2,060,933,968"
TRVI,"Trevi Therapeutics, Inc. Common Stock",$14.50,0.45,3.203%,"2,058,705,766"
DCO,Ducommun Incorporated Common Stock,$137.23,-0.51,-0.37%,"2,056,658,737"
SAM,"Boston Beer Company, Inc. (The) Common Stock",$197.34,-5.67,-2.793%,"2,054,988,644"
WS,"Worthington Steel, Inc. Common Shares",$40.43,UNCH,--,"2,054,100,245"
STOK,"Stoke Therapeutics, Inc. Common Stock",$32.89,0.10,0.305%,"2,048,095,887"
DHC,Diversified Healthcare Trust Common Shares of Beneficial Interest,$8.45,0.36,4.45%,"2,045,803,525"
TYRA,"Tyra Biosciences, Inc. Common Stock",$34.32,1.42,4.316%,"2,041,533,334"
GRC,Gorman-Rupp Company (The) Common Stock,$77.28,0.76,0.993%,"2,040,983,579"
CIMN,Chimera Investment Corporation 9.000% Senior Notes due 2029,$25.34,0.03,0.119%,"2,040,647,837"
