Symbol,Name,Last Sale,Net Change,% Change,Market Cap
TDW,Tidewater Inc. Common Stock,$58.36,-0.63,-1.068%,"2,892,505,843"
NMIH,NMI Holdings Inc. Common Stock,$37.62,0.57,1.538%,"2,891,771,451"
KYIV,Kyivstar Group Ltd. Common Shares,$12.12,0.04,0.331%,"2,890,985,442"
RELY,"Remitly Global, Inc. Common Stock",$13.79,0.27,1.997%,"2,882,743,388"
SUPN,"Supernus Pharmaceuticals, Inc. Common Stock",$50.26,-1.54,-2.973%,"2,881,875,731"
TDC,Teradata Corporation Common Stock,$30.90,0.31,1.013%,"2,879,880,000"
KNSA,"Kiniksa Pharmaceuticals International, plc Class A Ordinary Shares",$37.92,-1.64,-4.146%,"2,874,175,181"
CNK,"Cinemark Holdings Inc Cinemark Holdings, Inc. Common Stock",$24.46,0.38,1.578%,"2,873,460,563"
HYMC,Hycroft Mining Holding Corporation Class A Common Stock,$34.59,0.35,1.022%,"2,871,848,033"
MLCO,Melco Resorts & Entertainment Limited American Depositary Shares,$6.73,0.05,0.749%,"2,863,705,593"
MRX,Marex Group plc Ordinary Shares,$39.94,0.79,2.018%,"2,863,694,885"
BRZE,"Braze, Inc. Class A Common Stock",$25.48,-1.76,-6.461%,"2,859,250,889"
BOH,Bank of Hawaii Corporation Common Stock,$71.86,1.35,1.915%,"2,858,956,711"
VTMX,"Corporacion Inmobiliaria Vesta, S.A.B de C.V. American Depositary Shares, each representing ten (10) Common Shares",$32.08,0.14,0.438%,"2,837,432,500"
MH,"McGraw Hill, Inc. Common Stock",$14.81,-0.23,-1.529%,"2,828,732,496"
CPRX,"Catalyst Pharmaceuticals, Inc. Common Stock",$22.96,-0.21,-0.906%,"2,822,068,406"
POWWP,Outdoor Holding Company 8.75% Series A Cumulative Redeemable Perpetual Preferred Stock,$24.0953,-0.0381,-0.158%,"2,821,820,510"
EWTX,"Edgewise Therapeutics, Inc. Common Stock",$26.60,-1.57,-5.573%,"2,816,100,344"
AVPT,"AvePoint, Inc. Class A Common Stock",$13.05,0.04,0.307%,"2,816,050,535"
MSGE,Madison Square Garden Entertainment Corp. Class A Common Stock,$59.42,-1.24,-2.044%,"2,806,508,030"
INSP,"Inspire Medical Systems, Inc. Common Stock",$96.47,3.42,3.675%,"2,803,074,188"
CBZ,"CBIZ, Inc. Common Stock",$51.51,0.36,0.704%,"2,802,217,350"
DBRG,"DigitalBridge Group, Inc.",$15.33,-0.03,-0.195%,"2,800,398,935"
PTON,"Peloton Interactive, Inc. Class A Common Stock",$6.70,0.13,1.979%,"2,799,303,362"
FTAIM,FTAI Aviation Ltd. 9.500% Fixed-Rate Reset Series D Cumulative Perpetual Redeemable Preferred Shares,$27.275,0.1496,0.552%,"2,797,676,529"
SFNC,Simmons First National Corporation Class A Common Stock,$19.28,0.24,1.261%,"2,790,155,347"
KWR,Quaker Houghton Common Stock,$160.80,2.80,1.772%,"2,788,277,628"
NCNO,"nCino, Inc. Common Stock",$24.29,-0.18,-0.736%,"2,785,697,873"
ZGN,Ermenegildo Zegna N.V. Ordinary Shares,$11.02,0.17,1.567%,"2,783,430,267"
AMBA,"Ambarella, Inc. Ordinary Shares",$64.60,-0.20,-0.309%,"2,781,061,396"
WDFC,WD-40 Company Common Stock,$205.81,1.59,0.779%,"2,775,615,815"
SUNC,"SunocoCorp LLC Common Units, representing limited liability company interests",$53.82,-0.41,-0.756%,"2,772,655,596"
COTY,Coty Inc. Class A Common Stock,$3.17,-0.04,-1.246%,"2,772,538,033"
CON,"Concentra Group Holdings Parent, Inc. Common Stock",$21.58,1.15,5.629%,"2,765,912,959"
TR,"Tootsie Roll Industries, Inc. Common Stock",$37.80,0.06,0.159%,"2,758,894,614"
INSW,"International Seaways, Inc. Common Stock ",$55.78,-0.68,-1.204%,"2,755,759,471"
PAX,Patria Investments Limited Class A Common Shares,$17.43,0.20,1.161%,"2,755,254,083"
CRGY,Crescent Energy Company Class A Common Stock,$8.39,-0.11,-1.294%,"2,755,123,529"
CWT,California Water Service Group Common Stock,$46.23,0.56,1.226%,"2,754,907,694"
WBI,WaterBridge Infrastructure LLC Class A Shares Representing Limited Liability Company Interests,$22.31,0.03,0.135%,"2,754,281,050"
ATHM,"Autohome Inc. American Depositary Shares, each representing four class A ordinary shares.",$23.24,0.16,0.693%,"2,752,632,401"
AKR,Acadia Realty Trust Common Stock,$20.96,-0.05,-0.238%,"2,746,485,719"
MGRC,McGrath RentCorp Common Stock,$111.26,1.46,1.33%,"2,738,292,958"
ZIM,ZIM Integrated Shipping Services Ltd. Ordinary Shares,$22.70,-0.03,-0.132%,"2,734,385,477"
QUBT,Quantum Computing Inc. Common Stock,$12.18,-0.33,-2.638%,"2,729,821,843"
ASAN,"Asana, Inc. Class A Common Stock",$11.51,0.09,0.788%,"2,729,021,012"
BLKB,"Blackbaud, Inc. Common Stock",$56.93,-2.45,-4.126%,"2,723,199,810"
CVBF,CVB Financial Corporation Common Stock,$19.88,0.58,3.005%,"2,719,764,272"
BATRA,"Atlanta Braves Holdings, Inc. Series A Common Stock",$43.19,-0.15,-0.346%,"2,717,658,191"
ADPT,Adaptive Biotechnologies Corporation Common Stock,$17.78,-0.26,-1.441%,"2,714,387,043"
ERAS,"Erasca, Inc. Common Stock",$9.56,1.25,15.042%,"2,712,284,856"
NMFCZ,New Mountain Finance Corporation 8.250% Notes due 2028,$25.49,-0.06,-0.235%,"2,711,140,896"
ABM,ABM Industries Incorporated Common Stock,$45.04,1.06,2.41%,"2,710,400,230"
BKE,"Buckle, Inc. (The) Common Stock",$52.97,0.59,1.126%,"2,709,766,479"
OII,"Oceaneering International, Inc. Common Stock",$27.07,0.01,0.037%,"2,700,914,962"
WOR,"Worthington Enterprises, Inc. Common Shares",$54.51,0.91,1.698%,"2,700,784,130"
TENB,"Tenable Holdings, Inc. Common Stock",$22.63,0.10,0.444%,"2,700,760,740"
MODG,Topgolf Callaway Brands Corp. Common Stock,$14.68,0.08,0.548%,"2,699,411,791"
OLN,Olin Corporation Common Stock,$23.63,-0.27,-1.13%,"2,696,691,730"
PTEN,"Patterson-UTI Energy, Inc. Common Stock",$7.11,-0.02,-0.281%,"2,696,410,791"
PHIN,PHINIA Inc. Common Stock,$70.12,0.31,0.444%,"2,695,600,301"
WB,Weibo Corporation American Depositary Share,$11.01,-0.09,-0.811%,"2,695,526,333"
BBAI,"BigBear.ai, Inc. Common Stock",$6.17,-0.09,-1.438%,"2,693,521,077"
CUBI,"Customers Bancorp, Inc Common Stock",$78.73,1.43,1.85%,"2,690,052,702"
BHC,Bausch Health Companies Inc. Common Stock,$7.26,-0.19,-2.55%,"2,689,952,883"
TXG,"10x Genomics, Inc. Class A Common Stock",$21.20,0.28,1.338%,"2,682,924,681"
IRON,"Disc Medicine, Inc. Common Stock",$71.04,-6.04,-7.836%,"2,681,771,508"
LION,Lionsgate Studios Corp Common Shares,$9.23,0.25,2.784%,"2,674,201,568"
BKD,Brookdale Senior Living Inc. Common Stock,$11.25,0.11,0.987%,"2,673,623,160"
HCM,HUTCHMED (China) Limited American Depositary Shares,$15.31,0.01,0.065%,"2,670,583,530"
GT,The Goodyear Tire & Rubber Company Common Stock,$9.32,0.30,3.326%,"2,667,019,672"
DIOD,Diodes Incorporated Common Stock,$57.47,1.66,2.974%,"2,665,764,973"
VC,Visteon Corporation Common Stock,$97.54,-0.68,-0.692%,"2,661,468,832"
GSHD,"Goosehead Insurance, Inc. Class A Common Stock",$72.10,0.83,1.165%,"2,656,471,867"
DYN,"Dyne Therapeutics, Inc. Common Stock",$16.42,-1.03,-5.903%,"2,653,368,981"
PFS,"Provident Financial Services, Inc Common Stock",$20.29,0.44,2.217%,"2,650,328,171"
FCPT,"Four Corners Property Trust, Inc. Common Stock",$24.91,0.43,1.757%,"2,642,502,944"
FFBC,First Financial Bancorp. Common Stock,$26.81,0.86,3.314%,"2,641,581,096"
TOWN,TowneBank Common Stock,$35.31,0.93,2.705%,"2,634,737,922"
PRK,Park National Corporation Common Stock,$163.76,3.95,2.472%,"2,632,976,185"
UPWK,Upwork Inc. Common Stock,$20.15,0.05,0.249%,"2,632,695,892"
NSIT,"Insight Enterprises, Inc. Common Stock",$84.89,1.17,1.398%,"2,629,857,989"
KMT,Kennametal Inc. Common Stock,$34.56,1.07,3.195%,"2,629,778,780"
RUM,Rumble Inc. Class A Common Stock,$6.04,-0.24,-3.822%,"2,626,569,035"
MFAO,"MFA Financial, Inc. 9.000% Senior Notes due 2029",$25.58,0.09,0.353%,"2,626,265,397"
CHEF,"The Chefs' Warehouse, Inc. Common Stock",$64.55,4.29,7.119%,"2,626,252,188"
CNXC,Concentrix Corporation Common Stock,$42.18,0.76,1.835%,"2,626,018,777"
AMBP,Ardagh Metal Packaging S.A. Ordinary Shares,$4.39,UNCH,--,"2,623,901,183"
ETOR,eToro Group Ltd. Class A Common Shares,$31.27,-0.05,-0.16%,"2,617,423,705"
MFAN,"MFA Financial, Inc. 8.875% Senior Notes due 2029",$25.47,0.14,0.553%,"2,614,971,840"
FTAIN,FTAI Aviation Ltd. 8.25% Fixed - Rate Reset Series C Cumulative Perpetual Redeemable Preferred Shares,$25.4301,-0.0799,-0.313%,"2,608,439,740"
FORTY,Formula Systems (1985) Ltd. American Depositary Shares,$170.01,0.01,0.006%,"2,604,156,567"
FA,First Advantage Corporation Common Stock,$14.95,0.09,0.606%,"2,603,018,622"
APLS,"Apellis Pharmaceuticals, Inc. Common Stock",$20.53,0.20,0.984%,"2,597,562,726"
BTE,Baytex Energy Corp Common Shares,$3.38,0.01,0.297%,"2,596,911,460"
ATEC,"Alphatec Holdings, Inc. Common Stock",$17.46,1.51,9.467%,"2,593,686,230"
DAVE,Dave Inc. Class A Common Stock,$192.06,6.60,3.559%,"2,593,593,989"
OXLC,Oxford Lane Capital Corp. Common Stock,$14.92,0.05,0.336%,"2,590,112,000"
DKL,"Delek Logistics Partners, L.P. Common Units representing Limited Partner Interests",$48.41,0.09,0.186%,"2,588,986,212"
WAFD,"WaFd, Inc. Common Stock",$33.73,0.69,2.088%,"2,587,124,797"
DXC,DXC Technology Company Common Stock ,$14.84,-0.50,-3.259%,"2,584,147,773"
NSA,National Storage Affiliates Trust Common Shares of Beneficial Interest,$33.54,0.77,2.35%,"2,581,264,125"
ATRO,Astronics Corporation Common Stock,$72.41,0.83,1.16%,"2,579,904,652"
IE,Ivanhoe Electric Inc. Common Stock,$17.81,-0.33,-1.819%,"2,577,370,178"
TGB,"Taseko Mines, Ltd. Common Stock",$7.15,-0.14,-1.92%,"2,576,937,048"
DRVN,Driven Brands Holdings Inc. Common Stock,$15.63,-0.02,-0.128%,"2,570,419,427"
SYRE,"Spyre Therapeutics, Inc. Common Stock",$33.09,-0.07,-0.211%,"2,567,523,582"
TIC,"TIC Solutions, Inc. Common Stock",$11.64,0.46,4.114%,"2,567,315,059"
AAP,Advance Auto Parts Inc.,$42.72,-0.16,-0.373%,"2,564,150,306"
RXO,"RXO, Inc. Common Stock",$15.58,0.37,2.433%,"2,556,862,966"
GDV,Gabelli Dividend & Income Trust Common Shares of Beneficial Interest,$28.31,-0.08,-0.282%,"2,553,236,180"
TVTX,"Travere Therapeutics, Inc. Common Stock",$28.40,-0.53,-1.832%,"2,541,014,087"
CMBT,CMB.TECH NV Ordinary Shares,$11.52,-0.12,-1.031%,"2,534,684,694"
ANDG,Andersen Group Inc. Class A Common Stock,$22.83,-0.77,-3.263%,"2,533,045,575"
MTRN,Materion Corporation,$149.19,2.01,1.366%,"2,532,928,873"
WVE,Wave Life Sciences Ltd. Ordinary Shares,$14.07,-0.44,-3.032%,"2,532,308,807"
ALRM,"Alarm.com Holdings, Inc. Common Stock",$50.76,-0.41,-0.801%,"2,531,892,557"
BWNB,"Babcock & Wilcox Enterprises, Inc. 6.50% Senior Notes due 2026",$25.00,UNCH,--,"2,527,438,550"
CURB,Curbline Properties Corp. Common Stock,$23.98,-0.02,-0.083%,"2,526,727,518"
AAOI,"Applied Optoelectronics, Inc. Common Stock",$37.00,2.53,7.34%,"2,526,301,429"
TWST,Twist Bioscience Corporation Common Stock,$41.27,1.24,3.098%,"2,525,354,056"
BATRK,"Atlanta Braves Holdings, Inc. Series C Common Stock",$40.13,-0.16,-0.397%,"2,525,112,832"
ALMS,Alumis Inc. Common Stock,$24.17,-0.17,-0.698%,"2,523,188,551"
IMNM,"Immunome, Inc. Common Stock",$22.85,2.09,10.067%,"2,521,085,012"
SID,Companhia Siderurgica Nacional S.A. Common Stock,$1.90,-0.05,-2.564%,"2,519,578,499"
DBD,Diebold Nixdorf Incorporated Common stock,$70.19,0.54,0.775%,"2,517,515,680"
XRAY,DENTSPLY SIRONA Inc. Common Stock,$12.58,0.23,1.862%,"2,510,363,770"
TGLS,Tecnoglass Inc. Ordinary Shares,$53.82,1.47,2.808%,"2,506,367,584"
PTRN,Pattern Group Inc. Series A Common Stock,$14.20,1.19,9.147%,"2,502,393,907"
HOG,"Harley-Davidson, Inc. Common Stock",$21.07,0.02,0.095%,"2,489,249,053"
BELFB,Bel Fuse Inc. Class B Common Stock,$196.61,3.72,1.929%,"2,489,193,291"
TLX,Telix Pharmaceuticals Limited American Depositary Shares,$7.43,-0.19,-2.493%,"2,487,002,924"
WRD,WeRide Inc. American Depositary Shares,$8.73,-0.17,-1.91%,"2,483,937,341"
MLYS,"Mineralys Therapeutics, Inc. Common Stock",$31.38,-2.035,-6.09%,"2,483,411,819"
IHS,IHS Holding Limited Ordinary Shares,$7.42,-0.14,-1.852%,"2,474,131,753"
GENI,Genius Sports Limited Ordinary Shares,$10.31,0.41,4.141%,"2,472,518,497"
BKV,BKV Corporation Common Stock,$25.50,-0.19,-0.74%,"2,470,232,634"
TRMK,Trustmark Corporation Common Stock,$41.17,0.98,2.438%,"2,468,481,358"
HE,"Hawaiian Electric Industries, Inc. Common Stock",$14.28,0.25,1.782%,"2,465,020,397"
WSBCO,"WesBanco, Inc. Depositary Shares each representing 1/40th interest in a share of 7.375% Fixed-Rate Reset Non-Cumulative Perpetual Preferred Stock, Series B",$25.64,-0.02,-0.078%,"2,462,602,697"
SBLK,Star Bulk Carriers Corp. Common Shares,$20.90,0.29,1.407%,"2,447,965,398"
CVI,CVR Energy Inc. Common Stock,$24.30,0.34,1.419%,"2,442,893,556"
UAA,"Under Armour, Inc. Class A Common Stock",$5.76,-0.04,-0.69%,"2,441,602,725"
GEO,Geo Group Inc (The) REIT,$17.49,0.24,1.391%,"2,434,559,885"
OI,"O-I Glass, Inc. Common Stock",$15.81,-0.10,-0.629%,"2,428,329,203"
VSH,"Vishay Intertechnology, Inc. Common Stock",$17.87,0.82,4.809%,"2,422,964,619"
RXRX,"Recursion Pharmaceuticals, Inc. Class A Common Stock",$4.64,-0.21,-4.33%,"2,412,046,394"
NGVT,Ingevity Corporation Common Stock ,$66.93,0.97,1.471%,"2,407,072,662"
POWI,"Power Integrations, Inc. Common Stock",$43.48,1.38,3.278%,"2,406,016,324"
QDEL,QuidelOrtho Corporation Common Stock,$35.38,1.04,3.029%,"2,403,417,885"
OCUL,"Ocular Therapeutix, Inc. Common Stock",$11.28,0.21,1.897%,"2,403,175,484"
MBLY,Mobileye Global Inc. Class A Common Stock,$11.08,0.14,1.28%,"2,393,345,793"
ATKR,Atkore Inc. Common Stock,$70.84,1.18,1.694%,"2,390,884,428"
XNET,Xunlei Limited American Depositary Shares,$7.66,-0.10,-1.289%,"2,388,850,135"
FBNC,First Bancorp Common Stock,$57.53,2.11,3.807%,"2,385,500,377"
SPNT,SiriusPoint Ltd. Common Shares,$20.40,0.23,1.14%,"2,383,018,656"
AAPG,Ascentage Pharma Group International American Depository Shares,$27.30,-1.02,-3.602%,"2,376,919,409"
SEZL,Sezzle Inc. Common Stock,$69.37,-4.86,-6.547%,"2,369,200,686"
UA,"Under Armour, Inc. Class C Common Stock",$5.58,-0.02,-0.357%,"2,365,302,640"
CTRI,"Centuri Holdings, Inc. Common Stock",$26.68,-0.37,-1.368%,"2,365,159,429"
CECO,CECO Environmental Corp. Common Stock,$66.16,0.44,0.67%,"2,358,010,611"
MFICL,MidCap Financial Investment Corporation 8.00% Notes due 2028,$25.27,-0.0006,-0.002%,"2,357,782,528"
RCUS,"Arcus Biosciences, Inc. Common Stock",$21.79,-2.77,-11.279%,"2,352,743,349"
UE,Urban Edge Properties Common Shares of Beneficial Interest,$18.66,0.06,0.323%,"2,348,429,557"
CEPU,Central Puerto S.A. American Depositary Shares (each represents ten Common Shares),$15.51,-0.03,-0.193%,"2,348,248,525"
LC,LendingClub Corporation Common Stock,$20.36,0.37,1.851%,"2,347,537,318"
PLUS,ePlus inc. Common Stock,$88.75,2.00,2.305%,"2,346,450,245"
FLO,"Flowers Foods, Inc. Common Stock",$11.10,0.20,1.835%,"2,344,078,298"
ALG,"Alamo Group, Inc. Common Stock",$193.05,2.37,1.243%,"2,338,883,375"
HBNB,Hotel101 Global Holdings Corp. Class A Ordinary Shares,$9.97,0.5061,5.348%,"2,334,499,408"
EYE,"National Vision Holdings, Inc. Common Stock",$29.43,0.92,3.227%,"2,334,080,292"
CC,Chemours Company (The) Common Stock,$15.56,0.60,4.011%,"2,332,318,773"
RNG,"RingCentral, Inc. Class A Common Stock",$26.94,-1.91,-6.62%,"2,332,053,422"
BUSEP,"First Busey Corporation Depositary Shares, Each Representing a 1/40thInterest in a Share of 8.25% Fixed-Rate Series B Non-Cumulative Perpetual Preferred Stock, $0.001 par value",$26.22,0.06,0.229%,"2,318,085,107"
BB,BlackBerry Limited Common Stock,$3.92,0.05,1.292%,"2,312,800,000"
NVTS,Navitas Semiconductor Corporation Common Stock,$10.00,-0.04,-0.398%,"2,304,961,820"
SAM,"Boston Beer Company, Inc. (The) Common Stock",$216.08,-0.26,-0.12%,"2,303,060,157"
BBT,Beacon Financial Corporation Common stock,$27.39,0.60,2.24%,"2,298,263,703"
NAMSW,NewAmsterdam Pharma Company N.V. Warrant,$20.26,UNCH,--,"2,297,297,689"
PK,Park Hotels & Resorts Inc. Common Stock ,$11.49,0.30,2.681%,"2,296,831,214"
GRND,Grindr Inc. Common Stock,$12.42,-0.28,-2.205%,"2,294,397,783"
CHA,Chagee Holdings Limited American Depositary Shares,$12.35,0.47,3.956%,"2,294,043,252"
MESO,Mesoblast Limited American Depositary Shares,$17.73,0.09,0.51%,"2,288,592,283"
OMCL,"Omnicell, Inc. Common Stock ($0.001 par value)",$50.98,0.26,0.513%,"2,287,805,092"
NBTB,NBT Bancorp Inc. Common Stock,$43.71,1.00,2.341%,"2,286,697,086"
ADAMI,"Adamas Trust, Inc. 9.125% Senior Notes Due 2029",$25.18,-0.037,-0.147%,"2,280,790,526"
QFIN,"Qfin Holdings, Inc. American Depositary Shares",$16.89,-0.03,-0.177%,"2,273,394,000"
GCMG,GCM Grosvenor Inc. Class A Common Stock,$11.68,0.07,0.603%,"2,268,214,302"
ADAMM,"Adamas Trust, Inc. 7.875% Series E Fixed-to-Floating Rate Cumulative Redeemable Preferred Stock",$25.11,0.0399,0.159%,"2,267,773,969"
HCI,"HCI Group, Inc. Common Stock",$174.95,-1.51,-0.856%,"2,267,358,473"
RARE,Ultragenyx Pharmaceutical Inc. Common Stock,$23.50,-0.57,-2.368%,"2,267,222,872"
CSGS,"CSG Systems International, Inc. Common Stock",$79.48,0.02,0.025%,"2,266,783,668"
BELFA,Bel Fuse Inc. Class A Common Stock,$178.98,3.79,2.163%,"2,265,987,566"
CIVI,"Civitas Resources, Inc. Common Stock",$26.55,-0.48,-1.776%,"2,264,799,402"
OGN,Organon & Co. Common Stock ,$8.70,0.09,1.045%,"2,261,851,334"
KMPR,Kemper Corporation,$38.61,-0.06,-0.155%,"2,260,494,265"
LU,"Lufax Holding Ltd American Depositary Shares, each representing two (2) Ordinary Shares",$2.60,UNCH,--,"2,253,264,000"
SLNO,"Soleno Therapeutics, Inc. Common Stock",$41.95,-0.51,-1.201%,"2,253,135,549"
TPB,"Turning Point Brands, Inc. Common Stock",$118.01,2.67,2.315%,"2,250,540,034"
BANR,Banner Corporation Common Stock,$65.96,1.89,2.95%,"2,248,307,943"
SVM,Silvercorp Metals Inc. Common Shares,$10.20,0.13,1.291%,"2,247,175,097"
WD,"Walker & Dunlop, Inc Common Stock",$65.93,1.30,2.011%,"2,245,854,816"
HI,Hillenbrand Inc Common Stock,$31.83,UNCH,--,"2,244,232,049"
GLPG,Galapagos NV American Depositary Shares,$34.03,-0.09,-0.264%,"2,242,477,326"
SRPT,"Sarepta Therapeutics, Inc. Common Stock (DE)",$21.31,-1.49,-6.535%,"2,233,014,955"
FRME,First Merchants Corporation Common Stock,$38.53,0.73,1.931%,"2,227,998,021"
USAR,"USA Rare Earth, Inc. Class A Common Stock",$16.79,-1.49,-8.151%,"2,227,001,439"
LASR,"nLIGHT, Inc. Common Stock",$43.83,0.66,1.529%,"2,225,950,687"
EVCM,EverCommerce Inc. Common Stock,$12.41,0.37,3.073%,"2,225,949,173"
IVT,InvenTrust Properties Corp. Common Stock,$28.67,0.09,0.315%,"2,225,347,625"
TRMD,TORM plc Class A Common Stock,$22.73,-0.53,-2.279%,"2,223,313,379"
PMTU,PennyMac Mortgage Investment Trust 8.50% Senior Notes due 2028,$25.51,0.06,0.236%,"2,219,793,568"
RVLV,"Revolve Group, Inc. Class A Common Stock",$30.93,0.66,2.18%,"2,206,367,858"
TRN,"Trinity Industries, Inc. Common Stock",$27.48,-0.24,-0.866%,"2,203,360,772"
NOG,"Northern Oil and Gas, Inc. Common Stock",$22.56,-0.37,-1.614%,"2,201,923,184"
SAH,"Sonic Automotive, Inc. Common Stock",$64.36,1.26,1.997%,"2,199,353,942"
BUSE,First Busey Corporation Class A Common Stock,$24.86,0.66,2.727%,"2,197,848,809"
HTH,Hilltop Holdings Inc.,$35.83,0.71,2.022%,"2,197,401,481"
SDRL,Seadrill Limited Common Shares,$35.19,-0.09,-0.255%,"2,194,947,077"
OLMA,"Olema Pharmaceuticals, Inc. Common Stock",$29.19,0.42,1.46%,"2,194,259,996"
APPN,Appian Corporation Class A Common Stock,$29.66,-0.79,-2.594%,"2,189,595,163"
EPAC,Enerpac Tool Group Corp. Common Stock,$41.40,1.22,3.036%,"2,184,939,027"
ALKT,"Alkami Technology, Inc. Common Stock",$20.69,-0.89,-4.124%,"2,172,532,988"
BWLP,BW LPG Limited Common Shares,$14.32,0.02,0.14%,"2,170,030,504"
NYAX,Nayax Ltd. Ordinary Shares,$59.08,0.36,0.613%,"2,169,758,373"
VAC,Marriott Vacations Worldwide Corporation Common Stock,$62.48,-0.06,-0.096%,"2,162,682,158"
NTB,Bank of N.T. Butterfield & Son Limited (The) Voting Ordinary Shares,$50.27,0.43,0.863%,"2,161,610,000"
KSS,Kohl's Corporation Common Stock,$19.26,-0.05,-0.259%,"2,160,763,819"
NHC,National HealthCare Corporation Common Stock,$139.01,3.70,2.734%,"2,156,775,320"
EXTR,"Extreme Networks, Inc. Common Stock",$16.09,0.03,0.187%,"2,151,530,327"
BUR,Burford Capital Limited Ordinary Shares,$9.83,0.04,0.409%,"2,150,917,940"
UNFI,"United Natural Foods, Inc. Common Stock",$35.22,0.52,1.499%,"2,146,018,595"
MGNI,"Magnite, Inc. Common Stock",$14.90,-0.40,-2.614%,"2,140,353,248"
ASGN,ASGN Incorporated Common Stock,$50.02,0.64,1.296%,"2,135,854,000"
DHT,"DHT Holdings, Inc.",$13.28,-0.44,-3.207%,"2,132,209,948"
NOVTU,Novanta Inc. Tangible Equity Units,$59.60,0.60,1.017%,"2,132,197,331"
CLVT,Clarivate Plc Ordinary Shares,$3.22,0.02,0.625%,"2,129,820,922"
KALU,Kaiser Aluminum Corporation Common Stock,$131.22,3.56,2.789%,"2,126,584,781"
KN,Knowles Corporation Common Stock,$24.93,0.93,3.875%,"2,122,836,468"
VVX,"V2X, Inc. Common Stock",$67.28,0.43,0.643%,"2,121,680,384"
SFB,Stifel Financial Corporation 5.20% Senior Notes due 2047,$20.72,0.08,0.388%,"2,117,032,972"
TSLX,"Sixth Street Specialty Lending, Inc. Common Stock",$22.40,0.37,1.68%,"2,116,663,920"
HNI,HNI Corporation Common Stock,$46.12,0.80,1.765%,"2,113,737,757"
ARR,"ARMOUR Residential REIT, Inc.",$18.82,-0.05,-0.265%,"2,105,924,802"
MTX,Minerals Technologies Inc. Common Stock,$67.64,0.84,1.257%,"2,105,924,593"
NUVB,Nuvation Bio Inc. Class A Common Stock,$6.14,-0.17,-2.694%,"2,104,997,279"
SM,SM Energy Company Common Stock,$18.34,-0.23,-1.239%,"2,100,923,881"
DJTWW,Trump Media & Technology Group Corp. Warrants,$7.4994,-0.1605,-2.095%,"2,099,814,271"
ADEA,Adeia Inc. Common Stock,$19.17,0.21,1.108%,"2,099,310,361"
AVDL,Avadel Pharmaceuticals plc Ordinary Share,$21.48,-0.02,-0.093%,"2,097,665,143"
HRMY,"Harmony Biosciences Holdings, Inc. Common Stock",$36.41,0.37,1.027%,"2,097,083,395"
PGNY,"Progyny, Inc. Common Stock",$24.31,-1.81,-6.93%,"2,095,805,309"
HUN,Huntsman Corporation Common Stock,$12.05,0.33,2.816%,"2,093,699,863"
DX,"Dynex Capital, Inc. Common Stock",$14.26,0.20,1.422%,"2,093,678,084"
PRGO,Perrigo Company plc Ordinary Shares,$15.17,0.31,2.086%,"2,087,756,217"
HLIO,"Helios Technologies, Inc. Common Stock",$62.91,1.34,2.176%,"2,084,113,558"
CXW,"CoreCivic, Inc. Common Stock",$19.91,-0.02,-0.10%,"2,082,280,481"
ZLAB,Zai Lab Limited American Depositary Shares,$18.82,-0.79,-4.029%,"2,081,374,563"
ADAML,"Adamas Trust, Inc. 6.875% Series F Fixed-to-Floating Rate Cumulative Redeemable Preferred Stock, $0.01 par value per share",$23.045,-0.045,-0.195%,"2,081,276,428"
EFSC,Enterprise Financial Services Corporation Common Stock,$56.21,1.18,2.144%,"2,080,383,195"
GEL,"Genesis Energy, L.P. Common Units",$16.98,0.39,2.351%,"2,079,444,120"
FIHL,Fidelis Insurance Holdings Limited Common Shares,$18.60,-0.01,-0.054%,"2,078,984,105"
PRKS,United Parks & Resorts Inc. Common Stock,$38.09,-0.56,-1.449%,"2,077,832,773"
CENT,Central Garden & Pet Company Common Stock,$33.24,0.15,0.453%,"2,071,939,147"
UMBFO,"UMB Financial Corporation Depositary Shares Each Representing a 1/400th Interest in a Share of 7.750% Fixed-Rate Reset Non-Cumulative Perpetual Preferred Stock, Series B",$27.26,0.18,0.665%,"2,070,524,032"
SGRY,"Surgery Partners, Inc. Common Stock",$16.00,0.59,3.829%,"2,069,468,464"
SLVM,Sylvamo Corporation Common Stock,$52.27,0.11,0.211%,"2,061,437,693"
ATRC,"AtriCure, Inc. Common Stock",$41.46,4.09,10.945%,"2,061,266,322"
ARCB,ArcBest Corporation Common Stock,$91.49,1.58,1.757%,"2,059,533,311"
NEOG,Neogen Corporation Common Stock,$9.46,0.07,0.745%,"2,057,795,780"
VZLA,Vizsla Silver Corp. Common Shares,$5.98,0.06,1.014%,"2,057,683,274"
OSW,OneSpaWorld Holdings Limited Common Shares,$20.18,-0.68,-3.26%,"2,057,399,049"
TNK,Teekay Tankers Ltd.,$59.81,-1.61,-2.621%,"2,056,398,305"
SBET,"SharpLink Gaming, Inc. Common Stock",$10.44,-0.44,-4.044%,"2,053,476,914"
VECO,Veeco Instruments Inc. Common Stock,$34.09,0.81,2.434%,"2,050,939,966"
AORT,"Artivion, Inc. Common Stock",$43.29,0.79,1.859%,"2,050,861,109"
PRDO,Perdoceo Education Corporation Common Stock,$31.81,0.84,2.712%,"2,046,097,962"
CIMN,Chimera Investment Corporation 9.000% Senior Notes due 2029,$25.37,0.03,0.118%,"2,043,063,758"
ADAMN,"Adamas Trust, Inc. 8.00% Series D Fixed-to-Floating Rate Cumulative Redeemable Preferred Stock",$22.60,0.13,0.579%,"2,041,086,885"
AVAH,Aveanna Healthcare Holdings Inc. Common Stock,$9.76,0.42,4.497%,"2,038,975,098"
CCS,"Century Communities, Inc. Common Stock",$69.13,0.52,0.758%,"2,031,335,899"
CRML,Critical Metals Corp. Ordinary Shares,$17.25,-0.675,-3.766%,"2,030,400,797"
ADUS,Addus HomeCare Corporation Common Stock,$109.80,-0.65,-0.589%,"2,029,463,156"
IOSP,Innospec Inc. Common Stock,$81.89,1.04,1.286%,"2,029,036,190"
SYBT,"Stock Yards Bancorp, Inc. Common Stock",$68.83,1.38,2.046%,"2,028,658,114"
FIGS,"FIGS, Inc. Class A Common Stock",$12.33,0.03,0.244%,"2,028,268,959"
GNL,"Global Net Lease, Inc. Common Stock",$9.25,0.09,0.983%,"2,027,895,491"
SEDG,"SolarEdge Technologies, Inc. Common Stock",$33.84,-0.94,-2.703%,"2,023,633,726"
ALM,Almonty Industries Inc. Common Shares,$9.00,-0.03,-0.332%,"2,023,304,472"
PLAB,"Photronics, Inc. Common Stock",$34.22,2.80,8.912%,"2,021,192,015"
IRDM,Iridium Communications Inc Common Stock,$19.27,-0.42,-2.133%,"2,018,449,331"
NTCT,"NetScout Systems, Inc. Common Stock",$27.95,0.46,1.673%,"2,017,813,160"
NN,NextNav Inc. Common Stock,$14.93,0.37,2.541%,"2,012,998,284"
SLDE,"Slide Insurance Holdings, Inc. Common Stock",$16.17,-0.44,-2.649%,"2,009,766,050"
XZO,"Exzeo Group, Inc. Common Stock",$22.14,0.49,2.263%,"2,009,676,338"
WERN,"Werner Enterprises, Inc. Common Stock",$33.54,0.45,1.36%,"2,006,708,832"
PCT,"PureCycle Technologies, Inc. Common stock",$11.105,-0.355,-3.098%,"2,001,102,566"
WT,"WisdomTree, Inc. Common Stock",$14.22,0.29,2.082%,"2,000,968,438"
HWCPZ,Hancock Whitney Corporation 6.25% Subordinated Notes due 2060,$23.59,0.1002,0.427%,"1,999,369,931"
MCW,"Mister Car Wash, Inc. Common Stock",$6.10,-0.03,-0.489%,"1,998,167,063"
STC,Stewart Information Services Corporation Common Stock,$66.64,1.00,1.523%,"1,993,843,877"
NIC,Nicolet Bankshares Inc. Common Stock,$133.08,2.81,2.157%,"1,986,907,955"
STRA,"Strategic Education, Inc. Common Stock",$84.52,0.70,0.835%,"1,985,088,953"
UFPT,"UFP Technologies, Inc. Common Stock",$257.36,-3.15,-1.209%,"1,984,874,588"
BGR,BlackRock Energy and Resources Trust,$14.63,0.04,0.274%,"1,983,626,018"
EFXT,Enerflex Ltd Common Shares,$16.28,0.30,1.877%,"1,982,932,962"
ANDE,"Andersons, Inc. (The) Common Stock",$58.47,0.65,1.124%,"1,978,573,522"
CMPR,Cimpress plc Ordinary Shares (Ireland),$80.18,0.45,0.564%,"1,978,183,641"
TALO,"Talos Energy, Inc. Common Stock",$11.63,-0.34,-2.84%,"1,976,969,418"
WLDN,"Willdan Group, Inc. Common Stock",$133.99,4.78,3.699%,"1,976,336,689"
VOYG,"Voyager Technologies, Inc. Class A Common Stock",$33.15,-1.19,-3.465%,"1,974,008,940"
