Symbol,Name,Last Sale,Net Change,% Change,Market Cap
EGY,"VAALCO Energy, Inc.  Common Stock",$4.41,0.24,5.755%,"459,778,896"
LZM,Lifezone Metals Limited Ordinary Shares,$5.68,-0.16,-2.74%,"459,197,169"
ATEX,Anterix Inc. Common Stock,$24.52,0.47,1.954%,"458,931,645"
ABSI,Absci Corporation Common Stock,$3.05,-0.30,-8.955%,"458,633,170"
GTN,"Gray Media, Inc. Common Stock",$4.49,0.21,4.907%,"458,369,072"
CVGW,"Calavo Growers, Inc. Common Stock",$25.62,3.04,13.463%,"457,402,135"
SFST,"Southern First Bancshares, Inc. Common Stock",$55.85,2.74,5.159%,"457,365,535"
GLRE,"Greenlight Capital Re, Ltd. Class A Ordinary Shares",$13.40,-0.03,-0.223%,"456,929,628"
FPI,Farmland Partners Inc. Common Stock,$10.58,0.01,0.095%,"455,972,132"
PANL,Pangaea Logistics Solutions Ltd. Common Shares,$7.01,0.19,2.786%,"455,465,553"
THM,"International Tower Hill Mines, Ltd. Ordinary Shares (Canada)",$2.19,-0.02,-0.905%,"455,269,186"
EAF,GrafTech International Ltd. Common Stock,$17.63,-0.38,-2.11%,"455,208,539"
ANGO,"AngioDynamics, Inc. Common Stock",$11.01,0.78,7.625%,"453,803,420"
TRC,Tejon Ranch Co Common Stock,$16.85,0.50,3.058%,"453,163,142"
NMG,Nouveau Monde Graphite Inc. Common Shares,$2.97,-0.12,-3.883%,"452,711,769"
PSTL,"Postal Realty Trust, Inc. Class A Common Stock",$17.35,0.13,0.755%,"452,186,735"
MG,Mistras Group Inc Common Stock,$14.32,0.21,1.488%,"451,769,551"
HELE,Helen of Troy Limited Common Stock,$19.53,0.48,2.52%,"450,598,172"
CARE,"Carter Bankshares, Inc. Common Stock",$20.38,0.14,0.692%,"450,133,957"
TCI,"Transcontinental Realty Investors, Inc. Common Stock",$52.04,0.02,0.038%,"449,590,005"
CGC,Canopy Growth Corporation Common Shares,$1.22,UNCH,--,"449,518,065"
MGRD,"Affiliated Managers Group, Inc. 4.200% Junior Subordinated Notes due 2061",$15.80,0.08,0.509%,"448,910,595"
BCYC,Bicycle Therapeutics plc American Depositary Shares,$6.47,-0.15,-2.266%,"448,810,287"
CIVB,"Civista Bancshares, Inc. Common Stock",$23.23,0.60,2.651%,"448,638,179"
ETB,Eaton Vance Tax-Managed Buy-Write Income Fund Eaton Vance Tax-Managed Buy-Write Income Fund Common Shares of Beneficial Interest,$15.26,-0.10,-0.651%,"448,207,533"
CWBC,Community West Bancshares Common Stock,$23.38,0.77,3.406%,"447,924,047"
ORN,"Orion Group Holdings, Inc. Common",$11.22,0.49,4.567%,"447,688,973"
CLFD,"Clearfield, Inc. Common Stock",$32.34,-0.11,-0.339%,"447,556,365"
IMMP,Immutep Limited American Depositary Shares,$3.03,-0.07,-2.258%,"445,991,863"
OPAL,OPAL Fuels Inc. Class A Common Stock,$2.57,0.05,1.984%,"445,625,700"
GUT,Gabelli Utility Trust (The) Common Stock,$6.07,-0.10,-1.621%,"445,532,106"
DMAC,DiaMedica Therapeutics Inc. Common Stock,$8.54,-0.06,-0.698%,"444,741,329"
JACK,Jack In The Box Inc. Common Stock,$23.52,0.94,4.163%,"444,453,300"
EPRX,Eupraxia Pharmaceuticals Inc. Common Stock,$8.77,0.34,4.033%,"444,185,863"
RILYL,"BRC Group Holdings, Inc. Depositary Shares each representing 1/1000th in a share of 7.375% Series B Cumulative Perpetual Preferred Stock, par value $0.0001",$14.50,4.93,51.515%,"443,657,457"
ALT,"Altimmune, Inc. Common Stock",$4.24,0.06,1.435%,"442,037,694"
CTGO,"Contango ORE, Inc. Common Stock",$29.48,0.05,0.17%,"441,140,135"
DDI,"DoubleDown Interactive Co., Ltd. American Depository Shares",$8.90,-0.06,-0.67%,"441,025,616"
SLDB,Solid Biosciences Inc. Common Stock,$5.66,-0.15,-2.582%,"440,971,953"
VSTM,"Verastem, Inc. Common Stock",$6.60,-0.19,-2.798%,"440,721,640"
WEST,Westrock Coffee Company Common Stock,$4.55,0.08,1.79%,"440,553,341"
VNDA,Vanda Pharmaceuticals Inc. Common Stock,$7.45,-0.25,-3.247%,"440,269,894"
ADCT,ADC Therapeutics SA Common Shares,$3.55,-0.16,-4.313%,"439,763,744"
EVH,"Evolent Health, Inc Class A Common Stock",$3.94,0.04,1.026%,"439,707,373"
WNC,Wabash National Corporation Common Stock,$10.85,0.26,2.455%,"439,605,511"
ZUMZ,Zumiez Inc. Common Stock,$25.86,0.79,3.151%,"438,316,087"
DGNX,Diginex Limited Ordinary Shares,$2.17,-0.49,-18.421%,"438,231,726"
EVN,Eaton Vance Municipal Income Trust Common Stock,$11.04,-0.02,-0.181%,"437,925,480"
SUPX,SuperX AI Technology Limited Ordinary Shares,$13.89,-0.56,-3.875%,"437,621,507"
KELYB,"Kelly Services, Inc. Class B Common Stock",$12.35,UNCH,--,"436,436,724"
ADUR,Aduro Clean Technologies Inc. Common Stock,$13.99,-0.60,-4.112%,"436,397,149"
BWAY,BrainsWay Ltd. American Depositary Shares,$23.10,-0.45,-1.911%,"435,879,167"
DVLT,Datavault AI Inc. Common Stock,$0.7372,0.019,2.646%,"435,733,495"
EB,"Eventbrite, Inc. Class A Common Stock",$4.46,UNCH,--,"435,631,196"
FDMT,"4D Molecular Therapeutics, Inc. Common Stock",$7.61,-1.15,-13.128%,"434,797,921"
AVXL,Anavex Life Sciences Corp. Common Stock,$4.85,0.03,0.622%,"433,338,319"
BMRC,Bank of Marin Bancorp Common Stock,$26.91,0.56,2.125%,"433,108,000"
CTNM,"Contineum Therapeutics, Inc. Class A Common Stock",$11.84,0.08,0.68%,"432,508,676"
GRVY,"GRAVITY Co., Ltd. American Depository Shares",$62.24,-0.275,-0.44%,"432,499,536"
PERI,Perion Network Ltd. Ordinary Shares,$9.59,0.07,0.735%,"431,906,556"
CCSI,"Consensus Cloud Solutions, Inc. Common Stock",$22.67,UNCH,--,"430,860,919"
COFS,"ChoiceOne Financial Services, Inc. Common Stock",$28.65,0.64,2.285%,"430,429,922"
ONIT,Onity Group Inc. Common Stock,$53.35,1.98,3.854%,"429,940,928"
NGS,"Natural Gas Services Group, Inc. Common Stock",$34.20,0.20,0.588%,"429,856,961"
HVT,"Haverty Furniture Companies, Inc. Common Stock",$26.42,-0.03,-0.113%,"429,769,569"
FRBA,First Bank Common Stock,$17.05,0.32,1.913%,"428,541,571"
RILYP,"BRC Group Holdings, Inc. Depositary Shares, each representing a 1/1000th fractional interest in a share of Series A Cumulative Perpetual Preferred Stock",$14.00,4.03,40.421%,"428,358,924"
OBE,Obsidian Energy Ltd. Common Shares,$6.37,-0.41,-6.047%,"427,530,334"
HQL,abrdn Life Sciences Investors Shares of Beneficial Interest,$16.60,-0.26,-1.542%,"426,281,958"
LAW,"CS Disco, Inc. Common Stock",$6.82,0.10,1.488%,"426,192,671"
DEFT,"Defi Technologies, Inc. Common Stock",$1.10,-0.02,-1.786%,"424,465,773"
CAMP,CAMP4 Therapeutics Corporation Common Stock,$5.78,-0.14,-2.365%,"423,072,730"
AGL,"agilon health, inc. Common Stock",$1.02,0.0515,5.318%,"422,873,236"
ARQQ,Arqit Quantum Inc. Ordinary Shares,$26.97,0.36,1.353%,"422,130,637"
NEWT,"NewtekOne, Inc. Common Stock",$14.59,0.41,2.891%,"421,465,634"
NBP,NovaBridge Biosciences American Depositary Shares,$3.66,0.13,3.683%,"420,876,854"
HSHP,Himalaya Shipping Ltd. Common Shares,$9.03,0.03,0.333%,"420,346,500"
API,"Agora, Inc. American Depositary Shares",$4.47,0.01,0.224%,"417,993,012"
SNDL,SNDL Inc. Common Shares,$1.62,-0.01,-0.613%,"417,150,000"
CLPT,"ClearPoint Neuro, Inc. Common Stock",$14.65,-0.76,-4.932%,"416,401,462"
TLS,Telos Corporation Common Stock,$5.64,-0.01,-0.177%,"415,974,416"
PTLO,Portillo's Inc. Class A Common Stock,$5.51,0.06,1.101%,"415,314,316"
DDT,Dillard's Capital Trust I,$26.60,0.01,0.038%,"415,304,896"
GBLI,"Global Indemnity Group, LLC Class A Common Stock ",$28.8856,-0.2522,-0.866%,"413,756,006"
TRDA,"Entrada Therapeutics, Inc. Common Stock",$10.82,0.24,2.268%,"413,532,090"
BSVN,Bank7 Corp. Common stock,$43.72,0.58,1.344%,"413,302,211"
ETON,"Eton Pharmaceuticals, Inc. Common Stock",$15.41,-0.26,-1.659%,"413,258,214"
AIRO,"AIRO Group Holdings, Inc. Common Stock",$13.20,-0.03,-0.227%,"413,210,609"
BAND,Bandwidth Inc. Class A Common Stock,$13.53,-0.02,-0.148%,"412,956,991"
BMBL,Bumble Inc. Class A Common Stock,$3.65,0.06,1.671%,"411,497,332"
ALLT,Allot Ltd. Ordinary Shares,$10.32,-0.50,-4.621%,"409,629,840"
FBRX,"Forte Biosciences, Inc. Common Stock",$32.69,0.60,1.87%,"409,505,505"
SDHY,PGIM Short Duration High Yield Opportunities Fund Common Shares,$16.56,-0.06,-0.361%,"408,585,807"
SLP,"Simulations Plus, Inc. Common Stock",$20.26,0.37,1.86%,"408,169,812"
LXFR,Luxfer Holdings PLC Ordinary Shares,$15.27,0.27,1.80%,"408,037,458"
THH,TryHard Holdings Limited Ordinary Shares,$7.60,-24.40,-76.25%,"407,711,500"
SGU,Star Group L.P. Common Stock,$12.36,0.12,0.98%,"407,589,725"
AQST,"Aquestive Therapeutics, Inc. Common Stock",$3.34,-0.18,-5.114%,"407,490,397"
VKI,Invesco Advantage Municipal Income Trust II Common Shares of Beneficial Interest (DE),$9.16,-0.06,-0.651%,"406,759,143"
CODI,D/B/A Compass Diversified Holdings Shares of Beneficial Interest,$5.40,0.01,0.186%,"406,274,216"
TRON,Tron Inc. Common Stock,$1.58,-0.05,-3.067%,"406,242,332"
VHI,"Valhi, Inc. Common Stock",$14.34,0.38,2.722%,"405,854,882"
WILC,"G. Willi-Food International,  Ltd. Ordinary Shares",$29.23,-0.27,-0.915%,"405,332,907"
BRBS,"Blue Ridge Bankshares, Inc. Common Stock",$4.42,0.12,2.791%,"404,379,882"
YSG,"Yatsen Holding Limited American Depositary Shares, each representing twenty (20) Class A Ordinary Shares",$4.30,-0.14,-3.153%,"403,547,578"
PNNT,PennantPark Investment Corporation Common Stock,$6.18,0.02,0.325%,"403,529,861"
NEXN,Nexxen International Ltd. Ordinary Shares,$6.14,0.19,3.193%,"402,554,794"
RXST,"RxSight, Inc. Common Stock",$9.79,0.12,1.241%,"402,531,906"
ILPT,Industrial Logistics Properties Trust Common Shares of Beneficial Interest,$6.03,0.03,0.50%,"401,955,187"
RCKT,"Rocket Pharmaceuticals, Inc. Common Stock",$3.71,-0.25,-6.313%,"401,504,466"
VERI,"Veritone, Inc. Common Stock",$4.37,-0.21,-4.585%,"401,192,321"
XPOF,"Xponential Fitness, Inc. Class A Common Stock",$8.20,0.19,2.372%,"401,037,400"
SOR,"Source Capital, Inc. Cmn Shs of BI",$48.0463,-0.0037,-0.008%,"400,921,534"
LEO,"BNY Mellon Strategic Municipals, Inc. Common Stock",$6.43,UNCH,--,"400,530,191"
CMTG,"Claros Mortgage Trust, Inc. Common Stock",$2.85,0.03,1.064%,"399,623,477"
SAJ,Saratoga Investment Corp 8.00% Notes due 2027,$25.49,UNCH,--,"399,380,659"
OBT,"Orange County Bancorp, Inc. Common Stock",$29.86,0.76,2.612%,"399,130,856"
NGEN,NervGen Pharma Corp. Common stock,$5.47,-0.09,-1.619%,"398,411,771"
NFE,New Fortress Energy Inc. Class A Common Stock,$1.40,0.11,8.527%,"398,373,935"
SAZ,Saratoga Investment Corp 8.50% Notes due 2028,$25.4016,0.0216,0.085%,"397,995,596"
SAY,Saratoga Investment Corp 8.125% Notes due 2027,$25.39,0.0001,0.00%,"397,813,846"
VSTA,Vasta Platform Limited Class A Ordinary Shares,$4.96,-0.01,-0.201%,"397,802,034"
MCI,Barings Corporate Investors Common Stock,$19.63,0.67,3.534%,"397,737,544"
BYRN,"Byrna Technologies, Inc. Common Stock",$17.50,0.73,4.353%,"397,696,513"
GCO,Genesco Inc. Common Stock,$36.76,1.12,3.143%,"396,740,975"
BNTC,Benitec Biopharma Inc. Common Stock,$11.71,-0.42,-3.462%,"396,526,666"
VFF,"Village Farms International, Inc. Common Shares",$3.43,-0.10,-2.833%,"396,225,937"
NATR,"Nature's Sunshine Products, Inc. Common Stock",$22.64,0.39,1.753%,"396,099,546"
PDLB,"Ponce Financial Group, Inc. Common Stock",$16.49,0.27,1.665%,"395,778,551"
USNA,"USANA Health Sciences, Inc. Common Stock",$21.60,1.12,5.469%,"394,866,511"
LSAK,"Lesaka Technologies, Inc. Common Stock",$4.67,-0.04,-0.849%,"392,683,483"
HYLN,Hyliion Holdings Corp. Class A Common Stock,$2.23,0.13,6.19%,"392,422,528"
FBIOP,"Fortress Biotech, Inc. 9.375% Series A Cumulative Redeemable Perpetual Preferred Stock",$12.403,0.063,0.511%,"392,405,333"
BOC,Boston Omaha Corporation Class A Common Stock,$12.47,UNCH,--,"392,224,322"
HELP,Cybin Inc. Common Stock,$7.85,-0.29,-3.563%,"391,668,928"
CTRN,"Citi Trends, Inc. Common Stock",$46.86,-1.11,-2.314%,"391,058,884"
GPRK,Geopark Ltd Common Shares,$7.63,-0.13,-1.675%,"391,016,800"
SAT,Saratoga Investment Corp 6.00% Notes due 2027,$24.93,0.0089,0.036%,"390,606,506"
GNE,Genie Energy Ltd. Class B Common Stock Stock,$14.70,0.22,1.519%,"389,475,824"
SCM,Stellus Capital Investment Corporation Common Stock,$13.44,0.17,1.281%,"389,051,094"
WTBA,West Bancorporation Common Stock,$22.87,0.43,1.916%,"387,435,753"
AENT,Alliance Entertainment Holding Corporation Class A Common Stock,$7.60,-0.01,-0.131%,"387,276,012"
GCBC,"Greene County Bancorp, Inc. Common Stock",$22.72,0.09,0.398%,"386,849,532"
TITN,Titan Machinery Inc. Common Stock,$16.55,0.20,1.223%,"386,776,380"
ATLCZ,Atlanticus Holdings Corporation 9.25% Senior Notes due 2029,$25.55,0.09,0.353%,"386,455,222"
ESEA,Euroseas Ltd. Common Stock (Marshall Islands),$55.15,-0.20,-0.361%,"386,414,652"
ALMU,"Aeluma, Inc. Common Stock",$21.63,0.17,0.792%,"386,265,577"
DBI,Designer Brands Inc. Class A Common Stock,$7.78,0.47,6.43%,"386,168,796"
NATH,"Nathan's Famous, Inc. Common Stock",$94.42,0.77,0.822%,"386,131,534"
ISSC,"Innovative Solutions and Support, Inc. Common Stock",$21.75,-0.55,-2.466%,"386,113,700"
LND,Brasilagro Brazilian Agric Real Estate Co Sponsored ADR (Brazil),$3.76,0.02,0.535%,"386,089,749"
MEC,"Mayville Engineering Company, Inc. Common Stock",$18.97,-0.11,-0.577%,"385,439,479"
ENTA,"Enanta Pharmaceuticals, Inc. Common Stock",$13.35,-0.49,-3.54%,"385,315,723"
SAR,Saratoga Investment Corp New,$23.80,0.37,1.579%,"385,180,580"
CZNC,Citizens & Northern Corp Common Stock,$21.61,0.58,2.758%,"384,698,476"
AGCC,Agencia Comercial Spirits Ltd Class A Ordinary Shares,$11.273,-0.547,-4.628%,"384,567,122"
KFS,"Kingsway Financial Services, Inc. Common Stock (DE)",$13.26,-0.02,-0.151%,"383,958,576"
IONR,ioneer Ltd American Depositary Shares,$5.75,-0.195,-3.28%,"383,497,636"
AUTL,Autolus Therapeutics plc American Depositary Share,$1.44,0.02,1.408%,"383,246,332"
ELVA,Electrovaya Inc. Common Shares,$9.06,0.37,4.258%,"381,506,815"
MTRX,Matrix Service Company Common Stock,$13.56,0.24,1.802%,"381,368,586"
LCTX,"Lineage Cell Therapeutics, Inc. Common Stock",$1.65,-0.05,-2.941%,"380,040,436"
TTGT,"TechTarget, Inc. Common Stock",$5.25,0.07,1.351%,"378,829,007"
BWFG,"Bankwell Financial Group, Inc. Common Stock",$48.07,1.16,2.473%,"378,668,685"
ATGL,Alpha Technology Group Limited Class A Ordinary Shares,$23.00,-1.23,-5.076%,"378,637,500"
SPIR,"Spire Global, Inc. Class A Common Stock",$10.90,-0.03,-0.274%,"377,222,677"
GLSI,"Greenwich LifeSciences, Inc. Common Stock",$27.19,-2.10,-7.17%,"376,704,915"
ELA,Envela Corporation Common Stock,$14.46,0.72,5.24%,"375,431,863"
OWLT,"Owlet, Inc. Class A Common Stock",$13.60,-0.39,-2.788%,"375,096,255"
VENU,Venu Holding Corporation Common Stock,$8.75,0.13,1.508%,"374,915,993"
JFIN,Jiayin Group Inc. American Depositary Shares,$7.01,0.27,4.006%,"374,120,517"
DAVA,Endava plc American Depositary Shares (each representing one Class A Ordinary Share),$6.88,-0.12,-1.714%,"373,773,909"
RBB,RBB Bancorp Common Stock,$21.86,0.33,1.533%,"372,645,168"
AII,"American Integrity Insurance Group, Inc. Common Stock",$19.03,0.03,0.158%,"372,546,580"
ATLCL,Atlanticus Holdings Corporation 6.125% Senior Notes due 2026,$24.63,0.0928,0.378%,"372,539,809"
LAND,Gladstone Land Corporation Common Stock,$9.99,0.28,2.884%,"372,295,662"
ACCO,Acco Brands Corporation Common Stock,$4.13,0.13,3.25%,"372,262,229"
QTRX,Quanterix Corporation Common Stock,$7.95,0.60,8.163%,"371,350,836"
BGIN,Bgin Blockchain Limited Class A Ordinary Shares,$3.28,-0.06,-1.796%,"371,085,886"
TACO,Berto Acquisition Corp. Ordinary Shares,$10.16,UNCH,--,"370,253,077"
ATLCP,"Atlanticus Holdings Corporation 7.625% Series B Cumulative Perpetual Preferred Stock, no par value per share",$24.41,-0.09,-0.367%,"369,604,747"
RM,Regional Management Corp. Common Stock,$38.04,-0.14,-0.367%,"369,475,102"
CMDB,Costamare Bulkers Holdings Limited Common Stock,$15.19,0.06,0.397%,"367,654,887"
VELO,"Velo3D, Inc. Common stock",$17.56,-0.49,-2.715%,"367,217,740"
ISBA,Isabella Bank Corporation Common stock,$50.00,1.29,2.648%,"366,754,800"
MCFT,"MasterCraft Boat Holdings, Inc. Common Stock",$22.49,0.38,1.719%,"366,335,067"
KELYA,"Kelly Services, Inc. Class A Common Stock",$10.35,0.03,0.291%,"365,758,712"
CNCK,Coincheck Group N.V. Ordinary Shares,$2.69,0.17,6.746%,"365,643,958"
AMCX,AMC Networks Inc. Class A Common Stock,$8.40,0.01,0.119%,"365,624,860"
SOHOO,Sotherly Hotels Inc. 7.875% Series C Cumulative Redeemable Perpetual Preferred Stock,$17.8324,0.0424,0.238%,"365,394,810"
TECX,"Tectonic Therapeutic, Inc. Common Stock",$19.51,-0.16,-0.813%,"365,154,623"
NCMI,"National CineMedia, Inc. Common Stock",$3.89,0.09,2.368%,"365,003,240"
ACIU,AC Immune SA Common Stock,$3.63,-0.04,-1.09%,"364,489,669"
ASLE,AerSale Corporation Common Stock,$7.72,0.09,1.18%,"364,268,285"
PUBM,"PubMatic, Inc. Class A Common Stock",$7.84,-0.08,-1.01%,"363,892,048"
ACTG,Acacia Research Corporation (Acacia Tech) Common Stock,$3.77,-0.05,-1.309%,"363,655,625"
KTF,DWS Municipal Income Trust,$9.17,-0.01,-0.109%,"362,223,601"
ALLO,"Allogene Therapeutics, Inc. Common Stock",$1.61,-0.09,-5.294%,"361,815,532"
SVC,Service Properties Trust Common Stock,$2.15,0.05,2.381%,"361,385,336"
AREC,American Resources Corporation Class A Common Stock,$3.56,-0.12,-3.261%,"360,960,176"
DCTH,"Delcath Systems, Inc. Common Stock",$10.21,-0.17,-1.638%,"360,553,061"
OEC,Orion S.A. Common Shares,$6.42,0.16,2.556%,"360,481,113"
CARL,"Carlsmed, Inc. Common Stock",$13.54,0.78,6.113%,"360,067,974"
PMO,Putnam Municipal Opportunities Trust Common Stock,$10.59,-0.04,-0.376%,"359,864,795"
TII,Titan Mining Corporation Common Shares,$3.93,0.74,23.197%,"359,554,800"
BGS,"B&G Foods, Inc. Common Stock",$4.49,0.23,5.399%,"359,096,955"
STRT,STRATTEC SECURITY CORPORATION Common Stock,$85.73,4.46,5.488%,"358,803,283"
BNR,Burning Rock Biotech Limited American Depositary Shares,$33.32,4.80,16.83%,"358,742,979"
PPT,Putnam Premier Income Trust Common Stock,$3.60,0.01,0.279%,"358,301,747"
RC,Ready Capital Corporation Common Stock,$2.21,0.09,4.245%,"358,299,070"
KNOP,KNOT Offshore Partners LP Common Units representing Limited Partner Interests,$10.50,-0.23,-2.144%,"357,473,351"
FJET,"Starfighters Space, Inc. Common Stock",$11.12,-0.32,-2.797%,"356,967,902"
XOMA,XOMA Royalty Corporation Common Stock,$28.79,-0.57,-1.941%,"356,509,535"
USCB,"USCB Financial Holdings, Inc. Class A Common Stock",$19.67,0.55,2.877%,"356,231,273"
NMRA,"Neumora Therapeutics, Inc. Common Stock",$2.13,-0.02,-0.93%,"355,899,813"
AKBA,"Akebia Therapeutics, Inc. Common Stock",$1.34,-0.04,-2.899%,"355,590,431"
FCEL,"FuelCell Energy, Inc. Common Stock",$7.45,-0.04,-0.534%,"355,186,520"
FHTX,Foghorn Therapeutics Inc. Common Stock,$6.28,-0.03,-0.475%,"355,142,095"
FVR,"FrontView REIT, Inc. Common Stock",$16.39,0.15,0.924%,"354,903,635"
MBI,MBIA Inc. Common Stock,$7.02,0.05,0.717%,"354,465,255"
CDRO,"Codere Online Luxembourg, S.A. Ordinary Shares",$7.75,UNCH,--,"353,716,309"
SOHOB,Sotherly Hotels Inc. 8.0% Series B Cumulative Redeemable Perpetual Preferred Stock,$17.2336,0.0386,0.224%,"353,125,098"
VFSWW,VinFast Auto Ltd. Warrant,$0.15,-0.01,-6.25%,"350,926,901"
RMNI,"Rimini Street, Inc. (DE) Common Stock",$3.82,-0.09,-2.302%,"350,492,640"
ELLO,Ellomay Capital Ltd Ordinary Shares (Israel),$27.24,-0.435,-1.572%,"350,104,415"
GFR,Greenfire Resources Ltd. Common Shares,$4.98,-0.09,-1.775%,"349,879,860"
VALU,"Value Line, Inc. Common Stock",$37.23,0.03,0.081%,"349,584,972"
SGHT,"Sight Sciences, Inc. Common Stock",$6.60,-0.29,-4.209%,"348,953,425"
FMAO,"Farmers & Merchants Bancorp, Inc. Common Stock",$25.37,0.08,0.316%,"348,836,079"
NC,"NACCO Industries, Inc. Common Stock",$46.47,0.41,0.89%,"346,664,109"
RWAY,Runway Growth Finance Corp. Common Stock,$9.59,0.17,1.805%,"346,525,415"
ORBS,Eightco Holdings Inc. Common Stock,$1.75,-0.06,-3.315%,"346,205,326"
ECC           ,Eagle Point Credit Company Inc. Common Stock,$5.70,0.01,0.176%,"345,776,387"
ARTNA,Artesian Resources Corporation Class A Common Stock,$33.51,0.14,0.42%,"345,593,489"
SOPH,SOPHiA GENETICS SA Ordinary Shares,$5.16,0.01,0.194%,"344,848,326"
CAN,Canaan Inc. American Depositary Shares,$0.8201,-0.055,-6.285%,"344,658,145"
CBIO,"Crescent Biopharma, Inc. Common Stock",$12.50,-0.13,-1.029%,"344,459,588"
XRX,Xerox Holdings Corporation Common Stock,$2.69,0.19,7.60%,"344,427,630"
CD,Chaince Digital Holdings Inc. Ordinary Shares,$5.40,-0.24,-4.255%,"343,907,440"
YRD,"Yiren Digital Ltd. American Depositary Shares, each representing two ordinary shares",$3.98,-0.01,-0.251%,"343,897,806"
GBAB,Guggenheim Taxable Municipal Bond & Investment Grade Debt Trust Common Shares of Beneficial Interest,$15.34,0.07,0.458%,"343,568,523"
NVA,Nova Minerals Limited American Depositary Shares,$9.14,-0.10,-1.082%,"343,533,152"
PEPG,PepGen Inc. Common Stock,$4.99,-0.16,-3.107%,"343,053,638"
CHSCP,CHS Inc. 8%  Cumulative Redeemable Preferred Stock,$27.92,-0.17,-0.605%,"342,634,324"
MVBF,MVB Financial Corp. Common Stock,$27.19,0.85,3.227%,"342,168,041"
AVBC,"Avidia Bancorp, Inc. Common Stock",$16.98,0.09,0.533%,"340,894,725"
FLYX,"flyExclusive, Inc. Class A Common Stock",$3.74,0.05,1.355%,"340,769,120"
OTLY,Oatly Group AB American Depositary Shares,$11.37,0.11,0.977%,"340,281,269"
LOCO,"El Pollo Loco Holdings, Inc. Common Stock",$11.35,0.29,2.622%,"339,988,512"
DDD,3D Systems Corporation Common Stock,$2.64,0.20,8.197%,"339,868,357"
AUNA,Auna SA Class A Ordinary Shares,$4.59,-0.05,-1.078%,"339,719,509"
CLDT,Chatham Lodging Trust (REIT) Common Shares of Beneficial Interest,$7.00,0.12,1.744%,"339,612,000"
PBFS,"Pioneer Bancorp, Inc. Common Stock",$13.53,0.15,1.121%,"339,339,801"
FRST,Primis Financial Corp. Common Stock,$13.75,0.30,2.23%,"338,860,294"
CUB,Lionheart Holdings Class A Ordinary Shares,$10.66,UNCH,--,"338,653,020"
VOXR,Vox Royalty Corp. Common Stock,$4.95,-0.10,-1.98%,"337,931,174"
ATNI,"ATN International, Inc. Common Stock",$22.13,0.33,1.514%,"337,646,063"
LWAY,"Lifeway Foods, Inc. Common Stock",$22.14,0.06,0.272%,"337,164,813"
EVI,"EVI Industries, Inc.  Common Stock",$26.24,0.84,3.307%,"337,037,555"
ONTF,"ON24, Inc. Common Stock",$7.97,UNCH,--,"336,990,688"
EFT,Eaton Vance Floating Rate Income Trust Common Shares of Beneficial Interest,$11.55,-0.01,-0.087%,"335,994,293"
MLP,"Maui Land & Pineapple Company, Inc. Common Stock",$16.98,UNCH,--,"335,214,219"
PKOH,Park-Ohio Holdings Corp. Common Stock,$23.24,0.36,1.573%,"334,753,771"
AARD,"Aardvark Therapeutics, Inc. Common Stock",$15.35,0.37,2.47%,"334,219,725"
FINS,Angel Oak Financial Strategies Income Term Trust Common Shares of Beneficial Interest,$13.32,0.01,0.075%,"333,834,338"
GREEL,Greenidge Generation Holdings Inc. 8.50% Senior Notes due 2026,$21.25,-0.0088,-0.041%,"333,060,111"
MPX,Marine Products Corporation Common Stock,$9.50,0.06,0.636%,"332,490,823"
SHMD,SCHMID Group N.V. Class A Ordinary Shares,$7.72,0.33,4.465%,"332,441,936"
TOI,"The Oncology Institute, Inc. Common Stock",$3.36,0.01,0.299%,"330,561,302"
MTLS,Materialise NV American Depositary Shares,$5.59,0.12,2.194%,"330,185,570"
CCCC,"C4 Therapeutics, Inc. Common Stock",$2.22,-0.11,-4.721%,"329,870,961"
CLW,Clearwater Paper Corporation Common Stock,$20.54,0.21,1.033%,"329,427,442"
OOMA,"Ooma, Inc. Common Stock",$11.93,-0.07,-0.583%,"329,268,000"
SMRT,"SmartRent, Inc. Class A Common Stock",$1.74,-0.04,-2.247%,"329,209,256"
BBCP,"Concrete Pumping Holdings, Inc. Common Stock",$6.47,-0.215,-3.216%,"329,034,470"
SITC,SITE Centers Corp. Common Stock,$6.27,-0.06,-0.948%,"328,938,872"
OFLX,"Omega Flex, Inc. Common Stock",$32.50,0.67,2.105%,"328,065,465"
NECB,"NorthEast Community Bancorp, Inc. Common Stock",$23.38,0.37,1.608%,"327,956,871"
SSP,E.W. Scripps Company (The) Class A Common Stock,$3.69,0.05,1.374%,"327,679,860"
QUAD,"Quad Graphics, Inc Class A Common Stock",$6.42,0.27,4.39%,"326,658,428"
ZH,"Zhihu Inc. American Depositary Shares, each representing three (3) Class A Ordinary Shares",$3.73,-0.09,-2.356%,"326,616,932"
LNKB,"LINKBANCORP, Inc. Common Stock",$8.72,0.15,1.75%,"326,613,251"
TBRG,"TruBridge, Inc. Common Stock",$21.74,-0.21,-0.957%,"326,295,356"
CADL,"Candel Therapeutics, Inc. Common Stock",$5.94,-0.27,-4.348%,"326,095,920"
CBAN,"Colony Bankcorp, Inc. Common Stock",$18.68,0.26,1.412%,"325,678,926"
WSBF,"Waterstone Financial, Inc. Common Stock (MD)",$17.64,0.25,1.438%,"325,580,034"
AURA,"Aura Biosciences, Inc. Common Stock",$5.11,-0.15,-2.852%,"324,501,705"
EOLS,"Evolus, Inc. Common Stock",$5.00,-0.02,-0.398%,"324,098,920"
XOMAP,XOMA Royalty Corporation 8.625% Series A Cumulative Perpetual Preferred Stock,$26.1201,UNCH,--,"323,447,889"
ZEPP,"Zepp Health Corporation American depositary shares, each representing sixteen Class A ordinary shares",$22.50,1.85,8.959%,"323,281,395"
BKTI,BK Technologies Corporation Common Stock,$86.59,-0.88,-1.006%,"323,174,748"
DENN,Denny's Corporation Common Stock,$6.26,0.01,0.16%,"322,383,702"
OFSSH,OFS Capital Corporation 4.95% Notes due 2028,$24.05,0.3094,1.303%,"322,223,776"
TSSI,"TSS, Inc. Common Stock",$11.16,0.59,5.582%,"321,910,613"
PBYI,Puma Biotechnology Inc Common Stock,$6.38,-0.04,-0.623%,"321,495,263"
CHSCO,CHS Inc. Class B Cumulative Redeemable Preferred Stock,$26.18,0.05,0.191%,"321,281,039"
EVO,Evotec SE American Depositary Shares,$3.62,-0.08,-2.162%,"321,068,736"
NVEC,NVE Corporation Common Stock,$66.22,1.175,1.806%,"320,317,133"
PLBC,Plumas Bancorp,$46.01,0.73,1.612%,"320,023,199"
PCB,PCB Bancorp Common Stock,$22.39,0.28,1.266%,"319,298,282"
HDSN,"Hudson Technologies, Inc. Common Stock",$7.42,0.16,2.204%,"319,083,633"
RNGR,"Ranger Energy Services, Inc. Class A Common Stock",$14.72,-0.04,-0.271%,"318,153,473"
BCML,BayCom Corp Common Stock,$29.18,0.33,1.144%,"317,996,724"
RLGT,"Radiant Logistics, Inc. Common Stock",$6.79,0.06,0.892%,"317,952,234"
CMRC,"Commerce.com, Inc. Series 1 Common Stock",$3.91,-0.08,-2.005%,"317,739,683"
FSBW,"FS Bancorp, Inc. Common Stock",$42.26,0.65,1.562%,"317,730,204"
RFMZ,"RiverNorth Flexible Municipal Income Fund II, Inc. Common Stock",$13.02,-0.07,-0.535%,"317,059,863"
XFOR,"X4 Pharmaceuticals, Inc. Common Stock",$3.62,-0.15,-3.979%,"316,520,811"
CNDT,Conduent Incorporated Common Stock ,$2.07,0.04,1.97%,"316,481,246"
IKT,"Inhibikase Therapeutics, Inc. Common Stock",$1.65,-0.05,-2.941%,"315,414,185"
NIOBW,NioCorp Developments Ltd. Warrant,$2.6419,-0.258,-8.897%,"315,339,099"
PLG,Platinum Group Metals Ltd. Ordinary Shares (Canada),$2.80,0.03,1.083%,"315,199,116"
SOHON,Sotherly Hotels Inc. 8.25% Series D Cumulative Redeemable Perpetual Preferred Stock,$15.36,0.045,0.294%,"314,734,095"
CHSCL,"CHS Inc Class B Cumulative Redeemable Preferred Stock, Series 4",$25.60,-0.0793,-0.309%,"314,163,277"
XOMAO,XOMA Royalty Corporation Depositary Shares Rep Series B 8.375% Cumulative Preferred Stock,$25.35,-0.06,-0.236%,"313,911,661"
