Symbol,Name,Last Sale,Net Change,% Change,Market Cap
NVDA,NVIDIA Corporation Common Stock,$174.635,-0.765,-0.436%,"4,261,094,000,000"
MSFT,Microsoft Corporation Common Stock,$505.24,0.35,0.069%,"3,755,532,981,326"
AAPL,Apple Inc. Common Stock,$224.96,-1.05,-0.465%,"3,338,494,134,400"
GOOG,Alphabet Inc. Class C Capital Stock,$200.825,0.635,0.317%,"2,428,777,550,000"
GOOGL,Alphabet Inc. Class A Common Stock,$199.935,0.615,0.309%,"2,418,013,890,000"
AMZN,"Amazon.com, Inc. Common Stock",$221.60,-2.21,-0.987%,"2,363,344,520,695"
META,"Meta Platforms, Inc. Class A Common Stock",$736.00,-11.72,-1.567%,"1,848,936,125,600"
AVGO,Broadcom Inc. Common Stock,$287.99,-3.18,-1.092%,"1,354,552,607,242"
TSM,Taiwan Semiconductor Manufacturing Company Ltd.,$227.54,-1.06,-0.464%,"1,180,146,824,286"
BRK/A,Berkshire Hathaway Inc.,"$731,069.781199999969","-1,744.6288",-0.238%,"1,075,311,533,353"
BRK/B,Berkshire Hathaway Inc.,$487.35,-1.33,-0.272%,"1,075,245,846,657"
TSLA,"Tesla, Inc. Common Stock",$320.57,-3.33,-1.028%,"1,033,982,150,347"
JPM,JP Morgan Chase & Co. Common Stock,$291.825,-0.415,-0.142%,"802,446,918,444"
WMT,Walmart Inc. Common Stock,$97.7446,-4.8254,-4.704%,"780,042,781,273"
LLY,Eli Lilly and Company Common Stock,$714.59,9.15,1.297%,"676,328,535,414"
V,Visa Inc.,$343.90,-0.03,-0.009%,"667,146,018,034"
ORCL,Oracle Corporation Common Stock,$233.66,-1.40,-0.596%,"656,311,918,780"
MA,Mastercard Incorporated Common Stock,$589.685,-2.995,-0.505%,"533,082,220,101"
NFLX,"Netflix, Inc. Common Stock","$1,202.59",-11.27,-0.928%,"511,012,174,436"
XOM,Exxon Mobil Corporation Common Stock,$109.0801,0.5501,0.507%,"465,035,411,375"
COST,Costco Wholesale Corporation Common Stock,$977.17,-17.40,-1.749%,"433,352,504,127"
JNJ,Johnson & Johnson Common Stock,$179.57,0.73,0.408%,"432,465,411,245"
HD,"Home Depot, Inc. (The) Common Stock",$396.99,-4.75,-1.182%,"394,976,460,765"
ABBV,AbbVie Inc. Common Stock,$211.315,2.165,1.035%,"373,300,257,233"
PG,Procter & Gamble Company (The) Common Stock,$158.75,-0.76,-0.476%,"371,851,473,720"
PLTR,Palantir Technologies Inc. Class A Common Stock,$155.72,-0.29,-0.186%,"369,421,161,798"
BAC,Bank of America Corporation Common Stock,$48.345,-0.005,-0.01%,"358,088,867,799"
SAP,SAP  SE ADS,$268.77,-3.76,-1.38%,"330,185,082,435"
KO,Coca-Cola Company (The) Common Stock,$70.48,-0.22,-0.311%,"303,322,467,921"
TMUS,"T-Mobile US, Inc. Common Stock",$257.50,-1.51,-0.583%,"289,795,402,285"
ASML,ASML Holding N.V. New York Registry Shares,$733.03,-16.46,-2.196%,"288,288,765,272"
GE,GE Aerospace Common Stock,$270.09,3.65,1.37%,"286,414,074,035"
UNH,UnitedHealth Group Incorporated Common Stock (DE),$304.10,4.26,1.421%,"275,415,349,363"
BABA,Alibaba Group Holding Limited American Depositary Shares each representing eight Ordinary share,$118.56,-0.93,-0.778%,"273,788,173,252"
PM,Philip Morris International Inc Common Stock,$174.25,1.40,0.81%,"271,235,691,972"
CVX,Chevron Corporation Common Stock,$154.08,0.86,0.561%,"266,248,757,134"
AMD,"Advanced Micro Devices, Inc. Common Stock",$163.565,-1.635,-0.99%,"265,440,427,991"
CSCO,"Cisco Systems, Inc. Common Stock (DE)",$66.895,-0.215,-0.32%,"264,904,078,251"
TM,Toyota Motor Corporation Common Stock,$196.68,-2.51,-1.26%,"256,646,350,716"
NVS,Novartis AG Common Stock,$127.12,-0.13,-0.102%,"251,073,345,206"
AZN,AstraZeneca PLC American Depositary Shares,$80.68,0.16,0.199%,"250,218,141,109"
WFC,Wells Fargo & Company Common Stock,$77.86,-0.30,-0.384%,"249,419,932,533"
NVO,Novo Nordisk A/S Common Stock,$55.615,1.315,2.422%,"248,320,975,000"
CRM,"Salesforce, Inc. Common Stock",$244.26,-2.19,-0.889%,"233,512,560,000"
ABT,Abbott Laboratories Common Stock,$132.64,0.20,0.151%,"230,854,483,617"
MS,Morgan Stanley Common Stock,$143.99,-0.13,-0.09%,"229,856,385,506"
HSBC,"HSBC Holdings, plc. Common Stock",$65.18,-0.18,-0.275%,"226,631,513,495"
LIN,Linde plc Ordinary Shares,$481.45,-0.91,-0.189%,"225,756,494,181"
CCZ,Comcast Holdings ZONES,$60.85,UNCH,--,"224,670,765,647"
MCD,McDonald's Corporation Common Stock,$311.77,-1.31,-0.418%,"222,480,454,388"
IBM,International Business Machines Corporation Common Stock,$238.81,-3.74,-1.542%,"222,456,110,182"
MRK,"Merck & Company, Inc. Common Stock (new)",$87.10,2.44,2.882%,"217,556,917,678"
GS,"Goldman Sachs Group, Inc. (The) Common Stock",$715.00,-5.68,-0.788%,"216,445,580,780"
SHEL,Shell PLC American Depositary Shares (each representing two (2) Ordinary Shares) ,$72.20,0.11,0.153%,"214,669,989,527"
AXP,American Express Company Common Stock,$307.20,-1.20,-0.389%,"213,775,020,134"
T,AT&T Inc.,$29.445,0.165,0.564%,"210,543,100,459"
RTX,RTX Corporation Common Stock,$157.05,0.46,0.294%,"210,217,993,930"
DIS,Walt Disney Company (The) Common Stock,$115.98,-1.06,-0.906%,"208,524,365,951"
PEP,"PepsiCo, Inc. Common Stock",$149.23,-1.50,-0.995%,"204,307,391,153"
CAT,"Caterpillar, Inc. Common Stock",$415.525,-5.065,-1.204%,"194,664,704,480"
INTU,Intuit Inc. Common Stock,$697.00,-2.15,-0.308%,"194,426,059,000"
UBER,"Uber Technologies, Inc. Common Stock",$93.20,-0.53,-0.565%,"194,361,020,603"
HDB,HDFC Bank Limited Common Stock,$75.4235,0.4335,0.578%,"192,385,780,476"
RY,Royal Bank Of Canada Common Stock,$136.34,-0.15,-0.11%,"192,176,547,260"
VZ,Verizon Communications Inc. Common Stock,$45.075,0.015,0.033%,"190,050,840,721"
TMO,Thermo Fisher Scientific Inc Common Stock,$489.395,-5.415,-1.094%,"184,801,483,957"
MUFG,"Mitsubishi UFJ Financial Group, Inc. Common Stock",$15.28,-0.09,-0.586%,"184,394,622,858"
NOW,"ServiceNow, Inc. Common Stock",$881.06,-9.19,-1.032%,"183,260,480,000"
BKNG,Booking Holdings Inc. Common Stock,"$5,639.99",0.21,0.004%,"182,791,427,301"
TXN,Texas Instruments Incorporated Common Stock,$200.495,-0.275,-0.137%,"182,277,456,699"
SHOP,Shopify Inc. Class A Subordinate Voting Shares,$136.47,-0.82,-0.597%,"177,324,776,070"
BLK,"BlackRock, Inc. Common Stock","$1,123.81",-4.65,-0.412%,"174,025,728,654"
SCHW,Charles Schwab Corporation (The) Common Stock,$95.78,0.27,0.283%,"173,861,704,554"
PDD,PDD Holdings Inc. American Depositary Shares,$122.34,4.34,3.678%,"173,679,548,161"
ISRG,"Intuitive Surgical, Inc. Common Stock",$475.16,-5.29,-1.101%,"170,333,696,591"
C,"Citigroup, Inc. Common Stock",$92.22,-0.95,-1.02%,"169,767,604,154"
BA,Boeing Company (The) Common Stock,$224.18,-1.44,-0.638%,"169,515,432,065"
SPGI,S&P Global Inc. Common Stock,$553.0987,-3.9313,-0.706%,"168,861,033,110"
TBB,AT&T Inc. 5.350% Global Notes due 2066,$23.295,-0.065,-0.278%,"166,568,229,757"
GEV,GE Vernova Inc. Common Stock,$611.50,6.91,1.143%,"166,464,939,310"
SONY,Sony Group Corporation American Depositary Shares ,$27.58,-0.54,-1.92%,"166,169,563,296"
QCOM,QUALCOMM Incorporated Common Stock,$153.72,-1.72,-1.107%,"165,863,880,000"
ANET,"Arista Networks, Inc. Common Stock",$131.2697,-0.2003,-0.152%,"164,988,341,504"
AMGN,Amgen Inc. Common Stock,$297.24,0.79,0.266%,"160,022,676,591"
ACN,Accenture plc Class A Ordinary Shares (Ireland),$252.41,-2.64,-1.035%,"157,214,249,250"
NEE,"NextEra Energy, Inc. Common Stock",$75.895,-0.285,-0.374%,"156,290,010,966"
BSX,Boston Scientific Corporation Common Stock,$105.305,-0.745,-0.702%,"156,035,855,818"
UL,Unilever PLC Common Stock,$63.19,-0.37,-0.582%,"154,932,033,671"
TJX,"TJX Companies, Inc. (The) Common Stock",$136.84,-1.43,-1.034%,"152,660,841,988"
ADBE,Adobe Inc. Common Stock,$351.35,-2.08,-0.589%,"149,042,670,000"
SYK,Stryker Corporation Common Stock,$387.825,-4.045,-1.032%,"148,268,327,847"
DHR,Danaher Corporation Common Stock,$206.985,-4.415,-2.088%,"148,211,938,356"
PFE,"Pfizer, Inc. Common Stock",$25.805,0.425,1.675%,"146,715,630,653"
PGR,Progressive Corporation (The) Common Stock,$250.22,-2.46,-0.974%,"146,681,087,617"
GILD,"Gilead Sciences, Inc. Common Stock",$117.15,-1.58,-1.331%,"145,360,530,209"
LOW,"Lowe's Companies, Inc. Common Stock",$254.84,-2.30,-0.894%,"142,821,933,020"
SAN,"Banco Santander, S.A. Sponsored ADR (Spain)",$9.5601,0.0301,0.316%,"142,242,697,000"
APP,Applovin Corporation Class A Common Stock,$418.87,6.49,1.574%,"141,682,741,477"
ARM,Arm Holdings plc American Depositary Shares,$132.345,1.185,0.903%,"140,188,293,948"
SPOT,Spotify Technology S.A. Ordinary Shares,$686.90,-16.89,-2.40%,"140,020,724,542"
TTE,TotalEnergies SE,$63.11,0.01,0.016%,"138,460,442,935"
HON,Honeywell International Inc. Common Stock,$216.705,-0.295,-0.136%,"137,585,259,468"
BHP,BHP Group Limited American Depositary Shares (Each representing two Ordinary Shares),$54.085,0.495,0.924%,"137,233,385,592"
COF,Capital One Financial Corporation Common Stock,$212.18,-2.53,-1.178%,"135,692,781,987"
ETN,"Eaton Corporation, PLC Ordinary Shares",$345.52,-0.70,-0.202%,"134,510,936,000"
UNP,Union Pacific Corporation Common Stock,$224.92,-0.76,-0.337%,"133,387,381,357"
APH,Amphenol Corporation Common Stock,$108.99,0.34,0.313%,"133,068,191,888"
DE,Deere & Company Common Stock,$486.13,-6.59,-1.337%,"131,657,156,247"
MU,"Micron Technology, Inc. Common Stock",$116.18,-1.03,-0.879%,"130,019,954,234"
BTI,"British American Tobacco  Industries, p.l.c. Common Stock ADR",$59.12,0.11,0.186%,"129,578,668,312"
SNY,Sanofi ADS,$50.82,0.29,0.574%,"128,383,793,362"
AMAT,"Applied Materials, Inc. Common Stock",$159.52,-0.98,-0.611%,"128,014,515,576"
TD,Toronto Dominion Bank (The) Common Stock,$73.47,-0.24,-0.326%,"126,550,458,660"
UBS,UBS Group AG Registered Ordinary Shares,$39.405,-0.335,-0.843%,"125,103,989,016"
YMM,Full Truck Alliance Co. Ltd. American Depositary Shares (each representing 20 Class A Ordinary Shares),$11.905,0.895,8.129%,"124,513,703,677"
ADP,"Automatic Data Processing, Inc. Common Stock",$305.30,-3.73,-1.207%,"123,659,671,253"
LRCX,Lam Research Corporation Common Stock,$97.68,-1.47,-1.483%,"123,625,859,280"
ADI,"Analog Devices, Inc. Common Stock",$248.045,3.175,1.297%,"123,091,883,777"
CMCSA,Comcast Corporation Class A Common Stock,$33.315,0.025,0.075%,"123,005,859,614"
KKR,KKR & Co. Inc. Common Stock,$137.26,-0.83,-0.601%,"122,291,621,994"
PANW,"Palo Alto Networks, Inc. Common Stock",$181.505,-2.925,-1.586%,"121,027,534,000"
BX,Blackstone Inc. Common Stock,$163.33,-1.14,-0.693%,"120,389,182,134"
IBN,ICICI Bank Limited Common Stock,$33.27,0.08,0.241%,"118,699,699,782"
COP,ConocoPhillips Common Stock,$94.4926,-0.3974,-0.419%,"118,015,806,216"
MDT,Medtronic plc. Ordinary Shares,$92.08,-1.14,-1.223%,"117,978,853,852"
MELI,"MercadoLibre, Inc. Common Stock","$2,321.05",-14.93,-0.639%,"117,671,142,244"
KLAC,KLA Corporation Common Stock,$868.56,-9.88,-1.125%,"114,616,367,527"
MO,"Altria Group, Inc.",$67.455,-0.125,-0.185%,"113,317,044,235"
BUD,Anheuser-Busch Inbev SA Sponsored ADR (Belgium),$62.92,-0.17,-0.269%,"113,079,731,067"
RACE,Ferrari N.V. Common Shares,$463.29,-5.13,-1.095%,"112,290,934,841"
NKE,"Nike, Inc. Common Stock",$75.78,-0.48,-0.629%,"111,919,746,624"
CB,Chubb Limited  Common Stock,$280.11,0.43,0.154%,"111,677,137,972"
WELL,Welltower Inc. Common Stock,$166.78,0.79,0.476%,"111,546,790,607"
BBVA,Banco Bilbao Vizcaya Argentaria S.A. Common Stock,$18.97,0.08,0.424%,"109,329,525,271"
SMFG,Sumitomo Mitsui Financial Group Inc Unsponsored American Depositary Shares (Japan),$16.5899,-0.1401,-0.837%,"107,404,269,501"
IBKR,"Interactive Brokers Group, Inc. Class A Common Stock",$62.49,0.035,0.056%,"106,221,776,296"
SE,"Sea Limited American Depositary Shares, each representing one Class A Ordinary Share",$177.905,-0.835,-0.467%,"105,323,306,358"
LMT,Lockheed Martin Corporation Common Stock,$447.9034,1.9034,0.427%,"104,569,792,364"
ENB,Enbridge Inc Common Stock,$47.86,-0.17,-0.354%,"104,382,660,000"
DASH,"DoorDash, Inc. Class A Common Stock",$243.5782,-0.2418,-0.099%,"104,055,348,228"
SO,Southern Company (The) Common Stock,$94.50,-0.43,-0.453%,"103,954,479,962"
MMC,"Marsh & McLennan Companies, Inc. Common Stock",$210.945,-0.265,-0.125%,"103,705,633,751"
CRWD,"CrowdStrike Holdings, Inc. Class A Common Stock",$414.845,-4.325,-1.032%,"103,399,358,743"
ICE,Intercontinental Exchange Inc. Common Stock,$178.95,-2.35,-1.296%,"102,435,111,598"
INTC,Intel Corporation Common Stock,$23.2799,-0.2601,-1.105%,"101,896,122,300"
VRTX,Vertex Pharmaceuticals Incorporated Common Stock,$396.07,1.71,0.434%,"101,548,645,142"
SBUX,Starbucks Corporation Common Stock,$88.55,-0.96,-1.073%,"100,654,785,000"
PLD,"Prologis, Inc. Common Stock",$107.975,-2.205,-2.001%,"100,207,602,425"
BMY,Bristol-Myers Squibb Company Common Stock,$48.655,0.395,0.818%,"99,034,130,698"
CME,CME Group Inc. Class A Common Stock,$273.69,-0.92,-0.335%,"98,631,592,625"
AMT,American Tower Corporation (REIT) Common Stock,$209.04,-0.46,-0.22%,"97,883,236,074"
CEG,Constellation Energy Corporation Common Stock ,$313.03,-1.18,-0.376%,"97,792,318,394"
DUK,Duke Energy Corporation (Holding Company) Common Stock,$124.22,-0.26,-0.209%,"96,596,511,291"
HCA,"HCA Healthcare, Inc. Common Stock",$409.11,-1.07,-0.261%,"95,729,080,785"
MSTR,Strategy Inc Common Stock Class A,$336.91,-7.46,-2.166%,"95,531,823,374"
BN,Brookfield Corporation Class A Limited Voting Shares,$63.46,-0.59,-0.921%,"94,927,361,017"
BAM,Brookfield Asset Management Inc Class A Limited Voting Shares,$58.59,-0.78,-1.314%,"94,511,844,449"
CDNS,"Cadence Design Systems, Inc. Common Stock",$346.785,1.335,0.386%,"94,495,444,650"
TT,Trane Technologies plc,$421.905,-4.395,-1.031%,"93,880,342,539"
HOOD,"Robinhood Markets, Inc. Class A Common Stock",$106.14,0.80,0.759%,"93,665,255,521"
PH,Parker-Hannifin Corporation Common Stock,$732.545,-10.425,-1.403%,"93,603,137,940"
WM,"Waste Management, Inc. Common Stock",$229.30,-0.73,-0.317%,"92,368,991,230"
SNPS,"Synopsys, Inc. Common Stock",$594.62,-6.51,-1.083%,"92,261,796,954"
MCO,Moody's Corporation Common Stock,$511.44,-3.51,-0.682%,"91,752,336,000"
CVS,CVS Health Corporation Common Stock,$71.71,0.89,1.257%,"90,951,684,351"
SHW,Sherwin-Williams Company (The) Common Stock,$361.41,-5.72,-1.558%,"90,111,553,736"
BP,BP p.l.c. Common Stock,$33.8401,-0.0399,-0.118%,"89,864,256,941"
RELX,RELX PLC PLC American Depositary Shares (Each representing One Ordinary Share),$48.18,-0.51,-1.047%,"88,357,731,091"
RCL,Royal Caribbean Cruises Ltd. Common Stock,$324.76,-4.36,-1.325%,"88,213,798,862"
MCK,McKesson Corporation Common Stock,$705.95,3.01,0.428%,"87,809,162,238"
ORLY,"O'Reilly Automotive, Inc. Common Stock",$103.32,-0.68,-0.654%,"87,666,676,978"
DELL,Dell Technologies Inc. Class C Common Stock ,$128.3582,-0.1218,-0.095%,"87,135,896,554"
CTAS,Cintas Corporation Common Stock,$216.13,-0.60,-0.277%,"87,095,619,146"
NOC,Northrop Grumman Corporation Common Stock,$597.155,4.615,0.779%,"85,502,433,616"
GD,General Dynamics Corporation Common Stock,$316.95,-0.53,-0.167%,"85,257,439,747"
NTES,"NetEase, Inc. American Depositary Shares",$131.66,1.14,0.873%,"83,366,886,071"
MMM,3M Company Common Stock,$154.045,-0.705,-0.456%,"82,048,942,445"
GSK,GSK plc American Depositary Shares (Each representing two Ordinary Shares),$40.265,0.195,0.487%,"82,046,949,569"
MFG,"Mizuho Financial Group, Inc. Sponosred ADR (Japan)",$6.475,-0.065,-0.994%,"81,353,409,646"
BMO,Bank Of Montreal Common Stock,$112.58,-0.15,-0.133%,"81,290,726,949"
MDLZ,"Mondelez International, Inc. Class A Common Stock",$62.785,-0.385,-0.609%,"81,240,362,692"
CI,The Cigna Group Common Stock,$302.79,-1.78,-0.584%,"80,823,151,829"
AON,Aon plc Class A Ordinary Shares (Ireland),$374.205,0.205,0.055%,"80,688,550,730"
ECL,Ecolab Inc. Common Stock,$282.9233,-2.5467,-0.892%,"80,244,096,065"
RBLX,Roblox Corporation Class A Common Stock,$115.2602,-3.2298,-2.726%,"79,903,747,413"
TDG,Transdigm Group Incorporated Common Stock,"$1,393.7599",-8.4001,-0.599%,"78,538,767,587"
TRI,Thomson Reuters Corporation Common Shares,$174.23,-1.54,-0.876%,"78,522,099,232"
AJG,Arthur J. Gallagher & Co. Common Stock,$305.18,2.54,0.839%,"78,248,152,000"
ING,"ING Group, N.V. Common Stock",$24.845,0.035,0.141%,"78,196,933,693"
ABNB,"Airbnb, Inc. Class A Common Stock",$124.68,-0.28,-0.224%,"77,480,599,336"
COIN,"Coinbase Global, Inc. Class A Common Stock",$301.03,-3.36,-1.104%,"77,346,093,402"
MSI,"Motorola Solutions, Inc. Common Stock",$461.96,-0.17,-0.037%,"76,964,334,872"
NEM,Newmont Corporation,$69.901,0.901,1.306%,"76,782,734,227"
PNC,"PNC Financial Services Group, Inc. (The) Common Stock",$194.68,-0.32,-0.164%,"76,666,421,128"
APO,"Apollo Global Management, Inc. (New) Common Stock",$133.83,-1.51,-1.116%,"76,554,337,945"
ITW,Illinois Tool Works Inc. Common Stock,$262.4827,0.4627,0.177%,"76,513,707,050"
RIO,Rio Tinto Plc Common Stock,$60.995,0.375,0.619%,"76,497,250,710"
PBR,Petroleo Brasileiro S.A. Petrobras ADS,$11.83,-0.09,-0.755%,"76,236,854,287"
FI,"Fiserv, Inc. Common Stock",$139.62,-0.34,-0.243%,"75,896,479,792"
EQIX,"Equinix, Inc. Common Stock REIT",$769.66,-6.63,-0.854%,"75,321,995,465"
SCCO,Southern Copper Corporation Common Stock,$93.44,-0.26,-0.277%,"75,132,106,912"
CRH,CRH PLC Ordinary Shares,$110.505,-0.265,-0.239%,"74,278,126,401"
RSG,"Republic Services, Inc. Common Stock",$235.23,-0.88,-0.373%,"73,442,527,339"
EMR,Emerson Electric Company Common Stock,$130.30,-0.59,-0.451%,"73,332,840,000"
UPS,"United Parcel Service, Inc. Common Stock",$86.51,-0.43,-0.495%,"73,323,249,729"
EQNR,Equinor ASA,$24.835,0.455,1.866%,"73,132,447,631"
CVNA,Carvana Co. Class A Common Stock,$336.975,-1.635,-0.483%,"72,518,179,868"
USB,U.S. Bancorp Common Stock,$46.20,-0.21,-0.452%,"71,895,952,729"
BK,The Bank of New York Mellon Corporation Common Stock,$101.31,0.06,0.059%,"71,447,947,069"
MAR,Marriott International Class A Common Stock,$262.53,-0.33,-0.126%,"71,265,826,473"
DB,Deutsche Bank AG Common Stock,$36.595,0.035,0.096%,"71,181,877,004"
BCS,Barclays PLC Common Stock,$20.185,-0.075,-0.37%,"71,144,957,952"
NGG,"National Grid Transco, PLC National Grid PLC (NEW) American Depositary Shares",$71.38,-0.70,-0.971%,"70,826,520,979"
INFY,Infosys Limited American Depositary Shares,$17.035,0.025,0.147%,"70,767,023,804"
BNS,Bank Nova Scotia Halifax Pfd 3 Ordinary Shares,$56.67,-0.04,-0.071%,"70,585,261,830"
WMB,"Williams Companies, Inc. (The) Common Stock",$57.76,0.54,0.944%,"70,535,208,184"
ELV,"Elevance Health, Inc. Common Stock",$311.45,1.45,0.468%,"70,131,782,781"
ZTS,Zoetis Inc. Class A Common Stock,$157.185,0.425,0.271%,"69,661,794,046"
HWM,Howmet Aerospace Inc. Common Stock,$172.29,0.35,0.204%,"69,454,634,017"
CL,Colgate-Palmolive Company Common Stock,$85.47,-0.58,-0.674%,"69,078,633,058"
CP,Canadian Pacific Kansas City Limited Common Shares,$73.82,-0.47,-0.633%,"68,686,266,423"
AZO,"AutoZone, Inc. Common Stock","$4,100.02",-58.08,-1.397%,"68,588,061,974"
EPD,Enterprise Products Partners L.P. Common Stock,$31.665,0.155,0.492%,"68,562,560,156"
JCI,Johnson Controls International plc Ordinary Share,$104.75,-1.25,-1.179%,"68,546,874,840"
LYG,Lloyds Banking Group Plc American Depositary Shares,$4.545,-0.015,-0.329%,"68,448,912,442"
AEM,Agnico Eagle Mines Limited Common Stock,$135.945,1.255,0.932%,"68,341,511,827"
CM,Canadian Imperial Bank of Commerce Common Stock,$72.955,-0.165,-0.226%,"68,153,873,326"
CSX,CSX Corporation Common Stock,$35.965,-0.025,-0.069%,"67,048,722,809"
NET,"Cloudflare, Inc. Class A Common Stock",$191.57,-1.63,-0.844%,"66,758,617,622"
NU,Nu Holdings Ltd. Class A Ordinary Shares,$13.675,0.055,0.404%,"65,895,156,902"
VST,Vistra Corp. Common Stock,$192.57,-0.34,-0.176%,"65,246,629,793"
APD,"Air Products and Chemicals, Inc. Common Stock",$291.79,-0.58,-0.198%,"64,938,926,616"
SNOW,Snowflake Inc. Common Stock,$194.515,-0.285,-0.146%,"64,909,655,500"
PYPL,"PayPal Holdings, Inc. Common Stock",$67.5642,-0.5158,-0.758%,"64,549,377,631"
ITUB,Itau Unibanco Banco Holding SA American Depositary Shares (Each repstg 500 Preferred shares),$6.595,-0.035,-0.528%,"64,473,409,276"
EOG,"EOG Resources, Inc. Common Stock",$117.955,-0.405,-0.342%,"64,402,653,384"
NSC,Norfolk Southern Corporation Common Stock,$284.43,-1.06,-0.371%,"63,887,214,300"
REGN,"Regeneron Pharmaceuticals, Inc. Common Stock",$601.64,10.63,1.799%,"63,766,284,605"
DEO,Diageo plc Common Stock,$114.28,-0.97,-0.842%,"63,577,892,604"
HLT,Hilton Worldwide Holdings Inc. Common Stock ,$269.96,0.06,0.022%,"63,492,905,560"
MNST,Monster Beverage Corporation,$64.275,-0.115,-0.179%,"62,759,921,848"
CNQ,Canadian Natural Resources Limited Common Stock,$29.84,0.21,0.709%,"62,327,912,080"
TRV,"The Travelers Companies, Inc. Common Stock",$275.21,0.82,0.299%,"61,959,084,382"
NWG,"NatWest Group plc American Depositary Shares, (each representing two (2) Ordinary Shares)",$15.195,0.115,0.763%,"61,431,630,008"
MRVL,"Marvell Technology, Inc. Common Stock",$71.055,-0.165,-0.232%,"61,263,621,000"
ADSK,"Autodesk, Inc. Common Stock",$286.08,-2.55,-0.883%,"61,221,120,000"
ALNY,"Alnylam Pharmaceuticals, Inc. Common Stock",$465.67,7.36,1.606%,"61,039,564,915"
AEP,"American Electric Power Company, Inc. Common Stock",$113.38,-0.17,-0.15%,"60,635,030,229"
WDAY,"Workday, Inc. Class A Common Stock",$226.49,-1.00,-0.44%,"60,472,830,000"
ET,Energy Transfer LP Common Units ,$17.51,0.18,1.039%,"60,106,253,608"
FCX,"Freeport-McMoRan, Inc. Common Stock",$41.505,0.195,0.472%,"59,591,805,432"
KMI,"Kinder Morgan, Inc. Common Stock",$26.775,0.205,0.772%,"59,496,128,168"
AXON,"Axon Enterprise, Inc. Common Stock",$756.805,-4.085,-0.537%,"59,412,552,714"
TEL,TE Connectivity plc Ordinary Shares,$200.62,-0.93,-0.461%,"59,279,496,724"
FTNT,"Fortinet, Inc. Common Stock",$77.1908,-2.4192,-3.039%,"59,148,688,100"
COR,"Cencora, Inc. Common Stock",$304.55,0.86,0.283%,"59,045,508,659"
CNI,Canadian National Railway Company Common Stock,$94.02,0.21,0.224%,"58,687,284,000"
AMX,"America Movil, S.A.B. de C.V. American Depositary Shares (each representing the right to receive twenty (20) Series B Shares",$19.175,0.075,0.393%,"58,234,475,000"
ARES,Ares Management Corporation Class A Common Stock,$177.87,-1.06,-0.592%,"58,111,547,158"
E,ENI S.p.A. Common Stock,$35.29,0.07,0.199%,"57,954,835,331"
AFL,AFLAC Incorporated Common Stock,$108.08,0.18,0.167%,"57,804,587,439"
ROP,"Roper Technologies, Inc. Common Stock",$536.47,-4.05,-0.749%,"57,731,588,161"
CMG,"Chipotle Mexican Grill, Inc. Common Stock",$42.895,-0.175,-0.406%,"57,517,262,075"
URI,"United Rentals, Inc. Common Stock",$890.19,-11.68,-1.295%,"57,275,912,412"
BDX,"Becton, Dickinson and Company Common Stock",$198.475,-0.725,-0.364%,"56,888,386,910"
TFC,Truist Financial Corporation Common Stock,$43.93,-0.46,-1.036%,"56,644,886,886"
NXPI,NXP Semiconductors N.V. Common Stock,$224.19,-4.58,-2.002%,"56,521,571,053"
SPG,"Simon Property Group, Inc. Common Stock",$172.875,-1.255,-0.721%,"56,442,436,404"
FAST,Fastenal Company Common Stock,$49.18,-0.36,-0.727%,"56,440,768,824"
PWR,"Quanta Services, Inc. Common Stock",$376.97,1.10,0.293%,"56,170,770,333"
DLR,"Digital Realty Trust, Inc. Common Stock",$163.04,-2.29,-1.385%,"55,604,862,922"
GLW,Corning Incorporated Common Stock,$64.86,0.26,0.402%,"55,560,289,595"
CARR,Carrier Global Corporation Common Stock ,$65.21,-1.63,-2.439%,"55,495,199,201"
ALL,Allstate Corporation (The) Common Stock,$207.685,-5.935,-2.778%,"54,726,105,292"
CMI,Cummins Inc. Common Stock,$394.30,-2.05,-0.517%,"54,329,034,783"
O,Realty Income Corporation Common Stock,$59.42,-0.48,-0.801%,"54,328,067,690"
NDAQ,"Nasdaq, Inc. Common Stock",$94.22,-0.28,-0.296%,"54,062,987,701"
SRE,DBA Sempra Common Stock,$82.16,-0.24,-0.291%,"53,607,134,520"
FDX,FedEx Corporation Common Stock,$226.87,-0.34,-0.15%,"53,518,428,363"
GM,General Motors Company Common Stock,$56.19,-0.58,-1.022%,"53,497,251,638"
TRP,TC Energy Corporation Common Stock,$51.34,-0.53,-1.022%,"53,358,704,921"
LNG,"Cheniere Energy, Inc. Common Stock",$241.18,5.17,2.191%,"53,003,671,323"
MET,"MetLife, Inc. Common Stock",$79.27,0.24,0.304%,"52,716,615,301"
D,"Dominion Energy, Inc. Common Stock",$61.035,-0.485,-0.788%,"52,089,321,302"
FLUT,Flutter Entertainment plc Ordinary Shares,$293.975,-0.555,-0.188%,"51,682,391,877"
LHX,"L3Harris Technologies, Inc. Common Stock",$275.82,-0.33,-0.12%,"51,604,487,184"
MPLX,MPLX LP Common Units Representing Limited Partner Interests,$50.50,UNCH,--,"51,462,828,152"
CPNG,"Coupang, Inc. Class A Common Stock",$28.125,-0.715,-2.479%,"51,273,709,397"
PCAR,PACCAR Inc. Common Stock,$97.415,-0.765,-0.779%,"51,152,946,932"
IDXX,"IDEXX Laboratories, Inc. Common Stock",$636.02,-3.83,-0.599%,"50,884,585,478"
MFC,Manulife Financial Corporation Common Stock,$29.95,-0.13,-0.432%,"50,871,151,762"
PSA,Public Storage Common Stock,$285.57,-1.37,-0.477%,"50,104,069,803"
PSX,Phillips 66 Common Stock,$123.77,0.20,0.162%,"50,018,460,279"
MPC,Marathon Petroleum Corporation Common Stock,$164.255,-1.565,-0.944%,"49,936,855,855"
PAYX,"Paychex, Inc. Common Stock",$138.54,-0.34,-0.245%,"49,908,186,720"
CTVA,"Corteva, Inc. Common Stock ",$72.94,-0.02,-0.027%,"49,533,554,000"
HMC,"Honda Motor Company, Ltd. Common Stock",$33.86,-0.66,-1.912%,"49,057,604,703"
VRT,"Vertiv Holdings, LLC Class A Common Stock",$126.885,-0.655,-0.514%,"48,453,151,662"
TAK,Takeda Pharmaceutical Company Limited American Depositary Shares (each representing 1/2 of a share of Common Stock),$15.32,-0.16,-1.034%,"48,216,625,153"
EW,Edwards Lifesciences Corporation Common Stock,$81.98,0.59,0.725%,"48,130,458,000"
WCN,"Waste Connections, Inc. Common Shares",$186.71,0.91,0.49%,"48,071,477,047"
KDP,Keurig Dr Pepper Inc. Common Stock,$35.115,-0.065,-0.185%,"47,701,454,822"
GWW,"W.W. Grainger, Inc. Common Stock",$995.42,-4.21,-0.421%,"47,613,172,322"
CBRE,CBRE Group Inc Common Stock Class A,$159.68,-1.16,-0.721%,"47,513,474,616"
ROST,"Ross Stores, Inc. Common Stock",$145.10,-1.25,-0.854%,"47,457,932,597"
AMP,"Ameriprise Financial, Inc. Common Stock",$503.075,-2.325,-0.46%,"47,425,667,562"
DHI,"D.R. Horton, Inc. Common Stock",$158.735,-4.635,-2.837%,"47,322,638,376"
KR,Kroger Company (The) Common Stock,$71.17,-0.66,-0.919%,"47,054,460,990"
SU,Suncor Energy  Inc. Common Stock,$38.70,0.10,0.259%,"46,952,644,658"
OKE,"ONEOK, Inc. Common Stock",$74.21,0.53,0.719%,"46,734,191,202"
VEEV,Veeva Systems Inc. Class A Common Stock,$283.57,-0.45,-0.158%,"46,338,818,255"
FERG,Ferguson Enterprises Inc. Common Stock,$229.125,-1.445,-0.627%,"46,145,558,935"
CPRT,"Copart, Inc. (DE) Common Stock",$47.565,-0.045,-0.095%,"45,992,321,019"
