Symbol,Name,Last Sale,Net Change,% Change,Market Cap
SOHOO,Sotherly Hotels Inc. 7.875% Series C Cumulative Redeemable Perpetual Preferred Stock,$14.2502,0.0002,0.001%,"291,993,737"
NATR,"Nature's Sunshine Products, Inc. Common Stock",$16.55,0.065,0.394%,"291,868,386"
ALLT,Allot Ltd. Ordinary Shares,$7.35,0.09,1.24%,"291,742,183"
MFH,Mercurity Fintech Holding Inc. Ordinary Shares,$4.58,0.09,2.004%,"291,684,459"
GAMB,Gambling.com Group Limited Ordinary Shares,$8.388,-0.062,-0.734%,"291,591,197"
CLPT,"ClearPoint Neuro, Inc. Common Stock",$10.255,-0.115,-1.109%,"291,523,161"
BRT,BRT Apartments Corp. (MD) Common Stock,$15.3731,-0.0069,-0.045%,"290,594,619"
ANTA,Antalpha Platform Holding Company Class A Ordinary Shares,$12.25,0.80,6.987%,"290,237,719"
BNED,"Barnes & Noble Education, Inc Common Stock",$8.52,-0.04,-0.467%,"290,138,776"
OMER,Omeros Corporation Common Stock,$4.26,0.07,1.671%,"289,917,819"
FCNCP,"First Citizens BancShares, Inc. Depositary Shares",$22.42,-0.16,-0.709%,"289,693,214"
OCCIO,"OFS Credit Company, Inc. 6.125% Series C Term Preferred Stock",$24.935,-0.0649,-0.26%,"289,657,677"
FNLC,"First Bancorp, Inc  (ME) Common Stock",$25.805,-0.325,-1.244%,"289,289,223"
RNAC,"Cartesian Therapeutics, Inc. Common Stock",$11.1148,0.0448,0.405%,"289,007,496"
RLGT,"Radiant Logistics, Inc. Common Stock",$6.12,0.02,0.328%,"288,516,249"
RMMZ,"RiverNorth Managed Duration Municipal Income Fund II, Inc. Common Stock",$14.6111,0.0761,0.524%,"288,417,679"
MG,Mistras Group Inc Common Stock,$9.14,-0.04,-0.436%,"288,257,777"
OMSE,OMS Energy Technologies Inc. Ordinary Shares,$6.79,0.05,0.742%,"288,226,700"
CBAN,"Colony Bankcorp, Inc. Common Stock",$16.385,-0.015,-0.091%,"286,105,350"
FHTX,Foghorn Therapeutics Inc. Common Stock,$5.06,-0.20,-3.802%,"286,041,643"
TCMD,"Tactile Systems Technology, Inc. Common Stock",$12.83,0.01,0.078%,"286,008,220"
SOHOB,Sotherly Hotels Inc. 8.0% Series B Cumulative Redeemable Perpetual Preferred Stock,$13.95,-0.1147,-0.816%,"285,842,489"
PLBC,Plumas Bancorp,$41.12,-0.29,-0.70%,"285,665,739"
NPCE,"Neuropace, Inc. Common Stock",$8.63,-0.03,-0.346%,"285,493,328"
CVEO,Civeo Corporation (Canada) Common Shares,$22.71,0.41,1.839%,"285,050,674"
SPIR,"Spire Global, Inc. Class A Common Stock",$8.74,0.10,1.157%,"284,784,020"
MNTK,"Montauk Renewables, Inc. Common Stock",$2.0013,0.0113,0.568%,"284,698,168"
OCFT,"OneConnect Financial Technology Co., Ltd. American Depositary Shares, each representing thirty ordinary shares",$7.30,-0.04,-0.545%,"284,695,292"
LMNR,Limoneira Co Common Stock,$15.745,0.055,0.351%,"284,496,862"
FGBIP,"First Guaranty Bancshares, Inc. 6.75% Series A Fixed-Rate Non-Cumulative Perpetual Preferred Stock",$18.8102,0.0002,0.001%,"284,413,459"
RNGR,"Ranger Energy Services, Inc. Class A Common Stock",$13.02,0.22,1.719%,"284,401,875"
CAN,Canaan Inc. American Depositary Shares,$0.6757,0.001,0.148%,"283,972,087"
MEC,"Mayville Engineering Company, Inc. Common Stock",$13.965,-0.135,-0.957%,"283,738,426"
PAYS,"Paysign, Inc. Common Stock",$5.20,0.02,0.386%,"283,149,818"
OCCIN,"OFS Credit Company, Inc. 5.25% Series E Term Preferred Stock Due 2026",$24.35,0.0764,0.315%,"282,862,019"
AIRJ,AirJoule Technologies Corporation Class A Common Stock,$4.68,-0.04,-0.847%,"282,857,295"
KOPN,Kopin Corporation Common Stock,$1.735,-0.035,-1.977%,"282,468,153"
PMM,Putnam Managed Municipal Income Trust Common Stock,$5.79,UNCH,--,"282,197,704"
GCO,Genesco Inc. Common Stock,$26.165,0.545,2.127%,"282,027,433"
DSGN,"Design Therapeutics, Inc. Common Stock",$4.94,0.15,3.132%,"281,323,742"
NGNE,Neurogene Inc. Common Stock ,$19.69,0.08,0.408%,"281,014,026"
SLP,"Simulations Plus, Inc. Common Stock",$13.945,-0.095,-0.677%,"280,672,549"
BWAY,BrainsWay Ltd. American Depositary Shares,$14.85,0.08,0.542%,"280,208,036"
CIO,"City Office REIT, Inc. Common Stock",$6.92,UNCH,--,"279,316,389"
FET,"Forum Energy Technologies, Inc. Common Stock",$23.44,0.26,1.122%,"279,012,789"
MMT,MFS Multimarket Income Trust Common Stock,$4.6799,0.0063,0.135%,"278,680,113"
AVIR,"Atea Pharmaceuticals, Inc. Common Stock",$3.51,0.01,0.286%,"278,545,011"
XPER,Xperi Inc. Common Stock ,$6.005,-0.035,-0.579%,"277,792,261"
MCR,MFS Charter Income Trust Common Stock,$6.30,-0.01,-0.158%,"277,252,794"
VMD,"Viemed Healthcare, Inc. Common Shares",$7.00,0.14,2.041%,"277,235,035"
HYLN,Hyliion Holdings Corp. Class A Common Stock,$1.575,0.045,2.941%,"276,312,702"
ZUMZ,Zumiez Inc. Common Stock,$15.54,-0.12,-0.766%,"276,155,746"
TMQ,Trilogy Metals Inc. Common Stock,$1.68,0.03,1.818%,"275,925,569"
RXT,"Rackspace Technology, Inc. Common Stock",$1.15,0.01,0.877%,"275,264,779"
GLUE,"Monte Rosa Therapeutics, Inc. Common Stock",$4.45,0.02,0.451%,"274,829,108"
CDZI,"CADIZ, Inc. Common Stock",$3.35,UNCH,--,"274,763,730"
CTNM,"Contineum Therapeutics, Inc. Class A Common Stock",$9.785,0.915,10.316%,"274,389,943"
NMG,Nouveau Monde Graphite Inc. Common Shares,$1.8002,-0.0198,-1.088%,"274,351,749"
STRT,STRATTEC SECURITY CORPORATION Common Stock,$65.81,UNCH,--,"274,302,924"
DBVT,DBV Technologies S.A. American Depositary Shares,$10.00,0.20,2.041%,"273,947,390"
CZFS,"Citizens Financial Services, Inc. Common Stock",$56.91,-0.11,-0.193%,"273,584,240"
VOR,Vor Biopharma Inc. Common Stock,$2.155,-0.045,-2.045%,"273,002,104"
WEYS,"Weyco Group, Inc. Common Stock",$28.56,-0.81,-2.758%,"272,444,664"
LFCR,"Lifecore Biomedical, Inc. Common Stock",$7.275,0.035,0.483%,"272,142,611"
UIS,Unisys Corporation New Common Stock,$3.81,-0.02,-0.522%,"271,626,418"
YMT,Yimutian Inc. American Depositary Shares,$2.37,0.14,6.278%,"271,073,658"
GCMGW,GCM Grosvenor Inc. Warrant,$1.39,UNCH,--,"270,891,749"
LAES,SEALSQ Corp Ordinary Shares,$2.59,UNCH,--,"270,678,054"
NC,"NACCO Industries, Inc. Common Stock",$36.2732,0.3032,0.843%,"270,295,300"
SMTI,Sanara MedTech Inc. Common Stock,$30.36,-0.37,-1.204%,"270,275,376"
ACB,Aurora Cannabis Inc. Common Shares,$4.785,0.065,1.377%,"270,132,141"
TTSH,"Tile Shop Holdings, Inc. Common Stock",$6.03,0.19,3.253%,"269,911,453"
NEWP,New Pacific Metals Corp. Common Shares,$1.57,0.01,0.641%,"269,850,765"
FVR,"FrontView REIT, Inc. Common Stock",$13.15,-0.03,-0.228%,"269,035,653"
SSP,E.W. Scripps Company (The) Class A Common Stock,$3.045,0.135,4.639%,"268,974,387"
VNDA,Vanda Pharmaceuticals Inc. Common Stock,$4.545,-0.055,-1.196%,"268,560,096"
GWRS,"Global Water Resources, Inc. Common Stock",$9.77,0.07,0.722%,"268,413,916"
LNKB,"LINKBANCORP, Inc. Common Stock",$7.16,-0.02,-0.279%,"268,137,153"
AVNW,"Aviat Networks, Inc. Common Stock",$21.10,-0.21,-0.985%,"267,810,294"
NREF,"NexPoint Real Estate Finance, Inc. Common Stock",$15.08,0.02,0.133%,"267,245,166"
LWLG,"Lightwave Logic, Inc. Common Stock",$2.0613,-0.0087,-0.42%,"266,814,643"
WSBF,"Waterstone Financial, Inc. Common Stock (MD)",$14.2749,-0.0451,-0.315%,"266,643,212"
SJT,San Juan Basin Royalty Trust Common Stock,$5.72,-0.12,-2.055%,"266,602,313"
PKOH,Park-Ohio Holdings Corp. Common Stock,$18.50,-0.29,-1.543%,"266,311,052"
AUDC,AudioCodes Ltd. Common Stock,$9.03,-0.04,-0.441%,"266,142,030"
JRVR,"James River Group Holdings, Ltd. Common Shares",$5.795,-0.095,-1.613%,"266,085,845"
AMBI,Ambipar Emergency Response Class A Ordinary Shares,$4.80,UNCH,--,"266,063,285"
TG,Tredegar Corporation Common Stock,$7.625,0.025,0.329%,"266,056,090"
BETR,Better Home & Finance Holding Company Class A Common Stock,$17.3962,-0.5238,-2.923%,"266,011,592"
SCAG,Scage Future American Depositary Shares,$3.67,-0.09,-2.394%,"265,135,451"
RMM,"RiverNorth Managed Duration Municipal Income Fund, Inc. Common Stock",$13.42,UNCH,--,"264,905,808"
LCTX,"Lineage Cell Therapeutics, Inc. Common Stock",$1.16,-0.03,-2.521%,"264,893,296"
ONEW,OneWater Marine Inc. Class A Common Stock,$16.14,-0.38,-2.30%,"264,218,660"
HITI,High Tide Inc. Common Shares,$3.26,0.18,5.844%,"264,178,439"
PBYI,Puma Biotechnology Inc Common Stock,$5.24,0.13,2.544%,"263,942,589"
FRST,Primis Financial Corp. Common Stock,$10.70,-0.09,-0.834%,"263,682,080"
OIA,Invesco Municipal Income Opportunities Trust Common Stock,$5.515,-0.025,-0.451%,"262,544,823"
SMRT,"SmartRent, Inc. Class A Common Stock",$1.395,-0.055,-3.793%,"262,358,512"
CTRN,"Citi Trends, Inc. Common Stock",$31.575,0.255,0.814%,"261,884,660"
PAMT,PAMT CORP Common Stock,$12.505,-0.065,-0.517%,"261,679,880"
BTM,Bitcoin Depot Inc. Class A Common Stock,$3.84,0.09,2.40%,"261,433,452"
SKIN,The Beauty Health Company Class A Common Stock,$2.06,-0.06,-2.83%,"261,260,318"
MPAA,"Motorcar Parts  of America, Inc. Common Stock",$13.46,-0.02,-0.148%,"260,479,737"
RITR,Reitar Logtech Holdings Limited Ordinary shares,$4.17,-0.08,-1.882%,"260,390,438"
TLSI,"TriSalus Life Sciences, Inc. Common Stock",$5.22,0.10,1.953%,"260,307,196"
FEIM,"Frequency Electronics, Inc. Common Stock",$26.75,-0.25,-0.926%,"260,222,074"
NMRA,"Neumora Therapeutics, Inc. Common Stock",$1.6053,-0.0047,-0.292%,"259,970,994"
CTGO,"Contango ORE, Inc. Common Stock",$20.51,-0.16,-0.774%,"259,851,671"
LXEO,"Lexeo Therapeutics, Inc. Common Stock",$4.80,UNCH,--,"259,205,827"
ORN,"Orion Group Holdings, Inc. Common",$6.52,-0.10,-1.511%,"259,073,797"
CHPT,"ChargePoint Holdings, Inc. Common Stock",$11.0733,-0.3167,-2.781%,"258,627,397"
TSBK,"Timberland Bancorp, Inc. Common Stock",$32.745,-0.105,-0.32%,"258,595,091"
GASS,"StealthGas, Inc. Common Stock",$6.99,0.01,0.143%,"258,480,966"
ALCO,"Alico, Inc. Common Stock",$33.795,-0.065,-0.192%,"258,374,941"
NODK,"NI Holdings, Inc. Common Stock",$12.49,-0.02,-0.16%,"258,234,959"
FRGE,"Forge Global Holdings, Inc. Common Stock",$18.95,-0.72,-3.66%,"257,745,810"
CDXS,"Codexis, Inc. Common Stock",$2.855,0.035,1.241%,"257,713,610"
CATX,"Perspective Therapeutics, Inc. Common Stock",$3.47,0.09,2.663%,"257,692,575"
FTF,Franklin Limited Duration Income Trust Common Shares of Beneficial Interest,$6.3754,0.0004,0.006%,"257,600,421"
LOVE,The Lovesac Company Common Stock,$17.70,-0.57,-3.12%,"257,519,389"
COSO,"CoastalSouth Bancshares, Inc. Common Stock",$21.48,UNCH,--,"257,307,223"
HMST,"HomeStreet, Inc. Common Stock",$13.57,-0.18,-1.309%,"256,755,365"
UPXI,"Upexi, Inc. Common Stock",$6.8884,-0.1616,-2.292%,"256,616,135"
THM,"International Tower Hill Mines, Ltd. Ordinary Shares (Canada)",$1.23,0.03,2.50%,"255,699,132"
DDD,3D Systems Corporation Common Stock,$1.9901,0.0201,1.02%,"255,235,412"
NRGV,"Energy Vault Holdings, Inc. Common Stock",$1.575,-0.045,-2.778%,"254,922,266"
STXS,"Stereotaxis, Inc. Common Stock",$2.81,-0.04,-1.404%,"254,737,091"
SWIN,Solowin Holdings Class A Ordinary Share,$4.45,0.05,1.136%,"254,032,967"
FINW,FinWise Bancorp Common Stock,$18.79,0.19,1.022%,"254,026,332"
NNOX,NANO-X IMAGING LTD Ordinary Shares,$3.98,0.075,1.921%,"253,772,764"
MREO,Mereo BioPharma Group plc American Depositary Shares,$1.635,0.005,0.307%,"253,663,067"
TPVG,TriplePoint Venture Growth BDC Corp. Common Stock,$6.28,0.10,1.618%,"253,233,093"
PKBK,"Parke Bancorp, Inc. Common Stock",$21.325,-0.125,-0.583%,"252,641,476"
WTI,"W&T Offshore, Inc. Common Stock",$1.7027,0.0227,1.351%,"252,576,866"
AVBH,"Avidbank Holdings, Inc. Common stock",$24.00,UNCH,--,"252,532,416"
SLN,Silence Therapeutics Plc American Depository Share,$5.38,0.05,0.938%,"251,784,000"
GALT,Galectin Therapeutics Inc. Common Stock,$3.93,0.03,0.769%,"251,756,830"
CIA,"Citizens, Inc. Class A Common Stock ($1.00 Par)",$5.00,-0.03,-0.596%,"251,226,835"
SLSN,"Solesence, Inc. Common Stock",$3.56,0.06,1.714%,"250,915,724"
GHI,Greystone Housing Impact Investors LP Beneficial Unit Certificates representing assignments of limited partnership interests,$10.6311,-0.0589,-0.551%,"250,707,416"
EOT,Eaton Vance Municipal Income Trust EATON VANCE NATIONAL MUNICIPAL OPPORTUNITIES TRUST,$16.04,-0.055,-0.342%,"250,623,733"
EAF,GrafTech International Ltd. Common Stock,$0.97,-0.04,-3.96%,"250,406,900"
WRN,Western Copper and Gold Corporation Common Stock,$1.24,UNCH,--,"250,043,468"
TGEN,Tecogen Inc. Common Stock,$8.42,0.23,2.808%,"249,996,519"
UHG,"United Homes Group, Inc Class A Common Stock",$4.25,0.19,4.68%,"249,912,151"
TVRD,"Tvardi Therapeutics, Inc. Common Stock",$26.64,-0.24,-0.893%,"249,814,815"
FDBC,"Fidelity D & D Bancorp, Inc. Common Stock",$42.93,-0.24,-0.556%,"247,590,275"
EGHT,8x8 Inc Common Stock,$1.815,-0.005,-0.275%,"247,509,450"
OPRT,Oportun Financial Corporation Common Stock,$5.62,-0.01,-0.178%,"247,332,822"
CHMG,Chemung Financial Corp Common Stock,$51.51,UNCH,--,"246,781,268"
EWCZ,"European Wax Center, Inc. Class A Common Stock",$4.465,-0.015,-0.335%,"246,562,948"
JILL,"J. Jill, Inc. Common Stock",$16.10,0.10,0.625%,"246,056,992"
BKTI,BK Technologies Corporation Common Stock,$65.84,1.45,2.252%,"245,824,438"
LIEN,"Chicago Atlantic BDC, Inc. Common Stock",$10.76,-0.11,-1.012%,"245,549,548"
EDIT,"Editas Medicine, Inc. Common Stock",$2.7246,0.0546,2.045%,"244,996,479"
EB,"Eventbrite, Inc. Class A Common Stock",$2.535,-0.015,-0.588%,"244,627,710"
HUMA,"Humacyte, Inc. Common Stock",$1.5442,-0.0858,-5.264%,"244,558,310"
KNOP,KNOT Offshore Partners LP Common Units representing Limited Partner Interests,$7.175,0.195,2.794%,"244,273,456"
VIOT,"Viomi Technology Co., Ltd American Depositary Shares",$3.58,0.28,8.485%,"244,183,591"
DOYU,DouYu International Holdings Limited ADS,$8.09,-0.165,-1.999%,"244,146,969"
OM,"Outset Medical, Inc. Common Stock",$13.72,0.38,2.849%,"243,752,168"
SOPH,SOPHiA GENETICS SA Ordinary Shares,$3.635,0.055,1.536%,"242,930,943"
ACRE,Ares Commercial Real Estate Corporation Common Stock,$4.415,-0.095,-2.106%,"242,848,633"
IMMP,Immutep Limited American Depositary Shares,$1.6693,0.0093,0.56%,"242,811,011"
WNEB,"Western New England Bancorp, Inc. Common Stock",$11.845,-0.045,-0.378%,"242,727,337"
PCYO,Pure Cycle Corporation Common Stock,$10.08,-0.17,-1.659%,"242,668,994"
SI,"Shoulder Innovations, Inc. Common Stock",$12.17,0.07,0.579%,"242,468,520"
FC,Franklin Covey Company Common Stock,$19.06,0.15,0.793%,"240,953,127"
SCPH,scPharmaceuticals Inc. Common Stock,$4.52,0.07,1.573%,"240,908,298"
ALLO,"Allogene Therapeutics, Inc. Common Stock",$1.085,0.025,2.358%,"240,740,916"
CURI,CuriosityStream Inc. Class A Common Stock,$4.145,-0.115,-2.70%,"240,118,743"
ATNI,"ATN International, Inc. Common Stock",$15.70,0.07,0.448%,"239,541,039"
OZ,"Belpointe PREP, LLC Class A Units",$61.625,0.375,0.612%,"239,519,305"
LPRO,Open Lending Corporation Common Stock,$2.025,-0.035,-1.699%,"239,299,266"
ISBA,Isabella Bank Corporation Common stock,$32.50,UNCH,--,"239,197,108"
ANNX,"Annexon, Inc. Common Stock",$2.175,0.035,1.636%,"239,003,405"
ARL,"American Realty Investors, Inc. Common Stock",$14.793,0.333,2.303%,"238,937,172"
NRDY,Nerdy Inc. Class A Common Stock,$1.285,-0.015,-1.154%,"238,751,490"
FSTR,L.B. Foster Company Common Stock,$22.515,-0.135,-0.596%,"238,606,833"
TKNO,"Alpha Teknova, Inc. Common Stock",$4.453,0.003,0.067%,"238,303,039"
AOMR,"Angel Oak Mortgage REIT, Inc. Common Stock",$9.98,-0.02,-0.20%,"237,176,716"
PNRG,PrimeEnergy Resources Corporation Common Stock,$143.39,-6.51,-4.343%,"236,450,110"
MFIN,Medallion Financial Corp. Common Stock,$10.1668,-0.0432,-0.423%,"236,343,462"
TOYO,"TOYO Co., Ltd Ordinary Shares",$5.07,0.1201,2.426%,"236,240,417"
ISSC,"Innovative Solutions and Support, Inc. Common Stock",$13.40,0.18,1.362%,"236,217,384"
VPV,Invesco Pennsylvania Value Municipal Income Trust Common Stock (DE),$9.91,0.04,0.405%,"236,150,781"
SGMT,Sagimet Biosciences Inc. Series A Common Stock,$7.25,0.07,0.975%,"235,781,593"
NYXH,Nyxoah SA Ordinary Shares,$6.275,-0.07,-1.103%,"234,856,088"
ALTG,Alta Equipment Group Inc. Class A Common Stock,$7.32,-0.31,-4.063%,"234,590,943"
FLX,BingEx Limited American Depositary Shares,$3.29,UNCH,--,"234,017,404"
FUND,"Sprott Focus Trust, Inc. Common Stock",$7.895,-0.025,-0.316%,"233,956,933"
FVCB,"FVCBankcorp, Inc. Common Stock",$12.95,-0.105,-0.804%,"233,769,347"
OVLY,Oak Valley Bancorp (CA) Common Stock,$27.86,UNCH,--,"233,482,457"
ICG,Intchains Group Limited American Depositary Shares,$1.94,-0.06,-3.00%,"232,700,084"
III,Information Services Group Inc. Common Stock,$4.82,-0.03,-0.619%,"232,302,161"
CNFRZ,"Conifer Holdings, Inc. 9.75% Senior Unsecured Notes due 2028",$19.00,1.04,5.791%,"232,234,739"
BBOT,"BridgeBio Oncology Therapeutics, Inc. Common Stock  ",$9.87,0.24,2.492%,"232,033,830"
PRQR,ProQR Therapeutics N.V. Ordinary Shares,$2.205,0.065,3.037%,"231,993,622"
NWFL,Norwood Financial Corp. Common Stock,$25.038,-0.072,-0.287%,"231,891,315"
ACV,Virtus Diversified Income & Convertible Fund Common Shares of Beneficial Interest,$22.375,-0.075,-0.334%,"231,871,096"
MBCN,Middlefield Banc Corp. Common Stock,$28.64,-0.42,-1.445%,"231,445,368"
MITT,"AG Mortgage Investment Trust, Inc. Common Stock",$7.29,-0.09,-1.22%,"231,329,422"
MEI,"Methode Electronics, Inc. Common Stock",$6.57,-0.11,-1.647%,"231,308,761"
CURV,Torrid Holdings Inc. Common Stock,$2.20,-0.02,-0.901%,"231,045,375"
QTRX,Quanterix Corporation Common Stock,$4.97,0.06,1.222%,"230,935,598"
ZVIA,Zevia PBC Class A Common Stock,$3.0707,0.0407,1.343%,"230,147,715"
GEOS,Geospace Technologies Corporation Common Stock (Texas),$17.92,0.60,3.464%,"229,746,980"
SDA,SunCar Technology Group Inc. Class A Ordinary Shares,$2.33,0.02,0.866%,"229,516,785"
SNBR,Sleep Number Corporation Common Stock,$10.07,-0.39,-3.728%,"229,303,970"
ASUR,"Asure Software, Inc Common Stock",$8.36,0.10,1.211%,"229,273,075"
WTF,Waton Financial Limited Ordinary Shares,$4.75,-0.1021,-2.104%,"229,127,992"
GENC,"Gencor Industries, Inc. Common Stock",$15.60,-0.18,-1.141%,"228,660,151"
INSE,"Inspired Entertainment, Inc. Common Stock",$8.49,0.10,1.192%,"228,555,096"
FBLA,"FB Bancorp, Inc. Common Stock",$11.5202,-0.1398,-1.199%,"228,531,968"
FENC,Fennec Pharmaceuticals Inc. Common Stock,$8.23,0.15,1.856%,"228,242,590"
JBIO,"Jade Biosciences, Inc. Common Stock",$6.98,0.13,1.898%,"227,734,575"
STIM,"Neuronetics, Inc. Common Stock",$3.4392,0.1092,3.279%,"227,416,481"
CERS,Cerus Corporation Common Stock,$1.185,0.025,2.155%,"227,163,071"
RGCO,RGC Resources Inc. Common Stock,$21.90,0.18,0.829%,"226,128,757"
FUNC,First United Corporation Common Stock,$34.74,0.03,0.086%,"225,622,786"
BRLT,"Brilliant Earth Group, Inc. Class A Common Stock",$2.26,UNCH,--,"225,442,004"
INV,"Innventure, Inc. Common Stock",$4.02,-0.09,-2.19%,"225,222,727"
TRVG,trivago N.V. American Depositary Shares,$3.20,-0.01,-0.312%,"224,983,376"
SRI,"Stoneridge, Inc. Common Stock",$8.01,-0.02,-0.249%,"224,332,017"
ATLN,Atlantic International Corp. Common Stock,$3.84,-0.15,-3.759%,"224,161,874"
MGRM,Monogram Technologies Inc. Common Stock,$5.51,0.03,0.547%,"223,884,342"
PVBC,"Provident Bancorp, Inc. (MD) Common Stock",$12.585,-0.025,-0.198%,"223,812,244"
BPRN,"Princeton Bancorp, Inc. Common Stock (PA)",$33.16,UNCH,--,"223,761,127"
IMMR,Immersion Corporation Common Stock,$6.895,-0.025,-0.361%,"223,373,399"
CMDB,Costamare Bulkers Holdings Limited Common Stock,$9.20,0.04,0.437%,"222,674,454"
ONTF,"ON24, Inc. Common Stock",$5.255,0.035,0.67%,"222,319,554"
ALEC,"Alector, Inc. Common Stock",$2.195,-0.005,-0.227%,"222,161,062"
SNFCA,Security National Financial Corporation Class A Common Stock,$8.52,0.11,1.308%,"221,370,747"
PPIH,"Perma-Pipe International Holdings, Inc. Common Stock",$27.705,0.605,2.232%,"221,157,046"
DOUG,Douglas Elliman Inc. Common Stock,$2.49,0.01,0.403%,"220,883,171"
BRY,Berry Corporation (bry) Common Stock,$2.845,0.045,1.607%,"220,775,986"
STRZ,Starz Entertainment Corp. Common Shares,$13.184,-0.316,-2.341%,"220,460,343"
ISTR,Investar Holding Corporation Common Stock,$22.41,0.03,0.134%,"220,239,900"
KLTR,"Kaltura, Inc. Common Stock",$1.425,-0.015,-1.042%,"220,150,380"
CFFI,C&F Financial Corporation Common Stock,$67.935,-0.105,-0.154%,"219,993,978"
FBIOP,"Fortress Biotech, Inc. 9.375% Series A Cumulative Redeemable Perpetual Preferred Stock",$7.39,-0.20,-2.635%,"219,887,625"
GDEV,GDEV Inc. Ordinary Shares,$12.12,-0.69,-5.386%,"219,736,691"
QSI,Quantum-Si Incorporated Class A Common Stock,$1.085,0.085,8.50%,"219,707,290"
SLND,"Southland Holdings, Inc. Common Stock",$4.05,-0.12,-2.878%,"219,157,796"
VLN,Valens Semiconductor Ltd. Ordinary Shares,$2.0702,-0.0198,-0.947%,"218,858,774"
EICA,Eagle Point Income Company Inc. 5.00% Series A Term Preferred Stock due 2026,$24.5434,-0.0366,-0.149%,"218,635,258"
RILYL,"B. Riley Financial, Inc. Depositary Shares each representing 1/1000th in a share of 7.375% Series B Cumulative Perpetual Preferred Stock, par value $0.0001",$7.16,0.35,5.14%,"218,358,993"
DENN,Denny's Corporation Common Stock,$4.235,-0.035,-0.82%,"218,098,240"
LCNB,LCNB Corporation Common Stock,$15.37,0.11,0.721%,"217,883,445"
ELLO,Ellomay Capital Ltd Ordinary Shares (Israel),$16.95,-0.19,-1.109%,"217,851,316"
NB,NioCorp Developments Ltd. Common Stock,$3.9092,-0.1008,-2.514%,"217,778,260"
PAL,"Proficient Auto Logistics, Inc. Common Stock",$7.83,0.19,2.487%,"217,587,753"
DRTS,Alpha Tau Medical Ltd. Ordinary Shares,$3.09,0.03,0.98%,"217,475,961"
SGHT,"Sight Sciences, Inc. Common Stock",$4.15,0.08,1.966%,"217,324,540"
ABAT,American Battery Technology Company Common Stock,$2.365,-0.02,-0.839%,"217,311,364"
XGN,Exagen Inc. Common Stock,$9.85,0.01,0.102%,"216,735,864"
FLXS,"Flexsteel Industries, Inc. Common Stock",$41.07,1.07,2.675%,"216,572,501"
OABI,"OmniAb, Inc. Common Stock",$1.765,-0.065,-3.552%,"216,567,784"
PESI,"Perma-Fix Environmental Services, Inc. Common Stock",$11.70,0.24,2.094%,"216,101,352"
TRDA,"Entrada Therapeutics, Inc. Common Stock",$5.68,0.37,6.968%,"216,050,609"
GNFT,GENFIT S.A. American Depositary Shares,$4.32,UNCH,--,"215,983,519"
TE,T1 Energy Inc. Common Stock,$1.385,0.055,4.135%,"215,974,257"
EARN,Ellington Credit Company Common Shares of Beneficial Interest,$5.75,UNCH,--,"215,965,371"
MASS,908 Devices Inc. Common Stock,$5.98,UNCH,--,"215,792,474"
EVC,Entravision Communications Corporation Common Stock,$2.371,-0.019,-0.795%,"215,704,779"
WOLF,"Wolfspeed, Inc. Common Stock",$1.385,-0.025,-1.773%,"215,543,007"
INBKZ,First Internet Bancorp 6.0% Fixed-to-Floating Rate Subordinated Notes Due 2029,$24.72,0.0113,0.046%,"215,387,684"
RILYP,"B. Riley Financial, Inc. Depositary Shares, each representing a 1/1000th fractional interest in a share of Series A Cumulative Perpetual Preferred Stock",$7.05,0.28,4.136%,"215,004,315"
MIMI,Mint Incorporation Limited Class A Ordinary Shares,$8.59,0.05,0.585%,"214,857,375"
TLSA,Tiziana Life Sciences Ltd. Common Shares,$1.925,0.115,6.354%,"214,565,538"
GHG,"GreenTree Hospitality Group Ltd. American depositary shares, each representing one Class A ordinary share",$2.11,-0.02,-0.939%,"214,216,676"
GPJA,"Georgia Power Company Series 2017A 5.00% Junior Subordinated Notes due October 1, 2077",$22.95,-0.04,-0.174%,"212,551,425"
AFRI,Forafric Global PLC Ordinary Shares,$7.88,0.04,0.51%,"211,984,545"
SMID,Smith-Midland Corporation Common Stock,$39.93,0.33,0.833%,"211,812,918"
CCRD,CoreCard Corporation Common Stock,$27.15,-0.02,-0.074%,"211,563,171"
PINE,"Alpine Income Property Trust, Inc. Common Stock",$14.94,0.04,0.268%,"211,523,359"
TCX,Tucows Inc. Class A Common Stock,$19.04,0.04,0.211%,"210,932,926"
MERC,Mercer International Inc. Common Stock,$3.145,-0.025,-0.789%,"210,659,981"
VABK,Virginia National Bankshares Corporation Common Stock,$39.045,UNCH,--,"210,529,820"
MYFW,"First Western Financial, Inc. Common Stock",$21.64,0.04,0.185%,"210,295,832"
SSSS,SuRo Capital Corp. Common Stock,$8.78,0.07,0.804%,"209,737,579"
OSUR,"OraSure Technologies, Inc. Common Stock",$2.865,-0.035,-1.207%,"209,537,468"
HCAT,"Health Catalyst, Inc Common Stock",$2.975,0.055,1.884%,"209,361,534"
BMNR,"BitMine Immersion Technologies, Inc. Common Stock",$48.65,-3.41,-6.55%,"209,358,756"
OGI,Organigram Global Inc. Common Shares,$1.555,0.055,3.667%,"208,404,470"
ZJK,"ZJK Industrial Co., Ltd. Ordinary Shares",$3.3942,0.1142,3.482%,"208,340,235"
MFM,MFS Municipal Income Trust Common Stock,$5.05,-0.03,-0.591%,"207,997,537"
ACIU,AC Immune SA Common Stock,$2.07,-0.07,-3.271%,"207,849,480"
COE,"51Talk Online Education Group American depositary shares, each representing 60 Class A ordinary shares",$35.415,0.28,0.797%,"207,513,307"
OPOF,Old Point Financial Corporation Common Stock,$40.66,-0.08,-0.196%,"207,455,330"
IPHA,Innate Pharma S.A. ADS,$2.2501,0.0201,0.901%,"207,362,799"
AARD,"Aardvark Therapeutics, Inc. Common Stock",$9.55,-0.12,-1.241%,"207,205,328"
HWBK,"Hawthorn Bancshares, Inc. Common Stock",$30.00,0.01,0.033%,"207,179,040"
MNPR,Monopar Therapeutics Inc. Common Stock,$33.37,0.37,1.121%,"205,891,599"
ENGN,enGene Holdings Inc. Common Stock,$4.02,0.16,4.145%,"205,442,908"
INGN,"Inogen, Inc Common Stock",$7.59,0.22,2.985%,"205,236,560"
INBK,First Internet Bancorp Common Stock,$23.50,-0.14,-0.592%,"204,757,709"
OPBK,OP Bancorp Common Stock,$13.70,-0.09,-0.653%,"203,932,912"
WALD,Waldencast plc Class A Ordinary Share,$1.66,-0.04,-2.353%,"203,716,712"
ETX           ,Eaton Vance Municipal Income 2028 Term Trust Common Shares of Beneficial Interest,$18.70,-0.11,-0.585%,"203,548,677"
BTCS,BTCS Inc. Common Stock,$4.23,-0.23,-5.157%,"203,263,251"
RDCM,Radcom Ltd. Ordinary Shares,$12.77,0.06,0.472%,"203,242,416"
SAMG,Silvercrest Asset Management Group Inc. Class A Common Stock,$16.15,-0.01,-0.062%,"202,957,858"
TWNP,Twin Hospitality Group Inc. Class A Common Stock,$3.5389,0.0039,0.11%,"202,870,472"
LYEL,"Lyell Immunopharma, Inc. Common Stock",$10.545,-0.105,-0.986%,"202,582,125"
HKD,AMTD Digital Inc. American Depositary Shares (every five of which represent two Class A Ordinary Shares),$1.6036,0.0136,0.855%,"202,316,544"
MPV,Barings Participation Investors Common Stock,$19.0201,-0.2999,-1.552%,"201,645,394"
HRTX,"Heron Therapeutics, Inc. Common Stock",$1.315,0.015,1.154%,"201,578,714"
FCCO,First Community Corporation Common Stock,$26.15,UNCH,--,"200,982,467"
NEN,New England Realty Associates Limited Partnership Class A Depositary Receipts Evidencing Units of Limited Partnership,$71.25,UNCH,--,"200,841,638"
KG,"Kestrel Group, Ltd.",$25.92,-0.88,-3.284%,"200,671,163"
FXNC,First National Corporation Common Stock,$22.305,-0.095,-0.424%,"200,502,723"
CLLS,Cellectis S.A. American Depositary Shares,$2.78,-0.04,-1.418%,"200,420,967"
