Symbol,Name,Last Sale,Net Change,% Change,Market Cap
MQ,"Marqeta, Inc. Class A Common Stock",$5.93,-0.05,-0.836%,"2,658,020,219"
RIG,Transocean Ltd (Switzerland) Common Stock,$2.815,0.015,0.536%,"2,654,896,836"
GTX,Garrett Motion Inc. Common Stock,$13.17,0.02,0.152%,"2,654,748,795"
NEXT,NextDecade Corporation Common Stock,$10.13,0.10,0.997%,"2,653,942,188"
SOC,Sable Offshore Corp. Common Stock,$26.67,-0.42,-1.55%,"2,653,858,358"
TOWN,TowneBank Common Stock,$35.44,-0.01,-0.028%,"2,644,438,175"
BHF,"Brighthouse Financial, Inc. Common Stock",$46.22,-0.47,-1.007%,"2,641,582,588"
DJTWW,Trump Media & Technology Group Corp. Warrants,$9.4672,0.1772,1.907%,"2,623,052,451"
EXTR,"Extreme Networks, Inc. Common Stock",$19.82,-0.07,-0.352%,"2,620,394,391"
RNG,"RingCentral, Inc. Class A Common Stock",$28.90,-0.51,-1.734%,"2,616,684,608"
ATS,ATS Corporation Common Shares,$26.75,-0.16,-0.595%,"2,612,224,357"
PRVA,"Privia Health Group, Inc. Common Stock",$21.249,0.099,0.468%,"2,607,888,176"
JOYY,JOYY Inc. American Depositary Shares,$50.42,0.06,0.119%,"2,607,822,837"
HAE,Haemonetics Corporation Common Stock,$54.085,-0.365,-0.67%,"2,605,666,891"
ELPC,Companhia Paranaense de Energia (COPEL) American Depositary Shares (each representing four (4) Common Shares),$8.03,UNCH,--,"2,605,179,926"
MFAO,"MFA Financial, Inc. 9.000% Senior Notes due 2029",$25.3478,0.0378,0.149%,"2,602,425,725"
BOH,Bank of Hawaii Corporation Common Stock,$65.425,-0.195,-0.297%,"2,601,789,211"
MPW,"Medical Properties Trust, Inc. common stock",$4.325,-0.005,-0.115%,"2,599,757,500"
PBF,PBF Energy Inc. Class A Common Stock,$22.46,-1.15,-4.871%,"2,598,591,522"
FTAIN,FTAI Aviation Ltd. 8.25% Fixed - Rate Reset Series C Cumulative Perpetual Redeemable Preferred Shares,$25.3109,0.0009,0.004%,"2,596,154,149"
AIR,AAR Corp. Common Stock,$72.26,0.49,0.683%,"2,590,346,781"
CLSK,"CleanSpark, Inc. Common Stock",$9.2087,-0.2813,-2.964%,"2,588,412,540"
OPEN,Opendoor Technologies Inc Common Stock,$3.51,0.29,9.006%,"2,583,199,193"
MFAN,"MFA Financial, Inc. 8.875% Senior Notes due 2029",$25.146,-0.0341,-0.135%,"2,581,707,180"
SBCF,Seacoast Banking Corporation of Florida Common Stock,$29.33,-0.15,-0.509%,"2,576,778,791"
WRD,WeRide Inc. American Depositary Shares,$9.0485,0.0385,0.427%,"2,574,559,797"
MIAX,"Miami International Holdings, Inc. Common Stock",$32.395,-0.375,-1.144%,"2,573,307,386"
ALG,"Alamo Group, Inc. Common Stock",$212.47,-1.94,-0.905%,"2,573,205,048"
IMVT,"Immunovant, Inc. Common Stock",$14.71,-0.11,-0.742%,"2,564,200,731"
BSM,"Black Stone Minerals, L.P. Common units representing limited partner interests",$12.09,0.04,0.332%,"2,561,302,419"
SYNA,Synaptics Incorporated Common Stock $0.001 Par Value,$66.12,-0.64,-0.959%,"2,548,625,683"
FUN,Six Flags Entertainment Corporation Common Stock New,$25.125,-1.005,-3.846%,"2,544,643,970"
IRDM,Iridium Communications Inc Common Stock,$23.9656,-0.1644,-0.681%,"2,543,083,713"
DV,"DoubleVerify Holdings, Inc. Common Stock",$15.53,0.01,0.064%,"2,541,148,726"
DAVE,Dave Inc. Class A Common Stock,$186.015,-2.235,-1.187%,"2,535,320,833"
LXP,LXP Industrial Trust Common Stock (Maryland REIT),$8.55,-0.15,-1.724%,"2,528,971,967"
VAC,Marriott Vacations Worldwide Corporation Common Stock,$73.075,-0.425,-0.578%,"2,528,577,614"
MRX,Marex Group plc Ordinary Shares,$35.96,0.24,0.672%,"2,527,660,261"
POWI,"Power Integrations, Inc. Common Stock",$45.04,-0.56,-1.228%,"2,526,545,013"
UE,Urban Edge Properties Common Shares of Beneficial Interest,$20.04,-0.07,-0.348%,"2,520,853,624"
CHEF,"The Chefs' Warehouse, Inc. Common Stock",$61.82,-0.09,-0.145%,"2,519,947,518"
AKR,Acadia Realty Trust Common Stock,$19.22,-0.08,-0.415%,"2,518,071,378"
SIMO,Silicon Motion Technology Corporation American Depositary Shares,$73.855,-0.285,-0.384%,"2,509,863,948"
GCMG,GCM Grosvenor Inc. Class A Common Stock,$12.85,-0.01,-0.078%,"2,504,287,028"
DFH,"Dream Finders Homes, Inc. Class A Common Stock",$26.9351,-1.0449,-3.734%,"2,501,777,447"
CPRX,"Catalyst Pharmaceuticals, Inc. Common Stock",$20.43,0.09,0.442%,"2,500,448,334"
ALVO,Alvotech Ordinary Shares,$8.2784,0.0584,0.71%,"2,498,468,116"
VTMX,"Corporacion Inmobiliaria Vesta, S.A.B de C.V. American Depositary Shares, each representing ten (10) Common Shares",$28.20,0.01,0.035%,"2,494,251,761"
DXC,DXC Technology Company Common Stock ,$13.69,-0.01,-0.073%,"2,491,043,229"
KNSA,"Kiniksa Pharmaceuticals International, plc Class A Ordinary Shares",$33.57,0.36,1.084%,"2,487,794,415"
LU,"Lufax Holding Ltd American Depositary Shares, each representing two (2) Ordinary Shares",$2.87,0.12,4.364%,"2,487,256,800"
DEI,"Douglas Emmett, Inc. Common Stock",$14.775,-0.135,-0.905%,"2,474,019,821"
REVG,"REV Group, Inc. Common Stock",$50.53,-0.38,-0.746%,"2,465,730,146"
BTDR,Bitdeer Technologies Group Class A Ordinary Shares,$12.52,-0.42,-3.246%,"2,463,261,785"
LCII,LCI Industries,$101.59,-0.26,-0.255%,"2,462,976,710"
ASH,Ashland Inc. Common Stock,$53.875,-0.195,-0.361%,"2,462,408,487"
ACLS,"Axcelis Technologies, Inc. Common Stock",$78.275,-0.795,-1.005%,"2,459,311,267"
DIOD,Diodes Incorporated Common Stock,$52.8813,0.2713,0.516%,"2,455,952,202"
DAN,Dana Incorporated Common Stock ,$18.715,0.035,0.187%,"2,454,540,242"
PGY,Pagaya Technologies Ltd. Class A Ordinary Shares,$30.06,-0.23,-0.759%,"2,453,149,286"
PFS,"Provident Financial Services, Inc Common Stock",$18.75,-0.14,-0.741%,"2,449,202,869"
FL,"Foot Locker, Inc.",$25.60,-0.04,-0.156%,"2,439,107,456"
FFBC,First Financial Bancorp. Common Stock,$25.47,0.05,0.197%,"2,438,853,259"
OGN,Organon & Co. Common Stock ,$9.345,-0.025,-0.267%,"2,429,378,336"
NG,Novagold Resources Inc.,$5.95,0.03,0.507%,"2,421,041,000"
SXI,Standex International Corporation Common Stock,$200.27,-0.33,-0.165%,"2,416,910,831"
ALKT,"Alkami Technology, Inc. Common Stock",$23.22,0.93,4.172%,"2,416,810,464"
SUPN,"Supernus Pharmaceuticals, Inc. Common Stock",$43.08,0.40,0.937%,"2,415,628,631"
OLN,Olin Corporation Common Stock,$21.055,-0.225,-1.057%,"2,413,777,519"
WSBCP,"WesBanco, Inc. Depositary Shares, Each Representing a 1/40th Interest in a Share of 6.75% Fixed-Rate Reset Non-Cumulative Perpetual Preferred Stock, Series A",$25.13,UNCH,--,"2,412,224,252"
CPRI,Capri Holdings Limited Ordinary Shares,$20.26,0.11,0.546%,"2,411,913,635"
WAFD,"WaFd, Inc. Common Stock",$30.58,-0.09,-0.293%,"2,409,461,011"
MAG,MAG Silver Corporation Ordinary Shares,$23.22,0.39,1.708%,"2,407,061,663"
BWLP,BW LPG Limited Common Shares,$15.86,0.26,1.667%,"2,403,399,706"
NEGG,"Newegg Commerce, Inc. Common Shares",$123.32,12.68,11.461%,"2,403,335,878"
MFICL,MidCap Financial Investment Corporation 8.00% Notes due 2028,$25.62,-0.01,-0.039%,"2,390,438,796"
RXO,"RXO, Inc. Common Stock",$14.57,0.11,0.761%,"2,389,294,072"
SPNS,Sapiens International Corporation N.V. Common Shares (Cayman Islands),$42.71,UNCH,--,"2,386,943,380"
GDV,Gabelli Dividend & Income Trust Common Shares of Beneficial Interest,$26.435,0.055,0.208%,"2,384,132,760"
NSA,National Storage Affiliates Trust Common Shares of Beneficial Interest,$31.045,-0.265,-0.846%,"2,383,171,008"
TARS,"Tarsus Pharmaceuticals, Inc. Common Stock",$56.40,0.99,1.787%,"2,380,875,578"
CRGY,Crescent Energy Company Class A Common Stock,$9.35,0.07,0.754%,"2,380,651,914"
KWR,Quaker Houghton Common Stock,$136.715,-0.265,-0.193%,"2,378,105,337"
VIAV,Viavi Solutions Inc. Common Stock,$10.615,0.065,0.616%,"2,369,755,388"
PAYO,Payoneer Global Inc. Common Stock,$6.575,-0.075,-1.128%,"2,369,074,695"
STNG,Scorpio Tankers Inc. Common Shares,$47.38,1.14,2.465%,"2,365,045,760"
ATEC,"Alphatec Holdings, Inc. Common Stock",$15.96,0.07,0.441%,"2,361,821,049"
SAM,"Boston Beer Company, Inc. (The) Common Stock",$216.67,-1.66,-0.76%,"2,359,237,945"
NOMD,Nomad Foods Limited Ordinary Shares,$15.36,0.31,2.06%,"2,356,269,727"
GT,The Goodyear Tire & Rubber Company Common Stock,$8.225,-0.065,-0.784%,"2,352,732,150"
IHS,IHS Holding Limited Ordinary Shares,$7.055,0.315,4.674%,"2,352,425,811"
HURN,Huron Consulting Group Inc. Common Stock,$135.865,0.575,0.425%,"2,351,400,202"
LQDA,Liquidia Corporation Common Stock,$27.245,-0.105,-0.384%,"2,345,561,664"
QUBT,Quantum Computing Inc. Common Stock,$14.67,0.05,0.342%,"2,345,486,353"
CURB,Curbline Properties Corp. Common Stock,$22.265,-0.075,-0.336%,"2,342,603,692"
XMTR,"Xometry, Inc. Class A Common Stock",$46.04,1.51,3.391%,"2,338,663,862"
CNTA,Centessa Pharmaceuticals plc American Depositary Shares,$17.39,0.11,0.637%,"2,331,537,052"
KEN,Kenon Holdings Ltd. Ordinary Shares,$44.685,0.415,0.937%,"2,330,333,564"
TRMK,Trustmark Corporation Common Stock,$38.565,0.055,0.143%,"2,328,036,888"
FOLD,"Amicus Therapeutics, Inc. Common Stock",$7.5413,0.1413,1.909%,"2,324,525,591"
WWW,"Wolverine World Wide, Inc. Common Stock",$28.57,-0.06,-0.21%,"2,321,436,808"
VCYT,"Veracyte, Inc. Common Stock",$29.49,UNCH,--,"2,320,025,130"
EVTC,"Evertec, Inc. Common Stock",$36.10,-0.06,-0.166%,"2,309,750,381"
BANC,"Banc of California, Inc. Common Stock",$15.605,-0.115,-0.732%,"2,306,081,495"
NOG,"Northern Oil and Gas, Inc. Common Stock",$23.61,0.37,1.592%,"2,304,210,442"
DKL,"Delek Logistics Partners, L.P. Common Units representing Limited Partner Interests",$42.98,-0.15,-0.348%,"2,297,875,370"
OII,"Oceaneering International, Inc. Common Stock",$22.87,0.33,1.464%,"2,291,747,721"
FRME,First Merchants Corporation Common Stock,$39.66,0.16,0.405%,"2,289,664,565"
FINV,FinVolution Group American Depositary Shares,$9.03,0.38,4.393%,"2,288,327,165"
NYMTI,"New York Mortgage Trust, Inc. 9.125% Senior Notes Due 2029",$25.18,0.0916,0.365%,"2,280,790,526"
TSLX,"Sixth Street Specialty Lending, Inc. Common Stock",$24.195,-0.065,-0.268%,"2,280,145,220"
SYBT,"Stock Yards Bancorp, Inc. Common Stock",$77.34,0.17,0.22%,"2,279,467,497"
NWL,Newell Brands Inc. Common Stock,$5.435,-0.135,-2.424%,"2,277,808,500"
CIFR,Cipher Mining Inc. Common Stock,$5.785,-0.165,-2.773%,"2,275,140,153"
HTFL,"Heartflow, Inc. Common Stock",$29.25,-0.06,-0.205%,"2,271,557,486"
MEOH,Methanex Corporation Common Stock,$33.695,-0.025,-0.074%,"2,270,881,668"
IQ,"iQIYI, Inc. American Depositary Shares",$2.355,0.055,2.391%,"2,267,768,087"
SOUNW,"SoundHound AI, Inc. Warrant",$5.56,-0.07,-1.243%,"2,266,735,817"
AUGO,Aura Minerals Inc. Common Shares,$27.40,-0.12,-0.436%,"2,264,058,493"
MTRN,Materion Corporation,$109.23,-0.49,-0.447%,"2,264,001,144"
PCT,"PureCycle Technologies, Inc. Common stock",$12.57,-0.02,-0.159%,"2,263,770,192"
TRN,"Trinity Industries, Inc. Common Stock",$27.99,0.12,0.431%,"2,262,637,678"
HUT,Hut 8 Corp. Common Stock,$21.4077,-0.9023,-4.044%,"2,259,110,224"
EPAC,Enerpac Tool Group Corp. Common Stock,$41.8205,-0.1095,-0.261%,"2,255,686,026"
ASGN,ASGN Incorporated Common Stock,$51.43,-0.14,-0.271%,"2,252,634,000"
BUSEP,"First Busey Corporation Depositary Shares, Each Representing a 1/40thInterest in a Share of 8.25% Fixed-Rate Series B Non-Cumulative Perpetual Preferred Stock, $0.001 par value",$25.28,UNCH,--,"2,251,586,205"
PSNY,Polestar Automotive Holding UK PLC Class A ADS,$1.065,-0.005,-0.467%,"2,247,527,619"
OSW,OneSpaWorld Holdings Limited Common Shares,$21.87,0.17,0.783%,"2,245,988,529"
AI,"C3.ai, Inc. Class A Common Stock",$16.69,-0.25,-1.476%,"2,242,901,105"
VITL,"Vital Farms, Inc. Common Stock",$50.18,0.39,0.783%,"2,242,342,476"
XNET,Xunlei Limited American Depositary Shares,$7.19,-0.13,-1.776%,"2,242,275,780"
NYMTM,"New York Mortgage Trust, Inc. 7.875% Series E Fixed-to-Floating Rate Cumulative Redeemable Preferred Stock",$24.79,0.005,0.02%,"2,238,883,663"
PMTU,PennyMac Mortgage Investment Trust 8.50% Senior Notes due 2028,$25.675,0.01,0.039%,"2,234,151,308"
NBTB,NBT Bancorp Inc. Common Stock,$42.51,0.02,0.047%,"2,227,272,553"
CENT,Central Garden & Pet Company Common Stock,$35.41,0.23,0.654%,"2,226,264,695"
BANR,Banner Corporation Common Stock,$64.345,0.185,0.288%,"2,225,339,781"
BWSN,"Babcock & Wilcox Enterprises, Inc. 8.125% Senior Notes due 2026",$22.00,0.25,1.149%,"2,224,145,924"
FSM,Fortuna Mining Corp. Common Shares,$7.245,0.155,2.186%,"2,223,925,099"
PK,Park Hotels & Resorts Inc. Common Stock ,$11.095,-0.035,-0.314%,"2,218,040,238"
CORZW,"Core Scientific, Inc. Tranche 1 Warrants",$7.26,-0.54,-6.923%,"2,217,265,289"
DBD,Diebold Nixdorf Incorporated Common stock,$60.51,-0.17,-0.28%,"2,216,695,747"
PPBI,Pacific Premier Bancorp Inc,$22.84,-0.23,-0.997%,"2,215,284,490"
AMSC,American Superconductor Corporation Common Stock,$49.02,0.91,1.891%,"2,213,788,593"
CXW,"CoreCivic, Inc. Common Stock",$20.57,-0.41,-1.954%,"2,202,223,130"
SBLK,Star Bulk Carriers Corp. Common Shares,$18.775,0.195,1.05%,"2,199,069,395"
IVT,InvenTrust Properties Corp. Common Stock,$28.335,-0.145,-0.509%,"2,198,977,231"
HBI,Hanesbrands Inc. Common Stock,$6.205,-0.035,-0.561%,"2,194,901,711"
LMAT,"LeMaitre Vascular, Inc. Common Stock",$96.79,0.28,0.29%,"2,191,085,754"
AMBP,Ardagh Metal Packaging S.A. Ordinary Shares,$3.665,-0.045,-1.213%,"2,190,568,983"
PRCT,PROCEPT BioRobotics Corporation Common Stock,$39.32,-0.06,-0.152%,"2,187,605,200"
JJSF,J & J Snack Foods Corp. Common Stock,$112.18,-0.15,-0.134%,"2,183,888,381"
ABR,Arbor Realty Trust Common Stock,$11.355,-0.255,-2.196%,"2,183,582,556"
FBNC,First Bancorp Common Stock,$52.63,0.34,0.65%,"2,182,167,059"
SFB,Stifel Financial Corporation 5.20% Senior Notes due 2047,$21.2848,-0.0952,-0.445%,"2,174,740,512"
PHIN,PHINIA Inc. Common Stock,$55.86,-0.16,-0.286%,"2,173,203,974"
SPNT,SiriusPoint Ltd. Common Shares,$18.61,-0.02,-0.107%,"2,172,895,021"
APGE,"Apogee Therapeutics, Inc. Common Stock",$36.38,0.36,0.999%,"2,168,117,359"
DNLI,Denali Therapeutics Inc. Common Stock,$14.815,0.305,2.102%,"2,166,134,899"
AGIO,"Agios Pharmaceuticals, Inc. Common Stock",$37.25,0.43,1.168%,"2,164,281,546"
BB,BlackBerry Limited Common Stock,$3.625,-0.025,-0.685%,"2,161,587,500"
CXM,"Sprinklr, Inc. Class A Common Stock",$8.325,0.045,0.543%,"2,154,825,035"
CELC,Celcuity Inc. Common Stock,$50.72,1.95,3.998%,"2,151,882,782"
INSW,"International Seaways, Inc. Common Stock ",$43.40,1.16,2.746%,"2,142,496,378"
APPN,Appian Corporation Class A Common Stock,$28.94,-0.05,-0.172%,"2,142,484,836"
AGM,Federal Agricultural Mortgage Corporation Common Stock,$195.425,-0.575,-0.293%,"2,136,761,707"
HUBG,"Hub Group, Inc. Class A Common Stock",$34.87,-0.05,-0.143%,"2,134,726,789"
LFST,"LifeStance Health Group, Inc. Common Stock",$5.485,0.135,2.523%,"2,133,316,121"
HRMY,"Harmony Biosciences Holdings, Inc. Common Stock",$37.055,0.425,1.16%,"2,131,870,530"
IBRX,"ImmunityBio, Inc. Common Stock",$2.255,-0.005,-0.221%,"2,131,549,315"
WLY,"John Wiley & Sons, Inc. Common Stock",$39.90,0.01,0.025%,"2,130,399,852"
PINC,"Premier, Inc. Class A Common Stock",$25.77,0.22,0.861%,"2,127,304,249"
UAA,"Under Armour, Inc. Class A Common Stock",$4.96,-0.17,-3.314%,"2,126,948,594"
WLYB,"John Wiley & Sons, Inc. Common Stock",$39.7901,UNCH,--,"2,124,531,909"
FORM,"FormFactor, Inc. FormFactor, Inc. Common Stock",$27.54,-0.36,-1.29%,"2,123,725,454"
PRDO,Perdoceo Education Corporation Common Stock,$32.66,0.32,0.989%,"2,121,377,358"
EFSC,Enterprise Financial Services Corporation Common Stock,$57.35,0.10,0.175%,"2,121,256,983"
CC,Chemours Company (The) Common Stock,$14.145,-0.195,-1.36%,"2,117,482,454"
IDYA,"IDEAYA Biosciences, Inc. Common Stock",$24.15,-0.17,-0.699%,"2,116,595,017"
HCI,"HCI Group, Inc. Common Stock",$163.29,0.77,0.474%,"2,116,204,762"
ADUS,Addus HomeCare Corporation Common Stock,$114.87,0.02,0.017%,"2,114,439,544"
GEL,"Genesis Energy, L.P. Common Units",$17.21,0.26,1.534%,"2,107,610,913"
HWCPZ,Hancock Whitney Corporation 6.25% Subordinated Notes due 2060,$24.80,UNCH,--,"2,101,923,454"
VICR,Vicor Corporation Common Stock,$46.70,0.21,0.452%,"2,097,729,629"
BLTE,"Belite Bio, Inc American Depositary Shares",$64.97,1.55,2.444%,"2,097,346,142"
GLPG,Galapagos NV American Depositary Shares,$31.81,0.05,0.157%,"2,096,185,829"
AEO,"American Eagle Outfitters, Inc. Common Stock",$12.09,-0.22,-1.787%,"2,094,812,949"
HTH,Hilltop Holdings Inc.,$33.21,0.16,0.484%,"2,092,288,416"
UUUU,Energy Fuels Inc Ordinary Shares (Canada),$9.0582,0.5282,6.192%,"2,089,499,497"
PAR,PAR Technology Corporation Common Stock,$51.36,-0.10,-0.194%,"2,084,244,115"
UA,"Under Armour, Inc. Class C Common Stock",$4.86,-0.17,-3.38%,"2,084,066,566"
RXRX,"Recursion Pharmaceuticals, Inc. Class A Common Stock",$4.7932,0.0232,0.486%,"2,080,975,138"
IRON,"Disc Medicine, Inc. Common Stock",$59.815,1.095,1.865%,"2,079,503,228"
CUBI,"Customers Bancorp, Inc Common Stock",$65.6041,-0.1859,-0.283%,"2,074,630,600"
IOSP,Innospec Inc. Common Stock,$83.50,-0.15,-0.179%,"2,073,568,944"
OCUL,"Ocular Therapeutix, Inc. Common Stock",$11.90,-0.06,-0.502%,"2,070,543,130"
TIGR,UP Fintech Holding Ltd American Depositary Share representing fifteen Class A Ordinary Shares,$11.0585,0.5285,5.019%,"2,066,788,288"
BUSE,First Busey Corporation Class A Common Stock,$23.18,-0.05,-0.215%,"2,064,547,794"
TRUP,"Trupanion, Inc. Common Stock",$47.91,0.16,0.335%,"2,059,874,879"
AVDX,"AvidXchange Holdings, Inc. Common Stock",$9.915,0.005,0.05%,"2,059,333,136"
PAX,Patria Investments Limited Class A Common Shares,$13.00,-0.10,-0.763%,"2,054,980,096"
PTEN,"Patterson-UTI Energy, Inc. Common Stock",$5.315,0.025,0.473%,"2,047,165,273"
TIC,Acuren Corporation Common Stock,$10.205,0.165,1.643%,"2,047,018,480"
AORT,"Artivion, Inc. Common Stock",$43.355,0.335,0.779%,"2,045,647,493"
ALIT,"Alight, Inc. Class A Common Stock",$3.825,0.015,0.394%,"2,041,873,813"
CIMN,Chimera Investment Corporation 9.000% Senior Notes due 2029,$25.3236,-0.0408,-0.161%,"2,039,327,133"
NSP,"Insperity, Inc. Common Stock",$54.07,-0.12,-0.221%,"2,037,015,932"
BBAI,"BigBear.ai, Inc. Common Stock",$5.485,-0.125,-2.228%,"2,033,307,041"
COCO,"The Vita Coco Company, Inc. Common Stock",$35.71,-0.21,-0.585%,"2,029,148,652"
CENX,Century Aluminum Company Common Stock,$21.70,-0.14,-0.641%,"2,025,458,926"
TRMD,TORM plc Class A Common Stock,$20.67,0.10,0.486%,"2,021,816,434"
CENTA,Central Garden & Pet Company Class A Common Stock Nonvoting,$32.01,0.19,0.597%,"2,012,503,047"
DBRG,"DigitalBridge Group, Inc.",$11.05,-0.24,-2.126%,"2,012,466,023"
ENVX,Enovix Corporation Common Stock,$10.235,0.145,1.437%,"2,012,201,133"
EVCM,EverCommerce Inc. Common Stock,$11.09,0.15,1.371%,"2,010,381,382"
HE,"Hawaiian Electric Industries, Inc. Common Stock",$11.64,-0.05,-0.428%,"2,009,201,969"
OI,"O-I Glass, Inc. Common Stock",$13.02,0.08,0.618%,"2,006,033,806"
SKWD,"Skyward Specialty Insurance Group, Inc. Common Stock",$49.475,-0.115,-0.232%,"2,003,077,306"
UMBFO,"UMB Financial Corporation Depositary Shares Each Representing a 1/400th Interest in a Share of 7.750% Fixed-Rate Reset Non-Cumulative Perpetual Preferred Stock, Series B",$26.37,0.09,0.342%,"2,002,228,084"
ZGN,Ermenegildo Zegna N.V. Ordinary Shares,$7.92,-0.12,-1.493%,"2,000,432,642"
HNI,HNI Corporation Common Stock,$43.53,-0.48,-1.091%,"1,993,858,393"
ACHC,"Acadia Healthcare Company, Inc. Common Stock",$21.535,0.235,1.103%,"1,988,683,859"
KLG,WK Kellogg Co Common Stock,$23.01,0.01,0.043%,"1,988,441,226"
NYMTL,"New York Mortgage Trust, Inc. 6.875% Series F Fixed-to-Floating Rate Cumulative Redeemable Preferred Stock, $0.01 par value per share",$21.9999,0.0318,0.145%,"1,986,898,617"
FIHL,Fidelis Insurance Holdings Limited Common Shares,$17.74,0.13,0.738%,"1,982,859,034"
STC,Stewart Information Services Corporation Common Stock,$70.705,0.145,0.205%,"1,979,635,569"
SMA,"SmartStop Self Storage REIT, Inc. Common Stock",$35.70,0.15,0.422%,"1,979,227,457"
FORTY,Formula Systems (1985) Ltd. American Depositary Shares,$129.00,UNCH,--,"1,975,979,043"
VNET,"VNET Group, Inc. American Depositary Shares",$7.33,-0.65,-8.145%,"1,971,959,854"
WEN,Wendy's Company (The) Common Stock,$10.3399,0.0699,0.681%,"1,970,424,088"
ACVA,ACV Auctions Inc. Class A Common Stock,$11.44,0.06,0.527%,"1,968,905,464"
PGNY,"Progyny, Inc. Common Stock",$22.895,0.335,1.485%,"1,968,567,254"
CSTM,Constellium SE Ordinary Shares (France),$14.10,-0.30,-2.083%,"1,967,500,224"
TDC,Teradata Corporation Common Stock,$20.81,0.22,1.068%,"1,966,545,000"
FIVN,"Five9, Inc. Common Stock",$25.43,-0.32,-1.243%,"1,964,790,207"
NGVT,Ingevity Corporation Common Stock ,$53.85,-0.87,-1.59%,"1,963,709,447"
VSH,"Vishay Intertechnology, Inc. Common Stock",$14.47,-0.30,-2.031%,"1,961,926,700"
CMPO,"CompoSecure, Inc. Class A Common Stock",$19.155,0.135,0.71%,"1,961,062,811"
ANIP,"ANI Pharmaceuticals, Inc.",$90.31,-0.31,-0.342%,"1,959,694,127"
FRA,Blackrock Floating Rate Income Strategies Fund Inc  Common Stock,$13.165,0.025,0.19%,"1,958,457,931"
OZKAP,Bank OZK 4.625% Series A Non-Cumulative Perpetual Preferred Stock,$17.31,-0.185,-1.057%,"1,958,386,445"
MOBBW,Mobilicom Limited Warrants,$0.95,0.0499,5.544%,"1,958,308,287"
YELP,Yelp Inc. Common Stock,$31.03,0.01,0.032%,"1,956,772,125"
CGON,"CG Oncology, Inc. Common stock",$25.65,0.12,0.47%,"1,955,750,453"
TRIP,"TripAdvisor, Inc. Common Stock",$16.835,-0.325,-1.894%,"1,955,109,004"
NYMTN,"New York Mortgage Trust, Inc. 8.00% Series D Fixed-to-Floating Rate Cumulative Redeemable Preferred Stock",$21.62,-0.02,-0.092%,"1,952,588,334"
PBI,Pitney Bowes Inc. Common Stock,$11.335,-0.005,-0.044%,"1,951,014,160"
PL,Planet Labs PBC Class A Common Stock,$6.4198,-0.0102,-0.159%,"1,947,965,884"
SHOO,"Steven Madden, Ltd. Common Stock",$26.77,0.17,0.639%,"1,944,904,534"
UPWK,Upwork Inc. Common Stock,$14.63,0.425,2.992%,"1,940,034,251"
MAN,ManpowerGroup Common Stock,$41.785,-0.365,-0.866%,"1,934,272,903"
PNFPP,"Pinnacle Financial Partners, Inc. Depositary shares of Pinnacle Financial Partners, Inc., each representing a 1/40th Interest in a share of its 6.75% Fixed-Rate Non-Cumulative Perpetual Preferred Stock, Series B",$24.91,-0.09,-0.36%,"1,932,117,945"
NIC,Nicolet Bankshares Inc. Common Stock,$129.80,-0.33,-0.254%,"1,928,424,062"
BTU,Peabody Energy Corporation Common Stock ,$15.845,-0.155,-0.969%,"1,926,752,000"
PRGS,Progress Software Corporation Common Stock (DE),$44.58,0.02,0.045%,"1,921,770,109"
ADPT,Adaptive Biotechnologies Corporation Common Stock,$12.615,0.32,2.603%,"1,920,935,438"
PRCH,"Porch Group, Inc. Common Stock",$15.66,0.34,2.219%,"1,919,619,948"
BWNB,"Babcock & Wilcox Enterprises, Inc. 6.50% Senior Notes due 2026",$18.97,-0.2189,-1.141%,"1,917,820,372"
JSM,"Navient Corporation 6% Senior Notes due December 15, 2043",$19.2846,0.0246,0.128%,"1,917,487,795"
NN,NextNav Inc. Common Stock,$14.35,0.155,1.092%,"1,910,423,636"
ENR,"Energizer Holdings, Inc. Common Stock",$27.965,-0.565,-1.98%,"1,909,129,581"
OFG,OFG Bancorp Common Stock,$42.87,-0.09,-0.209%,"1,908,537,032"
NTB,Bank of N.T. Butterfield & Son Limited (The) Voting Ordinary Shares,$44.35,-0.07,-0.158%,"1,907,050,000"
STRA,"Strategic Education, Inc. Common Stock",$79.745,0.375,0.472%,"1,905,938,036"
WT,"WisdomTree, Inc. Common Stock",$12.925,-0.135,-1.034%,"1,901,359,539"
PSIX,"Power Solutions International, Inc. Common Stock",$82.55,1.82,2.254%,"1,901,113,787"
MTX,Minerals Technologies Inc. Common Stock,$60.57,-0.07,-0.115%,"1,900,451,346"
ATKR,Atkore Inc. Common Stock,$56.42,-0.26,-0.459%,"1,898,857,020"
LZ,"LegalZoom.com, Inc. Common Stock",$10.525,-0.005,-0.047%,"1,897,124,661"
HLMN,Hillman Solutions Corp. Common Stock,$9.565,-0.115,-1.188%,"1,890,419,187"
ABLLL,"Abacus Global Management, Inc. 9.875% Fixed Rate Senior Notes due 2028",$25.3101,0.1201,0.477%,"1,889,433,058"
ADNT,Adient plc Ordinary Shares ,$23.25,0.13,0.562%,"1,888,967,826"
ARQT,"Arcutis Biotherapeutics, Inc. Common Stock",$15.73,-0.06,-0.38%,"1,886,106,877"
EYE,"National Vision Holdings, Inc. Common Stock",$23.77,-0.43,-1.777%,"1,882,498,024"
TMC,TMC the metals company Inc. Common Stock,$4.6268,-0.0432,-0.925%,"1,880,298,767"
SRPT,"Sarepta Therapeutics, Inc. Common Stock (DE)",$19.17,-1.41,-6.851%,"1,873,166,606"
KLIC,"Kulicke and Soffa Industries, Inc. Common Stock",$35.90,0.01,0.028%,"1,872,024,383"
PLUS,ePlus inc. Common Stock,$70.285,-0.915,-1.285%,"1,871,378,469"
BKV,BKV Corporation Common Stock,$22.05,0.31,1.426%,"1,867,882,401"
MCW,"Mister Car Wash, Inc. Common Stock",$5.70,-0.05,-0.87%,"1,865,468,879"
PPTA,Perpetua Resources Corp. Common Shares,$17.32,0.28,1.643%,"1,863,110,010"
WBTN,WEBTOON Entertainment Inc. Common stock,$14.23,-0.82,-5.449%,"1,858,555,767"
CDLR,Cadeler A/S American Depositary Share (each representing four (4) Ordinary Shares),$21.18,0.10,0.474%,"1,858,320,407"
SEI,"Solaris Energy Infrastructure, Inc. Class A Common Stock",$27.44,0.28,1.031%,"1,854,474,310"
AFGB,"American Financial Group, Inc. 5.875% Subordinated Debentures due 2059",$22.21,0.08,0.362%,"1,852,191,379"
PWP,Perella Weinberg Partners Class A Common Stock,$21.17,-0.11,-0.517%,"1,851,933,881"
MCRI,"Monarch Casino & Resort, Inc. Common Stock",$101.36,0.24,0.237%,"1,851,588,833"
HMN,Horace Mann Educators Corporation Common Stock,$45.49,0.03,0.066%,"1,851,248,712"
SCS,Steelcase Inc. Common Stock,$16.11,-0.07,-0.433%,"1,847,945,896"
ARDT,"Ardent Health, Inc. Common Stock",$12.90,-0.12,-0.922%,"1,846,073,166"
COUR,"Coursera, Inc. Common Stock",$11.245,-0.115,-1.012%,"1,840,806,500"
CCS,"Century Communities, Inc. Common Stock",$61.91,-1.72,-2.703%,"1,837,475,242"
SLDE,"Slide Insurance Holdings, Inc. Common Stock",$14.61,0.10,0.689%,"1,833,517,496"
UTZ,Utz Brands Inc Class A Common Stock ,$12.94,-0.09,-0.691%,"1,831,668,659"
VVX,"V2X, Inc. Common Stock",$57.645,0.705,1.238%,"1,827,912,632"
CCOI,"Cogent Communications Holdings, Inc.",$37.085,0.60,1.645%,"1,823,940,763"
AIN,Albany International Corporation Common Stock,$61.75,0.38,0.619%,"1,821,625,000"
ROCK,"Gibraltar Industries, Inc. Common Stock",$61.71,-0.58,-0.931%,"1,821,155,097"
SDRL,Seadrill Limited Common Shares,$29.24,0.05,0.171%,"1,819,470,199"
DXPE,"DXP Enterprises, Inc. Common Stock",$115.69,0.80,0.696%,"1,815,648,578"
JBLU,JetBlue Airways Corporation Common Stock,$4.99,-0.15,-2.918%,"1,814,685,551"
SEDG,"SolarEdge Technologies, Inc. Common Stock",$30.41,-1.65,-5.147%,"1,805,587,455"
AMR,"Alpha Metallurgical Resources, Inc. Common Stock",$138.29,-1.12,-0.803%,"1,805,213,183"
DHT,"DHT Holdings, Inc.",$11.235,0.265,2.416%,"1,803,868,883"
